Keyword,Title,Description,Original Link,Link,Publication Date
산업은행,"1.2조 펀딩 나선 프리미어, 해외 투자자 지갑 열었다","지난해부터 시작된 6호 펀드 자금 조달 때는 국민연금, 산업은행, 수출입은행, 과학기술인공제회, 교직원공제회 등의 출자 사업에서 연이어 승전보를 울리며 주요 LP를 확보했다. 2021년 설립돼 비교적 신생 운용사인... ",https://biz.chosun.com/stock/market_trend/2025/12/08/TRJ5SZQIAJA73AI4QFPTJRW5VQ/?utm_source=naver&utm_medium=original&utm_campaign=biz,https://n.news.naver.com/mnews/article/366/0001128754?sid=101,"Mon, 08 Dec 2025 15:31:00 +0900"
산업은행,"포스코·동원 &quot;내부 검토만&quot;···HMM 인수전, 정부 지분 '민영화' 걸림...",대규모 자금을 투입해 산업은행 측 지분(35.42%)을 매입한 뒤에도 한국해양진흥공사(35.08%)를 비롯해 국민연금 등 여전히 상당한 정부 측 지분을 통해 자율적인 경영권 행사에 어려움을 겪을 수 있다는 취지다. 업계 한... ,http://www.enewstoday.co.kr/news/articleView.html?idxno=2366030,http://www.enewstoday.co.kr/news/articleView.html?idxno=2366030,"Mon, 08 Dec 2025 15:15:00 +0900"
산업은행,&lt;강원의 경쟁력 &gt; ① ‘투자 펀드’ 시대..“소멸위기 강원에 기회”,"펀드의 구조는 정부 재정, 지방소멸대응기금, 산업은행이 각각 1,000억 원씩 출자하여 총 3,000억 원 규모의 모(母)펀드를 조성하는 것으로 시작된다. 이 모펀드가 마중물이 되어 민간 투자를 유인하고, 자(子)펀드를 결성해... ",https://www.g1tv.co.kr/news/?newsid=336774&mid=1_207&newscode=web,https://www.g1tv.co.kr/news/?newsid=336774&mid=1_207&newscode=web,"Mon, 08 Dec 2025 14:54:00 +0900"
산업은행,석유화학 구조 개편 2호 하세월…내년으로 연기땐 지방선거 변수에 골치,8일 석화업계와 금융권에 따르면 지난 5일 여의도 한국산업은행 본관에서 롯데케미칼 채권단 자율협의회 회의가 열렸다. 같은 날 오후에는 HD현대케미칼 채권단 자율협의회가 소집됐다. 충남 대산산업단지의... ,http://www.fieldnews.kr/news/articleView.html?idxno=24061,http://www.fieldnews.kr/news/articleView.html?idxno=24061,"Mon, 08 Dec 2025 14:54:00 +0900"
산업은행,[단독]LIG넥스원 '금융기획실' 신설.... 해외 투자 '실탄' 마련,"산업은행과 수출입은행 등 국책은행이 K-방산에 힘을 보태고 있지만, K방산 전반적으로 자금소요가 커 LIG넥스원에게 돌아올 몫에 한계가 있는 것도 한몫했다. LIG넥스원이 해외로 자금 유치를 위해 눈을 돌리는... ",http://www.fnnews.com/news/202512080809549296,https://n.news.naver.com/mnews/article/014/0005445741?sid=101,"Mon, 08 Dec 2025 14:51:00 +0900"
산업은행,10조원대 HMM 매각 재시동...'부산 이전' 노조 반대 새 변수,"최대주주인 산업은행이 HMM 주식에 대한 공정가치 평가에 나섰고, 포스코와 동원그룹 등 잠재 인수 후보들도 인수 검토에 들어갔다. 산업은행과 해양진흥공사 등 정부는 HMM의 경영 정상화 직후인 지난 2023년부터 HMM... ",https://www.newspim.com/news/view/20251208000744,https://www.newspim.com/news/view/20251208000744,"Mon, 08 Dec 2025 14:37:00 +0900"
산업은행,산은 실사 착수로 HMM 매각 절차 시작…동원도 가세,"최대주주인 한국산업은행이 보유 지분에 대한 공정가치 평가에 착수하면서, 사실상 ‘2차 인수전의 신호탄’이 울렸다는 해석이 나옵니다. 여기에 포스코그룹에 이어 동원그룹까지 인수 검토에 나서며 시장의 열기가... ",http://www.newstomato.com/ReadNews.aspx?no=1284151&inflow=N,http://www.newstomato.com/ReadNews.aspx?no=1284151&inflow=N,"Mon, 08 Dec 2025 14:32:00 +0900"
산업은행,기업銀부터 예보·서금원까지…인사철 되니 '낙하산 포비아' 확산,"8일 업계에 따르면 양대 금융노조에 속한 기업은행(전국금융산업노동조합 소속), 예보(전국사무금융서비스노동조합 소속)는 5·8일 각각 기자회견을 열고 새 행장·사장 인선은 투명해야 한다고 강조했다. 예보의 경우 현재... ",http://www.newsdream.kr/news/articleView.html?idxno=102458,http://www.newsdream.kr/news/articleView.html?idxno=102458,"Mon, 08 Dec 2025 14:30:00 +0900"
산업은행,"부산 가는 해운사들, 못 움직이는 HMM… 매각전의 역설","산업은행과 한국해양진흥공사는 최근 회계법인에 입찰제안요청서(RFP)를 발송해 지분가치 평가를 진행 중이며, 시장에서는 이를 '매각 재시동 신호'로 해석한다. 여기에 2023년 인수전에서 고배를 마셨던 동원그룹이 다시... ",https://www.ebn.co.kr/news/articleView.html?idxno=1690061,https://www.ebn.co.kr/news/articleView.html?idxno=1690061,"Mon, 08 Dec 2025 14:08:00 +0900"
산업은행,"예보, 사장 선임 두고 내부 '진통'…공운법 통한 '인사 외압' 논란","한편, 이날(8일) 김광남 전 예보 부사장이 차기 사장 '유력 후보'로 하마평에 오르며, 최근 산업·수출입은행 등에서 내부 출신이 발탁된 현 정부의 공공기관장 선임 기조가 예보에도 적용될 가능성이 일각에서 제기되고... ",https://www.newsworks.co.kr/news/articleView.html?idxno=822088,https://www.newsworks.co.kr/news/articleView.html?idxno=822088,"Mon, 08 Dec 2025 14:08:00 +0900"
산업은행,동원·포스코·한화 눈독 들이는데…찬물 끼얹는 HMM ‘부산행 청구서’...,산업은행과 해양진흥공사는 이번에야말로 정치적 셈법을 철저히 배제하고 오직 ‘기업 경쟁력 강화’라는 원칙에 따라 매각을 추진해야 한다. 골든타임을 놓치고 또 다시 정치 놀음으로 허송세월한다면 HMM 매각은... ,https://www.mk.co.kr/article/11486751,https://n.news.naver.com/mnews/article/009/0005602543?sid=101,"Mon, 08 Dec 2025 14:05:00 +0900"
산업은행,NCC 통폐합 본격화...대산·여수·울산 산단 사업 재편 '가속',|중앙이코노미뉴스 송태원 기자|롯데케미칼 대산 공장[사진=롯데케미칼] 롯데케미칼과 HD현대케미칼이 주채권은행인 산업은행(이하 산은)에 금융지원을 공식 신청하면서 국내 석유화학업계의 사업재편이 본격화될... ,https://www.joongangenews.com/news/articleView.html?idxno=473204,https://www.joongangenews.com/news/articleView.html?idxno=473204,"Mon, 08 Dec 2025 14:02:00 +0900"
산업은행,"해수부, 부산이전 시작…23일부터 부산시대 개막",HMM 육상노조는 지난 4일 용산 대통령실 인근에서 기자회견을 열고 &quot;정부가 '유치'라는 표현을 쓰지만 실제로는 민간기업에 대한 강제 이전&quot;이라며 &quot;해수부·해양진흥공사·산업은행 등이 조직적으로 압박하는 것은... ,https://www.asiatoday.co.kr/view.php?key=20251208010004107,https://www.asiatoday.co.kr/view.php?key=20251208010004107,"Mon, 08 Dec 2025 14:00:00 +0900"
산업은행,"HMM '새 주인' 찾기 2라운드…포스코·동원, 물밑 경쟁 점화","산업은행 등 채권단이 HMM 매각을 재추진할 것이라는 관측에 힘이 실리면서 잠재 후보군들이 발 빠르게 움직이고 있다. 포스코그룹은 지난 9월부터 삼일PwC, 보스턴컨설팅그룹(BCG) 등과 자문단을 꾸려 사업성 분석에... ",http://www.newslock.co.kr/news/articleView.html?idxno=120942,http://www.newslock.co.kr/news/articleView.html?idxno=120942,"Mon, 08 Dec 2025 13:42:00 +0900"
산업은행,"[경제포커스] 금융위원회, M.AX 얼라이언스-국민성장펀드 시너지 모색","아울러,  M.AX 얼라이언스 간사기관인 산업기술기획평가원과 산업은행에 설치된 국민성장펀드 사무국과 정기적인 협력 채널 운영도 추진한다. 김정관 장관은 &quot;산업과 금융은 우리 경제를 이끄는 수레의 두 바퀴로 서로... ",http://www.sisacast.kr/news/articleView.html?idxno=87651,http://www.sisacast.kr/news/articleView.html?idxno=87651,"Mon, 08 Dec 2025 13:24:00 +0900"
산업은행,"성호전자 주가, 상한가 기록... 호재는?","총 인수금액 가운데 1500억원은 산업은행 등이 주선한 인수금융으로 조달하며, 나머지 1300억원 중 성호전자가 700억원을 출자하고, 송광열 에스디에스테크 대표가 전환사채(CB)·신주인수권부사채(BW) 형태로 600억원을... ",https://www.ggilbo.com/news/articleView.html?idxno=1128847,https://www.ggilbo.com/news/articleView.html?idxno=1128847,"Mon, 08 Dec 2025 13:24:00 +0900"
산업은행,‘해양수도 지원’ 사모펀드 먼저 움직여,"국내 최대 해운기업 HMM의 1, 2대 주주인 산업은행과 한국해양진흥공사의 다음 움직임이 주목된다. 국내 대표적 사모펀드 중 하나인 한앤컴퍼니(한앤코)가 최대 주주인 SK해운과 에이치라인해운은 5일 부산에서... ",https://www.naeil.com/news/read/570167?ref=naver,https://www.naeil.com/news/read/570167?ref=naver,"Mon, 08 Dec 2025 13:04:00 +0900"
산업은행,곤돌라·소각장 재판…서울시 역점사업 기로,최근 시는 오랜 시간 다퉈온 산업은행과의 지방소득세 부당이득금 반환 소송에서 최종 승소했다. 대법원이 1·2심 결과를 뒤집고 서울시 손을 들어줬기 때문이다. 시가 거둔 세금이 법적 근거가 없는 부당이득이라는 은행측... ,https://www.naeil.com/news/read/570181?ref=naver,https://www.naeil.com/news/read/570181?ref=naver,"Mon, 08 Dec 2025 13:02:00 +0900"
산업은행,JP모건 '정치 성향 계좌 해지' 논란…암호화폐 업계 '초크포인트 2.0' 우...,초크포인트(Operation Chokepoint) : 정부 기관이 은행을 통해 특정 산업군의 금융 접근을 제한하는 비공식 간접 규제 방식. 최근 암호화폐 업계에 이를 적용하려는 움직임이 '초크포인트 2.0'으로 불린다.,https://www.tokenpost.kr/news/cryptocurrency/312271,https://www.tokenpost.kr/news/cryptocurrency/312271,"Mon, 08 Dec 2025 12:52:00 +0900"
산업은행,"해수부 이어 SK·에이치라인 해운, 부산행 결정... &quot;집적화 신호탄&quot;",HMM은 산업은행과 한국해양진흥공사가 지분을 70% 이상 보유하고 있어 사실상 공기업으로 불린다. 틀어지면 정부의 구상도 삐걱댈 수 있다. 이전 로드맵 마련에 분주한 해수부는 충분한 협의를 앞세우며 해법을 찾는... ,https://www.ohmynews.com/NWS_Web/View/at_pg.aspx?CNTN_CD=A0003189326&CMPT_CD=P0010&utm_source=naver&utm_medium=newsearch&utm_campaign=naver_news,https://n.news.naver.com/mnews/article/047/0002497628?sid=102,"Mon, 08 Dec 2025 12:16:00 +0900"
산업은행,"D-10 금투협회장 선거, 서유석·이현승·황성엽 3파전 공약 경쟁",황성엽 후보는 자본 시장 비전으로 국가 전략 산업 핵심 동반자를 은행 중심에서 자본 시장으로 옮기는 방안을 주장했다. 그는 부동산에 편중된 가계 자산 흐름도 증시 및 연금 시장으로 옮기겠다고 밝혔다. 규제 리스크... ,https://www.womaneconomy.co.kr/news/articleView.html?idxno=246420,https://www.womaneconomy.co.kr/news/articleView.html?idxno=246420,"Mon, 08 Dec 2025 12:04:00 +0900"
산업은행,"HD현대로보틱스, 그룹 중장기 성장 전략 핵심…리더십 시험대",이 회사는 2020년 KT로부터 500억원의 투자를 유치한데 이어 올해 10월 프리 IPO를 통해 한국산업은행과 사모펀드 운용사 KY프라이빗에쿼티(KY PE)에게 1800억원의 재원을 조달했다. 특히 이번 투자과정에선 IPO에 대해... ,https://dealsite.co.kr/articles/152842,https://dealsite.co.kr/articles/152842,"Mon, 08 Dec 2025 12:02:00 +0900"
산업은행,&lt;일요대담&gt; ‘소신파’ 조경태 의원 혼란의 국힘을 말하다,"KDB산업은행도 부산으로 이전해야 한다고 생각한다. 부산에 가장 큰 도움이 되는 건 기업 이전이다. 실질적으로 기업이 오게 해서 활발하게 경제활동을 할 수 있도록 하려면, 금융산업이 발달해야 한다. 그래서 KDB산업은행... ",https://www.ilyosisa.co.kr/news/article.html?no=253152,https://www.ilyosisa.co.kr/news/article.html?no=253152,"Mon, 08 Dec 2025 11:52:00 +0900"
산업은행,"[단독] 성호전자, 엔비디아 납품 AI 데이터센터 부품업체 2800억 인수","2800억원 가운데 1500억원은 산업은행 등이 주선하는 인수금융으로 마련한다. 나머지 1300억원 중 성호전자가 700억원을 출자하고, 송광열 에스디에스테크 대표가 전환사채(CB)·신주인수권부사채(BW) 형태로 600억원을... ",https://www.hankyung.com/article/202512067780r,https://n.news.naver.com/mnews/article/015/0005221408?sid=101,"Mon, 08 Dec 2025 11:31:00 +0900"
산업은행,'하이닉스 금융사' 나오나…AI-반도체 위해 43년 만 금산분리 완화 가닥,"금산분리는 1982년 은행법을 통해 처음 도입됐고, 이후 1997년 IMF 구제금융 당시 방만하게 늘어난 재벌 계열사 문제가 부각되면서 은행법과 금융지주회사법을 통해 산업자본의 은행 소유 규제를 재확인했다. 대기업의... ",https://www.newsquest.co.kr/news/articleView.html?idxno=258057,https://www.newsquest.co.kr/news/articleView.html?idxno=258057,"Mon, 08 Dec 2025 11:04:00 +0900"
산업은행,인니 소규모 은행 구조조정 방침에 '각자도생' 전략,조치가 아니라 지나치게 많은 소규모 은행을 줄이고 산업 경쟁력을 높이기 위한 것”이라며 “기술 혁신과 경제 환경 변화 속에서 은행 간 협업과 통합이 필수”라고 강조했다. 인도네시아 금융당국청(OJK) CI. (사진=OJK),https://www.theguru.co.kr/news/article.html?no=95321,https://www.theguru.co.kr/news/article.html?no=95321,"Mon, 08 Dec 2025 10:22:00 +0900"
산업은행,150조 국민성장펀드 출범…정책펀드 되풀이 막을 열쇠는 '결과물',"정부 보증 기반의 기금채와 산업은행의 자금 출연으로 75조원 규모의 첨단전략산업기금이 꾸려진다. 나머지 75조원은 금융권의 재원 투입, 일반 국민의 공모 자금으로 마련된다. 펀드를 위한 조직과 투자 의사 결정... ",https://news.einfomax.co.kr/news/articleView.html?idxno=4387672,https://news.einfomax.co.kr/news/articleView.html?idxno=4387672,"Mon, 08 Dec 2025 10:22:00 +0900"
산업은행,"[단독] 예보, 차기 사장에 ‘첫 내부 출신’ 김광남 전 부사장 유력",최근 산업은행·수출입은행 등에서 내부 출신이 발탁된 현 정부의 공공기관장 선임 기조가 예보에도 적용될 가능성이 제기되는 배경이다. 차기 예보 사장은 중대한 정책 과제를 안게 된다. 예금자 보호 한도가 지난 9월... ,https://www.viva100.com/article/20251208500350,https://www.viva100.com/article/20251208500350,"Mon, 08 Dec 2025 10:16:00 +0900"
산업은행,대한항공–아시아나 합병 '국가경쟁력' 명분 뒤에 남은 독점과 불투명성,"국토교통부와 산업은행은 &quot;대한항공 단일 메가캐리어 체제로 글로벌 경쟁력을 확보할 수 있다&quot;고 강조해 왔지만, 실제로는 대한항공이 국제·국내선 대부분에서 과점적 지위를 확보하며 요금·서비스·노선 선택권의 축소... ",https://www.polinews.co.kr/news/articleView.html?idxno=716101,https://www.polinews.co.kr/news/articleView.html?idxno=716101,"Mon, 08 Dec 2025 09:18:00 +0900"
산업은행,"[더벨][동원그룹, HMM 인수 재도전]몸값 오른 HMM, 재검토 가능한 이유는",산업은행과 해양진흥공사 지분이 모두 거래 대상이던 2023년과 달리 최근엔 산은 보유 지분만 파는 방안이 시장에서 거론되고 있다. 한 때 25조원을 넘어섰던 HMM 주가 역시 하반기 들어 안정화되는 추세다. 최근 시가를... ,https://www.thebell.co.kr/free/content/ArticleView.asp?key=202512051540273520108339,https://www.thebell.co.kr/free/content/ArticleView.asp?key=202512051540273520108339,"Mon, 08 Dec 2025 08:22:00 +0900"
산업은행,"[더벨][동원그룹, HMM 인수 재도전]동원산업, 신임 CFO 이준석 상무 자금...",산업은행과 한국해양진흥공사 등 국책은행과의 긴밀한 협상도 중요하다는 평가다. 산은 입장에서는 공적자금을 회수해야 하고 인수 희망자 입장에서는 대규모 현금을 투입이 부담스러울 수밖에 없다. 향후 산은 측... ,https://www.thebell.co.kr/free/content/ArticleView.asp?key=202512051101388480103526,https://www.thebell.co.kr/free/content/ArticleView.asp?key=202512051101388480103526,"Mon, 08 Dec 2025 08:22:00 +0900"
산업은행,"[더벨][동원그룹, HMM 인수 재도전]매각 공식화 전 '사전준비' 착수…포...",아직 KDB산업은행 등 채권단 차원에서 본격적인 매각 절차가 개시되지 않았다는 점도 동원그룹 측이 신중함을 유지하는 배경으로 꼽힌다. 단 매각 이전부터 포스코가 인수 후보군으로 부상한 상황이 달갑지는 않을... ,https://www.thebell.co.kr/free/content/ArticleView.asp?key=202512051100414320109549,https://www.thebell.co.kr/free/content/ArticleView.asp?key=202512051100414320109549,"Mon, 08 Dec 2025 08:22:00 +0900"
산업은행,[더벨][임팩트&amp;기술 스타트업]성용준 인진 대표 “파력발전 세계 첫 상...,"KDB산업은행, SK이노베이션, 하나증권, 영국 혁신청 등 국내외 기관과 벤처캐피탈(VC)로부터 투자와 지원금을 확보했다. 현재 상업화 직전 최종 투자를 유치하고 있으며 내년 본격적 시설 착공에 돌입할 계획이다. ◇세계... ",https://www.thebell.co.kr/free/content/ArticleView.asp?key=202511181406033080101148,https://www.thebell.co.kr/free/content/ArticleView.asp?key=202511181406033080101148,"Mon, 08 Dec 2025 08:02:00 +0900"
산업은행,잠재 매물 'HMM 인수전' 후끈…'단골' 포스코vs'재도전' 동원 2파전,HMM의 최대 주주인 산업은행 등이 매각에 나설 수밖에 없을 것이란 전망이 제기되면서 인수전이 달아오르는 모양새다. 산은 입장에서는 HMM은 위험자산으로 분류되기 때문에 국제결제은행(BIS) 자기자본비율에... ,https://www.news1.kr/industry/general-industry/5999767,https://n.news.naver.com/mnews/article/421/0008647703?sid=101,"Mon, 08 Dec 2025 07:07:00 +0900"
산업은행,[이번주 한국은행 및 금융위·금감원 일정],"(석간) ※11월 중 가계대출 동향(잠정) 및 「가계부채 점검회의」 개최(12:00) ※이찬진 금융감독원장, 금융지주회장 간담회(15:00) *12월11일(목) ※금융감독원·한국산업은행, 디지털 취약계층 금융교육앱... ",https://news.einfomax.co.kr/news/articleView.html?idxno=4387621,https://news.einfomax.co.kr/news/articleView.html?idxno=4387621,"Mon, 08 Dec 2025 07:06:00 +0900"
산업은행,[Invest]산업은행 부행장들 인사 훈풍 기대…계열사 세 곳에 국민성장펀...,올해 산업은행 고위급 인사엔 훈풍이 불 것으로 기대된다. 인사 적체에 고위급이 갈 만한 자리도 줄어드는 추세였는데 올해는 계열사 사장 자리 세 곳이 나고 국민성장펀드 담당 부행장 자리도 새로 생긴다. 수석부행장... ,https://www.investchosun.com/site/data/html_dir/2025/12/05/2025120580155.html,https://www.investchosun.com/site/data/html_dir/2025/12/05/2025120580155.html,"Mon, 08 Dec 2025 07:02:00 +0900"
산업은행,[N2 포커스] ‘매출 100조원’ 목표 띄운 HD현대...AI·로봇 신사업에도...,"HD현대로보틱스는 지난 10월 KDB산업은행, 국내 사모펀드 운용사 KY PE와 1800억원 규모의 투자 유치 계약을 체결하기도 했다. 올 3분기 HD현대의 연결 기준 매출액 가운데 HD현대로보틱스가 차지한 비중은 39.5%로... ",https://www.news2day.co.kr/article/20251204500326,https://www.news2day.co.kr/article/20251204500326,"Mon, 08 Dec 2025 07:02:00 +0900"
산업은행,"계열사 줄인 HD현대, 로보틱스 IPO 시동…중복 상장 논란 넘어설까","지난 2020년 KT로부터 500억원의 투자금을 유치했고, 지난 10월엔 한국산업은행과 KY PE에서 1800억원 규모 프리IPO 투자를 유치했다. 기업가치는 5년 만에 약 4배 상승했다. HD현대로보틱스는 투자 유치를 통해 확보한... ",https://www.ceoscoredaily.com/page/view/2025120515190291874,https://www.ceoscoredaily.com/page/view/2025120515190291874,"Mon, 08 Dec 2025 07:00:00 +0900"
기업은행,은퇴전 고가 아파트 증여한다면…국세청 감정평가 대상인지 살펴야,감정평가사업 대상 확대(초고가 아파트 등) 및 범위 확대(시가와 신고가액 차액이 5억원 이상이거나 5% 이상 등)의 개정사항을 파악해 상속·증여를 준비할 필요가 있을 것이다. [박서현 IBK기업은행 컨설팅센터 전문위원],https://www.mk.co.kr/article/11486995,https://n.news.naver.com/mnews/article/009/0005602721?sid=101,"Mon, 08 Dec 2025 16:42:00 +0900"
기업은행,갤러리로 변신한 산업단지…IBK 사회공헌 '일석이조',IBK기업은행(은행장 김성태)의 야심 찬 사회공헌활동이다. 기업은행은 한국메세나협회(회장 윤영달)와 산업단지 공공미술 프로젝트 'IBK예술로 3호'를 성공적으로 마쳤다고 8일 밝혔다. 올해로 3회째를 맞은 IBK예술로는... ,https://www.mk.co.kr/article/11486994,https://n.news.naver.com/mnews/article/009/0005602720?sid=101,"Mon, 08 Dec 2025 16:42:00 +0900"
기업은행,"IBK기업은행, 양자컴퓨터 시대 대비 양자내성암호 기술 검증 완료",IBK기업은행이 한국퀀텀컴퓨팅과 차세대 금융 보안 기술인 양자내성암호의 기술 검증을 성공적으로 마쳤다고 8일 밝혔다. 양자내성암호는 양자컴퓨터로도 해독이 어려운 차세대 암호 기술이다. 이번 기술 검증은... ,https://www.autodaily.co.kr/news/articleView.html?idxno=539724,https://www.autodaily.co.kr/news/articleView.html?idxno=539724,"Mon, 08 Dec 2025 16:40:00 +0900"
기업은행,"IBK기업은행, 양자내성암호 기술 검증 완료",IBK기업은행 본사. 사진=IBK기업은행  IBK기업은행은 한국퀀텀컴퓨팅과 차세대 금융 보안 기술인 양자내성암호의 기술 검증을 마쳤다고 8일 밝혔다. 양자내성암호는 양자컴퓨터로도 해독이 어려운 차세대 암호 기술이다.... ,https://weekly.hankooki.com/news/articleView.html?idxno=7140495,https://weekly.hankooki.com/news/articleView.html?idxno=7140495,"Mon, 08 Dec 2025 16:40:00 +0900"
기업은행,"IBK기업은행, 양자컴퓨터 시대 대비한 양자내성암호 기술 검증 완료",IBK기업은행은 한국퀀텀컴퓨팅과 차세대 금융 보안 기술인 양자내성암호의 기술 검증을 성공적으로 마쳤다고 8일 밝혔다. 양자내성암호는 양자컴퓨터로도 해독이 어려운 차세대 암호 기술이다. 이번 기술 검증은... ,https://www.newsinside.kr/news/articleView.html?idxno=4242236,https://www.newsinside.kr/news/articleView.html?idxno=4242236,"Mon, 08 Dec 2025 16:40:00 +0900"
기업은행,"IBK기업은행, 'IBK상거래원스톱 서비스' 출시",IBK기업은행(은행장 김성태)이 지난 5일 소상공인과 중소기업의 전자상거래 업무 간소화를 지원하는 'IBK상거래원스톱 서비스'를 출시했다고 8일 밝혔다. 이번 서비스는 전자세금계산서 발행부터 가상계좌 기반의 자동... ,https://www.financialpost.co.kr/news/articleView.html?idxno=240537,https://www.financialpost.co.kr/news/articleView.html?idxno=240537,"Mon, 08 Dec 2025 16:38:00 +0900"
기업은행,"IBK기업은행, 양자내성암호 기술검증…&quot;양자컴퓨터시대 준비&quot;",IBK기업은행 전경. (사진=IBK기업은행) IBK기업은행(은행장 김성태)은 한국퀀텀컴퓨팅(대표 김준영)과 차세대 금융 보안 기술인 양자내성암호의 기술 검증을 성공적으로 마쳤다고 8일 밝혔다. 양자내성암호는... ,https://www.delighti.co.kr/news/articleView.html?idxno=107444,https://www.delighti.co.kr/news/articleView.html?idxno=107444,"Mon, 08 Dec 2025 16:36:00 +0900"
기업은행,"IBK기업은행, 중소기업 전자상거래 간소화 위한 '상거래원스톱 서비스'...",IBK기업은행(은행장 김성태)은 지난 5일 소상공인과 중소기업의 전자상거래 업무 간소화를 지원하는 'IBK상거래원스톱 서비스'를 출시했다고 8일 밝혔다. 이번 서비스는 전자세금계산서 발행부터 가상계좌 기반의 자동 수납... ,http://www.ttlnews.com/news/articleView.html?idxno=3058070,http://www.ttlnews.com/news/articleView.html?idxno=3058070,"Mon, 08 Dec 2025 16:34:00 +0900"
기업은행,"IBK기업은행, 차세대 금융보안 기술 '양자내성암호' 검증 완료",IBK기업은행이 차세대 금융 보안 기술로 꼽히는 한국퀀텀컴퓨팅 양자내성암호의 기술 검증을 성공적으로 마쳤다고 8일 밝혔다. /한스경제 DB | 한스경제=이성노 기자 | IBK기업은행이 차세대 금융 보안 기술로 꼽히는... ,http://www.hansbiz.co.kr/news/articleView.html?idxno=798716,http://www.hansbiz.co.kr/news/articleView.html?idxno=798716,"Mon, 08 Dec 2025 16:28:00 +0900"
