Keyword,Title,Description,Original Link,Link,Publication Date
오기형,"코스피 5000은 ‘기록’, 6000은 ‘과제’…현실 가능성은",이후 더불어민주당 코스피 5000 특별위원회 위원장인 오기형 민주당 의원은 코스피가 5000선을 돌파한 1월 22일 오후 국회 브리핑에서 “현재 성과에 만족하지 않고 지속적으로 제도를 개혁하겠다는 의견을 나눴다”며... ,https://economist.co.kr/article/view/ecn202601230055,https://n.news.naver.com/mnews/article/243/0000092314?sid=101,"Mon, 02 Feb 2026 07:00:00 +0900"
오기형,"與, 자사주 소각 다음은 국민연금 의결권·공시 강화…“기업 압박” 피...",오기형 민주당 의원은 “우리나라는 주주제안 요건이 지나치게 엄격하고 대상 범위도 주주총회 승인 사항으로 한정돼 있다”고 지적했다. 국민연금 의결권 강화 움직임을 놓고 야당과 일부 전문가들은 우려를 표한다.... ,https://biz.chosun.com/policy/politics/2026/02/02/MNS3HAOBLNA2ZNBTYPL77H7VHA/?utm_source=naver&utm_medium=original&utm_campaign=biz,https://n.news.naver.com/mnews/article/366/0001139776?sid=100,"Mon, 02 Feb 2026 06:01:00 +0900"
오기형,&quot;좀비기업 진입 엄격해야…코스닥 신뢰 더 쌓여야&quot;[만났습니다]②,오기형 더불어민주당 코스피5000특별위원회 위원장은 지난달 28일 국회 의원회관에서 진행한 이데일리와의... 오기형 코스피5000특위위원장이 28일 국회 의원회관에서 이데일리와 인터뷰를 하고 있다(사진=이데일리 김태형... ,http://www.edaily.co.kr/news/newspath.asp?newsid=01397286645346584,https://n.news.naver.com/mnews/article/018/0006211015?sid=100,"Mon, 02 Feb 2026 05:02:00 +0900"
오기형,‘코스피 5000시대’ 흔드는 제약사들 ‘자사주 맞교환’ 카르텔,오기형 더불어민주당 코스피5000 특별위원장은 “법안 처리를 최대한 빨리 해야 한다”고 강조했다. 주주가치 제고 목적으로 회사돈을 들여 사들인 자사주는 소각하는 게 원칙이다. 신기술 도입 등의 경영상 목적과... ,https://www.hani.co.kr/arti/economy/economy_general/1242806.html,https://n.news.naver.com/mnews/article/028/0002789456?sid=101,"Mon, 02 Feb 2026 05:02:00 +0900"
오기형,&quot;자사주 소각 의무화해야 '코리아 프리미엄' 실현된다&quot;[만났습니다]①,오기형 더불어민주당 코스피5000특별위원회 위원장을 만나 ‘코리아 디스카운트’를 해소하고 ‘코리아 프리미엄’으로 가기 위한 해법을 들어 봤다. [편집자] 오기형 더불어민주당 코스피5000특별위원회 위원장은... ,http://www.edaily.co.kr/news/newspath.asp?newsid=01380886645346584,https://n.news.naver.com/mnews/article/018/0006211008?sid=100,"Mon, 02 Feb 2026 05:01:00 +0900"
오기형,[신장섭의 기업과 경제] '회계 근본주의' 강요하는 자사주소각법안,자사주 소각 의무화에 앞장서는 이남우 한국기업거버넌스포럼 회장이나 오기형 코스피5000특별위원장 등은 여기에서 한걸음 더 나아가 이런 '회계 근본주의'가 '글로벌 스탠더드'라고 사실을 왜곡한다. 기업회계에서... ,https://www.mk.co.kr/article/11949562,https://n.news.naver.com/mnews/article/009/0005630480?sid=110,"Sun, 01 Feb 2026 17:05:00 +0900"
오기형,與 '자사주 소각' 3차 상법개정 드라이브…&quot;설 전 80여건 민생법안 처리...,"지난해 11월 더불어민주당 코스피5000특위 위원장인 오기형 의원이 대표 발의한 법안이다. 자기주식을 신규 취득할 경우 1년 이내에 소각하고, 기존 보유 주식에는 6개월의 처분 유예기간을 준다. 자사주 소각 의무화는... ",https://www.mt.co.kr/politics/2026/02/01/2026020110541314008,https://n.news.naver.com/mnews/article/008/0005312330?sid=100,"Sun, 01 Feb 2026 14:16:00 +0900"
오기형,[더벨][보수 산정 시스템 점검] 자사주 의무 소각 전 RSU 도입 움직임…...,더불어민주당 코스피5000위원장을 맡고 있는 오기형 의원이 대표 발의한 상법 개정안에 따르면 자사주를 취득하면 취득일로부터 1년 내 의무 소각해야 하는데 임직원 보상 등에 활용하는 경우는 주총 특별결의를 받아... ,https://www.thebell.co.kr/free/content/ArticleView.asp?key=202601261404205720109250,https://www.thebell.co.kr/free/content/ArticleView.asp?key=202601261404205720109250,"Sun, 01 Feb 2026 13:38:00 +0900"
이소영 의원,갈 길 먼 정의로운 전환…기후국회 ‘골든타임’ 지키나,이소영 위성곤 더불어민주당 의원들과 △정혜경 진보당 의원 △서왕진 조국혁신당 의원 등이 각각 대표 발의를 했다. 위 의원은 기후특위 위원장이기도 하다. ◆”탄소예산 고려한 감축경로 재설계” = 기후특위는... ,https://www.naeil.com/news/read/576623?ref=naver,https://www.naeil.com/news/read/576623?ref=naver,"Mon, 02 Feb 2026 13:04:00 +0900"
이소영 의원,'포스트 5000피' 준비...與 '5000특위→K자본시장 특위' 개편,"그간 특위는 위원장인 오기형 의원을 비롯해 민병덕·박상혁·이소영·이정문·김남근·김영환·김현정·박홍배·안도걸·이강일·박균택·정준호 의원 등으로 구성, 활동해 왔는데 조기에 코스피 목표가 달성된 만큼... ",https://www.financialpost.co.kr/news/articleView.html?idxno=246361,https://www.financialpost.co.kr/news/articleView.html?idxno=246361,"Mon, 02 Feb 2026 11:50:00 +0900"
이소영 의원,‘5000피’ 달성에 與 ‘5000특위’→‘K자본시장 특위’ 개편,특위는 위원장인 재선 오기형 의원을 비롯해 민병덕·박상혁·이소영·이정문·김남근·김영환·김현정·박홍배·안도걸·이강일·박균택·정준호 의원 등으로 구성됐다. 아울러 이날 비공개 최고위원회의에서는 박상혁 전... ,https://www.sedaily.com/article/20003602?ref=naver,https://n.news.naver.com/mnews/article/011/0004585571?sid=100,"Mon, 02 Feb 2026 11:14:00 +0900"
이소영 의원,"[더벨][코스피5000 시대 개막] 코스피 절반, 아직 PBR 1배 미만…7000시대...",이는 이소영 의원이 대표 발의한 상속·증여세법으로 PBR이 0.8배 미만인 상장사에 대해서는 상속 및 증여 시 주가가 아닌 자산과 수익공정가치평가를 기반으로 과세하도록 하는 내용이다. 대주주가 상속·증여세를... ,https://www.thebell.co.kr/front/newsview.asp?key=202601261031439160106555,https://www.thebell.co.kr/front/newsview.asp?key=202601261031439160106555,"Mon, 02 Feb 2026 10:22:00 +0900"
이소영 의원,"경기도수의사회, 한병진·양철호 감사 선출..이성식 회장 명예회장 추대","대의원 정기총회는 대의원 125명 중 108명 참석, 16명 위임장 제출로 성원됐다.이성식 회장 및 대의원들은 물론... 박강효, 박민호, 송치용, 이민형, 이현규, 이성준, 이소영, 정주현 회원은 경기도수의사회장상을 수상했고... ",https://www.dailyvet.co.kr/news/association/272014,https://www.dailyvet.co.kr/news/association/272014,"Mon, 02 Feb 2026 08:52:00 +0900"
이소영 의원,"코스피 5000은 ‘기록’, 6000은 ‘과제’…현실 가능성은",특히 이소영 의원이 대표 발의한 ‘주가 누르기 방지법(상속세 및 증여세법 개정안)’에 대해서도 이 대통령이 공감의 뜻을 나타낸 것으로 전해졌다. 오너 일가가 지주사 지분 상속·증여 과정에서 세 부담을 줄이기... ,https://economist.co.kr/article/view/ecn202601230055,https://n.news.naver.com/mnews/article/243/0000092314?sid=101,"Mon, 02 Feb 2026 07:00:00 +0900"
이소영 의원,&quot;합당 논의 멈춰야&quot; 재반발…&quot;집안 정리부터&quot; 저격,"[한준호/민주당 의원 : 여기에서 멈춰 주시기 바랍니다. 충분한 숙의 없는 통합은 결코 통합으로 완성되지... 우상호 전 청와대 정무수석을 돕겠다는 입장을 밝혔습니다. (영상취재 : 신동환, 영상편집 : 이소영, 디자인 : 최재영)",https://news.sbs.co.kr/news/endPage.do?news_id=N1008426503&plink=ORI&cooper=NAVER,https://n.news.naver.com/mnews/article/055/0001329382?sid=100,"Mon, 02 Feb 2026 06:22:00 +0900"
이소영 의원,&quot;합당 논의 멈춰야&quot; 공개 요구…&quot;집안 정리 먼저&quot;,"[한준호/민주당 의원 : 여기에서 멈춰 주시기 바랍니다. 충분한 숙의 없는 통합은 결코 통합으로 완성되지... 전 청와대 정무수석을 돕겠다는 입장을 밝혔습니다. (영상취재 : 신동환, 영상편집 : 이소영, 디자인 : 최재영)",https://news.sbs.co.kr/news/endPage.do?news_id=N1008426331&plink=ORI&cooper=NAVER,https://n.news.naver.com/mnews/article/055/0001329326?sid=100,"Sun, 01 Feb 2026 20:07:00 +0900"
이소영 의원,[브릿지 칼럼] 증시 PBR 높이려면 ‘주가 누르기’막아야,"개인적으로 상속세율의 인하 혹은 감면 범위 확대를 선호하지만, 이른바 ‘주가 누르기 방지법’(상속세법·증여세법 개정안, 이소영 의원 대표발의)도 좋은 대안이 될 것이라 생각한다. 상장사 주가가 지나치게... ",https://www.viva100.com/article/20260130500753,https://www.viva100.com/article/20260130500753,"Sun, 01 Feb 2026 17:44:00 +0900"
이소영 의원,"과천 경마장·국군방첩사령부 이전 부지 개발 계획, 지역 정치권 입장 ...","반면, 이소영(민주, 의왕·과천) 국회의원은 현재의 과천 여건상 경마장 이전은 불가피하다는 입장이다. 이 의원은 ‘과천 경마장, 방첩사 이전 및 개발계획에 대한 입장문’을 통해 “경마장은 과천시 세수에 기여해... ",https://www.kgnews.co.kr/news/article.html?no=883034,https://www.kgnews.co.kr/news/article.html?no=883034,"Sun, 01 Feb 2026 15:06:00 +0900"
이소영 의원,"안철수 &quot;6만호 공급대책의 성패, 민주당 의원들 이중성 최대 걸림돌&quot;",더불어 &quot;과천의 이소영 의원은 정부과천청사가 문재인 정부의 8·4 대책에 포함되자 '청사는 숨통'이라며 반대집회에서 목소리를 높였었다&quot;며 &quot;경마장과 방첩사가 포함된 이번에도 그때처럼 거리로 나가실 건지 묻고 싶다... ,https://www.newsis.com/view/NISX20260201_0003497926,https://n.news.naver.com/mnews/article/003/0013741901?sid=100,"Sun, 01 Feb 2026 13:04:00 +0900"
정성호,"박재용 도의원, 의료급여 수급자 장기요양 제한 구조 진단 정책토론회 ...","이날 토론회에는 현장 참석은 하지 못했지만 김동연 경기도지사, 정성호 국회의원, 김진경 경기도의회 의장, 이선구 경기도의회 보건복지위원장이 영상 및 서면 축사를 통해 토론회 개최를 축하하며 논의의 필요성에... ",https://www.newscj.com/news/articleView.html?idxno=3370364,https://www.newscj.com/news/articleView.html?idxno=3370364,"Mon, 02 Feb 2026 14:38:00 +0900"
정성호,1인당 수용자 60~70명 관리하는 ‘극한직업’ 교도관…화성직업훈련교도...,"이날 함께 현장을 찾은 정성호 법무부 장관은 “수용자 1명당 연간 3000만 원이 드는데, 이들이 출소 후 재범할 경우 사회적 비용은 두 배가 된다”며 “교정시설 환경개선과 현장 근무자 처우개선을 최우선 과제로 삼아... ",https://www.munhwa.com/article/11565502?ref=naver,https://n.news.naver.com/mnews/article/021/0002768253?sid=102,"Mon, 02 Feb 2026 14:38:00 +0900"
정성호,"법무부, 제1회 '일잘러·효율러 골든벨을 울려라' 진행",법무부는 정성호 장관이 지난달 30일 '제1회 법무부 일잘러·효율러 골든벨을 울려라'의 우수사례 수상자들과 티타임을 진행하며 수상자들을 격려했다고 밝혔다. 법무부는 법무행정에 임하거나 불필요한 일을 줄여... ,http://www.shinailbo.co.kr/news/articleView.html?idxno=2186111,http://www.shinailbo.co.kr/news/articleView.html?idxno=2186111,"Mon, 02 Feb 2026 12:42:00 +0900"
정성호,"“교도관 제복 입고 난동 진압까지”…정성호 법무부 장관, 교정현장 ‘...",법무부는 정성호 장관이 지난 1월 29일 화성직업훈련교도소를 찾아 교정시설 전반에 대한 현장 진단을... 이날 정성호 장관과 법조 기자단은 교도관 제복을 착용하고 출입 절차와 보안 검색 등 기본 업무부터 수용자 관리... ,https://www.gosiweek.com/article/1065584288643417,https://www.gosiweek.com/article/1065584288643417,"Mon, 02 Feb 2026 12:40:00 +0900"
정성호,“정성호 발언은 망언이며 모욕적” 유시민 작심 비판,유시민 작가가 검찰개혁에 대한 소신을 피력하면서 정성호 법무부 장관을 강하게 비판했다. ‘모든 검사를... 이어 “보완수사권이니 뭐니 되지도 않는 얘기들을 가지고… 저는 특히 정성호 법무부 장관이 국회 상임위에... ,https://www.kmib.co.kr/article/view.asp?arcid=0029337207&code=61111111&cp=nv,https://n.news.naver.com/mnews/article/005/0001829743?sid=100,"Mon, 02 Feb 2026 12:01:00 +0900"
정성호,"윤석열 '검찰 특활비' 잔액 공개, 정성호 결정에 달렸다",정성호 장관의 결정만 남았다 ▲  지난 1월 12일 서울 여의도 국회에서 열린 법제사법위원회 전체회의에서 정성호 법무부 장관이 의원 질의에 답하고 있다. ⓒ 연합뉴스 검찰이 항소장을 제출할 수 있는 시한은 2월 6일이다.... ,https://www.ohmynews.com/NWS_Web/View/at_pg.aspx?CNTN_CD=A0003203644&CMPT_CD=P0010&utm_source=naver&utm_medium=newsearch&utm_campaign=naver_news,https://n.news.naver.com/mnews/article/047/0002503522?sid=102,"Mon, 02 Feb 2026 12:01:00 +0900"
정성호,[인사]한국외대外,김사훈▲일반대학원장 정성호▲통번역대학원장 황지연▲국제지역대학원장 김찬완▲법학전문대학원장 최철▲TESOL대학원장 최호성▲서양어대학장 정민영▲사범대학장 김의수▲AI융합대학장 박정식▲미네르바대학장... ,https://www.munhwa.com/article/11565408?ref=naver,https://n.news.naver.com/mnews/article/021/0002768165?sid=102,"Mon, 02 Feb 2026 11:42:00 +0900"
정성호,"법무부, ‘일잘러‧효율러 골든벨’ 첫 시상…작은 성과도 즉시 보상",▲출처: 법무부 정성호 정성호 법무부 장관은 이날 수상자들을 격려하며 “작은 일이라도 적극적으로 해나가면 그 노력이 모여 결국 큰 변화를 이룬다”며 “맡은 업무의 경중을 떠나 우리 모두가 사회의 안전과 국민의... ,https://www.gosiweek.com/article/1065580358579404,https://www.gosiweek.com/article/1065580358579404,"Mon, 02 Feb 2026 11:36:00 +0900"
정성호,유시민 “민주당·혁신당 합치는 게 이해찬 기획에 가까워”,유 전 이사장은 검찰개혁과 관련해 정성호 법무부 장관을 겨냥해 “정 장관이 상임위에 나와서 ‘모든 검사가 다 나쁘다고 생각하지 말라’고 이야기한 게 모욕적이었다”고 했다. 유 전 이사장은 “지금까지 검찰개혁... ,https://www.hani.co.kr/arti/politics/politics_general/1242859.html,https://n.news.naver.com/mnews/article/028/0002789506?sid=100,"Mon, 02 Feb 2026 11:36:00 +0900"
정성호,&quot;안에선 '모범 생활' 하지만 사회 나가면…&quot; 밤엔 교도관 27명 뿐인 과밀...,이날 현장을 점검한 정성호 법무부 장관은 &quot;어려운 여건 속에서도 묵묵히 임무를 수행해 온 직원들의 노고에 감사드린다&quot;며 &quot;교정시설 환경 개선과 현장 근무자의 처우 개선을 올해 최우선 과제로 삼아 성과를 만들어... ,https://view.asiae.co.kr/article/2026020209125021018,https://n.news.naver.com/mnews/article/277/0005715399?sid=102,"Mon, 02 Feb 2026 11:34:00 +0900"
정성호,[인사]한국외국어대학교,일반대학원장 △정성호 ▷통번역대학원장 △황지연 ▷국제지역대학원장 △김찬완 ▷법학전문대학원장 △최철 ▷TESOL대학원장 △최호성 ▷서양어대학장 △정민영 ▷사범대학장 △김의수 ▷AI융합대학장 △박정식... ,https://www.mt.co.kr/policy/2026/02/02/2026020210575425938,https://n.news.naver.com/mnews/article/008/0005312625?sid=102,"Mon, 02 Feb 2026 11:17:00 +0900"
정성호,"[뉴공 아카이브]퍼니포: ‘한국의 힐러리’ 꿈꿨던 김건희, 총선 출마 준...","정성호 장관 때문에 내가 화났나 봐. 그때,▣홍사훈 : 그러니까 약간 좀 그런 면은 좀 있기는 있었어요.▶김어준 : (웃음)유시민 : 그렇죠? 그러면 안 되는데. 정치하는 사람도 아니니까 뭐.▣홍사훈 : 본심이 그렇지는... ",http://www.ddanzi.com/870936746,http://www.ddanzi.com/870936746,"Mon, 02 Feb 2026 11:16:00 +0900"
정성호,"평택보호관찰소, 업무공유 및 소통강화를 위한 팀별 업무간담회 가져",법무부(장관 정성호) 평택보호관찰소(평택준법지원센터)는 2026년도 보호관찰 중점추진과제의 취지와 방향성을 공유하고 소통과 화합의 조직문화를 정착하기 위해 1월 마지막 주 3일 동안 팀별 업무간담회를 가졌다고 2일... ,http://www.lawissue.co.kr/view.php?ud=2026020211132569679a8c8bf58f_12,http://www.lawissue.co.kr/view.php?ud=2026020211132569679a8c8bf58f_12,"Mon, 02 Feb 2026 11:16:00 +0900"
정성호,"GIST 정철웅 동문, '생명과학·화학 분야 발전기금 1억 원' 기탁","이날 기탁식에는 정철웅 동문과 가족을 비롯해 GIST 임기철 총장, 정성호 교학부총장, 정용화 대외부총장, 김영준 생명의과학융합대학 학장, 서지원 화학과장, 안진희 화학과 교수와 (재)지스트발전재단 최은모... ",http://www.newsworker.co.kr/news/articleView.html?idxno=412669,http://www.newsworker.co.kr/news/articleView.html?idxno=412669,"Mon, 02 Feb 2026 11:10:00 +0900"
정성호,"경기도의회 박재용 의원, 의료급여 수급자 장기요양 서비스 관련 문제 ...","토론회에는 김동연 경기도지사, 정성호 국회의원, 김진경 경기도의회 의장, 이선구 보건복지위원회 위원장 등이 영상 메시지와 서면 축사를 통해 토론회 개최를 축하하고, 의료급여 수급자의 장기요양 접근권 보장과 지속... ",https://www.kmaeil.com/news/articleView.html?idxno=628415,https://www.kmaeil.com/news/articleView.html?idxno=628415,"Mon, 02 Feb 2026 11:06:00 +0900"
정성호,"박재용 경기도의원, 의료급여 수급자 장기요양 이용 제한, 구조적 문제...","이날 현장에는 직접 참석하지 못했지만 김동연 경기도지사와 정성호 국회의원, 김진경 경기도의회 의장, 이선구 경기도의회 보건복지위원회 위원장은 영상 메시지와 서면 축사 등을 통해 토론회 개최를 축하하며, 의료급여... ",https://www.seoul.co.kr/news/publicnews/local_govern/kyungki_do/2026/02/02/20260202500069?wlog_tag3=naver,https://n.news.naver.com/mnews/article/081/0003613566?sid=102,"Mon, 02 Feb 2026 10:42:00 +0900"
정성호,"[동정] 법무장관, '일잘러·효율러' 직원 포상…적극 행정 사례 선정",정성호 법무부 장관은 지난달 30일 '제1회 법무부 일잘러·효율러 골든벨을 울려라' 우수 사례 직원을 포상했다. '일잘러·효율러 골든벨을 울려라' 제도는 사소하더라도 법무 행정에 적극 임하거나 불필요한 일을 줄여... ,https://www.news1.kr/society/general-society/6058640,https://n.news.naver.com/mnews/article/421/0008747632?sid=102,"Mon, 02 Feb 2026 10:33:00 +0900"
정성호,"[게시판] 법무부, 적극·효율행정 '일잘러·효율러' 직원 포상","안윤정 인권구조과 검찰주사, 남승우 국가소송과 행정주사를 선정했다고 2일 밝혔다. 정성호 장관은 &quot;직원들이 보다 적극적이고 효율적으로 업무를 수행할 수 있도록 전폭 지원하겠다&quot;고 말했다. (서울=연합뉴스)",https://www.yna.co.kr/view/AKR20260202063400004?input=1195m,https://n.news.naver.com/mnews/article/001/0015879234?sid=102,"Mon, 02 Feb 2026 10:27:00 +0900"
정성호,"GIST 정철웅 동문, 생명과학/화학 분야 발전기금 1억원 기탁","이날 기탁식에는 정철웅 동문과 가족을 비롯해 GIST 임기철 총장, 정성호 교학부총장, 정용화 대외부총장, 김영준 생명의과학융합대학 학장, 서지원 화학과장, 안진희 화학과 교수와 (재)지스트발전재단 최은모... ",http://www.veritas-a.com/news/articleView.html?idxno=596459,http://www.veritas-a.com/news/articleView.html?idxno=596459,"Mon, 02 Feb 2026 09:06:00 +0900"
정성호,“제 이름은 열쇠따개”…‘배변’수용실·10분 점심 버티는 이유,이와 관련해 정성호 법무부 장관은 &quot;교정시설 환경개선과 현장 근무자의 처우 개선을 올해 최우선 과제로 삼아 성과를 만들어 가겠다&quot;고 밝혔다. ■'교화' 통해 재범 없이 사회 구성원 되는 모습에 행복… 어려움 속 희망... ,https://news.kbs.co.kr/news/pc/view/view.do?ncd=8474661&ref=A,https://n.news.naver.com/mnews/article/056/0012116732?sid=102,"Mon, 02 Feb 2026 09:00:00 +0900"
정성호,"정철웅 GIST 동문, 생명과학·화학 분야 발전기금 1억원 기탁","이날 기탁식에는 정철웅 동문과 가족을 비롯해 임기철 GIST 총장, 정성호 교학부총장, 정용화 대외부총장, 김영준 생명의과학융합대학 학장, 서지원 화학과장, 안진희 화학과 교수와 (재)지스트발전재단 최은모 이사장... ",http://www.enewstoday.co.kr/news/articleView.html?idxno=2389084,http://www.enewstoday.co.kr/news/articleView.html?idxno=2389084,"Mon, 02 Feb 2026 08:54:00 +0900"
정성호,[인사] 한국외국어대학교,글로벌) 윤승영 ▲기획조정처장 정석오 ▲대외협력처장 김강석 ▲연구산학협력단장 전종근 ▲정보처장 신찬수 ▲대학원교학처장 김현정 ▲홍보실장 지성욱 ▲교육혁신원장 김사훈 ▲일반대학원장 정성호,http://www.veritas-a.com/news/articleView.html?idxno=596447,http://www.veritas-a.com/news/articleView.html?idxno=596447,"Mon, 02 Feb 2026 08:52:00 +0900"
정성호,[인사]한국외대,김사훈 ▲일반대학원장 정성호 ▲통번역대학원장 황지연 ▲국제지역대학원장 김찬완 ▲법학전문대학원장 최철 ▲TESOL대학원장 최호성 ▲서양어대학장 정민영 ▲사범대학장 김의수 ▲AI융합대학장 박정식... ,https://www.newsis.com/view/NISX20260202_0003498311,https://n.news.naver.com/mnews/article/003/0013742419?sid=102,"Mon, 02 Feb 2026 08:45:00 +0900"
정성호,"최교진 교육부 장관, 학교 현장의 헌법교육 강화를 위해 관계기관과 업...","교육부(장관 최교진)와 법무부(장관 정성호), 법제처(처장 조원철), 헌법재판연구원(원장 지성수)은 지난달 30일 서울청사에서 학교 현장의 헌법교육 강화를 위한 업무협약을 체결한다. 교육부는 '2026년 민주시민교육... ",https://www.ibabynews.com/news/articleView.html?idxno=147842,https://www.ibabynews.com/news/articleView.html?idxno=147842,"Mon, 02 Feb 2026 08:04:00 +0900"
정성호,"GIST 정철웅 동문, 생명과학·화학 분야 발전기금 1억 원 기탁","이날 기탁식에는 정철웅 동문과 가족을 비롯해 GIST 임기철 총장, 정성호 교학부총장, 정용화 대외부총장, 김영준 생명의과학융합대학 학장, 서지원 화학과장, 안진희 화학과 교수와 (재)지스트발전재단 최은모... ",http://www.kyosu.net/news/articleView.html?idxno=156690,http://www.kyosu.net/news/articleView.html?idxno=156690,"Mon, 02 Feb 2026 07:40:00 +0900"
정성호,"정성호 법무부 장관, 화성직업훈련교도소서 교정 현장 진단",정성호 장관과 법조 기자단 제복 입고 교정공무원 체험 법무부가 현장 중심의 정책 개발과 문제 해결 방안을 모색하기 위해 1월 29일 화성직업훈련교도소에서 교정시설 현장 진단을 실시했다. 이날 현장 진단에는 정성호... ,https://www.lawtimes.co.kr/news/215509,https://www.lawtimes.co.kr/news/215509,"Mon, 02 Feb 2026 05:10:00 +0900"
정성호,"점심 15분뿐, 화장실은 사치…교도관 홀로 86명 감시했다","보니, 훈련 배정을 받지 못한 채 시간만 죽이는 ‘미지정 수용자’들이 급증하고 있다. 체험에 함께한 정성호 법무부 장관은 “교정시설 환경과 근무자 처우를 개선하는 것을 올해 최우선 과제로 삼겠다”고 말했다.",https://www.seoul.co.kr/news/society/2026/02/02/20260202012007?wlog_tag3=naver,https://n.news.naver.com/mnews/article/081/0003613441?sid=102,"Mon, 02 Feb 2026 05:03:00 +0900"
정성호,과밀화에 비명 지르는 교도소… ‘교화’ 대신 ‘번아웃’만 남아,이날 행사에 함께 참여한 정성호 법무부 장관은 “교정 공무원과 교정 시설에 대한 관심이 너무 부족하다”며 “이들에 대한 처우 개선에 힘쓰겠다”고 말했다. 그러면서 교화의 필요성도 강조했다. 정 장관은 “수용자... ,https://www.donga.com/news/Society/article/all/20260201/133276020/2,https://n.news.naver.com/mnews/article/020/0003694121?sid=102,"Mon, 02 Feb 2026 04:33:00 +0900"
