Keyword,Title,Description,Original Link,Link,Publication Date
국정기획위원회,"미 해군 MRO 수혜, 중형 조선사까지 이어질까",산업통상자원부는 지난 6월 국정기획위원회에 보고한 공약 이행 계획에서 한미 조선 협력 강화와 중소 조선사들의 미국 MRO 시장 진출 지원 방안을 발표했다. 장비 대여와 시설 투자 등을 통해 중소형사가 독자적으로 미... ,https://www.kukinews.com/article/view/kuk202508290153,https://www.kukinews.com/article/view/kuk202508290153,"Sat, 30 Aug 2025 06:02:00 +0900"
국정기획위원회,728조 예산 확대에도…구설·논란에 관가 뒤숭숭[쿡~세종],구윤철 경제부총리 겸 기획재정부 장관은 전날 브리핑에서 “투자와 지출 혁신 병행한 이번 예산안은 단순히 한해짜리 예산이 아니라 향후 5년간의 국정 방향을 보여주는 이정표”라며 “어렵게 되살린 회복의 불씨를... ,https://www.kukinews.com/article/view/kuk202508290130,https://www.kukinews.com/article/view/kuk202508290130,"Sat, 30 Aug 2025 06:02:00 +0900"
국정기획위원회,‘사라지는 아이들’ 막으려 나선 경기도…정부 호응은 언제?,"■ 국정기획위, 이주 배경 아동들에게도 가족 센터 등 지원 추진 국정기획위원회 국정과제에도 이주 아동에 대한 지원을 확대하는 방안이 담긴 것으로 확인됐습니다. 국정기획위원회 자료에 따르면, 현재 사실상... ",https://news.kbs.co.kr/news/pc/view/view.do?ncd=8344256&ref=A,https://n.news.naver.com/mnews/article/056/0012019319?sid=102,"Sat, 30 Aug 2025 06:01:00 +0900"
국정기획위원회,다음 주 정기국회…우원식 의장 &quot;개헌특위 구성&quot;,&lt;우원식 국회의장(어제)&gt; &quot;내년 지방선거에 맞춰 합의가능한 것까지만 1차 개헌을 하고 그리고 다음 총선까지 합의하는 것은 2차 개헌을 하고…&quot; 한편 이재명 정부 국정기획위원회도 국정운영 5개년 계획에 개헌에 대한... ,https://www.natv.go.kr/natv/news/newsView.do?newsId=511515,https://www.natv.go.kr/natv/news/newsView.do?newsId=511515,"Sat, 30 Aug 2025 03:18:00 +0900"
국정기획위원회,"한국 여성 임금, 남성보다 29% 낮아…OECD국가 중 최대 격차","이는 국정기획위원회가 지난 13일 발표한 이재명 정부의 123개 국정과제에도 포함됐다. 이와 관련, 여성가족부는 국정운영 5개년 계획안에서 “여성의 경제활동 지원을 강화해 성별 임금 격차를 해소하고 여성의... ",https://www.joongang.co.kr/article/25362900,https://n.news.naver.com/mnews/article/353/0000052779?sid=102,"Sat, 30 Aug 2025 01:17:00 +0900"
국정기획위원회,수뇌부와 잦은 마찰… 한직 돌다 李정부서 파격 승진,"전전했고, 2022년에는 수년간의 근무 평정이 최하위라는 이유로 검사 적격 심사에 회부되기도 했다. 하지만 이재명 정부 출범 후 발족한 국정기획위원회 정치·행정 분과 전문위원으로 위촉돼 검찰 개혁 방안을 다뤘다.",https://www.chosun.com/national/court_law/2025/08/30/YXMKM6H7I5BYTIJXXZEZOKYXBU/?utm_source=naver&utm_medium=referral&utm_campaign=naver-news,https://n.news.naver.com/mnews/article/023/0003926203?sid=102,"Sat, 30 Aug 2025 00:56:00 +0900"
국정기획위원회,"임은정 “정성호, 검찰에 장악돼”… 지검장이 법무장관 개혁안 공격",임 검사장은 “중수청을 어디에 둘지 국정기획위원회에서 많은 논의가 있었고 행안부 산하에 두는 데 찬성했다”면서 “검찰 인적 청산이 안 된 상황에서 법무부에 중수청만 두면 법무부 자리 늘리기만 될 것”이라고... ,https://www.chosun.com/national/court_law/2025/08/30/DFIMQLEHPJBW5M6WK3RJT5FXSA/?utm_source=naver&utm_medium=referral&utm_campaign=naver-news,https://n.news.naver.com/mnews/article/023/0003926204?sid=102,"Sat, 30 Aug 2025 00:56:00 +0900"
국정기획위원회,"포항시, 새정부 국정과제 대응 전략사업 발굴…AI·탄소중립·해양관광...","29일 시청에서 열린 '새정부 국정과제 대응 전략사업 발굴 보고회'에서는 장상길 부시장을 비롯한 간부 공무원들이 대거 참석한 가운데, 국정기획위원회의 5개년 계획에 대응하는 포항시의 전략 방향이 집중 논의됐다.... ",https://www.kyongbuk.co.kr/news/articleView.html?idxno=4050626,https://www.kyongbuk.co.kr/news/articleView.html?idxno=4050626,"Fri, 29 Aug 2025 22:46:00 +0900"
국정기획위원회,‘공공기관 2차 이전’ 유치전 재점화…경쟁 치열,"[앵커] 국정기획위원회가 공공기관 2차 지방 이전을 국정과제로 채택하면서 공공기관 유치전이 다시 시작됐습니다. 원주시는 기존 혁신도시를 이용해 일찌감치 유치전에 나섰고, 춘천과 강릉 등 다른 시군도 걸음을... ",https://news.kbs.co.kr/news/pc/view/view.do?ncd=8344145&ref=A,https://n.news.naver.com/mnews/article/056/0012019229?sid=101,"Fri, 29 Aug 2025 22:02:00 +0900"
국정기획위원회,‘공공기관 2차 이전’ 유치전 재점화…경쟁 치열,"[앵커] 국정기획위원회가 공공기관 2차 지방 이전을 국정과제로 채택하면서 공공기관 유치전이 다시 시작됐습니다. 원주시는 기존 혁신도시를 이용해 일찌감치 유치전에 나섰고, 춘천과 강릉 등 다른 시군도 걸음을... ",https://news.kbs.co.kr/news/pc/view/view.do?ncd=8344067&ref=A,https://n.news.naver.com/mnews/article/056/0012019198?sid=100,"Fri, 29 Aug 2025 21:44:00 +0900"
국정기획위원회,"법무법인 화우, ‘국정감사솔루션팀’ 발족",조성욱 대표변호사는 국회 법제사법위원회 입법심의관으로 활동했고 법무부 기획조정실장을 역임했다.... 국정감사솔루션팀을 기획한 홍정석 GRC센터장은 “국정감사는 기업 경영활동에 큰 영향을 미치는 이벤트”라며... ,https://www.munhwa.com/article/11529342?ref=naver,https://n.news.naver.com/mnews/article/021/0002732853?sid=102,"Fri, 29 Aug 2025 21:32:00 +0900"
국정기획위원회,"대구시, 복지사업과 교부세 포함한 국비 8조 원대 확보의 교두보 마련","특히, 권한대행 체제 전환 이후 대구시는 ▲지방재정협의회(5월 21일) ▲제3차 재정정책자문회의(6월 18일) ▲민주당 대구시당 당정협의회(6월 26일) ▲국정기획위원회 방문(7월 10일, 7월 24일) ▲국민의힘 예산정책협의회... ",https://tk.newdaily.co.kr/site/data/html/2025/08/29/2025082900311.html,https://tk.newdaily.co.kr/site/data/html/2025/08/29/2025082900311.html,"Fri, 29 Aug 2025 21:04:00 +0900"
국정기획위원회,"포항시, 새정부 123대 국정과제 연계한 지역 발전 로드맵 본격 가동","시는 29일 장상길 부시장 주재로 '새정부 국정과제 대응 전략사업 발굴 보고회'를 열고 국정기획위원회가 발표한 국정운영 5개년 계획에 대응해 철강, 이차전지 등 주력산업 경쟁력 강화, 바이오·AI 등 신산업 육성... ",http://www.newstown.co.kr/news/articleView.html?idxno=649413,http://www.newstown.co.kr/news/articleView.html?idxno=649413,"Fri, 29 Aug 2025 20:38:00 +0900"
국정기획위원회,“인건비 보조 대신 성과 기반 지원”…사회적기업 제도 개편 한목소리,/채예빈 기자 장종익 한신대 교수(전 국정기획위원)는 포럼 발제에서 “예산을 단순 복원하는 데 그칠 게... 별도 위원회 설치와 전국단위 네트워크 재설계가 시급하다”고 말했다. 정부도 같은 문제의식을 공유했다.... ,https://futurechosun.com/?p=129456,https://futurechosun.com/?p=129456,"Fri, 29 Aug 2025 20:26:00 +0900"
국정기획위원회,AI·에너지·북극항로...李 경제 뒷받침할 입법 과제 공개,및 국정 과제로 내세운 경제·산업 법안이 담겼다. 인천 영종도에서 1박 2일에 걸쳐 진행된 워크숍에 하정우 대통령실 AI미래기획 수석비서관이 찾아와 강연할 만큼 AI의 중요성은 관련 입법 과제 목록에서도 돋보였다.... ,http://www.fnnews.com/news/202508291942277274,https://n.news.naver.com/mnews/article/014/0005398897?sid=100,"Fri, 29 Aug 2025 19:53:00 +0900"
국정기획위원회,농어촌 6곳 주민에 월 15만원…‘이재명표 기본소득’ 시험한다,올해 예산(395억 원) 대비 약 3배로 늘어난 금액이다. 앞서 국정기획위원회는 13일 발표한 국정운영 5개년 계획에서 현 정부 임기 내 세종집무실을 완성하고 국회 조기 건립을 지원하겠다고 밝힌 바 있다.,https://www.donga.com/news/Economy/article/all/20250829/132281987/1,https://n.news.naver.com/mnews/article/020/0003657566?sid=101,"Fri, 29 Aug 2025 19:44:00 +0900"
국정기획위원회,"230만 소상공인에 25만원씩…이재명 정부, 지역화폐 24조 발행 지원한다",국정기획위원회는 5년간 농어촌 기본소득 지급에 총 6조2000억원이 투입될 것으로 추산했다. 만 0세부터 8세 미만까지만 지급하던 아동수당을 내년에는 9세 미만까지 지급한다. 이에 따라 아동수당 지급 대상은... ,https://www.mk.co.kr/article/11406410,https://n.news.naver.com/mnews/article/009/0005549925?sid=101,"Fri, 29 Aug 2025 19:01:00 +0900"
국정기획위원회,"3년 만에 오른 건강보험료, 월급 309만원이면 얼마 오르나…",보건복지부는 앞서 국정기획위원회에 “올해 건강보험 재정이 당기수지 적자를 기록할 것으로 보인다”며 &quot;건강보험료율을 2% 수준으로 꾸준히 높여가야 한다&quot;고 보고한 바 있다. 최근 16년간 평균 건보료율... ,https://health.chosun.com/site/data/html_dir/2025/08/29/2025082902645.html,https://n.news.naver.com/mnews/article/346/0000096558?sid=004,"Fri, 29 Aug 2025 19:01:00 +0900"
국정기획위원회,"임은정 “정성호 법무장관 개혁안, ‘검찰개혁 5적’ 결과물”",그러면서 “보완수사권을 부여하면 안 된다는 입장으로 국정기획위원회에서 말씀드렸다”고 덧붙였다. 발제를 맡은 김은진 원광대 법학전문대학원 교수는 2021년부터 시행된 검찰청법 개정안을 언급하며... ,https://www.kukinews.com/article/view/kuk202508290136,https://www.kukinews.com/article/view/kuk202508290136,"Fri, 29 Aug 2025 18:52:00 +0900"
국정기획위원회,"포항시, 새 정부 국정 과제 연계 '지역 발전 로드맵' 본격 가동","시는 29일 장상길 부시장 주재로 '새 정부 국정과제 대응 전략 사업 발굴 보고회'를 열고 국정기획위원회가 발표한 국정운영 5개년 계획에 대응해 철강, 이차전지 등 주력산업 경쟁력 강화, 바이오·AI 등 신산업 육성... ",https://www.polinews.co.kr/news/articleView.html?idxno=705648,https://www.polinews.co.kr/news/articleView.html?idxno=705648,"Fri, 29 Aug 2025 18:44:00 +0900"
국정기획위원회,'AI·R&amp;D'에 걸었다…李정부 첫 예산 728조·8%대 확장재정(종합),예산안은 9월 초 국회에 제출되면 각 상임위원회 및 예산결산특위의 감액·증액 심사를 거쳐 오는 12월... 구윤철 부총리 겸 기획재정부 장관은 브리핑에서 &quot;이재명 정부는 출범과 동시에 위축된 경기와 얼어붙은... ,https://www.yna.co.kr/view/AKR20250828181051002?input=1195m,https://n.news.naver.com/mnews/article/001/0015594971?sid=101,"Fri, 29 Aug 2025 18:40:00 +0900"
국정기획위원회,"“누구나 어디서나 건강할 권리를”…병원·돌봄 현장 노동자들, 내달 ...",그런데 지난 겨울 광장 투쟁으로 집권한 새 정부의 국정계획도 “윤석열 정부에서 추진했던 의료 민영화... 중앙노동위원회(이하 ‘중노위’)에 노동쟁의 조정 신청 후 조합원 대상 파업 찬반 투표에서 과반이 파업에... ,https://newscham.net/articles/113949,https://newscham.net/articles/113949,"Fri, 29 Aug 2025 18:38:00 +0900"
국정기획위원회,"광양시 주요 현안 사업, 내년도 예산안 대거 반영",중앙부처와 기획재정부를 수차례 방문하며 국고 확보에 총력을 기울인 결과라는 설명이다. 광양시는 9월부터 국회를 상대로 적극적인 설명과 설득 활동을 이어갈 계획이다. 특히 관련 상임위원회와 국회... ,https://www.newspim.com/news/view/20250829000948,https://www.newspim.com/news/view/20250829000948,"Fri, 29 Aug 2025 18:24:00 +0900"
국정기획위원회,"&quot;법무 장관조차 검찰에 장악&quot; 임은정, 정성호 공개 저격","그는 &quot;이번 (법무부) 첫 인사는 대통령직인수위원회 없이 급하게 하다 보니 난 참사 수준&quot;이라며 &quot;이진수 차관... 이어 &quot;중수청을 어디에 둘 것인지에 대해서도 국정기획위에서 많은 논의가 있었고, 유능한 검사들이 중수청에... ",https://www.sisajournal.com/news/articleView.html?idxno=344583,https://n.news.naver.com/mnews/article/586/0000110548?sid=102,"Fri, 29 Aug 2025 18:22:00 +0900"
국정기획위원회,"대구시, 3년 연속 국비 8조원대 확보 ‘청신호’","특히 권한대행 체제 전환 이후 대구시는 지방재정협의회(5.21), 제3차 재정정책자문회의(6.18), 민주당 대구시당 당정협의회(6.26), 국정기획위원회 방문(7.10, 7.24), 국민의힘 예산정책협의회(7.25), 경제부총리 예산협의회(8.... ",https://www.nspna.com/news/?mode=view&newsid=774304,https://www.nspna.com/news/?mode=view&newsid=774304,"Fri, 29 Aug 2025 18:16:00 +0900"
국정기획위원회,‘부동산 악몽 재연될라’ 공급책 집중하는 與… 온플법은 축소,"자본시장법 개정은 이 대통령의 대선 공약이자, 국정기획위원회의 ‘5개년 계획’에도 포함된 핵심 과제다. 다만 민주당이 발표한 ‘정기국회 중점 법안’ 목록에는 자본시장법 개정이 포함되지 않았다. 일각에선 “정책... ",https://biz.chosun.com/policy/politics/assembly/2025/08/29/DSHNB6BUC5AELCPSJGGMXASEJU/?utm_source=naver&utm_medium=original&utm_campaign=biz,https://n.news.naver.com/mnews/article/366/0001104056?sid=100,"Fri, 29 Aug 2025 18:14:00 +0900"
국정기획위원회,&quot;檢에 장악당한 정성호&quot; 맹비난한 임은정,임 지검장은 국정기획위원회 전문위원으로 검찰개혁안 밑그림을 마련하는 데 참여했다. 그는 “인적 청산이 안 된 상황에서 법무부 산하에 중대범죄수사청을 두면 자리 늘리기만 되겠다는 생각이 들어 행정안전부 밑에... ,https://www.hankyung.com/article/2025082910591,https://n.news.naver.com/mnews/article/015/0005177656?sid=102,"Fri, 29 Aug 2025 18:03:00 +0900"
국정기획위원회,지역화폐 발행에 1.1조 … 아동·소상공인 현금성 지원도 확대,국정기획위원회는 5년간 농어촌 기본소득 지급에 총 6조2000억원이 투입될 것으로 추산했다. 만 0세부터 8세 미만까지만 지급하던 아동수당을 내년에는 9세 미만까지 지급한다. 이에 따라 아동수당 지급 대상은... ,https://www.mk.co.kr/article/11406369,https://n.news.naver.com/mnews/article/009/0005549891?sid=101,"Fri, 29 Aug 2025 18:01:00 +0900"
국정기획위원회,"[창의·융합·혁신 포항] 숲과 물이 어우러진 친환경 체험장, 내연산보...","시는 29일 장상길 부시장 주재로 '새정부 국정과제 대응 전략사업 발굴 보고회'를 열고 국정기획위원회가 발표한 국정운영 5개년 계획에 대응해 철강, 이차전지 등 주력산업 경쟁력 강화, 바이오·AI 등 신산업 육성... ",http://www.newsprime.co.kr/news/article.html?no=702283,http://www.newsprime.co.kr/news/article.html?no=702283,"Fri, 29 Aug 2025 17:50:00 +0900"
국정기획위원회,"[배종찬 칼럼] 李 대통령 지지율 직격탄 '이춘석, 조국 그리고 트럼프'","지난 대통령 선거 당시 이재명 후보의 비서실장을 맡았고, 아무런 경제 경력과 전문성이 없지만 국정기획위원회 경제 2분과장 직책을 수행하던 이 의원이 인공지능(AI) 관련 주식 종목을 차명 거래했다는 의혹이 이... ",https://weekly.hankooki.com/news/articleView.html?idxno=7126141,https://weekly.hankooki.com/news/articleView.html?idxno=7126141,"Fri, 29 Aug 2025 17:46:00 +0900"
국정기획위원회,'투자자 표심 잡자'…배당금 감세 입법 쏟아져,◇“개인투자자 장기 투자 유도” 29일 정치권에 따르면 국회 기획재정위원회 소속 차규근 조국혁신당... 이재명 정부가 내세운 국정과제에 210조원에 달하는 재원이 필요한 점도 세제 개편 셈법을 복잡하게 하는... ,https://www.hankyung.com/article/2025082910271,https://n.news.naver.com/mnews/article/015/0005177620?sid=100,"Fri, 29 Aug 2025 17:42:00 +0900"
국정기획위원회,"'구멍 술술' AI 인재 육성…시수는 부족, 교원은 미비","전망입니다.국정기획위원회는 5개년 계획으로 초중고 AI 역량을 강화하고, 생애주기별 AI 교육을 지원하겠다고 밝혔습니다. 하지만 아직은 원론적인 수준에 머물러 있어 구체화가 필요하다는 지적입니다.무엇보다 수업... ",https://news.mtn.co.kr/news-detail/2025082916295858898,https://news.mtn.co.kr/news-detail/2025082916295858898,"Fri, 29 Aug 2025 17:42:00 +0900"
국정기획위원회,"대구시, 2026년 국비 4.2조 확보…역대 최대 규모","특히 지방재정협의회, 재정정책자문회의, 여야 예산정책협의회, 국정기획위원회 방문 등 다양한 대외 접촉이 예산 반영에 결정적 영향을 미쳤다. 분야별 주요 반영 사업으로는 첫째 미래 신산업 육성에 △ AX... ",https://www.pressian.com/pages/articles/2025082916082595326?utm_source=naver&utm_medium=search,https://n.news.naver.com/mnews/article/002/0002403672?sid=102,"Fri, 29 Aug 2025 17:39:00 +0900"
국정기획위원회,[인터뷰] 이재준 수원시장 &quot;4기 신도시 아닌 역세권 고밀복합개발이 해...,"그래서 그는 21대 대통령선거 당시 이재명 더불어민주당 대선 후보에 수익성 없는 신도시 건설보다 역세권 고밀복합 개발 추진을 건의했고, 이어 새정부 출범 후에는 국정기획위원회에도 이 같은 내용을 제안했다. 그가... ",https://www.kpinews.kr/newsView/1065593744300275,https://www.kpinews.kr/newsView/1065593744300275,"Fri, 29 Aug 2025 17:31:00 +0900"
국정기획위원회,[이로운넷Pic] 더불어민주당 사회연대경제 입법추진단 발족…&quot;사회연대...,"위원회를 비롯해 국회 사회혁신포럼, 사회연대경제전국회의가 공동주최했다. 행사에는 다양한 사회연대경제 분야 활동가와 단체 관계자 500여 명이 운집해 성황을 이루었고, 우원식 국회의장, 이한주 국정기획위원장... ",https://www.eroun.net/news/articleView.html?idxno=62129,https://www.eroun.net/news/articleView.html?idxno=62129,"Fri, 29 Aug 2025 17:26:00 +0900"
국정기획위원회,"포항시, 새정부 123대 국정과제 연계 ‘지역 발전 로드맵’ 본격 가동","29일 포항시는 장상길 부시장 주재로 ‘새정부 국정과제 대응 전략사업 발굴 보고회’를 열고, 국정기획위원회가 발표한 국정운영 5개년 계획에 대응해 철강, 이차전지 등 주력산업 경쟁력 강화와 바이오·AI 등 신산업... ",https://www.viva100.com/article/20250829500800,https://www.viva100.com/article/20250829500800,"Fri, 29 Aug 2025 17:24:00 +0900"
국정기획위원회,[이로운넷현장] &quot;10년 묵은 과제 풀자&quot; 국회 대회의실 가득 메운 열망.....,"더불어민주당 사회적경제위원회, 국회 사회혁신포럼, 사회연대경제전국회의가 공동 주최했으며 현장에는... 이한주 국정기획위원장은 &quot;사회연대경제의 시작은 김대중 대통령께서 실업 극복 국민운동으로부터 비롯됐다... ",https://www.eroun.net/news/articleView.html?idxno=62128,https://www.eroun.net/news/articleView.html?idxno=62128,"Fri, 29 Aug 2025 17:22:00 +0900"
국정기획위원회,"법무법인 화우, ‘국정감사솔루션팀’ 발족","외교통일위원회 수석전문위원), 박재현 고문(전 매일경제 편집국장), 윤영호 고문(전 동아일보 전문기자)... 국정감사솔루션팀을 기획한 홍정석 GRC센터장은 “국정감사는 이제 피해갈 수 없는 기업 경영활동에 큰 영향을... ",http://www.edaily.co.kr/news/newspath.asp?newsid=03883526642272240,https://n.news.naver.com/mnews/article/018/0006101930?sid=102,"Fri, 29 Aug 2025 17:17:00 +0900"
국정기획위원회,"포항시, 새정부 국정과제 연계 지역 발전 본격화","29일 장상길 부시장 주재로 열린 '새정부 국정과제 대응 전략사업 발굴 보고회'에서는 국정기획위원회가 발표한 5개년 국정운영 계획에 맞춰 철강, 이차전지 등 기존 주력산업 경쟁력 강화와 바이오·인공지능(AI) 등... ",https://www.getnews.co.kr/news/articleView.html?idxno=838200,https://www.getnews.co.kr/news/articleView.html?idxno=838200,"Fri, 29 Aug 2025 17:08:00 +0900"
국정기획위원회,李정부 첫 예산 728兆·8%대 확장재정…'눈덩이' 국가채무 어쩌나,구윤철 부총리 겸 기획재정부 장관(오른쪽 두번째)이 지난 28일 정부세종청사 중앙동 공용브리핑실에서... 예산안은 9월 초 국회에 제출되면 각 상임위원회 및 예산결산특위의 감액·증액 심사를 거쳐 오는 12월... ,https://www.esgeconomy.com/news/articleView.html?idxno=12587,https://www.esgeconomy.com/news/articleView.html?idxno=12587,"Fri, 29 Aug 2025 16:54:00 +0900"
국정기획위원회,"포항시, 새정부 123대 국정과제 연계한 지역 발전 로드맵 본격 가동","시는 29일 장상길 부시장 주재로 ‘새정부 국정과제 대응 전략사업 발굴 보고회’를 열고 국정기획위원회가 발표한 국정운영 5개년 계획에 대응해 철강, 이차전지 등 주력산업 경쟁력 강화, 바이오·AI 등 신산업 육성... ",https://www.nspna.com/news/?mode=view&newsid=774270,https://www.nspna.com/news/?mode=view&newsid=774270,"Fri, 29 Aug 2025 16:50:00 +0900"
국정기획위원회,교육부·기재부 지역의사제 '수용 곤란'…국회 제2의 의정갈등 우려,"ⓒ의협신문 더불어민주당이 이재명 대통령 국정기획위원회 국정과제에 포함된 지역의사제를 '2025년 정기국회 중점 처리법안'에 포함하면서 추진 의지를 본격화한 가운데, 교육부와 기재부 등 관계부처가 지역의사제에... ",http://www.doctorsnews.co.kr/news/articleView.html?idxno=160956,http://www.doctorsnews.co.kr/news/articleView.html?idxno=160956,"Fri, 29 Aug 2025 16:46:00 +0900"
국정기획위원회,사회문제 해결 나설 '사회연대경제 활성화' 이루려면 기본법 제정 필수,"더불어민주당 사회적경제위원회, 국회 사회혁신포럼, 사회연대경제전국회의가 지난 28일 서울 여의도... 이날 행사에는 우원식 국회의장, 정청래 민주당 당대표, 이한주 국정기획위원장 등도 축사를 보내 힘을 보탰다.... ",https://www.ntoday.co.kr/news/articleView.html?idxno=118920,https://www.ntoday.co.kr/news/articleView.html?idxno=118920,"Fri, 29 Aug 2025 16:44:00 +0900"
국정기획위원회,정부 예산 728조 '확장재정'…R&amp;D예산 역대급 증가,구윤철 부총리 겸 기획재정부 장관(오른쪽 두번째)이 지난 28일 정부세종청사 중앙동 공용브리핑실에서... 예산안은 9월 초 국회에 제출되면 각 상임위원회 및 예산결산특위의 감액·증액 심사를 거쳐 오는 12월... ,https://www.goodnews1.com/news/articleView.html?idxno=451043,https://www.goodnews1.com/news/articleView.html?idxno=451043,"Fri, 29 Aug 2025 16:42:00 +0900"
국정기획위원회,"대구시, 3년 연속 국비 8조원대 확보…'교두보' 마련",시에 따르면 권한대행 체제 전환 이후 △지방재정협의회(5월 21일) △제3차 재정정책자문회의(6월 18일) △민주당 대구시당 당정협의회(6월 26일) △국정기획위원회 방문(7월 10~24일) △국민의힘 예산정책협의회(7월 25일)... ,https://ilyo.co.kr/?ac=article_view&entry_id=498773,https://ilyo.co.kr/?ac=article_view&entry_id=498773,"Fri, 29 Aug 2025 16:40:00 +0900"
국정기획위원회,"[기고] 산업통상자원부, 홍천 양수발전소 실시계획인가 고시에 생존권을...","앞서 주민들은 대통령실과 국정기획위원회를 방문해 서류 공개와 사업 전면 재검토를 약속받았지만, 산자부는 이를 뒤집고 인가를 강행했다. 이번 결정을 주도한 김정관 산업통상자원부 장관은 양수발전소 핵심 설비를... ",https://www.womennews.co.kr/news/articleView.html?idxno=266799,https://n.news.naver.com/mnews/article/310/0000129077?sid=110,"Fri, 29 Aug 2025 16:39:00 +0900"
국정기획위원회,"포항시, 새정부 국정과제 연계 지역발전 로드맵 가동",포항시가 새정부 국정과제(123대 과제)를 시정과 연계해 지역 발전을 견인할 로드맵 가동에 나섰다.시는 29일 장상길 부시장 주재로 ‘새정부 국정과제 대응 전략사업 발굴 보고회’를 열고 국정기획위원회가 발표한... ,https://www.kbsm.net/news/view.php?idx=487915,https://www.kbsm.net/news/view.php?idx=487915,"Fri, 29 Aug 2025 16:36:00 +0900"
