Keyword,Title,Description,Original Link,Link,Publication Date
기재부,"[태평로] 李 대통령, 국가 소멸 막을 의지가 있나","검찰청 폐지, 기재부 해체, 환경부 확대 개편이 국민 실생활 개선과 무슨 관련이 있는지 잘 이해되지 않는다. 저출생 문제 해결이 국가의 최우선 과제임은 좌우 모두 동의하고 있다. 그런데도 이재명 정부가 정부 조직 개편... ",https://www.chosun.com/opinion/taepyeongro/2025/09/14/ZXDVM4RF25GPPDGDVISNSF6RLU/?utm_source=naver&utm_medium=referral&utm_campaign=naver-news,https://n.news.naver.com/mnews/article/023/0003929122?sid=110,"Sun, 14 Sep 2025 23:40:00 +0900"
기재부,배경훈 장관 &quot;5년내 GPU 20만장 확보…AI로 2030년까지 성장잠재력 3% 회...,"배 장관은 &quot;기술 전문가들이 충분히 R&amp;D 예산을 검토할 시간이 부족해 부실이 발생할 수밖에 없었다&quot;며 &quot;예산권 강화도 기재부와 과기부 간 역할이 잘 정립돼야 할 것 같고, 이런 부분에서 이야기하고 있다&quot;고 말했다.... ",https://www.busan.com/view/busan/view.php?code=2025091423021708251,https://n.news.naver.com/mnews/article/082/0001344792?sid=101,"Sun, 14 Sep 2025 23:28:00 +0900"
기재부,"정부, 미국에 한미 통화스와프 제안…&quot;외환 시장 영향 최소화&quot;","대통령실 관계자도 &quot;기재부 입장을 참고해달라&quot;면서 &quot;국익을 최우선으로 논의를 진행 중&quot;이라고 설명했습니다. 앞서 김용범 대통령실 정책실장은 지난 9일 토론회에서 &quot;외환시장에 미칠 충격에 대해 같이 고민하고, 미국이... ",http://www.yonhapnewstv.co.kr/AKR20250914224538zKH,https://n.news.naver.com/mnews/article/422/0000781286?sid=100,"Sun, 14 Sep 2025 22:46:00 +0900"
기재부,'동남권 순환 광역철도 예타 촉구' 건설소방위 원안 가결,6㎞ 광역철도 노선이다. 지난 2021년 제4차 국가철도망 구축계획에 반영됐고 2024년 기재부 예비타당성 조사 대상에 선정된 후 지난해 12월부터 올해12월까지 조사가 진행되고 있다.,http://www.gnmaeil.com/news/articleView.html?idxno=571002,http://www.gnmaeil.com/news/articleView.html?idxno=571002,"Sun, 14 Sep 2025 22:18:00 +0900"
기재부,산청 내년 신규사업 정부안에 대거 반영,항구복구 특별교부세 193억 원을 추가 확보해 조속한 군민 일상 회복에 속도를 낸다. 군은 정부 공모사업과 총액배분 사업 등 국비가 확정되지 않은 사업에도 기재부와 국회의원 등과 협력해 국비 확보에 전력할 방침이다.,http://www.gnmaeil.com/news/articleView.html?idxno=570996,http://www.gnmaeil.com/news/articleView.html?idxno=570996,"Sun, 14 Sep 2025 22:18:00 +0900"
기재부,"[정동칼럼]한은 ‘빚’에 기댄 정부, 재정 흔들린다","기재부의 일시차입 남용은 재정적자와 세수 부족을 드러내기 싫어 되풀이해온 낡은 습관이다. “어차피 한국은행이 빌려주겠지”라는 안일한 인식은 예산 편성과 집행의 긴장감을 무너뜨리고, 세입 예측의 정확성과 지출... ",https://www.khan.co.kr/article/202509142130005,https://n.news.naver.com/mnews/article/032/0003396384?sid=110,"Sun, 14 Sep 2025 21:30:00 +0900"
기재부,"이영주 경기도의원, 경원선 1호선 증차ㆍ셔틀열차 운행 추진 상황 점검","또한 “코레일도 사업 추진 의지가 있고 지자체들도 원인자 부담을 감수하며 합의한 상황에서 불필요한 경제성 검토로 사업이 지연되지 않도록 국토부·기재부와 협의하고, 국비 반영을 통해 국가 주도 사업으로 추진될... ",https://www.ksmnews.co.kr/news/view.php?idx=563045,https://www.ksmnews.co.kr/news/view.php?idx=563045,"Sun, 14 Sep 2025 21:08:00 +0900"
기재부,"임창휘 의원, 경기주택도시공사 사장 후보 인사청문회에서 경기RE100과 ...","동부의 발전을 위해 GH가 가능한 모든 역량을 쏟겠다”며, “평화경제특구의 성공에 필수적인 규제 완화와 재정 지원을 끌어내기 위해 통일부, 국방부, 기재부 등 중앙정부와의 협력 강화에 최선을 다하겠다”고 답했다.",https://www.ksmnews.co.kr/news/view.php?idx=563147,https://www.ksmnews.co.kr/news/view.php?idx=563147,"Sun, 14 Sep 2025 21:07:00 +0900"
기재부,"정부, 미국에 무제한 통화스와프 요청?…대통령실 “이런저런 얘기 중”",정부가 14일 한-미 관세협상을 통해 합의한 3500억달러(약 485조원) 규모의 대미 투자펀드 세부 협상에 과정에서 무제한 한-미 통화스와프 개설을 요구한 것으로 알려졌다. 대통령실 고위관계자는 14일 ‘미국 정부에... ,https://www.hani.co.kr/arti/politics/bluehouse/1218667.html,https://n.news.naver.com/mnews/article/028/0002766312?sid=100,"Sun, 14 Sep 2025 20:18:00 +0900"
기재부,"정부, 미국에 통화스와프 요청…“외환시장 혼란 최소화 필요”","그러나 기재부는 “한미간 협의 중인 사항에 대해 구체적인 내용은 확인할 수 없다”고 설명했습니다. 통화스와프는 유사시 자국 화폐를 상대국에 맡기고, 미리 정해진 환율로 상대국 통화를 빌리는 계약을 말합니다. 우리... ",https://news.kbs.co.kr/news/pc/view/view.do?ncd=8357142&ref=A,https://n.news.naver.com/mnews/article/056/0012029001?sid=101,"Sun, 14 Sep 2025 20:14:00 +0900"
기재부,"한국, 미국에 무제한 통화스와프 요구했나…“말 못한다”",우리 정부가 미국과 관세 후속 협상을 벌이면서 무제한 한미통화스와프를 요구한 걸로 알려졌다. 한미통화스와프는 최근 미국 정부의 불공정 협상 요구에 대한 한국의 맞대응카드 성격에서 나온 걸로 전해졌다. 미국은... ,http://www.edaily.co.kr/news/newspath.asp?newsid=01856486642300120,https://n.news.naver.com/mnews/article/018/0006115647?sid=101,"Sun, 14 Sep 2025 20:00:00 +0900"
기재부,"산청군, 2026년 정부 예산에 신규사업 대거 반영",산청군은 정부 공모사업과 총액배분 사업 등 국비가 확정되지 않은 사업에 대해서도 기재부와 국회의원 등과 협력해 확보에 총력을 기울인다는 방침이다. 이승화 군수는 &quot;현재 가용 가용한 모든 행정력을 동원해... ,https://www.gnnews.co.kr/news/articleView.html?idxno=618790,https://www.gnnews.co.kr/news/articleView.html?idxno=618790,"Sun, 14 Sep 2025 19:24:00 +0900"
기재부,"밀양시, 안일환 전 대통령실 경제수석·조재호 전 농진청장 영입","행정고시 32회 출신인 안 고문은 기획재정부 예산 실무부서를 두루 거친 후 기재부 예산실장, 제2차관, 주OECD 특명 전권대사 등 요직을 거치며 예산 분야에서 탁월한 전문성을 인정 받은 인물이다. 특히 안 고문은... ",https://www.gnnews.co.kr/news/articleView.html?idxno=618787,https://www.gnnews.co.kr/news/articleView.html?idxno=618787,"Sun, 14 Sep 2025 19:24:00 +0900"
기재부,"산청군, 내년 정부 예산에 신규사업 대거 반영..재난 안전·관광 등 탄력",산청군은 정부 공모사업과 총액배분 사업 등 국비가 확정되지 않은 사업에 대해서도 기재부와 국회의원 등과 협력해 확보에 총력을 기울인다는 방침이다. 이승화 산청군수는 “현재 가용 가용한 모든 행정력을... ,http://kpenews.com/View.aspx?No=3781347,http://kpenews.com/View.aspx?No=3781347,"Sun, 14 Sep 2025 18:32:00 +0900"
기재부,임실군-기획재정부-국민연금공단 도내 첫 상생 자매결연‘맞손’,"또한, 이 자리에는 전북특별자치도 김관영 도지사와 기재부 및 국민연금공단 간부급 관계자, 지역 주민 대표... 심 민 군수는“오늘 이렇게 처음으로 기획재정부 구윤철 부총리님과 김태현 이사장님이 함께 기재부와... ",http://sjbnews.com/news/news.php?number=859751,http://sjbnews.com/news/news.php?number=859751,"Sun, 14 Sep 2025 18:18:00 +0900"
기재부,의무지출 급증하는 韓…&quot;재정파탄 남의 일 아니다&quot;,기재부가 최근 내놓은 ‘제3차 장기재정전망’(2025~2065)에 따르면 구조개혁이 수반되지 않을 경우... 지난달 무디스 연례협의단은 구윤철 부총리 겸 기재부 장관을 찾아 “아직은 재정 비용과 부채 부담을 관리할 수... ,https://www.hankyung.com/article/2025091428391,https://n.news.naver.com/mnews/article/015/0005184705?sid=101,"Sun, 14 Sep 2025 18:10:00 +0900"
기재부,"총리, 부총리, 장관님들이 오셨는데",구윤철 부총리의 임실군 방문은 국민연금공단(이사장 김태현)이 '기재부' '임실군'과 함께하는 '지방살리기 상생 자매결연'협약식 참석을 위해서다. 행사 자체는 비교적 소박하고 한가한 쪽이다. 그러나 제3금융중심지... ,http://www.domin.co.kr/news/articleView.html?idxno=1528800,http://www.domin.co.kr/news/articleView.html?idxno=1528800,"Sun, 14 Sep 2025 18:02:00 +0900"
기재부,"與 &quot;기재부·금융위 개편안, 합의 안되면 패스트트랙 지정&quot;",현재 기재부와 금융위 소관 상임위원회인 기획재정위원회와 정무위원회는 국민의힘이 위원장을 맡고 있다.... 당초 정부가 1월을 목표로 했던 기재부 분할과 금융위 개편 작업이 수개월 미뤄질 수밖에 없는 것이다.... ,http://www.edaily.co.kr/news/newspath.asp?newsid=01781046642300120,https://n.news.naver.com/mnews/article/018/0006115610?sid=100,"Sun, 14 Sep 2025 17:51:00 +0900"
기재부,&quot;과기AI장관회의 신설…韓 제조업 강점 살려 '피지컬 AI' 승부수&quot;,과기정통부 장관이 기재부 장관과 나란히 부총리가 되면서 과학기술계에서는 예산권 조정에 대한 기대가 커졌다. 배 장관은 “전문가들이 R&amp;D 예산안을 (기재부에 넘기느라) 검토할 시간이 부족하고 부실한 부분이... ,https://www.sedaily.com/NewsView/2GXWE6QSZZ,https://n.news.naver.com/mnews/article/011/0004532894?sid=105,"Sun, 14 Sep 2025 17:50:00 +0900"
기재부,[여의대로] 두렵기만 했던 S&amp;P·무디스 또 등장하나,우리 경제를 바라보는 국제금융시장의 눈길도 곱지 않을 것이다.때마침 정부는 조직개편을 통해 기재부를... 확장 재정에 경계심을 갖고 속도 조절이 필요하다는 기재부의 목소리는 이제 수면 아래로 가라앉게 됐다. 앞서... ,https://www.asiatoday.co.kr/view.php?key=20250914010007429,https://www.asiatoday.co.kr/view.php?key=20250914010007429,"Sun, 14 Sep 2025 17:50:00 +0900"
기재부,산청군 내년 정부 예산에 신규사업 대거 반영,산청군은 정부 공모사업과 총액배분 사업 등 국비가 확정되지 않은 사업에 대해서도 기재부와 국회의원 등과 협력해 확보에 총력을 기울인다는 방침이다. 이승화 군수는 &quot;현재 가용 가용한 모든 행정력을 동원해... ,http://www.gndomin.com/news/articleView.html?idxno=447610,http://www.gndomin.com/news/articleView.html?idxno=447610,"Sun, 14 Sep 2025 17:30:00 +0900"
기재부,&quot;부·울·경 30분 시대 위해 동남권 광역철도 선결돼야&quot;,지난 2021년 제4차 국가철도망 구축계획에 반영됐고 지난 2024년 기재부 예비타당성 조사 대상에 선정된 후 2024년 12월부터 2025년 12월까지 조사가 진행되고 있다. 서희봉 위원장은 이 사업이 통과된다면 부산·울산·경남... ,https://www.newsgn.com/news/articleView.html?idxno=503968,https://www.newsgn.com/news/articleView.html?idxno=503968,"Sun, 14 Sep 2025 17:22:00 +0900"
기재부,"산청군, 내년 정부 예산에 신규사업 대거 반영",산청군은 정부 공모사업과 총액배분 사업 등 국비가 확정되지 않은 사업에 대해서도 기재부와 국회의원 등과 협력해 확보에 총력을 기울인다는 방침이다. 이승화 산청군수는 &quot;현재 가용 가용한 모든 행정력을 동원해... ,https://www.newsgn.com/news/articleView.html?idxno=503954,https://www.newsgn.com/news/articleView.html?idxno=503954,"Sun, 14 Sep 2025 17:18:00 +0900"
기재부,"경남도, 기재부와 외국인력 지원책 현장 간담회","경남도가 외국인력 지원책을 논의하고자 10일 도청에서 현장 간담회를 열었다. 유수영 기획재정부 미래전략국장 등 정부 부처와 도내 조선·항공·ICT 업체, 경영자총협회, 경남연구원 등 관계자가 참석했다.... ",https://www.idomin.com/news/articleView.html?idxno=946178,https://www.idomin.com/news/articleView.html?idxno=946178,"Sun, 14 Sep 2025 17:16:00 +0900"
기재부,"[이슈+] 금융 조직개편, 국회에서 더딘걸음…정책 추진도 ‘올스톱’",제출한 개정안에는 기재부를 기획예산처와 재정경제부로 분리하고 금융위원회를 금융감독위원회로... 기재부 개편과 금감위 신설의 경우 이를 심사하는 국회 상임위원회 위원장이 모두 국민의힘 소속이기 때문에 야당의... ,https://www.ekn.kr/web/view.php?key=20250914023496654,https://www.ekn.kr/web/view.php?key=20250914023496654,"Sun, 14 Sep 2025 17:10:00 +0900"
기재부,"임실군, 도내 첫 상생 자매결연","또한, 이 자리에는 전북특별자치도 김관영 도지사와 기재부 및 국민연금공단 관계자, 지역 주민 대표 등 30여 명도 참석해 자리를 빛냈다. 이번 협약은 국민주권정부 출범 후 첫 경제관계장관회의에서 마련된'지방살리기... ",http://www.jjn.co.kr/news/articleView.html?idxno=1017297,http://www.jjn.co.kr/news/articleView.html?idxno=1017297,"Sun, 14 Sep 2025 16:54:00 +0900"
기재부,"[단독] 정부, '25% 관세 감수' 여지에 &quot;모든 가능성 열려 있어&quot;","약속의 성격이 아직 명확하지 않지만, 트럼프가 설명하는 방식과 약간이라도 비슷하다면 한국과 일본이 합의를 수용하는 게 너무나도 어리석다&quot;고 말했습니다. #관세협상 #한미 #대미투자 #산업부 #기재부 #대통령실",http://www.yonhapnewstv.co.kr/AKR20250914164716FeZ,https://n.news.naver.com/mnews/article/422/0000781234?sid=100,"Sun, 14 Sep 2025 16:48:00 +0900"
기재부,"특검법 뒤집은 민주당, 정부조직개편안 ‘암초’… 올해 힘들 듯","더불어민주당이 기획재정부(기재부)와 금융위원회 기능을 재구성하는 정부조직법 개정안을 당론으로... 기재부의 예산 기능을 분리해 기획예산처를 만들고, 대신 기재부에 금융위원회(금융위)의 국내 금융 정책을 넘겨... ",https://www.dt.co.kr/article/12017824?ref=naver,https://n.news.naver.com/mnews/article/029/0002982033?sid=100,"Sun, 14 Sep 2025 16:27:00 +0900"
기재부,새만금 공항 취소 판결 후폭풍… 지방공항 추진 지자체들도 제동 걸릴까...,원칙을 훼손하는 전형적 편법이며 멸종위기종 서식지 파괴와 조류 충돌 위험 또한 심각하다”고 지적했다. 현재 흑산공항은 기재부에서 타당성 재조사를 하고 있으며 만약 조사가 길어질 경우 연내 착공이 불투명하다.,https://www.seoul.co.kr/news/society/law/2025/09/14/20250914500067?wlog_tag3=naver,https://n.news.naver.com/mnews/article/081/0003574494?sid=102,"Sun, 14 Sep 2025 16:26:00 +0900"
기재부,"양도세 대주주 기준, 다시 50억으로 후퇴?…배당 분리과세도 추가 완화...","기재부 관계자는 “대주주 기준 변경은 정부 시행령으로 정할 사안이지만 대통령이 국회에 맡기겠다고 한... 이후, 구윤철 부총리 겸 기재부 장관은 대주주 양도세 기준 관련 “정부 정책에서 그 결정이 반드시 옳다고는... ",https://www.dt.co.kr/article/12017803?ref=naver,https://n.news.naver.com/mnews/article/029/0002982013?sid=101,"Sun, 14 Sep 2025 15:44:00 +0900"
금융위,갈등 커지는 금융당국…조직개편은 첩첩산중,예정된 금융위원회의 내부 혼란도 심하다. 야당의 반대로 국회에서 관련 법안 처리도 늦어질 것으로 보여... 금융위가 금감위로 개편되면서 금감원의 주요 기능을 가져가는 방안을 논의하는 것도 금감원 직원들의 반발을... ,https://view.asiae.co.kr/article/2025091411140808005,https://n.news.naver.com/mnews/article/277/0005651665?sid=101,"Mon, 15 Sep 2025 06:15:00 +0900"
금융위,'금융위 해체' 정부조직 개편안 발표에 신용정보협회 회추위 구성 불발...,"금융위원회 해체를 포함한 정부 조직개편 계획 발표된 가운데, 차기 회장 선임을 위한 회장후보추천위원회 구성이 불발됐다. 금융위원회 해체가 기정사실화 되면서 후속 인사가 필요해진 만큼, 차기 회장 선임 지연은... ",http://www.fntimes.com/html/view.php?ud=2025091217203090838a55064dd1_18,http://www.fntimes.com/html/view.php?ud=2025091217203090838a55064dd1_18,"Mon, 15 Sep 2025 06:02:00 +0900"
금융위,"[데스크 시각] 금융당국 조직개편, 왜 지금인가",밑그림은 금융위원회의 정책 기능을 기획재정부에서 쪼갠 재정경제부로 옮기고 17년 전의 금융감독위원회를... 금융위 내부에선 이재명 대통령의 ‘열일(열심히 일함)’ 칭찬에 뒤통수 맞았다는 탄식이 나온다. ‘어차피... ,https://www.etoday.co.kr/news/view/2505996,https://www.etoday.co.kr/news/view/2505996,"Mon, 15 Sep 2025 06:02:00 +0900"
금융위,[세종 인사이드아웃] 정부조직 개편에 공무원 800명 대이동?… “정부청...,이들 3개 부처는 기획재정부·금융위원회·산업통상자원부 등 기존 부처에 있던 일부 기능을 쪼개거나... ▲기획예산처가 될 현 기획재정부 예산실·재정관리국 인원 254명 ▲재정경제부로 합류하게 될 금융위원회 인원... ,https://biz.chosun.com/topics/topics_social/2025/09/15/QP6PBJ5RHNHLRPVUAGPW3S3T5Y/?utm_source=naver&utm_medium=original&utm_campaign=biz,https://n.news.naver.com/mnews/article/366/0001107978?sid=102,"Mon, 15 Sep 2025 06:01:00 +0900"
금융위,"[필드 뒷얘기] 금융감독체계 개편, '금감원 힘 빼기' 된 이유","금융에 대한 과도한 제재나, 상급 기관인 금융위원회를 거치지 않은 입장 표명 등이 그 일환이다. 이는... 있다&quot;며 &quot;금융위보다 금감원이 나서서 목소리를 내는 것도 월권&quot;이라고 지적했다. 윤 정부 시절 발탁된 이 전 원장은... ",https://www.kbanker.co.kr/news/articleView.html?idxno=221651,https://www.kbanker.co.kr/news/articleView.html?idxno=221651,"Mon, 15 Sep 2025 06:00:00 +0900"
금융위,제재권·분쟁조정 기능도 넘기나… 반발 커지는 금감원,이는 공공기관 지정 이외에도 금융위원회가 금감원의 제재 권한을 축소하는 방안을 검토 중이기 때문이다.... 금감원 직원들은 “금융위가 제재심과 분조위까지 가져가려 한다면 힘든 검사·조사는 회피하고 권한만... ,https://www.seoul.co.kr/news/economy/2025/09/15/20250915018002?wlog_tag3=naver,https://n.news.naver.com/mnews/article/081/0003574572?sid=101,"Mon, 15 Sep 2025 05:03:00 +0900"
금융위,"은행권 생산적금융 박차…첨단산업 육성, 中企 경쟁력 강화","이에 따라 이억원 금융위원장 후보자, 권대영 금융위원회 부위원장, 이찬진 금융감독원장 등 당국 핵심 인사들도 모두 최근 발언을 통해 고금리를 비판하고 생산적 금융을 독려하고 있다. 은행권은 지난달 초까지만... ",http://www.fntimes.com/html/view.php?ud=202509140737218086dd55077bc2_18,http://www.fntimes.com/html/view.php?ud=202509140737218086dd55077bc2_18,"Mon, 15 Sep 2025 05:02:00 +0900"
금융위,개딸 여야 합의 반발에…李정부 밑그림 ‘슬로우트랙’ 태우는 與,"지난 7일 당정이 공식 발표한 기재부·금융위 개편 시행일은 내년 1월 2일이었다. 하지만 신속처리안건으로 지정되면 최장 330일(소관 상임위 180일, 법제사법위원회 90일, 본회의 60일)간 법안을 심의한다. 여야 합의 처리보다... ",https://www.joongang.co.kr/article/25366887,https://n.news.naver.com/mnews/article/025/0003469067?sid=100,"Mon, 15 Sep 2025 05:00:00 +0900"
금융위,금융당국 개편 '난항'… 내부 반발·야권 반대,"금융위원회·금융감독원 직원들의 극심한 반발과 인력 이탈 가능성, 야권의 반대 등 넘어야 할 산이 많아... 개정안에 따르면 정부는 기획재정부를 국무총리실 소속 기획예산처와 재정경제부로 분리하고 금융위의 국내... ",https://www.moneys.co.kr/article/2025091414292395325,https://n.news.naver.com/mnews/article/417/0001101203?sid=100,"Mon, 15 Sep 2025 05:00:00 +0900"
금융위,'부정거래' 저지르고도 호화생활…피해자 &quot;이런데 투자하겠나&quot; [코스피...,"솜방망이 처벌로 범죄자가 재범률이 30%에 육박(금융위원회 조사)하고, 이는 개인투자자들의 시장 불신으로... 금융위에 따르면 제도 도입 뒤 12일 현재까지 관련 사건으로 과징금을 부과한 건수가 0건인 것으로... ",https://www.joongang.co.kr/article/25366895,https://n.news.naver.com/mnews/article/025/0003469076?sid=101,"Mon, 15 Sep 2025 05:00:00 +0900"
금융위,‘징벌적 과징금’ 도입에 전문가들 “분명한 한계⋯인센티브 병행해야...,금융위원회도 금융권의 보안 규제를 강화하고 있다. 금융위는 올해 2월 ‘전자금융감독규정’ 일부개정규정안을 의결했다. 금융사의 금융보안 규제를 규칙 중심에서 원칙 중심으로 전환하려는 취지다. 기존... ,https://www.etoday.co.kr/news/view/2505959,https://www.etoday.co.kr/news/view/2505959,"Mon, 15 Sep 2025 05:00:00 +0900"
금융위,'시한부' 이억원 금융위 출범... 내부 불만 진화 급선무,이억원 신임 금융위원장이 15일 취임식으로 첫 일정을 시작한다. 내년 해체를 앞두고 금융위 내부 불만이 임계점에 다다른 가운데 이뤄지는 직원과의 첫 만남이다. 앞서 12일 이재명 대통령은 국회 정무위원회에서 야당이... ,https://www.hankookilbo.com/News/Read/A2025091411310001344?did=NA,https://n.news.naver.com/mnews/article/469/0000887169?sid=101,"Mon, 15 Sep 2025 04:31:00 +0900"
금융위,해체 앞둔 금융위 ‘이억원號’ 출범… 조직개편 혼란수습 과제,"해체를 앞둔 금융위원회의 새 수장에게 금융당국 조직개편에 따른 혼란 수습이 시급한 과제로 떠올랐다. 이억원 신임 금융위원장은 취약계층의 빚 탕감을 위한 배드뱅크 설립, 가계부채 관리, 원화 스테이블코인 제도화... ",https://www.donga.com/news/Economy/article/all/20250914/132384357/2,https://n.news.naver.com/mnews/article/020/0003660969?sid=101,"Mon, 15 Sep 2025 03:03:00 +0900"
금융위,이 “15% 금리 잔인”에 금융권 ‘추가 출연 해야 하나’ 긴장,금융위원회와 서금원이 올해 최저신용자 특례보증 예산을 편성하면서 상정한 대위변제율은 53.5%에 달한다.... 권대영 금융위 부위원장은 국무회의에서 “서민금융을 위한 특별기금을 만들어 재정과 민간금융 간 출연을... ,https://www.kmib.co.kr/article/view.asp?arcid=1757841750&code=11151100&cp=nv,https://n.news.naver.com/mnews/article/005/0001802167?sid=101,"Mon, 15 Sep 2025 00:43:00 +0900"
금융위,3분기 혁신금융서비스 접수 시작...샌드박스 신청방법·기간은?,금융위원회 로고 금융위원회가 올해 3분기 혁신금융서비스 지정 정기신청 접수를 받는다. 접수는 오는 15일부터 26일까지 금융규제 샌드박스 홈페이지를 통해 가능하다. 접수방법은 혁신금융서비스 지정을 희망하는... ,https://www.gukjenews.com/news/articleView.html?idxno=3376530,https://www.gukjenews.com/news/articleView.html?idxno=3376530,"Mon, 15 Sep 2025 00:16:00 +0900"
금융위,"특검법 이어 '금감위 설치법'도 강행?…與, 패스트트랙 예고","정부조직법 개정안에 포함된 금감위 설치법은 기존 금융위원회의 금융정책을 기획재정부 산하 재정경제부로 이관하고, 감독 권한을 가진 금감위를 신설하는 내용을 담고 있다. 현재 금융위는 금융정책 기능과 감독... ",https://www.dailian.co.kr/news/view/1548764/?sc=Naver,https://n.news.naver.com/mnews/article/119/0003002709?sid=100,"Mon, 15 Sep 2025 00:10:00 +0900"
금융위,'숨은 금융자산 찾기 캠페인' 내 자산 조회방법은? 환급절차 알기,숨은 금융자산 찾아주기 캠페인 환급 조회 / 금융위 제공 금융위원회와 금융감독원이 15일부터 다음 달 31일까지 7주간 '숨은 금융자산 찾아주기 캠페인'을 진행한다. 14일 금융위와 금감원은 은행·보험사·증권사·카드사... ,https://www.gukjenews.com/news/articleView.html?idxno=3376491,https://www.gukjenews.com/news/articleView.html?idxno=3376491,"Mon, 15 Sep 2025 00:06:00 +0900"
금융위,정부 조직개편 혼란 속 ‘이억원 금융위’ 출범,이억원(사진) 신임 금융위원장은 취임과 동시에 난제에 직면했다. 조직개편을 둘러싼 혼란을 수습하는... 이 위원장이 금융위원장 후보로 지명된 지 약 한 달여 만이다. 취임식은 15일 오후 정부서울청사에서 열린다. 이... ,https://www.joongang.co.kr/article/25366833,https://n.news.naver.com/mnews/article/025/0003469015?sid=101,"Mon, 15 Sep 2025 00:01:00 +0900"
