Keyword,Title,Description,Original Link,Link,Publication Date
국정기획위원회,“정당 요직에 여성 많아야 건강해져”,국정기획위원회 현판식 사진이 많은 비판을 받았다. 현판식에 등장한 11명 모두 남성이었기 때문이다. 조국혁신당 전당대회 이후 최고위원회의 모습도 이래서는 안 된다는 거다. 당대표 옆자리 모두 남성으로 채울 수 없다.... ,https://www.naeil.com/news/read/568115?ref=naver,https://www.naeil.com/news/read/568115?ref=naver,"Wed, 19 Nov 2025 13:10:00 +0900"
국정기획위원회,"[기획] 그린워싱의 민낯… EU는 처벌, 한국은 방치",19일 국회 기후에너지환경노동위원회 소속 더불어민주당 김주영 의원실이 한국환경산업기술원으로부터... 김소희 국민의힘 국회의원은 지난 국정감사에서 스타벅스코리아의 텀블러 마케팅을 그린워싱으로 규정하고... ,http://www.m-i.kr/news/articleView.html?idxno=1304935,http://www.m-i.kr/news/articleView.html?idxno=1304935,"Wed, 19 Nov 2025 12:00:00 +0900"
국정기획위원회,"일하는 어르신, 연금 덜 깎는다","&quot;일하는 어르신의 연금 감액을 줄이겠다&quot;는 건 이재명 대통령 공약으로, 앞서 국정기획위원회는 월 초과소득 200만 원까지 더 높은 감액 기준선을 제시하기도 했는데요. 다만 이 경우, 재정 소요도 더 큰 폭으로... ",https://biz.sbs.co.kr/article_hub/20000273139?division=NAVER,https://n.news.naver.com/mnews/article/374/0000475709?sid=101,"Wed, 19 Nov 2025 11:50:00 +0900"
국정기획위원회,세종 상가 공실률 25%... 커져가는 행정도시의 '유령 상권',국회 행정안전위원회 국정감사 자료와 세종시·한국부동산원 통계에 따르면 올해 2분기 기준 세종시 중대형... 상권 기획이 함께 병행돼야 한다&quot;고 분석했다. 이어 &quot;정부 부처 추가 이전과 도시 인프라 확충이 장기적으로... ,http://www.chungnamilbo.co.kr/news/articleView.html?idxno=859646,http://www.chungnamilbo.co.kr/news/articleView.html?idxno=859646,"Wed, 19 Nov 2025 11:42:00 +0900"
국정기획위원회,225조 공공조달 '의무→자율·경쟁' 대전환…지방정부 단가계약 폐지(종...,"겸 기획재정부 장관 주재로 '경제관계장관회의'를 열고 이 같은 내용을 담은 '공공조달 개혁 추진 방향'을... 아울러 안전관리 전문위원회를 신설하고, 안전 문제 발생 시 공사정지요구권도 보장토록 한다. 기후위기 대응을... ",https://www.newsis.com/view/NISX20251119_0003408742,https://n.news.naver.com/mnews/article/003/0013609314?sid=101,"Wed, 19 Nov 2025 11:24:00 +0900"
국정기획위원회,"“새벽배송, 국민 편의 있지만…야간노동 규율안 마련돼야”",이재명 정부 출범 직후에는 인수위원회 역할을 했던 국정기획위원회 사회1분과 고용노동팀장을 맡아 정부 노동정책의 밑그림을 그렸다. 이 대통령이 민주당 대표를 지내던 때에는 당 법률위원장으로서 역할을 수행했다.... ,https://biz.heraldcorp.com/article/10619192?ref=naver,https://n.news.naver.com/mnews/article/016/0002559956?sid=100,"Wed, 19 Nov 2025 11:23:00 +0900"
국정기획위원회,"오창석 신임 청년재단 이사장, 14일 취임",뿐만 아니라 오창석 이사장은 취임 전 국정기획위원회 기획분과 전문위원(2025.6~2025.8)으로 활동하며 청년정책을 포함한 다양한 국가정책의 기획-평가 경험을 쌓았다. 또한 시사평론가로서 사회 전반의 이슈를 다각도로... ,http://www.wowtv.co.kr/NewsCenter/News/Read?articleId=A202511190365&t=NN,https://n.news.naver.com/mnews/article/215/0001231473?sid=101,"Wed, 19 Nov 2025 11:04:00 +0900"
국정기획위원회,"&quot;정년 연장은 새로운 화두아냐...이재명 대통령의 공약이자, 정식 국정...",그래서 당선되자마자 인수위가 없었지만 국정기획위원회를 출범시켜서 정식 국정 과제로 정착을 했고요. 그래서 당에서도 4월달에 정년 연장 특별대책위원회를 꾸려서 당과 정이 함께 지금 7개월째 논의를 해오고 있는... ,https://news.ifm.kr/news/articleView.html?idxno=457717,https://news.ifm.kr/news/articleView.html?idxno=457717,"Wed, 19 Nov 2025 11:04:00 +0900"
국정기획위원회,오창석 신임 청년재단 이사장 취임,오 이사장은 이번 정부 국정기획위원회 기획분과 전문위원으로 참여해 청년정책 등 주요 기획·평가 경험을 쌓았다. 유튜브 채널 ‘사장남천동’을 운영해왔으며 시사평론 활동도 이어왔다. 신임 이사장은 17일 청년재단... ,https://futurechosun.com/?p=137066,https://futurechosun.com/?p=137066,"Wed, 19 Nov 2025 11:02:00 +0900"
국정기획위원회,청년재단 오창석 이사장 취임…&quot;대표 청년지원 플랫폼으로 도약&quot;,오 이사장은 취임 전 국정기획위원회 기획분과 전문위원(2025년 6~8월)으로 활동하며 청년정책을 포함한 국가정책 기획·평가 경험을 쌓았다. 또한 시사평론가로서 사회 현안을 다각도로 분석하며 공공 소통에도 꾸준히... ,https://www.newsworks.co.kr/news/articleView.html?idxno=819354,https://www.newsworks.co.kr/news/articleView.html?idxno=819354,"Wed, 19 Nov 2025 11:00:00 +0900"
국정기획위원회,CEO 33인 레이스 'KT맨 vs 외부 혁신가'…양손잡이 리더십 시험대,"친문계 주형철 전 대통령비서실 경제보좌관도 이재명 정부에서 국정기획위원회 경제2분과 기획위원으로 활동했다. 다만 SK커뮤니케이션즈, NHN, 한국벤처투자 대표 등을 지내며 민간과 정부를 오갔다는 경력이 있다.... ",https://www.dailian.co.kr/news/view/1575194/?sc=Naver,https://n.news.naver.com/mnews/article/119/0003026930?sid=105,"Wed, 19 Nov 2025 10:59:00 +0900"
국정기획위원회,오창석 신임 청년재단 이사장 취임,"오 이사장은 취임 전 국정기획위원회 기획분과 전문위원으로 활동하며 청년정책을 포함한 다양한 국가정책의 기획, 평가 경험을 쌓았다. 또한 시사평론가로서 사회 전반의 이슈를 다각도로 분석하며 공공 소통을 꾸준히... ",http://www.edaily.co.kr/news/newspath.asp?newsid=03207846642367360,https://n.news.naver.com/mnews/article/018/0006167494?sid=102,"Wed, 19 Nov 2025 10:40:00 +0900"
국정기획위원회,"이용우 “새벽배송, 국민편의 감안하되 야간노동 규율 필요” [노동·안...",이재명 정부 출범 직후에는 인수위원회 역할을 했던 국정기획위원회 사회1분과 고용노동팀장을 맡아 정부 노동정책의 밑그림을 그렸다. 이 대통령이 민주당 대표를 지내던 때에는 당 법률위원장으로서 역할을 수행했다.... ,https://biz.heraldcorp.com/article/10619092?ref=naver,https://n.news.naver.com/mnews/article/016/0002559871?sid=100,"Wed, 19 Nov 2025 10:37:00 +0900"
국정기획위원회,나경원 &quot;내년 지방선거 전광훈·이준석 등 뜻 같으면 함께해야&quot;,com 나경원 국민의힘 의원이 지난달 31일 국회에서 2025년도 법제사법위원회 국정감사 결산 기자회견을 하고 있다. [사진=연합뉴스] 국민의힘 지방선거 총괄기획단장을 맡은 나경원 의원은 19일 내년 지방선거를 앞두고... ,https://www.ajunews.com/view/20251119090529267,https://www.ajunews.com/view/20251119090529267,"Wed, 19 Nov 2025 10:26:00 +0900"
국정기획위원회,[정년 65세 토론] &quot;일해야 먹고산다 vs 청년 실업은?&quot;,그럼 나머지 88%는 사실은 노동자의 이익을 집단적으로 대변할 수 있는 사람이 없기 때문에 이 문제와 관련해서 이재명 정부도 이제 국정기획위원회에서 근로자 대표제를 제도화하겠다. 노동조합이 없더라도 근로자가... ,https://www.nocutnews.co.kr/news/6430663?utm_source=naver&utm_medium=article&utm_campaign=20251119101858,https://n.news.naver.com/mnews/article/079/0004087467?sid=100,"Wed, 19 Nov 2025 10:11:00 +0900"
국정기획위원회,오창석 신임 청년재단 이사장 취임…“청년지원 대표 플랫폼 도약”,오 이사장은 올 6월부터 8월까지 국정기획위원회 기획분과 전문위원으로 활동하며 청년정책을 포함한 다양한 국가정책을 기획하는 경험을 쌓았다. 그동안 시사평론가로 사회 전반의 이슈를 다각도로 분석하며... ,https://www.munhwa.com/article/11547894?ref=naver,https://n.news.naver.com/mnews/article/021/0002751024?sid=102,"Wed, 19 Nov 2025 09:47:00 +0900"
국정기획위원회,[서종빈 평화칼럼] 인구 절벽과 이민 정책,‘인구전략위원회’로 바꿔 기능과 권한을 강화하고 정책 범위도 확대하기로 했다. 저출산·고령화 외에도 경제인구 확대와 외국인 정책 등 사회·경제적 제도 정비에 나서고 인구 관련 예산의 기획과 조정 권한도... ,https://news.cpbc.co.kr/article/1168495?division=NAVER,https://news.cpbc.co.kr/article/1168495?division=NAVER,"Wed, 19 Nov 2025 09:46:00 +0900"
국정기획위원회,오창석 신임 청년재단 이사장 취임… 청년 지원 플랫폼으로 확장 예고,뿐만 아니라 오창석 이사장은 취임 전 국정기획위원회 기획분과 전문위원(2025.6~2025.8)으로 활동하며 청년정책을 포함한 다양한 국가정책의 기획ㆍ평가 경험을 쌓았다. 또한 시사평론가로서 사회 전반의 이슈를 다각도로... ,https://www.segye.com/newsView/20251119504899?OutUrl=naver,https://n.news.naver.com/mnews/article/022/0004083748?sid=101,"Wed, 19 Nov 2025 09:44:00 +0900"
국정기획위원회,"오창석 신임 청년재단 이사장, 14일 공식 취임",더불어 오창석 이사장은 취임 전 국정기획위원회 기획분과 전문위원(2025.6~2025.8)으로 활동하며 청년정책을 포함한 다양한 국가정책의 기획ㆍ평가 경험을 쌓았다. 또한 시사평론가로서 사회 전반의 이슈를 다각도로... ,https://view.asiae.co.kr/article/2025111909343993467,https://n.news.naver.com/mnews/article/277/0005681435?sid=101,"Wed, 19 Nov 2025 09:40:00 +0900"
국정기획위원회,오창석 신임 청년재단 이사장 취임,더불어 오창석 이사장은 취임 전 국정기획위원회 기획분과 전문위원(2025.6~2025.8)으로 활동하며 청년정책을 포함한 다양한 국가정책의 기획ㆍ평가 경험을 쌓았다. 또한 시사평론가로서 사회 전반의 이슈를 다각도로... ,https://www.seoul.co.kr/news/economy/2025/11/19/20251119500033?wlog_tag3=naver,https://n.news.naver.com/mnews/article/081/0003593289?sid=101,"Wed, 19 Nov 2025 09:31:00 +0900"
국정기획위원회,충남도의회 기경위 &quot;탄소중립·AI 등 시대 변화 반영한 교육체계 필요&quot;,"▲ 제362회 정례회 행정사무감사 기획경제위원회 충남도의회 기획경제위원회는 18일 인재개발원과... 또한 &quot;국정 기조 변화와 AI 산업 확산에 맞춰 교육 과정도 신속히 조정돼야 하며, 이러닝(e-learning) 과정은 필요시 즉시... ",https://www.ccdailynews.com/news/articleView.html?idxno=2380115,https://www.ccdailynews.com/news/articleView.html?idxno=2380115,"Wed, 19 Nov 2025 09:26:00 +0900"
국정기획위원회,"철도 3사 수장 공석 장기화…SR, 코레일 새 사장 공모 착수","이 이사장의 임기는 2027년 2월까지로 지난 국정감사에서 제기된 이 이사장의 자전거 구매는 &quot;규정 상... 이후 임추위가 복수의 후보를 선정하면, 기획재정부 공공기관운영위원회(공운위)에서 후보들의 인사검증을 실시한... ",https://www.widedaily.com/news/articleView.html?idxno=283179,https://www.widedaily.com/news/articleView.html?idxno=283179,"Wed, 19 Nov 2025 09:22:00 +0900"
국정기획위원회,오창석 신임 청년재단 이사장 공식 취임…임기 3년,"국정기획위원회 기획분과 전문위원 활동  청년재단은 이사회를 통해 오창석 신임 청년재단 이사장을 선임했다고 19일 밝혔다. 오 이사장은 지난 14일자로 공식 취임했으며, 임기는 3년이다. 향후 청년정책 체계 고도화... ",https://www.youthdaily.co.kr/news/article.html?no=203148,https://www.youthdaily.co.kr/news/article.html?no=203148,"Wed, 19 Nov 2025 09:18:00 +0900"
국정기획위원회,공공조달 AI·기후테크 성장 마중물…중대재해 잦은 업체 입찰 제한,"겸 기획재정부 장관 주재로 '경제관계장관회의'를 열고 이 같은 내용을 담은 '공공조달 개혁 추진 방향'을... 아울러 안전관리 전문위원회를 신설하고, 안전 문제 발생 시 공사정지요구권도 보장토록 한다. 기후위기 대응을... ",https://www.newsis.com/view/NISX20251119_0003408192,https://n.news.naver.com/mnews/article/003/0013608640?sid=101,"Wed, 19 Nov 2025 09:00:00 +0900"
국정기획위원회,"與 김현정 원내대변인 &quot;대장동 국정조사, 野 급하면 상임위서 못할 이유...","원내대변인 - 국정조사 내용, 거의 합의 완료..'항소 포기' 국조 與단독 진행 안 할 것 - 野, 추미애 두고 문제... 다음 주 25일 화요일날 APEC 성과 확산 및 한미 관세 협상 후속 지원위원회가 발족을 하는데 김병기... ",https://www.ytn.co.kr/_ln/0101_202511190846306410,https://n.news.naver.com/mnews/article/052/0002275124?sid=100,"Wed, 19 Nov 2025 08:46:00 +0900"
국정기획위원회,"철도 3사 수장 공석 장기화…SR, 코레일 새 사장 공모 착수","이 이사장의 임기는 2027년 2월까지로 지난 국정감사에서 제기된 이 이사장의 자전거 구매는 &quot;규정 상... 이후 임추위가 복수의 후보를 선정하면, 기획재정부 공공기관운영위원회(공운위)에서 후보들의 인사검증을 실시한... ",https://www.newsis.com/view/NISX20251118_0003407461,https://n.news.naver.com/mnews/article/003/0013608600?sid=102,"Wed, 19 Nov 2025 08:46:00 +0900"
국정기획위원회,"[오늘의 국회일정] (19일, 수)",포기 국정조사와 관련한 협상을 위해 모여 포즈를 취하고 있다. 2025.11.18 ◇상임위원회 10:00 법제사법위원회 법안심사제1소위원회(본관 406호) 10:00 기획재정위원회 경제재정소위원회... ,http://www.queen.co.kr/news/articleView.html?idxno=446075,http://www.queen.co.kr/news/articleView.html?idxno=446075,"Wed, 19 Nov 2025 08:36:00 +0900"
국정기획위원회,"[기획] 오세훈 서울시장 향한 당정 공세에 '선거 개입' 논란, 왜?","국토교통위원회 위원들과 '속도 잃은 신통기획(신속통합기획), 서울시 권한의 자치구 이양 통한 활성화 방안... 굳이 서울시에서 진행하는 지방사무에 관해서만 시시콜콜 '감 놔라 배 놔라' 하는 자세는 국정 전체를... ",http://www.sisafocus.co.kr/news/articleView.html?idxno=350399,http://www.sisafocus.co.kr/news/articleView.html?idxno=350399,"Wed, 19 Nov 2025 08:02:00 +0900"
국정기획위원회,"[지자체 이슈] 봉화군, 농어촌 기본소득 시범사업 봉화군 추가 선정 촉...","예산결산특별위원회(예결위)를 방문해 농어촌 기본소득 시범사업의 추가 선정 예산 통과를 강력히 촉구했다. 박현국 봉화군수는 11월 17일 예결위 소속 임종득·임미애·박형수·안호영 의원을 잇따라 면담하며, 국정과제... ",http://www.queen.co.kr/news/articleView.html?idxno=446069,http://www.queen.co.kr/news/articleView.html?idxno=446069,"Wed, 19 Nov 2025 08:00:00 +0900"
국정기획위원회,[예규·판례] 행법 &quot;국감 출석 예정자와 미승인 해외출장...정직징계 정...,행정법원이 '국정감사를 앞두고 증인으로 채택된 상사와 미승인 해외출장을 강행한 한국언론진흥재단... 출장을 기획·주도·실행했다는 이유였다. 이에 A씨는 징계가 부당하다며 서울지방노동위원회(지노위)에... ,https://www.tfmedia.co.kr/news/article.html?no=197962,https://www.tfmedia.co.kr/news/article.html?no=197962,"Wed, 19 Nov 2025 08:00:00 +0900"
국정기획위원회,론스타와의 13년 악연 마침표…한푼도 안줘도 된다[뉴스쏙:속],"국정안정 조치라고 강조했습니다. 김 총리는 어제 국무회의에서 헌법과 적법 절차에 따라 꼭 필요한 범위에서 과하지도, 덜하지도 않게 신속히 진행되고 마무리될 거라며 이같이 말했습니다. 국회 운영위원회에... ",https://www.nocutnews.co.kr/news/6430540?utm_source=naver&utm_medium=article&utm_campaign=20251119075358,https://n.news.naver.com/mnews/article/079/0004087389?sid=100,"Wed, 19 Nov 2025 07:54:00 +0900"
국정기획위원회,"대장동 개발사업 비리 1심 판결문(총 719쪽) | “이재명, 대장동 개발사...",성남도시개발공사 기획본부장에게 징역 8년에 벌금 4억원과 추징금 8억 1000만원 ▲민간 개발업자 남욱... 추진위원회’를 결성했다. 이때 민간 개발업자들(남욱·정영학)은 이곳에 눈독을 들이고 민간 개발을 기대하며... ,http://monthly.chosun.com/client/news/viw.asp?ctcd=A&nNewsNumb=202512100009,http://monthly.chosun.com/client/news/viw.asp?ctcd=A&nNewsNumb=202512100009,"Wed, 19 Nov 2025 07:52:00 +0900"
국정기획위원회,"금리 상승세 일단 주춤…채권시장, 이창용 입에 달려 '귀 쫑긋'",▲이창용 한국은행 총재가 지난 10월 29일 국회 기획재정위원회에서 열린 2025년 종합 국정감사에 출석해 의원 질의를 듣다 생각에 잠겨 있다.(사진출처=연합뉴스) 최근 가팔랐던 국고채 금리 상승세가 오를 만큼... ,https://www.goodnews1.com/news/articleView.html?idxno=453594,https://www.goodnews1.com/news/articleView.html?idxno=453594,"Wed, 19 Nov 2025 07:28:00 +0900"
국정기획위원회,[Who Is ?] 성대규 동양생명 대표이사 사장,"33회 행정고시에 합격한 뒤 재정경제원, 기획재정부, 청와대 국정기획수석실을 거쳐 금융위원회에서 보험과장과 은행과장, 공적자금관리위원회 사무국장으로 일했다. 공직에서 물러나 법무법인 태평양에서... ",https://www.businesspost.co.kr/BP?command=article_view&num=420498,https://www.businesspost.co.kr/BP?command=article_view&num=420498,"Wed, 19 Nov 2025 07:26:00 +0900"
국정기획위원회,7대 금투협회장 후보 공모 D-DAY...서유석-황성엽-이현승 3파전 구도,"그는 경영기획, 자산운용, 법인사업, 투자은행(IB) 업무, 경영총괄 등을 거쳐 2020년 3월 각자대표로... 한편, 올해 국회 국정감사 자료와 강민국 국민의힘 의원실이 금융위원회로부터 제출받은 자료 등에 따르면 지난해... ",https://www.pinpointnews.co.kr/news/articleView.html?idxno=397120,https://www.pinpointnews.co.kr/news/articleView.html?idxno=397120,"Wed, 19 Nov 2025 07:20:00 +0900"
국정기획위원회,[2025 국감 우수의원] 국회 문화체육관광위원회 임오경 의원,‘2025 국정감사 우수의원’은 쿠키뉴스가 국회 상임위원회 활동을 종합적으로 평가해서 선정했다. 평가... 제시하며 기획·제작·유통 과정에서 우리가 지식재산(IP)을 확보하되 다양한 글로벌 파트너십도 구축할 것을... ,https://www.kukinews.com/article/view/kuk202511180043,https://www.kukinews.com/article/view/kuk202511180043,"Wed, 19 Nov 2025 07:02:00 +0900"
국정기획위원회,[2025 국감 우수의원] 국회 기획재정위원회 최은석 의원,국회 기획재정위원회(기재위) 소속 최은석 국민의힘 의원이 쿠키뉴스가 선정한 ‘2025 국정감사 우수의원’에 이름을 올렸다. ‘국정감사 우수의원’은 쿠키뉴스가 국회 상임위원회 활동을 종합 평가해 선정하는 상으로... ,https://www.kukinews.com/article/view/kuk202511180258,https://www.kukinews.com/article/view/kuk202511180258,"Wed, 19 Nov 2025 07:02:00 +0900"
국정기획위원회,[2025 국감 우수의원] 국회 기획재정위원회 오기형 의원,국회 기획재정위원회(기재위) 소속 오기형 더불어민주당 의원이 쿠키뉴스가 선정한 ‘2025 국정감사 우수의원’에 이름을 올렸다. ‘2025 국정감사 우수의원’은 쿠키뉴스가 국회 상임위원회 활동을 종합적으로 평가해서... ,https://www.kukinews.com/article/view/kuk202511180196,https://www.kukinews.com/article/view/kuk202511180196,"Wed, 19 Nov 2025 07:02:00 +0900"
국정기획위원회,'형제복지원 규명' 진화위 2기 마무리…미처리 사건 2100건 과제,2기 ‘진실·화해를 위한 과거사 정리 위원회(진실화해위)’가 약 5년간 활동을 정리한 종합 보고서를... 국정기획위가 3기 진실화해위 출범을 신속 과제로 선정하고 연내 이행을 추진하면서 출범은 확실시된다. 하지만... ,https://www.joongang.co.kr/article/25383223,https://n.news.naver.com/mnews/article/025/0003483678?sid=102,"Wed, 19 Nov 2025 05:00:00 +0900"
국정기획위원회,&quot;물가부터 잡아라&quot; 80년대 10%씩 성장…중산층 커졌다 [창간기획 대한민...,군사정변으로 정권을 잡은 전두환은 안정을 국정의 최우선 과제로 내세웠다. 80년 초 ‘서울의 봄’은... 공정거래위원회 설립과 시장 개방이 대표적이다. 70년대까지 국내에서는 생산자가 담합을 통해 독점 이익을... ,https://www.joongang.co.kr/article/25383206,https://n.news.naver.com/mnews/article/025/0003483664?sid=102,"Wed, 19 Nov 2025 05:00:00 +0900"
국정기획위원회,젠슨 황이 강조한 '피지컬 AI'는? 딥시크 충격 넘어 로봇 시대 연 중국 ...,전망해보는 기획시리즈를 준비했다. &quot;여기는 전 세계 최초 인공지능(AI)으로 구동되는 로봇 편의점입니다.... 중국은 규모가 큰 연구의 경우 매년 국가자연과학기금위원회(NSFC)와 과학기술부를 중심으로 발표하는... ,https://www.hankookilbo.com/News/Read/A2025111611410003051?did=NA,https://n.news.naver.com/mnews/article/469/0000898320?sid=101,"Wed, 19 Nov 2025 04:40:00 +0900"
국정기획위원회,&quot;전주소리축제 '임금 특혜' 거짓 해명 논란…의혹 점점 확산&quot;/김관영 지...,이사장은 '임원추천위원회에서 판단하는 부분'이라고 반복적으로 답했다&quot;는 기사는 &quot;최 의원은 이날 기획조... 또 기사는 &quot;앞서 지난 10월 28일 국회 행정안전위원회의 전북자치도 국정감사에서 시설공단 임원의 부적정... ,http://www.jbsori.com/news/articleView.html?idxno=16495,http://www.jbsori.com/news/articleView.html?idxno=16495,"Wed, 19 Nov 2025 04:38:00 +0900"
국정기획위원회,[본지-전문대교협 공동기획③] '기술인력' 수요 커지는데… 'AI 인재 양...,"김영도 한국전문대학교육협의회(이하 전문대교협) 회장은 지난달 16일 진행된 국회 교육위원회 국정감사에서 &quot;현재 반도체, 이차전지, 로봇 같은 국가 신성장산업분야 인재 양성을 위한 지원이 일반대학 중심으로... ",https://news.unn.net/news/articleView.html?idxno=586317,https://news.unn.net/news/articleView.html?idxno=586317,"Tue, 18 Nov 2025 23:50:00 +0900"
국정기획위원회,"오세훈표 주택정책 때린 민주...서울시장 탈환, 돌격 앞으로?","선거관리위원회의 즉각 조사를 촉구하면서, 선거판 콩밭만 맴돌지 말라는 일침도 날렸습니다. [배현진 / 국민의힘 의원 : 총리의 책무라 하면 국정을 운영하고 민생을 살피며 돌봐야 하는 겁니다. 서울시의 정책이 있는... ",https://www.ytn.co.kr/_ln/0101_202511182239446865,https://n.news.naver.com/mnews/article/052/0002274993?sid=100,"Tue, 18 Nov 2025 22:39:00 +0900"
국정기획위원회,[뉴스NIGHT] '항소 포기' 후폭풍 계속...연일 오세훈 때리는 민주,당분간은 국정조사 계획에 대해서 일방처리하지 않기로 합의했다. 여기까지 지금 나온 그런 상황입니다. 그리고 오늘 운영위로 가보겠습니다. 대통령실 참모들이 출석한 국회 운영위원회에서 김용범 정책실장이 야당의 '딸... ,https://www.ytn.co.kr/_ln/0101_202511182236010028,https://n.news.naver.com/mnews/article/052/0002274991?sid=100,"Tue, 18 Nov 2025 22:36:00 +0900"
국정기획위원회,"충남도의회 기획경제위원회, 탄소중립·AI 등 시대 변화 반영한 교육체...","충남도의회 기획경제위원회는 18일 인재개발원과 충남도립대학교에 대한 2025년도 행정사무감사를... 또한 구형서 부위원장 &quot;국정 기조 변화와 AI 산업 확산에 맞춰 교육과정도 신속히 조정돼야 하며, 이러닝(e-learning)... ",http://www.newstnt.com/news/articleView.html?idxno=555905,http://www.newstnt.com/news/articleView.html?idxno=555905,"Tue, 18 Nov 2025 21:30:00 +0900"
국정기획위원회,나경원 &quot;한동훈 출마 가능하지만 '당게' 진실 밝혀야...당명 교체? 의견...,"민주당 국정조사 역시 범위 좁히자고 할 것 - 범죄수익 환수 특별법 발의, 범죄자들 수익 가져가는 것 납득... 우리 당의 간사만 임명 안 해 주는 것뿐만 아니라, 이 상임위 밑에는 또 소위원회라는 게 있습니다. 그런... ",https://radio.ytn.co.kr/program/?f=2&id=105929&s_mcd=0263&s_hcd=01,https://radio.ytn.co.kr/program/?f=2&id=105929&s_mcd=0263&s_hcd=01,"Tue, 18 Nov 2025 21:30:00 +0900"
