Keyword,Title,Description,Original Link,Link,Publication Date
국정기획위원회,"내달부터 환경부→기후부, 내년 1월 기재부→재경부 예산처 분리",당초 국정기획위원회와 당정대는 금융위원회를 금융감독위원회로 개편하는 안도 함께 추진했지만 전날(25일) 국회 본회의 상정 직전 해당 내용을 철회한다고 발표했다. 국무총리실은 매머드급 조직으로 재탄생한다.... ,https://www.donga.com/news/Politics/article/all/20250927/132475760/2,https://n.news.naver.com/mnews/article/020/0003664150?sid=100,"Sat, 27 Sep 2025 01:42:00 +0900"
국정기획위원회,'검찰청 폐지' 정부조직법 통과에 與 &quot;환영&quot; 野 &quot;정부 유린&quot;,또 &quot;건전 재정을 지켜온 마지막 보루인 기획재정부마저 사라졌다&quot;라며 &quot;그 자리를 대신한 건 '기획예산처... 동시에 이날 본회의에서 정부조직법 개정안이 의결된 후 방송통신위원회를 '방송미디어통신위'로 개편하는... ,http://www.shinailbo.co.kr/news/articleView.html?idxno=2123599,http://www.shinailbo.co.kr/news/articleView.html?idxno=2123599,"Sat, 27 Sep 2025 00:40:00 +0900"
국정기획위원회,"대전 국정자원 화재, 70개 정부서비스 일제히 중단","하지만 국무조정실 국무총리비서실, 과학기술정보통신부, 기획재정부, 행정안전부, 문화체육관광부, 교육부, 해양수산부, 보건복지부, 고용노동부, 환경부, 개인정보보호위원회, 금융위원회, 방송통신위원회, 소방청... ",https://www.m-economynews.com/news/article.html?no=60312,https://www.m-economynews.com/news/article.html?no=60312,"Sat, 27 Sep 2025 00:34:00 +0900"
국정기획위원회,[취재수첩] '탁상공론'에 헛바퀴 도는 금융감독체계 개편,"국정기획위원회와 더불어민주당, 대통령실은 ‘금융위 해체·금소원 신설’을 핵심으로 하는 감독체계 개편안을 마련했다. 그 어느 때보다 개편안 통과 가능성이 컸지만, 윤한홍 국회 정무위원장을 비롯한 국민의힘... ",https://www.hankyung.com/article/2025092607801,https://n.news.naver.com/mnews/article/015/0005190798?sid=110,"Sat, 27 Sep 2025 00:13:00 +0900"
국정기획위원회,[위클립] 9월 4주,"제1회 교육에선 이수진 민주당 국회의원이 국회 보건복지위원회와 국정과제를, 안은미 한국노총 정책2국장이... 민주일반연맹 공공연대노조는 기획재정부 앞에서 결의대회를 열고 공공기관 자회사를 통해 정규직 전환된... ",https://www.laborplus.co.kr/news/articleView.html?idxno=36349,https://www.laborplus.co.kr/news/articleView.html?idxno=36349,"Fri, 26 Sep 2025 23:01:00 +0900"
국정기획위원회,"“여가부, 성평등가족부로 확대 개편…예산과 권한이 성패 가른다”",한편 성평등가족부는 대선기간인 5월 28일 이재명 대통령의 선거공약으로 발표되어 대통령 직속 국정기획위원회가 여성가족부에 성평등가족부로의 조직 개편을 주문하면서 가시화됐다. 특히 26일 정부조직법 개정안이... ,https://www.seoul.co.kr/news/society/2025/09/26/20250926500208?wlog_tag3=naver,https://n.news.naver.com/mnews/article/081/0003578338?sid=102,"Fri, 26 Sep 2025 22:56:00 +0900"
국정기획위원회,[투나잇이슈] '정부조직법 개정안' 국회 통과…‘방통위 폐지법’ 상정,이후 방송미디어통신위원회 설치법이 본회의에 상정되면서 국민의힘은 다시 필리버스터에 돌입했는데요.... 국민의힘이 표결에 불참한 가운데 재석 180명 중 찬성 174명으로 검찰청 폐지와 기획재정부 분리를 담은... ,http://www.yonhapnewstv.co.kr/MYH20250926224314Xib,https://n.news.naver.com/mnews/article/422/0000785696?sid=100,"Fri, 26 Sep 2025 22:44:00 +0900"
국정기획위원회,정부 온라인 서비스 70개 ‘먹통’...국가정보자원관리원 화재,"행안부 소속인 국가정보자원관리원(이하 국정자원)은 정부 전산시스템 서버와 데이터베이스 등을 대규모로... 법제처는 국가법령정보센터, 국민참여정보센터 등이 접속되지 않는다고 밝혔고 권익위원회도... ",https://www.kyeonggi.com/article/20250926580226,https://n.news.naver.com/mnews/article/666/0000084279?sid=102,"Fri, 26 Sep 2025 22:42:00 +0900"
국정기획위원회,검찰청 없애고 기재부 쪼개고… 정부조직 ‘19부6처19청’ 개편,"2025.9.26 /연합뉴스 검찰청을 폐지하고 기획재정부를 분리하는 등 정부 조직을 이재명 정부의 국정철학에... 6위원회(총 50개) 체제로 변하게 됐다. 개정안은 기획재정부를 재정경제부와 기획예산처로 분리하고, 기재부... ",https://www.kyeongin.com/article/1752500,https://www.kyeongin.com/article/1752500,"Fri, 26 Sep 2025 22:28:00 +0900"
국정기획위원회,정부조직법 국회 통과…78년만에 검찰청 폐지·기재부 분리,검찰청을 폐지하고 기획재정부를 분리하는 등 정부 조직을 이재명 정부의 국정 철학에 맞게 바꾸기 위한... 설립된 기획재정부는 18년 만에 간판을 내리게 된다. 당초 민주당이 추진했던 금융위원회 개편은 이번... ,https://www.ngonews.kr/news/articleView.html?idxno=215005,https://www.ngonews.kr/news/articleView.html?idxno=215005,"Fri, 26 Sep 2025 22:18:00 +0900"
국정기획위원회,"더팩트 '이춘석 차명 주식거래' 보도, 이달의 기자상 수상",이 의원은 국정기획위원회에서 AI 정책을 다루는 경제 2분과장이었다는 측면에서 미공개 정보를 이용해 자본시장법을 위반했다는의혹과 지난해 재산 공개에서 '보유한 주식이 없다'라고 주장해 공직자윤리법 위반... ,https://news.tf.co.kr/read/photomovie/2248275.htm,https://n.news.naver.com/mnews/article/629/0000430325?sid=102,"Fri, 26 Sep 2025 21:58:00 +0900"
국정기획위원회,정청래 “검찰청 폐지 확정”…추미애 “윤석열이 초래한 일”,이재명 정부 인수위원회 격인 국정기획위원회에서 정부 조직 개편을 논의했던 박홍근 의원도 “검찰 해체의 순간을 바로 눈앞에서 지켜보는 것이 무척이나 감격스럽고 영광스럽다”고 말했습니다. 국회 법사위 민주당... ,https://news.kbs.co.kr/news/pc/view/view.do?ncd=8369015&ref=A,https://n.news.naver.com/mnews/article/056/0012037844?sid=100,"Fri, 26 Sep 2025 21:46:00 +0900"
국정기획위원회,'검찰청 폐지' 정부조직법 통과...본회의장 또 망언 논란,"'공룡 부처' 기획재정부를 쪼개고 환경부를 '기후에너지환경부'로 확대하는 등 '19부 6처 19청 6위원회'로 나라... 정부 국정운영 기틀을 마련해 달라며, 국민주권 정부가 경제를 살리겠다고 강조했습니다. [서영교... ",https://www.ytn.co.kr/_ln/0101_202509262135408194,https://n.news.naver.com/mnews/article/052/0002252518?sid=100,"Fri, 26 Sep 2025 21:35:00 +0900"
국정기획위원회,"국민의힘 &quot;정부 조직, 與 손에 유린… 부메랑 돼 돌아올 것&quot;","새로운 '방송미디어통신위원회'가 출범한다. 여성가족부는 '성평등가족부'로 개편된다. 또한 기획재정부는... 이어 &quot;아마추어들이 권력을 쥐면 제도는 휴지 조각이 되고, 국정은 도박판이 되며, 국민은 희생양이 된다는... ",https://www.newscj.com/news/articleView.html?idxno=3322532,https://www.newscj.com/news/articleView.html?idxno=3322532,"Fri, 26 Sep 2025 21:22:00 +0900"
국정기획위원회,78년 영욕의 검찰청 역사 속으로...정부조직법 국회 통과,검찰청을 폐지하고 기획재정부를 분리하는 등 정부 조직을 이재명 정부의 국정 철학에 맞게 바꾸기 위한... 설립된 기획재정부는 18년 만에 간판을 내리게 된다. 당초 민주당이 추진했던 금융위원회 개편은 이번... ,https://www.slist.kr/news/articleView.html?idxno=681253,https://www.slist.kr/news/articleView.html?idxno=681253,"Fri, 26 Sep 2025 20:28:00 +0900"
국정기획위원회,"공소·중수청은 내년 10월 출범, 신설 부처는 공포 즉시 시행","예산심사 일정과 제도 정비 등을 고려해 재정경제부와 기획예산처는 내년 1월 2일, 공소청과 중대범죄수사청은 내년 10월께 각각 출범할 예정이다. 행안부는 이번 개편은 정부조직 전반에 국정 철학과 비전을 반영하고... ",https://www.hani.co.kr/arti/politics/politics_general/1221001.html,https://n.news.naver.com/mnews/article/028/0002768515?sid=100,"Fri, 26 Sep 2025 20:20:00 +0900"
국정기획위원회,정부 &quot;개편 부처 직제 조속 확정&quot;…공소청·중수청 준비 착수,"특히 기후 위기와 인공지능(AI) 대전환 등 미래 위기에 대응하기 위해 기획재정부 분리, 검찰청 폐지, 기후에너지환경부 개편을 추진했다고 강조했다. 이번 개편으로 중앙행정기관은 기존 19부 3처 20청 6위원회(48개)에서... ",https://www.daejonilbo.com/news/articleView.html?idxno=2229444,https://n.news.naver.com/mnews/article/656/0000149383?sid=100,"Fri, 26 Sep 2025 20:14:00 +0900"
국정기획위원회,'검찰청 폐지' 정부조직법 통과...본회의장 또 망언 논란,"'공룡 부처' 기획재정부를 쪼개고 환경부를 '기후에너지환경부'로 확대하는 등 '19부 6처 19청 6위원회'로 나라... 정부 국정운영 기틀을 마련해 달라며, 국민주권 정부가 경제를 살리겠다고 강조했습니다. [서영교... ",https://www.ytn.co.kr/_ln/0101_202509262013040555,https://n.news.naver.com/mnews/article/052/0002252504?sid=100,"Fri, 26 Sep 2025 20:13:00 +0900"
국정기획위원회,정부조직법 與주도 국회 통과…78년만 검찰청 폐지·기재부 분리(종합),표결…방송미디어통신위원회 상정 후 필버 돌입 곽민서 김정진 오규진 기자 = 검찰청을 폐지하고 기획재정부를 분리하는 등 정부 조직을 이재명 정부의 국정 철학에 맞게 바꾸기 위한 정부조직법 수정안이 26일... ,https://www.yna.co.kr/view/AKR20250926145551001?input=1195m,https://n.news.naver.com/mnews/article/001/0015651902?sid=100,"Fri, 26 Sep 2025 20:10:00 +0900"
국정기획위원회,"정부 &quot;개편 부처 직제 신속 마련, 공소·중수청 내년 10월 시행&quot;","예산심사 일정과 제도 정비 등을 고려해 재정경제부와 기획예산처는 내년 1월 2일, 공소청과 중대범죄수사청은 내년 10월께 각각 시행합니다. 행안부는 이번 개편은 정부조직 전반에 국정 철학과 비전을 반영하고... ",http://www.tjb.co.kr/sub0301/bodo/view/id/85233,http://www.tjb.co.kr/sub0301/bodo/view/id/85233,"Fri, 26 Sep 2025 20:02:00 +0900"
국정기획위원회,"[이슈] 여야, 선출직 평가 돌입 지방선거 모드 전환…민주 &quot;지방선거 압...","이른바 내란 사태를 극복하고 성장·회복 기조를 완성하려면 시·군 단위까지 여권 인사들로 채워 국정... 총괄기획단을 꾸린 장동혁 대표는 지난 15일 부산 현장 최고위원회의에 이어 오는 21일 동대구역 장외투쟁, 25일... ",https://www.polinews.co.kr/news/articleView.html?idxno=708813,https://www.polinews.co.kr/news/articleView.html?idxno=708813,"Fri, 26 Sep 2025 19:52:00 +0900"
국정기획위원회,"검찰, 78년 만에 역사 속으로…정부조직법 개정안 국회 통과",방송미디어통신위원회 설치법이 통과되면 윤석열 정부에서 임명한 이진숙 현 방통위원장은 자리를 잃는다. 이 위원장은 국회에서 기자들과 만나 “내가 나가고 나면 소위 이재명 대통령의 국정 철학과 가치에 맞는... ,http://www.edaily.co.kr/news/newspath.asp?newsid=04011446642304056,https://n.news.naver.com/mnews/article/018/0006126797?sid=100,"Fri, 26 Sep 2025 19:49:00 +0900"
국정기획위원회,정부 “공소·중수청 내년 10월 시행…개편 부처 직제 신속 마련”,"예산심사 일정과 제도 정비 등을 고려해 재정경제부와 기획예산처는 내년 1월 2일, 공소청과 중대범죄수사청은 내년 10월께 각각 시행한다. 행안부는 이번 개편은 정부조직 전반에 국정 철학과 비전을 반영하고, 정부가... ",https://biz.heraldcorp.com/article/10584658?ref=naver,https://n.news.naver.com/mnews/article/016/0002535621?sid=100,"Fri, 26 Sep 2025 19:48:00 +0900"
국정기획위원회,"정부 &quot;정부조직법 통과 후속 직제 신속 마련, 공소·중수청 내년 10월 시...","다만 예산심사 일정과 제도 정비 등을 고려해 재정경제부와 기획예산처는 내년 1월 2일 출범하고, 공소청과 중대범죄수사청은 내년 10월쯤부터 각각 시행된다. 행안부는 이번 개편이 국정 철학과 비전을 정부조직... ",https://www.kado.net/news/articleView.html?idxno=2007883,https://n.news.naver.com/mnews/article/654/0000144017?sid=100,"Fri, 26 Sep 2025 19:39:00 +0900"
국정기획위원회,"'검찰청 해체' 정부조직법 개정안, 국회 본회의 통과…방통위설치법 필...","서 의원은 &quot;국민 주권, 혁신 경제, 균형 성장 등 새 정부 국정 목표를 뒷받침하기 위한 것&quot;이라며 정부조직법... 산하 기획예산처로 이관된다. 방송통신위원회는 폐지되고 방송미디어통신위원회가 신설된다. 여성가족부는... ",https://www.newsis.com/view/NISX20250926_0003346264,https://n.news.naver.com/mnews/article/003/0013508650?sid=100,"Fri, 26 Sep 2025 19:33:00 +0900"
국정기획위원회,"정부 &quot;개편 부처 직제 신속 마련, 공소·중수청 내년 10월 시행&quot;","예산심사 일정과 제도 정비 등을 고려해 재정경제부와 기획예산처는 내년 1월 2일, 공소청과 중대범죄수사청은 내년 10월께 각각 시행한다. 행안부는 이번 개편은 정부조직 전반에 국정 철학과 비전을 반영하고, 정부가... ",https://www.yna.co.kr/view/AKR20250926155700530?input=1195m,https://n.news.naver.com/mnews/article/001/0015651803?sid=100,"Fri, 26 Sep 2025 19:29:00 +0900"
국정기획위원회,"검찰청 폐지, 금융위 분리 보류…'정부조직개편 통과' 한숨·안도 교차","금융위 분리, 없던 일로…'힘 빠진' 기재부 허탈 경제부처와 금융당국인 기획재정부와 금융위원회는 하루... 당장 추석 연휴가 끝난 뒤 다음 달 13일부터 시작되는 국정 감사도 문제다. 환경부는 환경노동위원회, 산업부는... ",https://www.newsis.com/view/NISX20250925_0003343790,https://n.news.naver.com/mnews/article/003/0013508640?sid=100,"Fri, 26 Sep 2025 19:25:00 +0900"
국정기획위원회,"금융감독 체계 개편, 불씨 살리는 與","분리하고 정리할 필요가 있을 것 같다’고 언급한 점을 거론하며 “이런 연유로 국정기획위원회는 금융감독 체계 개편을 마련했고, 민주당 원내대표는 직접 금융위 설치법 개정안을 대표발의한 것”이라고 설명했다.... ",https://biz.chosun.com/policy/politics/assembly/2025/09/26/DAUSP7WX7FCUBFE55MA7NUP2YM/?utm_source=naver&utm_medium=original&utm_campaign=biz,https://n.news.naver.com/mnews/article/366/0001111411?sid=100,"Fri, 26 Sep 2025 19:12:00 +0900"
국정기획위원회,검찰·기재부 쪼개서 힘빼고 … 기후부는 에너지 합쳐 '공룡'으로,기획예산처로 이관된다. 기후대응기금은 기후환경에너지부로 옮겨진다. 다만 그동안 논의됐던 금융위원회... 보면 국정의 효율이 낮아질 가능성이 있다&quot;고 말했다. 현행 조직 개편안에 대해 경제부총리가 경제 정책의... ,https://www.mk.co.kr/article/11430470,https://n.news.naver.com/mnews/article/009/0005565741?sid=100,"Fri, 26 Sep 2025 19:12:00 +0900"
국정기획위원회,"&quot;국정감사, '대구 꼴찌' 말고 '희망'도 전했으면&quot;",평화뉴스 10기 독자위원회 2차 회의(전체 92차)가 지난 9월 23일 저녁 대구 중구 '혁신공간 바람' 혁신홀에서... 독자위원들은 특히 '2025년 국정감사' 보도들을 포함해 ▲대구시 언론 홍보비 지출 ▲일제 강제징용 노동자... ,https://www.pn.or.kr/news/articleView.html?idxno=32646,https://www.pn.or.kr/news/articleView.html?idxno=32646,"Fri, 26 Sep 2025 18:46:00 +0900"
국정기획위원회,與 내부서 금융위·금감원 현행 유지에 '유감'...&quot;2단계 추진해야&quot;,그는 &quot;이재명 대통령도 지난 대선 과정에서 '금융위가 감독도 하고 정책도 하며 업무가 뒤섞여 있어서 분리하고 정리할 필요가 있을 것 같다'고 밝힌 바 있다&quot;며 &quot;이런 연유로 국정기획위원회는 금융감독체계 개편을... ,https://www.newspim.com/news/view/20250926000927,https://www.newspim.com/news/view/20250926000927,"Fri, 26 Sep 2025 17:43:00 +0900"
국정기획위원회,與더미래 &quot;금융감독 체계 개편 멈추면 안돼…2단계 추진해야&quot;,"분리하고 정리할 필요가 있을 거 같다'고 언급한 점을 거론하면서 &quot;이런 연유로 국정기획위원회는 금융감독 체계 개편을 마련했고, 민주당 원내대표는 직접 금융위 설치법 개정안을 대표발의한 것&quot;이라고 했다. 더미래는... ",https://www.news1.kr/politics/assembly/5926685,https://n.news.naver.com/mnews/article/421/0008511508?sid=100,"Fri, 26 Sep 2025 17:21:00 +0900"
국정기획위원회,"무신사 조만호, 'IPO 심판대' 국정감사 극복할까",조만호 무신사(MUSINSA) 총괄대표가 IPO(기업공개)를 위한 또 하나의 관문인 국회 국정감사와 마주했다. 국감을... 2023년 국회 기획재정위원회(기재위) 국감에서 J사는 고객 동의 없이 약 13만 명의 개인정보를 유출시켰으며... ,http://www.newsdream.kr/news/articleView.html?idxno=96342,http://www.newsdream.kr/news/articleView.html?idxno=96342,"Fri, 26 Sep 2025 17:14:00 +0900"
국정기획위원회,정부조직법에 무제한토론 진행 중…오후 표결 예정,정부 국정 목표를 뒷받침하기 위한….&quot;] 검찰청 해체와 기획재정부 분리를 핵심으로 하는 이번 정부조직법 개정안은 오늘 저녁 민주당 주도로 무제한 토론이 종결된 직후 표결에 부쳐집니다. 이어 현행 방송통신위원회를... ,https://news.kbs.co.kr/news/pc/view/view.do?ncd=8368757&ref=A,https://n.news.naver.com/mnews/article/056/0012037653?sid=100,"Fri, 26 Sep 2025 17:02:00 +0900"
국정기획위원회,"[폴리티션스토리](하) 박홍근 &quot;서울시장, 의지뿐이겠나...대전환의 시기...",박 의원은 지난 10일 서울 여의도에서 뉴스핌TV와 만나 서울시장 출마 의향을 묻는 말에 &quot;의지뿐이겠나&quot;라며 &quot;지난해 늦여름 당시 이재명 대표와 한번 상의를 했고 (최근 국정기획위원회 활동을 마치고) 이 대통령을 뵙고... ,https://www.newspim.com/news/view/20250924001165,https://www.newspim.com/news/view/20250924001165,"Fri, 26 Sep 2025 17:00:00 +0900"
국정기획위원회,&quot;이대로 못 버텨&quot;…백화점 공백에 상인 울상,"지난 7월, 국정기획위원회가 현장을 찾기도 했지만, 해법은 나오지 않았습니다. 상인들은 건물이 장기간 방치되면서 사람들의 발길은 끊기고, 상권 분위기 자체가 무너졌다고 하소연합니다. [박진득 / 인근 상인 : 장사를... ",http://news.lghellovision.net/news/articleView.html?idxno=521338,http://news.lghellovision.net/news/articleView.html?idxno=521338,"Fri, 26 Sep 2025 16:52:00 +0900"
국정기획위원회,"민주, 지방선거 대비 릴레이 특강 추진…&quot;李정부 국정철학 강연&quot;",2주차인 11월 12일에는 국정기획위원장을 지낸 이한주 민주연구원장이 '이재명 정부의 국정철학과 주요 과제... 한편 정청래 대표는 지난 13일 비공개 최고위원회의 의결을 통해 조직강화특별위원회(조강특위)와... ,https://www.newsis.com/view/NISX20250926_0003346042,https://n.news.naver.com/mnews/article/003/0013508392?sid=100,"Fri, 26 Sep 2025 16:45:00 +0900"
국정기획위원회,정부 조직 개편서도 '패싱'…무기력증 빠진 경제 관료들,기재부의 관계자는 “금융정책의 재경부 이관은 예산 기능 분리와 함께 대통령 공약에서부터 국정기획위원회 논의를 거쳐 고위 당정협의까지 일관되게 추진돼 왔던 것”이라며 “이런 결정을 뒤집는데도 기재부의 의견은... ,https://www.sedaily.com/NewsView/2GY1WXE02B,https://n.news.naver.com/mnews/article/011/0004538053?sid=101,"Fri, 26 Sep 2025 16:38:00 +0900"
국정기획위원회,與 더미래 의원들 &quot;금융감독체계 개편 멈추면 안돼…2단계 추진해야&quot;,"더미래는 “이런 연유로 국정기획위원회는 금융감독체계 개편을 마련했고, 민주당 원내대표는 직접 금융위원회 설치법 개정안을 대표발의한 것”이라며 “오랜 기간 논의되어 온 정책을 갑자기 바꾼다면 민주당과 정부는... ",https://www.sedaily.com/NewsView/2GY1WD6R4J,https://n.news.naver.com/mnews/article/011/0004538050?sid=100,"Fri, 26 Sep 2025 16:37:00 +0900"
국정기획위원회,[기고] 외국인 계절근로자 단상,"대표적인 것이 이민전담기관의 설치였지만, 국정기획위원회나 여당의 정부조직 개편안에 제대로 논의조차 이루어지지 못했다. 그나마 지난 대선에서 이민정책 관련 공약이 딱 한 가지 있었는데, 바로 농어촌 외국인... ",https://www.newspim.com/news/view/20250926000825,https://www.newspim.com/news/view/20250926000825,"Fri, 26 Sep 2025 16:19:00 +0900"
국정기획위원회,與더미래 의원들 &quot;금융위 개편 멈춰선 안돼...2단계 추진해야&quot;,오 의원은 &quot;학계와 실무에서 금융감독체계 개편에 대한 다양한 요구가 있었고 2013년부터 금융감독체계 개편에 관한 법안들이 꾸준히 발의됐다&quot;며 &quot;이런 연유로 국정기획위원회는 금융감독체계 개편을 마련했고... ,https://www.mt.co.kr/politics/2025/09/26/2025092615490067451,https://n.news.naver.com/mnews/article/008/0005256518?sid=100,"Fri, 26 Sep 2025 16:09:00 +0900"
국정기획위원회,"구윤철, 30일 확대간부회의 소집…조직개편·인사 메시지 나오나","당정대는 기재부에서 예산 기능을 떼어낸 기획예산처, 금융위원회의 금융정책 기능을 더한 재정경제부로... 기재부 한 관계자는 “가뜩이나 인사 적체와 지연으로 인한 불만이 터지기 직전인 상황”이라며 “국정감사를... ",http://www.edaily.co.kr/news/newspath.asp?newsid=03503046642304056,https://n.news.naver.com/mnews/article/018/0006126389?sid=101,"Fri, 26 Sep 2025 15:56:00 +0900"
국정기획위원회,광주 교통체계 혁신 방안 토론회 열린다.,이날 국회 국토교통위원회 소속 더불어 민주당 정준호 국회의원 (광주 북구 갑 ) 이 주관한다. 토론회는... 이어지는 토론에서는 ▲ 오동규 철도기술연구원 철도모빌리티정책실장 ▲ 백효순 국가철도공단 사업기획처장... ,http://www.namdonews.com/news/articleView.html?idxno=834401,http://www.namdonews.com/news/articleView.html?idxno=834401,"Fri, 26 Sep 2025 15:42:00 +0900"
국정기획위원회,李정부 대통령실 첫 재산 공개…김상호 비서관 60억 ‘1위’,정부공직자윤리위원회는 26일 관보를 통해 9월 수시재산 변동 사항을 공개했다. 이번 공개 대상은 지난... 대통령실 수석비서관급 중에는 네이버클라우드 AI이노베이션센터장 출신 하정우 AI미래기획수석비서관이... ,https://www.mk.co.kr/article/11430173,https://n.news.naver.com/mnews/article/024/0000100184?sid=102,"Fri, 26 Sep 2025 15:41:00 +0900"
국정기획위원회,43일 만에 '원위치'로 돌아갔다...금융위·금감원 조직개편 전격 철회,"이는 지난 8월 13일 국정기획위원회가 금융당국 개편안을 발표한 이후 43일 만의 전면 철회로, 금융위원회와 금융감독원의 거센 반발과 야당의 필리버스터 예고, 무엇보다 경제 현안 해결에 국력을 집중해야 한다는 현실적... ",https://www.ezyeconomy.com/news/articleView.html?idxno=222447,https://www.ezyeconomy.com/news/articleView.html?idxno=222447,"Fri, 26 Sep 2025 15:20:00 +0900"
국정기획위원회,송도 R2 개발 부결… 도마 위에 오른 인천시 '행정 투명성',"인천 송도 R2 블록 개발안이 인천시 투자유치기획위원회에서 부결되면서 절차적 하자와 특혜 의혹 논란이... 지난 국정감사에서 문제가 된 기업이 또다시 제안서를 제출했음에도, 외국인 직접투자(FDI) 확정이 없었는데... ",https://www.newswhoplus.com/news/articleView.html?idxno=41889,https://www.newswhoplus.com/news/articleView.html?idxno=41889,"Fri, 26 Sep 2025 15:18:00 +0900"
국정기획위원회,"박정현 부여군수, 하구복원특별법 제정 토론회서 개회사","이번 행사는 지난해 12월 전라남도와 올 2월 충남 부여군에서 열린 전국토론회에 이어 세 번째로 마련됐으며, 8월 국정기획위원회의 '4대강 재자연화와 한반도 생물다양성 회복' 국정과제 채택 이후 하구복원특별법 제정을... ",http://www.newsprime.co.kr/news/article.html?no=706088,http://www.newsprime.co.kr/news/article.html?no=706088,"Fri, 26 Sep 2025 15:12:00 +0900"
