Keyword,Title,Description,Original Link,Link,Publication Date
산업은행,"임이자 기재위원장 &quot;수은, 관세 피해기업 지원 6조 푼다더니 집행률 26%...","5월~8월 집행률을 비교하면 수출입은행은 19.7%로, 산업은행(0.5%)에 이어 두 번째로 낮았다. 반면 기술보증기금의 ‘위기극복 특례보증’과 중소벤처기업진흥공단의 ‘통상리스크 대응 긴급자금’은 같은 기간 각각 60... ",https://www.taxtimes.co.kr/news/article.html?no=271639,https://www.taxtimes.co.kr/news/article.html?no=271639,"Fri, 26 Sep 2025 16:06:00 +0900"
산업은행,"신용보증기금, 아시아·아프리카·남미 7개국 대상 '중소기업 혁신금융...","연수 프로그램은 녹색금융 최신 동향과 한국 정책 지원 사례를 바탕으로, △녹색보증제도 운영 사례 분석 △녹색보증기업 현장 탐방 △글로벌녹색성장기구(GGGI), 산업은행, 기업은행 등 정책기관 소개 △참가국 맞춤형... ",https://www.s-journal.co.kr/news/articleView.html?idxno=34094,https://www.s-journal.co.kr/news/articleView.html?idxno=34094,"Fri, 26 Sep 2025 16:04:00 +0900"
산업은행,[사사건건] 사라지는 검찰청…보완수사요구권 등 후속 조치 어떻게?,"실제 또 공공금융기관 간에는 수출입은행 또 산업은행, IBK기업은행, 이 세 은행이 기업 지원 업무를 다 하거든요. 그런데 중복되는 경우가 상당히 많습니다. 또 이런 경우는 기능의 세분화, 또 조정이 반드시 필요하고 또... ",https://news.kbs.co.kr/news/pc/view/view.do?ncd=8368706&ref=A,https://n.news.naver.com/mnews/article/056/0012037647?sid=100,"Fri, 26 Sep 2025 16:00:00 +0900"
산업은행,금융노조 총파업 '머쓱'... 은행원 99% 외면,주요 은행 참여율 1% 미만 '주 4.5일제' 명분 약해... 동참 꺼려 억대 연봉 파업에 여론도 싸늘 전국금융산업노동조합 총파업. 사진=김호정 기자 [디지털포스트(PC사랑)=김호정 기자 ] 전국금융산업노조동조합(금융노조)이 주... ,https://www.ilovepc.co.kr/news/articleView.html?idxno=56208,https://www.ilovepc.co.kr/news/articleView.html?idxno=56208,"Fri, 26 Sep 2025 15:28:00 +0900"
산업은행,"임이자 기재위원장, &quot;관세 피해기업 지원 성적표…수은 집행률 26%, 6개 ...","5월~8월 집행률을 비교하면 수출입은행은 19.7%로, 산업은행(0.5%)에 이어 두 번째로 낮았다. 반면 기술보증기금의 '위기극복 특례보증'과 중소벤처기업진흥공단의 '통상리스크 대응 긴급자금'은 같은 기간 각각 60% 이상의... ",http://www.intn.co.kr/news/articleView.html?idxno=2046254,http://www.intn.co.kr/news/articleView.html?idxno=2046254,"Fri, 26 Sep 2025 15:20:00 +0900"
산업은행,‘연봉 1.2억’ 금융노조 총파업… “4.5일제 절박” 주장에 시민들 시...,사실상 IBK기업은행과 산업은행 등 국책은행을 중심으로 파업이 이뤄질 전망이다. 주요 은행들도 이번 총파업에 대비해 대체 인력을 투입하는 등 대비책을 마련했다. 실제 파업으로 인한 소비자 민원은 많지 않은... ,https://biz.chosun.com/stock/finance/2025/09/26/Y5VQQI2GQBFJDMDGDWBI3DNUAE/?utm_source=naver&utm_medium=original&utm_campaign=biz,https://n.news.naver.com/mnews/article/366/0001111339?sid=101,"Fri, 26 Sep 2025 15:19:00 +0900"
산업은행,李 대통령 &quot;韓 증시 저평가 요인인 지정학적 리스크 해소할 것&quot;…증권가...,"◆ 금융지주 회장들 대거 참석...증권가, &quot;외국인 투자 유치 기대&quot; 이번 설명회에는 신한금융지주, 하나금융지주, 한국산업은행, 삼성카드, 한화생명, 현대캐피탈 등 국내 주요 금융기관 수장들이 대거 참석했다.... ",http://www.hansbiz.co.kr/news/articleView.html?idxno=779891,http://www.hansbiz.co.kr/news/articleView.html?idxno=779891,"Fri, 26 Sep 2025 15:16:00 +0900"
산업은행,&quot;석화기업 지원방안 나온다&quot;…30일 채권단 자율협의회 협약식 개최,"협약에는 권대영 금융위원회 부위원장과 5대 시중은행뿐만 아니라 기업은행, 한국산업은행 등이 참석한다. 지난달 20일 금융위 주재로 석유화학산업 경쟁력 제고를 위한 금융권 간담회에 이어 자율협약을 체결해 추후 금융... ",https://www.news1.kr/finance/general-finance/5926345,https://n.news.naver.com/mnews/article/421/0008511218?sid=101,"Fri, 26 Sep 2025 15:14:00 +0900"
산업은행,"과기부, 'K-Global@실리콘밸리 2025' 열고 국내 AI 스타트업 글로벌 도약...","이외에도 한국투자공사·한국벤처투자·한국산업은행 등 투자 유관기관은 물론, 삼성 벤처스·네이버 D2SF·롯데 벤처스·KT 아메리카·SK하이닉스 벤처스 등 국내 대기업이 현지에서 운영 중인 스타트업 발굴·투자기관... ",https://www.ezyeconomy.com/news/articleView.html?idxno=222490,https://www.ezyeconomy.com/news/articleView.html?idxno=222490,"Fri, 26 Sep 2025 15:12:00 +0900"
산업은행,은행원도 부담스러운 총파업...5대 은행 영업점 모두 정상 운영,"당초 금융노조는 한국산업은행 이전과 공공기관 예산 삭감이 주요 쟁점이었던 2022년 파업과 달리, 올해 파업은 은행원 모두에 영향을 미치는 사안인 만큼 참여율이 높을 것으로 기대했지만 이번에도 초라한 참여율로... ",http://www.fnnews.com/news/202509261428429671,https://n.news.naver.com/mnews/article/014/0005412898?sid=101,"Fri, 26 Sep 2025 15:12:00 +0900"
산업은행,"신보, 신흥국 공무원 대상 '중기 혁신금융 역량 강화' 연수 성료","연수 프로그램은 녹색금융의 최신 동향과 한국의 정책 지원 사례를 바탕으로, △녹색보증제도 운영 사례 분석 △녹색보증기업 현장 탐방 △글로벌녹색성장기구(GGGI), 산업은행, 기업은행 등 정책기관 소개 △참가국... ",https://www.mediapen.com/news/view/1045752,https://www.mediapen.com/news/view/1045752,"Fri, 26 Sep 2025 15:10:00 +0900"
산업은행,"신용보증기금, 7개 신흥국 대상 '중소기업 혁신금융 역량 강화' 연수 성...","연수는 녹색보증제도 운영 사례 분석, 녹색보증기업 현장 탐방, 글로벌녹색성장기구·산업은행·기업은행 등 정책기관 소개, 참가국 맞춤형 실행계획 수립 등 실무 중심 프로그램으로 구성됐습니다. 연수생 대표인... ",https://news.bbsi.co.kr/news/articleView.html?idxno=4048728,https://news.bbsi.co.kr/news/articleView.html?idxno=4048728,"Fri, 26 Sep 2025 15:06:00 +0900"
산업은행,"신용보증기금, 7개국 대상 ‘중소기업 혁신금융 역량 강화’ 연수 진행","연수 프로그램은 녹색금융의 최신 동향과 한국의 정책 지원 사례를 바탕으로 △녹색보증제도 운영 사례 분석 △녹색보증기업 현장 탐방 △글로벌녹색성장기구(GGGI), 산업은행, 기업은행 등 정책기관 소개 △참가국... ",https://www.ekn.kr/web/view.php?key=20250926021291132,https://www.ekn.kr/web/view.php?key=20250926021291132,"Fri, 26 Sep 2025 15:00:00 +0900"
산업은행,"아크로멧, 시리즈A 라운드 70억원 투자 유치","이번 라운드에는 기존 투자사인 한국투자엑셀러레이터를 비롯해 인라이트벤처스, 기술보증기금, 에버그린투자파트너스, 산업은행 등이 신규 참여했다. 한편, 아크로멧은 시리즈A 이전 단계에서도... ",https://magazine.hankyung.com/business/article/202509260331b,https://n.news.naver.com/mnews/article/050/0000096678?sid=101,"Fri, 26 Sep 2025 14:56:00 +0900"
산업은행,"신용보증기금, 아시아·아프리카·남미 7개국과 '중소기업 혁신금융 역...","프로그램은 녹색금융의 최신 동향과 한국의 정책 지원 사례로 녹색보증제도 운영 사례 분석과 녹색보증기업 현장 탐방, 글로벌녹색성장기구(GGGI), 산업은행, 기업은행 소개, 참가국 맞춤형 실행계획 수립 등 실무 중심... ",https://www.globale.co.kr/news/articleView.html?idxno=34774,https://www.globale.co.kr/news/articleView.html?idxno=34774,"Fri, 26 Sep 2025 14:54:00 +0900"
산업은행,"중앙대, 역대 최대 규모 창업공모전…‘무농약 비료’ 아이템 대상","전영민 전 롯데벤처스 대표가 심사위원장을 맡고 서울경제진흥원, 신한은행 등 학계와 산업계를 아우르는 전문가들이 심사에 참여해 아이템의 차별성과 사업화 가능성을 날카롭게 평가했다. 김창봉 중앙대... ",https://www.mk.co.kr/article/11430113,https://n.news.naver.com/mnews/article/009/0005565525?sid=102,"Fri, 26 Sep 2025 14:48:00 +0900"
산업은행,"임이자 기재위원장 &quot;수출입은행 위기대응특별프로그램, 집행 부진 심각...",5~8월 집행률을 보면 수출입은행은 19.7%로 산업은행(0.5%)에 이어 두 번째로 낮았다. 반면 기술보증기금의 위기극복 특례보증과 중소벤처기업진흥공단의 통상리스크 대응 긴급자금은 각각 60% 이상을 달성해 대조를... ,https://www.ziksir.com/news/articleView.html?idxno=106206,https://www.ziksir.com/news/articleView.html?idxno=106206,"Fri, 26 Sep 2025 14:42:00 +0900"
산업은행,"신용보증기금, 7개국 대상 중소기업 혁신금융 연수 성료","프로그램은 △녹색보증제도 운영 사례 분석 △녹색보증기업 현장 탐방 △글로벌녹색성장기구(GGGI), 산업은행·기업은행 등 정책기관 소개 △참가국 맞춤형 실행계획 수립 등 실무 중심으로 구성됐다. 캄보디아... ",http://www.newsdream.kr/news/articleView.html?idxno=96321,http://www.newsdream.kr/news/articleView.html?idxno=96321,"Fri, 26 Sep 2025 14:34:00 +0900"
산업은행,금융노조 총파업 실시했지만…시중은행 참여율 저조,"총파업에는 KB국민은행, 신한은행, 하나은행, 우리은행 등 주요 시중은행과 산업은행, 기업은행 등 국책은행 소속 42개 지부 10만여 조합원이 참여할 예정이다. 2025.09.26 yym58@newspim.com 금융노조는 이날 서울 광화문... ",https://www.newspim.com/news/view/20250926000629,https://www.newspim.com/news/view/20250926000629,"Fri, 26 Sep 2025 14:27:00 +0900"
산업은행,"'부채율 600%' 금호건설, 아시아나 지분 담보 600억 대출",26일 금호건설에 따르면 회사는 최근 산업은행과 600억원 규모의 대출 계약을 체결하면서 아시아나항공 지분 11.12% 전량을 담보로 제공했다. 이번 계약은 '변경 계약'으로 기록돼 있어 기존 차입금을 산업은행 대출로... ,https://www.ebn.co.kr/news/articleView.html?idxno=1680286,https://www.ebn.co.kr/news/articleView.html?idxno=1680286,"Fri, 26 Sep 2025 14:26:00 +0900"
산업은행,"아크로멧, 시리즈A 라운드 70억 투자 유치","이번 라운드에는 기존 투자사인 한국투자엑셀러레이터를 비롯해 인라이트벤처스, 기술보증기금, 에버그린투자파트너스, 산업은행 등이 신규 참여했다. 한편, 아크로멧은 시리즈A 이전 단계에서도... ",https://www.joongang.co.kr/article/25370235,https://n.news.naver.com/mnews/article/025/0003472089?sid=102,"Fri, 26 Sep 2025 14:20:00 +0900"
산업은행,"[CNB뉴스 위클리픽-은행] 하나은행, 폴란드 브로츠와프 지점 열어 外","산업은행, ‘남부권 지역성장지원펀드’ 5개 위탁운용사 선정 2025 남부권 지역성장지원펀드 위탁운용사 선정 결과. (자료=산업은행) 한국산업은행이 ‘2025 남부권 지역성장지원펀드’의 위탁운용사로 5개 운용사를... ",https://www.cnbnews.com/news/article.html?no=752878,https://www.cnbnews.com/news/article.html?no=752878,"Fri, 26 Sep 2025 14:12:00 +0900"
산업은행,&quot;주 4.5일제 요구&quot; 금융노조 3년 만에 총파업…은행원도 '외면',"주요 5대 은행의 참여율이 저조하며 사실상 국책은행(IBK기업은행, 한국산업은행) 위주의 파업이 될 것으로 보인다. 산업은행의 경우 부서마다 1명 이상이 파업에 참여하며, 지난해 12월 특별성과급과 적체된 시간 외... ",https://www.news1.kr/finance/general-finance/5926033,https://n.news.naver.com/mnews/article/421/0008511019?sid=101,"Fri, 26 Sep 2025 14:09:00 +0900"
기업은행,◇오늘의 경기(27일),IBK기업은행-현대건설(16시·이상 여수 진남체육관) △골프= KPGA 투어 현대해상 최경주 인비테이셔널(페럼클럽) KLPGA 투어 제25회 하이트진로 챔피언십(블루헤런) △프로축구2부= 전남-부천(14시·광양전용구장)... ,https://www.yna.co.kr/view/AKR20250926013251007?input=1195m,https://m.sports.naver.com/general/article/001/0015652132,"Sat, 27 Sep 2025 06:15:00 +0900"
기업은행,채용인원 줄었는데 디지털·AI도 '따로'···더 좁아지는 문과 채용문 ...,"IBK기업은행이 이달 초 올린 하반기 정규직 수시채용 모집 분야 4개 중 3개 부문이 디지털 보안 분야였다. 금융업계 관계자는 &quot;예전에는 경영학과를 비롯한 인문·상경계 취업준비생을 많이 뽑았지만, 지금은 금융 DX... ",http://www.fntimes.com/html/view.php?ud=202509262301384524b4a7c6999c_18,http://www.fntimes.com/html/view.php?ud=202509262301384524b4a7c6999c_18,"Sat, 27 Sep 2025 06:02:00 +0900"
기업은행,"LGU+, 추석 앞두고 중소 협력사 대금 350억원 조기 지급","협력사가 신제품 개발·품질제고·생산성 향상에 필요한 자금을 무이자로 대출해주는 '직접자금지원' 프로그램, IBK기업은행과 연계해 최대 3.3% 우대금리로 기업 운영 자금을 대출해주는 '동반성장펀드'를 운영하고... ",https://www.apnews.kr/news/articleView.html?idxno=3040602,https://www.apnews.kr/news/articleView.html?idxno=3040602,"Sat, 27 Sep 2025 05:46:00 +0900"
기업은행,&quot;이 와중에 주 4.5일제 파업을?&quot;…부담느낀 은행원 대거 불참,금융노조위원장이 속한 IBK기업은행은 참여 인원이 1477명이었지만 전체 607개 지점이 이날 정상 운영됐다. 시중은행 관계자는 “주4.5일제가 영업점 직원까지 파업에 나설 정도로 시급한 사안인가에 대한 문제의식이... ,https://www.sedaily.com/NewsView/2GY2C6XVVN,https://n.news.naver.com/mnews/article/011/0004538192?sid=101,"Sat, 27 Sep 2025 05:31:00 +0900"
기업은행,[주간금융] 코스피 3400대 아래로···금융감독체계 개편안 철회,"회사별로는 토스증권(61%), 카카오뱅크(50%), 카카오페이손해보험(48%) 등 인터넷은행·핀테크 계열사가 높은 비중을 기록한 반면, 기업은행(6%), DB생명(6%), 코리아에셋투자증권(2%), 안양저축은행(2%) 등은 한 자릿수에... ",https://www.smartfn.co.kr/news/articleView.html?idxno=121378,https://www.smartfn.co.kr/news/articleView.html?idxno=121378,"Sat, 27 Sep 2025 05:00:00 +0900"
기업은행,&quot;주 4.5일제 명분 없는 파업&quot;...한산한 금융노조 총파업,"반면 정책금융기관인 IBK기업은행과 한국산업은행에서는 파업 참여자가 상대적으로 많았다. 한편 이번 총파업은 금융산업사용자협의회와 진행 중인 산별 중앙교섭의 일환으로, 금융노조는 주 4.5일제 근무 도입과 5% 임금... ",http://weekly.chosun.com/news/articleView.html?idxno=44868,https://n.news.naver.com/mnews/article/053/0000052569?sid=101,"Sat, 27 Sep 2025 04:30:00 +0900"
기업은행,"기업은행, 개인사업자 특화카드 2종 출시…&quot;실질 비용 절감 지원&quot;",©AP신문(AP뉴스)/이미지 제공 = IBK기업은행 IBK기업은행(은행장 김성태)은 개인사업자의 소비 패턴을 반영한 특화카드 'B-RETAIL'과 'B-F&amp;B'를 출시했다고 26일 밝혔다. 이번 카드는 신규 개인사업자가 많은 도소매... ,https://www.apnews.kr/news/articleView.html?idxno=3040615,https://www.apnews.kr/news/articleView.html?idxno=3040615,"Sat, 27 Sep 2025 02:14:00 +0900"
기업은행,[오늘의 경기] 2025년 9월 27일,(13시30분·SBS스포츠) IBK기업은행-현대건설(16시·이상 여수 진남체) 스포츠클라이밍 2025 IFSC 세계선수권(올림픽공원 한얼광장 및 케이스포돔·10시) 배드민턴 2025 수원빅터코리아오픈 월드투어 슈퍼 500(수원체),https://www.chosun.com/sports/sports_general/2025/09/27/UOI2GEL7VBCZ5KLAQ3FTFG7XGM/?utm_source=naver&utm_medium=referral&utm_campaign=naver-news,https://m.sports.naver.com/general/article/023/0003931658,"Sat, 27 Sep 2025 00:47:00 +0900"
기업은행,"'김세인 17점' 한국도로공사, 정관장 꺾고 컵대회 준결승 진출…4강 대진...","이에 따라 초청팀으로 B조에 합류했던 득지앙(베트남)의 출전이 무산됐고, 결국 B조에선 한국도로공사, IBK기업은행, 정관장 3개 팀이 한 차례씩 맞대결을 펼쳤다. 2연승으로 B조 1위에 오른 IBK기업은행은 A조 2위... ",http://www.stoo.com/article.php?aid=102788952654,http://www.stoo.com/article.php?aid=102788952654,"Fri, 26 Sep 2025 23:30:00 +0900"
기업은행,"IBK기업은행, 한국인터넷진흥원과 사이버 보안 강화를 위한 업무협약",IBK기업은행은 지난 25일 한국인터넷진흥원(원장 이상중)과 '사이버 위협 대응 및 정보 공유 체계 강화를 위한 업무협약'을 체결했다고 26일 밝혔다. 이번 협약은 날로 지능화되는 사이버 공격에 선제적으로 대응하고자... ,https://www.dailysportshankook.co.kr/news/articleView.html?idxno=415239,https://www.dailysportshankook.co.kr/news/articleView.html?idxno=415239,"Fri, 26 Sep 2025 23:30:00 +0900"
기업은행,"IBK기업은행, 개인사업자 특화 카드 2종 출시",IBK기업은행(은행장 김성태)은 개인사업자의 소비 패턴을 반영한 특화 카드 'B-RETAIL'과 'B-F&amp;B'를 출시했다고 26일 밝혔다. 이번 카드는 신규 개인사업자가 많은 도소매·음식점 업종의 결제 데이터를 기반으로... ,https://www.dailysportshankook.co.kr/news/articleView.html?idxno=415233,https://www.dailysportshankook.co.kr/news/articleView.html?idxno=415233,"Fri, 26 Sep 2025 23:16:00 +0900"
기업은행,&quot;주 4.5일제 요구&quot; 금융노조 총파업에도...은행은 '정상 영업',"다만, 노조위원장이 속한 기업은행은 노조원의 16%가량인 천4백여 명이 업무를 거부했습니다. 일부 직원의 파업 참여로 이 영업점에선 전체 21개 창구 가운데 2개가 비어있습니다. 창구의 절반밖에 운영하지 못한 지점도... ",https://www.ytn.co.kr/_ln/0102_202509262251005424,https://n.news.naver.com/mnews/article/052/0002252551?sid=101,"Fri, 26 Sep 2025 22:51:00 +0900"
기업은행,"'디펜딩 챔프' 현대건설 포함, 컵대회 준결승 대진 완성... 도로공사, '준...",IBK기업은행은 B조에서 2전 전승으로 조1위를 차지했다. 한국도로공사는 정관장과 최종전에서 승리하며 1승 1패 조2위로 4강행에 성공했다. A조에서는 GS칼텍스가 3전 전승으로 선두를 차지했다. 현대건설은 2승 1패로... ,https://www.starnewskorea.com/sports/2025/09/26/2025092621124844505,https://m.sports.naver.com/volleyball/article/108/0003370101,"Fri, 26 Sep 2025 22:04:00 +0900"
기업은행,"여자배구 한국도로공사, 정관장 3-1로 꺾고 컵대회 준결승 진출",반면 지난 22일 IBK기업은행전(1-3 패)에 이어 이날 경기마저 패한 정관장(2패)은 조별리그에서 탈락했다. 김세인은 이날 서브에이스 3개를 비롯해 17득점을 올리며 팀의 승리를 이끌었다. 강소휘(16득점)도 블로킹... ,https://www.newsis.com/view/NISX20250926_0003346256,https://m.sports.naver.com/volleyball/article/003/0013508786,"Fri, 26 Sep 2025 22:01:00 +0900"
기업은행,"[프로배구] 컵대회 4강 확정…도로공사, 정관장 꺾고 준결승 막차","B조 1위는 2승을 거둔 IBK기업은행이다. 2패를 기록한 정관장은 최하위로 탈락했다. 4강이 모두 확정된 가운데 A조 1위 GS칼텍스와 B조 2위 도로공사는 27일 오후 1시 30분 맞붙고, A조 2위 현대건설과 B조 1위... ",https://www.newspim.com/news/view/20250926001027,https://www.newspim.com/news/view/20250926001027,"Fri, 26 Sep 2025 21:47:00 +0900"
기업은행,"정부, 부울경 수출기업 금융지원 설명회…수출입은행·무보·기은 등 미...","행사에는 수출입은행, 무역보험공사, 중소벤처기업진흥공단, 신용보증기금, 기술보증기금, IBK기업은행 등 6대 정책금융기관과 지역 수출기업들이 참석했다. 설명회는 통상환경 변화 속에서 늘어나는 기업의 금융... ",http://www.econonews.co.kr/news/articleView.html?idxno=406709,http://www.econonews.co.kr/news/articleView.html?idxno=406709,"Fri, 26 Sep 2025 21:40:00 +0900"
기업은행,"도로공사, 정관장 꺾고 KOVO컵 4강 막차 합류","지난 24일 IBK기업은행에 1-3으로 졌던 도로공사는 정관장을 잡고 1승1패를 기록, B조 2위로 준결승에 올랐다. 기업은행이 2승으로 일찌감치 4강에 진출했고, 정관장은 2패로 탈락했다. 국제배구연맹(FIVB)의... ",https://www.news1.kr/sports/volleyball/5926865,https://m.sports.naver.com/volleyball/article/421/0008511885,"Fri, 26 Sep 2025 21:36:00 +0900"
기업은행,"&quot;김세인 17점 맹활약&quot;…도로공사, 정관장 꺾고 컵대회 준결승행","도로공사는 1승 1패를 기록하며 IBK기업은행에 이어 조2위로 준결승 진출을 확정했다. 반면, 정관장은 두 경기 모두 패하며 조별리그에서 탈락했다. 경기는 도로공사가 1세트에서 팀 공격 성공률 42.85%를 올리며 초반... ",https://www.topstarnews.net/news/articleView.html?idxno=15821000,https://www.topstarnews.net/news/articleView.html?idxno=15821000,"Fri, 26 Sep 2025 21:30:00 +0900"
기업은행,"LG유플러스, 추석 앞두고 중소 협력사에 350억 조기 지급","신제품 개발, 품질 제고, 생산성 향상에 필요한 자금을 무이자로 대출해주는 '직접자금지원' 프로그램과 IBK기업은행과 연계하여 최대 3.3% 우대금리로 기업 운영 자금을 대출해주는 '동반성장펀드'가 있다. 또한, 차세대... ",http://www.newsbrite.net/news/articleView.html?idxno=193598,http://www.newsbrite.net/news/articleView.html?idxno=193598,"Fri, 26 Sep 2025 21:22:00 +0900"
기업은행,“억대 연봉에 임금 파업은 좀”...눈치 본 은행원들 집회출석률 ‘10%’,김형선 금융노조 위원장이 속한 IBK기업은행의 경우 노조원 9400여 명의 16% 수준인 1400여 명이 파업에 참여했다. 다만 기업은행 측에선 비노조원의 추가 배치 조치 등으로 영업점 운영 차질은 없었다는 입장이다. 다른... ,https://www.mk.co.kr/article/11430487,https://n.news.naver.com/mnews/article/009/0005565754?sid=101,"Fri, 26 Sep 2025 21:19:00 +0900"
기업은행,"도로공사, 프로배구 컵대회 준결승 진출…정관장에 3-1 승리","1승 1패를 기록한 한국도로공사는 IBK기업은행(2승)에 이어 조2위를 확정했다. 2패를 당한 정관장은 B조 최하위로 탈락했다. 각 조 1, 2위가 진출하는 컵대회 여자부 준결승 대진은 완성됐다. A조 1위 GS칼텍스와 B조... ",https://www.yna.co.kr/view/AKR20250926160700007?input=1195m,https://m.sports.naver.com/volleyball/article/001/0015651995,"Fri, 26 Sep 2025 21:15:00 +0900"
기업은행,"신한자산운용, '신한디딤글로벌EMP' 디딤펀드 출시 1년만에 자금유입 1위",해당 펀드는 신한은행·신한투자증권·삼성증권·하나은행·미래에셋증권·농협은행·부산은행·IBK기업은행·한국투자증권·우리투자증권·KB증권·제주은행·미래에셋생명·교보생명에서 가입할 수 있다.,http://www.bizwnews.com/news/articleView.html?idxno=112709,http://www.bizwnews.com/news/articleView.html?idxno=112709,"Fri, 26 Sep 2025 20:16:00 +0900"
기업은행,"&quot;평균 연봉 1.2억&quot; 금융노조 3년 만의 '총파업', 공감대는 글쎄",기업은행에서는 노조원 약 9400명 중 16%가량인 1400여 명이 파업에 참여했지만 영업점 607곳은 정상 운영됐다. 김형선 금융노조 위원장은 &quot;주4.5일제는 배부른 투쟁이 아니라 사랑하는 가족과 함께하기 위한 절실한 요구... ,http://www.joseilbo.com/news/news_read.php?uid=553720&class=1&grp=,https://n.news.naver.com/mnews/article/123/0002369029?sid=101,"Fri, 26 Sep 2025 19:39:00 +0900"
기업은행,"IBK기업은행, 한국인터넷진흥원과 사이버 보안 강화를 위한 업무협약 체...",IBK기업은행(은행장 김성태)은 지난 25일 한국인터넷진흥원(원장 이상중)과 '사이버위협 대응 및 정보 공유 체계 강화를 위한 업무협약'을 체결했다고 밝혔다. 이번 협약은 날로 지능화되는 사이버 공격에 선제적으로... ,https://www.autodaily.co.kr/news/articleView.html?idxno=536984,https://www.autodaily.co.kr/news/articleView.html?idxno=536984,"Fri, 26 Sep 2025 19:36:00 +0900"
기업은행,"신용보증기금, 2주간 '중소기업 혁신금융 역량 강화' 연수 실시","대표적으로는 ▲녹색보증제도 운영 사례 분석 ▲녹색보증기업 현장 탐방 ▲글로벌녹색성장기구(GGGI), 산업은행, 기업은행 등 정책기관 소개 ▲참가국 맞춤형 실행계획 수립 등이 있다. 연수생 대표인 캄보디아... ",http://www.seoulwire.com/news/articleView.html?idxno=673076,http://www.seoulwire.com/news/articleView.html?idxno=673076,"Fri, 26 Sep 2025 19:22:00 +0900"
