Keyword,Title,Description,Original Link,Link,Publication Date
이재명,김민석 &quot;차기 주자 육성? 어처구니 없는 공상&quot;…김어준 발언 반박,김민석 국무총리가 16일 방송인 김어준씨가 자신의 미국 출장을 두고 &quot;이재명 대통령의 '차기 대권 주자 육성 프로그램'&quot;이라고 발언한 데 대해 &quot;어처구니 없는 공상&quot;이라고 반박했다. 미국을 방문 중인 김 총리는 이날... ,http://weekly.chosun.com/news/articleView.html?idxno=49695,https://n.news.naver.com/mnews/article/053/0000056653?sid=100,"Mon, 16 Mar 2026 17:35:00 +0900"
이재명,"李 대통령 부부, 신형 2호기 첫 탑승…순항속도·최대항속거리 향상",15일 3·15 의거 기념식 참석 위해 탑승 향후 5년 간 전용기로 운용 이재명 대통령과 영부인 김혜경 여사는 15일 오전 경기도 성남시 서울공항에서 신형 공군2호기에 첫 탑승했다고 청와대가 16일 밝혔다. 이 대통령... ,https://news.tf.co.kr/read/ptoday/2302776.htm,https://n.news.naver.com/mnews/article/629/0000481922?sid=100,"Mon, 16 Mar 2026 17:35:00 +0900"
이재명,李대통령 &quot;김구 선생 꿈이 현실로&quot;…케데헌 쾌거에 환호,핵심요약 &quot;우리 문화 지평 넓혀…오늘 성과 토대로 더 큰 꿈&quot; 이재명 대통령은 16일 '케이팝 데몬 헌터스'(케데헌)의 오스카 2관왕에 대해 &quot;김구 선생이 꿈꿨던 '높고 새로운 문화의 근원이 되고 목표가 되고 모범이 되는... ,https://www.nocutnews.co.kr/news/6485770?utm_source=naver&utm_medium=article&utm_campaign=20260316053344,https://n.news.naver.com/mnews/article/079/0004125398?sid=100,"Mon, 16 Mar 2026 17:34:00 +0900"
이재명,"이춘희 후보, &quot;세종시 특별법,조속 처리 촉구&quot;",이 예비후보는 SNS를 통해 &quot;이재명 정부 지방시대위원회 특별위원장으로서 또 세종의 미래를 책임질 후보로서 행정수도 완성은 내게 '천명(天命)'과 같다&quot;며 &quot;정치적 셈법에 세종의 운명이 휘둘리지 않도록 모든 것을 걸고... ,https://daily.hankooki.com/news/articleView.html?idxno=1347516,https://daily.hankooki.com/news/articleView.html?idxno=1347516,"Mon, 16 Mar 2026 17:34:00 +0900"
이재명,"황명선 민주당 최고위원 &quot;국민연금, 투기자본과의 결탁 끊어야… MBK는 ...","앞서 지난해 12월 이재명 대통령이 &quot;국민 주식을 갖고 있으니 의결권을 제대로 행사해야 한다&quot;며 기관투자자의 수탁자 책임 원칙(스튜어드십 코드)를 강조한 가운데, 이를 뒷받침하는 발언들이 민주당을 중심으로 나오고... ",https://www.s-journal.co.kr/news/articleView.html?idxno=39414,https://www.s-journal.co.kr/news/articleView.html?idxno=39414,"Mon, 16 Mar 2026 17:34:00 +0900"
이재명,"이재명 대통령, 신형 공군 2호기 개통 행사",이재명 대통령과 김혜경 여사가 지난 15일 경기 성남 서울공항에서 열린 신형 공군 2호기 개통 행사에서 기념촬영을 하고 있다. (청와대 제공. 재판매 및 DB 금지) 2026.3.16/뉴스1,https://www.news1.kr/photos/7799694,https://n.news.naver.com/mnews/article/421/0008829249?sid=100,"Mon, 16 Mar 2026 17:34:00 +0900"
이재명,"김연풍, 대전시의원 유성3선거구 출마 선언…&quot;유성 변화 이끌 실천 정치...",이어 &quot;이재명 정부의 성공이 대한민국의 성공으로 이어질 수 있도록 김연풍 후보에게 힘을 모아 달라&quot;고 밝혔다. 김 예비후보는 &quot;현장에서 구민과 호흡하며 얻은 경험은 정치가 구호가 아닌 실천이어야 한다는 확신을 줬다... ,https://www.ccdn.co.kr/news/articleView.html?idxno=1067909,https://www.ccdn.co.kr/news/articleView.html?idxno=1067909,"Mon, 16 Mar 2026 17:34:00 +0900"
이재명,"충남 아산, 중동 위기 대응 긴급 민생안정 대책 추진",이번 대책은 이재명 대통령이 지난 10일 국무회의에서 외부 충격에 따른 민생 부담 최소화를 위한 범정부 대응을 주문한 데 따른 것이다. 시는 중앙정부 대응 기조에 발맞춰 지역 차원의 긴급 민생안정 대책을 마련했다.... ,https://www.ccdn.co.kr/news/articleView.html?idxno=1067894,https://www.ccdn.co.kr/news/articleView.html?idxno=1067894,"Mon, 16 Mar 2026 17:34:00 +0900"
이재명,"송기섭 예비후보, 민주당 후보들에 정책토론 제안","제안하며, 이재명 대통령의 국정 철학을 반영한 ‘충북 균형발전 2.0’ 전략을... 송 후보는 지난 13일 이재명 대통령과 함께한 타운홀 미팅에서 확인한 ‘모닥불론... ",http://www.breaknews.com/1192195,http://www.breaknews.com/1192195,"Mon, 16 Mar 2026 17:34:00 +0900"
이재명,"국민의힘, 전재수 의원 공세 수위 높여",(전재수/더불어민주당 국회의원(3월 12일)/이재명 정부와 전재수에게 일정한 기대를 가지고 계시고 그러한 기대가 선거 결과를 통해서 나타나지 않을까 조심스럽게 생각을 하고요.) 개혁신당 정이한 예비후보는 전재수... ,https://news.knn.co.kr/news/article/185048,https://news.knn.co.kr/news/article/185048,"Mon, 16 Mar 2026 17:34:00 +0900"
이재명,기초연금 개편 속도…李 &quot;하후상박 어떤가&quot;,SNS통해 &quot;빈곤노인 후하게 부부감액 불이익 없게 손질&quot; 소득0원인 117만명 연금액 300만원초과 15만명과 동일 향후 저소득 노인만 증액 제안 이재명 대통령이 기초연금에 대한 개혁 필요성을 다시 한 번 강조했다. 특히... ,https://www.mk.co.kr/article/11989335,https://n.news.naver.com/mnews/article/009/0005651044?sid=102,"Mon, 16 Mar 2026 17:33:00 +0900"
이재명,"경찰청, '남양주 스토킹 살인' 부실대응 감찰 착수",이는 이재명 대통령의 지시에 따른 것이다. 앞서 이규연 청와대 홍보소통수석은 이날 오후 춘추관에서 브리핑을 통해 이 대통령이 이번 사태에 책임 있는 관계자를 감찰한 뒤 엄하게 조치하라고 지시했다고 밝혔다. 앞서... ,https://www.news1.kr/society/incident-accident/6103034,https://n.news.naver.com/mnews/article/421/0008829247?sid=102,"Mon, 16 Mar 2026 17:33:00 +0900"
이재명,이 대통령 &quot;검찰개혁 우려는 기우...반격 명분 줄 필요 없어&quot;,"이재명 대통령은 검찰개혁에 대한 일각의 우려는 '기우'라며, 이른바 '정부안'에 대한 비판에 정면 반박했습니다. 이 대통령은 오늘(16일) SNS에, 수사·기소 분리와 검찰의 수사 배제는 국정과제로 이미 확정됐고 돌이킬 수... ",https://www.ytn.co.kr/_ln/0101_202603161733344187,https://n.news.naver.com/mnews/article/052/0002327960?sid=100,"Mon, 16 Mar 2026 17:33:00 +0900"
이재명,"최동민 동대문구청장 예비후보 &quot;동대문을 가장 잘 아는 사람, 실천하는...","한편 최 예비후보는 서울시립대 총학생회장을 시작으로 국토해양부 과장, 서울특별시 정무보좌관, 청와대 행정관, 이재명 대선후보 부대변인을 역임하면서 중앙과 지방을 아우르는 현장 행정과 정책 실무 역량을... ",https://www.ngonews.kr/news/articleView.html?idxno=226323,https://www.ngonews.kr/news/articleView.html?idxno=226323,"Mon, 16 Mar 2026 17:32:00 +0900"
이재명,"李 &quot;기초연금, 빈곤 노인에 더 주는건 어떤가&quot;","이재명 대통령이 16일 “월수입이 수백만원 되는 노인이나, 수입이 제로인 노인의 기초연금액이 똑같다”... 정부는 이재명 대통령이 16일 언급한 ‘하후상박’ 구조로 기초연금을 개편하기 위한 작업을 연초부터... ",https://www.hankyung.com/article/2026031648331,https://n.news.naver.com/mnews/article/015/0005262926?sid=100,"Mon, 16 Mar 2026 17:32:00 +0900"
이재명,"李대통령 &quot;검찰개혁, 위헌소지 남겨선 안돼&quot;",이재명 대통령이 16일 검찰 개혁 법안과 관련해 &quot;당과 정부가 당정 협의를 통해 수정안을 만들었다. 이것이... 이재명 대통령이 15일 오전 경상남도 창원에서 열린 '66주년 3·15 의거 기념식'에 참석해 기념사를 하고 있다.... ,https://www.newspim.com/news/view/20260316001117,https://www.newspim.com/news/view/20260316001117,"Mon, 16 Mar 2026 17:32:00 +0900"
이재명,이 대통령 “검찰총장 명칭변경 납득 어려워…개혁은 실질적 성과 중요...,이재명 대통령은 16일 정부의 검찰개혁에 대해 여권 일부에서 반대의 목소리가 나오는 것과 관련해 “개혁은 실질적 성과가 중요하다. 본질과 괴리된 과도한 선명성 경쟁과 긴요하지 않은 조치 때문에 해체돼야 할 기득... ,https://www.viva100.com/article/20260316501458,https://www.viva100.com/article/20260316501458,"Mon, 16 Mar 2026 17:32:00 +0900"
이재명,李 대통령 &quot;검찰개혁 본질은 수사·기소 분리… 과도한 선명성 경쟁 경...,민주신문=조환흠 기자｜이재명 대통령은 16일 중대범죄수사청 및 공소청 설치법안을 둘러싼 여권 내 논쟁에 대해 &quot;만고불변의 확정안이 아니라 필요한 입법 과정에서 또 논의하고 수정하면 된다&quot;고 밝혔다. 이 대통령은... ,http://www.iminju.net/news/articleView.html?idxno=160616,http://www.iminju.net/news/articleView.html?idxno=160616,"Mon, 16 Mar 2026 17:32:00 +0900"
이재명,"송기섭, 대통령 모닥불론 충북에서 실현",송기섭 더불어민주당 충북지사 예비후보가 이재명 대통령의 국정 철학인 '모닥불론'을 충북 균형발전 전략의 핵심 동력으로 삼아 '충북 균형발전 2.0'을 실현하겠다고 밝혔다. 송기섭 예비후보는 16일 충북도청... ,https://www.ccdn.co.kr/news/articleView.html?idxno=1067993,https://www.ccdn.co.kr/news/articleView.html?idxno=1067993,"Mon, 16 Mar 2026 17:32:00 +0900"
이재명,"이 대통령, 검찰개혁 논란에 1838자 트윗으로 못박기",▲  이재명 대통령이 15일 경남 창원시 마산회원구 국립 3·15 민주 묘지에서 열린 제66주년 3·15의거 기념식에서 기념사를 하고 있다. 2026.3.15 [청와대통신사진기자단] 이재명 대통령이 현재 논란이 되고 있는 중대범죄수사청... ,https://www.ohmynews.com/NWS_Web/View/at_pg.aspx?CNTN_CD=A0003215394&CMPT_CD=P0010&utm_source=naver&utm_medium=newsearch&utm_campaign=naver_news,https://n.news.naver.com/mnews/article/047/0002508263?sid=100,"Mon, 16 Mar 2026 17:31:00 +0900"
이재명,&quot;검찰개혁은 당정합의안&quot;…李대통령 &quot;누군가의 선명성 위한 수정 안 돼...,이재명 대통령이 검찰개혁안 수정을 주장하는 여당 일각의 입장에 대해 작심하고 재차 비판했다. 검찰개혁 정부안에 대해 '사실상의 당정합의안'이라며 한껏 의미를 부여하고 &quot;누군가의 선명성을 드러내기 위해 재수정... ,https://www.mt.co.kr/politics/2026/03/16/2026031617253254061,https://n.news.naver.com/mnews/article/008/0005330637?sid=100,"Mon, 16 Mar 2026 17:31:00 +0900"
이재명,"[기자의 눈] 빅파마 투자 몰리는 한국, 영국을 반면교사 삼아야",이재명 대통령 주도 하에 '바이오 5대 강국' 도약을 추진하는 한국으로서는 반가울 따름이다. 이 투자금이 바이오 강국 역군이 될 우리 바이오텍을 대상으로 한 오픈 이노베이션 생태계 구축에 쓰일 예정이기 때문이다.... ,https://www.ekn.kr/web/view.php?key=20260316025017967,https://www.ekn.kr/web/view.php?key=20260316025017967,"Mon, 16 Mar 2026 17:30:00 +0900"
이재명,'케데헌' 아카데미 2관왕…李 &quot;김구 꿈꾸던 문화강국 현실로&quot;,"이재명 대통령은 16일 장편 애니메이션 영화 '케이팝 데몬 헌터스'의 아카데미 2관왕을 축하하며 &quot;케이팝의 역동적 에너지와 한국적 감성, 그리고 독창적 상상력이 어우러져 우리 문화의 지평을 한층 넓혀줬다&quot;고 밝혔다.... ",https://view.asiae.co.kr/article/2026031617304332503,https://n.news.naver.com/mnews/article/277/0005735125?sid=100,"Mon, 16 Mar 2026 17:30:00 +0900"
이재명,"李대통령 &quot;검찰개혁, 과도한 선명성 경쟁 안돼&quot;",이재명 대통령이 15일 경남 창원시 마산회원구 국립 3·15 민주 묘지에서 열린 제66주년 3·15의거 기념식에서 기념사를 하고 있다. 사진=연합뉴스 매일일보 = 박철호 기자  | 이재명 대통령은 16일 정부의 검찰개혁 방향 관련... ,https://www.m-i.kr/news/articleView.html?idxno=1351171,https://www.m-i.kr/news/articleView.html?idxno=1351171,"Mon, 16 Mar 2026 17:30:00 +0900"
이재명,[상장의 꿈] 중동 리스크에 얼어붙은 공모 투심…레메디·스카이랩스·피...,이재명 정부의 정책 기조 속에 증시 유동성은 풍부하지만 중동발(發) 지정학 리스크와 투심 악화가 맞물리며 공모 시장 변동성이 커졌기 때문이다. 위축된 투심과 깐깐해진 상장 요건을 뚫고 코스닥 시장에 안착할... ,http://www.newsdream.kr/news/articleView.html?idxno=109393,http://www.newsdream.kr/news/articleView.html?idxno=109393,"Mon, 16 Mar 2026 17:30:00 +0900"
이재명,李 &quot;'케데헌' 아카데미 2관왕 축하…김구 꿈꾼 문화강국 현실로&quot;,이재명 대통령은 16일 넷플릭스 애니메이션 영화 '케이팝 데몬 헌터스(KPop Demon Hunters)'의 아카데미 2관왕 수상을 축하하며 “김구 선생께서 꿈꾸셨던 문화강국이 어느덧 현실이 되고 있다”고 밝혔다. 이 대통령은 이날... ,http://www.fnnews.com/news/202603161725114136,https://n.news.naver.com/mnews/article/014/0005492245?sid=100,"Mon, 16 Mar 2026 17:30:00 +0900"
이재명,"검찰개혁추진단장 “보완수사권 논의, 국민관점서 고민해야”","윤 단장은 “검찰개혁의 변할 수 없는 대원칙은 수사-기소 분리를 통한 국민권익 보호”라며 “이재명 대통령도 검찰 개혁의 최종 목표는 국민 인권 보호와 권리 구제, 그리고 억울한 범죄 피해자를 위해 가해자를 제대로... ",https://www.hani.co.kr/arti/politics/politics_general/1249576.html,https://n.news.naver.com/mnews/article/028/0002796171?sid=100,"Mon, 16 Mar 2026 17:30:00 +0900"
이재명,'특별시장' 수박 겉핥기식 토론회 안 된다,서울 여의도 중앙당사에서 열린 합동연설회에 나선 7명의 후보는 한두 명을 제외하고는 이재명 대통령과의... 이재명 대통령을 앞세운 부분도 일부 후보의 경우 얼굴이 후끈거릴 정도였다. 첫 번째 연설자로 나선 정준호... ,http://www.jndn.com/article.php?aid=1773649593428839008,http://www.jndn.com/article.php?aid=1773649593428839008,"Mon, 16 Mar 2026 17:30:00 +0900"
이재명,"李대통령, ‘케이팝 데몬 헌터스’ 아카데미 2관왕 축하",이재명 대통령은 16일 애니메이션 ‘케이팝 데몬 헌터스’가 아카데미 시상식에서 장편 애니메이션상과 주제가상을 동시에 받자 “대한민국 국민과 함께 축하의 박수를 보낸다”며 한국 문화 콘텐츠의 세계적 성과를 높이... ,https://www.kyeonggi.com/article/20260316580534,https://n.news.naver.com/mnews/article/666/0000099402?sid=100,"Mon, 16 Mar 2026 17:30:00 +0900"
이재명,"정원영 전 용인시정연구원장, 용인시장 출마 선언…반도체 기본소득·U...",지난 대선에서는 이재명 후보 직속 기본사회위원회 부위원장과 인구미래위원회 부위원장을 맡아 정책 설계에 참여했습니다. 이날 정 예비후보는 용인의 미래를 위한 두 가지 핵심 공약도 발표했습니다. 첫 번째 공약은... ,http://www.paxetv.com/news/articleView.html?idxno=265437,http://www.paxetv.com/news/articleView.html?idxno=265437,"Mon, 16 Mar 2026 17:30:00 +0900"
정상순방,[오늘의 주요 정치 일정] 정치(3월16일 월요일),◇대통령실【대통령】 공식일정 없음 ◇총리실【총리】 09:00 간부회의(미국·정부서울청사) 해외순방(미국·스위스) ◇국방부【장관】 통상일정 ◇외교부【장관】 10:00 실국장회의 16:00 한·중앙아 정상회의... ,http://www.econonews.co.kr/news/articleView.html?idxno=431144,http://www.econonews.co.kr/news/articleView.html?idxno=431144,"Mon, 16 Mar 2026 11:30:00 +0900"
정상순방,"[뉴공 아카이브]김희교 광운대 동북아문화산업학과 교수, 김흥종 전 대...",앞뒤가 안 맞아.▷김흥종 : 그런데 이제 미중 정상회담이 얼마 안 남았으니까 미중정상회담에서 얘기해야 될... ▷김흥종 : 일단 지금 시대에 와가지고요 누가 대통령이 되든 간에 대통령의 해외 순방에 대한 수요가... ,http://www.ddanzi.com/875929716,http://www.ddanzi.com/875929716,"Mon, 16 Mar 2026 11:20:00 +0900"
정상순방,"[오늘의 주요일정·16일] 기후부, 중동상황 경제대응 TF 2차 회의","■ 분야별 ▲ 김민석 국무총리 미국·스위스 순방 ▲ 김민석 국무총리 간부회의(미국·정부서울청사)... 한·중앙아 정상회의 준비기획단 출범식(16:00) ▲ 박윤주 외교부 1차관, 미국 출장(총리 수행) ▲ 김진아... ",https://www.safetimes.co.kr/news/articleView.html?idxno=240684,https://www.safetimes.co.kr/news/articleView.html?idxno=240684,"Mon, 16 Mar 2026 07:06:00 +0900"
정상순방,[오늘의 주요일정]정치(3월16일 월요일),◇대통령실【대통령】 공식일정 없음 ◇총리실【총리】 09:00 간부회의(미국·정부서울청사) 해외순방(미국·스위스) ◇국방부【장관】 통상일정 ◇외교부【장관】 10:00 실국장회의 16:00 한·중앙아 정상회의... ,https://www.newsis.com/view/NISX20260315_0003548964,https://n.news.naver.com/mnews/article/003/0013823228?sid=100,"Mon, 16 Mar 2026 05:00:00 +0900"
정상순방,김민석 총리 &quot;백악관서 트럼프와 ‘깜짝 회동’...북미 접촉 대화 늘려...,김 총리는 이번 순방을 통해 대한민국을 ‘세계 AI 민주주의’의 선도국가로... 김 총리는 “(북미 정상 간 만남을 위한) 작은 가능성이라도 살리기 위해 접촉과... ,http://www.breaknews.com/1191921,http://www.breaknews.com/1191921,"Sun, 15 Mar 2026 21:24:00 +0900"
정상순방,"&quot;정부 공적개발원조(ODA), 국익·가시성 원조에 머물러선 안 돼&quot;","연계, 정상외교와 연계한 ODA 활용, 태극기 사용 원칙화 등 정책 가시성과 국가 이미지 중심 요소를 전면에 배치하는 부분에서 개발협력의 가치 중심 접근이 약화할 수 있다고 우려했습니다. 대통령 순방 등 고위급... ",https://biz.sbs.co.kr/article_hub/20000297327?division=NAVER,https://n.news.naver.com/mnews/article/374/0000498016?sid=104,"Sun, 15 Mar 2026 15:00:00 +0900"
국회,이명수 충남교육감 출마선언,4선 국회의원을 지낸 이명수(사진) 전 오송첨단의료산업진흥재단 이사장은 16일 충남도청 브리핑 룬에서 충남교육감 출마선언 기자회견을 가졌다. 이명수 예비후보는 &quot;교육이 바로서야 나라가 살아난다&quot;며 &quot;충남교육을... ,https://www.ccdn.co.kr/news/articleView.html?idxno=1067892,https://www.ccdn.co.kr/news/articleView.html?idxno=1067892,"Mon, 16 Mar 2026 17:35:00 +0900"
국회,"'명태균 무죄' 재판장의 골프 여행 접대, 조희대 대법원 '뒷북' 제도 개...","지난해 10월 국회 국정감사에서도 이 사건이 도마에 올랐고, 김인택 부장판사가 주요 관심 사건인 ‘명태균 게이트’의 재판을 계속 맡아야 하는지에 대한 공정성 논란이 일었다. 그럼에도 김인택 부장판사는 명태균... ",https://newstapa.org/article/-x0UE,https://n.news.naver.com/mnews/article/607/0000003223?sid=102,"Mon, 16 Mar 2026 17:35:00 +0900"
국회,"고려아연, '인터배터리 2026' 성료…52년 제련 기술력 선보여","이철규 국회 산업통상자원중소벤처기업위원회 위원장과 엄기천 한국배터리산업협회장, LG에너지솔루션, LS일렉트릭, 에코프로비엠, 엘앤에프 등 기업 관계자들이 공식 VIP 투어 중 부스를 찾았다. 고려아연 관계자는... ",https://www.dailian.co.kr/news/view/1621468/?sc=Naver,https://n.news.naver.com/mnews/article/119/0003069601?sid=101,"Mon, 16 Mar 2026 17:35:00 +0900"
국회,주진우 &quot;부산 소상공인 앵커 할당제 추진···흑자 기반 만들 것&quot;,국민의힘 주진우 국회의원(부산 해운대갑)이 대학·병원·공공기관의 구매력을 지역 소상공인에게 연결하는 '부산형 앵커기관 조달 할당제' 도입을 추진하겠다고 밝혔다. 주 의원은 16일 부산시 소상공인연합회를 방문해... ,https://www.pointe.co.kr/news/articleView.html?idxno=75265,https://www.pointe.co.kr/news/articleView.html?idxno=75265,"Mon, 16 Mar 2026 17:34:00 +0900"
국회,전북도지사 경선 '내란 방조' 의혹 매몰,전북도지사 출마를 선언한 이원택(김제ㆍ부안ㆍ군산을) 국회의원은 16일... 끝으로 &quot;오늘 안호영(더불어민주당 국회의원) 후보도 '내란'만 다투는 정치로 흘러가는... ,http://www.breaknews.com/1192210,http://www.breaknews.com/1192210,"Mon, 16 Mar 2026 17:34:00 +0900"
국회,"경주시, 153억원 투입해 문무대왕 해양역사관 준공","이날 준공식에는 주낙영 경주시장과 김석기 국회의원을 비롯해 도·시의원, 유관기관 관계자와 지역 주민 등... 김석기 국회의원은 &quot;문무대왕 해양역사관 준공은 문무대왕의 위대한 호국정신과 해양 개척 정신을 되새기는... ",https://www.smartbizn.com/news/articleView.html?idxno=139197,https://www.smartbizn.com/news/articleView.html?idxno=139197,"Mon, 16 Mar 2026 17:34:00 +0900"
국회,"이춘희 후보, &quot;세종시 특별법,조속 처리 촉구&quot;",사진=이춘희 캠프 제공   더불어민주당 이춘희 세종시장 예비후가 여야 대치로 멈춰선 '세종시 특별법' 처리를 위해 국회 본진을 직접 타격하며 전방위 압박에 나섰다. 이춘희 후보는 16일 국회의장실 방문 직후 곧바로... ,https://daily.hankooki.com/news/articleView.html?idxno=1347516,https://daily.hankooki.com/news/articleView.html?idxno=1347516,"Mon, 16 Mar 2026 17:34:00 +0900"
국회,"배준영 의원, 공항운영사 통합 철회 촉구...&quot;인천공항 수익으로 적자 메...",배준영 국회의원이 정부가 검토 중인 인천국제공항공사·한국공항공사·가덕도신공항건설공단 통합 방안에 대해 전면 철회를 촉구했다. 배 의원은 16일 발표한 성명에서 최근 정부가 세 기관을 하나로 통합하는 방안을... ,http://www.kdfnews.com/news/articleView.html?idxno=180069,http://www.kdfnews.com/news/articleView.html?idxno=180069,"Mon, 16 Mar 2026 17:34:00 +0900"
국회,이금선 대전시의원 &quot;신계룡 북천안 송전선로 사업 재검토해야&quot;,"결단이 함께 이뤄져야 지역에서 생산한 에너지를 지역에서 소비하는 선순환 구조가 가능하다&quot;고 덧붙였다. 이날 본회의에서 채택된 건의안은 대통령실과 국회, 산업통상자원부 등 관계 기관과 주요 정당에 전달될 예정이다.",https://www.ccdn.co.kr/news/articleView.html?idxno=1067916,https://www.ccdn.co.kr/news/articleView.html?idxno=1067916,"Mon, 16 Mar 2026 17:34:00 +0900"
국회,장철민 &quot;신수도특별시 제안&quot;..대전시장 경선 자신감,"대전시장에 출사표를 던진 장철민 민주당 국회의원이 대전과 세종, 청주를 통합한 신수도특별시를 제안했습니다. 장 의원은 '대전과 세종, 청주를 통합해 신수도를 만들겠다'며 '시장에 당선되면 내년 하반기에... ",https://www.tjb.co.kr/news05/bodo/view/id/96160,https://www.tjb.co.kr/news05/bodo/view/id/96160,"Mon, 16 Mar 2026 17:34:00 +0900"
국회,정부 부처 빼가기 대한민국 행정 붕괴 '자해 행위',최근 우원식 국회의장은 행정수도 명문화 개헌을 논의 대상에서 삭제한 데 이어 지방선거에 출마한 일부 후보들이 세종시에 위치한 정부 부처를 유치하겠다는 공약을 제시하고 있다. 지난 10일 우원식 국회의장은 단계적... ,https://www.ccdn.co.kr/news/articleView.html?idxno=1067896,https://www.ccdn.co.kr/news/articleView.html?idxno=1067896,"Mon, 16 Mar 2026 17:34:00 +0900"
국회,Pre완도국제해조류박람회 D-50 성공 개최 군민 결의 대회 열려,"군민 결의 대회에는 신우철 완도군수와 박지원 국회의원, 김양훈 완도군의회 의장, 이철·신의준 도의원, 완도군 의원, 해조류박람회 추진위원회 위원, 각급 기관·사회 단체장 등 500여 명이 참석했다. 대회는 식전 축하... ",https://www.startuptoday.co.kr/news/articleView.html?idxno=599459,https://www.startuptoday.co.kr/news/articleView.html?idxno=599459,"Mon, 16 Mar 2026 17:34:00 +0900"
국회,"국민의힘, 전재수 의원 공세 수위 높여",국회에서 길재섭 기자가 취재했습니다. &lt;리포트&gt; 국민의힘은 당 차원에서 전재수 의원에 대한 공세에... (주진우/국민의힘 국회의원/전재수 의원 출판기념회에서 30만 원이 든 돈 봉투가 사진에 찍혔습니다. 더 이상... ,https://news.knn.co.kr/news/article/185048,https://news.knn.co.kr/news/article/185048,"Mon, 16 Mar 2026 17:34:00 +0900"
