Keyword,Title,Description,Original Link,Link,Publication Date
국회,국내 거래소 알트코인 상장 가속…‘투자자 보호’ 2단계 법안 필요성 ...,국회에서는 이를 법률로 보완하려는 시도가 이어지고 있다. 민병덕 더불어민주당 의원이 6월 대표 발의한 '디지털자산기본법'은 거래지원 적격성 평가위원회를 두고 상장 및 상장폐지 권한을 부여해 이해 상충 가능성을... ,https://www.etoday.co.kr/news/view/2505974,https://www.etoday.co.kr/news/view/2505974,"Mon, 15 Sep 2025 06:02:00 +0900"
국회,"직선제 산부인과醫, 임신중절 법안·미프진 도입 &quot;시기상조&quot;","2019년 헌법재판소는 낙태죄에 대해 헌법 불합치 결정을 내리며 2020년 말까지 보완입법을 마련하라고 요구했지만, 국회와 정부는 합의안을 내놓지 못한 채 법적 공백을 방치했다. 이로 인해 여성과 의료진 모두 불확실성과... ",https://www.medipana.com/article/view.php?news_idx=346622&sch_cate=E,https://www.medipana.com/article/view.php?news_idx=346622&sch_cate=E,"Mon, 15 Sep 2025 06:02:00 +0900"
국회,"대통령 말대로 18억 아파트 상속세 면제 땐, 5년간 세수 3조 감소","14일 국회예산정책처가 상속세 일괄공제 확대안(5억→8억원)에 따른 세수 효과를 분석한 자료를 보면, 이 공제로 향후 5년간 3조843억원(연평균 6169억원)의 세수가 줄어들 것으로 추산된다. 이는 임광현 국세청장이... ",https://www.hani.co.kr/arti/economy/economy_general/1218686.html,https://n.news.naver.com/mnews/article/028/0002766331?sid=101,"Mon, 15 Sep 2025 06:02:00 +0900"
국회,사법부 독립이 보장돼야 하는 이유[기자수첩],"헌법 제104조 제3항에 따라 법관 임명 권한은 대법원장과 대법관회의에 있지만 국회와 변호사 단체가 사실상 특정 판사를 고를 수 있도록 한 것은 명백한 위헌 소지가 있다. 이 외에 대법관 추천 방식 변경, 외부인의 법관... ",http://www.edaily.co.kr/news/newspath.asp?newsid=01623606642300448,https://n.news.naver.com/mnews/article/018/0006115708?sid=102,"Mon, 15 Sep 2025 06:02:00 +0900"
국회,위헌 시비 피하고 픈 민주 “법원 스스로 내란 전담재판부 만들라“ 압...,"한 의장이 사례로 든 노동법원이나 가정법원, 지식재산전담재판부는 재판부 구성에 국회 등 외부 기관의 추천 절차를 두지 않는다는 점에서, 민주당 일부 의원들이 법안을 발의한 내란특별재판부와도 다르다. 이와 관련해... ",https://www.hani.co.kr/arti/politics/assembly/1218687.html,https://n.news.naver.com/mnews/article/028/0002766332?sid=100,"Mon, 15 Sep 2025 06:02:00 +0900"
국회,[뉴스토마토프라임] 산업은행 퇴사자에 &quot;후회 안 하냐&quot; 물어보니,산은 본점 이전의 근거가 되는 산은법 개정이 국회를 통과하기 어렵게 되자 산은은 임시 방편으로 자체적인 조직 개편을 통해서라도 부산 조직을 키워왔습니다. 이에 대응해 노조는 윤석열정부가 출범한 지난 2022년... ,http://www.newstomato.com/ReadNews.aspx?no=1274793&inflow=N,http://www.newstomato.com/ReadNews.aspx?no=1274793&inflow=N,"Mon, 15 Sep 2025 06:02:00 +0900"
국회,국회 주도 '노사정 대화' 10월 중순 출범…정년연장·주4.5일제 급물살,민주노총의 사회적 대화 테이블 복귀로 국회가 주도하는 사회적 대화 기구가 오는 10월 중순께 공식 출범할... 내달 중순 공식 출범을 목표로 추진 중인 대화체는 국회를 플랫폼으로 삼아 사회적 갈등 현안을 중재하고... ,https://www.news1.kr/economy/employment-labor/5911782,https://n.news.naver.com/mnews/article/421/0008485407?sid=101,"Mon, 15 Sep 2025 06:02:00 +0900"
국회,1부 오늘의 주요뉴스,◀ 앵커 ▶ 오늘부터 나흘간 이재명 정부 출범 후 첫 정기국회 대정부질문이 진행됩니다. 내란 청산 등 정국 현안은 물론 국정 운영 기조를 두고 여야가 전방위로 격돌할 것으로 예상됩니다. ◀ 앵커 ▶ 한학자 통일교... ,https://imnews.imbc.com/replay/2025/nwtoday/article/6755807_36807.html,https://n.news.naver.com/mnews/article/214/0001449195?sid=102,"Mon, 15 Sep 2025 06:01:00 +0900"
기재위,개딸 여야 합의 반발에…李정부 밑그림 ‘슬로우트랙’ 태우는 與,"등 기재위 소관 법안이 2건, 은행법 개정안·금감위 설처법 등 정무위 소관 법안이 9건가량 된다”고 전했다. 정무위원장은 한때 국민의힘에서 ‘찐윤’으로 통한 윤한홍 의원, 기재위원장은 같은 당 소속 임이자 의원이다.... ",https://www.joongang.co.kr/article/25366887,https://n.news.naver.com/mnews/article/025/0003469067?sid=100,"Mon, 15 Sep 2025 05:00:00 +0900"
기재위,금융당국 개편 '난항'… 내부 반발·야권 반대,"금감위 신설 관련 후속 입법을 처리하려면 국회 정무위·기재위에서 관련 법이 의결돼야 한다. 하지만 현재 정무위와 기재위에는 국민의힘 소속인 윤한홍, 임의자 위원장이 각각 버티고 있다. 민주당은 '패스트트랙(신속... ",https://www.moneys.co.kr/article/2025091414292395325,https://n.news.naver.com/mnews/article/417/0001101203?sid=100,"Mon, 15 Sep 2025 05:00:00 +0900"
기재위,'내란몰이' 넘어 '정책정당'으로…열쇠 쥔 3인방은 누구,"논의를, 기재위 간사 박수영 의원실과는 기재위·기재부 분리 문제를 다루는 세미나를 연이어 개최한다. 이 자리에서 나온 핵심 쟁점과 토론 내용을 종합해 향후 협상 과정에서 민주당과 마주할 때 당의 논리를 뒷받침하고... ",https://www.dailian.co.kr/news/view/1548732/?sc=Naver,https://n.news.naver.com/mnews/article/119/0003002712?sid=100,"Mon, 15 Sep 2025 04:05:00 +0900"
기재위,"정일영 &quot;한은, 27조 당기순이익 기록해도 기부는 11억...인색해&quot;",다른 기재위 소관 기관들과도 대비된다. 한국투자공사는 같은 기간 5656억원의 순이익을 내고 36억원을 기부했다. 한국수출입은행은 2조7392억원의 순이익 가운데 435억원을 기부했다. 한은이 두 기관보다 훨씬... ,https://www.ajunews.com/view/20250914163642248,https://www.ajunews.com/view/20250914163642248,"Sun, 14 Sep 2025 17:00:00 +0900"
기재위,"특검법 뒤집은 민주당, 정부조직개편안 ‘암초’… 올해 힘들 듯",특히 기재부 개편과 금감위 설치를 위해선 임이자·윤한홍 국민의힘 의원이 각각 상임위원장을 맡고 있는 기획재정위원회(기재위)와 정무위원회(정무위)에서 관련 법을 통과시켜야 한다. 위원장들이 법안을 상정하지 않고... ,https://www.dt.co.kr/article/12017824?ref=naver,https://n.news.naver.com/mnews/article/029/0002982033?sid=100,"Sun, 14 Sep 2025 16:27:00 +0900"
기재위,한정애 &quot;중앙지법에 내란전담부 설치…문제 없다&quot;,정무위 소관인 금융감독위원회 설치법 외 패스트트랙 지정 가능성이 있는 법안을 묻는 질문에 한 정책위의장은 &quot;기재위를 통해서 와야 하는 법은 공공기관운영 관련법 등 2개&quot;라면서 패스트트랙 지정 시 &quot;정무위와 기재위... ,http://www.newstomato.com/ReadNews.aspx?no=1274819&inflow=N,http://www.newstomato.com/ReadNews.aspx?no=1274819&inflow=N,"Sun, 14 Sep 2025 16:06:00 +0900"
기재위,한국은행 27조원 벌고 기부는 '고작 0.004%',"기재위 소속 공공기관인 한국투자공사는 최근 5년 5천656억원, 한국수출입은행은 2조 7천392억원의... 한국은행을 비롯한 기재위 소관기관에 사회공헌 활동을 확대하는 방안을 마련하도록 요구할 것&quot;이라고 밝혔다.",http://www.labortoday.co.kr/news/articleView.html?idxno=230200,http://www.labortoday.co.kr/news/articleView.html?idxno=230200,"Sun, 14 Sep 2025 15:36:00 +0900"
기재위,與 &quot;정조법 패스트트랙 불가피…내란전담재판부 위헌 아냐”,한정애 민주당 정책위의장은 14일 국회에서 기자간담회를 열고 &quot;금융감독위원회 설치법과 공공기관운영관련법이 25일 본회의에서 통과되지 못한다면 패스트트랙으로 지정할 수밖에 없다&quot;며 &quot;기재위와 정무위 소관이라... ,https://www.etoday.co.kr/news/view/2506270,https://www.etoday.co.kr/news/view/2506270,"Sun, 14 Sep 2025 15:14:00 +0900"
기재위,고칠 조문 9000개에 野 반발까지…내년 1월 출범 불투명[금융감독체계 ...,"금감위 신설 관련 후속 입법을 처리하려면 국회 정무위·기재위에서 관련 법이 의결돼야 한다. 하지만 현재 정무위와 기재위에는 국민의힘 소속인 윤한홍, 임의자 위원장이 각각 버티고 있다. 민주당은 '패스트트랙... ",https://www.newsis.com/view/NISX20250912_0003327403,https://n.news.naver.com/mnews/article/003/0013480642?sid=101,"Sun, 14 Sep 2025 14:00:00 +0900"
기재위,금융공공기관 지형 요동 … 재경부 이관·통폐합 '태풍의 눈',기존 금융위 제청·정무위 검증 체계가 기재위 소관으로 바뀌면서 정책 논의 무게가 ‘금융산업 발전’보다는 ‘재정 효율성·건전성’에 쏠릴 수 있다는 관측이다. ◇금융권 우려 확산 … ‘효율’ vs ‘지원’ 갈림길... ,https://biz.newdaily.co.kr/site/data/html/2025/09/12/2025091200215.html,https://biz.newdaily.co.kr/site/data/html/2025/09/12/2025091200215.html,"Sun, 14 Sep 2025 06:02:00 +0900"
기재위,"경기도, 안보전시관·한미동맹 기념관 건립 내년 상반기까지 연구용역 ...","이날 보고회에는 조성환 경기도의회 기획재정위원장과 기재위 의원들, 이순구 경기도 비상기획관을 비롯한 도 관계 공무원, 용역 수행기관 관계자, 안보·관광·교육·전시 분야 전문가 등이 참석했다. 두 건의 연구용역은... ",http://www.seoulwire.com/news/articleView.html?idxno=670733,http://www.seoulwire.com/news/articleView.html?idxno=670733,"Sat, 13 Sep 2025 19:28:00 +0900"
기재위,예산안·정부조직법 두고 정기국회 전운 최고조…여야 강대강 대치,"기재위에서는 역대 최대인 728조원 규모의 내년도 예산안을 놓고, 민주당은 '민생회복 마중물', 국민의힘은... 당론으로 발의한 민주당은 더욱 속도를 내겠다는 입장이지만 금감위 설치법 소관인 정무위와 기재위의 경우... ",http://www.yonhapnewstv.co.kr/MYH20250913184218aUH,https://n.news.naver.com/mnews/article/422/0000781040?sid=161,"Sat, 13 Sep 2025 18:43:00 +0900"
임이자,"국회, 오늘부터 나흘간 대정부질문…특검법·조지아 사태 쟁점","민주당에선 재선의 박성준 의원을, 국민의힘은 3선 의원으로 전투력이 입증된 임이자 의원을 첫 타자로 각각 내세웠다. 조지아주 한국인 구금 사태와 한미 관세 협상 후속 대책, 대북 유화 정책 등은 외교·안보 분야의 핵심... ",https://www.sedaily.com/NewsView/2GXWT895DL,https://n.news.naver.com/mnews/article/011/0004532980?sid=100,"Mon, 15 Sep 2025 06:04:00 +0900"
임이자,‘구속’ 손현보 교회 찾은 장동혁… ‘尹어게인’ 손잡나,"임이자 의원은 12일 ‘야당 탄압 독재정치 규탄 대회’에서 “민주당은 전교조, 민노총과 똘똘 뭉쳐서 우리를... 대회''에서 임이자 의원의 발언을 듣고 있다. 연합뉴스 당 대표 선임 이후 강성 세력과 거리를 유지해온 장... ",https://www.segye.com/newsView/20250914508535?OutUrl=naver,https://n.news.naver.com/mnews/article/022/0004068131?sid=100,"Mon, 15 Sep 2025 06:03:00 +0900"
임이자,오늘부터 나흘 국회 대정부 질문…'정부·여당 실정' vs '국정운영 성과...,"정치 분야에서는 임이자 의원을 필두로 법률가 출신인 유영하, 곽규택 의원이 질의에 나선다. 보수성향 야당인 개혁신당에서는 이준석 당 대표가 정치 분야 질문을 한다. 둘째 날인 외교·통일·안보 분야 질의에서는... ",http://news.mt.co.kr/mtview.php?no=2025091417505927513,https://n.news.naver.com/mnews/article/008/0005250213?sid=100,"Mon, 15 Sep 2025 05:40:00 +0900"
임이자,전광훈 이어 손현보…'아스팔트 우파'에 손짓하는 국힘,"지난 12일 국회 규탄대회에서 임이자 의원은 &quot;이제 뺄셈 정치를 그만하자&quot;며 전광훈·전한길 등과의 연대 필요성을 주장했고, 당 지도부 중 '강성'으로 분류되는 김민수 최고위원도 &quot;우리는 광장으로 나가야 한다&quot;고 강조한... ",https://www.nocutnews.co.kr/news/6399889?utm_source=naver&utm_medium=article&utm_campaign=20250915061551,https://n.news.naver.com/mnews/article/079/0004066016?sid=100,"Mon, 15 Sep 2025 05:01:00 +0900"
임이자,개딸 여야 합의 반발에…李정부 밑그림 ‘슬로우트랙’ 태우는 與,"정무위원장은 한때 국민의힘에서 ‘찐윤’으로 통한 윤한홍 의원, 기재위원장은 같은 당 소속 임이자 의원이다. 지난 7일 당정이 공식 발표한 기재부·금융위 개편 시행일은 내년 1월 2일이었다. 하지만 신속처리안건으로... ",https://www.joongang.co.kr/article/25366887,https://n.news.naver.com/mnews/article/025/0003469067?sid=100,"Mon, 15 Sep 2025 05:00:00 +0900"
임이자,"국회, 대정부 질문 시작…3대 특검·정부조직법 대격돌 예고","이해식·천준호 의원, 국회 행정안전위원장 신정훈 의원 등도 가세한다. 국민의힘에서는 당내 '공격수'로 평가받는 임이자 의원과 3선 신성범 의원, 국회 법제사법위원회 소속 곽규택 의원 등이 대정부 질문에 나선다.",https://www.yna.co.kr/view/AKR20250914048400001?input=1195m,https://n.news.naver.com/mnews/article/001/0015625203?sid=100,"Mon, 15 Sep 2025 05:00:00 +0900"
임이자,與 ‘투톱’ 갈등 일단 봉합… 정부조직법 개편은 차질 불가피,두 상임위는 국민의힘 임이자(기획재정위) 윤한홍(정무위) 의원이 상임위원장이다. 민주당은 야당의 협조가 없다면 금감위 설치 시기를 내년 1월 2일에서 법안 처리가 가능해지는 내년 4월 이후로 조정할 계획이다. 한... ,https://www.donga.com/news/Politics/article/all/20250915/132385512/2,https://n.news.naver.com/mnews/article/020/0003661006?sid=100,"Mon, 15 Sep 2025 03:04:00 +0900"
임이자,"오늘부터 나흘간 대정부질문…여 “내란 청산”, 야 “관세 등 정책 검...","정책적 질의를 통해 정확히 진단하고 명명백백하게 밝혀낼 생각&quot;이라고 말했습니다. 정치 분야 대정부 질문에서 민주당 첫 질의자로는 박성준 의원이 나서고, 국민의힘에서는 임이자 의원이 첫 타자로 나설 예정입니다.",https://news.kbs.co.kr/news/pc/view/view.do?ncd=8357248&ref=A,https://n.news.naver.com/mnews/article/056/0012029082?sid=100,"Mon, 15 Sep 2025 01:01:00 +0900"
임이자,이재명 정부 첫 대정부질문…여야 격돌 예고,"첫날 정치 분야에는 당내 '공격수'로 평가받는 3선 임이자 의원이 첫 타자로 나서며 3선 신성범 의원, 국회 법사위 소속 곽규택 의원 등이 가세할 예정이다. 외교·통일·안보 분야에는 원내수석부대표를 지낸 재선 배준영... ",https://www.ksilbo.co.kr/news/articleView.html?idxno=1036799,https://www.ksilbo.co.kr/news/articleView.html?idxno=1036799,"Mon, 15 Sep 2025 00:04:00 +0900"
임이자,국힘 장외투쟁 카드 만지작…우파와도 연대하나,"지난 12일 국회에서 개최한 '야당 탄압 독재정치 규탄 대회'에서 임이자 의원은 &quot;민주당은 전교조, 민노총과 똘똘 뭉쳐 우리를 겨냥하는데 이제 우리도 뺄셈 정치를 그만하자&quot;며 &quot;전광훈 목사가 극우라고, 전한길 강사가 더... ",https://www.ulsanpress.net/news/articleView.html?idxno=558989,https://www.ulsanpress.net/news/articleView.html?idxno=558989,"Sun, 14 Sep 2025 21:43:00 +0900"
임이자,문경서 亞소프트테니스 25개국 ‘대격돌’,"또한 9월 15일 오후 6시 문경시민운동장에서 열리는 개회식(식전공연 오후 5시 시작)에는 신현국 문경시장, 안도 미츠지 아시아소프트테니스연맹회장, 정인선 대한소프트테니스협회 회장, 임이자 국회의원, 이정걸... ",https://www.ksmnews.co.kr/news/view.php?idx=563015,https://www.ksmnews.co.kr/news/view.php?idx=563015,"Sun, 14 Sep 2025 21:06:00 +0900"
임이자,"여야, 李정부 첫 대정부질문 전방위 격돌 예고","첫날 정치 분야에는 당내 ‘공격수’로 평가받는 3선의 임이자 의원이 첫 타자로 나서며 3선 신성범 의원, 국회 법사위 소속 곽규택 의원 등이 가세한다. 외교·통일·안보 분야에는 원내수석부대표를 지낸 재선 배준영... ",http://www.kjdaily.com/article.php?aid=1757847515663814002,http://www.kjdaily.com/article.php?aid=1757847515663814002,"Sun, 14 Sep 2025 20:06:00 +0900"
임이자,강성 지지층이 黨 쥐고 흔든다…‘공당’ 가치 실종,"지난 12일 국회에서 열린 ‘야당 탄압 독재정치 규탄 대회’에서 임이자 의원은 “민주당은 전교조, 민노총과 똘똘 뭉쳐 우리를 겨냥하는데 이제 우리도 뺄셈 정치를 그만하자”며 “전광훈 목사가 극우라고, 전한길... ",http://www.kookje.co.kr/news2011/asp/newsbody.asp?code=0100&key=20250915.22001004428,https://n.news.naver.com/mnews/article/658/0000120008?sid=100,"Sun, 14 Sep 2025 20:01:00 +0900"
임이자,"&quot;뺄셈정치 그만하자&quot;···국민의힘, '아스팔트 우파'와 손잡나","지난 12일 국회에서 개최한 '야당 탄압 독재정치 규탄 대회'에서 임이자 의원은 &quot;민주당은 전교조, 민노총과 똘똘 뭉쳐 우리를 겨냥하는데 이제 우리도 뺄셈 정치를 그만하자&quot;라며 &quot;전광훈 목사가 극우라고, 전한길 강사가... ",https://www.iusm.co.kr/news/articleView.html?idxno=1054402,https://www.iusm.co.kr/news/articleView.html?idxno=1054402,"Sun, 14 Sep 2025 19:22:00 +0900"
임이자,“특검법 개정 강행… 협치 깨졌다” 국힘 장외투쟁론 솔솔,"임이자(상주·문경) 의원은 “민주당은 전교조, 민노총과 똘똘 뭉쳐 우리를 겨냥하는데 이제 우리도 뺄셈 정치를 그만하자”며 “전광훈 목사가 극우라고, 전한길 강사가 더 나갔다고, 이준석이 결이 다르다고 뺄셈... ",https://www.kbmaeil.com/article/20250914500530,https://www.kbmaeil.com/article/20250914500530,"Sun, 14 Sep 2025 19:20:00 +0900"
임이자,이재명 정부 첫 대정부질문… ‘내란 종식’-‘야당 탄압’ 격돌 예고,"정치 분야에서는 임이자(상주·문경) 의원이 첫 주자로 나서며 신성범·곽규택 의원 등이 가세한다. 외교·안보 분야에서는 배준영 의원을 필두로 김건 의원, 탈북민 출신 박충권 의원이 정부의 대외정책을 집중 추궁할... ",https://www.kbmaeil.com/article/20250914500485,https://www.kbmaeil.com/article/20250914500485,"Sun, 14 Sep 2025 19:18:00 +0900"
임이자,"2026 경북도지사 선거, 이철우 출마 여부가 ‘최대 변수’","(김천), 임이자(문경·상주), 김석기(경주), 이만희(영천·청도), 김정재(포항북) 의원 등이다. 울진이 고향인... 임이자 의원은 최초의 여성 기획재정위원장으로 중책을 맡은 만큼 국정 수행이 우선이라고 밝혔다. 또한 이철우... ",https://www.ksmnews.co.kr/news/view.php?idx=563176,https://www.ksmnews.co.kr/news/view.php?idx=563176,"Sun, 14 Sep 2025 18:52:00 +0900"
임이자,내란특별재판부…&quot;반드시 필요&quot; vs &quot;인민재판 하겠다는 것&quot; [정치오늘],"첫날 정치 분야에서는 민주당 박성준 의원과 국민의힘 임이자 의원이 각각 첫 질의자로 나서 내란특별재판부, 관세 문제, 한미 외교 현안 등을 놓고 공방을 벌일 전망이다.",http://www.sisaon.co.kr/news/articleView.html?idxno=175383,http://www.sisaon.co.kr/news/articleView.html?idxno=175383,"Sun, 14 Sep 2025 18:52:00 +0900"
임이자,전투력 전면 배치… 대정부질문 여야 격돌,"첫날 정치 분야에는 당내 ‘공격수’로 평가받는 3선 임이자 의원이 첫 타자로 나서고 3선 신성범 의원, 법사위 소속 곽규택 의원 등이 가세한다. 외교·통일·안보 분야에는 원내수석부대표를 지낸 재선 배준영(인천 중구... ",https://www.kyeongin.com/article/1751497,https://www.kyeongin.com/article/1751497,"Sun, 14 Sep 2025 18:50:00 +0900"
임이자,"수세 몰린 국힘, 힘 실리는 장외투쟁","임이자 “전한길 뺄셈정치는 진다” 아스팔트우파 연대 극우몰이 우려 국민의힘 내부에서 장외투쟁 주장이... 임이자 의원은 당시 “민주당은 전교조, 민노총과 똘똘 뭉쳐 우리를 겨냥하는데 이제 우리도 뺄셈 정치를... ",https://www.kyeongin.com/article/1751495,https://www.kyeongin.com/article/1751495,"Sun, 14 Sep 2025 18:46:00 +0900"
임이자,"여야, 첫 정기국회 대정부 질문서 정면 충돌 예고","첫날 정치 분야에는 당내 '공격수'로 평가받는 임이자 의원이 첫 타자로 나서며 신성범 의원, 국회 법사위 소속 곽규택 의원 등 모두 3선 의원이 선봉에 나설 예정이다. 외교·통일·안보 분야에는 재선 배준영 의원을 필두로... ",https://www.kyongbuk.co.kr/news/articleView.html?idxno=4051952,https://www.kyongbuk.co.kr/news/articleView.html?idxno=4051952,"Sun, 14 Sep 2025 18:42:00 +0900"
임이자,"여야, 이재명 정부 첫 대정부질문…현안 대격돌 예고","첫날 정치 분야에는 당내 ‘공격수’로 평가받는 3선의 임이자 의원이 첫 타자로 나서며 3선 신성범 의원, 국회 법사위 소속 곽규택 의원 등이 가세할 예정이다. 외교·통일·안보 분야에는 원내수석부대표를 지낸 재선... ",http://www.jndn.com/article.php?aid=1757842392417571001,http://www.jndn.com/article.php?aid=1757842392417571001,"Sun, 14 Sep 2025 18:36:00 +0900"
임이자,與野 대정부 질문 격돌 예고,"첫날인 15일 정치 분야 질의에는 민주당 박성준·이해식·천준호·신정훈·이건태·김남근 의원이 나서고, 국민의힘에선 임이자·신상범·곽규택·유영하 의원이 공세를 펼친다. 개혁신당에서는 이준석 대표가 질의자로... ",https://www.incheonilbo.com/news/articleView.html?idxno=1303071,https://www.incheonilbo.com/news/articleView.html?idxno=1303071,"Sun, 14 Sep 2025 18:36:00 +0900"
임이자,15일부터 李 정부 첫 대정부 질문… 여야 전면 충돌 전망,"첫날 정치 분야에는 당내 ‘공격수’로 평가받는 3선 임이자 의원이 첫 타자로 나서고, 3선 신성범 의원과 국회 법제사법위원회 소속 곽규택 의원 등이 가세한다. 외교·통일·안보 분야에서는 재선 배준영 의원을 중심으로... ",https://www.busan.com/view/busan/view.php?code=2025091418292060877,https://n.news.naver.com/mnews/article/082/0001344768?sid=100,"Sun, 14 Sep 2025 18:31:00 +0900"
임이자,‘내란 청산’ 벼르는 與… 李 실정 부각 겨누는 野,"첫날 정치 분야에는 당내 ‘공격수’로 평가받는 3선의 임이자 의원이 첫 타자로 나선다. 3선 신성범 의원, 국회 법사위 소속 곽규택 의원 등이 가세한다. 외교·통일·안보 분야에는 원내수석부대표를 지낸 배준영 의원과... ",https://www.segye.com/newsView/20250914508509?OutUrl=naver,https://n.news.naver.com/mnews/article/022/0004068057?sid=100,"Sun, 14 Sep 2025 18:26:00 +0900"
임이자,이재명 정부 첫 대정부질문 여야 현안 놓고 격돌 예고,국민의힘에선 임이자·신성범·곽규택·유영하 의원 등이 참여한다. 이준석 개혁신당 대표 역시 이날 질의에 참석할 예정이다. 이번 대정부질문에 충청권 의원들이 참여하지 않아 아쉬움을 남기고 있다.,https://www.daejonilbo.com/news/articleView.html?idxno=2226845,https://n.news.naver.com/mnews/article/656/0000147630?sid=100,"Sun, 14 Sep 2025 18:21:00 +0900"
임이자,與투톱 갈등 파고드는 국힘… '大우파 연대' 장외투쟁 만지작,"임이자 국민의힘 의원은 지난 12일 열린 '야당탄압 독재정치 규탄대회'에서 &quot;우리도 '뺄셈 정치'를 그만하자&quot;며 &quot;전광훈 목사가 극우라고, 전한길 강사가 더 나갔다고, 이준석이 결이 다르다고 뺄셈 정치하면 진다. 작은... ",https://www.asiatoday.co.kr/view.php?key=20250915010007594,https://www.asiatoday.co.kr/view.php?key=20250915010007594,"Sun, 14 Sep 2025 18:14:00 +0900"
임이자,'강철 지사' 이철우가 진짜 돌아왔다,"이에 앞서 지난 10일엔 우원식 국회의장, 이학영 부의장 등 국회의장단은 물론 김병기 더불어민주당 원내대표, 장동혁 국민의힘 당대표, 임이자 기획재정위원장 등 여야지도부를 두루 만나 지역 현안 해결과 국비 지원을... ",http://www.hidomin.com/news/articleView.html?idxno=592476,http://www.hidomin.com/news/articleView.html?idxno=592476,"Sun, 14 Sep 2025 17:58:00 +0900"
