Keyword,Title,Description,Original Link,Link,Publication Date
안도걸,"재계 &quot;한국 유조선 7척 호르무즈해협에 갇혀, 정부 지원책 마련해달라&quot;...","당 정책위 상임부의장을 맡은 안도걸 의원은 &quot;당장 대응해야 하는 게 에너지 문제&quot;라며 &quot;원유의 70%, 액화천연가스(LNG)의 20%가 호르무즈해협을 통해 들어오는데 수급에 차질을 빚으면 굉장히 큰 문제가 있다&quot;고 했다. 이날... ",https://www.newsis.com/view/NISX20260305_0003535771,https://n.news.naver.com/mnews/article/003/0013802810?sid=100,"Thu, 05 Mar 2026 10:18:00 +0900"
안도걸,중동 긴장 고조에 긴박한 與 “위기 프로그램 마련해 기업 금융지원”,"안도걸 의원은 “원유의 70%, 액화천연가스(LNG)의 20%가 호르무즈 해협을 통해 들어오는데 수급 차질을 빚게 되면 굉장히 큰 문제”라면서 “원유 비축 물량이 270일 정도 되는데 LNG는 9일이라 가장 큰 문제다. LNG를 중심으로... ",https://biz.heraldcorp.com/article/10687434?ref=naver,https://n.news.naver.com/mnews/article/016/0002608726?sid=100,"Thu, 05 Mar 2026 10:10:00 +0900"
안도걸,재계 만난 與 “100조원대 시장 안정 준비…중견기업 금융지원”,"재경위 소속 안도걸 의원도 “원유의 70%, 액화천연가스(LNG)의 20%가 호르무즈 해협을 통해 들어오는데 수급 차질을 빚게 되면 굉장히 큰 문제”라며 “원유의 비축 물량이 270일 정도 되는데 LNG는 9일이라 가장 큰 문제다.... ",https://biz.heraldcorp.com/article/10687373?ref=naver,https://n.news.naver.com/mnews/article/016/0002608680?sid=100,"Thu, 05 Mar 2026 09:37:00 +0900"
안도걸,與 &quot;중동사태 장기화 대비…정부 금융지원 외 추가 지원책 필요&quot;,"당 정책위 상임부의장을 맡은 안도걸 의원은 &quot;당장 대응해야 하는 게 에너지 문제&quot;라며 &quot;원유의 70%, 액화천연가스(LNG)의 20%가 호르무즈해협을 통해 들어오는데 수급에 차질을 빚으면 굉장히 큰 문제가 있다&quot;고 했다. 이날... ",https://www.newsis.com/view/NISX20260305_0003535499,https://n.news.naver.com/mnews/article/003/0013802437?sid=100,"Thu, 05 Mar 2026 09:03:00 +0900"
안도걸,"민주당·재계, 중동 현황 두고 머리 맞대…&quot;일단 대미투자특별법부터 신...","안도걸 민주당 의원은 &quot;원유의 70%, LNG의 20%가 호르무즈 해협을 통해 중동쪽에서 들어오고 있는데 수급에 차질을 빚게 되면 큰 문제가 있다&quot;며 &quot;원유의 경우 비축량이 270일 정도 되니 괜찮은데 LNG가 9일정도라 문제라... ",https://view.asiae.co.kr/article/2026030508572135891,https://n.news.naver.com/mnews/article/277/0005729538?sid=100,"Thu, 05 Mar 2026 08:57:00 +0900"
안도걸,"與, 중동 사태 간담회 개최…“韓 증시 변동 과도…심리적 요소 강해”","관료 출신인 안도걸 의원은 “원유의 70%, LNG의 20%가 호르무즈 통해서 들어온다”며 “원유 같은 경우은 비축 물량이 270일 정도 있지만 LNG는 9일 밖에 없어 큰 문제”라고 말했다. 그러면서 “LNG 중심으로 에너지 수급... ",https://www.sedaily.com/article/20015426?ref=naver,https://n.news.naver.com/mnews/article/011/0004595916?sid=100,"Thu, 05 Mar 2026 08:52:00 +0900"
안도걸,국회 대미투자 특위 재가동…여야 “12일 본회의서 특별법 처리”,[강명구/국회 대미투자특위 위원/국민의힘 : &quot;국회 보고와 사전동의 절차를 꼭 이 대미투자 특별법 안에 명확하게….&quot;] [안도걸/국회 대미투자특위 위원/더불어민주당 : &quot;(건건이 국회 심의는) 투자 결정의 신속성과 탄력성을... ,https://news.kbs.co.kr/news/pc/view/view.do?ncd=8499717&ref=A,https://n.news.naver.com/mnews/article/056/0012135537?sid=100,"Thu, 05 Mar 2026 06:33:00 +0900"
안도걸,"환갑 맞은 국세청, 'K-AI 세정' 대전환 60대 미래혁신안 발표","행사에는 국회 재정경제기획위원회 임이자 위원장과 이인선, 유상범, 안도걸, 박민규, 천하람, 최은석 의원, 조만희 재정경제부 세제실장, 구재이 한국세무사회장, 이영 조세재정연구원장 등이 참석했습니다.",https://www.ytn.co.kr/_ln/0102_202603050028125647,https://n.news.naver.com/mnews/article/052/0002322793?sid=101,"Thu, 05 Mar 2026 00:28:00 +0900"
안도걸,안도걸 의원 “대미투자 자본유출 아니라 국부확대투자 전략이다”,민주당 정책위 상임부의장 안도걸 의원(광주 동구남구을)은 국회 대미투자특별법 처리를 위한... 안도걸 의원은 “대미투자 전략을 국가 차원에서 장기적·체계적으로 추진하기 위해선 투자 프로젝트 발굴과 자금 운용... ,http://www.lawissue.co.kr/view.php?ud=20260304235647855792eef753eb_12,http://www.lawissue.co.kr/view.php?ud=20260304235647855792eef753eb_12,"Wed, 04 Mar 2026 23:58:00 +0900"
안도걸,국세청 60주년 맞은 임광현 청장 &quot;세계가 부러워하는 K-세정 시대 열겠...,"왼쪽부터 천하람 개혁신당 국회의원, 이인선 국민의힘 의원, 최종원 국세개혁위원장, 조만희 재정경제부 세제실장, 임광혁 국세청장, 임이자 재정경제기획위원회 위원장, 안도걸 더불어민주당 의원, 박민규... ",https://www.newspim.com/news/view/20260304001172,https://www.newspim.com/news/view/20260304001172,"Wed, 04 Mar 2026 21:27:00 +0900"
안도걸,‘환갑’맞은 국세청…60주년 기념식서 ‘AI 대전환’ 미래혁신안 발표,"이날 기념식에는 국회 재정경제기획위원회 임이자 위원장, 이인선·유상범·안도걸·박민규·천하람·최은석 의원, 조만희 재정경제부 세제실장, 구재이 한국세무사회장, 이영 조세재정연구원장 등이 참석했다.",https://www.mk.co.kr/article/11978894,https://n.news.naver.com/mnews/article/009/0005645368?sid=101,"Wed, 04 Mar 2026 21:02:00 +0900"
안도걸,임광현 국세청장 “인공지능 대전환 발맞춰 ‘K-AI’ 세정시대 열겠다”,"이날 행사에는 국회 재정경제기획위원회 임이자 위원장, 이인선·유상범·안도걸·박민규·천하람·최은석 의원, 조만희 재정경제부 세제실장, 구재이 한국세무사회장, 이영 조세재정연구원장 등이 참석했다.",https://www.segye.com/newsView/20260304520063?OutUrl=naver,https://n.news.naver.com/mnews/article/022/0004110222?sid=101,"Wed, 04 Mar 2026 20:28:00 +0900"
안도걸,"여야, 대미특위 재가동 &quot;상당 부분 합의&quot;…활동시한 D-5 잰걸음(종합)",안도걸 민주당 의원은 &quot;개별 프로젝트에 대해서 건건이 국회 심의를 받자는 의견도 있습니다만 이는 투자 결정의 신속성과 탄력성을 저해하는 측면이 있다고 보인다&quot;며 &quot;30억 불 이상 되는 상당한 규모의 투자에 대해서만... ,https://www.newsis.com/view/NISX20260304_0003535155,https://n.news.naver.com/mnews/article/003/0013802043?sid=100,"Wed, 04 Mar 2026 20:16:00 +0900"
안도걸,"국세청, 'K-AI 대전환' 60대 미래혁신안 발표","이날 행사에는 국회 재정경제기획위원회 임이자 위원장, 이인선·유상범·안도걸·박민규·천하람·최은석 의원, 조만희 재정경제부 세제실장, 구재이 한국세무사회장, 이영 조세재정연구원장 등이 참석했다.",https://www.hankyung.com/article/202603049527i,https://n.news.naver.com/mnews/article/015/0005258327?sid=101,"Wed, 04 Mar 2026 20:03:00 +0900"
안도걸,국회 대미투자 특위 재가동…여야 “12일 본회의서 특별법 처리”,[강명구/국회 대미투자특위 위원/국민의힘 : &quot;국회 보고와 사전동의 절차를 꼭 이 대미투자 특별법 안에 명확하게….&quot;] [안도걸/국회 대미투자특위 위원/더불어민주당 : &quot;(건건이 국회 심의는) 투자 결정의 신속성과 탄력성을... ,https://news.kbs.co.kr/news/pc/view/view.do?ncd=8499268&ref=A,https://n.news.naver.com/mnews/article/056/0012135213?sid=100,"Wed, 04 Mar 2026 19:25:00 +0900"
안도걸,[이슈] 트럼프 압박 속 여야 12일 대미투자특별법 처리 합의…관세협상...,이에 안도걸 민주당 의원은 &quot;개별 투자에 대한 국회 심의는 투자 결정의 신속성과 탄력성을 저해할 수 있다. 30억 달러 이상 되는 상당한 규모의 투자에 대해서만 사전에 국회 동의를 받는게 어떻겠느냐&quot;고 제안했다.... ,https://www.polinews.co.kr/news/articleView.html?idxno=724506,https://www.polinews.co.kr/news/articleView.html?idxno=724506,"Wed, 04 Mar 2026 18:46:00 +0900"
오기형,"강원 우상호·인천 박찬대·경남 김경수…與, 서울 경선 피날레","사무실을 중구 신당동에 꾸린 정원오 캠프엔 현역 이해식·채현일·박민규·이정헌·오기형 의원, 신현영 전 의원이 합류했다. 이해식 의원이 위원장, 채 의원이 본부장을 맡았다. 여의도 사무실을 차린 박주민 캠프는 현역... ",https://www.news1.kr/politics/assembly/6091703,https://n.news.naver.com/mnews/article/421/0008809158?sid=100,"Thu, 05 Mar 2026 16:49:00 +0900"
오기형,"K자본시장특위, 스튜어드십코드 이행 실태 점검나서","특위 위원장인 오기형 의원도 “스튜어드십 코드는 기관투자자들이 남의 돈을 맡아서 관리하니까 경영진과 적극적으로 소통하고, 필요하면 의결권을 행사하라는 의미”라며 “주총에 한정되는게 아니고, 평소 (소통)하는... ",https://www.mk.co.kr/article/11979829,https://n.news.naver.com/mnews/article/009/0005645804?sid=100,"Thu, 05 Mar 2026 16:46:00 +0900"
오기형,여당 &quot;국민연금 자산위탁 배분 때 스튜어드십 평가점수 반영&quot;,"특위 위원장인 오기형 의원은 &quot;스튜어드십 코드는 기관투자자들이 남의 돈을 맡아서 관리하니까 경영진과 적극적으로 소통하고, 필요하면 의결권을 행사하라는 의미&quot;라며 &quot;주총 기간에만 한정된 것은 아니고 평소... ",https://imnews.imbc.com/news/2026/politics/article/6805158_36911.html,https://n.news.naver.com/mnews/article/214/0001484203?sid=100,"Thu, 05 Mar 2026 16:29:00 +0900"
오기형,수탁자책임 활동 잘하는 운용사에 국민연금 자산 더 몰아준다,"특위위원장을 맡고 있는 오기형 의원은 &quot;국민연금이 위탁 비율을 조정하는 방식이 있고, 금융위나 정부 정책자금 등을 운용사에 배분할 때 기준을 바꾸는 것이 있다&quot;며 &quot;기준이 정해진 것은 아니고 앞으로 이런 것을... ",https://www.ajunews.com/view/20260305160120905,https://www.ajunews.com/view/20260305160120905,"Thu, 05 Mar 2026 16:24:00 +0900"
오기형,與 &quot;국민연금 자산위탁 배분 때 스튜어드십 평가점수 반영&quot;,"특위 위원장인 오기형 의원은 &quot;스튜어드십 코드는 기관투자자들이 남의 돈을 맡아서 관리하니까 경영진과 적극적으로 소통하고, 필요하면 의결권을 행사하라는 의미&quot;라며 &quot;주총 기간에만 한정된 것은 아니고 평소 (소통)... ",https://biz.sbs.co.kr/article_hub/20000295410?division=NAVER,https://n.news.naver.com/mnews/article/374/0000496082?sid=101,"Thu, 05 Mar 2026 16:20:00 +0900"
오기형,"'중동사태'에 재계와 머리맞댄 與…野, 정부 책임론 부각","민주당 K-자본시장특위 위원장을 맡고 있는 오기형 의원은 &quot;보다 차분하게 대응해야 한다&quot;며 &quot;그간 자본시장 변화 과정에서 큰 흐름으로 유지되는 것은 정책적 기조, 지배구조 투명성 문제와 반도체 실적이다. 그 두 가지... ",http://www.shinailbo.co.kr/news/articleView.html?idxno=2198907,http://www.shinailbo.co.kr/news/articleView.html?idxno=2198907,"Thu, 05 Mar 2026 16:16:00 +0900"
오기형,與 “기관투자자 스튜어드십 코드 평가해 국민연금 위탁 운용사 선정에...,"與 자본시장특위, 금융위·금감원 등 업무보고 스튜어드십 코드 이행 평가 기준 마련 오기형 “스튜어드십... 위원장을 맡은 오기형 민주당 의원은 “스튜어드십 코드는 원래 민간이 자율적으로 운영하는 제도지만... ",https://biz.chosun.com/policy/politics/assembly/2026/03/05/DH5ZBINOH5FK5CH76GJZZQAGCI/?utm_source=naver&utm_medium=original&utm_campaign=biz,https://n.news.naver.com/mnews/article/366/0001146112?sid=100,"Thu, 05 Mar 2026 15:51:00 +0900"
오기형,"민주 '중동 상황' 재계 간담회…국힘, 청와대 앞 상복의총","위원장을 맡고 있는 오기형 의원은 &quot;우리나라가 주변국에 비해서도 변동성이 크다&quot;면서도 &quot;변수는 변수대로 대응하고, 할 일은 해 나가야 한다&quot;고 말했습니다. 그러면서 &quot;스튜어드십 코드 내실화는 자본시장 선진화 정책의... ",http://www.yonhapnewstv.co.kr/MYH20260305154845HGR,https://n.news.naver.com/mnews/article/422/0000840757?sid=100,"Thu, 05 Mar 2026 15:49:00 +0900"
오기형,與 스튜어드십 코드 우수 운용사 연금위탁 확대 검토...&quot;10배도 가능&quot;,특위 위원장인 오기형 의원은 &quot;스튜어드십 코드 내실화는 자본시장 선진화 정책 중 일부로 국정과제에... 특위 위원장인 오기형 의원은 &quot;정해진 것이 아니라 제도 보완을 해나가자는 데 공감했다&quot;며 &quot;스튜어드십 코드는... ,https://www.mt.co.kr/politics/2026/03/05/2026030513463166382,https://n.news.naver.com/mnews/article/008/0005325923?sid=100,"Thu, 05 Mar 2026 15:48:00 +0900"
오기형,與 &quot;중동사태 장기화 대비…정부 금융지원 외 추가 지원책 필요&quot;,"민주당 오기형 의원은 현재 위기 상황에 &quot;보다 차분하게 대응해야 한다&quot;며 &quot;그간 자본시장 변화 과정에서 큰 흐름으로 유지되는 것은 정책적 기조, 지배구조 투명성 문제와 반도체 실적&quot;이라고 했다. 그러면서 &quot;유가 변동... ",http://www.metroseoul.co.kr/article/20260305500488,http://www.metroseoul.co.kr/article/20260305500488,"Thu, 05 Mar 2026 15:40:00 +0900"
오기형,與 자본시장특위 “국민연금 등 자산 배분 때 ‘스튜어드십 코드’ 평가...,오기형 특위 위원장은 이번 조치가 민간 자율성을 침해할 수 있다는 일각의 우려에 대해 “기관투자자가 남의 돈을 맡아 관리하는 만큼 평소 경영진과 소통하고 의결권을 행사하라는 의미”라며 “자산운용사들이 역할을... ,https://www.dt.co.kr/article/12049834?ref=naver,https://n.news.naver.com/mnews/article/029/0003014079?sid=100,"Thu, 05 Mar 2026 15:32:00 +0900"
오기형,與 “국민연금 위탁운용 선정·배분에 ‘스튜어드십 평가’ 적용”,특위 위원장인 오기형 의원은 “제도 설계와 관련해 스튜어드십 코드를 하는 데 컨설팅 비용 등을 어떻게 줄일 것이냐에 대한 문제와 인센티브에 대한 고민이 있다”고 했다. 오 의원은 “국민연금이 위탁 비율을... ,https://www.etoday.co.kr/news/view/2562288,https://www.etoday.co.kr/news/view/2562288,"Thu, 05 Mar 2026 15:12:00 +0900"
오기형,호르무즈 해협에 유조선 최대 7척 발 묶여… 국내 원유 수급 '긴장',"대해서는 과도한 불안 심리를 경계해야 한다는 의견도 나왔다. 오기형 민주당 의원은 &quot;유가 변동 폭에 비해 자본시장이 과도하게 반응한 측면이 있다&quot;며 &quot;재계와 정부, 정치권이 차분하게 대응해야 한다&quot;고 말했다.",http://www.hidomin.com/news/articleView.html?idxno=611114,http://www.hidomin.com/news/articleView.html?idxno=611114,"Thu, 05 Mar 2026 15:06:00 +0900"
오기형,與 &quot;금융위 등이 자산운용사 '스튜어드십 코드' 활동 평가하도록 할 것...,특위 위원장인 오기형 의원은 &quot;국민연금이 위탁 비율을 조정하는 방식이 있고 금융위나 정부 정책자금 등을 운용사에 배분할 때 기준을 바꾸는 것이 있다&quot;며 &quot;기준이 정해진 것은 아니고 앞으로 이런 것을 고려한 제도... ,https://www.newsis.com/view/NISX20260305_0003536308,https://n.news.naver.com/mnews/article/003/0013803954?sid=100,"Thu, 05 Mar 2026 15:00:00 +0900"
오기형,"민주당, 국민연금 스튜어드십 코드 강화를 통한 자산운용사 평가 본격화",특별위원회 위원장인 오기형 의원은 스튜어드십 코드의 의미를 강조하며 기관투자자들이 올바른 방식으로 자금을 관리하는 것이 중요하다고 말했다. 그는 특히 스튜어드십 코드는 단순히 주주총회 시기에만 국한되지 않고... ,https://www.gokorea.kr/news/articleView.html?idxno=859581,https://www.gokorea.kr/news/articleView.html?idxno=859581,"Thu, 05 Mar 2026 14:54:00 +0900"
오기형,"민주 '중동 상황' 재계 간담회…국힘, 청와대 앞 상복의총","위원장을 맡고 있는 오기형 의원은 &quot;우리나라가 주변국에 비해서도 변동성이 크다&quot;면서 &quot;변수는 변수대로 대응하고, 할 일은 해 나가야한다&quot;고 말했습니다. 그러면서 &quot;스튜어드십 코드 내실화는 자본시장 선진화 정책의... ",http://www.yonhapnewstv.co.kr/MYH202603051445523ri,https://n.news.naver.com/mnews/article/422/0000840730?sid=100,"Thu, 05 Mar 2026 14:46:00 +0900"
오기형,"美, 이란 침공 충격에 코스피 대폭 하락... 與野 반응 엇갈려","이 자리에서 오기형 의원은 중동사태에 따른 우리나라의 유가, 환율, 증시 등 변동성이 주변국에 비해 크다는 점을 지적했다. 오 의원은 “주변 국가와 비교해 우리나라의 반응이 과하다”며 “우리 경제의 심리적 요소가... ",https://www.siminilbo.co.kr/news/newsview.php?ncode=1160284812825758,https://www.siminilbo.co.kr/news/newsview.php?ncode=1160284812825758,"Thu, 05 Mar 2026 14:26:00 +0900"
오기형,민주 &quot;국민연금 자산위탁 배분 때 스튜어드십 평가점수 반영&quot;,"특위 위원장인 오기형 의원은 &quot;스튜어드십 코드는 기관투자자들이 남의 돈을 맡아서 관리하니까 경영진과 적극적으로 소통하고, 필요하면 의결권을 행사하라는 의미&quot;라며 &quot;주총 기간에만 한정된 것은 아니고 평소 (소통)... ",http://www.yonhapnewstv.co.kr/AKR20260305142345l66,https://n.news.naver.com/mnews/article/422/0000840714?sid=100,"Thu, 05 Mar 2026 14:24:00 +0900"
오기형,與 &quot;국민연금 위탁 자산 배분 때 스튜어드십 평가점수 반영&quot;,"특위 위원장인 오기형 의원은 &quot;스튜어드십 코드는 기관투자자들이 남의 돈을 맡아서 관리하니까 경영진과 적극적으로 소통하고, 필요하면 의결권을 행사하라는 의미&quot;라며 &quot;주총 기간에만 한정된 것은 아니고 평소 (소통)... ",https://www.pinpointnews.co.kr/news/articleView.html?idxno=434265,https://www.pinpointnews.co.kr/news/articleView.html?idxno=434265,"Thu, 05 Mar 2026 14:24:00 +0900"
오기형,與자본시장 특위 &quot;국민연금 자산 위탁 시 스튜어드십 평가 점수 반영&quot;,오기형 의원은 &quot;자본시장 선진화 과제 중 스튜어드십 코드 내실화 내용이 국정과제로 포함돼 있다. 스튜어드십 코드 제도가 제대로 운영되고 있는지 살펴볼 것&quot;이라고 했다. 스튜어드십 코드는 기관투자자가 자산 운용... ,https://view.asiae.co.kr/article/2026030514194644002,https://n.news.naver.com/mnews/article/277/0005729900?sid=100,"Thu, 05 Mar 2026 14:19:00 +0900"
오기형,與 &quot;국민연금 자산위탁 배분 때 스튜어드십 평가점수 반영&quot;,"특위 위원장인 오기형 의원은 &quot;스튜어드십 코드는 기관투자자들이 남의 돈을 맡아서 관리하니까 경영진과 적극적으로 소통하고, 필요하면 의결권을 행사하라는 의미&quot;라며 &quot;주총 기간에만 한정된 것은 아니고 평소 (소통)... ",https://www.yna.co.kr/view/AKR20260305100000001?input=1195m,https://n.news.naver.com/mnews/article/001/0015939877?sid=100,"Thu, 05 Mar 2026 13:46:00 +0900"
오기형,한정애 “100조 중동 프로젝트 좌초 가능성”,"민주당 K-자본시장특위 위원장을 맡고 있는 오기형 의원은 현재 위기 상황을 거론하며 “보다 차분하게 대응해야 한다”고 했다. 그는 “그간 자본시장 변화 과정에서 큰 흐름으로 유지되는 것은 정책적 기조, 지배구조... ",https://www.naeil.com/news/read/580078?ref=naver,https://www.naeil.com/news/read/580078?ref=naver,"Thu, 05 Mar 2026 13:06:00 +0900"
오기형,"與, 중동·관세 불확실성에 &quot;100조 금융지원 프로그램 가동&quot;","민주당 K-자본시장특위 위원장을 맡고 있는 오기형 의원은 &quot;보다 차분하게 대응해야 한다&quot;라며 &quot;그간 자본시장 변화 과정에서 큰 흐름으로 유지되는 것은 정책적 기조, 지배구조 투명성 문제와 반도체 실적이다. 그 두 가지... ",https://www.m-i.kr/news/articleView.html?idxno=1343041,https://www.m-i.kr/news/articleView.html?idxno=1343041,"Thu, 05 Mar 2026 13:02:00 +0900"
오기형,與 &quot;국민연금 위탁운용사 스튜어드십 코드 이행평가 따라 자금 배분&quot;,특위 위원장인 오기형 의원은 &quot;두 가지 측면에서 제도 설계에 대한 고민이 있다. 첫째는 스튜어드십 코드를... 대화하는 민주당 오기형 K-자본시장 특위 위원장과 김남근 의원(서울=연합뉴스) 신현우 기자 = 더불어민주당... ,https://news.einfomax.co.kr/news/articleView.html?idxno=4401951,https://news.einfomax.co.kr/news/articleView.html?idxno=4401951,"Thu, 05 Mar 2026 12:52:00 +0900"
오기형,"민주 '중동 상황' 재계 간담회…국힘, 청와대 앞 의총","위원장을 맡고 있는 오기형 의원은 &quot;주변국에 비해서도 변동성이 크다&quot;면서도 &quot;변수는 변수대로 대응하고, 할 일은 해 나가야 한다&quot;고 말했습니다. 그러면서 &quot;스튜어드십 코드 내실화는 자본시장 선진화 정책의 일부인 만큼... ",http://www.yonhapnewstv.co.kr/MYH20260305121743o2e,https://n.news.naver.com/mnews/article/422/0000840673?sid=100,"Thu, 05 Mar 2026 12:18:00 +0900"
오기형,"규제 일변도 정책은 그대로 … 민주 &quot;단기 주가 연연 안 해, 스튜어드십...",민주당 코리아 프리미엄 K-자본시장 특별위원회 위원장을 맡고 있는 오기형 의원은 5일 국회에서 열린 특위 업무보고에서 &quot;주식시장 변동폭이 컸다. 주변국과 비교해도 큰 것 같다&quot;면서도 &quot;지금 현재 외생 변수 발생했지만... ,https://www.newdaily.co.kr/site/data/html/2026/03/05/2026030500185.html,https://www.newdaily.co.kr/site/data/html/2026/03/05/2026030500185.html,"Thu, 05 Mar 2026 11:56:00 +0900"
오기형,"기업인 불러놓고…與의원들, 중동현안 간담회서 릴레이 발언",K-자본시장특별위원회 위원장을 맡고 있는 오기형 의원은 전날 급락한 코스피 증시를 염두에 둔 듯 &quot;과도한 반응이 있는 것 같고 보다 차분하게 대응할 필요가 있다&quot;고 주장했다. 진성준 의원은 &quot;미국 트럼프 행정부의... ,https://www.hankyung.com/article/202603050589i,https://n.news.naver.com/mnews/article/015/0005258530?sid=100,"Thu, 05 Mar 2026 11:45:00 +0900"
오기형,업계 &quot;韓원유선 7척 호르무즈해협 묶여…원유수요 시나리오 필요&quot;(종합...,"민주당 '코리아 프리미엄 K-자본시장 특위' 위원장인 오기형 의원은 간담회에서 &quot;현재 유가 변동 폭에 비해 자본시장이 과도하게 반응하고 있으니 무엇보다 재계와 정부, 정치권이 일희일비하기보다는 차분하게 대응해야... ",https://www.yna.co.kr/view/AKR20260305028451001?input=1195m,https://n.news.naver.com/mnews/article/001/0015939532?sid=100,"Thu, 05 Mar 2026 11:38:00 +0900"
오기형,민주 '중동 상황' 재계 간담회…여야 지선 잰걸음,"위원장을 맡고 있는 오기형 의원은 &quot;주변국에 비해서도 변동성이 크다&quot;면서도 &quot;변수는 변수대로 대응하고, 할 일은 해 나가야 한다&quot;고 말했습니다. 그러면서 &quot;스튜어드십 코드 내실화는 자본시장 선진화 정책의 일부인 만큼... ",http://www.yonhapnewstv.co.kr/MYH20260305111058fcD,https://n.news.naver.com/mnews/article/422/0000840626?sid=100,"Thu, 05 Mar 2026 11:12:00 +0900"
오기형,與 “주가 누르는 기업에 스튜어드십 코드 활동 강화 할것”,인센티브가 필요하다는 제안도 있어서 이같은 방안에 대해 다양한 이야기를 들어보겠다”고 말했다. 오기형 의원도 “스튜어드십 코드 활동을 강화할 수 있도록 하는 유인체계를 만들어야 한다는 의견이 많다”고 덧붙였다.,https://www.sedaily.com/article/20015552?ref=naver,https://n.news.naver.com/mnews/article/011/0004596008?sid=100,"Thu, 05 Mar 2026 11:09:00 +0900"
