Keyword,Title,Description,Original Link,Link,Publication Date
이재명,김어준 &quot;李 순방 중 대책회의 없어&quot; vs 총리실 반박…또 공방,총리실은 이재명 대통령의 순방 기간 발생한 중동 사태에 대응하기 위해 &quot;정부는 중동 상황 발발 직후부터 매일 오후 비상점검을 위한 관계장관회의(3월 1~4일 매일)를 개최했다&quot;고 전했다. 이어 &quot;회의에서는 재외국민 보호... ,https://www.news1.kr/politics/president/6091717,https://n.news.naver.com/mnews/article/421/0008809187?sid=100,"Thu, 05 Mar 2026 16:59:00 +0900"
이재명,"민주당, 김경수 경남지사 후보로 단수공천…우상호·박찬대 이어 '3호'","이어 &quot;이재명 정부 출범과 함께 지방시대위원장을 맡아 정부의 국정철학은 물론 지역균형발전에 대한 이해도... 동안 이재명 대통령과 함께 지방시대위원장 일을 하면서 대한민국을 5극3특의 균형성장, 지역주도성장으로... ",https://www.pressian.com/pages/articles/2026030514555921594?utm_source=naver&utm_medium=search,https://n.news.naver.com/mnews/article/002/0002430527?sid=100,"Thu, 05 Mar 2026 16:59:00 +0900"
이재명,"검찰, ‘쌍방울 대북송금’ 진술 회유 의혹 관련 서민석 변호사 첫 소환...","서 변호사는 지난 2023년 수원지검이 쌍방울 대북송금 의혹을 수사할 당시 이 전 부지사의 법률대리인을 맡았던 인물로, 당시 수사 과정에서 이재명 더불어민주당 대표에게 불리한 방향의 진술을 하도록 이 전 부지사를... ",https://www.kyeonggi.com/article/20260305580416,https://n.news.naver.com/mnews/article/666/0000098203?sid=102,"Thu, 05 Mar 2026 16:59:00 +0900"
이재명,전국 평균 휘발유값 1800원 돌파…지역·유종별 최고가 지정되나,"중동 정세 긴장으로 국내 주유소 기름값이 상승세를 보이는 가운데 이재명 대통령이 나서 유류 최고가격 지정 검토를 지시했지만, 기름값 상승세가 쉽게 꺾이지 않는 모습이다. 5일 한국석유공사 유가정보시스템... ",https://www.newsis.com/view/NISX20260305_0003536613,https://n.news.naver.com/mnews/article/003/0013804399?sid=101,"Thu, 05 Mar 2026 16:58:00 +0900"
이재명,대전 기름값 폭등에 전국서 순위권... 이재명 대통령 재제 방안 주문,"대전을 비롯한 전국 주유소 기름값이 중동 정세 불안으로 급등한 가운데, 이재명 대통령의 가격 폭등... 기름값 폭등에 이재명 대통령이 제재방안 발언으로 안정화를 꾀할지 주목된다. 이날 이재명 대통령은... ",https://www.joongdo.co.kr/web/view.php?key=20260305010001640,https://www.joongdo.co.kr/web/view.php?key=20260305010001640,"Thu, 05 Mar 2026 16:58:00 +0900"
이재명,중기부가 끌고 민간이 동행한다…민관정책협의회 신설(종합),"또 협의회의 지속 가능성 담보 방안에 대해 이 위원장은 &quot;2004~2025년 우리나라 벤처기업 1세대들, 여러 국회의원과 연구 모임을 만들어 벤처 관련 법률 11개를 통과시킨 적이 있다&quot;며 &quot;이재명 대통령께서도 중소기업·벤처로... ",https://www.newsis.com/view/NISX20260305_0003536676,https://n.news.naver.com/mnews/article/003/0013804395?sid=101,"Thu, 05 Mar 2026 16:58:00 +0900"
이재명,"與 박수현 수석대변인 사임, 충남도지사 도전장",박 의원은 전날 JTBC '이가혁 라이브'에서 &quot;짧은 시간 안에 충남지사 출마 선언을 하게 될 것&quot;이라며 &quot;이재명 정부 5극 3특 설계자로서 책임감을 무한히 느낀다&quot;고 언급하기도 했다. 박 의원은 6일 충남도청에서 충남도지사... ,https://www.daejonilbo.com/news/articleView.html?idxno=2261027,https://n.news.naver.com/mnews/article/656/0000169316?sid=100,"Thu, 05 Mar 2026 16:58:00 +0900"
이재명,전북 도정과 교육 미래는 뒷전?…선거 승리 위한 네거티브 활개,현재 전북은 이재명 정부의 균형발전 기조 속에서 피지컬 AI와 새만금 개발이라는 전략적 기회를 맞이하고 있다. 현대차의 새만금 9조 원 투자 약속도 전북을 산업 발전의 중심지로 만드는 중요한 기회가 될 수 있다.... ,https://www.jjan.kr/article/20260305500343,https://www.jjan.kr/article/20260305500343,"Thu, 05 Mar 2026 16:58:00 +0900"
이재명,"정청래 만난 송영길, 계양을 출마 문제에 &quot;당 결정 따를 것&quot;",정금민 한재혁 김윤영 기자 = 송영길 더불어민주당 전 대표가 5일 정청래 민주당 대표와 만나 &quot;이재명 정부의 성공과 지방선거 (승리를 위해) 뜻을 모아나가자&quot;고 했다. 자신의 지역구였던 인천 계양을 국회의원 보궐선거... ,https://www.newsis.com/view/NISX20260305_0003536599,https://n.news.naver.com/mnews/article/003/0013804394?sid=100,"Thu, 05 Mar 2026 16:58:00 +0900"
이재명,3월 5일 미리 보는 MBN 뉴스7,▶ 이 대통령 &quot;돈이 마귀라지만&quot;…기름값 정조준 이재명 대통령이 오늘(5일) 오전 국무회의에서 &quot;휘발유 가격에 바가지를 씌우는 행위에는 엄중 대응하라&quot;고 말했습니다. 이 대통령은 &quot;돈이 마귀라고 하지만 너무 심하다... ,http://www.mbn.co.kr/pages/news/newsView.php?news_seq_no=5179792,https://n.news.naver.com/mnews/article/057/0001938350?sid=102,"Thu, 05 Mar 2026 16:58:00 +0900"
이재명,'빈말 않는다' 강조한 李대통령 &quot;규칙 어겨 이익 보는 시대는 갔다&quot;,이재명 대통령은 5일 금융시장의 부당 시스템에 대해 재차 경고했다. 이 대통령은 이날 엑스(X·옛 트위터)에 국세청이 주가 조작 등으로 주식 시장을 교란한 27개 기업과 관련자 200여명에 대해 세무조사를 벌여 2576억원을... ,https://magazine.hankyung.com/business/article/202603051799b,https://n.news.naver.com/mnews/article/050/0000103185?sid=101,"Thu, 05 Mar 2026 16:57:00 +0900"
이재명,'계양을' 귀환 노리는 송영길…정청래 만나 &quot;당 결정 따르겠다&quot;,"이재명 정부 성공과 지방선거 승리를 위해 함께 뜻을 모아나가자는 취지로 말했다&quot;고 했다. 송 전 대표의... 해당 지역에서 내리 5선을 지낸 송 전 대표의 귀환과 더불어, 이재명 대통령의 복심으로 평가받는 김남준 전... ",http://www.inews24.com/view/1945807,https://n.news.naver.com/mnews/article/031/0001010754?sid=100,"Thu, 05 Mar 2026 16:57:00 +0900"
이재명,"기름값 폭등, 이 대통령이 직격한 ‘주유소 폭리’만 문제일까?","이재명 대통령은 이날 국무회의에서 국민께서 일상에서 느끼기로는 (기름값이) 오를 때는 엄청 빨리 많이 오르고, 내릴 때는 천천히 조금만 내린다는 문제 인식을 갖고 있다고 짚었다. 이어 호르무즈 해역 봉쇄나 국제... ",https://vop.co.kr/A00001689101.html,https://vop.co.kr/A00001689101.html,"Thu, 05 Mar 2026 16:56:00 +0900"
이재명,이재명 대통령 &quot;규칙 어겨 돈 버는 시대 끝&quot;…주가조작 엄단 재확인,이재명 대통령이 금융시장 교란 행위에 대한 강경 대응 의지를 다시 한 번 공개적으로 밝혔다. 시장 규칙을... 연합뉴스에 따르면 이재명 대통령은 5일 사회관계망서비스(SNS) 엑스(X·옛 트위터)에 글을 올려 금융시장 교란... ,https://www.topstarnews.net/news/articleView.html?idxno=15991783,https://www.topstarnews.net/news/articleView.html?idxno=15991783,"Thu, 05 Mar 2026 16:56:00 +0900"
이재명,"조용식, 신중앙시장 방문 李대통령 밀착동행",더불어민주당 조용식 익산시장 예비후보가 이재명 대통령과 밀착 동행하는 모습이 공개되면서 시민들의 눈길을 끌고 있다. 조용식 예비후보는 이재명 대통령이 전주 신중앙시장 방문 당시 근거리에서 동행하면서 현장의... ,http://www.jjn.co.kr/news/articleView.html?idxno=1034016,http://www.jjn.co.kr/news/articleView.html?idxno=1034016,"Thu, 05 Mar 2026 16:56:00 +0900"
이재명,"구윤철, 석유 최고가격제 지정 검토…&quot;부당 이득 행위 용납 안 해&quot;",이날 회의에서 이재명 대통령은 유가가 오를 때는 빠르고 내릴 때는 느린 시장의 불합리한 구조를 강하게 비판했다. 이 대통령은 &quot;호르무즈 해협 봉쇄가 국내에 실질적인 영향을 미치지 않고 있는 상태임에도 가격이... ,http://www.iminju.net/news/articleView.html?idxno=159698,http://www.iminju.net/news/articleView.html?idxno=159698,"Thu, 05 Mar 2026 16:56:00 +0900"
이재명,"&quot;같은 평택, 다른 선거&quot;… '거물 격전지' vs '야당 후보 실종'","여기에 이재명 대통령의 핵심 측근으로 알려진 김용 전 민주연구원 부원장의 출마 가능성까지 나오면서 전국적인 관심이 집중되고 있습니다. 국민의힘에서는 유의동 전 국회의원이 출마 의사를 밝혔고, 원유철 전... ",https://news.ifm.kr/news/articleView.html?idxno=466138,https://news.ifm.kr/news/articleView.html?idxno=466138,"Thu, 05 Mar 2026 16:56:00 +0900"
이재명,"민주 '1호 공천' 우상호, 강원지사 예비후보 등록","우상호 전 정무수석은 오늘 강원도선거관리위원회를 찾아 예비후보 등록을 마치고, “대통령이 이재명으로 바뀌었을 뿐인데 대한민국이 정말 눈부시게 바뀌고 있다&quot;며 &quot;강원도지사가 바뀌면 어떻게 변하는지 피부로... ",https://www.mbceg.co.kr/post/134175,https://www.mbceg.co.kr/post/134175,"Thu, 05 Mar 2026 16:56:00 +0900"
이재명,&quot;단일화까지 앞으로 한 달&quot;…엇갈린 김상곤·이재정 전 경기교육감 지지...,"김 전 교육감은 지난 1월 안 예비후보의 출판기념회에 참여해 &quot;안 전 의원이 이재명 정부와 함께 혁신교육을 복원·계승하고, 미래 자치교육으로 발전시킬 것으로 기대된다&quot;고 말한 바 있다. 이밖에 안 예비후보는... ",https://www.joongboo.com/news/articleView.html?idxno=363718882,https://www.joongboo.com/news/articleView.html?idxno=363718882,"Thu, 05 Mar 2026 16:56:00 +0900"
이재명,'첫 여성 경남도지사' 도전 나선 전희영 예비후보,특히 이번 지방선거에서는 이재명 정부 출범 이후 빛의 혁명을 완수해야 한다. 지난 빛의 혁명에서 여성들이 주역으로 등장했는데 그 의미를 살려 지지해 주는 분들이 있다. 호재가 될 수 있겠다고 생각한다. '노동자... ,https://www.idomin.com/news/articleView.html?idxno=2000530,https://www.idomin.com/news/articleView.html?idxno=2000530,"Thu, 05 Mar 2026 16:56:00 +0900"
이재명,“기름 넣기 무서워요”…정부 ‘최고가 지정’ 초강수 검토,"이재명 대통령은 이날 임시 국무회의에서 “아직 심각한 차질이 벌어진 것도 아닌데 갑자기 폭등했다”고 지적하며 “아침 점심 저녁 가격이 다 다르고, 리터당 200원 가까이 올린 곳도 있다고 들었다”면서 제재... ",https://www.mk.co.kr/article/11979840,https://n.news.naver.com/mnews/article/024/0000103872?sid=102,"Thu, 05 Mar 2026 16:56:00 +0900"
이재명,"한국-싱가포르, 공공안전 AI 협력 확대…NIPA·HTX 맞손",(사진=NIPA) 이번 협약은 이재명 대통령과 로런스 웡 싱가포르 총리 임석 하에 싱가포르 외교부에서 체결됐다. 박윤규 NIPA 원과 찬 찬 싱가포르 과학기술청 청장이 협약 서명에 참여했다. 두 기관은 협약에 따라... ,https://zdnet.co.kr/view/?no=20260305165414,https://n.news.naver.com/mnews/article/092/0002413085?sid=105,"Thu, 05 Mar 2026 16:55:00 +0900"
이재명,"정순욱 민주당 의왕시장 예비후보, '의왕 새로운 변화' 선거사무소 8일...","정 전 부시장은 경기도청 비서실장을 비롯, 동두천시·광명시 부시장을 역임한  정통 관료출신으로, 특히 이재명 대통령의 경기도지사 재임 시절 비서실장으로 섬세한 일처리로 2년 6개월간 비서실장으로 재임하면서... ",http://www.suwonilbo.kr/news/articleView.html?idxno=314884,http://www.suwonilbo.kr/news/articleView.html?idxno=314884,"Thu, 05 Mar 2026 16:54:00 +0900"
이재명,구윤철 &quot;석유가 인상 몰염치…주유소 담합 조사해 강력처벌&quot;,구윤철 경제부총리 겸 재정경제부 장관은 5일 청와대에서 열린 임시 국무회의에서 이재명 대통령에게 &quot;최근 휘발유 가격의 과도한 인상 등 현상이 나타나고 있다&quot;며 &quot;집중 점검을 통해 민생 물가 특별관리 품목과 관련한... ,https://www.idaegu.co.kr/news/articleView.html?idxno=540721,https://www.idaegu.co.kr/news/articleView.html?idxno=540721,"Thu, 05 Mar 2026 16:54:00 +0900"
이재명,4월초 與 경기지사 후보 결정…선호투표 미적용,"후보들은 각자의 지지세력에 더해 '명심(이재명 대통령의 의중)' 확보에 신경을 기울이고 있다. 또 불출마를... 염 의원은 이날 SNS에 &quot;이재명 정부의 성공과 더 나은 경기도를 위해, 젊은 리더 한준호 의원과 기쁜 마음으로... ",https://www.kihoilbo.co.kr/news/articleView.html?idxno=3015322,https://www.kihoilbo.co.kr/news/articleView.html?idxno=3015322,"Thu, 05 Mar 2026 16:54:00 +0900"
이재명,"막 올린 경기도지사 선거…&quot;민주당 5파전, 국힘도 꿈틀&quot;","한준호 의원은 이재명 대통령 측근들과 잇따라 회동하는 한편 SNS를 통해 김동연 지사를 겨냥한 견제 메시지를 이어가고 있습니다. 권칠승 의원은 &quot;정책 전문성과 당 경력을 바탕으로 승부하겠다&quot;고 강조했고, 양기대 전... ",https://news.skbroadband.com/news/articleView.html?idxno=219832,https://news.skbroadband.com/news/articleView.html?idxno=219832,"Thu, 05 Mar 2026 16:54:00 +0900"
이재명,이 대통령 “100조 안정 프로그램 신속 집행…시세교란 같은 범죄행위 ...,중동 정세 불안정에 따른 국내 자금시장 개입 의사 밝혀 인더뉴스 김용운 기자ㅣ이재명 대통령은 5일 미국과... 이재명 대통령이 5일 청와대에서 중동 상황 대응책 논의를 위한 국무회의를 주재하고 있다. 사진｜연합뉴스,https://www.inthenews.co.kr/news/article.html?no=83833,https://www.inthenews.co.kr/news/article.html?no=83833,"Thu, 05 Mar 2026 16:54:00 +0900"
이재명,"[선우윤호의 경제본색] 심각한 서민 밥상 물가, 닭고기·삼겹살·쌀까지...","한편, 이재명 정부가 일부 대책을 내놓고 있으나, 시장의 상승 압력을 감안하면 보다 적극적인 물가 관리가 필요하다. 방역 관리 강화, 공급 안정 대책, 수입 원자재 가격 완충 정책 등 다층적인 대응이 요구된다.... ",https://www.pennmike.com/news/articleView.html?idxno=116214,https://www.pennmike.com/news/articleView.html?idxno=116214,"Thu, 05 Mar 2026 16:54:00 +0900"
이재명,"계룡시장 민주당 후보 적합도, 정준영 1위…",이번 지방선거의 성격을 묻는 질문에는 ‘이재명 정부에 힘을 실어주기 위해 여당 후보가 당선돼야 한다’는 정부 지원론이 57.9%로 나타났다. ‘정부를 견제하기... ,http://www.breaknews.com/1189438,http://www.breaknews.com/1189438,"Thu, 05 Mar 2026 16:54:00 +0900"
이재명,&quot;더 오르기 전 가득&quot;… 유가 폭등 우려에 주유소 북새통,한편 유가가 폭등하자 이재명 대통령은 이날 열린 임시 국무회의에서 &quot;유류 공급은 아직 객관적으로 심각한 차질이 벌어진 것도 아닌데 갑자기 폭등했다&quot;며 불공정 행위의 강력한 단속과 유류 최고가격 지정 검토를... ,https://www.kado.net/news/articleView.html?idxno=2037184,https://n.news.naver.com/mnews/article/654/0000169292?sid=102,"Thu, 05 Mar 2026 16:54:00 +0900"
정상순방,이 대통령 &quot;100조 시장안정 프로그램 집행…유류 최고가격 신속 지정&quot;(종...,김지은 조재완 김경록 기자 = 동남아시아 순방을 마치고 귀국한 이재명 대통령이 5일 중동 상황에 대한... 이 대통령은 &quot;증권시장 안정과는 다른 개념으로 구조적으로 문제가 없는데 일시적으로 비정상이 발생할 때... ,https://www.newsis.com/view/NISX20260305_0003536639,https://n.news.naver.com/mnews/article/003/0013804363?sid=100,"Thu, 05 Mar 2026 16:48:00 +0900"
정상순방,[정치ON] 이 대통령 &quot;100조 원 규모 시장안정 프로그램 집행&quot;,"순방을 마치고 돌아온 이재명 대통령은 100조 원 규모 시장 안정 프로그램을 신속히 집행하라며 기름값... 하지만 지금 우리 대통령님의 강력한 의지와 함께 자본시장을 정상화시키겠다는. 또 우리 민주당이 상법을 1차, 2차... ",https://www.ytn.co.kr/_ln/0101_202603051624096053,https://n.news.naver.com/mnews/article/052/0002323164?sid=100,"Thu, 05 Mar 2026 16:24:00 +0900"
정상순방,이 대통령이 '이란 공습'에 환율·금융·유가 살펴… 시장안정 100조원 ...,이 대통령은 지난 1~4일 싱가포르·필리핀 순방을 다녀왔다. 그럼에도 중동 상황이 엄중해 귀국 다음날 임시... 비정상이 발생할 때 교정하기 위한 것&quot;이라며 &quot;옛날에는 주식 가격을 떠받치기 위해서 억지로 (정부가) 주식을... ,http://www.metroseoul.co.kr/article/20260305500533,http://www.metroseoul.co.kr/article/20260305500533,"Thu, 05 Mar 2026 16:16:00 +0900"
정상순방,"캐나다, 트럼프와 관계 악화에...인도·일본 등 '미들파워' 결속 강화","카니 총리는 지난해 3월 취임 이후 처음으로 일본을 방문하는 것으로, 인도와 호주 등 아시아·태평양 국가 순방의 일환이다. 양국 정상은 무역의 다각화와 안보 협력 강화를 논의할 예정이다. 카니 총리의 이번 아시아... ",https://www.hankookilbo.com/news/article/A2026030509200003696?did=NA,https://n.news.naver.com/mnews/article/469/0000917724?sid=104,"Thu, 05 Mar 2026 15:05:00 +0900"
정상순방,"[김능구·차재원의 정국진단 3월①][전문] &quot;미-이란 전쟁, 이번 주말이 ...","이 부분과 관련해서는 정부가 비상이라고 생각하고, 지금 대통령 순방 중입니다만 오늘 오시나요? 내일... 4월 미중 정상회담 과정에서도 트럼프와 김정은의 정상회담 가능성이 높아진 걸로 이야기되고 그랬는데 미·이란... ",https://www.polinews.co.kr/news/articleView.html?idxno=724596,https://www.polinews.co.kr/news/articleView.html?idxno=724596,"Thu, 05 Mar 2026 14:09:00 +0900"
정상순방,싱가포르·필리핀 순방 후 귀국···경제 영토 확장,아세안(ASEAN·동남아시아국가연합) 핵심 국가인 두 나라 순방을 통해 한국의 경제 영토를 넓혔다는... 이들 두 국가에 국빈으로 초청받은 이 대통령은 정상회담을 계기로 한국의 경제 지평을 아세안으로 확장했습니다.... ,https://www.ktv.go.kr/content/view?content_id=749363,https://www.ktv.go.kr/content/view?content_id=749363,"Thu, 05 Mar 2026 13:50:00 +0900"
정상순방,"李대통령, 싱가포르·필리핀 순방 마무리... AI·원전·방산 협력 확대","아세안 순방을 통해 인공지능(AI), 원전, 방산 등 첨단 미래 산업 분야에서의 협력 관계를 대폭 강화하는 성과를 거두었다는 평가를 받고 있습니다. 싱가포르와의 정상회담에서는 자유무역협정(FTA) 개선 협상 개시에 대한... ",https://www.insight.co.kr/news/545409,https://www.insight.co.kr/news/545409,"Thu, 05 Mar 2026 12:54:00 +0900"
정상순방,"우원식 국회의장, 일본 중의원 의장 등과 한일 협력논의","축하하면서 &quot;양국 정상 간 셔틀 외교가 안정화되는데 기쁘게 생각하고, 이번... 이번 순방에는 문진석·박희승·전진숙·김동아 의원(더불어민주당), 이상휘 의원... ",http://www.breaknews.com/1189260,http://www.breaknews.com/1189260,"Thu, 05 Mar 2026 12:16:00 +0900"
정상순방,[단독] 선거구 손도 못댔는데…국민의힘 보이콧에 정개특위 ‘잠정 중단...,이 대통령은 필리핀 순방 중이라 청와대를 비운 상태였다. 정개특위는 ‘사법개혁 3법 유탄’을 맞았다.... 활동을 정상적으로 진행하기로 했다고 밝혔다. 유 수석부대표는 “지방선거 선거구 획정이라는 중대한 사안이... ,https://ilyo.co.kr/?ac=article_view&entry_id=509219,https://ilyo.co.kr/?ac=article_view&entry_id=509219,"Thu, 05 Mar 2026 11:30:00 +0900"
정상순방,"우원식 의장, 일 중·참의원 의장과 회동…“역사·경제·평화 세 기둥 ...","모리 에이스케 중의원 의장을 만난 우 의장은 지난달 중의원 의장 취임을 축하하며 &quot;양국 정상 간 셔틀외교가... 이번 순방에는 문진석, 박희승, 전진숙, 김동아, 이상휘 의원 등이 동행했다. 【 청년일보=김재두 기자 】... ",https://www.youthdaily.co.kr/news/article.html?no=214697,https://www.youthdaily.co.kr/news/article.html?no=214697,"Thu, 05 Mar 2026 11:00:00 +0900"
정상순방,[전격시사] 전현희 더불어민주당 의원 - “사법3법 국민기본권 보장…민...,그러나 지금 일부 의원들을 중심으로 조희대 사법부에 대한 불신과 그리고 또 심지어 국회에서 정상적인... 필리핀 순방 도중에 SNS를 통해서 ‘국민이 맡긴 수사기소권으로 누군가를 죽이고 빼앗고 감금하기 위해 하는 증거... ,https://news.kbs.co.kr/news/pc/view/view.do?ncd=8500103&ref=A,https://n.news.naver.com/mnews/article/056/0012135747?sid=100,"Thu, 05 Mar 2026 10:55:00 +0900"
정상순방,"우원식, '일본 의회' 지도부와 협력 강화 논의","역사 문제와 관련해선, 지난 1월 정상회담에서 합의한 조세이 탄광 유골 DNA 공동 감정을 언급하며 &quot;과거사... 열어 한인 사회의 애로사항을 청취하고 격려했다. 이번 순방에는 여야 의원과 외교특임대사 등이 동행했다.",https://www.gukjenews.com/news/articleView.html?idxno=3520451,https://www.gukjenews.com/news/articleView.html?idxno=3520451,"Thu, 05 Mar 2026 10:54:00 +0900"
정상순방,"우원식 의장, 日 중의원·참의원 의장 면담…한일 역사·경제·문화 논의","우 의장은 이날 모리 에이스케 중의원 의장과의 면담에서 지난달 중의원 의장 취임을 축하하며 &quot;양국 정상 간... 이번 순방에는 문진석·박희승·전진숙·김동아 의원(더불어민주당), 이상휘 의원(국민의힘), 조오섭... ",https://www.newspim.com/news/view/20260305000384,https://www.newspim.com/news/view/20260305000384,"Thu, 05 Mar 2026 10:39:00 +0900"
정상순방,조현 &quot;두바이에 '전세기' 투입 검토…바레인서도 추가 대피&quot;,한편 조 장관은 지난 1일부터 전날까지 이재명 대통령의 싱가포르·필리핀 순방에서 정상 수행했다. 이번 동남아시아 지역 정상회담 일정에 대해 조 장관은 &quot;싱가포르·필리핀과 전략적 동반자관계를 통해 우리 국익을... ,https://www.mt.co.kr/politics/2026/03/05/2026030509341727592,https://n.news.naver.com/mnews/article/008/0005325628?sid=100,"Thu, 05 Mar 2026 09:58:00 +0900"
정상순방,“헌신 덕에 오늘의 대한민국” 참전용사 만난 이 대통령…한·필 비즈...,필리핀 동포 간담회를 끝으로 3박 4일 동남아시아 순방 일정은 모두 마무리됐습니다. 특히 이 대통령은 이번 아세안 국가 정상과 회담에서 불안정한 국제 정세 속 평화 수호와 함께 동반자적 관계로 위기를 이겨나가자는데... ,https://news.kbs.co.kr/news/pc/view/view.do?ncd=8499911&ref=A,https://n.news.naver.com/mnews/article/056/0012135688?sid=100,"Thu, 05 Mar 2026 09:42:00 +0900"
정상순방,[정치쇼] 조현 &quot;이란 전쟁 관련 만반의 준비했다…李대통령 순방으로 A...,"대통령과 함께 순방길에 올랐던 분이지요. 조현 외교부 장관 모시고 국빈방문의 성과, 그리고 이란 사태... 그래서 사실은 정상회담 준비도 본인도 많이 하시고 그래서 정상회담장에서 늘 느끼는 것은 가슴 뿌듯한... ",https://news.sbs.co.kr/news/endPage.do?news_id=N1008464757&plink=ORI&cooper=NAVER,https://n.news.naver.com/mnews/article/055/0001337766?sid=100,"Thu, 05 Mar 2026 09:24:00 +0900"
정상순방,&quot;AI·원전 협력···아세안 경제 영토 확장&quot;,"불안한 국제 정세 속에서 아세안 국가들과의 협력 지평을 확장하는 데 공을 들였는데요, 정상외교 주요 성과... 이번 순방에서는 20년만에 싱가포르와 자유무역협정 FTA 개선하기로 했고, 필리핀과도 FTA가 확대되었습니다.... ",https://www.ktv.go.kr/content/view?content_id=749350,https://www.ktv.go.kr/content/view?content_id=749350,"Thu, 05 Mar 2026 09:00:00 +0900"
정상순방,"이 대통령, 싱-필리핀서 AI·원전 협력 성과…'경제 영토 확장' 거두고 ...","&quot; 이번 순방에서 이 대통령은 AI, 조선, 원전 등 미래 유망 분야에서 MOU를 체결하며 아세안 국가로 경제 영토를 확장했습니다. 또 정상들과 중동 등 불안한 국제정세 인식을 공유하며 위기 극복 의지를 다졌습니다.... ",http://www.mbn.co.kr/pages/news/newsView.php?news_seq_no=5179609,https://n.news.naver.com/mnews/article/057/0001938219?sid=100,"Thu, 05 Mar 2026 07:58:00 +0900"
