Keyword,Title,Description,Original Link,Link,Publication Date
수출입은행,대미투자기금 3조 원 한도…전담 투자공사 신설 방침,"기재부는 내년도 정부 예산안에 산업은행(6,300억 원)과 수출입은행(7,000억 원), 무역보험기금(5,700억 원) 각각 나눠 편성된 예산을 신설되는 기금으로 끌어모으기로 했습니다. 이렇게 정부 예산을 1조 9천억 원 투입하고... ",https://news.kbs.co.kr/news/pc/view/view.do?ncd=8410589&ref=A,https://n.news.naver.com/mnews/article/056/0012068673?sid=101,"Tue, 18 Nov 2025 18:08:00 +0900"
수출입은행,[강윤경 칼럼] 산업은행 부산 이전을 다시 생각한다,"2010년 12월 부산서 열린 ‘금융중심지 활성화 정책간담회’에서 국책은행인 산은과 수출입은행의 부산 이전 논의가 공식화한다. 진동수 금융위원장, 허태열 정무위원장, 한나라당 서병수 최고위원을 비롯해 정부와 금융... ",https://www.busan.com/view/busan/view.php?code=2025111817563626825,https://n.news.naver.com/mnews/article/082/0001354297?sid=110,"Tue, 18 Nov 2025 18:04:00 +0900"
수출입은행,"한국해사포럼, '포트 프리와 탈탄소 정책' 관련 공개포럼 개최","발표 이후에는 한국해사포럼 윤민현 명예회장이 좌장을 맡아 현대글로비스, 팬오션, 한국수출입은행 관계자들과 함께 종합 토론을 진행한다. 이들은 △친환경 선박 도입 전략(LNG·메탄올·암모니아), △탄소 비용... ",https://www.klnews.co.kr/news/articleView.html?idxno=318808,https://www.klnews.co.kr/news/articleView.html?idxno=318808,"Tue, 18 Nov 2025 18:00:00 +0900"
산업은행,"박상신 DL이앤씨 대표, 필리핀 대통령 만나 에너지 협력 논의 [건설오늘...","이번 거래는 BNP 파리바, 크레디 아크리골, 도이치뱅크, HSBC, 한국산업은행(KDB)가 주관했다. 이번 유로화 공모채권 발행은 LH 통합 이래 최초로 진행된 것으로 앞서 지난 5월 진행됐던 5억달러(약 6936억원) 공모채 발행에... ",http://www.sisaon.co.kr/news/articleView.html?idxno=177641,http://www.sisaon.co.kr/news/articleView.html?idxno=177641,"Wed, 19 Nov 2025 13:40:00 +0900"
산업은행,“오픈뱅킹이 뭐여?” 시니어들 위해 빗장 푼다... 영업점서도 타행계좌...,한국산업은행 수협은행 제주은행은 내년 상반기부터 실시 예정이다. 마이데이터 서비스는 KB국민은행 신한은행 하나은행 우리은행 NH농협은행 IBK기업은행 광주은행 전북은행 8곳에서 현재 이용 가능하다. 서비스 가입을... ,https://www.mk.co.kr/article/11471895,https://n.news.naver.com/mnews/article/009/0005592644?sid=101,"Wed, 19 Nov 2025 13:36:00 +0900"
산업은행,"LH, 5억 유로화 공모채권 최초 발행","이번 거래는 BNP Paribas, Credit Agricole, Deutsche Bank, HSBC, KDB(한국산업은행)가 주관했다. 이번 유로화 공모채권 발행은 LH 통합 이래 최초로 진행된 것으로, 앞서 5월 진행됐던 5억 미달러화(약 6,936억원) 공모채... ",https://www.joongangenews.com/news/articleView.html?idxno=466812,https://www.joongangenews.com/news/articleView.html?idxno=466812,"Wed, 19 Nov 2025 13:36:00 +0900"
산업은행,"신용보증기금, 금융위원회 공공기관 2025년 11월 브랜드평판 1위 기록","2025년 11월 금융위원회 공공기관 브랜드평판 순위는 신용보증기금, 서민금융진흥원, 한국주택금융공사, 한국자산관리공사, 중소기업은행, 예금보험공사, 한국산업은행 순이었다. ​금융위원회... ",https://www.energy-news.co.kr/news/articleView.html?idxno=220003,https://www.energy-news.co.kr/news/articleView.html?idxno=220003,"Wed, 19 Nov 2025 13:34:00 +0900"
산업은행,박상진 산은 회장 “韓 진짜 성장 위해 모든 역량 집중”,박상진 한국산업은행 회장이 &quot;시대적 과제 속에서 산업 혁신과 기업 성장을 뒷받침할 수 있도록 모든 역량을 집중하겠다&quot;고 밝혔다. 박 회장은 19일 오후 서울 콘래드 호텔에서 열린 '2025 넥스트 100 포럼'에서 개회사를... ,https://view.asiae.co.kr/article/2025111913342869278,https://n.news.naver.com/mnews/article/277/0005681643?sid=101,"Wed, 19 Nov 2025 13:34:00 +0900"
산업은행,"신용보증기금, 금융위원회 공공기관 2025년 11월 브랜드평판 1위","2025년 11월 금융위원회 공공기관 브랜드평판 순위는 신용보증기금, 서민금융진흥원, 한국주택금융공사, 한국자산관리공사, 중소기업은행, 예금보험공사, 한국산업은행 순이었다. ​금융위원회... ",https://www.thefairnews.co.kr/news/articleView.html?idxno=60893,https://www.thefairnews.co.kr/news/articleView.html?idxno=60893,"Wed, 19 Nov 2025 13:32:00 +0900"
산업은행,"금감원, 국민은행 진출 해외 금융감독당국과 협의체 개최","금감원은 한국 은행산업과 은행규제 현황, 최근 한국 금융감독의 주요 이슈, 국민은행 감독·검사 이슈 등을 설명할 예정이다. 금감원 박충현 부원장보는 &quot;최근 가상자산 확산, 금융의 디지털화 및 AI 도입·활용, 무역... ",https://news.tvchosun.com/site/data/html_dir/2025/11/19/2025111990131.html,https://n.news.naver.com/mnews/article/448/0000571625?sid=101,"Wed, 19 Nov 2025 13:31:00 +0900"
산업은행,"[이슈] 韓, 론스타 4천억 규모 소송 완승 '배상금 0원'·'소송비용 73억...",당시 은행법상 산업자본은 국내 은행을 인수할 수 없었는데 론스타는 일본에 골프장과 예식장 등 산업자본 계열회사를 보유하고 있었던 것이다. 그럼에도 금융당국은 외환은행 자기자본비율(BIS)이 8% 밑으로 떨어져... ,https://www.polinews.co.kr/news/articleView.html?idxno=714205,https://www.polinews.co.kr/news/articleView.html?idxno=714205,"Wed, 19 Nov 2025 13:26:00 +0900"
산업은행,"정기적금 2025년 11월 브랜드평판...SBI저축은행, 아이엠뱅크, 신한은행...","씨티은행, 산업은행, 스마트저축은행, 고려저축은행, 제주은행, NH저축은행, 페퍼저축은행, 모아저축은행, 한국투자저축은행, IBK저축은행, 우리금융저축은행 정기적금 순으로 나타났다. 정기적금... ",https://www.energy-news.co.kr/news/articleView.html?idxno=219999,https://www.energy-news.co.kr/news/articleView.html?idxno=219999,"Wed, 19 Nov 2025 13:20:00 +0900"
산업은행,"정기적금 2025년 11월 브랜드평판... 1위 SBI저축은행, 2위 아이엠뱅크,...","씨티은행, 산업은행, 스마트저축은행, 고려저축은행, 제주은행, NH저축은행, 페퍼저축은행, 모아저축은행, 한국투자저축은행, IBK저축은행, 우리금융저축은행 정기적금 순으로 나타났다. 정기적금... ",https://www.thefairnews.co.kr/news/articleView.html?idxno=60887,https://www.thefairnews.co.kr/news/articleView.html?idxno=60887,"Wed, 19 Nov 2025 13:18:00 +0900"
산업은행,‘배상금 0원’ 13년 론스타 분쟁 마감,당시 은행법상 산업자본은 국내 은행을 인수할 수 없도록 했는데 론스타는 일본에 골프장과 예식장 등 산업자본 계열사를 보유하고 있었다. 그럼에도 금융당국이 은행법 시행령의 ‘부실 금융기관의 정리 등 특별한... ,https://www.naeil.com/news/read/568104?ref=naver,https://www.naeil.com/news/read/568104?ref=naver,"Wed, 19 Nov 2025 13:08:00 +0900"
산업은행,"LH, 5억 유로화 공모채권 최초 발행",이번 거래는 BNP파리바 크레디트아그리콜 도이치방크 HSBC 한국산업은행이 주관했다. 이번 유로화 공모채권 발행은 LH 통합 이래 최초로 진행된 것으로 앞서 5월 진행됐던 5억 미달러화(약 6936억원) 공모채 발행에... ,https://www.naeil.com/news/read/568045?ref=naver,https://www.naeil.com/news/read/568045?ref=naver,"Wed, 19 Nov 2025 13:04:00 +0900"
산업은행,은행 창구 한 곳에서 여러 은행 계좌 관리 가능해져…금융자산도 통합 ...,다만 수협은행·산업은행·제주은행은 내년 상반기에 실시될 예정이다. 오프라인 마이데이터 서비스는 이날 전국 8개 은행(마이데이터 사업자) 영업점에서 대면 방식으로 제공된다. 이용 가능한 은행은 농협은행... ,https://www.naeil.com/news/read/568039?ref=naver,https://www.naeil.com/news/read/568039?ref=naver,"Wed, 19 Nov 2025 13:02:00 +0900"
산업은행,"LH, 5억 유로화(약 8,493억원) 공모채권 최초 발행","이번 거래는 BNP Paribas, Credit Agricole, Deutsche Bank, HSBC, KDB(한국산업은행)가 주관했다. 이번 유로화 공모채권 발행은 LH 통합 이래 최초로 진행된 것으로, 앞서 5월 진행됐던 5억 미달러화(약 6,936억원) 공모채... ",https://www.pressman.kr/news/articleView.html?idxno=96432,https://www.pressman.kr/news/articleView.html?idxno=96432,"Wed, 19 Nov 2025 12:42:00 +0900"
산업은행,수출입은행 20년 규제 풀릴까…'대출 없이도 직접 투자' 국회 소위 통과,"최병권 기재위 수석전문위원은 검토보고서에서 &quot;무분별한 업무 확장 우려가 있다&quot;며 &quot;산업은행, 기업은행 등과 역할이 중복될 수 있다&quot;고 지적했다. 개정안에 포함된 '수익성 확보가 확실한 경우'라는 기준이 모호해... ",https://www.etoday.co.kr/news/view/2527286,https://www.etoday.co.kr/news/view/2527286,"Wed, 19 Nov 2025 12:36:00 +0900"
산업은행,"레몬헬스케어, 4년 만에 코스닥 상장 재도전","한편, 주요 재무적 투자자로는 한화자산운용의 스마트헬스케어 펀드를 비롯해 한국투자프라이빗에쿼티(한투PE), 미래에셋캐피탈, 기술보증기금, 신한은행, KDB산업은행, 네이버펀드 등이 있다. 회사는 2018년 이후 세... ",https://www.dailymedi.com/news/news_view.php?wr_id=931128,https://www.dailymedi.com/news/news_view.php?wr_id=931128,"Wed, 19 Nov 2025 12:22:00 +0900"
산업은행,"LH, 5억 유로 '유로화 공모채' 첫 발행…한화 8493억원 조달","이번 딜에는 BNP파리바, 크레디 아그리콜, 도이치뱅크, HSBC, 한국산업은행(KDB)이 공동 주관사로 참여했다. 유로화 공모채 발행은 LH가 통합 공사로 출범한 이후 이번이 처음이다. 해외 공모 조달로는 지난 5월 5억... ",https://www.ebn.co.kr/news/articleView.html?idxno=1687406,https://www.ebn.co.kr/news/articleView.html?idxno=1687406,"Wed, 19 Nov 2025 12:14:00 +0900"
산업은행,‘먹튀’ 론스타에 4천억원 안 줘도 된다... 한국 정부 13년만에 승소,"은행법상 산업자본이 국내은행을 인수할 수 없었는데, 당시 론스타는 일본에 골프장과 예식장 등 산업자본 계열회사를 보유하고 있었다. 하지만 금융당국은 2003년 외환은행 자기자본비율(BIS)이 8 밑으로 떨어져... ",https://vop.co.kr/A00001683098.html,https://vop.co.kr/A00001683098.html,"Wed, 19 Nov 2025 12:12:00 +0900"
산업은행,"[직격인터뷰] 최진철 시아스 회장 “정체기 맞은 K-푸드, 컨테이너에 실...","수출입은행, 무역보험공사, 산업은행 어디에도 ‘글로벌 로컬 식품 펀드’ 같은 건 없습니다. 해외 공장을 지으면 당연히 정책금융이 따라올 거로 생각하는데, 현실은 정반대예요.” 실제 사례를 들려준다. “프랑스... ",https://www.mk.co.kr/article/11471832,https://n.news.naver.com/mnews/article/009/0005592598?sid=004,"Wed, 19 Nov 2025 12:06:00 +0900"
산업은행,은행 영업점에서 타행 계좌 조회·이체 … 오픈뱅킹 오프라인 전면 확대,"수협은행, 산업은행, 제주은행은 2026년 상반기부터 참여할 예정이다. 이용 대상은 만 19세 이상 개인 고객이다. 신분증을 지참해 은행 영업점을 방문한 뒤 창구 직원 안내에 따라 오프라인 오픈뱅킹 또는 마이데이터... ",https://biz.newdaily.co.kr/site/data/html/2025/11/19/2025111900188.html,https://biz.newdaily.co.kr/site/data/html/2025/11/19/2025111900188.html,"Wed, 19 Nov 2025 12:02:00 +0900"
산업은행,은행 창구서 타행 계좌 조회·이체 가능… 앱으로만 하던 오픈뱅킹 오프...,"전국 11개 은행(KB국민·신한·하나·우리·NH농협·IBK기업·부산·광주·전북·경남은행, 아이엠뱅크) 영업점에서는 이날부터 서비스가 개시되며, 수협·산업·제주은행은 내년 상반기부터 서비스를 시행한다. 권대영 금융위... ",https://www.munhwa.com/article/11547977?ref=naver,https://n.news.naver.com/mnews/article/021/0002751106?sid=105,"Wed, 19 Nov 2025 11:51:00 +0900"
산업은행,"'디지털 소외' 노년층, 은행 뺑뺑이 끝난다…오픈뱅킹·마이데이터, 영...",수협·산업·제주은행은 2026년 상반기에 합류할 예정이다. 특히 주목할 점은 '자금 채우기(이체)' 기능이다. 고객은 방문한 은행 창구에서 다른 은행에 있는 자금을 끌어와 예·적금에 가입하거나 송금할 수 있다. 다만... ,https://www.imaeil.com/page/view/2025111911443946766,https://n.news.naver.com/mnews/article/088/0000982144?sid=101,"Wed, 19 Nov 2025 11:46:00 +0900"
산업은행,"'11번가 우려 해소' H&amp;Q, 7000억 블라인드펀드 결성 순항","내년 상반기에 산재보험기금, 산업은행 등도 출자사업이 예정돼 있고, 올해 출자사업을 중단한 국민연금도 내년에 출자사업을 재개하면 목표액인 6000~7000억 원 결성에 무리는 없을 전망이다.",https://www.etoday.co.kr/news/view/2527220,https://www.etoday.co.kr/news/view/2527220,"Wed, 19 Nov 2025 11:46:00 +0900"
산업은행,"LH, 5억 유로화 공모채권 첫 발행 … &quot;공공임대 건설에 활용&quot;","이번 거래는 BNP 파리바, 크레디 아그리콜, 도이치뱅크, HSBC, KDB한국산업은행이 주관했다. 이번 유로화 공모채권 발행은 LH 통합 이래 최초로 진행된 것으로, 앞서 5월 진행됐던 5억달러(약 6936억원) 공모채 발행에... ",https://biz.newdaily.co.kr/site/data/html/2025/11/19/2025111900179.html,https://biz.newdaily.co.kr/site/data/html/2025/11/19/2025111900179.html,"Wed, 19 Nov 2025 11:42:00 +0900"
산업은행,해양수산부 부산 시대 눈앞에…진행 상황과 향후 과제는?,"대표적인 사례가 바로 HMM 부산 이전인데요, HMM은 산업은행과 한국해양진흥공사가 가장 많은 지분을 보유한 우리나라 최대의 해운 업쳅니다. 전 세계에서도 7, 8위 정도 하는 글로벌 기업입니다. 이 HMM이 부산에 오게 되면... ",https://www.nocutnews.co.kr/news/6430779?utm_source=naver&utm_medium=article&utm_campaign=20251119113858,https://n.news.naver.com/mnews/article/079/0004087546?sid=102,"Wed, 19 Nov 2025 11:39:00 +0900"
산업은행,"오픈뱅킹·마이데이터, 은행 영업점으로 확장","수협·산업·제주은행은 내년 상반기 도입을 목표로 시스템을 구축 중이다. 이용을 원하는 고객은 신분증을 지참해 가까운 은행 영업점을 방문한 뒤, 직원 안내에 따라 약관 동의를 거쳐 다른 은행의 본인계좌를... ",https://m.skyedaily.com/news_view.html?ID=291042,https://m.skyedaily.com/news_view.html?ID=291042,"Wed, 19 Nov 2025 11:38:00 +0900"
산업은행,"LH, 유럽 시장서 첫 채권 발행…공공사업 자금 확보","이번 거래는 BNP파리바, 크레디트 아그리꼴, 도이치뱅크, HSBC, 한국산업은행이 공동 주관했다. LH는 &quot;2013년 이후 한국계 비정책 금융기관의 유로화 공모 발행이 없었던 만큼 우량 해외 투자자 확보를 위해 적극적인... ",http://www.whitepaper.co.kr/news/articleView.html?idxno=254712,http://www.whitepaper.co.kr/news/articleView.html?idxno=254712,"Wed, 19 Nov 2025 11:34:00 +0900"
산업은행,'축구장 27개 크기' 천안 물류센터 화재…금융권 영향은,군인공제회·사학연금 등 주요 주주…산업은행·신한은행은 채권단 &quot;재보험사 손실 가능성 높아&quot; 지난 15일 화재가 발생한 충남 천안시 이랜드월드 물류센터 (서울=연합인포맥스) 서영태 기자 = 충청남도 천안에 있는... ,https://news.einfomax.co.kr/news/articleView.html?idxno=4384645,https://news.einfomax.co.kr/news/articleView.html?idxno=4384645,"Wed, 19 Nov 2025 11:34:00 +0900"
산업은행,[자본시장 사건파일] '롯데 신동주 불법자문' 민유성 전 산업은행장 항...,자본시장 사건파일 롯데그룹 경영권 분쟁 과정에서 변호사 자격도 없이 법률자문을 한 혐의를 받는 민유성 전 산업은행장에 대한 항소심 선고가 다음 달 진행된다. 앞서 1심에서 민 전 행장은 징역 3년을 선고받았다.... ,https://www.bloter.net/news/articleView.html?idxno=647829,https://n.news.naver.com/mnews/article/293/0000075255?sid=101,"Wed, 19 Nov 2025 11:33:00 +0900"
산업은행,"LH, 8500억 ‘유로화 공모채권’ 첫 발행","이번 거래는 비엔피 파리바, 크레디트아그리콜, 도이치뱅크, HSBC, 한국산업은행이 주관했다. 이번 유로화 공모채권 발행은 LH 통합 이래 최초로 진행된 것으로, 앞서 5월 진행됐던 5억 미달러화(약 6936억원) 공모채... ",https://biz.heraldcorp.com/article/10619234?ref=naver,https://n.news.naver.com/mnews/article/016/0002559992?sid=101,"Wed, 19 Nov 2025 11:32:00 +0900"
산업은행,"외환은행 매각의 저주… 22년 론스타 악몽, 한국 금융지형 바꿨다",'부실은행 정리' 명목으로 산업자본의 은행 지배를 넓게 인정하던 관행도 사라졌다. 정부 차원의 ISDS 대응 역량도 한층 강화됐다. 론스타는 외국계 기업이 한국 정부를 상대로 제기한 첫 ISDS 사례였다. 법무부를... ,https://www.hankookilbo.com/News/Read/A2025111818540004551?did=NA,https://n.news.naver.com/mnews/article/469/0000898366?sid=101,"Wed, 19 Nov 2025 11:31:00 +0900"
산업은행,"오픈뱅킹·마이데이터, 비대면 넘어 영업점으로…&quot;하이브리드 채널 완성...","수협은행, 산업은행, 제주은행은 내년도 상반기 서비스를 도입한다. 마이데이터 서비스는 마이데이터사업자인 농협은행, 신한은행, 우리은행, 하나은행, 국민은행, 광주은행, 전북은행, 기업은행에서 이용할 수 있다.... ",https://www.news1.kr/finance/general-finance/5981090,https://n.news.naver.com/mnews/article/421/0008613154?sid=101,"Wed, 19 Nov 2025 11:27:00 +0900"
산업은행,"한국토지주택공사, 5억 유로화 공모 채권 최초 발행","이번 거래는 BNP Paribas, Credit Agricole, Deutsche Bank, HSBC, KDB(한국산업은행)가 주관했다. 이번 유로화 공모채권 발행은 LH 통합 이래 최초로 진행된 것으로, 앞서 5월 진행했던 5억 미달러화(약 6936억원) 공모채 발행에... ",http://www.newsprime.co.kr/news/article.html?no=712464,http://www.newsprime.co.kr/news/article.html?no=712464,"Wed, 19 Nov 2025 11:26:00 +0900"
산업은행,"[사설] ‘론스타에 승소’, 낯뜨거운 전·현 정부 치적 싸움","이 과정에서 론스타가 산업자본 은행소유 금지, 국제결제은행 기준 자기자본비율(BIS) 등 자격조건을 만족했는지가 문제가 됐다. 결정적인 것은 ‘헐값 매각’ 의혹이었다. 외환카드 주가조작 혐의는 유죄판결이 났다.... ",https://biz.heraldcorp.com/article/10619204?ref=naver,https://n.news.naver.com/mnews/article/016/0002559967?sid=110,"Wed, 19 Nov 2025 11:24:00 +0900"
산업은행,"LH, 5억 유로 규모 유로화 표시 채권 첫 발행","이번 거래는 BNP 파리바, 크레디 아크리골, 도이치뱅크, HSBC, KDB(한국산업은행)가 주관했다. LH 통합 이후 최초로 진행된 유로화 공모채권 발행으로 5월 진행한 5억 달러(6936억 원) 공모채 발행에 이은 두 번째... ",https://ilyo.co.kr/?ac=article_view&entry_id=503443,https://ilyo.co.kr/?ac=article_view&entry_id=503443,"Wed, 19 Nov 2025 11:22:00 +0900"
산업은행,[1.5℃ HOW] &quot;청정에너지 공적금융 확대 시 고용 최대 11만개 가능&quot;,"보고서에서 다루고 있는 주요 공적 금융 기관은 한국수출입은행, 한국무역보험공사, 한국산업은행 등으로 2020~2024년 이들 기관의 에너지 부문 지원 총액은 61.3조원이며 이중 74.5%가 화석연료 부문에 투입된 것으로... ",http://www.hansbiz.co.kr/news/articleView.html?idxno=792830,http://www.hansbiz.co.kr/news/articleView.html?idxno=792830,"Wed, 19 Nov 2025 11:16:00 +0900"
산업은행,국민성장펀드 출범 초읽기… 문화·콘텐츠까지 지원확대,산은법 시행령 국무회의 통과… 첨단기금 지원산업·심의회 구성 확정 연말 출범을 앞둔 ‘국민성장펀드’의 핵심 기반인 '한국산업은행법 시행령' 개정안이 지난 18일 국무회의에서 의결됐다. 금융위원회는 이번 개정을... ,http://www.mhj21.com/170663,http://www.mhj21.com/170663,"Wed, 19 Nov 2025 11:14:00 +0900"
산업은행,"정부, 론스타에 완승…4000억 배상금 ‘0원’으로 소멸","당시 은행법에선 산업자본의 국내 은행 인수를 금지하고 있었는데, 금융당국이 시행령의 ‘부실 금융기관의 정리 등 특별한 사유’를 인정해 론스타의 외환은행 인수를 승인했다. 이 과정에서 론스타가 외환은행을... ",https://www.mk.co.kr/article/11471796,https://n.news.naver.com/mnews/article/024/0000101424?sid=102,"Wed, 19 Nov 2025 11:10:00 +0900"
산업은행,"&quot;국제 정합성 있는 기후공시 제도 논의&quot;... 박상혁, 아시아 기후금융 활...",해당 세션의 토론은 정수종 서울대학교 환경대학원 교수의 진행으로 ▲김경민 한국산업은행 ESG센터 센터장 ▲나승호 한국은행 지속가능성장실 실장 ▲박재홍 EY한영회계법인 ESG 임팩트 허브 총괄리더 ▲장민희... ,https://www.tournews21.com/news/articleView.html?idxno=121108,https://www.tournews21.com/news/articleView.html?idxno=121108,"Wed, 19 Nov 2025 11:08:00 +0900"
산업은행,"LH, 8500억원 규모 유로화 공모 채권 최초 발행","거래는 BNP파리바, 크레디트 아그리꼴, 도이치뱅크, HSBC, 한국산업은행(KDB)이 주관했다. 이번 유로화 공모 채권 발행은 LH 통합 이래 최초다. 올해 해외 공모채 발행은 지난 5월 진행된 5억달러(약 7000억원)에 이어 두... ",https://www.newsquest.co.kr/news/articleView.html?idxno=256831,https://www.newsquest.co.kr/news/articleView.html?idxno=256831,"Wed, 19 Nov 2025 11:08:00 +0900"
산업은행,배당은 '아직' 오버행 '여전'…속 타는 금호타이어 주주들,"평균 처분단가는 각각 5042원, 5022원, 5065원 수준이다.앞서 우리은행과 산업은행을 비롯한 채권단은 금호타이어의 기업회생 과정에서 주당 5000원에 6636만8844주(23.1%)를 출자전환 했다. 이후 지난해 7월 6일 대주주인... ",https://news.mtn.co.kr/news-detail/2025111910573182255,https://news.mtn.co.kr/news-detail/2025111910573182255,"Wed, 19 Nov 2025 11:06:00 +0900"
산업은행,"한국토지주택공사(LH), 5억 유로화 규모 채권 발행","이번 거래는 BNP 파리바, 크레디 아크리골, 도이치뱅크, HSBC, KDB(한국산업은행)가 주관했다. 이번 유로화 공모채권 발행은 LH 통합 이래 최초로 진행된 것이다. 앞서 5월 진행됐던 5억 미 달러화(약 6936억원) 공모채... ",https://biz.chosun.com/real_estate/real_estate_general/2025/11/19/Q4XXGVAAZ5GCVKU6PHMAQCFM2E/?utm_source=naver&utm_medium=original&utm_campaign=biz,https://n.news.naver.com/mnews/article/366/0001124174?sid=101,"Wed, 19 Nov 2025 11:04:00 +0900"
산업은행,"금감원, 국민은행 진출 4개국 해외 감독당국자 초청 회의","금감원은 한국 은행 산업 및 규제 현황, 국민은행 감독 관련 이슈 등을 소개할 예정이다. 국민은행도 주요 경영현황과 글로벌 영업 전략, 리스크 관리 방안 등을 공유한다. 금감원은 “해외진출을 확대하고 있는... ",https://www.dt.co.kr/article/12030198?ref=naver,https://n.news.naver.com/mnews/article/029/0002994423?sid=101,"Wed, 19 Nov 2025 11:01:00 +0900"
산업은행,"韓, 먹튀논란 론스타에 배상금 '4천억→0원'...13년간 분쟁 압승 배경은",당시 은행법은 산업자본의 국내 은행 인수를 금지하고 있었다. 하지만 금융당국이 시행령의 '부실 금융기관의 정리 등 특별한 사유'를 인정해 론스타의 외환은행 인수를 승인했다. 시민단체인 투기자본감시센터는... ,http://www.opinionnews.co.kr/news/articleView.html?idxno=127896,http://www.opinionnews.co.kr/news/articleView.html?idxno=127896,"Wed, 19 Nov 2025 11:00:00 +0900"
산업은행,벌써 10배 수익 잭팟...8600억 에이티넘 벤처펀드 소진율 50% 눈앞,"해당 펀드에는 국민연금공단, 한국산업은행, 중소기업은행, 한국교직원공제회 등 27개 기관이 출자자로 참여했다. 에이티넘인베스트먼트는 부문별 대표 체제를 통해 투자 속도를 높이고 있다. 펀드 결성과 동시에... ",https://www.mt.co.kr/future/2025/11/19/2025111814203192492,https://n.news.naver.com/mnews/article/008/0005280268?sid=101,"Wed, 19 Nov 2025 11:00:00 +0900"
