Keyword,Title,Description,Original Link,Link,Publication Date
정태호,"김민주 민주당 부대변인, 출판기념회 '압도적인 민주, 시민주권 오산' ...",이인영·신정훈·박주민·맹성규·김영호·박찬대·박정·서영교·박수현·김병주·문진석·한준호·장경태·이용선·김영배·정태호·김한규·장철민·전용기 등 국회의원 35명이 영상으로 김 부대변인의 출판을 축하했다.... ,https://www.thereport.co.kr/news/articleView.html?idxno=80160,https://www.thereport.co.kr/news/articleView.html?idxno=80160,"Mon, 08 Dec 2025 14:36:00 +0900"
정태호,"김민주 부대변인, 오산 출판기념회 1000명 운집…민주당 핵심인사 총집...",축하 영상에는 이인영·신정훈·박주민·맹성규·김영호·박찬대·박정·서영교·박수현·김병주·문진석·한준호·장경태·이용선·김영배·정태호·김한규·장철민·전용기 등 총 35명의 국회의원이 참여했다. 기초단체장... ,https://www.etoday.co.kr/news/view/2533777,https://www.etoday.co.kr/news/view/2533777,"Mon, 08 Dec 2025 12:48:00 +0900"
정태호,[PICK! 이 안건] 정태호 등 15인 &quot;에너지 정책 수립과정에서의 주민 참여...,"더불어민주당 정태호 의원 등 15인이 '에너지법 일부개정법률안'을 제안했다. 정 의원 등은 제안이유에 대해... 더불어민주당 정태호, 권칠승, 김문수, 김윤, 김태선, 진성준, 김영환, 황명선, 김주영, 조정식, 이학영, 홍기원... ",https://www.jeonmae.co.kr/news/articleView.html?idxno=1209668,https://www.jeonmae.co.kr/news/articleView.html?idxno=1209668,"Mon, 08 Dec 2025 11:50:00 +0900"
정태호,[PICK! 이 안건] 진성준 등 10인 &quot;국가와 지방자치단체가 전동휠체어 및...,"더불어민주당 진성준, 임오경, 김교흥, 강준현, 황명선, 안호영, 정태호, 위성곤, 이학영, 정일영 의원이다. 한편 해당 안건은 국회입법예고 홈페이지에서 해당 안건 검색 후 의견을 작성할 수 있다. [전국매일신문]... ",https://www.jeonmae.co.kr/news/articleView.html?idxno=1209177,https://www.jeonmae.co.kr/news/articleView.html?idxno=1209177,"Mon, 08 Dec 2025 08:00:00 +0900"
정태호,"김영희, 정태호 위해 이벤트 속옷도 준비했는데.. 딸 손유담 등장에 혼...",'뜨거운 부부' 정태호를 향한 김영희의 깜짝 이벤트가 손유담의 등장으로 무산됐다. 무슨 사연일까. 7일 KBS 2TV '개그콘서트'에서 정태호 김영희가 메인으로 나선 '뜨거운 부부' 코너가 펼쳐졌다. 이날 정태호는 &quot;집에 아무도... ,https://www.tvreport.co.kr/breaking/article/970006/,https://m.entertain.naver.com/article/213/0001364583,"Sun, 07 Dec 2025 23:27:00 +0900"
기재부,"기재부, 11일 대통령 업무보고…외환 안정 대책·금산분리 완화 주목","8일 관계부처에 따르면 기재부는 11일 이재명 대통령에게 내년도 정책 방향을 보고한다. 기재부를 시작으로 주요 경제부처의 업무보고가 순차적으로 진행되며, 이번 보고는 국무회의처럼 생중계 형식으로 국민에게... ",https://www.newsis.com/view/NISX20251208_0003432846,https://n.news.naver.com/mnews/article/003/0013645802?sid=101,"Mon, 08 Dec 2025 16:38:00 +0900"
기재부,[D리포트] &quot;지역 주느니 은행 예치&quot; 지역 방송 예산 삭감에 '홀대' 반발,"기재부가 기금 수지가 좋지 않다며 반대하고, 예산은 은행에 넣어두기로 했습니다. [황현구 지역민방협회... [이훈기 의원/국회 과학기술정보방송통신위원회 : 우리가 아직도 기재부 국가가 아닙니다. 이제는 이재명 정부의... ",https://news.sbs.co.kr/news/endPage.do?news_id=N1008360362&plink=ORI&cooper=NAVER,https://n.news.naver.com/mnews/article/055/0001314290?sid=102,"Mon, 08 Dec 2025 16:35:00 +0900"
기재부,백령공항 개항 지연 우려에 주변지역 개발 계획 대폭 축소,이에 기재부는 한국개발연구원(KDI)에 의뢰해 현재 타당성 재조사를 진행 중이다. 타당성 재조사는 1000억원 이상의 재정사업이 예타 조사 결과 대비 총사업비가 15% 이상 늘어나면 수반되는 절차다. 그런데 타당성... ,https://www.incheontoday.com/news/articleView.html?idxno=312003,https://www.incheontoday.com/news/articleView.html?idxno=312003,"Mon, 08 Dec 2025 16:24:00 +0900"
기재부,"여성농민 숙원 '여성농민정책과', 기재부가 훼방","받았지만 기재부의 벽에 가로막힌 상태다. 정부직제상 과 승격을 위해선 현재 5명인 농촌여성정책팀 인원을 최소 7명으로 늘려야 하는데, 기재부가 증원을 1명으로 제한했다는 것이다. 정규조직인 과는 한시조직인 팀에... ",http://www.ikpnews.net/news/articleView.html?idxno=68986,http://www.ikpnews.net/news/articleView.html?idxno=68986,"Mon, 08 Dec 2025 16:24:00 +0900"
기재부,"NXC, 1512억 규모 자사주 소각…기재부 포함 전 주주 참여",넥슨 그룹의 지주회사인 NXC가 주주가치 제고와 주주들의 자산 유동화 기회 제공을 위해 1천500억 원 규모의 자사주를 매입해 소각한다. NXC는 8일 공시를 통해 배당가능이익을 재원으로 보통주 2만 5천997주를 장외... ,https://www.inven.co.kr/webzine/news/?news=311936,https://m.sports.naver.com/esports/article/442/0000188098,"Mon, 08 Dec 2025 16:17:00 +0900"
기재부,KTX·SRT 내년 3월 교차운행…통합 본격화,"윤진환 국토부 철도국장은 “오늘 설명드린 로드맵의 기재부 심의·의결을 거치고, 이후에는 철도산업발전계획을 변경해 기존 경쟁체제에서 통합체제로 수정할 예정이다. 통합추진위원회와 추진단의 실무 조정을... ",https://www.ekn.kr/web/view.php?key=20251208025415760,https://www.ekn.kr/web/view.php?key=20251208025415760,"Mon, 08 Dec 2025 16:16:00 +0900"
기재부,"강원도, 기재부에 용문~홍천 광역철도 예타 통과 촉구",없었던 홍천의 교통복지가 개선되고 지역 균형 발전도 촉진될 것으로 기대됩니다. 김진태 지사는 다음 주 개최되는기재부 SOC 분과위원회에도 참석해용문~홍천 광역철도의 필요성과 도민의 염원을 전달할 예정입니다.,https://chmbc.co.kr/article/WUPNKrXYP_Mgk,https://chmbc.co.kr/article/WUPNKrXYP_Mgk,"Mon, 08 Dec 2025 16:16:00 +0900"
기재부,"&quot;행정 멈추니 미래 멈춰&quot;…김포 시민들, 5호선 연장 지연에 '불만 확산'",김포검단시민연대 등의 시민단체는 이날 세종 기획재정부 청사 앞에서 공동집회를 열고 &quot;KDI 신속예타와 기재부 발표가 멈춘 만큼 김포의 미래도 멈췄다&quot;며 정부의 즉각적인 행정 조치를 요구했다. 김포시민들은 5호선... ,https://www.mt.co.kr/policy/2025/12/08/2025120814463914421,https://n.news.naver.com/mnews/article/008/0005288879?sid=102,"Mon, 08 Dec 2025 16:16:00 +0900"
기재부,김포 5호선 연장·콤팩트시티 지연 장기화…시민 불만 고조,"김포검단시민연대, 김포신도시주민대책위원회, 양촌대책위원회, 연합비상대책위원회 등 시민단체 4곳은 이날 기획재정부 앞에서 집회를 열고 “정부가 발표한 5호선 연장 계획이 사실상 중단됐다”며 “기재부와... ",https://www.kmib.co.kr/article/view.asp?arcid=0029084279&code=61122013&cp=nv,https://n.news.naver.com/mnews/article/005/0001819119?sid=102,"Mon, 08 Dec 2025 16:13:00 +0900"
기재부,"오늘의 인사-권익위, 기재부, 복지부,국토부 외",■국민권익위원회 ◇과장급 임용 △감사담당관 홍진명 ■기획재정부 ◇과장급 △홍보담당관 김영현 ■보건복지부 △의료정보정책과장 최경일 ■국토교통부 ◇과장급 전보 △건축정책과장 김동준... ,https://www.khan.co.kr/article/202512081609001,https://n.news.naver.com/mnews/article/032/0003413838?sid=102,"Mon, 08 Dec 2025 16:09:00 +0900"
기재부,파주 통일동산 박물관클러스터 조성 속도…국비 확보,박 의원은 파주시로부터 건의를 받고 지난해 총선부터 파주국립박물관 클러스터 조성을 공약으로 문체부와 협력해 이번 국회는 물론이고 앞서 정부(기재부) 예산 편성을 요청해 성사시켰다. 시는 통일동산 내 각종 국립... ,https://www.kyeonggi.com/article/20251208580226,https://n.news.naver.com/mnews/article/666/0000090031?sid=102,"Mon, 08 Dec 2025 16:07:00 +0900"
기재부,&quot;김포 특수성 고려해 5호선 조속 추진해야&quot;…기재부 앞 거리에 선 시민...,“정부와 기재부는 김포골드라인 혼잡률 등 김포시의 특수한 환경을 고려해 경제성이 다소 미흡하더라도... 서형배 김포검단시민연대 위원장은 “KDI의 신속예타 재조사 지연과 기재부의 발표 지연으로 인해 사업 전체가... ,https://www.sedaily.com/NewsView/2H1NGAM5U0,https://n.news.naver.com/mnews/article/011/0004564809?sid=102,"Mon, 08 Dec 2025 16:00:00 +0900"
기재부,사장 선임 앞둔 예보… 노조 “전문성·대외영향력 갖춘 인물 필요”,지금은 기재부 장관이 추천하는 인사 중심으로 운영되고 있다”고 지적했다. 임추위 역시 개편이 필요하다고 주장했다. 김 지부장은 “현재 임추위는 대부분 비상임이사가 들어가 있는 구조이고 이들은 금융위원장이... ,https://www.kukinews.com/article/view/kuk202512080171,https://www.kukinews.com/article/view/kuk202512080171,"Mon, 08 Dec 2025 15:56:00 +0900"
기재부,아산세무서 이전 또 미뤄지나…설계비 전액삭감 차질 불가피,"아산세무서 이전은 2022년 말 기재부가 온천지구 부지를 매입한 뒤, 올해 4월 행정안전부 청사수급관리계획에 건립계획이 반영되며 재추진 기대가 높아졌다. 그러나 내년도 예산안에 설계비가 포함되지 않으면서 2028년... ",https://www.pressian.com/pages/articles/2025120814215753474?utm_source=naver&utm_medium=search,https://n.news.naver.com/mnews/article/002/0002417831?sid=102,"Mon, 08 Dec 2025 15:55:00 +0900"
기재부,"쿠팡까지 탈탈 털렸는데…개인정보위, 조사 인력 턱없이 모자라","개인정보위 관계자는 &quot;조사 인력 확충은 행안부 협의를 마쳤고, 기재부와 예산 조정이 마무리되면 규모가 확정될 것&quot;이라며 “현재 기준으로는 상당 부분 늘어날 가능성이 크고, 대부분이 조사 부문에 배정될 예정... ",http://www.inews24.com/view/1915308,https://n.news.naver.com/mnews/article/031/0000987387?sid=105,"Mon, 08 Dec 2025 15:45:00 +0900"
기재부,"안호영 의원, 전북 예산 10조 원 시대 개막...직접 뛰어 이뤄냈다","이러한 성과는 사전 검토, 기후부·노동부 관계자 및 기재부·예결위원장과의 면밀한 조율, 예산 타당성 근거 제시 등 다층적인 설득 노력이 뒷받침된 결과다. 다른 상임위 주요 사업의 예산 반영률을 보면... ",http://www.jeonmin.co.kr/news/articleView.html?idxno=429975,http://www.jeonmin.co.kr/news/articleView.html?idxno=429975,"Mon, 08 Dec 2025 15:42:00 +0900"
기재부,"김검시대와 주민대책위 등, 세종 기재부 앞에서 공동 집회","집회 연설에서 서형배 위원장은 KDI의 신속예타 재조사 지연과 기재부 발표 미루기로 인해 사업 전체가 멈춰... 참여 단체들은 신속예타 재조사의 조속한 마무리와 기재부 발표 일정 공개, 콤팩트시티 지장물조사와 보상... ",https://www.ajunews.com/view/20251208144947061,https://www.ajunews.com/view/20251208144947061,"Mon, 08 Dec 2025 15:36:00 +0900"
기재부,차기 사장 인선 앞둔 예금보험공사... 노조 &quot;낙하산 불가&quot;,"인사·예산·조직 운영을 핀셋 수준으로 통제받고 있어, 기재부와 금융위 등으로부터 눈치를 봐야 하는 처지라는 설명이다. 노조는 &quot;상임임원에 대한 임명권을 가진 사장은 그 권한도 제대로 행사하지 못하고 정치권, 관료... ",https://www.meconomynews.com/news/articleView.html?idxno=124485,https://www.meconomynews.com/news/articleView.html?idxno=124485,"Mon, 08 Dec 2025 15:32:00 +0900"
기재부,與 이훈기 &quot;방발기금 지원 대상서 지역방송 소외…기금 목적 위반&quot;,"■ 기금 수지 악화, 기재부 책임…적자 명분으로 지역방송 지원 축소 기획재정부는 내년 지역·중소방송... 이 의원은 “기금 수지 악화는 기재부가 목적 외 사업에 기금을 과도하게 투입해 스스로 만든 결과”라며... ",https://news.tvchosun.com/site/data/html_dir/2025/12/08/2025120890191.html,https://n.news.naver.com/mnews/article/448/0000575701?sid=100,"Mon, 08 Dec 2025 15:29:00 +0900"
기재부,[고수다] &quot;법 기술로 재판 중단 안 되게 충분히 논의&quot;‥조희대 역할은?,그래서 이런 부분들은 정상적인 형태로 제가 보기엔 경제가 굴러갈 수 있게끔 기업과 개인들의 노력 필요하고 그것을 관리하고 있는 한국은행과 기재부에서도 그것을 잘 살펴보면서 환율을 조정해 나가겠다라는 취지가... ,https://imnews.imbc.com/replay/2025/nw1400/article/6783085_36776.html,https://n.news.naver.com/mnews/article/214/0001466644?sid=100,"Mon, 08 Dec 2025 15:21:00 +0900"
기재부,"창원시, 내년 정부예산 국비 2조397억원 확보","이후 6월에는 장금용 시장 권한대행을 중심으로 기재부를 방문하여 주요 국비 사업에 대한 사업 설명과 관심이 필요함을 밝혔고, 9월에는 지역 국회의원 보좌진 간담회를 통해 2026년도 핵심 사업에 대한 지원 방향... ",http://www.shinailbo.co.kr/news/articleView.html?idxno=2159078,http://www.shinailbo.co.kr/news/articleView.html?idxno=2159078,"Mon, 08 Dec 2025 15:20:00 +0900"
기재부,증권사 IMA 첫 상품 출시 '발목'…과세 방식 논란 불거져,"기재부의 과세 방식 결정 시점은 연말쯤으로 예상되며, 통상 세제가 명확해진 뒤 금융상품을 출시하는 게 원칙이라는 설명이다. 증권업계는 일단 상품을 선출시하고 세제는 나중에 정비하자는 쪽이었지만, 금감원이... ",https://www.moneys.co.kr/article/2025120815161437800,https://n.news.naver.com/mnews/article/417/0001117970?sid=101,"Mon, 08 Dec 2025 15:19:00 +0900"
기재부,구 부총리 &quot;새해 첫날 민생사업 즉시 집행…계획 수립 이달 중 마무리&quot;,기획재정부는 8일 구윤철 부총리 겸 기재부 장관 주재로 정부서울청사에서 제28차 재정집행점검회의를 열어 내년 예산 집행 사전준비 및 올해 재정 집행상황 등을 논의했다고 밝혔다. 구윤철 경제부총리 겸 기획재정부... ,https://www.korea.kr/news/policyNewsView.do?newsId=148956053&call_from=naver_news,https://www.korea.kr/news/policyNewsView.do?newsId=148956053&call_from=naver_news,"Mon, 08 Dec 2025 15:16:00 +0900"
기재부,"기획재정부, 재정경제부·기획예산처 분리 초읽기 돌입'","정부는 오는 1월 2일 재정경제부와 기획예산처를 공식 출범시키고 기존 기재부의 기능을 '조정'과 '기획'으로... 한편 기획처 초대 장관 후보로는 임기근 현 기재부 2차관, 류덕현 대통령실 재정기획보좌관, 안도걸... ",http://www.intn.co.kr/news/articleView.html?idxno=2047722,http://www.intn.co.kr/news/articleView.html?idxno=2047722,"Mon, 08 Dec 2025 15:14:00 +0900"
기재부,&quot;용문~홍천 광역철도 예타 통과 필요&quot;,오는 16일 기재부 SOC분과위원회가 열려 최종 결과가 나올 것으로 전망되는 가운데 김지사도 위원회에 참석할 뜻을 내비쳤다. 도는 철도 개통시 홍천과 청량리까지 1시간내 접근이 가능하다고 내다봤다. 철도노선이... ,http://www.engdaily.com/news/articleView.html?idxno=21169,http://www.engdaily.com/news/articleView.html?idxno=21169,"Mon, 08 Dec 2025 15:12:00 +0900"
기재부,“용문~홍천철도 예타 결과 발표 임박… 마지막까지 총력 대응”,16일 기재부 SOC 분과위 예정 김 지사 “직접 참석 당위성 피력” 김진태 강원도지사가 8일 용문~홍천... 김 지사는 “다음 주 열리는 기재부 SOC 분과위원회에 직접 참석해 사업의 필요성과 도민의 염원을 전달할 예정”... ,https://www.mk.co.kr/article/11486836,https://n.news.naver.com/mnews/article/009/0005602606?sid=102,"Mon, 08 Dec 2025 15:09:00 +0900"
기재부,"김포 시민단체, 기재부 앞 집회 &quot;5호선 예타 결과 공개하라&quot;","서형배 김검시대 위원장은 &quot;KDI의 신속예타 지연과 기재부 발표 미루기로 사업 전반이 멈춰 서 있다&quot;며 &quot;사업... 신속 예타를 조속히 마무리하고, 기재부는 결과 발표를 더 이상 미뤄선 안 된다&quot;고 강조했다.",https://www.news1.kr/local/incheon/6001564,https://n.news.naver.com/mnews/article/421/0008649126?sid=102,"Mon, 08 Dec 2025 15:05:00 +0900"
기재부,"AI 개발, ‘원본데이터 학습’ 길 열린다… 개인 캠핑카 대여도 허용",향후 기재부·국세청과 협업해 주류시장의 추가 구조개편도 검토한다. 정부는 이외에도 식품·건강기능식품 포장지에 QR코드를 통한 정보제공을 확대해 가독성이 떨어지는 문제와 불필요한 비용 부담을 해소하고... ,http://www.metroseoul.co.kr/article/20251208500316,http://www.metroseoul.co.kr/article/20251208500316,"Mon, 08 Dec 2025 15:02:00 +0900"
기재부,"이재명 대통령님, 전세사기 피해자와의 약속을 잊으셨습니까","지난 11월에는 국회 국토교통위에서 전세사기 피해지원 예산 1천억 원을 증액 의결했지만, 기재부의 반대로 예산안 반영에 실패했습니다. 국회 여당 의원이 적극적으로 추진하고, 야당 의원도 동의하며, 주무 부처인... ",https://www.ohmynews.com/NWS_Web/View/at_pg.aspx?CNTN_CD=A0003189388&CMPT_CD=P0010&utm_source=naver&utm_medium=newsearch&utm_campaign=naver_news,https://n.news.naver.com/mnews/article/047/0002497655?sid=102,"Mon, 08 Dec 2025 14:56:00 +0900"
기재부,"김진태 강원지사, 16일 기재부 SOC 분과위원회 직접 참석",8일 김진태 강원특별자치도지사가 기자간담회를 하고 있다./사진=강원특별자치도김진태 강원특별자치도지사는 도청 기자실에서 간담회를 통해 &quot;16일 용문~홍천 광역철도 건설사업 기획재정부 SOC 분과위원회에 직접... ,https://news.mtn.co.kr/news-detail/2025120814343238455,https://news.mtn.co.kr/news-detail/2025120814343238455,"Mon, 08 Dec 2025 14:56:00 +0900"
기재부,"&quot;달러 유출 잡아라&quot;…정부, 기업·개인·연금 '3대 환율 수급' 정조준",국민연금과 뉴프레임워크 논의…환헤지·외환 스와프 등 마지막 과제인 국민연금의 해외 투자로 인한 외화유출 문제는 이미 국민연금과 기재부·한은 등 4차 협의체에서 '뉴 프레임워크' 구축을 목표로 논의 중이다. 이는... ,https://www.news1.kr/economy/trend/6001426,https://n.news.naver.com/mnews/article/421/0008649103?sid=101,"Mon, 08 Dec 2025 14:56:00 +0900"
기재부,"강원도, 기재부에 용문~홍천 광역철도 예타 통과 촉구",오는 16일 용문~홍천 광역철도 건설사업 기획재정부 SOC 분과위원회를 앞두고 강원도가 예비타당성조사 통과를 강력히 촉구했습니다. 지난해 1월 예비타당성 조사 대상사업으로 선정된 용문~홍천 광역철도는 경기도... ,https://www.mbceg.co.kr/post/131548,https://www.mbceg.co.kr/post/131548,"Mon, 08 Dec 2025 14:50:00 +0900"
기재부,사무금융노조 “낙하산 아닌 진짜 예금보험공사 수장 필요해”,특히 금융위원회·기재부 중심의 현행 임원 인사 시스템의 문제점을 강하게 비판했다. 현재 예보 사장 임명은 임원추천위원회를 통해 이뤄지는데 위원회 구성원 5명 중 노동자 대표 1명을 제외한 나머지는 모두 금융위의... ,https://www.segye.com/newsView/20251208510624?OutUrl=naver,https://n.news.naver.com/mnews/article/022/0004088524?sid=101,"Mon, 08 Dec 2025 14:49:00 +0900"
기재부,금감원 “IMA 수익 과세 ‘소비자 보호’ 보강해야”…연내 출시 어쩌나...,"시행령 개정은 기재부가 맡는 만큼 관련 근거 마련이 필요할 경우 출시가 해를 넘길 가능성도 배제할 수 없다. 금감원 관계자는 “세제 자체는 기재부가 판단할 사안이지만, 미정 상태의 과세 구조를 투자자에게 어떻게... ",https://biz.heraldcorp.com/article/10631606?ref=naver,https://n.news.naver.com/mnews/article/016/0002568837?sid=101,"Mon, 08 Dec 2025 14:41:00 +0900"
기재부,‘역대 최대’ 이재명정부 첫 예산안 해부,"기획재정부(이하 기재부)에 따르면 내년 우리나라 국가부채는 1413조8000억원까지 불어날 전망이다. 지난해... 기재부가 발표한 2025~2065년 중장기 재정계획에 따르면, 이정부의 임기가 끝나는 2030년에는 국가부채 비율이... ",https://www.ilyosisa.co.kr/news/article.html?no=253156,https://www.ilyosisa.co.kr/news/article.html?no=253156,"Mon, 08 Dec 2025 14:36:00 +0900"
기재부,"강원자치도, 용문~홍천 광역철도 예타 통과 강력 촉구키로","김진태 강원도지사가 용문~홍천 광역철도 건설사업 관련, 오는 16일 열리는 기획재정부 SOC 분과위원회에 직접 참석, 예비타당성조사 통과를 강력 촉구하기로 했다. 8일 강원자치도에 따르면 용문~홍천 광역철도는... ",http://www.fnnews.com/news/202512081423312388,https://n.news.naver.com/mnews/article/014/0005445727?sid=102,"Mon, 08 Dec 2025 14:36:00 +0900"
기재부,예금보험공사 차기 사장 임명 초읽기…노조 “전문성·독립성 갖춘 수장...,"9~10대 사장이었던 곽범국, 위성백 사장도 모두 기재부 출신이었다. 현재 하마평에 오르내리고 있는 김광남 전... 공운법(공공기관의 운영에 관한 법률)이란 기재부가 매년 지정하는 공공기관을 대상으로 적용되는 법이다.... ",http://www.fntimes.com/html/view.php?ud=2025120813493261955e6e69892f_18,http://www.fntimes.com/html/view.php?ud=2025120813493261955e6e69892f_18,"Mon, 08 Dec 2025 14:36:00 +0900"
기재부,기재부 &quot;경기 회복 흐름&quot; 첫 언급…낙관과 경고 동시에 내놨다,"기획재정부(기재부)가 지난 11월 14일 발표한 '최근 경제동향(그린북) 11월호'에서 우리 경제가 &quot;회복 흐름을... 기재부는 그린북 11월호에서 &quot;최근 우리 경제는 소비 등 내수 개선, 반도체 호조 등으로 경기가 회복 흐름을... ",https://www.sisamagazine.co.kr/news/articleView.html?idxno=522034,https://www.sisamagazine.co.kr/news/articleView.html?idxno=522034,"Mon, 08 Dec 2025 14:35:00 +0900"
기재부,"불편함 없게…부산시, 해수부 이전 직원 주거지원 분주","기재부 예산으로 지원되는 관사는 부산 전역에 흩어져 있는데, 대부분 1인 관사(오피스텔)다. 나머지는 해수부 직원이 개별적으로 주거 문제를 해결할 것으로 부산시는 파악했다. 시는 해수부 직원들이 큰 불편 없이... ",https://www.yna.co.kr/view/AKR20251208091400051?input=1195m,https://n.news.naver.com/mnews/article/001/0015784469?sid=100,"Mon, 08 Dec 2025 14:34:00 +0900"
기재부,"대기업 지원은 투자, 사회기업 투자는 반시장?","그러나 사회연대경제를 사회주의 정책이라 비판하는 국민의힘이 번번이 가로막았고, 사회연대경제의 주무부처인 기재부조차 반대를 하면서 국회 기획재정위 문턱조차 넘지 못했다. 이번 22대 국회에서도 본 의원이 낸... ",https://www.ohmynews.com/NWS_Web/View/at_pg.aspx?CNTN_CD=A0003189379&CMPT_CD=P0010&utm_source=naver&utm_medium=newsearch&utm_campaign=naver_news,https://n.news.naver.com/mnews/article/047/0002497653?sid=102,"Mon, 08 Dec 2025 14:31:00 +0900"
기재부,"&quot;李대통령, 전세사기 특별법 개정 지시해주세요&quot;…피해자들 면담 요청","박 팀장은 &quot;기재부는 지금 국회에 발의된 전세사기특별법 개정안에 대해서도 반대 입장을 고수하고 있다&quot;며 &quot;전세 사기 피해자들의 외침이 더 이상 공회전하지 않도록, 정부는 지금 당장 대응에 나서야 한다&quot;고 꼬집었다.... ",https://www.news1.kr/society/incident-accident/6001473,https://n.news.naver.com/mnews/article/421/0008648982?sid=102,"Mon, 08 Dec 2025 14:30:00 +0900"
기재부,"&quot;방구석 여포 필요 없다&quot;...예보 노조, 차기 사장에 '독립성' 강력 촉구","노조는 &quot;중립적 정책을 수행하는 예보기구 수장이 정치권, 기재부·금융위 등 관료나 업계의 눈치를 볼 수밖에 없는 자가 임명된다면 결국 그 피해는 5천만 국민의 고통으로 돌아갈 것&quot;이라고 지적했다. 특히 노조는 예보... ",https://www.newsway.co.kr/news/view?ud=2025120814242447277,https://www.newsway.co.kr/news/view?ud=2025120814242447277,"Mon, 08 Dec 2025 14:28:00 +0900"
