Keyword,Title,Description,Original Link,Link,Publication Date
이재명,6·3 지방선거 사전투표 첫날 11.6% 기록···역대 지선 최고치 경신,"이재명 대통령과 김혜경 여사가 제9회 전국동시지방선거 사전투표 첫날인 29일 서울 종로구 삼청동 주민센터에서 사전투표를 하고 있다. [연합뉴스]  제9회 전국동시지방선거 사전투표 첫날인 29일, 투표율이... ",https://www.ziksir.com/news/articleView.html?idxno=135365,https://www.ziksir.com/news/articleView.html?idxno=135365,"Sat, 30 May 2026 07:48:00 +0900"
이재명,"사면초가 강호동, ‘조합원 직선제’ 승부수… 인적 리스크 덮는 개혁 ...",표면적으로는 이재명 대통령이 강도 높게 주문한 ‘진짜 농협’으로의 체질 개선 요구에 적극 화답한... 이처럼 리더십이 뿌리째 흔들리던 일촉즉발의 상황에서 이재명 대통령이 직접 ‘진짜 농협’을 언급하며 고강도... ,https://www.dailyt.co.kr/newsView/dlt202605260012,https://www.dailyt.co.kr/newsView/dlt202605260012,"Sat, 30 May 2026 07:20:00 +0900"
이재명,윤·박 이어 'MB어게인'까지‥보수 결집 이렇게?,"◀ 리포트 ▶ 사전투표 첫날, 첫 일정으로 세종시를 찾은 국민의힘 장동혁 대표, 또 '이재명 대통령 때리기'에... [장동혁/국민의힘 대표] &quot;이재명 그날 밤 부산 자갈치 시장에 가서 회파티하고 있었습니다.&quot; 서소문 고가 붕괴... ",https://imnews.imbc.com/replay/2026/nwtoday/article/6826352_37012.html,https://n.news.naver.com/mnews/article/214/0001502227?sid=162,"Sat, 30 May 2026 07:14:00 +0900"
이재명,&quot;이 대통령에 힘 싣고‥내란 세력 활개 막자&quot;,"추미애!&quot; 이재명 정부의 국정운영을 뒷받침하려면 여당을 지지해 달라고 호소했습니다. [정청래/더불어민주당 대표 (어제)] &quot;이재명 대통령을 지지하는 성남시민 여러분! 이재명 대통령에게 힘을 실어 주시려면, 성남시장은... ",https://imnews.imbc.com/replay/2026/nwtoday/article/6826351_37012.html,https://n.news.naver.com/mnews/article/214/0001502226?sid=162,"Sat, 30 May 2026 07:12:00 +0900"
이재명,부산시장 선거 막판까지 전재수·박형준 네거티브 공방,"박 후보가 부산시장 재임 기간 분산에너지특구와 기회발전특구 지정 등을 치적으로 내세운 데 대해서도 전 후보 캠프는 이재명 정부가 한 것이라며 반박했고, 전 후보가 의원 재직 시절 구포 개 시장 폐쇄를 내세운 데 대해... ",https://www.yna.co.kr/view/AKR20260529132500051?input=1195m,https://n.news.naver.com/mnews/article/001/0016108652?sid=100,"Sat, 30 May 2026 07:03:00 +0900"
이재명,윤상현 “‘초과 이윤’ 용어 자체가 잘못…국민에게 돈 아닌 미래를 줘...,윤상현 국민의힘 의원이 29일 이재명 정부의 ‘AI 국민배당금’과 초과이윤 재분배 논의를 정면 비판하며 “지금 필요한 것은 돈을 나누는 정치가 아니라 국민 모두에게 미래를 만들 기회를 여는 정치”라고 밝혔다. 윤... ,https://www.sedaily.com/article/20049928?ref=naver,https://n.news.naver.com/mnews/article/011/0004626004?sid=100,"Sat, 30 May 2026 07:01:00 +0900"
이재명,"'지선 D-3' 막판 변수 투표율, 與野 지지층 투표 독려 총력전…'말실수...",박성훈 국민의힘 중앙선대위 공보단장도 같은 날 국회에서 기자들과 만나 &quot;이재명 대통령과 민주당의 오만과 독선을 심판하겠다는 유권자들이 사전투표장에 많이 나오고 계신 것&quot;이라고 했다. 여야 모두 상대 당에게... ,https://www.newsis.com/view/NISX20260529_0003649690,https://n.news.naver.com/mnews/article/003/0013976892?sid=100,"Sat, 30 May 2026 07:00:00 +0900"
이재명,LNG에서 시작된 이야기…한·일 군사협력 가능성 따져보니,지난 5월 19일 이재명 대통령의 고향인 경북 안동에서 열린 한·일 정상회담을 계기로 이 대통령과 다카이치 사나에 일본 총리는 에너지 분야 협력을 강화하기로 뜻을 모았다. 이 흐름은 지난 4월 21일 일본 정부가... ,http://weekly.chosun.com/news/articleView.html?idxno=51990,https://n.news.naver.com/mnews/article/053/0000058694?sid=104,"Sat, 30 May 2026 07:00:00 +0900"
이재명,박찬대 &quot;다시 집으로 돌아왔다…중앙의 힘을 인천의 결과로&quot;,"이재명 대통령께서 '광역지자체장은 가장 절박한 수십, 수백 명의 사람을 살릴 수 있는 자리'라고 하신... &quot;ABC+E 전략은 이재명 정부의 국정과제 'ABCDEF'에서 인천만이 가진 고유한 특성을 고려해 제시한 인천 미래 비전이다.... ",https://www.newsworks.co.kr/news/articleView.html?idxno=842320,https://www.newsworks.co.kr/news/articleView.html?idxno=842320,"Sat, 30 May 2026 07:00:00 +0900"
이재명,지방선거 사전투표율 11.6%…역대 최고치,국민의힘 오세훈 후보는 &quot;이재명 대통령을 좀 더 겸손한 마음으로 국정을 이끌어갈 수 있도록 하는 방법이... 이재명 대통령과 김혜경 여사 역시 서울 삼청동 주민센터 사전투표소에서 투표를 마쳤다. 이날 첫날... ,https://www.bntnews.co.kr/article/view/bnt202605300017,https://www.bntnews.co.kr/article/view/bnt202605300017,"Sat, 30 May 2026 06:48:00 +0900"
이재명,"“대구 이번엔 변화” vs “독주 견제 균형추”…김부겸∙추경호, 막판...",여당 소속 지자체장이 중앙정부의 지원을 원활히 받을 수 있다는 점과 이재명 대통령의 국정 운영을 뒷받침해야 한다는 논리를 내세우겠다는 것이다. 김부겸 후보는 사전투표 첫날 수성구 고산2동 주민센터에서 아내와... ,https://www.segye.com/newsView/20260529509381?OutUrl=naver,https://n.news.naver.com/mnews/article/022/0004131683?sid=162,"Sat, 30 May 2026 06:42:00 +0900"
이재명,"6.3 지방선거 사전투표 이틀째...첫 날 투표율 11.6%, 지선 사상 최고","사전 투표 첫 날인 29일에는 이재명 대통령과 김혜경 여사,우원식 국회의장과 여야 지도부. 후보들도 대부분 사전투표를 했다. 중앙선거관리위원회에 따르면 첫날 전국 유권자 4464만9908명 중 518만486명이... ",https://www.womennews.co.kr/news/articleView.html?idxno=278152,https://n.news.naver.com/mnews/article/310/0000137089?sid=100,"Sat, 30 May 2026 06:35:00 +0900"
이재명,&quot;감옥 3인방 심판해달라&quot; vs &quot;투표로 독재 막아야&quot;,"&lt;기자&gt; 민주당 정청래 대표는 이재명 대통령의 정치적 고향인 경기 성남을 찾아 유세를 시작했습니다. 정... 윤석열·박근혜·이명박, 감옥 3인방보다 10배, 100배 일 잘하는 분이 이재명 대통령 아닙니까?] 두 전직 대통령의... ",https://news.sbs.co.kr/news/endPage.do?news_id=N1008586631&plink=ORI&cooper=NAVER,https://n.news.naver.com/mnews/article/055/0001360303?sid=100,"Sat, 30 May 2026 06:31:00 +0900"
이재명,[지선 현장] &quot;이재명 같은 대통령은 처음 봐&quot;…박형준이 목소리 높인 이...,&quot;그동안 우리나라에 많은 대통령이 있었지만 이재명 대통령처럼 이렇게 잔머리를 굴리고 또 정상적인... 그는 &quot;저 무도한 이재명 정권이 지금 기도하고 있는 '대통령 죄지우기 특검법'을 막지 않는다면 '대한민국은... ,https://www.dailian.co.kr/news/view/1650450/?sc=Naver,https://n.news.naver.com/mnews/article/119/0003096009?sid=162,"Sat, 30 May 2026 06:30:00 +0900"
이재명,사전투표 이틀째…첫날 투표율 11.6% 역대 최고치,"[오세훈/국민의힘 서울시장 후보 : 이번 선거를 통해서 이재명 대통령을 좀 더 겸손한 마음으로 국정을 이끌어갈 수 있도록 하는 방법이 무엇인지 깊이 고민해 주셨으면.] 개혁신당 김정철, 정의당 권영국 후보도... ",https://news.sbs.co.kr/news/endPage.do?news_id=N1008586630&plink=ORI&cooper=NAVER,https://n.news.naver.com/mnews/article/055/0001360302?sid=100,"Sat, 30 May 2026 06:28:00 +0900"
이재명,"&quot;시청 압수수색, 선거개입&quot;…&quot;시정 무능·무책임&quot;","&quot;투표를 하루 앞두고 이재명 대통령이 사실상 하명 수사 지시를 내렸고, 날이 밝자마자 수사기관이 들이닥쳤다&quot;며 &quot;선거 개입&quot;이라고 목소리를 높였습니다. [오세훈/국민의힘 서울시장 후보 : 서울시청 쓰레기통까지 샅샅이... ",https://news.sbs.co.kr/news/endPage.do?news_id=N1008586629&plink=ORI&cooper=NAVER,https://n.news.naver.com/mnews/article/055/0001360301?sid=100,"Sat, 30 May 2026 06:24:00 +0900"
이재명,"“한 표 차이로 져도 패배는 패배”…국민의힘, 투표 독려하며 중원 공...","이재명의 독재, 막아내지 못하는 것입니다.&quot;] 이어 경기도 구석구석을 다니며 수도권 표심을 공략했습니다. 전국에서 유권자가 가장 많은 경기에서 '정권 심판론' 바람을 일으키겠다는 듯 투표로 정부·여당의 오만함을 막아... ",https://news.kbs.co.kr/news/pc/view/view.do?ncd=8573913&ref=A,https://n.news.naver.com/mnews/article/056/0012190952?sid=100,"Sat, 30 May 2026 06:11:00 +0900"
이재명,"‘사전투표 2일차’ 민주당, 전남광주행…격전지 전북·평택서도 유세","이재명 대통령의 정치적 기반 성남에서, '대통령 국정운영 도우려면 반드시 투표해야 한다'고, 지지층을 투표장으로 끄는 데 주력했습니다. [정청래/더불어민주당 총괄상임선대위원장 : &quot;감옥 3인방이 설치고 있습니다.... ",https://news.kbs.co.kr/news/pc/view/view.do?ncd=8573912&ref=A,https://n.news.naver.com/mnews/article/056/0012190951?sid=100,"Sat, 30 May 2026 06:09:00 +0900"
이재명,사전투표한 이 대통령 “반만 찍혀도 괜찮나”…여야 공방,사전투표 첫날인 어제 이재명 대통령도 김혜경 여사와 함께 청와대 인근 사전투표소에서 한 표를... [리포트] 청와대 인근 삼청동 주민센터 사전투표소를 찾은 이재명 대통령과 김혜경 여사. 이 대통령은 특정 정당 색을... ,https://news.kbs.co.kr/news/pc/view/view.do?ncd=8573911&ref=A,https://n.news.naver.com/mnews/article/056/0012190950?sid=100,"Sat, 30 May 2026 06:06:00 +0900"
이재명,미국 눈에는 한·일·대만 모두 항공모함(?) [김태훈의 의미 또는 재미],이재명정부 출범 직전인 2025년 5월 제이비어 브런슨 주한미군 사령관은 한국을 가리켜 “일본과 중국 본토 사이에 떠 있는 섬이나 고정된 항공모함 같다”고 말했다. 그러면서 “주한미군은 북한을 격퇴하는 것에만... ,https://www.segye.com/newsView/20260529511887?OutUrl=naver,https://n.news.naver.com/mnews/article/022/0004131668?sid=104,"Sat, 30 May 2026 06:02:00 +0900"
이재명,[르포]&quot;여당 김남국 뽑겠다&quot; &quot;김석훈 사람 좋아 &quot;…안산갑 표심 어디로,이번 안산시갑 재선거는 친명(친이재명)계 원조로 꼽히는 김남국 더불어민주당 후보와 '37년 안산인'을... 김남국 후보는 이재명 정부 대통령실 디지털소통비서관과 민주당 대변인을 지냈다. '가장 이재명답게 일한다'는... ,https://www.sidae.com/article/2026052914255941421,https://n.news.naver.com/mnews/article/417/0001145429?sid=162,"Sat, 30 May 2026 06:01:00 +0900"
이재명,[르포] “재선 도전” vs “여당 파워”…안갯속 충남지사 선거,하지만 박씨는 “최근 이재명 정부의 삼성 때리기와 모든 땅의 거래를 금지하는 부동산 정책으로 피해를 본 농민들이 투표 변수”라고 말했다. 아산에서는 강훈식 대통령 비서실장의 빈자리를 채우기 위한 아산을... ,https://biz.chosun.com/policy/politics/election/2026/05/30/GNUM2TESQJGL3MHL4AFKHH3MU4/?utm_source=naver&utm_medium=original&utm_campaign=biz,https://n.news.naver.com/mnews/article/366/0001168134?sid=162,"Sat, 30 May 2026 06:01:00 +0900"
이재명,"선거 막판 지지층 구심점 재편…與 '이재명', 野 '박근혜·MB' 전면에","더불어민주당은 현재 높은 지지율을 기록하고 있는 이재명 대통령을, 국민의힘은 진영 내 상징성을 지닌 박근혜·이명박 전 대통령을 진영 결집의 구심점으로 소환하는 모습이다. 정치권에 따르면 정청래 민주당 대표는... ",https://www.news1.kr/politics/assembly/6182105,https://n.news.naver.com/mnews/article/421/0008974613?sid=162,"Sat, 30 May 2026 06:00:00 +0900"
이재명,장동혁 “李 지나갈땐 감춰라”…선거판 등장한 ‘스타벅스 전쟁’,이재명이 지나갈 때는 그거 살짝 뒤로 감추셔”라며 여권의 강경 대응을 비꽜다. 이번 논란은... 이재명 대통령은 논란 당일인 지난 18일 X에 “저질 장사치의 비인간적 막장 행태에 분노한다”고 질타했다. 이어 24일엔... ,https://www.joongang.co.kr/article/25432552,https://n.news.naver.com/mnews/article/025/0003526815?sid=162,"Sat, 30 May 2026 06:00:00 +0900"
이재명,GTX 철근 누락 이어 고가 사고까지…서울시 관리 책임 ′도마′,이재명 대통령은 서소문 고가차도 사고와 GTX 철근 누락 문제를 두고 &quot;이 사건들은 누구보다 국민 안전에 앞장서야 할 공공부문이 관련됐다는 점에서 심각성이 크다&quot;며 관계기관의 신속한 진상 규명과 엄정한 책임 규명을... ,https://www.newspim.com/news/view/20260529000993,https://www.newspim.com/news/view/20260529000993,"Sat, 30 May 2026 06:00:00 +0900"
이재명,대출규제·투기지정 이어 세제개편?…文·李 ‘부동산 평행이론’,"“최근 집값이 다시 오른다는데 이에 대한 대책을 세우고 있느냐?” 이재명 대통령이 지난 26일... ①첫 카드, 대출 규제=이재명 정부는 지난해 취임 첫 달 6·27 대출 규제를 통해 수도권·규제지역 내 주택담보대출... ",https://www.joongang.co.kr/article/25432548,https://n.news.naver.com/mnews/article/025/0003526811?sid=101,"Sat, 30 May 2026 06:00:00 +0900"
이재명,"재보선 민주 9~13, 국힘 0~4, 조국당·무소속 각각 0~1곳 [중앙SUNDAY 여론...",여론조사 취합·분석해보니 6·3 선거는 윤석열 전 대통령의 탄핵으로 이재명 정부가 출범한 지 1년밖에 안 된 상황에서 치러지는 지방선거라 현 정부에 대한 중간평가의 성격으로 보기엔 어려운 측면이 있다. 오히려... ,https://www.joongang.co.kr/article/25432544,https://n.news.naver.com/mnews/article/025/0003526812?sid=100,"Sat, 30 May 2026 06:00:00 +0900"
이재명,"정용진, 리치 이기, 이준석 - 주류가 된 일베 멘탈리티의 삼위일체[위근...",5월24일 이재명 대통령이 일베를 비롯해 조롱과 혐오를 조장하는 인터넷 사이트에 대한 폐쇄 혹은 징벌적 손해 배상을 언급하자 그는 발 빠르게 페이스북을 통해 “정치가 제 역할을 하고 국민의 삶이 풀리는 사회에서... ,https://www.khan.co.kr/article/202605300600001,https://n.news.naver.com/mnews/article/032/0003448827?sid=103,"Sat, 30 May 2026 06:00:00 +0900"
이재명,‘최대 20%’ 역대급 무당층…결국 ‘샤이 표심’에 달렸다 [중앙SUNDAY ...,"정치권에선 이번엔 이재명 대통령의 국정 지지율이 60%대 고공 행진을 이어가는 데다, 윤석열 전 대통령... 박동원 폴리컴 대표는 “이재명 대통령이 그동안 이어온 지방 순회 일정의 효과를 상당 부분 덮어버린 측면이... ",https://www.joongang.co.kr/article/25432541,https://n.news.naver.com/mnews/article/025/0003526807?sid=100,"Sat, 30 May 2026 06:00:00 +0900"
이재명,&quot;또 일베냐&quot;…10년째 신고해도 혐오는 현재 진행형,"그럼에도 이재명 대통령이 일베를 향해 &quot;사이트 폐쇄, 징벌적 배상, 과징금 등을 검토해야 한다&quot;고 언급한 데엔 개별 게시물 삭제나 접속 차단만으론 혐오 표현의 확산을 막기 어렵다는 문제의식이 깔려있다. 실제 일베는... ",https://www.mt.co.kr/tech/2026/05/30/2026052917542948906,https://n.news.naver.com/mnews/article/008/0005364921?sid=105,"Sat, 30 May 2026 06:00:00 +0900"
정상순방,[李정부 1년]국익 중심 실용외교 기반 구축…한미 동맹 현대화 속 안보...,"한미 정상 역대 최단기간 상호 방문…최대 난제 관세협상 선방 이 대통령은 임기 1년 차에 순방 9회, 14개국 방문 및 126건의 양해각서(MOU) 체결 등 'G7+외교 강국 실현'을 위한 정상외교를 활발히 전개했다. 우선 이재명 정부... ",https://www.newsis.com/view/NISX20260527_0003645712,https://n.news.naver.com/mnews/article/003/0013976870?sid=100,"Sat, 30 May 2026 06:00:00 +0900"
정상순방,"두 토끼 노리는 정청래, 과연? 민주당 시선은 벌써 차기 당권 전쟁으로","APEC 정상회의 때 ‘국정안정법(재판중지법)’ 추진, 이 대통령 순방 기간 ‘1인 1표제’ 추진, 코스피 5000 목표 달성일에 민주당-조국혁신당 기습 합당 추진 발표 등의 논란으로 정 대표는 이재명 정부 지원보다 ‘자기... ",https://ilyo.co.kr/?ac=article_view&entry_id=511165,https://ilyo.co.kr/?ac=article_view&entry_id=511165,"Fri, 29 May 2026 17:48:00 +0900"
정상순방,'투기·폭력·교육중립 훼손·자질' 비난…혼탁해진 대전교육감 선거,금융기관에서 정상적으로 받은 것&quot;이라고 반박했다. 이 사안을 두고 진동규 후보가 &quot;투기가 아니더라도... 이에 대해 오 후보는 &quot;과거 주상파울루 한국교육원장을 지내며 박 전 대통령의 브라질 순방 때 교육외교 실무를... ,https://www.news1.kr/local/daejeon-chungnam/6181846,https://n.news.naver.com/mnews/article/421/0008974163?sid=162,"Fri, 29 May 2026 16:06:00 +0900"
정상순방,뭔 일 있기에? 푸틴 체재중 카자흐스탄 찾아간 靑 안보실장,"청와대가 공식적으로 밝힌 위 실장의 방문 목적은 오는 9월 서울에서 열릴 예정인 '한국-중앙아시아 정상회... 당시 강 비서실장은 카자흐스탄에 이어 오만, 사우디아라비아를 방문하며 에너지 순방 외교를 펼쳤다.... ",https://www.cnbnews.com/news/articleView.html?idxno=1003074,https://www.cnbnews.com/news/articleView.html?idxno=1003074,"Fri, 29 May 2026 11:18:00 +0900"
정상순방,세계 정상들 줄줄이 베이징행...“시진핑 황제 조공 연상시켜”,해외 순방은 중국 주변국과 중앙아시아 동남아시아 파트너들에 집중됐다”며 “미국이 상대적으로 관심을 덜 기울인 지역”이라고 설명했다. 시 주석이 국제회의보다 베이징에서 개별 정상회담을 선호한다는 분석도... ,https://www.sedaily.com/article/20049479?ref=naver,https://n.news.naver.com/mnews/article/011/0004625656?sid=104,"Fri, 29 May 2026 06:30:00 +0900"
정상순방,5천피 시대 연다던 李대통령...&quot;1년 만에 8천피&quot; 한국증시 재평가,취임 후 첫 외부 일정으로 한국거래소를 방문해 불법행위 자본시장 정상화 의지를 보인 이 대통령의 행보도... 집중적으로 순방했다&quot;며 &quot;중국처럼 우리와 우호적이지 않은 국가와도 '이익에 따라 경제적인 교류를 할 수... ,https://www.mt.co.kr/politics/2026/05/29/2026052817385535125,https://n.news.naver.com/mnews/article/008/0005364478?sid=100,"Fri, 29 May 2026 06:30:00 +0900"
정상순방,싱가포르 외무장관이 올린 30초짜리 평양 시내 영상,"앞서 싱가포르 외교부는 24일 발라크리슈난 장관이 24일부터 28일까지 중국·북한·한국을 순방한다고 발표한... 한국을 비롯해 미국, 일본 등 외교장관은 매년 ARF를 빠지지 않고 참석해 온 만큼, 최근 정상국가로서의... ",https://www.chosun.com/international/international_general/2026/05/28/5BME6UCG55ETBHWW36FVKPM3ZA/?utm_source=naver&utm_medium=referral&utm_campaign=naver-news,https://n.news.naver.com/mnews/article/023/0003978963?sid=104,"Thu, 28 May 2026 16:26:00 +0900"
정상순방,"&quot;특검, 김명수 전 합참의장 최소 '24년 7월' 계엄 가능성 인식 판단&quot;","당시 윤 전 대통령은 북대서양조약기구(NATO·나토) 정상회의 순방 중 미국 하와이 인도태평양사령부를 찾았는데, 동행한 김용현 당시 경호처장과 강호필 합참 차장에게 사실상 계엄을 암시하는 발언을 했다고 매체는... ",https://news.jtbc.co.kr/article/NB12300294?influxDiv=NAVER,https://n.news.naver.com/mnews/article/437/0000493363?sid=102,"Thu, 28 May 2026 15:46:00 +0900"
정상순방,트럼프 관세 폭탄 막고 일본과 밀착…이재명 1년 외교 &quot;A학점&quot;,취임 1주년을 맞는 이재명 대통령의 핵심 성과로는 단연 외교 정상화가 꼽힌다. 국익 중심의 실용외교 기조... 집중적으로 순방했다&quot;며 &quot;중국처럼 우리와 우호적이지 않은 국가와도 '이익에 따라 경제적인 교류를 할 수... ,https://www.mt.co.kr/politics/2026/05/29/2026052708423446662,https://n.news.naver.com/mnews/article/008/0005364220?sid=100,"Thu, 28 May 2026 15:45:00 +0900"
국회,6·3 지방선거 사전투표 첫날 11.6% 기록···역대 지선 최고치 경신,"이번 지선과 병행되는 14개 지역 국회의원 재·보궐선거의 사전투표율은 12.07%를 기록했다. 선거구별로는 전북 군산김제부안을이 24.8%로 가장 높았고, 충남 공주부여청양(16.56%), 전북 군산김제부안갑(15.66%)이... ",https://www.ziksir.com/news/articleView.html?idxno=135365,https://www.ziksir.com/news/articleView.html?idxno=135365,"Sat, 30 May 2026 07:48:00 +0900"
국회,사상 첫 전국 농지 전수조사…이제 농지는 ‘보유’보다 ‘관리’가 중...,농지는 농사짓는 사람이 소유해야 한다는 원칙을 다시 강화하는 방향의 농지법 일부개정법률안이 2026년 5월 7일 국회 본회의를 통과했습니다. 특히 이번 개정안은 1996년 농지법 시행 이후 사실상 처음으로 진행되는 전국... ,https://www.hankyung.com/article/202605224292O,https://n.news.naver.com/mnews/article/015/0005293097?sid=101,"Sat, 30 May 2026 07:44:00 +0900"
국회,"[아주 사설 | 기본·원칙·상식] 첫날 기준 최고 사전투표율, 국민들은 ...","국회는 대립을 반복하고 정당은 진영논리에 갇혀 있으며 정치권에 대한 신뢰는 좀처럼 회복되지 않고 있다.... 대통령도, 국회의원도, 지방자치단체장도 결국 국민의 표로 선출된다. 민주주의는 거창한 구호가 아니라... ",https://www.ajunews.com/view/20260530064236673,https://www.ajunews.com/view/20260530064236673,"Sat, 30 May 2026 07:40:00 +0900"
국회,산악인 故 고상돈 제47주기 추모제 거행,추모제에 참석한 문성유 국민의힘 제주도지사 후보와 고기철 국민의힘 서귀포시 국회의원 후보는 기념사업회의 오랜 숙원인 '고상돈 기념관' 설립에 대해 &quot;고인의 위상에 맞춰 국가 사업으로 추진될 수 있도록... ,https://www.jejumaeil.net/news/articleView.html?idxno=401410,https://www.jejumaeil.net/news/articleView.html?idxno=401410,"Sat, 30 May 2026 07:38:00 +0900"
국회,"뜨거운 바다와 선거, 식은 기후담론…'新로댕'이 묻는 기후공약 [황덕현...",부산과 평택 등 국회의원 보궐선거까지 겹치며 국정 안정과 정권 견제를 둘러싼 정치권의 긴장도 함께 달아오르는 모양새다. 이 풍경은 더워지는 계절과 겹친다. 최근 한낮 기온은 봄철(3~5월)인데도 33도까지 올라갔고... ,https://www.news1.kr/society/environment/6181784,https://n.news.naver.com/mnews/article/421/0008974666?sid=162,"Sat, 30 May 2026 07:30:00 +0900"
국회,[속보]지선 둘째날 사전투표도 시작…오전 7시 현재 투표율 12.11%,"한편 6·3 지선과 국회의원 재·보궐 선거 사전투표는 이날 오후 6시까지 진행된다. 사전투표를 하기 위해서는 주민등록증, 여권, 운전면허증 등 관공서나 공공기관이 발행한 신분증을 반드시 지참해야 한다.",https://www.munhwa.com/article/11592291?ref=naver,https://n.news.naver.com/mnews/article/021/0002794503?sid=100,"Sat, 30 May 2026 07:30:00 +0900"
국회,"이승환, 또 투표 인증샷 화제…&quot;안전한 서울&quot; 눈길 [핫피플]","한편, 6·3 지방선거 및 국회의원 재·보궐선거 사전투표는 29일부터 이틀간 전국 3571개 사전투표소에서 진행된다. 유권자는 주민등록증, 운전면허증, 여권 등 사진이 부착된 신분증을 지참하면 전국 어느... ",http://www.osen.co.kr/article/G1112810971,https://m.entertain.naver.com/article/109/0005543539,"Sat, 30 May 2026 07:29:00 +0900"
국회,검단구 빠진 인천 서해구 구청장은? 구재용·강범석 막판 경쟁,"여기에 무소속 김용섭 후보가 국제도시 브랜드 확립, 이동권 보장, 주거 환경 개선 및 공교육 보완 등을 내걸고 서구청장 선거에 뛰어든 상태다. 김 후보는 2020년 국회의원 선거에 무소속으로 출마했다가 낙선한 바 있다.",https://www.yna.co.kr/view/AKR20260529092100065?input=1195m,https://n.news.naver.com/mnews/article/001/0016108664?sid=162,"Sat, 30 May 2026 07:27:00 +0900"
