Keyword,Title,Description,Original Link,Link,Publication Date
산업은행,안병길 해진공 사장 &quot;북극항로는 미래 아닌 현재진행형…해운거래소 신...,특히 외화채 조달과 관련해 “국제금융기관과의 긴밀한 네트워크가 필수”라며 “산업은행이나 수출입은행 수준으로 외화채를 안정적으로 발행하는 것이 목표”라고 밝혔다. 그는 북극항로 개척과 함께 ‘부산... ,http://www.fnnews.com/news/202512041054474949,https://n.news.naver.com/mnews/article/014/0005444228?sid=101,"Thu, 04 Dec 2025 12:01:00 +0900"
산업은행,안병길 사장 &quot;외화채 시장서 산은·수은 수준으로 자금 조달할 것&quot;,“외화채권 조달에서 한국산업은행과 한국수출입은행 같은 경쟁력 있는 금리로 자금을 조달해서 한국 해운·물류업에 기여하겠다.” 안병길 한국해양진흥공사 사장이 싱가포르 지사의 의미에 대해 설명하고 있다.(사진... ,http://www.edaily.co.kr/news/newspath.asp?newsid=03489926642395240,https://n.news.naver.com/mnews/article/018/0006177593?sid=101,"Thu, 04 Dec 2025 12:01:00 +0900"
산업은행,안병길 해진공 사장 &quot;신해양수도 화룡점정은 해운거래소”,안 사장은 &quot;외화채를 조달하기 위해서는 IP(기술)기업들과 끈끈한 유대관계가 필요하다&quot;면서 산업은행이나 수출입은행 수준으로 외화채 발행하는 것을 목표로 하고 있다&quot;고 제시했다. 해진공이 산은·수은과 같은 경쟁력... ,https://www.busan.com/view/busan/view.php?code=2025120409371716651,https://n.news.naver.com/mnews/article/082/0001356835?sid=101,"Thu, 04 Dec 2025 12:00:00 +0900"
산업은행,안병길 해진공 사장 &quot;북극항로는 미래 아닌 현재진행형…해운거래소 신...,안 사장은 &quot;외화채를 조달하기 위해서는 IP기업들과 끈끈한 유대관계가 필요하다&quot;면서 산업은행이나 수출입은행 수준으로 외화채 발행하는 것을 목표로 하고 있다&quot;고 제시했다. 북극항로 개척과 관련해서는 &quot;북극항로는... ,https://www.newspim.com/news/view/20251204000182,https://www.newspim.com/news/view/20251204000182,"Thu, 04 Dec 2025 12:00:00 +0900"
산업은행,"롯데·HD현대 케미칼, 산은에 자금 요청…내일 채권단 회의","산업은행이 롯데케미칼과 HD현대케미칼 자금지원과 관련 첫 채권단 자율협의회를 열고 검토에 본격 착수합니다. 두 석유화학 회사는 자금을 지원받으면 공장을 통폐합하고, 제품 개발에 투자할 계획인데요. 정광윤 기자... ",https://biz.sbs.co.kr/article_hub/20000276471?division=NAVER,https://n.news.naver.com/mnews/article/374/0000478745?sid=101,"Thu, 04 Dec 2025 11:57:00 +0900"
산업은행,최민호 세종시장 &quot;행정수도 완성 가시화…미래전략수도 도약 전환점&quot;,"아울러 전국 최초 한글문화도시 지정을 비롯해 산업은행 세종지점 유치, 폴리텍대학 세종국제기술교육센터 국내 최초 개소 등 임기 중 많은 공공기관을 유치하며 부족한 자족기능을 확충을 위한 발판을 마련했다고... ",https://www.newspim.com/news/view/20251204000522,https://www.newspim.com/news/view/20251204000522,"Thu, 04 Dec 2025 11:55:00 +0900"
산업은행,‘석화 빅딜 1호’ 8000억 유상증자… 여수·울산도 ‘자구안’ 압박 커...,한국산업은행은 오는 5일 롯데케미칼과 HD현대케미칼 채권단의 자율협의회를 소집했다. 회의에서는 사업재편 대상 기업 선정과 현장실사 관련 안건이 부의될 것으로 보인다. 업계는 롯데케미칼과 HD현대케미칼의... ,https://www.munhwa.com/article/11551829?ref=naver,https://n.news.naver.com/mnews/article/021/0002754844?sid=101,"Thu, 04 Dec 2025 11:54:00 +0900"
산업은행,"'국내 로봇 매출 1위' HD현대로보틱스, IPO 본격 시동",HD현대로보틱스는 올해 10월 한국산업은행과 사모펀드 운용사 KY PE로부터 1800억원 규모의 프리IPO 투자를 유치했는데 당시 1조8000억원에 달하는 기업가치를 인정받았다. 지난 2020년 KT에서도 500억원을 투자받았는데... ,http://www.newswatch.kr/news/articleView.html?idxno=75113,http://www.newswatch.kr/news/articleView.html?idxno=75113,"Thu, 04 Dec 2025 11:50:00 +0900"
산업은행,내년 금융위 예산안 키워드는 ‘미래·청년·서민’…올해比 11.2% 증액,"◇ 국민성장펀드 출자에 1조원…첨단산업 투자 본격화 내년도 예산 중 가장 큰 규모의 신규 배정은 산업은행을 통한 국민성장펀드 출자금이다. 인공지능(AI), 반도체, 로봇, 미래차 등 첨단전략산업 육성을 위해 5년간... ",https://www.tfmedia.co.kr/news/article.html?no=198617,https://www.tfmedia.co.kr/news/article.html?no=198617,"Thu, 04 Dec 2025 11:48:00 +0900"
산업은행,[부고] 정찬호(우리금융지주 감사부문 부사장)씨 부친상,"▲정경채씨 별세, 정찬호(우리금융지주 감사부문 부사장)·찬필(목회자)·지혜씨 부친상, 이춘원(한국산업은행 기업금융3실장)씨 장인상 = 3일, 충남 부여군 부여읍 건양대학교부여병원 장례식장, 발인 6일 오전... ",http://www.econonews.co.kr/news/articleView.html?idxno=416914,http://www.econonews.co.kr/news/articleView.html?idxno=416914,"Thu, 04 Dec 2025 11:46:00 +0900"
산업은행,"놀유니버스, 우리은행과 '여가·금융 융합' 협력사업 드라이브",놀유니버스는 우리은행과 여가 산업에 금융 서비스를 접목한 새로운 고객 경험을 제공하기 위해 전략적 업무협약(MOU)을 체결했다고 4일 밝혔다. 놀유니버스가 보유한 엔터테인먼트·여행 인프라 역량과 우리은행의 금융... ,http://www.updownnews.co.kr/news/articleView.html?idxno=315280,http://www.updownnews.co.kr/news/articleView.html?idxno=315280,"Thu, 04 Dec 2025 11:42:00 +0900"
산업은행,[부고]정경채씨 별세外,"△정경채씨 별세, 정찬호우리금융지주감사부문부사장·찬필목회자·지혜씨 부친상, 이춘원한국산업은행기업금융3실장 장인상 = 3일 건양대 부여병원. 발인 6일 6시 041-837-4441 △이종훈전중앙대총장 별세... ",https://www.munhwa.com/article/11551770?ref=naver,https://n.news.naver.com/mnews/article/021/0002754792?sid=102,"Thu, 04 Dec 2025 11:33:00 +0900"
산업은행,"세종시정 4기, 행정수도·교통망·자족기능 확충에 &quot;성과&quot;","산업은행 세종지점 유치, 공공기관 이전, 폴리텍대학 세종국제기술교육센터 개소 등도 자족 기반 강화의 사례로 언급됐다. 내년도 정부 예산 확보 규모가 올해 성과로 강조됐다. 세종시는 총 1조7320억원의 국비를... ",http://www.inews24.com/view/1914129,https://n.news.naver.com/mnews/article/031/0000986436?sid=102,"Thu, 04 Dec 2025 11:20:00 +0900"
산업은행,"산은, 5일 롯데·HD현대케미칼 첫 채권단 회의⋯ '구조혁신' 시동",이투데이=박민석 기자 | 1금융권 10여 곳 참여… 현장실사·스탠드스틸 등 안건 논의 전망 한국산업은행이 롯데케미칼과 HD현대케미칼의 금융지원 방안을 논의하기 위해 채권단 자율협의회를 소집한다. 4일 금융권에... ,https://www.etoday.co.kr/news/view/2532711,https://www.etoday.co.kr/news/view/2532711,"Thu, 04 Dec 2025 11:18:00 +0900"
산업은행,[김병헌의 체인지] 성장통인가 위기인가···롯데 대전환의 시작,"한국은행, 산업연구원 통계에 따르면 석유화학 업종의 수익성은 글로벌 공급과잉과 중국 중심의 수요 위축으로 지난 5년간 구조적으로 하락했다. 여기에 일진머티리얼즈 인수 등 대규모 투자 부담이 겹치며 화학군... ",https://www.ekn.kr/web/view.php?key=20251204026226754,https://www.ekn.kr/web/view.php?key=20251204026226754,"Thu, 04 Dec 2025 11:18:00 +0900"
산업은행,"2025년 세종시 '4기 성과' 토대, 행정수도 원년 간다","앞선 2024년 일자리경제진흥원 신설과 집현동 공동캠퍼스 개교, 2025년 산업은행 지점 개설, 근로복지공단 지사 이전, 폴리텍대학 세종국제기술교육센터 개소도 긍정적 효과를 가져오고 있다. 이 같은 모든 성과 아래... ",https://www.joongdo.co.kr/web/view.php?key=20251204010001944,https://www.joongdo.co.kr/web/view.php?key=20251204010001944,"Thu, 04 Dec 2025 11:18:00 +0900"
산업은행,[부고] 정찬호(우리금융지주 감사부문 부사장)씨 부친상,"▲ 정경채씨 별세, 정찬호(우리금융지주 감사부문 부사장)·정찬필(목회자)·정지혜씨 부친상, 이춘원(한국산업은행 기업금융3실장)씨 장인상 = 3일, 충남 부여군 부여읍 건양대학교 부여병원 장례식장 특3호실... ",https://www.newswhoplus.com/news/articleView.html?idxno=47926,https://www.newswhoplus.com/news/articleView.html?idxno=47926,"Thu, 04 Dec 2025 11:16:00 +0900"
산업은행,[부고] 정찬호(우리금융지주 감사부문 부사장)씨 부친상,"▲ 정경채 씨 별세, 정찬호(우리금융지주 감사부문 부사장)·정찬필(목회자)·정지혜 씨 부친상, 이춘원(한국산업은행 기업금융3실장)씨 장인상 = 3일, 충남 부여군 부여읍 건양대학교 부여병원 장례식장... ",https://www.ekn.kr/web/view.php?key=20251204026474551,https://www.ekn.kr/web/view.php?key=20251204026474551,"Thu, 04 Dec 2025 11:16:00 +0900"
산업은행,[부고] 정찬호(우리금융지주 감사부문 부사장)씨 부친상,"▲ 정경채씨 별세, 정찬호(우리금융지주 감사부문 부사장)·정찬필(목회자)·정지혜씨 부친상, 이춘원(한국산업은행 기업금융3실장)씨 장인상 = 3일, 충남 부여군 부여읍 건양대학교 부여병원 장례식장 특3호실... ",https://www.delighti.co.kr/news/articleView.html?idxno=107192,https://www.delighti.co.kr/news/articleView.html?idxno=107192,"Thu, 04 Dec 2025 11:14:00 +0900"
산업은행,[부음] 정찬호 씨(우리금융지주 감사부문 부사장) 부친상,"▲정경채씨 별세, 정찬호(우리금융지주 감사부문 부사장)·정찬필(목회자)·정지혜씨 부친상, 이춘원(한국산업은행 기업금융3실장)씨 장인상=3일, 충남 부여군 부여읍 건양대학교 부여병원 장례식장 특3호실, 발인... ",https://www.nbnews.kr/news/articleView.html?idxno=117814,https://www.nbnews.kr/news/articleView.html?idxno=117814,"Thu, 04 Dec 2025 11:14:00 +0900"
산업은행,"금융위, 내년 예산 4.7조원…&quot;미래성장동력·금융 약자 지원 초점&quot;",지역활성화투자펀드는 정부·지자체·민간이 협력해 산업은행 출자를 통해 500억원이 편성됐다. 금융 약자 지원은 ▲햇살론 특례 및 햇살론 유스(1297억원) ▲청년미래적금(7446억원) ▲채무자대리인 선임 지원... ,https://www.newsway.co.kr/news/view?ud=2025120411022943086,https://www.newsway.co.kr/news/view?ud=2025120411022943086,"Thu, 04 Dec 2025 11:14:00 +0900"
산업은행,[부고] 정찬호(우리금융지주 감사부문 부사장)씨 부친상,"▲ 정경채씨 별세, 정찬호(우리금융지주 감사부문 부사장)·정찬필(목회자)·정지혜씨 부친상, 이춘원(한국산업은행 기업금융3실장)씨 장인상 = 3일, 충남 부여군 부여읍 건양대학교 부여병원 장례식장 특3호실... ",http://www.beyondpost.co.kr/view.php?ud=202512041112362314be44c0aacd_30,http://www.beyondpost.co.kr/view.php?ud=202512041112362314be44c0aacd_30,"Thu, 04 Dec 2025 11:14:00 +0900"
산업은행,'햇살론 금리 연 9.9%'에 1297억 예산..청년미래적금에 7446억 확보,150조원 규모의 국민성장펀드 조성을 위해 금융위원회가 내년 예산에 1조원을 편성해 산업은행 출자에 나선다. 이재명 대통령의 지시에 따라 저신용·저소득 서민층 대상 햇살론 특례 금리를 최대 연 9.9%로 낮추기... ,https://www.mt.co.kr/finance/2025/12/04/2025120410393430610,https://n.news.naver.com/mnews/article/008/0005287278?sid=101,"Thu, 04 Dec 2025 11:12:00 +0900"
산업은행,[오늘의 주요 사회 일정] 사회(12월4일 목요일),"학교비정규직연대, 여의도 의사당역 2번출구~산업은행 앞, 릴레이 총파업 ▲오후 2시 공공운수노조, 명동 세종호텔 앞, 고공농성자 문제 해결 촉구 ▲오후 7시30분 철도노조, 전농동 청량리역 광장, 임단협 승리 결의대회",http://www.econonews.co.kr/news/articleView.html?idxno=416921,http://www.econonews.co.kr/news/articleView.html?idxno=416921,"Thu, 04 Dec 2025 11:12:00 +0900"
산업은행,"13년 끈 론스타 소송전, 한국 역전승","당시 은행법상 산업자본은 국내 은행을 인수할 수 없었는데, 론스타가 일본에 골프장과 예식장 등을 보유하고 있었기 때문이다. 그러나 금융당국은 은행법 시행령의 ‘부실 금융기관의 정리 등 특별한 사유’를... ",http://www.yonhapmidas.com/article/251204095957_539506,http://www.yonhapmidas.com/article/251204095957_539506,"Thu, 04 Dec 2025 11:10:00 +0900"
산업은행,러우사태 장기화 속 외국기업 투자 진출에 대한 러시아의 정책 변화,"또한 전략 산업(은행, 항공사, 방송사, 에너지 기업 등) 관련 비우호국 투자자의 참여가 제한되며 기존 참여 건에 대해서도 러시아 정부의 승인 없이 지분을 늘리거나 프로젝트를 종료할 수가 없다. 사업체 운영 관련... ",http://dream.kotra.or.kr/kotranews/cms/news/actionKotraBoardDetail.do?SITE_NO=3&MENU_ID=100&CONTENTS_NO=1&bbsGbn=322&bbsSn=322&pNttSn=236492,http://dream.kotra.or.kr/kotranews/cms/news/actionKotraBoardDetail.do?SITE_NO=3&MENU_ID=100&CONTENTS_NO=1&bbsGbn=322&bbsSn=322&pNttSn=236492,"Thu, 04 Dec 2025 11:09:00 +0900"
산업은행,[부고] 정찬호(우리금융지주 감사부문 부사장)씨 부친상,"▲ 정경채씨 별세, 정찬호(우리금융지주 감사부문 부사장)·정찬필(목회자)·정지혜씨 부친상, 이춘원(한국산업은행 기업금융3실장)씨 장인상 = 3일, 충남 부여군 부여읍 건양대학교 부여병원 장례식장 특3호실, 발인 6일... ",https://www.e-science.co.kr/news/articleView.html?idxno=117560,https://www.e-science.co.kr/news/articleView.html?idxno=117560,"Thu, 04 Dec 2025 11:08:00 +0900"
산업은행,"한국산업은행, 美 완전동형암호 기술 신생기업 '나이오븀' 투자",340억 시드 라운드 참여 완전동형암호 하드웨어 가속기 상용화 박차  한국산업은행이 미국 완전동형암호(FHE) 기술 신생기업 '나이오븀(Niobium)'에 투자했다. 나이오븀은 4일 2300만 달러(약 340억원) 규모 시드 자금조달... ,https://www.theguru.co.kr/news/article.html?no=95220,https://www.theguru.co.kr/news/article.html?no=95220,"Thu, 04 Dec 2025 11:08:00 +0900"
산업은행,내년 금융위 예산 '4.7조' 확정…미래산업·청년지원 대폭 확대,"금융위는 산업은행 출자를 통해 '국민성장펀드' 조성에 필요한 재정 1조원을 배정했다. 인공지능(AI), 반도체, 로봇, 미래차 등 10대 첨단전략산업 전반에 향후 5년간 150조원을 투자하는 초대형 프로젝트로, 민간 투자... ",https://www.newsworks.co.kr/news/articleView.html?idxno=821582,https://www.newsworks.co.kr/news/articleView.html?idxno=821582,"Thu, 04 Dec 2025 11:06:00 +0900"
산업은행,롯데·HD현대케미칼 자율협의회 내일 첫 소집…금융지원 검토 착수,오늘(4일) 업계 등에 따르면 산업은행은 내일 오전과 오후로 나눠 각각 롯데케미칼과 HD현대케미칼 채권단의 자율협의회를 소집합니다. 채권단에 속한 1금융권 금융사 10여곳이 참석 대상으로 전해집니다. 회의에서는... ,https://news.kbs.co.kr/news/pc/view/view.do?ncd=8424609&ref=A,https://n.news.naver.com/mnews/article/056/0012079307?sid=101,"Thu, 04 Dec 2025 11:05:00 +0900"
산업은행,"금융위원회, 2026년 예산 4조7000억원 편성…전년비 11.2% 증가","com 금융위원회의 2026년 예산 주요 부분은 먼저 국민성장펀드 조성을 위한 산업은행 출자로 1조원이 투입된다. 글로벌 패권 경쟁에 대응해 AI, 반도체, 로봇, 미래차 등 첨단전략산업에 5년간 150조원의 대규모 자금을... ",https://www.newspim.com/news/view/20251204000452,https://www.newspim.com/news/view/20251204000452,"Thu, 04 Dec 2025 11:04:00 +0900"
산업은행,"'롯데케미칼·HD현대케미칼, 채권단 자율협의회 첫 집결'…금융지원 해...","금융권에 따르면 산업은행은 5일 오전과 오후 각각 롯데케미칼 및 HD현대케미칼 채권단 자율협의회를 별도로 소집하며, 회의에는 1금융권 소속 10여 곳이 참석 대상에 포함된다. 이번 자율협의회에서는 두 회사의 사업재편... ",https://www.ppss.kr/news/articleView.html?idxno=277398,https://www.ppss.kr/news/articleView.html?idxno=277398,"Thu, 04 Dec 2025 11:03:00 +0900"
산업은행,[부고] 정찬호(우리금융지주 감사부문 부사장)씨 부친상,"▲ 정경채씨 별세, 정찬호(우리금융지주 감사부문 부사장)·정찬필(목회자)·정지혜씨 부친상, 이춘원(한국산업은행 기업금융3실장)씨 장인상 = 3일, 충남 부여군 부여읍 건양대학교 부여병원 장례식장 특3호실... ",https://biz.sbs.co.kr/article_hub/20000276450?division=NAVER,https://n.news.naver.com/mnews/article/374/0000478717?sid=101,"Thu, 04 Dec 2025 11:03:00 +0900"
산업은행,[부고] 정찬호(우리금융지주 감사부문 부사장)씨 부친상,"▲ 정경채씨 별세, 정찬호(우리금융지주 감사부문 부사장)·정찬필(목회자)·정지혜씨 부친상, 이춘원(한국산업은행 기업금융3실장)씨 장인상 = 3일, 충남 부여군 부여읍 건양대학교 부여병원 장례식장 특3호실... ",https://www.financialpost.co.kr/news/articleView.html?idxno=240135,https://www.financialpost.co.kr/news/articleView.html?idxno=240135,"Thu, 04 Dec 2025 11:02:00 +0900"
산업은행,[부고] 정찬호(우리금융지주 감사부문 부사장)씨 부친상,"▲ 정경채씨 별세, 정찬호(우리금융지주 감사부문 부사장)·정찬필(목회자)·정지혜씨 부친상, 이춘원(한국산업은행 기업금융3실장)씨 장인상 = 3일, 충남 부여군 부여읍 건양대학교 부여병원 장례식장 특3호실, 발인 6일... ",https://www.thepublic.kr/news/articleView.html?idxno=286018,https://www.thepublic.kr/news/articleView.html?idxno=286018,"Thu, 04 Dec 2025 11:02:00 +0900"
산업은행,금융위 내년 예산 약 4.7조원 확정...미래성장동력 확보에 재정 1조 투입,"지역이 경제성장의 중심이 될 수 있도록, 정부·지자체·민간이 협력해 지역 우수 프로젝트에 투자하는 지역활성화투자펀드 재원으로 500억원(산업은행 출자)을 편성했다. 금융위는 민간자금 투자를 유도하는 마중물... ",http://www.joseilbo.com/news/news_read.php?uid=558134&class=18&grp=,https://n.news.naver.com/mnews/article/123/0002373206?sid=101,"Thu, 04 Dec 2025 11:00:00 +0900"
산업은행,"K-철강·석화업계, 특별법으로 구조조정·고부가 전환 속도","롯데케미칼은 대산 NCC를 물적 분할해 신설 법인을 만든 뒤 HD현대케미칼과 합병하기로 사업재편계획을 짰고, 이를 위한 산업은행 자금 지원도 신청한 상태다. 철강 업계 역시 철근 등 범용재 설비 감축과 특수탄소강 등... ",https://biz.newdaily.co.kr/site/data/html/2025/12/04/2025120400124.html,https://biz.newdaily.co.kr/site/data/html/2025/12/04/2025120400124.html,"Thu, 04 Dec 2025 11:00:00 +0900"
산업은행,"최민호 시장, 시정 4기 '행정수도 완성·교통망 확충·최대 투자유치' 성...","근로복지공단 세종지사 이전, 농어촌공사 복합사옥 건립, 산업은행 지점 유치 등이 확정됐으며 오는 16일 폴리텍 세종국제기술교육센터가 문을 연다. ◇ 내년 국비 1조7320억 확보… &quot;핵심 사업 모두 원안 통과... ",https://news.tf.co.kr/read/national/2269060.htm,https://n.news.naver.com/mnews/article/629/0000450046?sid=102,"Thu, 04 Dec 2025 10:50:00 +0900"
기업은행,"IBK기업은행, 성평등가족부 '가족친화인증' 재인증 획득","기업은행 전경/사진=IB기업은행 IBK기업은행은 성평등가족부가 주관하는 '가족친화인증' 심사와 심의를 통과해 재인증을 획득했다고 4일 밝혔다. '가족친화인증'은 자녀 출산 및 양육 지원, 유연근무제도 등... ",http://www.issuenbiz.com/news/articleView.html?idxno=69403,http://www.issuenbiz.com/news/articleView.html?idxno=69403,"Thu, 04 Dec 2025 13:44:00 +0900"
기업은행,신한금융 회장 최종 후보에 진옥동…사실상 3년 연임 확정,"지난 1980년 은행원(IBK기업은행)으로 사회에 첫발을 내딛은 진 회장은 이후 40여년 ‘신한맨’ 경력을 이어오고 있다. 신한은행 자금부, 오사카지점, SBJ법인장, 부행장 등을 거치며 입행 당시 후발주자였던 신한은행을... ",https://www.viva100.com/article/20251204500767,https://www.viva100.com/article/20251204500767,"Thu, 04 Dec 2025 13:42:00 +0900"
기업은행,'진옥동 2기' 열린다...진옥동 신한금융 회장 연임 성공,"1980년 기업은행에 입사한 후 1986년 신생 금융사인 신한은행으로 옮겨 40년을 근무하고 있다. 오사카지점장, 일본 현지법인 SBJ은행 대표이사 사장 등을 역임하며 18년간 일본서 근무해 최대주주의 재일교포의 신뢰를 받고... ",https://www.pointdaily.co.kr/news/articleView.html?idxno=283222,https://www.pointdaily.co.kr/news/articleView.html?idxno=283222,"Thu, 04 Dec 2025 13:40:00 +0900"
기업은행,"[위클리오늘] IBK기업은행, 성평등가족부 주관 '가족친화인증' 재인증 획...","IBK기업은행은 성평등가족부가 주관하는 '가족친화인증' 심사와 심의를 통과해 재인증을 획득했다고 4일 밝혔다. '가족친화인증'은 자녀 출산 및 양육 지원, 유연근무제도 등 가족친화제도를 모범적으로 운영하는 기업이나... ",http://www.weeklytoday.com/news/articleView.html?idxno=743168,http://www.weeklytoday.com/news/articleView.html?idxno=743168,"Thu, 04 Dec 2025 13:40:00 +0900"
기업은행,진옥동 신한금융 회장 연임 성공…&quot;재임중 괄목할만한 성과&quot;,"금융권에 처음 발을 들인 것은 1980년 중소기업은행에 입사하면서다. 이후 1986년 신한은행으로 적을 옮겨 인력개발실, 고객지원부, 종합기획부에서 근무했다. 신한 내에선 '일본통'으로도 손꼽힌다. 진 회장은 1997년... ",http://news.bizwatch.co.kr/article/finance/2025/12/04/0021,https://n.news.naver.com/mnews/article/648/0000042393?sid=101,"Thu, 04 Dec 2025 13:40:00 +0900"
기업은행,배당소득 분리과세 수혜…은행주 '국민주'로 떠오르다,"지난해 기준 iM금융지주와 카카오뱅크는 배당성향 35%를 넘겼고 하나·우리·BNK·JB금융지주와 기업은행도 배당성향 25%를 웃돈다. KB금융과 신한금융의 경우 각각 23.64%, 24.45%로 요건에 미달한 상황이지만 남은 4분기 배당... ",https://www.asiatime.co.kr/article/20251204500233,https://www.asiatime.co.kr/article/20251204500233,"Thu, 04 Dec 2025 13:38:00 +0900"
기업은행,"IBK기업銀, ‘가족친화인증’ 재인증 획득",IBK기업은행은 성평등가족부가 주관하는 ‘가족친화인증’ 심사와 심의를 통과해 재인증을 획득했다고 4일 밝혔다. ▲ IBK기업은행 전경 [사진=IBK기업은행 전경] ‘가족친화인증’은 자녀 출산 및 양육 지원... ,https://www.megaeconomy.co.kr/news/newsview.php?ncode=1065587572280534,https://www.megaeconomy.co.kr/news/newsview.php?ncode=1065587572280534,"Thu, 04 Dec 2025 13:36:00 +0900"
기업은행,"신한금융, 진옥동 회장 연임 확정…새로운 금융혁신 시대 열리나","그는 1980년 기업은행에서 금융계에 첫 발을 내디뎠으며 이후 신한은행으로 옮겼다. 오사카지점장, 일본 현지 법인 대표, 신한은행 부행장, 신한은행장 등을 역임하며 경력을 쌓았다. 진 회장이 취임한 이후... ",https://www.gokorea.kr/news/articleView.html?idxno=849113,https://www.gokorea.kr/news/articleView.html?idxno=849113,"Thu, 04 Dec 2025 13:34:00 +0900"
기업은행,"IBK기업은행, 성평등가족부 주관 '가족친화인증' 재인증 획득","IBK기업은행은 성평등가족부가 주관하는 '가족친화인증' 심사와 심의를 통과해 재인증을 획득했다고 4일 밝혔다. '가족친화인증'은 자녀 출산 및 양육 지원, 유연근무제도 등 가족친화제도를 모범적으로 운영하는... ",http://www.newslock.co.kr/news/articleView.html?idxno=120756,http://www.newslock.co.kr/news/articleView.html?idxno=120756,"Thu, 04 Dec 2025 13:32:00 +0900"
기업은행,"키움인베스트, 운용자산 9000억 눈앞...내년 '1조 클럽' 입성 기대","이 밖에 세컨더리펀드 민간 출자자 풀로 참여하는 IBK기업은행 등이 출자 확약을 한 것으로 알려졌다. 키움인베스트먼트는 일반적인 구주 투자 외에도 LP지분 유동화, M&amp;A 목적 투자 등 다양하게 투자할 계획이다.... ",https://www.mt.co.kr/future/2025/12/04/2025120409090419949,https://n.news.naver.com/mnews/article/008/0005287340?sid=101,"Thu, 04 Dec 2025 13:30:00 +0900"
