Keyword,Title,Description,Original Link,Link,Publication Date
이재명,"정다은 광주시의원, 민주당 부대변인 임명","한편, 정 의원은 민주사회를 위한 변호사모임(민변) 출신으로 대한변협 우수변호사에 선정됐고, 이재명 대통령 당대표 시절 1급 포상을 받는 등 활발한 정치 활동과 법조인 경력을 갖추고 있다.또 더불어민주당 21대 대선... ",https://news.mtn.co.kr/news-detail/2026020214375846603,https://news.mtn.co.kr/news-detail/2026020214375846603,"Mon, 02 Feb 2026 14:44:00 +0900"
이재명,"LG생활건강, ‘국빈 선물’로 중국 시장서 반등 모색",더후 환유 레드 에디션은 산삼 성분을 기반으로 하는 LG생활건강의 최고급 안티에이징 제품군으로 지난해 10월 경주에서 개최된 아시아태평양경제협력체(APEC) 정상회의 당시 이재명 대통령이 시진핑 중국... ,https://www.ekn.kr/web/view.php?key=20260202024544987,https://www.ekn.kr/web/view.php?key=20260202024544987,"Mon, 02 Feb 2026 14:44:00 +0900"
이재명,"靑, 유튜브 등 새로운 출입 기자단 추가 모집 나서",홈페이지에 공고 내고 “뉴미디어에 취재 기회 확대” 이재명 대통령이 청와대로 첫 출근한 29일 오전 서울 종로구 청와대의 모습이 보이고 있다. 임세준 기자 청와대가 공식 출입 기자단을 추가로 받는다고 2일 밝혔다.... ,https://biz.heraldcorp.com/article/10667856?ref=naver,https://n.news.naver.com/mnews/article/016/0002594631?sid=100,"Mon, 02 Feb 2026 14:43:00 +0900"
이재명,靑 &quot;다주택 양도세 중과유예 5월9일 종료 분명…보유세는 최후 수단&quot;,강 대변인은 최근 이재명 대통령이 소셜미디어에 지속적으로 다주택자를 겨냥해 '강력한 정책 수단'을 시사하는 것을 두고 '보유세 강화' 관측이 나오는 것에 대해선 &quot;부동산에 대해서는 여러 정책을 쓰고 있고 실효적... ,https://www.news1.kr/politics/president/6059104,https://n.news.naver.com/mnews/article/421/0008748464?sid=100,"Mon, 02 Feb 2026 14:43:00 +0900"
이재명,혁신당 합당 놓고 민주당 '명청 갈등' 재점화…비당권·친명 견제 가시...,"내부의 '명청(이재명-정청래) 갈등'이 다시 수면 위로 떠올랐다. 비당권파와 친명계, 초선 의원 그룹이 잇따라... 이어 &quot;이재명의 민주당을 정청래·조국의 민주당으로 전환하려는 시도&quot;라고 규정하며 정 대표를 정면으로... ",https://www.ilyoseoul.co.kr/news/articleView.html?idxno=512579,https://www.ilyoseoul.co.kr/news/articleView.html?idxno=512579,"Mon, 02 Feb 2026 14:42:00 +0900"
이재명,"靑 &quot;다주택자 양도세 중과 유예, 오는 5월 9일 종료&quot;…정책 일관성 강조",강유정 청와대 대변인은 2일 브리핑에서 &quot;이재명 대통령이 소셜미디어를 통해 다주택자 양도세 중과 유예는... 강 대변인은 &quot;이재명 대통령이 신년 기자회견에서 보유세는 '최후의 수단'이라고 밝힌 바 있다&quot;며 &quot;모든 정책... ,https://www.daejonilbo.com/news/articleView.html?idxno=2254907,https://n.news.naver.com/mnews/article/656/0000165352?sid=100,"Mon, 02 Feb 2026 14:42:00 +0900"
이재명,"李대통령, 기재부 2차관 허장·아시아문화도시위원장 김원중","이재명 대통령이 2일 경제·과학기술·문화 분야 주요 보직에 대한 인선을 단행했다. 국제경제와 과학기술 행정, 문화 상징성을 두루 고려한 인사다. 강유정 청와대 대변인은 이날 오후 브리핑을 통해 이 대통령이... ",http://www.seoulwire.com/news/articleView.html?idxno=704656,http://www.seoulwire.com/news/articleView.html?idxno=704656,"Mon, 02 Feb 2026 14:42:00 +0900"
이재명,아틀라스는 ‘사람’을 떠받칠 수 있을까[김민아 칼럼],"이재명 대통령은 “흘러오는 거대한 수레를 피할 수 없다”고 말했다. 원론적으로 맞다. 저출생·고령화 시대, 신기술 도입을 통한 생산성 향상은 피하기 어려운 ‘방향’이다. 노동자들은 바보가 아니다. 하지만... ",https://www.khan.co.kr/article/202602021442001,https://n.news.naver.com/mnews/article/032/0003425261?sid=110,"Mon, 02 Feb 2026 14:42:00 +0900"
이재명,"종부세 공정가액비율, 95%→60%→80%?...보유세 재강화되나",이재명 대통령이 최근 보유세 강화를 시사하는 발언을 내놓은 점이 배경으로 꼽힌다. 그는 지난달 25일 SNS를 통해 &quot;팔면서 내는 세금(양도세)보다 버티는 세금이 더 비싸도 그렇게 할 수 있을까&quot;라고 밝혔다.... ,https://www.newspim.com/news/view/20260202000677,https://www.newspim.com/news/view/20260202000677,"Mon, 02 Feb 2026 14:41:00 +0900"
이재명,"이종배 서울시의원, ‘1·29 도심 주택공급 확대 및 신속화 방안’… 국...","이 의원은 “이재명 정부는 실패한 정책을 반복하면서도 마치 새로운 해법인 양 포장하고 있다”며 “서울시가 발표 직후 ‘협의되지 않았다’며 반발한 것에서 보듯, 이번 대책은 정책 내용부터 추진 방식까지 문재인... ",https://www.seoul.co.kr/news/publicnews/local_govern/smc_movement/2026/02/02/20260202500179?wlog_tag3=naver,https://n.news.naver.com/mnews/article/081/0003613671?sid=102,"Mon, 02 Feb 2026 14:41:00 +0900"
이재명,[프로필] 신임 우주항공청장에 오태석 한국과학기술기획평가원장,과기정통부 1차관 등 역임 누리호 발사 지휘 등 기술정책 주도 이재명 대통령이 2일 신임 우주항공청장에 오태석 한국과학기술기획평가원장을 임명했다. 강유정 청와대 대변인은 이날 춘추관에서 브리핑을 열고 오... ,https://biz.chosun.com/it-science/ict/2026/02/02/C5UVUX25TJHNLDXWIPYX2YS5ZU/?utm_source=naver&utm_medium=original&utm_campaign=biz,https://n.news.naver.com/mnews/article/366/0001139941?sid=105,"Mon, 02 Feb 2026 14:41:00 +0900"
이재명,"'복직 농성' 세종호텔 노조원·시민 12명 연행... &quot;경찰력 동원, 참담한...","이들은 기자회견에 앞서 &quot;이재명 정부 1호 공권력 침탈&quot;이라며 &quot;이로써 이재명 정권은 반노동정권임을 인정했다&quot;라고 주장했다. ▲  제정당, 시민단체들이 세종호텔 앞에서 연행을 규탄하는 기자회견을 진행하고 있다.... ",https://www.ohmynews.com/NWS_Web/View/at_pg.aspx?CNTN_CD=A0003203842&CMPT_CD=P0010&utm_source=naver&utm_medium=newsearch&utm_campaign=naver_news,https://n.news.naver.com/mnews/article/047/0002503550?sid=102,"Mon, 02 Feb 2026 14:41:00 +0900"
이재명,&quot;채권자 압류 걱정 NO&quot; 상생 행보 나선 5대 은행...'생계비 계좌'에 쏠리...,"즉 '빚은 갚되, 삶은 멈추지 않게 하자'는 이재명 정부의 취지가 반영된 정책인 셈.은행 입장에서도 이 제도는 단순 복지가 아니다. 채무자가 완전히 무너져버리면 회수 가능성도 사라진다. 반대로 기본 생활을 유지할 수... ",https://www.techm.kr/news/articleView.html?idxno=149025,https://www.techm.kr/news/articleView.html?idxno=149025,"Mon, 02 Feb 2026 14:40:00 +0900"
이재명,포스코이앤씨 송치영 사장 안전경영 전문가 맞나?...&quot;사망사고 이어 서...,지난해 7월 이재명 대통령이 취임 한 달여 만에 포스코이앤씨의 잇따른 사망사고에 대해 '면허 반납'까지 검토하란 지시가 있었기 때문에 이번 2월 내에 발표 예정인 국토부의 신안산선 붕괴사고 원인 결과에 따라... ,https://www.ngonews.kr/news/articleView.html?idxno=223600,https://www.ngonews.kr/news/articleView.html?idxno=223600,"Mon, 02 Feb 2026 14:40:00 +0900"
이재명,"김동연 &quot;경기도, 정부목표 잠재성장률 3% 중 2% 책임지겠다&quot;","김동연 지사는 &quot;이재명 정부 출범 1년도 되지 않아 우리 경제는 확실한 회복과 성장의 궤도에 올라섰고, 경기도는 '국정 제1동반자'로서 '이재명 정부' 성공의 '현장책임자'가 되겠다&quot;면서 &quot;이제는 중앙정부의 성과를... ",http://www.suwonilbo.kr/news/articleView.html?idxno=314341,http://www.suwonilbo.kr/news/articleView.html?idxno=314341,"Mon, 02 Feb 2026 14:40:00 +0900"
이재명,보험연구원장 3파전 … 김헌수 교수 유력,"문재인 정부에서는 초대 금융감독원 금융소비자보호처장(부원장급) 후보 1순위로 거론되기도 했으며, 지난 대선에서는 더불어민주당 이재명 후보의 정책 싱크탱크인 '성장과 통합'의 금융분과 공동부위원장으로... ",http://www.globalepic.co.kr/view.php?ud=2026020214350380027cc35ccc5c_29,http://www.globalepic.co.kr/view.php?ud=2026020214350380027cc35ccc5c_29,"Mon, 02 Feb 2026 14:40:00 +0900"
이재명,민주·혁신당 '2차종합 특검' 후보 추천…&quot;李대통령 사흘 내 임명&quot;,이재명 대통령이 3일 내 추천된 후보 중 1명을 특별검사로 임명하면 준비 기간을 거쳐 공식 수사에 들어간다.... 추천했고 이재명 대통령이 3일 이내에 1명을 임명하게 된다&quot;며 이같이 말했다. 2차 종합특검법은 민주당이... ,https://www.newsis.com/view/NISX20260202_0003499199,https://n.news.naver.com/mnews/article/003/0013743680?sid=100,"Mon, 02 Feb 2026 14:40:00 +0900"
이재명,"민주·혁신당, 2차 종합특검 1명씩 추천…3일 이내 대통령 임명",이에 이재명 대통령은 지난달 20일 국무회의에서 해당 법안을 의결했다. 2차 종합특검은 3대 특검(내란·김건희·순직해병)에서 다루지 못했던 '노상원 수첩' 등 17개의 의혹을 총 170일간 수사할 수 있다. 인원은 특검... ,https://www.news1.kr/politics/assembly/6059088,https://n.news.naver.com/mnews/article/421/0008748447?sid=100,"Mon, 02 Feb 2026 14:39:00 +0900"
이재명,김동연 &quot;경기도가 이재명 정부 성공의 '현장 책임자' 될 것&quot;,&quot;정부 제시 잠재성장률 3% 중 2% 책임…민선 7기 이어달리기 가속&quot; 김동연 경기도지사는 2일 &quot;경기도는 '국정 제1동반자'로서 이재명 정부 성공의 '현장 책임자가'가 되겠다&quot;고 재차 강조했다. 김 지사는 이날 도청에서 열린... ,https://www.yna.co.kr/view/AKR20260202110800061?input=1195m,https://n.news.naver.com/mnews/article/001/0015879967?sid=102,"Mon, 02 Feb 2026 14:39:00 +0900"
이재명,김동연 &quot;신천지에게 사탄의 수괴란 얘기 들어…접촉 말 안돼&quot;,신천지가 지난해 더불어민주당 대선 경선 당시 이재명 당시 후보 외의 다른 후보 측에 접근한 정황이 있다는... 앞서 한 언론은 지난해 4월 민주당 대선 후보 최종 경선 행사장에 일부 신천지 인사들이 참석해 이재명 당시... ,https://news.jtbc.co.kr/article/NB12282956?influxDiv=NAVER,https://n.news.naver.com/mnews/article/437/0000476388?sid=102,"Mon, 02 Feb 2026 14:38:00 +0900"
이재명,"전주·완주 통합, 안호영 찬성으로 다시 수면 위…정동영·이성윤 동석","이재명 정부가 광주·전남, 대전·충남 통합에 각각 4년간 최대 20조원에 달하는 재정 지원을 약속한 것이... “흡수 통합은 반대” 안 의원은 태도 변화의 배경으로 이재명 정부의 ‘5극 3특’ 국가균형발전 정책 기조를... ",https://www.joongang.co.kr/article/25402046,https://n.news.naver.com/mnews/article/025/0003500603?sid=102,"Mon, 02 Feb 2026 14:38:00 +0900"
이재명,[프로필] 김좌관 국가물관리위원장…&quot;4대강 재자연화 풀 것&quot;,이재명 정부 신임 국가물관리위원회 위원장에 김좌관 부산가톨릭대학교 석좌교수가 임명됐다. 2일 임명된 김 위원장은 1960년 부산 출생으로 부산동성고등학교와 부경대학교 환경공학과를 졸업했다. 김 위원장은 대통령... ,https://www.news1.kr/politics/president/6059086,https://n.news.naver.com/mnews/article/421/0008748443?sid=100,"Mon, 02 Feb 2026 14:37:00 +0900"
이재명,“한동훈이 티켓 장사? 김어준은 더 받았다…선관위 문의한 뒤 가격 정...,스타일은 이재명 대통령하고 거의 비슷한 것 같다”며 “스타일리스트가 이 대통령이랑 좀 비슷하게... 이재명 정부 국무위원과 더불어민주당 의원이 민주당 정청래 대표와 조국혁신당 조국 대표의 ‘합당 밀약설’을... ,https://www.donga.com/news/Politics/article/all/20260202/133279761/1,https://n.news.naver.com/mnews/article/020/0003694283?sid=100,"Mon, 02 Feb 2026 14:37:00 +0900"
이재명,"[국회라이브1/정치직설] 배종호 &quot;이광재, 강원도지사 불출마…'원팀' 위...",그래서 반대하는 목소리는 대체로 이재명 대통령하고 친한 분들이거나 또는 김민석 총리하고 친한... 뭐라고 했냐면 지금 이런 조국혁신당과의 합당 추진 움직임은 이재명의 민주당을 정청래의 민주당으로 전환하려는... ,https://www.natv.go.kr/natv/news/newsView.do?newsId=512588,https://www.natv.go.kr/natv/news/newsView.do?newsId=512588,"Mon, 02 Feb 2026 14:36:00 +0900"
이재명,&quot;노력은 배신 안해...伊설원과 빙판에서 노력의 결실 꽃필것&quot;이재명 대...,이재명 대통령이 밀라노-코르티나동계패럴림픽에 출전하는 태극전사들을 향해 축사로 응원의 메시지를... 이날 이재명 대통령이 보낸 축사를 최휘영 문체부 장관이 대독했다. 이재명 대통령은 지난주 국무회의에서... ,https://www.sportschosun.com/sports-news/2026-02-02/202602020100010580000659,https://m.sports.naver.com/milanocortina2026/article/076/0004370619,"Mon, 02 Feb 2026 14:36:00 +0900"
이재명,"김재원 ''대통령, 설탕세·부동산·주식까지 과잉 개입''","최고위원회의에서 이재명 대통령의 국정 운영 태도를 강하게 질타했다. 그는 &quot;대통령이 모든 분야에 개입하며 만물박사 행세를 하고 있다. 부동산, 주식, 심지어 생리대 문제까지 SNS로 개입한다&quot;며 &quot;참모들은 아부만 하고... ",https://www.gukjenews.com/news/articleView.html?idxno=3495592,https://www.gukjenews.com/news/articleView.html?idxno=3495592,"Mon, 02 Feb 2026 14:36:00 +0900"
이재명,"&quot;돈 벌어오는 CEO 서울시장 되겠다&quot;...전현희, 서울시장 출마 선언",전 의원은 &quot;서울은 '오세훈 표 겉멋 정치 전시행정'이 아닌 '이재명표 실리주의 실용 행정'이 필요하다&quot;면서 &quot;동대문 일대 상권을 부흥시켜 서울의 핵심 문화관광 특구로 조성해 다시 강북 시대를 열겠다&quot;고 강조했다.,http://www.newsprime.co.kr/news/article.html?no=722648,http://www.newsprime.co.kr/news/article.html?no=722648,"Mon, 02 Feb 2026 14:36:00 +0900"
이재명,"이언주 “2인자, 3인자들이 간판 되려는 욕망”, 정청래 “당원들에게 ...",이 최고위원은 “조기 합당은 민주당 주류 교체 시도이자 이재명의 민주당을 정청래·조국의 민주당으로 전환하려는 시도”라고 노골적으로 불만을 드러냈다. 그는 “이 사안의 정치적 본질은 대통령 지지율이 매우 높고... ,https://weekly.khan.co.kr/article/202602021436001,https://n.news.naver.com/mnews/article/033/0000050234?sid=100,"Mon, 02 Feb 2026 14:36:00 +0900"
이재명,"민주, '1인 1표제' 당헌 개정 재표결 돌입",그는 &quot;여러분의 소중한 한 표가 '더 큰 민주당'과 '더 강한 이재명 정부'를 만드는 버팀목이 될 것&quot;이라고... 유동수 중앙위원회 부의장 역시 &quot;6월 지방선거 승리는 이재명 정부의 국정을 뒷받침할 시대적 소명&quot;이라며 이번... ,https://www.mediapen.com/news/view/1078882,https://www.mediapen.com/news/view/1078882,"Mon, 02 Feb 2026 14:36:00 +0900"
이재명,"李대통령, 재경부 2차관 허장·우주항공청장 오태석 임명(상보)",이재명 대통령이 2일 장·차관급 등 4명에 대한 인사를 단행했다. 강유정 대통령실 대변인은 이날 청와대 춘추관에서 브리핑을 통해 △재정경제부 2차관 △우주항공청장 △국가 물관리위원회 위원장 △아시아문화중심도시... ,http://www.edaily.co.kr/news/newspath.asp?newsid=03886806645346584,https://n.news.naver.com/mnews/article/018/0006211573?sid=100,"Mon, 02 Feb 2026 14:36:00 +0900"
정상순방,2026년 한국의 4강 외교 과제와 한반도 평화,"ⓒ 대통령실 국제 평화·공동번영 주도할 기반 갖춘 한국의 실용 외교 이재명 대통령은 작년 후반 6개월간 다자외교 5회, 9개국 순방 및 35차례 정상회담을 가졌다. 올해 들어 중국과 일본을 방문해 전쟁 중인 러시아를... ",https://www.ohmynews.com/NWS_Web/View/at_pg.aspx?CNTN_CD=A0003203765&CMPT_CD=P0010&utm_source=naver&utm_medium=newsearch&utm_campaign=naver_news,https://n.news.naver.com/mnews/article/047/0002503509?sid=104,"Mon, 02 Feb 2026 10:56:00 +0900"
정상순방,2026년 한국의 4강 외교 과제와 한반도 평화,"홍현익 전 국립외교원장 국제 평화·공동번영 주도할 기반 갖춘 한국의 실용 외교 이재명 대통령은 작년 후반 6개월간 다자외교 5회, 9개국 순방 및 35차례 정상회담을 가졌다. 올해 들어 중국과 일본을 방문해 전쟁 중인... ",https://www.korea.kr/news/cultureColumnView.do?newsId=148958903&call_from=naver_news,https://www.korea.kr/news/cultureColumnView.do?newsId=148958903&call_from=naver_news,"Mon, 02 Feb 2026 10:50:00 +0900"
정상순방,"“국회 너무 느리다”던 이 대통령, 주말 ‘SNS 글 폭풍’…‘정책 텐션...","취임 초 외국 정상과의 통화, 다자외교·순방 성과, 정부 구성 소식 등을 주로 알렸는데, 1월부터 부동산값 안정 등 정책 이슈 비율이 크게 늘었다. 대통령실은 부쩍 잦아진 에스엔에스 활용 배경에 △정책 일관성과 실현... ",https://www.hani.co.kr/arti/politics/bluehouse/1242761.html,https://n.news.naver.com/mnews/article/028/0002789411?sid=100,"Sun, 01 Feb 2026 16:56:00 +0900"
국회,[기자수첩] 네 번째 대통령의 존영,"최고위가 열리는 국회 본청 당대표실 우측 벽면에는 보수 진영이 배출한 세 명의 대통령(이승만·박정희·김영삼)의 존영이 걸려있는데, 앞으로 추가될 네 번째 대통령의 초상화를 배치할 공간이 마땅치 않아보였다. 아마... ",http://www.m-i.kr/news/articleView.html?idxno=1332471,http://www.m-i.kr/news/articleView.html?idxno=1332471,"Mon, 02 Feb 2026 14:44:00 +0900"
국회,이장우 대전시장 “단순한 물리적 대전·충남 통합은 반대”,특별법안’이 국회에 제출됐다. 이와관련 이 시장은 지난 1월 30일 더불어민주당 당론으로 발의된... 이 시장은 &quot;국회 입법 과정에서 이러한 중앙과 지방 간 권한과 재정 불균형이 반드시 수정돼야 한다&quot;며 &quot;대통령의... ,http://www.inews24.com/view/1934603,https://n.news.naver.com/mnews/article/031/0001002094?sid=102,"Mon, 02 Feb 2026 14:44:00 +0900"
국회,"오세훈 “1·29 대책, 일방적 발표… 정비구역 지정 25만가구 착공 1년 ...","오 시장은 이날 국회에서 열린 ‘국민의힘-서울시 부동산정책협의회’ 모두발언에서 이같이 말하며 “이미 실패로 판명된 문재인 정부의 8·4 대책을 떠올리게 한다”고 했다. 오 시장은 용산 국제업무지구, 태릉CC 부지가... ",https://biz.chosun.com/real_estate/real_estate_general/2026/02/02/QF5NQN3YR5FDNAYIX4YEA7PBE4/?utm_source=naver&utm_medium=original&utm_campaign=biz,https://n.news.naver.com/mnews/article/366/0001139945?sid=101,"Mon, 02 Feb 2026 14:44:00 +0900"
국회,"전주시·전주시의회 &quot;안호영 의원, 완주·전주 통합 찬성 결단 환영&quot;","완주·전주 행정통합에 부정적 입장이었던 안호영 국회의원(완주·진안·무주·장수)이 2일 기자회견을 통해... 정부와 국회, 전북특별자치도와 양 시·군, 그리고 정치권 모두가 책임 있는 논의 구조를 만들어야 한다&quot;고... ",https://www.news1.kr/local/jeonbuk/6059073,https://n.news.naver.com/mnews/article/421/0008748466?sid=102,"Mon, 02 Feb 2026 14:43:00 +0900"
국회,"靑, 유튜브 등 새로운 출입 기자단 추가 모집 나서",아울러 ▷국회 2년 이상 출입 경력 ▷중앙정부부처나 이에 준하는 공공기관 2곳 이상에 총 5년 이상 출입 경력 ▷뉴미디어 활동 경력 2년 이상 중 하나의 요건을 충족해야 한다. 앞서 이규연 청와대 홍보소통수석은 지난달... ,https://biz.heraldcorp.com/article/10667856?ref=naver,https://n.news.naver.com/mnews/article/016/0002594631?sid=100,"Mon, 02 Feb 2026 14:43:00 +0900"
국회,부동산정책협의회 참석하는 송언석-오세훈,송언석 국민의힘 원내대표와 오세훈 서울시장이 2일 오전 서울 여의도 국회에서 열린 국민의힘-서울시 부동산정책협의회에 참석하고 있다./사진=이용우 기자,https://www.gukjenews.com/news/articleView.html?idxno=3495623,https://www.gukjenews.com/news/articleView.html?idxno=3495623,"Mon, 02 Feb 2026 14:42:00 +0900"
국회,[기자의눈] '특별'할 것 없는 특검의 민낯,특검법을 입법하고 통과시킨 국회는 2차 종합특검을 통해 다시 진상규명에 나서야 한다고 말한다. 3대(내란... '특검을 통한 진실규명'을 외치는 국회가 법원의 판단을 어떻게 받아 들이고 해석할 것인지 궁금하다. 2차... ,https://www.asiatoday.co.kr/view.php?key=20260131010013997,https://www.asiatoday.co.kr/view.php?key=20260131010013997,"Mon, 02 Feb 2026 14:42:00 +0900"
국회,국민의힘-서울시 부동산정책협의회,송언석 국민의힘 대표와 오세훈 서울시장을 비롯한 참석자들이 2일 오전 서울 여의도 국회에서 열린 국민의힘-서울시 부동산정책협의회에서 기념촬영을 하고 있다./사진=이용우 기자,https://www.gukjenews.com/news/articleView.html?idxno=3495626,https://www.gukjenews.com/news/articleView.html?idxno=3495626,"Mon, 02 Feb 2026 14:42:00 +0900"
국회,[일요서울TV] &quot;위대한 전진을 위한 준비&quot; 김재원 경북지사 출마 선언,김재원 국민의힘 최고위원이 2일 국회에서 기자회견을 열어 경상북도지사 출마 선언을 하고 있다. 2026.02.02 일요서울TV,https://www.ilyoseoul.co.kr/news/articleView.html?idxno=512558,https://www.ilyoseoul.co.kr/news/articleView.html?idxno=512558,"Mon, 02 Feb 2026 14:42:00 +0900"
국회,&quot;이제 월 250만원은 못 뺏긴다&quot;…압류 막아주는 '생계비계좌' 등장,"법무부는 지난달 8일 '민사집행법' 개정안이 국회를 통과하고, 지난달 20일에는 '민사집행법 시행령' 개정안이 국무회의를 통과했다고 밝힌 바 있다. 이에 따라 2월부터 누구나 국내 시중은행, 지방은행 등 다양한... ",https://sports.hankooki.com/news/articleView.html?idxno=6923851,https://sports.hankooki.com/news/articleView.html?idxno=6923851,"Mon, 02 Feb 2026 14:42:00 +0900"
국회,"“속도 내는 정부, 멈추라는 업계”…제네릭 약가 인하 충돌",홍정기 한국제약바이오협회 상무는 국회 정책토론회에서 제도 시행 유예를 적극 강조했다. 협회차원에서는... 업계 반발에 국회도 움직임을 보이고 있다. 보건복지위 여당 의원들은 정부의 R&amp;D 차등 우대책이... ,https://www.mediapen.com/news/view/1078859,https://www.mediapen.com/news/view/1078859,"Mon, 02 Feb 2026 14:42:00 +0900"
국회,"전남도의회, 행정통합 특별법 동의안 4일 처리키로",전남도의회가 전남·광주 행정통합특별법 통과를 위해 국회 일정에 맞춰 오는 4일 특별법 동의안을... 앞서 지난달 30일 더불어민주당은 당론으로 채택한 '전남광주통합특별시 설치를 위한 특별법안'을 서울 여의도 국회... ,https://www.namdonews.com/news/articleView.html?idxno=900006,https://www.namdonews.com/news/articleView.html?idxno=900006,"Mon, 02 Feb 2026 14:42:00 +0900"
국회,"한국거래소, 코스피 5000 기념 세미나 개최…향후 자본시장 과제 논의","행사는 정은보 한국거래소 이사장의 개회사로 시작되며, 이억원 금융위원회 위원장과 강준현 더불어민주당 의원(국회 정무위원회 여당 간사), 오기형 더불어민주당 의원(코스피5000 특별위원회 위원장)이 축사에... ",https://www.ajunews.com/view/20260202144007488,https://www.ajunews.com/view/20260202144007488,"Mon, 02 Feb 2026 14:42:00 +0900"
국회,곰팡이부터 이물질까지…'두쫀쿠' 위생 신고 급증,"국회 보건복지위원회 소속 더불어민주당 서미화 의원실이 식약처에서 제출받은 자료에 따르면, 위생 관리와 무허가 영업이 각각 7건으로 가장 많았습니다. 그 뒤를 이물질 발견 2건, 기타 2건, 표시사항 1건 등이었습니다.... ",http://www.yonhapnewstv.co.kr/MYH20260202144157aSM,https://n.news.naver.com/mnews/article/422/0000829384?sid=101,"Mon, 02 Feb 2026 14:42:00 +0900"
