Keyword,Title,Description,Original Link,Link,Publication Date
재경부,비수도권 중견기업에 청년 고용 장려금,올 1분기 청년 고용률이 43.5%로 코로나19 이후 최저 수준으로 집계된 만큼 국가 차원의 총체적 대응이 필요한 상황이라고 재경부는 설명했다. ‘쉬었음’ 청년의 사회적 고립을 막기 위해 상담→회복→훈련→취업을 전... ,https://www.hankyung.com/article/2026042963241,https://n.news.naver.com/mnews/article/015/0005281450?sid=101,"Wed, 29 Apr 2026 18:08:00 +0900"
재경부,작년 국고채 ‘역대 최대’ 226兆 발행… 두차례 추경에 70兆 증가,"구윤철 부총리 겸 재경부 장관은 발간사에서 “우리 국채 시장이 추경·재정 신속 집행 등 경제 회복... 재경부에 따르면, 이달 1일부터 27일까지 국고채 순매수 규모가 결제액 기준 7조9000억원으로 집계됐다. 체결... ",https://biz.chosun.com/policy/policy_sub/2026/04/29/V2SOX6NVU5ELHHQNTQAIOTILLQ/?utm_source=naver&utm_medium=original&utm_campaign=biz,https://n.news.naver.com/mnews/article/366/0001160868?sid=101,"Wed, 29 Apr 2026 17:57:00 +0900"
재경부,‘청년뉴딜’ 발표에 “독서실 인턴 양성” vs “기회 제공 필요”,"재경부 측은 새롭게 생긴 업무에서 청년을 우선 채용하는 것이라고 밝혔다. 재경부 관계자는 “이번 대책의 초점은 단기 일자리나 불필요한 인턴 채용이 아닌, 일경험 제공, 취업역량 강화 등에 맞춰져 있다”고... ",https://www.segye.com/newsView/20260429516909?OutUrl=naver,https://n.news.naver.com/mnews/article/022/0004124648?sid=101,"Wed, 29 Apr 2026 17:33:00 +0900"
재경부,‘고용절벽’ 청년 10만명에 취업 지원…총 8000억 투입,"재경부 관계자는 “이번 청년뉴딜 방안으로 10만명의 청년들이 취업에 필요한 서비스를 받게 될 것&quot;이라며 “이번 추가경정예산에 이들 사업을 담았고, 청년들이 6월 중 대부분의 프로그램에 선발될 수 있도록 할... ",https://www.ekn.kr/web/view.php?key=20260429025401161,https://www.ekn.kr/web/view.php?key=20260429025401161,"Wed, 29 Apr 2026 17:30:00 +0900"
재경부,"재경부, 부처 최초 AI 해커톤 개최…업무용 서비스 발굴",재경부는 6월 10일부터 12일까지 2박 3일간 태안연수원에서 ‘생성형 AI 서비스 발굴 해커톤’을 개최한다고... 이번 대회는 재경부 업무에 특화된 AI 서비스를 개발하는 데 초점을 맞춘다. 참가자들은 제한된 시간 안에... ,https://www.munhwa.com/article/11586017?ref=naver,https://n.news.naver.com/mnews/article/021/0002788368?sid=101,"Wed, 29 Apr 2026 17:15:00 +0900"
재경부,작년 국고채 발행 226조 '사상 최대'…외국인 투자도 역대 최고,"재경부는 WGBI 편입에 앞서 해외 투자설명회 개최와 외국인 투자 제도 개선 등을 통해 해외 자금 유입... 재경부는 외국인 투자자 대상 설명을 강화하기 위해 영문판 'Korea Treasury Bonds 2025'도 함께 발간했으며, 해당... ",http://www.newsfc.co.kr/news/articleView.html?idxno=78406,http://www.newsfc.co.kr/news/articleView.html?idxno=78406,"Wed, 29 Apr 2026 17:14:00 +0900"
재경부,지난해 국고채 발행 첫 200조 돌파…외국인 비중도 '최고',"구윤철 부총리 겸 재경부 장관은 발간사에서 &quot;지난해 226조2000억원의 국고채를 성공적으로 발행해 연간 발행규모 200조원을 최초로 돌파했다&quot;며 &quot;추경, 재정 신속집행 등 경제회복 노력을 뒷받침해주는 든든한... ",https://www.ajunews.com/view/20260429170453534,https://www.ajunews.com/view/20260429170453534,"Wed, 29 Apr 2026 17:10:00 +0900"
재경부,대기업이 직접 청년 교육…8000억원 투입해 ‘쉬었음 청년’ 일터로 부...,제공에 초점이 맞춰져 있어 고용 지표 개선에 한계가 있다는 지적이 나온다. 이주섭 재경부 민생경제국장은 “당장의 취업자 수 목표보다는 청년들에게 도약과 경험의 기회를 제공하는 데 중심을 뒀다”고 설명했다.,https://www.seoul.co.kr/news/economy/2026/04/29/20260429500229?wlog_tag3=naver,https://n.news.naver.com/mnews/article/081/0003639867?sid=101,"Wed, 29 Apr 2026 17:04:00 +0900"
재경부,'쉬었음' 등 청년 10만명에게 '고용시장 진입' 기회 준다,재정경제부(재경부) 장관 주재로 ‘민관합동 청년뉴딜 보고회’를 열고 이런 내용의 ‘청년뉴딜 추진방안’을 관계부처 합동으로 발표했다. 재경부에 따르면 국내 전체 취업자 수 증가 폭(전년 동월 대비)은 지난 2월... ,http://www.kookje.co.kr/news2011/asp/newsbody.asp?code=0200&key=20260429.99099008238,https://n.news.naver.com/mnews/article/658/0000142436?sid=101,"Wed, 29 Apr 2026 17:03:00 +0900"
기획처,[공공 DR ①] 대개편 앞둔 '공공 시스템'…공공 DR 시장 열린다,"이 중 463억 원은 행안부 안전디딤돌, 기획처 디브레인, 과기부 인터넷우체국 등 3개 시스템의 민간 클라우드 이전에 배정되며 나머지 1,658억 원은 주민등록, 나라장터, 119구급스마트, 통합보훈, 혈액통합관리 등 10개... ",http://www.itdaily.kr/news/articleView.html?idxno=239111,http://www.itdaily.kr/news/articleView.html?idxno=239111,"Thu, 30 Apr 2026 07:06:00 +0900"
기획처,[오늘의 주요일정·30일] '서부지법 난동범들' 상고심 선고,"국회) ▲ 기획처, 재경위 전체회의(10:00 국회) ▲ 기획처, 비상경제본부회의 겸 경제관계장관회의 겸 대외경제장관회의(14:00 정부서울청사) ▲ 기획처, 제8차 재정집행 점검회의(15:00) ▲ 금융위, 주간업무회의(10... ",https://www.safetimes.co.kr/news/articleView.html?idxno=242401,https://www.safetimes.co.kr/news/articleView.html?idxno=242401,"Thu, 30 Apr 2026 07:04:00 +0900"
기획처,"김위상 의원, ‘기후위기 시대, 지속가능한 수도사업 정책 토론회’ 개...","이어지는 토론은 세종대학교 맹승규 교수가 좌장을 맡고 백명수 먹는물 네트워크 이사, 이충기 한국방송통신대학교 교수, 박정수 한밭대학교 교수, 김상훈 기후부 수도기획과 과장, 박일준 K-water 수도기획처 처장이... ",https://www.ksmnews.co.kr/news/view.php?idx=603095,https://www.ksmnews.co.kr/news/view.php?idx=603095,"Wed, 29 Apr 2026 20:42:00 +0900"
기획처,"김위상, 기후위기 속 기존 수도체계 한계 지적","이어지는 토론은 세종대학교 맹승규 교수가 좌장을 맡고 백명수 먹는물 네트워크 이사, 이충기 한국방송통신대학교 교수, 박정수 한밭대학교 교수, 김상훈 기후부 수도기획과 과장, 박일준 K-water 수도기획처 처장이... ",https://www.ksmnews.co.kr/news/view.php?idx=603139,https://www.ksmnews.co.kr/news/view.php?idx=603139,"Wed, 29 Apr 2026 20:40:00 +0900"
기획처,예타 착수에 국가계획 반영… 충청 광역도로망 구축사업 속도,"최근 시와 국토부, 기획처 등 관계 기관 간 협의를 진행 중으로, 협의 결과에 따라 기본 설계도 마무리될 전망이다. 시는 연내 기본설계를 마치겠다는 목표다. 추산 총사업비는 850억 원이다. 대전과 세종을 연결하는 또... ",https://www.daejonilbo.com/news/articleView.html?idxno=2272471,https://n.news.naver.com/mnews/article/656/0000175170?sid=102,"Wed, 29 Apr 2026 19:48:00 +0900"
기획처,"S&amp;P, 한국 신용등급 AA 유지…고유가 충격에도 '완충 여력'",기획처는 &quot;이번 등급 발표에 앞서 S&amp;P 연례협의단과 면담을 실시하면서 한국 경제의 경쟁력과 정책 방향을 명확히 설명하는 등 적극 대응했다&quot;며 &quot;앞으로도 한국 경제의 국가신인도가 안정적으로 유지될 수 있도록... ,https://www.newspim.com/news/view/20260429001357,https://www.newspim.com/news/view/20260429001357,"Wed, 29 Apr 2026 18:44:00 +0900"
기획처,"기획처, 반도체·로봇·조선 등 핵심산업 투자 방향 점검",기획처는 29일 서울지방조달청에서 조용범 예산실장 주재로 산업연구원과 기업 관계자들이 참석한 가운데... 방문하는 ‘기획처 예산실 The 100 현장경청 프로젝트’의 일환으로 진행됐다. 정부 측에서는 조용범 예산실장과... ,https://www.sedaily.com/article/20038659?ref=naver,https://n.news.naver.com/mnews/article/011/0004615997?sid=101,"Wed, 29 Apr 2026 16:19:00 +0900"
기획처,기획처 &quot;핵심산업 경쟁력 강화&quot;…전략적 재정투자 모색,아주경제=장선아 기자 sunrise@ajunews.com 기획처[사진=기획예산처] 기획예산처는 핵심 산업 경쟁력 강화를 위한 재정투자 방안을 마련하기로 했다. 29일 기획처는 서울지방조달청에서 '산업 경쟁력 강화를 위한 전략적... ,https://www.ajunews.com/view/20260429160134338,https://www.ajunews.com/view/20260429160134338,"Wed, 29 Apr 2026 16:14:00 +0900"
기획처,반도체·조선 등 산업계 한목소리…정부 재정투자 확대 요구,기획처는 이번 간담회를 통해 수렴된 의견을 향후 예산 편성에 반영할 계획이다. 기업 현장의 애로사항과 위험 요인을 선제적으로 해소하는 방향으로 재정투자 방안을 구체화한다는 방침이다.,https://www.dailian.co.kr/news/view/1639477/?sc=Naver,https://n.news.naver.com/mnews/article/119/0003086001?sid=101,"Wed, 29 Apr 2026 16:12:00 +0900"
기획처,기획처 &quot;국가가 적극 투자자로 나설 전환기…핵심산업 적극 투자&quot;,"29일 기획처에 따르면 조용범 예산실장은 이날 서울지방조달청에서 산업연구원 및 반도체, 전기·전자... 후속으로, 기획처 예산실이 100곳 이상의 예산 현장을 방문하는 'The 100 현장경청 프로젝트' 52차 일정으로 마련됐다.... ",https://www.news1.kr/economy/trend/6152947,https://n.news.naver.com/mnews/article/421/0008919291?sid=101,"Wed, 29 Apr 2026 15:47:00 +0900"
기획처,기획처 &quot;공급망 불안·기술 경쟁 격화…전략산업 재정투자 확대 모색&quot;,적극적 재정투자를 할 수 있도록 구체적인 방안을 모색해 나가겠다&quot;고 답했다. 기획처는 이번 간담회에서 제기된 의견을 토대로 첨단산업 경쟁력 확보를 위한 재정투자 방향을 구체화해 향후 예산 편성에 반영할 계획이다.,https://www.newsis.com/view/NISX20260429_0003611637,https://n.news.naver.com/mnews/article/003/0013917623?sid=101,"Wed, 29 Apr 2026 15:33:00 +0900"
기획처,"[단독] 인사불만 커지자 결국…재경부-기획처, 팀장급 이하 일대일 맞교...",박홍근 기획처 장관 취임 이후 조직 안정화가 이뤄지면서 기계적 분리로 발생했던 인사 미스매치를 위한 해소 노력이 시작된 것으로 보인다. 재경부와 기획처는 29일부터 내달 11일까지 부처 간 전출입 희망자를 조사한다.... ,https://view.asiae.co.kr/article/2026042913540435305,https://n.news.naver.com/mnews/article/277/0005756571?sid=101,"Wed, 29 Apr 2026 14:02:00 +0900"
기획처,"박홍근의 공간혁신…기획예산처, 세종청사 최초 자녀돌봄워크센터 조성",29일 관가에 따르면 기획처는 새로 이전 중인 세종청사 5동(옛 해양수산부 건물)에... 기획처 관계자는 &quot;세종청사 내에서는 처음으로 기획처가 업무와 육아를 병행할 수 있는 공간을 만드는 것&quot;이라며 &quot;놀이공간과... ,https://view.asiae.co.kr/article/2026042908280388465,https://n.news.naver.com/mnews/article/277/0005756335?sid=101,"Wed, 29 Apr 2026 09:41:00 +0900"
기획처,&quot;기후재난 및 첨단산업 수요 급증에 대비한 물관리 패러다임 전환 모색...,"이어지는 토론은 세종대 맹승규 교수가 좌장을 맡고 백명수 먹는물 네트워크 이사 , 이충기 한국방송통신대 교수 , 박정수 한밭대 교수 , 김상훈 기후부 수도기획과 과장 , 박일준 K-water 수도기획처 처장이 참여하여 열띤... ",https://www.pinpointnews.co.kr/news/articleView.html?idxno=449498,https://www.pinpointnews.co.kr/news/articleView.html?idxno=449498,"Wed, 29 Apr 2026 09:02:00 +0900"
기획처,[오늘의 주요일정·29일] 포스코 '직고용·온전한 정규직' 기자회견,"(홍콩·싱가포르) ▲ 기획처, 국무회의(임시) 겸 비상경제본부회의(08:30 정부서울청사) ▲ 기획처, 재정정책자문회의 민간위원 오찬간담회(12:00) ▲ 기획처, 재경위 법안소위(14:00 국회) ▲ 공정위... ",https://www.safetimes.co.kr/news/articleView.html?idxno=242354,https://www.safetimes.co.kr/news/articleView.html?idxno=242354,"Wed, 29 Apr 2026 07:04:00 +0900"
기획처,학생 줄어도 재정은 급증… 교육교부금 개편 논의 ‘재점화’,"내국세의 20.79% 자동 배정 구조 기획처, 연동 비율 단계 축소 검토 고등교육 예산으로 전환 방안 거론... 기획처는 교육교부금을 ‘고등교육’에, 행안부는 지역균형발전에 쓰길 희망한다. 한 경제부처 관계자는... ",https://www.seoul.co.kr/news/society/education-news/2026/04/29/20260429016001?wlog_tag3=naver,https://n.news.naver.com/mnews/article/081/0003639571?sid=102,"Wed, 29 Apr 2026 05:02:00 +0900"
기획처,보조금 부정수급 992건 적발…&quot;관리단 2년 연장&quot;,기획처 관계자는 “관리단 업무를 위탁한 한국재정정보원에서 단기 인력을 채용해 투입하려 하고 있는... 이상의 부정수급 사건은 기획처 산하 보조금관리위원회가 직접 심의하도록 해 처벌의 실효성을 높일 방침이다.,http://www.edaily.co.kr/news/newspath.asp?newsid=01685926645421040,https://n.news.naver.com/mnews/article/018/0006268658?sid=101,"Wed, 29 Apr 2026 05:02:00 +0900"
기획처,[관가뒷담] 부총리도 안 한 대국민 타운홀미팅 한 ‘4선’ 기획처 장관,기획처는 이번 행사를 시작으로 오는 6월까지 두 차례 정도 대국민 타운홀 미팅을 추가로 계획하고 있는... 박 장관의 파격 행보가 이어질수록 기획처와 재정경제부 두 부처 간의 미묘한 위상 변화나 서열 정리가 이뤄지는... ,https://www.kmib.co.kr/article/view.asp?arcid=0029747465&code=61141111&cp=nv,https://n.news.naver.com/mnews/article/005/0001846048?sid=101,"Wed, 29 Apr 2026 05:02:00 +0900"
기획처,‘李 정부 나라 곳간지기’ 박홍근 “쓰일 곳에 제대로”…국민과 150분...,"기획처 이용욱 재정참여정책관, 정창길 재정성과국장, 박창환 예산총괄심의관은 국민참여예산제도... 개인은 기획처 장관 명의의 포상·표창을 준비하고, 연말 정부 업무평가에 반영되도록 할 계획”이라고 설명했다.... ",https://biz.heraldcorp.com/article/10727717?ref=naver,https://n.news.naver.com/mnews/article/016/0002636755?sid=101,"Tue, 28 Apr 2026 19:17:00 +0900"
기획처,"중수청, 검찰청사 안쓴다…준비단장 행안차관·부단장 현직검사(종합)","검·경·인사처·기획처 등 64명 규모로 개청 준비…30일 출범 본청 청사, 서울 을지로 2곳 후보지로…추후 신청사 이전 유력 양정우 이밝음 기자 = 올해 10월 출범하는 중대범죄수사청(이하 중수청) 개청 준비를 위한 범정부... ",https://www.yna.co.kr/view/AKR20260427137251530?input=1195m,https://n.news.naver.com/mnews/article/001/0016048579?sid=102,"Tue, 28 Apr 2026 18:13:00 +0900"
기획처,박홍근 &quot;예산편성 과정 투명하게 공개…결과는 끝까지 책임&quot;,"국민, 민간전문가, 중앙부처, 지방정부 관계자 등 120여명이 참석했다. 기획처는 이번 행사를 시작으로 중장기 국가발전전략, 재정지출 효율화 등을 주제로 국민과의 소통 행보를 지속할 계획이다.",http://www.edaily.co.kr/news/newspath.asp?newsid=05120086645420712,https://n.news.naver.com/mnews/article/018/0006268552?sid=101,"Tue, 28 Apr 2026 17:45:00 +0900"
기획처,[기자의 눈]IMF를 반박하는 한국의 격세지감,기획처는 “한국 부채 전망치는 주요국 대비 낮은 수준”이라며 설명자료까지 냈다. IMF 보고서 한 줄에... 기획처는 IMF가 2021년 한국의 2023년 부채비율을 61.0%로 전망했지만 실제는 50.5%에 그쳤다는 점을 반박... ,https://www.sedaily.com/article/20038190?ref=naver,https://n.news.naver.com/mnews/article/011/0004615598?sid=110,"Tue, 28 Apr 2026 17:35:00 +0900"
기획처,[Who Is ?] 박홍근 기획예산처 장관,박홍근 기획예산처 장관이 취임 첫날인 2026년 3월25일 세종시 정부세종청사에서 기획처 직원들과 소통... 기획처는 2008년 기획재정부로 통합됐다가 18년 만에 정부조직 개편으로 재출범했다. 기재부에서 분리 신설된... ,https://www.businesspost.co.kr/BP?command=article_view&num=436328,https://www.businesspost.co.kr/BP?command=article_view&num=436328,"Tue, 28 Apr 2026 17:34:00 +0900"
기획처,추경 부담·청년지원 쏟아진 질문들…국민 앞에 선 예산당국,"기획예산처는 28일 서울 명동 커뮤니티하우스 마실에서 박홍근 기획처 장관 주재로 국민, 민간 전문가, 부처 및 지방정부 참석자 120여 명과 함께 '국민과 함께 만드는 나라살림' 타운홀 미팅을 개최했다고 밝혔다. 박홍근... ",https://www.newspim.com/news/view/20260428001242,https://www.newspim.com/news/view/20260428001242,"Tue, 28 Apr 2026 17:32:00 +0900"
기획처,"기획처, 나라살림 타운홀 미팅…박홍근 “쓰일 곳에 제대로 쓰겠다&quot;","박홍근 기획처 초대 장관 주재로 이날 열린 ‘국민과 함께 만드는 나라살림’ 타운홀 미팅에는 국민, 민간전문가, 부처 및 지방정부 참석자 120여명이 함께 했습니다. 이번 행사는 기획처가 주제 발표를 하고 참석자 전원이... ",https://biz.sbs.co.kr/article_hub/20000307279?division=NAVER,https://n.news.naver.com/mnews/article/374/0000507225?sid=101,"Tue, 28 Apr 2026 17:30:00 +0900"
기획처,&quot;추경으로 미래세대 부담 증가&quot;…국민 쓴소리 경청한 박홍근,"기획처는 28일 서울 명동 커뮤니티하우스 마실에서 박 장관과 국민, 민간전문가, 부처·지방정부 관계자 등... 참석자는 공개 모집을 통해 선정해 다양한 연령대, 성별, 지역의 국민들이 고르게 지원했다고 기획처는 전했다.... ",https://www.newsis.com/view/NISX20260428_0003610054,https://n.news.naver.com/mnews/article/003/0013915469?sid=101,"Tue, 28 Apr 2026 17:29:00 +0900"
기획처,"기획처, 나라살림 타운홀 미팅…“적극적 재정 역할 중요”","박홍근 기획처 장관 주재로 국민, 민간전문가, 부처와 지방정부 관계자 120여명과 '국민과 함께 만드는 나라살림' 타운홀 미팅을 했다고 밝혔다. 타운홀 미팅은 약 2시간 30분 진행됐다. 이번 행사는 기획처가 주제발표를... ",https://www.etoday.co.kr/news/view/2580080,https://www.etoday.co.kr/news/view/2580080,"Tue, 28 Apr 2026 17:28:00 +0900"
기획처,"박홍근, 국가부채 우려에 &quot;재정 지속가능성 경계 늦추지 않을 것&quot;","기획처, '국민과 함께 만드는 나라살림' 타운홀 미팅 개최 박홍근 장관, '국민과 함께 하는 나라 살림' 타운홀... 행보로, 기획처가 주제 발표를 하고 참석자 전원이 자유롭게 질의·답변하는 토론 방식으로 진행됐다. 특히... ",https://news.einfomax.co.kr/news/articleView.html?idxno=4412168,https://news.einfomax.co.kr/news/articleView.html?idxno=4412168,"Tue, 28 Apr 2026 17:24:00 +0900"
기획처,"박홍근 &quot;적극적 재정 역할 중요, 예산 구조조정 통해 지속가능성 경계&quot;",행사는 기획처의 주제 발표 이후 참석자 전원이 자유발언과 질의응답에 참여하는 방식으로 진행됐다. 현장 질의뿐 아니라 유튜브 생중계를 통해 접수된 의견에도 실시간으로 답변이 이뤄졌다. 자유토론에서는 재정... ,https://www.news1.kr/economy/trend/6151769,https://n.news.naver.com/mnews/article/421/0008917079?sid=101,"Tue, 28 Apr 2026 17:23:00 +0900"
기획처,"기획처, 나라살림 타운홀미팅…박홍근 장관 &quot;국민이 예산 주인&quot;","이날 박홍근 기획처 장관은 &quot;어떻게 하면 예산과 재정을 좀 더 국민의 삶 가까이에 만들어 낼 것이냐가... 기획처는 이번 행사를 시작으로 중장기 국가발전전략, 재정지출 효율화 등을 주제로 일반국민과의 소통 행보를... ",https://www.ajunews.com/view/20260428170814863,https://www.ajunews.com/view/20260428170814863,"Tue, 28 Apr 2026 17:16:00 +0900"
금융위,[오늘 재경부 등 경제부처 일정],(12:00) [금융위원회] ▲10:00 위원장 주간업무회의(정부서울청사) ▲16:00 위원장 중기부-금융위-금융지주 MOU(팁스타운 S6) ▲부위원장 해외출장 ※'상호금융 제도개선 TF' Kick-off회의 개최(30일 석간)... ,https://news.einfomax.co.kr/news/articleView.html?idxno=4412494,https://news.einfomax.co.kr/news/articleView.html?idxno=4412494,"Thu, 30 Apr 2026 07:06:00 +0900"
금융위,[현장] ‘핀테크-금융사’ 연결 핵심은 PoC…“스파크는 그 안에서 튄다...,"금융위원회는 이날 이억원 금융위원장 주재로 행사를 열고 핀테크 지원 방식 개편 방향을 제시했다. 단순 창업 지원이나 네트워킹을 넘어 금융회사와의 실증, 투자 연계, 정책금융 지원까지 연결하는 구조로... ",https://www.dailian.co.kr/news/view/1639540/?sc=Naver,https://n.news.naver.com/mnews/article/119/0003086161?sid=101,"Thu, 30 Apr 2026 07:05:00 +0900"
금융위,[오늘의 주요일정·30일] '서부지법 난동범들' 상고심 선고,"(15:00) ▲ 금융위, 주간업무회의(10:00 정부서울청사) ▲ 금융위, 중기부-금융위-금융지주 MOU(16:00 팁스타운 S6) ▲ 권대영 금융부위원장, 해외출장 [산업] ▲ 김정관 산업부 장관, 아름다운가게-유통업계 협약식(16... ",https://www.safetimes.co.kr/news/articleView.html?idxno=242401,https://www.safetimes.co.kr/news/articleView.html?idxno=242401,"Thu, 30 Apr 2026 07:04:00 +0900"
금융위,"[N2 모닝 경제 브리핑-4월 30일] 美증시, 반도체 힘으로 혼조 마감…인텔...","30분) [금융위원회] - 위원장 주간업무회의(정부서울청사, 10시) - 위원장 중기부-금융위-금융지주 MOU(팁스타운 S6, 16시) [한국은행] - 유상대 한국은행 부총재,「한중일 재무장관·중앙은행총재 회의」, 「ASEAN... ",https://www.news2day.co.kr/article/20260429500044,https://www.news2day.co.kr/article/20260429500044,"Thu, 30 Apr 2026 06:52:00 +0900"
금융위,"금융위, 상호금융 포용금융 확대 유도…규제 완화 인센티브 검토","30일 금융위원회에 따르면 금융위는 전날 관계부처, 금융감독원, 상호금융중앙회 및 민간 전문가 등이 참여하는 '상호금융 제도개선 태스크포스(TF)'를 출범하고 포용적 금융 역할 강화 방안을 논의했다. 금융위는 포용적... ",https://news.einfomax.co.kr/news/articleView.html?idxno=4412491,https://news.einfomax.co.kr/news/articleView.html?idxno=4412491,"Thu, 30 Apr 2026 06:06:00 +0900"
금융위,포용금융 늘린 상호금융에 규제 완화…'포용조합' 인센티브 검토,"금융위원회는 29일 정부서울청사에서 금융산업국장 주재로 금감원, 관계부처, 민간전문가, 상호금융중앙회... 김진홍 금융위 금융산업국장은 &quot;건전성과 포용성은 상호금융권의 신뢰 회복을 견인하는 두 축&quot;이라며... ",https://www.etoday.co.kr/news/view/2580584,https://www.etoday.co.kr/news/view/2580584,"Thu, 30 Apr 2026 06:02:00 +0900"
금융위,"상호금융, 부동산 대출 줄이고 ‘포용금융’ 확대 추진","금융위원회는 30일 금융산업국장 주재로 관계부처, 금융감독원, 상호금융중앙회, 민간 전문가 등이 참석한... 금융위 관계자는 “건전성 관리 기조를 유지하면서도 포용금융 확대를 통해 상호금융권의 신뢰 회복을... ",http://www.edaily.co.kr/news/newspath.asp?newsid=02099206645421368,https://n.news.naver.com/mnews/article/018/0006269498?sid=101,"Thu, 30 Apr 2026 06:01:00 +0900"
금융위,"금융당국, 7월 상호금융권 포용금융 강화방안 내놓는다","상호금융 제도개선 TF 발족 회의 6월 방안 마련 목표로 의견수렴 등 조합 규제 완화 등 인센티브 검토 [금융위... 금융위원회는 30일 김진홍 금융산업국장 주재로 금융감독원, 관계부처, 민간전문가, 상호금융중앙회 등과... ",https://biz.heraldcorp.com/article/10728686?ref=naver,https://n.news.naver.com/mnews/article/016/0002637523?sid=101,"Thu, 30 Apr 2026 06:01:00 +0900"
금융위,"금융위, 상호금융 조합 규제 완화해 포용금융 유도",금융위원회가 규제를 완화해 포용금융 취급 유인을 높이는 방안을 검토한다. 금융위는 지난 29일 서울시 종로구 정부서울청사에서 열린 '상호금융 제도개선 TF 발족 회의'에서 &quot;금융소외계층 자금 공급을 위한... ,http://www.inews24.com/view/1964693,https://n.news.naver.com/mnews/article/031/0001025700?sid=101,"Thu, 30 Apr 2026 06:01:00 +0900"
