Keyword,Title,Description,Original Link,Link,Publication Date
이재명,김태흠 충남지사 &quot;국립치의학연구원 예산 미반영 유감&quot;,"김태흠 충남지사는 4일 &quot;국립치의학연구원(천안 설립)은 이재명 대통령 공약임에도 부처가 공모 방식으로 전환, 예산을 반영하지 않았다. 대통령에게 강하게 요청했음에도 반영되지 않아 유감&quot;이라고 말했다. 김... ",https://www.goodmorningcc.com/news/articleView.html?idxno=435937,https://www.goodmorningcc.com/news/articleView.html?idxno=435937,"Thu, 04 Dec 2025 13:36:00 +0900"
이재명,김병기 &quot;유령 필리버스터 국민 피로만..본회의서 최우선 처리&quot;,"한편, 김 원내대표는 이날 같은 자리에서 &quot;민주당은 이재명 대통령께서 약속하신 것처럼 12월 3일을 법정 민주화운동기념일 '국민주권의 날'로 제정하겠다&quot;며 &quot;국민의 승리를 국가의 역사로 남기겠다&quot;고 목소리를 높였다.... ",http://www.00news.co.kr/news/articleView.html?idxno=99796,http://www.00news.co.kr/news/articleView.html?idxno=99796,"Thu, 04 Dec 2025 13:36:00 +0900"
국회,‘인사청탁 의혹’ 문진석 “입 열개라도 할말 없어…부적절 처신 송구...,앞서 2일 문 의원이 국회 본회의장에서 텔레그램 사용자명 ‘홍성범 대한자동차산업협회 본부장’으로부터 받은 파일을 김남국 대통령디지털소통비서관에게 전달하며 “내가 추천하면 강훈식 (비서)실장이 반대할... ,https://www.donga.com/news/Politics/article/all/20251204/132900500/2,https://n.news.naver.com/mnews/article/020/0003679338?sid=100,"Thu, 04 Dec 2025 13:47:00 +0900"
국회,국민의힘 &quot;내란몰이 종지부&quot;…추경호 영장기각에 대여 공세 강화,장동혁 대표는 이날 국회 최고위원회의에서 &quot;대통령이 직접 나치 전범을 들먹이며 국민을 겁박하고 있다. 국민과 전쟁을 벌이겠다는 것&quot;이라고 강하게 비판했다. 이어 &quot;국민과 함께 이재명 정권의 내란 몰이를 끝내겠다&quot;고... ,https://www.kado.net/news/articleView.html?idxno=2020636,https://n.news.naver.com/mnews/article/654/0000154948?sid=100,"Thu, 04 Dec 2025 13:47:00 +0900"
국회,"&quot;수원 군공항 갈등 풀고, 국제공항 검토&quot;…내년 예산에 7억 반영","내년 정부 예산안에 '수원 군공항 예비이전후보지 이전 갈등 관리'와 '경기국제공항 건설 사전타당성 조사 용역' 명목으로 총 7억 원이 반영됐다, 4일 경기 수원시에 따르면 국회가 지난 2일 본회의에서 의결한 2026년... ",https://www.news1.kr/local/gyeonggi/5998152,https://n.news.naver.com/mnews/article/421/0008643039?sid=102,"Thu, 04 Dec 2025 13:46:00 +0900"
국회,"[12·3 계엄 1년] 내란의 새벽, 민초들 민주주의를 사수하다","그날 국회는 그야말로 전장 같았다. 국회 봉쇄와 의장 월담, 무장 계엄군이 헬기를 통해 국회 경내 진입까지. 민주주의는 가장 어두운 시험대 위에 놓였다. 1년이 지난 2025년 12월 3일, 다시는 반복되어선 안 될 그날... ",https://www.ekoreanews.co.kr/news/articleView.html?idxno=83436,https://www.ekoreanews.co.kr/news/articleView.html?idxno=83436,"Thu, 04 Dec 2025 13:46:00 +0900"
국회,"與, 문진석 인사청탁에 '엄중 경고'..거취·윤리감찰은 미정","문금주 원내대변인은 4일 국회 기자들과 만나 &quot;엄중 경고만 들었고, (문 수석) 거취와 관련해선 따로 들은 바... 문 수석은 인사청탁 논란 이후 지난 3일 국회 운영위에 이어 이날 당 정책조정회의에 불참했다. 앞서 그는 지난... ",http://www.dtnews24.com/news/articleView.html?idxno=802753,http://www.dtnews24.com/news/articleView.html?idxno=802753,"Thu, 04 Dec 2025 13:46:00 +0900"
국회,"전국학교비정규직연대회의, 2차 총파업 돌입","전국학교비정규직연대회의가 4일 서울 여의도 국회 앞에서 2차 총파업대회를 열었다. 전국교육공무직본부, 전국여성노동조합, 전국학교비정규직노동조합으로 구성된 전국학교비정규직연대회의(연대회의)는 이날부터... ",https://www.kukinews.com/article/view/kuk202512040134,https://www.kukinews.com/article/view/kuk202512040134,"Thu, 04 Dec 2025 13:46:00 +0900"
국회,"[숏츠] 장동혁 &quot;진보당·민주당 국가보안법 폐지, 대한민국 간첩 천국 만...","장 대표는 오늘(4일) 국회에서 열린 최고위원회의에서 &quot;정권이 나라의 주권과 국민의 생명을 지킬 의지가 없다면 더 이상 존재할 이유가 없다&quot;고 비판했습니다. 장동혁,국민의힘 장동혁",https://www.newscj.com/news/articleView.html?idxno=3348000,https://www.newscj.com/news/articleView.html?idxno=3348000,"Thu, 04 Dec 2025 13:46:00 +0900"
국회,동춘천산단 '국방방호시험장' 유치.. &quot;방위산업 거점 도약&quot;,"내년 정부 예산 국회 의결로 사업 추진이 확정된 국방방호시험장은 군 체계 장비의 방탄·내구 성능을 정밀하게 시험·평가할 수 있는 국가기반시설로, 방탄소재산업과 강원도가 추진 중인 방산혁신클러스터 조성 등 강원... ",https://chmbc.co.kr/article/jNPGsjlrLjk8-lq3O,https://chmbc.co.kr/article/jNPGsjlrLjk8-lq3O,"Thu, 04 Dec 2025 13:46:00 +0900"
국회,"정청래 &quot;檢 조작 기소, 내란과 마찬가지로 단죄해야…국민 요구 높아&quot;","정 대표는 이날 국회 본관 로텐더홀에서 열린 '윤석열 정치검찰의 조작 기소 책임자 처벌 촉구를 위한 규탄대회'에서 &quot;(이 대통령의) 변호사비 대납이 없었다고 무위로 끝나자 대북송금을 들고 나왔고, 검찰의 연어 술 파티... ",https://www.sisajournal.com/news/articleView.html?idxno=355355,https://n.news.naver.com/mnews/article/586/0000117405?sid=100,"Thu, 04 Dec 2025 13:46:00 +0900"
국회,"&quot;우아하게만 일한다&quot; 욕먹던 국민의힘 소장파의 '계엄 반성' 선언, 일부...",국민의힘 초·재선 의원들이 3일 국회 소통관에서 비상계엄 1년 성찰과 반성 기자회견을 열고 있다. ⓒ뉴스1... 소장파와 친한(친한동훈)계로 분류되는 국민의힘 초·재선 의원 25명은 3일 국회에서 기자회견을 열어 대국민... ,https://www.huffingtonpost.kr/news/articleView.html?idxno=240065,https://www.huffingtonpost.kr/news/articleView.html?idxno=240065,"Thu, 04 Dec 2025 13:46:00 +0900"
국회,정부 허락도 없이?! 해외서 먼저 등장한 '원화 스테이블코인'…토종업계...,국회에 발의된 원화 스테이블코인 관련 법안들은 한국은행과 금융당국의 견해 차이로 연내 처리가 불투명하다. 반면 시장은 이미 한국 원화 기반 상품을 '필요한 상품'으로 판단하고 선택하고 있다. 전문가들은 이미... ,https://www.techm.kr/news/articleView.html?idxno=147413,https://www.techm.kr/news/articleView.html?idxno=147413,"Thu, 04 Dec 2025 13:46:00 +0900"
국회,"與, 문진석-김남국 '김현지 청탁' 논란에 &quot;윤리감찰 안 해…확대해석 말...",문금주 민주당 원내대변인은 4일 국회에서 김 원내대표의 의중에 대해 &quot;엄중 경고(했다는 것)만 들었고 (문... 앞서 문 수석은 지난 2일 국회 본회의장에서 김남국 비서관에게 중앙대 동문 출신의 한 인사를... ,https://www.imaeil.com/page/view/2025120413430080494,https://n.news.naver.com/mnews/article/088/0000985078?sid=100,"Thu, 04 Dec 2025 13:45:00 +0900"
국회,"KAMA, 대미 자동차 관세 확정에 '환영'… &quot;불확실성 해소되고 기업 부담...","&quot;마지막까지 최선 다한 정부 및 국회에 감사&quot; &quot;일본과 EU 등과 같은 조건서 경쟁할 수 있어&quot; &quot;앞으로 글로벌... 주신 국회에도 감사한다&quot;고 전했다.이어 &quot;이번 자동차 15% 관세 적용으로 우리 업계는 일본, EU와 동등한... ",https://www.asiatoday.co.kr/view.php?key=20251204010002583,https://www.asiatoday.co.kr/view.php?key=20251204010002583,"Thu, 04 Dec 2025 13:44:00 +0900"
국회,"한화에어로, 수출·R&amp;D용 장비 자체 보유… 기술개발·수주 속도전","하지만 유용원 국민의힘 의원이 대표발의한 방위사업법 개정안이 지난 7월 국회를 통과하면서, 방산물자를... 한화에어로스페이스 관계자는 &quot;국회와 정부의 지원으로 글로벌 방산 시장 변화에 더욱 기민하게 대응할 수... ",http://www.metroseoul.co.kr/article/20251204500197,http://www.metroseoul.co.kr/article/20251204500197,"Thu, 04 Dec 2025 13:44:00 +0900"
국회,과도한 쿠팡 때리기에 눈물짓는 소상공인...이유는,4일 관련업계에 따르면 박대준 쿠팡 대표는 지난 2일 국회 과학기술정보방송통신위원회(과방위) 쿠팡 개인정보 유출 사고 관련 긴급 현안 질의에 참석해 연신 고개를 숙이고 &quot;책임을 회피할 생각이 없다&quot;며 빠른 사태... ,https://www.techm.kr/news/articleView.html?idxno=147415,https://www.techm.kr/news/articleView.html?idxno=147415,"Thu, 04 Dec 2025 13:44:00 +0900"
국회,추미애 &quot;내란재판부로 민주주의 반역 세력 끝을 내야&quot;,아주경제=정현환 기자 dondevoy@ajunews.com 추미애 국회 법제사법위원회 위원장 [사진=연합뉴스] 국회 법제사법위원장인 추미애 더불어민주당 의원이 12·3 내란 1주년인 지난 3일 법사위에서 내란전담재판부법을 통과시켰다고... ,https://www.ajunews.com/view/20251204133548996,https://www.ajunews.com/view/20251204133548996,"Thu, 04 Dec 2025 13:44:00 +0900"
국회,"익산시, 국가예산 3년 연속 1조원대…신규사업 33건 반영","취임 당시 6229억원 수준이던 국가예산은 10년 만에 약 70% 증가했으며, 2024년부터는 3년 연속 1조원 시대를 열었다.정 시장은 이 자리에서 &quot;이춘석·한병도 국회의원, 김경진 익산시의장 등 지역 정치권과 언론, 공직자... ",https://www.asiatoday.co.kr/view.php?key=20251204010002554,https://www.asiatoday.co.kr/view.php?key=20251204010002554,"Thu, 04 Dec 2025 13:44:00 +0900"
국회,"인천경제청, 국회서 '콘텐츠산업 유치 제도개선 토론회' 개최","인천경제자유구역청이 K-콘랜드(K-CON LAND) 조성을 위해 국회와 함께 제도적 기반 마련에 나섰다. 인천경제청은 4일 오전 10시 국회의원회관 제2세미나실에서 김교흥(서구갑, 문체위원장), 배준영(중구강화옹진), 이용우... ",https://www.thebk.co.kr/news/articleView.html?idxno=304702,https://www.thebk.co.kr/news/articleView.html?idxno=304702,"Thu, 04 Dec 2025 13:44:00 +0900"
국회,"김한규, 제주 핵심 현안 해결 위한 주요 예산 대폭 반영","김한규 국회의원. 728조 원 규모의 2026년도 정부 예산안이 국회 본회의를 통과한 가운데, 더불어민주당 김한규 국회의원(제주시을·예산결산특별위원회)이 정부 예산안 심사 과정에서 제주 지역 핵심 현안 해결을 위한... ",https://www.gukjenews.com/news/articleView.html?idxno=3447375,https://www.gukjenews.com/news/articleView.html?idxno=3447375,"Thu, 04 Dec 2025 13:44:00 +0900"
국회,현지 누나 인사청탁 문자…민주 &quot;범죄 아냐&quot; 국힘 &quot;고발 조치&quot;,다만 김남국 비서관이나 김현지 대통령실 1부속실장 등을 국회로 불러 추궁해야 한다는 야당 주장에 대해서는... 앞서 뉴스핌은 문 원내운영수석부대표가 지난 2일 밤 예산 처리 국회 본회의 도중 김 비서관에게 보낸... ,https://news.jtbc.co.kr/article/NB12273710?influxDiv=NAVER,https://n.news.naver.com/mnews/article/437/0000467297?sid=100,"Thu, 04 Dec 2025 13:44:00 +0900"
국회,"&quot;방산 대기업 영업이익률 13%, 협력 중소기업 6.8% 불과&quot;","국민의힘 국회 국방위원들과 정책위원회가 4일 국회 의원회관에서 방산 중소협력업체와 간담회를 열고, K-방산의 지속가능한 성장을 위한 대·중소기업 상생협력 방안 논의에 본격 착수했다. 이날 간담회에는 성일종 국회... ",https://www.news1.kr/local/daejeon-chungnam/5998153,https://n.news.naver.com/mnews/article/421/0008643031?sid=102,"Thu, 04 Dec 2025 13:44:00 +0900"
국회,"반도체특별법, 산자위 소위 여야 합의 통과…'주 52시간 특례'는 빠져",이투데이=정성욱 기자 | 여야 &quot;R&amp;D 인력 근로시간 특례 필요성 인식&quot; 부대의견 달고 소관 상임위서 계속 논의키로 '반도체산업 경쟁력 강화 및 지원에 관한 특별법안'(반도체특별법)이 4일 여야 합의로 국회... ,https://www.etoday.co.kr/news/view/2532773,https://www.etoday.co.kr/news/view/2532773,"Thu, 04 Dec 2025 13:44:00 +0900"
국회,"고등학생과 부적절 관계 교사, 류중일 감독 전 며느리",4일 연합뉴스 취재를 종합하면 류 감독은 이날 국회 국민동의 청원 게시판에 글을 올리고 자신의 가족이 겪은 억울한 사건이 재발하지 않도록 제도 개선을 해달라고 호소했다. 류씨는 &quot;저는 '학생과 부적절한 관계를 맺은... ,https://www.thereport.co.kr/news/articleView.html?idxno=75569,https://www.thereport.co.kr/news/articleView.html?idxno=75569,"Thu, 04 Dec 2025 13:44:00 +0900"
국회,[6·3지선] 국민의힘 충북지사·청주시장 경선 윤희근·서승우 연대 가능...,"전 국회의원 등이 국민의힘에서는 재선을 노리는 김영환 지사와 윤석열 대통령 변호인인 윤갑근 전 국민의힘... 청주시장 후보군으로는 민주당에서는 이장섭 전 국회의원, 박완희 청주시의원, 허창원 전 충북도의원... ",https://www.gukjenews.com/news/articleView.html?idxno=3447374,https://www.gukjenews.com/news/articleView.html?idxno=3447374,"Thu, 04 Dec 2025 13:44:00 +0900"
국회,"양천구, 목동 1~3단지 정비구역 지정 완료…14개 단지 퍼즐 완성","목동아파트 재건축 마지막 퍼즐이었던 목동 1~3단지는 14개 단지 중 유일하게 2종 일반주거지역으로 종상향 문제로 갈등이 있었으나, 민선 8기 출범 이후 국회대로 공원과 안양천을 연계한 열린 녹지 '목동그린웨이... ",https://news.tf.co.kr/read/life/2269008.htm,https://n.news.naver.com/mnews/article/629/0000450132?sid=102,"Thu, 04 Dec 2025 13:44:00 +0900"
국회,"“한국형 핵잠, 자체 개발하되 건조는 美와 분업이 바람직”",4일 국회 부승찬 의원 주최 핵잠 협력 세미나 최용선 율촌 수석전무위원 “‘완전수입’에서 시작해 ‘혼합형’으로 가야 ” 핵잠 기술 이전 전략 제시도…“미국 연합 방위력 역할 강조해야” 4일 국회도서관 강당에서... ,https://biz.heraldcorp.com/article/10629686?ref=naver,https://n.news.naver.com/mnews/article/016/0002567307?sid=101,"Thu, 04 Dec 2025 13:43:00 +0900"
국회,"쿠팡, 역대급 과징금 나오나…ISMS-P 취소 가능성에 '이중고'",송경희 개인정보위원장은 전날 국회 정무위원회 현안질의에서 허영 더불어민주당 의원이 &quot;쿠팡에게 과징금을 물 때 ISMS-P 인증을 받았다는 이유로 50% 감면할 것이냐&quot;고 묻자 &quot;여러 상황을 엄격히 보겠다&quot;며 &quot;감경 역시... ,https://www.yna.co.kr/view/AKR20251204089600530?input=1195m,https://n.news.naver.com/mnews/article/001/0015778762?sid=101,"Thu, 04 Dec 2025 13:43:00 +0900"
국회,"조길형 충주시장, 시정 주요사업 점검하며 새해 준비 박차",조 시장은 &quot;정부 예산안이 통과된 가운데 충주시는 전력으로 잘 대처해 만족스러운 성과를 거둘 수 있었다&quot;며 &quot;지역 발전을 위해 열심히 해준 이종배 국회의원을 비롯해 대외적으로 협력해준 많은 분들과 공직자들께 특별한... ,https://www.inews365.com/news/article.html?no=897471,https://www.inews365.com/news/article.html?no=897471,"Thu, 04 Dec 2025 13:42:00 +0900"
국회,"문진석, '인사 청탁' 논란에 결국 사과… &quot;입 열 개라도 할 말 없어&quot;",문 수석부대표는 지난 2일 국회 본회의장에서 김 비서관에게 한국자동차산업협회 회장직에 홍성범 전 자동차산업협회 본부장을 추천하는 텔레그램 메시지를 보내는 모습이 포착돼 논란이 일었다. 문자에는 &quot;남국아. 대통령... ,https://www.moneys.co.kr/article/2025120413241683092,https://n.news.naver.com/mnews/article/417/0001117344?sid=100,"Thu, 04 Dec 2025 13:42:00 +0900"
국회,"‘깜깜이 특구 지정’ 끝났다~권향엽 의원 ‘지역특구법 개정안’, 국회...","법안이 국회 본회의를 통과했다. 앞으로는 정부가 지자체의 특구 지정 신청을 반려할 경우, 반드시 그 사유를... 2일 국회 본회의에서 재석 의원 233명 전원의 만장일치 찬성으로 최종 가결됐다. 이번 개정안의 핵심은 두... ",https://www.wikitree.co.kr/articles/1099861,https://www.wikitree.co.kr/articles/1099861,"Thu, 04 Dec 2025 13:42:00 +0900"
국회,"&quot;특별한 희생에는 특별한 보상&quot;...보훈부, 내년 예산 6조6870억 '확정'",국가보훈부는 2026년도 예산이 국회 심의를 거쳐 기존의 정부안보다 288억원 늘어난 6조6870억원으로 최종 확정됐다고 4일 밝혔다. 이는 올해 예산 6조4467억원 대비 3.7% 증가한 규모다. 보훈부는 내년 예산을 편성함에... ,https://www.wolyo.co.kr/news/articleView.html?idxno=305159,https://www.wolyo.co.kr/news/articleView.html?idxno=305159,"Thu, 04 Dec 2025 13:42:00 +0900"
국회,&quot;쿠팡페이도 위험하다?&quot;...금융사고 우려로 번진 쿠팡사태,이찬진 금융감독원장은 국회 정무위 현안질의에서 쿠팡 페이가 뚫린 것은 아닌지 살펴보고 있다고 밝혔습니다. [이찬진 / 금융감독원장 : 쿠팡페이만 전자금융업자로 지금 돼 있어서 저희가 규제의 한계가 있다고는... ,https://science.ytn.co.kr/program/view.php?mcd=0082&hcd=&key=202512041109061174,https://science.ytn.co.kr/program/view.php?mcd=0082&hcd=&key=202512041109061174,"Thu, 04 Dec 2025 13:42:00 +0900"
국회,[김구철 칼럼] 김남국이 열어버린 판도라의 상자,김남국은 3년전에도 국회 상임위원회에서 핸드폰으로 코인 거래를 하다가 핸드폰 화면이 언론 카메라에 적발된 인물이다. 도피 행각을 벌이는 소동 끝에 지난해 국회의원 공천도 못 받았다. 이번에 똑같은 실수를 저지른... ,https://www.pennmike.com/news/articleView.html?idxno=111656,https://www.pennmike.com/news/articleView.html?idxno=111656,"Thu, 04 Dec 2025 13:42:00 +0900"
국회,세종 시민단체 &quot;완전한 내란 종식과 사회대개혁 향해&quot;,참가자들은 &quot;국회 계엄해제 표결을 방해한 혐의를 받고 있는 추경호 국민의힘 전 원내대표에 대한 영장을 조희대 사법부가 또 기각했다&quot;며 &quot;이는 계엄과 내란 사태의 진상을 규명하고 책임자를 단죄해야 할 국민의 명령을... ,https://www.joongdo.co.kr/web/view.php?key=20251204010001950,https://www.joongdo.co.kr/web/view.php?key=20251204010001950,"Thu, 04 Dec 2025 13:42:00 +0900"
국회,"맹정섭·박일선, &quot;충북대·한국교통대 부당한 절차 통합 원천 무효 주장...",지역구 국회의원도 사실상 방관적 지지를 하는 모습에 과연 저들이 누구를 위해 존재하는지 묻지 않을 수... 둘째 시장이 비상식적 행위를 하면 국회의원이라도 중심을 잡고 민의를 올바로 대변해야 했다. 그러나 지역의... ,https://www.gukjenews.com/news/articleView.html?idxno=3447364,https://www.gukjenews.com/news/articleView.html?idxno=3447364,"Thu, 04 Dec 2025 13:42:00 +0900"
국회,"국민의힘 김정재 의원, ‘해병대 4군체제 추진 입법 패키지’ 8건 일괄...",김정재 국회의원(포항북구·국민의힘)이 4일 해병대를 독립된 군종으로 재편하는 내용의 ‘해병대 4군체제 추진 입법 패키지’ 8건을 일괄 대표발의했다고 밝혔다. 변화하는 해양·도서 안보 환경 속에서 해병대의 역할과... ,http://www.breaknews.com/1166573,http://www.breaknews.com/1166573,"Thu, 04 Dec 2025 13:42:00 +0900"
국회,'DMZ 출입통제' 통일부장관 비판‥유엔사 &quot;절차에 따라 요청 검토&quot;,정 장관은 앞서 국회 행사에 참석해 &quot;얼마 전 국가안보실 1차장이 백마고지 유해 발굴 현장에 가는 걸 불허당했다&quot;며 &quot;주권 국가로서 체면이 말이 아니&quot;라고 말했습니다. 더불어민주당 한정애 의원 등은 평화적 이용을 위해... ,https://imnews.imbc.com/news/2025/politics/article/6781978_36711.html,https://n.news.naver.com/mnews/article/214/0001465917?sid=100,"Thu, 04 Dec 2025 13:41:00 +0900"
국회,변협·여변 역대 회장들 &quot;내란재판부·법왜곡죄 도입 반대&quot;,앞서 전날 12·3 계엄 사태와 관련해 윤석열 전 대통령 등이 연루된 내란 사건을 전담하는 특별재판부 설치법이 국회 법제사법위원회 전체회의를 통과했다. 판검사가 재판 또는 수사 과정에서 법을 고의로 왜곡하거나... ,https://www.yna.co.kr/view/AKR20251204088400004?input=1195m,https://n.news.naver.com/mnews/article/001/0015778747?sid=102,"Thu, 04 Dec 2025 13:41:00 +0900"
국회,"민주당 문진석, '김남국 인사청탁' 논란에 &quot;부적절한 처신 송구하다&quot;",문 수석부대표는 지난 2일 국회 본회의 도중 김남국 대통령실 디지털소통비서관에게 휴대전화로 같은 대학 출신 인사를 한국자동차산업협회장에 추천해달라는 취지의 문자 메시지를 보냈다. 이 사실은 문 수석부대표의... ,https://www.mt.co.kr/politics/2025/12/04/2025120413211116924,https://n.news.naver.com/mnews/article/008/0005287350?sid=100,"Thu, 04 Dec 2025 13:41:00 +0900"
국회,"한국골프장경영협회, 대한민국 커뮤니케이션대상 수상",지이코노미 김대진 기자 | (사) 한국골프장경영협회(회장 최동호)는 제35회 대한민국 커뮤니케이션 대상 시상식에서 국회 문화체육관광위원장상을 받았다고 4일 밝혔다. 3일 서울 중구 한국프레스센터에서 열린... ,https://www.geconomy.co.kr/news/article.html?no=311577,https://www.geconomy.co.kr/news/article.html?no=311577,"Thu, 04 Dec 2025 13:40:00 +0900"
국회,"장동혁은 만났는데… 조국, 이준석 예방은 언제?",조국혁신당 조국 전 대표가 지난달 11일 서울 여의도 국회에서 열린 조국혁신당 전국당원대회 출발식에서 발언하고 있다. 사진=연합뉴스 매일일보 = 이현민 기자  |  조국 조국혁신당 대표가 취임한 지 일주일이 넘었지만... ,http://www.m-i.kr/news/articleView.html?idxno=1311249,http://www.m-i.kr/news/articleView.html?idxno=1311249,"Thu, 04 Dec 2025 13:40:00 +0900"
국회,"국토부 내년도 예산, 역대 최대 62조8,000억원 확정","국토부는 지난 2일 국회 본회의 의결을 거쳐 2026년 국토부 예산이 62조8,000억원으로 최종 확정됐다고 3일... 예산안을 국회에 제출했다. 국회 심의 과정에서 3,536억원이 증액되고, 616억원이 감액됨에 따라 예산안... ",http://www.arunews.com/news/articleView.html?idxno=51788,http://www.arunews.com/news/articleView.html?idxno=51788,"Thu, 04 Dec 2025 13:40:00 +0900"
국회,"식약처, 2026년도 예산 8천320억 확정","새해 예산은 식약처 출범 이래 최대 규모로 국회의 예산안 심사 과정에서 정부안 8천122억원에서 198억원이... 국회에서 증액된 주요 예산은 허가·심사 혁신 인력 증원에 따른 인건비·운영비(+155억원), 희귀·필수의약품... ",https://idsn.co.kr/news/view/1065586882421554,https://idsn.co.kr/news/view/1065586882421554,"Thu, 04 Dec 2025 13:40:00 +0900"
국회,'유출인데 노출?' 쿠팡 통지 논란…당국 지적도 무시,4일 국회 과학기술방송통신위원장 더불어민주당 최민희 의원실이 과학기술정보통신부로부터 제출받은... 박대준 쿠팡 대표는 같은 날 국회 과방위 긴급 현안 질의에서 최 위원장을 비롯한 여야 의원들의 항의에 &quot;유출로... ,https://www.kbsm.net/news/view.php?idx=499947,https://www.kbsm.net/news/view.php?idx=499947,"Thu, 04 Dec 2025 13:40:00 +0900"
국회,與주도 '내란재판부' 설치법 통과…'대법원장 인사권 박탈' 발의,국회 법사위가 여당 주도로 내란 전담 재판부 설치 법안과 법 왜곡죄 신설 법안을 통과시켰다.... 지난 1일 소위원회를 통과한 내란전담재판부 설치법도 어제 국회 법제사법위원회에서 안건조정위원회를 거쳐 통과됐다.... ,https://www.slist.kr/news/articleView.html?idxno=699130,https://www.slist.kr/news/articleView.html?idxno=699130,"Thu, 04 Dec 2025 13:40:00 +0900"
국회,닛케이 &quot;한중일 정상회의 연내 개최 사실상 무산&quot;,닛케이에 따르면 다카이치 사나에 일본 총리의 ‘대만 유사시’ 관련 국회 답변이 분위기를 바꿨다. 대만 주변 해협 봉쇄 상황에서 미군이 개입하는 가능성을 언급하며 “무력 행사가 수반된다면 어떻게 보아도... ,http://www.fnnews.com/news/202512041331375765,https://n.news.naver.com/mnews/article/014/0005444259?sid=104,"Thu, 04 Dec 2025 13:39:00 +0900"
