Keyword,Title,Description,Original Link,Link,Publication Date
이재명,서울시장 '명심'은 어디에?...나경원 &quot;선거 개입&quot; [앵커리포트],이재명 대통령이 여당의 서울시장 유력 후보로 꼽히는 정원오 성동구청장에 대한 격려 글을 직접 올려 그 배경에 관심이 쏠리는데요. 국민의힘 측은 '대통령의 선거개입'이라고 비판했습니다. 이 대통령이 SNS에 '성동구가... ,https://www.ytn.co.kr/_ln/0103_202512081630065568,https://n.news.naver.com/mnews/article/052/0002284125?sid=102,"Mon, 08 Dec 2025 16:30:00 +0900"
이재명,"통합돌봄지원, '빚좋은 개살구' 되나…시행 앞두고 '쥐꼬리 예산'","단체들에 따르면 &quot;더불어민주당은 이번 대선에서 지역사회통합돌봄체계를 구축하겠다고 공약했고, 이재명 정부 역시 123개 국정과제 중 하나(과제78번)로 채택했다는 점&quot;을 내세웠다. 이어 &quot;그런데 이 초라한 예산이 그... ",https://www.1conomynews.co.kr/news/articleView.html?idxno=45441,https://www.1conomynews.co.kr/news/articleView.html?idxno=45441,"Mon, 08 Dec 2025 16:30:00 +0900"
이재명,"국힘, 양대 노총 110억 원 지원에 &quot;李정권 혈세로 대선 청구서 결제&quot;",장 대표는 오늘 국회 의원회관에서 열린 당 정책위원회 주최 청년정책 토론회에 참석해 &quot;이념투쟁으로 얼룩진 일터를 진짜 노동자들에게 돌려드리겠다&quot;며 &quot;이재명 정권과 민주당은 성실한 삶의 현장인 일터를 정파적... ,https://imnews.imbc.com/news/2025/politics/article/6783124_36711.html,https://n.news.naver.com/mnews/article/214/0001466648?sid=100,"Mon, 08 Dec 2025 16:30:00 +0900"
이재명,손정의 “한국의 약한 고리는 에너지”… IEA도 지적한 구조적 제약,손정의 일본 소프트뱅크 회장이 최근 이재명 대통령을 만나 “인공지능(AI) 혁명 시대에는 에너지 확보가 매우 중요하다”며 “한국의 결정적 약점이 에너지”라고 조언했다. 국제에너지기구(IEA)도 최신 보고서에서... ,https://www.joongang.co.kr/article/25388322,https://n.news.naver.com/mnews/article/025/0003488263?sid=101,"Mon, 08 Dec 2025 16:29:00 +0900"
이재명,"與 &quot;조진웅 은퇴, 성급한 결정&quot;…野 &quot;정치권이 나설 일 아냐&quot;",앞서 조진웅은 지난 8월 자신이 내레이션을 맡은 다큐멘터리 영화 '독립군:끝나지 않은 전쟁'을 이재명 대통령과 함께 관람하고 영화 홍보 차원에서 친여 성향 방송인 '김어준의 겸손은 힘들다 뉴스공장'에 출연하기도... ,https://www.hankyung.com/article/2025120801107,https://n.news.naver.com/mnews/article/015/0005221571?sid=100,"Mon, 08 Dec 2025 16:29:00 +0900"
이재명,양향자 &quot;尹 옥중 메시지 멈춰야…이대로 가면 백전백패&quot;,그는 윤 전 대통령이 주도하는 구도가 '윤석열 대 이재명'으로 흐를 경우 &quot;국민의힘은 백전백패할 것&quot;이라며... 정권을 이재명 민주당에 헌납했다&quot;고 직격했다. 양 최고위원은 내년 지방선거를 향한 위기의식을 강조하며... ,https://www.newsis.com/view/NISX20251208_0003432187,https://n.news.naver.com/mnews/article/003/0013645787?sid=102,"Mon, 08 Dec 2025 16:29:00 +0900"
국회,&quot;안 가면 찍힐까&quot; 단체장 출판기념회마다 반복되는 공무원 '이중고' 논란,"단체장들은 표를 직접 호소하는 발언만 삼가고 있을 뿐 출마 의지를 암시하거나 지역구 국회의원, 기관·단체 관계자들이 대거 참석해 세 결집 장면도 쉽게 목격된다. 출판기념회는 단체장 측근이나 일부 간부가 부하... ",https://www.hankookilbo.com/News/Read/A2025120810290003422?did=NA,https://n.news.naver.com/mnews/article/469/0000901895?sid=102,"Mon, 08 Dec 2025 16:42:00 +0900"
국회,흔들리는 장동혁號…당내 쇄신 압박에도 '일단 투쟁',민주당에서 추진하고 있는 △내란전담재판부 △법왜곡죄 △고위공직자범죄수사처 수사 범위 확대 △필리버스터(국회법상 무제한 토론을 통한 합법적 의사진행 방해) 제한법 △재판소원제 등을 겨냥해 '사법부 장악... ,http://www.fnnews.com/news/202512081424382335,https://n.news.naver.com/mnews/article/014/0005445827?sid=100,"Mon, 08 Dec 2025 16:42:00 +0900"
국회,"이준석 '내란재판부 추진' 겨냥 &quot;尹은 술에, 與는 독재유혹에 취해&quot;",이 대표는 8일 국회에서 열린 최고위원회의에서 &quot;헌법 기능을 정지시키는 국보위를 요하던 젊은 시절의 기개는 어디로 가고 국보위 같은 임시 기구를 남발하고 있다&quot;며 &quot;이 위험한 시도를 반드시 막아내야 한다&quot;고... ,http://www.newsprime.co.kr/news/article.html?no=715323,http://www.newsprime.co.kr/news/article.html?no=715323,"Mon, 08 Dec 2025 16:42:00 +0900"
국회,"[8일 오!정말] 홍준표 &quot;난 뭘해도 욕먹어, 입시 앞둔 청년들 진로결정 신...","&quot; (장동혁 국민의힘 당대표가 국회에서 열린 당 노동위원회 임명장 수여식 및 제1차 전체회의에서 이재명... 이분이 정의로운 척, 의로운 척, 개념연예인인 척 해왔다.&quot; (김재원 국민의힘이 최고위원이 국회에서 열린... ",https://www.businesspost.co.kr/BP?command=article_view&num=422880,https://www.businesspost.co.kr/BP?command=article_view&num=422880,"Mon, 08 Dec 2025 16:42:00 +0900"
국회,이원택 의원 도내 전역 어디든 달려가겠다,국회 이원택(더불어민주당 군산김제부안을) 의원이 '열린 귀 경청투어'를 본격 가동한다. QR코드를 통한 직접 신청 방식을 도입해 누구나 필요할 때 의원을 '빌려 쓸 수 있는' 새로운 정치 실험에 나선 것이다. 이 의원의... ,http://www.jeollailbo.com/news/articleView.html?idxno=786236,http://www.jeollailbo.com/news/articleView.html?idxno=786236,"Mon, 08 Dec 2025 16:42:00 +0900"
국회,&quot;덕평 물류센터 화재 때도 그랬다&quot;…쿠팡식 소통 방식에 소비자 신뢰 '뚝...,박대준 쿠팡 대표는 지난 3일 국회 현안 질의에서 &quot;피해자 보상을 검토하겠다&quot;고 밝혔다. 다만 피해자 보상은 피해 범위를 먼저 확정한 후 진행하겠다는 입장이다. 앞서 SK텔레콤과 KT 사례에서 보상 확정까지 수개월이... ,https://www.insightkorea.co.kr/news/articleView.html?idxno=236987,https://www.insightkorea.co.kr/news/articleView.html?idxno=236987,"Mon, 08 Dec 2025 16:42:00 +0900"
국회,“특별법·지원 판 다 깔렸다”⋯ K-석유화학 구조조정 ‘막판 진통’,"최근 국회를 통과한 석유화학산업 특별법이 내년 초 시행을 앞둔 가운데, 롯데케미칼·HD현대케미칼의 1호... 최근 국회를 통과한 ‘석유화학산업의 경쟁력 강화 및 지원에 관한 특별법’은 이르면 내년 1분기 시행된다.... ",https://www.viva100.com/article/20251208501178,https://www.viva100.com/article/20251208501178,"Mon, 08 Dec 2025 16:42:00 +0900"
국회,심보균 &quot;익산시 농촌 기본소득 시범사업 포함해야&quot;,"읍·면 우선 포함, '농어촌 기본소득법'에 시 소속 읍·면도 포함되도록 명문화 등 두 가지 개선책을 요구했다. 그는 끝으로 &quot;소멸해가는 마을의 위기는 다르지 않다&quot;며 정부와 국회의 제도 개선을 거듭 촉구했다.",http://www.jeollailbo.com/news/articleView.html?idxno=786242,http://www.jeollailbo.com/news/articleView.html?idxno=786242,"Mon, 08 Dec 2025 16:42:00 +0900"
국회,"대건협 전북도회-이원택 의원, 지역건설산업 활성화 간담회","대한건설협회 전북특별자치도회(회장 소재철)는 8일 이원택 국회의원을 초청해 간담회를 열고, 물량 감소와... 위한 국회 차원의 지원 정책이 필요하다&quot;고 강조했다. 특히 △전북광역권 핵심 SOC 반영 지원 △대도시권... ",http://www.jeollailbo.com/news/articleView.html?idxno=786238,http://www.jeollailbo.com/news/articleView.html?idxno=786238,"Mon, 08 Dec 2025 16:42:00 +0900"
국회,"최병욱 전국퇴직공무원노조 위원장, 국민의힘 노동위 부위원장에 임명",국민의힘은 이날 국회 본관에서 장동혁 당 대표와 당직자 등이 참석한 가운데 국토교통부 노동조합 최초로 3연임 위원장을 지낸 최병욱 전국퇴직공무원노조 위원장을 중앙당 노동위원회 부위원장으로 임명했다. 최병욱... ,https://news.tf.co.kr/read/national/2270254.htm,https://n.news.naver.com/mnews/article/629/0000451172?sid=102,"Mon, 08 Dec 2025 16:41:00 +0900"
국회,무주공산 대구시장에 출사표 본격화... '국힘 주자 vs 김부겸' 성사되나,"국민의힘에서는 절반에 이르는 대구 국회의원들의 출마설이 기정사실화하고 있고, 3선 구청장들도 이름을... 여기다 홍석준 전 국회의원, 이진숙 전 방송통신위원장, 조원진 우리공화당 대표, 조응천 전 개혁신당 의원도... ",https://www.hankookilbo.com/News/Read/A2025120810270000770?did=NA,https://n.news.naver.com/mnews/article/469/0000901894?sid=102,"Mon, 08 Dec 2025 16:41:00 +0900"
국회,안수용 이사장 정읍시장 출마 시동··· 출판 기념회 개최,"'정읍의 꿈, 문화의 힘'이라는 주제로 열린 기념회에는 윤준병 정읍·고창 국회의원을 비롯한 문화예술인, 시민 등 1천여 명이 참석해 뜨거운 관심을 보냈다. 이번에 출간된 책은 저자의 삶과 정읍에 대한 깊은 애정을 담은... ",http://www.jjn.co.kr/news/articleView.html?idxno=1025547,http://www.jjn.co.kr/news/articleView.html?idxno=1025547,"Mon, 08 Dec 2025 16:40:00 +0900"
국회,"「M포토」 ‘세포배양육 식품산업화, 안전한가?’ 국회 포럼 열려",8일 국회의원회관에서 열렸다. 포럼 참석자들이 기념 촬영하고 있다. 사진= 서영석 더불어민주당 의원이 환영사하고 있다. 사진= 서울대명예교수인 최윤재 박사가 주제 발표하고 있다. 사진= 포럼 참석자들이 열띤 토론을... ,https://www.m-economynews.com/news/article.html?no=62551,https://www.m-economynews.com/news/article.html?no=62551,"Mon, 08 Dec 2025 16:40:00 +0900"
국회,"법관대표, 내란재판부·법왜곡죄 &quot;위헌논란&quot;…&quot;사법개혁 신중히&quot;",현안법안 입장표명…판사 인사·평가제 변경도 &quot;재판 독립 영향&quot; 판사 대표들의 협의체인 전국법관대표회의는 여당 주도로 국회에서 논의 중인 내란전담특별재판부 설치 법안과 법왜곡죄 신설 법안에 대해 위헌성 논란과... ,https://www.yna.co.kr/view/AKR20251208114100004?input=1195m,https://n.news.naver.com/mnews/article/001/0015784876?sid=102,"Mon, 08 Dec 2025 16:40:00 +0900"
국회,"법관 대표들 “내란재판부·법왜곡죄, 재판 독립성 침해…사법개혁에 법...","국회 법제사법위원회를 통과한 내란전담재판부 설치 특별법은 사건 무작위 배당 원칙을 훼손해 헌법상... 법관은 국회의 입법권이나 여야를 불문한 정치권과 학계, 시민사회의 논의를 존중할 뿐 아니라 법원 의견도... ",https://www.hani.co.kr/arti/society/society_general/1233446.html,https://n.news.naver.com/mnews/article/028/0002780368?sid=102,"Mon, 08 Dec 2025 16:40:00 +0900"
국회,"이장우 대전시장, 관광·제조·연구 등 3대 축 충청권 통합안 제시","발의돼 국회 소관위원회에 회부된 상황이다. ※CBS노컷뉴스는 여러분의 제보로 함께 세상을 바꿉니다. 각종 비리와 부당대우, 사건사고와 미담 등 모든 얘깃거리를 알려주세요.이메일 : 카카오톡 : @노컷뉴스사이트 : https... ",https://www.nocutnews.co.kr/news/6439917?utm_source=naver&utm_medium=article&utm_campaign=20251208043817,https://n.news.naver.com/mnews/article/079/0004093839?sid=102,"Mon, 08 Dec 2025 16:39:00 +0900"
국회,與 '내란재판부 강행' 앞두고 여론전 나선 국민의힘…&quot;독재 악법 알려야...,이날 의원총회는 민주당이 필리버스터 제한법안 등을 우선 단독 처리할 것으로 보이는 오는 9일 국회 본회의를 앞두고 맞불 차원에서 소집됐다. 여당의 입법 독주에 필리버스터를 예고하고 있는 가운데 사전 여론전을 펼쳐... ,https://www.mt.co.kr/politics/2025/12/08/2025120815101150971,https://n.news.naver.com/mnews/article/008/0005288905?sid=100,"Mon, 08 Dec 2025 16:39:00 +0900"
국회,"[단독] 민주당, 내란전담재판부 설치법 LKB평산에 검토 의뢰",12월 3일 서울 여의도 국회에서 열린 제429회 국회(정기회) 법제사법위원회 제16차 전체회의 &lt;사진=연합뉴스&gt; 최근 위헌 가능성과 재판지연 우려가 제기되고 있는 내란전담재판부 설치법과 관련해 더불어민주당이 법안의... ,https://www.lawtimes.co.kr/news/213946,https://www.lawtimes.co.kr/news/213946,"Mon, 08 Dec 2025 16:38:00 +0900"
국회,시대의 얼굴들-제헌국회의원을 추억하다,㈔대한민국 제헌국회의원 유족회(회장 윤인구· 사진)는 창립 30주년을 맞아 오는 14일 오후 5시 서울 여의도 글래드 호텔 블룸홀에서 '시대의 얼굴들-제헌국회의원을 추억하다' 출판기념회를 개최한다고 8일 밝혔다.... ,http://www.fnnews.com/news/202512081422532395,https://n.news.naver.com/mnews/article/014/0005445826?sid=100,"Mon, 08 Dec 2025 16:38:00 +0900"
국회,미 대사대리 &quot;미국 안보전략에 '북 비핵화' 빠진 건 팩트시트서 합의했...,케빈 김 주한미국대사대리가 2일 국회를 방문해 정청래 더불어민주당 대표와 면담하고 있다. &lt;연합뉴스&gt; 지난 5일(현지시각) 공개된 도널드 트럼프 2기 행정부의 NSS에는 비핵화 목표를 포함해 북한 언급이 아예 빠졌다.... ,https://www.businesspost.co.kr/BP?command=article_view&num=422869,https://www.businesspost.co.kr/BP?command=article_view&num=422869,"Mon, 08 Dec 2025 16:38:00 +0900"
국회,"야당, 통일교 금품수수 의혹 수사 촉구… 여당 &quot;합법적 후원금&quot;","송언석 원내대표는 이날 오전 국회에서 열린 당 최고위원회의에서 &quot;통일교가 민주당 의원 2명에게 수천만 원의 금품을 제공하고, 15명의 민주당 정치인이 금품수수에 연루됐다는 구체적 진술이 있는데도 특검은 수사를... ",https://www.kihoilbo.co.kr/news/articleView.html?idxno=3006283,https://www.kihoilbo.co.kr/news/articleView.html?idxno=3006283,"Mon, 08 Dec 2025 16:38:00 +0900"
국회,"[영상] 與, '필리버스터 제대로법' 처리 초읽기...송언석 &quot;소수당 입틀막...",송언석 국민의힘 원내대표가 8일 서울 여의도 국회에서 열린 최고위원회의에서 발언했다.,http://www.newskr.kr/news/articleView.html?idxno=101845,http://www.newskr.kr/news/articleView.html?idxno=101845,"Mon, 08 Dec 2025 16:38:00 +0900"
국회,與주도 '허위조작근절법' 과방위 심사…野 &quot;권력감시 기능 위축&quot;,국회 과학기술정보방송통신위원회는 이날 오후 정보통신방송법안심사소위원회를 열고 더불어민주당 소속... 좌담회에는 국회 과방위 국민의힘 간사인 최형두 의원과 이상휘·박충권·최수진·추경호·이인선·유용원 의원... ,https://view.asiae.co.kr/article/2025120816380732948,https://n.news.naver.com/mnews/article/277/0005690542?sid=100,"Mon, 08 Dec 2025 16:38:00 +0900"
국회,"주호영 국회 부의장, &quot;12.3 비상 계엄은 명백한 잘못&quot;","국민의힘 주호영 국회부의장이 “윤석열 대통령의 12.3 비상계엄은 명백한 잘못이고 당이 너무 늦게까지... 지역 국회의원들과 당 지도부 의견도 들어야 한다”며, “대구시장 출마에 필요한 준비를 어느 정도 해온 것도... ",https://www.kbsm.net/news/view.php?idx=500413,https://www.kbsm.net/news/view.php?idx=500413,"Mon, 08 Dec 2025 16:38:00 +0900"
국회,&quot;왜 집주인만? 세입자 내력도 알아야죠&quot;…월세체납·흡연 등 공개한다,지난달 12일 국회전자청원 홈페이지에는 악성 임차인에 의한 피해 방지를 위해 '임차인 면접제'를... 청원에는 전날까지 2330명이 동의했으며 오는 12일까지 5만명 이상의 동의를 받으면 국회 소관 상임위원회에 자동... ,https://economist.co.kr/article/view/ecn202512080040,https://n.news.naver.com/mnews/article/243/0000089282?sid=101,"Mon, 08 Dec 2025 16:38:00 +0900"
국회,공무원 국민안전 발명챌린지서 '중금속 감지티슈' 금상 수상,"지식재산처(처장 김용선)는 8일 국회의원회관에서 관세청·경찰청·소방청·해양경찰청, 김원이·강승규·이재관 국회 의원실과 함께 '2025 국민안전 발명챌린지' 시상식을 개최했다고 밝혔다. 지식재산처·관세청·경찰청... ",http://www.joseilbo.com/news/news_read.php?uid=558371&class=8&grp=,https://n.news.naver.com/mnews/article/123/0002373427?sid=101,"Mon, 08 Dec 2025 16:37:00 +0900"
국회,"신재경 국힘 남동을 위원장, 인천시 정무부시장 내정","충남 부여 출생인 신 내정자는 인하대 사범대학 부속 고등학교와 숭실대를 졸업했고 국회의원 보좌관, 윤석열 대통령비서실 총무비서관실 선임행정관 등을 역임했다. 현재 인천도시공사(iH) 비상임이사를 맡고 있습니다.... ",http://news.lghellovision.net/news/articleView.html?idxno=528352,http://news.lghellovision.net/news/articleView.html?idxno=528352,"Mon, 08 Dec 2025 16:36:00 +0900"
국회,명태균 &quot;말도 안 되는 수사&quot; 법정 소란…재판부는 팔짱만,김영선 전 국회의원에게서 불법 정치자금을 기부받은 혐의로 재판에 넘겨진 명태균 씨가 검찰을 겨냥해... 엄중해야 할 법정이 산만해지자 피고인인 김 전 국회의원이 주신문에 끼어들기도 했다. 2시간가량 시종일관... ,https://www.idomin.com/news/articleView.html?idxno=951987,https://www.idomin.com/news/articleView.html?idxno=951987,"Mon, 08 Dec 2025 16:36:00 +0900"
국회,"[로엘법무법인 칼럼] 친족강간, 가까운 사이인만큼 처벌 무거워","최근 국회 본회의를 통과한, 친족이 미성년자를 대상으로 저지른 성범죄에 대한 공소시효를 사실상 폐지하는 내용을 담은 개정안은 가족 내 성범죄를 더욱 엄중히 처벌하고 피해자를 보호하려는 사회적 분위기가 강화되고... ",http://www.hortitimes.com/news/articleView.html?idxno=33376,http://www.hortitimes.com/news/articleView.html?idxno=33376,"Mon, 08 Dec 2025 16:36:00 +0900"
국회,"황명 부여소방서 소방장, ‘2025 국민안전 발명챌린지’ 대상",8일 오전 10시 국회 의원회관에서 ‘2025 국민안전 발명챌린지 시상식’이 열렸다. ‘국민안전 발명챌린지’는... 그 결과 황명 소방장이 제안한 ‘도로 중앙분리대 횡단용 이동식 거치대’가 대상인 국회의장상을... ,http://fpn119.co.kr/243780,http://fpn119.co.kr/243780,"Mon, 08 Dec 2025 16:36:00 +0900"
국회,부산 시민단체 &quot;조희대 탄핵과 내란재판부 설치&quot; 촉구,"부산지역 시민단체가 내란전담재판부 설치법 국회 본회의 상정을 앞두고 조희대 대법원장 탄핵과... 마련해 국회 본회의에서 통과시켜야 한다”고 밝혔다. 이들은 “내란이 일어난 지 1년이 지났지만, 아직도 내란범 중 단... ",http://www.kookje.co.kr/news2011/asp/newsbody.asp?code=0300&key=20251208.99099002848,https://n.news.naver.com/mnews/article/658/0000128446?sid=102,"Mon, 08 Dec 2025 16:36:00 +0900"
국회,[뉴스초점] 배우 조진웅 사건으로 보는 '소년범' 대한 엇갈린 시선…&quot;교...,김원이 더불어민주당 국회의원은 한 교수 등의 주장을 옹호하며 &quot;(과거에) 크고 작은 범죄로 경찰서에... 한편 나경원 국민의힘 국회의원은 대통령과 국회의원 등 공직자와 고위공무원의 소년기 흉악범죄 전력을 국가가... ,https://www.idaegu.com/news/articleView.html?idxno=653482,https://www.idaegu.com/news/articleView.html?idxno=653482,"Mon, 08 Dec 2025 16:36:00 +0900"
국회,"[속보] 조국혁신당, '내란전담재판부' 위헌 소지 우려.. &quot;틈 보여선 안 ...","조 대표는 오늘(8일) 국회에서 열린 당 최고위원회의에서 &quot;위헌 제청이 이뤄지면, 윤석열 등 내란 일당은 석방될 가능성이 높다&quot;며 이같이 말했습니다. 이어 &quot;위헌 여부를 판단해 위헌 제청을 하는 주체는 국회의원이 아니다... ",http://www.jmbc.co.kr/news/view_breakingnews/60350,https://n.news.naver.com/mnews/article/659/0000039290?sid=100,"Mon, 08 Dec 2025 16:36:00 +0900"
국회,"사망교사 어머니의 눈물… “학생도 죄 없다, 교장도 죄 없다 하는데…...",또한 “허위 경위서를 작성하고 국회에 제출한 관련 책임자들을 교육청 차원에서 즉각 고발 조치하고 파면하라”며 “진상조사 공정성을 위해 독립된 진상조사위원회의 주최를 교육부에서 외부감사 및 특별감사 형태로... ,https://www.seoul.co.kr/news/society/accident/2025/12/08/20251208500178?wlog_tag3=naver,https://n.news.naver.com/mnews/article/081/0003599011?sid=102,"Mon, 08 Dec 2025 16:35:00 +0900"
국회,[D리포트] &quot;지역 주느니 은행 예치&quot; 지역 방송 예산 삭감에 '홀대' 반발,국회 과방위는 이번 예산 심사에서 오랜 논란인 방송 발전 기금 문제를 풀었습니다. 기금은 내지 않고... 이재명 정부 반드시 약속을 지켜야 합니다.] 국회 과방위는 물론 지역 사회는 강하게 반발하고 있습니다. 지역과... ,https://news.sbs.co.kr/news/endPage.do?news_id=N1008360362&plink=ORI&cooper=NAVER,https://n.news.naver.com/mnews/article/055/0001314290?sid=102,"Mon, 08 Dec 2025 16:35:00 +0900"
국회,[정치 ON] 대통령실 &quot;위헌 논란 최소화&quot;...민주당 속도 조절,그러면 민주당 내에서는 금품을 받은 국회의원이 누구인지 파악되셨을까요? [김한규] 파악이 되지 않았고요. 그런데 금품을 제공했다는 게 불법적인 정치자금을 낸 건지 아니면 500만 원 이하의 후원금을 낸 건지 그 부분이... ,https://www.ytn.co.kr/_ln/0101_202512081634339248,https://n.news.naver.com/mnews/article/052/0002284127?sid=100,"Mon, 08 Dec 2025 16:34:00 +0900"
국회,'제6회 고성독수리 생태축제∙몽골인의 날' 성료,"개막식에는 정점식 국회의원, 이상근 군수, 최을석 군의회 의장, 주부산몽골영사 차강 웁궁 자담바, 지역구 도의원과 군의원, 고성교육지원청 교육장이 참여해 행사를 축하했다. 군민과 관광객, 몽골교민회 등 2800여명이... ",https://www.newsfreezone.co.kr/news/articleView.html?idxno=662447,https://www.newsfreezone.co.kr/news/articleView.html?idxno=662447,"Mon, 08 Dec 2025 16:34:00 +0900"
국회,"野 사법개혁안 저지 여론전 포문...&quot;내란재판부, 존재 자체가 위헌&quot;",국민의힘 송언석 원내대표가 8일 국회에서 열린 의원총회 및 이재명 정권 독재악법 국민고발회에서... 국회 법제사법위원회 소속 주진우 의원은 &quot;입법 권력이 수사권과 재판권을 장악하려는 것은 세계사적으로 독재... ,http://www.m-i.kr/news/articleView.html?idxno=1312618,http://www.m-i.kr/news/articleView.html?idxno=1312618,"Mon, 08 Dec 2025 16:34:00 +0900"
국회,"의성군 2026년 국도비 보조금 3천181억원 확보, 역대 최대 규모",향후 국회 정부 예산심의 중 증액된 사업의 국도비까지 포함하면 실질적인 규모는 더 늘어날 것으로... 또 국회의원실과 긴밀한 협조로 국회 예산 심의 단계에서 ▷산불피해목자원화센터설치 7억5천만원... ,https://www.imaeil.com/page/view/2025120813593641323,https://n.news.naver.com/mnews/article/088/0000985687?sid=102,"Mon, 08 Dec 2025 16:34:00 +0900"
국회,"HD현대, 한화오션과 KDDX 선정 놓고 경쟁 중...수의계약과 공동설계 따라...","현재 국회 국방위원회 등 정치권과 일부 업계 관계자들 사이에서는 사업의 안정적 추진과 양사 상생을 위해 공동설계 및 동시 건조가 바람직하다는 의견이 중론이다. 다만, 공동설계 추진 시 기술 영역 분할의 어려움과... ",http://www.lkp.news/news/articleView.html?idxno=73036,http://www.lkp.news/news/articleView.html?idxno=73036,"Mon, 08 Dec 2025 16:34:00 +0900"
국회,"수원 정치권, 국방장관에 수원 군 공항 이전 건의",지역 국회의원 5명은 8일 오전 국방부 장관을 만나 수원군공항 이전을 위한 건의문을 전달했다. 이 시장을 비롯해 김승원(수원갑)·백혜련(수원을)·김영진(수원병)·김준혁(수원정)·염태영(수원무) 국회의원은 이날 오전... ,https://www.kihoilbo.co.kr/news/articleView.html?idxno=3006279,https://www.kihoilbo.co.kr/news/articleView.html?idxno=3006279,"Mon, 08 Dec 2025 16:34:00 +0900"
