Keyword,Title,Description,Original Link,Link,Publication Date
관가,[기획] 공공주도 공급 속도 높이는 정부…시장 효과는,"28일 관가에 따르면 정부는 지난 9·7 주택공급 확대 방안으로 향후 5년간 매입임대 14만 가구를 계획했지만, 규제지역 집중 공급 정책을 통해 총 규모를 15만 가구로 늘릴 방침이다. 주요 내용을 살펴보면 낡은 빌라나... ",https://www.m-i.kr/news/articleView.html?idxno=1376908,https://www.m-i.kr/news/articleView.html?idxno=1376908,"Thu, 28 May 2026 14:16:00 +0900"
관료,"SK, '에너지·전력통' 정승일 전 차관 영입…미래성장 총괄 사장에 앉혔...",SK그룹이 에너지·전력 분야의 대표적인 관료 출신 전문가로 꼽히는 정승일 전 산업통상자원부(현 산업통상부) 차관을 영입해 그룹 미래 성장 전략을 총괄하는 사장 자리에 앉힌다. 29일 재계에 따르면 SK그룹은 내달... ,http://www.newsroad.co.kr/news/articleView.html?idxno=59890,http://www.newsroad.co.kr/news/articleView.html?idxno=59890,"Sat, 30 May 2026 07:00:00 +0900"
관료,“폐지 줍는 노인 캠퍼스 들여보낸 학교에 감사드립니다···중국 대학...,인민대를 졸업한 한 베이징 주민은 “출입예약제는 중국식 관료주의다. 지하철역 보안검색도 2008년 올림픽 때 시작했다가 정착됐다”며 “대학 출입 통제도 처음에는 ‘비상조치’로서 시작됐지만 관리하는 입장에서... ,https://www.khan.co.kr/article/202605300600021,https://n.news.naver.com/mnews/article/032/0003448828?sid=104,"Sat, 30 May 2026 06:00:00 +0900"
관료,[이기자의 메디컬나우] 복지부 대변인 '권병기·손호준' 2파전,반면 홍보 업무 경력 보유는 손 정책관이 권 국장을 앞서고 있어 두 관료를 주목하는 눈이 늘고 있다. 한 관가 소식통은 &quot;현 정부 출범 후 청와대에 추천된 복지부 관료 중 손영래 의료개혁추진단장과 진영주 연금정책관은... ,https://www.sisajournal-e.com/news/articleView.html?idxno=421391,https://www.sisajournal-e.com/news/articleView.html?idxno=421391,"Sat, 30 May 2026 06:00:00 +0900"
관료,[코트의 시선] 성과급 논란과 반도체 강국의 역설,"기술 관료가 권력을 설계한다는 것이다. 미국의 권력은 규칙을 만들고 해석하는 법률가에 의해 작동한다. 반면 중국은 공산당 핵심 엘리트 상당수가 이공계 출신이다. 기술 관료(테크노크라트)들이 철도와 도시, 공장과... ",https://www.lawtimes.co.kr/news/articleView.html?idxno=221233,https://www.lawtimes.co.kr/news/articleView.html?idxno=221233,"Sat, 30 May 2026 05:16:00 +0900"
관료,트럼프 &quot;종전협상 최종 결정 위해 회의&quot;…호르무즈 개방엔 이견 [이상은...,트럼프 대통령의 발언이나 미국 측 관료들의 전언을 보면 협상 타결이 임박한 상황이다. 다만 이날 이란 파르스통신은 관련 소식통을 인용해 &quot;트럼프 대통령의 주장은 사실과 거짓이 뒤섞였다&quot;며 &quot;승리를 작위적으로... ,https://www.hankyung.com/article/202605307776i,https://n.news.naver.com/mnews/article/015/0005293089?sid=104,"Sat, 30 May 2026 01:49:00 +0900"
관료,[책의 향기]“하노이 결렬 책임은 트럼프”… 美 북핵 외교 ‘35년 실패...,"저자가 만난 미국의 관료들은 대개 북한의 핵 위협을 단순한 호전성 분출로, 북한 지도자를 충동적이라고 인식하고 있었다. 저자는 “미국은 북한과의 직접적 경험 대신 근거 없는 신화나 시대에 뒤떨어진 냉전적 정보에... ",https://www.donga.com/news/Culture/article/all/20260529/134018468/2,https://n.news.naver.com/mnews/article/020/0003723378?sid=103,"Sat, 30 May 2026 01:43:00 +0900"
관료,미국은 왜 북한 핵무장 억제에 실패했나,저자인 조엘 S 위트는 미 국무부 관료 출신으로 ‘북핵 협상’을 이끈 핵심 인물이다. 북한과의 대화를 중시하는 이른바 ‘관여파(Engagement)’로 분류된다. 트럼프 대통령 1기 때 국가안보보좌관을 지낸 존 볼턴 같은 대북... ,https://www.joongang.co.kr/article/25432479,https://n.news.naver.com/mnews/article/353/0000055575?sid=103,"Sat, 30 May 2026 00:16:00 +0900"
관료,“업무에 필요해서” 600억 어치 금괴 빼돌린 간 큰 CIA 간부,"27일(현지 시각) 워싱턴포스트(WP) 등에 따르면 연방수사국(FBI)이 지난 18일 전직 CIA 고위 관료인 데이비드 러시에 대해 버지니아주 자택을 압수 수색을 하던 중 금괴 303개와 명품 롤렉스 시계 30여개, 현금 200만달러... ",https://www.munhwa.com/article/11592272?ref=naver,https://n.news.naver.com/mnews/article/021/0002794485?sid=104,"Fri, 29 May 2026 23:44:00 +0900"
관료,국민의힘 &quot;물가·집값 심판하는 선거...낭떠러지 앞 대한민국 구해야&quot;,"투표장에 가서 국힘을 지켜주시고 대한민국을 지켜주십시오.] 경제관료 출신, 당 투톱 송언석 원내대표는 국회에서 '경제 실정 심판'을 호소했습니다. 치솟은 물가와 환율, 집값을 심판해야 한다며, 국민 삶과 민생 경제를... ",https://www.ytn.co.kr/_ln/0101_202605292233589035,https://n.news.naver.com/mnews/article/052/0002359765?sid=100,"Fri, 29 May 2026 22:33:00 +0900"
관료,"SK그룹, '에너지통' 정승일 전 차관 '사장'으로 영입",SK그룹이 정통 관료 출신 에너지 전문가인 정승일 전 산업통상자원부(현 산업통상부) 차관을 사장으로... SK는 앞서 올 초 박성택 전 산업부 차관을 SK차이나 사장으로 선임하는 등 산업부 고위 관료를 잇따라... ,http://www.fnnews.com/news/202605291858432856,https://n.news.naver.com/mnews/article/014/0005528338?sid=101,"Fri, 29 May 2026 19:05:00 +0900"
관료,"'이재명 소년원' 허위 유포 모스탄, 투표소 등장하더니…",[모스 탄/미국 리버티대 교수 (어제 / 유튜브 '박주현변호사TV') : 저명한 고위 미국 관료를 만났습니다. 우리는 한국이 지금 위기 상태라는 것을 이해했습니다.] 경찰은 입국 다음날인 오늘 바로 출석을 요구했으나 탄... ,https://news.jtbc.co.kr/article/NB12300542?influxDiv=NAVER,https://n.news.naver.com/mnews/article/437/0000493604?sid=102,"Fri, 29 May 2026 19:02:00 +0900"
관료,국민의힘 &quot;물가·집값 심판하는 선거...낭떠러지 앞 대한민국 구해야&quot;,"투표장에 가서 국힘을 지켜주시고 대한민국을 지켜주십시오.] 경제관료 출신, 당 투톱 송언석 원내대표는 국회에서 '경제 실정 심판'을 호소했습니다. 치솟은 물가와 환율, 집값을 심판해야 한다며, 국민 삶과 민생 경제를... ",https://www.ytn.co.kr/_ln/0101_202605291844306112,https://n.news.naver.com/mnews/article/052/0002359695?sid=162,"Fri, 29 May 2026 18:44:00 +0900"
관료,천주교 대구대교구 첫 부교구장에 김종강 주교 임명… 전례 없는 파격 ...,위계적이고 관료화된 행정 체계로 인해 시대의 변화와 평신도들의 역동적인 목소리를 담아내지 못한다는... 한국 천주교회 역사상 처음으로 시도된 이번 '교구 간 벽 허물기' 인사가 교회의 관료주의와 성직자... ,http://www.catholicpress.kr/news/view.php?idx=8230,http://www.catholicpress.kr/news/view.php?idx=8230,"Fri, 29 May 2026 18:42:00 +0900"
관료,"베선트, 美·이란 60일 휴전 합의 접근... 나쁜 거래는 하지 않을 것",전문가들과 전직 관료들 사이에서는 최종 핵 합의까지 도달하기는 쉽지 않을 것이라는 회의론도 만만치... 미 정보당국은 이란의 최종 결정권자인 모즈타바 하메네이 최고 지도자가 현재 모처에 은둔 중이어서 고위 관료들... ,http://www.fnnews.com/news/202605291801480692,https://n.news.naver.com/mnews/article/014/0005528324?sid=104,"Fri, 29 May 2026 18:20:00 +0900"
관료,"트럼프, 이란 재건 '450조원 펀드' 추진…중동국에 지원 요청",NYT는 이란 관료가 이 투자펀드 규모를 3000억달러로 언급했으나 중재에 참여한 다른 관계자들은 금액을 말하지 않았다고 전했다. 또 이란에 대한 투자펀드 조성이 스티브 윗코프 중동특사 및 재러드 쿠슈너(트럼프 대통령... ,https://www.hankyung.com/article/2026052974081,https://n.news.naver.com/mnews/article/015/0005292989?sid=104,"Fri, 29 May 2026 18:12:00 +0900"
관료,[자막뉴스] '초과이윤 처분' 이슈 맞붙은 수장들…산업장관 페북에 댓글...,"김정관 장관은 관료·기업인 출신, 김영훈 장관은 민주노총 위원장 출신으로, 정부 내 산업·노동 정책을 총괄하는 두 장관이 민간 기업의 이익 처분을 두고 서로 결이 다른 메시지를 낸 셈인데, 강유정 청와대 수석대변인은... ",https://news.sbs.co.kr/news/endPage.do?news_id=N1008586117&plink=ORI&cooper=NAVER,https://n.news.naver.com/mnews/article/055/0001360243?sid=100,"Fri, 29 May 2026 18:04:00 +0900"
관료,'도시개발·생활정치 전면에' 김경대 앞세운 국민의힘…후보군 살펴보니...,행정 엘리트 출신 관료와 지역 기반 정치인의 대결이라는 평가도 나온다. ◇ 서울시의원 후보군…도시개발·예산 전문가 전면 배치 국민의힘은 서울시의원 후보군에도 현역 의원과 도시정책 전문가를 전면 배치했다. 용산... ,http://www.fntimes.com/html/view.php?ud=202605291714028481b372994c95_18,http://www.fntimes.com/html/view.php?ud=202605291714028481b372994c95_18,"Fri, 29 May 2026 18:02:00 +0900"
관료,&quot;60일 휴전·호르무즈 개방&quot;…트럼프 사인만 남았다,NYT는 이란 관료가 이 투자펀드 규모를 3000억달러로 언급했으나 중재에 참여한 다른 관계자들은 금액을 말하지 않았다고 전했다. 또 이란에 대한 투자펀드 조성이 스티브 윗코프 중동특사 및 재러드 쿠슈너(트럼프 대통령... ,https://www.hankyung.com/article/2026052974681,https://n.news.naver.com/mnews/article/015/0005292973?sid=104,"Fri, 29 May 2026 17:58:00 +0900"
관료,"국힘 원강수 원주시장 후보 캠프, 민주당 구자열 시장 후보 측 경찰 고...",원 후보 측은 구 후보의 선거공보물에 기재된 '원주천 차집관료(약 420억 규모) 하도급 선정 과정에서 외압 의혹 발생. 전 비서실장이 특정 업체 선정 압력 행사 혐의로 검찰 송치되는 등 논란 확대'라는 내용이 &quot;명백한... ,https://www.kado.net/news/articleView.html?idxno=2053010,https://n.news.naver.com/mnews/article/654/0000183118?sid=102,"Fri, 29 May 2026 17:50:00 +0900"
관료,"8조 기부하니 13조 계약으로?…'주가 급등' 델 테크놀로지스, 트럼프 수...",워싱턴 정가 안팎에서는 이번 사태를 두고 미국 전통 관료 사회의 에토스와 대기업 필란트로피(자선 활동)의 규범이 무너진 단면이라고 우려하고 있다. 특히 권력층과 자산가 사이에 최소한의 완충 장치조차 작동하지... ,https://zdnet.co.kr/view/?no=20260529170305,https://n.news.naver.com/mnews/article/092/0002424705?sid=105,"Fri, 29 May 2026 17:05:00 +0900"
관료,"유정훈 아주대 교수, 한국도로공사 사장 유력…&quot;개혁·미래 모빌리티 전...","그동안 도로공사는 관료와 정치권, 공공기관 출신 인사들이 주로 이끌어왔다는 점에서 학계 전문가 출신 기관장의 등장은 적지 않은 변화로 받아들여진다. 한국도로공사 관계자는 이날 &lt;뉴스투데이&gt;와의 통화에서 &quot;신임... ",https://www.news2day.co.kr/article/20260529500184,https://www.news2day.co.kr/article/20260529500184,"Fri, 29 May 2026 17:00:00 +0900"
관료,[정치 ON] 사전투표 첫날...막판 여론조사 혼전 속 첫 TV토론,"부처별로 업무가 나눠져 있고 근대국가는 그렇게 하라고 이른바 관료제를 채택하고 있는 겁니다. 그래서 다른 부분에서 그 대책은 나와야 하는 것이지, 압수수색을 한 것이 그와 연동된다고 얘기하는 건 약간 여론을... ",https://www.ytn.co.kr/_ln/0101_202605291651349381,https://n.news.naver.com/mnews/article/052/0002359654?sid=162,"Fri, 29 May 2026 16:51:00 +0900"
관료,"국힘 장동혁, 최민호 후보 지원 유세…&quot;마지막 1% 채워달라&quot;","해본 일도 어려운 것이 행정과 위기 대응&quot;이라며 &quot;나의 군 복무 경험과 오랜 행정 관료 이력, 그리고 세종시정을 직접 이끌었던 경험을 바탕으로 시민의 안전과 세종의 미래를 책임지겠다&quot;고 역설했다. 침체된 지역 상권과... ",http://www.ccnnews.co.kr/news/articleView.html?idxno=410223,http://www.ccnnews.co.kr/news/articleView.html?idxno=410223,"Fri, 29 May 2026 16:12:00 +0900"
관료,정부 내부 격론…반도체 초과이익 분배 두고 장관들 엇갈린 견해,"의견이 교환될 수 있도록 지원하는 방안을 모색하고 있다. 이러한 고위 관료들의 견해 차이는 반도체 업계의 초과이익을 둘러싼 정책 방향 설정에 있어서 중요한 시사점을 제공하고 있으며, 관련 논의는 계속 이어질 전망이다.",https://www.gokorea.kr/news/articleView.html?idxno=867824,https://www.gokorea.kr/news/articleView.html?idxno=867824,"Fri, 29 May 2026 15:54:00 +0900"
관료,이건희는 왜 &quot;다섯 번 왜&quot;를 물었나…세종 &quot;억울한 백성이 없게 하라&quot;,"조세 제도인 공법을 추진할 때는 관료와 수령뿐 아니라 농민들까지 폭넓게 의견을 들었다. 책은 세종의 업적보다 그 업적을 가능하게 한 정치의 태도에 주목한다. 억울한 사람이 없는 법치, 백성을 먼저 생각하는 정책... ",https://www.nocutnews.co.kr/news/6524915?utm_source=naver&utm_medium=article&utm_campaign=20260529033829,https://n.news.naver.com/mnews/article/079/0004152199?sid=103,"Fri, 29 May 2026 15:39:00 +0900"
관료,"&quot;쓴소리하니 면허심사로 압박&quot;…미 ABC, 정부 심사 앞당겨지자 항의",이어 &quot;관료주의적 절차를 가장해 표현의 자유를 억압하려는 이 같은 시도가 용납돼서는 안 된다&quot;며 &quot;방송사가 규제 보복을 고려하게 되면 대중은 정부로부터 자유로운 저널리즘에 대한 접근권을 잃게 된다&quot;고... ,http://www.yonhapnewstv.co.kr/news/AKR20260529144229pP9,https://n.news.naver.com/mnews/article/422/0000869611?sid=104,"Fri, 29 May 2026 14:43:00 +0900"
관료,한만중 서울교육감 후보 “시민이 주인 되는 서울교육 열 것”... 거버넌...,"민주진보시민사회 추대 한만중 서울시교육감 후보가 일방통행식 관료 중심의 교육 행정을 탈피하고, 교육... 교육 민주주의 실질화 필요한 후보는 현재 서울교육이 직면한 가장 큰 문제점으로 관료주의적 하향식 구조를... ",https://www.koreadaily.com/article/20260528223943001,https://www.koreadaily.com/article/20260528223943001,"Fri, 29 May 2026 14:40:00 +0900"
관료,"[인터뷰] &quot;AI 규제 합리화, '미래 먹거리' 위한 '혁신의 고속도로'를 까...",챙기니 관료사회의 태도와 우선순위 달라져&quot; &quot;삼성 노사 합의는 끝이 아니라 출발점…사회적 정의와... 대통령이 직접 챙긴다는 사실만으로도 관료사회의 태도와 우선순위가 달라진다는 것을 체감하고 있다.&quot; 현재 가장... ,https://www.sisajournal.com/news/articleView.html?idxno=374696,https://n.news.naver.com/mnews/article/586/0000130281?sid=100,"Fri, 29 May 2026 14:36:00 +0900"
관료,"[인터뷰] 윤창환 “여신업계 복합위기, AI 디지털 금융으로 풀겠다”","이번 공모에서 관료 출신 인사가 제외된 가운데, 정치권 인맥과 경험을 갖춘 유력 후보로 떠올랐다. 윤 후보는 자신의 경쟁력으로 30년간의 입법·규제 대응력, 대관 역량, AI·디지털 금융 정책 전문성을 꼽았다. 그는... ",https://www.ddaily.co.kr/page/view/2026052911351936707,https://n.news.naver.com/mnews/article/138/0002229314?sid=101,"Fri, 29 May 2026 14:32:00 +0900"
관료,"KAI 김종출호, '책임경영' 기반 조직개편 단행",방산 업계 한 관계자는 &quot;과거 방산 기업들은 정부 발주 물량 관리 위주의 관료제적 성격이 강해 의사결정 구조가 비대해지는 경향이 있었다&quot;며 &quot;KAI의 이번 개편은 사장에게 쏠린 권한을 부사장급 책임자들에게 과감히... ,https://www.newsworks.co.kr/news/articleView.html?idxno=842293,https://www.newsworks.co.kr/news/articleView.html?idxno=842293,"Fri, 29 May 2026 14:26:00 +0900"
박수영,가상자산 과세 앞두고 찬반 논란… “왜 코인만” “더 미루면 안돼”,국회 재경위 조세소위원장인 국민의힘 박수영 의원은 이달 7일 국회에서 긴급 토론회를 열어 가상자산 과세 중단 논의에 불을 붙였다. 반면 더불어민주당은 예정대로 내년 1월부터 가상자산 과세를 시행해야 한다는... ,https://www.donga.com/news/Economy/article/all/20260529/134018399/2,https://n.news.naver.com/mnews/article/020/0003723400?sid=101,"Sat, 30 May 2026 01:44:00 +0900"
박수영,"조이, 레트로 무드로 포착된 셀카…시선 사로잡는 눈빛","그룹 레드벨벳(Red Velvet) 조이(박수영, 29세)가 셀카 한 장으로 근황을 전했다. 시선을 정면으로 향한 채 개성 있는 스타일링을 선보였다. 29일 올라온 게시물에는 침대 위에 기대 앉아 한 손으로 얼굴을 부분 가린... ",https://www.topstarnews.net/news/articleView.html?idxno=16075122,https://www.topstarnews.net/news/articleView.html?idxno=16075122,"Fri, 29 May 2026 20:00:00 +0900"
박수영,"조이, 레이스 커튼 사이 창가 포즈…감각적인 비주얼 눈길","그룹 레드벨벳(Red Velvet) 조이(박수영, 29세)가 창가에서 촬영한 사진으로 근황을 전했다. 창을 배경으로 한 실내 공간에서 스타일리시한 모습을 담아 시선을 모았다. 29일 올라온 게시물에는 조이가 큰 창틀에 앉아... ",https://www.topstarnews.net/news/articleView.html?idxno=16075121,https://www.topstarnews.net/news/articleView.html?idxno=16075121,"Fri, 29 May 2026 20:00:00 +0900"
박수영,"&quot;국회의원에게 알릴까&quot;...전근향 전 민주당 구의원, 현수막 두고 갑질 논...","곽규택, 박수영 의원에게도 전달하겠다. 시당에도 알리겠다. 그것(현수막) 때문에 시장 선거도 방해를 받고 있다&quot;고 말했다. 곽규택 의원은 이 지역 당협위원장이며, 박수영 의원은 전 부산시당위원장을 역임한 바 있다.... ",https://www.pennmike.com/news/articleView.html?idxno=121291,https://www.pennmike.com/news/articleView.html?idxno=121291,"Fri, 29 May 2026 15:52:00 +0900"
박수영,"그랜드모먼트 유스호스텔, 청소년박람회서 진로·체험 프로그램 선봬",박수영 그랜드모먼트 유스호스텔 운영대표는 “청소년들에게 단순한 숙박 공간을 제공하는 것을 넘어 다양한 체험과 건전한 여가 활동 기회를 제공하고자 이번 프로그램을 마련했다”며 “앞으로도 청소년들이... ,https://www.kmib.co.kr/article/view.asp?arcid=0029891200&code=61121111&cp=nv,https://n.news.naver.com/mnews/article/005/0001851857?sid=102,"Fri, 29 May 2026 14:16:00 +0900"
박수영,"그랜드모먼트 유스호스텔, 대한민국청소년박람회 참가…체험형 콘텐츠...",그랜드모먼트 유스호스텔 박수영 운영대표(사진 가운데)가 제22회 대한민국청소년박람회 체험부스에서... 박수영 운영대표는 &quot;청소년들에게 단순한 숙박 공간을 넘어 다양한 체험과 건전한 여가활동 기회를 제공하기... ,https://daily.hankooki.com/news/articleView.html?idxno=1371675,https://daily.hankooki.com/news/articleView.html?idxno=1371675,"Fri, 29 May 2026 08:28:00 +0900"
박수영,"‘탱크데이’ 후폭풍…5·18 단체, 정용진 회장 고소","또 부상자회는 국민의힘 박수영 의원과 정재학 시인, 블로거 A씨 등을 5·18특별법 위반 혐의 등으로 광주 서부경찰서에 고소했다고 밝혔다. 논란은 스타벅스코리아가 5·18민주화운동 기념일인 지난 18일 '탱크 데이... ",http://www.joseilbo.com/news/news_read.php?uid=569105&class=33&grp=,https://n.news.naver.com/mnews/article/123/0002383818?sid=102,"Thu, 28 May 2026 21:44:00 +0900"
박수영,유보층 표심 어디로… 29~30일 교육감 사전투표,"선거는 일반 선거보다 후보 정보가 제한적이어서 투표 당일까지 고민하다가 결국 회피형 선거로 이어지는 것 같다&quot;며 &quot;학부형, 교사 생각보다 아이들을 먼저 생각해주는 사람이었으면 좋겠다&quot;고 말했다. 박수영 기자",https://www.joongdo.co.kr/web/view.php?key=20260528010007755,https://www.joongdo.co.kr/web/view.php?key=20260528010007755,"Thu, 28 May 2026 18:16:00 +0900"
박수영,&quot;대전교육 변화 선택해 달라&quot;… 교육감 후보들 투표 참여 호소,해소와 원도심 교육 활성화에 대한 의지를 시민들에게 상징적으로 보여주기 위한 것&quot;이라고 설명했다. 후보들은 사전투표 시작과 함께 본선 막판 총력전에 돌입하며 부동층 표심 확보에 집중하는 분위기다.박수영 기자,https://www.joongdo.co.kr/web/view.php?key=20260528010007770,https://www.joongdo.co.kr/web/view.php?key=20260528010007770,"Thu, 28 May 2026 18:08:00 +0900"
박수영,교실을 넘어 세계로 '대전국제교육원' 개원,학생들의 글로벌 역량을 키우는 국제교육 플랫폼으로 자리매김하길 기대한다&quot;며 &quot;학생들이 더 넓은 세계를 경험하고 미래를 준비할 수 있도록 다양한 지원을 이어가겠다&quot;고 말했다.박수영 기자,https://www.joongdo.co.kr/web/view.php?key=20260528010007578,https://www.joongdo.co.kr/web/view.php?key=20260528010007578,"Thu, 28 May 2026 17:58:00 +0900"
박수영,‘샤이 보수’ 등장 가능성에 촉각 곤두세운 부산 정치권…여야 셈법 엇...,"2024년 총선 당시 부산 남구 출구조사에서는 민주당 박재호 후보가 51.3%, 국민의힘 박수영 후보가 48.7%로 박 후보의 2.6%P 우세가 예상됐다. 그러나 실제 개표 결과는 박수영 후보 54.40%, 박재호 후보 45.59%로 박 후보가... ",https://www.busan.com/view/busan/view.php?code=2026052812425146030,https://n.news.naver.com/mnews/article/082/0001382884?sid=100,"Thu, 28 May 2026 17:13:00 +0900"
박수영,"오월단체, 스타벅스 '탱크데이' 정용진 회장 고소","앞서 부상자회는 지난 26일 정재학 시인의 옹호 칼럼을 공유한 국민의힘 박수영 국회의원 등 3명을 같은 혐의로 고소하기도 했다. 스타벅스는 논란이 확산하자 뒤늦게 이벤트를 철회했고, 정용진 회장은 지난 26일 대국민... ",https://view.asiae.co.kr/article/2026052814222998595,https://n.news.naver.com/mnews/article/277/0005769039?sid=102,"Thu, 28 May 2026 14:39:00 +0900"
박수영,"오월단체, 스타벅스 '탱크데이' 논란 정용진 신세계그룹 회장 고소 가세","앞서 5·18 민주화운동부상자회는 지난 26일 같은 혐의로 박수영 국민의힘 국회의원과 정재학 시인, 블로거 A 씨 등 3명을 광주 서부경찰서에 고소했다. 정 시인은 한 인터넷 매체에 정 회장을 옹호하는 칼럼을 쓰며 &quot;5... ",https://news.tf.co.kr/read/national/2327068.htm,https://n.news.naver.com/mnews/article/629/0000502939?sid=102,"Thu, 28 May 2026 14:13:00 +0900"
박수영,"5·18 단체, 정용진·스타벅스 관계자 고소…&quot;진정성 없는 사과&quot; 규탄","앞서 부상자회는 지난 26일 같은 혐의로 박수영 의원과 정재학 시인, 블로거 등을 고소했다. 정 시인은 인터넷 매체 칼럼에서 &quot;5·18에 탱크가 동원된 적 있습니까?&quot;라는 표현 등을 사용해 정 회장을 옹호했고, 박 의원과... ",https://news.tvchosun.com/site/data/html_dir/2026/05/28/2026052890154.html,https://n.news.naver.com/mnews/article/448/0000615058?sid=102,"Thu, 28 May 2026 13:41:00 +0900"
박대출,&quot;진주·사천 경제적 공동전선 구축&quot;,"국민의힘 한경호 진주시장 후보, 박동식 사천시장 후보, 박대출·강민국·서천호 국회의원은 이날 오전 진주시청 브리핑룸에서 기자회견을 열고 '사천·진주 경제동행 시티' 산업경제 협약 구상을 발표했다. 이들은 공동... ",http://www.gnmaeil.com/news/articleView.html?idxno=587501,http://www.gnmaeil.com/news/articleView.html?idxno=587501,"Thu, 28 May 2026 21:42:00 +0900"
박대출,“진주·사천 경제동행 시티 조성”,"국민의힘 한경호 진주시장 후보, 박동식 사천시장 후보와 박대출(진주시갑), 강민국(진주시을), 서천호(사천남해하동) 국회의원은 28일 ‘사천·진주 경제 동행 시티’ 산업 경제 협약 구상을 발표했다. 이들은 공동... ",http://www.knnews.co.kr/news/articleView.php?idxno=1542670,http://www.knnews.co.kr/news/articleView.php?idxno=1542670,"Thu, 28 May 2026 21:40:00 +0900"
