Keyword,Title,Description,Original Link,Link,Publication Date
국회,[단독] 국민 80% “인공임신중절 찬성”…44%는 “여성 선택에 전면 맡겨...,"여성의 건강권 보장을 위해 조속히 법 개정을 추진하겠다&quot;고 밝혔다. 한편, 지난 7월 남 의원은 수술뿐 아니라 약물 임신중지를 허용하고 건강보험 적용을 포함하는 '모자보건법 개정안'을 22대 국회에서 처음 발의했다.",https://www.womennews.co.kr/news/articleView.html?idxno=267902,https://n.news.naver.com/mnews/article/310/0000129901?sid=102,"Sat, 27 Sep 2025 06:00:00 +0900"
국회,“대통령실에 동맹파 너무 많다”...작심발언 한 ‘자주파 원로’,26일 정 전 장관은 국회에서 열린 더불어민주당 외교안보통일자문회의 세미나에 참석해 “이른바 동맹파들이 (이재명 대통령 주위에) 너무 많다”고 작심 발언을 했다. 그는 동맹파 관료들을 향해 “미국이 싫으면... ,https://www.mk.co.kr/article/11430548,https://n.news.naver.com/mnews/article/009/0005565797?sid=100,"Sat, 27 Sep 2025 05:54:00 +0900"
국회,"무제한 토론, 오늘 저녁 7시쯤 종결…이후 방송미디어통신위원회 설치법...",방송미디어통신위원회 설치법의 국회 본회의 상정에 반발해 국민의힘이 신청한 무제한 토론(필리버스터)이 오늘(27일) 오후 종결될 전망입니다. 국회는 무제한 토론이 시작된 지 24시간이 지나는 오늘 오후 7시쯤... ,https://news.kbs.co.kr/news/pc/view/view.do?ncd=8369206&ref=A,https://n.news.naver.com/mnews/article/056/0012038011?sid=100,"Sat, 27 Sep 2025 05:51:00 +0900"
국회,"6년만에 서울 거리 나서는 국민의힘, 10만명 모인다",국민의힘이 장외투쟁에 나서는 것은 더불어민주당이 과반 의석을 앞세워 국회를 주도하는 상황을 막을 뚜렷한 방법이 없기 때문이다. 국민의힘은 필리버스터(무제한 토론을 통한 합법적 의사진행 방해)를 통해 국회... ,https://www.mt.co.kr/politics/2025/09/27/2025092616444691246,https://n.news.naver.com/mnews/article/008/0005256663?sid=100,"Sat, 27 Sep 2025 05:50:00 +0900"
국회,비의료인 문신 합법화… &quot;문신사 관리에 의사 포함&quot;,25일 보건복지부 곽순헌 건강정책국장은 이날 오후 국회 본회의에서 가결된 ‘문신사법 제정안’에 대한... 것” 국회는 25일 오후 본회의를 열고 비의료인의 문신 시술을 허용하는 ‘문신사법’ 제정안을 재석 202명 중... ,https://www.dailymedi.com/news/news_view.php?wr_id=929379,https://www.dailymedi.com/news/news_view.php?wr_id=929379,"Sat, 27 Sep 2025 05:24:00 +0900"
국회,"돌아온 이해진의 승부수...네이버, 두나무 품는다","국회에서도 원화 스테이블 코인 제도화 준비가 진행되는 가운데, 네이버 페이의 간편결제 기반과 두나무의 블록체인 기술, 가상자산 유통 역량이 합쳐지면 시너지 효과가 클 것으로 관측됩니다. [이효진 / 메리츠증권... ",https://www.ytn.co.kr/_ln/0102_202509270522163740,https://n.news.naver.com/mnews/article/052/0002252626?sid=101,"Sat, 27 Sep 2025 05:22:00 +0900"
국회,"&quot;응급구조사, 현장서 진통제 사용 허용 검토&quot;","26일 국회 보건복지위원회 김예지 의원(국민의힘)이 소방청으로부터 제출받은 자료에 따르면, 최근 3년간 구급차로 이송된 절단 환자는 총 9595명이었다. 그러나 이송 중 진통제를 투여받은 사례는 4건(0.04%)에... ",https://www.dailymedi.com/news/news_view.php?wr_id=929409,https://www.dailymedi.com/news/news_view.php?wr_id=929409,"Sat, 27 Sep 2025 05:22:00 +0900"
기재위,"[사설] 예산·금융 기능 없는 기재부, 경제정책 조율 가능하겠나","기획재정부 소관 국회 상임위원회인 기재위와 금융위 소관 정무위 위원장이 모두 야당 출신인데, 두 위원장 협조가 없으면 ‘패스트 트랙’을 거쳐야 해, 법 처리에 최장 6개월 이상 더 걸린다. 결국 경제정책과 금융... ",https://www.hankookilbo.com/News/Read/A2025092614400004534?did=NA,https://n.news.naver.com/mnews/article/469/0000889575?sid=110,"Sat, 27 Sep 2025 00:11:00 +0900"
기재위,"무신사 조만호, 'IPO 심판대' 국정감사 극복할까","2023년 국회 기획재정위원회(기재위) 국감에서 J사는 고객 동의 없이 약 13만 명의 개인정보를 유출시켰으며, 소비자들을 대상으로 과장광고를 벌였다는 비판을 받았다. 민감한 과세정보는 납세자 또는 세무대리인에게만... ",http://www.newsdream.kr/news/articleView.html?idxno=96342,http://www.newsdream.kr/news/articleView.html?idxno=96342,"Fri, 26 Sep 2025 17:14:00 +0900"
기재위,"'마약사범 급증'…박수영, &quot;8월까지 810명 적발, 관세청 더 적극적 단속...","26일 국회 기재위 소속 국민의힘 박수영 국민의힘 의원이 관세청에서 받은 자료에 따르며, 올해 1월부터 8월까지 적발한 마약사범은 총 810명으로 이미 지난해 799명을 넘어섰다. 이 추세라면 올해 1000명을 훌쩍 넘어... ",https://www.sejungilbo.com/news/articleView.html?idxno=55085,https://www.sejungilbo.com/news/articleView.html?idxno=55085,"Fri, 26 Sep 2025 15:02:00 +0900"
기재위,정치권 '디지털자산 기본법' 속도전…스테이블코인 요건 최대 쟁점,"기재위 소속인 안도걸(가치안정형 디지털자산법) 의원은 스테이블코인을 지급수단 중심으로 설계, 이자·보상 지급을 전면 금지하고 발행·준비금·상환 절차를 세밀히 규정했다. 국민의힘은 비교적 산업 진흥에 무게를... ",https://www.digitaltoday.co.kr/news/articleView.html?idxno=594281,https://www.digitaltoday.co.kr/news/articleView.html?idxno=594281,"Fri, 26 Sep 2025 14:40:00 +0900"
기재위,"자영업자 소득 대비 부채 비율, 10분기 만에 상승","오늘(26일) 국회 기재위 소속 조국혁신당 차규근 의원실과 한국은행에 따르면, 올해 2분기 자영업자의 LTI는 344.4%로, 전 분기 대비 0.1%포인트 올랐습니다. 해당 비율은 아홉 분기 연속 하락세를 이어오다 올해 2분기에... ",http://mbnmoney.mbn.co.kr/news/view?news_no=MM1005680288,http://mbnmoney.mbn.co.kr/news/view?news_no=MM1005680288,"Fri, 26 Sep 2025 10:42:00 +0900"
기재위,"'SNS 마켓' 20조 시장 추정…김영진, &quot;체납액, 상반기에 작년 규모 추월...","김영진 의원 26일 국회 기재위 소속 더불어민주당 김영진 의원이 국세청으로부터 제출받은 자료에 따르면, `21년 4685명이던 'SNS 마켓' 주업종 등록 사업자 수는 올해 8월 기준 이미 1만 4160명을 돌파했다. 같은 기간... ",https://www.sejungilbo.com/news/articleView.html?idxno=55078,https://www.sejungilbo.com/news/articleView.html?idxno=55078,"Fri, 26 Sep 2025 10:32:00 +0900"
기재위,"[뉴스UP] 또다시 '필리버스터' 정국 돌입...여야, 본회의 충돌 격화",있는 기재위와 정무위의 협조를 받아야 되는데 거기서도 협조를 받고 있지 못한 상황입니다. 그런 상황에서... 그렇기 때문에 기재위와 정무위가 충분히 협조할 여지가 있었음에도 불구하고 민주당의 일반적인 협상 파기로... ,https://www.ytn.co.kr/_ln/0101_202509260846053726,https://n.news.naver.com/mnews/article/052/0002252162?sid=100,"Fri, 26 Sep 2025 08:46:00 +0900"
기재위,“공공기관운영법 신속처리 동의 못 해… 여야 협상을”,지난 7월부터 기재위를 이끌어온 임 위원장은 이날 국회 기재위원장실에서 진행한 서울신문과의 인터뷰에서 “새 정부의 국정철학에 맞는 조직 개편이 필요하다는 데는 공감한다”면서도 “이렇게 여권의 밀실... ,https://www.seoul.co.kr/news/politics/2025/09/26/20250926009003?wlog_tag3=naver,https://n.news.naver.com/mnews/article/081/0003578130?sid=100,"Fri, 26 Sep 2025 05:05:00 +0900"
기재위,“금융위·금감원 현행 유지”… 본회의 3시간 전 대선 공약 철회,"민주당은 이날 금감위 설치법 등 관련 법안 대신 정무위 소관 법안인 공익신고자보호법 개정안, 민주유공자 예우법과 기재위 소관 법안인 대통령과 공공기관장 임기를 맞추는 내용의 공공기관운영법 개정안, 통계법... ",https://www.seoul.co.kr/news/politics/2025/09/26/20250926005004?wlog_tag3=naver,https://n.news.naver.com/mnews/article/081/0003578059?sid=100,"Fri, 26 Sep 2025 05:02:00 +0900"
기재위,"&quot;AI로 가치 창출, 화합으로 가치공유&quot;…서울세무사회, '선진화하는 워크...",국회 기재위 전체회의를 통과했다&quot;고 보고하면서 통과를 위해 노력해준 서울 회원들에 감사를 표했다. 이날 기재위 전체회의를 통과한 개정안은 ▲세무법인 인적요건 완화(세무사 3명으로 법인 설립) ▲무자격자의... ,http://www.intn.co.kr/news/articleView.html?idxno=2046233,http://www.intn.co.kr/news/articleView.html?idxno=2046233,"Thu, 25 Sep 2025 21:38:00 +0900"
기재위,&quot;액상형 전자담배도 담배&quot;…담배사업법 개정안 기재위 통과,국회 기재위는 이날 전체회의를 열고 담배의 정의를 확대하는 내용의 담배법 개정안을 여야 합의로 의결했다. 개정안은 담배의 정의를 천연니코틴 원료인 '연초의 잎'에서 '연초' 또는 '니코틴'으로 확대해 '니코틴을... ,https://www.idaegu.co.kr/news/articleView.html?idxno=524648,https://www.idaegu.co.kr/news/articleView.html?idxno=524648,"Thu, 25 Sep 2025 19:34:00 +0900"
기재위,합성니코틴도 담배 규제하는 담배사업법 개정안 9년 만에 국회 상임위 ...,"이날 기재위에서는 국가연구개발사업을 예비타당성조사 대상에서 제외하는 국가재정법 개정안도 가결됐다.... 기재위는 2025년도 국정감사 계획도 의결했으며, 증인 및 참고인 채택은 여야가 계속 협의하기로 했다.... ",https://www.news2day.co.kr/article/20250925500305,https://www.news2day.co.kr/article/20250925500305,"Thu, 25 Sep 2025 19:20:00 +0900"
기재위,문신사법·APEC 결의안·산불특별법…여야 합의로 국회 본회의 통과,두 상임위(기재위·정무위) 모두 국민의힘이 위원장을 맡고 있다. 패스트트랙에 오르면 여야 합의 없이도 처리할 수 있지만 본회의 상정까지는 6개월 이상이 걸린다. 민주유공자법은 6월 민주항쟁 등에서 다치거나 숨진... ,https://www.news1.kr/politics/assembly/5925241,https://n.news.naver.com/mnews/article/421/0008509532?sid=100,"Thu, 25 Sep 2025 18:21:00 +0900"
기재위,"쪼개지는 기획재정부, 마지막 국감은 10월 13일부터","국세청 등 외청에 대한 종합감사일은 10월 29일이다. 한편 기재위는 이날 계획서만 의결했을 뿐, 국감 증인은 채택하지 않았다. 오는 30일 다시 전체회의를 열어 증인 명단을 확정할 것으로 전해졌다. (사진=기재부)",http://www.edaily.co.kr/news/newspath.asp?newsid=04201686642303728,https://n.news.naver.com/mnews/article/018/0006125254?sid=101,"Thu, 25 Sep 2025 18:20:00 +0900"
기재위,&quot;액상형 전자담배도 담배&quot;...담배사업법 개정안 기재위 통과,"기재위에선 국가연구개발사업을 예비 타당성 조사 대상에서 제외하는 내용의 국가재정법 개정안도 가결됐습니다. 세무법인 설립의 인적 요건을 현행 세무사 5인에서 3인으로 완화하는 내용의 세무사법, 파산 선고 후... ",https://www.ytn.co.kr/_ln/0101_202509251816023183,https://n.news.naver.com/mnews/article/052/0002251969?sid=100,"Thu, 25 Sep 2025 18:16:00 +0900"
기재위,"'정부조직 개편' 후속 법안, '패스트트랙' 안건 지정","기재위에서 심사가 끝난 뒤에는 법제사법위원회에서 90일 이내 체계·자구 심사를 끝내야 하고, 본회의에는 60일 이내에 상정돼야 한다. 최장 330일이 지나면 법안이 자동으로 본회의에 상정돼 투표에 부쳐지는 것이다.... ",https://www.newspim.com/news/view/20250925001088,https://www.newspim.com/news/view/20250925001088,"Thu, 25 Sep 2025 18:10:00 +0900"
기재위,"민주유공자법 등 4개 법안, 신속처리안건 지정…야 “절차적 정당성 짓...","이 법안들은 모두 국민의힘이 위원장을 맡고 있는 국회 정무위, 기재위 소관입니다. 국민의힘은 반대표를 던지며 강하게 항의했습니다. 국회 정무위 소속 국민의힘 유영하 의원은 해당 법안들이 &quot;단 한 번도 법안소위에... ",https://news.kbs.co.kr/news/pc/view/view.do?ncd=8367613&ref=A,https://n.news.naver.com/mnews/article/056/0012036806?sid=100,"Thu, 25 Sep 2025 18:08:00 +0900"
기재위,"국회 기재위 2025년 국정감사-기재부 13~14일, 국세청 16일","국회 기획재정위원회는 내달 13일 기획재정부를 시작으로 30일까지 18일간 2025년 국정감사를 진행한다. 국세청과 수도권 지방국세청에 대한 국감은 내달 16일 세종정부청사에서, 관세청은 내달 21일 국회에서... ",https://www.taxtimes.co.kr/news/article.html?no=271622,https://www.taxtimes.co.kr/news/article.html?no=271622,"Thu, 25 Sep 2025 18:04:00 +0900"
임이자,&lt;화보&gt; 2025 상주 세계모자 페스티벌,"/이용선기자 photokid@kbmaeil.com 26일 오후 열린 개막식에서 강영석 상주시장, 임이자 국회의원, 안경숙 상주시의회 의장을 비롯한 내빈들이 인사말하고 있다. 26일 오후 열린 개막식에서 세계 모자를 주제로 한 패션쇼가... ",https://www.kbmaeil.com/article/20250927500007,https://www.kbmaeil.com/article/20250927500007,"Sat, 27 Sep 2025 00:38:00 +0900"
임이자,'2025 상주 세계모자페스티벌' 개막...인사말 하는 임이자 국회의원,"임이자 국회의원(국힘. 상주·문경시)이 26일 오후 7시 경북 상주시 태평성대 경상감영공원에서 열린 '2025 상주 세계모자페스티벌' 개막식에서 인사말을 하고 있다. 사진 맨 오른쪽부터 남영숙·김홍구 도의원, 안경숙... ",https://daily.hankooki.com/news/articleView.html?idxno=1277048,https://daily.hankooki.com/news/articleView.html?idxno=1277048,"Sat, 27 Sep 2025 00:32:00 +0900"
임이자,"임이자 , “관세 피해기업 지원 성적표… 수은 집행률 26%, 6개 기관 중 ...","데일리 환경 이정윤(assh1010@dailyt.co.kr) 국회 기획재정위원회 임이자 위원장(국민의힘 경북 상주·문경)은... 그러나 임이자 위원장이 수출입은행으로부터 제출받은 자료에 따르면, 프로그램의 집행 실적은 기대와 달리... ",https://www.dailyt.co.kr/newsView/dlt202509260019,https://www.dailyt.co.kr/newsView/dlt202509260019,"Fri, 26 Sep 2025 23:12:00 +0900"
임이자,[여랑야랑]“호남에선 불 안 나나” 목소리 주인을 찾습니다,임이자 / 국민의힘 의원 (어제) 왜 기권해! [현장음] 호남에선 불 안 나나? [현장음] 이런 걸 왜 기권을 해요? 임이자 / 국민의힘 의원 (어제) 왜 반대하지? Q. 국민의힘 쪽은 맞군요? 네. 목소리 나온 의석 쪽에 앉았던 국민의힘... ,https://www.ichannela.com/news/main/news_detailPage.do?publishId=000000493977,https://n.news.naver.com/mnews/article/449/0000321967?sid=100,"Fri, 26 Sep 2025 19:32:00 +0900"
임이자,‘이재명 정부 첫 시험대’ 6·3 지방선거 광역단체장 후보군 톺아보기,"김석기 김정재 이만희 임이자 의원, 최경환 전 경제부총리, 이강덕 포항시장, 백승주 전 의원이 자천타천 언급되고 있다. 민주당에서는 권오을 국가보훈부 장관, 임미애 의원이 거론된다. 권 장관은 2018년 지선 때... ",https://ilyo.co.kr/?ac=article_view&entry_id=500430,https://ilyo.co.kr/?ac=article_view&entry_id=500430,"Fri, 26 Sep 2025 17:10:00 +0900"
임이자,"관세 피해기업 지원 성적표…수출입은행,집행률 26%로 6개 기관 중 5위",국회 기획재정위원회 임이자 위원장(국민의힘 경북 상주·문경)은 26일 한국 수출입은행이 운영 중인 위기대응특별프로그램의 집행 부진과 소극적인 운영 방식을 비판했다. 임 위원장은 &quot;최근 한 · 미 정상회담 관세... ,https://www.pinpointnews.co.kr/news/articleView.html?idxno=380710,https://www.pinpointnews.co.kr/news/articleView.html?idxno=380710,"Fri, 26 Sep 2025 16:20:00 +0900"
임이자,"임이자 기재위원장 &quot;수은, 관세 피해기업 지원 6조 푼다더니 집행률 26%...",국회 기획재정위원장인 임이자 의원(국민의힘)이 26일 수출입은행으로부터 제출받은 자료에 따르면... 관세 충격에 가장 취약한 중소·중견기업조차 제때 충분한 지원을 받지 못한다는 것이 임이자 위원장의... ,https://www.taxtimes.co.kr/news/article.html?no=271639,https://www.taxtimes.co.kr/news/article.html?no=271639,"Fri, 26 Sep 2025 16:06:00 +0900"
임이자,"임이자 기재위원장, &quot;관세 피해기업 지원 성적표…수은 집행률 26%, 6개 ...","임이자 의원 국회 기획재정위원회 임이자 위원장(국민의힘)은 26일 한국수출입은행이 운영 중인 위기대응특별프로그램의 집행 부진과 소극적인 운영 방식을 강하게 비판했다. 지난 4월, 한국수출입은행은 미국 정부의... ",http://www.intn.co.kr/news/articleView.html?idxno=2046254,http://www.intn.co.kr/news/articleView.html?idxno=2046254,"Fri, 26 Sep 2025 15:20:00 +0900"
임이자,"[2025 국감] 수출입은행, 관세피해기업 지원 저조…집행율 26%",26일 국회 기획재정위원회위원장 임이자 국민의힘 의원이 수출입은행으로부터 제출받은 자료에 따르면... 임이자 의원은 &quot;관세 충격에 가장 취약한 중소·중견기업조차 제때 충분한 지원을 받지 못한다면 관세 충격을... ,http://www.shinailbo.co.kr/news/articleView.html?idxno=2123448,http://www.shinailbo.co.kr/news/articleView.html?idxno=2123448,"Fri, 26 Sep 2025 15:08:00 +0900"
임이자,"임이자 기재위원장 &quot;수출입은행 위기대응특별프로그램, 집행 부진 심각...",임이자 의원. [임이자 의원실]   국회 기획재정위원회 임이자 위원장(국민의힘·경북 상주·문경)은 26일 한국수출입은행이 운영 중인 위기대응특별프로그램의 집행 부진과 소극적 운영을 강하게 비판했다.... ,https://www.ziksir.com/news/articleView.html?idxno=106206,https://www.ziksir.com/news/articleView.html?idxno=106206,"Fri, 26 Sep 2025 14:42:00 +0900"
임이자,"국민의힘 임이자 의원 &quot;한국은행 포항본부, 올해 연구실적 0건... 지역경...",조직 관리 부실 지적 임이자 “철강산업 위기 지역에서 조사연구 부재... 한국은행 각성 필요” 25일 국회 기획재정위원회 전체회의에서 국민의힘 소속 임이자 위원장이 담배사업법 개정안 등 안건을 의결하며 의사봉을... ,https://www.news2day.co.kr/article/20250926500121,https://www.news2day.co.kr/article/20250926500121,"Fri, 26 Sep 2025 13:16:00 +0900"
임이자,"수출입은행, 美 관세 피해 지원 실적 저조…달성률 26% 그쳐",임이자 &quot;지원 미흡…즉각·실질 집행 통해 체감 높여야&quot; 한국수출입은행(수출입은행)의 미국 관세 피해기업 지원을 위한 집행실적이 저조하다는 조사 결과가 나왔다. 임이자(국회 기획재정위원장) 국민의힘 의원실이... ,https://news.tf.co.kr/read/economy/2248077.htm,https://n.news.naver.com/mnews/article/629/0000430162?sid=101,"Fri, 26 Sep 2025 11:59:00 +0900"
임이자,"배현진 의원이 &quot;쪽팔림&quot; 말한 그 날, 국힘 단톡방에서 예고된 공포 [12.7...","(비례), 임이자(경북 상주시문경시), 임종득(경북 영주시영양군봉화군) 자 장동혁(충남 보령시서천군), 정동만(부산 기장군), 정성국(부산 부산진구갑), 정연욱(부산 수영구), 정점식(경남 통영시고성군), 정희용(경북... ",https://www.ohmynews.com/NWS_Web/View/at_pg.aspx?CNTN_CD=A0003168096&CMPT_CD=P0010&utm_source=naver&utm_medium=newsearch&utm_campaign=naver_news,https://n.news.naver.com/mnews/article/047/0002489609?sid=100,"Fri, 26 Sep 2025 11:59:00 +0900"
임이자,"경북 발전 시리즈 세미나 개최, SOC사업 ‘미래 비전’ 모색","이번 세미나는 구자근 경북도당위원장과 강명구·김석기·김정재·김형동·박형수·송언석·이만희·이상휘·임이자·임종득·정희용·조지연 경북지역 국회의원이 공동 주최하고, 국민의힘 경북도당과 경상북도 공동... ",https://www.sentv.co.kr/article/view/sentv202509260082,https://www.sentv.co.kr/article/view/sentv202509260082,"Fri, 26 Sep 2025 11:56:00 +0900"
임이자,"수출입은행, 美관세 피해기업 지원 프로그램 집행률 26%…지원건수도 매...","국회 기획재정위원회 위원장인 임이자 국민의힘 의원이 수출입은행에 요청해 26일 공개한 자료에 따르면... 임이자 위원장실은 수출입은행 해당 프로그램의 낮은 실적 이유로 지원 대상 범위협소, 비효율적인... ",https://www.newsis.com/view/NISX20250926_0003345353,https://n.news.naver.com/mnews/article/003/0013507550?sid=100,"Fri, 26 Sep 2025 10:57:00 +0900"
임이자,“공공기관운영법 신속처리 동의 못 해… 여야 협상을”,"소속 임이자(3선, 경북 상주·문경) 국회 기획재정위원장은 25일 더불어민주당이 정부조직법을 강행한 데 대해... 임이자가 무서워 패스트트랙을 태우나. 충분히 논의를 거쳐야 하는데도 민주당이 힘으로 밀어붙이는 모습을... ",https://www.seoul.co.kr/news/politics/2025/09/26/20250926009003?wlog_tag3=naver,https://n.news.naver.com/mnews/article/081/0003578130?sid=100,"Fri, 26 Sep 2025 05:05:00 +0900"
임이자,특검법 '합의 파기'→정부조직법 후퇴 '나비효과',실제 국민의힘 소속 윤한홍 정무위원장이나 임이자 기획재정위원장이 안건을 상정하지 않으면 정부·여당의 시간표대로 금융조직 개편안을 완성하기는 사실상 무리였다. 고육지책으로 후속 법안을 패스트트랙에 올릴 수... ,https://www.nocutnews.co.kr/news/6406267?utm_source=naver&utm_medium=article&utm_campaign=20250926073115,https://n.news.naver.com/mnews/article/079/0004070371?sid=100,"Fri, 26 Sep 2025 05:01:00 +0900"
임이자,임이자 “한국은행 포항본부 올해 조사 연구 0건,"국민의힘 임이자 국회의원이 한국은행으로부터 제출받은 자료에 따르면 올해 8월까지 본부별 조사연구는 대전·세종·충남이 9건, 강원 7건, 대구·경북은 5건인데 반해 포항본부는 0건입니다. 임이자 의원은 \&quot;철강산업... ",http://www.phmbc.co.kr/www/news/desk_news?idx=197962&mode=view,http://www.phmbc.co.kr/www/news/desk_news?idx=197962&mode=view,"Thu, 25 Sep 2025 20:40:00 +0900"
임이자,본회의 투표에서 명패수와 투표수 차이 인정 논란 …국힘 &quot;부정투표&quot;,임이자 국민의힘 의원은 &quot;이렇게 했을 때는 다 무효로 해야한다&quot;고 주장했다. 최민희 민주당 의원은 &quot;챗GPT에게 맡기자&quot;고 받아쳤다. 우 의장은 국민의힘의 항의에도 불구하고 이날 2표를 모두 유효표로 인정해... ,https://www.newsis.com/view/NISX20250925_0003344600,https://n.news.naver.com/mnews/article/003/0013506517?sid=100,"Thu, 25 Sep 2025 20:05:00 +0900"
임이자,항의하는 임이자,임이자 국민의힘 의원이 25일 서울 여의도 국회에서 열린 제429회 국회(정기회) 제9차 본회의에서 민주유공자 예우에 관한 법률안에 대한 신속처리안건 지정동의의 건이 명패수보다 투표수가 많은 상황이 발생하자... ,https://www.news1.kr/photos/7516260,https://n.news.naver.com/mnews/article/421/0008509669?sid=100,"Thu, 25 Sep 2025 19:51:00 +0900"
임이자,국회 투표서 명패수가 더 적자…국힘 &quot;부정&quot;·與 &quot;국힘이 한것&quot;(종합),"이 과정에서 여야 의석에서는 &quot;이렇게 했을 땐 다 무효로 해야 한다&quot;(국민의힘 임이자 의원), &quot;챗GPT에 맡기자&quot;(민주당 최민희 의원)는 발언이 나오는 등 큰 혼란이 빚어졌다. 이에 대해 우 의장은 &quot;제가 아무리 봐도 이것을... ",https://www.yna.co.kr/view/AKR20250925166251001?input=1195m,https://n.news.naver.com/mnews/article/001/0015649707?sid=100,"Thu, 25 Sep 2025 19:38:00 +0900"
임이자,합성니코틴도 담배 규제하는 담배사업법 개정안 9년 만에 국회 상임위 ...,연 9300억 세수 확보 전망 국회 기획재정위원회 전체회의에서 지난 8일 국민의힘 소속 임이자 위원장이... 국회 기획재정위원회(위원장 임이자)는 25일 전체회의를 열고 이 같은 내용의 담배사업법 개정안을 의결했다. 이날... ,https://www.news2day.co.kr/article/20250925500305,https://www.news2day.co.kr/article/20250925500305,"Thu, 25 Sep 2025 19:20:00 +0900"
