Keyword,Title,Description,Original Link,Link,Publication Date
관료,"EU 전 상임의장, 나토 수장 직격 “미국 대리인 노릇 멈춰라”","그는 미국의 &quot;매우 충직한 파트너&quot;인 EU에 그린란드를 병합하겠다고 위협하고, 블라디미르 푸틴 러시아 대통령에게 정당성을 부여하려 하고, 전직 EU 관료를 제재하는 등의 행동을 트럼프 대통령이 하는 것은 옳지 않다고... ",https://news.kbs.co.kr/news/pc/view/view.do?ncd=8473966&ref=A,https://n.news.naver.com/mnews/article/056/0012116204?sid=104,"Sat, 31 Jan 2026 03:42:00 +0900"
관료,"美, 이란 협상 압박속 내무장관 제재…&quot;시위대 사망 책임&quot;",미국 재무부 해외자산통제국(OFAC)은 30일(현지 시간) 에스칸다르 모메니 칼라가리 이란 내무부 장관 등 이란 시위대에 대한 잔혹한 탄압에 책임있는 관료들에 제재를 가한다고 밝혔다. 재무부는 모메니 장관에 대해... ,https://www.newsis.com/view/NISX20260131_0003497450,https://n.news.naver.com/mnews/article/003/0013740936?sid=104,"Sat, 31 Jan 2026 03:14:00 +0900"
관료,"EU 전 상임의장, 나토 수장 직격 &quot;美 대리인 노릇 멈춰라&quot;","그는 미국의 &quot;매우 충직한 파트너&quot;인 EU에 그린란드를 병합하겠다고 위협하고, 블라디미르 푸틴 러시아 대통령에게 정당성을 부여하려 하고, 전직 EU 관료를 제재하는 등의 행동을 트럼프 대통령이 하는 것은 옳지 않다고... ",https://www.yna.co.kr/view/AKR20260131001900098?input=1195m,https://n.news.naver.com/mnews/article/001/0015877164?sid=104,"Sat, 31 Jan 2026 01:56:00 +0900"
관료,"현명한 패배도 있다…전쟁에도, 인생에도",경제관료로 화려한 이력을 쌓았던 지은이의 현재 전공은 다름 아닌 역사다. 『역사가 당신을 강하게... 경제관료 출신답게 게임이론 같은 경제학 개념과 세계 각국의 기업 경영 사례도 책에 녹여냈다.,https://www.joongang.co.kr/article/25401659,https://n.news.naver.com/mnews/article/353/0000054418?sid=103,"Sat, 31 Jan 2026 00:32:00 +0900"
관료,"[김영수의 디코드 차이나] 딥시크 쇼크 1년, 중국의 다음 10년","세제, 관료 인사, 금융 시스템에 깊이 박힌 ‘속도와 규모’ 위주 인센티브의 산물이다. 과잉 생산은 기업 수익률 하락과 임금 정체를 낳고, 국내 수요를 넘어 글로벌 덤핑으로 이어진다. 실제 2025년 중국의 대미 수출은... ",https://www.hankyung.com/article/2026013043761,https://n.news.naver.com/mnews/article/015/0005244941?sid=110,"Sat, 31 Jan 2026 00:10:00 +0900"
관료,시진핑만 비껴간 '칠상팔하'…76세 장유샤 버틴 게 화근,고위 관료 숙청의 경우 보통은 해당 인물의 신병을 먼저 확보하고 이어 측근 세력마저 진압한 뒤 어느 정도 국면이 안정되면 그 사실을 공표한다. 여론 예열 시간을 갖는 것이다. 허웨이둥도 지난해 3월 중순 모습이... ,https://www.joongang.co.kr/article/25401639,https://n.news.naver.com/mnews/article/353/0000054399?sid=102,"Sat, 31 Jan 2026 00:02:00 +0900"
관료,"조국혁신당·진보당·사회민주당, 대전·충남 행정통합 '진보적 대안' 모...",◆ 지원금 아닌 재정 자치·관료 아닌 정치 자치 이번 토론회에서는 중앙정부의 시혜성 지원금 확대가 아닌... 같은 관료 중심 대책이 아니라 지역 정당 활동과 시민 참여를 보장하는 정치 자치권 강화가 행정통합 논의의... ,http://www.newstnt.com/news/articleView.html?idxno=582251,http://www.newstnt.com/news/articleView.html?idxno=582251,"Fri, 30 Jan 2026 23:36:00 +0900"
관료,"트럼프, 차기 연준 의장에 케빈 워시 지명…'쿠팡 이사' 출신, 韓·아시...",월스트리트저널(WSJ)은 워시 후보자를 자유무역과 재정 건전성을 중시하는 전통적 공화당 성향의 경제 관료로 평가했다. 다만 금리 인하에 신중한 입장을 보여온 억만장자 투자자 스탠리 드러켄밀러와의 친분은 향후... ,http://www.newsian.co.kr/news/articleView.html?idxno=85735,http://www.newsian.co.kr/news/articleView.html?idxno=85735,"Fri, 30 Jan 2026 22:22:00 +0900"
재경부,"족쇄? 안전핀?…금감원 공공기관 재지정 논란, 마침표 아닌 ‘쉼표’ [...","금감원이 공공기관으로 지정되면 매년 재경부의 경영 평가를 받게 된다. 인사와 조직, 예산에 대한 통제와 기관장 해임 건의 등 재경부의 영향력이 커짐에 따라 금감원의 독립적인 업무수행에 제약을 받을 수 있다는... ",https://www.segye.com/newsView/20260130515385?OutUrl=naver,https://n.news.naver.com/mnews/article/022/0004102077?sid=101,"Sat, 31 Jan 2026 13:20:00 +0900"
재경부,올해 첫 물가지표 나온다…1월 물가 얼마나 올랐나[재경부·기획처 주간...,"다음은 재경부, 기획처, 국가데이터처, 한국개발연구원(KDI) 등 주간 주요 일정 및 보도 계획이다. ◇주요 주간 일정 &lt;재정경제부&gt; △2일(월) 16:15 설 맞이 전통시장 현장방문(부총리, 천안) △3일(화) 10:00 교섭단체... ",http://www.edaily.co.kr/news/newspath.asp?newsid=01948326645323296,https://n.news.naver.com/mnews/article/018/0006210678?sid=101,"Sat, 31 Jan 2026 12:29:00 +0900"
재경부,국가채무 관리 방안 묻는 무디스 질문에…구윤철 “성과 중심 전략적 기...,30일 재경부에 따르면 구 부총리는 전날 무디스 측과 만난 자리에서 한국 경제가 지난해 상반기 0.3% 성장하는... 정책 방향에 공감하며 한국의 AI 지원·산업 경쟁력 제고 방안 등에 관심을 보였다고 재경부는 설명했다.,https://www.segye.com/newsView/20260130510281?OutUrl=naver,https://n.news.naver.com/mnews/article/022/0004102043?sid=101,"Sat, 31 Jan 2026 08:15:00 +0900"
재경부,[다음주 재정경제부 등 경제부처 일정],"*2월2일(월) ▲16:15 부총리 설 맞이 전통시장 현장방문(천안) ※2025년 12월 및 연간 온라인쇼핑동향(12:00) ※국가데이터처, 일일물가조사로 설 물가 안정 지원한다(12:00) ※재경부·농식품부·해수부·중기부, 설... ",https://news.einfomax.co.kr/news/articleView.html?idxno=4396564,https://news.einfomax.co.kr/news/articleView.html?idxno=4396564,"Sat, 31 Jan 2026 08:06:00 +0900"
재경부,역대급 설 대책에도 변수 산적…물가 안정·경기 진작 동시 시험대,재경부 관계자는 &quot;작년 소매판매가 4년 만에 증가 전환하는 등 긍정적인 변화는 있지만 레벨로 보면 그간... 재경부 관계자는 &quot;내수와 소비 지표가 아주 좋은 상황이라고 말하기는 어렵다&quot;며 &quot;플러스 폭을 이어갈 수... ,https://www.newsis.com/view/NISX20260130_0003496547,https://n.news.naver.com/mnews/article/003/0013741000?sid=101,"Sat, 31 Jan 2026 07:00:00 +0900"
재경부,채권발행 쏠림 막는다…범정부 '채권 발행기관 협의체' 행정예고,재경부 소속의 공식 기구로 명문화하고 채권 수급 관리의 실행력을 높이는 것이 골자다. 행정절차법에 따라 2월12일까지 의견수렴을 거친 이후 규정안의 효력이 발생할 예정이다. 행정예고에 따르면 협의체 의장은 재경부... ,https://view.asiae.co.kr/article/2026013015020848930,https://n.news.naver.com/mnews/article/277/0005714750?sid=101,"Sat, 31 Jan 2026 07:00:00 +0900"
재경부,작년 산업 생산 증가율 0.5%…계엄 여파 5년 만에 가장 낮았다,재경부 관계자는 “2022년 공사비와 금리가 많이 오르면서 수주가 급감했던 영향이 시차를 두고 반영되고 있다”며 “재작년부터 건설 수주가 회복되고 있어 올해는 부진이 완화될 것”이라고 전망했다.,https://www.joongang.co.kr/article/25401683,https://n.news.naver.com/mnews/article/353/0000054441?sid=101,"Sat, 31 Jan 2026 01:04:00 +0900"
재경부,"美, 한국 3회 연속 환율 관찰대상국으로 분류… “원화 약세, 한국 경제...","재경부는 이날 보도자료에서 “앞으로도 미 재무부와 긴밀하게 소통하며 외환시장에 대한 상호 이해와 신뢰를 확대하고, 외환시장 안정을 위한 협력을 지속해 나갈 계획”이라고 밝혔다.",https://www.segye.com/newsView/20260130506407?OutUrl=naver,https://n.news.naver.com/mnews/article/022/0004101992?sid=101,"Sat, 31 Jan 2026 00:22:00 +0900"
재경부,"피치, 韓 신용도 'AA-' 유지···잠재성장률 '2.1%→1.9%'",30일 재경부 등에 따르면 피치는 한국의 장기 외화표시 발행자등급(IDR)을 'AA-'로 유지했다. 피치는 2012년 9월부터 한국의 국가등급을 'AA-'로 유지하고 있다. 피치는 한국 국내총생산(GDP) 증가율이 강한 민간 소비 등으로... ,https://www.seoulfn.com/news/articleView.html?idxno=619984,https://www.seoulfn.com/news/articleView.html?idxno=619984,"Fri, 30 Jan 2026 18:04:00 +0900"
재경부,"'약한 비둘기' 의장에…한은, 금리동결 길어지나","재경부는 워시 전 이사 취임 가능성에 따른 미국 통화정책 기조 변화와 외국인 자금 흐름, 국채시장에 미칠 영향을 면밀히 들여다보는 것으로 전해졌다. 관가에서는 이창용 한은 총재가 국제통화기금(IMF) 국장으로... ",https://www.hankyung.com/article/2026013044671,https://n.news.naver.com/mnews/article/015/0005244857?sid=101,"Fri, 30 Jan 2026 17:40:00 +0900"
재경부,"피치, 한국 신용등급 'AA-' 유지‥성장률은 2.0% 전망","재경부는 &quot;피치는 이번 발표를 통해 한국의 국가신용등급과 전망을 유지하면서 한국 경제에 대한 흔들림 없는 신뢰를 표했다&quot;며, &quot;특히 새 정부 출범 이후 정치적 불확실성 해소 및 대내외 건전성에 대한 긍정적 시각을... ",https://imnews.imbc.com/news/2026/econo/article/6797557_36932.html,https://n.news.naver.com/mnews/article/214/0001477760?sid=101,"Fri, 30 Jan 2026 17:38:00 +0900"
재경부,공공기관 지정 피하고 수사권 챙겼다…금감원 실세론 ‘솔솔’,공공기관이 될 경우 금융위 지도·감독에 더해 재경부의 경영평가까지 받아야 해 조직의 자율성이 크게 위축될 수 있는 상황이었다. 공운위는 “금감원에 대한 민주적 통제가 필요하다”면서도 “금융감독 기구의... ,https://www.kukinews.com/article/view/kuk202601300160,https://www.kukinews.com/article/view/kuk202601300160,"Fri, 30 Jan 2026 17:34:00 +0900"
재경부,"피치, 韓국가신용등급 ‘AA-’·‘안정적 전망’ 유지…잠재성장률 1%대...","[연합] 재경부는 “견조한 대외건전성과 역동적인 수출 구조, 안정적인 거시경제 성과 등이 신용등급을... 재경부는 “피치가 한국의 국가신용등급과 전망을 유지하며 한국 경제에 대한 흔들림 없는 신뢰를 표했다”... ",https://biz.heraldcorp.com/article/10666714?ref=naver,https://n.news.naver.com/mnews/article/016/0002593779?sid=101,"Fri, 30 Jan 2026 17:33:00 +0900"
재경부,"피치, 韓 신용등급 ‘AA-’ 유지…잠재성장률 1.9%로 하향 조정",통해 한국 경제에 대한 국제사회의 신뢰가 재확인됐다고 평가했다. 재경부 관계자는 “앞으로도 국제 신용평가사들과 긴밀히 소통하며 한국 경제의 견조한 대외신인도를 유지하기 위해 적극 노력할 것”이라고 밝혔다.,https://www.dailian.co.kr/news/view/1604784/?sc=Naver,https://n.news.naver.com/mnews/article/119/0003054330?sid=101,"Fri, 30 Jan 2026 17:29:00 +0900"
재경부,"[속보]피치, 한국 신용등급 AA- 유지…李정부에 “적자 구조 고착화 우...",평가를 통해 한국 경제에 대한 국제사회의 신뢰가 재확인됐다고 평가했다. 재경부는 “앞으로도 국제 신용평가사들과 긴밀히 소통하며 한국 경제의 견조한 대외신인도를 유지하기 위해 적극 노력할 것”이라고 밝혔다.,https://www.munhwa.com/article/11565020?ref=naver,https://n.news.naver.com/mnews/article/021/0002767780?sid=101,"Fri, 30 Jan 2026 17:11:00 +0900"
재경부,"피치, 한국 신용등급 'AA-' 유지…올해 성장률 2.0% 전망(종합)",재경부는 &quot;피치는 이번 발표를 통해 한국의 국가신용등급과 전망을 유지하면서 한국 경제에 대한 흔들림 없는 신뢰를 표했다&quot;며 &quot;특히 새 정부 출범 이후 정치적 불확실성 해소 및 대내외 건전성에 대한 긍정적 시각을... ,https://www.news1.kr/economy/trend/6057169,https://n.news.naver.com/mnews/article/421/0008745264?sid=101,"Fri, 30 Jan 2026 16:54:00 +0900"
재경부,"피치, 韓 국가신용등급 'AA-' 유지…&quot;반도체 수출·대외건전성 견조&quot;",평가를 통해 한국 경제에 대한 국제사회의 신뢰가 재확인됐다고 평가했다. 재경부는 &quot;앞으로도 국제 신용평가사들과 긴밀히 소통하며 한국 경제의 견조한 대외신인도를 유지하기 위해 적극 노력할 것&quot;이라고 밝혔다.,https://www.newsis.com/view/NISX20260130_0003497170,https://n.news.naver.com/mnews/article/003/0013740607?sid=101,"Fri, 30 Jan 2026 16:49:00 +0900"
재경부,"美, 韓 관찰대상국 지정 속 '원화 약세' 재언급…일부 하방압력 전망","이어 &quot;한국의 펀더멘탈 대비 원화 약세가 과하다는 것은 이창용 한은 총재나 재경부에서도 계속 언급했던 내용으로, 미국도 같은 의견을 공유하고 있다는 것을 확인한 것&quot;이라며 &quot;시장에 미치는 영향은 제한적&quot;이라고... ",https://www.news1.kr/economy/trend/6056981,https://n.news.naver.com/mnews/article/421/0008745235?sid=101,"Fri, 30 Jan 2026 16:40:00 +0900"
재경부,"李대통령, 또 '추경' 언급…&quot;창업지원 후반기에는 추경으로&quot;","구윤철 부총리 겸 재경부 장관에게도 &quot;다른 건 귀에 잘 안 들어오는데 '철철 넘치게 (하겠다)' 그것은 진짜냐&quot;며 &quot;(예산을) 쪼잔하게, 찔끔찔끔하지 말라&quot;고 당부했다. 이 대통령은 올해 들어 다양한 사안에서 추경을... ",https://view.asiae.co.kr/article/2026013016361047042,https://n.news.naver.com/mnews/article/277/0005714684?sid=100,"Fri, 30 Jan 2026 16:36:00 +0900"
재경부,최정예 창업루키 5000명 키운다… '모두의 창업 프로젝트' 본격 추진,중소벤처기업부(중기부)와 재정경제부(재경부)는 30일 청와대 충무실에서 '국가창업시대 전략회의'를 열고 국가창업시대 정책 방향을 발표했다. 재경부는 '스타트업 열풍 조성방안'의 추진 배경과 ▲모두의 창업... ,https://www.sidae.com/article/2026013016270790631,https://n.news.naver.com/mnews/article/417/0001127469?sid=101,"Fri, 30 Jan 2026 16:29:00 +0900"
재경부,"美 '환율관찰대상국' 재지정에…청와대 &quot;기계적 결정, 소통 지속&quot;",재경부는 &quot;우리 정부는 앞으로도 미 재무부와 긴밀하게 소통하며 외환시장에 대한 상호 이해와 신뢰를 확대하고 외환시장 안정을 위한 협력을 지속해 나갈 계획&quot;이라고 밝혔다. [뉴스웍스=],https://www.newsworks.co.kr/news/articleView.html?idxno=829375,https://www.newsworks.co.kr/news/articleView.html?idxno=829375,"Fri, 30 Jan 2026 16:04:00 +0900"
재경부,"‘추경’ 또 언급한 李 “창업지원, 후반기 예산 추경으로”","특히 구윤철 부총리 겸 재경부 장관으로부터 스타트업 열풍 조성 방안을 보고받은 뒤 “다른 건 귀에 잘 안 들어오는데 ‘철철 넘치게’(라는 표현) 그거 진짜냐. 그렇게 할 거냐”라며 “쪼잔하게, 찔끔찔끔하지 말라”... ",https://biz.chosun.com/policy/politics/president_office/2026/01/30/UODI4ODHLVA7VOQAJMC5XWV6IY/?utm_source=naver&utm_medium=original&utm_campaign=biz,https://n.news.naver.com/mnews/article/366/0001139558?sid=100,"Fri, 30 Jan 2026 16:00:00 +0900"
재경부,李대통령 &quot;AI로봇 대응 방법은 창업…거대한 수레 피할 수 없어&quot;,"중소벤처기업부(중기부)와 재정경제부(재경부)는 이날 국가창업시대 정책 방향을 발표하고, 국민의 아이디어에 국가가 투자하는 창업 오디션 '모두의 창업 프로젝트' 등의 계획을 설명했다. 또한 이 대통령은 구윤철... ",https://www.ngonews.kr/news/articleView.html?idxno=223471,https://www.ngonews.kr/news/articleView.html?idxno=223471,"Fri, 30 Jan 2026 15:48:00 +0900"
재경부,"미 재무부, 한국 ‘환율 관찰대상국’ 재지정…“원화 약세, 한국 경제...",재경부는 “지난해 하반기 이후 원화가 일방향 약세로 과도하게 움직인 것은 적절하지 않다는 미 재무부의... 구윤철 부총리 겸 재경부 장관은 페이스북에 “환율 관찰대상국 유지는 대미 무역흑자와 경상수지 흑자가... ,https://www.khan.co.kr/article/202601301546001,https://n.news.naver.com/mnews/article/032/0003424885?sid=101,"Fri, 30 Jan 2026 15:46:00 +0900"
재경부,건설업 침체가 경제 발목…SOC·반도체로 돌파구 찾나,올해 SOC 예산도 27조7000억원으로 전년(본예산 기준 25조4000억원·2차추경 기준 26조원)보다 확대됐다.조성중 재경부 경제분석과장은 &quot;건설기성은 2년 연속 감소했으나 상반기에 비해서는 하반기에 감소 폭 축소됐다... ,https://www.asiatoday.co.kr/view.php?key=20260130010013919,https://www.asiatoday.co.kr/view.php?key=20260130010013919,"Fri, 30 Jan 2026 15:42:00 +0900"
재경부,"생산·소비·투자, 4년만의 트리플 플러스에도 증가세 '미약'...회복 모...","재경부는 &quot;건설투자는 그간의 수주 개선이 시차를 두고 반영되는 가운데 SOC(사회간접자본) 예산 확대(7%), 반도체 생산시설 증설 등으로 부진이 완화될 전망&quot;이라고 밝혔다.",http://www.updownnews.co.kr/news/articleView.html?idxno=316035,http://www.updownnews.co.kr/news/articleView.html?idxno=316035,"Fri, 30 Jan 2026 15:34:00 +0900"
재경부,"구윤철 부총리, 신평사 '무디스' 만나 &quot;AI 기술 기반 일자리 창출 가능&quot;","설명했다고 재경부는 오늘 밝혔습니다. 구 부총리는 우리나라의 지난해 상반기 성장률이 0.3%에 그쳤지만... 정책 방향에 공감을 나타내며, AI 지원 정책과 산업 경쟁력 강화 방안에 높은 관심을 보였다고 재경부는 전했습니다.",https://news.bbsi.co.kr/news/articleView.html?idxno=4064704,https://news.bbsi.co.kr/news/articleView.html?idxno=4064704,"Fri, 30 Jan 2026 15:26:00 +0900"
재경부,"스테이블코인법 여당안, 이르면 내주 가닥…與 “李 대통령 속도 주문”",구윤철 경제부총리 겸 재경부 장관과 금융위는 지난 9일 이재명 대통령 주재로 열린 경제성장전략 국민보고회에 △1분기에 스테이블코인 관련 디지털자산 기본법(2단계 입법) 제정안 처리 △올 하반기에 관련된 각종... ,http://www.edaily.co.kr/news/newspath.asp?newsid=04168886645322968,https://n.news.naver.com/mnews/article/018/0006210329?sid=101,"Fri, 30 Jan 2026 15:19:00 +0900"
재경부,"경진대회 이기면 10억 지원...정부, ‘모두의 창업’ 프로젝트 발표",구윤철 부총리 겸 재경부 장관과 한성숙 중기부 장관은 “이번 토론회를 통해 수렴한 의견을 반영하여 ‘모두의 창업 프로젝트’를 속도감 있게 추진하겠다”며 “국민이 체감할 수 있는 창업 열풍으로 확산되도록... ,https://www.seoul.co.kr/news/economy/2026/01/30/20260130500188?wlog_tag3=naver,https://n.news.naver.com/mnews/article/081/0003613156?sid=101,"Fri, 30 Jan 2026 15:15:00 +0900"
재경부,"李대통령, 창업 지원 정책 추진에 &quot;후반기는 추경해서 확보&quot;","중소벤처기업부(중기부)와 재정경제부(재경부)는 이날 국가창업시대 정책 방향을 발표하고, 국민의 아이디어에 국가가 투자하는 창업 오디션 '모두의 창업 프로젝트' 등의 계획을 설명했다. 또한 이 대통령은 구윤철... ",https://www.news1.kr/politics/president/6056898,https://n.news.naver.com/mnews/article/421/0008744902?sid=100,"Fri, 30 Jan 2026 15:11:00 +0900"
기획처,올해 첫 물가지표 나온다…1월 물가 얼마나 올랐나[재경부·기획처 주간...,"다음은 재경부, 기획처, 국가데이터처, 한국개발연구원(KDI) 등 주간 주요 일정 및 보도 계획이다. ◇주요 주간 일정 &lt;재정경제부&gt; △2일(월) 16:15 설 맞이 전통시장 현장방문(부총리, 천안) △3일(화) 10:00 교섭단체... ",http://www.edaily.co.kr/news/newspath.asp?newsid=01948326645323296,https://n.news.naver.com/mnews/article/018/0006210678?sid=101,"Sat, 31 Jan 2026 12:29:00 +0900"
기획처,올해 확장재정 속 추경 추진되나…예술단체 간담회보다 더 주목받은 추...,"기획처는 이번 간담회가 내년도 예산안 편성 과정을 위한 간담회라며 추경과 상관이 없다고 밝혔지만, 이... 30일 기획처에 따르면 이번 간담회에서는 공연예술 역량 강화를 통한 국립예술단체 대표 레퍼토리 확대... ",https://www.segye.com/newsView/20260130512876?OutUrl=naver,https://n.news.naver.com/mnews/article/022/0004102058?sid=101,"Sat, 31 Jan 2026 10:20:00 +0900"
기획처,안산시호남향우회 새 얼굴... 임충섭 제24대 회장 취임,취임식은 김태훈 사무총장과 설성심 사무기획처 총무국장의 사회로 진행됐다. 임충섭 회장은 취임사에서 “안산시호남향우회는 단순한 친목단체를 넘어 세대와 지역을 잇는 공동체”라며 “‘우리는 하나다’라는... ,http://www.shinailbo.co.kr/news/articleView.html?idxno=2185454,http://www.shinailbo.co.kr/news/articleView.html?idxno=2185454,"Sat, 31 Jan 2026 08:40:00 +0900"
기획처,"기획처, 국제사회와 인구구조·AI 등 협력 본격 가동…“구조적 과제 논...","기획처는 30일 임기근 장관 직무대행 차관 명의로 협력 의사를 담은 서한을 발송했다고 밝혔다. 발송 대상은... 기획예산처 제공 임 대행은 서한에서 중장기 국가 발전 전략 수립, 성과 기반 재정 운용 등 기획처의 핵심... ",https://www.segye.com/newsView/20260130509931?OutUrl=naver,https://n.news.naver.com/mnews/article/022/0004102040?sid=101,"Sat, 31 Jan 2026 08:09:00 +0900"
기획처,"기획처, 장애인 고용기금 상반기 70% 집행…이달까지 1300억 완료","기획처는 30일 강영규 미래전략기획실장이 한국장애인고용공단 서울동부지사를 방문해 장애인 고용 촉진 및 직업재활 기금 사업 집행 상황을 점검하고, 장애인 표준사업장인 ㈜에이피알커뮤니케이션즈를 찾아 현장의... ",https://www.newspim.com/news/view/20260130001264,https://www.newspim.com/news/view/20260130001264,"Fri, 30 Jan 2026 17:54:00 +0900"
기획처,"기획예산처, 국제 재정 협력 본격화...G20 등에 서한 발송","기획처는 30일 임기근 장관 직무대행 차관 명의로 재정 협력 의사를 담은 서한을 발송했다고 밝혔다. 대상은... 이번 서한 발송은 기획처 출범을 국제사회에 공식적으로 알리고, 재정정책 당국이자 국가 중장기 발전... ",https://www.seoul.co.kr/news/economy/2026/01/30/20260130500215?wlog_tag3=naver,https://n.news.naver.com/mnews/article/081/0003613181?sid=101,"Fri, 30 Jan 2026 16:23:00 +0900"
기획처,"한양여자대학교, ‘2025학년도 재정지원사업 통합 성과공유회 개최",김송이 한양여자대학교 기획처 처장은 “이번 통합 성과공유회는 대학의 재정 지원사업이 실질적인 교육 성과와 지역 발전으로 이어지고 있음을 확인하는 자리였다”며 “앞으로도 지자체 및 산업체와 협력해 AI... ,https://www.donga.com/news/Society/article/all/20260130/133265050/1,https://n.news.naver.com/mnews/article/020/0003693761?sid=102,"Fri, 30 Jan 2026 15:28:00 +0900"
기획처,"기획처-문체부, 예술의전당 현장간담회...&quot;공연예술 역량 강화&quot;","정향우 기획처 사회예산심의관은 &quot;국립예술단체의 대표 레퍼토리는 국민이 일상에서 향유할 수 있는 공공 문화자산인 만큼, 유통 및 재창작 확대를 통해 우수한 작품이 확산될 수 있는 구조를 만들어 가는 것이 필요하다&quot;고... ",https://news.bbsi.co.kr/news/articleView.html?idxno=4064703,https://news.bbsi.co.kr/news/articleView.html?idxno=4064703,"Fri, 30 Jan 2026 15:26:00 +0900"
기획처,"기획처·문체부, 국립예술단체 간담회…&quot;기초공연예술 활성화&quot;",기획처 정향우 사회예산심의관은 &quot;기초 공연예술은 단기간 성과보다는 장기적인 안목에서의 지속적인 투자가 필요한 분야&quot;라며 &quot;창·제작 역량을 안정적으로 뒷받침하는 것이 무엇보다 중요하다&quot;고 말했다. 그러면서... ,https://news.tvchosun.com/site/data/html_dir/2026/01/30/2026013090177.html,https://n.news.naver.com/mnews/article/448/0000587352?sid=101,"Fri, 30 Jan 2026 15:23:00 +0900"
