Keyword,Title,Description,Original Link,Link,Publication Date
국정기획위원회,[박원재의 경제가 답이다] 증세라 쓰고 환원이라 읽는다 …8조 세금 말장...,국정기획위원회가 제시한 123대 국정과제를 이행하려면 210조원이 필요한데 지출 구조조정만으로는 감당할 수 없는 게 현실이다. 세금은 정권의 철학과 정체성을 반영하는 핵심 장치다. 증세와 감세 중 어느 쪽을 택할지는... ,https://www.ajunews.com/view/20250820102704336,https://www.ajunews.com/view/20250820102704336,"Thu, 21 Aug 2025 16:38:00 +0900"
국정기획위원회,"도의회, 기초단체 여론조사 착수…향후 파장은",이는 제주형 행정개편에 대한 주민투표 요구권을 갖고 있는 윤호중 행정안전부 장관과 새 정부 국정기획위원회가 제주도 기초단체 부활에 원칙적으로는 공감하면서도 기초단체 수를 명확히 할 것을 요구했기 때문이다.... ,http://www.jejunews.com/news/articleView.html?idxno=2220318,http://www.jejunews.com/news/articleView.html?idxno=2220318,"Thu, 21 Aug 2025 16:36:00 +0900"
국정기획위원회,"경기도, 국정과제 '필수의료 확충' 기반 마련…응급의료지원 자문단 가...",앞서 대통령 직속 국정기획위원회가 지난 13일 발표한 '국정운영 5개년 계획안'에는 필수의료 확충과 공공의료 강화가 주요 과제로 포함돼 있다. 유영철 경기도 보건건강국장은 &quot;응급의료 전문가들이 상시 참여하는... ,http://www.newskr.kr/news/articleView.html?idxno=100465,http://www.newskr.kr/news/articleView.html?idxno=100465,"Thu, 21 Aug 2025 16:36:00 +0900"
국정기획위원회,"‘실세’ 금감원장, 기대와 우려 [데스크 창]","이찬진 신임 금감원장은 현 정부의 대통령직인수위원회 역할을 하는 국정기획위 사회1분과장을 맡은 인물이다. 이재명 대통령과 사법시험 28회, 사법연수원 18기 동기로, 이 대통령의 ‘쌍방울 대북송금 사건’ 변호를... ",https://www.kukinews.com/article/view/kuk202508210166,https://www.kukinews.com/article/view/kuk202508210166,"Thu, 21 Aug 2025 16:26:00 +0900"
국정기획위원회,이찬진 금감원장 &quot;다음 주 놀랄 일 있을 것&quot;…조직개편안 발표 '촉각',"국정기획위원회는 소비자보호처를 분리래 금융소비자보호원을 신설하는 방안 등을 논의해왔는데, 이 같은 내용의 조직개편안 발표를 귀띔해준 것이란 의견이다. 또 기획재정부의 예산 기능을 분리해 '기획예산처'를... ",https://www.polinews.co.kr/news/articleView.html?idxno=704800,https://www.polinews.co.kr/news/articleView.html?idxno=704800,"Thu, 21 Aug 2025 16:22:00 +0900"
국정기획위원회,'실세' 금감원장 의미심장 한마디에…조직개편안 '재조명',지난달에는 금감원 직원 약 1500명이 금소처 분리에 반대한다는 내용의 호소문을 국정기획위원회에 전달하기도 했다. 일각에서는 대통령 측근인 이 원장이 존재감을 드러낸 것이라는 추측도 나왔다. 그가 국정기획위원회... ,https://www.ajunews.com/view/20250821161000487,https://www.ajunews.com/view/20250821161000487,"Thu, 21 Aug 2025 16:22:00 +0900"
국정기획위원회,"[전문] 김영진 &quot;정청래, 국힘 새 대표와 악수해야…젤렌스키와 푸틴도 ...",▶김영진 그건 이제 국정기획위원회에서 큰 방향으로 현재 기획재정부의 기능을 기획예산처의 기능과 재정경제부의 기능과 금융 기능을 이렇게 나눠주는 거였는데 조금 더 섬세하게 준비한다 해서 실제로는 다 임명을... ,https://news.jtbc.co.kr/article/NB12259741?influxDiv=NAVER,https://n.news.naver.com/mnews/article/437/0000453658?sid=100,"Thu, 21 Aug 2025 16:17:00 +0900"
국정기획위원회,"‘대통령실·국회 세종시 이전’ 행정수도특별법, 국토위 논의 본격화",국토교통위원회 법안심사소위원회로 넘어갔다. 이재명 정부의 국정운영 5개년 계획에도 행정수도 명문화가... 총리실이 배포한 국정기획위의 국정운영 5개년 계획안 자료집에 따르면 개헌 주요 의제에 행정수도 명문화... ,https://www.etoday.co.kr/news/view/2499007,https://www.etoday.co.kr/news/view/2499007,"Thu, 21 Aug 2025 16:14:00 +0900"
국정기획위원회,"경기도, '응급의료지원 자문단' 출범…중증환자 이송체계 개선 착수",앞서 대통령 직속 국정기획위원회가 지난 13일 발표한 '국정운영 5개년 계획안'에는 필수의료 확충과 공공의료 강화가 주요 과제로 포함돼 있다. 유영철 도 보건건강국장은 &quot;응급의료 전문가들이 상시 참여하는 자문체계... ,http://www.kihoilbo.co.kr/news/articleView.html?idxno=1156235,http://www.kihoilbo.co.kr/news/articleView.html?idxno=1156235,"Thu, 21 Aug 2025 16:08:00 +0900"
국정기획위원회,"제주형 기초자치단체, 건강주치의 등 제주 핵심현안, 새정부 국정과제·...","제주도는 13일 대통령 직속 국정기획위원회가 발표한 국정운영 계획에 제주 핵심 현안들이 다수 국정과제로 반영된 것으로 파악했다고 오늘(21일) 밝혔습니다. 특히, 도민 공론화를 통해 마련된 제주형 기초자치단체 설치... ",https://news.bbsi.co.kr/news/articleView.html?idxno=4043842,https://news.bbsi.co.kr/news/articleView.html?idxno=4043842,"Thu, 21 Aug 2025 16:06:00 +0900"
국정기획위원회,"[국정운영 세부계획] 국회, 예산심의권 내실화 통해 재정운용 투명성 강...",2025.07.04 pangbin@newspim.com 21일 정부의 '국정운영 5개년 계획안'에 따르면 국정기획위원회는 이같은 내용이 담긴 안을 정부에 건의했다. 국정위는 &quot;톱다운 방식의 예산제도는 부처의 자율성과 책임성이 확보되도록 운영하고... ,https://www.newspim.com/news/view/20250821000919,https://www.newspim.com/news/view/20250821000919,"Thu, 21 Aug 2025 16:06:00 +0900"
국정기획위원회,"국정기획위원회, 이재명 정부 123대 국정과제 설정","국정기획위원회(위원장 이한주)는 13일 공식 활동을 마무리하며 이재명 정부의 123대 국정과제를 설정하고, 개헌과 검찰 개혁, 경찰국 폐지 등 경찰 개혁, 전시작전통제권 전환 및 방첩사 기능 축소 등 국방 개혁, 노동·안전... ",http://www.mhj21.com/168878,http://www.mhj21.com/168878,"Thu, 21 Aug 2025 15:56:00 +0900"
국정기획위원회,"국정기획위원회, 개헌 방향 및 로드맵 제시…제7공화국 열릴까",공식 활동을 마무리한 국정기획위원회가 내년 지방선거나 2028년 국회의원 선거를 계기로 개헌 찬반 투표를 실시하는 방안을 제시한 것으로 확인됐다. 이재명 정부 이후 개헌을 통한 제7공화국 개막이 현실화될 수도... ,http://www.mhj21.com/168877,http://www.mhj21.com/168877,"Thu, 21 Aug 2025 15:52:00 +0900"
국정기획위원회,행정수도 기대감? 해수부 이전 악재?...세종 집값 향방은,지난 5일 박수현 국정기획위원회 국가균형성장특별위원회 위원장 브리핑에서 세종 집무실 건립의 필요성과 당위성을 강조하는 발언을 하기도 했다. 김효선 NH농협은행 부동산수석전문위원은 “정치적인 요소에 따라... ,https://www.etoday.co.kr/news/view/2498979,https://www.etoday.co.kr/news/view/2498979,"Thu, 21 Aug 2025 15:44:00 +0900"
국정기획위원회,토큰증권(STO) 국정과제 포함..벤처 자금조달 통로 될까 [크립토브리핑...,21일 국회 및 관련 업계에 따르면 국정기획위원회가 공식 활동을 마무리하며 배포한 ‘이재명 정부 국정운영 5개년 계획안’에 토큰증권(STO) 제도화에 대한 구체적 내용이 담겼다. 5대 국정목표 중 ‘세계를 이끄는... ,http://www.fnnews.com/news/202508211532510243,https://n.news.naver.com/mnews/article/014/0005394835?sid=105,"Thu, 21 Aug 2025 15:43:00 +0900"
국정기획위원회,[단독]교육교부금·지방교부세를 한 지갑에? 올해 공론화위원회서 ‘숙...,"정부가 초·중등 교육예산인 지방교육교부금(교육교부금) 개편을 추진 중인 가운데, 국정기획위원회가 교육교부금과 지방자치단체 예산인 지방교부세를 통합하는 방안을 공론화위원회를 구성해 논의하기로 한 것으로... ",https://www.seoul.co.kr/news/society/education-news/2025/08/21/20250821500193?wlog_tag3=naver,https://n.news.naver.com/mnews/article/081/0003567777?sid=102,"Thu, 21 Aug 2025 15:40:00 +0900"
국정기획위원회,코스피 5000 산술... 경제성장률 0.8%에 주가는 연 9.5% 오른다?,대선 공약으로 내건 이 목표는 8월 13일 국정기획위원회가 발표한 '국정운영 계획'에도 전략과제로 포함됐다. 코스피 지수는 현재 3200안팎을 오르내리고 있다. 5000까지 가려면 무려 56% 상승이 필요하다. 2030년... ,https://www.incheontoday.com/news/articleView.html?idxno=307146,https://www.incheontoday.com/news/articleView.html?idxno=307146,"Thu, 21 Aug 2025 15:40:00 +0900"
국정기획위원회,"제주 핵심현안, 새정부 '국정운영 5개년 계획'에 대거 반영",제주도는 대통령 직속 국정기획위원회가 발표한 국정운영 계획에 제주 핵심 현안들이 다수 국정과제로 반영된 것으로 파악했다고 21일 밝혔다. 특히 도민 공론화를 통해 마련된 제주형 기초자치단체 설치 지원이... ,https://www.newsis.com/view/NISX20250821_0003298514,https://n.news.naver.com/mnews/article/003/0013435011?sid=102,"Thu, 21 Aug 2025 15:38:00 +0900"
국정기획위원회,새 정부 청사진에 제주 제2공항·기초단체 포함,이재명 대통령이 지난 13일 청와대 영빈관에서 열린 국정기획위원회 국민보고대회에서 발언하고 있다. 사진=연합뉴스. 새 정부 국정운영 밑그림에 제주 제2공항 건설 사업과 제주형 기초자치단체 설치 등 핵심 현안들이... ,http://www.samdailbo.com/news/articleView.html?idxno=251158,http://www.samdailbo.com/news/articleView.html?idxno=251158,"Thu, 21 Aug 2025 15:36:00 +0900"
국정기획위원회,검찰개혁 '얼개 중 얼개'만 추석 전 완료…넘어야 할 산 3개,국정기획위원회가 공개한 '이재명 정부 국정운영 5개년 계획(안)'에도 국수위 설치는 빠져있다. 법안에 언급된 기능은 각 수사기관들이 할 수 있는 일로 자칫 국수위가 견제받지 않는 기관이 될 수 있다는 우려도 제기된... ,http://news.mt.co.kr/mtview.php?no=2025082112064120194,https://n.news.naver.com/mnews/article/008/0005239127?sid=102,"Thu, 21 Aug 2025 15:33:00 +0900"
국정기획위원회,"경기도, '응급의료 자문단' 출범…'필수의료 확충' 기반 마련",앞서 대통령 직속 국정기획위원회가 지난 13일 발표한 '국정운영 5개년 계획안'에는 필수 의료 확충과 공공의료 강화가 주요 과제에 포함됐다. 유영철 도 보건건강국장은 &quot;응급의료 전문가들이 상시로 참여하는 자문체계가... ,https://news.tf.co.kr/read/national/2236067.htm,https://n.news.naver.com/mnews/article/629/0000418694?sid=102,"Thu, 21 Aug 2025 15:31:00 +0900"
국정기획위원회,불안한 노후... 이재명 정부 국정과제 '78번'에 답 있다,"새 정부의 과제 : '기본이 튼튼한 사회'의 돌봄 새 정부가 내세운 국정과제 78번, '지금 사는 곳에서 누리는... 미국 콜롬비아대에서 박사학위를 받았으며, 문재인정부 정책기획위원회에서 포용사회분과위원장과... ",https://www.ohmynews.com/NWS_Web/View/at_pg.aspx?CNTN_CD=A0003158606&CMPT_CD=P0010&utm_source=naver&utm_medium=newsearch&utm_campaign=naver_news,https://n.news.naver.com/mnews/article/047/0002485252?sid=102,"Thu, 21 Aug 2025 15:31:00 +0900"
국정기획위원회,'함께 만드는 K-농정 협의체' 본격 출범,"또한 새 정부 국정기획위원회 국정과제 제안(안)의 주요 내용을 공유하고 농식품부 장관과 위원들 간 대화의 시간을 가졌다. 2부에서는 분과별로 대표 선출, 핵심 논의 과제 선정 등 분과별 착수 회의(Kick-off 회의)를... ",http://www.amnews.co.kr/news/articleView.html?idxno=67948,http://www.amnews.co.kr/news/articleView.html?idxno=67948,"Thu, 21 Aug 2025 15:30:00 +0900"
국정기획위원회,"실세 금감원장 '이찬진' 발언, 조직개편설 '재점화'","이재명 대통령 직속 국정기획위원회는 금융위원회를 사실상 해체하고 금감원과 통합하는 방안을 검토했으며, 금융정책 기능을 기획재정부로 이관하는 안까지 포함돼 금융권의 긴장을 키웠다. 이억원 후보자가 신임... ",https://www.ziksir.com/news/articleView.html?idxno=101382,https://www.ziksir.com/news/articleView.html?idxno=101382,"Thu, 21 Aug 2025 15:30:00 +0900"
국정기획위원회,새만금에 '메가샌드박스' 조성…글로벌 실험무대,"21일 전북도에 따르면 국정기획위원회는 최근 국정과제 국민 보고대회에서 'ABCDEF' 6대 첨단산업 육성 전략을 본격 추진한다고 밝혔다. 6대 전략은 AI(인공지능), Bio(바이오), Contents(문화콘텐츠), Defense(방위 산업), Energy... ",http://www.fnnews.com/news/202508211526022958,https://n.news.naver.com/mnews/article/014/0005394819?sid=102,"Thu, 21 Aug 2025 15:27:00 +0900"
국정기획위원회,"[위클리오늘] 경기도, 국정과제 '필수의료 확충' 기반 마련…응급의료지...",생명권 보호와 응급의료서비스 질 향상을 위한 전략적 기반을 강화할 예정이다. 앞서 대통령 직속 국정기획위원회가 지난 13일 발표한 '국정운영 5개년 계획안'에는 필수의료 확충과 공공의료 강화가 주요 과제로 포함돼 있다.,http://www.weeklytoday.com/news/articleView.html?idxno=718766,http://www.weeklytoday.com/news/articleView.html?idxno=718766,"Thu, 21 Aug 2025 15:26:00 +0900"
국정기획위원회,기초자치단체설치·제주제2공항·건강주치의 국정과제됐다,"대통령 직속 국정기획위원회가 발표한 국정운영 계획에 제주형 기초자치단체 설치 지원과 제주 제2공항, 건강주치의제 시범사업 등 제주 현안이 대거 반영된 것으로 나타났다. 21일 제주도에 따르면 국정기획위원회가... ",https://www.nocutnews.co.kr/news/6388474?utm_source=naver&utm_medium=article&utm_campaign=20250821032321,https://n.news.naver.com/mnews/article/079/0004058009?sid=102,"Thu, 21 Aug 2025 15:24:00 +0900"
국정기획위원회,"&quot;교수협의회 입법화 시급&quot;…사교련, 국회 토론회 개최","행사에는 유원준 사교련 이사장의 개회사를 시작으로 이한주 국정기획위원회 위원장, 문정복·강경숙 의원, 최은옥 교육부 차관 등이 축사를 전한다. 이후 김종원 정책위원장이 '사립대학 구조개선법 시행령 제정에 관한... ",https://www.straightnews.co.kr/news/articleView.html?idxno=279128,https://www.straightnews.co.kr/news/articleView.html?idxno=279128,"Thu, 21 Aug 2025 15:24:00 +0900"
국정기획위원회,전남에 의대 설립‥지역 필수·공공의료 강화,"국정기획위원회가 배포한 정부 '국정운영 5개년 계획안'을 보면 전남 국립의대 설립으로 의료 인력을 양성하고 사각지대를 해소하겠다는 공약이 포함됐습니다. 또, 지역 필수·공공의료 인력 양성을 위해 지역의사제를... ",https://ysmbc.co.kr/NewsArticle/1479196,https://ysmbc.co.kr/NewsArticle/1479196,"Thu, 21 Aug 2025 15:20:00 +0900"
국정기획위원회,"[포커스] 이 대통령, 日신문 인터뷰 왜?‥홍현익 &quot;트럼프 등장에 한일 동...",국정기획위원회 외교안보 분과장을 맡았던 홍현익 전 국립외교원장과 함께 정상회담 의제 짚어보겠습니다. 어서 오세요. 원장님. ◎ 홍현익 &gt; 안녕하십니까? ◎ 진행자 &gt; 안녕하세요. 오늘 여쭤볼 게 많은 날 딱 오셨습니다.... ,https://imnews.imbc.com/replay/2025/nw1400/article/6747853_36776.html,https://n.news.naver.com/mnews/article/214/0001444211?sid=100,"Thu, 21 Aug 2025 15:17:00 +0900"
국정기획위원회,"'주택공급 첨병' LH '야당 정치인 출신' 인국공·도공, 국토부 산하 공공...","김 장관도 지난 19일 국회 국토교통위원회 전체회의에서 원칙적으로는 8월 안에, 실무적 조율에 따라... 지난 3월까지 경기주택도시공사 사장도 지낸 김세용 전 사장은 국정기획위원으로도 활동하며 최근 국토부 장관... ",https://www.businesspost.co.kr/BP?command=article_view&num=408558,https://www.businesspost.co.kr/BP?command=article_view&num=408558,"Thu, 21 Aug 2025 15:14:00 +0900"
국정기획위원회,정년연장 불피운 현대차 노조…경영계는 '속도조절',"대통령 직속 국정기획위원회는 사회적 대화를 거쳐 연내 합의안을 마련한다는 방침이다. 더불어민주당은 국회 환경노동위원회와 기획재정위원회, 보건복지위원회 등에 소속된 민주당 의원들과 외부 전문가들로 구성된... ",http://www.mhj21.com/168874,http://www.mhj21.com/168874,"Thu, 21 Aug 2025 15:12:00 +0900"
국정기획위원회,"거제~통영 고속도로 건설사업, 예비타당성조사 통과","변광용 거제시장을 비롯한 시와 경남도 관계자들은 대통령실, 국회, 국정기획위원회, 지방시대위원회, 기획재정부, 국토교통부 등을 수차례 방문·건의하며 사업 추진을 위한 노력을 이어왔다. 또한 서일준 국회의원의... ",https://daily.hankooki.com/news/articleView.html?idxno=1260349,https://daily.hankooki.com/news/articleView.html?idxno=1260349,"Thu, 21 Aug 2025 15:06:00 +0900"
국정기획위원회,[맞수다] 김건희-'한남동 7인방' 통화 드러나 &quot;尹 정권 대통령은 2명이었...,"홍보기획비서관, 누구의 국정을 홍보기획을 해야 되죠. 배우자의 업무를 국정홍보 하거나 홍보기획 하거나... 국가수사위원회라는 건 생소하단 말이에요. 이걸 갑자기 법 통과 직후부터 시행하기 어려울 겁니다. 아마 그럴... ",https://imnews.imbc.com/replay/2025/nw1400/article/6747848_36776.html,https://n.news.naver.com/mnews/article/214/0001444205?sid=100,"Thu, 21 Aug 2025 14:59:00 +0900"
국정기획위원회,"이재명 정부 국정과제에 ‘공공동물병원, 공익형 표준수가제, 상생동물...",국정과제와 더불어 동물 진료비 부가세 관련 규정을 ‘원칙적 면세’로 재편하는 방안이 힘을 얻는다.국정기획위원회는 “동물의료 접근성 및 형평성을 제고하고 진료비 부담이 경감될 것”이라고 기대했다.... ,https://www.dailyvet.co.kr/news/policy/255100,https://www.dailyvet.co.kr/news/policy/255100,"Thu, 21 Aug 2025 14:52:00 +0900"
국정기획위원회,제주도 &quot;핵심현안 새정부 국정과제·지역공약 대거 반영&quot;,제주특별자치도는 13일 대통령 직속 국정기획위원회가 발표한 국정운영 5개년 계획에 제주 핵심 현안들이 다수 국정과제로 반영된 것으로 파악했다고 21일 밝혔다. 특히 도민 공론화를 통해 마련된 제주형 기초자치단체... ,http://www.headlinejeju.co.kr/news/articleView.html?idxno=575892,http://www.headlinejeju.co.kr/news/articleView.html?idxno=575892,"Thu, 21 Aug 2025 14:50:00 +0900"
국정기획위원회,"제주 핵심 현안, 새 정부 국정과제·지역공약에 대거 반영",제주도는 13일 대통령 직속 국정기획위원회가 발표한 국정운영 계획에 도가 제안한 과제가 국정과제와 지역공약으로 대거 포함됐다고 21일 밝혔다. 특히 도민 공론화를 거쳐 추진해 온 제주형 기초자치단체 설치 지원이... ,https://www.jejudomin.co.kr/news/articleView.html?idxno=313458,https://www.jejudomin.co.kr/news/articleView.html?idxno=313458,"Thu, 21 Aug 2025 14:48:00 +0900"
국정기획위원회,"민변, 민변, 또 민변…요직 곳곳에 포진한다 [세상&amp;]","‘N번방’ 사건의 공동대책위원회에 참여했으며 최근까지 더불어민주당 추천 국가인권위원회... 이상갑 국정원 감찰실장은 민변 광주·전남지부장을 지냈으며, 김희수 기획조정실장 역시 민변 소속 변호사로 활동한... ",https://biz.heraldcorp.com/article/10558931?ref=naver,https://n.news.naver.com/mnews/article/016/0002517575?sid=102,"Thu, 21 Aug 2025 14:46:00 +0900"
국정기획위원회,&quot;344만 명에 월 10만 원씩&quot;…아동수당 '8세→13세' 확대에 5년간 국비 13...,대통령 직속 국정기획위원회는 저출산 대응 방안의 하나로 지급 대상을 매년 1세씩 확대해 2030년까지 만 13세 미만 아동까지 지원하기로 했다. 지급 대상이 늘어나면 수급 아동은 올해 215만 명에서 2030년 344만... ,https://www.sedaily.com/NewsView/2GWPNL03IN,https://n.news.naver.com/mnews/article/011/0004523525?sid=102,"Thu, 21 Aug 2025 14:44:00 +0900"
국정기획위원회,경기도 맞춤 응급의료정책 ‘싱크탱크’ 신설···국정과제 이행 목표,이는 필수의료 확충과 공공의료 강화 등 국정기획위원회가 발표한 ‘국정운영 5개년 계획안’을 이행하기 위한 것이다. 도는 이날 ‘경기도 응급의료지원 자문단 1차 회의’를 개최하고 도내 응급의료 주요현안을... ,https://www.kgnews.co.kr/news/article.html?no=860833,https://www.kgnews.co.kr/news/article.html?no=860833,"Thu, 21 Aug 2025 14:44:00 +0900"
국정기획위원회,"경기도, 국정과제 '필수의료 확충' 기반 마련…응급의료지원 자문단 가...",앞서 대통령 직속 국정기획위원회가 지난 13일 발표한 '국정운영 5개년 계획안'에는 필수의료 확충과 공공의료 강화가 주요 과제로 포함돼 있다. 유영철 경기도 보건건강국장은 &quot;응급의료 전문가들이 상시 참여하는... ,http://www.econonews.co.kr/news/articleView.html?idxno=401314,http://www.econonews.co.kr/news/articleView.html?idxno=401314,"Thu, 21 Aug 2025 14:42:00 +0900"
국정기획위원회,"은행장들 만나는 신임 금감원장, &quot;소비자보호 최우선&quot; 당부할듯",금감원은 앞서 민간 전문가 중심의 '금융소비자 보호 평가위원회'를 신설하고 분쟁조정에 대한 편면적 구속력을 도입하는 방안 등을 국정기획위원회에 보고한 바 있다. 이와 관련해 일각에서는 정부가 금감원에서... ,https://view.asiae.co.kr/article/2025082114172848912,https://n.news.naver.com/mnews/article/277/0005640298?sid=101,"Thu, 21 Aug 2025 14:38:00 +0900"
국정기획위원회,이찬진 금감원장 &quot;내주 중요 발표&quot;…조직개편 급물살,무엇보다 이번 발언은 대통령실과 국정기획위원회가 논의해온 금융감독체계 개편안과 연결되는 것 아니냐는 해석이 가장 힘을 얻는다. 현재로선 소비자보호처를 분리해 별도 기관인 '금융소비자보호원'을 신설하는 방안이... ,http://www.m-i.kr/news/articleView.html?idxno=1273174,http://www.m-i.kr/news/articleView.html?idxno=1273174,"Thu, 21 Aug 2025 14:38:00 +0900"
국정기획위원회,제주 제2공항과 기초자치단체 등 국정계획안 반영 ... 확정은 아직,제주도는 13일 대통령 직속 국정기획위원회가 발표한 국정운영 계획안에 제주 핵심 현안들이 다수 반영된 것으로 파악했다고 21일 밝혔다. 앞서 국정기획위원회는 지난 13일 국민보고대회를 갖고 '국정운영 5개년 계획안... ,https://www.mediajeju.com/news/articleView.html?idxno=359969,https://www.mediajeju.com/news/articleView.html?idxno=359969,"Thu, 21 Aug 2025 14:36:00 +0900"
국정기획위원회,"[공기업 인사]①'불공정 계약' 책임론 한수원 황주호, 美원전 진출 기사...","한다&quot;며 &quot;국회는 국정조사로 철저히 진상 규명하고 안덕근 전 산업부 장관을 비롯한 관련자들에게 반드시... 압축해, 기획재정부 공공기관운영위원회에 보고한다. 이 위원회가 선정한 2명의 후보를 놓고 한수원이... ",https://www.newsfreezone.co.kr/news/articleView.html?idxno=642411,https://www.newsfreezone.co.kr/news/articleView.html?idxno=642411,"Thu, 21 Aug 2025 14:36:00 +0900"
국정기획위원회,[국정운영 세부계획] 국민연금 첫 가입 보험료 지원...군·출산 크레딧 ...,국정기획위원회 대국민보고대회 [사진=국정기획위원회] = 2025.08.13 yuna7402@newspim.com 정부는 군크레딧 제도 인정 기간도 12개월에서 복무기간 전체로 확대한다. 크레딧은 출산·군 복무 시 보험료를 납부하지 않아도 가입... ,https://www.newspim.com/news/view/20250821000718,https://www.newspim.com/news/view/20250821000718,"Thu, 21 Aug 2025 14:33:00 +0900"
국정기획위원회,제주 &quot;공동 책임 부여&quot;…기초자치단체 부활 국정과제 반영,제주도는 지난 13일 대통령 직속 국정기획위원회가 발표한 국정운영 계획에 주요 현안들이 다수 국정과제로 반영된 것으로 파악했다고 21일 밝혔다. 국정과제에는 최근 행정구역 개수를 두고 논란인 제주형... ,https://www.news1.kr/local/jeju/5886318,https://n.news.naver.com/mnews/article/421/0008440337?sid=102,"Thu, 21 Aug 2025 14:33:00 +0900"
