Keyword,Title,Description,Original Link,Link,Publication Date
국정기획위원회,"취임 한 달 '소비자보호' 외친 이찬진 금감원장, 금융감독 현안 산적......",국정기획위원회에서 이재명 정부의 로드맵 마련에 직접 관여한 이 원장이 정부조직 개편작업과 내부통합을 잘 이끌어내면서 본연의 업무는 또 어떻게 풀어갈지 귀추가 주목된다.,http://www.consumernews.co.kr/news/articleView.html?idxno=740326,http://www.consumernews.co.kr/news/articleView.html?idxno=740326,"Mon, 15 Sep 2025 06:16:00 +0900"
국정기획위원회,지방 노동부족 해소…장년층 이주가 해법 [Pick코노미],이철희 교수는 이재명 정부 국정기획위원회 사회1분과 위원으로 활동하며 인구 정책과 노동 정책의 밑그림 설계에 기여해 온 전문가로 이번 연구 결과는 실제 정책 현실화 가능성도 갖는다는 점에서 주목된다. 연구... ,https://www.sedaily.com/NewsView/2GXWSMS7CQ,https://n.news.naver.com/mnews/article/011/0004532975?sid=101,"Mon, 15 Sep 2025 06:01:00 +0900"
국정기획위원회,"[오늘의 국회일정] 李정부 첫 대정부질문 시작…행안위, 오송참사 국정...","행정안전위원회 국정조사(궁평제2지하차도, 충청북도 의회 청사) ◇의원실 세미나 10:00 김윤 의원실 등... 공보기획관, [9월 3주차 국회 정례브리핑] 11:20 고민정 의원, [교사의 학교 밖 정치기본권 보장을 위한 입법... ",https://www.newspim.com/news/view/20250914000194,https://www.newspim.com/news/view/20250914000194,"Mon, 15 Sep 2025 06:00:00 +0900"
국정기획위원회,[출근길 브리핑- 9월 15일] 美 연준 FOMC 금리인하 확실·李 첫 대정부질...,"◆李정부 첫 대정부질문, 여야 검찰개혁·국정운영 격돌 이재명 정부의 첫 대정부질문이 15~18일까지... 방산업계에 따르면 방사청은 오는 18일 열리는 방위사업기획·관리분과위원회(분과위)에 KDDX 상세설계 및... ",https://www.newsworks.co.kr/news/articleView.html?idxno=811117,https://www.newsworks.co.kr/news/articleView.html?idxno=811117,"Mon, 15 Sep 2025 06:00:00 +0900"
국정기획위원회,'산부인과'에서 '여성의학과'로···60% &quot;명칭 변경 찬성&quot;,"최근 대통령 직속 국정기획위원회가 산부인과 명칭을 여성의학과로 변경하는 방안을 논의한 것으로 알려진 가운데, 산부인과 의사 10명 중 6명이 명칭 변경에 찬성하는 것으로 조사됐다. 직선제산부인과개원의사회는... ",https://www.monews.co.kr/news/articleView.html?idxno=406308,https://www.monews.co.kr/news/articleView.html?idxno=406308,"Mon, 15 Sep 2025 06:00:00 +0900"
국정기획위원회,&quot;큰 정부의 귀환&quot;…확장 재정 다음 스텝은?[Pick코노미],"대통령 직속 국가인공지능(AI)위원회, 국가바이오위원회, 국정기획위원회 등이 신설되고 국무총리 소속 포항지진피해구제심의위원회, 2023새만금세계스카우트잼버리정부지원회 등이 폐지된 결과다. 575개 위원회... ",https://www.sedaily.com/NewsView/2GXWTF7I4A,https://n.news.naver.com/mnews/article/011/0004532967?sid=102,"Mon, 15 Sep 2025 05:31:00 +0900"
국정기획위원회,"[사설] 이 대통령 취임 100일, 국가책임농정 실천이 중요하다","국정기획위원회가 제시한 국정과제에는 전략산업으로 농업 육성, 국가 책임을 강화하는 농정대전환, 균형성장과 에너지 전환을 선도하는 농산어촌이 포함돼 있다. 이같은 목표가 자칫 장밋빛 청사진으로 끝나지 않으려면... ",https://www.nongmin.com/article/20250912500691,https://n.news.naver.com/mnews/article/662/0000077811?sid=110,"Mon, 15 Sep 2025 05:03:00 +0900"
국정기획위원회,[검찰개혁] 행안부 산하 '중수청'...권력 비대화 벌써 우려,14일 법조계에 따르면 이재명 정부는 지난 6월 출범한 국정기획위원회를 통해 검찰청 개혁 작업에 나섰고 지난 7일 정부서울청사에서 이런 내용이 담긴 정부조직법 개정안 내용을 밝혔다. 정부·여당은 '검찰청 폐지' 등을... ,https://www.ajunews.com/view/20250914145422183,https://www.ajunews.com/view/20250914145422183,"Mon, 15 Sep 2025 05:00:00 +0900"
국정기획위원회,"[오늘의 주요일정] 충북·세종(15일, 월)",화훼산업진흥지역 기획계획 수립 연구용역 최종보고회(대회의실) ◇증평군 -이재영 군수 14:00 32회 인삼골축제 안전관리위원회(재난안전상황실) ◇괴산군 -송인헌 군수 08:30 확대간부회의(군청 중회의실)... ,https://www.news1.kr/local/sejong-chungbuk/5911806,https://n.news.naver.com/mnews/article/421/0008485364?sid=102,"Mon, 15 Sep 2025 05:00:00 +0900"
국정기획위원회,[오늘의 주요일정]국회(9월15일 월요일),"행정안전위원회 국정조사(궁평제2지하차도, 충청북도 의회 청사) ◇의원실 세미나 10:00 김윤 의원실 등... 공보기획관, [9월 3주차 국회 정례브리핑] 11:20 고민정 의원, [교사의 학교 밖 정치기본권 보장을 위한 입법... ",https://www.newsis.com/view/NISX20250914_0003328318,https://n.news.naver.com/mnews/article/003/0013481088?sid=100,"Mon, 15 Sep 2025 05:00:00 +0900"
국정기획위원회,"금융당국 재편, 권한 분산 본격화","윤호중 행정안전부 장관은 &quot;이번 정부조직 개편은 국민이 원하는 핵심 국정과제를 이행하고, 새 정부... 이 같은 조직 개편이 이뤄질 경우, 2018년 이전 '재정경제부-기획예산처-금융감독위원회' 체제가 전면 부활하게 된다.... ",https://www.insnews.co.kr/news/articleView.html?idxno=85854,https://www.insnews.co.kr/news/articleView.html?idxno=85854,"Mon, 15 Sep 2025 00:00:00 +0900"
국정기획위원회,정부조직 개편안 일괄 통과 불투명,"문제는, 해당 법안의 소관 상임위원회인 기획재정위원회와 정무위원회 위원장이 국민의힘 소속이라는... 한편, 정부조직법 개정안이 통과되면 상임위 개편도 불가피해 당장 한달 뒤 국정감사 과정에서 혼란이 발생할 수... ",https://www.hani.co.kr/arti/politics/politics_general/1218682.html,https://n.news.naver.com/mnews/article/028/0002766327?sid=100,"Sun, 14 Sep 2025 22:42:00 +0900"
국정기획위원회,27조 벌고 기부는 고작 0.004%… 한국은행의 ‘인색한 사회공헌’,"또한 정 의원은 “한국은행의 수익금과 대비되는 인색한 사회공헌 활동은 국민 신뢰를 악화시킨다”라며, “이번 국정감사에서 한국은행을 비롯한 기획재정위원회의 소관 기관에 사회공헌 활동을 확대하는... ",https://www.sportsseoul.com/news/read/1545927?ref=naver,https://n.news.naver.com/mnews/article/468/0001177167?sid=100,"Sun, 14 Sep 2025 22:01:00 +0900"
국정기획위원회,"산부인과, 명칭 변경 논의…산부인과 개원의 절반 이상 “찬성”",대통령 직속 국정기획위원회가 산부인과 명칭을 여성의학과로 변경하는 방안을 추진하는 것으로 알려진 가운데 산부인과 개원의사 10명 중 6명은 개명에 찬성하는 것으로 조사됐다. 직선제 대한산부인과개원의사회... ,https://medicalworldnews.co.kr/news/view.php?idx=1510970039,https://medicalworldnews.co.kr/news/view.php?idx=1510970039,"Sun, 14 Sep 2025 20:10:00 +0900"
국정기획위원회,[경인 Pick] 되짚은 평화통일 가치… 현실적 대책을 논하다,정 교수는 이재명 정부 국정기획위원회 외교안보분과 전문위원으로 활동했다. 지난 13일 열린 제5차 국민 대상 합의 형성 토론회에서 ‘한반도에서 영구적인 평화체계 구축’을 주제로 강연 중인 정한범 국방대학교... ,https://www.kyeongin.com/article/1751515,https://www.kyeongin.com/article/1751515,"Sun, 14 Sep 2025 19:34:00 +0900"
국정기획위원회,정책·감독·소비자보호 분리…금융당국도 갈피 못잡아,기획재정부 개편에 떠밀려 ‘불똥’이 튄 것 아니냐는 불만 속에 시장 안정의 두 축인 금융위원회와... 문재인 정부에서도 정책·감독·소비자보호를 나누는 방안을 구상했지만 국정과제 우선순위에서 밀려 실행되지... ,http://www.edaily.co.kr/news/newspath.asp?newsid=01813846642300120,https://n.news.naver.com/mnews/article/018/0006115631?sid=101,"Sun, 14 Sep 2025 18:41:00 +0900"
국정기획위원회,느슨한 외국인 부동산 규제… 尹정부 시절 年 2억달러 유입,14일 국회 기획재정위원회 소속 더불어민주당 정태호 의원이 한국은행으로부터 받은 자료에 따르면... 윤 정부는 외국인의 투기성 주택거래 규제를 국정과제로 선정하고 국민의 거주권을 보호하겠다고 공약한 바... ,http://www.fnnews.com/news/202509141832588908,https://n.news.naver.com/mnews/article/014/0005406521?sid=101,"Sun, 14 Sep 2025 18:34:00 +0900"
국정기획위원회,읍면동장을 주민 손으로 뽑는다면 / 이용연,국정기획위원회가 제시한 읍면동장 주민선택제는 1995년 민선자치 이후 일부 기초자치단체에서 운영했던 주민추천제를 기초로 한 것이다. 이는 읍면동장을 5급 사무관 재직자 중에서 공모해 주민들이 후보자 중에서... ,http://www.kjdaily.com/article.php?aid=1757841902663741019,http://www.kjdaily.com/article.php?aid=1757841902663741019,"Sun, 14 Sep 2025 18:30:00 +0900"
국정기획위원회,정부조직개편 여야 합의 무산 후폭풍…국감 앞둔 국회도 '대혼란',"검찰청은 1년, 기획재정부는 3개월 유예를 두지만 기후에너지환경부는 즉시 출범한다. 정부와 여당은... 한정애 민주당 정책위원회 의장은 이날 국회 기자간담회에서 “환노위에서는 국정감사를 앞두고 에너지 분야를 준비... ",https://www.hankyung.com/article/2025091428431,https://n.news.naver.com/mnews/article/015/0005184698?sid=100,"Sun, 14 Sep 2025 18:08:00 +0900"
국정기획위원회,&quot;지니어스법 발맞춰 스테이블코인 제도화 서둘러야&quot;,"이번 심포지엄은 국정기획위원회가 8일 원화 스테이블코인 발행 권한을 은행과 비은행이 참여한 컨소시엄에 부여하는 방안 등을 담은 세부 이행계획을 밝힌 이후 열렸다. 이날 행사에는 법조계는 물론 금융, 증권... ",https://www.hankyung.com/article/2025091428251,https://n.news.naver.com/mnews/article/015/0005184677?sid=102,"Sun, 14 Sep 2025 17:58:00 +0900"
국정기획위원회,"대륙아주, 여권 인사 잇단 영입…김호기 명예교수·김수흥 전 의원","법무법인 대륙아주가 이재명 정부 국정기획위원회에서 활동한 김호기 연세대 사회학과 명예교수(사진)와 김수흥 전 더불어민주당 의원을 영입했다. 14일 법조계에 따르면 김 교수는 이달 2일부터, 김 전 의원은 4일부터... ",https://www.hankyung.com/article/2025091428291,https://n.news.naver.com/mnews/article/015/0005184678?sid=100,"Sun, 14 Sep 2025 17:58:00 +0900"
국정기획위원회,이재명 정부 '국가균형성장 전략' 16일 제 모습 드러내,"김경수 위원장은 &quot;4월 대선 출마 선언부터 이재명 정부 출범 후 지방시대위원장을 맡은 뒤 두 달여 동안 국정기획위원회와 국회 지역균형발전포럼, 자치분권균형발전전국회의 등과 머리를 맞대 기획한 국가균형성장 정책... ",https://www.idomin.com/news/articleView.html?idxno=946189,https://www.idomin.com/news/articleView.html?idxno=946189,"Sun, 14 Sep 2025 17:56:00 +0900"
국정기획위원회,"확장 재정 외친 정부, 이번엔 '부처·위원회' 늘려 몸집 키우기 예고","대통령 직속 국가인공지능(AI)위원회, 국가바이오위원회, 국정기획위원회 등이 신설되고 국무총리 소속 포항지진피해구제심의위원회, 2023새만금세계스카우트잼버리정부지원회 등이 폐지된 결과다. 575개 위원회... ",https://www.sedaily.com/NewsView/2GXWDW421D,https://n.news.naver.com/mnews/article/011/0004532885?sid=101,"Sun, 14 Sep 2025 17:47:00 +0900"
국정기획위원회,"민주당, “내란전담재판부가 무슨 문제···사법부 움직임 없다면 입법...","다만 이 경우 기획재정부 분리와 금융당국 개편은 당초 목표였던 내년 1월 시행이 어려워진다. 민주당은... 산업부의 에너지 기능을 기후에너지환경부로 이관하는 과정에서 국회 상임위원회 조정이 필요하지만, 국정감사... ",https://www.khan.co.kr/article/202509141746001,https://n.news.naver.com/mnews/article/032/0003396298?sid=100,"Sun, 14 Sep 2025 17:46:00 +0900"
국정기획위원회,① 금융사 재판받을 권리 빼앗아…강제조정 예외 조항 필요,이는 이재명 대통령의 대선 공약으로 국정기획위원회가 국정과제로 제시한 사안이다. 금융사들은 편면적 구속력에 위헌적 요소가 있다고 입을 모은다. 헌법 제27조는 ‘모든 국민은 헌법과 법률이 정한 법관에 의해... ,https://www.sedaily.com/NewsView/2GXWE3NTGX,https://n.news.naver.com/mnews/article/011/0004532863?sid=101,"Sun, 14 Sep 2025 17:29:00 +0900"
국정기획위원회,인구소멸로 '식품 사막화' 가속… 라면도 사기 힘든 농촌 현실,정부도 이같은 문제를 인지하고 '인구소멸지역 식품 이동판매 허용'을 국정기획위원회의 신속추진과제로 선정했다. 이에 그동안 이동 판매가 금지돼 온 포장육과 달걀이 관련 법 개정으로 허용됐다. 다만 식품 사막화... ,https://www.joongboo.com/news/articleView.html?idxno=363703368,https://www.joongboo.com/news/articleView.html?idxno=363703368,"Sun, 14 Sep 2025 17:06:00 +0900"
국정기획위원회,'인천대 공공의대 추진' 재점화… 26일 국회 토론회 개최,정부 국정 5개년 계획안 중 인천지역 공약에 공공의대 설립 검토가 포함됐다. 이에 범시민협의회는 공공의대... 이뿐만 아니라 인천대는 공공의료 전문가 자문위원회를 구성해 정책 전문성을 보완할 예정이다. 이와 관련... ,https://www.joongboo.com/news/articleView.html?idxno=363703357,https://www.joongboo.com/news/articleView.html?idxno=363703357,"Sun, 14 Sep 2025 16:48:00 +0900"
국정기획위원회,“정치양극화 해결 없인 민주주의 발전 불가능”,이재명정부는 국민통합위원회를 설치했고 보수측 인사를 위원장으로 임명해 양극화 문제를 적극 해결해 나갈 것으로 기대합니다.” 이재명 정부 국정기획위원회 기획분과 위원으로 참여했던 김호기 연세대 사회학과... ,https://www.dt.co.kr/article/12017829?ref=naver,https://n.news.naver.com/mnews/article/029/0002982038?sid=105,"Sun, 14 Sep 2025 16:37:00 +0900"
국정기획위원회,與 “정부조직법 두 차례 추진 불가피”… 국감 앞두고 상임위 혼란 예...,"금융감독위원회 설치법 등 연계 법안의 처리 여부가 불투명하다는 이유에서다. 여기에 기후환경에너지부 신설과 기획예산처·재정경제부 분리까지 맞물리면서, 10월 국정감사를 앞두고 국회 상임위 개편 논의가... ",https://biz.chosun.com/policy/politics/assembly/2025/09/14/NBJBKLMNYBHKVKD2M736URTGKA/?utm_source=naver&utm_medium=original&utm_campaign=biz,https://n.news.naver.com/mnews/article/366/0001107941?sid=100,"Sun, 14 Sep 2025 16:24:00 +0900"
국정기획위원회,與 &quot;25일까지 野에 금감위법 협조 설득…안 되면 패스트트랙&quot;,"국회법에 따르면 패스트트랙 지정 법안은 상임위 심사 180일, 법제사법위원회 심사 90일, 본회의 논의 60일 등 법안 통과까지 최장 330일의 시일이 소요된다. 민주당은 정부조직법 개정안에 기획재정부를 기획예산처와... ",https://www.yna.co.kr/view/AKR20250914030100001?input=1195m,https://n.news.naver.com/mnews/article/001/0015624922?sid=100,"Sun, 14 Sep 2025 16:10:00 +0900"
국정기획위원회,[창간 11주년] 정관계 인사들이 보내온 축하 메시지,"브릿지경제신문은 ‘비바100’ 기획을 통해 국민의 든든한 100세 시대 동반자가 되어주었고, ‘기자 수첩’ 등... ■주형환 저출산고령사회위원회 부위원장 브릿지경제 창간 11주년을 진심으로 축하드립니다. 지난 11년간... ",https://www.viva100.com/article/20250910500332,https://www.viva100.com/article/20250910500332,"Sun, 14 Sep 2025 16:02:00 +0900"
국정기획위원회,[초고령사회의 역설] 청년은 반발·노인은 불안… 정부 정책 '제자리걸...,"이재명 정부는 '국정운영 5개년 계획'을 통해 '새로운 시대로의 진입을 목전에 뒀다'며, 기후위기와 불평등, 인구위기 등과 더불어 초고령화를 중대 문제로 언급했다. 이에 중부일보는 지역신문발전위원회 '2025년 기획취... ",https://www.joongboo.com/news/articleView.html?idxno=363703348,https://www.joongboo.com/news/articleView.html?idxno=363703348,"Sun, 14 Sep 2025 16:00:00 +0900"
국정기획위원회,한국은행 27조원 벌고 기부는 '고작 0.004%',국회 기획재정위원회 소속 정일영 더불어민주당 의원이 한국은행으로부터 받아 14일 공개한 자료에... 것&quot;이라며 &quot;이번 국정감사에서 한국은행을 비롯한 기재위 소관기관에 사회공헌 활동을 확대하는 방안을... ,http://www.labortoday.co.kr/news/articleView.html?idxno=230200,http://www.labortoday.co.kr/news/articleView.html?idxno=230200,"Sun, 14 Sep 2025 15:36:00 +0900"
국정기획위원회,"여야, 내일부터 첫 대정부질문 … 검찰개혁·내란재판부·대미외교 놓고...","달라진 국정·사회·문화 변화상) ▲국익(정상 외교) ▲국가 개혁(검찰·사법·언론개혁 등) ▲국력 증대(AI 3대... 외교·통일·안보 분야에는 민주당은 문재인 정부에서 통일부 장관을 지낸 이인영 의원, 외교통일위원회... ",https://www.newdaily.co.kr/site/data/html/2025/09/14/2025091400055.html,https://www.newdaily.co.kr/site/data/html/2025/09/14/2025091400055.html,"Sun, 14 Sep 2025 15:36:00 +0900"
국정기획위원회,"민주당, 정부조직법 개정안 당론 발의… 25일 본회의 처리 방침",기재부를 기획예산처와 재정경제부로 분리하고 금융위원회를 금융감독위원회로 개편하는 방안도 포함됐다.... 최고위원회의 후 취재진에게 &quot;1월 초부터 이 문제가 원활하게 진행돼야 새 정부의 국정 운영도 차질이 없을... ,http://www.kihoilbo.co.kr/news/articleView.html?idxno=1159006,http://www.kihoilbo.co.kr/news/articleView.html?idxno=1159006,"Sun, 14 Sep 2025 15:14:00 +0900"
국정기획위원회,김영진 &quot;작년 유흥업소에 법인카드 6000억 썼다…룸살롱만 3000억&quot;,com 국회 기획재정위원회 소속 더불어민주당 김영진 의원이 18일 정부대전청사 대회의실에서 열린 조달청·관세청·통계청에 대한 국정감사에서 질의하고 있다.[사진=연합뉴스] 지난해 총 6000억원 상당의 법인카드... ,https://www.ajunews.com/view/20250914135322122,https://www.ajunews.com/view/20250914135322122,"Sun, 14 Sep 2025 14:54:00 +0900"
국정기획위원회,"대변인단 재정비·특위 개편…장동혁호, 대여 투쟁 전력 확충","다만 정기국회, 국정감사 등 원내 현안 이벤트들이 산적해 있어 당장은 가동되기 어려워 보인다. 한편 당은 지난 11일 전략기획부총장과 조직부총장에 각각 초선 서천호, 강명구 의원을 임명하며 실무진 인선을 마무리했다.... ",https://www.news1.kr/politics/assembly/5911596,https://n.news.naver.com/mnews/article/421/0008484962?sid=100,"Sun, 14 Sep 2025 14:41:00 +0900"
국정기획위원회,전 정권에서 임명된 방위사업청장이 국회까지 무시하고... 논란 확산,14일 업계에 따르면 방사청은 오는 18일 방위사업기획관리분과위원회를 열어 KDDX 상세설계 및 선도함 건조... 주도한다는 점에서 윤석열 정부의 투명한 국정운영 기조와 역행하는 것 아니냐는 지적도 받고 있다.,https://www.wikitree.co.kr/articles/1080803,https://www.wikitree.co.kr/articles/1080803,"Sun, 14 Sep 2025 14:16:00 +0900"
국정기획위원회,'지역의사제' 도입 두고 정부 안에서도 이견 발생,정부 관계자는 &quot;이번에 발표되는 안은 지난 국정기획위원회 발표 내용을 토대로 논의 과정을 거쳐 확정된 정부의 안&quot;이라고 설명했다. 국정기획위원회는 지난 달 국민보고대회 행사를 통해 123개의 국정과제 주요 내용을... ,https://www.imaeil.com/page/view/2025091414071631445,https://n.news.naver.com/mnews/article/088/0000969965?sid=102,"Sun, 14 Sep 2025 14:15:00 +0900"
국정기획위원회,국회 요구 묵살하고 KDDX 수의 계약 강행하는 방사청,"열리는 국정감사에서 '방산 기밀 탈취 기업 수의계약 혜택' 관련, 방사청에 대한 질타가 쏟아질 것으로 보인다, 14일 방산업계에 따르면 방사청은 오는 18일 방위사업기획ㆍ관리분과위원회(분과위)를 열고 'KDDX 상세설계... ",http://www.newsdream.kr/news/articleView.html?idxno=94844,http://www.newsdream.kr/news/articleView.html?idxno=94844,"Sun, 14 Sep 2025 13:46:00 +0900"
국정기획위원회,세종 '행정수도 완성' 논의 본격화,"국무회의 의결 후 핵심 정책 이행 의지 국정기획위, 세종집무실 완공 등 명시 행정수도특별법 제정도 핵심... 지방시대위원회 내 행정수도특별위원회가 구성돼 행정수도 세종완성 관련 세부 추진 작업도 활발히 진행되고... ",https://www.cctoday.co.kr/news/articleView.html?idxno=2218741,https://www.cctoday.co.kr/news/articleView.html?idxno=2218741,"Sun, 14 Sep 2025 13:26:00 +0900"
국정기획위원회,"&quot;소통의 이재명 정부에 역행?&quot; 방사청, 7조8000억원 KDDX 사업 수의계약...",투명한 국정운영 기조와 역행하는 것 아니냐는 지적까지 나오고 있다. 수의계약 강행 14일 업계 등에 따르면 방위사업청은 오는 18일 방위사업기획관리분과위원회를 열어 'KDDX 상세설계 및 선도함 건조' 사업을... ,https://www.econovill.com/news/articleView.html?idxno=711252,https://www.econovill.com/news/articleView.html?idxno=711252,"Sun, 14 Sep 2025 13:00:00 +0900"
국정기획위원회,“장년층 지방으로 이동시키는 대책 써야 지방 노동부족 해소”,이철희 교수는 이재명 정부 국정기획위원회 사회1분과 위원으로 활동하며 인구 정책과 노동 정책의 밑그림 설계에 기여해 온 전문가로 이번 연구 결과는 실제 정책 현실화 가능성도 갖는다는 점에서 주목된다. 연구... ,https://www.sedaily.com/NewsView/2GXWDNO8ET,https://n.news.naver.com/mnews/article/011/0004532792?sid=101,"Sun, 14 Sep 2025 12:01:00 +0900"
국정기획위원회,"[정책뽀개기]‘국민성장펀드’ 150조로 증액 왜? “AI 등 미래 먹거리, ...","국정기획위원회에서 국민성장펀드 규모를 100조원에서 150조원으로 늘리는 방안을 논의했고, 담당 부처인 금융위가 최종 규모를 확정했다. 펀드 자금은 민관 합동으로 조성한다. 산업은행이 운영하는 첨단전략산업기금... ",https://www.dt.co.kr/article/12017745?ref=naver,https://n.news.naver.com/mnews/article/029/0002981955?sid=101,"Sun, 14 Sep 2025 12:00:00 +0900"
국정기획위원회,27조 벌고 기부는 고작 0.004%…한국은행의 ‘인색한 사회공헌’,또한 정 의원은 “한국은행의 수익금과 대비되는 인색한 사회공헌 활동은 국민 신뢰를 악화시킨다”며 “이번 국정감사에서 한국은행을 비롯한 기획재정위원회의 소관기관에 사회공헌 활동을 확대하는 방안을... ,https://wemakenews.co.kr/news/view.php?no=22956,https://wemakenews.co.kr/news/view.php?no=22956,"Sun, 14 Sep 2025 11:56:00 +0900"
국정기획위원회,"한국은행, '인색한 사회공헌' 도마위... 순이익比 기부금 0.004%에 불과",그러면서 &quot;한국은행의 수익금과 대비되는 인색한 사회공헌 활동은 국민 신뢰를 악화시킨다&quot;며 &quot;이번 국정감사에서 한국은행을 비롯한 기획재정위원회의 소관기관에 사회공헌 활동을 확대하는 방안을 마련토록... ,http://www.chungnamilbo.co.kr/news/articleView.html?idxno=849160,http://www.chungnamilbo.co.kr/news/articleView.html?idxno=849160,"Sun, 14 Sep 2025 11:32:00 +0900"
국정기획위원회,"“근로기준법 확대 적용, 빈부 격차 해소 첫걸음”",근로기준법 확대 적용을 담은 이재명 정부 노동 개혁의 틀은 국정기획위원회가 그렸다. 노동 정책 분야 전문가인 정흥준 서울과학기술대학교 경영학과 교수는 국정위 사회1분과에 참여해 구체적인 '액션 플랜'을 짰다. 정... ,https://www.ekn.kr/web/view.php?key=20250914020426137,https://www.ekn.kr/web/view.php?key=20250914020426137,"Sun, 14 Sep 2025 10:14:00 +0900"
