Keyword,Title,Description,Original Link,Link,Publication Date
기업은행,"기업은행, 소상공인 특별 채무조정 프로그램 실시","화이트페이퍼, WHITEPAPER(사진=기업은행) IBK기업은행(은행장 김성태)은 경기침체로 경영난을 겪는 소상공인을 위해 특별 채무조정 프로그램을 시행한다고 29일 밝혔다. 이번 특별 채무조정 프로그램은 'IBK소상공인... ",http://www.whitepaper.co.kr/news/articleView.html?idxno=251251,http://www.whitepaper.co.kr/news/articleView.html?idxno=251251,"Fri, 29 Aug 2025 18:54:00 +0900"
기업은행,[은행가 브리프] KB국민은행 신한은행 하나은행 NH농협은행 IBK기업은행,"◇ IBK기업은행, 기술보증기금과 3000억원 규모 금융지원 협약 IBK기업은행은 29일 기술보증기금과 '기술창업 활성화 및 성장 촉진을 위한 금융지원 업무협약'을 맺었다. 이번 협약에 따라 기업은행은 기보 보증서를... ",https://www.s-journal.co.kr/news/articleView.html?idxno=33017,https://www.s-journal.co.kr/news/articleView.html?idxno=33017,"Fri, 29 Aug 2025 18:52:00 +0900"
기업은행,[은행가소식] 신한은행 금융정보 전달체계 전면개편,□ 기업은행 소상공인 특별 채무조정 실시 기업은행은 경기침체로 경영난을 겪는 소상공인을 위해 특별 채무조정 프로그램을 시행한다고 29일 밝혔다. 이번 특별 채무조정 프로그램은 'IBK소상공인 상생 재기지원'과... ,https://www.asiatime.co.kr/article/20250829500403,https://www.asiatime.co.kr/article/20250829500403,"Fri, 29 Aug 2025 18:40:00 +0900"
기업은행,"IBK기업은행, 소상공인 특별 채무조정 프로그램 시행",서울시 중구에 위치한 IBK기업은행 본점 전경 / 사진=IBK기업은행 IBK기업은행은 경기침체로 경영난을 겪는 소상공인을 위해 특별 채무조정 프로그램을 시행한다고 29일 밝혔다. 이번 특별 채무조정 프로그램은... ,https://www.businessplus.kr/news/articleView.html?idxno=95799,https://www.businessplus.kr/news/articleView.html?idxno=95799,"Fri, 29 Aug 2025 18:30:00 +0900"
기업은행,"여수시, 산업위기 대응 기업 운영자금 이자보전 지원사업 추진","취급 은행은 기업은행, 국민은행, 농협은행, 하나은행, 신한은행, 우리은행, 부산은행 등 7개 금융기관이다. 시에 따르면 이자보전 지원사업과 더불어 기업지원 및 인력양성 지원사업도 9월 중 추가로 추진될 계획이며... ",http://www.m-i.kr/news/articleView.html?idxno=1276156,http://www.m-i.kr/news/articleView.html?idxno=1276156,"Fri, 29 Aug 2025 18:18:00 +0900"
기업은행,"[은행 &amp; NOW] 신한은행, 금융 정보 전달 체계 전면 개편 등","IBK기업은행-기술보증기금, 금융지원 업무협약 체결 IBK기업은행은 기술보증기금 '기술창업 활성화 및 성장 촉진을 위한 금융지원 업무협약'을 체결했다고 29일 밝혔다. 이번 협약은 기술창업을 활성화하고 기술기업에... ",https://www.ebn.co.kr/news/articleView.html?idxno=1676510,https://www.ebn.co.kr/news/articleView.html?idxno=1676510,"Fri, 29 Aug 2025 18:18:00 +0900"
기업은행,[금융업계기상도]케이뱅크 ‘구름조금’·우리은행 ‘흐림’,"2025년 8월 5주차 금융업계기상도는 KB국민은행·하나은행·NH농협은행·IBK기업은행·카카오뱅크·토스뱅크의 ‘맑음’, 신한은행·케이뱅크의 ‘구름조금’, 우리은행의 ‘흐림’으로 기록됐다. ◆KB국민은행... ",https://www.nspna.com/news/?mode=view&newsid=774332,https://www.nspna.com/news/?mode=view&newsid=774332,"Fri, 29 Aug 2025 18:16:00 +0900"
기업은행,[업앤다운]은행주 하락…제주은행·BNK금융↓,기업은행은 전거래일 대비 0.89%(170원) 내려 1만9020원으로 장을 마쳤고 하나금융지주는 전거래일 대비 0.84%(700원) 하락해 8만2200원으로 장을 마감했다. KB금융은 전거래일 대비 0.82%(900원) 하락해... ,https://www.nspna.com/news/?mode=view&newsid=774345,https://www.nspna.com/news/?mode=view&newsid=774345,"Fri, 29 Aug 2025 18:16:00 +0900"
기업은행,"기업은행, 소상공인 채무조정 돌입···“대출금리 조정·상환유예”",IBK기업은행이 경기침체로 경영난을 겪는 소상공인을 위한 특별 채무조정 프로그램을 시행한다고 29일 알렸다. 이번 특별 채무조정 프로그램은 ‘IBK소상공인 상생 재기지원’과 ‘IBK소상공인 119plus-up’으로... ,http://www.fnnews.com/news/202508291718190314,https://n.news.naver.com/mnews/article/014/0005398890?sid=101,"Fri, 29 Aug 2025 18:12:00 +0900"
기업은행,"금융당국, 벤처·스타트업 금융지원 강화…“투자 선순환 구조 확립”","그는 한국산업은행의 KDB 넥스트라운드, IBK기업은행의 IBK창공, 은행권청년창업재단 디캠프, 한국핀테크지원센터, 신용보증기금, 민간 금융사(신한 퓨처스랩·KB 이노베이션 허브 등)와 협력해 상호 만남 행사를 적극... ",https://www.hankyung.com/article/202508290546i,https://n.news.naver.com/mnews/article/015/0005177659?sid=101,"Fri, 29 Aug 2025 18:07:00 +0900"
기업은행,"기업은행, 경영난 겪는 소상공인 위해 특별 채무조정 시행",인더스트리뉴스 홍윤기 기자  IBK기업은행은 경기침체로 경영난을 겪는 소상공인을 위해 특별 채무조정 프로그램을 시행한다고 29일 밝혔다. 이번 특별 채무조정 프로그램은 'IBK소상공인 상생 재기지원'과... ,https://www.industrynews.co.kr/news/articleView.html?idxno=70865,https://www.industrynews.co.kr/news/articleView.html?idxno=70865,"Fri, 29 Aug 2025 17:56:00 +0900"
기업은행,"KT&amp;G, 최대주주 국민연금으로 재변경",KT&amp;G는 최대주주가 기존 중소기업은행에서 국민연금공단으로 변경됐다고 29일 공시했다. 국민연금은 장내 매수를 통해 KT&amp;G 보유주식을 기존 915만7340주(7.50%)에서 995만4722주(지분율 8.16%)까지 늘렸다. 기존... ,http://www.inews24.com/view/1881652,https://n.news.naver.com/mnews/article/031/0000961180?sid=101,"Fri, 29 Aug 2025 17:55:00 +0900"
기업은행,"여수시, 기업당 최대 5억 대출 이자 연 3% 보전...&quot;석유화학 불황 타개&quot;","취급 은행은 기업은행, 국민은행, 농협은행, 하나은행, 신한은행, 우리은행, 부산은행 등 7개 금융기관이다. 시에 따르면 이자보전 지원사업과 더불어 기업지원 및 인력양성 지원사업도 9월 중 추가로 추진될 계획이며... ",http://www.siminsori.com/news/articleView.html?idxno=298176,http://www.siminsori.com/news/articleView.html?idxno=298176,"Fri, 29 Aug 2025 17:40:00 +0900"
기업은행,기업은행 19억원 업무상 배임 금융사고…&quot;관련 직원 고발 예정&quot;,"IBK기업은행에서 19억원 규모 업무상 배임 금융사고가 발생했습니다. 기업은행은 오늘(29일) 18억9900만원 상당 업무상 배임 금융사고를 공시했습니다. 기업은행의 손실 예상 금액은 현재 미정으로, 담보 금액이... ",https://biz.sbs.co.kr/article_hub/20000256344?division=NAVER,https://n.news.naver.com/mnews/article/374/0000460310?sid=101,"Fri, 29 Aug 2025 17:39:00 +0900"
기업은행,"&quot;全과정 블라인드&quot;...기업은행 등 국책銀, '공정·사회형평적' 채용 확대",국책은행인 IBK기업은행과 한국수출입은행이 올해 하반기 공개채용을 통해 433명의 신입 행원을 뽑을 예정이다. 29일 은행권에 따르면 기업은행과 수출입은행은 각각 내달 15일과 3일 오전 10시까지 하반기 신입 행원... ,http://www.wikileaks-kr.org/news/articleView.html?idxno=174045,http://www.wikileaks-kr.org/news/articleView.html?idxno=174045,"Fri, 29 Aug 2025 17:36:00 +0900"
기업은행,"기보·기업은행 '기술창업 활성화, 성장 촉진 금융지원 협약' 체결",기술보증기금이 29일 중소기업은행과 '기술창업 활성화 및 성장 촉진을 위한 금융지원 업무협약'을 체결했다. 이번 협약은 기술창업기업의 금융비용 부담을 완화하고 기업의 성장단계별 자금 수요에 대응할 수 있는... ,http://www.seoulwire.com/news/articleView.html?idxno=668145,http://www.seoulwire.com/news/articleView.html?idxno=668145,"Fri, 29 Aug 2025 17:32:00 +0900"
기업은행,"[은행권 풍향계] 하나은행, ‘치매안심 금융센터’ 신설 外","◇ 기업은행, 소상공인 대상 특별 채무조정 프로그램 가동 IBK기업은행이 경기침체로 경영난을 겪는 소상공인을 위해 특별 채무조정 프로그램을 가동한다. 이번 특별 채무조정 프로그램은 'IBK소상공인 상생 재기지원... ",https://www.ekn.kr/web/view.php?key=20250829025041896,https://www.ekn.kr/web/view.php?key=20250829025041896,"Fri, 29 Aug 2025 17:30:00 +0900"
기업은행,"IBK기업은행, 기보와 벤처스타트업에 3000억원 금융지원",IBK기업은행 전경. 사진/IBK기업은행 IBK기업은행이 기술보증기금(기보)와 함께 창업 7년 이내 벤처스타트업에게 총 3000억원 규모의 금융지원에 나선다. IBK기업은행은 29일 기술보증기금과 '기술창업 활성화 및 성장... ,http://www.smedaily.co.kr/news/articleView.html?idxno=336123,http://www.smedaily.co.kr/news/articleView.html?idxno=336123,"Fri, 29 Aug 2025 17:30:00 +0900"
기업은행,"IBK기업은행, 소상공인 특별 채무조정 프로그램 실시","IBK기업은행 전경. 사진/IBK기업은행 IBK기업은행이 경기침체 장기화로 경영난을 겪는 소상공인에게 대출금리 조정, 만기연장 및 상환유예 등 채무조정 프로그램을 시행한다. IBK기업은행은 소상공인을 위해 특별... ",http://www.smedaily.co.kr/news/articleView.html?idxno=336122,http://www.smedaily.co.kr/news/articleView.html?idxno=336122,"Fri, 29 Aug 2025 17:28:00 +0900"
기업은행,"국민연금, 2년 만에 KT&amp;G 최대주주 재등극",국민연금이 KT&amp;G(033780) 지분을 추가로 확보하면서 중소기업은행을 제치고 2년 만에 최대주주로 재등극했다. 29일 금융감독원 전자공시시스템에 따르면 KT&amp;G는 국민연금공단 지분이 7.50%에서 8.16%로 늘어나면서... ,https://www.sedaily.com/NewsView/2GWTD21RVH,https://n.news.naver.com/mnews/article/011/0004526856?sid=101,"Fri, 29 Aug 2025 17:27:00 +0900"
기업은행,[금융공기업 소식] 기보 '기술창업 성장 촉진 MOU' 체결,□ 기보 '기술창업 성장 촉진 MOU' 체결 기술보증기금이 기업은행과 '기술창업 활성화와 성장 촉진을 위한 금융지원 업무협약(MOU)'을 체결했다. 해당 MOU는 기술창업기업 금융비용 부담을 완화하고 기업의 성장단계별... ,https://www.asiatime.co.kr/article/20250829500391,https://www.asiatime.co.kr/article/20250829500391,"Fri, 29 Aug 2025 17:26:00 +0900"
기업은행,"기업은행, 소상공인 특별 채무조정 프로그램 실시",IBK기업은행 홈페이지 캡처. IBK기업은행은 경기침체로 경영난을 겪는 소상공인을 위해 특별 채무조정 프로그램을 시행한다고 29일 밝혔다. 이번 특별 채무조정 프로그램은 'IBK소상공인 상생 재기지원'과 'IBK소상공인... ,https://www.straightnews.co.kr/news/articleView.html?idxno=279930,https://www.straightnews.co.kr/news/articleView.html?idxno=279930,"Fri, 29 Aug 2025 17:22:00 +0900"
기업은행,"기업은행, 소상공인 구조조정·경영 정상화 지원...'특별 채무조정 프로...",IBK기업은행은 경기침체로 어려움을 겪는 소상공인을 위해 특별 채무조정 프로그램을 시행한다고 29일 밝혔다. 특별 채무조정 프로그램은 'IBK소상공인 상생 재기지원'과 'IBK소상공인 119plus-up'으로 구성돼 소상공인의... ,http://www.wikileaks-kr.org/news/articleView.html?idxno=174041,http://www.wikileaks-kr.org/news/articleView.html?idxno=174041,"Fri, 29 Aug 2025 17:20:00 +0900"
기업은행,"기업은행, 기보와 기술창업 활성화 업무협약···3000억 지원",IBK기업은행이 29일 기술보증기금(기보)과 ‘기술창업 활성화 및 성장 촉진을 위한 금융지원 업무협약’을 맺었다고 이날 전했다. 이번 협약은 기술창업을 활성화하고 기술기업에 대한 성장 촉진을 위해 체결됐다.... ,http://www.fnnews.com/news/202508291702524446,https://n.news.naver.com/mnews/article/014/0005398873?sid=101,"Fri, 29 Aug 2025 17:15:00 +0900"
기업은행,"IBK기업은행, 소상공인 특별 채무조정 프로그램 실시",사진=IBK기업은행  IBK기업은행은 경기침체로 경영난을 겪는 소상공인을 위해 특별 채무조정 프로그램을 시행한다고 29일 밝혔다. 이번 특별 채무조정 프로그램은 'IBK소상공인 상생 재기지원'과 'IBK소상공인 119 플러스업... ,https://weekly.hankooki.com/news/articleView.html?idxno=7126257,https://weekly.hankooki.com/news/articleView.html?idxno=7126257,"Fri, 29 Aug 2025 17:14:00 +0900"
기업은행,"기업은행 소상공인 대상 특별 채무조정 프로그램 실시, 김성태 &quot;다양한...",IBK기업은행이 소상공인을 대상으로 대출금리 인하와 상환유예 등을 지원하는 채무조정 프로그램을 실시한다. IBK기업은행은 경기침체로 경영난을 겪는 소상공인을 위해 특별 채무조정 프로그램을 시행한다고... ,https://www.businesspost.co.kr/BP?command=article_view&num=409713,https://www.businesspost.co.kr/BP?command=article_view&num=409713,"Fri, 29 Aug 2025 17:12:00 +0900"
기업은행,"IBK기업은행, 특별 채무조정 프로그램 실시…소상공인 경영 애로 해소 ...",IBK기업은행이 경기침체로 경영난을 겪는 소상공인을 위해 특별 채무조정 프로그램을 시행한다. 29일 IBK기업은행(은행장 김성태)에 따르면 이번 특별 채무조정 프로그램은 'IBK소상공인 상생 재기지원'과... ,https://www.newsquest.co.kr/news/articleView.html?idxno=251712,https://www.newsquest.co.kr/news/articleView.html?idxno=251712,"Fri, 29 Aug 2025 17:10:00 +0900"
기업은행,"IBK기업은행, 소상공인 위한 특별 채무조정 프로그램 실시",IBK기업은행은 경기침체로 경영난을 겪는 소상공인을 위해 특별 채무조정 프로그램을 시행한다고 29일 밝혔다. 이번 특별 채무조정 프로그램은 △IBK소상공인 상생 재기지원 △IBK소상공인 119plus-up으로 구성돼... ,http://www.shinailbo.co.kr/news/articleView.html?idxno=2107742,http://www.shinailbo.co.kr/news/articleView.html?idxno=2107742,"Fri, 29 Aug 2025 17:10:00 +0900"
기업은행,"기보-기업은행, 3천억 보증료 지원 협약…기술창업 금융지원 강화",기보 전경 매일일보 = 오시내 기자  |  기술보증기금(기보)은 중소기업은행과 '기술창업 활성화 및 성장 촉진을 위한 금융지원 업무협약'을 체결했다고 29일 밝혔다. 이번 협약은 기술창업기업의 금융비용 부담을... ,http://www.m-i.kr/news/articleView.html?idxno=1276115,http://www.m-i.kr/news/articleView.html?idxno=1276115,"Fri, 29 Aug 2025 17:08:00 +0900"
기업은행,"BK기업은행, 소상공인 특별 채무조정 프로그램 실시",IBK기업은행은 경기침체로 경영난을 겪는 소상공인을 위해 특별 채무조정 프로그램을 시행한다고 29일 밝혔다. 이번 특별 채무조정 프로그램은 ‘IBK소상공인 상생 재기지원’과 ‘IBK소상공인 119plus-up’으로 구성돼... ,https://news.tvchosun.com/site/data/html_dir/2025/08/29/2025082990220.html,https://n.news.naver.com/mnews/article/448/0000553248?sid=101,"Fri, 29 Aug 2025 17:07:00 +0900"
기업은행,"IBK기업은행, 소상공인 대상 특별 채무조정 프로그램 실시",IBK기업은행은 경기침체로 경영난을 겪는 소상공인을 위해 특별 채무조정 프로그램을 시행한다고 29일 밝혔다. 이번 특별 채무조정 프로그램은 'IBK소상공인 상생 재기지원'과 'IBK소상공인 119plus-up'으로 구성돼... ,https://www.newspim.com/news/view/20250829000816,https://www.newspim.com/news/view/20250829000816,"Fri, 29 Aug 2025 17:07:00 +0900"
기업은행,"기업은행, 경영난 겪는 소상공인 대상 특별 채무조정 프로그램 실시",IBK기업은행은 경기침체로 경영난을 겪는 소상공인을 위해 특별 채무조정 프로그램을 시행한다고 29일 밝혔다. 이번 특별 채무조정 프로그램은 'IBK소상공인 상생 재기지원'과 'IBK소상공인 119plus-up'으로 구성돼... ,http://www.srtimes.kr/news/articleView.html?idxno=184757,http://www.srtimes.kr/news/articleView.html?idxno=184757,"Fri, 29 Aug 2025 17:06:00 +0900"
기업은행,"KT&amp;G, 최대주주 중소기업은행서 국민연금으로 변경",KT&amp;G는 최대주주가 기존 중소기업은행에서 국민연금공단으로 변경됐다고 29일 밝혔다. 이번 최대주주 변경은 국민연금공단이 장내 매수를 통해 KT&amp;G 주식 보유량을 7.50%(915만7340주)에서 8.16%(995만4722주)로... ,http://www.g-enews.com/ko-kr/news/article/news_all/202508291702567807056c162803_1/article.html,http://www.g-enews.com/ko-kr/news/article/news_all/202508291702567807056c162803_1/article.html,"Fri, 29 Aug 2025 17:06:00 +0900"
기업은행,"잇그린 다회용컵 '리턴컵', 굿디자인 어워드 선정","사용자 경험을 기반으로 더 많은 생활 공간에서 재사용 문화를 확산시켜 나가겠다&quot;고 말했다 한편, 잇그린은 IBK기업은행 창업 육성 플랫폼인 'IBK창공(創工) 부산 12기' 졸업 기업으로, 시리즈벤처스가 함께 지원하고 있다.",http://news.mt.co.kr/mtview.php?no=2025082815304332512,https://n.news.naver.com/mnews/article/008/0005243049?sid=101,"Fri, 29 Aug 2025 17:01:00 +0900"
기업은행,"기업은행, 소상공인 대상 1070억원 규모 특별 채무조정 실시",IBK기업은행(은행장 김성태)은 경기침체로 경영난을 겪는 소상공인을 위해 특별 채무조정 프로그램을 시행한다고 29일 밝혔다. 이번 특별 채무조정 프로그램은 'IBK소상공인 상생 재기지원'과 'IBK소상공인 119plus-up... ,http://www.ttlnews.com/news/articleView.html?idxno=3026153,http://www.ttlnews.com/news/articleView.html?idxno=3026153,"Fri, 29 Aug 2025 16:56:00 +0900"
기업은행,"IBK기업은행, 소상공인 대상 1,070억 규모 특별 채무조정 실시",IBK기업은행이 경기침체로 경영난을 겪는 소상공인을 위해 특별 채무조정 프로그램을 시행한다고 29일 밝혔다. 이번 특별 채무조정 프로그램은 'IBK소상공인 상생 재기지원'과 'IBK소상공인 119plus-up'으로 구성돼... ,https://www.autodaily.co.kr/news/articleView.html?idxno=535620,https://www.autodaily.co.kr/news/articleView.html?idxno=535620,"Fri, 29 Aug 2025 16:56:00 +0900"
기업은행,KT&amp;G &quot;국민연금으로 최대주주 변경…장내매수로 지분율 상승&quot;,KT&amp;G[출처: 연합뉴스 자료사진] KT&amp;G[033780]는 최대주주가 중소기업은행에서 국민연금공단으로 변경됐다고 29일 공시했다. 이전 최대주주인 중소기업은행의 KT&amp;G 보통주 지분율은 7.79%다. 국민연금의 KT&amp;G 보통주... ,https://news.einfomax.co.kr/news/articleView.html?idxno=4372166,https://news.einfomax.co.kr/news/articleView.html?idxno=4372166,"Fri, 29 Aug 2025 16:56:00 +0900"
기업은행,"IBK기업은행, 소상공인 경영 애로 해소를 위한 특별 채무조정 프로그램...",IBK기업은행이 경기침체로 경영난을 겪는 소상공인을 위해 특별 채무조정 프로그램을 시행한다고 29일 밝혔다. 이번 특별 채무조정 프로그램은 'IBK소상공인 상생 재기지원'과 'IBK소상공인 119plus-up'으로 구성돼... ,https://www.ntoday.co.kr/news/articleView.html?idxno=118919,https://www.ntoday.co.kr/news/articleView.html?idxno=118919,"Fri, 29 Aug 2025 16:56:00 +0900"
기업은행,"IBK기업은행, 소상공인 특별 채무조정 프로그램 실시",IBK기업은행은 경기침체로 경영난을 겪는 소상공인을 위해 특별 채무조정 프로그램을 시행한다고 29일 밝혔다. 이번 특별 채무조정 프로그램은 'IBK소상공인 상생 재기지원'과 'IBK소상공인 119plus-up'으로 구성돼... ,https://www.getnews.co.kr/news/articleView.html?idxno=838221,https://www.getnews.co.kr/news/articleView.html?idxno=838221,"Fri, 29 Aug 2025 16:54:00 +0900"
기업은행,"IBK기업은행, 소상공인 위한 특별 채무조정 실시",IBK기업은행(은행장 김성태)은 경기 침체로 경영난을 겪는 소상공인을 위해 특별 채무조정 프로그램을 시행한다고 29일 밝혔다. 이번 특별 채무조정 프로그램은 'IBK소상공인 상생 재기지원'과 'IBK소상공인 119plus-up... ,http://www.newswell.co.kr/news/articleView.html?idxno=12684,http://www.newswell.co.kr/news/articleView.html?idxno=12684,"Fri, 29 Aug 2025 16:48:00 +0900"
기업은행,"IBK기업은행, 소상공인 경영 애로 해소 '특별 채무조정' 프로그램",IBK기업은행(은행장 김성태)은 경기침체로 경영난을 겪는 소상공인을 위해 특별 채무조정 프로그램을 한다고 29일 밝혔다. 특별 채무조정 프로그램은 'IBK소상공인 상생 재기지원(이하 재기지원)'과 'IBK소상공인 119plus... ,https://www.financialpost.co.kr/news/articleView.html?idxno=232271,https://www.financialpost.co.kr/news/articleView.html?idxno=232271,"Fri, 29 Aug 2025 16:46:00 +0900"
기업은행,"기보-기업은행, 기술창업 금융지원 강화 나서",기술보증기금 본점 전경.(사진=기보 제공) 기술보증기금이 기업은행과 '기술창업 활성화 및 성장 촉진을 위한 금융지원 업무협약'을 체결했다고 29일 밝혔다. 이번 협약은 기술창업기업의 금융비용 부담을 완화하고... ,https://www.cnbnews.com/news/article.html?no=747051,https://www.cnbnews.com/news/article.html?no=747051,"Fri, 29 Aug 2025 16:42:00 +0900"
기업은행,"IBK기업은행, 소상공인 경영애로 해소 특별 채무조정 프로그램",‘IBK소상공인 상생 재기지원’ 및 ‘IBK소상공인 119plus-up’ 신속한 구조조정과 경영 정상화 지원  IBK기업은행(은행장 김성태)은 경기침체로 경영난을 겪는 소상공인을 위해 특별 채무조정 프로그램을 시행한다고... ,https://www.seoultimes.news/news/article.html?no=2000079181,https://www.seoultimes.news/news/article.html?no=2000079181,"Fri, 29 Aug 2025 16:38:00 +0900"
기업은행,"기업은행, 1070억원 규모 소상공인 특별 채무조정 프로그램 실시",IBK기업은행 본점 전경. 사진=IBK기업은행  IBK기업은행은 경기침체로 경영난을 겪는 소상공인을 위해 특별 채무조정 프로그램을 시행한다고 29일 밝혔다. 이번 특별 채무조정 프로그램은 'IBK소상공인 상생 재기지원... ,https://daily.hankooki.com/news/articleView.html?idxno=1264166,https://daily.hankooki.com/news/articleView.html?idxno=1264166,"Fri, 29 Aug 2025 16:38:00 +0900"
기업은행,"IBK기업은행, 소상공인 채무조정 프로그램 시행",IBK기업은행은 경기침체로 경영난을 겪는 소상공인을 위해 특별 채무조정 프로그램을 시행한다고 29일 밝혔다. 이번 특별 채무조정 프로그램은 'IBK소상공인 상생 재기지원'과 'IBK소상공인 119plus-up'으로 구성돼... ,https://www.insightkorea.co.kr/news/articleView.html?idxno=231256,https://www.insightkorea.co.kr/news/articleView.html?idxno=231256,"Fri, 29 Aug 2025 16:38:00 +0900"
무역보험공사,李 특명에…금융공공기관 ‘통폐합 태풍’ 몰아치나,"이와 함께 수출입은행과 무역보험공사의 수출거래 보증, 주택금융공사와 주택도시기금의 주택담보대출 정책 일원화 등이 주요 검토 대상으로 꼽힌다. 다만 실제 추진은 쉽지 않을 것이란 전망이 많다. 역대 정부마다 업무... ",https://www.kukinews.com/article/view/kuk202508290145,https://www.kukinews.com/article/view/kuk202508290145,"Sat, 30 Aug 2025 06:02:00 +0900"
무역보험공사,"국방비 8% 늘어 66조, 7년만에 최대폭","협상을 뒷받침하기 위한 예산이 2조1000억 원 편성됐다. 산업은행과 수출입은행, 무역보험공사 등을 통한 정책금융 패키지 지원(1조9000억 원)으로 조선, 반도체 등 대미 관세 협상을 차질없이 뒷받침할 예정이다.",https://www.donga.com/news/Politics/article/all/20250830/132284953/2,https://n.news.naver.com/mnews/article/020/0003657636?sid=100,"Sat, 30 Aug 2025 01:44:00 +0900"
무역보험공사,[위클립] 8월 4주,이 관세 폭탄은 단순한 무역 문제가 아니라 한국 제조업의 근간을 흔들고 노동자들의 고용을 불안정하게... 한국도로공사 현장지원직 관련 법원 판결 이행 촉구 기자회견 ▷ 어떤 내용? 톨게이트에서 요금 수납 업무를... ,https://www.laborplus.co.kr/news/articleView.html?idxno=36199,https://www.laborplus.co.kr/news/articleView.html?idxno=36199,"Sat, 30 Aug 2025 00:32:00 +0900"
