Keyword,Title,Description,Original Link,Link,Publication Date
이재명,[포토] 이재명 정권 규탄 구호 외치는 참석자들,31일 오후 서울 종로구 광화문광장 일대에서 대한민국바로세우기국민운동본부 주최로 '광화문 국민대회'가 열리고 있다.,https://www.newscj.com/news/articleView.html?idxno=3369873,https://www.newscj.com/news/articleView.html?idxno=3369873,"Sat, 31 Jan 2026 14:10:00 +0900"
이재명,[포토] 이재명 정권 규탄 구호 외치는 보수단체 참석자들,31일 오후 서울 종로구 광화문광장 일대에서 대한민국바로세우기국민운동본부 주최로 '광화문 국민대회'가 열리고 있다.,https://www.newscj.com/news/articleView.html?idxno=3369872,https://www.newscj.com/news/articleView.html?idxno=3369872,"Sat, 31 Jan 2026 14:08:00 +0900"
이재명,[속보] 故 이해찬 전 총리 영결식 엄수.. 세종서 '영면',"오늘 영결식에는 이재명 대통령과 김혜경 여사, 우원식 국회의장, 김민석 국무총리 등이 정관계 주요 인사들과 참석해 고인의 마지막 길을 배웅했습니다. 상임장례위원장으로 이 전 총리 장례 절차를 총괄한 김 총리는... ",http://www.jmbc.co.kr/news/view_breakingnews/62014,https://n.news.naver.com/mnews/article/659/0000040961?sid=102,"Sat, 31 Jan 2026 14:05:00 +0900"
이재명,한동훈 전 대표 지지자 '당 지도부' 규탄대회…이해찬 영결식서 눈물 흘...,"오늘 아침 이해찬 전 총리의 영결식에 이재명 대통령도 참석했죠? [기자] 네, 이재명 대통령은 부인 김혜경 여사와 함께 국회에서 열린 이해찬 전 총리 영결식에 참석해 고인의 마지막 길을 함께 했습니다. 검은 정장에 근조... ",https://news.tvchosun.com/site/data/html_dir/2026/01/31/2026013190042.html,https://n.news.naver.com/mnews/article/448/0000587495?sid=100,"Sat, 31 Jan 2026 14:00:00 +0900"
이재명,김동연 &quot;출발선부터 다시 짜겠다&quot;… 사회이동 사다리·도민연금·AI·반...,"또 이재명 대통령이 경기도지사 재임 시 추진했던 일산대교 통행료 무료화, 경기극저신용대출, 경기지역화폐, 노동안전지킴이 정책을 언급하며 &quot;경기도가 선제적으로 이어가겠다&quot;고 강조했다. 경제 비전도 분명히 했다.... ",http://www.newsprime.co.kr/news/article.html?no=722514,http://www.newsprime.co.kr/news/article.html?no=722514,"Sat, 31 Jan 2026 13:58:00 +0900"
이재명,레이건을 닮은 이재명노믹스 어떤가 [논설실 Pick],"이재명노믹스, 레이건을 닮을 필요 쓸모없는 실패란 없다. 인생도, 세상 돌아가는 이치도 그렇다. 정치의 영역에서 보자면, 초대 기획예산처 장관 후보자로 보수 정치인 출신 이혜훈을 지명했다가 쓴맛을 본 이재명... ",https://www.mk.co.kr/article/11949153,https://n.news.naver.com/mnews/article/009/0005630214?sid=100,"Sat, 31 Jan 2026 13:57:00 +0900"
이재명,“5000피 만큼 쉽다” “왜 못했나”…부동산 정책 두고 정치권 입씨름,기자 | 이재명 대통령이 부동산 정상화가 ‘쉬운 일’이라며 자신감을 드러내자 국민의힘이 “왜 아직 못 했느냐”며 날을 세웠다. 부동산 정책을 둘러싼 정치권의 대립이 심화하는 분위기다. 국민의힘은 31일 이재명... ,https://www.etoday.co.kr/news/view/2551628,https://www.etoday.co.kr/news/view/2551628,"Sat, 31 Jan 2026 13:56:00 +0900"
이재명,'혁신당과 밀약? 타격 소재' 메시지에 박수현 &quot;부적절&quot;,혁신당과 합당해야 한다는 민주당 정청래 대표의 제안과 관련해 이재명 정부 국무위원과 여당 모 의원 사이 '밀약 여부를 공격해야 한다'는 취지 텔레그램 메시지가 포착된 걸 두고 민주당 박수현 수석대변인이... ,https://www.ytn.co.kr/_ln/0101_202601311354366097,https://n.news.naver.com/mnews/article/052/0002308502?sid=100,"Sat, 31 Jan 2026 13:54:00 +0900"
이재명,"이 대통령, SNS에 “부동산 정상화는 5000P보다 훨씬 쉬워”","이재명 대통령. 대통령실 이재명 대통령이 31일 소셜미디어(X·옛 트위터)를 통해 부동산 시장 정상화 의지를 거듭 강조했다. 이 대통령은 “부동산 정상화는 (코스피) 5천피, 계곡 정비보다 훨씬 쉽고 중요한 일”이라며... ",http://www.segyebiz.com/newsView/20260131504807?OutUrl=naver,http://www.segyebiz.com/newsView/20260131504807?OutUrl=naver,"Sat, 31 Jan 2026 13:54:00 +0900"
이재명,[기본·원칙·상식 : 부동산 세레나데] — 집은 사는 곳이지 투기대상이...,- 이재명 대통령이 말하는 부동산의 원칙 아브라함 곽 대한민국에서 부동산은 단순한 자산이 아니라 시대의... 지금 이재명 대통령이 보이는 부동산 투기 억제 의지는 단순한 시장 개입이 아니라 대한민국 경제 구조를 다시... ,https://www.ajunews.com/view/20260131133545672,https://www.ajunews.com/view/20260131133545672,"Sat, 31 Jan 2026 13:52:00 +0900"
이재명,‘광주전남 행정통합 건설·안전·교통·노동 분야 시민공청회’ 성료,"이어 “최근 이재명 대통령이 통합 명칭을 ‘전남광주특별시’, 약칭은 ‘광주특별시’로 확정한 것과 관련해 ‘대화·타협·공존, 과연 민주주의의 본산답습니다’라고 사회관계망서비스(SNS)를 통해 격려했다”며... ",https://www.g-enews.com/view.php?ud=20260131125120769786960e4862_1,https://www.g-enews.com/view.php?ud=20260131125120769786960e4862_1,"Sat, 31 Jan 2026 13:50:00 +0900"
이재명,"민주, '합당 밀약설' 문자 논란에 &quot;부적절…국민께 송구&quot;","&quot;양당 간 합동 논의 절차 전혀 진행되지 않아&quot; 장경태·최민희, 내달 12일 윤심위서 소명 전망 더불어민주당이 31일 한 의원이 이재명 정부 한 국무위원과 조국혁신당과 합당 추진을 두고 '밀약설'을 주장하는 대화를 나눈... ",https://news.tf.co.kr/read/ptoday/2288125.htm,https://n.news.naver.com/mnews/article/629/0000468088?sid=100,"Sat, 31 Jan 2026 13:50:00 +0900"
이재명,이해찬 전 총리 영결식… 이재명 대통령 등 정계 인사들 애도,이날 영결식에는 이재명 대통령과 김혜경 여사를 비롯한 정계 주요 인사들이 대거 참석해 고인을 애도했다. 그동안 헌신적으로 민주주의에 이바지한 고인의 삶을 기리기 위해 많은 인사가 자리를 함께했다. 대회의실에서... ,https://www.gokorea.kr/news/articleView.html?idxno=856223,https://www.gokorea.kr/news/articleView.html?idxno=856223,"Sat, 31 Jan 2026 13:50:00 +0900"
이재명,"이재명 대통령, 고 이해찬 전 총리 영결식에서 슬픔의 눈물","이재명 대통령과 김혜경 여사는 31일 국회에서 치러진 고 이해찬 전 국무총리의 영결식에 참석하여 깊은... 추도 영상으로 이어지는 시간 동안, 영상에는 이재명 대통령이 이해찬 전 총리와 함께한 다양한 순간들이 담겼다.... ",https://www.gokorea.kr/news/articleView.html?idxno=856222,https://www.gokorea.kr/news/articleView.html?idxno=856222,"Sat, 31 Jan 2026 13:50:00 +0900"
이재명,고(故) 이해찬 전 국무총리 발인 엄수… 정계 인사들 눈물 속 배웅,"발인이 시작되자 군 의장대는 고인의 영정과 이재명 대통령이 추서한 국민훈장 무궁화장을 차례로 들고 장례식장을 나섰다. 이어 태극기로 덮인 관이 군 의장대에 의해 운구 차량으로 옮겨졌다. 유족과 우 의장, 김 총리... ",https://www.jeonmae.co.kr/news/articleView.html?idxno=1226638,https://www.jeonmae.co.kr/news/articleView.html?idxno=1226638,"Sat, 31 Jan 2026 13:48:00 +0900"
이재명,李 “부동산 정상화 오천피보다 쉬워”…국힘 “어처구니 없어”,압박” 이재명 대통령이 “부동산 정상화는 5천피(코스피 5000)보다 훨씬 쉽고 더 중요한 일”이라며 주택시장 안정화에 대한 의지를 드러냈다. 국민의힘은 “이재명정부 들어 네 차례의 부동산 대책이 나왔지만 약발이... ,https://www.segye.com/newsView/20260131504755?OutUrl=naver,https://n.news.naver.com/mnews/article/022/0004102079?sid=100,"Sat, 31 Jan 2026 13:48:00 +0900"
이재명,"국민의힘, 이재명 대통령 부동산 정책 맹비판… &quot;쉬운 정상화는 어디에...",국민의힘은 31일 이재명 대통령의 사회관계망서비스(SNS) 발언을 계기로 부동산 정책에 대한 공세를 이어갔다.... 그는 &quot;이재명 정부 들어 연이어 발표된 네 차례의 부동산 대책 중 어느 것도 효과적인 결과를 만들어내지... ,https://www.gokorea.kr/news/articleView.html?idxno=856220,https://www.gokorea.kr/news/articleView.html?idxno=856220,"Sat, 31 Jan 2026 13:48:00 +0900"
이재명,"李 대통령 &quot;망국적 부동산 정상화, 표 계산 말고 국민 믿어야&quot;",이재명 대통령이 지난 29일 청와대에서 열린 수석보좌관회의에서 발언하고 있다. 이재명 대통령은 31일 &quot;'망국적 부동산'의 정상화가 불가능할 것 같은가&quot;라며 &quot;표 계산 없이 국민을 믿고 비난을 감수하면 될 일&quot;이라고... ,https://www.jeonmae.co.kr/news/articleView.html?idxno=1226637,https://www.jeonmae.co.kr/news/articleView.html?idxno=1226637,"Sat, 31 Jan 2026 13:48:00 +0900"
이재명,"이재명 대통령 &quot;종묘 앞 고층 개발은 되고, 태릉 옆 주택 공급은 안 되나...","뉴데일리 오승영 기자 = 이재명 대통령은 31일 사회관계망서비스(SNS)를 통해 서울시와 정부의 개발 정책을 둘러싼 상반된 태도를 지적했다. 이 대통령은 이날 엑스(X·옛 트위터)에 &quot;'종묘 앞 고층 개발은 되고, 태릉 옆 주택... ",https://www.newdaily.co.kr/site/data/html/2026/01/31/2026013100038.html,https://www.newdaily.co.kr/site/data/html/2026/01/31/2026013100038.html,"Sat, 31 Jan 2026 13:46:00 +0900"
이재명,"“집값 정상화, 오천피보다 쉽다” vs “근데 왜 못했나”…李대통령-국...",“부동산 정상화 5천피 보다도 쉽다.”(이재명 대통령) “그렇게 쉬운 부동산 정책을 아직까지 하지 못하고 있나.”(국민의힘) 국민의힘이 31일 이재명 대통령의 부동산 정책을 정면 비판하고 나섰다. 이 대통령이 이날 SNS에... ,https://www.dt.co.kr/article/12043935?ref=naver,https://n.news.naver.com/mnews/article/029/0003008158?sid=100,"Sat, 31 Jan 2026 13:44:00 +0900"
이재명,"‘민주주의 거목’ 이해찬, 눈물의 영결식","이재명 대통령도 정치적 스승이자 버팀목이었던 이 전 총리와의 영별을 애도했다.영결식에는 이 대통령과 김혜경 여사, 우원식 국회의장과 주호영 부의장, 노무현 대통령 배우자 권양숙 여사, 김민석 국무총리, 정청래... ",https://vop.co.kr/A00001687344.html,https://vop.co.kr/A00001687344.html,"Sat, 31 Jan 2026 13:44:00 +0900"
이재명,현대차 '아틀라스' 언급 반복하는 李대통령... &quot;이런 흐름 대응해야&quot;,"이재명 대통령은 '국가창업시대 전략회의'에 참석해 &quot;고용보다는 이제는 창업으로 국가의 중심을 바꾸는 첫날이 되지 않을까, 대전환의 첫 출발점이라고 생각한다&quot;고 말했습니다.30일 이 대통령은 &quot;양극화라는 것이 우리... ",https://www.insight.co.kr/news/540919,https://www.insight.co.kr/news/540919,"Sat, 31 Jan 2026 13:40:00 +0900"
이재명,국힘 “李 망국적 부동산 정책…아니면 말고식 SNS 자중하라”,뉴시스 국민의힘은 31일 “망국적 부동산의 원인이 있다면 그것은 바로 이재명 정부의 망국적 부동산 정책”이라고 비판했다. 박성훈 수석대변인은 논평에서 “이재명 정부 들어 네 차례의 부동산 대책이 나왔지만... ,https://www.munhwa.com/article/11565096?ref=naver,https://n.news.naver.com/mnews/article/021/0002767854?sid=100,"Sat, 31 Jan 2026 13:36:00 +0900"
이재명,국힘 &quot;李정부 부동산 정책이 곧 망국적 정책…쉬운데 왜 정상화 못했나...,"국민의힘은 31일 이재명 대통령을 향해 &quot;그렇게 쉬운 부동산 정상화 왜 아직도 못했나&quot;라고 비판했다. 앞서... 박 수석대변인은 또 &quot;이재명 정부 들어 네 차례의 부동산 대책이 나왔지만, 약발이 먹힌 정책은 단 하나도 없다... ",https://www.imaeil.com/page/view/2026013113145597363,https://n.news.naver.com/mnews/article/088/0000994738?sid=100,"Sat, 31 Jan 2026 13:35:00 +0900"
이재명,李대통령 “부동산 정상화 5천피보다 쉽다”…국힘 “그리 쉬운 걸 왜 ...,"이재명 대통령이 31일 소셜미디어를 통해 “부동산 정상화는 5천피, 계곡 정비보다 훨씬 쉽고 더 중요한 일”... 뿐”이라며 “이재명 정부 들어 네 차례의 부동산 대책이 나왔지만, 약발이 먹힌 정책은 단 하나도 없다”고... ",https://www.mk.co.kr/article/11949145,https://n.news.naver.com/mnews/article/009/0005630210?sid=100,"Sat, 31 Jan 2026 13:33:00 +0900"
이재명,"이재명 대통령 &quot;부동산 정상화, 5000피보다 쉬워… 기회 있을 때 잡길&quot;",이재명 대통령이 부동산 시장 정상화에 대한 강한 의지를 드러냈다. 31일 이 대통령은 자신의 엑스(X·옛 트위터)를 통해 &quot;부동산 정상화가 불가능할 것 같은가&quot;라며 &quot;표 계산 없이 국민을 믿고 비난을 감수하면 될 일&quot;이라고... ,https://www.sidae.com/article/2026013113133894092,https://n.news.naver.com/mnews/article/417/0001127522?sid=100,"Sat, 31 Jan 2026 13:32:00 +0900"
이재명,정부의 스타트업 진흥이 성공하려면…[김유성의 통캐스트],이재명 대통령이 그들의 말을 귀기울이면서 여러 대안을 제안했습니다. 그중 하나가 정부 주도 스타트업... 이재명 대통령이 30일 청와대에서 열린 국가창업시대 전략회의 'K-스타트업이 미래를 만든다'에서 발언하고 있다.... ,http://www.edaily.co.kr/news/newspath.asp?newsid=01974566645323296,https://n.news.naver.com/mnews/article/018/0006210686?sid=100,"Sat, 31 Jan 2026 13:31:00 +0900"
이재명,'비핵화' 빼고 '관세'로 때리고…한국 안보·경제 뒤흔드는 '트럼프 리스...,국익 중심의 실용주의를 핵심 기조로 삼고 있는 이재명 정부는 지금까지 외치에서 큰 흔들림 없이 성과를 거둬왔다는 평가를 받는다. 그럼에도 이번 트럼프의 관세 번복에서 나타나듯 양국이 불신과 오해 대신 신뢰와... ,https://www.sisajournal.com/news/articleView.html?idxno=361178,https://n.news.naver.com/mnews/article/586/0000121441?sid=100,"Sat, 31 Jan 2026 13:30:00 +0900"
이재명,"여야, 교육부 ‘민주시민교육’ 공방…“교실의 정치화”·“정치선동”","교육부가 이재명 정부 국정과제 중 하나인 ‘민주시민교육’을 위해 헌법·선거 교육 강화에 나선 것을 두고 여야가 공방을 벌였습니다. 국민의힘은 “교실의 정치화”라고 비판했고, 더불어민주당은 이 같은 비판이... ",https://news.kbs.co.kr/news/pc/view/view.do?ncd=8474112&ref=A,https://n.news.naver.com/mnews/article/056/0012116331?sid=100,"Sat, 31 Jan 2026 13:30:00 +0900"
이재명,이해찬 전 총리 영결식 눈물 속 엄수…&quot;민주주의의 거목&quot; 애도,"맨 앞줄에는 이재명 대통령과 김혜경 여사, 우원식 국회의장, 김민석 국무총리, 노무현 전 대통령 배우자... 서울추모공원에서 화장된 뒤 세종시 은하수공원에 안장될 예정입니다. #이해찬 #영결식 #민주주의 #이재명 #국회",https://www.ikbc.co.kr/article/view/kbc202601310018,https://n.news.naver.com/mnews/article/660/0000102391?sid=100,"Sat, 31 Jan 2026 13:29:00 +0900"
정상순방,"한국MICE협회, '2026년 신년인사교류회' 성료",그는 &quot;지난해 새 정부 출범과 함께 APEC 정상회의라는 초대형 국가적 행사를 성공적으로 치러내며 우리... 해외 순방 시 경제사절단에 마이스 기업이 포함될 수 있도록 정부를 설득하겠다는 포부다. 그는 &quot;이미 해외에서... ,http://www.ttlnews.com/news/articleView.html?idxno=3074850,http://www.ttlnews.com/news/articleView.html?idxno=3074850,"Sat, 31 Jan 2026 13:22:00 +0900"
정상순방,강훈식 &quot;노르웨이와 천무 수출 계약 체결&quot;,"강 실장은 “지난해 11월 G20 정상회의에서 대통령과 나란히 앉아 많은 허심탄회한 대화를 나눈 것도... 동유럽·북유럽 순방이 있었다. 그는 폴란드와 루마니아, 노르웨이를 5박 3일 일정으로 방문해 천무의 성능과 함께... ",http://www.edaily.co.kr/news/newspath.asp?newsid=01672806645323296,https://n.news.naver.com/mnews/article/018/0006210598?sid=100,"Sat, 31 Jan 2026 08:58:00 +0900"
정상순방,[이슈&amp;한반도] “한국 주도로 북한 억제…북핵 분명한 본토 위협” 외,한국이 '모범 동맹'이기 때문에 취임 후 첫 순방지로 택했다고 했는데요. 추켜세우는 덴 이유가 있겠죠? 이슈... 단기적으로 정상화되기 더욱 어려워질 거라고 예상됩니다. 북한이 2022년 9월에 최고인민회의를 통해서 핵을... ,https://news.kbs.co.kr/news/pc/view/view.do?ncd=8474051&ref=A,https://n.news.naver.com/mnews/article/056/0012116284?sid=100,"Sat, 31 Jan 2026 08:21:00 +0900"
국회,중국인들 &quot;일본 여행 안 가&quot;…中→日항공편 반토막,중일 관계는 지난해 11월 다카이치 사나에 일본 총리가 국회에서 '대만 유사시 개입' 가능성을 언급한 이후 급속도로 악화됐다. 이후 중국 정부는 치안 등을 이유로 자국민에게 일본 여행을 자제하라고 권고했다.... ,https://news.tf.co.kr/read/world/2288127.htm,https://n.news.naver.com/mnews/article/629/0000468090?sid=104,"Sat, 31 Jan 2026 14:11:00 +0900"
국회,[속보] 故 이해찬 전 총리 영결식 엄수.. 세종서 '영면',"고(故) 이해찬 전 국무총리의 영결식이 오늘(31일) 국회 의원회관 대회의실에서 엄수됐습니다. 오늘 영결식에는 이재명 대통령과 김혜경 여사, 우원식 국회의장, 김민석 국무총리 등이 정관계 주요 인사들과 참석해 고인의... ",http://www.jmbc.co.kr/news/view_breakingnews/62014,https://n.news.naver.com/mnews/article/659/0000040961?sid=102,"Sat, 31 Jan 2026 14:05:00 +0900"
국회,김정관·러트닉 관세협의 결론 없이 끝…연준 의장에 '쿠팡 사외이사' ...,"닷새 전 트럼프 대통령이 한미 관세합의 국회 비준을 문제 삼으며 급작스럽게 관세를 10%P 인상하자, 김 장관은 미국으로 급파돼 연이틀 러트닉 장관과 만났습니다. 김 장관은 귀국 이후 화상으로 후속 협의를 이어간다는... ",https://news.tvchosun.com/site/data/html_dir/2026/01/31/2026013190044.html,https://n.news.naver.com/mnews/article/448/0000587496?sid=104,"Sat, 31 Jan 2026 14:02:00 +0900"
국회,"남양주시의회, 경기동부권 시·군의장협의회 제137차 정례회의 개최",이어 손자병법의 ‘동주공제(同舟共濟)’를 언급하며 “국회와 행정부와 힘을 모아 팔당 유역의 각종 규제 철폐와 주민의 행복추구권·재산권 확보라는 공동의... ,http://www.breaknews.com/1181467,http://www.breaknews.com/1181467,"Sat, 31 Jan 2026 14:02:00 +0900"
국회,"민주당, 합당 관련 ‘밀약’ ‘타격 소재’ 언급에 “부적절, 송구”","박 수석대변인은 오늘(31일) 국회에서 기자들과 만나, 관련한 질문에 “민생이 처리되는 국회 본회의장에서 적절치 않은 모습이 보인 것에 대해 죄송하게 생각한다”며 이같이 밝혔습니다. 앞서 혁신당 황운하 의원은... ",https://news.kbs.co.kr/news/pc/view/view.do?ncd=8474116&ref=A,https://n.news.naver.com/mnews/article/056/0012116335?sid=100,"Sat, 31 Jan 2026 14:01:00 +0900"
국회,"[IT뒷담화] 관세 인상 여파, 플랫폼법·정밀지도 디지털 규제 불만?",미국 국무부는 지난달 31일(현지시간) 한국 국회 본회의를 통과한 정보통신망법 개정안에 대해 우려를 제기한... 삼은 '한국 국회가 한미 간 무역 합의 이행에 필요한 법적 절차를 진행하지 않았다'는 언급과는 직접적인... ,http://www.enewstoday.co.kr/news/articleView.html?idxno=2388816,http://www.enewstoday.co.kr/news/articleView.html?idxno=2388816,"Sat, 31 Jan 2026 14:00:00 +0900"
국회,한동훈 전 대표 지지자 '당 지도부' 규탄대회…이해찬 영결식서 눈물 흘...,"이 시각 국회 앞에는 한동훈 전 대표 제명을 결정한 국민의힘 지도부에 대한 규탄대회가 열리고 있습니다. 취재기자 연결해 자세한 소식 알아보겠습니다. 고희동 기자, 집회가 언제 시작되는 건가요? 네, 국회 앞에선... ",https://news.tvchosun.com/site/data/html_dir/2026/01/31/2026013190042.html,https://n.news.naver.com/mnews/article/448/0000587495?sid=100,"Sat, 31 Jan 2026 14:00:00 +0900"
국회,레이건을 닮은 이재명노믹스 어떤가 [논설실 Pick],"일례로 지난 29일 대통령 직속 ‘규제합리화위원회’를 출범시키기 위한 근거법이 국회 본회의를 통과했다. 현행 규제개혁위원회가 앞으로 규제합리화위원회로 바뀌고, 위원장이 대통령으로 격상된다. 기자는 이... ",https://www.mk.co.kr/article/11949153,https://n.news.naver.com/mnews/article/009/0005630214?sid=100,"Sat, 31 Jan 2026 13:57:00 +0900"
국회,"최구식 전 의원, 이해찬 빈소서 정청래 민주당대표 만나",정 대표는 17대 국회에서 4년간 같은 상임위에서 활동했던 시절을 거론하며 &quot;출판계의 오랜 숙원이었던 도서정가제를 간사였던 최 전의원과 내가 여·야합의로 통과시켰던 것이 기억에 남는다&quot;고 말했다. 이날 조문에는... ,http://www.newsprime.co.kr/news/article.html?no=722518,http://www.newsprime.co.kr/news/article.html?no=722518,"Sat, 31 Jan 2026 13:56:00 +0900"
국회,'혁신당과 밀약? 타격 소재' 메시지에 박수현 &quot;부적절&quot;,"박 수석대변인은 오늘(31일) 국회 의원회관에서 열린 고 이해찬 전 국무총리 영결식이 끝난 뒤 기자들과 만나, 민생이 처리되는 국회 본회의장에서 국민에게 송구스러운 모습이라며 이같이 밝혔습니다. 그러면서 양당 간... ",https://www.ytn.co.kr/_ln/0101_202601311354366097,https://n.news.naver.com/mnews/article/052/0002308502?sid=100,"Sat, 31 Jan 2026 13:54:00 +0900"
국회,쿠팡 로저스 12시간 조사 후 귀가…재출국 질문에 답 없어,이외에도 로저스 대표는 &quot;자체 조사는 국정원 지시였다&quot;는 국회 청문회 발언을 국정원이 부인하면서 위증 혐의도 추가됐습니다. 경찰은 우선 로저스 대표를 상대로 증거인멸과 자체 조사 과정에서 직접적인 지시나 관여... ,http://www.yonhapnewstv.co.kr/MYH20260131135314NX1,https://n.news.naver.com/mnews/article/422/0000828851?sid=102,"Sat, 31 Jan 2026 13:54:00 +0900"
국회,[기본·원칙·상식 : 부동산 세레나데] — 집은 사는 곳이지 투기대상이...,국회의원을 거쳐 대통령에 이르기까지 부동산 정책의 입법·행정·정치적 맥락을 모두 체득한 인물이다. 이력만 보더라도 부동산을 이론이나 이념이 아니라 현장에서 체감한 지도자라 할 수 있다. 그가 아파트 투기와 개발... ,https://www.ajunews.com/view/20260131133545672,https://www.ajunews.com/view/20260131133545672,"Sat, 31 Jan 2026 13:52:00 +0900"
국회,"헤럴드 로저스 쿠팡 임시대표, 12시간 경찰조사 후 귀가","해롤드 로저스 쿠팡 임시 대표가 17일 오전 서울 여의도 국회 과학기술정보방송통신위원회 전체회의에서... 그러나 증거인멸 혐의를 인정하는지, 국정원의 지시로 자체조사에 나섰다는 과거 국회 청문회 증언이... ",https://www.gukjenews.com/news/articleView.html?idxno=3494335,https://www.gukjenews.com/news/articleView.html?idxno=3494335,"Sat, 31 Jan 2026 13:50:00 +0900"
국회,이해찬 전 총리 영결식… 이재명 대통령 등 정계 인사들 애도,"고(故) 이해찬 전 국무총리의 영결식이 31일 오전 국회 의원회관에서 엄수됐다. 이날 영결식에는 이재명... 대회의실에서 열린 영결식에는 우원식 국회의장과 김민석 국무총리, 노무현 전 대통령의 배우자 권양숙 여사가... ",https://www.gokorea.kr/news/articleView.html?idxno=856223,https://www.gokorea.kr/news/articleView.html?idxno=856223,"Sat, 31 Jan 2026 13:50:00 +0900"
국회,"민주, '합당 밀약설' 문자 논란에 &quot;부적절…국민께 송구&quot;",박 수석대변인은 이날 오전 고(故) 이해찬 전 국무총리 영결식을 마친 뒤 국회에서 기자들과 만나 &quot;민생(법안)이 처리되는 국회 본회의장에서 적절치 않은 모습을 보인 데 대해 죄송하다&quot;라며 이같이 말했다. 박... ,https://news.tf.co.kr/read/ptoday/2288125.htm,https://n.news.naver.com/mnews/article/629/0000468088?sid=100,"Sat, 31 Jan 2026 13:50:00 +0900"
