Keyword,Title,Description,Original Link,Link,Publication Date
국정기획위원회,"[사설] 부산행 '해수부', 대한민국의 해수부다",중도일보 = 해양수산부 부산 이전이 국정기획위원회 신속추진과제로 채택될 때부터 거침없더니 속전속결이다. 8일부터 부산 동구 수정동 임시청사에 입주를 시작한다. 공간을 임대하는 방식으로 이전을 앞당기라고 이재명... ,https://www.joongdo.co.kr/web/view.php?key=20251208010003191,https://www.joongdo.co.kr/web/view.php?key=20251208010003191,"Mon, 08 Dec 2025 16:34:00 +0900"
국정기획위원회,"KT 차기 대표 후보군, 내일 3~4명으로 압축",이 대통령 당선 뒤 국정기획위원회 경제2분과 위원으로도 활동했다. 김철수 전 사장은 SK텔레콤 전신인 대한텔레콤과 LG텔레콤에서 근무한 뒤 2014년 KT에 합류했다. 박윤영 전 사장은 1992년 한국통신에 입사했다.... ,http://www.inews24.com/view/1915338,https://n.news.naver.com/mnews/article/031/0000987424?sid=105,"Mon, 08 Dec 2025 16:32:00 +0900"
국정기획위원회,연말 어수선한 관가 ‘고삐 죄는’ 이 대통령···이번주 부처별 업무...,이 대통령은 이날 오후 용산 대통령실에서 지방시대위원회 보고회를 열고 김경수 지방시대위원장 등 참석자들로부터 업무보고를 받았다. 업무보고는 약 1시간 진행됐고 전부 생중계됐다. 이 대통령은 오는 11일부터 기획... ,https://www.khan.co.kr/article/202512081632001,https://n.news.naver.com/mnews/article/032/0003413847?sid=100,"Mon, 08 Dec 2025 16:32:00 +0900"
국정기획위원회,정준호 의원 &quot;KTX-SR 통합으로 호남선 하루 4600좌석 증가&quot;,"국토위 상임위와 장관 인사청문회, 국정감사에서 국토부 장관 등에게 4회 이상 질의했고, 국토부... KTX-SR 통합 안건은 오는 10일 기획재정부 공공기관운영위원회에서 심의될 예정이다. 이에 정준호 의원은 &quot;KTX-SR... ",https://www.pressian.com/pages/articles/2025120816201305987?utm_source=naver&utm_medium=search,https://n.news.naver.com/mnews/article/002/0002417861?sid=102,"Mon, 08 Dec 2025 16:31:00 +0900"
국정기획위원회,"통합돌봄지원, '빚좋은 개살구' 되나…시행 앞두고 '쥐꼬리 예산'",123개 국정과제 중 하나(과제78번)로 채택했다는 점&quot;을 내세웠다. 이어 &quot;그런데 이 초라한 예산이 그 화려한 약속과 막중한 책임에 상응하는 것인가. 기획재정부와 보건복지부는 국민의 절박한 삶에서 저출생 고령사회... ,https://www.1conomynews.co.kr/news/articleView.html?idxno=45441,https://www.1conomynews.co.kr/news/articleView.html?idxno=45441,"Mon, 08 Dec 2025 16:30:00 +0900"
국정기획위원회,충북도 2차 공공기관 유치전 본격 시동…65개 대상·전략 확정,"새 정부의 국정과제인 '2차 공공기관 이전' 대응을 위한 시행 전략도 담았다. 유치 대상 충북 특화... 시민단체와 경제단체 등이 참여하는 '균형발전 및 공공기관 유치 범도민위원회(가칭)'를 구성해 대도민 결의대회, 국회... ",https://www.inews365.com/news/article.html?no=897909,https://www.inews365.com/news/article.html?no=897909,"Mon, 08 Dec 2025 16:14:00 +0900"
국정기획위원회,"&quot;유정복 선거법 혐의, 무죄 쉽지 않을 것&quot; vs &quot;지시 개입 가능성 없어, ...",최근에 또 보니까 민주당 인천시당 박선원 국회의원과 함께 위원장님 인천 지방 선거 기획단 공동 단장에... ◇ 조택상 : 국정 위원회에 들어가세요. ◆ 이도형 : 약간 합리적인 분이 들어 가셔야 돼요. ○ 유제홍 : 아마... ,https://news.ifm.kr/news/articleView.html?idxno=459356,https://news.ifm.kr/news/articleView.html?idxno=459356,"Mon, 08 Dec 2025 15:58:00 +0900"
국정기획위원회,KT 차기 사장 후보 면접 D-1…주형철 '1강' 레이스 속 막판 변수는?,"이재명 정부 인수위원회 격이었던 국정기획위원회 경제2분과 기획위원을 지냈다. 지난 2022년 지방선거 후 맡았던 경기도 산하 경기연구원장을 지난해 11월 내려놓고 더불어민주당 집권플랜본부로 이동했으며, 지난... ",https://www.pinpointnews.co.kr/news/articleView.html?idxno=403794,https://www.pinpointnews.co.kr/news/articleView.html?idxno=403794,"Mon, 08 Dec 2025 15:42:00 +0900"
국정기획위원회,"&quot;KTX-SR 통합…호남선 좌석 하루 4,600석 증가 가능&quot;","국토위 상임위와 장관 인사청문회, 국정감사에서 국토부 장관 등에게 4회 이상 질의했고 국토부... KTX-SR 통합 안건은 오는 10일 기획재정부 공공기관운영위원회에서 심의될 예정입니다. 이에 정준호 의원은 &quot;KTX-SR... ",https://www.ikbc.co.kr/article/view/kbc202512080036,https://n.news.naver.com/mnews/article/660/0000098604?sid=100,"Mon, 08 Dec 2025 15:32:00 +0900"
국정기획위원회,"이 대통령 “분권과 균형발전, 자치 강화는 국가 생존전략”","지방시대위원회 보고회 모두 발언에서 “최근에 수도권 집중이 지나치게 강화되면서 오히려 이제는 성장의... 이날 보고회에는 지방시대 김경수 위원장과 신용한 부위원장, 조봉업 기획단장을 비롯해 김기석·김상우... ",https://www.joongdo.co.kr/web/view.php?key=20251208010003159,https://www.joongdo.co.kr/web/view.php?key=20251208010003159,"Mon, 08 Dec 2025 15:28:00 +0900"
국정기획위원회,고속철 KTX-SR 통합…‘예매 전쟁’ 해소 기대,"이에 정 의원은 국토교통위원회 상임위, 장관 인사청문회, 국정감사 등에서 KTX-SR 통합 필요성을 꾸준히... KTX-SR 통합 안건은 오는 10일 기획재정부 공공기관운영위원회에서 심의될 예정이다. 정 의원은 “KTX-SR 통합은... ",https://news.mtn.co.kr/news-detail/2025120815044226490,https://news.mtn.co.kr/news-detail/2025120815044226490,"Mon, 08 Dec 2025 15:24:00 +0900"
국정기획위원회,"정준호 의원 &quot;KTX-SR 통합 환영, 호남선 1일 4천600석 증가 가능&quot;","10일 기획재정부 공공기관운영위원회에서 심의될 예정이다. 정 의원은 &quot;그간 호남선 포함 고속철도 좌석수 확대를 위해 KTX-SR 통합의 필요성을 강조해왔다&quot;면서 &quot;국토위 상임위와 장관 인사청문회, 국정감사에서 국토부... ",http://www.namdonews.com/news/articleView.html?idxno=841730,http://www.namdonews.com/news/articleView.html?idxno=841730,"Mon, 08 Dec 2025 15:20:00 +0900"
국정기획위원회,"전세사기 피해자들 &quot;끝나지 않은 겨울, 대통령은 약속 잊었나&quot;",이어 &quot;특별법 개정이 지연되고 국정기획위원회 신속과제조차 처리되지 않는 현실이 안타깝다. 정부와 민주당이 피해자 구제의 골든타임을 놓치고 있다&quot;고 비판했다. 특히 피해자들의 극단적 선택과 청년층 피해의... ,https://www.newsclaim.co.kr/news/articleView.html?idxno=3051856,https://www.newsclaim.co.kr/news/articleView.html?idxno=3051856,"Mon, 08 Dec 2025 15:10:00 +0900"
국정기획위원회,"이재명 대통령님, 전세사기 피해자와의 약속을 잊으셨습니까","그러나 최근 여야 합의로 국회 국토교통위원회를 통과한 전세사기 피해자 최소지원금 예산 증액안이... 국민주권정부 출범 이후 국정기획위에서는 전세사기 해결을 위한 신속추진과제를 발표하고, 국정과제에도... ",https://www.ohmynews.com/NWS_Web/View/at_pg.aspx?CNTN_CD=A0003189388&CMPT_CD=P0010&utm_source=naver&utm_medium=newsearch&utm_campaign=naver_news,https://n.news.naver.com/mnews/article/047/0002497655?sid=102,"Mon, 08 Dec 2025 14:56:00 +0900"
국정기획위원회,"李대통령 &quot;분권·균형발전·자치 강화, 피할 수 없는 국가생존전략&quot;","지방시대위원회 기획단장, 박지우·정종숙·김중석·김기석·김상태·신원철·이병헌·김영만·김상우·안기돈... 김병욱 정무비서관, 이선호 자치발전비서관, 한상익 국정과제비서관, 강유정 대변인 등이 자리했다. [뉴스웍스=]",https://www.newsworks.co.kr/news/articleView.html?idxno=822140,https://www.newsworks.co.kr/news/articleView.html?idxno=822140,"Mon, 08 Dec 2025 14:54:00 +0900"
국정기획위원회,"KT 이사회, 후보 4명 선정 임박...‘기술·글로벌·보안’ 역량이 관건","주형철 전 대표는 SK텔레콤 출신으로 김동연 경기지사 시절 경기연구원장을 지냈고, 지난해 더불어민주당 집권플랜본부 먹사니즘본부장을 거쳐 이재명 대통령 당선 뒤 국정기획위원회 경제2분과 위원에 올랐다. 정권... ",http://www.beyondpost.co.kr/view.php?ud=202512081439115518023e3e11ae_30,http://www.beyondpost.co.kr/view.php?ud=202512081439115518023e3e11ae_30,"Mon, 08 Dec 2025 14:46:00 +0900"
국정기획위원회,[속보] 인천시 글로벌도시정무부시장에 신재경 국민의힘 남동을 당협위...,이후 이완구 전 국무총리와 유민봉 전 국정기획수석이 국회의원으로 재직했을 당시 보좌관으로 활동했다. 제20대 대통령직인수위원회 전문위원과 대통령비서실 총무비서관실 선임행정관 등을 지내고 제22대 총선에서... ,https://www.incheonilbo.com/news/articleView.html?idxno=1311243,https://www.incheonilbo.com/news/articleView.html?idxno=1311243,"Mon, 08 Dec 2025 14:32:00 +0900"
국정기획위원회,"대기업 지원은 투자, 사회기업 투자는 반시장?","새정부 초기, '위스테이 별내'라는 사회주택을 찾은 국정기획위원회 위원들은 &quot;이건 LH도 못 하고, 국토부도 못 한다&quot;라는 반응을 보였다고 한다. 세 사례의 공통점은 그 주체가 협동조합이라는 점이다. 이처럼 협동조합을... ",https://www.ohmynews.com/NWS_Web/View/at_pg.aspx?CNTN_CD=A0003189379&CMPT_CD=P0010&utm_source=naver&utm_medium=newsearch&utm_campaign=naver_news,https://n.news.naver.com/mnews/article/047/0002497653?sid=102,"Mon, 08 Dec 2025 14:31:00 +0900"
국정기획위원회,전세사기 피해자들 &quot;선구제 원칙 담은 특별법 올해 안에 처리하라&quot;,"8일 오전 전세사기·깡통전세피해자전국대책위원회(대책위)는 서울 용산구 대통령 집무실 앞에서... 안 위원장은 &quot;그토록 희망하던 정부가 바뀌었고, 국정기획위에서 최우선변제금 보완을 약속했을 때 누구보다... ",https://www.newspim.com/news/view/20251208000699,https://www.newspim.com/news/view/20251208000699,"Mon, 08 Dec 2025 14:30:00 +0900"
국정기획위원회,7명으로 압축된 KT 차기 CEO 후보군…심사 기준은 ‘안 알려줌’,"반면, 문재인 정부 청와대 출신이자 현 정부에서 국정기획위원회 위원으로 활동한 주형철 후보는 여권 추천설이 꾸준히 제기된다. 남중수 전 케이티 사장 시절(2005∼2008) 혁신기획실장과 아이티(IT)기획실장 등을 지낸... ",https://www.hani.co.kr/arti/economy/it/1233414.html,https://n.news.naver.com/mnews/article/028/0002780338?sid=105,"Mon, 08 Dec 2025 14:28:00 +0900"
국정기획위원회,“이재명 대통령님 '선구제' 약속 잊으셨나요” 전세사기 피해자들의 절...,"국정기획위원회 국민주권위원으로 활동하며 '사회적 재난 규정'과 '신속 법안 처리' 약속을 믿었으나, 12월 현재까지 특별법 개정 및 예산 반영이 이뤄지지 않아... ",http://www.breaknews.com/1167326,http://www.breaknews.com/1167326,"Mon, 08 Dec 2025 14:22:00 +0900"
국정기획위원회,시민단체들 &quot;李정부 '돌봄예산' 삭감…사업은 이해하고 있나&quot;,보건복지위원회도 이를 일부 반영해 995억원이 증액된 1771억원을 의결해 예산결산위원회에 넘겼다. 그러나... 123개 국정과제의 하나(과제 78번)로 채택했다. 시민단체들은 &quot;기획재정부와 보건복지부는 국민의 절박한... ,http://www.inews24.com/view/1915245,https://n.news.naver.com/mnews/article/031/0000987341?sid=102,"Mon, 08 Dec 2025 14:02:00 +0900"
국정기획위원회,고속철도 경쟁체제 결국 실패…일부 성과에도 9년 만에 통합 추진,"이재명 대통령의 대선공약, 국토교통부 장관 인사청문회, 국정기획위원회 논의, 세 차례의 장관 주재 간담회를 거치며 고속철도 통합 방향성은 이미 공감대로 자리 잡았다. 국토부는 이를 토대로 2026년까지 완전 통합을... ",https://www.etoday.co.kr/news/view/2533797,https://www.etoday.co.kr/news/view/2533797,"Mon, 08 Dec 2025 14:00:00 +0900"
국정기획위원회,"더불어민주당 전국청년위원회, '청년정책광장·제1회 전국 청년위원장 ...","또한, 김민석 국무총리와 정청래 당대표가 참석하여  각각 K-국정설명회와 정치 역량 강화 특강을 진행했다.... 출발점으로 기획되었다. 전국 17개 시·도당·254개 지역위원회 청년위원장과 청년 지방의원을 총망라하는... ",https://www.tournews21.com/news/articleView.html?idxno=122989,https://www.tournews21.com/news/articleView.html?idxno=122989,"Mon, 08 Dec 2025 13:58:00 +0900"
국정기획위원회,[단독] 적십자회비 받는 기관의 은폐: 부당한 '휴게시간 수당' 환수 안 ...,김 회장의 인종차별 발언이 알려진 건 지난 10월 30일 열린 보건복지위원회 국정감사에서였다. 논란은... 대한적십자사는 2016년 6월 '혈액 기획관리업무 추진실태 특정감사 결과'를 근거로 그해 11월 25일 전국 15개 혈액원... ,https://www.thescoop.co.kr/news/articleView.html?idxno=308283,https://n.news.naver.com/mnews/article/665/0000006319?sid=102,"Mon, 08 Dec 2025 13:36:00 +0900"
국정기획위원회,기획재정부 조직분리안 윤곽…예산 떼고 ‘컨트롤타워’ 가능할까,"지난 6월 국정기획위 보고에서도 기재부는 AI·반도체 등 전략산업 투자 확대, AI 데이터센터 세제지원... 금융위원회는 150조원 규모 국민성장펀드 운용 방안과 정책서민금융상품 금리 인하 및 지원 확대, 청년미래적금 등... ",https://www.naeil.com/news/read/570212?ref=naver,https://www.naeil.com/news/read/570212?ref=naver,"Mon, 08 Dec 2025 13:08:00 +0900"
국정기획위원회,"리더십·윤리·청렴도 하위권 고착…최연혜 3년, 조직 신뢰는 '없다' [최...","최연혜 한국가스공사 사장이 부임한 2022년 리더십·전략기획 등급은 D+로 한단계, 윤리경영 등급도 E+로... 사진은 지난해 최연혜 한국가스공사 사장이 국회 산업통상자원중소벤처기업위원회 국정감사에서 업무... ",https://www.straightnews.co.kr/news/articleView.html?idxno=288651,https://www.straightnews.co.kr/news/articleView.html?idxno=288651,"Mon, 08 Dec 2025 12:58:00 +0900"
국정기획위원회,김현 의원 &quot;2026년 정부예산 안산지역 주요 현안 사업비 4858억 원 반영 ...,"국회 과학기술정보방송통신위원회 더불어민주당 간사인 김현(경기 안산시을) 국회의원은 2026년도... 가속화라는 국정기조를 반영해 전면 재편되었다. 지역사랑상품권 1조1500억 원, AI 3강 선도 전략을 위한 약 10조 원... ",https://www.thereport.co.kr/news/articleView.html?idxno=80074,https://www.thereport.co.kr/news/articleView.html?idxno=80074,"Mon, 08 Dec 2025 12:38:00 +0900"
국정기획위원회,[디플정위 천일야화②] 혜택알리미·AI 가이드라인·거버텍 생태계 구축...,대통령 직속 디지털플랫폼정부위원회가 지난달 공식 폐지됐다. 2022년 9월 2일 출범 이후 1159일 동안 데이터... AI·데이터 등 첨단기술을 활용해 정부의 일하는 방식을 혁신하고 과학적인 국정운영을 실현하는 것이... ,https://www.newsworks.co.kr/news/articleView.html?idxno=821969,https://www.newsworks.co.kr/news/articleView.html?idxno=821969,"Mon, 08 Dec 2025 12:00:00 +0900"
국정기획위원회,"李대통령, 지방시대委 업무보고…‘5극 3특’ 지방성장 전략 논의",올 한 해 정책성과를 정리하고 내년 국정운영 방향을 확정하기 위한 절차로 국정운영의 투명성을 높이기... 이 대통령은 아울러 오는 11일부터 기획재정부를 시작으로 19부 5처 18청 7위원회를 포함한 228개 공공기관및... ,https://biz.heraldcorp.com/article/10631803?ref=naver,https://n.news.naver.com/mnews/article/016/0002568758?sid=100,"Mon, 08 Dec 2025 11:42:00 +0900"
국정기획위원회,KT 차기 CEO 7인 윤곽…李캠프 출신 주형철 급부상에 '낙하산' 논란,"그는 SK텔레콤과 SK커뮤니케이션즈에서 경력을 시작해 문재인 정부 청와대 경제보좌관, 경기연구원장, 이재명 캠프 정책본부 부본부장, 국정기획위원회 경제분야 담당 등을 지내며 기술과 정책 모두에 대한 이해도를... ",https://www.esgeconomy.com/news/articleView.html?idxno=13726,https://www.esgeconomy.com/news/articleView.html?idxno=13726,"Mon, 08 Dec 2025 11:36:00 +0900"
국정기획위원회,[2025결산/종합] 보안·통상·규제 삼중고…한국 산업 생존전략 다시 쓰...,역시 국정감사장에서 보안 관리와 보고체계를 놓고 강한 질타를 받았다. ‘보안’은 이제 통신사의 경영... 방송미디어통신위원회(방미통위) 출범 준비다. 오랜 공백 끝에 방미통위 구성 작업이 본격화됐고 이재명... ,https://www.ddaily.co.kr/page/view/2025120710123370033,https://n.news.naver.com/mnews/article/138/0002211793?sid=105,"Mon, 08 Dec 2025 10:55:00 +0900"
국정기획위원회,"李대통령, 오늘 지방시대委 업무보고…‘5극 3특’ 전략 논의",지방시대위부터 업무보고 시작… 각 부처 보고 이어져 정책성과 정리하고 국정운영 방향 확정하기 위한... 이 대통령은 아울러 오는 11일부터 기획재정부를 시작으로 19부 5처 18청 7위원회를 포함한 228개 공공기관및... ,https://biz.heraldcorp.com/article/10631661?ref=naver,https://n.news.naver.com/mnews/article/016/0002568655?sid=100,"Mon, 08 Dec 2025 10:50:00 +0900"
국정기획위원회,"김현 민주당 의원, 신안산선 사업 등 예산확보…의정활동 전력다해","김현 더불어민주당 국회의원(안산시을, 국회 과학기술정보방송통신위원회 간사)은 2026년도 예산안에서 총... 가속화라는 국정기조를 반영해 전면 재편되었다. 지역사랑상품권 1조 1,500억 원, AI 3강 선도 전략을 위한 약... ",https://www.viva100.com/article/20251208500491,https://www.viva100.com/article/20251208500491,"Mon, 08 Dec 2025 10:40:00 +0900"
국정기획위원회,"민주당의 내란 청산, 새로운 민주주의로 나아가고 있는가[인권으로 읽는...",'국민주권정부'를 내걸고 국민통합을 이루겠다고 선언한 새 정부의 국정기조 역시 비상계엄과 내란을 멈춰... 쇄신기구 '새로고침위원회'가 발간한 보고서에는 한국사회 민주주의 위기와 더불어민주당 위기의 전조가... ,https://www.pressian.com/pages/articles/2025120809081363331?utm_source=naver&utm_medium=search,https://n.news.naver.com/mnews/article/002/0002417714?sid=102,"Mon, 08 Dec 2025 10:32:00 +0900"
국정기획위원회,"닻 올린 이재명 정부 '의료개혁', 성과 위해 해야 할 일[시민건강논평]","위원회 규정에 따르면, 정부위원으로 기획재정부∙행정안전부∙보건복지부 장관이 참여하고(제3조), 분야별... 윤석열 정부의 의대증원 사태는 국정 최고책임자의 정치적 오판일 뿐만 아니라, 불합리하고 독단적인... ",https://www.pressian.com/pages/articles/2025120809054687516?utm_source=naver&utm_medium=search,https://n.news.naver.com/mnews/article/002/0002417713?sid=102,"Mon, 08 Dec 2025 10:31:00 +0900"
국정기획위원회,"충북도, 정부 예산 9조7144억원 확보... 올해 대비 7.8% 증가",위원회 예산소위에 충북 출신 의원이 없어 불리한 여건이었지만 충북이 제안한 주요 사업들이 국정기조와... AI 기반 항체의약품 개발을 지원할 청주 오송 AI 바이오 데이터센터 구축 사전기획 용역비 5억원도 포함됐다.... ,https://www.ccdailynews.com/news/articleView.html?idxno=2383577,https://www.ccdailynews.com/news/articleView.html?idxno=2383577,"Mon, 08 Dec 2025 10:24:00 +0900"
국정기획위원회,바람보다 먼저 눕는 감사원은 누가 감사하나 [視리즈],"6월), ▲국민권익위원회 감사(2022년 10월) 등은 달랐다. 감사원은 이들 감사 후 모조리 '검찰 고발'이 아닌... 대통령비서실 국정기획수석에게 '감사원 해명자료 배포 예정' 관련 문자메시지를 보냈는데, 그것이 모 언론사... ",https://www.thescoop.co.kr/news/articleView.html?idxno=308284,https://n.news.naver.com/mnews/article/665/0000006318?sid=102,"Mon, 08 Dec 2025 10:10:00 +0900"
국정기획위원회,KT 새 수장 레이스 막판… 내부 출신 3파전 vs 외부 인사 변수,지난해 더불어민주당에서 활동했고 이재명 대통령 당선 후 국정기획위원회 경제2분과 위원을 맡았다. SK커뮤니케이션즈 재직 당시 네이트·싸이월드 개인정보 유출 사태로 논란이 있지만 당시 '고객정보보호... ,https://www.pointdaily.co.kr/news/articleView.html?idxno=283611,https://www.pointdaily.co.kr/news/articleView.html?idxno=283611,"Mon, 08 Dec 2025 09:58:00 +0900"
국정기획위원회,"李대통령, 지방시대위원회 업무보고로 '5극 3특' 균형발전 전략 점검 착...","단계로, 국정과제 중 하나인 지방분권·균형발전 정책을 우선 점검한다는 의미를 담고 있다. 대통령실에 따르면 이 대통령은 이날 오후 2시 용산 대통령실에서 열리는 '지방시대위원회 보고회'에 참석한다. 회의에서는... ",https://www.pointdaily.co.kr/news/articleView.html?idxno=283584,https://www.pointdaily.co.kr/news/articleView.html?idxno=283584,"Mon, 08 Dec 2025 09:04:00 +0900"
국정기획위원회,사법개혁부터 비밀유지권 법안 발의까지… '격변의 해' 2025년 법조신문...,변협은 국정기획위원회를 찾아 변호사 비밀유지권 등을 포함한 사법제도 개선안을 국정과제로 공식 제안하기도 했다. 국정기획위원회는 이재명 정부의 향후 5년 국정운영 계획을 수립하기 위해 6월 16일 출범했다.... ,https://news.koreanbar.or.kr/news/articleView.html?idxno=34700,https://news.koreanbar.or.kr/news/articleView.html?idxno=34700,"Mon, 08 Dec 2025 09:00:00 +0900"
국정기획위원회,[시민건강논평] 국민참여 의료혁신위원회에 바란다,"위원회 규정에 따르면, 정부위원으로 기획재정부∙행정안전부∙보건복지부 장관이 참여하고(제3조), 분야별... 윤석열 정부의 의대증원 사태는 국정 최고책임자의 정치적 오판일 뿐만 아니라, 불합리하고 독단적인... ",https://www.rapportian.com/news/articleView.html?idxno=229866,https://www.rapportian.com/news/articleView.html?idxno=229866,"Mon, 08 Dec 2025 08:38:00 +0900"
국정기획위원회,"기관장 평가 부활에 맞춘 실적보고서 대응… 한국공공기관연구원, 12월...","기획재정부는 2025년 9월 공공기관운영위원회에서 2025년도 공공기관 경영평가편람 수정안을 의결하며, 이재명 정부 국정과제인 공공기관 경영혁신·공공성 강화 기조에 맞춰 ‘기관장 경영계약 이행실적 평가(기관장... ",https://dhnews.co.kr/news/view/1065578428837638,https://dhnews.co.kr/news/view/1065578428837638,"Mon, 08 Dec 2025 08:04:00 +0900"
국정기획위원회,"[2025년 12월 8일 총리·장차관 주요 일정] 구윤철 부총리, 한-우즈벡 경...",▲ 구윤철 부총리 겸 기획재정부 장관 08:00 제28차 재정집행점검회의(정부서울청사) 13:30 제6차 미래전략... 법제사법위원회 전체회의 참석 ▲ 김남중 차관 13:30 통일부-한국정치학회 공동세미나. 환영사... ,https://www.mediapen.com/news/view/1064460,https://www.mediapen.com/news/view/1064460,"Mon, 08 Dec 2025 08:04:00 +0900"
국정기획위원회,"[더벨][KT 차기 리더는]주형철 전 대표, 유일한 외부 출신 후보 '친정부...","최근까지 국정기획위원회 위원으로 일한 주 전 대표는 여권, 당국 핵심 인사와의 직접적인 소통창구란 큰 무기를 가지고 있다. 주 전 대표가 현 정부의 정책 설계에 직접 관여했던 것도 KT 대표 후보로서 큰 장점으로... ",https://www.thebell.co.kr/free/content/ArticleView.asp?key=202512051028054240108759,https://www.thebell.co.kr/free/content/ArticleView.asp?key=202512051028054240108759,"Mon, 08 Dec 2025 07:48:00 +0900"
국정기획위원회,'AI 3강 도약'에서 빠지지 말아야 할 것 '사람과 노동',국정과제 등을 살펴봤을 때 AI 산업과 투자에 대한 이야기는 많은데 노동은 상대적으로 이야기가 없다. 기본적 프레임은 (정권 교체 이후에도) 달라진 게 없다. 이러한 불균형에 대해 AI 문제를 다루는 국가 차원의 위원회... ,https://www.labortoday.co.kr/news/articleView.html?idxno=231596,https://www.labortoday.co.kr/news/articleView.html?idxno=231596,"Mon, 08 Dec 2025 07:36:00 +0900"
