Keyword,Title,Description,Original Link,Link,Publication Date
관료,트럼프가 임명하고 그에 맞섰던 파월 연준의장 '미완의 퇴장'(종합),"내달 의장 임기종료 후 이사직 당분간 유지키로…'보복' 우려한듯 투자은행·재무관료 출신 보수적 성향에도 '反트럼프' 이미지 남겨 트럼프와 충돌한 '사상 초유'의 마지막 1년, 美중앙은행 '고난기'로 (워싱턴=연합뉴스)... ",https://www.yna.co.kr/view/AKR20260430003451071?input=1195m,https://n.news.naver.com/mnews/article/001/0016051575?sid=104,"Thu, 30 Apr 2026 06:09:00 +0900"
관료,[뉴욕증시] 에너지 공급 장기화 우려…빅테크 기업 호실적 낙관↑,"트럼프는 행정부 관료들과 최근 정유업계 임원들을 비공개로 만나 중동전쟁으로 인한 에너지 시장의 파장, 대응책 등을 논의했고 미 온라인매체 악시오스 등은 보도했다. 이 자리에서 이란 해상 봉쇄가 수개월 더... ",http://www.hansbiz.co.kr/news/articleView.html?idxno=836222,http://www.hansbiz.co.kr/news/articleView.html?idxno=836222,"Thu, 30 Apr 2026 06:08:00 +0900"
관료,"‘트럼프 압박’ 맞선 파월 연준의장, 다음달 의장직만 물러나며 “이사...","투자은행·재무관료 출신 보수적 인사…트럼프가 의장 임명 트럼프 2기서 금리인하 압박, 연준 독립성 위기 겪어 사상 초유 연준 의장 수사까지…美중앙은행 ‘고난기’ 남은 마지막 1년 다음달 의장 임기 끝나도 이사직... ",https://biz.heraldcorp.com/article/10728841?ref=naver,https://n.news.naver.com/mnews/article/016/0002637526?sid=104,"Thu, 30 Apr 2026 06:01:00 +0900"
관료,[민병두의 job史 (17)] 씨족장과 부족장의 출현,"왕은 씨족장과 부족장이 수행하던 기능이 영토화·관료화·세금화된 결과이다. 국가는 대체로 큰 부족이 더 강하게 중앙집권화되면서 출현하며, 법 집행, 군사력, 공공재정, 폭력의 독점 같은 특징을 갖는다. 왕의 시대가... ",https://www.news2day.co.kr/article/20260428500192,https://www.news2day.co.kr/article/20260428500192,"Thu, 30 Apr 2026 05:42:00 +0900"
관료,AI 로봇·온라인 성착취 기획 돋보여… “솔루션 저널리즘 강화를”[독...,다만 지면에 들어간 ‘계유정란 당시 관료의 연결망’ 그래픽보다는 온라인 기사에 담긴 ‘과거 급제자 중 세도가 비율’ 그래픽이 전체 맥락을 이해하는 데 도움이 됐다. 지면 한계로 담지 못한 그래픽과 데이터를... ,https://www.seoul.co.kr/news/society/2026/04/30/20260430022001?wlog_tag3=naver,https://n.news.naver.com/mnews/article/081/0003639980?sid=102,"Thu, 30 Apr 2026 05:03:00 +0900"
관료,"“대구, 與 오만함에 경계심 커져… 보수의 심장 지키겠다” [6·3선거-후...","35년 경제 관료로 국가 정책과 예산 설계를 했고, 경제부총리로 대한민국 위기를 관리했다. 3선 의원과 원내대표로 정치적 조정과 설득을 체득했다. 추경호가 나서서 단디 하겠다. 취임 즉시 비상경제상황실을 설치할... ",https://www.seoul.co.kr/news/politics/local-election2026/2026/04/30/20260430004003?wlog_tag3=naver,https://n.news.naver.com/mnews/article/081/0003639930?sid=100,"Thu, 30 Apr 2026 05:01:00 +0900"
관료,[인터뷰] 추경호 &quot;권력 한쪽으로 기울어…대구 지켜 균형 바로잡겠다&quot;,▲ 저는 35년간 경제 관료의 길을 걸으며 위기 때마다 해법을 찾아왔다. 경제부총리로서 대한민국의 가계부를 책임졌던 그 경험과 실력을 이제는 대구의 살림을 넉넉하게 만드는 데 모두 쏟아붓겠다. 지금 대한민국은... ,https://www.yna.co.kr/view/AKR20260429155900053?input=1195m,https://n.news.naver.com/mnews/article/001/0016051510?sid=162,"Thu, 30 Apr 2026 05:00:00 +0900"
관료,트럼프가 임명하고 그에 맞섰던 파월 연준의장 '절반의 퇴장',"트럼프발 보복 공포…내달 의장 임기종료후에도 이사직 당분간 유지키로 투자은행·재무관료 출신 보수적 성향에도 '反트럼프' 이미지 남겨 트럼프와 충돌한 '사상 초유'의 마지막 1년, 美중앙은행 '고난기'로 (워싱턴... ",https://www.yna.co.kr/view/AKR20260430003400071?input=1195m,https://n.news.naver.com/mnews/article/001/0016051500?sid=104,"Thu, 30 Apr 2026 04:09:00 +0900"
관료,충청 광역단체장 여·야 대진표 완성,최 시장은 행정안전부와 행정중심복합도시건설청을 거친 관료 출신 현직으로 행정 경험과 시정 연속성을 전면에 세웠다. 개혁신당은 하헌휘(39) 시당창당준비위원장이 예비후보 등록했다. 충북지사 선거는 국민의힘... ,http://www.dynews.co.kr/news/articleView.html?idxno=848819,http://www.dynews.co.kr/news/articleView.html?idxno=848819,"Thu, 30 Apr 2026 01:52:00 +0900"
관료,&quot;4년간 '인프라 구축' 치열한 성과…춘천 초일류도시로 격상시킬 것&quot;,"연구개발특구도 강원도에서 처음에는 강원특별법에 제외했지만 내가 끌고 왔다.&quot; -관료 출신으로 그동안 정부에서 많은 일을 해왔다. &quot;나는 행운아다. 기재부, 청와대 등 국정 전반을 포괄적으로 아우르는 곳에서 일했다.... ",https://www.kado.net/news/articleView.html?idxno=2047779,https://n.news.naver.com/mnews/article/654/0000178443?sid=102,"Thu, 30 Apr 2026 00:10:00 +0900"
관료,'특보단 1783명' 외연 확장,"심기준 전 국회의원을 비롯해 전직 선출직과 양민석 전 도체육회 사무처장, 장철규 전 도 경제진흥국장 등 관료 출신, 기업·법률·체육·농업·민간 등 다양한 분야 인사들이 참여한 것이 특징이다. 캠프는 이들을... ",https://www.kado.net/news/articleView.html?idxno=2047789,https://n.news.naver.com/mnews/article/654/0000178453?sid=100,"Thu, 30 Apr 2026 00:10:00 +0900"
관료,"美국방 &quot;한국, 국방지출 늘리는 모범동맹…특별호의 받을것&quot;","5% 수준까지 확대하기로 했고, 전시작전통제권 전환도 추진하고 있다. 이에 미 국방부 고위관료들은 한국을 여러차례 모범 동맹으로 언급했는데, 헤그세스 국방장관이 이러한 수사를 반복한 것이다．",https://www.newsis.com/view/NISX20260429_0003612221,https://n.news.naver.com/mnews/article/003/0013918377?sid=104,"Wed, 29 Apr 2026 23:29:00 +0900"
관료,&quot;종전 협상 둘러싸고 이란 강경파 이례적 분열 양상&quot;,"그러면서 &quot;그런 메시지가 없다면, 이는 100% '관료들의 선동'이며, 모든 발언은 쿠데타 기획자가 직접 작성한 것&quot;이라고 갈리바프를 겨냥해 주장했다. 이러한 갈등은 강경 매체들의 충돌로 확산했다. 라자 뉴스와 타스님... ",https://www.newsis.com/view/NISX20260429_0003612191,https://n.news.naver.com/mnews/article/003/0013918366?sid=104,"Wed, 29 Apr 2026 22:40:00 +0900"
관료,"김부겸 &quot;대구, 31년 만의 변화&quot; 호소...&quot;시민들에게 행정의 효능감 느끼...","김부겸: 지금 대구에 필요한 시장은 단순한 경제 관료가 아니다. 중앙정부를 움직이고, 여당의 힘을 끌어내고, 대구의 숙원 사업을 실제로 풀어낼 수 있는 시장이다. 대구는 지금 신공항, 산업 대전환, 행정통합, 청년... ",https://www.pn.or.kr/news/articleView.html?idxno=33573,https://www.pn.or.kr/news/articleView.html?idxno=33573,"Wed, 29 Apr 2026 22:08:00 +0900"
관료,[지선 : TK리부트] “절박함 위에 선 대구 민심”···김부겸이 내놓은...,"지금 대구에 필요한 시장은 단순한 경제 관료가 아니다. 중앙정부를 움직이고, 여당의 힘을 끌어내고, 대구의 숙원 사업을 실제로 풀어낼 수 있는 시장이다. 대구는 지금 신공항, 산업 대전환, 행정통합, 청년 일자리... ",https://www.newsmin.co.kr/news/131937/,https://www.newsmin.co.kr/news/131937/,"Wed, 29 Apr 2026 22:02:00 +0900"
관료,"백악관에서 일어난, 트럼프 암살 미수 사건 : 자작극 이야기가 나오는 ...","출처- 트럼프 행정부의 고위 관료들은 테이블 아래로 숨었다. 나중에 밝혀진 사실이지만, 트럼프 행정부는 사건 당시 ‘지정생존자’를 정해두지 않은 상태였다. ‘지정생존자’는 전쟁이나 국가적 위기 상황에서... ",http://www.ddanzi.com/880062412,http://www.ddanzi.com/880062412,"Wed, 29 Apr 2026 21:30:00 +0900"
관료,추경호 &quot;기울어진 권력 균형추…대구서 보수 재건 시작&quot;,특히 경제 관료 출신답게 &quot;보수의 경제적 유능함을 성과로 증명해 시민들의 기대에 보답하겠다&quot;는 의지를 분명히 했다. 지역구 주민들을 향해서는 '달성 사람 추경호'를 강조하며 정서적 유대를 호소했다. 그는 &quot;떠나는... ,https://www.idaegu.co.kr/news/articleView.html?idxno=546724,https://www.idaegu.co.kr/news/articleView.html?idxno=546724,"Wed, 29 Apr 2026 21:24:00 +0900"
관료,"[6·3 인물] &quot;여수, 행정만 있고 경영이 없었다.&quot;","행정가들 충분히 있었고 관료들 넘쳐났습니다. 없었던 게 있습니다. 행정과 경영, 지방자치는 살림인데 경영이 없었어요. 시민 여러분의 결단만이 여수를 살릴 수 있었습니다. [최황지 기자] 네 후보님 인터뷰 여기까지... ",https://ysmbc.co.kr/NewsArticle/1516544,https://ysmbc.co.kr/NewsArticle/1516544,"Wed, 29 Apr 2026 21:12:00 +0900"
관료,“백지화된 부·울·경 메가시티 복원…도민에게 진 빚 갚겠다”,"“관료 스타일대로 안정적으로 무난하게 관리해왔다. 그러나 인공지능(AI) 전환기인 지금 무난한 관리는 오히려 마이너스다. 정치인이 가진 과감한 상상력으로 지역을 혁신해야 한다. 국회의원과 도지사, 국정을 두루... ",https://www.khan.co.kr/article/202604292103005,https://n.news.naver.com/mnews/article/032/0003442978?sid=100,"Wed, 29 Apr 2026 21:03:00 +0900"
관료,中 '금융당국 수장' 리윈쩌 강등된 듯…사정 칼날 금융권 정조준,홈페이지 지도부 소개서도 사라져…고위 금융관료 잇단 조사·낙마 김현정 특파원 = 중국의 금융 규제 체계 개편 이후 초대 수장을 맡았던 리윈쩌 국가금융감독관리총국(NFRA) 총국장이 규율 위반 혐의로 강등된 것으로... ,https://www.yna.co.kr/view/AKR20260429183000083?input=1195m,https://n.news.naver.com/mnews/article/001/0016051351?sid=104,"Wed, 29 Apr 2026 20:55:00 +0900"
관료,‘행정’ 넘어 ‘주권’ 통합…통합특별시 시민청·시민국 제안,지정 토론자로 참여한 기우식 광주 시민단체협의회 정책위원장과 김석 전남 시민사회연대회의 운영위원 등은 행정 중심의 통합 논의가 자칫 관료주의의 비대화로 이어질 수 있음을 경계했다. 토론에 나선 기우식... ,http://www.kwangju.co.kr/article.php?aid=1777463100798383277,http://www.kwangju.co.kr/article.php?aid=1777463100798383277,"Wed, 29 Apr 2026 20:48:00 +0900"
관료,"백승주 민주연구원 부원장 &quot;전남·광주 통합, 대한민국 균형발전 선도할...",부원장님께서는 30년 동안 경제와 재정 분야에 몸을 담아오신 정통 관료 출신이신데요. 우리 광주·전남과 어떤 인연이 있으실까요? ▲ 백승주 부원장: 네 어떤 인연이라고 말씀하셨는데 사실 그 이상입니다. 저는 지역... ,https://www.ikbc.co.kr/article/view/kbc202604290066,https://n.news.naver.com/mnews/article/660/0000108406?sid=100,"Wed, 29 Apr 2026 20:02:00 +0900"
관료,"주광덕 남양주시장, 예비후보 등록…본격적인 선거 운동에 돌입","최 후보는 행정고시 출신으로 중앙정부와 경기도 주요 부서를 거친 뒤 경기도 경제실장과 남양주시 부시장을 역임한 관료 출신이다. 판교테크노밸리 조성 설계 참여, 남양주 부시장 재임 경험 등 대형 정책과 지역 행정을... ",https://www.pressian.com/pages/articles/2026042919401196833?utm_source=naver&utm_medium=search,https://n.news.naver.com/mnews/article/002/0002439756?sid=102,"Wed, 29 Apr 2026 19:44:00 +0900"
관료,[세상읽기] 지역을 소멸시키는 것은 권력의 선택이다,지역의 가능성을 믿지 않고 스스로를 주변부로 밀어내는 선택을 반복해 온 공공기관과 관료주의다. 문화예술... 결국 지금의 선택은 문화적 판단이 아니라 책임 회피를 위한 관료적 계산이다. 하지만 그 대가는 고스란히... ,http://www.kookje.co.kr/news2011/asp/newsbody.asp?code=1700&key=20260430.22018008211,https://n.news.naver.com/mnews/article/658/0000142450?sid=110,"Wed, 29 Apr 2026 19:25:00 +0900"
관료,[Review] 굴욕이라는 이름의 전쟁 - 굴욕 [도서],"그러면서 전에 읽은 작품들이 떠올랐다.프란츠 카프카의 걸작 &lt;소송&gt;은 정체를 알 수 없는 소송에 휘말린 K의 이야기로, 그는 관료제의 부조리 때문에 여기저기 불려만 다니다가 최후를 맞이한다. (미완성 장은 제외하고)... ",https://www.artinsight.co.kr/news/view.php?no=80695,https://www.artinsight.co.kr/news/view.php?no=80695,"Wed, 29 Apr 2026 19:04:00 +0900"
관료,"트럼프 처음 참석한 백악관 기자단 만찬, 총격에 아수라장","그가 범행 직전 가족에게 보낸 ‘선언문(manifesto)’에는 트럼프 대통령을 비롯한 고위직 관료를 표적으로 삼겠다는 뜻이 담겨 있었다. 미국 검찰은 4월 27일 앨런을 대통령 암살미수, 중범죄 의도 무기 운반, 총기 사용 등... ",https://weekly.donga.com/3/all/11/6205996/1,https://n.news.naver.com/mnews/article/037/0000038077?sid=104,"Wed, 29 Apr 2026 19:02:00 +0900"
관료,AI가 바꾼 최초의 전쟁 &quot;지상전 없이 공중에서 끝낸다&quot; [김광수의 참견...,"엄 실장은 &quot;트럼프가 지난해부터 미 방산업계에 '관료주의를 없애라', '무기생산의 불필요한 절차를 줄여라', '수익이 나면 생산라인을 늘리라'며 대량생산과 신속 납기를 주문해온 이유&quot;라고 설명했다. 한국은... ",https://www.hankookilbo.com/news/article/A2026042615120003854?did=NA,https://n.news.naver.com/mnews/article/469/0000928321?sid=100,"Wed, 29 Apr 2026 19:00:00 +0900"
관가뒷담,[관가뒷담] 부총리도 안 한 대국민 타운홀미팅 한 ‘4선’ 기획처 장관,세종 관가가 박홍근 기획예산처 장관의 파격 행보에 술렁이고 있다. 28일 서울에서 ‘국민과 함께 만드는... 관가는 흥미 어린 시선을 보내고 있다. 경제 수장인 부총리도 시도한 적 없는 대국민 직접 소통에 기획예산처... ,https://www.kmib.co.kr/article/view.asp?arcid=0029747465&code=61141111&cp=nv,https://n.news.naver.com/mnews/article/005/0001846048?sid=101,"Wed, 29 Apr 2026 05:02:00 +0900"
박수영,"&quot;'임핀지-이뮤도' 병용요법, 진행성 간암 치료 지속가능성 높여&quot;","메디파나뉴스는 최근 박수영 경북대학교병원 소화기내과 교수를 만나 기존 간세포암의 치료 환경과 미충족 수요, 새로운 면역치료 전략인 STRIDE 요법의 임상적 혜택과 도입 의미 등에 대해 얘기를 나눴다. 박수영 교수는... ",https://www.medipana.com/news/articleView.html?idxno=410607,https://www.medipana.com/news/articleView.html?idxno=410607,"Thu, 30 Apr 2026 06:06:00 +0900"
박수영,[단독] 규제 사각지대 '무니코틴' 역대급 물량 수입됐다,"위험성을 가지고 있다고 생각합니다.] 법망을 피한 시장은 더 커져가는데, 안전성에 대한 검증은 미흡한 상황입니다. [자료제공 박수영 국민의힘 의원실] [영상취재 김재식 조용희 정철원 영상편집 오원석 영상디자인 김관후]",https://news.jtbc.co.kr/article/NB12296353?influxDiv=NAVER,https://n.news.naver.com/mnews/article/437/0000489529?sid=102,"Wed, 29 Apr 2026 20:35:00 +0900"
박수영,'면전 쓴소리 후' 장동혁 행보…당대표 '존재감'이 점점,"[장동혁/국민의힘 대표 : 지방 부동산에 대한 DSR 규제를 단계적으로 완화하여 대출 한도를 늘리고 실수요자의 주택 구입 기회를 확대하겠습니다.] 박수영 중앙 공약 개발단장 등 복수의 의원들이 참석할 예정이었지만, 다른... ",https://news.jtbc.co.kr/article/NB12296375?influxDiv=NAVER,https://n.news.naver.com/mnews/article/437/0000489518?sid=162,"Wed, 29 Apr 2026 20:15:00 +0900"
박수영,&quot;수도권 블랙홀 방치하면 공멸&quot; 비수도권 &quot;지역별 차등세제를&quot;,130여명이 참석한 이날 포럼은 임이자·구자근·박수영·정태호·천하람·허성무 의원이 비수도권상공회의소협의회와 함께 주최했다. 더불어민주당 허성무 의원(창원 성산구)은 인사말에서 &quot;법인세와 근로소득세의 지역... ,https://www.gnnews.co.kr/news/articleView.html?idxno=636067,https://www.gnnews.co.kr/news/articleView.html?idxno=636067,"Wed, 29 Apr 2026 19:56:00 +0900"
박수영,정치색 없다는데…교육감 선거 진영 프레임 반복,한 학부모는 &quot;교육감 선거는 미래 세대를 이끌 아이들의 교육 방향을 결정하는 중요한 선거&quot;라며 &quot;반복되는 진영 대결을 넘어 유권자가 체감할 수 있는 현실성 있는 교육 정책을 내놔야 한다&quot;고 말했다.박수영 기자,https://www.joongdo.co.kr/web/view.php?key=20260429010008886,https://www.joongdo.co.kr/web/view.php?key=20260429010008886,"Wed, 29 Apr 2026 17:40:00 +0900"
박수영,“세금 깎아 기업·청년 붙잡아야”… 국회 온 상공인들 ‘차등 세제’...,비수도권상공회의소협의회(비상협)는 이날 임이자·정태호·박수영·구자근·천하람·허성무 등 여야 국회의원 6명과 공동으로 ‘국가균형발전을 위한 비수도권 세제 개편 포럼’을 열었다. 포럼의 핵심은 명확했다.... ,https://www.chosun.com/national/2026/04/29/R2574IPYQBAITN22ZIT5TPFYJ4/?utm_source=naver&utm_medium=referral&utm_campaign=naver-news,https://n.news.naver.com/mnews/article/023/0003973775?sid=102,"Wed, 29 Apr 2026 17:28:00 +0900"
박수영,"창원상공회의소, 비수도권 5개 권역, 국회서 입법 촉구","비수도권상공회의소협의회는 29일 오후 2시 국회의원회관 제2소회의실에서 임이자, 정태호, 박수영, 구자근, 천하람, 허성무 의원과 공동으로 ‘국가균형발전을... ",http://www.breaknews.com/1204098,http://www.breaknews.com/1204098,"Wed, 29 Apr 2026 16:14:00 +0900"
박수영,비수도권 상공인 국회 찾아 &quot;비수도권 차등적용 세제개편 조속통과 촉구...,"임이자, 정태호, 박수영, 구자근, 천하람, 허성무 의원 등 6명과 공동으로 개최한 이번 포럼은 수도권 일극주의와 지방소멸 위기를 극복하고, 비수도권 지역으로의 기업 투자 확대와 청년 인재 유입을 유인할 수 있는... ",https://www.hankyung.com/article/202604295827h,https://n.news.naver.com/mnews/article/015/0005281262?sid=101,"Wed, 29 Apr 2026 15:43:00 +0900"
박수영,"장동혁 대표, 국회서 '지역경제·민생 공약' 발표…청년 간담회로 현장...","이날 행사에는 정점식 정책위의장과 박수영 중앙공약개발단장, 박성민 국회 산업통상자원중소벤처기업위원회 야당 간사, 이종욱 국회 국토교통위원회 야당 간사 등 당 정책라인 인사들이 참석해 공약 설명에 힘을 보탠다.... ",https://www.fntoday.co.kr/news/articleView.html?idxno=383388,https://www.fntoday.co.kr/news/articleView.html?idxno=383388,"Wed, 29 Apr 2026 11:18:00 +0900"
박수영,"박수영 의원 &quot;李대통령 공정수당, 장기근속자·베테랑에 대한 역차별&quot;",박수영 국민의힘 의원은 이재명 대통령이 추진하는 '공정수당' 정책에 대해 &quot;단기 근로자의 위치가... 박수영 국민의힘 의원. [사진=뉴스핌 DB] 그는 &quot;기업 입장에서는 단기 근로자를 쓸 이유가 사라지는 것&quot;이라며 &quot;이재명... ,https://www.newspim.com/news/view/20260429000199,https://www.newspim.com/news/view/20260429000199,"Wed, 29 Apr 2026 09:25:00 +0900"
박수영,[연합뉴스 이 시각 헤드라인] - 07:30,"정점식 정책위의장, 박수영 중앙공약개발단장 겸 국회 재정경제기획위원회 간사, 박성민 국회 산업통상자원중소벤처기업위원회 야당 간사, 이종욱 국회 국토교통위원회 야당 간사 등이 참석한다.... ",https://www.yna.co.kr/view/AKR20260429015100011?input=1195m,https://n.news.naver.com/mnews/article/001/0016049004?sid=102,"Wed, 29 Apr 2026 07:30:00 +0900"
박수영,"장동혁, 국회서 '지역경제·민생 공약' 발표…청년들과 간담회도","정점식 정책위의장, 박수영 중앙공약개발단장 겸 국회 재정경제기획위원회 간사, 박성민 국회 산업통상자원중소벤처기업위원회 야당 간사, 이종욱 국회 국토교통위원회 야당 간사 등이 참석한다. 장 대표는 오후에는... ",https://www.yna.co.kr/view/AKR20260428174700001?input=1195m,https://n.news.naver.com/mnews/article/001/0016048926?sid=100,"Wed, 29 Apr 2026 05:01:00 +0900"
박수영,교복부터 릴스까지… 대전교육감 후보 이색 홍보 경쟁,화제성 경쟁을 넘어 교육철학과 공약 검증이 병행돼야 한다는 지적이다. 대전의 한 학부모는 &quot;대전교육을 이끌 수장을 뽑는 선거인 만큼 보여주기식 홍보를 넘어 실질적인 교육정책 경쟁이 필요하다&quot;고 말했다.박수영 기자,https://www.joongdo.co.kr/web/view.php?key=20260428010008491,https://www.joongdo.co.kr/web/view.php?key=20260428010008491,"Tue, 28 Apr 2026 18:14:00 +0900"
박수영,"국민의힘, “이재명표 세금폭탄·안보리스크 중단하라”… 총공세",박수영 재정경제기획위원회 간사 (경제 잠재력 하락 및 사회주의 정책 비판) 박수영 간사는 “OECD가 우리나라 잠재성장률을 1.5% 수준으로 전망한 것은 이재명 대통령의... ,http://www.breaknews.com/1203764,http://www.breaknews.com/1203764,"Tue, 28 Apr 2026 16:44:00 +0900"
박수영,"그랜드모먼트 유스호스텔 , 부산국제어린이청소년영화제와 협약",그랜드모먼트 유스호스텔(운영대표 박수영)은 지난 21일 영화의전당 회의실에서... 그랜드모먼트 유스호스텔 박수영 운영대표는 “이번 협약을 계기로 청소년들이 다양한 문화 콘텐츠를 접하고 성장할 수 있는 환경을... ,https://www.busan.com/view/busan/view.php?code=2026042210451596277,https://n.news.naver.com/mnews/article/082/0001378212?sid=102,"Tue, 28 Apr 2026 14:27:00 +0900"
박수영,박수영 의원 &quot;잠재성장률 망가뜨리는 노조주도성장·반기업 정책 폐기해...,박수영 국민의힘 의원은 이재명 대통령의 잠재성장률 3% 공약을 겨냥해 &quot;더 늦기 전에  대한민국 잠재력을... 박수영 국민의힘 의원. [사진=뉴스핌 DB] 그는 잠재성장률 하락 원인으로 이재명 정부의 노조 주도 성장을... ,https://www.newspim.com/news/view/20260428000864,https://www.newspim.com/news/view/20260428000864,"Tue, 28 Apr 2026 14:03:00 +0900"
박수영,노조는 판치고 기업은 손목 비틀기?...정부 노조주도성장 직격한 박수영,국민의힘 박수영 의원이 28일 서울 여의도 국회에서 열린 원내대책회의에 참석했다. 박 의원은 &quot;대한민국의 잠재성장률 하락은 이재명 정권의 노조주도성장 탓&quot;이라며 비판했다. 더퍼블릭,https://www.thepublic.kr/news/articleView.html?idxno=302757,https://www.thepublic.kr/news/articleView.html?idxno=302757,"Tue, 28 Apr 2026 13:22:00 +0900"
박대출,"국힘, 원내대표 조기선출론 부상...지선 코앞인데 마음은 콩밭에?",여기에 박대출(경남 진주시갑) 의원과 이종배(충북 충주시) 의원의 이름도 자천타천으로 나온다. 다만 실제 경선이 치러질 경우 지방선거 결과에 따라 후보 구도 역시 크게 달라질 수 있다는 전망이 우세하다. 한 지도부... ,https://www.mediapen.com/news/view/1096343,https://www.mediapen.com/news/view/1096343,"Wed, 29 Apr 2026 15:54:00 +0900"
박대출,경남 농·축협 조합장 '농협 자율성 수호' 선언문 국회 전달,경남 농·축협 조합장들은 국회를 방문해 국민의힘 박대출(경남 진주갑) 의원과 박상용(밀양·창녕·함안·의령) 의원을 각각 만나 간담회를 갖고 ‘농협 자율성 수호 및 농업현장 의견 반영 촉구 공동선언문’을 전달했다.... ,https://www.newsis.com/view/NISX20260429_0003611040,https://n.news.naver.com/mnews/article/003/0013916610?sid=102,"Wed, 29 Apr 2026 11:07:00 +0900"
박대출,경남 농·축협 조합장 &quot;농협 자율성 수호&quot; 공동선언문 국회 전달,경남 농·축협 조합장이 지난 28일 국회를 방문해 박대출 의원과 박상용 의원을 각각 만나 '농협 자율성 수호 및 농업현장 의견 반영 촉구 공동선언문'을 전달했다. 이번 선언문은 농협법 개정 논의가 진행되는 가운데... ,https://www.nocutnews.co.kr/news/6509976?utm_source=naver&utm_medium=article&utm_campaign=20260429105629,https://n.news.naver.com/mnews/article/079/0004141957?sid=102,"Wed, 29 Apr 2026 10:57:00 +0900"
