Keyword,Title,Description,Original Link,Link,Publication Date
박수영,"법인세율 일괄 인상, 하위구간 ‘변수’…20일 배당소득 분리과세 논의...",박수영 국회 기재위 조세소위원장이 18일 서울 여의도 국회에서 열린 기획재정위원회 조세소위원회를... 국민의힘 소속 박수영 조세소위 위원장은 “과표구간별로 1%p씩 세율을 올렸을 때 세입이 얼마나 늘어나는지를... ,http://www.edaily.co.kr/news/newspath.asp?newsid=05074166642367032,https://n.news.naver.com/mnews/article/018/0006167154?sid=100,"Tue, 18 Nov 2025 19:33:00 +0900"
박수영,'법인세 인상' 여야 이견에 보류…'대기업만 인상' 거론,조세소위원장이자 기재위 야당 간사인 박수영 국민의힘 의원은 이날 회의 이후 기자들과 만나 &quot;각 과표 구간별로 1%P를 올릴 때 세입이 얼마나 늘어나는 지에 대해 (정부가) 다시 계산해 가져오기로 했다&quot;고 말했다.... ,https://www.mt.co.kr/politics/2025/11/18/2025111818485827946,https://n.news.naver.com/mnews/article/008/0005279996?sid=100,"Tue, 18 Nov 2025 19:30:00 +0900"
박수영,"국회 조세소위, ‘年 사업소득 200억 이하 중소기업’ 법인세 인상 제외...",기재위 야당 간사인 박수영 국민의힘 의원은 이날 비공개 조세소위 후 기자들과 만나 “법인세 1%를 올리는 부분에 대해 의원들 안이 다 다르다. 과표구간별로 (상위) 구간 2개를 1% 올리자는 안 등이 있다”며 “각각의... ,https://biz.chosun.com/policy/politics/assembly/2025/11/18/XBKDMJPJ55C4RCE2F5THZUA2AQ/?utm_source=naver&utm_medium=original&utm_campaign=biz,https://n.news.naver.com/mnews/article/366/0001124055?sid=100,"Tue, 18 Nov 2025 19:25:00 +0900"
박수영,"이완섭 서산시장, 내년도 국비 확보 위한 발걸음 '분주'","이날 만난 국회의원은 장동혁·송언석·복기왕·조은희·강승규·박수영·황명선 의원 총 7명이다. 장동혁... 박수영, 황명선 의원과는 국비 반영이 필요한 주요 현안 사업들에 대한 당위성을 설명하고, 이에 대해 공감대를... ",http://www.dtnews24.com/news/articleView.html?idxno=801601,http://www.dtnews24.com/news/articleView.html?idxno=801601,"Tue, 18 Nov 2025 18:00:00 +0900"
정태호,수은 투자규제 완화법 기재소위 통과…'알박기 인사 금지법'은 추가 논...,경제재정소위원회 위원장인 민주당 소속 정태호 의원은 소위 직후 기자들과 만나 &quot;수은법은 이미 통과된 게... 소속 정태호 소위원장을 비롯한 소위원들이 국가재정법 개정안 등 안건을 심사하고 있다. 2025.9.29 utzza@yna.co.... ,https://news.einfomax.co.kr/news/articleView.html?idxno=4384674,https://news.einfomax.co.kr/news/articleView.html?idxno=4384674,"Wed, 19 Nov 2025 13:10:00 +0900"
정태호,수출입은행 20년 규제 풀릴까…'대출 없이도 직접 투자' 국회 소위 통과,"경제재정소위원회 위원장인 민주당 간사 정태호 의원은 소위 직후 기자들과 만나 &quot;수출입은행법은 이미 통과된 게 있었고, 오늘 남아있는 것이 다 통과됐다&quot;고 설명했다. 이날 통과된 개정안의 핵심은 수출입은행이... ",https://www.etoday.co.kr/news/view/2527286,https://www.etoday.co.kr/news/view/2527286,"Wed, 19 Nov 2025 12:36:00 +0900"
정태호,"&quot;국제 정합성 있는 기후공시 제도 논의&quot;... 박상혁, 아시아 기후금융 활...","박상혁의원(더불어민주당, 경기도 김포시을)과 더불어민주당 전현희, 안호영, 위성곤, 이정문, 정태호, 김남근, 김현정, 박정현, 이용우 의원, 조국혁신당 서왕진, 신장식 의원은 서울대학교 환경에너지법정책센터... ",https://www.tournews21.com/news/articleView.html?idxno=121108,https://www.tournews21.com/news/articleView.html?idxno=121108,"Wed, 19 Nov 2025 11:08:00 +0900"
정태호,민주평통 정읍시협의회 제22기 힘찬 출범,이날 행사에는 이학수 시장과 정태호 협의회장을 비롯해 자문위원 60여 명이 참석해 새롭게 구성된 협의회의... 정태호 협의회장 또한 &quot;정읍시협의회의 22기 출범은 지역사회와 소통하며 책임 있는 통일 활동을 펼칠... ,http://www.jeollailbo.com/news/articleView.html?idxno=784273,http://www.jeollailbo.com/news/articleView.html?idxno=784273,"Wed, 19 Nov 2025 09:56:00 +0900"
정태호,한국 대표 뮤지션 총출동,"앞줄 왼쪽부터 김희현(드럼), 웅산(보컬), 김준(보컬), 이정식(색소폰), 한충은(대금). 뒷줄 왼쪽부터 정태호(아코디언), 최우준(기타), 신동하(베이스), 강재훈(피아노), 신동진(드럼). 2025.11.19",https://www.yna.co.kr/view/PYH20251119026400013?input=1196m,https://m.entertain.naver.com/article/001/0015750480,"Wed, 19 Nov 2025 09:27:00 +0900"
정태호,재즈의 결정판 '재즈 올스타즈'의 주역들,"앞줄 왼쪽부터 김희현(드럼), 웅산(보컬), 김준(보컬), 이정식(색소폰), 한충은(대금). 뒷줄 왼쪽부터 정태호(아코디언), 최우준(기타), 신동하(베이스), 강재훈(피아노), 신동진(드럼). 2025.11.19",https://www.yna.co.kr/view/PYH20251119026500013?input=1196m,https://m.entertain.naver.com/article/001/0015750481,"Wed, 19 Nov 2025 09:27:00 +0900"
정태호,'대포폰·발신번호 변작기 원천 차단'… 전기통신사업법 개정안 발의,"이번 개정안에는 대표 발의자인 한정애 의원을 비롯해 박희승, 채현일, 박수현, 송옥주, 강준현, 김윤, 허영, 정준호, 이병진, 강선우, 이재강, 정태호 의원 등 더불어민주당 소속 13명이 참여했다. 한정애 의원은 &quot;범죄는... ",http://www.energydaily.co.kr/news/articleView.html?idxno=161983,http://www.energydaily.co.kr/news/articleView.html?idxno=161983,"Wed, 19 Nov 2025 08:46:00 +0900"
정태호,&quot;음악에는 나이 없어…한국 재즈 활활 타오르고 있죠&quot;,"아코디어니스트 정태호, 이 시대 가장 주목 받는 한국 재즈 뮤지션 마리아킴 등이 그 주인공이다. 이들이... 한국 재즈의 토양을 닦은 1세대 김준·최선배·김희현, 전성기를 연 2세대 웅산·이정식·정태호, 세계를 무대로... ",https://www.yna.co.kr/view/AKR20251118084600005?input=1195m,https://m.entertain.naver.com/article/001/0015750262,"Wed, 19 Nov 2025 07:00:00 +0900"
정태호,"고령교육청, 교육기부 업무 담당자 연수",정태호 교육장은 “MBTI 소통법으로 교육기부가 활성화되는 학교문화 조성을 위해 우리 교육지원청에서는 앞으로도 다양한 방면으로 적극 지원하겠다”라고 덧붙였다.,https://www.ksmnews.co.kr/news/view.php?idx=575409,https://www.ksmnews.co.kr/news/view.php?idx=575409,"Tue, 18 Nov 2025 20:48:00 +0900"
정태호,"여야, '법인세 인상' 이견…과표 하위구간 동결 가능성",국민의힘 소속 박수민(왼쪽) 위원과 더불어민주당 소속 정태호 위원이 대화하고 있다. 2025.2.11 kjhpress@yna.co.kr nkhwang@yna.co.kr 본 기사는 인포맥스 금융정보 단말기에서 2시간 더 빠른 19시 34분에 서비스된 기사입니다.,https://news.einfomax.co.kr/news/articleView.html?idxno=4384539,https://news.einfomax.co.kr/news/articleView.html?idxno=4384539,"Tue, 18 Nov 2025 19:36:00 +0900"
정태호,"법인세율 일괄 인상, 하위구간 ‘변수’…20일 배당소득 분리과세 논의...",기재위 여당 간사인 정태호 의원은 최근 국회 세법개정안 토론회에서 “(국세) 수입을 늘려나가야 하는데 윤석열 정부는 전혀 관심이 없었고 오히려 감면만 있었다”고 비판했다. 또한 법인세 인하 효과가 기업투자로... ,http://www.edaily.co.kr/news/newspath.asp?newsid=05074166642367032,https://n.news.naver.com/mnews/article/018/0006167154?sid=100,"Tue, 18 Nov 2025 19:33:00 +0900"
정태호,"서귀포시, 한국실업최강전 전국태권도대회 개최","이번 대회는 한국실업태권도연맹(회장 박규용)이 주최하고 서귀포시태권도협회(회장 정태호)가 주관하는 이번 대회는 전국 20개 실업팀, 200여명의 선수와 관계자가 참가해 남·여 개인전(체급별 겨루기)과 3인조·5인조... ",https://www.jemin.com/news/articleView.html?idxno=830088,https://www.jemin.com/news/articleView.html?idxno=830088,"Tue, 18 Nov 2025 18:22:00 +0900"
정태호,"기본법 제정 문턱에서, 사회연대경제가 짚어야 할 실행 조건들","△기본소득당 사회연대경제특별위원회 △전국협동조합협의회 △한국사회가치연대기금이 공동주관하고, △한국사회연대경제 △전국광역사회적경제지원센터협의회 △김영배‧복기왕‧용혜인‧윤종오‧정태호‧차규근... ",https://www.lifein.news/news/articleView.html?idxno=19696,https://www.lifein.news/news/articleView.html?idxno=19696,"Tue, 18 Nov 2025 18:06:00 +0900"
기재부,지방공사 지역업체 참여 확대 추진…연간 수주액 3.3조 상승 목표,[사진=기재부] 정부가 지방공사에서 지역 업체의 수주 비율을 높이기 위한 제도 개선 방안을 냈다. 지역에 투입되는 재정이 지역경제 활성화로 직접 이어지도록 공공 발주체계 전반의 지역업체 참여 요건을 한층... ,https://www.koit.co.kr/news/articleView.html?idxno=203685,https://www.koit.co.kr/news/articleView.html?idxno=203685,"Wed, 19 Nov 2025 13:28:00 +0900"
기재부,대외채권 첫 1조1000억달러 돌파…역대 최대,"19일 기획재정부(기재부)가 발표한 '2025년 3분기 대외채권·채무 동향'에 따르면, 이 기간 대외채권은... 기재부 관계자는 &quot;정부는 글로벌 통상환경과 통화정책 변화, 주요국 증시 변동성 확대 등 대외여건이... ",http://www.shinailbo.co.kr/news/articleView.html?idxno=2148898,http://www.shinailbo.co.kr/news/articleView.html?idxno=2148898,"Wed, 19 Nov 2025 13:26:00 +0900"
기재부,3분기 대외채권 1.1조달러 돌파… 해외 채권 투자·외화예금 증가 영향,"기재부는 &quot;3분기 대외채무 증가는 비거주자의 우리 채권에 대한 순투자를 반영한 것&quot;이라며 &quot;7~9월... 기재부는 &quot;글로벌 통상환경과 통화정책 변화, 주요국 증시 변동성 확대 등 대외여건 불확실성 속에서도... ",https://www.moneys.co.kr/article/2025111913200013802,https://n.news.naver.com/mnews/article/417/0001114129?sid=101,"Wed, 19 Nov 2025 13:23:00 +0900"
기재부,&quot;기업 실적 뒷받침되면 주가 더 오를 것…코리아 프리미엄도 가능&quot;,"그래서 저희도 지금 기재부나 한국은행과 계속 점검하고 있는데, 첫 번째, 이게 다시 외환위기가 올 만한 상황이냐? 그건 아니라는 의견이 많더라. 두 번째, 이게 뉴노멀이냐? 최근의 상황은 미국과의 관세협상에 따른... ",https://www.m-joongang.com/news/articleView.html?idxno=401836,https://www.m-joongang.com/news/articleView.html?idxno=401836,"Wed, 19 Nov 2025 13:16:00 +0900"
기재부,지방 활성화 위해 지역입찰 허용금액 150억까지 높인다,기재부는 “대책 발표 직후 시행규칙·계약예규 등 관련 과제를 조속히 개정할 것”이라며 “12월 중 사전 예방교육을 실시하고 입찰담함 모니터링에서 담합 협의 확인 시 엄중 제재할 것”이라고 강조했다. ◆공공조달... ,https://www.naeil.com/news/read/568040?ref=naver,https://www.naeil.com/news/read/568040?ref=naver,"Wed, 19 Nov 2025 13:04:00 +0900"
기재부,'별의 순간' 언급된 한동훈 &quot;론스타 소송 승산없다더니 황당…與 사과하...,"이어 &quot;그때 그걸 주도했던 기재부 관료들을 수사하고 기소했던 당시 검사가 한동훈, 이복현 이런 검사들이었다&quot;면서 &quot;그런 잘못된 부분들부터는 앞으로 다시 재발되지 않도록 하는 그런 조치들, 그런 것들도 중요시하게... ",http://www.joseilbo.com/news/news_read.php?uid=557093&class=32&grp=,https://n.news.naver.com/mnews/article/123/0002372242?sid=100,"Wed, 19 Nov 2025 12:56:00 +0900"
기재부,3분기 대외채권 첫 1조1000억달러 넘어…대외채무 25조 증가,국내 거주자의 해외 채권 투자와 외화 예치금 증가 등으로 증가했다는 게 기재부 설명이다. 대외채권은... 기재부 관계자는 “3분기 중 대외채무 증가는 외국인 등 비거주자의 우리 채권에 대한 순투자(자금 유입)... ,https://www.dt.co.kr/article/12030229?ref=naver,https://n.news.naver.com/mnews/article/029/0002994455?sid=101,"Wed, 19 Nov 2025 12:20:00 +0900"
기재부,사설)권한대행 체제에서 대구의 도약이 이뤄지려면,"김 대행은 국방부·기재부 등 중앙과의 협의를 지속하며 대구·경북의 미래 비전을 언급했지만, 신공항은 단순한 건설사업이 아니라 군 공항 이전, 배후도시 조성, 재정 부담 등 다층적 조정이 필요한 대형 정치사업이다.... ",https://www.idaegu.com/news/articleView.html?idxno=652392,https://www.idaegu.com/news/articleView.html?idxno=652392,"Wed, 19 Nov 2025 12:06:00 +0900"
기재부,[뉴공 아카이브]김용범 대통령실 정책실장: ‘을사늑약’ 될 뻔한 美 관...,"그 이후로는 이제 재경위, 재경부, 금융위, 증선위 그리고 마지막으로 문재인 정부에서 기재부 1차관 하고... 기재부 차관하고 대통령실 정책실장은 다른 거죠.▷김용범 : 그렇습니다. 그래서 뭐 우리 강훈식 실장님하고... ",http://www.ddanzi.com/864472125,http://www.ddanzi.com/864472125,"Wed, 19 Nov 2025 12:04:00 +0900"
기재부,외국인 투자에 3분기 대외채무 7381억달러…&quot;건전성 지표는 개선&quot;,"기재부는 외채 증가 배경으로 올해 3분기 중 외국인 등 비거주자의 우리 채권에 대한 순투자를 꼽았다.... 기재부 관계자는 “글로벌 통상환경 및 통화정책 변화, 주요국 증시 변동성 확대 등 대외여건이... ",http://www.edaily.co.kr/news/newspath.asp?newsid=03788406642367360,https://n.news.naver.com/mnews/article/018/0006167621?sid=101,"Wed, 19 Nov 2025 12:02:00 +0900"
기재부,서학개미 역대급 투자에 3분기 순대외금융자산 258억弗↑,"기재부에 따르면 외채 등에 대한 국내은행의 상환능력을 나타내는 외화유동성 커버리지 비율(LCR)은 3분기말 기준 160.5%로 구제 비율인 80%를 크게 상회했다. 기재부는 &quot;글로벌 통상환경 및 통화정책 변화, 주요국... ",https://news.einfomax.co.kr/news/articleView.html?idxno=4384653,https://news.einfomax.co.kr/news/articleView.html?idxno=4384653,"Wed, 19 Nov 2025 12:02:00 +0900"
기재부,3분기 대외채무 7381억弗…전기 대비 25억 달러↑,"기재부 관계자는 &quot;글로벌 통상환경과 통화정책 변화, 주요국 증시 변동성 확대 등 대외여건이 불확실한 상황에서 우리 경제가 안정적인 흐름을 이어나갈 수 있도록 대외건전성 유지에 만전을 기할 것&quot;이라고... ",https://www.ajunews.com/view/20251119114740503,https://www.ajunews.com/view/20251119114740503,"Wed, 19 Nov 2025 12:02:00 +0900"
기재부,외국인 채권 투자에 3분기 대외채무 7381억 달러,"기재부는 “글로벌 통상환경 및 통화정책 변화, 주요국 증시 변동성 확대 등 대외여건이 불확실한 상황에서 우리 경제가 안정적인 흐름을 이어나갈 수 있도록 대외건전성 유지에 만전을 기할 계획”이라고... ",https://www.dailian.co.kr/news/view/1575068/?sc=Naver,https://n.news.naver.com/mnews/article/119/0003026983?sid=101,"Wed, 19 Nov 2025 12:01:00 +0900"
기재부,美채권 사고 달러 바꾸는 서학개미..3분기 대외채권 40조 늘어 '역대 최...,"김희재 기재부 국제금융과장은 &quot;환율·증시 등의 영향을 받기는 하지만, 올들어 대외채권 증가 추이로 보면 국내 거주자의 미국 등 해외 주식·채권투자 추세가 당분간 이어질 것으로 보인다&quot;고 말했다. 3·4분기... ",http://www.fnnews.com/news/202511191101325362,https://n.news.naver.com/mnews/article/014/0005436702?sid=101,"Wed, 19 Nov 2025 12:01:00 +0900"
기재부,3분기 대외채무 25억弗 증가…외채건전성 지표는 개선,이처럼 대외채무가 증가한 데 대해 기재부는 외국인 등 비거주자의 채권에 대한 순투자가 증가한 점을 반영했다고 봤다. 실제로 3분기 동안 상장채권에 대해 외국인 자금이 3조 2천억 원 유입됐다. 대외채권은... ,https://www.nocutnews.co.kr/news/6430662?utm_source=naver&utm_medium=article&utm_campaign=20251119120058,https://n.news.naver.com/mnews/article/079/0004087551?sid=101,"Wed, 19 Nov 2025 12:01:00 +0900"
기재부,2분기 이어 3분기도 역대 최대 대외채무… 건전성 지표는 개선,기재부 관계자는 “경제 규모가 커지면 대외채권과 채무는 자연스럽게 늘어난다”면서 “채권과 채무 규모보다는 외화보유액 대비 단기외채 비중 등으로 대외건전성을 판단할 수 있다”고 설명했다. 총외채 중... ,https://biz.chosun.com/policy/policy_sub/2025/11/19/OJNU37726BGZ5OX45TKTPQ4RUU/?utm_source=naver&utm_medium=original&utm_campaign=biz,https://n.news.naver.com/mnews/article/366/0001124188?sid=101,"Wed, 19 Nov 2025 12:01:00 +0900"
기재부,3분기 대외채무 7381억달러로 소폭 증가…장기외채↑·단기외채↓,"기재부는 &quot;3분기 대외채무 증가는 외국인 등 비거주자의 우리 채권에 대한 순투자를 반영하고 있다&quot;고... 기재부는 &quot;대외건전성이 견조한 수준을 유지하고 있다&quot;며 &quot;글로벌 통상환경 및 통화정책 변화, 주요국... ",https://www.news1.kr/economy/trend/5980800,https://n.news.naver.com/mnews/article/421/0008613288?sid=101,"Wed, 19 Nov 2025 12:00:00 +0900"
기재부,"대외채무 7,381억달러…외국인 채권 투자 늘며 3분기 25억달러 증가","4%로 규제기준인 80%를 크게 웃돌았다. 기재부 관계자는 &quot;글로벌 통상환경 변화, 주요국 통화정책 전환, 증시 변동성 확대 등 불확실성이 여전한 만큼 대외건전성 관리에 총력을 기울이겠다&quot;고 했다.",https://www.imaeil.com/page/view/2025111911280887820,https://n.news.naver.com/mnews/article/088/0000982146?sid=101,"Wed, 19 Nov 2025 12:00:00 +0900"
기재부,환율 상승 이유 있었네…3분기 대외채권 1.1조 달러 역대 최대,"기재부는 &quot;글로벌 통상환경 및 통화정책 변화, 주요국 증시 변동성 확대 등 대외여건이 불확실한 상황에서 우리 경제가 안정적인 흐름을 이어나갈 수 있도록 대외건전성 유지에 만전을 기할 계획&quot;이라고 전했다.",https://www.newsis.com/view/NISX20251119_0003408631,https://n.news.naver.com/mnews/article/003/0013609470?sid=101,"Wed, 19 Nov 2025 12:00:00 +0900"
기재부,3분기 대외채무 25억달러 늘어 7381억달러…기재부 &quot;건전성 양호&quot;,기재부는 “3분기 중 대외채무 증가는 외국인 등 비거주자의 우리 채권에 대한 순투자(자금 유입)를... 4%로 규제비율인 80%를 크게 상회하는 등 대외건전성이 견조한 수준을 계속 유지하고 있다고 기재부는... ,https://biz.sbs.co.kr/article_hub/20000273099?division=NAVER,https://n.news.naver.com/mnews/article/374/0000475718?sid=101,"Wed, 19 Nov 2025 12:00:00 +0900"
기재부,옥천역세권 개발 언제쯤…타당서조사·기본구상 용역 정지,"배치, 인근 산업단지와 연계한 연구단지와 실증단지 등 복합기능을 할 개발사업을 그렸다. 옥천군 관계자는 &quot;내년 기재부 타당성 재조사 결과가 나오면 옥천역세권 중·장기계획을 단계적으로 추진할 계획&quot;이라고 말했다.",https://www.news1.kr/local/sejong-chungbuk/5981061,https://n.news.naver.com/mnews/article/421/0008613260?sid=102,"Wed, 19 Nov 2025 11:53:00 +0900"
기재부,與김현정 &quot;당 이슈에 대통령 성과 묻힌다는 지적 있어&quot;,그러면서 &quot;그때 그걸 주도했던 기재부 관료들을 수사하고 기소했던 당시 검사가 한동훈·이복현 검사였다&quot;며 &quot;그런 잘못된 부분들부터 앞으로 다시 재발되지 않도록 하는 조치도 중요하게 봐야 한다&quot;고 강조했다.... ,http://www.shinailbo.co.kr/news/articleView.html?idxno=2148786,http://www.shinailbo.co.kr/news/articleView.html?idxno=2148786,"Wed, 19 Nov 2025 11:32:00 +0900"
기재부,국민성장펀드 출범 초읽기… 문화·콘텐츠까지 지원확대,"민간전문가 중심의 9인 체제로 국회 상임위 추천 2인, 금융위·기재부·산업부·중기부·과기정통부·대한상의 추천 각 1인, 산업은행 내부 1인으로 구성된다. 금융위원장이 위촉하며, 심의회는 자금지원 방향·기본정책 등... ",http://www.mhj21.com/170663,http://www.mhj21.com/170663,"Wed, 19 Nov 2025 11:14:00 +0900"
기재부,통화하는 임기근 기재부 2차관,임기근 기획재정부 2차관이 19일 서울 여의도 국회에서 열린 제429회 국회(정기회) 제3차 예산안등조정소위원회에 출석해 전화통화를 하고 있다. 2025.11.19/뉴스1,https://www.news1.kr/photos/7608298,https://n.news.naver.com/mnews/article/421/0008612999?sid=100,"Wed, 19 Nov 2025 10:47:00 +0900"
기재부,"정부, 지역건설사 지원 나서…지역제한경쟁입찰 현재 공공 88억원·지방...",기획재정부는 구윤철 부총리 겸 기재부 장관 주재로 19일 정부세종청사에서 경제관계장관회의를 갖고 이 같은 지방공사 지역업체 참여 확대 방안과 공공조달 개혁 방안 등을 논의했다고 밝혔다. 정부는 비수도권 지역의... ,https://www.viva100.com/article/20251119500505,https://www.viva100.com/article/20251119500505,"Wed, 19 Nov 2025 10:40:00 +0900"
기재부,"與 김현정 &quot;사과 요구한 한동훈, '우리 정부 잘했다' 하면 돼&quot;","이어 &quot;그걸 주도했던 기재부 관료들을 수사하고 기소했던 당시 검사가 한동훈, 이복현 이런 검사들이었다&quot;면서 &quot;그런 잘못된 부분들부터는 앞으로 다시 재발되지 않도록 하는 그런 조치들, 그런 것들도 중요시하게 봐야... ",http://www.inews24.com/view/1908645,https://n.news.naver.com/mnews/article/031/0000982179?sid=100,"Wed, 19 Nov 2025 10:38:00 +0900"
기재부,&quot;론스타 '숟가락' 얹지 마라&quot; 한동훈 직격에…與 반응이,김 대변인은 &quot;그때 론스타는 산업자본이기 때문에 국내 은행을 인수할 수 없었는데도 불구하고 정부에서 허가해 준 데부터 문제가 생긴 것&quot;이라며 &quot;그것을 주도해 기재부 관료들을 수사하고 기소했던 당시 검사가 한동훈... ,http://www.wowtv.co.kr/NewsCenter/News/Read?articleId=A202511190350&t=NN,https://n.news.naver.com/mnews/article/215/0001231464?sid=100,"Wed, 19 Nov 2025 10:29:00 +0900"
기재부,국회 예결위 예산소위 출석한 임기근 기재부 2차관,"임기근 기획재정부 2차관이 19일 국회에서 예산안 조정소위원회 사흘째 심사에 출석해 회의 시작을 기다리고 있다. 예결위 예산소위는 이날 기획재정부, 국세청, 산업통상부, 기후에너지환경부, 고용노동부 등... ",https://www.yna.co.kr/view/PYH20251119051100013?input=1196m,https://n.news.naver.com/mnews/article/001/0015750747?sid=100,"Wed, 19 Nov 2025 10:29:00 +0900"
기재부,김현정 &quot;대통령 순방 때마다 당내 이슈로 성과 묻혀…내부 지적 있었다...,김 원내대변인은 &quot;그때 그걸 주도했던 기재부 관료들을 수사하고 기소했던 당시 검사가 한동훈·이복현 검사였다&quot;고 지적하며 &quot;그런 잘못된 부분들부터 앞으로 다시 재발되지 않도록 하는 조치도 중요하게 봐야 할 영역... ,https://daily.hankooki.com/news/articleView.html?idxno=1298174,https://daily.hankooki.com/news/articleView.html?idxno=1298174,"Wed, 19 Nov 2025 10:26:00 +0900"
기재부,"침체 빠진 '지방 건설' 숨통 틀까…정부, '로컬 우대' 전면 가동","기획재정부와 행정안전부, 국토교통부 등은 19일 정부세종청사에서 구윤철 경제부총리 겸 기재부 장관 주재로 경제관계장관회의를 열고 '지방공사 지역업체 참여 확대방안'을 확정·발표했다. 정부는 지난해 지방 공사... ",https://www.ebn.co.kr/news/articleView.html?idxno=1687376,https://www.ebn.co.kr/news/articleView.html?idxno=1687376,"Wed, 19 Nov 2025 10:20:00 +0900"
기재부,지방 건설사 살린다…지방공사 '150억 미만 지역입찰' 전면 확대,기재부·국토교통부·공정거래위원회가 12월 중 예방교육을 실시하고 조달청·공정위 간 담합정보 공유를 확대한다. 담합이 적발될 경우 입찰참가자격 제한·등록말소·과징금 등 강력한 제재가 이뤄진다. 정부 관계자는... ,https://www.mt.co.kr/economy/2025/11/19/2025111908202065153,https://n.news.naver.com/mnews/article/008/0005280211?sid=101,"Wed, 19 Nov 2025 10:09:00 +0900"
