Keyword,Title,Description,Original Link,Link,Publication Date
이재명,"李대통령, 외국인·최저임금제 언급…&quot;지역경제에 도움되나?&quot;",이재명 대통령이 외국인 노동자 최저임금 문제라는 화두를 꺼냈다. 울산 조선업 현장에서 외국인 노동자... 이재명 대통령이 23일 울산전시컨벤션센터에서 열린 ‘울산의 마음을 듣다’ 타운홀미팅 간담회에서 김정관... ,http://www.edaily.co.kr/news/newspath.asp?newsid=04103286645320672,https://n.news.naver.com/mnews/article/018/0006206234?sid=100,"Fri, 23 Jan 2026 16:45:00 +0900"
이재명,"코스피, 장중 5000 '터치' 후 오름폭 줄여 4990대 마감",'코스피 5000 특별위원회'가 전날 이재명 대통령과의 오찬에서 디지털 자산을 활용한 코스닥 3000선 달성을 제안했다는 보도가 영향을 끼친 것으로 보인다. 코스닥시장에서 외국인과 기관이 각각 933억원... ,https://www.ziksir.com/news/articleView.html?idxno=121135,https://www.ziksir.com/news/articleView.html?idxno=121135,"Fri, 23 Jan 2026 16:44:00 +0900"
이재명,李대통령 &quot;'5극3특' 재편 과정에 저항 크다… 국민 지지 중요&quot;,이재명 대통령이 23일 울산전시컨벤션센터에서 열린 '울산의 마음을 듣다' 타운홀미팅 간담회에서 참석자들로부터 발언권 요청을 받고 있다. 이재명 대통령은 23일 &quot;'5극 3특' 체제로 재편을 시도하고 있지만 관성과... ,https://www.jeonmae.co.kr/news/articleView.html?idxno=1224389,https://www.jeonmae.co.kr/news/articleView.html?idxno=1224389,"Fri, 23 Jan 2026 16:44:00 +0900"
이재명,이혜훈 후보자 “0%대 성장 지속…적극적 재정 무엇보다 필요”,"그간 재정건전성을 강조해 왔던 이 후보자의 철학이 이재명 정부와 맞지 않는다는 지적에 대해선 “확장이냐 긴축이냐를 결정하는 것은 그때 당시 경제 여건, 재정수지, 통화정책, 물가 등 각종 경제변수를 종합 고려해야... ",https://www.hankyung.com/article/202601239290i,https://n.news.naver.com/mnews/article/015/0005241390?sid=101,"Fri, 23 Jan 2026 16:44:00 +0900"
이재명,&quot;1년 뒤 1400원 아래로&quot;…원화 강세 전망 속 사흘 연속 하락한 원·달러...,골드만삭스는 최근 이재명 대통령이 원·달러 환율이 1400원 전후로 하락할 수 있다고 언급한 점 등을... 한편 이재명 대통령은 이날 울산전시컨벤션센터에서 열린 ‘울산의 마음을 듣다’를 주제로 한... ,https://www.sedaily.com/NewsView/2K7EYL4E38,https://n.news.naver.com/mnews/article/011/0004582329?sid=101,"Fri, 23 Jan 2026 16:43:00 +0900"
이재명,&quot;스테이블코인 기대감&quot;…카카오페이 '上'·네이버 8%↑(종합),전날 이재명 대통령이 주재한 코스피5000 특별위원회 오찬에서 민병덕 더불어민주당 의원이 디지털자산을 언급했다는 소식에 투심이 몰렸다. 민 의원은 이날 오찬에서 코스닥 3000선 돌파를 위해 디지털자산을... ,https://www.newsis.com/view/NISX20260123_0003488364,https://n.news.naver.com/mnews/article/003/0013727771?sid=101,"Fri, 23 Jan 2026 16:43:00 +0900"
이재명,"코스피, 또 신고가… 순환매 상승 견인","전날 이재명 대통령이 주재한 코스피5000 특별위원회 오찬에서 민병덕 더불어민주당 의원이 디지털자산을 언급했다는 소식에 투자심리가 올라갔다. 또 미래에셋증권(16.58%), 키움증권(5.21%), 한국금융지주(4.93%) 등... ",https://it.chosun.com/news/articleView.html?idxno=2023092155542,https://it.chosun.com/news/articleView.html?idxno=2023092155542,"Fri, 23 Jan 2026 16:42:00 +0900"
이재명,"정청래 합당 추진, 장동혁 단식에 보수 결집…지방선거 '빅텐트' 대결",민주당과 조국혁신당 간 합당론을 두고 김 교수는 &quot;조국 대표가 먼저 합당을 이재명 대통령에게 제안했고 이 대통령이 정청래 대표와 교감한 것으로 보인다&quot;고 말했다. 이어 &quot;조국 대표의 국회 복귀 의지를 읽을 수 있다.... ,https://www.moneys.co.kr/article/2026012307412019566,https://n.news.naver.com/mnews/article/417/0001126158?sid=100,"Fri, 23 Jan 2026 16:41:00 +0900"
이재명,“민주당은 과거에도 통합 깜짝 발표”…코너 몰린 정청래 지원사격 나...,합당이 이재명 대통령의 평소 지론이었다고 밝혔다”며 “저는 민주당과 혁신당이 지방선거를 같이... 대선에서는 이재명 정부를 탄생시켜 증명된 원팀이기도 하다”고 강조했다. 당내 의견 수렴을 충분히 하지 않았다는... ,https://www.munhwa.com/article/11563300?ref=naver,https://n.news.naver.com/mnews/article/021/0002766101?sid=100,"Fri, 23 Jan 2026 16:41:00 +0900"
이재명,중국 방문 한국인 작년 36.9% 급증...비자면제 효과,다이 대사는 또 &quot;역사의 분기점에서 반드시 역사의 올바른 편에 서야 한다&quot;고 강조했다. 시진핑 중국 국가주석이 최근 한·중 정상회담에서 이재명 대통령에게 한 발언을 반복한 것이다.,https://www.hankyung.com/article/202601239259i,https://n.news.naver.com/mnews/article/015/0005241386?sid=100,"Fri, 23 Jan 2026 16:40:00 +0900"
이재명,"與 최고위원 3인, '합당 제안' 정청래에 공개 반발",합당 제안이 이재명 대통령과 사전 교감이 있었던 것처럼 비치게 된 점도 지적했다. 이들ㅇ느 &quot;확인 결과... 황 최고위원은 &quot;그 '단순한 제안' 때문에 이재명 정부가 국민과 약속한 역사적인 '코스피 5000 돌파' 뉴스가 묻혔다... ,http://www.00news.co.kr/news/articleView.html?idxno=101356,http://www.00news.co.kr/news/articleView.html?idxno=101356,"Fri, 23 Jan 2026 16:40:00 +0900"
이재명,"&quot;답 없으면 못 들어온다&quot; 장민영 신임 기업은행장, 노조 저지에 출근 못...",이날 이재명 대통령이 임명했다. 지난 2일 김성태 전 행장이 퇴임한 이후 김형일 전무이사 대행 체제로... 이번 사태는 이재명 대통령이 해결을 지시한 만큼 예상보다 빠르게 사태가 마무리될 것이란 분석도 나온다. 이... ,https://www.socialvalue.kr/news/view/1065575675199990,https://www.socialvalue.kr/news/view/1065575675199990,"Fri, 23 Jan 2026 16:40:00 +0900"
이재명,"[이로운넷현장] 통합돌봄, 의료·요양에 머물 것인가 &quot;돌봄을 넘어 기본...",이재명 대통령의 핵심 국정 비전인 '기본사회'가 대통령령에 따른 추진기구 출범과 국회 기본법 발의를 계기로 정책 실행 단계에 들어선 가운데 통합돌봄법 시행을 두 달 앞둔 지금이야말로 기본사회를 현장에서 구현할... ,https://www.eroun.net/news/articleView.html?idxno=71713,https://www.eroun.net/news/articleView.html?idxno=71713,"Fri, 23 Jan 2026 16:40:00 +0900"
이재명,李대통령 “오천피는 국민 재산 증가”…균형발전·연금 안정 자신감,"울산 타운홀미팅서 AI·안전 성장 강조 “5극3특 개혁 저항 크다” 국민 지지 호소 이재명 대통령은 23일 코스피가 사상 처음으로 5,000선을 돌파한 것과 관련해 “대한민국 기업이 제대로 평가받으면, 그만큼 우리 국민... ",https://www.dnews.co.kr/uhtml/view.jsp?idxno=202601231636223860994,https://www.dnews.co.kr/uhtml/view.jsp?idxno=202601231636223860994,"Fri, 23 Jan 2026 16:40:00 +0900"
이재명,"[특징주] 갤럭시아머니트리, &quot;디지털자산으로 코스닥3000 달성&quot; 가상화폐...",지난 22일 더불어민주당 코스피 5000특별위원회는 이재명 대통령과의 청와대 오찬에서 &quot;다음 목표로 디지털자산을 활용해 코스닥 3000을 달성해야 한다&quot;는 의견을 전달한 것으로 나타났다. 이날 오전 코스피가 사상... ,https://www.widedaily.com/news/articleView.html?idxno=287370,https://www.widedaily.com/news/articleView.html?idxno=287370,"Fri, 23 Jan 2026 16:40:00 +0900"
이재명,천스닥 카운트다운...'헥카네' 디지털자산주 불기둥,정치권에 따르면 민병덕 더불어민주당 의원은 전날 이재명 대통령과의 청와대 오찬에서 &quot;코스피 5000시대의 낙수 효과가 코스닥으로 이어지기 위해서는 디지털자산 시장의 활성화가 필수적&quot;이라고 건의했다.​ 민... ,https://www.digitaltoday.co.kr/news/articleView.html?idxno=623615,https://www.digitaltoday.co.kr/news/articleView.html?idxno=623615,"Fri, 23 Jan 2026 16:38:00 +0900"
이재명,원/달러 환율 사흘째 하락…1465.8원 마감,당시는 스콧 베선트 미국 재무장관의 이례적인 발언이 원화 약세를 억제하는 효과가 약해지던 상황이었는데 이재명 대통령이 환율 하락 전망을 전하면서 상승세에 다시 제동이 걸렸다. 이 대통령은 &quot;당국에... ,https://www.slist.kr/news/articleView.html?idxno=711345,https://www.slist.kr/news/articleView.html?idxno=711345,"Fri, 23 Jan 2026 16:38:00 +0900"
이재명,"이재명 '중복상장·주가누르기' 법안 논의, 코스피5천에 '개미' 지원 추...",이재명 대통령이 '코스피 5천 시대'를 맞아 개미 투자자 보호를 향한 추가 입법 추진에 속도를 내고 있다.... 이재명 대통령이 23일 울산전시컨벤션센터에서 열린 '울산의 마음을 듣다' 타운홀미팅 간담회에서 발언하고... ,https://www.businesspost.co.kr/BP?command=article_view&num=427850,https://www.businesspost.co.kr/BP?command=article_view&num=427850,"Fri, 23 Jan 2026 16:38:00 +0900"
이재명,"이 대통령 “부울경 통합, 이번 지선 때 하는게 현실적&quot;",이재명 대통령은 23일 울산을 찾아 지방소멸시대 대안으로 광역화를 강조하면서 이번 6.3 지방선거 때 부산... 이재명 대통령이 23일 울산전시컨벤션센터에서 열린 '울산의 마음을 듣다' 타운홀미팅 간담회에서 김정관... ,https://www.mediapen.com/news/view/1076697,https://www.mediapen.com/news/view/1076697,"Fri, 23 Jan 2026 16:38:00 +0900"
이재명,이혜훈 “0%대 성장 상황에 적극적 재정 역할 필요” 강조,이재명 정부의 확장재정 기조를 뒷받침하겠다는 점을 분명히 한 것으로 풀이된다. 이 후보자는 이날 국회에서 열린 인사청문회 모두발언에서 “4분기 연속 0%대 성장을 기록하다가 겨우 경기회복세로 기로에 선 시점”... ,https://www.khan.co.kr/article/202601231637001,https://n.news.naver.com/mnews/article/032/0003423468?sid=101,"Fri, 23 Jan 2026 16:37:00 +0900"
이재명,"코스피, 오름폭 줄여 4,990대 마감··· '천스닥' 코앞","코스피 5,000 특별위원회가 전날 이재명 대통령과의 오찬에서 디지털 자산을 활용한 코스닥 도약 방안을 제안했다는 보도가 전해지며 기대감이 반영된 것으로 풀이된다. 코스닥시장에서는 외국인과 기관이 각각... ",https://www.jeonmae.co.kr/news/articleView.html?idxno=1224387,https://www.jeonmae.co.kr/news/articleView.html?idxno=1224387,"Fri, 23 Jan 2026 16:36:00 +0900"
이재명,"이재명 대통령·김두겸 시장 한자리에… 울산, AI 기반 미래도시 구상 ...","사진/김은희 기자 | 한스경제=김은희 기자 | 이재명 대통령과 김두겸 울산시장, 시민 200여 명이 참석한 2026년 새해 첫 타운홀 미팅이 1월 23일 오후 2시 울산전시컨벤션센터에서 열렸다. 이번 행사는 지난해 6월 울산... ",http://www.hansbiz.co.kr/news/articleView.html?idxno=811353,http://www.hansbiz.co.kr/news/articleView.html?idxno=811353,"Fri, 23 Jan 2026 16:36:00 +0900"
이재명,"&quot;장동혁 단식, 타이밍 공교로워... 진정한 의도 의심&quot;","단식은 이재명 대통령의 민주당 대표 시절을 벤치마킹한 것으로 내부용이란 분석도 있던데. &quot;멀리는 김영삼 전 대통령, 김대중 전 대통령부터 시작해서 손학규 바른미래당 전 대표, 또 황교안 전 자유한국당 대표, 이재명... ",https://www.ohmynews.com/NWS_Web/View/at_pg.aspx?CNTN_CD=A0003201161&CMPT_CD=P0010&utm_source=naver&utm_medium=newsearch&utm_campaign=naver_news,https://n.news.naver.com/mnews/article/047/0002502498?sid=100,"Fri, 23 Jan 2026 16:36:00 +0900"
이재명,'1심 실형' 대장동 업자들 2심서 혐의 부인…&quot;재산 추징도 풀라&quot;,남 변호사는 그간 유 전 본부장에게 간 일부 자금이 과거 이재명 대통령 측근으로 꼽히는 정진상 전 더불어민주당 정무조정실장과 김용 전 민주연구원 부원장에게 전달되는 것으로 알았다는 입장이었다. 하지만 새 정부... ,https://www.slist.kr/news/articleView.html?idxno=711344,https://www.slist.kr/news/articleView.html?idxno=711344,"Fri, 23 Jan 2026 16:36:00 +0900"
이재명,국회 '정년 65세' 입법 가속…경제계 &quot;사회적 합의·유연화가 우선&quot;,정년연장은 이재명 정부의 국정과제로 이미 추진 동력이 강하게 형성된 사안이다. 현재 정치권과 노동계를 중심으로 논의가 빠르게 전개되고 있다. 반면 경제계와 사용자 측의 현실적 우려는 상대적으로 논의에서... ,http://www.kbiznews.co.kr/news/articleView.html?idxno=113319,http://www.kbiznews.co.kr/news/articleView.html?idxno=113319,"Fri, 23 Jan 2026 16:36:00 +0900"
이재명,"[단독] '하나님이 윤석열 부활'…경찰-서초구, 윤 지지자 현수막 일제 철...","신자유연대 현수막에는 '하나님께서 윤석열 대통령님 부활 복귀시킨다', '하나님께서 곧 이재명과 공산당을 심판하신다' 등 문구가 적혔다. 대한민국바로세우기운동본부 현수막에는 '특검 탄핵 대상은 김건희 여사가... ",https://news.tf.co.kr/read/life/2285394.htm,https://n.news.naver.com/mnews/article/629/0000465613?sid=102,"Fri, 23 Jan 2026 16:36:00 +0900"
이재명,'1심 실형' 대장동 업자들 2심서 혐의 부인…&quot;재산 추징도 풀라&quot;,남 변호사는 그간 유 전 본부장에게 간 일부 자금이 과거 이재명 대통령 측근으로 꼽히는 정진상 전 더불어민주당 정무조정실장과 김용 전 민주연구원 부원장에게 전달되는 것으로 알았다는 입장이었습니다. 하지만 새... ,https://news.sbs.co.kr/news/endPage.do?news_id=N1008416053&plink=ORI&cooper=NAVER,https://n.news.naver.com/mnews/article/055/0001326956?sid=102,"Fri, 23 Jan 2026 16:36:00 +0900"
이재명,"&quot;이 대통령, 영수회담 응해야&quot; vs &quot;자가당착&quot;","국민의힘의 단독 영수회담 요구에 이재명 대통령이 정당 간의 대화가 우선이라고 밝힌 것을 두고, 여야의 입장이 엇갈렸습니다. 국민의힘 박성훈 수석대변인은 국정 운영의 동력이 상대를 인정하는 소통에서 시작된다며... ",https://www.natv.go.kr/natv/news/newsView.do?newsId=512510,https://www.natv.go.kr/natv/news/newsView.do?newsId=512510,"Fri, 23 Jan 2026 16:36:00 +0900"
이재명,李대통령 &quot;(코스피 5000p) 국민연금 고갈 걱정 안 해도 되는 상황&quot;,"이재명 대통령이 23일 울산전시컨벤션센터에서 열린 '울산의 마음을 듣다' 타운홀미팅 간담회에서 발언하고 있다(사진=연합뉴스) 이재명 대통령은 23일 코스피가 사상 처음으로 5,000선을 돌파한 것과 관련해 &quot;대한민국... ",https://www.delighti.co.kr/news/articleView.html?idxno=110159,https://www.delighti.co.kr/news/articleView.html?idxno=110159,"Fri, 23 Jan 2026 16:36:00 +0900"
이재명,"한정애, 수출기업 경쟁력 강화 위한 전략수출금융기금 조성법 발의","이 법안들은 이재명 정부의 2026년 경제성장전략 중 전략수출금융기금 신설을 입법으로 구체화한 것이다. 최근 각국의 방위비 지출 확대 등으로 에너지, 방산 등 대규모 수출 프로젝트 수주를 둘러싼 글로벌 경쟁이... ",https://www.hankyung.com/article/202601239275i,https://n.news.naver.com/mnews/article/015/0005241383?sid=100,"Fri, 23 Jan 2026 16:35:00 +0900"
정상순방,이탈리아 총리는 왜 일본과 한국을 방문했을까?,"이에 이번 한국-이탈리아 정상회담은 이탈리아의 아시아 순방의 전체적인 맥락에서 이해할 필요가 있고, 적어도 일본, 한국과 가진 정상회담의 결과물 곳곳에 중국의 그림자가 드리워져 있다. 덧붙여, 곧 21세기... ",https://www.ohmynews.com/NWS_Web/View/at_pg.aspx?CNTN_CD=A0003201229&CMPT_CD=P0010&utm_source=naver&utm_medium=newsearch&utm_campaign=naver_news,https://n.news.naver.com/mnews/article/047/0002502495?sid=104,"Fri, 23 Jan 2026 16:16:00 +0900"
정상순방,트럼프의 ‘군사전략 책사’ 콜비 미 국방차관 내주 한국 온다,한국·일본 순방에 나설 것으로 23일 알려졌다. 그가 국방부 차관 취임 이후 한국을 찾는 것은 이번이... 한미 정상회담과 안보협의회의(SCM)에서 합의된 사안에 대한 후속 조치가 우선적으로 논의될 전망이다. 콜비... ,https://www.mk.co.kr/article/11941366,https://n.news.naver.com/mnews/article/009/0005626333?sid=100,"Fri, 23 Jan 2026 14:47:00 +0900"
정상순방,[정치家] 이재명 대한민국 대통령 ⑥ - &quot;대한민국 대도약의 해&quot;,"● 2026-01-19 한-이탈리아 정상, 반도체 협력과 비핵화 의지 재확인 이재명 대통령과 멜로니 이탈리아 총리... ● 2026-01-07 이재명 대통령, &quot;샤오미폰은 한중 협력의 산물&quot; 순방 기자단 오찬 간담회, 발언하는 이재명 대통령... ",https://www.cbci.co.kr/news/articleView.html?idxno=551695,https://www.cbci.co.kr/news/articleView.html?idxno=551695,"Fri, 23 Jan 2026 14:24:00 +0900"
정상순방,"우원식 의장, 인도네시아 하원의장 및 국민평의회 의장 면담","양국 정상이 논의한 것처럼 '특별 전략적 동반자 관계'에 걸맞게 호혜적인 협력을 더욱 심화시켜 나갈... 이번 순방에는 국민의힘 한기호·서일준 의원, 더불어민주당 서미화·김현정·송재봉·이정헌 의원, 곽현... ",https://www.thefairnews.co.kr/news/articleView.html?idxno=67525,https://www.thefairnews.co.kr/news/articleView.html?idxno=67525,"Fri, 23 Jan 2026 11:14:00 +0900"
정상순방,&quot;연대 안하면 메뉴판에 오른다&quot; 다보스 경종울린 리더[글로벌키맨],글로벌 금융위기 당시 캐나다 중앙은행 총재로서 주요 7개국(G7) 가운데 캐나다 경제를 가장 빨리 정상화한... 카니 총리는 취임 직후 첫 해외 순방지로 미국이 아닌 유럽을 선택하는 등 트럼프 대통령의 '미국 우선주의'에... ,https://www.mt.co.kr/world/2026/01/23/2026012217265232929,https://n.news.naver.com/mnews/article/008/0005308414?sid=104,"Fri, 23 Jan 2026 05:10:00 +0900"
정상순방,"제2차 세계대전 승리 성과를 수호하고, 동북아 평화를 함께 지켜나가자","이는 이재명 대통령의 2026년 첫 해외 순방이자, 중국이 새해 들어 처음 맞이한 외국 정상의 방문이기도 하다. 이는 곧 중·한 양국이 양자 관계를 얼마나 중요시하는지를 분명히 보여준다. 양국 정상 회담에서 시진핑 주석은... ",http://www.gnmaeil.com/news/articleView.html?idxno=579337,http://www.gnmaeil.com/news/articleView.html?idxno=579337,"Thu, 22 Jan 2026 22:56:00 +0900"
정상순방,"“‘5000피’ 李 성과에 또 찬물”… 與 일각 ‘부글’ [정청래, 혁신당...",이 대통령이 주요 20개국(G20) 정상회의 참석차 아랍에미리트(UAE) 등 중동·아프리카 4개국 순방을 위해 출국하던 지난해 11월 민주당은 대의원 및 권리당원 ‘1인 1표제’ 개정을 위한 당원투표를 실시했다. 또 이 대통령이... ,https://www.segye.com/newsView/20260122515900?OutUrl=naver,https://n.news.naver.com/mnews/article/022/0004099710?sid=100,"Thu, 22 Jan 2026 17:58:00 +0900"
정상순방,"'이젠 성과'…집권 2년차, 화약고는 '당청 갈등'",코스피 5000 돌파와 중·일 정상회담이라는 새해 초 굵직한 성과를 바탕으로 국정 운영의 주도권을 쥔 건데요.... 여기에 개혁 과제 추진의 시기가 이 대통령의 순방 일정 등과 겹치면서 정부의 성과를 묻히게 하는 현상까지... ,http://www.newstomato.com/ReadNews.aspx?no=1288765&inflow=N,http://www.newstomato.com/ReadNews.aspx?no=1288765&inflow=N,"Thu, 22 Jan 2026 16:48:00 +0900"
국회,"국민의힘 &quot;이혜훈 장남, '다자녀→사회기여자'로 연대 특혜 입학…즉각...","이어 &quot;문제는 이 전형의 적용 근거&quot;라며 &quot;이혜훈 후보자는 장남의 입학이 과거 국회의원이었던 시아버지가 수훈한 청조·홍조 훈장에 따른 것이라고 설명하며, '연세대 내부 기준에 따른 것'이라고 답변했지만 대한민국... ",https://www.dailian.co.kr/news/view/1601978/?sc=Naver,https://n.news.naver.com/mnews/article/119/0003051749?sid=100,"Fri, 23 Jan 2026 16:45:00 +0900"
국회,"김민석 총리, 美 의원들 만나 “쿠팡 차별 전혀 없다”",최근 쿠팡에 대한 한국 국회의 강도 높은 대응을 두고 미국에서 제기된 ‘미국 기업 차별’ 우려를 직접 불식시킨 것이다. 국무총리실에 따르면 김 총리는 이날 하원의원들과 가진 오찬 간담회에서 “한국 정부는 ‘조지아... ,https://www.mk.co.kr/article/11941522,https://n.news.naver.com/mnews/article/024/0000102984?sid=101,"Fri, 23 Jan 2026 16:45:00 +0900"
국회,이혜훈 후보자 “0%대 성장 지속…적극적 재정 무엇보다 필요”,이혜훈 기획예산처 장관 후보자(사진)가 23일 열린 국회 인사청문회에서 “지금처럼 4분기 연속 0% 성장을 하는 상황에서는 적극적 재정이 무엇보다 필요하다”고 말했다. 이날 국회 재정경제기획위원회 인사청문회에서... ,https://www.hankyung.com/article/202601239290i,https://n.news.naver.com/mnews/article/015/0005241390?sid=101,"Fri, 23 Jan 2026 16:44:00 +0900"
국회,"진통 끝 열린 이혜훈 청문회…여야, 자료 제출부터 부정 청약 의혹 등 질...",한 차례 무산됐던 이혜훈 기획예산처 장관 후보자에 대한 국회 인사청문회가 23일 열린 가운데 여야가... 최은석 국민의힘 의원은 이날 국회 재정경제기획위원회에서 열린 인사청문회 의사진행발언에서 “지난번 전체회의... ,https://www.seoul.co.kr/news/politics/2026/01/23/20260123500218?wlog_tag3=naver,https://n.news.naver.com/mnews/article/081/0003611310?sid=100,"Fri, 23 Jan 2026 16:43:00 +0900"
국회,‘美 조사 요청’ 쿠팡 투자사에 시민단체 “주권 침해 중단하라”,"한국에서 벌어진 불법과 불공정에 대해 누가, 어떻게 책임질 것인가에 대한 문제”라며 “정부와 국회는 흔들리지 말고 법과 원칙에 따라 단호하게 대응해야 한다”고 촉구했습니다. 김성민... ",https://news.kbs.co.kr/news/pc/view/view.do?ncd=8467421&ref=A,https://n.news.naver.com/mnews/article/056/0012111299?sid=102,"Fri, 23 Jan 2026 16:43:00 +0900"
국회,"구리시의회 신동화 의장, '광역교통법' 개정 촉구 결의안 채택","아울러, 신 의장은 “윤호중 국회의원이 대표 발의한 「광역교통법」 개정안(의안번호 2204988)의 조속한... 또한, 신 의장은 결의문을 통해“첫째, 국회 국토교통위원회는 계류 중인 「광역교통법」 개정안을 최우선 민생... ",https://www.siminilbo.co.kr/news/newsview.php?ncode=1160290785402507,https://www.siminilbo.co.kr/news/newsview.php?ncode=1160290785402507,"Fri, 23 Jan 2026 16:43:00 +0900"
국회,‘아파트 팔 수 있나’ 이혜훈 “수사기관 결과 따르겠다”,23일 국회 재정경제위원회 인사청문회에서 이 후보자의 부정 청약 의혹 관련 ‘2023년 8월 대외경제정책연구원(KIEP)에 취업한 장남이 실제로는 이 후보자 부부와 같이 산 것이 아니라 세종에 거주한 것 아니냐’는 의문이... ,http://www.kookje.co.kr/news2011/asp/newsbody.asp?code=0100&key=20260123.99099006656,https://n.news.naver.com/mnews/article/658/0000133256?sid=100,"Fri, 23 Jan 2026 16:43:00 +0900"
국회,"택배대화기구 “심야배송 노동, ‘일일 8시간·주 46~50시간 제한’ 합의...",더불어민주당 김남근 의원은 오늘(23일) 오후 국회에서 열린 제6차 택배사회적대화기구 회의 결과 브리핑에서 이같이 밝히며 “조금의 유연성을 둘지는 추후 협의할 예정”이라고 설명했습니다. 구체적인 주간 노동시간... ,https://news.kbs.co.kr/news/pc/view/view.do?ncd=8467422&ref=A,https://n.news.naver.com/mnews/article/056/0012111300?sid=100,"Fri, 23 Jan 2026 16:43:00 +0900"
국회,민주당 지도부 진천 집결...'충북 소외론' 정면 돌파,"[이광희 / 더불어민주당 충북도당위원장 : 광주·전남의 통합과 대전·충남의 통합 소식에 우리는 섬이냐라는 자조적인, 자조 섞인 말과 함께 때로는 분노를 표출하는 도민들도 계십니다.] [이연희 / 더불어민주당 국회의원... ",https://ccn.hcn.co.kr/user/news/BD_newsView.do?news_category=01&story_id=NS2026012300018&story_seq=0&soCode=114&socttSn=NS2026012300018&socttSeq=0,https://ccn.hcn.co.kr/user/news/BD_newsView.do?news_category=01&story_id=NS2026012300018&story_seq=0&soCode=114&socttSn=NS2026012300018&socttSeq=0,"Fri, 23 Jan 2026 16:42:00 +0900"
