Keyword,Title,Description,Original Link,Link,Publication Date
이재명,李 “전쟁 추경은 속도전”…‘지방 우대’ 원칙도 지시,"이재명 대통령이 이번 추가경정예산안(추경)을 '전쟁 추경'으로 규정하고, 속도감 있게 추진할 것을 당부했다. 이 대통령은 19일 청와대에서 주재한 수석보좌관회의에서 “사실상 '전쟁 추경'인 이번 추경은 민생경제... ",https://www.ekn.kr/web/view.php?key=20260319025459272,https://www.ekn.kr/web/view.php?key=20260319025459272,"Thu, 19 Mar 2026 17:02:00 +0900"
이재명,"청와대, '이 대통령 조폭 연루설' 허위 확정에 &quot;추후 보도 게재 요청&quot;",확정된 이재명 대통령에 대한 이른바 '조폭 연루설' 관련 보도에 대한 추후보도청구권을 행사하겠다고 밝혔다. '조폭 연루설'은 20대 대선을 앞둔 2021년 10월 &quot;이재명 더불어민주당 대선후보가 성남시장 재임 당시 사업... ,https://www.ohmynews.com/NWS_Web/View/at_pg.aspx?CNTN_CD=A0003216399&CMPT_CD=P0010&utm_source=naver&utm_medium=newsearch&utm_campaign=naver_news,https://n.news.naver.com/mnews/article/047/0002508695?sid=100,"Thu, 19 Mar 2026 17:01:00 +0900"
이재명,"[기자수첩] 가격 인하 압박, 물가 잡기의 최선책인가","3년 전 프랑스 정부의 정책이 낯설지 않은 건 최근 이재명 정부의 가격 인하 압박 기조와 닮았기 때문이다. 정부의 물가 안정 기조에 맞춰 식품기업들이 잇따라 가격 인하에 나서고 있지만, 소비자들이 체감하는 물가는... ",https://biz.chosun.com/opinion/journalist/2026/03/19/WPHURUXFFVFRHC6NLS2ZYGS5XQ/?utm_source=naver&utm_medium=original&utm_campaign=biz,https://n.news.naver.com/mnews/article/366/0001149927?sid=110,"Thu, 19 Mar 2026 17:01:00 +0900"
이재명,“24시간 주식거래? ‘피로사회’ 앞당기는 촉매제”,반드시 이재명 정부가 제동을 걸고 바로잡아야 한다.” 개인투자자 의견 도외시한 ‘갑툭튀’ 선언 철회해야 밤사이에 터지는 대형 악재에 개인투자자들이 대응할 정보 공시 체계는 준비될 거라고 보나. “이러지도... ,https://shindonga.donga.com/3/all/13/6144976/1,https://n.news.naver.com/mnews/article/262/0000019246?sid=101,"Thu, 19 Mar 2026 17:01:00 +0900"
이재명,"&quot;인재 구합니다, 연봉은 '회사 내규'&quot;…깜깜이 연봉 채용 막는다",김 장관은 이날 청와대에서 이재명 대통령 주재로 열린 경제사회노동위원회(경사노위) 1기 출범식 및 노동정책 토론회에서 이같이 밝혔다. 이날 토론회에 참석한 한다스리 국제의료재단노조 위원장은 &quot;수많은 채용... ,https://economist.co.kr/article/view/ecn202603190040,https://n.news.naver.com/mnews/article/243/0000094774?sid=101,"Thu, 19 Mar 2026 17:01:00 +0900"
이재명,정권 따라 오락가락 '남북관계 발전 기본계획'…&quot;최소 합의 있어야&quot;,"평화 공존(문재인 정부)에서 비핵화(윤석열 정부)로, 또다시 평화 공존(이재명 정부)으로. 최근 한국 정부... 이재명 정부의 ‘한반도 평화 공존 정책’을 구현하려는 이번 기본계획안은 ‘한반도 평화 공존 및 공동 성장’... ",https://www.hankookilbo.com/news/article/A2026031914440001504?did=NA,https://n.news.naver.com/mnews/article/469/0000920453?sid=100,"Thu, 19 Mar 2026 17:01:00 +0900"
이재명,"靑, '李 조폭연루설 허위 사실 확정'에 &quot;자율적으로 추후보도 해달라&quot;","조재완 김경록 기자 = 청와대는 19일 과거 이재명 대통령의 조폭 연루설을 보도한 언론사를 향해 대법원... 언론은 이재명 후보가 성남시장 재직 시절 조직폭력배로부터 20억원 상당의 금품을 수수했다는 의혹은 물론, 돈... ",https://www.newsis.com/view/NISX20260319_0003555793,https://n.news.naver.com/mnews/article/003/0013833546?sid=100,"Thu, 19 Mar 2026 17:00:00 +0900"
이재명,“전주로 핵심 인력 보내라”…국민연금 요구에 운용사 ‘난색’,이재명 대통령은 공공기관 지방 이전 효과가 기대에 미치지 못했다는 점을 지적하며 전주 소재 운용사에 대한 인센티브 부여 방안을 제시한 바 있다. 김성주 국민연금 이사장 역시 전주 사무소를 둔 운용사에 “큰 기회를... ,https://www.etoday.co.kr/news/view/2567257,https://www.etoday.co.kr/news/view/2567257,"Thu, 19 Mar 2026 17:00:00 +0900"
이재명,"'농협 주유소' 李 질타에 현장 찾은 송미령, 면세유 부담 점검",이재명 대통령은 지난 17일 국무회의에서 농협 알뜰주유소의 유류 가격이 상승한 것과 관련해 &quot;농협이 이러면 되냐라는 얘기가 의외로 많다&quot;며 &quot;농협은 기대가 있고 지원도 있지 않느냐&quot;고 언급하며 관련 상황을... ,https://www.newsis.com/view/NISX20260319_0003555704,https://n.news.naver.com/mnews/article/003/0013833544?sid=101,"Thu, 19 Mar 2026 17:00:00 +0900"
이재명,신용한 '대통령 신임 문자' 논란 확산…노영민과 공방 격화,해당 메시지에는 이재명이 공개적으로 신 예비후보에 대한 신임을 표시했다는 취지의 언론 보도와 링크가 포함된 것으로 알려졌다. 이후 해당 기사는 삭제됐고 오해 소지가 있다는 이유로 정정 보도가 이어졌다. 신... ,https://www.ccreview.co.kr/news/articleView.html?idxno=344780,https://www.ccreview.co.kr/news/articleView.html?idxno=344780,"Thu, 19 Mar 2026 17:00:00 +0900"
이재명,靑 &quot;李 대통령 '조폭 연루설' 허위 확정…'추후보도' 요청&quot;,청와대가 이재명 대통령의 20대 대선 후보 당시 제기된 '조폭 연루설'을 보도한 언론에 대해 '추후보도청구권'을 행사한다고 19일 밝혔다. 이규연 청와대 홍보소통수석은 이날 춘추관에서 기자들과 만나 &quot;사실 관계를... ,http://www.inews24.com/view/1951185,https://n.news.naver.com/mnews/article/031/0001014986?sid=100,"Thu, 19 Mar 2026 17:00:00 +0900"
이재명,‘남양주 스토킹 살해 사건’ 범인 44세 김훈 피의자 신상 공개 : 대통령...,"차례 거주지를 옮기는 등 위험에 노출돼 있었던 것으로 알려졌다. 이재명 대통령은 지난 16일 이번 범행을 두고 “관계당국의 대응이 더뎠고, 국민 눈높이에 한참 못 미쳤다”고 질타하며 대책 마련과 함께 감찰을 지시했다.",https://www.huffingtonpost.kr/article/250411,https://www.huffingtonpost.kr/article/250411,"Thu, 19 Mar 2026 17:00:00 +0900"
이재명,수명이 다한 체제를 개혁하고 새 체제로 대응해야!,이재명 정권의 폭주는 계속된다. 그들 내부에서조차 불안을 느꼈는지 일부... 검찰 문제를 놓고는 이재명이 브레이크를 밟기도 한다. 그러나 결국 강경파의 득세는... ,http://www.breaknews.com/1193355,http://www.breaknews.com/1193355,"Thu, 19 Mar 2026 17:00:00 +0900"
이재명,"李 “한 방울의 석유 절실…강훈식, 표창이라도 해드릴까”",이재명 대통령은 19일 미국과 이란 전쟁 장기화와 관련해 “전쟁이 언제까지 지속될지 예단하기가 어려운 상황”이라며 “청와대와 모든 정부 부처는 경제 전시 상황이라는 점을 염두에 두고 엄중한 자세를 가져달라”고... ,https://www.donga.com/news/Politics/article/all/20260319/133564473/1,https://n.news.naver.com/mnews/article/020/0003705427?sid=100,"Thu, 19 Mar 2026 16:59:00 +0900"
이재명,"靑, 李 대통령 ‘조폭 연루설’ 보도 언론사에 추후보도 요청",이규연 홍보소통수석 백브리핑 청와대는 이재명 대통령의 20대 대선후보 시절 제기된 ‘조폭 연루설’을 보도한 언론에 대해 추후 보도 청구권을 행사한다고 19일 밝혔다. 이규연 청와대 홍보소통수석은 이날 춘추관에서... ,https://www.chosun.com/politics/politics_general/2026/03/19/6V43LH4XCBBEPEAWRH4UENPP4Y/?utm_source=naver&utm_medium=referral&utm_campaign=naver-news,https://n.news.naver.com/mnews/article/023/0003965574?sid=100,"Thu, 19 Mar 2026 16:59:00 +0900"
이재명,'노사정공동선언문 들고',이재명 대통령이 19일 청와대에서 열린 경사노위 1기 출범 맞이 노동정책 토론회를 마친 뒤 노사정 공동선언문을 든 김지형 경제사회노동위원회 위원장 등 참석자들과 기념촬영을 하고 있다. 왼쪽부터 구윤철 부총리... ,https://www.news1.kr/photos/7806667,https://n.news.naver.com/mnews/article/421/0008836939?sid=100,"Thu, 19 Mar 2026 16:58:00 +0900"
이재명,"민주·혁신·진보·개혁·기본·사민 6당, 지방선거·개헌 동시 추진 합...","개헌안에는 우 의장이 제안한 5.18정신 헌법 전문수록과 비상계엄 통제 강화, 지역균형발전 명시에 이어 최근 이재명 대통령이 언급한 '부마민주항쟁'도 담는 방안을 논의한다. 우 의장은 &quot;국회의 1만 2000명 국민... ",https://www.joongdo.co.kr/web/view.php?key=20260319010006703,https://www.joongdo.co.kr/web/view.php?key=20260319010006703,"Thu, 19 Mar 2026 16:58:00 +0900"
이재명,"與 서울시장 토론, 부동산 키워드로 오세훈 '맹공'…정원오엔 '견제'",박 예비후보는 최근 정 예비후보가 인터뷰에서 '민간·공공 투트랙으로 값싸고 질 좋은 주택을 대거 공급해야 한다'고 한 발언을 거론하며 &quot;이를 토대로 시세의 70~80% 수준의 아파트를 공급하면 이재명정부의 임대물량 확대... ,https://www.mt.co.kr/politics/2026/03/19/2026031915472557725,https://n.news.naver.com/mnews/article/008/0005332416?sid=162,"Thu, 19 Mar 2026 16:58:00 +0900"
이재명,李정부 국정과제 후속조치 하세월…충청 핵심 현안 지지부진,"이재명 정부가 국정과제 반영을 통해 충청권 등 지역 현안 해결을 약속했지만, 이를 뒷받침할 후속 조치는... 이재명 정부는 집권 직후 세종시 행정수도 명문화 개헌을 국정과제에 포함시켰다. 하지만 지금까지 이를... ",https://www.joongdo.co.kr/web/view.php?key=20260319010006562,https://www.joongdo.co.kr/web/view.php?key=20260319010006562,"Thu, 19 Mar 2026 16:58:00 +0900"
이재명,"김어준 “강훈식 잦은 해외출장, 李 대통령식 차기주자 육성 과정”",그는 이러한 행보를 두고 “이재명 대통령 방식의 차기 지도자 육성 과정”이라며 “국정 운영 경험을 폭넓게 쌓도록 하려는 의도가 깔린 것으로 보인다”고 주장했다. 김씨는 근거로 과거 정부 사례를 들었다. 보수 정권... ,https://www.joongang.co.kr/article/25413145,https://n.news.naver.com/mnews/article/025/0003510246?sid=100,"Thu, 19 Mar 2026 16:58:00 +0900"
이재명,"&quot;이재명표 부동산 정책, 화성이 가장 먼저&quot;…화성특례시-한국부동산원 ...","[사진=화성시] 경기 화성특례시(시장 정명근)가 이재명 정부 부동산 국정 철학을 지역 현장에서 가장 먼저... 특히, 이재명 대통령이 경기도지사 시절 경기주택도시공사(GH) 사장으로 '기본주택' 정책을 설계했던 이헌욱... ",https://www.joongangenews.com/news/articleView.html?idxno=504113,https://www.joongangenews.com/news/articleView.html?idxno=504113,"Thu, 19 Mar 2026 16:58:00 +0900"
이재명,"靑, ‘李대통령 조폭연루설 허위 확정’에 “추후보도 요청”",청와대는 19일 최근 대법원에서 허위 사실로 최종 판단한 ‘이재명 대통령의 조폭 연루설’을 보도한 언론사에 사실을 바로잡는 추후 보도를 게재할 것을 요청했다. 이규연 청와대 홍보소통수석 이날 춘추관에서... ,https://www.seoul.co.kr/news/politics/president/2026/03/19/20260319500247?wlog_tag3=naver,https://n.news.naver.com/mnews/article/081/0003627524?sid=100,"Thu, 19 Mar 2026 16:58:00 +0900"
이재명,"세월호 12주기 기억행사, 4월 인천 동구서 열려",이들은 또 ▲세월호 참사에 관한 국가책임 인정과 공식 사과 ▲이재명 대통령의 12주기 기억식 참석 ▲대통령 기록물을 포함한 세월호 관련 비공개 기록 전면 공개 ▲생명안전기본법 즉각 제정 등을 요구했다. ※ 이... ,https://www.incheontoday.com/news/articleView.html?idxno=316679,https://www.incheontoday.com/news/articleView.html?idxno=316679,"Thu, 19 Mar 2026 16:58:00 +0900"
이재명,‘평화공존’ 앞세운 남북관계 5개년 로드맵…尹 정부 계획 조기 폐기,"5차 계획에서는 이재명 정부의 한반도 평화공존 정책을 가장 앞세웠다. ‘북한 체제 존중’, ‘흡수통일 불추구’, ‘적대행위 불추진’ 3가지 추진 원칙에 따라 6가지 중점 추진과제를 담았다. 중점 추진과제로 ▲화해... ",https://www.seoul.co.kr/news/politics/2026/03/19/20260319500246?wlog_tag3=naver,https://n.news.naver.com/mnews/article/081/0003627523?sid=100,"Thu, 19 Mar 2026 16:58:00 +0900"
이재명,"서왕진 &quot;정치개혁 막히니 개헌도 정체, 지독한 교착 상태 끝내야&quot;","아울러 그는 &quot;이재명 정부가 '진짜 대한민국을 위한 개헌'을 국정과제 1호로 확정했고, 우원식 국회의장은 지방선거와 개헌 국민투표 동시 실시라는 구체적 일정까지 제시했다&quot;며 &quot;대통령 역시 정부 차원의 검토를 지시하며... ",https://www.m-i.kr/news/articleView.html?idxno=1355706,https://www.m-i.kr/news/articleView.html?idxno=1355706,"Thu, 19 Mar 2026 16:58:00 +0900"
이재명,경사노위 1기 출범을 맞아,이재명 대통령이 19일 청와대에서 열린 경사노위 1기 출범 맞이 노동정책 토론회를 마친 뒤 김지형 경제사회노동위원회 위원장 등 참석자들과 함께 기념촬영을 하고 있다. (청와대 제공. 재판매 및 DB 금지) 2026.3.19... ,https://www.news1.kr/photos/7806666,https://n.news.naver.com/mnews/article/421/0008836938?sid=100,"Thu, 19 Mar 2026 16:58:00 +0900"
이재명,유시민 &quot;못되게 해…미안해&quot; 정청래 &quot;어릴 때라 나도 민망…두배로 사과...,"유 작가는 이날 방송에서 당내 뉴이재명 세력을 비판하며, 이익을 좇아 유입된 일부 지지층이 위기 시 가장 먼저 등을 돌릴 수 있다고 지적했다. 그러면서 기존 핵심 지지층의 중요성을 강조하며 내부 분열을 경계해야... ",https://www.busan.com/view/busan/view.php?code=2026031916200296958,https://n.news.naver.com/mnews/article/082/0001371821?sid=100,"Thu, 19 Mar 2026 16:57:00 +0900"
이재명,임광현 국세청장 &quot;사업자대출로 주택 구입 전수검증… 탈세 엄정 대응&quot;,앞서 이재명 대통령도 지난 17일 엑스에서 &quot;부동산 투기 자금으로 쓰려고 부동산 구입 자금 대출을 하지 않으려는 금융기관에 사업자금이라 속이고 대출받아 (대출금을) 부동산 구입용으로 쓰면 사기죄로 형사 처벌된다&quot;고... ,https://www.daejonilbo.com/news/articleView.html?idxno=2263823,https://n.news.naver.com/mnews/article/656/0000171162?sid=101,"Thu, 19 Mar 2026 16:57:00 +0900"
이재명,"“입국 혼잡 줄이고, 암표 잡아라”…李대통령, BTS 공연 전 꼼꼼 지시",이틀 앞으로 다가온 방탄소년단(BTS)의 광화문 공연을 앞두고 이재명 대통령이 ‘공항 혼잡 대응’과 ‘암표 단속’을 잇달아 주문하며 현장 곳곳의 세부 대응을 챙기고 있다. 이 대통령은 19일 청와대 수석보좌관회의... ,https://www.kmib.co.kr/article/view.asp?arcid=0029552472&code=61111111&cp=nv,https://n.news.naver.com/mnews/article/005/0001838115?sid=100,"Thu, 19 Mar 2026 16:57:00 +0900"
이재명,"&quot;주가조작 세력 저승사자, 더 늘린다&quot;…'원금몰수' 제재도 추가",이재명 대통령은 지난해 12월 금융위 업무보고 당시 합동대응단에 팀을 1~2개 만들어 경쟁을 붙이는 등 조직 기능강화와 확대를 검토하도록 지시했다. 이후 지난 1월 확대 개편이 이뤄지자 이 대통령은 해당 내용을 담은... ,https://www.mt.co.kr/stock/2026/03/19/2026031914230048173,https://n.news.naver.com/mnews/article/008/0005332415?sid=101,"Thu, 19 Mar 2026 16:57:00 +0900"
정상순방,[오늘의 주요일정·19일] 이승로 성북구청장 석사학위논문 표절 기자회...,"미국·스위스 순방 김대중정치학교 개강식(19:00 국회) ▲ 우원식 국회의장 본회의(14:30 본회의장)... 산업부, 정상 경제행사 성과관리 TF 2차회의(10:00 대한상의) ▲ 산업부, 희토류 업계 통상현안 간담회(14:30... ",https://www.safetimes.co.kr/news/articleView.html?idxno=240839,https://www.safetimes.co.kr/news/articleView.html?idxno=240839,"Thu, 19 Mar 2026 07:06:00 +0900"
정상순방,"정부, 정상 경제행사 성과관리 TF 2차 회의 개최...기업 의견 반영 체계...",아주경제=최예지 기자 ruizhi@ajunews.com 산업통상부[사진=아주경제DB] 정부가 기업·경제단체와 함께 정상 순방·방한 계기 경제협력 성과를 극대화하기 위한 후속 관리에 속도를 내고 있다. 산업통상부는 여한구... ,https://www.ajunews.com/view/20260318174523722,https://www.ajunews.com/view/20260318174523722,"Thu, 19 Mar 2026 06:02:00 +0900"
정상순방,"金총리, 스위스 대통령과 통화…글로벌 AI 허브 협력 논의",김 총리는 &quot;AI 정상회의가 성공적으로 개최될 수 있도록 한국에서도 관심을 갖고 대표단 참석 등을 통해 적극 지원하겠다&quot;고 말했다. 김 총리는 미국 순방에 이어 이번 스위스 방문을 계기로 글로벌 AI 허브를 유치하기... ,https://news.tf.co.kr/read/ptoday/2303782.htm,https://n.news.naver.com/mnews/article/629/0000482875?sid=100,"Wed, 18 Mar 2026 19:22:00 +0900"
정상순방,"金총리, 스위스 대통령과 20분간 통화…'글로벌 AI 허브' 유치 협력 요청",또한 2027년도 제네바에서 열리는 AI 정상회의에 한국이 관심을 가져달라고 당부했다. 김 총리는 AI... 김 총리는 이번 순방 성과를 토대로 제1차 글로벌 AI 허브 유치위원회와 국민보고회를 열고 향후 추진 계획을... ,https://www.news1.kr/politics/president/6106065,https://n.news.naver.com/mnews/article/421/0008834520?sid=100,"Wed, 18 Mar 2026 18:26:00 +0900"
정상순방,"[전문] &quot;정청래, 궁지 몰린 김어준 도와주러 간 듯…김어준, 언론사 대표...",검사들도 다 사법고시 봐서 정상적으로 공무원이 된 사람들을 다 법적인 근거 없이 잘라서 제명한다 이렇게... 그러니까 이제 후계 양성 프로그램의 일환으로 대통령이 막 계속 순방도 보내고 해외 일정도 보내고 한다. 내가... ,https://news.jtbc.co.kr/article/NB12290202?influxDiv=NAVER,https://n.news.naver.com/mnews/article/437/0000483463?sid=100,"Wed, 18 Mar 2026 15:24:00 +0900"
정상순방,"[6.3 지선] '기사회생' 이재준의 귀환, 고양시 판도 흔드나","재정자립도 하락과 예산 확보 미비, 잦은 해외 순방 등을 조목조목 비판하며 &quot;시정을 정상화하겠다&quot;는 의지를 피력했다. 특히 시청사 그린벨트 환원 중단 등 현 시정의 핵심 현안에 경고장을 날린 것은, 본선에 앞서 현직... ",https://www.g-enews.com/view.php?ud=202603161723571553f0f3e23044_1,https://www.g-enews.com/view.php?ud=202603161723571553f0f3e23044_1,"Wed, 18 Mar 2026 14:04:00 +0900"
국회,[사설]31만 당심 잡아야 민주당 특별시장 후보 경선 1차 관문 넘는다,예비 경선에는 김영록 전남지사·강기정 광주시장·정준호 국회의원·주철현 국회의원·신정훈 국회의원·민형배 국회의원 (이상 기호순) 등 6명이 링에 오른다. 이들 중 1명은 컷오프된다. 예비 경선은 19일과 20일... ,https://www.namdonews.com/news/articleView.html?idxno=904571,https://www.namdonews.com/news/articleView.html?idxno=904571,"Thu, 19 Mar 2026 17:00:00 +0900"
국회,진보당 김명호 &quot;제주 제2공항 주민투표&quot; 민주당 회동 제안,이어 김 예비후보는 민주당 도지사 후보군인 오영훈 제주도지사와 문대림·위성곤 국회의원을 향해 4자 회동을 제안했다. 조속한 제2공항 추진을 주요 공약으로 내세우는 국민의힘은 제외됐다. 김 예비후보는 &quot;4인... ,https://www.jejusori.net/news/articleView.html?idxno=500631,https://www.jejusori.net/news/articleView.html?idxno=500631,"Thu, 19 Mar 2026 17:00:00 +0900"
국회,경북도 &quot;구미국가산단을 탄소중립 1호 모델로&quot;,"설명회에는 지역 국회의원, 경북도 경제부지사, 경북도의원, 구미시 부시장, 사업 주관 컨소시엄(SK이노베이션 등) 기업 및 기관, 구미국가산업단지 입주기업 관계자 등 400여명이 참석했다. 경북도는 국비 500억원, 지방비... ",https://www.newsis.com/view/NISX20260319_0003555597,https://n.news.naver.com/mnews/article/003/0013833545?sid=102,"Thu, 19 Mar 2026 17:00:00 +0900"
국회,&quot;3선 성공 vs 탈환&quot; 전·현직 시흥시장 빅매치 박빙 예고,"시흥시을 지역구에서는 조정식 국회의원 비서관 출신인 이동현 경기도의원(시흥5)이 최근 예비후보 등록을 마쳤습니다. 민주당에서는 시흥시갑, 을 지역 후보가 정리되면 경선 단일화를 진행할 예정입니다. 야권 후보 중... ",https://news.ifm.kr/news/articleView.html?idxno=467178,https://news.ifm.kr/news/articleView.html?idxno=467178,"Thu, 19 Mar 2026 17:00:00 +0900"
국회,구미교육지원청 신청사 개청…“교육행정 새 도약”,"행사에는 임종식 경상북도교육감과 이철우 경북도지사, 구자근 국회의원, 김장호 구미시장, 박채아 경북도의회 교육위원장 등 지역 주요 인사와 교육 관계자들이... ",http://www.breaknews.com/1193354,http://www.breaknews.com/1193354,"Thu, 19 Mar 2026 17:00:00 +0900"
국회,국민의힘 포항시장 경선 4파전…비전·경험 앞세워 지지층 공략,"그는 “이번 경선은 단순한 경쟁이 아니라 포항의 미래를 결정하는 중요한 과정”이라며 “국회와 대통령실, 정당에서 20년간 쌓아온 경험과 인적 네트워크를... ",http://www.breaknews.com/1193353,http://www.breaknews.com/1193353,"Thu, 19 Mar 2026 17:00:00 +0900"
국회,"이철우 경북지사, 3선 도전 선언… “보수의 낙동강 전선 지키겠다”",이번 선거의 우군으로는 김석기 국회 외교통일위원장(경주)이 합류했다. 2025 APEC 정상회의 유치를 함께 이끈 김 위원장이 후원회장을 맡으면서 이 지사의 정치적... ,http://www.breaknews.com/1193352,http://www.breaknews.com/1193352,"Thu, 19 Mar 2026 17:00:00 +0900"
국회,"정유업계, 석유 최고가격제 손실보전 제대로 이뤄질까 '우려'",정점식 국민의힘 정책위의장은 이날 국회에서 열린 정유업계 정책간담회에서 &quot;석유제품 최고가격제 시행으로 (국내 유가가) 일정 부분 안정세를 보이나 정유업계의 부담은 상당하다&quot;며 &quot;중동 상황이 언제 안정될지... ,http://www.newsdream.kr/news/articleView.html?idxno=109825,http://www.newsdream.kr/news/articleView.html?idxno=109825,"Thu, 19 Mar 2026 17:00:00 +0900"
국회,“최은석은 ‘강한 상대’가 아니라 ‘다른 상대’…민주당에도 새로운...,"한편, CJ제일제당 대표이사를 역임한 최 의원은 ‘비비고’를 통해 K-푸드를 세계화하고 ‘올리브영’ 성공 신화를 이끈 성과를 바탕으로 ‘100대 CEO’에 선정되는 등 기업가 정신을 평가받아 국회에 입성한 바 있다.",https://biz.heraldcorp.com/article/10698346?ref=naver,https://n.news.naver.com/mnews/article/016/0002616443?sid=100,"Thu, 19 Mar 2026 17:00:00 +0900"
국회,한국조정학회 '의료분쟁조정과 민사조정' 학술대회 20일 개최,특히 국회에서 논의 중인 의료분쟁조정법 개정안과 관련해 조정 제도의 역할과 한계를 점검하는 데 초점을 맞췄다&quot;고 밝혔다. 유병현 회장은 &quot;의료분쟁은 전문성과 특수성이 강해 단순한 법적 판단만으로 해결하기... ,https://www.lawtimes.co.kr/news/articleView.html?idxno=218039,https://www.lawtimes.co.kr/news/articleView.html?idxno=218039,"Thu, 19 Mar 2026 17:00:00 +0900"
국회,노란봉투법 시행 9일···교섭요구 683건 쏟아져,"국회 기후에너지환경노동위원회 소속 국민의힘 간사인 김형동 의원&lt;사진&gt;은 19일 노란봉투법 시행 초기부터 산업 현장의 혼란이 가중되고 있다고 지적했다. 김 의원이 고용노동부로부터 제출받은 자료에 따르면, 지난... ",https://www.koscaj.com/news/articleView.html?idxno=322984,https://www.koscaj.com/news/articleView.html?idxno=322984,"Thu, 19 Mar 2026 17:00:00 +0900"
국회,"특검, 김현태 전 707단장 구속 요청...&quot;사회분열 조장&quot;","특검팀은 &quot;김 전 단장은 내란 핵심 임무인 국회 무력화를 위해 국회의사당 봉쇄 등을 직접 지휘하고 실행한 사람&quot;이라며 &quot;그 역할과 가담 정도만 보더라도 구속 수사와 재판받는 여인형 전 국군방첩사령관, 곽종근 전 육군... ",http://www.fnnews.com/news/202603191611346517,https://n.news.naver.com/mnews/article/014/0005494343?sid=102,"Thu, 19 Mar 2026 16:58:00 +0900"
