Keyword,Title,Description,Original Link,Link,Publication Date
관료,"[지선26, 선택!심판!] 황대호 불출마·한준호 지지 선언…경기지사 경선...",황 위원장은 &quot;오늘부로 출마를 접고 한준호 의원의 경기도지사 도전에 함께하겠다&quot;며 &quot;이재명 정부의 성공과 더 나은 경기도를 위해 시대교체의 길에 동행하겠다&quot;고 밝혔다./ 김두일 기자 특히 그는 &quot;관료적이고 권위적인... ,http://www.hansbiz.co.kr/news/articleView.html?idxno=824621,http://www.hansbiz.co.kr/news/articleView.html?idxno=824621,"Mon, 16 Mar 2026 17:00:00 +0900"
관료,신흥·개도국 “美국제법 위반·유럽 침묵…세계 이끌 자격 없다”,"미국, 유럽, 신흥국 등 약 110개국에서 정부 관료 및 전문가들이 참석했다. 닛케이는 “현장에서 가장 깊은 인상을 남긴 것은 신흥국들이 트럼프 행정부를 바라보는 시선이 예상보다 훨씬 냉담하고 혹독했다는 현실”... ",http://www.edaily.co.kr/news/newspath.asp?newsid=04264006645383976,https://n.news.naver.com/mnews/article/018/0006236512?sid=104,"Mon, 16 Mar 2026 16:56:00 +0900"
관료,“적자국채 불난집에 기름 붓는 격... 원포인트 추경으로 효과 최대화”,기획예산처 출신의 한 전직 고위 관료는 16일 “추경을 짜다 보면 온갖 증액 요구가 빗발치는데 이재명 대통령 또한 재정의 적극적 역할을 강조하고 있어 판도가 완전히 달라질 가능성도 배제할 수 없다”고 말했다.... ,https://www.sedaily.com/article/20019987?ref=naver,https://n.news.naver.com/mnews/article/011/0004599841?sid=101,"Mon, 16 Mar 2026 16:55:00 +0900"
관료,"체코 신정부, 고부가가치 경제 전환 위한 국가경제전략 발표","비즈니스 환경(행정·규제) 분야에서는 관료주의 축소와 디지털 정부를 핵심 해법으로 제시했다. 2028년까지 기업가 포털을 출시하고, 2029년까지 기업 행정 부담을 20% 줄이는 것을 목표로 통합 보고체계 도입 및... ",http://dream.kotra.or.kr/kotranews/cms/news/actionKotraBoardDetail.do?SITE_NO=3&MENU_ID=80&CONTENTS_NO=2&bbsGbn=242&bbsSn=242&pNttSn=239614,http://dream.kotra.or.kr/kotranews/cms/news/actionKotraBoardDetail.do?SITE_NO=3&MENU_ID=80&CONTENTS_NO=2&bbsGbn=242&bbsSn=242&pNttSn=239614,"Mon, 16 Mar 2026 16:55:00 +0900"
관료,"황대호 경기도의원, 지방선거 불출마…한준호 도지사 예비후보 지지","역동성, △관료적이고 권위적인 행정에서 벗어나 용인반도체산단, K-컬처밸리, 서울-양평고속도로 등 31개 시군의 현안을 대통령과 협력해 해결할 추진력을 겸비했다는 점을 꼽았다. 황 의원은 &quot;경기도의 새로운 비전은... ",https://www.newspim.com/news/view/20260316001060,https://www.newspim.com/news/view/20260316001060,"Mon, 16 Mar 2026 16:33:00 +0900"
관료,황대호 경기도의원 “지방선거 불출마”..한준호 경기지사 도전 지지 선...,"황 의원은 “이재명 정부의 가치와 철학을 이어갈 수 있는 적임자이며, 점점 젊어지는 경기도에 걸맞은 젊은 일꾼”이라며 “관료적이고 권위적인 경기도 행정을 혁신할 추진력을 갖춘 인물”이라고 평가했다. 이어... ",https://www.viva100.com/article/20260316501306,https://www.viva100.com/article/20260316501306,"Mon, 16 Mar 2026 16:32:00 +0900"
관료,이재명 대통령에 쓴소리 한인섭 &quot;검찰개혁 의지 실종…치명적 오류&quot;,"(윤석열 정부에서) 무조건 맹종ㆍ굴신했던 한덕수 이하 관료들은 그 대가를 치르고 있다&quot;며 &quot;국민이 따라야 할 의무는 없고, 공직자는 국민 설득하면서 국민 견해 경청해야 할 무한책무를 진다&quot;고 충고했다. 한인섭 서울대... ",http://www.lawleader.co.kr/news/articleView.html?idxno=18719,http://www.lawleader.co.kr/news/articleView.html?idxno=18719,"Mon, 16 Mar 2026 16:26:00 +0900"
관료,"경기도의회 황대호 위원장, 지방선거 불출마…한준호 지지선언","그러면서 &quot;한 의원은 이재명 정부의 가치와 철학을 이어갈 수 있는 적임자로 점점 젊어지는 도에 걸맞은 젊은 일꾼&quot;이라며 &quot;관료적이고 권위적인 도를 혁신하고, 도의 새로운 비전을 담기 위해선 한준호가 필요하다&quot;고... ",https://www.kihoilbo.co.kr/news/articleView.html?idxno=3016394,https://www.kihoilbo.co.kr/news/articleView.html?idxno=3016394,"Mon, 16 Mar 2026 16:02:00 +0900"
관료,이스라엘 &quot;작전 최소 3주 더&quot; 이란 &quot;협상은 없다&quot;… 17일째 공격 지속,"도널드 트럼프 미국 대통령과 행정부 주요 인사들이 '전쟁의 끝이 머지않았다'는 메시지를 발신하고 있지만, 실제로는 종전이 요원하다는 분석이 나왔다. 미국과 이란이 모두 제3국 중재를 뿌리치는 등 휴전 의향조차... ",https://www.hankookilbo.com/news/article/A2026031609510000516?did=NA,https://n.news.naver.com/mnews/article/469/0000919716?sid=104,"Mon, 16 Mar 2026 16:01:00 +0900"
관료,"부산교육감 선거, 김석준–최윤홍 '양자 구도' 가능성",교육행정 실무 경험이 풍부한 관료 출신이라는 점을 강점으로 내세우고 있다. 최근 여론조사에서는 보수 성향 후보군 가운데 상대적으로 높은 지지도를 보이며 존재감을 나타내고 있다. 내외경제TV가 여론조사기관... ,https://daily.hankooki.com/news/articleView.html?idxno=1347434,https://daily.hankooki.com/news/articleView.html?idxno=1347434,"Mon, 16 Mar 2026 15:52:00 +0900"
관료,[데이터 뉴스룸] 전자 업체 사외이사 영입 1순위로 '재계' 출신 60% 육박...,행정 등 관료 출신 중에는 하나마이크론에서 금융감독원 국장을 역임했던 윤승한 새시대 회계법인 심리위원장이 이번에 신규 사외이사 명단에 이름을 올렸다. 이녹스첨단소재도 금융감독원 금융투자검사 국장을... ,https://www.greened.kr/news/articleView.html?idxno=338069,https://www.greened.kr/news/articleView.html?idxno=338069,"Mon, 16 Mar 2026 15:48:00 +0900"
관료,국민의힘 “이재명 정권 '방탄 독재-민생 파탄-공소취소 거래 의혹 밝혀...,그러면서 그는 “임진왜란 당시 백성을 버린 관료들의 역사가 되풀이돼서는 안 된다”며 “민주주의 대원칙을 무너뜨리는 신독재의 망령을 반드시 막아내야 한다”... ,http://www.breaknews.com/1192134,http://www.breaknews.com/1192134,"Mon, 16 Mar 2026 15:48:00 +0900"
관료,&quot;지방선거 코앞인데 제도개혁은 실종?&quot;,"이들은 &quot;일당독점과 관료지배, 정경유착과 부정부패, 권력의 무책임과 도덕적 해이가 대구를 정체의 늪으로 밀어 넣었다&quot;며 ▲기초의회 3~5인 중대선거구제 전면 도입 ▲자치단체장 결선투표제 실시 ▲지방의회 연동형... ",https://www.ohmynews.com/NWS_Web/View/at_pg.aspx?CNTN_CD=A0003215340&CMPT_CD=P0010&utm_source=naver&utm_medium=newsearch&utm_campaign=naver_news,https://n.news.naver.com/mnews/article/047/0002508236?sid=102,"Mon, 16 Mar 2026 15:46:00 +0900"
관료,"황대호 위원장, 지방선거 불출마 선언… 민주 경기지사 경선 ‘한준호 ...","그러면서 한 의원을 지지하는 이유로 이재명 대통령과 국정철학을 공유하고 있다는 점, 경기도에 걸맞은 젊은 리더십, 관료적 도정을 혁신할 적임자라는 점 등을 꼽았다. 끝으로 “이 도전의 끝에는 대한민국의 새로운... ",https://www.kyeongin.com/article/1760307,https://www.kyeongin.com/article/1760307,"Mon, 16 Mar 2026 15:38:00 +0900"
관료,"6·3부산시장 선거, PK 정치판 뒤흔들 최대 승부처",부산 지역 국회의원들과 일부 전직 관료 출신 인사들이 도전 가능성을 타진하는 것으로 알려졌다. 특히 PK 정치권에서는 “부산시장 선거는 단순한 지방선거가 아니라 전국 정치의 바로미터이다”라는 말이 나올 정도로... ,https://m.skyedaily.com/news_view.html?ID=300374,https://m.skyedaily.com/news_view.html?ID=300374,"Mon, 16 Mar 2026 15:34:00 +0900"
관료,"오거돈·김영춘·전재수...민주당 부산시장 후보 공식, 또 '해수부 장관...","오 전 시장은 행정고시 출신 관료로 부산시 정무부시장과 행정부시장을 거쳐 해양수산부 장관을 지냈고... 해양 분야에서 잔뼈가 굵은 실무 관료 출신이라기보다 정치인 출신 장관에 가까웠지만, 해수부 장관 경력은... ",https://www.thepublic.kr/news/articleView.html?idxno=297533,https://www.thepublic.kr/news/articleView.html?idxno=297533,"Mon, 16 Mar 2026 15:34:00 +0900"
관료,"황대호 경기도의원, 수원시장 불출마 …한준호 경기지사 예비후보 지지",지지 이유로는 ▲이재명 정부의 가치와 철학을 이어갈 적임자라는 점 ▲IT·금융 등 민간 분야에서 폭넓은 경험을 갖춘 역동적인 리더십 ▲관료적 행정에서 벗어나 경기도 현안을 해결할 추진력을 갖춘 점 등을 꼽았다.... ,http://www.seoulwire.com/news/articleView.html?idxno=711501,http://www.seoulwire.com/news/articleView.html?idxno=711501,"Mon, 16 Mar 2026 15:32:00 +0900"
관료,서울교통공사 노조 &quot;알박기 인사 중단하라&quot;,또 서울시 고위 관료 출신인 김태균 전 부시장을 서울교통공사 사장으로 내정하고 인사청문위원회를 구성하는 것은 차기 시장의 인사권을 침해하는 무책임한 행정이라고 규탄했습니다. 서울교통공사 노조는 17일... ,http://news.lghellovision.net/news/articleView.html?idxno=537484,http://news.lghellovision.net/news/articleView.html?idxno=537484,"Mon, 16 Mar 2026 15:24:00 +0900"
관료,"장병길, 예산군수 출마 선언",오는 6·3 지방선거에서 충남 예산군수 선거에 도전하는 장병길 예비후보가 16일 공식 출마를 선언하며 &quot;관료 중심 행정을 성과 중심의 경영으로 바꾸겠다&quot;고 밝혔다. 장 예비후보는 이날 예산군청 브리핑룸에서 가진... ,https://www.joongdo.co.kr/web/view.php?key=20260316010005195,https://www.joongdo.co.kr/web/view.php?key=20260316010005195,"Mon, 16 Mar 2026 15:16:00 +0900"
관료,"장병길 예비후보, 예산군 'CEO' 자임","장 예비후보는 &quot;자신은 밑바닥부터 성장한 '진짜 예산 사람이자, 실전 경영 전문가'라며, 예산 군정을 관료적 행정에서 성과 중심의 경영으로 대전환시킬 것&quot;이라고 강조했다. 장 예비후보는 젊은 시절 삶의 밑 바닥인... ",https://www.jeonmae.co.kr/news/articleView.html?idxno=1238982,https://www.jeonmae.co.kr/news/articleView.html?idxno=1238982,"Mon, 16 Mar 2026 15:14:00 +0900"
관료,"황대호 도의회 문체위원장, 불출마 선언…한준호 지지 [영상]","아울러 황 위원장은 한 의원이 점점 젊어지는 경기도에 걸맞은 ‘젊은 일꾼’이라며, 관료적이고 권위적인 경기도를 혁신할 필요가 있다는 점을 해결 과제로 제시했다. 황 위원장은 “한준호 의원과 기쁜 마음으로... ",https://www.kyeonggi.com/article/20260316580335,https://n.news.naver.com/mnews/article/666/0000099365?sid=100,"Mon, 16 Mar 2026 15:12:00 +0900"
관료,"황대호 위원장, 지방의회 불출마··· 한준호 경기도지사 후보 지지 선...","이어 점점 젊어지는 경기도에 걸맞은 젊은 일꾼이 필요하다고 했고, 마지막으로 관료적이고 권위적인 도정을 바꿀 수 있는 추진력 있는 리더십이 필요하다고 강조했다. 특히 용인반도체산단, K컬처밸리, 서울양평고속도로... ",https://www.jeonmae.co.kr/news/articleView.html?idxno=1238964,https://www.jeonmae.co.kr/news/articleView.html?idxno=1238964,"Mon, 16 Mar 2026 14:44:00 +0900"
관료,"&quot;NST 공통행정 채용 반대&quot;… 과학계, '즉각 중단' 촉구",풍부한 관료들이 업무를 수행해 비용 절감과 기관장 전횡 견제가 동시에 가능하다”고 밝혔다. 또 노조는 이번 채용의 추진 배경에 NST 내부 임금 인상이 연관됐다는 의혹도 제기했다. 노조는 “NST가 충원 인력 채용... ,https://www.kukinews.com/article/view/kuk202603160134,https://www.kukinews.com/article/view/kuk202603160134,"Mon, 16 Mar 2026 14:40:00 +0900"
재경부,"공공기관 통폐합, 이달 말 밑그림…인천공항 노조 “양대 공항공사 통합...","각 부처는 전문가 의견을 검토해, 이번주부터 재경부와 협의할 예정이다. 부처별 협의를 거친 뒤 재경부는 청와대에 초안을 보고할 예정이다. 국토교통부에 전달된 전문가 의견에는 인천공항공사와 한국공항공사... ",https://www.hani.co.kr/arti/economy/economy_general/1249560.html,https://n.news.naver.com/mnews/article/028/0002796155?sid=101,"Mon, 16 Mar 2026 16:54:00 +0900"
재경부,국제유가 급등에 정부 고심…유류세 인하 확대하되 ‘유가 보조금’ 무...,재경부 고위 관계자는 16일 “고유가 상황이 얼마나 장기화할지 불확실한 만큼 유류세 인하폭을 한 번에... 재경부 고위 관계자는 “취약계층 문제는 보조금 등의 방법으로 해결해야 한다”고 말했다. 이재명 대통령도... ,https://www.khan.co.kr/article/202603161636011,https://n.news.naver.com/mnews/article/032/0003433591?sid=101,"Mon, 16 Mar 2026 16:36:00 +0900"
재경부,인천공항공사 등 3개 공항 기관 통폐합에 노조 반발,16일 재정경제부에 따르면 재경부는 3개 공항 공공기관 통폐합안을 마련해 국토교통부에 전달했다. 재경부 의견 제시 요청을 받은 국토부는 현재 통폐합을 검토 중인 것으로 알려졌다. 재경부는 &quot;민간전문가 등이 공항 관리... ,https://www.econovill.com/news/articleView.html?idxno=733338,https://www.econovill.com/news/articleView.html?idxno=733338,"Mon, 16 Mar 2026 15:26:00 +0900"
재경부,"“먹거리 이어 교복·장례식장까지”…공정위, 민생 품목 조사 확대","이와 함께 재경부, 농림축산식품부, 산업통상부 등 관계부처는 민생 물가에 민감한 쌀, 석유, 통신비 등 23개... 게 재경부 설명이다. 통신비의 경우 필수 서비스지만 과점 구조로 인해 지속적인 관리가 필요하다는 이유로... ",https://www.ekn.kr/web/view.php?key=20260316024078072,https://www.ekn.kr/web/view.php?key=20260316024078072,"Mon, 16 Mar 2026 15:14:00 +0900"
재경부,공항 공기업 통합 추진…“운영 효율화 기대”vs“인국공 경쟁력 약화 ...,"16일 관가에 따르면 정부는 최근 공공기관 통폐합 논의의 일환으로 인천국제공항공사와 한국공항공사, 가덕도신공항건설공단 통합 방안을 검토하고 관련 부처인 국토부와 재경부 등에 내용을 전달했다. 정부는 관계 부처와... ",https://www.etoday.co.kr/news/view/2565752,https://www.etoday.co.kr/news/view/2565752,"Mon, 16 Mar 2026 15:06:00 +0900"
재경부,인천공항 노조 “공항 운영사 통합 추진 즉각 철회하라”,재경부는 “3개 공기업의 통합이 결정된 것은 없다”고 밝혔지만 공사 노조 등은 졸속추진이라며 반대 입장을 밝혔다. 인천공항 전경 인천공항 내 7개 노동조합으로 구성된 인천공항졸속통합저지공동투쟁위원회는 16일... ,https://www.segye.com/newsView/20260316512067?OutUrl=naver,https://n.news.naver.com/mnews/article/022/0004113140?sid=102,"Mon, 16 Mar 2026 14:43:00 +0900"
재경부,"내려도 1830원대...여전히 부담스러운 기름값, 물가 들끓는다",재경부 관계자는 &quot;소비자물가지수를 구성하는 품목은 458개로 석유류가 올라가더라도 농축수산물 등 (물가상승률은) 좀 더 나은 편이라 종합적으로 고려해야 한다&quot;며 &quot;정부가 민생물가 안정을 위해 노력하는 만큼... ,https://www.mt.co.kr/economy/2026/03/16/2026031608484354342,https://n.news.naver.com/mnews/article/008/0005330454?sid=101,"Mon, 16 Mar 2026 14:34:00 +0900"
재경부,"정부, 에너지·민생 대응 추경 추진…3월 말 정부안 국회 제출 목표",재경부는 세수 전망 작업을 예년보다 앞당겼다. 재경부 세제실은 지난 14일 세수 가추계 전망치를 산출해 기획처에 전달했다. 통상 3월 말 법인세 신고·납부 실적을 확인한 뒤 세수 재추계를 거쳐 추경 논의를 진행하지만... ,https://biz.heraldcorp.com/article/10695287?ref=naver,https://n.news.naver.com/mnews/article/016/0002614294?sid=101,"Mon, 16 Mar 2026 14:34:00 +0900"
재경부,"신용보증기금, 강승준 이사장 취임","1991년 행정고시 35회로 공직생활을 시작한 강 이사장은 기재부(현 재경부) 예산총괄과장, 공공정책국장을 거쳐 재정관리국장과 차관보급인 재정관리관 등 주요 보직을 역임한 정통 경제 전문가다. 또한 한국은행... ",https://www.job-post.co.kr/news/articleView.html?idxno=210401,https://www.job-post.co.kr/news/articleView.html?idxno=210401,"Mon, 16 Mar 2026 13:52:00 +0900"
재경부,[사실은 이렇습니다] 재경부 &quot;공항 관리 공공기관 개편안 결정된 바 없...,"[재경부 설명] □ 공항 관리 공공기관 개편안은 민간 전문가 등을 중심으로 다양한 내용이 검토되고 있으나, 이와 관련해서 전혀 결정된 바 없습니다. ㅇ 향후 공항 운영의 효율성과 고객 서비스 품질 제고 가능성 등을... ",https://www.korea.kr/briefing/actuallyView.do?newsId=148960884&call_from=naver_news,https://www.korea.kr/briefing/actuallyView.do?newsId=148960884&call_from=naver_news,"Mon, 16 Mar 2026 13:26:00 +0900"
재경부,&quot;지방 공항 적자 인천공항이 메우나&quot;… 인천·한국공항공사 통합에 노조...,"정부의 인천국제공항공사(인천공항공사)와 한국공항공사, 가덕도신공항건설공단 통합 방안에 인천공항공사 내부에서 반발하는 목소리가 나왔다. 인천공항공사노동조합 등 7개 노조는 16일... ",https://www.hankookilbo.com/news/article/A2026031608020003681?did=NA,https://n.news.naver.com/mnews/article/469/0000919662?sid=102,"Mon, 16 Mar 2026 13:01:00 +0900"
재경부,"국회, '원스톱 조세불복' 심사 착수…재경부는 '신중'",국회가 조세불복 절차의 온라인 통합을 위한 국세기본법 개정 논의에 착수했다. 다만 원스톱 행정심판 시스템 구축을 둘러싸고 재정경제부가 혼란을 우려하며 신중론을 펴고 있다. 18일 국회 재정경제기획위원회는... ,https://www.sejungilbo.com/news/articleView.html?idxno=57527,https://www.sejungilbo.com/news/articleView.html?idxno=57527,"Mon, 16 Mar 2026 12:50:00 +0900"
재경부,"국세청, 최고가격제･매점매석 대응 금일 현장점검 실시","최고가격제와 관련하여 폭리를 얻을 목적으로 매점하거나 판매를 기피하는 행위를 방지하기 위해 오늘 고시된 ｢석유제품 매점매석행위 금지 등에 관한 고시｣(재경부 제2026-66호, '26.3.13.)에 따르면, 석유정제업자는... ",https://www.job-post.co.kr/news/articleView.html?idxno=210362,https://www.job-post.co.kr/news/articleView.html?idxno=210362,"Mon, 16 Mar 2026 12:04:00 +0900"
재경부,인천공항공사 등 3개 공항 기관 통폐합 검토…노조 반발,"16일 재정경제부에 따르면 재경부는 이같은 내용의 공공기관(공사, 공단) 통폐합안을 마련해 국토교통부 등 관련 부처에 전달했다. 재경부의 의견 제시 요청을 받은 국토부는 현재 통폐합안을 검토하고 있는 것으로... ",http://www.edaily.co.kr/news/newspath.asp?newsid=03181606645383976,https://n.news.naver.com/mnews/article/018/0006236253?sid=102,"Mon, 16 Mar 2026 11:50:00 +0900"
재경부,"정부, 이달말 추경안 국회제출…최대 20조 관측",재경부는 세수 전망 작업을 예년보다 앞당겼다. 재경부 세제실은 지난 14일 세수 가추계 전망치를 산출해 기획처에 전달했다. 통상 3월 말 법인세 신고·납부 실적을 확인한 뒤 세수 재추계를 거쳐 추경 논의를 진행하지만... ,https://biz.heraldcorp.com/article/10695089?ref=naver,https://n.news.naver.com/mnews/article/016/0002614150?sid=101,"Mon, 16 Mar 2026 11:27:00 +0900"
재경부,인천공항·공항공사에 가덕도까지···정부 3개 기관 통합 추진에 노조...,"재경부는 인천공항공사, 한국공항공사, 가덕도신공항건설공단 등 공항 관리기관 개편안에 대해 민간 전문가 등을 중심으로 다양한 내용을 검토하고 있다고 16일 밝혔다. 재경부는 “공항 운영의 효율성과 고객서비스 품질... ",https://www.khan.co.kr/article/202603161126001,https://n.news.naver.com/mnews/article/032/0003433499?sid=100,"Mon, 16 Mar 2026 11:26:00 +0900"
재경부,"與, 중동 사태 추경 편성 강조…&quot;민생 회복 위해 필요&quot;",다만 추경 규모에 대해선 &quot;아직 정해진 것은 없다&quot;며 &quot;기획예산처와 재경부 등 관계부처에서 논의하는 상황이라 구체적으로 언급할 단계가 아니다&quot;고 말을 아꼈다. 그는 추경이 국회에서 언제 처리되는지 예상하느냐는... ,https://www.ajunews.com/view/20260316094804367,https://www.ajunews.com/view/20260316094804367,"Mon, 16 Mar 2026 10:56:00 +0900"
재경부,"당정, 추경안 3월 말까지 국회 제출키로…&quot;심사 과정 10일 이내&quot;","그러한 소요들이 확정돼야 하고 또 재경부에서 내년 초과세수 규모에 대한 검토를 하고 있으니 가용 재원 규모, 긴급 지출소요 등 검토가 이뤄진 후에 구체적 추경 규모가 논의될 수 있다&quot;고 부연했다. 또 당정은 중동... ",https://www.newspim.com/news/view/20260316000371,https://www.newspim.com/news/view/20260316000371,"Mon, 16 Mar 2026 10:31:00 +0900"
재경부,'밤샘 추경' 속도 붙었다…재경부 세수 가추계-기획처 사업 검토,재경부 관계자는 &quot;이번에는 3월 법인세 실적을 확인하기 전에 전망치를 토대로 세수 추계를 진행해야 하는 상황&quot;이라며 &quot;기획예산처에서 사업 규모를 검토하려면 세수 전망이 먼저 나와야 하기 때문에 가능한 한 빠르게... ,https://www.widedaily.com/news/articleView.html?idxno=290369,https://www.widedaily.com/news/articleView.html?idxno=290369,"Mon, 16 Mar 2026 10:28:00 +0900"
재경부,재경위 조세소위 출석한 이형일 재경부 1차관,이형일 재정경제부 1차관이 16일 국회에서 열린 재정경제기획위원회 조세소위원회에 출석해 상임위 관계자와 대화하고 있다. 2026.3.16,https://www.yna.co.kr/view/PYH20260316054400013?input=1196m,https://n.news.naver.com/mnews/article/001/0015961031?sid=100,"Mon, 16 Mar 2026 10:28:00 +0900"
재경부,"당정 &quot;중동발 민생위기 추경, 3월말 국회 제출…10일내 처리”","회의에는 코트라·무역협회·중기중앙회·한경협·대한상의 등 경제단체와 KDI·산업연구원, 재경부·중기부·금융위·에너지부 차관급이 참석했다. 에너지 수급과 관련해선 현재 208일분인 원유 비축량을 유지하면서... ",https://www.etoday.co.kr/news/view/2565641,https://www.etoday.co.kr/news/view/2565641,"Mon, 16 Mar 2026 10:14:00 +0900"
재경부,공항 공기업 왜 하나로 묶나…정부 통합 논의 착수,이에 대해 재경부 관계자는 &quot;공항 운영사의 통합 논의는 첫 시작단계에 있고 가덕도신공항 건설비용을 인천공항이 부담한다는 논의는 현재까지 없다&quot;고 선을 그었다. 그는 &quot;민간 전문가들로 구성된 민간작업반이 그간... ,https://www.newsis.com/view/NISX20260316_0003549434,https://n.news.naver.com/mnews/article/003/0013823832?sid=102,"Mon, 16 Mar 2026 10:05:00 +0900"
재경부,인천공항·한국공항공사 등 3곳 통폐합 검토…공공기관 개혁 '속도',"재경부는 &quot;공항 관리 공공기관 개편안은 민간 전문가 등을 중심으로 다양한 내용이 검토되고 있으나, 이와... 재경부 관계자는 &quot;민간 작업반이 그간 언론과 국회 지적 등을 토대로 부처에 전달한 다양한 아이디어 중 하나... ",https://www.news1.kr/economy/trend/6102061,https://n.news.naver.com/mnews/article/421/0008827761?sid=101,"Mon, 16 Mar 2026 09:49:00 +0900"
재경부,"금투협, 신임 이사로 배형근 현대차증권 대표·서정호 변호사 선임","배 대표는 고려대학교 경영학과를 나와 현대차그룹에 입사해, 현대모비스 재경부문장 부사장(CFO), 현대차 경영층보좌역 상무, 현대차 기업전략실장 전무를 거쳐 현대차증권 대표이사를 맡고 있다. 서변호사는 서울... ",https://www.dnews.co.kr/uhtml/view.jsp?idxno=202603142035461430157,https://www.dnews.co.kr/uhtml/view.jsp?idxno=202603142035461430157,"Mon, 16 Mar 2026 09:42:00 +0900"
재경부,공공기관 통폐합 속도… 재경부 일단 '신중',재경부는 &quot;민간 전문가 등을 중심으로 다양한 내용이 검토되고 있지만 관련해서 전혀 결정된 바 없다&quot;며... 재경부 대변인은 이날 본지와의 통화에서 &quot;아직 정해진 바 없으며 금주 회의 여부도 잘 모르겠다&quot;고 말했다. 앞서... ,https://weekly.hankooki.com/news/articleView.html?idxno=7154734,https://weekly.hankooki.com/news/articleView.html?idxno=7154734,"Mon, 16 Mar 2026 09:34:00 +0900"
