Keyword,Title,Description,Original Link,Link,Publication Date
정성호,"성남보호관찰소, 사회봉사·수강명령 기피한 40대 구치소 유치 후 집행...",법무부(장관 정성호) 성남보호관찰소는 징역형의 집행유예 기간 중 15개월 이상 사회봉사명령 집행을 피해 도망다닌 A씨(49)를 서울동부구치소에 유치하고 집행유예 취소 신청을 했다고 16일 밝혔다. A씨는 지난 2024년... ,http://www.lawissue.co.kr/view.php?ud=2026031613571963879a8c8bf58f_12,http://www.lawissue.co.kr/view.php?ud=2026031613571963879a8c8bf58f_12,"Mon, 16 Mar 2026 14:00:00 +0900"
정성호,[브릿지 칼럼] 공소취소와 보완수사를 둘러싼 ‘명청대전’,"정성호 법무부 장관을 필두로 한 정부 측은 실무적 효율성을 이유로 보완수사권의 필요성을 주장하고 있으나, 당내 강경파는 ‘검찰개혁의 후퇴’로 규정하며 강력히 반발하고 있다. 한편으로는 역학 관계의 충돌이다.... ",https://www.viva100.com/article/20260316500410,https://www.viva100.com/article/20260316500410,"Mon, 16 Mar 2026 13:40:00 +0900"
정성호,정청래 &quot;검찰개혁 원칙 지켜지게 당정청 심도 있게 조율&quot;,이미 작년 정성호 법무부 장관이 국회 법사위에 출석해 &quot;이재명 정부의 검찰은 다르다&quot;는 발언을 해 논란을... 또 정성호 법무부 장관이 중앙일보와의 인터뷰에서 '경찰의 비대화'를 이유로 검찰에 보완수사권이 필요하다는... ,https://www.goodmorningcc.com/news/articleView.html?idxno=442915,https://www.goodmorningcc.com/news/articleView.html?idxno=442915,"Mon, 16 Mar 2026 13:40:00 +0900"
정성호,송언석 &quot;헌법 절차 무시한 파병 결정은 안 돼&quot;,"정성호 법무부 장관의 외압 의혹, 송영길 전 대표의 출마 선언, 김용·김경수 등 범죄 연루 인사들의 정치 행보를 언급하며 &quot;대한민국 사법 체계는 대혼돈의 시대에 접어들었다. 그 피해는 결국 국민에게 돌아갈 것&quot;이라고... ",https://www.gukjenews.com/news/articleView.html?idxno=3530127,https://www.gukjenews.com/news/articleView.html?idxno=3530127,"Mon, 16 Mar 2026 13:00:00 +0900"
정성호,"與, ‘李 대통령 공소취소 거래설 논란’ 정면 돌파 위해 국정조사 요구...","특히 송 원내대표는 “이 대통령은 연일 SNS에 대북송금 사건, 조폭 연루설 등(본인 관련 사건)을 직접 거론하면서 언론 겁박 선봉에 섰고 정성호 법무부 장관은 검찰에 공소취소 외압을 가했다”며 “(이 대통령 사건)... ",https://www.siminilbo.co.kr/news/newsview.php?ncode=1160276460806298,https://www.siminilbo.co.kr/news/newsview.php?ncode=1160276460806298,"Mon, 16 Mar 2026 12:48:00 +0900"
정성호,민주당 쪼개는 민주당발 음모론,"서울동부지검장은 정성호 법무부 장관과 주고받은 문자 내역을 공개하며 “장관님께 문자메시지와 이메일로 종종 건의사항을 보내고 있는데, 가장 최근 문자를 받은 것은 지난 12월”이라고 밝혔다. 정성호 법무부 장관은... ",https://www.ilyosisa.co.kr/news/article.html?no=254776,https://www.ilyosisa.co.kr/news/article.html?no=254776,"Mon, 16 Mar 2026 11:32:00 +0900"
정성호,"서울남부보호관찰소, 준법의식 함양...초등학교생 대상 법교육 실시","이운안 기자 = 법무부(장관 정성호) 서울남부보호관찰소는 16일 양천구 소재 갈산초등학교 4~6학년생들을 대상으로 법교육을 실시하였다. 이번 법교육은 법무부로부터 전문강사를 지원받아 실시하였으며, 학교폭력 및... ",https://www.gukjenews.com/news/articleView.html?idxno=3529998,https://www.gukjenews.com/news/articleView.html?idxno=3529998,"Mon, 16 Mar 2026 11:24:00 +0900"
정성호,"국힘 &quot;범죄자들, 너도나도 재판소원...지금이라도 사법3법 고쳐야&quot;",송 원내대는 &quot;검찰에 공공연하게 7800억 원의 대장동 사건에 대한 항소 취소 외압을 자행한 정성호 법무부 장관이 이번에는 이 대통령에 대한 공소 취소 외압을 하고 있다&quot;며 &quot;이는 경우에 따라 대통령 탄핵까지 가능하다는... ,https://www.mediapen.com/news/view/1087167,https://www.mediapen.com/news/view/1087167,"Mon, 16 Mar 2026 11:14:00 +0900"
정성호,"장동혁 &quot;법왜곡죄, 정치보복 칼날···여야 합의로 즉각 재개정해야&quot;","이어 &quot;국정조사권 발동을 요구하며 이재명 대통령 한 사람을 위한 공소 취소 선동에 홍위병 역할을 연일 매진하고 있다&quot;며 &quot;정성호 법무부 장관이 검찰에 이 대통령에 대한 공소 취소 외압을 자행하고 있고, 공소 취소를... ",https://www.polinews.co.kr/news/articleView.html?idxno=725527,https://www.polinews.co.kr/news/articleView.html?idxno=725527,"Mon, 16 Mar 2026 11:13:00 +0900"
정성호,"서울남부보호관찰소, 갈산초 4~6학년 학생 대상 법교육","법무부(장관 정성호) 서울남부보호관찰소는 3월 16일 양천구 소재 갈산초등학교 4~6학년생들을 대상으로 법교육을 진행했다고 밝혔다. 이번 법교육은 법무부로부터 전문강사를 지원받아, 학교폭력 및 사이버폭력 예방... ",http://www.lawissue.co.kr/view.php?ud=2026031611044167559a8c8bf58f_12,http://www.lawissue.co.kr/view.php?ud=2026031611044167559a8c8bf58f_12,"Mon, 16 Mar 2026 11:06:00 +0900"
정성호,[초점] &quot;경영권 싸움이 국제분쟁으로&quot;···현대엘리 vs 쉰들러 '20년 갈...,◇ 정성호 장관 &quot;사기업 갈등의 국가 책임화 차단&quot; = 이번 판정은 외국 투자자가 기업 간 분쟁을 국가 책임 문제로 확대하려는 시도를 차단한 사례라는 평가가 나온다. 정성호 법무부 장관은 페이스북에 이와 관련... ,https://www.seoulfn.com/news/articleView.html?idxno=623655,https://www.seoulfn.com/news/articleView.html?idxno=623655,"Mon, 16 Mar 2026 10:56:00 +0900"
정성호,국힘 &quot;법왜곡죄로 무법 독재 시대&quot;…박민영 등 재임명은 보류 (종합),송 원내대표는 &quot;국정조사를 요구하며 이 대통령 한 사람을 위한 공소 취소 선동의 홍위병 역할에 연일 매진하고 있다&quot;며 정성호 법무부 장관의 '대장동 사건 항소 포기 외압 의혹'을 거론하며 &quot;경우에 따라 대통령 탄핵까지... ,https://www.asiatoday.co.kr/view.php?key=20260316010004505,https://www.asiatoday.co.kr/view.php?key=20260316010004505,"Mon, 16 Mar 2026 10:40:00 +0900"
정성호,"정부, 쉰들러 국제투자분쟁 사건 100% 승소... 쉰들러배상 청구 모두 기...",정성호 법무부장관이 정부와 스위스의 글로벌 승강기 업체인 쉰들러 사이의... 정성호 법무부장관은 ‘앞으로도 우리 정부는 혼신의 힘을 다해 국제투자분쟁에... ,http://www.breaknews.com/1191970,http://www.breaknews.com/1191970,"Mon, 16 Mar 2026 10:22:00 +0900"
정성호,"국힘 &quot;李, SNS서 공소취소 선동 지휘…사법 3법, 지금이라도 고쳐야&quot;(종...",송 원내대표는 &quot;검찰에 공공연하게 7800억 원의 대장동 사건에 대한 항소 취소 외압을 자행한 정성호 법무부 장관이 이번에는 이 대통령에 대한 공소 취소 외압을 하고 있다&quot;며 &quot;이는 경우에 따라 대통령 탄핵까지... ,https://www.news1.kr/politics/assembly/6102172,https://n.news.naver.com/mnews/article/421/0008827826?sid=100,"Mon, 16 Mar 2026 10:15:00 +0900"
정일영,"정일영 의원, 공정·안전사회 패키지 3법 발의","정일영 의원 정일영 더불어민주당 의원이 최근 '법인세법', '성폭력범죄의 처벌 등에 관한 특례법', '형법' 개정안을 묶은 이른바 '공정·안전 사회 패키지 3법'을 대표 발의했다. 이번 법안은 허위 기부금영수증을 통한 세금... ",https://www.jeonmae.co.kr/news/articleView.html?idxno=1239012,https://www.jeonmae.co.kr/news/articleView.html?idxno=1239012,"Mon, 16 Mar 2026 16:00:00 +0900"
정일영,민주당 인천시당 '적격 판정' 기초단체장 예비후보 39명 중 18명 전과 이...,"연수구 2명 연수구에서는 김희철 전 더불어민주당 정일영 의원 보좌관은 지난 1997년 8월 20일 식품위생법 위반으로 벌금 200만원, 이어 1997년 11월 20일 식풍위생법 위반으로 벌금 500만원을 처분을 받아 전과 2건이... ",https://www.incheontoday.com/news/articleView.html?idxno=316467,https://www.incheontoday.com/news/articleView.html?idxno=316467,"Mon, 16 Mar 2026 15:42:00 +0900"
정일영,반복되는 허위 기부금영수증 가산세 최대 200% 중과 추진,"정일영 의원(더불어민주당) 의원은 이러한 내용을 담은 법인세법 개정안을 포함해 성폭력범죄의 처벌 등에... 정일영 의원은 &quot;허위 기부금으로 세금을 빼돌리고, 불법촬영물로 피해자의 삶을 파괴하며, 테러 협박으로... ",http://www.intn.co.kr/news/articleView.html?idxno=2049576,http://www.intn.co.kr/news/articleView.html?idxno=2049576,"Mon, 16 Mar 2026 11:50:00 +0900"
정일영,"더불어민주당 정일영, '공정·안전 사회 패키지 3법' 발의","기자 │더불어민주당 정일영(인천 연수을) 의원이 허위 기부금 영수증 발급, 불법촬영물 공유, 다중이용시설 대상 테러 협박 등 반사회 범죄 대응을 강화하는 이른바 '공정·안전 사회 패키지 3법'을 대표 발의했다. 정일영... ",https://www.incheontoday.com/news/articleView.html?idxno=316442,https://www.incheontoday.com/news/articleView.html?idxno=316442,"Mon, 16 Mar 2026 11:20:00 +0900"
정일영,"써브웨이, 잠봉 햄 활용 신메뉴 4종 출시","영상 속 카니는 프랑스어로 '맛있다'를 의미하는 &quot;쎄봉(C'est bon)!&quot;을 외치며 잠봉의 매력을 전달하며, 실제 프랑스어 전문가인 정일영 교수가 깜짝 등장해 유쾌한 호흡을 선보인다.",https://www.slist.kr/news/articleView.html?idxno=724110,https://www.slist.kr/news/articleView.html?idxno=724110,"Mon, 16 Mar 2026 10:42:00 +0900"
정일영,"“프랑스 정통햄 잠봉, 쎄봉!”… 써브웨이 ‘잠봉 샌드위치 컬렉션’ ...","실제 프랑스어 전문가인 정일영 교수가 깜짝 등장해 유쾌한 호흡을 선보인다. 두 사람의 케미는 “섬세하게 살아있는 결, 깊게 번지는 풍미”라는 메인 카피를 재미있고 직관적으로 전달한다. 최아람 써브웨이... ",http://www.segyebiz.com/newsView/20260316506690?OutUrl=naver,http://www.segyebiz.com/newsView/20260316506690?OutUrl=naver,"Mon, 16 Mar 2026 10:34:00 +0900"
정일영,정일영 의원 &quot;허위 기부금영수증 세금 탈루 엄단…가산세 최대 200% 중과...,"정일영 의원(더불어민주당)은 13일 법인세법, 성폭력범죄의 처벌 등에 관한 특례법, 형법 개정안 등 이른바... 정일영 의원은 “허위 기부금으로 세금을 빼돌리고, 불법촬영물로 피해자의 삶을 파괴하며, 테러 협박으로... ",https://www.taxtimes.co.kr/news/article.html?no=274313,https://www.taxtimes.co.kr/news/article.html?no=274313,"Mon, 16 Mar 2026 09:44:00 +0900"
정일영,"정일영, 기부금영수증 허위발급 시 가산세율 5%→10% 강화 추진","정일영 더불어민주당(인천 연수구을) 의원이 기부금 영수증 가산세율을 허위발급 시 10%, 기타 불성실 발급 시 5%, 명세 미작성 시 0.5%로 강화하는 내용을 담은 법인세법 일부 개정안을 대표 발의했다. 정일영 의원 정... ",https://www.sejungilbo.com/news/articleView.html?idxno=57524,https://www.sejungilbo.com/news/articleView.html?idxno=57524,"Mon, 16 Mar 2026 09:22:00 +0900"
정일영,"써브웨이, 프랑스 정통 맛 '잠봉 샌드위치 컬렉션' 출시","프랑스 현지 분위기를 유쾌하게 담아낸 광고 영상을 공개한다. 영상 속 카니는 프랑스어로 '맛있다'를 의미하는 &quot;쎄봉&quot;(C'est bon)!을 외치며 잠봉의 매력을 전달하며, 실제 프랑스어 전문가인 정일영 교수도 깜짝 등장한다.",https://www.news1.kr/industry/distribution/6102033,https://n.news.naver.com/mnews/article/421/0008827522?sid=101,"Mon, 16 Mar 2026 08:50:00 +0900"
정일영,허위 기부금 사기·불법촬영·테러 협박 등 '3대 반사회 범죄'정조준,"정국회 기획재정위원회 정일영 의원(더불어민주당,송도국제도시)은 최근 '법인세법', '성폭력범죄의 처벌... 이에 정일영 의원이 발의한 '공정·안전 사회 패키지 3법'은 다음과 같은 내용을 담고 있다. 법인세법 개정안은... ",https://www.pinpointnews.co.kr/news/articleView.html?idxno=436931,https://www.pinpointnews.co.kr/news/articleView.html?idxno=436931,"Mon, 16 Mar 2026 08:18:00 +0900"
정일영,"[입법 프리뷰] 정일영, ‘공정ㆍ안전 사회 패키지 3법’ 대표발의",15일 정일영 더불어민주당 의원은 △법인세법 △성폭력범죄의 처벌 등에 관한 특례법 △형법 개정안 등... 이에 정일영 의원이 발의한 ‘공정ㆍ안전 사회 패키지 3법’은 다음과 같은 내용을 담고 있다. 우선 법인세법... ,https://www.dnews.co.kr/uhtml/view.jsp?idxno=202603151626237070198,https://www.dnews.co.kr/uhtml/view.jsp?idxno=202603151626237070198,"Sun, 15 Mar 2026 16:40:00 +0900"
조승래,[부고종합·16일] 조승래 더불어민주당 국회의원 부친상 등,"■ 조승래 더불어민주당 국회의원 부친상 ▲조경제(향년 87세)씨 별세, 조형래·승래(더불어민주당 국회의원·사무총장)·명래 씨 부친상, 백희숙·조유신 씨 시부상, 조현준·현재·연우·혜정 씨 조부상, 김다운... ",https://www.safetimes.co.kr/news/articleView.html?idxno=240717,https://www.safetimes.co.kr/news/articleView.html?idxno=240717,"Mon, 16 Mar 2026 17:18:00 +0900"
조승래,"민주, 6·3 지선 앞두고 당직자들에 정치적 중립·보안 요청",조승래 민주당 사무총장은 최근 당 내 ‘전국동시지방선거 관련 당직자 중립의무 및 보안 준수 협조 요청’ 공지를 통해 이같이 밝혔다. 경선이 이뤄지는 상황에서 불필요한 공정성 시비를 차단하려는 것으로 보인다. 조... ,https://www.sedaily.com/article/20019905?ref=naver,https://n.news.naver.com/mnews/article/011/0004599783?sid=100,"Mon, 16 Mar 2026 14:54:00 +0900"
조승래,청장직 던진 김의겸에 조국-한동훈 설전까지…뜨거워진 군산 재선거,"이와 관련, 조승래 더불어민주당 사무총장은 지난달 22일 “재보궐 선거는 원칙적으로 전략 공천”이라며 “모든 지역에 후보를 내는 것에 대해 고민 중”이라고 선을 그었다. 정치권 일각에선 “민주당과 조국혁신당의... ",https://www.joongang.co.kr/article/25412078,https://n.news.naver.com/mnews/article/025/0003509329?sid=102,"Mon, 16 Mar 2026 14:09:00 +0900"
조승래,[부고] 조승래(더불어민주당 국회의원)씨 부친상,"▲조경제씨 별세, 조승래(더불어민주당 국회의원)씨 부친상 = 15일, 대전 성심장례식장 VIP1호실, 발인 17일 오전 7시20분, 장지 논산시 은진면 선영. 042-522-4494.",http://www.econonews.co.kr/news/articleView.html?idxno=431136,http://www.econonews.co.kr/news/articleView.html?idxno=431136,"Mon, 16 Mar 2026 11:16:00 +0900"
조승래,조승래 시인의 시통공간(詩通空間).538 - 구자순,"◇ 조승래 시인은 한국타이어 상무이사, 단국대학교 상경대 겸임교수(경영학박사)를 했고, 한국문인협회, 한국시인협회 이사, 계간문예작가회 부회장으로 활동 중이다. 또한 시향문학회와 시와시학 문인회 전임 회장이다.",https://www.newsgn.com/news/articleView.html?idxno=540081,https://www.newsgn.com/news/articleView.html?idxno=540081,"Mon, 16 Mar 2026 11:04:00 +0900"
조승래,&quot;아케이드-디지털 게임 분리 규제 긍정적···웹보드·P2E는 쟁점&quot;,아케이드 게임에 해당하는 특정 장소형 게임과 온라인 게임에 해당하는 디지털 게임의 규율체계를 이원화하는 내용의 게임법 전부개정안(조승래 더불어민주당 의원 대표 발의)에 대해 &quot;긍정적인 방향&quot;이라는 전문가... ,https://www.seoulfn.com/news/articleView.html?idxno=623644,https://www.seoulfn.com/news/articleView.html?idxno=623644,"Mon, 16 Mar 2026 10:00:00 +0900"
조승래,[부음] 박복순 별세 외,"별세, 조형래·조승래 더불어민주당 국회의원·조명래 부친상, 백희숙·조유신 시부상, 조현준·조현재·조연우·조혜정 조부상, 김다운 시조부상=15일1시3분 대전 성심장례식장, 발인 17일7시20분, (042)522-4494",https://www.chosun.com/national/obituary-personnel/2026/03/16/3552JBHXLRHFTOGXBZWCPB37GQ/?utm_source=naver&utm_medium=referral&utm_campaign=naver-news,https://n.news.naver.com/mnews/article/023/0003964706?sid=102,"Mon, 16 Mar 2026 00:46:00 +0900"
조승래,"&quot;재판소원법, 또다른 이름은 '재판불복'&quot;…양문석이 쏘아올린 與 '사법...","조승래 공관위 부위원장은 지난 13일 여의도 중앙당사에서 진행된 공천 관련 브리핑 이후, 기자들과 만나 &quot;나도 좀 헷갈린다. 구체적인 어떤 행위(재판소원 접수)를 아직 했는지 잘 모르겠다&quot;며 &quot;법률적 해석과... ",https://www.dailian.co.kr/news/view/1621022/?sc=Naver,https://n.news.naver.com/mnews/article/119/0003069205?sid=100,"Mon, 16 Mar 2026 00:05:00 +0900"
조승래,[부고] 조승래(더불어민주당 국회의원)씨 부친상,"▲ 조경제 씨 별세, 조승래(더불어민주당 국회의원) 씨 부친상 = 15일, 대전 성심장례식장 VIP 1호실, 발인 17일 오전 7시 20분. ☎ 042-522-4494",https://biz.sbs.co.kr/article_hub/20000297502?division=NAVER,https://n.news.naver.com/mnews/article/374/0000498024?sid=101,"Sun, 15 Mar 2026 23:58:00 +0900"
조승래,[부고] 조승래(더불어민주당 국회의원·사무총장)씨 부친상,"▲조경제씨 별세(향년 87세), 조형래·조승래(더블어민주당 국회의원·사무총장)·조명래씨 부친상, 백희숙·조유신씨 시부상=15일, 빈소 대전 성심장례식장 VIP1호실, 입관 16일 오전 10시30분, 발인 17일 오전... ",https://www.g-enews.com/view.php?ud=202603152110424608c5fa75ef86_1,https://www.g-enews.com/view.php?ud=202603152110424608c5fa75ef86_1,"Sun, 15 Mar 2026 21:38:00 +0900"
조승래,게임법 전면 개편 논쟁 본격화…경품 규제 완화에 웹보드·P2E 파장,지난 13일 서울 중구 CKL 기업지원센터에서 열린 한국게임정책학회 세미나에서는 조승래 더불어민주당 의원이 발의한 게임산업진흥법 전부개정안을 중심으로 주요 쟁점이 집중적으로 논의됐다. 이번 법안의 핵심은 게임... ,https://www.mydaily.co.kr/page/view/2026031521275084122,https://n.news.naver.com/mnews/article/117/0004044095?sid=105,"Sun, 15 Mar 2026 21:28:00 +0900"
조승래,&quot;게임법 개정안 방향성 긍정적…웹보드·P2E 허용 쟁점&quot;,조승래 더불어민주당 의원이 대표 발의한 '게임산업진흥에 관한 법률' 전부개정안에 대해 전문가들은... 황성기 한양대 법학전문대학원 교수(한국게임정책학회 의장)는 지난 13일 서울 중구 CKL스테이지에서 열린 '조승래... ,https://view.asiae.co.kr/article/2026031521011075984,https://n.news.naver.com/mnews/article/277/0005734550?sid=105,"Sun, 15 Mar 2026 21:01:00 +0900"
조승래,[부고] 조승래(더불어민주당 국회의원)씨 부친상,"▲ 조경제 씨 별세, 조승래(더불어민주당 국회의원) 씨 부친상 = 15일, 대전 성심장례식장 VIP 1호실, 발인 17일 오전 7시 20분. ☎ 042-522-4494",https://www.pinpointnews.co.kr/news/articleView.html?idxno=436844,https://www.pinpointnews.co.kr/news/articleView.html?idxno=436844,"Sun, 15 Mar 2026 18:00:00 +0900"
조승래,[부고] 조승래씨(더불어민주당 국회의원) 부친상 외,"▲조경제씨 별세, 조승래씨(더불어민주당 국회의원) 부친상=15일 대전 성심장례식장 발인 17일 오전 7시 20분 (042)522-4494 ▲박복순씨 별세, 윤석헌씨(전 금융감독원장) 모친상=14일 서울 아산병원 장례식장 발인... ",https://www.sedaily.com/article/20019503?ref=naver,https://n.news.naver.com/mnews/article/011/0004599435?sid=102,"Sun, 15 Mar 2026 17:43:00 +0900"
조승래,박범계 불출마…民 장철민·장종태·허태정 3파전,또 조승래 의원(대전 유성갑)과 같은 지역에서 정치적 행보를 오랜기간 함께한 경험 역시 허 전 시장의 지지기반으로 꼽힌다. 당 사무총장이기도 한 조 의원은 중앙당 공천관리위원회 부위원장으로 활동하고 있다. 물론... ,https://www.ggilbo.com/news/articleView.html?idxno=1146730,https://www.ggilbo.com/news/articleView.html?idxno=1146730,"Sun, 15 Mar 2026 16:48:00 +0900"
조승래,오늘의 부고 종합,"△조경제씨 별세, 조승래(더불어민주당 국회의원) 씨 부친상=15일, 대전 성심장례식장 VIP 1호실, 발인 17일 오전 7시 20분, 042-522-4494 △박복순씨 별세, 윤석헌(전 금융감독원장)씨 모친상=14일, 서울 아산병원... ",http://www.edaily.co.kr/news/newspath.asp?newsid=01810566645383648,https://n.news.naver.com/mnews/article/018/0006235740?sid=102,"Sun, 15 Mar 2026 16:32:00 +0900"
조승래,"황성기 교수 &quot;조승래 게임법 전부개정안, 온라인은 규제보다 진흥&quot;",황성기 한양대학교 법학전문대학원 교수(한국게임정책학회 의장)가 조승래 더불어민주당 의원의 게임산업진흥에 관한 법률 전부개정안을 두고 “현행 게임법 체계를 완전히 바꾸는 큰 법안”이라고 평가했다. 황 교수는... ,https://zdnet.co.kr/view/?no=20260315161729,https://n.news.naver.com/mnews/article/092/0002414417?sid=105,"Sun, 15 Mar 2026 16:18:00 +0900"
조승래,"[부음] 조승래 부친, 윤석헌 모친, 양수근 부친","△조경제씨 별세, 조승래(더불어민주당 국회의원) 부친상 = 15일, 빈소 대전 성심장례식장 VIP 1호실, 발인 17일 오전 7시20분, (042)522-4494. △박복순씨 별세, 윤석헌(전 금융감독원장) 모친상 = 14일, 빈소... ",https://www.businesspost.co.kr/BP?command=article_view&num=432911,https://www.businesspost.co.kr/BP?command=article_view&num=432911,"Sun, 15 Mar 2026 14:46:00 +0900"
조승래,[부고] 조승래 국회의원 부친상,"▲조승래(더불어민주당 국회의원) 씨 부친상=15일 별세, 대전성심장례식장 VIP 1호실, 발인 3월 17일 화요일 오전 7시, 장지 충남 논산 은진면 선영.",https://www.ggilbo.com/news/articleView.html?idxno=1146708,https://www.ggilbo.com/news/articleView.html?idxno=1146708,"Sun, 15 Mar 2026 14:38:00 +0900"
조승래,"법조계, 게임위 통폐합 어떻게 보나","◇ 황성기 교수 &quot;게임진흥원 내 게임위 설치, 위헌 아냐&quot; 게임위 통폐합 내용은 조승래 의원이 지난해 9월... 황성기 한양대학교 법학전문대학원 교수는 지난 13일 서울 중구에 위치한 CKL 기업지원센터에서 열린 '조승래 의원... ",https://www.sisaweek.com/news/articleView.html?idxno=234249,https://www.sisaweek.com/news/articleView.html?idxno=234249,"Sun, 15 Mar 2026 13:28:00 +0900"
조승래,&quot;AI 시대 게임을 어떻게 볼 것인가&quot;…게임법 개정안이 던진 화두,열린 ‘조승래 의원 게임법 전부개정안의 주요 쟁점’ 세미나에서 김앤장의 김원 변호사는 이같이... 지난해 조승래 더불어민주당 의원이 발의한 ‘게임법 전부개정안’을 기점으로 국내 게임법은 전환의 기로에 서... ,https://www.ajunews.com/view/20260313181928585,https://www.ajunews.com/view/20260313181928585,"Sun, 15 Mar 2026 13:24:00 +0900"
조승래,[부음] 조승래(더불어민주당 국회의원)씨 부친상,"▲ 조경제 씨 별세, 조승래(더불어민주당 국회의원) 씨 부친상 = 15일, 대전 성심장례식장 VIP 1호실, 발인 17일 오전 7시 20분. (042)522-4494",https://www.etnews.com/20260315000061,https://n.news.naver.com/mnews/article/030/0003407497?sid=102,"Sun, 15 Mar 2026 12:48:00 +0900"
조승래,[부고] 조승래(더불어민주당 국회의원)씨 부친상,"▲ 조경제(향년 87세)씨 별세, 조형래·승래(더불어민주당 국회의원·사무총장)·명래 씨 부친상, 백희숙·조유신 씨 시부상, 조현준·현재·연우·혜정 씨 조부상, 김다운 씨 시조부상 = 15일, 대전 성심장례식장... ",https://www.meconomynews.com/news/articleView.html?idxno=128987,https://www.meconomynews.com/news/articleView.html?idxno=128987,"Sun, 15 Mar 2026 12:30:00 +0900"
조승래,'바다이야기' 그림자 털어낼까...게임산업법 개정안 주요 쟁점은,황성기 한양대학교 법학전문대학원 교수가 지난 13일 서울 중구 CKL기업지원센터에서 열린 '조승래 의원의... &quot; 황성기 한양대학교 법학전문대학원 교수는 지난 13일 서울 중구 CKL기업지원센터에서 열린 '조승래 의원의... ,https://www.techm.kr/news/articleView.html?idxno=150207,https://www.techm.kr/news/articleView.html?idxno=150207,"Sun, 15 Mar 2026 12:04:00 +0900"
