Keyword,Title,Description,Original Link,Link,Publication Date
관가,기업 설립부터 상장까지 13년…VC 10년펀드 활성화 목표지만 문제는 LP ...,19일 관가에 따르면 전날 정부는 '자본시장 체질 개선 방안'을 발표하면서 VC 장기 만기 펀드를 우대하는 방법으로 개선하겠다고 예고했다. 현재 대부분의 VC 펀드 만기가 7~8년이다. 기업의 자생력·수익구조와... ,https://news.einfomax.co.kr/news/articleView.html?idxno=4404650,https://news.einfomax.co.kr/news/articleView.html?idxno=4404650,"Thu, 19 Mar 2026 09:22:00 +0900"
관가,"교원투어, 유희관가 함께 메이저리그 직관 '버킷리스트 투어' 패키지 출...",교원투어 여행이지가 메이저리그 경기 관람과 로스앤젤레스 여행을 동시에 즐길 수 있는 '유희관 해설위원과 함께하는 버킷리스트 투어' 패키지를 선보인다. 사진/교원투어 교원투어 여행이지가 메이저리그 경기 관람과... ,http://www.smedaily.co.kr/news/articleView.html?idxno=353949,http://www.smedaily.co.kr/news/articleView.html?idxno=353949,"Thu, 19 Mar 2026 09:16:00 +0900"
관가,'그냥 쉬는 청년' 80만명 육박…추경에 청년 일자리 정책 담기나,"관가에서는 이 같은 정책 기조를 반영해 '청년 뉴딜'로 불리는 대규모 청년 지원 정책을 마련하고 있는 것으로 알려졌다. 다만 추경 편성 여부와 규모, 청년 정책의 구체적인 내용은 향후 경제 상황과 재정 여건 등을... ",https://www.newspim.com/news/view/20260318001168,https://www.newspim.com/news/view/20260318001168,"Thu, 19 Mar 2026 06:00:00 +0900"
관가,[취재일기] “머슴이 마당을 쓸어야지”…국무회의 생중계에 씁쓸한 관...,"어쩐지 요즘 세종 관가에 흐르는 미묘한 기류를 관통하는 것 같아서다. 표면적으로는 ‘국민의 머슴’인 공무원이 시키지도 않은 일을 하느라 시간을 허비해서야 되겠느냐는 의미인데, 알고 보면 뼈가 있다. 이재명... ",https://www.joongang.co.kr/article/25412896,https://n.news.naver.com/mnews/article/025/0003510034?sid=110,"Thu, 19 Mar 2026 00:10:00 +0900"
관가,&quot;또 간판 떼나&quot;…행정통합 앞 광주·전남연구원 재결합 운명,"18일 지역 관가에 따르면, 행정통합에 따른 기능 재편이 본격화되면서 현재 분리 운영 중인 두 연구원의 재통합 논의가 수면 위로 급부상했다. 하나의 거대한 통합특별시 밑그림을 그리기 위해서는 두 연구원이 힘을 합쳐... ",https://www.jnilbo.com/news/articleView.html?idxno=90000026902,https://www.jnilbo.com/news/articleView.html?idxno=90000026902,"Thu, 19 Mar 2026 00:00:00 +0900"
관가,K뷰티 정책 주도권 두고 복지부-식약처 신경전,관가에선 정은경 장관이 식약처와 중소벤처기업부 등 다른 부처가 화장품 정책을 내세우는 데 불편한 기색을 보였다는 이야기도 돌았다. 식약처는 이달 5일 열린 '점프업 K-코스메틱' 워크숍에서 화장품경쟁력위원회 설치... ,https://www.etnews.com/20260318000300,https://n.news.naver.com/mnews/article/030/0003408858?sid=102,"Wed, 18 Mar 2026 16:01:00 +0900"
관가,대미 투자 ‘1호 사업’ 후보는? ‘에너지·원전’ 유력,한미전략투자공사 설립위원회가 출범하면서 '대미 투자 1호 프로젝트'가 무엇이 될지에 관가와 산업계의... 특히 관가에서는 이번 대미 투자가 정부 부처 사업과 연계될 가능성도 주목하고 있다. 예를 들어... ,https://view.asiae.co.kr/article/2026031816010839597,https://n.news.naver.com/mnews/article/277/0005736406?sid=101,"Wed, 18 Mar 2026 16:01:00 +0900"
관료,"박용선 포항시장 예비후보, '현장 전문가' 정체성 전면에... &quot;포항의 실...",그는 포항 지진과 태풍 힌남노 피해 등 포항이 절체절명의 위기에 처했을 때마다 관료적 행정의 틀을 깨고... 박용선 예비후보의 현장 전문가론은 지방 자치가 직면한 관료주의의 벽을 허물겠다는 선언으로 읽힌다. 그간의... ,http://www.enewstoday.co.kr/news/articleView.html?idxno=2408279,http://www.enewstoday.co.kr/news/articleView.html?idxno=2408279,"Thu, 19 Mar 2026 17:01:00 +0900"
관료,"미 국방부, 이란 전쟁 추가 예산 300조원 추진… 의회 통과는 난항 전망","특히 미 정보기관에서 고위 관료가 전쟁을 이유로 사퇴한 데 이어, 전쟁 발발 후 첫 공식 청문회 때 전쟁 배경에 대한 모호한 평가까지 내놓으면서 트럼프 정부의 ‘전쟁 명분’을 둘러싼 논란은 갈수록 확산하는... ",https://www.khan.co.kr/article/202603191656001,https://n.news.naver.com/mnews/article/032/0003434410?sid=104,"Thu, 19 Mar 2026 16:56:00 +0900"
관료,"[26] 광주 면앙로의 주인공, 면앙정 송순 [도로명속 남도 역사인물]","그러나 송순은 시인이기 이전에 50여 년을 관직에 몸담은 관료였다. 조광조가 축출된 기묘년(1919)에 실시된... 송순이 모든 관료들이 부러워하는 삼사에 15년여를 근무하였고, 사간원과 사헌부의 장에 오를 수 있었던 것은... ",https://www.namdonews.com/news/articleView.html?idxno=904585,https://www.namdonews.com/news/articleView.html?idxno=904585,"Thu, 19 Mar 2026 16:46:00 +0900"
관료,"한은 이창용, 4월 임기만료…후임설에 신현송·고승범","행정고시(28회) 출신으로 금융통화위원으로 금융위원장까지 지낸 베테랑 관료이다.2021년 문재인 정부 마지막 금융위원장을 지낸 그는 윤석열 정부가 출범하면서 9개월의 짧은 임기를 지냈는데, 가계 부채 안정에 대해... ",http://www.newswatch.kr/news/articleView.html?idxno=78570,http://www.newswatch.kr/news/articleView.html?idxno=78570,"Thu, 19 Mar 2026 16:30:00 +0900"
관료,국민의힘 포항시장 경선 후보 명단 확정…&quot;괴문자가 사실로&quot; 탈락 후보...,"안승대 예비후보는 1970년생으로 제2회 지방행정고시를 합격한 행정 관료 출신이다. 경북도와 울산은 물론 행정안전부, 외교통상부 등 중앙부처를 거치며 풍부한 행정 경험 및 인적 네트워크를 쌓아 왔다. 한편, 국민의힘... ",https://www.imaeil.com/page/view/2026031916031125153,https://n.news.naver.com/mnews/article/088/0001001820?sid=102,"Thu, 19 Mar 2026 16:16:00 +0900"
관료,건설업계 주총 키워드 안전·지속가능…이사회 전문성 수혈로 '돌파구',"고용노동부 고위 관료나 법조계 출신 영입을 통해 각종 법적 리스크를 방어하고, 관련 조사 과정에서 핵심 자문을 얻을 수 있다. 장·차관 출신 인사를 선임해 폭넓은 네트워크를 활용해 대관 업무와 규제 대응력을... ",https://www.newspim.com/news/view/20260319001065,https://www.newspim.com/news/view/20260319001065,"Thu, 19 Mar 2026 16:15:00 +0900"
관료,참세상 인터링크 위클리 (2026.03.19),"이번 사임은 최근 몇 년간 이스라엘 정책을 둘러싸고 이어진 고위 관료들의 연쇄 사임 흐름과 함께, 공화당 내부 특히 MAGA 진영 내 외교 노선 갈등을 드러낸다. 결국 이 사건은 미국의 대이란 전쟁 정당성과 대이스라엘... ",https://newscham.net/articles/115841,https://newscham.net/articles/115841,"Thu, 19 Mar 2026 16:00:00 +0900"
관료,[세상의 모든 정보 윤인구입니다] 장성철 “이정현 공천 컨셉? 최은석은...,"▶ 김준일 : 당권파 중에서도 원내대표가 지금 다, 원내대표와 가까운 사람들이 다 지금 나오고 있고 말씀하신 대로 박수민 의원 같은 경우에는 기재부 관료 출신이기도 한데 이분이 벤처사업가이기도 해요. 그래서 지금... ",https://news.kbs.co.kr/news/pc/view/view.do?ncd=8512885&ref=A,https://n.news.naver.com/mnews/article/056/0012145308?sid=100,"Thu, 19 Mar 2026 15:55:00 +0900"
관료,트럼프 만나러 간 다카이치...전 세계 '이목 집중',하지만 총리가 미국으로 떠난 뒤로는 내각 관료들은 관련 언급을 자제하는 분위기입니다. 현재로썬 다카이치 총리가 직접 트럼프 대통령을 만나서 군함 파견 여부를 밝히지 않을까 하는 전망에 무게가 실립니다. 대신... ,https://www.ytn.co.kr/_ln/0104_202603191553273034,https://n.news.naver.com/mnews/article/052/0002329496?sid=104,"Thu, 19 Mar 2026 15:53:00 +0900"
관료,소청과의사회 “정은경 장관은 백신 관리 부실 책임지고 용퇴하라”,고위관료로서의 양심은 어디 있는가라고 지적했다. 또한 국민을 실험실의 대상처럼 취급한 행정 편의주의적... 고위 관료로서 보일 수 있는 마지막 품격이자 예의”라며 주장했다. 그러면서 소청과의사회는 ▲정은경... ,http://www.whosaeng.com/169021,http://www.whosaeng.com/169021,"Thu, 19 Mar 2026 15:44:00 +0900"
관료,이스라엘 &quot;이란 고위직 무조건 제거&quot;... 이란 &quot;피 한 방울마다 보복&quot;,전날 공습으로 라리자니 사무총장과 골람레자 솔레이마니 바시지 민병대 사령관이 숨진 데 이어 이틀 사이 세 명의 이란 고위 관료가 이스라엘의 공격에 명을 달리했다. 이스라엘은 추가적인 표적 공습을 예고했다. 카츠... ,https://www.hankookilbo.com/news/article/A2026031910020001912?did=NA,https://n.news.naver.com/mnews/article/469/0000920412?sid=104,"Thu, 19 Mar 2026 15:31:00 +0900"
관료,"대구 달서구청장 국힘 주자 윤곽 &quot;김용판,김형일, 홍성주&quot; 압축","지역 정가 관계자는 &quot;전직 국회의원과 고위 행정 관료 간의 대결로 압축된 만큼, 당심(黨心)과 민심(民心)이 어디로 향할지가 관건&quot;이라며 &quot;신청사 건립 이슈와... ",http://www.breaknews.com/1193264,http://www.breaknews.com/1193264,"Thu, 19 Mar 2026 15:04:00 +0900"
관료,[인터뷰] 김용환 전 농협금융 회장 &quot;2008년 금융위기와 유사…불확실성...,"김 전 회장은 1979년 행정고시 23회로 공직에 입문해 재정경제부 복지생활과장, 금융감독위원회 감독정책2국장, 금융위원회 상임위원, 금융감독원 수석부원장 등을 역임한 정통 경제 관료다. 이후 한국수출입은행장... ",https://www.ajunews.com/view/20260319140654243,https://www.ajunews.com/view/20260319140654243,"Thu, 19 Mar 2026 15:02:00 +0900"
관료,호르무즈 봉쇄보다 더 큰 ‘한방’… 에너지 시설 타격에 전쟁 ‘새 국...,"WSJ에 따르면, 미국 고위 관료들은 “트럼프 대통령이 이란에 호르무즈 해협 봉쇄를 해제하도록 압박하기 위해 공습을 승인했다”고 밝혔다. 이번 사건은 단순한 지역 분쟁을 넘어 국제 에너지 공급과 가격 안정성에... ",https://www.mk.co.kr/article/11992504,https://n.news.naver.com/mnews/article/024/0000104198?sid=101,"Thu, 19 Mar 2026 14:55:00 +0900"
관료,"KF-21 양산 앞둔 KAI, 대표 공백 8개월 만에 김종출 체제…노조 반응 등...",항공기 생산에 드라이브를 걸고 수주 실패를 만회할 경영인보다 군·방산 관료 출신 인사가 대표가 되면서 산적한 과제를 어떻게 풀어갈지 시선이 모였다. 군 출신 대표 선임을 반대한 노조와 향후 관계도 지켜볼... ,http://www.newsworker.co.kr/news/articleView.html?idxno=418185,http://www.newsworker.co.kr/news/articleView.html?idxno=418185,"Thu, 19 Mar 2026 14:36:00 +0900"
관료,"KT, 이사회 권한 확대 속 CEO 체제 전환···지배구조 균형 시험대",기존 관료·법률 중심 이사회에서 산업·기술 중심으로 무게추를 옮기려는 시도로 해석된다. 동시에 일부 사외이사의 연임 포기 등 변수도 발생하며 이사회 재편은 단순 교체를 넘어 구조적 변화로 이어지는 양상이다.... ,https://www.smartbizn.com/news/articleView.html?idxno=139608,https://www.smartbizn.com/news/articleView.html?idxno=139608,"Thu, 19 Mar 2026 14:34:00 +0900"
관료,"장성군수 선거, 정치인 출신 현직 재선 vs 관료 출신 등 새 인물",전남 장성군수 선거는 정치인 출신 현직 군수가 현직 프리미엄을 앞세워 재선 가도를 달릴지 아니면 관료... 있는 관료 출신이 필요하다&quot;라고 밝혔다. 소 전 부시장은 △반도체 클러스터 장성 유치△군내버스 완전 공영화... ,https://www.nocutnews.co.kr/news/6487699?utm_source=naver&utm_medium=article&utm_campaign=20260319022816,https://n.news.naver.com/mnews/article/079/0004126747?sid=102,"Thu, 19 Mar 2026 14:29:00 +0900"
관료,"[6.3 지방선거 D-76] &quot;박범인의 守城(수성)이냐, 문정우의 雪辱(설욕)이...",정통행정관료 출신으로 풍부한 행정 경험을 자랑하고 있다. 문경주 전 국장은 기자와의 통화에서 &quot;취임 후 초기 6개월이라는 골든타임을 놓치지 않기 위해 전문가들과 정책 검토를 마쳤다&quot;면서 &quot;40년 행정 경험과 정무... ,http://www.newstnt.com/news/articleView.html?idxno=597491,http://www.newstnt.com/news/articleView.html?idxno=597491,"Thu, 19 Mar 2026 14:26:00 +0900"
관료,"'곰팡이 코로나19 백신' 논란 일파만파… 의료단체, 정은경 장관에 사퇴...","국민적 지지를 받았기에, 그 신뢰를 기만한 이번 사태의 책임은 더욱 무겁다. 자신의 과오를 인정한다면 장관직이라는 '방역의 훈장'을 스스로 내려놓는 것이 고위 관료로서 보일 수 있는 마지막 품격이자 예의&quot;라고 말했다.",https://www.m-i.kr/news/articleView.html?idxno=1355361,https://www.m-i.kr/news/articleView.html?idxno=1355361,"Thu, 19 Mar 2026 14:10:00 +0900"
관료,'노사정'이 아니라 '정사노'여야 한다[윤효원의 '노동과 세계'],정부 관료들이 귀에 피가 나도록 들어온 이야기들이 대부분이었다. 물론 시대 변화와 기술 발전에 따라... 비공개로 분류되어 관료들의 캐비넷에 들어가 세월을 보내기 일쑤다. 그러다 때때로 대통령이나 장관의 입맛에... ,https://www.pressian.com/pages/articles/2026031913290532400?utm_source=naver&utm_medium=search,https://n.news.naver.com/mnews/article/002/0002432590?sid=102,"Thu, 19 Mar 2026 14:10:00 +0900"
관료,[KINN] 바람을 판 나라① 낙월해상풍력의 숨겨진 주인,"그리고 그 구조에는 한국 에너지 사업 인허가를 좌우한 전직 관료 이름이 등장했다. 기후위기를 막기 위한 돈이 이토록 불투명한 곳으로 흘러가고 있다면, 미래 세대를 핑계로 미래를 판 것은 아닐까. &lt;살아지구... ",https://newstapa.org/article/cb5cG,https://n.news.naver.com/mnews/article/607/0000003228?sid=102,"Thu, 19 Mar 2026 14:10:00 +0900"
관료,[해풍단상] 국무총리형 포항 부시장,"특히 행정의 달인이라 불릴 만큼 검증된 관료 출신 인사에게 이러한 실질적 칼자루를 쥐여준다면, 포항시 공무원 조직은 그 어느 때보다 역동적이고 성과 중심적인 집단으로 탈바꿈할 것이다. 이는 특정 후보에게 양보를... ",https://www.ksmnews.co.kr/news/view.php?idx=595852,https://www.ksmnews.co.kr/news/view.php?idx=595852,"Thu, 19 Mar 2026 14:04:00 +0900"
관료,차기 한은 총재 인선 본격화…'금리·환율·가계부채' 복합 과제 산적,"우선 관료 출신에서는 고승범 전 금융위원장의 이름이 오르내린다. 고 전 위원장은 금융위원장과... 한 금융권 관계자는 &quot;관료형은 정책 조율, 국제통은 대외 대응, 내부 출신은 정책 연속성에 강점이 있다&quot;며 &quot;어떤... ",https://daily.hankooki.com/news/articleView.html?idxno=1349084,https://daily.hankooki.com/news/articleView.html?idxno=1349084,"Thu, 19 Mar 2026 14:00:00 +0900"
관료,"다카이치, 트럼프에 직접 파견 말할까?...&quot;선물 보따리도 준비&quot;","하지만 총리가 미국으로 떠난 뒤로는 내각 관료들은 관련 언급을 더 자제하는 분위기입니다. 결국, 다카이치 총리 의견이 제일 중요하기 때문일 겁니다. 현재로썬 다카이치 총리가 직접 트럼프 대통령을 만나서 군함 파견... ",https://www.ytn.co.kr/_ln/0104_202603191342581539,https://n.news.naver.com/mnews/article/052/0002329406?sid=104,"Thu, 19 Mar 2026 13:42:00 +0900"
관료,'최원철·백성현·이완섭 현역 단수 공천'…충남 기초단체장 공천 '안정...,이완섭 서산시장은 숭실대 대학원 IT정책경영학을 전공했으며 서산시 부시장과 행정안전부 상훈담당관을 지낸 행정 관료 출신이다. ◇ '안정 vs 경쟁' 공천 의미 이번 공천은 현역 단체장에 대한 '재신임' 성격이 강하다.... ,https://www.bzeronews.com/news/articleView.html?idxno=814148,https://www.bzeronews.com/news/articleView.html?idxno=814148,"Thu, 19 Mar 2026 13:36:00 +0900"
관료,통합 동력은 일회성 인센티브 '왜 해야 하는지' 명료한 목표 공유해야,통합이 관료 조직의 이해관계를 확대하는 수단으로 활용될 가능성 등 운용 과정상의 부작용을 면밀히... 김 교수는 &quot;통합 지자체의 관료 중심이 아닌 주민과 전문가가 참여하는 독립 기구가 자원 배분의 공정성을 감시하고... ,https://www.m-joongang.com/news/articleView.html?idxno=402235,https://www.m-joongang.com/news/articleView.html?idxno=402235,"Thu, 19 Mar 2026 13:34:00 +0900"
관료,"법치(法治)보다 인치(人治)? 여권의 맹공, 민심 역풍 부를 수도","법원 내부의 관료주의를 타파하고 판결의 일관성과 예측 가능성을 높이는 작업이 병행돼야 한다. 대법원장에게 집중된 인사권을 분산하고, 법관들이 외부의 압력뿐만 아니라 내부의 서열 구조로부터 독립해 양심에 따라... ",https://www.m-joongang.com/news/articleView.html?idxno=402248,https://www.m-joongang.com/news/articleView.html?idxno=402248,"Thu, 19 Mar 2026 13:32:00 +0900"
관료,"[뉴스퀘어 2PM] '에너지 전쟁' 격화...트럼프, 지상군 준비하나?",그래서 물론 이 전쟁은 빨리 미국 내에서도 반발하는 관료가 나왔으니까요. 정당성을 찾는 데 많은 파장이 있겠습니다마는 지금 나오는 뉴스들을 보게 되면 협상이 깨진 것에 대해서 전쟁 책임을 서로에게 넘기는 그런... ,https://www.ytn.co.kr/_ln/0104_202603191330223848,https://n.news.naver.com/mnews/article/052/0002329431?sid=104,"Thu, 19 Mar 2026 13:30:00 +0900"
관료,"미국 자제하던 원유 인프라까지 공격, 중동 전쟁 새 국면",미국 고위 관료들은 WSJ과 인터뷰에서 “트럼프 대통령이 이란에 호르무즈 해협 차단을 해제하도록 압박하기 위해 이번 공습을 승인했다”고 밝혔다. 이는 중동 전쟁이 새로운 국면에 진입하고 있다는 것을 의미하며... ,https://www.news1.kr/world/usa-canada/6106940,https://n.news.naver.com/mnews/article/421/0008836008?sid=104,"Thu, 19 Mar 2026 13:28:00 +0900"
관료,"[김동욱의 세계를 바꾼 순간들] 근대 국가의 주역, '영혼 없는' 관료주의","‘관료주의’라는 단어는 오늘날 부정적 의미로 주로 쓰인다. 과도한 형식과 규정에의 집착, 시장과 고객에... 하지만 이런 평가는 독일의 사회학자 막스 베버가 ‘관료제·관료주의(Bürokratie)’라는 용어를 처음... ",https://www.hankyung.com/article/2026031386391,https://n.news.naver.com/mnews/article/015/0005264335?sid=101,"Thu, 19 Mar 2026 13:23:00 +0900"
박수영,국힘 일각 '호르무즈 해협 파병' 주장,국회 재정경제기획위원회 야당 간사인 박수영 국민의힘 의원도 이날 국회에서 열린 정유 업계 대표 정책간담회에서 &quot;중동 사태는 더 이상 남의 나라 전쟁이 아니다&quot;라며 &quot;우리나라 배와 국민이 볼모로 잡혀 있을 뿐 아니라... ,http://www.newsprime.co.kr/news/article.html?no=727579,http://www.newsprime.co.kr/news/article.html?no=727579,"Thu, 19 Mar 2026 16:48:00 +0900"
박수영,박수영 국민의힘 의원 “선제적으로 호르무즈 호위 참여 선언해야”,박수영 국민의힘 의원. 연합뉴스 박수영 국민의힘 의원은 19일 “선제적으로 우리 군의 호르무즈 해협 호위 참여를 선언해야 한다”고 했다. 국회 재정경제기획위원회 간사인 박 의원은 이날 4대 정유사 간담회에서... ,https://www.munhwa.com/article/11575883?ref=naver,https://n.news.naver.com/mnews/article/021/0002778459?sid=100,"Thu, 19 Mar 2026 16:44:00 +0900"
박수영,국힘 일부 의원들 &quot;美 호르무즈 해협 파병 요청 응해야&quot;,"박수영 의원 또한 페이스북을 통해 &quot;이역만리에 고립된 우리나라 배, 우리나라 국민을 구할 책임은 다른 나라가 아닌 우리나라에 있다&quot;며 파병 찬성 취지의 목소리를 냈다. 박 의원은 &quot;우리나라는 미국과 피를 나눈 굳건한... ",https://www.newsis.com/view/NISX20260319_0003555847,https://n.news.naver.com/mnews/article/003/0013833493?sid=100,"Thu, 19 Mar 2026 16:44:00 +0900"
박수영,"국민의힘 부산의원들 &quot;'통일교 의혹' 전재수, 망상 버리고 특검 심판대...",조경태·김도읍·박수영·조승환 의원 등은 19일 국회에서 기자회견을 열어 &quot;전재수 의원이 어제 배우자의 참고인 조사에 이어 통일교 관련 정교유착 비리 의혹의 피의자 신분으로 소환 조사를 받는다&quot;며 &quot;부산시장 후보로... ,https://www.dailian.co.kr/news/view/1623025/?sc=Naver,https://n.news.naver.com/mnews/article/119/0003071030?sid=100,"Thu, 19 Mar 2026 16:43:00 +0900"
박수영,"중동 위기 속 '오일쇼크' 우려… 국민의힘, 정유업계와 긴급 점검","국회 재정경제기획위원회 국민의힘 간사인 박수영 의원은 현재 해당 해역에서 국내 선박과 선원들이 발이 묶인 상황을 지적하며, 자국민 보호를 위한 보다 적극적인 대응이 필요하다고 주장했다. 그는 군의 호위 참여... ",http://www.newsian.co.kr/news/articleView.html?idxno=87428,http://www.newsian.co.kr/news/articleView.html?idxno=87428,"Thu, 19 Mar 2026 16:38:00 +0900"
박수영,국힘 내부에서 &quot;호르무즈 해협에 즉각 파병해야‥일본이 선언하면 늦어...,"국회 재정경제기획위원회 야당 간사인 박수영 의원도 오늘 국회에서 열린 정유업계대표 정책간담회에서 &quot;우리나라 배와 국민이 볼모로 잡혀 있을 뿐 아니라, 환율·기름값·물가 등 민생경제, 나아가 우리나라의 모든... ",https://imnews.imbc.com/news/2026/politics/article/6808756_36911.html,https://n.news.naver.com/mnews/article/214/0001487286?sid=100,"Thu, 19 Mar 2026 16:32:00 +0900"
박수영,"정치권, 앞다퉈 산업계 간담회 ...공소청법 필리버스터 시작","박수영 의원의 발언입니다. [박수영 / 국민의힘 의원 : 우리나라 배, 우리나라 국민을 구할 책임은 다른 나라가 아닌 우리나라에 있습니다. 그렇지만 이재명 정부는 너무 소극적이다 못해 무책임하다고 보고 있습니다.]... ",https://www.ytn.co.kr/_ln/0101_202603191628469332,https://n.news.naver.com/mnews/article/052/0002329530?sid=100,"Thu, 19 Mar 2026 16:28:00 +0900"
박수영,"국힘, 정유업계 만나 &quot;최고가격제, 업계 부담... 최악 시나리오 염두&quot;",국회 재정경제기획위원회 야당 간사인 박수영 의원은 이역만리에 고립된 우리나라 배와 국민을 구할 책임은 다른 나라가 아닌 우리나라에 있지만 이재명 정부는 소극적이다 못해 무책임하다&quot;면서 &quot;전쟁이 격화되는... ,https://www.meconomynews.com/news/articleView.html?idxno=129158,https://www.meconomynews.com/news/articleView.html?idxno=129158,"Thu, 19 Mar 2026 16:28:00 +0900"
박수영,&quot;파병이 곧 국익&quot;…국민의힘 내부에서 호르무즈 파병 요구 '솔솔',국회 재정경제위원회 야당 간사인 박수영 국민의힘 의원은 이날 국회에서 열린 국내 정유업계와의 간담회에서 &quot;중동 사태는 더 이상 남의 나라 전쟁이 아니다&quot;라며 파병을 주장했다. 박 의원은 &quot;이역만리에 고립된 우리나라... ,https://www.mt.co.kr/politics/2026/03/19/2026031916032957076,https://n.news.naver.com/mnews/article/008/0005332380?sid=100,"Thu, 19 Mar 2026 16:21:00 +0900"
박수영,"안양시, '2026년 1분기 민원 우수공무원과의 간담회' 개최","2026년 1분기 '베스트 친절공무원'으로는 김영수, 소림아, 이재헌 등 3명이 선정됐으며, '민원마일리지 우수공무원'으로는 박수영, 윤소라, 손호영 등 3명이 이름을 올렸다. 시 관계자는 &quot;시민의 입장에서 한 발 더 다가가는... ",https://www.kmaeil.com/news/articleView.html?idxno=633619,https://www.kmaeil.com/news/articleView.html?idxno=633619,"Thu, 19 Mar 2026 16:04:00 +0900"
박수영,안철수 등 국힘 일각 &quot;호르무즈 해협 즉각 파병해야…남의 나라 전쟁 아...,安·박수영·조정훈 의원 페이스북 통해 공개 촉구 &quot;대미협상 주도권 쥐어야…마지못해 끌려가면 최악... 국회 재정경제기획위원회 야당 간사인 박수영 의원도 이날 국회에서 열린 정유업계대표 정책간담회에서 &quot;중동... ,https://www.sisajournal.com/news/articleView.html?idxno=366413,https://n.news.naver.com/mnews/article/586/0000124782?sid=100,"Thu, 19 Mar 2026 15:59:00 +0900"
