Keyword,Title,Description,Original Link,Link,Publication Date
안도걸,종량제봉투 생산현장 찾은 유동수 위원장과 의원들,"더불어민주당 중동전쟁 경제대응특별위원회 유동수 위원장과 안도걸 간사, 허종식 의원이 29일 오후 종량제봉투를 생산하는 인천 서구의 장애인 직업재활시설을 찾아 수급상황 현장 점검을 하고 있다. 2026.... ",https://www.newsis.com/view/NISI20260429_0021265867,https://n.news.naver.com/mnews/article/003/0013917428?sid=100,"Wed, 29 Apr 2026 14:53:00 +0900"
안도걸,"가톨릭중앙의료원, 국내 의료기관 최초 ‘의료 AI 윤리 강령’ 마련","이날 오전 10시 열리는 비전 선포식에는 서울대교구장 정순택 대주교와 주한 교황대사 가스파리 대주교, 과학기술정보통신부 류제명 차관, 대통령 직속 국가AI전략위원회 임문영 부위원장, 더불어민주당 안도걸 의원... ",https://news.cpbc.co.kr/article/1172513?division=NAVER,https://news.cpbc.co.kr/article/1172513?division=NAVER,"Wed, 29 Apr 2026 13:22:00 +0900"
안도걸,[PICK! 이 안건] 이언주 등 10인 &quot;변호사 예비시험 신설하고 합격자에 변...,"더불어민주당 이언주, 허성무, 안도걸, 정진욱, 소병훈, 이상식, 이개호, 문대림, 이광희, 무소속 최혁진 의원이다. 한편 해당 안건은 국회입법예고 홈페이지에서 해당 안건 검색 후 의견을 작성할 수 있다.",https://www.jeonmae.co.kr/news/articleView.html?idxno=1252365,https://www.jeonmae.co.kr/news/articleView.html?idxno=1252365,"Wed, 29 Apr 2026 13:08:00 +0900"
안도걸,"재경위, '전략수출금융지원법' 공청회…기여금 부담·집행 기준 쟁점","한정애·안도걸 의원이 각각 발의한 두 법안은 국가가 전략 수출 기업에 장기 대출과 보증 등 금융을 지원하고, 수출 이익의 일부를 기여금으로 환수해 산업 전반에 활용하는 구조를 담고 있다. 기존 한국수출입은행과... ",https://view.asiae.co.kr/article/2026042912134138511,https://n.news.naver.com/mnews/article/277/0005756528?sid=100,"Wed, 29 Apr 2026 12:13:00 +0900"
안도걸,첨복단지법 상임위 문턱 넘어…지역첨복단지 신설·재단 통합 추진,"28일 보건복지위원회 법안심사소위원회는 전진숙 의원안, 안도걸 의원안, 윤준병 의원안 등 첨단의료복합단지 육성에 관한 특별법 일부개정법률안을 병합 심사하고 상임위원회 대안으로 의결했다. 개정안의 핵심은 기존... ",https://www.hitnews.co.kr/news/articleView.html?idxno=75795,https://www.hitnews.co.kr/news/articleView.html?idxno=75795,"Wed, 29 Apr 2026 12:00:00 +0900"
안도걸,"조인철, 인구감소지역 주택 취득 양도세 특례 5년 연장 추진",종합부동산세 과세특례 적용 기한을 ′31년 12월 31일까지 5년 더 연장하는 내용을 담았다. 개정안은 ▲박용갑 ▲박희승 ▲주철현 ▲정준호 ▲박수현 ▲서삼석 ▲안도걸 ▲정진욱 ▲이해민 의원이 공동발의했다. [세정일보],https://www.sejungilbo.com/news/articleView.html?idxno=58233,https://www.sejungilbo.com/news/articleView.html?idxno=58233,"Wed, 29 Apr 2026 09:08:00 +0900"
안도걸,"안도걸 &quot;토큰증권, 투자 민주화와 자산이익 공유 가능케 하는 새 금융질...",안도걸 더불어민주당 의원이 토큰증권(STO)을 통한 자산시장 구조 전환의 필요성을 강조했다. 안 의원은 지난... 안도걸 더불어민주당 의원. [사진=뉴스핌 DB] 안 의원은 축사를 통해 &quot;토큰증권은 부동산과 같은 실물자산을... ,https://www.newspim.com/news/view/20260429000129,https://www.newspim.com/news/view/20260429000129,"Wed, 29 Apr 2026 08:55:00 +0900"
안도걸,"&quot;부동산, 소수가 독점하는 자산에서 국민이 함께 참여하는 투자시장으로...","국회 안도걸 의원(더불어민주당, 광주 동남을)은 28일 오후 3 시 금융투자교육원 리더스홀에서 열린 '공공 STO... 안도걸 의원은 &quot;이제 자산시장은 소수의 독점 구조에서 벗어나 국민이 함께 참여하고 이익을 공유하는... ",https://www.pinpointnews.co.kr/news/articleView.html?idxno=449456,https://www.pinpointnews.co.kr/news/articleView.html?idxno=449456,"Wed, 29 Apr 2026 08:20:00 +0900"
안도걸,"&quot;한예종 이전, 통수맞았다&quot;는 그 동네 민주당 득표율은","정준호 의원을 비롯 양부남·안도걸·조인철·정진욱·전진숙·민형배·박균택 등 광주 국회의원 8명과 맹성규·이건태·이연희 등 인천, 경기, 충북 국회의원 3명 등 민주당 국회의원 총 11명은 지난 22일 '한국예술종합학교... ",https://www.imaeil.com/page/view/2026042901093724864,https://n.news.naver.com/mnews/article/088/0001007656?sid=100,"Wed, 29 Apr 2026 07:30:00 +0900"
안도걸,서클 이어 솔라나 회장도 방한…스테이블코인법 탄력,"TF는 이정문(위원장)·안도걸(간사)·강준현·민병덕·김현정·박민규·이강일·이주희·한민수 의원으로 구성돼 있다. 솔라나는 고성능 블록체인 플랫폼이자 비트코인, 이더리움, XRP(리플)처럼 투자자들에게 널리 알려진... ",http://www.edaily.co.kr/news/newspath.asp?newsid=02443606645421040,https://n.news.naver.com/mnews/article/018/0006268695?sid=101,"Wed, 29 Apr 2026 06:56:00 +0900"
안도걸,73조원 전력망 사업 한전 독점 막 내린다,"28일 국회에 따르면 국회 기후에너지환경노동위원회는 최근 법안심사소위원회를 열고, 허종식·안도걸 의원(더불어민주당)이 각각 발의한 개정안을 병합 심사해 위원회 대안으로 여야 합의 처리했다. 이번 개정안의... ",https://www.dnews.co.kr/uhtml/view.jsp?idxno=202604281009227680907,https://www.dnews.co.kr/uhtml/view.jsp?idxno=202604281009227680907,"Wed, 29 Apr 2026 06:22:00 +0900"
안도걸,"[6·3 지방선거] &quot;끝까지 간다!&quot;… 박희정 더민주 포항시장 후보, 철강업...","이번 개정안은 민병덕 의원의 대표 발의로 이수진, 김문수, 임미애, 오세희, 한준호, 김한규, 이훈기, 김태년, 김영호, 이재정, 김현정, 안도걸, 추미애, 박홍배, 정진욱 의원 등 총 16인이 공동 발의에 참여했다. 이는... ",https://www.polinews.co.kr/news/articleView.html?idxno=729795,https://www.polinews.co.kr/news/articleView.html?idxno=729795,"Wed, 29 Apr 2026 00:00:00 +0900"
안도걸,"박희정 민주당 포항시장 후보, 철강산업 전기요금 부담 완화 앞장","이번 개정안은 민병덕 의원 대표발의로 이수진, 김문수, 임미애, 오세희, 한준호, 김한규, 이훈기, 김태년, 김영호, 이재정, 김현정, 안도걸, 추미애, 박홍배, 정진욱 의원 등 총 16인이 공동발의에 참여했다.이는... ",https://www.ksmnews.co.kr/news/view.php?idx=602875,https://www.ksmnews.co.kr/news/view.php?idx=602875,"Tue, 28 Apr 2026 20:36:00 +0900"
오기형,정원오 ‘착착 개발’ 오세훈 ‘활력 서울’,"정 전 구청장 측 정책총괄본부장인 오기형 민주당 의원은 통화에서 “착착 개발은 ‘500가구 이하 소규모 사업 지정 권한은 구청장에게 넘기겠다’, ‘지정 이후에도 과정·절차 관리를 하겠다’ 등 5가지 항목을 보완한... ",https://www.seoul.co.kr/news/politics/local-election2026/2026/04/30/20260430001005?wlog_tag3=naver,https://n.news.naver.com/mnews/article/081/0003639935?sid=100,"Thu, 30 Apr 2026 05:01:00 +0900"
오기형,"이찬진 '주간·여의도', 이복현 '야간·서울 전역'… 금감원장 법카 용처...","국회 기획재정위원회 소속 오기형 더불어민주당 의원이 금감원에서 받은 자료에 따르면, 이 전 원장은 2022년 6월부터 지난해 5월까지 3년간 378건, 총 9,057만 원을 썼다. 월평균 251만 원을 쓴 셈이다. 이 중 법인카드... ",https://www.hankookilbo.com/news/article/A2026042916050003124?did=NA,https://n.news.naver.com/mnews/article/469/0000928385?sid=101,"Thu, 30 Apr 2026 04:32:00 +0900"
오기형,오차범위까지 붙은 서울…승부처는 '부동산 민심',선거 캠프에 합류한 서울 강북 지역 의원인 김영배(상임선대위원장·성북갑)·오기형(정책총괄본부장·도봉을)·김남근(제1정책본부장·성북을) 의원과 인근 재개발조합 관계자들이 동행했습니다. '착착 개발'을... ,http://www.newstomato.com/ReadNews.aspx?no=1299592&inflow=N,http://www.newstomato.com/ReadNews.aspx?no=1299592&inflow=N,"Wed, 29 Apr 2026 18:26:00 +0900"
오기형,정원오 “정비사업 15년서 10년으로”,이날 자리에는 김영배·오기형·김남근 민주당 의원과 인근 재개발조합 관계자들이 참석했다. 정 후보의 구상은 정비구역 지정까지만 지원했던 오세훈 서울시장의 ‘신통기획’을 확대해 정비사업은 물론 입주까지... ,https://www.sedaily.com/article/20038772?ref=naver,https://n.news.naver.com/mnews/article/011/0004616102?sid=100,"Wed, 29 Apr 2026 18:06:00 +0900"
오기형,"정원오, 서울 주택공급 '착착개발' 청사진 제시…정비사업 15년→10년 내...","현장에는 김영배 상임선대위원장, 오기형 정책총괄본부장, 김남근 착착개발·도시발전위원장과 재개발 조합 관계자들이 함께했다. 정 후보는 현재 평균 15년가량 소요되는 정비사업 기간을 10년 이내로 줄이겠다는... ",https://www.eroun.net/news/articleView.html?idxno=79459,https://www.eroun.net/news/articleView.html?idxno=79459,"Wed, 29 Apr 2026 17:14:00 +0900"
오기형,"輿, 종량제봉투 생산 현장 점검... &quot;수급·순환경제 두 토끼 잡겠다&quot;",유동수 위원장과 안도걸 간사를 비롯해 오기형·허종식·이강일 의원이 참석했다. 이들은 종량제봉투 제조 설비를 둘러보며 원료 수급 현황과 실제 생산 공정을 점검했다. 이어진 간담회에는 한국프라스틱공업협동조합... ,https://www.meconomynews.com/news/articleView.html?idxno=130683,https://www.meconomynews.com/news/articleView.html?idxno=130683,"Wed, 29 Apr 2026 16:30:00 +0900"
오기형,"&quot;AI 슈퍼사이클, '상상 초월'…주식시장 펀더멘털 '굳건'&quot;",오기형 與 K-자본시장특위 위원장 &quot;중동 변수 이미 주가에 반영&quot; &quot;시장의 핵심 요구는 정책 일관성…지배구조... 여당에서 정책통으로 꼽히는 오기형 K-자본시장특별위원회 위원장은 코스피 지수가 6600선을 넘은 4월27일... ,https://www.sisajournal.com/news/articleView.html?idxno=371386,https://n.news.naver.com/mnews/article/586/0000128122?sid=100,"Wed, 29 Apr 2026 16:20:00 +0900"
오기형,"정원오, 부동산 공약 '착착개발' 발표…&quot;吳, 정책대결 하자&quot;","이 자리에는 인근 지역구 의원이자 정 후보 캠프 관계자인 김영배(성북구갑) 상임선대위원장, 오기형(도봉구을) 정책총괄본부장, 김남근(성북구을) 착착개발·도시발전위원장도 함께했다. 정 후보는 &quot;기본 계획과 정비구역... ",https://www.mt.co.kr/politics/2026/04/29/2026042910391128237,https://n.news.naver.com/mnews/article/008/0005351125?sid=162,"Wed, 29 Apr 2026 14:55:00 +0900"
오기형,재개발 구역 찾은 정원오 &quot;오세훈 공급 성과 부족…정비 사업 3년 단축&quot;,"이날 공약 발표 자리에는 김영배(재선·성북구갑) 상임선대위원장, 오기형(재선·도봉구을) 정책총괄본부장, 김남근(초선·성북구을) 착착개발·도시발전위원장과 인근 재개발 조합 관계자들이 동행했다.",https://view.asiae.co.kr/article/2026042913453577125,https://n.news.naver.com/mnews/article/277/0005756561?sid=162,"Wed, 29 Apr 2026 13:45:00 +0900"
오기형,정원오 “재건축·재개발 정비사업 기간 15년→10년 이내로 단축”,"이 자리엔 캠프 김영배 상임선대위원장, 오기형 정책총괄본부장, 김남근 착착개발·도시발전위원장과 인근 재개발 조합 관계자들이 동행했다. 정 후보는 정비사업 기간을 앞당기기 위해 정부·여당과 협력해... ",https://www.mk.co.kr/article/12030622,https://n.news.naver.com/mnews/article/009/0005673038?sid=100,"Wed, 29 Apr 2026 11:44:00 +0900"
오기형,정원오 “정비사업 기간 10년 이내로...실속주택 대규모 공급”,"이 자리엔 캠프 김영배(재선성북구갑) 상임선대위원장, 오기형(재선도봉구을) 정책총괄본부장, 김남근(초선성북구을) 착착개발도시발전위원장과 인근 재개발 조합 관계자들이 동행했다.정 후보는 우선 기존 15년... ",https://vop.co.kr/A00001692776.html,https://vop.co.kr/A00001692776.html,"Wed, 29 Apr 2026 11:28:00 +0900"
오기형,"정원오 “정비사업 기간 10년 이내로 단축, 공공정비 활성화·실속주택...","현장에는 정원오 캠프의 김영배(재선·성북구갑) 상임선대위원장, 오기형(재선·도봉구을) 정책총괄본부장, 김남근(초선·성북구을) 착착개발·도시발전위원장과 인근 재개발 조합 관계자들이 동행했다. 정 후보는 우선... ",https://biz.heraldcorp.com/article/10728219?ref=naver,https://n.news.naver.com/mnews/article/016/0002637134?sid=100,"Wed, 29 Apr 2026 11:16:00 +0900"
오기형,정원오 &quot;중산층·서민도 서울에 내 집 마련 가능하게 하겠다&quot;,"선거캠프 김영배 상임선대위원장과 오기형 정책총괄본부장, 김남근 착착개발·도시발전위원장 등 관계자들이 참석했다. 오세훈 국민의힘 후보가 시행해온 신속통합기획과 비교해 공공 정비사업을 활성화하고 시세보다... ",https://www.sidae.com/article/2026042909470450199,https://n.news.naver.com/mnews/article/417/0001141108?sid=101,"Wed, 29 Apr 2026 11:15:00 +0900"
오기형,"[6·3 지선] 정원오, 부동산 공약…정비사업 기간 줄이고 소형주택도 확...","이날 캠프 소속 김영배(재선·성북구갑) 상임선대위원장, 오기형(재선·도봉구을) 정책총괄본부장, 김남근(초선·성북구을) 착착개발·도시발전위원장과 인근 재개발 조합 관계자들이 함께 자리했다. 정원오... ",https://www.newspim.com/news/view/20260429000479,https://www.newspim.com/news/view/20260429000479,"Wed, 29 Apr 2026 11:15:00 +0900"
오기형,&quot;금융은 '기본권·인프라'…성장 정책과 결합을&quot;,"강경훈 동국대학교 교수는 지난 27일 더불어민주당 민병덕·오기형·이정문 의원과 한국경제법학회, 한국금융소비자학회 등이 공동 개최한 정책토론회에서 '국민의 금융기본권 보장을 위한 패러다임 전환'을 주제로... ",https://www.junggi.co.kr/news/articleView.html?idxno=36261,https://www.junggi.co.kr/news/articleView.html?idxno=36261,"Wed, 29 Apr 2026 00:00:00 +0900"
오기형,"정 “오세훈, 토허제 즉흥해제 혼란”-오 “정원오, 1주택자도 갈라치기...","6명의 상임선대위원장(이인영·서영교·박주민·전현희·김영배 의원, 김형남 전 군인권센터 사무국장)을 비롯해 이해식 총괄선대본부장과 오기형 공동선대본부장, 채현일 종합상황본부장, 고민정 오세훈 10년 심판본부장... ",https://www.hani.co.kr/arti/politics/election/1256361.html,https://n.news.naver.com/mnews/article/028/0002802912?sid=162,"Tue, 28 Apr 2026 21:00:00 +0900"
오기형,달아오르는 정원오 용광로 선대위…첫 공개 회의서 오세훈에 '맹폭',"이밖에 진성준, 오기형 의원 등도 참여했다. 정 후보는 모두발언부터 오 후보가 정책보다 네거티브에 치중하고 있다며 맹비난했다. 정 후보는 “(오 후보가)시민의 삶보다 보수 재건을 먼저 말하고, 정책 경쟁보다... ",http://www.edaily.co.kr/news/newspath.asp?newsid=05412006645420712,https://n.news.naver.com/mnews/article/018/0006268596?sid=100,"Tue, 28 Apr 2026 18:54:00 +0900"
오기형,정원오 '용광로 선대위' 회의 생중계…오세훈 '시민동행 선대위' 맞불,"이외에 이해식 총괄선대본부장과 오기형 공동선대본부장, 채현일 종합상황본부장, 고민정 오세훈 10년 심판본부장, 박민규 비서실장 등을 포함해 민주당 의원만 22명이 자리했다. 정 후보는 이 자리에서 오 후보를 겨냥해... ",https://www.mt.co.kr/politics/2026/04/29/2026042814585929066,https://n.news.naver.com/mnews/article/008/0005350611?sid=162,"Tue, 28 Apr 2026 16:11:00 +0900"
오기형,"금융지주 지배구조 개편, 혁신으로 이어질까","지난 15일 국회 재정경제기획위원회 소속 오기형 더불어민주당 의원이 위원장을 맡고 있는 '코리아 프리미엄 K-자본시장 특별위원회'와 경제개혁연대, 경제정의실천시민연합이 공동 주최하고 박홍배 더불어민주당 의원이... ",http://www.enewstoday.co.kr/news/articleView.html?idxno=2424176,http://www.enewstoday.co.kr/news/articleView.html?idxno=2424176,"Tue, 28 Apr 2026 15:00:00 +0900"
이소영 의원,"더불어민주당 경기도당, '추추선대위' 출범…경기도지사·31개 시군 동시...","TV토론단은 이소영 의원이 단장을 맡아 정책 검증과 토론 대응을 준비하고, 특보단은 박정 의원과 김현 의원이 이끈다. 공명선거 실천단은 김현 의원이, 법률지원단은 김기표·이건태 의원이 맡아 공정선거 관리와 법률... ",http://www.newstown.co.kr/news/articleView.html?idxno=702210,http://www.newstown.co.kr/news/articleView.html?idxno=702210,"Wed, 29 Apr 2026 23:07:00 +0900"
이소영 의원,[6.3지방선거]추미애 민주당 경기도지사 후보 선대위 구성 발표,"전 의원이 자리했다. 또 ▲비서실장 전용기 ▲공보단·대변인실 박상혁 ▲수석대변인 김성회·박지혜·부승찬 ▲정무실장 김용민, 부실장 이기헌 ▲TV토론단장 이소영 ▲특보단 박정·김현 ▲공명선거 실천단 김현... ",https://www.nspna.com/news/?mode=view&newsid=811535,https://www.nspna.com/news/?mode=view&newsid=811535,"Wed, 29 Apr 2026 19:46:00 +0900"
이소영 의원,추미애 ‘추추선대위’ 출격…현역 의원 총동원 ‘매머드급’ 전열,"총괄선대본부 직속 기구에서는 이소영 의원이 TV토론단 단장을 맡았으며, 박정·김현 의원이 특보단을 이끈다. 공명선거 실천단으로는 김현 의원, 법률지원단으로는 김기표·이건태 의원이 각각 단장을 맡는다. 분야별 본부... ",https://www.kyeonggi.com/article/20260429580587,https://n.news.naver.com/mnews/article/666/0000105311?sid=100,"Wed, 29 Apr 2026 18:44:00 +0900"
이소영 의원,'추진력은 추미애' 내건 민주당…경기 전역 선거판 본격 가동 모드,"TV토론단장은 이소영 의원, 특보단장은 박정·김현 의원, 공명선거 실천단장은 김현 의원, 법률지원단장은 김기표·이건태 의원이 각각 맡았다. 분야별 본부도 구성됐다. 총무본부는 최민희 의원, 전략본부는 김영환 의원... ",https://www.etnews.com/20260429000479,https://n.news.naver.com/mnews/article/030/0003423171?sid=100,"Wed, 29 Apr 2026 18:01:00 +0900"
이소영 의원,"추미애, 매머드급 ‘추추선대위’ 구성…총괄위원장에 조정식·김태년","TV 토론단은 이소영 의원이 단장을 맡고, 특보단은 박정 의원과 김현 의원이 이끈다. 공명선거 실천단은 김현 의원, 법률지원단은 김기표·이건태 의원이 맡아 정책 검증, 토론 대응, 법률 지원, 공정선거 관리 기능을... ",https://www.womennews.co.kr/news/articleView.html?idxno=276890,https://n.news.naver.com/mnews/article/310/0000136179?sid=100,"Wed, 29 Apr 2026 17:45:00 +0900"
이소영 의원,"'선대위원장만 14명' 추미애, 메머드급 '추추 선대위' 가동(종합)","총괄선거대책본부는 김영진 의원이 총괄수석을, 이재정·백혜련 의원이 본부장을 맡아 선거 전략 전반을 지휘한다. 종합상황본부(민병덕·이수진), TV토론단(이소영), 공명선거 실천단(김현), 법률지원단(김기표·이건태)... ",https://www.nocutnews.co.kr/news/6510405?utm_source=naver&utm_medium=article&utm_campaign=20260429051132,https://n.news.naver.com/mnews/article/079/0004142254?sid=102,"Wed, 29 Apr 2026 17:12:00 +0900"
이소영 의원,추미애 '추추선대위' 출범…조정식·김태년 '투톱' 체제,"총괄선거대책본부 직속 기구 가운데 TV토론단은 이소영 국회의원이 단장을 맡고, 특보단은 박정·김현 국회의원이 이끈다. 공명선거 실천단은 김현 국회의원, 법률지원단은 김기표·이건태 국회의원이 맡아 정책 검증, 토론... ",https://news.tf.co.kr/read/national/2318529.htm,https://n.news.naver.com/mnews/article/629/0000495759?sid=102,"Wed, 29 Apr 2026 17:10:00 +0900"
이소영 의원,추미애 '추추선대위' 출범…조정식·김태년 투톱 체제,"TV토론단은 이소영 의원이 단장을 맡고, 특보단은 박정 의원과 김현 의원이 이끈다. 공명선거 실천단은 김현 의원, 법률지원단은 김기표·이건태 의원이 맡아 정책 검증, 토론 대응, 법률 지원, 공정선거 관리 기능을... ",https://www.sidae.com/article/2026042916042244591,https://n.news.naver.com/mnews/article/417/0001141203?sid=162,"Wed, 29 Apr 2026 16:44:00 +0900"
이소영 의원,"민주당 추미애 경기도지사 후보, ‘추추선대위’ 출범… 현역 의원 총동...","총괄선거대책본부 직속 기구는 TV토론단 단장 이소영 의원이, 특보단 단장으로는 박정, 김현 의원이 이름을 올렸다. 공명선거 실천단 단장 김현 의원, 법률지원단 단장 김기표, 이건태 의원은 정책 검증, 법률 지원 등 관리... ",https://www.kgnews.co.kr/news/article.html?no=893857,https://www.kgnews.co.kr/news/article.html?no=893857,"Wed, 29 Apr 2026 16:32:00 +0900"
이소영 의원,"[6·3 지방선거] 추미애 경기도지사 후보, 메머드급 '추추선대위' 발표","TV토론단은 이소영 의원이 단장을 맡고, 특보단은 박정 의원과 김현 의원이 이끈다. 공명선거 실천단은 김현 의원, 법률지원단은 김기표·이건태 의원이 담당한다. 토론 대응, 정책 검증, 법률 지원, 공정선거 관리 기능을... ",https://www.ajunews.com/view/20260429161221370,https://www.ajunews.com/view/20260429161221370,"Wed, 29 Apr 2026 16:32:00 +0900"
이소영 의원,[병원계 소식] 4월 29일,"또 지난 5년간 문종호 센터장, 이소영 소장(순천향대 부천병원 정신건강의학과 교수), 홍경순 부소장 등... 페트라 드 수터 총장은 생식의학 분야 권위자로, 유럽의회 의원(2019년)과 벨기에 부총리 겸 장관(2020~2025년)을... ",http://www.doctorstimes.com/news/articleView.html?idxno=237858,http://www.doctorstimes.com/news/articleView.html?idxno=237858,"Wed, 29 Apr 2026 16:26:00 +0900"
이소영 의원,추미애 '추추' 선대위 본격 가동…현역 의원 44명 참여,"이 밖에도 TV토론단(단장 이소영 의원), 특보단(박정·김현 의원)과 함께 공명선거 실천단, 법률지원단, 전략·정책·홍보·조직·유세·온라인 소통·청년·기후환경 본부 등 기능별 조직도 꾸렸다. 민주당 경기도당 관계자는... ",https://www.kado.net/news/articleView.html?idxno=2047618,https://n.news.naver.com/mnews/article/654/0000178298?sid=100,"Wed, 29 Apr 2026 16:25:00 +0900"
이소영 의원,추미애 경기지사 후보 '추추선대위(추진력은 추미애)' 출범...&quot;시·군 지...,"TV토론단은 이소영 의원이 단장을 맡고, 특보단은 박정 의원과 김현 의원이 이끈다. 분야별 총무본부는 최민희 의원, 전략본부는 김영환 의원, 직능본부는 서영석 의원, 정책본부는 권칠승 의원, 홍보본부는 송옥주 의원이... ",https://www.getnews.co.kr/news/articleView.html?idxno=868990,https://www.getnews.co.kr/news/articleView.html?idxno=868990,"Wed, 29 Apr 2026 16:20:00 +0900"
이소영 의원,추미애 ‘추추선대위’ 출범…경기도 전역 승리 겨냥,"또한 TV토론단(이소영 의원), 특보단(박정·김현 의원), 공명선거 실천단(김현 의원)과 법률지원단(김기표·이건태 의원) 등 기능별 조직도 강화됐다. 분야별로는 총무(최민희), 전략(김영환), 직능(서영석), 정책(권칠승), 홍보... ",https://www.kmib.co.kr/article/view.asp?arcid=0029751981&code=61122013&cp=nv,https://n.news.naver.com/mnews/article/005/0001846147?sid=102,"Wed, 29 Apr 2026 16:04:00 +0900"
이소영 의원,"추미애, '6선 조정식·5선 김태년' 선봉 선 메가 선대위 출범","총괄선거대책본부에는 TV토론단(단장 이소영 의원), 특보단(박정·김현 의원), 공명선거 실천단(단장 김현 의원), 법률지원단(김기표·이건태 의원) 등이 꾸려진다. 이외에 총무본부, 전략본부, 직능본부, 정책본부, 홍보본부... ",https://www.mt.co.kr/politics/2026/04/29/2026042915110247939,https://n.news.naver.com/mnews/article/008/0005351155?sid=162,"Wed, 29 Apr 2026 15:38:00 +0900"
