Keyword,Title,Description,Original Link,Link,Publication Date
기재부,강원특별자치도 제2경춘국도 사업 탄력...수도권-강원 연결 강화,"한기호 의원(춘천‧철원‧화천‧양구을)도 &quot;기재부, 국토부, 강원도청 공직자들의 노력에 감사하며 접경지역 도로망 구축도 차질 없이 추진하겠다&quot;고 말했다. 이번 사업은 강원권 균형발전과 지역 교통 환경 개선에... ",https://www.newspim.com/news/view/20250821000674,https://www.newspim.com/news/view/20250821000674,"Thu, 21 Aug 2025 15:00:00 +0900"
기재부,"기재부, '반덤핑팀' 신설…中 저가 공세 맞서 국내 산업 보호 나서","기존에는 산업통상자원부 무역위원회가 조사와 건의를 담당하고, 기재부가 이를 집행하는 구조였다. 그러나 앞으로는 기재부 내부에 전담 조직을 두어 ▲덤핑방지관세 부과의 타당성 검토 ▲해외 공급자와의 가격 협의... ",http://www.srtimes.kr/news/articleView.html?idxno=184071,http://www.srtimes.kr/news/articleView.html?idxno=184071,"Thu, 21 Aug 2025 14:56:00 +0900"
기재부,"조승래 의원, 노은도매시장 시설 현대화 '예타 대상' 선정 이끌어",통해 기재부 차관에게 사업 필요성을 직접 설명하는 등 설득에 나선 결과 이번 선정으로 이어졌다. 조... 한다&quot;며 &quot;예타 통과까지 대전시와 기재부와 협력하며 최선을 다하겠다&quot;고 강조했다. 민영뉴스통신사 국제뉴스,https://www.gukjenews.com/news/articleView.html?idxno=3355716,https://www.gukjenews.com/news/articleView.html?idxno=3355716,"Thu, 21 Aug 2025 14:46:00 +0900"
기재부,대전노은도매시장 시설현대화 청신호,조승래 의원은 &quot;노은도매시장은 향후 도시개발 등으로 이용 수요가 더욱 증가할 것인 만큼 조속히 시설현대화 사업이 추진돼야 한다&quot;며 &quot;해당 사업이 예비타당성 조사를 통과할 때까지 대전시 및 기재부와 협력하며... ,https://www.ccdn.co.kr/news/articleView.html?idxno=1036198,https://www.ccdn.co.kr/news/articleView.html?idxno=1036198,"Thu, 21 Aug 2025 14:45:00 +0900"
기재부,'중부권 재난의료 거점' 국립 충남 아산경찰병원 예타 통과…건립 본격...,"또 같은 해 시는 중부권 재난전문병원 설립 필요성을 정부에 제안했고, 2022년 12월 경찰청 전국 공모에서 최종 후보지로 확정됐다. 이후 1년 3개월간의 기재부 예타조사 절차를 거쳐 이번 성과를 거뒀다.",https://www.ccdn.co.kr/news/articleView.html?idxno=1036250,https://www.ccdn.co.kr/news/articleView.html?idxno=1036250,"Thu, 21 Aug 2025 14:44:00 +0900"
기재부,"주호영, &quot;지역거점 AX 혁신기술개발 사업, 차질 없이 진행 최선&quot;","주호영 국회부의장(국민의힘, 대구 수성구갑)은 21일 '지역거점 AX(AI Transformation·인공지능 전환) 혁신기술개발 사업'의 국무회의 의결 및 예비타당성조사 면제와 관련해 &quot;사업이 차질 없이 진행돼 많은 일자리를... ",https://www.imaeil.com/page/view/2025082114280792978,https://n.news.naver.com/mnews/article/088/0000965655?sid=100,"Thu, 21 Aug 2025 14:44:00 +0900"
기재부,"회생절차 '휴테크산업', 재매각 나서…이번에는 성공할까",기재부는 주 대표가 상속세를 현물로 대납하면서 지분을 보유하게 됐다. 휴테크산업의 100% 자회사인 휴앤은 건강 관련 가전 렌탈 플랫폼 사업을 영위한다. 휴테크산업은 지난해 8월부터 서울회생법원의... ,https://www.etoday.co.kr/news/view/2498898,https://www.etoday.co.kr/news/view/2498898,"Thu, 21 Aug 2025 14:38:00 +0900"
기재부,"아산시, 국립 공공종합병원 예타 최종 통과",이후 1년 3개월간 기재부 협의와 평가 절차를 거쳐 이번 예타 통과 성과를 거뒀다. 이번 결정으로 아산에는 국비 1724억원이 투입되는 300병상 규모의 국립 공공종합병원이 건립된다. 시는 2026년 설계예산을 확보해 기본... ,http://www.inews24.com/view/1878739,https://n.news.naver.com/mnews/article/031/0000958928?sid=102,"Thu, 21 Aug 2025 14:33:00 +0900"
기재부,"코레일, 안전관리 '미흡'에도 경영평가는 매년 올라...한문희 사장 '사의...",필요하다&quot;며 기재부로부터 안전 관리 역량은 여전히 부족하다는 평가를 받았다. '사망사고 감소 성과와... 이같이 잇달은 사망 사고는 2022년 윤석열 정부 들어 기재부 공공기관 경영평가의 '산재 예방' 점수가 대폭... ,http://www.newsfc.co.kr/news/articleView.html?idxno=73310,http://www.newsfc.co.kr/news/articleView.html?idxno=73310,"Thu, 21 Aug 2025 14:32:00 +0900"
기재부,"정부, '공급망 금융' 50조원 대규모 지원한다…업-미들-다운스트림 '맞...",기획재정부는 20일 구윤철 부총리 겸 기재부 장관 주재로 제5차 공급망안정화위원회를 개최해 이같은 내용의 &quot;공급망 전주기 금융지원 방향&quot;을 확정했다고 발표했다. 정부가 투입하는 50조원 규모 지원은... ,https://www.greened.kr/news/articleView.html?idxno=330151,https://www.greened.kr/news/articleView.html?idxno=330151,"Thu, 21 Aug 2025 14:31:00 +0900"
기재부,"구윤철 “‘PBR 10’ 발언, PER와 순간 착각…불찰에 송구”",뒷자리에 앉아있던 기재부 한 간부가 알려준대로 대답했으나 실제인 1.06 수준과는 현격한 차이가 나는 오답이었다. 이 때문에 주식 양도소득세를 부과하는 대주주 기준 강화로 인해 가뜩이나 성나 있던... ,http://www.edaily.co.kr/news/newspath.asp?newsid=03768726642269616,https://n.news.naver.com/mnews/article/018/0006095150?sid=101,"Thu, 21 Aug 2025 14:28:00 +0900"
기재부,기재부에 '반덤핑팀' 신설... 최근 덤핑관세 부과 급증,"기획재정부에 '반(反)덤핑팀'이 신설된다.한국의 덤핑방지 관세는 산업통상자원부 무역위원회가 조사를 거쳐 건의하고 기재부가 집행하는 방식인데, 기재부 세제실에 별도 조직을 만들어 업무 전문성을 높이겠다는... ",https://weeklytrade.co.kr/news/view.html?section=1&category=3&item=&no=96384,https://weeklytrade.co.kr/news/view.html?section=1&category=3&item=&no=96384,"Thu, 21 Aug 2025 14:26:00 +0900"
기재부,"“전곡, 안보의 땅에서 평화의 물길로&quot;","대체시설을 기부채납하고, 국방부가 용도폐지 및 기재부 등 중앙승인을 하면 해당 군부지를 양여 받아 민간개발(워터파크 등 상업시설) 할 수 있다. 실현 가능성을 높이기 위해 ‘국방부의 용도폐지 결정(안보)ㆍ보호구역... ",https://www.siminilbo.co.kr/news/newsview.php?ncode=1160284814118711,https://www.siminilbo.co.kr/news/newsview.php?ncode=1160284814118711,"Thu, 21 Aug 2025 14:26:00 +0900"
기재부,'대주주 주식양도세 기준 강화' 찬성 43% 반대 46%...팽팽 [NBS],이재명 정부에서 처음 발표한 세제법안으로 기재부 측에서는 전임 정부의 '부자감세' 기조를 철회하겠다는 설명이 이어졌다고 한다. 다만 주식 양도세가 부과되는 대주주 기준을 현행 50억원에서 10억원으로... ,http://www.joseilbo.com/news/news_read.php?uid=550933&class=32&grp=,https://n.news.naver.com/mnews/article/123/0002366378?sid=100,"Thu, 21 Aug 2025 14:25:00 +0900"
기재부,"완도군, 국내 최초 수산 특화 국립해양수산박물관 예타 통과","이후 문화체육관광부의 사전 타당성 평가 통과, 기획재정부의 예비 타당성 조사 대상 사업 선정에 이어 1년 7개월간 한국조세재정연구원의 현장 설명회, 기재부의 점검 회의 및 심의 등을 거치며 해양수산부와 전라남도... ",http://www.metroseoul.co.kr/article/20250821500287,http://www.metroseoul.co.kr/article/20250821500287,"Thu, 21 Aug 2025 14:16:00 +0900"
기재부,"완도군, 오랜 숙원 '국립해양수산박물관 건립' 예타 통과","이후 문화체육관광부의 사전 타당성 평가 통과, 기획재정부의 예비 타당성 조사 대상 사업 선정에 이어 1년 7개월간 한국조세재정연구원의 현장 설명회, 기재부의 점검 회의 및 심의 등을 거치며 해양수산부와 전라남도... ",https://www.tournews21.com/news/articleView.html?idxno=113055,https://www.tournews21.com/news/articleView.html?idxno=113055,"Thu, 21 Aug 2025 14:14:00 +0900"
기재부,"완도군, 국내 최초 수산 특화 국립해양수산박물관 조성","이후 문화체육관광부의 사전 타당성 평가 통과, 기획재정부의 예비 타당성 조사 대상 사업 선정에 이어 1년 7개월간 한국조세재정연구원의 현장 설명회, 기재부의 점검 회의 및 심의 등을 거치며 해양수산부와 전라남도... ",https://www.joongdo.co.kr/web/view.php?key=20250824010006817,https://www.joongdo.co.kr/web/view.php?key=20250824010006817,"Thu, 21 Aug 2025 14:08:00 +0900"
기재부,"이억원, 9월 초 청문회 준비 착착…관전 포인트는",앞서 국정기획위는 금융위의 국내 금융정책을 기재부로 넘기고 감독정책은 금융감독위원회를 설립해 이관하는 방향을 대통령실에 보고했다. 이 같은 안이 확정될 경우 금융위원회 조직은 해체 수순을 밟는다.... ,https://www.newsway.co.kr/news/view?ud=2025082113350108691,https://www.newsway.co.kr/news/view?ud=2025082113350108691,"Thu, 21 Aug 2025 14:08:00 +0900"
기재부,"아산 경찰병원 건립, 예타 통과로 2029년 개원 목표","2022년 전국 공모에서 아산이 최종 후보지로 선정됐고, 이후 충남도는 기재부와 국회를 수차례 방문하며 조속한 건립을 요청해 왔다. 지난해 신속 예타 대상사업으로 선정된 뒤 이번에 최종 관문을 넘었다. 충남도... ",https://www.topstarnews.net/news/articleView.html?idxno=15776731,https://www.topstarnews.net/news/articleView.html?idxno=15776731,"Thu, 21 Aug 2025 14:06:00 +0900"
기재부,“시민 염원 결실” 경찰병원 아산 유치 지역민 ‘반색’,충남도와 아산시에 따르면 20일 기재부 ‘2025년 제8차 재정사업평가위원회’에서 아산 경찰병원 건립... 더불어민주당 복기왕 의원(아산시갑)은 “지난해 4월 국회의원 당선 직후부터 기재부와 지속 협의했왔다”며... ,https://www.seoul.co.kr/news/society/health-medical/2025/08/21/20250821500147?wlog_tag3=naver,https://n.news.naver.com/mnews/article/081/0003567737?sid=102,"Thu, 21 Aug 2025 14:05:00 +0900"
금융위,석유화학 구조조정 '시동'... 은행권 자본여력 시험대로 부상,금융위원회는 21일 은행연합회에서 열린 '석유화학 사업재편 금융권 간담회'에서 기업의 철저한 자구노력과 금융권의 협조를 동시에 요구했다. 권대영 금융위 부위원장은 &quot;비 올 때 우산을 뺏는 행동은 자제해 달라&quot;며... ,https://www.newsfreezone.co.kr/news/articleView.html?idxno=642462,https://www.newsfreezone.co.kr/news/articleView.html?idxno=642462,"Thu, 21 Aug 2025 16:32:00 +0900"
금융위,"금융위, 석화산업 사업재편에 대한 금융지원 유지",금융위원회는 전날 열린 산업경쟁력 강화 관계장관회의(산경장) 및 석유화학업계 사업재편 자율협약식을... 권대영 금융위원회 부위원장 주재로 21일 은행연합회에서 열린 '석유화학 사업재편 금융권 간담회'에서... ,http://www.e2news.com/news/articleView.html?idxno=322486,http://www.e2news.com/news/articleView.html?idxno=322486,"Thu, 21 Aug 2025 16:30:00 +0900"
금융위,"금융위, 석유화학 구조조정 전면 지원…'선 자구노력 후 지원' 원칙 강조",권대영 금융위원회 부위원장이 21일 오전 서울 중구 은행연합회에서 열린 석유화학 경쟁력 제고를 위한 금융권 간담회에서 발언하고 있다. [사진=금융위원회] 금융위원회가 글로벌 공급 과잉과 경쟁력 약화로 위기에 처한... ,https://www.ntoday.co.kr/news/articleView.html?idxno=118663,https://www.ntoday.co.kr/news/articleView.html?idxno=118663,"Thu, 21 Aug 2025 16:30:00 +0900"
금융위,서산 대산 등 석유화학단지 살리기 본격화,"금융위원회도 발 빠르게 대응하고 있다. 21일 5대 은행(KB국민·신한·하나·우리·NH농협), 산업·기업... 금융권 관계자는 &quot;은행권이 기업들의 정상화 가능성을 살펴가며 점진적 구조조정에 협조하는 것이 금융위의 지침... ",https://www.ggilbo.com/news/articleView.html?idxno=1108388,https://www.ggilbo.com/news/articleView.html?idxno=1108388,"Thu, 21 Aug 2025 16:28:00 +0900"
금융위,"‘실세’ 금감원장, 기대와 우려 [데스크 창]",이 전 원장은 상위기관인 금융위와 충돌하며 ‘월권’ 논란에 휩싸이기도 했다. 금융위가 상법 개정을 반대하는 상황에서 “직을 걸겠다”며 개정의 필요성을 역설했다. 이 전 원장이 ‘실세’로 평가받을 수 있었던... ,https://www.kukinews.com/article/view/kuk202508210166,https://www.kukinews.com/article/view/kuk202508210166,"Thu, 21 Aug 2025 16:26:00 +0900"
금융위,"사망보험금 55세부터 연금 전환…노후 대비 새 길, 유족보장 축소 논란...","금융위, 종신보험 연금 전환 연령 65세→55세로 앞당겨 한화·삼성·교보·신한·KB생명 TF 구성…35조 시장... 21일 업계에 따르면 금융위원회는 종신보험 가입자가 55세 이상일 경우 사망보험금을 연금 형태로 선수령할 수... ",https://www.kgnews.co.kr/news/article.html?no=860885,https://www.kgnews.co.kr/news/article.html?no=860885,"Thu, 21 Aug 2025 16:22:00 +0900"
금융위,'실세' 금감원장 의미심장 한마디에…조직개편안 '재조명',"이재명 정부가 금융위원회의 금융정책 기능은 기획재정부로 이관하고, 금융감독 기능은 금감원과 통합하는 방안을 고민하고 있기 때문이다. 특히 금감원은 금융위와의 통합과는 별개로 금융소비자보호처를 분리하는... ",https://www.ajunews.com/view/20250821161000487,https://www.ajunews.com/view/20250821161000487,"Thu, 21 Aug 2025 16:22:00 +0900"
금융위,"금융위 “석화업계 안일한 인식, 보따리부터 내놓으라는 격”","권대영 금융위 부위원장은 21일 5대 시중은행(KB·신한·하나·우리·NH농협)과 산업은행, 기업은행, 수출입은행... 금융위는 사업재편의 기본 원칙으로 철저한 자구노력, 고통 분담, 신속한 실행을 강조했다. 권 부위원장은... ",https://www.donga.com/news/Economy/article/all/20250821/132228270/1,https://n.news.naver.com/mnews/article/020/0003655705?sid=101,"Thu, 21 Aug 2025 16:06:00 +0900"
금융위,"[저녁 뉴스브리핑] 與 김현정, 스테이블코인 법률안 대표발의...'자기자...","갖춰 금융위원회 인가를 받도록 하는 내용이 담겼다. 또 해외 발행 스테이블코인을 국내에서 유통하려는 경우에도 금융위에 등록하는 절차를 하는 특례 조항도 마련됐다. 서클, 韓 가상자산 기업 투자 검토 달러... ",https://www.tokenpost.kr/news/briefing/278899,https://www.tokenpost.kr/news/briefing/278899,"Thu, 21 Aug 2025 16:04:00 +0900"
금융위,"[21일 특징주] 석유·화학株, 정부 '구조조정' 지원 예고에 동반 '상승'",이날 금융위원회도 '석유화학 사업재편 금융권 간담회'를 열고 공동협약을 통해 5대 시중은행과 산업은행·수출입은행 등과 함께 석유화학 업계 자금 수요에 대응하기로 했다. 권대영 금융위 부위원장은... ,https://www.newsworks.co.kr/news/articleView.html?idxno=808171,https://www.newsworks.co.kr/news/articleView.html?idxno=808171,"Thu, 21 Aug 2025 16:02:00 +0900"
금융위,금융위 &quot;보따리부터 내놓으라는 격&quot;…석화업계 작심 비판,"권대영 금융위원회 부위원장이 석유화학업계를 향해 자기 뼈를 깎는 자구노력이 전제돼야 금융지원이 가능하다며 작심 발언을 했다. 권 부위원장은 21일 5대 시중은행(KB·신한·하나·우리·NH농협)과 산업은행, 기업은행... ",http://www.popcornnews.net/news/articleView.html?idxno=91078,http://www.popcornnews.net/news/articleView.html?idxno=91078,"Thu, 21 Aug 2025 16:00:00 +0900"
금융위,이찬우 농협금융 회장 &quot;농협만의 특색 갖춘 생산적 금융 확대해야&quot;,최근 권대영 금융위 부위원장은 공식석상에서 &quot;생산적 분야로 자금공급이 확대될수록 경제성장과 함께 일자리가 창출될 것&quot;이라며 &quot;금융기관들은 담보대출 위주의 전당포식 영업보다는 생산적 분야로 자금을 적극... ,http://www.wikileaks-kr.org/news/articleView.html?idxno=173534,http://www.wikileaks-kr.org/news/articleView.html?idxno=173534,"Thu, 21 Aug 2025 15:54:00 +0900"
금융위,"ELS 가이드라인 언제 나오나…은행들, 수수료이익 확충 다급",은행들이 ELS(주가연계증권) 판매를 위한 금융위원회의 가이드라인 확정을 목빠지게 기다리고 있다.... 21일 금융권에 따르면 은행들은 지난 7월 금융위에 ELS 판매 계획을 전달했다. 지난 2월 금융위가 발표한... ,http://news.bizwatch.co.kr/article/finance/2025/08/21/0027,https://n.news.naver.com/mnews/article/648/0000039063?sid=101,"Thu, 21 Aug 2025 15:49:00 +0900"
금융위,"돈줄 열어달라 vs 리스크 부담…금융권 “석화, 대주주 자구노력부터”...",금융위원회는 21일 5대 시중은행(KB·신한·하나·우리·NH농협)과 산업·수출입·기업은행 등과 ‘석유화학... 권대영 금융위 부위원장은 “석유화학산업은 우리나라 산업 경쟁력의 근간을 이루는 기간산업으로 포기할 수... ,https://www.dt.co.kr/article/12012769?ref=naver,https://n.news.naver.com/mnews/article/029/0002976995?sid=101,"Thu, 21 Aug 2025 15:46:00 +0900"
금융위,"김현정 의원, '스테이블코인 법안' 대표발의...자기자본 50억원 이상",또한 해외에서 발행한 스테이블코인을 국내 유통할 경우 금융위 등록과 보호기금의 적립을 의무화하도록 규정했다. 김 의원은 &quot;국제적으로 스테이블코인이 새로운 금융의 축으로 자리잡고 있지만 최소한의 이용자 보호... ,http://www.wikileaks-kr.org/news/articleView.html?idxno=173552,http://www.wikileaks-kr.org/news/articleView.html?idxno=173552,"Thu, 21 Aug 2025 15:46:00 +0900"
금융위,"빗썸, '코인 대여' 두고 금융당국과 줄다리기…이견 좁힐까","금융위원회는 가상자산 이용자 보호를 위해 대여 서비스 행정지도를 실시한다고 지난 19일 밝혔다. 골자는... 금융위에 따르면, 빗썸 코인 대여 이용자 2만7600명 가운데 13% 규모인 3635명은 강제청산을 경험했다. 시세... ",https://www.newspost.kr/news/articleView.html?idxno=216708,https://www.newspost.kr/news/articleView.html?idxno=216708,"Thu, 21 Aug 2025 15:42:00 +0900"
금융위,배드뱅크 분담금 결정 이달까지인데…당국 뒷짐에 논의 제자리걸음,금융당국 '업권 자율 결정' 고수…업계 '눈치싸움' 계속 아주경제=안선영 기자 asy728@ajunews.com 서울 종로구 소재 금융위원회 내부 전경 [사진=금융위원회] 배드뱅크 설립과 관련한 분담금 납입 마감일이 열흘 앞으로... ,https://www.ajunews.com/view/20250821134017283,https://www.ajunews.com/view/20250821134017283,"Thu, 21 Aug 2025 15:38:00 +0900"
금융위,"스테이블코인, 국내 제도권 편입 박차","갖춰 금융위원회 인가를 받아야 한다. 무인가 영업행위는 당연히 금지된다. 특히 이용자 보호를 위해... 또한 해외에서 발행된 스테이블코인을 국내에서 유통시키려는 경우, 금융위에 등록해야 하며 국내 이용자 보호를... ",http://www.newsprime.co.kr/news/article.html?no=701107,http://www.newsprime.co.kr/news/article.html?no=701107,"Thu, 21 Aug 2025 15:38:00 +0900"
금융위,금융위 “살려주는데 보따리 내놓으라는 격” 직격,권대영(사진) 금융위원회 부위원장이 석유화학 업계에서 ‘선 자구노력 후 지원 조치’에 대해 불만이 제기된 것을 두고 “물에 빠지려고 하는 사람을 구해주려고 하는데 보따리부터 내놓으라는 격”이라며 “안일한... ,https://www.sedaily.com/NewsView/2GWPNWOFU2,https://n.news.naver.com/mnews/article/011/0004523553?sid=101,"Thu, 21 Aug 2025 15:36:00 +0900"
금융위,[액트 논란] 한미사이언스 경영권 분쟁 '헛발질'...이해상충·자본시장...,"전까지 금융위, 거래소 제출) 등을 위반했다고 보고 있다. 이와 관련 &lt;녹색경제신문&gt;은 이상목 컨두잇 대표의 입장과 해명을 듣기 위해 20일부터 수 차례 연락을 시도했으나 답변을 들을 수 없었다. 지난해 11월 공지된... ",https://www.greened.kr/news/articleView.html?idxno=330185,https://www.greened.kr/news/articleView.html?idxno=330185,"Thu, 21 Aug 2025 15:35:00 +0900"
금융위,SGI서울보증·웰컴금융 뚫렸다…금융권 사이버 보안 ‘경고등’,금융위원회는 지난달 30일 ‘금융권·금융 공공기관 침해사고 대비 태세 점검 회의’를 개최해 침해사고... 금융위 관계자는 “지난번 회의 결과를 바탕으로 자체 점검을 해 이달 말까지 진행될 예정이다. 또 테마 점검은... ,https://www.dt.co.kr/article/12012759?ref=naver,https://n.news.naver.com/mnews/article/029/0002976985?sid=101,"Thu, 21 Aug 2025 15:33:00 +0900"
금융위,"실세 금감원장 '이찬진' 발언, 조직개편설 '재점화'",시장 일각에서는 금융위원회 해체론이나 대규모 인사 교체설까지 거론하며 금감원의 행보를 예의주시하는... 새 정부 출범 이후 금융위원회와 금감원은 사실상 '컨트롤타워' 공백 상태였다. 김병환 전 금융위원장은 교체... ,https://www.ziksir.com/news/articleView.html?idxno=101382,https://www.ziksir.com/news/articleView.html?idxno=101382,"Thu, 21 Aug 2025 15:30:00 +0900"
금융위,"김현정, 스테이블코인 법안 대표발의…발행업 인가제 도입·50억 이상 자...","법안을 살펴보면 ▲발행 사업자 최소 50억원 이상 자기자본 ▲인력 및 물적 설비 등 요건 갖춰 금융위원회... 또한, ▲해외 발행 스테이블코인 국내 유통시 금융위 등록 ▲국내 이용자 보호 위한 보호기금 의무적 적립 등의... ",http://www.fieldnews.kr/news/articleView.html?idxno=20729,http://www.fieldnews.kr/news/articleView.html?idxno=20729,"Thu, 21 Aug 2025 15:28:00 +0900"
금융위,"&quot;ESG 공시 불확실성에 시달린 3년, 이제 끝?&quot; 멈췄던 시계 빨라질까",회의에서 금융위가 ESG 공시 의무화 시기를 2026년 이후로 연기한다고 밝히며 의무화 시점이 밀렸다. 이후 지난해 12월30일 김소영 당시 금융위 부위원장이 올해 상반기 안으로 구체적인 공시 기준과 로드맵을... ,http://news.mt.co.kr/mtview.php?no=2025082115082711678,https://n.news.naver.com/mnews/article/008/0005239116?sid=101,"Thu, 21 Aug 2025 15:27:00 +0900"
금융위,금융위 부위원장 권대영 석유화학업계 작심 비판 &quot;뼈 깎는 자구노력 보...,"금융위원회는 21일 오전 서울 중구 은행연합회 중회의실에서 권대영 부위원장 주재로 5대 시중은행, 정책금융기관과 석유화학 사업재편을 위한 간담회를 열었다. 권대영 금융위원회 부위원장이 21일 서울 중구... ",https://www.businesspost.co.kr/BP?command=article_view&num=408554,https://www.businesspost.co.kr/BP?command=article_view&num=408554,"Thu, 21 Aug 2025 15:26:00 +0900"
금융위,"금융위, 석화업계 작심 비판…&quot;뼈를 깎는 자구노력 선행돼야&quot;",com 권대영 금융위원회 부위원장(오른쪽)이 21일 서울 중구 은행연합회에서 석유화학 사업재편을 위한 간담회를 주재하고 있다. [사진=금융위원회] 석유화학업계 사업재편이 공식화하면서 금융권도 지원사격을 준비하고... ,https://www.ajunews.com/view/20250821151459418,https://www.ajunews.com/view/20250821151459418,"Thu, 21 Aug 2025 15:24:00 +0900"
금융위,스테이블코인 본격 추진…&quot;규율 체계 마련해야&quot;,"따르면 금융위원회는 오는 10월 원화 스테이블코인 관련 법안을 공개한다. 법안엔 원화 스테이블코인 발행 요건과 담보관리, 내부통제 체계 등을 담으며 가상자산이용자보호법 2단계 입법에 포함될 예정이다, 금융위가... ",https://www.viva100.com/article/20250819500674,https://www.viva100.com/article/20250819500674,"Thu, 21 Aug 2025 15:22:00 +0900"
금융위,"김현정 의원, 국내 첫 스테이블코인 포괄법 발의…테더·서클도 보호금...","사업자는 최소 50억원 이상의 자기자본과 건전한 사업계획, 정해진 인적, 물적 요건을 갖춰 금융위원회의... 이 역시 금융위 등록이 필요하고, 국내 이용자 보호를 위해 보호기금을 의무적으로 적립하도록 하는 특례 조항을... ",https://www.dt.co.kr/article/12012755?ref=naver,https://n.news.naver.com/mnews/article/029/0002976981?sid=101,"Thu, 21 Aug 2025 15:21:00 +0900"
