Keyword,Title,Description,Original Link,Link,Publication Date
수출입은행,"日은 서명, 韓은 고심…'국익' 앞세운 韓 정부, 수익배분 구조에 제동","또한 투자 재원을 마련하려면 산업은행·수출입은행 등이 국내외에서 채권을 발행하고 이를 달러로 환전해야 하는데, 이 경우 금융기관의 자본비율이 악화될 가능성도 배제할 수 없다. 이 때문에 정부는 투자처 선정에... ",https://www.ajunews.com/view/20250914120032079,https://www.ajunews.com/view/20250914120032079,"Sun, 14 Sep 2025 16:02:00 +0900"
수출입은행,한국은행 27조원 벌고 기부는 '고작 0.004%',"기재위 소속 공공기관인 한국투자공사는 최근 5년 5천656억원, 한국수출입은행은 2조 7천392억원의 당기순이익을 냈고, 각각 36억원과 435억원을 기부했다. 또 한국은행이 제출한 최근 5년 사회공헌 활동 내역에... ",http://www.labortoday.co.kr/news/articleView.html?idxno=230200,http://www.labortoday.co.kr/news/articleView.html?idxno=230200,"Sun, 14 Sep 2025 15:36:00 +0900"
수출입은행,[글로벌이코노믹 사설] 타산지석 삼을 일본의 대미 투자협정,한국의 수출입은행과 수출보험공사에 해당하는 기관이다. 물론 이들 기관은 민간은행의 대출을 보증하는 역할만 할 수도 있다. 만약 채권발행으로 자금을 조달할 경우 일본 엔화약세 충격을 받을 수도 있기 때문이다.... ,http://www.g-enews.com/ko-kr/news/article/news_all/20250912140216975335e857d010_1/article.html,http://www.g-enews.com/ko-kr/news/article/news_all/20250912140216975335e857d010_1/article.html,"Sun, 14 Sep 2025 14:56:00 +0900"
수출입은행,27조 벌고 기부는 고작 0.004%…한국은행의 ‘인색한 사회공헌’,"같은 기획재정위원회의 소관기관인 한국투자공사는 최근 5년간 총 5,656억원, 한국수출입은행은 총 2조 7,392억원의 당기순이익을 냈고, 각각 총 36억원과 435억원을 기부했다. 한국은행은 두 기관과 비교했을 때... ",https://wemakenews.co.kr/news/view.php?no=22956,https://wemakenews.co.kr/news/view.php?no=22956,"Sun, 14 Sep 2025 11:56:00 +0900"
수출입은행,"한국은행, '인색한 사회공헌' 도마위... 순이익比 기부금 0.004%에 불과","(사진=정일영 의원실) 같은 기획재정위원회의 소관기관인 한국투자공사는 최근 5년간 총 5656억 원, 한국수출입은행은 총 2조7392억원의 당기순이익을 냈고 각각 총 36억 원과 435억 원을 기부했다. 한국은행은 두... ",http://www.chungnamilbo.co.kr/news/articleView.html?idxno=849160,http://www.chungnamilbo.co.kr/news/articleView.html?idxno=849160,"Sun, 14 Sep 2025 11:32:00 +0900"
수출입은행,더 꼬여가는 한미 관세 협상 … '3500억 달러' 놓고 '경제 동맹' 사실상...,또 재원을 확보하려면 산업은행과 수출입은행 등이 국내외에서 채권을 찍어 마련한 자금을 달러로 환전해야 해 자본비율의 급격한 하락 가능성도 우려된다. 이에 향후 한·미간 협상의 세부조율을 매듭짓고 협정 문안에... ,https://biz.newdaily.co.kr/site/data/html/2025/09/14/2025091400017.html,https://biz.newdaily.co.kr/site/data/html/2025/09/14/2025091400017.html,"Sun, 14 Sep 2025 10:32:00 +0900"
수출입은행,"27조 벌고 기부는 ‘쥐꼬리’…한국은행, 사회적 책임 외면","비슷한 기간 한국투자공사(KIC)와 한국수출입은행은 각각 5656억원, 2조 7392억원의 당기순이익을 냈다. 하지만 기부금은 한국투자공사가 총 36억원, 수출입은행은 무려 435억원을 내놓으며 한국은행과 대조적인... ",https://www.livesnews.com/news/article.html?no=54397,https://www.livesnews.com/news/article.html?no=54397,"Sun, 14 Sep 2025 10:08:00 +0900"
수출입은행,"권성동, 왜 7천억 필리핀 사업에 집착했나?",그는 한국수출입은행이 필리핀 정부에 ‘일본의 지원을 받으라’고 제안했다는 내밀한 사실까지도 알고 있었습니다. 권 의원이 그런 결정을 할 위치에 있는가 하면 그렇지 않습니다. EDCF 지원 여부를 결정하는 것은... ,https://h21.hani.co.kr/arti/politics/politics_general/57988.html,https://n.news.naver.com/mnews/article/036/0000052301?sid=100,"Sun, 14 Sep 2025 09:20:00 +0900"
수출입은행,"폴란드서 기회 찾는 은행권…잇딴 기업 진출에 지점 열고, 법인 출범",폴란드에 국내 방산기업 수출을 위해 대출과 보증업무를 맡고 있는 수출입은행도 지난 6월부터 정식 인가를 받고 업무를 시작했다. 시중은행의 방산수출 금융을 이끌고 있는 하나은행은 이번 지점 개소를 통해 폴란드... ,http://news.mt.co.kr/mtview.php?no=2025091216212969822,https://n.news.naver.com/mnews/article/008/0005250000?sid=101,"Sun, 14 Sep 2025 06:20:00 +0900"
수출입은행,금융공공기관 지형 요동 … 재경부 이관·통폐합 '태풍의 눈',수출입은행과 무역보험공사는 수출 보증·보험 기능이 겹쳐 효율성 논란이 반복돼 왔다. 주택금융공사와 주택도시기금(HUG 포함) 역시 서민·주택금융 지원에서 업무 중복이 지적된다. 이에 따라 이들 금융공공기관은 개편... ,https://biz.newdaily.co.kr/site/data/html/2025/09/12/2025091200215.html,https://biz.newdaily.co.kr/site/data/html/2025/09/12/2025091200215.html,"Sun, 14 Sep 2025 06:02:00 +0900"
수출입은행,김정관·러트닉 뉴욕 회동... ’3500억달러 이견' 속 관세협상 장기화되...,정부는 지난 7월 30일 협상 타결 직후만 하더라도 3500억 달러 대미 투자의 성격에 대해 “일부는 자본금 출연 형식을 띠지만 직접투자 비율은 높지 않을 것이고 대부분이 수출입은행이나 무역보험공사 등을 동한 대출... ,https://www.chosun.com/international/us/2025/09/14/H6IDQIXJO5H77C5LU5G63J3WLY/?utm_source=naver&utm_medium=referral&utm_campaign=naver-news,https://n.news.naver.com/mnews/article/023/0003929036?sid=104,"Sun, 14 Sep 2025 04:03:00 +0900"
산업은행,"[8천억 혈세의 역설②] 대한항공, 소비자 후생 '뒷전'…서비스 저하·마...","산업은행은 지난 2020년 11월 한진칼에 8000억원의 공적자금을 투입해 대한항공의 아시아나 인수를 공식화했다. 항공산업의 경쟁력을 강화한다는 취지였지만, 5년이 지난 현시점에서 항공산업의 구조 개편이 소비자 후생을... ",https://www.ebn.co.kr/news/articleView.html?idxno=1678359,https://www.ebn.co.kr/news/articleView.html?idxno=1678359,"Mon, 15 Sep 2025 06:22:00 +0900"
산업은행,[뉴스토마토프라임] 산업은행 퇴사자에 &quot;후회 안 하냐&quot; 물어보니,"뉴스토마토 = 이종용 기자 | 떠들썩했던 KDB산업은행의 부산 이전 이슈가 이재명정부 출범한 이후 잠잠해졌습니다. 윤석열정부에서는 대선 공약으로 걸었던 산은의 부산 이전을 강력하게 추진했고, 강석훈 전 산은 회장이... ",http://www.newstomato.com/ReadNews.aspx?no=1274793&inflow=N,http://www.newstomato.com/ReadNews.aspx?no=1274793&inflow=N,"Mon, 15 Sep 2025 06:02:00 +0900"
산업은행,"&quot;부동산 와르르, 리먼 700조 파산&quot;…한국이 빚 떠안을 뻔 '아찔'[뉴스속...",한국 KDB산업은행도 리먼 브라더스 인수를 검토했지만 결국 참여하지 않았다. 이에 대해 결과적으로 한국은 '최악의 거래'를 피했다는 평가를 받는다. 만약 이를 인수했더라면 700조원에 달하는 막대한 채무를... ,http://news.mt.co.kr/mtview.php?no=2025091210451327882,https://n.news.naver.com/mnews/article/008/0005250220?sid=102,"Mon, 15 Sep 2025 06:00:00 +0900"
산업은행,"은행권 생산적금융 박차…첨단산업 육성, 中企 경쟁력 강화",나머지 75억원은 첨단전략산업기금으로 산업은행이 부담한다. 이재명 대통령은 국민성장펀드에 대해 &quot;좀 더 과감하게 펀드 규모를 150조원으로 50% 더 늘려서 확대하기로 했다&quot;며 &quot;지원방식도 대대적으로 개편해서 우리... ,http://www.fntimes.com/html/view.php?ud=202509140737218086dd55077bc2_18,http://www.fntimes.com/html/view.php?ud=202509140737218086dd55077bc2_18,"Mon, 15 Sep 2025 05:02:00 +0900"
산업은행,"정진완號 우리은행, 기업 컨설팅·혁신금융 패키지로 강화 [은행권 생산...","우리은행은 산업통상자원부와 함께 ‘Rising Leaders 300’ 프로젝트를 추진, 2023년부터 2027년까지 5년간 우량·선도 중견기업에 최대 4조 원 규모 여신한도와 금리 우대, 수출입 금융 및 ESG 컨설팅을 제공한다. 이미 1... ",http://www.fntimes.com/html/view.php?ud=202509140754401048dd55077bc2_18,http://www.fntimes.com/html/view.php?ud=202509140754401048dd55077bc2_18,"Mon, 15 Sep 2025 05:02:00 +0900"
산업은행,"오픈뱅킹 활발한데...금융권 들쑥날쑥 ‘보안 투자 공시’ [해킹, 붕괴된...","한국산업은행, 기술보증기금 등은 투자·인력 운용 현황조차 공개하지 않아 실태 파악이 불가능하다. 공공기관경영정보공개시스템(알리오)에도 단순 등급만 표기돼 있을 뿐이다. 이는 제도적 허점에서 비롯됐다. 현행... ",https://www.etoday.co.kr/news/view/2505776,https://www.etoday.co.kr/news/view/2505776,"Mon, 15 Sep 2025 05:00:00 +0900"
산업은행,"與, 尹정부 公기관장 물갈이 속도조절… ‘대통령과 임기 일치’ 법안 ...",출범 100일이 지난 이재명 정부도 새로 임명된 공공기관장은 박상진 한국산업은행장 1명뿐이다. 윤석열 정부 때도 취임 100일 시점에 임명된 공공기관장은 3명에 그쳤다. 정부 관계자는 “환경부 블랙리스트 사건 이후... ,https://www.donga.com/news/Politics/article/all/20250915/132385507/2,https://n.news.naver.com/mnews/article/020/0003661007?sid=100,"Mon, 15 Sep 2025 03:04:00 +0900"
산업은행,"정부, 美에 통화스와프 체결 요청…&quot;외환시장 혼란 최소화 필요&quot;",그러면서 &quot;우리나라가 수출입은행이나 산업은행을 통해 1년에 조달할 수 있는 금액이 200억~300억달러를 넘기가 어렵다&quot;며 &quot;근본적으로 외환시장에 미칠 충격에 대해 (미국 측이) 같이 도와주고 해답을 달라고 했다&quot;고... ,https://www.ajunews.com/view/20250914222520312,https://www.ajunews.com/view/20250914222520312,"Sun, 14 Sep 2025 22:30:00 +0900"
산업은행,"韓, 미국 정부에 무제한 통화스와프 요청",그러면서 &quot;우리나라가 수출입은행이나 산업은행을 통해 1년에 조달할 수 있는 금액이 200억~300억달러를 넘기가 어렵다&quot;며 &quot;근본적으로 외환시장에 미칠 충격에 대해 (미국 측이) 같이 도와주고 해답을 달라고 했다&quot;고... ,http://news.mt.co.kr/mtview.php?no=2025091419563864638,https://n.news.naver.com/mnews/article/008/0005250181?sid=101,"Sun, 14 Sep 2025 20:50:00 +0900"
산업은행,[단독] 한미 통화 스와프 요청…미국은 부정적,▶ 인터뷰 : 김용범 / 대통령실 정책실장 (지난 9일) - &quot;우리나라가 1년에 조달할 수 있는 수출입은행이나 산업은행 쪽에서 조달할 수 있는 금액이 200~300억 불을 넘기가 어려운데….&quot; 우리나라는 원화 채권을 발행해 자금을... ,http://www.mbn.co.kr/pages/news/newsView.php?news_seq_no=5141035,https://n.news.naver.com/mnews/article/057/0001908348?sid=100,"Sun, 14 Sep 2025 19:44:00 +0900"
산업은행,이억원 금융위원장 15일 취임… 조직개편 혼란 수습 '과제',"이는 산업은행이 운영하는 첨단전략산업기금 75조원과 민간·국민·금융권 자금 75조원으로 구성된다. 가계부채 관리도 빼놓을 수 없다. 정부의 연이은 가계대출 규제 발표로, 증가세는 주춤한 사태다. 하지만 여전히 집값... ",http://www.dynews.co.kr/news/articleView.html?idxno=820098,http://www.dynews.co.kr/news/articleView.html?idxno=820098,"Sun, 14 Sep 2025 19:38:00 +0900"
산업은행,"자본배분·재무부담 등 금융권도 부정적, 지분 일부매각이 공공성 담보...",공공성을 확보하면서도 조기 공적 자금 회수를 통해 HMM 지분이 산업은행의 건전성 지표를 악화시키는 것을 막을 수 있다는 것이다. iM증권은 지난 6월 ‘공적 자금 투자의 모범 사례’라는 제목의 HMM 보고서를 통해... ,http://www.kookje.co.kr/news2011/asp/newsbody.asp?code=0200&key=20250915.22003004414,https://n.news.naver.com/mnews/article/658/0000119982?sid=101,"Sun, 14 Sep 2025 19:22:00 +0900"
산업은행,“해운 생태계 망가질 것” 포스코의 HMM 인수설 업계 반발,"2016년 산업은행에 편입 비핵심 사업, 자금 부족 등 SK그룹 SK해운 2018년 한앤컴퍼니에 매각 비핵심 사업 CSX Sea-Land 1999년 머스크에 정기선 부문 매각 철도사업 집중 TUI 하팍-로이드 2009~2012년 Albert Ballin 컨소시엄에 지분... ",http://www.kookje.co.kr/news2011/asp/newsbody.asp?code=0200&key=20250915.22003004415,https://n.news.naver.com/mnews/article/658/0000119983?sid=101,"Sun, 14 Sep 2025 19:22:00 +0900"
산업은행,"부산 찾은 장동혁, PK 민심 공략…방명록엔 '버티거나 죽거나' 각오",이어 장 대표는 &quot;부산을 글로벌 허브 도시로 만들려면 금융이 함께 오지 않으면 안 된다고 생각한다&quot;며 산업은행 이전을 언급하기도 했다. 부산의 청년 인구 유출 현상에 대해서는 &quot;큰 틀에서는 완벽한 지방 분권이 될 때... ,https://www.news1.kr/politics/assembly/5911727,https://n.news.naver.com/mnews/article/421/0008485122?sid=100,"Sun, 14 Sep 2025 18:21:00 +0900"
산업은행,"장병익 전주시의원, 공공기관 2차 이전 대응 전략 촉구","장병익 의원은 지난 12일 열린 제423회 전주시의회 임시회 제3차 본회의 시정질문에서 전주시의 공공기관 2차 이전 대응 전략 부재를 지적하며, 한국산업은행 유치와 원도심 이전을 통한 균형발전 전략을 제시했다. 장... ",http://sjbnews.com/news/news.php?number=859839,http://sjbnews.com/news/news.php?number=859839,"Sun, 14 Sep 2025 18:18:00 +0900"
산업은행,애경그룹 '뷰티·생활용품' 떼내고 '항공·화학' 체력키운다,제주항공은 코로나19 당시 지원받은 산업은행 기간산업안정기금 중 364억원 규모의 영구전환사채(CB) 콜옵션을 행사하는 등 정책자금 조기 상환에 나서고 있다. 재무구조를 개선하고 경영 자율성을 확보하겠다는 의지로... ,https://www.asiatoday.co.kr/view.php?key=20250915010007578,https://www.asiatoday.co.kr/view.php?key=20250915010007578,"Sun, 14 Sep 2025 18:14:00 +0900"
산업은행,&quot;공공기관 2차 이전 전략 부재&quot;,"전주시의회 장병익 의원(완산동,중화산1·2동)은 지난 12일 열린 시정질문에서 전주시의 공공기관 2차 이전 대응 전략 부재를 지적하며, 한국산업은행 유치와 원도심 이전을 통한 균형발전 전략을 강력히 요구했다. 또한 장... ",http://www.jjn.co.kr/news/articleView.html?idxno=1017308,http://www.jjn.co.kr/news/articleView.html?idxno=1017308,"Sun, 14 Sep 2025 18:12:00 +0900"
산업은행,금융 公기관 CEO 연봉 3.3억…'낙하산 천국',14일 금융권에 따르면 금융위 산하 공공기관 일곱 곳의 CEO 중 내부 출신은 김성태 기업은행장과 박상진 산업은행 회장 등 두 명(28.6%)에 불과하다. 최원목 신용보증기금 이사장과 정정훈 한국자산관리공사 사장은 각각... ,https://www.hankyung.com/article/2025091428151,https://n.news.naver.com/mnews/article/015/0005184697?sid=101,"Sun, 14 Sep 2025 18:08:00 +0900"
산업은행,日은행 산업부흥 외치는데…韓은 '소비자 보호' 얽매여,세계무역기구(WTO) 체제 종말과 미국의 고율 관세로 글로벌 경제·무역의 틀이 바뀌는 상황에서 국내 은행들이 핵심 산업 지원에 나서지 못한 채 상생 금융을 위한 도구로 전락하고 있다. 금융산업 발전과 역할... ,https://www.sedaily.com/NewsView/2GXWEW9OCY,https://n.news.naver.com/mnews/article/011/0004532887?sid=101,"Sun, 14 Sep 2025 17:47:00 +0900"
산업은행,금융 산하기관장 인선 ‘지각변동’…내부 출신 기용 기대감,여기에 KDB산업은행에 첫 내부 출신 회장이 내정되면서 다른 국책은행과 금융 공공기관에서도 내부 인사 발탁 가능성에 눈길이 쏠린다. 14일 대통령실에 따르면 이재명 대통령은 이억원 금융위원장과 주병기... ,https://www.etoday.co.kr/news/view/2506182,https://www.etoday.co.kr/news/view/2506182,"Sun, 14 Sep 2025 17:34:00 +0900"
산업은행,"MUFG, 반도체 기업에 설비교체 먼저 제안…한국은 산업군 전담팀조차 없...",우리금융연구소는 “은행이 핵심 산업군을 선정하고 동일 산업군 내에서도 개별 기업 단위로 타깃 업체를 선별할 필요가 있다”며 “핵심 업종에 대한 전담 조직을 운영해 성장 유망 산업에 선택과 집중을 할 필요가... ,https://www.sedaily.com/NewsView/2GXWEA7HJI,https://n.news.naver.com/mnews/article/011/0004532862?sid=101,"Sun, 14 Sep 2025 17:27:00 +0900"
산업은행,"72조 필요한 송전망, 금융사 참여땐 조기 구축",한국산업은행 같은 국책은행을 중심으로 시중은행과 보험사·연기금 등이 들어오면 공공성을 유지하면서도 사업 속도를 높일 수 있다는 것이다. 실제로 지난해 말 현재 한전의 부채는 205조 4449억 원으로 부채비율은 496.69... ,https://www.sedaily.com/NewsView/2GXWECPYHF,https://n.news.naver.com/mnews/article/011/0004532860?sid=101,"Sun, 14 Sep 2025 17:23:00 +0900"
산업은행,"[금융街 풍향계] 이찬진 금감원장,&quot;투자자 보호 최우선&quot; 주문...iM금융 황...","한국산업은행 새사령탑 박상진 전 준법감시인 내정 한화생명 권혁웅 부회장 “AI 기반 맞춤 솔루션 강화” 새마을금고 박차훈 전 회장, 파기환송심도 징역 6년 [서울타임즈뉴스 = 최남주 기자] 금융권이 투자자 보호와... ",https://www.seoultimes.news/news/article.html?no=2000080297,https://www.seoultimes.news/news/article.html?no=2000080297,"Sun, 14 Sep 2025 16:36:00 +0900"
산업은행,"한진 3000억에 없앤 정부, HMM 6조8000억 지원... BIS 5조의 덫",하지만 BIS 자기자본 규제로 산업은행의 정책금융 대출여력이 최대 5조원 축소될 위기에 처했다. 2027년까지 매각하지 못하면 산업은행의 기업 지원 능력이 크게 떨어진다. 2016년 국정농단과 한진해운 파산... ,https://www.incheontoday.com/news/articleView.html?idxno=308280,https://www.incheontoday.com/news/articleView.html?idxno=308280,"Sun, 14 Sep 2025 16:22:00 +0900"
산업은행,[창간기획·K조선 경쟁력의 비밀] 美 MRO 시장 석권⋯ ‘황금기’ 여는...,"아울러 KDB산업은행, 미국 사모펀드 서버러스 캐피탈과 함께 마스가(MASGA·Make American Shipbuilding Great Again) 프로젝트 관련 업무협약을 체결한 HD현대그룹은 필리핀 수빅 조선소에서의 경험을 바탕으로 미국 현지 조선소... ",https://www.viva100.com/article/20250831500708,https://www.viva100.com/article/20250831500708,"Sun, 14 Sep 2025 16:12:00 +0900"
산업은행,"日은 서명, 韓은 고심…'국익' 앞세운 韓 정부, 수익배분 구조에 제동","또한 투자 재원을 마련하려면 산업은행·수출입은행 등이 국내외에서 채권을 발행하고 이를 달러로 환전해야 하는데, 이 경우 금융기관의 자본비율이 악화될 가능성도 배제할 수 없다. 이 때문에 정부는 투자처 선정에... ",https://www.ajunews.com/view/20250914120032079,https://www.ajunews.com/view/20250914120032079,"Sun, 14 Sep 2025 16:02:00 +0900"
산업은행,"패스트레인, 나노시스템즈, 엑스센트리 투자 유치[주간VC동향]","이번 시리즈 C 라운드는 프리IPO 성격의 투자 유치로 한국산업은행, 티인베스트먼트 등 총 7곳이 참여했다. 패스트레인은 운영하는 '여신티켓'은 피부과 미용 시술 정보 제공∙예약 플랫폼으로 올해 상반기 기준 다운로드... ",http://www.fnnews.com/news/202509140925274268,https://n.news.naver.com/mnews/article/014/0005406394?sid=101,"Sun, 14 Sep 2025 15:29:00 +0900"
산업은행,"하나은행, 美 관세 피해 기업에 1000억원 수출 금융 지원","하나은행은 산업통상자원부, HL그룹, 한국무역보험공사와 미국 관세 부과로 직·간접 피해가 우려되는 협력 업체를 대상으로 한 '상생 협력 수출 금융 지원' 업무 협약을 체결했다고 14일 밝혔다. 지난 12일 하나은행... ",https://www.financialpost.co.kr/news/articleView.html?idxno=233080,https://www.financialpost.co.kr/news/articleView.html?idxno=233080,"Sun, 14 Sep 2025 15:12:00 +0900"
산업은행,‘포스코 HMM 인수 검토’ 강력 반발하는 해운업계,"해운업계 한 관계자는 “산업은행이 보유한 30% 이상의 최대 주주 지분을 특정 대기업 한 곳에 몰아주는 것보다는 국민연금이나 부산시, 부울경 상공계, 국내 해운기업들이 골고루 참여해 공유하는 것이 바람직한... ",https://www.busan.com/view/busan/view.php?code=2025091414010247341,https://n.news.naver.com/mnews/article/082/0001344699?sid=102,"Sun, 14 Sep 2025 14:44:00 +0900"
산업은행,금융위 새 수장 이억원… 조직개편 혼란 수습 ‘과제’,이는 산업은행이 운영하는 첨단전략산업기금 75조원과 민간·국민·금융권 자금 75조원으로 구성된다. 이 위원장은 금융권의 생산적 금융 투자를 독려해야 한다. 금융권이 주택담보대출(주담대) 같은 이자 장사보다는... ,https://www.dt.co.kr/article/12017775?ref=naver,https://n.news.naver.com/mnews/article/029/0002981986?sid=101,"Sun, 14 Sep 2025 14:23:00 +0900"
산업은행,"하나은행, 산업부·HL그룹·한국무역보험공사와 협력업체 자금 지원…'...","▲ 하나은행과 산업통상자원부, HL그룹, 한국무역보험공사 등이 '상생 협력 수출금융 지원'을 위한 업무협약을 체결하고 기념촬영을 하고 있다. 왼쪽부터 장영진 한국무역보험공사 사장, 박정성 산업통상자원부... ",https://www.incheonilbo.com/news/articleView.html?idxno=1303016,https://www.incheonilbo.com/news/articleView.html?idxno=1303016,"Sun, 14 Sep 2025 13:30:00 +0900"
산업은행,"하나은행, 산업통상자원부·HL그룹·무역보험공사와 맞손..&quot;관세 피해 협...","앞서 하나은행은 지난달 미국 관세 부과에 따른 대외 불확실성 해소 및 자동차산업 수출 공급망 강화를 위해 현대차·기아, 무역보험공사와 업무협약을 체결하고 총 6300억원 규모의 유동성 자금을 공급키로 했다. 또 관세... ",http://www.fnnews.com/news/202509141312501595,https://n.news.naver.com/mnews/article/014/0005406343?sid=101,"Sun, 14 Sep 2025 13:29:00 +0900"
산업은행,"하나은행-산업통상자원부-HL그룹-한국무역보험공사, 관세 피해 협력업체...","지난 12일 하나은행 을지로 본점에서 열린 협약식에는 박정성 산업통상자원부 무역투자실장, 정몽원 HL그룹 회장, 장영진 한국무역보험공사 사장, 이호성 하나은행장 등이 참석했다. 이번 협약은 미국의 관세 조치로 큰... ",http://www.wsobi.com/news/articleView.html?idxno=289595,http://www.wsobi.com/news/articleView.html?idxno=289595,"Sun, 14 Sep 2025 12:50:00 +0900"
산업은행,어김없이 되풀이된 관제펀드…은행권은 '부담',"기존 100조원에서 150조원으로 몸집을 불린 국민성장펀드의 절반은 은행 등 민간이 재원 마련을 담당한다.14일 관계부처에 따르면 국민성장펀드는 산업은행에 설치하는 첨단전략산업기금 75조원에 금융사, 연기금, 일반... ",https://news.mtn.co.kr/news-detail/2025091412004692105,https://news.mtn.co.kr/news-detail/2025091412004692105,"Sun, 14 Sep 2025 12:44:00 +0900"
산업은행,&quot;필름형 태양전지로 모빌리티 혁신을 주도&quot;,"역량과 혁신 자원을 활용해 국가전략기술분야 딥테크 창업 및 투자 활성화를 촉진하기 위해 마련됐다. 연구개발특구재단과 미래과학기술지주가 공동으로 주관했으며, 5개 과기특성화대와 한국산업은행이 함께 참여했다.",http://www.namdonews.com/news/articleView.html?idxno=832896,http://www.namdonews.com/news/articleView.html?idxno=832896,"Sun, 14 Sep 2025 12:40:00 +0900"
산업은행,"하나은행·산업부·HL그룹·무역보험공사, 관세 피해 협력사 수출금융 ...","미 관세 피해 우려 협력업체에 1000억원 규모 금융지원보증료 전액 지원·금리·환율 우대 등 실질적 혜택 제공자동차 수출 공급망 안정화 및 상생 협력 강화 이로운넷 = 이수진 에디터 하나은행은 산업통상자원부, HL그룹... ",https://www.eroun.net/news/articleView.html?idxno=63111,https://www.eroun.net/news/articleView.html?idxno=63111,"Sun, 14 Sep 2025 12:34:00 +0900"
