Keyword,Title,Description,Original Link,Link,Publication Date
국회,"대한민국 산림정책, ‘경영’과 ‘보존’의 갈림길에 서다","지난 8월 5일 국회의원관 제1세미나실에서는 산림청과 학계, 환경단체와 현장 임업인, 그리고 국회의원들이 참석한 가운데 ‘산림경영 논쟁 대토론회’가 개최됐다. 이번 토론회는 최근 잇따른 산림 재난에 대해 과학적인... ",http://www.lak.co.kr/news/boardview.php?id=21030,http://www.lak.co.kr/news/boardview.php?id=21030,"Thu, 21 Aug 2025 16:36:00 +0900"
국회,이상경 국토 차관 &quot;토허구 지정으로 외국인 투기 원천 차단&quot;,현재 국회에서는 외국인의 토지거래허가구역 도입과 상호주의 원칙을 의무화하는 부동산거래신고법 개정안이 다수 발의된 상태다. 이상경 국토교통부 1차관[출처: 국토교통부] ysyoon@yna.co.kr 본 기사는 인포맥스 금융정보... ,https://news.einfomax.co.kr/news/articleView.html?idxno=4370804,https://news.einfomax.co.kr/news/articleView.html?idxno=4370804,"Thu, 21 Aug 2025 16:36:00 +0900"
국회,"김현정 의원, '가치안정형 디지털자산 발행업법' 대표 발의","이어 &quot;주요국들은 이미 스테이블코인 규제 입법을 통해 자국 통화의 디진털 주도권을 확보하고, 금융안정을 꾀하고 있다&quot;면서 &quot;국민의 자산을 보호하고, 디지털 금융강국으로 나아가기 위한 제도적 기반을 국회에서 조속히... ",https://www.kfenews.co.kr/news/articleView.html?idxno=644582,https://www.kfenews.co.kr/news/articleView.html?idxno=644582,"Thu, 21 Aug 2025 16:36:00 +0900"
국회,민주원로 “한미관계 기술·경제 동맹으로 발전...트럼프에 북미대화 권...,"전 국회의장, 이해찬 전 대표, 정동영 통일부 장관 등 원로들이 참석했다. 대통령실에서는 강훈식 비서실장과... “대통령이 국회의 개헌 논의를 잘 지켜보면서 지원했으면 좋겠다”, “국민이 참여하는 개헌 논의가 의미... ",https://www.etnews.com/20250821000323,https://n.news.naver.com/mnews/article/030/0003342755?sid=100,"Thu, 21 Aug 2025 16:36:00 +0900"
국회,외통위 간담회 참석한 빌 게이츠 이사장,빌 게이츠 게이츠재단 이사장이 21일 오후 서울 여의도 국회에서 열린 외교통일위원회 간담회에 참석해 인사말을 하고 있다. 2025.08.21 mironj19@newspim.com,https://www.newspim.com/news/view/20250821000987,https://www.newspim.com/news/view/20250821000987,"Thu, 21 Aug 2025 16:36:00 +0900"
기재위,"구윤철 &quot;PBR 10배&quot; 발언 해명…&quot;PER로 착각, 불찰 송구&quot;",앞서 구 부총리는 지난 19일 기재위 회의에서 &quot;우리 코스피 PBR이 얼마인지 아느냐&quot;는 더불어민주당 이소영 의원의 질의에 &quot;10 정도 안 되느냐&quot;고 답했습니다. 구 부총리의 발언이 전해진 뒤 투자자들 사이에서는... ,http://mbnmoney.mbn.co.kr/news/view?news_no=MM1005646041,http://mbnmoney.mbn.co.kr/news/view?news_no=MM1005646041,"Thu, 21 Aug 2025 16:40:00 +0900"
기재위,‘주식 양도세 대주주’ 결론 못내는 당정… 與 내부선 “소통 더 필요...,정일영 민주당 의원은 지난 19일 기재위 회의에서 “대주주 기준 논란으로 시장 혼란이 크다. 언제 결론을 내릴 것이냐”라고 기재부를 향해 질타했다. 다만 대주주 양도세 기준은 법 개정이 아닌 시행령 사항인 만큼... ,https://biz.chosun.com/policy/politics/assembly/2025/08/21/54O3C7ZAIVEPTIMJJSJI55YMX4/?utm_source=naver&utm_medium=original&utm_campaign=biz,https://n.news.naver.com/mnews/article/366/0001102008?sid=100,"Thu, 21 Aug 2025 16:40:00 +0900"
기재위,‘PBR 10’이라는 경제수장과 ‘유체이탈’ 세법[기자수첩],구 부총리는 21일 기재위에서는 PBR과 PER(주가수익비율)을 착각했다고 해명했다. 20일 기준 코스피의 PER은 14.32배로 15배에 가깝다. 아직 세법은 국회 논의 과정에서 ‘유체이탈’에서 벗어날 기회가 있다. 21일 서울... ,http://www.edaily.co.kr/news/newspath.asp?newsid=04162326642269616,https://n.news.naver.com/mnews/article/018/0006095264?sid=100,"Thu, 21 Aug 2025 16:37:00 +0900"
기재위,"구윤철, 'PBR 10' 논란에 &quot;PER로 순간 착각…제 불찰 송구&quot;","구 부총리는 지난 19일 열린 기재위 전체회의에서 &quot;코스피의 PBR이 얼마인지 아느냐&quot;는 더불어민주당 이소영 의원의 질의에, &quot;10정도 되지 않느냐&quot;고 답한 바 있다. 현재 코스피 PBR은 1.0 수준으로 정도로, 구 부총리의... ",https://news.einfomax.co.kr/news/articleView.html?idxno=4370802,https://news.einfomax.co.kr/news/articleView.html?idxno=4370802,"Thu, 21 Aug 2025 16:32:00 +0900"
기재위,&quot;불찰 송구&quot;…'PBR vs PER' 헷갈린 구윤철,구윤철 경제부총리 겸 기획재정부 장관이 국회 기재위에서 국내 증시의 주가순자산비율(PBR)을 &quot;10 정도&quot;라고... 임이자 기재위원장의 질의에 &quot;제 불찰이기 때문에 송구하게 생각한다'고 밝혔다. 구 부총리는 &quot;변명하는 것... ,http://www.wowtv.co.kr/NewsCenter/News/Read?articleId=A202508210749&t=NN,https://n.news.naver.com/mnews/article/215/0001220877?sid=101,"Thu, 21 Aug 2025 16:26:00 +0900"
기재위,"'檢 개혁' 입 맞춘 李·與, 양도세는 글쎄 … &quot;피해는 일반 투자자&quot; 항의...",구윤철 경제부총리 겸 기획재정부 장관은 지난 19일 국회에서 열린 기재위 전체회의에서 대주주 기준 논란과 관련해 &quot;다양한 의견을 듣고 지금 심사숙고 하고 있다&quot;며 &quot;여러 가지 상황을 보고 판단할 것&quot;이라고 말했다. 주식... ,https://www.newdaily.co.kr/site/data/html/2025/08/21/2025082100337.html,https://www.newdaily.co.kr/site/data/html/2025/08/21/2025082100337.html,"Thu, 21 Aug 2025 16:22:00 +0900"
기재위,[퇴근길 7분 뉴스] SMR·구윤철·씨에스윈드·코레일·SKT,앞서 구 부총리는 19일 기재위 업무보고에서 PBR 수준을 묻는 질문에 &quot;10 정도&quot;라고 대답했으나 실제 1.06 수준과는 큰 차이가 나는 오답이었다. 이 발언은 주식 양도소득세 강화 논란 속 투자자들의 강한 반발을 불러왔다.... ,https://news.dealsitetv.com/articles/158298,https://news.dealsitetv.com/articles/158298,"Thu, 21 Aug 2025 16:18:00 +0900"
기재위,"[전문] 김영진 &quot;정청래, 국힘 새 대표와 악수해야…젤렌스키와 푸틴도 ...",정프로 오늘 날아다니게 두려고 하는데 이제 김영진 위원님이 또 기재위 소속이시고 그 구윤철 부총리의 발언이 나왔던 그 회의 기재위 업무보고 현장에 계셨잖아요. 답변 듣고 진짜 분위기가 약간 싸했을 것 같아요.... ,https://news.jtbc.co.kr/article/NB12259741?influxDiv=NAVER,https://n.news.naver.com/mnews/article/437/0000453658?sid=100,"Thu, 21 Aug 2025 16:17:00 +0900"
기재위,"개미 분노 산 구윤철 부총리 해명 “PBR, PER로 착각”",21일 국회 기획재정위원회 전체회의에서 임이자 기재위원장(국민의힘)은 “코스피 피비알에 대해 (부총리가... 앞서 지난 19일 기재위 전체회의에서 구 부총리는 “소위 ‘피비알’이라고 하죠? 주가순자산비율이... ,https://www.hani.co.kr/arti/economy/economy_general/1214469.html,https://n.news.naver.com/mnews/article/028/0002762330?sid=101,"Thu, 21 Aug 2025 16:08:00 +0900"
기재위,"구윤철, 'PBR 10' 발언에 &quot;PER로 순간 착각해…불찰 송구&quot;",임이자 기재위원장의 질문에 이같이 답했다. 구 부총리는 “변명하는 것 같아 말씀 드리지 않으려 했는데... 앞서 구 부총리는 지난 19일 기재위 업무보고에서 ‘코스피가 3200 정도인데 PBR이라고 하는 주가순자산비율이... ,https://news.tvchosun.com/site/data/html_dir/2025/08/21/2025082190193.html,https://n.news.naver.com/mnews/article/448/0000551231?sid=101,"Thu, 21 Aug 2025 16:03:00 +0900"
기재위,"구윤철, 'PBR 10정도' 발언에 &quot;PER로 순간 착각…불찰 송구&quot;",임이자 기재위원장의 질의에 &quot;변명하는 것 같아 말씀 안 드리려 했는데 기회를 주시니 답변을 드리도록... 앞서 구 부총리는 지난 19일 기재위 회의에서 &quot;우리 코스피 PBR이 얼마인지 아느냐&quot;는 더불어민주당 이소영... ,https://www.cstimes.com/news/articleView.html?idxno=662943,https://www.cstimes.com/news/articleView.html?idxno=662943,"Thu, 21 Aug 2025 15:58:00 +0900"
기재위,"구윤철, 'PBR 10' 발언에 &quot;PER로 순간 착각…불찰 송구&quot;",임이자 기재위원장의 질의에 &quot;변명하는 것 같아 말씀 안 드리려 했는데 기회를 주시니 답변을 드리도록... 앞서 구 부총리는 지난 19일 기재위 회의에서 &quot;우리 코스피 PBR이 얼마인지 아느냐&quot;는 더불어민주당 이소영... ,http://www.m-i.kr/news/articleView.html?idxno=1273226,http://www.m-i.kr/news/articleView.html?idxno=1273226,"Thu, 21 Aug 2025 15:40:00 +0900"
기재위,구윤철 'PBR 10정도' 발언 논란에…&quot;PER로 착각…송구하다&quot;,구 부총리는 오늘(21일) 오후 국회 기획재정위원회 전체회의에서 임이자 기재위원장 질의에 답변하는... 앞서 구 부총리는 지난 19일 기재위 회의에서 &quot;우리 코스피 PBR이 얼마인지 아느냐&quot;는 더불어민주당 이소영... ,http://www.yonhapnewstv.co.kr/AKR20250821153904504,https://n.news.naver.com/mnews/article/422/0000772993?sid=100,"Thu, 21 Aug 2025 15:39:00 +0900"
기재위,"구윤철, ‘코스피 PBR 10’ 논란에… “PER로 순간 착각”",임이자 기재위원장의 질문에 “변명하는 것 같아 말씀 드리지 않으려 했는데 위원장께서 기회를 주셔서... 구 부총리는 지난 19일 기재위 업무보고에서 ‘코스피가 3200 정도인데 PBR이라고 하는 주가순자산비율이... ,https://biz.chosun.com/policy/policy_sub/2025/08/21/ZWJHIGEHMBG3RJDCHIGZZ7NVNI/?utm_source=naver&utm_medium=original&utm_campaign=biz,https://n.news.naver.com/mnews/article/366/0001101984?sid=101,"Thu, 21 Aug 2025 15:39:00 +0900"
기재위,“한국 PBR은 10(코스피 3만)” 구윤철 부총리 “제 불찰…코스피 5천시...,21일 구 부총리는 국회 기획재정위원회 전체회의에서 임이자 기재위원장이 관련 질의를 하자 “변명 같아... 앞서 구 부총리는 지난 19일 기재위 업무보고에서 이소영 더불어민주당 의원의 질의에 “코스피 PBR이 10... ,https://www.mk.co.kr/article/11399397,https://n.news.naver.com/mnews/article/009/0005545270?sid=101,"Thu, 21 Aug 2025 15:26:00 +0900"
기재위,"구윤철 ‘코스피 PBR 10정도’ 발언 논란에 “PER로 순간 착각, 제 불찰...",기재위 전체회의…“코스피5000 시대 열기 위해 최선” 구윤철 부총리 겸 기획재정부 장관은 21일... 구 부총리는 이날 국회 기획재정위원회 전체회의에서 ‘PBR 발언이 오해를 사고 있다’는 임이자 기재위원장의... ,https://www.dt.co.kr/article/12012757?ref=naver,https://n.news.naver.com/mnews/article/029/0002976983?sid=101,"Thu, 21 Aug 2025 15:23:00 +0900"
기재위,"구윤철, 'PBR 10정도' 발언에 &quot;PER로 순간 착각…불찰 송구&quot;",임이자 기재위원장의 질의에 &quot;변명하는 것 같아 말씀 안 드리려 했는데 기회를 주시니 답변을 드리도록... 앞서 구 부총리는 지난 19일 기재위 회의에서 &quot;우리 코스피 PBR이 얼마인지 아느냐&quot;는 더불어민주당 이소영... ,https://www.yna.co.kr/view/AKR20250821115400002?input=1195m,https://n.news.naver.com/mnews/article/001/0015578887?sid=101,"Thu, 21 Aug 2025 15:09:00 +0900"
기재위,기재위 주재하는 임이자 위원장,임이자 국회 기획재정위원회 위원장이 21일 서울 여의도 국회에서 열린 기획재정위원회 전체회의를 주재하고 있다. 2025.08.21. kgb@newsis.com,https://www.newsis.com/view/NISI20250821_0020942079,https://n.news.naver.com/mnews/article/003/0013434799?sid=100,"Thu, 21 Aug 2025 15:02:00 +0900"
기재위,기재위 산회 선포하는 임이자 위원장,임이자 국회 기획재정위원회 위원장이 21일 서울 여의도 국회에서 열린 기획재정위원회 전체회의에서 산회를 선포하고 있다. 2025.08.21. kgb@newsis.com,https://www.newsis.com/view/NISI20250821_0020942078,https://n.news.naver.com/mnews/article/003/0013434802?sid=100,"Thu, 21 Aug 2025 15:02:00 +0900"
기재위,국무위원들과 악수하는 기재위 국민의힘,국회 기획재정위원회 국민의힘 의원들이 21일 서울 여의도 국회에서 열린 기획재정위원회 전체회의에서 산회 후 국무위원들과 악수를 하고 있다. 2025.08.21. kgb@newsis.com,https://www.newsis.com/view/NISI20250821_0020942081,https://n.news.naver.com/mnews/article/003/0013434791?sid=100,"Thu, 21 Aug 2025 15:02:00 +0900"
기재위,국무위원들과 악수하는 기재위 더불어민주당,국회 기획재정위원회 더불어민주당 의원들이 21일 서울 여의도 국회에서 열린 기획재정위원회 전체회의에서 산회 후 구윤철 구윤철 경제부총리 겸 기획재정부 장관 등 국무위원들과 악수를 하고 있다. 2025.... ,https://www.newsis.com/view/NISI20250821_0020942080,https://n.news.naver.com/mnews/article/003/0013434795?sid=100,"Thu, 21 Aug 2025 15:02:00 +0900"
기재위,"임이자 &quot;기재위, 특정 정당 독주 허용 않을 것&quot;",21일 오후 서울 여의도 국회에서 열린 기획재정위원회 제428회국회(임시회) 제3차 전체회의에서 임이자 위원장이 발언하고 있다. 2025.8.21/뉴스1,https://www.news1.kr/photos/7454733,https://n.news.naver.com/mnews/article/421/0008440450?sid=100,"Thu, 21 Aug 2025 14:57:00 +0900"
기재위,"기재위, 2024회계연도 결산 의결",21일 오후 서울 여의도 국회에서 열린 기획재정위원회 제428회국회(임시회) 제3차 전체회의에서 임이자 위원장이 의사봉을 두드리고 있다. 2025.8.21/뉴스1,https://www.news1.kr/photos/7454723,https://n.news.naver.com/mnews/article/421/0008440418?sid=100,"Thu, 21 Aug 2025 14:47:00 +0900"
기재위,"구윤철 “‘PBR 10’ 발언, PER와 순간 착각…불찰에 송구”",임이자 기재위원장의 질문에 이같이 답했다. 구 부총리는 “변명하는 것 같아 말씀 드리지 않으려 했는데... 앞서 구 부총리는 지난 19일 기재위 업무보고에서 ‘코스피가 3200 정도인데 PBR이라고 하는 주가순자산비율이... ,http://www.edaily.co.kr/news/newspath.asp?newsid=03768726642269616,https://n.news.naver.com/mnews/article/018/0006095150?sid=101,"Thu, 21 Aug 2025 14:28:00 +0900"
기재위,가시화 된 스테이블코인 주도권 경쟁,"국회 기획재정위원회 소속 안도걸 더불어민주당 의원은 지난 19일 기재위 전체회의에서 &quot;한은이 스테이블코인 도입 취지에 공감하면서도 통화정책과 금융 불안, 외환 규제 약화 등을 과도하게 우려하고 있다&quot;라며 &quot;원화... ",http://www.smedaily.co.kr/news/articleView.html?idxno=335366,http://www.smedaily.co.kr/news/articleView.html?idxno=335366,"Thu, 21 Aug 2025 12:40:00 +0900"
기재위,"서일준 의원, &quot;거제-통영 고속도로 예타 통과, 지역 숙원 해결&quot;","이에 서 의원은 초선 의원 시절부터 국회 국토위, 기재위, 예결위 활동을 통해 인구 20만 이상 도시 중 유일하게 거제시만이 고속도로, 철도, 공항 등 3대 SOC가 전무하다는 점을 지속적으로 강조하면서 고속도로 연장의... ",http://www.enewstoday.co.kr/news/articleView.html?idxno=2318423,http://www.enewstoday.co.kr/news/articleView.html?idxno=2318423,"Thu, 21 Aug 2025 12:30:00 +0900"
기재위,"[뉴공 아카이브]박시동 경제평론가, 이광수 명지대 겸임교수· 광수네복...","안 할 수는 있는데 이해도가 낮은 것 같아요.▷박시동 : 그러니까 이 정책을 총괄하고 있는 경제 수장이, 아, 이 정도 인식 수준밖에 안 됐구나, 라고 하니까 시장에서 대단히 실망한 건데▶김어준 : 기재위 전체 회의, 이거... ",http://www.ddanzi.com/856444052,http://www.ddanzi.com/856444052,"Thu, 21 Aug 2025 11:50:00 +0900"
기재위,"국힘 기재위원장 “대통령-공공기관장 임기일치법, 동의 불가…상정 반...",개정안의 기재위 상정 등에 반대하겠다고 21일 밝혔다. 21일 박성훈 국민의힘 수석대변인은 이날 의원총회를 마친 뒤 기자들과 만나 “(기재위원장인)임이자 의원이 ‘대통령-공공기관장 임기 일치시키는 법에 대해 절대... ,http://www.edaily.co.kr/news/newspath.asp?newsid=03316086642269616,https://n.news.naver.com/mnews/article/018/0006095010?sid=100,"Thu, 21 Aug 2025 11:27:00 +0900"
기재위,[오늘의 주요 경제 일정] 경제(8월21일목요일),"1차관, 기재위 예결소위(국회) ▲14:00 구윤철 경제부총리 겸 기획재정부 장관, 기재위 전체회의(국회) ▲14:00 이형일 기획재정부 1차관,기재위 전체회의(국회) ▲14:00 임기근 기획재정부 2차관, 기재위 전체회의... ",http://www.econonews.co.kr/news/articleView.html?idxno=401281,http://www.econonews.co.kr/news/articleView.html?idxno=401281,"Thu, 21 Aug 2025 11:08:00 +0900"
기재위,[오늘의 주요 정치 일정] 정치(8월21일 목요일),14:00 기재위 전체회의 / 기재위 전체회의실(국회 본관 430호) 24:00 JTBC &lt;논/쟁&gt; 출연 ◇진보당【상임대표】 통상일정 【원내대표】 09:00 국토위 전체회의 / 국토위 회의실 10:00 국회본회의 / 본회의장 11:00 트럼프... ,http://www.econonews.co.kr/news/articleView.html?idxno=401273,http://www.econonews.co.kr/news/articleView.html?idxno=401273,"Thu, 21 Aug 2025 11:00:00 +0900"
기재위,"與, 경제형벌 TF 출범…'기관장 임기 제한' 법 강행처리 시사","현재 기재위에 회부된 공공기관운영법 개정안은 공기업, 준정부기관 기관장, 감사의 임기를 대통령 임기와 일치하도록 하는 내용이 골자입니다. 또, 새 정부 출범 후 약 6개월 이내에 직무 수행 능력 평가를 실시해 해임할... ",https://biz.sbs.co.kr/article_hub/20000254546?division=NAVER,https://n.news.naver.com/mnews/article/374/0000458730?sid=101,"Thu, 21 Aug 2025 10:53:00 +0900"
기재위,조승래 의원 &quot;노은도매시장 시설 현대화사업 예타 대상 선정&quot;,국회 기재위 위원으로 기재부와 소통하며 필요성 설득 조 의원 총선 공약인 '노은농수산물도매시장 시설현대화' 청신호 조 의원 &quot;예타 통과를 위해 대전시 및 기재부와 계속 협력할 것&quot; [천지일보 대전=김지현 기자]... ,https://www.newscj.com/news/articleView.html?idxno=3308107,https://www.newscj.com/news/articleView.html?idxno=3308107,"Thu, 21 Aug 2025 10:32:00 +0900"
기재위,양향자 &quot;李 체코 원전 진상조사? 전임 정부 깎아내리려 매국노 짓 하나...,◇양향자: 제가 21대 국회에서 기재위에서 가장 치열하게 다퉜던 이슈입니다. 그리고 이제 저는 민주당... 그래서 이제 어떻게 하면 좋겠냐면 그때도 제가 기재위 때 그렇게 만들어 놓은 건데 우선은 당장은 50억을 유지할... ,https://radio.ytn.co.kr/program/?f=2&id=104483&s_mcd=0214&s_hcd=01,https://radio.ytn.co.kr/program/?f=2&id=104483&s_mcd=0214&s_hcd=01,"Thu, 21 Aug 2025 10:00:00 +0900"
기재위,[오늘의 채권ㆍ외환 메모] (08월21일),86달러) [주요일정] ◇기획재정부 ▲14:00 부총리 1차관 2차관 기재위 전체회의(국회) ▲10:00 1차관 기재위 예결소위(국회) ※불공정무역 대응 강화를 위한 반덤핑팀 신설(10:00) ※2025년 상반기... ,https://news.einfomax.co.kr/news/articleView.html?idxno=4370698,https://news.einfomax.co.kr/news/articleView.html?idxno=4370698,"Thu, 21 Aug 2025 09:30:00 +0900"
기재위,김병기 &quot;경제형벌 민사책임합리화 TF 출범...배임죄 등 정비할 것&quot;,"현재 기재위에 회부된 공공기관운영법 개정안은 공기업, 준정부기관 기관장, 감사의 임기를 대통령 임기와 일치하도록 하는 내용이 골자다. 또 새 정부 출범 후 약 6개월 이내에 직무 수행 능력 평가를 실시해 해임할 수... ",http://news.mt.co.kr/mtview.php?no=2025082108534962130,https://n.news.naver.com/mnews/article/008/0005238850?sid=100,"Thu, 21 Aug 2025 09:27:00 +0900"
기재위,“엄밀히 말해 ‘불평등 협상’…세부 항목서 얻을 것 더 얻어내야”,임 위원장은 8월 6일 국회 기재위 전체회의에서 구윤철 경제부총리 겸 기획재정부 장관을 향해 “대미 투자... 기재위원장으로서 이번 협상에 대해 어떻게 평가하는가. “경제부총리는 ‘소나기를 피했다’고 하고... ,https://shindonga.donga.com/3/all/13/5796385/1,https://n.news.naver.com/mnews/article/262/0000018709?sid=101,"Thu, 21 Aug 2025 09:02:00 +0900"
기재위,"[기획] 이재명 정부, '코스피 5000' 공약 물 건너가나",그러나 구윤철 경제부총리 겸 기재부 장관은 지난 19일 국회 기재위 전체회의에서 &quot;다양한 의견을 듣고... 구 부총리가 지난 19일 국회 기재위 전체회의에서 코스피 주가순자산비율(PBR)을 &quot;10 정도 안 되느냐&quot;라고 답한... ,http://www.sisafocus.co.kr/news/articleView.html?idxno=345188,http://www.sisafocus.co.kr/news/articleView.html?idxno=345188,"Thu, 21 Aug 2025 08:38:00 +0900"
기재위,양향자 &quot;李 체코 원전 진상조사? 전임 정부 깎아내리려 매국노 짓 하나...,◇양향자: 제가 21대 국회에서 기재위에서 가장 치열하게 다퉜던 이슈입니다. 그리고 이제 저는 민주당... 그래서 이제 어떻게 하면 좋겠냐면 그때도 제가 기재위 때 그렇게 만들어 놓은 건데 우선은 당장은 50억을 유지할... ,https://www.ytn.co.kr/_ln/0101_202508210834474438,https://n.news.naver.com/mnews/article/052/0002235758?sid=100,"Thu, 21 Aug 2025 08:34:00 +0900"
기재위,[2025년 8월 21일 총리·장차관 주요일정]구윤철 부총리 겸 기획재정부 ...,▲ 구윤철 부총리 겸 기획재정부 장관 14:00 기재위 전체회의(국회) ▲ 이형일 1차관 10:00 기재위 예결소위(국회) 14:00 기재위 전체회의(국회) ▲ 임기근 2차관 14:00 기재위 전체회의(국회) [과기정통부] ▲ 배경훈... ,https://www.mediapen.com/news/view/1037483,https://www.mediapen.com/news/view/1037483,"Thu, 21 Aug 2025 08:30:00 +0900"
기재위,[2025년 8월 21일 정치·외교안보·사회 주요일정]정청래 더불어민주당...,"원내대표, 기재위 전체회의(14:00 본관 430호) 천하람 원내대표, JTBC &lt;논/쟁&gt; 출연(24:00) ▲ 조국혁신당 김선민 당대표 권한대행·서왕진 원내대표, 최고위원회의(09:30 국회 본관 당회의실) 김선민 당대표 권한대행... ",https://www.mediapen.com/news/view/1037487,https://www.mediapen.com/news/view/1037487,"Thu, 21 Aug 2025 08:30:00 +0900"
기재위,"[2025년 8월 21일 경제·산업 주요일정] 권대영 금융위 부위원장, 석유화...","▲ 금융위·권대영 부위원장, 정무위 전체회의(10:00 국회) ▲ 권대영 금융위 부위원장, 석유화학 경쟁력 제고를 위한 금융권 간담회(08:30 은행연합회) ▲ 기재부, 기재위 예결소위(10:00 국회) ▲ 기재부, 기재위... ",https://www.mediapen.com/news/view/1037488,https://www.mediapen.com/news/view/1037488,"Thu, 21 Aug 2025 08:30:00 +0900"
기재위,[오늘의 투자전략] 잭슨홀 경계 심리 확산…코스피 3000선은 수성할 듯,"전날 기재위 질의 과정에서 경제부총리의 답변에 실망감이 나타났고, 기재부의 국회 보고자료에 양도세 대주주 기준 논의가 빠졌다는 소식에 시장이 반등한 점은 정책 불확실성이 여전히 시장을 짓누르고 있음을... ",https://www.etoday.co.kr/news/view/2498737,https://www.etoday.co.kr/news/view/2498737,"Thu, 21 Aug 2025 08:16:00 +0900"
기재위,[임광현 인청-3]'프리랜서 해촉증명서' 아시나요?,다음은 국회 기획재정위원회(기재위)가 임광현 후보자를 대상으로 진행한 인사청문회 가운데 프리랜서 조세 제도 관련 차규근 의원의 질의와 답변. 차규근 의원(혁신) = 후보자가 되신 걸 먼저 축하드립니다. 임광현... ,https://www.dailybrief.co.kr/news/articleView.html?idxno=2989,https://www.dailybrief.co.kr/news/articleView.html?idxno=2989,"Thu, 21 Aug 2025 07:51:00 +0900"
기재위,"[N2 모닝 경제 브리핑-8월 21일] 美 증시, 잭슨홀 미팅 관망 속 혼조…기...","2차관 기재위 전체회의(국회, 14시) - 1차관 기재위 예결소위(국회, 10시) - 2025년 상반기 지역별고용조사 시군구 주요고용지표(12시) - 2025.8월 국고채 '모집 방식 비경쟁인수' 발행 여부 및 발행계획(17시)... ",https://www.news2day.co.kr/article/20250820500243,https://www.news2day.co.kr/article/20250820500243,"Thu, 21 Aug 2025 07:16:00 +0900"
