Keyword,Title,Description,Original Link,Link,Publication Date
이재명,의정갈등 나비효과?...3년 만에 오르는 건강보험료,"또, 이재명 대통령이 요양병원 간병비 건보 편입과 임플란트 확대 적용 등을 약속했던 만큼 앞으로 들어갈 예산은 더욱 늘 수밖에 없어 보입니다. YTN 권민석입니다.",https://science.ytn.co.kr/program/view.php?mcd=0082&hcd=&key=202509011233368278,https://science.ytn.co.kr/program/view.php?mcd=0082&hcd=&key=202509011233368278,"Mon, 01 Sep 2025 13:22:00 +0900"
이재명,이대통령 지지율 2주 연속 상승세… 대구·경북서 '껑충',"이재명 대통령의 국정 수행 지지율이 2주 연속 상승해 50%대 초반을 유지했다는 여론조사 결과가 1일 나왔다. 리얼미터 여론조사(에너지경제 의뢰, 8월25~29일 전국 만18세 이상 유권자 2537명 대상, 무선... ",http://www.shinailbo.co.kr/news/articleView.html?idxno=2108601,http://www.shinailbo.co.kr/news/articleView.html?idxno=2108601,"Mon, 01 Sep 2025 13:20:00 +0900"
이재명,"장동혁, 김민석 총리 만나 &quot;아직 여야 손 잡기에 거리가 너무 멀다&quot;",김민석 국무총리는 이재명 대통령과 여야 지도부 함께 만나 한미정상회담 결과를 공유하는 등 자리가 만들어졌으면 좋겠다고 장 대표에게 말했다. 김 총리는 &quot;알다시피 이 대통령은 취임 이후부터 야당 지도자들과 다양한... ,http://www.metroseoul.co.kr/article/20250901500280,http://www.metroseoul.co.kr/article/20250901500280,"Mon, 01 Sep 2025 13:20:00 +0900"
이재명,‘한복 vs 상복’…이재명 정부 첫 정기국회부터 여야 격돌,"이재명 정부 들어 첫 정기 국회가 1일 개막한다. 올해보다 대폭 늘어난 728조원대 내년 예산안을 심사할 예정이어서 여야간 치열한 공방이 예상된다. 또 검찰 개혁안, 기후환경에너지부 신설 등이 포함된 정부조직법... ",https://www.ekn.kr/web/view.php?key=20250901028452393,https://www.ekn.kr/web/view.php?key=20250901028452393,"Mon, 01 Sep 2025 13:20:00 +0900"
이재명,"1년 7개월만에 전공의 근무 시작…'교수 비판' 박단, 복귀 실패",윤석열 전 대통령의 탄핵으로 이재명 대통령이 당선되면서 박 전 위원장을 위시한 강경 투쟁은 더 이상 전공의들의 지지를 받지 못했다. 해결책 제시 없이 투쟁만 장기화되는 원인이 됐다는 비판을 받았다. 정부와 대화로... ,https://www.dongascience.com/news/view/73758,https://n.news.naver.com/mnews/article/584/0000034169?sid=103,"Mon, 01 Sep 2025 13:20:00 +0900"
이재명,[생생뉴스] 휴가 중 보이스피싱범 검거·미스터폴리스 1위 ‘대전경찰’...,◇ 박지은: 이재명 대통령께서 미국에서 돌아와서 사회관계망에 (이진웅 경사)사진과 실명을 언급하셨더라고요. 저희도 보도 이후에 반응이 뜨겁구나! 알게 됐는데요. 보이스피싱범 검거 당시 형사의 촉이라고 할까요? 쓱... ,https://news.kbs.co.kr/news/pc/view/view.do?ncd=8345362&ref=A,https://n.news.naver.com/mnews/article/056/0012020054?sid=102,"Mon, 01 Sep 2025 13:19:00 +0900"
국회,"당정, 경제부처 조직개편안 &quot;9월 본회의 처리 목표&quot;","국회 정무위원회 간사인 강준현 민주당 의원은 이날 당정협의회 직후 기자들과 만나 기재부와 금융위원회, 금융감독원 등의 조직 개편안 마련을 &quot;(오는 25일 본회의 일정) 계획에 맞춰서 해보려고 노력하겠다&quot;고 말했다. 강... ",http://www.fnnews.com/news/202509011259118484,https://n.news.naver.com/mnews/article/014/0005399630?sid=100,"Mon, 01 Sep 2025 13:45:00 +0900"
국회,"&quot;하루에 변호인 접견 39회 가능한가&quot;…與법사위, 尹구치소 CCTV 열람",국회 법제사법위원회 소속 민주당 의원들과 민주당 3대특검 종합대응특위 위원들은 이날 오전부터 서울구치소를 찾아 윤 전 대통령이 수감 중 특혜를 제공받았는지 여부를 확인 중이다. 특히 윤 전 대통령이 지난달... ,https://magazine.hankyung.com/business/article/202509014668b,https://n.news.naver.com/mnews/article/050/0000095652?sid=101,"Mon, 01 Sep 2025 13:45:00 +0900"
국회,"「M포토」 김민석, 장동혁 국민의힘 대표 예방",김민석 국무총리가 1일 국회를 찾아 장동혁 국민의힘 대표를 예방해 이야기 나누고 있다. 사진=최동환 기자 김민석 국무총리가 1일 국회를 찾아 장동혁 국민의힘 대표를 예방해 기념사진 촬영하고 있다. 사진=최동환 기자,https://www.m-economynews.com/news/article.html?no=59292,https://www.m-economynews.com/news/article.html?no=59292,"Mon, 01 Sep 2025 13:44:00 +0900"
국회,"김민석 “李 대통령, 야당 만나려 노력” 장동혁 “여야 거리 너무 멀어...","이에 대해 장 대표는 “오늘 정기국회 개원식이 있지만, 여야가 손을 잡기에는 거리가 너무 먼 것 같다”고... 특히나 국회 정기국회가 있는 날이라 특히나 마음이 무겁다”라면서 “총리께서 오셨으니 여야 협치에 총리도... ",https://www.etoday.co.kr/news/view/2501960,https://www.etoday.co.kr/news/view/2501960,"Mon, 01 Sep 2025 13:44:00 +0900"
국회,"與의원들·한국노총 &quot;석탄발전폐지 지원법, 연내 입법돼야&quot;","더불어민주당 김원이·김주영·박해철·박홍배 의원과 한국노총 등이 1일 국회 소통관에서 기자회견을 열고... 대한 국회 논의가 진척되고 있지 않은 가운데, 여당 의원들과 노동조합이 1일 조속한 법 제정을 촉구했다.... ",http://www.edaily.co.kr/news/newspath.asp?newsid=03201286642295856,https://n.news.naver.com/mnews/article/018/0006104206?sid=100,"Mon, 01 Sep 2025 13:44:00 +0900"
국회,"장동혁 &quot;여당, 협치 말하면서 정쟁 몰두…국정 파트너로 존중하라&quot;",김민석 국무총리와 국민의힘 장동혁 대표(오른쪽)가 1일 서울 여의도 국회에서 만나 악수하고 있다.  사진=연합뉴스 장동혁 국민의힘 대표는 1일 국회를 예방한 김민석 국무총리와의 회동 자리에서 &quot;여당이 협치를... ,https://www.fntoday.co.kr/news/articleView.html?idxno=362065,https://www.fntoday.co.kr/news/articleView.html?idxno=362065,"Mon, 01 Sep 2025 13:44:00 +0900"
국회,발언하는 김병기 원내대표,김병기 더불어민주당 원내대표가 1일 서울 여의도 국회에서 열린 최고위원회의에서 발언하고 있다./사진=이용우 기자,https://www.gukjenews.com/news/articleView.html?idxno=3364275,https://www.gukjenews.com/news/articleView.html?idxno=3364275,"Mon, 01 Sep 2025 13:44:00 +0900"
국회,"전쟁터 같았던 백악관 한미 정상회담 현장, 최선을 다했던 한국 기자들","현장 질의응답 분위기는 한국의 대통령실이나 국회는 물론, 이전 한미 정상회담 공동기자회견과도 달랐다. 지난 정부에서 2022년 5월21일 용산 대통령실, 2023년 4월27일 미국 백악관에서 한미정상 공동기자회견이 있었는데... ",https://www.mediatoday.co.kr/news/articleView.html?idxno=328493,https://n.news.naver.com/mnews/article/006/0000131582?sid=100,"Mon, 01 Sep 2025 13:44:00 +0900"
국회,"정청래, 김건희 입장문 발표에 “어쭙잖은 신파극 연기”",정청래 대표는 이날 국회 본관에서 열린 최고위원회의에서 “국민께 진짜 송구한가. 어떠한 변명도 하지 않았나”라며 김건희를 향해 따져 물었다. 정 대표는 “특검 검사들께 진짜 감사하고 고맙나. 그런데 왜 진술은... ,https://www.m-economynews.com/news/article.html?no=59295,https://www.m-economynews.com/news/article.html?no=59295,"Mon, 01 Sep 2025 13:44:00 +0900"
국회,제천국제음악영화제의 시기 변경과 장소 이전은 &quot;개혁&quot;,앞서 엄태영(국민의힘·제천단양) 국회의원은 지난달 11일 시와의 정책 간담회에서 &quot;아스팔트 광장에서... 제천 / 이형수기자 제천시가 마련한 지역 국회의원 초청 정책 간담회에서 엄태영 국회의원이 발언하고 있다.,https://www.inews365.com/news/article.html?no=883352,https://www.inews365.com/news/article.html?no=883352,"Mon, 01 Sep 2025 13:44:00 +0900"
국회,"장동혁 &quot;민주당, 野공격에만 집중&quot;…김민석 &quot;李대통령 조속히 만나야&quot;",장 대표는 이날 국회에서 김 총리를 접견하면서 &quot;민주당은 미래로 나아가자고 하면서도 과거 일에 집착해 야당을 공격하는 데 집중하고 있다&quot;며 &quot;야당 역시 여당에 협치의 손을 내밀지 못하는 상황이 안타깝다&quot;고 말했다.... ,https://www.newsworks.co.kr/news/articleView.html?idxno=809379,https://www.newsworks.co.kr/news/articleView.html?idxno=809379,"Mon, 01 Sep 2025 13:44:00 +0900"
국회,김영훈 노동부 장관 &quot;노란봉투법 우려 크지 않아… 산재 감축에 직 걸겠...,김 장관은 모두발언에서 지난달 24일 국회를 통과한 노동조합법 2·3조(노란봉투법)를 언급하며 &quot;노사가 대립을 넘어 상생의 길로 나아가는 첫걸음&quot;이라면서도 &quot;법 하나로 노동시장 격차를 해결할 수는 없다. 노사정이... ,http://www.metroseoul.co.kr/article/20250901500318,http://www.metroseoul.co.kr/article/20250901500318,"Mon, 01 Sep 2025 13:44:00 +0900"
국회,"노동장관, 산재사망자 OECD평균으로 줄이는데 &quot;직 걸겠다&quot;(종합)",아울러 김 장관은 지난달 국회를 통과한 노조법 2·3조 개정안(노란봉투법)이 &quot;상생을 위한 첫걸음&quot;이라며 &quot;이를 토대로 다양한 상생 교섭 촉진 방안을 구상하고 있다&quot;고 밝혔다. 그는 &quot;시행까지 남은 6개월간 양대 노총의... ,https://www.yna.co.kr/view/AKR20250901072651530?input=1195m,https://n.news.naver.com/mnews/article/001/0015597835?sid=102,"Mon, 01 Sep 2025 13:43:00 +0900"
국회,"당정, 금융위 '조직개편' 논의…&quot;25일 본회의 처리 노력&quot;","국회 정무위원회 소속 더불어민주당 의원들은 1일 정부, 대통령실과 금융위원회 해체 등을 골자로 한... 강 의원은 이번 정기국회 안에 경제부처 조직 개편안이 통과할 수 있냐는 질문에는 &quot;계획에 맞춰 해보려고 노력하는... ",https://biz.sbs.co.kr/article_hub/20000256583?division=NAVER,https://n.news.naver.com/mnews/article/374/0000460537?sid=101,"Mon, 01 Sep 2025 13:42:00 +0900"
국회,최고위 참석하는 정청래 대표,정청래 더불어민주당 대표가 1일 서울 여의도 국회에서 열린 최고위원회의에 참석하고 있다./사진=이용우 기자,https://www.gukjenews.com/news/articleView.html?idxno=3364273,https://www.gukjenews.com/news/articleView.html?idxno=3364273,"Mon, 01 Sep 2025 13:42:00 +0900"
국회,"[YTN 실시간뉴스] &quot;속옷차림 성경 읽으며 거부&quot;...윤 측, 반발","■막 오른 정기국회…한복 vs 상복 '기싸움' ■김정은 오늘 중국행…보란 듯 무기 시찰 ■&quot;속옷차림 성경 읽으며 거부&quot;…윤 측, 반발 ■'금거북이 매관매직' 이배용 사의 표명",https://www.ytn.co.kr/_ln/0103_202509011342276646,https://n.news.naver.com/mnews/article/052/0002240698?sid=102,"Mon, 01 Sep 2025 13:42:00 +0900"
국회,"‘7248억원’...특허청, 내년 예산안 편성",사장되지 않도록 기술 문제 해결과 제품 개발을 지원하는 IP기반 기술사업화 전략지원 사업을 신설한다.특허청 내년 예산안과 기금운용계획안은 국회 제출 후 상임위예결위 심의와 본회의 의결을 거쳐 12월 확정될 예정이다.,http://www.boannews.com/media/view.asp?idx=139007&kind=1,http://www.boannews.com/media/view.asp?idx=139007&kind=1,"Mon, 01 Sep 2025 13:42:00 +0900"
국회,"[지자체 이슈] 남양주시, '제19회 남양주시장기 배드민턴대회' 생활체육...","개회식에는 주광덕 시장을 비롯해 지역 국회의원과 도의원, 이정애 시의회 부의장, 윤성현 남양주시체육회장, 박병삼 남양주시배드민턴협회장 등 주요 인사가 참석해 선수들을 격려하고, 지역 체육 발전에 대한 지속적인... ",http://www.queen.co.kr/news/articleView.html?idxno=441312,http://www.queen.co.kr/news/articleView.html?idxno=441312,"Mon, 01 Sep 2025 13:42:00 +0900"
국회,박은정 '검찰 보완수사권ㆍ전건송치' 일축…&quot;검찰청 폐지 검찰개혁&quot;,"검사 출신 박은정 조국혁신당 국회의원은 &quot;검찰개혁은 더 이상 미룰 수 없는 시대적 과제다. 지금 필요한... 박홍근ㆍ박은정ㆍ황운하 국회의원과 촛불행동, 검사를 검사하는 변호사모임, 민생경제연구소는 지난 8월 29일... ",http://www.lawleader.co.kr/news/articleView.html?idxno=16898,http://www.lawleader.co.kr/news/articleView.html?idxno=16898,"Mon, 01 Sep 2025 13:42:00 +0900"
국회,"경찰, 檢 보완수사권 폐지 찬성…“경찰 수사에 ‘10중 통제’ 작동”","박 본부장은 “국회, 국민권익위원회, 언론이나 변호인에 의한 수사 견제·감시 등 외부 통제장치도 계속해서 작동 중”이라며 “추후 개헌 논의가 이뤄질 때 영장청구권 (검찰 독점 상황도) 개선도 필요하다고 보고드린 게... ",https://www.hankyung.com/article/202509014648i,https://n.news.naver.com/mnews/article/015/0005178275?sid=102,"Mon, 01 Sep 2025 13:41:00 +0900"
국회,"인천교육감, &quot;특수교사 사망 책임 통감… 같은 아픔 반복 않겠다&quot; 약속","인천시교육청은 순직 인정을 위해 교육감 의견서와 직원 탄원서를 제출했으며, 교육부·인사혁신처·국회 등 관계기관을 직접 찾아 강력히 요청하고 있다. 또 진상조사위원회 조사와 감사원 공익감사 결과를 종합해 책임... ",https://www.newscj.com/news/articleView.html?idxno=3312229,https://www.newscj.com/news/articleView.html?idxno=3312229,"Mon, 01 Sep 2025 13:40:00 +0900"
국회,"장기 미추진 지방 재개발, 주민 70% 동의로 조합설립인가 추진",조국혁신당 황운하 의원은 지난달 27일 이 같은 내용을 담은 '도시 및 주거환경정비법 일부개정법률안'을 국회에 제출했다고 밝혔다. 이번 개정안의 핵심은 수도권 외 지역에 한해 정비구역 지정 후 3년 이상 조합설립이... ,http://www.arunews.com/news/articleView.html?idxno=50371,http://www.arunews.com/news/articleView.html?idxno=50371,"Mon, 01 Sep 2025 13:40:00 +0900"
국회,"&quot;딥페이크 범죄 증가, 'AI 규제 유예' 신중해야&quot;…인권위, 국회에 입장 ...",22일 국회의장에게 신중히 검토해달라는 의견을 표명했다고 1일 밝혔다. 인공지능기본법 제31조~35조는... 현재 국회에는 이 조항들이 인공지능 기술의 발전을 저해하고 기업 혁신을 위축시킬 수 있다는 이유로 적용을... ,https://news.tvchosun.com/site/data/html_dir/2025/09/01/2025090190132.html,https://n.news.naver.com/mnews/article/448/0000553681?sid=102,"Mon, 01 Sep 2025 13:40:00 +0900"
국회,충남 '국비 12조 시대' 눈앞…도 핵심사업 다수 반영,"1일 도에 따르면 오는 3일 국회에 제출되는 내년도 정부 예산안에는 충남 현안 사업 국비 총 11조 9297억 원이 담겼다. 이는 올해 도 정부 예산안 10조 7798억 원보다 1조 1499억 원(10.6%) 많고, 국회에서 확정한 최종액 10조... ",https://www.news1.kr/local/daejeon-chungnam/5897231,https://n.news.naver.com/mnews/article/421/0008458869?sid=102,"Mon, 01 Sep 2025 13:40:00 +0900"
국회,"힘쎈충남, ‘국비 12조 시대’ 눈앞","충남도는 오는 3일 국회에 제출되는 내년도 정부예산안에는 충남 현안 사업 국비 총 11조 9297억 원이 담겼다고 1일 밝혔다. 이는 올해 정부예산안 10조 7798억 원보다 1조 1499억 원(10.6%) 많고, 국회에서 확정한 최종액 10조... ",https://www.sedaily.com/NewsView/2GXQFHCIYQ,https://n.news.naver.com/mnews/article/011/0004527574?sid=102,"Mon, 01 Sep 2025 13:40:00 +0900"
국회,인사 나누는 장동혁-김민석,장동혁(오른쪽) 국민의힘 대표가 1일 오전 서울 여의도 국회에서 예방 온 김민석 국무총리와 악수를 하고 있다./사진=이용우 기자,https://www.gukjenews.com/news/articleView.html?idxno=3364270,https://www.gukjenews.com/news/articleView.html?idxno=3364270,"Mon, 01 Sep 2025 13:40:00 +0900"
국회,"장동혁, 김민석 만나 협치 의지… &quot;손 잡기에 거리 멀어&quot;","장동혁 국민의힘 대표는 이날 국회에서 김민석 국무총리와 접견하고 대통령과 여야지도부 회동을 포함해 민생 현안, 여야 협치 관련 의견을 주고 받았다. 장 대표는 &quot;산적한 민생 문제, 여러 어려운 문제가 있는데 국회가... ",http://www.shinailbo.co.kr/news/articleView.html?idxno=2108628,http://www.shinailbo.co.kr/news/articleView.html?idxno=2108628,"Mon, 01 Sep 2025 13:40:00 +0900"
국회,악수하는 장동혁-김민석,장동혁(오른쪽) 국민의힘 대표가 1일 오전 서울 여의도 국회에서 예방 온 김민석 국무총리와 악수를 하고 있다./사진=이용우 기자,https://www.gukjenews.com/news/articleView.html?idxno=3364266,https://www.gukjenews.com/news/articleView.html?idxno=3364266,"Mon, 01 Sep 2025 13:40:00 +0900"
국회,"&quot;도정 정책-이재명 정부 기조 부합, 시너지 효과&quot;",그러면서 오 지사는 &quot;2026년도 국비 확보를 위해 마지막까지 부처와 국회를 설득하는 노력을 이어가야 한다&quot;며 &quot;서로 협력하고 연대한다면 어떤 어려움도 극복할 수 있다&quot;고 당부.,http://www.samdailbo.com/news/articleView.html?idxno=251575,http://www.samdailbo.com/news/articleView.html?idxno=251575,"Mon, 01 Sep 2025 13:40:00 +0900"
국회,김진태 &quot;국비 10조시대 개막...정부 건의 3대 핵심사업 모두 반영&quot;,지역구 국회의원들께 깊이 감사드린다&quot;며 &quot;도비와 시군비를 매칭해 사업이 차질없이 추진되도록 최선을 다하겠다&quot;고 말했다. 김 지사는 &quot;내일 국회예산안이 제출되면 지역구 국회의원과 긴밀하게 협력해 확보된... ,https://www.ajunews.com/view/20250901124505658,https://www.ajunews.com/view/20250901124505658,"Mon, 01 Sep 2025 13:40:00 +0900"
국회,"김태흠 충남지사 &quot;환경부 장관, 지천댐 백지화 시도 의심&quot;",특히 김성환 환경부장관을 향해서는 화력발전소폐지지원특별법이 김 장관의 반대로 제21대 국회를 통과하지... 김 지사는 &quot;김 장관의 반대로 제21대 국회에서 석탄화력발전폐지지원특별법이 통과되지 못한 것&quot;이라며... ,https://www.cctoday.co.kr/news/articleView.html?idxno=2218075,https://www.cctoday.co.kr/news/articleView.html?idxno=2218075,"Mon, 01 Sep 2025 13:40:00 +0900"
국회,"'중2병'이라는 말, 쓰지 말아야 하는 이유 아시나요?","교사 외에도 대학생, 학부모, 국회의원 등 다양한 회원이 있다. 2024년 기획실 내에 문해력팀, 통합교육팀을... 통합교육 운영에 대한 바람직한 사례를 모으고 국회나 교육부에 제안하려고 한다. 학교에서의 진정한... ",https://www.ohmynews.com/NWS_Web/View/at_pg.aspx?CNTN_CD=A0003160810&CMPT_CD=P0010&utm_source=naver&utm_medium=newsearch&utm_campaign=naver_news,https://n.news.naver.com/mnews/article/047/0002486477?sid=103,"Mon, 01 Sep 2025 13:39:00 +0900"
국회,"여가차관, &quot;정의연 국가보조금 계속?&quot; 질문에 &quot;부조리한 면 있으면 시정...",신 차관은 1일 오전 서울 여의도 국회에서 열린 여성가족위원회 전체회의에 참석했다. 이날 신 차관은... 또 교제폭력 관련 법제도 마련에 여가부가 어떤 준비를 하고 있느냐는 질문엔 &quot;국회에 관련 개정안이 발의가 많이... ,https://www.newsis.com/view/NISX20250901_0003310710,https://n.news.naver.com/mnews/article/003/0013453511?sid=102,"Mon, 01 Sep 2025 13:39:00 +0900"
국회,"국가수사본부장 &quot;검찰개혁, 경찰 비대화와 관련 없어…경찰 수사엔 '10중...","최근 국회에서 추진하는 검찰 개혁으로 경찰의 수사권이 비대화할 것이란 우려가 나오는 가운데 박성주... 있고 국회와 국가인권위원회, 언론 등에 의한 외부 통제 장치도 작동하고 있다&quot;고 밝혔다. 이어 &quot;&quot;향후 내부적... ",https://news.tvchosun.com/site/data/html_dir/2025/09/01/2025090190129.html,https://n.news.naver.com/mnews/article/448/0000553678?sid=102,"Mon, 01 Sep 2025 13:39:00 +0900"
국회,김영훈 &quot;원·하청 격차 줄면 하청이 정규직 요구하겠나…간접고용 기형...,지난달 24일 국회 본회의를 통과한 노조법2조는 사용자 개념을 직접 근로계약이 없어도 실질적·구체적 지배력을 행사하는 자까지 넓혔다. 하청 노조가 원청 사용자에게도 교섭할 길이 열렸다는 의미다. 김 장관은 국내... ,http://www.fnnews.com/news/202509011311521097,https://n.news.naver.com/mnews/article/014/0005399624?sid=101,"Mon, 01 Sep 2025 13:38:00 +0900"
국회,장동혁 '전한길=의병' 비유..황명선 &quot;역사 모독&quot;,앞서 장 대표는 지난달 28일 조선일보와 인터뷰에서 &quot;관군인 우리가 국회 안에서 소리를 낼 때 전씨는 당 밖에서 의병으로 그 소리를 증폭하고 적을 막는 역할을 했다&quot;고 평가했다. 황 최고위원은 1일 최고위원회의... ,http://www.dtnews24.com/news/articleView.html?idxno=797157,http://www.dtnews24.com/news/articleView.html?idxno=797157,"Mon, 01 Sep 2025 13:38:00 +0900"
국회,중앙부처 문 두드린 민선 8기 용인특례시… 난제·현안 줄줄이 성과,행안부에도 2022년 특별재난구역으로 지정된 동천동 재해복구사업 국비 신속 교부를 건의해 관철했으며 실질적인 특례 권한 확보를 위해 특례시 지원 특별법 제정을 건의한 결과 2024년 12월 행안부에서는 국회로 특례시... ,https://www.kyeonggi.com/article/20250901580103,https://n.news.naver.com/mnews/article/666/0000082396?sid=102,"Mon, 01 Sep 2025 13:38:00 +0900"
국회,빠르면 올해부터 선박 조각투자 가능해진다,"현재 국회에는 조각투자 관련 신규 기술을 법제화하기 위한 법률 개정안이 13건 발의돼 있다. 개정안이 국회를 통과하면 발행 절차 간소화, 발행 주체 다양화, 유통시장 활성화, 블록체인 기술 본격 도입 등 관련 조각투자... ",https://news.mtn.co.kr/news-detail/2025090113303437539,https://news.mtn.co.kr/news-detail/2025090113303437539,"Mon, 01 Sep 2025 13:38:00 +0900"
국회,발언하는 장동혁 국민의힘 대표,장동혁(오른쪽) 국민의힘 대표가 1일 오전 서울 여의도 국회에서 김민석 국무총리의 예방을 받으며 발언하고 있다/사진=이용우 기자,https://www.gukjenews.com/news/articleView.html?idxno=3364258,https://www.gukjenews.com/news/articleView.html?idxno=3364258,"Mon, 01 Sep 2025 13:38:00 +0900"
국회,발언하는 김민석 국무총리,김민석(가운데) 국무총리가 1일 오전 서울 여의도 국회에서 장동혁(오른쪽) 국민의힘 대표를 예방해 발언하고 있다./사진=이용우 기자,https://www.gukjenews.com/news/articleView.html?idxno=3364261,https://www.gukjenews.com/news/articleView.html?idxno=3364261,"Mon, 01 Sep 2025 13:38:00 +0900"
국회,경찰 &quot;17일부터 보이스피싱 24시간 상담…중국 등과 공조 강화&quot;,한편 최근 국회에는 '한국 경찰이 중국 공안과 맺은 모든 업무협약을 폐기하라'는 취지의 청원이 올라왔다. 이 청원은 5만명 이상의 동의를 받아 관련 상임위원회에 회부될 예정이다.,https://www.ngonews.kr/news/articleView.html?idxno=213035,https://www.ngonews.kr/news/articleView.html?idxno=213035,"Mon, 01 Sep 2025 13:38:00 +0900"
국회,[여론] 이재명 긍정평가 53.1%... 민주당 42.6% 국민의힘 31.2%,"조국 전 장관 행보, 긍정 34.5% 부정 59.6% 광복절 특별사면 이후 내년 국회의원 보궐 선거 등 출마설이 나오는 조국 전 장관의 행보를 두고 긍정 평가가 34.5%, 부정 평가가 59.6%로 집계됐다. 세대별로 보면 ▲20대... ",https://www.incheontoday.com/news/articleView.html?idxno=307563,https://www.incheontoday.com/news/articleView.html?idxno=307563,"Mon, 01 Sep 2025 13:38:00 +0900"
국회,'지천댐 재검토' 시사 김성환 저격..김태흠 &quot;전 정부 사업 백지화?&quot;,특히 김 장관이 지난21대 국회 산자중기위원회 소속일 당시 '석탄화력발전소 폐지 지원 특별법' 소위를 불참해 무산시켰다는 주장을 강조하며 &quot;환경부 장관이 지금 그 자리에 있어야 할 사람인지 의심스럽다&quot;고 평가했다.... ,http://www.dtnews24.com/news/articleView.html?idxno=797161,http://www.dtnews24.com/news/articleView.html?idxno=797161,"Mon, 01 Sep 2025 13:38:00 +0900"
