Keyword,Title,Description,Original Link,Link,Publication Date
이재명,"전한길 첫 '유언' 공개 감동연설, '전한길 죽이기' 맞서 전면전 선포......",이재명 현상금 논란 관련: 워싱턴 DC에서의 사적인 자리에서 나온 '풍자'성 발언이 국정감사에서까지 언급되며 자신을 '체포 대상'으로 몰았다고 지적했다. 전 씨는 이 모든 공격이 이재명 대장동 사건 항소 포기 논란 등... ,https://www.thepublic.kr/news/articleView.html?idxno=284131,https://www.thepublic.kr/news/articleView.html?idxno=284131,"Wed, 19 Nov 2025 13:26:00 +0900"
이재명,삼성·현대차·한화 총수 UAE 집결…AI·수소·방산 협력 확대 주목,"이 행사는 이재명 대통령의 UAE 국빈 방문 일정에 맞춰 한국경제인협회와 대한무역투자진흥공사(KOTRA)가 공동 주최하는 양국 경제 협력 행사다. 재계에 따르면 이재용 삼성전자 회장, 정의선 현대차그룹 회장, 김동관... ",https://www.mstoday.co.kr/news/articleView.html?idxno=99536,https://www.mstoday.co.kr/news/articleView.html?idxno=99536,"Wed, 19 Nov 2025 13:26:00 +0900"
이재명,나경원 &quot;윤어게인·부정선거론 내칠 필요 있나…넓은 집 지어야&quot;,앞서 장 대표는 지난 16일 유튜브 방송 《이영풍TV》에 출연해 &quot;국민의힘만으로는 이재명 정권과 싸우기 어렵다고 생각한다&quot;면서 &quot;체제 전쟁의 깃발 아래 모일 수 있는 모든 우파들은 함께 모여야 한다. 이재명 정권이... ,https://www.sisajournal.com/news/articleView.html?idxno=353530,https://n.news.naver.com/mnews/article/586/0000116294?sid=100,"Wed, 19 Nov 2025 13:26:00 +0900"
이재명,"주철현 의원, “전남 전력망 확충은 재생에너지 허브 실현의 첫걸음”","나아가 이재명 대통령의 대선공약인 ‘재생에너지 허브 전남’ 실현을 위한 핵심 과제”라고 강조했다. 토론에서는 한국전력공사 이경윤 처장이 마이크로그리드 및 ADMS 도입, ESS를 활용한 수용성 확대 방안을 제시했으며... ",http://www.beyondpost.co.kr/view.php?ud=2025111913224685859aeda69934_30,http://www.beyondpost.co.kr/view.php?ud=2025111913224685859aeda69934_30,"Wed, 19 Nov 2025 13:26:00 +0900"
이재명,"[이슈] 韓, 론스타 4천억 규모 소송 완승 '배상금 0원'·'소송비용 73억...",與 &quot;기적같은 결과…명백한 이재명 정부 성과&quot; 민주당은 이번 승소에 환영의 입장을 내며 사과 요구에는... 들었다&quot;며 &quot;이재명 대통령의 외교적인 성과와 더욱 빛나게 된 대한민국을 또 자랑스럽게 생각한다&quot;고... ,https://www.polinews.co.kr/news/articleView.html?idxno=714205,https://www.polinews.co.kr/news/articleView.html?idxno=714205,"Wed, 19 Nov 2025 13:26:00 +0900"
이재명,'이재명 정부가 책임져라'[한전KPS 비정규직 직접고용 촉구 농성],"사진=태안화력 고 김충현 비정규직 노동자 사망사고 대책위원회 한전KPS 비정규직 노동자들이 이재명 정부가 불법파견을 바로잡고 약속을 이행할 것을 요구하며, 협의체에서 즉각적인 직접고용 의결과 불법 중단... ",https://www.newsclaim.co.kr/news/articleView.html?idxno=3051146,https://www.newsclaim.co.kr/news/articleView.html?idxno=3051146,"Wed, 19 Nov 2025 13:24:00 +0900"
국회,서영교 &quot;쿠팡 오찬 의혹은 공작&quot; 野 &quot;본인 잣대대로 거취표명해야&quot;,서 의원은 19일 오전 국회에서 기자회견을 열고 &quot;저는 쿠팡 상무와 만나지 않았고 대한변협과 만났다&quot;며 &quot;국회의원으로서 대한변협이 제가 담당하는 직능 단체다&quot;라고 주장했다. 이어 &quot;(당시 오찬에선) 대한변협과 만났고... ,https://www.hankyung.com/article/2025111931577,https://n.news.naver.com/mnews/article/015/0005213312?sid=100,"Wed, 19 Nov 2025 13:42:00 +0900"
국회,유럽 내 기독교인 대상 혐오범죄 갈수록 '악화' 추세,핀란드 국회 페이비 래세넨(Päivi Räsänen) 의원은 LGBT 프라이드 달 지지를 비판하며 성경구절을 인용한 트윗으로 여러 차례 법정에 끌려갔다. 아프가니스탄 전쟁 영국군 참전용사인 아담 스미스코너 씨는 지난해... ,https://www.goodnews1.com/news/articleView.html?idxno=453608,https://www.goodnews1.com/news/articleView.html?idxno=453608,"Wed, 19 Nov 2025 13:42:00 +0900"
국회,“이재명·한동훈 모두 쫓아내자”… 극우 유투버·국민의힘 뭉친다,26일 국회 도서관 대강당에서 정책포럼을 열고 본격적인 활동에 들어간다. 특히 대자유총은 이재명정권은... 특히 내달 26일 국회 도서관 대강당에서 열리는 대자유총 정책포럼에 장동혁 국민의힘 대표가 참석할 것으로... ,https://m.skyedaily.com/news_view.html?ID=291071,https://m.skyedaily.com/news_view.html?ID=291071,"Wed, 19 Nov 2025 13:42:00 +0900"
국회,"안성시-한국노총 안성지역지부, 노사화합 한마당 음악회 성황리 개최","이날 행사에는 김보라 안성시장, 국회의원, 안성시의회 의장, 안성상공회의소, 관내 기업 노무 담당 관계자들도 참석해 화합의 장을 마련했다. 본 행사는 노동자들이 일상의 긴장을 풀고 재충전하는 것은 물론, 노사 간의... ",http://www.m-i.kr/news/articleView.html?idxno=1305018,http://www.m-i.kr/news/articleView.html?idxno=1305018,"Wed, 19 Nov 2025 13:42:00 +0900"
국회,"횡성군, '친환경에너지복합타운' 기공식 개최… 청정 횡성 100년 미래 연...","군은 11월 18일 공근면 초원리 사업 부지에서 김명기 군수, 표한상 군의회 의장, 지역 국회의원, 한국환경공단 관계자, 지역 주민 등이 참석한 가운데 기공식을 개최했으며, 2029년 준공을 목표로 사업을 진행한다고 밝혔다.... ",http://www.aflnews.co.kr/news/articleView.html?idxno=308537,http://www.aflnews.co.kr/news/articleView.html?idxno=308537,"Wed, 19 Nov 2025 13:42:00 +0900"
국회,"서초구, 세계적 환경상 '그린애플어워즈' 3관왕 달성…친환경 정책 국제...",이미지 = 그린애플어워즈 시상식 사진 서울 서초구(구청장 전성수)는 지난 17일(현지시간) 영국 런던 웨스트민스터 국회의사당에서 열린 '2025 그린애플어워즈(Green Apple Awards)' 시상식에서 대상(Champion)을 포함한 총 3개... ,https://www.job-post.co.kr/news/articleView.html?idxno=190793,https://www.job-post.co.kr/news/articleView.html?idxno=190793,"Wed, 19 Nov 2025 13:42:00 +0900"
국회,"국회 기후노동위, 19일 파주 방문, ‘경기북부 에너지고속도로’ 첫 현...","박정 의원 제안, 접경지역 재생에너지 확대와 송전망 혁신 검토 실질적 자리 될 듯 국회... 한편 이번 현장 방문을 계기로 국회 해당 상임위와 정부가 경기북부 에너지고속도로에 대한 공감대를 형성, 사업 현실화가... ",https://www.kgnews.co.kr/news/article.html?no=874751,https://www.kgnews.co.kr/news/article.html?no=874751,"Wed, 19 Nov 2025 13:42:00 +0900"
국회,"한독네트워크, 한국-독일 학생 교환방문 프로그램 MOU 체결","사단법인 한국독일네트워크(ADeKo)는 19일 국회의원회관에서 ‘한국-독일 학생 교환방문 프로그램’ 추진을 위한 양해각서(MOU)를 체결했다고 밝혔다. 체결식에는 김희정·김영배 국회의원(한독의원친선협회), 게오르크... ",https://www.megaeconomy.co.kr/news/newsview.php?ncode=1065588030280551,https://www.megaeconomy.co.kr/news/newsview.php?ncode=1065588030280551,"Wed, 19 Nov 2025 13:42:00 +0900"
국회,전한길 &quot;김예지 출당해야…박민영 감싼 장동혁 정말 잘했다&quot;,"전 씨는 어제(18일) 자신의 유튜브 채널 라이브 방송을 통해 &quot;김예지 의원은 탄핵할 때, 내란특검팀 만들 때 더불어민주당 손잡고 윤석열 전 대통령 등에 칼 꽂은 자 아닌가&quot;라며 &quot;(국민의힘 국회의원으로서) 한 게 뭐가 있나.... ",https://news.jtbc.co.kr/article/NB12271571?influxDiv=NAVER,https://n.news.naver.com/mnews/article/437/0000465199?sid=100,"Wed, 19 Nov 2025 13:42:00 +0900"
국회,서울중앙지검장에 박철우 임명…주진우 &quot;항소 포기 덮겠단 뜻&quot;,국민의힘 주진우 의원이 12일 오전 서울 여의도 국회의사당 본관 앞 중앙계단에서 열린 대장동 일당 7400억 국고 환수 및 검찰 항소포기 외압 규탄대회에서 발언을 하고 있다. 사진 / 이 훈 기자 대장동 항소 포기 파장으로... ,http://www.sisafocus.co.kr/news/articleView.html?idxno=350442,http://www.sisafocus.co.kr/news/articleView.html?idxno=350442,"Wed, 19 Nov 2025 13:42:00 +0900"
국회,"박상신 DL이앤씨 대표, 필리핀 대통령 만나 에너지 협력 논의 [건설오늘...",지난 18일 국회의원회관 제1소회의실에서 열린 '지속가능한 임도의 조성과 관리를 위한 정책개선 국회토론회'에서 윤준병 더불어민주당 의원(왼쪽에서 다섯번째)과 유용재 정인욱학술장학재단 사무국장(오른쪽에서... ,http://www.sisaon.co.kr/news/articleView.html?idxno=177641,http://www.sisaon.co.kr/news/articleView.html?idxno=177641,"Wed, 19 Nov 2025 13:40:00 +0900"
국회,"최태원, 국힘에 &quot;대규모 투자 뒷받침할 규제 개선·입법 지원 필요&quot;","이번 간담회는 정기국회 주요 법안 논의를 앞두고 경제계 애로와 건의 사항을 듣기 위해 마련됐다. 최 회장은 정년 연장, 위기 산업 지원, 기업 경영 불확실성 완화 등 현안 과제를 정리한 '제22대 국회 입법 현안에 대한... ",https://www.kado.net/news/articleView.html?idxno=2017446,https://n.news.naver.com/mnews/article/654/0000152265?sid=101,"Wed, 19 Nov 2025 13:40:00 +0900"
국회,&quot;지금이 예산 확보 골든타임&quot; 군산시 국비 확보 총력전,19일 김영민 부시장은 이날 국회를 직접 찾아 예산결산특별위원회 소속 의원과 전북 지역 국회의원들을 잇달아 만나며 지역 핵심 현안 사업의 필요성을 설명하고 국회 차원의 적극적인 지원을 요청했다. 새 정부가... ,http://www.jeollailbo.com/news/articleView.html?idxno=784303,http://www.jeollailbo.com/news/articleView.html?idxno=784303,"Wed, 19 Nov 2025 13:40:00 +0900"
국회,나경원 국회 대관 '유튜버 연합'…&quot;한동훈이 김예지 러브해&quot;[오목조목],장소인 국회도서관 대강당의 대관 신청을 한 것으로 알려졌습니다. 대자유총의 간부를 맡은 유튜버들은... 그 중 부회장직을 맡은 한 유튜버는 지난 8월 나 의원 주재로 열린 '노란봉투법 입법 반대 국회 기자회견'에... ,https://www.nocutnews.co.kr/news/6430804?utm_source=naver&utm_medium=article&utm_campaign=20251119013958,https://n.news.naver.com/mnews/article/079/0004087571?sid=102,"Wed, 19 Nov 2025 13:40:00 +0900"
국회,"국민의힘, 야당 역할 못한다","여소야대 정국 하에서 집권세력이 일치단결하더라도 국회 다수 의석을 믿고 무도함을 불사하는 민주당을 상대하기 벅찬데, 그들은 따로 놀았다. ***국민의힘 타격감 제로 국힘은 대통령을 보유한 집권여당이었으나... ",https://www.inews365.com/news/article.html?no=895162,https://www.inews365.com/news/article.html?no=895162,"Wed, 19 Nov 2025 13:40:00 +0900"
국회,조국 &quot; '지민비조'가 22대 총선 승리 견인… '2당 도약'이 최종 목표&quot;,특히 조 전 위원장은 현재 국회에서 혁신당 소속 의원들의 성과가 민주당 위성정당 출신 의원들보다 뚜렷하다고 주장했다. 그는 한발 더 나아가 2028년 제23대 총선에서 국민의힘을 제치고 원내 2당으로 도약하겠다는... ,http://www.seoulwire.com/news/articleView.html?idxno=681320,http://www.seoulwire.com/news/articleView.html?idxno=681320,"Wed, 19 Nov 2025 13:40:00 +0900"
국회,"'쿠팡 오찬 의혹' 서영교 &quot;악의적 공작, 법적 조치&quot;",국회 법제사법위원회 소속 서영교 더불어민주당 의원은 19일 이재명 대통령이 검찰의 '쿠팡 봐주기 의혹'을... 서 의원은 이날 국회에서 회견을 열어 &quot;(전날) 대한변호사협회와 만났다. 대한변협이 제가 담당하는 직능단체... ,https://www.news1.kr/politics/assembly/5981230,https://n.news.naver.com/mnews/article/421/0008613459?sid=100,"Wed, 19 Nov 2025 13:40:00 +0900"
국회,&quot;2년째 표류 중인 광주 운전면허시험장 건립 사업 정상화해야&quot;,"이어 &quot;328억 원 규모로 2023년 착공된 광주운전면허시험장 건립 사업이 예산 부족으로 사실상 중단된 상태&quot;라며 &quot;도로교통공단이 원자재 및 인건비 상승분을 반영해 국회, 경찰청, 광주시에 예산 증액을 요청했지만 전혀... ",https://www.nocutnews.co.kr/news/6430812?utm_source=naver&utm_medium=article&utm_campaign=20251119013858,https://n.news.naver.com/mnews/article/079/0004087570?sid=102,"Wed, 19 Nov 2025 13:39:00 +0900"
국회,"&quot;中, 日정부에 일본산 수산물 수입 중지 통보&quot;","이는 최근 국회에서 다카이치 사나에(高市早苗) 일본 총리가 대만 유사시 개입 가능성을 언급한 데 따른 대항 조치로 보인다. 중국은 다카이치 총리의 발언에 크게 항의하며 철회를 요구했으나, 다카이치 총리는 철회는... ",https://www.newsis.com/view/NISX20251119_0003408930,https://n.news.naver.com/mnews/article/003/0013609672?sid=104,"Wed, 19 Nov 2025 13:39:00 +0900"
국회,"경북교육청, 김천 증산초 분교장 개편 추진···&quot;통폐합 중단&quot; 반발","증산초 발전위원회 등 주민 측은 경북교육청의 분교장 개편 시도에 반발하며 국회를 방문해 대책 마련을 요구한 바 있다. 교육단체 반발도 이어지고 있다. 19일 오전 9시 30분 경북교육연대, 증산초등학교발전위원회 등은... ",https://www.newsmin.co.kr/news/126089/,https://www.newsmin.co.kr/news/126089/,"Wed, 19 Nov 2025 13:38:00 +0900"
국회,"JDC, 제5회 영리더스포럼 27~28일 개최...청년이 준비하는 미래란?","이틀간 열리는 세션에 박태웅 녹서포럼 의장, 세계적 베스트셀러 작가 만딥 라이(Mandeep Rai), 문정인 연세대 제임스 레이니 석좌교수, 강금실 지구와 사람 공동대표, 문대림 국회의원, 조정원 LG AI 수석변호사 등이... ",https://news.bbsi.co.kr/news/articleView.html?idxno=4055339,https://news.bbsi.co.kr/news/articleView.html?idxno=4055339,"Wed, 19 Nov 2025 13:38:00 +0900"
국회,"장동혁 &quot;정부, 친기업 환경 만드는지 의문…족쇄 푸는 데 최선&quot;","이어 &quot;성장 중심 산업정책을 만들고, 계단식 규제 구조를 개선하는 국회 차원의 입법에 힘쓰겠다&quot;고 말했다. 이날 간담회에는 국민의힘 김도읍 정책위의장, 윤한홍 정무위원장, 임이자 기재위원장 등이 참석했으며... ",https://www.fntoday.co.kr/news/articleView.html?idxno=369171,https://www.fntoday.co.kr/news/articleView.html?idxno=369171,"Wed, 19 Nov 2025 13:38:00 +0900"
국회,"눈치없는 포스코? … 굳이, 이 와중에 위례 신사옥 착공","기공식에는 신상진 성남시장, 김태년 국회의원, 이주태 포스코홀딩스 사장 등이 참석했으나 장인화... 국회에서도 'K-스틸법' 제정을 요구하며 규제 완화와 지원을 호소한 바 있다. 이런 상황에서 수도권 신사옥에 대한... ",https://www.ilovepc.co.kr/news/articleView.html?idxno=56908,https://www.ilovepc.co.kr/news/articleView.html?idxno=56908,"Wed, 19 Nov 2025 13:36:00 +0900"
국회,"[AI發 전력亂]②AI데이터센터, 세제 혜택 주지만…규제·전기요금 '발목...",국회도 AI데이터센터 지원을 위해 입법에 나섰다. 기존 데이터센터를 AI 인프라로 전환할 때 전력 등을 포함해 구축·운영 비용에 세액공제를 부여하자는 입법안도 나왔다. 이인선 국민의힘 의원은 지난 7월 AI인프라의... ,https://www.asiatime.co.kr/article/20251119500153,https://www.asiatime.co.kr/article/20251119500153,"Wed, 19 Nov 2025 13:36:00 +0900"
국회,손솔 의원 &quot;동물학대 소싸움 금지해야&quot;,오전 국회 소통관에서 동물학대 소싸움폐지 전국행동 회원들과 기자회견을 열고 &quot;동물학대 소싸움을 이젠... 원칙을 바로 세우고 국회가 시대의 요구를 외면하지 않도록 끝까지 노력할 것&quot;이라고 밝혔다.,http://www.ikpnews.net/news/articleView.html?idxno=68811,http://www.ikpnews.net/news/articleView.html?idxno=68811,"Wed, 19 Nov 2025 13:36:00 +0900"
국회,박지원 &quot;'바이든 날리면' 했던 김은혜…정책실장에 사과해야&quot;,박지원 더불어민주당 의원은 김용범 대통령실 정책실장과 국회 운영위원회에서 고성을 주고받으며 공방을... 이에 앞서 어제(18일) 국회 운영위에서는 김은혜 의원과 김용범 정책실장 사이에 고성이 오갔습니다. 김 의원이... ,https://news.jtbc.co.kr/article/NB12271570?influxDiv=NAVER,https://n.news.naver.com/mnews/article/437/0000465198?sid=100,"Wed, 19 Nov 2025 13:36:00 +0900"
국회,최태원 &quot;투자 가로막는 규제 개선해야&quot;…국민의힘에 경제현안 건의,"최 회장은 그러면서 첨단 전략산업 경쟁력 강화, 생산적 금융 활성화, 기업 경영 불확실성 해소, 위기산업 사업재편 지원 등 주요 현안을 담은 '제22대 국회 입법 현안에 대한 상의 리포트'를 장동혁 대표에게 전달하며... ",https://www.straightnews.co.kr/news/articleView.html?idxno=286964,https://www.straightnews.co.kr/news/articleView.html?idxno=286964,"Wed, 19 Nov 2025 13:36:00 +0900"
국회,"서산시, 중부권 동서횡단철도 국가철도망 구축계획 반영 촉구","지난해 6월 28일과 7월 1일 국회에서 중부권 동서횡단철도 건설을 위한 특별법안이 발의되고, 지난 10월 국정감사에서 해당 철도의 건설을 촉구하는 등 지역사회의 관심이 높아지고 있다. 홍순광 부시장은 &quot;중부권... ",http://www.chungnamilbo.co.kr/news/articleView.html?idxno=859671,http://www.chungnamilbo.co.kr/news/articleView.html?idxno=859671,"Wed, 19 Nov 2025 13:36:00 +0900"
국회,"제5회 영리더스포럼 제주, 27일 개막","이틀간 열리는 세션에 박태웅 녹서포럼 의장, 세계적 베스트셀러 작가 만딥 라이(Mandeep Rai), 문정인 연세대 제임스 레이니 석좌교수, 강금실 지구와 사람 공동대표, 문대림 국회의원, 조정원 LG AI 수석변호사 등이... ",https://www.newsjeju.net/news/articleView.html?idxno=414534,https://www.newsjeju.net/news/articleView.html?idxno=414534,"Wed, 19 Nov 2025 13:36:00 +0900"
국회,"“한전KPS 불법파견 즉각 중단” 요구 비정규직 노동자들, 대통령실 앞...","양한웅 김충현 대책위 공동대표는 “대통령, 국무총리, 국회의장까지 약속했지만 6개월이 지나도 아무것도 해결되지 않았다”며 “정부가 노동자들의 농성이 길어지기 전에 직접고용 약속을 이행해야 한다”고 말했다.... ",https://newscham.net/articles/114636,https://newscham.net/articles/114636,"Wed, 19 Nov 2025 13:34:00 +0900"
국회,허위조작정보 근절법 ‘급브레이크’…내달 2일 심사 유력,국회 과학기술정보방송통신위원회(과방위) 법안심사소위원회가 이른바 ‘허위조작정보 근절법’ 입법... 19일 국회와 업계에 따르면 더불어민주당 언론개혁특별위원회가 추진하는 ‘허위조작정보 근절법’(정보통신망법... ,https://www.ddaily.co.kr/page/view/2025111911494301744,https://n.news.naver.com/mnews/article/138/0002210044?sid=105,"Wed, 19 Nov 2025 13:34:00 +0900"
국회,"충주시, '야현체육센터' 준공… 시민 복합문화공간 탄생","이날 행사에는 조길형 충주시장을 비롯해 국회의원, 시·도의원, 유관단체, 시민 등이 참석해 사업 경과보고와 유공자 시상 및 새롭게 조성된 시설을 둘러보는 시간을 가졌다. 야현체육센터는 2019년 생활SOC 공모사업... ",https://www.gukjenews.com/news/articleView.html?idxno=3432329,https://www.gukjenews.com/news/articleView.html?idxno=3432329,"Wed, 19 Nov 2025 13:34:00 +0900"
국회,장동혁 저격한 박지원… &quot;내년 6월 정치생명 끝날 사람&quot;,그는 지난 12일 국회 본청 앞에서 열린 '대장동 일당 국고 환수 촉구 및 검찰 항소 포기 외압 규탄 대회'에서 황교안 전 국무총리가 체포된 것에 대해 &quot;전쟁이다. 우리가 황교안이다. 뭉쳐서 싸우자&quot;고 외쳤다. 또 장 대표는... ,https://www.sisaweek.com/news/articleView.html?idxno=230930,https://www.sisaweek.com/news/articleView.html?idxno=230930,"Wed, 19 Nov 2025 13:34:00 +0900"
국회,"국힘 만난 최태원, '금산분리' 완화 요청",이번 간담회는 정기국회에서 본격적으로 입법 논의가 시작하기 앞서 경제계가 국민의힘 측에 기업들의... ‘제22대 국회 입법현안에 대한 상의리포트’ 제언집을 장동혁 대표에게 직접 전달하며 기업의 목소리를 적극... ,http://www.shinailbo.co.kr/news/articleView.html?idxno=2148902,http://www.shinailbo.co.kr/news/articleView.html?idxno=2148902,"Wed, 19 Nov 2025 13:32:00 +0900"
국회,"청양군, 농어촌 기본소득 선정 7개 군 협력체계 구축","앞서 지난 7일과 17일 김돈곤 군수를 비롯한 6개 군 대표단은 국회를 방문해 농림축산식품해양수산위원, 예산결산특별위원회, 여야 대표실 등을 방문해 국비 비율 상향 및 지방비 부담 완화를 공동 요청했다. 이번 청양... ",http://www.cctimes.kr/news/articleView.html?idxno=876866,http://www.cctimes.kr/news/articleView.html?idxno=876866,"Wed, 19 Nov 2025 13:32:00 +0900"
국회,"금천구, 성탄 트리 점등... 주민과 함께 연말 분위기 물씬","점등식에는 유성훈 금천구청장을 비롯해 국회의원, 구의장, 시·구의원 등 주요 인사들이 참석했다. 또한 금천구교구협의회 소속 교회와 성도들, 많은 주민이 함께해 뜻깊은 시간이 됐다. 행사에서는 성탄절을 기념하는... ",https://biz.heraldcorp.com/article/10619331?ref=naver,https://n.news.naver.com/mnews/article/016/0002560049?sid=102,"Wed, 19 Nov 2025 13:32:00 +0900"
국회,"호남대 전광섭 교수, &quot;지방자치/국가 균형발전 기여&quot; 홍조근정훈장","또한, 제 27대 한국거버넌스학회장과 국회 공직자윤리위원회 위원, 국무총리 직속 도시재생특별위원회 위원 및 기획재정부 공공기관 경영평가위원, 행정안전부 제8기 정책자문위원, 광주연구원 연구자문위원장 등으로... ",http://www.veritas-a.com/news/articleView.html?idxno=583885,http://www.veritas-a.com/news/articleView.html?idxno=583885,"Wed, 19 Nov 2025 13:32:00 +0900"
국회,충청 택배노조 &quot;노동자 보호·지속가능 새벽배송 방안 마련해야&quot;,이어 &quot;쿠팡을 비롯한 모든 택배사는 사회적 책임을 다하고 3차 사회적 합의에 성실히 임해야 한다&quot;며 &quot;정부와 국회도 지속 가능한 산업 질서가 확립될 수 있도록 앞장서길 바란다&quot;고 덧붙였다.,https://www.yna.co.kr/view/AKR20251119086200063?input=1195m,https://n.news.naver.com/mnews/article/001/0015751330?sid=101,"Wed, 19 Nov 2025 13:32:00 +0900"
국회,"김예지 &quot;국민의힘, 약자와 동행해야…개인적으론 당 대응 이해 안돼&quot;","김 의원은 19일 국회 소통관에서 아동·노인·중증장애인 보호 법안 대표발의 기자회견을 마친 뒤 취재진과 만나, 당의 박 대변인 구두 경고 조치에 대한 견해를 묻자 &quot;피해자와 당 동료의 입장은 다를 수밖에 없지만... ",https://www.kado.net/news/articleView.html?idxno=2017442,https://n.news.naver.com/mnews/article/654/0000152262?sid=100,"Wed, 19 Nov 2025 13:31:00 +0900"
국회,"계엄 옹호 껴안은 국힘, ‘장애인 혐오’까지 감싸나…당안팎 우려 목소...",논란이 커지자 박 대변인은 자신의 SNS를 통해 “‘장애인 할당이 많다’는 건 국회 전체가 아니라 국민의힘... 김 의원과 함께 국회 보건복지위 소속인 박주민 더불어민주당 의원은 “국민의힘 대변인이 자당의 장애인... ,https://www.mk.co.kr/article/11471883,https://n.news.naver.com/mnews/article/009/0005592639?sid=100,"Wed, 19 Nov 2025 13:31:00 +0900"
국회,"李대통령, 한미 협상 초반 &quot;낭떠러지서 뛰어내릴 용기 있어야&quot;",한편 김 실장은 전날 국회 운영위원회에서 김은혜 국민의힘 의원과 설전을 벌인 데 대해서는 &quot;좀 더 부드럽게 답변하는 훈련을 해야겠다&quot;며 &quot;(정치 영역에 들어왔다는) 인식을 더 해야할 것 같다&quot;고 말했다. 옆자리에 앉은... ,http://www.shinailbo.co.kr/news/articleView.html?idxno=2148910,http://www.shinailbo.co.kr/news/articleView.html?idxno=2148910,"Wed, 19 Nov 2025 13:30:00 +0900"
