Keyword,Title,Description,Original Link,Link,Publication Date
관료,"美, 이란 내무장관 등 고위직 대거 제재…&quot;시위 유혈진압 책임&quot;","박정우 특파원 = 미국 재무부가 이란 정권의 자국민 탄압과 부패 행위를 이유로 이란 고위 관료 및 관련 기관을 대거 제재했다. 이번 조치에는 시위 진압을 지휘한 핵심 인물뿐만 아니라, 제재 회피 수단으로 활용된... ",https://www.newspim.com/news/view/20260131000013,https://www.newspim.com/news/view/20260131000013,"Sat, 31 Jan 2026 04:14:00 +0900"
관료,"EU 전 상임의장, 나토 수장 직격 “미국 대리인 노릇 멈춰라”","그는 미국의 &quot;매우 충직한 파트너&quot;인 EU에 그린란드를 병합하겠다고 위협하고, 블라디미르 푸틴 러시아 대통령에게 정당성을 부여하려 하고, 전직 EU 관료를 제재하는 등의 행동을 트럼프 대통령이 하는 것은 옳지 않다고... ",https://news.kbs.co.kr/news/pc/view/view.do?ncd=8473966&ref=A,https://n.news.naver.com/mnews/article/056/0012116204?sid=104,"Sat, 31 Jan 2026 03:42:00 +0900"
관료,"美, 이란 협상 압박속 내무장관 제재…&quot;시위대 사망 책임&quot;",미국 재무부 해외자산통제국(OFAC)은 30일(현지 시간) 에스칸다르 모메니 칼라가리 이란 내무부 장관 등 이란 시위대에 대한 잔혹한 탄압에 책임있는 관료들에 제재를 가한다고 밝혔다. 재무부는 모메니 장관에 대해... ,https://www.newsis.com/view/NISX20260131_0003497450,https://n.news.naver.com/mnews/article/003/0013740936?sid=104,"Sat, 31 Jan 2026 03:14:00 +0900"
관료,"EU 전 상임의장, 나토 수장 직격 &quot;美 대리인 노릇 멈춰라&quot;","그는 미국의 &quot;매우 충직한 파트너&quot;인 EU에 그린란드를 병합하겠다고 위협하고, 블라디미르 푸틴 러시아 대통령에게 정당성을 부여하려 하고, 전직 EU 관료를 제재하는 등의 행동을 트럼프 대통령이 하는 것은 옳지 않다고... ",https://www.yna.co.kr/view/AKR20260131001900098?input=1195m,https://n.news.naver.com/mnews/article/001/0015877164?sid=104,"Sat, 31 Jan 2026 01:56:00 +0900"
관료,"현명한 패배도 있다…전쟁에도, 인생에도",경제관료로 화려한 이력을 쌓았던 지은이의 현재 전공은 다름 아닌 역사다. 『역사가 당신을 강하게... 경제관료 출신답게 게임이론 같은 경제학 개념과 세계 각국의 기업 경영 사례도 책에 녹여냈다.,https://www.joongang.co.kr/article/25401659,https://n.news.naver.com/mnews/article/353/0000054418?sid=103,"Sat, 31 Jan 2026 00:32:00 +0900"
관료,"[김영수의 디코드 차이나] 딥시크 쇼크 1년, 중국의 다음 10년","세제, 관료 인사, 금융 시스템에 깊이 박힌 ‘속도와 규모’ 위주 인센티브의 산물이다. 과잉 생산은 기업 수익률 하락과 임금 정체를 낳고, 국내 수요를 넘어 글로벌 덤핑으로 이어진다. 실제 2025년 중국의 대미 수출은... ",https://www.hankyung.com/article/2026013043761,https://n.news.naver.com/mnews/article/015/0005244941?sid=110,"Sat, 31 Jan 2026 00:10:00 +0900"
관료,시진핑만 비껴간 '칠상팔하'…76세 장유샤 버틴 게 화근,고위 관료 숙청의 경우 보통은 해당 인물의 신병을 먼저 확보하고 이어 측근 세력마저 진압한 뒤 어느 정도 국면이 안정되면 그 사실을 공표한다. 여론 예열 시간을 갖는 것이다. 허웨이둥도 지난해 3월 중순 모습이... ,https://www.joongang.co.kr/article/25401639,https://n.news.naver.com/mnews/article/353/0000054399?sid=102,"Sat, 31 Jan 2026 00:02:00 +0900"
관료,"조국혁신당·진보당·사회민주당, 대전·충남 행정통합 '진보적 대안' 모...",◆ 지원금 아닌 재정 자치·관료 아닌 정치 자치 이번 토론회에서는 중앙정부의 시혜성 지원금 확대가 아닌... 같은 관료 중심 대책이 아니라 지역 정당 활동과 시민 참여를 보장하는 정치 자치권 강화가 행정통합 논의의... ,http://www.newstnt.com/news/articleView.html?idxno=582251,http://www.newstnt.com/news/articleView.html?idxno=582251,"Fri, 30 Jan 2026 23:36:00 +0900"
관료,"트럼프, 차기 연준 의장에 케빈 워시 지명…'쿠팡 이사' 출신, 韓·아시...",월스트리트저널(WSJ)은 워시 후보자를 자유무역과 재정 건전성을 중시하는 전통적 공화당 성향의 경제 관료로 평가했다. 다만 금리 인하에 신중한 입장을 보여온 억만장자 투자자 스탠리 드러켄밀러와의 친분은 향후... ,http://www.newsian.co.kr/news/articleView.html?idxno=85735,http://www.newsian.co.kr/news/articleView.html?idxno=85735,"Fri, 30 Jan 2026 22:22:00 +0900"
박수영,[심층분석] 베선트의 비준(ratify)을 외면하는 민주당의 진짜 속내는,"국회 재경위 야당 간사인 박수영 의원은 30일 오전 국회에서 열린 원내대책회의에서 &quot;이재명 정권은... 김건·박수영·박성민 의원이 주관한 '대미투자특별법 긴급 진단 토론회'의 발제자로 나서, MOU와 대미투자특별법의... ",https://www.pennmike.com/news/articleView.html?idxno=114560,https://www.pennmike.com/news/articleView.html?idxno=114560,"Sat, 31 Jan 2026 09:18:00 +0900"
박수영,"우후죽순 도심 마라톤 대회… 교통 마비 주범이냐, 건강한 취미냐",카페 손님 박수영(47)씨는 &quot;화장실 줄이 너무 길어 정작 카페 손님은 이용을 못한다&quot;고 토로했다. 안전 관리와 교통 통제에 투입되는 경찰력 낭비를 지적하는 목소리도 있다. 국회 행정안전위원회 소속 채현일... ,https://www.hankookilbo.com/news/article/A2026012510550001797?did=NA,https://n.news.naver.com/mnews/article/469/0000912011?sid=101,"Sat, 31 Jan 2026 04:30:00 +0900"
박수영,당협과 엇박자 난 구청장들…부산 국민의힘 공천 지형 ‘요동’,"오은택 구청장과 남구 당협위원장인 박수영 의원 간 인사 갈등설이 지역 정가에 확산되고 있다. 오 구청장은 주민 밀착형 행보 덕에 높게 평가받는 인사이지만, 최근 인사 문제를 둘러싼 노조와의 충돌로 조직 장악력에... ",https://www.ekn.kr/web/view.php?key=20260130020474464,https://www.ekn.kr/web/view.php?key=20260130020474464,"Fri, 30 Jan 2026 22:08:00 +0900"
박수영,김정관-러트닉 관세협상 결론 못 내...국힘 &quot;비준 동의 먼저&quot;,"박수영 국민의힘 의원은 오늘(30일) &quot;외환보유고 절반 수준의 큰 돈을 미국으로 보내야 하는데 이는 국가에 중대한 재정적 부담&quot;이라며 &quot;국회 비준 동의를 먼저 받고, 법을 통과시켜야 한다&quot;라고 말했습니다. 반면 민주당은... ",https://biz.sbs.co.kr/article_hub/20000288718?division=NAVER,https://n.news.naver.com/mnews/article/374/0000489866?sid=101,"Fri, 30 Jan 2026 18:09:00 +0900"
박수영,트럼프에 '볼모' 잡힌 한국 기업들…국민의힘에 '발목' 잡힌 대미투자법,국회 재경위 야당 간사인 박수영 국민의힘 의원(부산 남구)은 이날 오전 국회 원내대책회의에서 &quot;이재명 정권은 명심하라. 국회 비준 동의를 먼저 받아 쟁점을 해소하고 대미투자특별법(안)을 신속히 통과시키는 게 가장... ,https://www.sidae.com/article/2026013012353398031,https://n.news.naver.com/mnews/article/417/0001127476?sid=100,"Fri, 30 Jan 2026 16:49:00 +0900"
박수영,"국민의힘 “이재명 정부, '안보·부동산·환율' 대한민국 생명선 흔들어...","*박수영 재정경제기획위원회 간사(환율·관세)=박수영 재정경제기획위 간사는 “무리한 환율 개입이 결국 관찰대상국 재지정을 불렀다”며, “헌법을 무시하고... ",http://www.breaknews.com/1181290,http://www.breaknews.com/1181290,"Fri, 30 Jan 2026 15:46:00 +0900"
박수영,[지방선거 여론조사] 민주당이 8년만에 부-울-경 휩쓰나,"7%, 박수영 15.5%, 서병수 11.6%, 조경태 7.3% 순이었다. 더불어민주당 전재수와 국민의힘 박형준이 대결할 경우 누구를 지지할지를 묻은 양자대결 가상조사에선 전재수 47.9% 대 박형준 33.6%로 전재수가 14.3%p 크게 앞서는... ",https://www.cnbnews.com/news/article.html?no=776193,https://www.cnbnews.com/news/article.html?no=776193,"Fri, 30 Jan 2026 15:04:00 +0900"
박수영,"[이슈] 美, 관세 인상 카드에 환율 관찰대상국 재지정까지…韓 대미투자...",국회 재정경제기획위원회 국민의힘 간사인 박수영 의원은 30일 원내대책회의에서 &quot;이재명 정부는 지난해 9월 미 재무부와 환율 협상을 한 이후에 환율 관찰 대상국에서 제외될 것으로 자신했지만 결과는 이재명 정권... ,https://www.polinews.co.kr/news/articleView.html?idxno=721420,https://www.polinews.co.kr/news/articleView.html?idxno=721420,"Fri, 30 Jan 2026 14:20:00 +0900"
박수영,국힘 &quot;대미투자특별법 처리 보다 국회 비준이 먼저&quot;,국회 재정경제기획위원회 야당 간사인 박수영 의원은 30일 국회에서 열린 원내대책회의에서 &quot;이재명 정권은 명심하라. 국회 비준 동의 먼저 받아서 쟁점을 해소하고 대미투자특별법을 신속히 통과시키는 게 가장 빠른 길... ,http://www.iminju.net/news/articleView.html?idxno=156671,http://www.iminju.net/news/articleView.html?idxno=156671,"Fri, 30 Jan 2026 12:52:00 +0900"
박수영,"국민의힘 &quot;대미투자특별법, 국회 비준 동의가 우선&quot;",국회 재정경제기획위원회 야당 간사인 박수영 의원은 이날 오전 국회 원내대책회의에서 &quot;국회 비준 동의를 먼저 받아 쟁점을 해소한 뒤 대미투자특별법을 신속히 통과시키는 것이 가장 빠른 길&quot;이라며 &quot;국민의힘은... ,https://www.wolyo.co.kr/news/articleView.html?idxno=308198,https://www.wolyo.co.kr/news/articleView.html?idxno=308198,"Fri, 30 Jan 2026 12:30:00 +0900"
박수영,국민의힘 &quot;정부 주택공급 대책 실효성 한계&quot;…DMZ법·설탕세도 비판,"2026.01.30 pangbin@newspim.com 박수영 재정경제기획위원회 간사는 &quot;한국시간으로 오늘 아침 미국 재무부가 우리나라를 환율 관찰 대상국으로 재지정했다&quot;며 &quot;이재명 정부는 지난해 9월, 미 재무부와 환율 협상을 한 이후에 환율... ",https://www.newspim.com/news/view/20260130000694,https://www.newspim.com/news/view/20260130000694,"Fri, 30 Jan 2026 12:19:00 +0900"
박성훈,“5000피 만큼 쉽다” “왜 못했나”…부동산 정책 두고 정치권 입씨름,"박성훈 국민의힘 수석대변인은 이날 논평을 내고 “그렇게 쉬운 부동산 정상화를 왜 아직 하지 못하고 있는지, 국민은 대통령의 현실 인식에 어처구니가 없을 뿐”이라며 “이재명 정부 들어 네 차례의 부동산 대책이... ",https://www.etoday.co.kr/news/view/2551628,https://www.etoday.co.kr/news/view/2551628,"Sat, 31 Jan 2026 13:56:00 +0900"
박성훈,"국민의힘, 이재명 대통령 부동산 정책 맹비판… &quot;쉬운 정상화는 어디에...","박성훈 국민의힘 수석대변인은 이날 성명을 통해, 이 대통령이 언급한 &quot;쉬운 부동산 정상화&quot;를 왜 아직 이뤄내지 못했는지에 대한 답변을 요구하며 비판의 목소리를 높였다. 그는 &quot;이재명 정부 들어 연이어 발표된 네... ",https://www.gokorea.kr/news/articleView.html?idxno=856220,https://www.gokorea.kr/news/articleView.html?idxno=856220,"Sat, 31 Jan 2026 13:48:00 +0900"
박성훈,"“집값 정상화, 오천피보다 쉽다” vs “근데 왜 못했나”…李대통령-국...","박성훈 수석대변인은 이날 논평을 내고 “그렇게 쉬운 부동산 정상화를 왜 아직까지 하지 못하고 있는지, 국민들은 대통령의 현실 인식에 어처구니가 없을 뿐”이라며 “이재명 정부 들어 네 차례의 부동산 대책이... ",https://www.dt.co.kr/article/12043935?ref=naver,https://n.news.naver.com/mnews/article/029/0003008158?sid=100,"Sat, 31 Jan 2026 13:44:00 +0900"
박성훈,국힘 “李 망국적 부동산 정책…아니면 말고식 SNS 자중하라”,"박성훈 수석대변인은 논평에서 “이재명 정부 들어 네 차례의 부동산 대책이 나왔지만, 약발이 먹힌 정책은 단 하나도 없다”며 이같이 말했다. 그는 “최근 발표한 1·29 공급대책 역시 기존 정책의 재탕 삼탕에 불과하고... ",https://www.munhwa.com/article/11565096?ref=naver,https://n.news.naver.com/mnews/article/021/0002767854?sid=100,"Sat, 31 Jan 2026 13:36:00 +0900"
박성훈,국힘 &quot;李정부 부동산 정책이 곧 망국적 정책…쉬운데 왜 정상화 못했나...,"박성훈 국민의힘 수석대변인은 이날 논평에서 &quot;이 대통령이 자신의 엑스(X·옛 트위터)를 통해 '부동산 정상화는 5천피, 계곡 정비보다 훨씬 쉽고 더 중요한 일'이라며 또 망언을 내놓았다&quot;며 &quot;그렇게 쉬운 부동산 정상화를... ",https://www.imaeil.com/page/view/2026013113145597363,https://n.news.naver.com/mnews/article/088/0000994738?sid=100,"Sat, 31 Jan 2026 13:35:00 +0900"
박성훈,李대통령 “부동산 정상화 5천피보다 쉽다”…국힘 “그리 쉬운 걸 왜 ...,"박성훈 수석대변인은 이날 논평에서 “그렇게 쉬운 부동산 정상화를 왜 아직까지 하지 못하고 있는지, 국민들은 대통령의 현실 인식에 어처구니가 없을 뿐”이라며 “이재명 정부 들어 네 차례의 부동산 대책이 나왔지만... ",https://www.mk.co.kr/article/11949145,https://n.news.naver.com/mnews/article/009/0005630210?sid=100,"Sat, 31 Jan 2026 13:33:00 +0900"
박성훈,"여야, 교육부 ‘민주시민교육’ 공방…“교실의 정치화”·“정치선동”","■ 국민의힘 “교육 현장 정치 편향 논란 이어져” 국민의힘 박성훈 수석대변인은 오늘(31일) 논평에서, 교육부가 초·중·고교에 전문 강사를 파견하는 등 선거·헌법 교육을 확대하기로 한 것에 대해 “중립적으로 운영될지... ",https://news.kbs.co.kr/news/pc/view/view.do?ncd=8474112&ref=A,https://n.news.naver.com/mnews/article/056/0012116331?sid=100,"Sat, 31 Jan 2026 13:30:00 +0900"
박성훈,"국민의힘 &quot;李 정부, 망국적 부동산 원인…약발 먹힌 정책 없어&quot;","박성훈 국민의힘 수석대변인은 논평에서 &quot;이재명 정부 들어 네 차례의 부동산 대책이 나왔지만, 약발이 먹힌 정책은 단 하나도 없다&quot;며 이같이 말했다. 박 수석대변인은 '부동산 정상화는 5천피, 계곡 정비보다 훨씬 쉽고 더... ",https://news.tf.co.kr/read/ptoday/2288124.htm,https://n.news.naver.com/mnews/article/629/0000468087?sid=100,"Sat, 31 Jan 2026 13:28:00 +0900"
박성훈,"‘부동산 정상화, 5천피보다 쉽다’ 李 대통령에…국힘, “어처구니 없...","박성훈 수석대변인은 이날 논평을 내고 이 대통령의 발언에 대해 “그렇게 쉬운 부동산 정상화를 왜 아직까지 하지 못하고 있는지, 국민들은 대통령의 현실 인식에 어처구니가 없을 뿐”이라며 “이재명 정부 들어 네... ",https://economist.co.kr/article/view/ecn202601310011,https://n.news.naver.com/mnews/article/243/0000092279?sid=101,"Sat, 31 Jan 2026 13:23:00 +0900"
박성훈,[인사] 세종대학교,김경도 ▲반도체시스템공학과장 박성훈 ▲컴퓨터공학과장 나중채 ▲정보보호학과장 박기웅 ▲인공지능데이터사이언스학과장 심태용 ▲데이터사이언스학 주임교수 김장겸 ▲AI로봇학과장 이진영 ▲AI로봇학 부학과장... ,http://www.econonews.co.kr/news/articleView.html?idxno=425468,http://www.econonews.co.kr/news/articleView.html?idxno=425468,"Sat, 31 Jan 2026 13:16:00 +0900"
박성훈,‘민주시민교육’ 확대에 여야 “기본 교육” vs “교실 정치화”,"이에 앞서 박성훈 국민의힘 수석대변인은 이날 국회 소통관에서 논평을 내고 “확증 편향 등 가짜뉴스로 인한 폐해로부터 학생들을 보호하고 민주주의와 헌법의 가치를 알리겠다는 취지라고는 하지만, 국가 백년대계를... ",https://www.m-economynews.com/news/article.html?no=64263,https://www.m-economynews.com/news/article.html?no=64263,"Sat, 31 Jan 2026 13:16:00 +0900"
박성훈,"국힘, ‘부동산 정상화 5천피보다 쉽고 중요’ 李대통령에 공세",국민의힘은 31일 이재명 대통령이 엑스(X·옛 트위터)를 통해 “부동산 정상화는 5천피 달성보다 훨씬 쉽고 중요한 일”이라고 언급한 것을 두고 정부의 부동산 정책에 대한 공세에 나섰다 박성훈 국민의힘 수석대변인은... ,http://www.kookje.co.kr/news2011/asp/newsbody.asp?code=0100&key=20260131.99099008948,https://n.news.naver.com/mnews/article/658/0000133973?sid=100,"Sat, 31 Jan 2026 12:58:00 +0900"
박성훈,"국힘, 李 부동산 발언 직격··· &quot;그렇게 쉬운 정상화 왜 못했나&quot;","박성훈 수석대변인은 이날 논평을 통해 &quot;국민들은 대통령의 현실 인식에 어처구니가 없을 뿐&quot;이라며 &quot;얼마 전 '집값 대책 없다'며 손 털던 모습을 똑똑히 기억하고 있는데, 그 사이 대단한 묘수라도 찾은 것이냐&quot;며 공세에... ",https://www.dkilbo.com/news/articleView.html?idxno=532192,https://www.dkilbo.com/news/articleView.html?idxno=532192,"Sat, 31 Jan 2026 12:48:00 +0900"
박성훈,"국힘 “李, 그렇게 쉬운 부동산 정상화 왜 아직도 못했나”","국민의힘 박성훈 수석대변인은 이날 논평에서 “이 대통령이 자신의 엑스(X·옛 트위터)를 통해 ‘부동산 정상화는 5천피, 계곡 정비보다 훨씬 쉽고 더 중요한 일’이라며 또 망언을 내놓았다”며 “그렇게 쉬운 부동산... ",https://www.donga.com/news/Politics/article/all/20260131/133270686/2,https://n.news.naver.com/mnews/article/020/0003693936?sid=100,"Sat, 31 Jan 2026 12:45:00 +0900"
박성훈,"국민의힘, 이재명 부동산 발언 집중 공격…“쉽다더니 왜 못하나”",박성훈 국민의힘 수석대변인은 이날 논평을 내고 “그렇게 쉬운 부동산 정상화를 왜 아직까지 하지 못하고 있는지 국민들은 대통령의 현실 인식에 어처구니가 없을 뿐”이라며 “이재명 정부 들어 네 차례 부동산 대책이... ,https://www.sedaily.com/article/20003155?ref=naver,https://n.news.naver.com/mnews/article/011/0004585150?sid=100,"Sat, 31 Jan 2026 12:25:00 +0900"
박성훈,"국민의힘, 교육부 선거·헌법 교육 확대에 “교실 정치화 우려”",박성훈 국민의힘 수석대변인은 이날 논평에서 최교진 교육부 장관이 전국교직원노동조합 출신이라는 점을 언급하며 “교육부 수장이 한쪽으로 기울어진 편향된 인사인 만큼 교육부가 추진하는 ‘민주시민교육 확대’가... ,http://www.kookje.co.kr/news2011/asp/newsbody.asp?code=0300&key=20260131.99099008946,https://n.news.naver.com/mnews/article/658/0000133972?sid=100,"Sat, 31 Jan 2026 12:21:00 +0900"
박성훈,"국힘, '부동산 정상화 5천피보다 쉽다' 李대통령에 &quot;왜 못했나&quot;","박성훈 수석대변인은 이날 논평을 내고 이 대통령의 발언에 대해 &quot;그렇게 쉬운 부동산 정상화를 왜 아직까지 하지 못하고 있는지, 국민들은 대통령의 현실 인식에 어처구니가 없을 뿐&quot;이라며 &quot;이재명 정부 들어 네 차례의... ",https://www.yna.co.kr/view/AKR20260131028400001?input=1195m,https://n.news.naver.com/mnews/article/001/0015877529?sid=100,"Sat, 31 Jan 2026 12:04:00 +0900"
박성훈,"국힘, 교육부 '선거·헌법 교육 확대' 발표에 &quot;교실 정치화 우려&quot;",박성훈 수석대변인은 논평에서 &quot;교육부 수장이 한쪽으로 기울어진 편향된 인사인 만큼 교육부가 추진하는 민주시민교육 확대가 중립적으로 운영될지는 의문&quot;이라며 &quot;청소년 정치 참여 확대라는 순기능보다 자칫 교실이... ,https://www.newsis.com/view/NISX20260131_0003497567,https://n.news.naver.com/mnews/article/003/0013741311?sid=100,"Sat, 31 Jan 2026 11:53:00 +0900"
박성훈,"'부동산 정상화' 코스피5000보다 쉽다?…국민의힘 &quot;李대통령, 어처구니...","박성훈 수석대변인은 31일 논평을 통해 &quot;이 대통령은 그렇게 쉬운 부동산 정상화를 왜 아직도 못했나&quot;며 이같이 말했다. 앞서 이 대통령은 이날 엑스(X·옛 트위터)를 통해 &quot;비정상의 정상화, 부동산 투기 억제는 실패할 것... ",https://www.dailian.co.kr/news/view/1604878/?sc=Naver,https://n.news.naver.com/mnews/article/119/0003054420?sid=100,"Sat, 31 Jan 2026 11:46:00 +0900"
박성훈,"국민의힘, &quot;이재명 X, 그렇게 쉬운 부동산 정상화 왜 아직도 못했나&quot; 비...","박성훈 수석대변인은 31일 서면 논평을 통해 &quot;그렇게 쉬운 부동산 정상화를 왜 아직까지 하지 못하고 있는지, 국민들은 대통령의 현실 인식에 어처구니가 없을 뿐&quot;이라고 말했다. 그는 &quot;이재명 정부 들어 네 차례의 부동산... ",https://www.daejonilbo.com/news/articleView.html?idxno=2254307,https://n.news.naver.com/mnews/article/656/0000165151?sid=102,"Sat, 31 Jan 2026 11:45:00 +0900"
박성훈,부동산 정상화 쉽다는 이 대통령에 野 &quot;쉬운데 왜 못했나&quot;,박성훈 국민의힘 수석대변인은 이날 논평에서 &quot;얼마 전까지만 해도 '집값 대책이 없다’며 물러서는 듯한 모습을 보였던 것을 국민들은 기억하고 있다”며 “그 사이 새로운 해법이라도 마련했는지 의문&quot;이라고 밝혔다.... ,https://www.newdaily.co.kr/site/data/html/2026/01/31/2026013100032.html,https://www.newdaily.co.kr/site/data/html/2026/01/31/2026013100032.html,"Sat, 31 Jan 2026 11:42:00 +0900"
박성훈,"국민의힘 &quot;이 대통령, 그렇게 쉬운 부동산 정상화 왜 못 했나&quot;","박성훈 수석대변인은 오늘(31일) 논평에서 이재명 정부 들어 네 차례 부동산 대책이 나왔지만 약발이 먹힌 정책은 하나도 없었다며, 오히려 전세 물건이 줄고 월세 전환이 늘어 서민 주거 부담이 커졌다고 비판했습니다.... ",https://www.ytn.co.kr/_ln/0101_202601311137088497,https://n.news.naver.com/mnews/article/052/0002308479?sid=100,"Sat, 31 Jan 2026 11:37:00 +0900"
박성훈,국힘 &quot;망국적 부동산 원인 李 망국적 정책…아니면 말고식 SNS 자중하라...,"박성훈 수석대변인은 논평에서 &quot;이재명 정부 들어 네 차례의 부동산 대책이 나왔지만, 약발이 먹힌 정책은 단 하나도 없다&quot;라며 이같이 말했다. 그는 &quot;최근 발표한 1·29 공급대책 역시 기존 정책의 재탕 삼탕에 불과하고... ",https://www.newsis.com/view/NISX20260131_0003497557,https://n.news.naver.com/mnews/article/003/0013741305?sid=100,"Sat, 31 Jan 2026 11:36:00 +0900"
박성훈,"&quot;쉽다면서 왜 아직 못했나&quot;…국민의힘, 이재명 부동산 발언에 직격탄",박성훈 국민의힘 수석대변인은 이날 논평에서 &quot;얼마 전 '집값 대책 없다'며 손을 털던 대통령이 이제 와서 대단한 묘수라도 찾은 것이냐&quot;며 &quot;국민들은 대통령의 현실 인식에 어처구니가 없을 뿐&quot;이라고 비판했다. 박... ,http://www.hidomin.com/news/articleView.html?idxno=607087,http://www.hidomin.com/news/articleView.html?idxno=607087,"Sat, 31 Jan 2026 11:28:00 +0900"
박성훈,주진우 &quot;서학개미 탓하더니 靑고위직은 '테슬라' 몰빵&quot;,"박성훈 수석대변인도 논평을 통해 &quot;이 대통령은 '코스피 5000시대'를 외치며 개미들에게 국장 투자를 독려했지만, 정작 청와대 참모들과 국무 위원들은 미국 주식을 수백억 원어치 쓸어 담으며 '한국 탈출'을 몸소 실천하고... ",https://www.dailian.co.kr/news/view/1604874/?sc=Naver,https://n.news.naver.com/mnews/article/119/0003054417?sid=100,"Sat, 31 Jan 2026 11:25:00 +0900"
박성훈,국힘 &quot;대통령으로서의 무게감 따위는 없고 한없이 가벼운 발언&quot;,"박성훈 국민의힘 수석대변인은 31일 논평에서 &quot;이 대통령이 자신의 엑스를 통해 부동산 정상화는 5000피, 계곡... 이재명 X, 그렇게 쉬운 부동산 정상화 왜 아직도 못했나 [국민의힘 박성훈 수석대변인 논평] 이재명 대통령이... ",https://www.wikitree.co.kr/articles/1114460,https://www.wikitree.co.kr/articles/1114460,"Sat, 31 Jan 2026 11:18:00 +0900"
박성훈,"김민석, 총리 관저 지역구 행사 사용 논란 … 野 &quot;즉각 사퇴하라&quot;",박성훈 국민의힘 수석대변인은 이날 논평을 통해 &quot;김 총리는 정치적 입지를 다지기 위한 수단으로 총리 자리를 보존해서는 안 된다&quot;며 &quot;국민 앞에 책임지는 모습을 보여야 한다&quot;고 밝혔다. 박 수석대변인에 따르면 김 총리는... ,https://www.newdaily.co.kr/site/data/html/2026/01/31/2026013100027.html,https://www.newdaily.co.kr/site/data/html/2026/01/31/2026013100027.html,"Sat, 31 Jan 2026 11:16:00 +0900"
