Keyword,Title,Description,Original Link,Link,Publication Date
관료,이재명 대통령에 쓴소리 한인섭 &quot;검찰개혁 의지 실종…치명적 오류&quot;,"(윤석열 정부에서) 무조건 맹종ㆍ굴신했던 한덕수 이하 관료들은 그 대가를 치르고 있다&quot;며 &quot;국민이 따라야 할 의무는 없고, 공직자는 국민 설득하면서 국민 견해 경청해야 할 무한책무를 진다&quot;고 충고했다. 한인섭 서울대... ",http://www.lawleader.co.kr/news/articleView.html?idxno=18719,http://www.lawleader.co.kr/news/articleView.html?idxno=18719,"Mon, 16 Mar 2026 16:26:00 +0900"
관료,"경기도의회 황대호 위원장, 지방선거 불출마…한준호 지지선언","그러면서 &quot;한 의원은 이재명 정부의 가치와 철학을 이어갈 수 있는 적임자로 점점 젊어지는 도에 걸맞은 젊은 일꾼&quot;이라며 &quot;관료적이고 권위적인 도를 혁신하고, 도의 새로운 비전을 담기 위해선 한준호가 필요하다&quot;고... ",https://www.kihoilbo.co.kr/news/articleView.html?idxno=3016394,https://www.kihoilbo.co.kr/news/articleView.html?idxno=3016394,"Mon, 16 Mar 2026 16:02:00 +0900"
관료,이스라엘 &quot;작전 최소 3주 더&quot; 이란 &quot;협상은 없다&quot;… 17일째 공격 지속,"도널드 트럼프 미국 대통령과 행정부 주요 인사들이 '전쟁의 끝이 머지않았다'는 메시지를 발신하고 있지만, 실제로는 종전이 요원하다는 분석이 나왔다. 미국과 이란이 모두 제3국 중재를 뿌리치는 등 휴전 의향조차... ",https://www.hankookilbo.com/news/article/A2026031609510000516?did=NA,https://n.news.naver.com/mnews/article/469/0000919716?sid=104,"Mon, 16 Mar 2026 16:01:00 +0900"
관료,"부산교육감 선거, 김석준–최윤홍 '양자 구도' 가능성",교육행정 실무 경험이 풍부한 관료 출신이라는 점을 강점으로 내세우고 있다. 최근 여론조사에서는 보수 성향 후보군 가운데 상대적으로 높은 지지도를 보이며 존재감을 나타내고 있다. 내외경제TV가 여론조사기관... ,https://daily.hankooki.com/news/articleView.html?idxno=1347434,https://daily.hankooki.com/news/articleView.html?idxno=1347434,"Mon, 16 Mar 2026 15:52:00 +0900"
관료,국민의힘 “이재명 정권 '방탄 독재-민생 파탄-공소취소 거래 의혹 밝혀...,그러면서 그는 “임진왜란 당시 백성을 버린 관료들의 역사가 되풀이돼서는 안 된다”며 “민주주의 대원칙을 무너뜨리는 신독재의 망령을 반드시 막아내야 한다”... ,http://www.breaknews.com/1192134,http://www.breaknews.com/1192134,"Mon, 16 Mar 2026 15:48:00 +0900"
관료,[데이터 뉴스룸] 전자 업체 사외이사 영입 1순위로 '재계' 출신 60% 육박...,행정 등 관료 출신 중에는 하나마이크론에서 금융감독원 국장을 역임했던 윤승한 새시대 회계법인 심리위원장이 이번에 신규 사외이사 명단에 이름을 올렸다. 이녹스첨단소재도 금융감독원 금융투자검사 국장을... ,https://www.greened.kr/news/articleView.html?idxno=338069,https://www.greened.kr/news/articleView.html?idxno=338069,"Mon, 16 Mar 2026 15:48:00 +0900"
관료,&quot;지방선거 코앞인데 제도개혁은 실종?&quot;,"이들은 &quot;일당독점과 관료지배, 정경유착과 부정부패, 권력의 무책임과 도덕적 해이가 대구를 정체의 늪으로 밀어 넣었다&quot;며 ▲기초의회 3~5인 중대선거구제 전면 도입 ▲자치단체장 결선투표제 실시 ▲지방의회 연동형... ",https://www.ohmynews.com/NWS_Web/View/at_pg.aspx?CNTN_CD=A0003215340&CMPT_CD=P0010&utm_source=naver&utm_medium=newsearch&utm_campaign=naver_news,https://n.news.naver.com/mnews/article/047/0002508236?sid=102,"Mon, 16 Mar 2026 15:46:00 +0900"
관료,"황대호 위원장, 지방선거 불출마 선언… 민주 경기지사 경선 ‘한준호 ...","그러면서 한 의원을 지지하는 이유로 이재명 대통령과 국정철학을 공유하고 있다는 점, 경기도에 걸맞은 젊은 리더십, 관료적 도정을 혁신할 적임자라는 점 등을 꼽았다. 끝으로 “이 도전의 끝에는 대한민국의 새로운... ",https://www.kyeongin.com/article/1760307,https://www.kyeongin.com/article/1760307,"Mon, 16 Mar 2026 15:38:00 +0900"
관료,"오거돈·김영춘·전재수...민주당 부산시장 후보 공식, 또 '해수부 장관...","오 전 시장은 행정고시 출신 관료로 부산시 정무부시장과 행정부시장을 거쳐 해양수산부 장관을 지냈고... 해양 분야에서 잔뼈가 굵은 실무 관료 출신이라기보다 정치인 출신 장관에 가까웠지만, 해수부 장관 경력은... ",https://www.thepublic.kr/news/articleView.html?idxno=297533,https://www.thepublic.kr/news/articleView.html?idxno=297533,"Mon, 16 Mar 2026 15:34:00 +0900"
관료,"6·3부산시장 선거, PK 정치판 뒤흔들 최대 승부처",부산 지역 국회의원들과 일부 전직 관료 출신 인사들이 도전 가능성을 타진하는 것으로 알려졌다. 특히 PK 정치권에서는 “부산시장 선거는 단순한 지방선거가 아니라 전국 정치의 바로미터이다”라는 말이 나올 정도로... ,https://m.skyedaily.com/news_view.html?ID=300374,https://m.skyedaily.com/news_view.html?ID=300374,"Mon, 16 Mar 2026 15:34:00 +0900"
관료,"황대호 경기도의원, 수원시장 불출마 …한준호 경기지사 예비후보 지지",지지 이유로는 ▲이재명 정부의 가치와 철학을 이어갈 적임자라는 점 ▲IT·금융 등 민간 분야에서 폭넓은 경험을 갖춘 역동적인 리더십 ▲관료적 행정에서 벗어나 경기도 현안을 해결할 추진력을 갖춘 점 등을 꼽았다.... ,http://www.seoulwire.com/news/articleView.html?idxno=711501,http://www.seoulwire.com/news/articleView.html?idxno=711501,"Mon, 16 Mar 2026 15:32:00 +0900"
관료,서울교통공사 노조 &quot;알박기 인사 중단하라&quot;,또 서울시 고위 관료 출신인 김태균 전 부시장을 서울교통공사 사장으로 내정하고 인사청문위원회를 구성하는 것은 차기 시장의 인사권을 침해하는 무책임한 행정이라고 규탄했습니다. 서울교통공사 노조는 17일... ,http://news.lghellovision.net/news/articleView.html?idxno=537484,http://news.lghellovision.net/news/articleView.html?idxno=537484,"Mon, 16 Mar 2026 15:24:00 +0900"
관료,"장병길, 예산군수 출마 선언",오는 6·3 지방선거에서 충남 예산군수 선거에 도전하는 장병길 예비후보가 16일 공식 출마를 선언하며 &quot;관료 중심 행정을 성과 중심의 경영으로 바꾸겠다&quot;고 밝혔다. 장 예비후보는 이날 예산군청 브리핑룸에서 가진... ,https://www.joongdo.co.kr/web/view.php?key=20260316010005195,https://www.joongdo.co.kr/web/view.php?key=20260316010005195,"Mon, 16 Mar 2026 15:16:00 +0900"
관료,"장병길 예비후보, 예산군 'CEO' 자임","장 예비후보는 &quot;자신은 밑바닥부터 성장한 '진짜 예산 사람이자, 실전 경영 전문가'라며, 예산 군정을 관료적 행정에서 성과 중심의 경영으로 대전환시킬 것&quot;이라고 강조했다. 장 예비후보는 젊은 시절 삶의 밑 바닥인... ",https://www.jeonmae.co.kr/news/articleView.html?idxno=1238982,https://www.jeonmae.co.kr/news/articleView.html?idxno=1238982,"Mon, 16 Mar 2026 15:14:00 +0900"
관료,"황대호 도의회 문체위원장, 불출마 선언…한준호 지지 [영상]","아울러 황 위원장은 한 의원이 점점 젊어지는 경기도에 걸맞은 ‘젊은 일꾼’이라며, 관료적이고 권위적인 경기도를 혁신할 필요가 있다는 점을 해결 과제로 제시했다. 황 위원장은 “한준호 의원과 기쁜 마음으로... ",https://www.kyeonggi.com/article/20260316580335,https://n.news.naver.com/mnews/article/666/0000099365?sid=100,"Mon, 16 Mar 2026 15:12:00 +0900"
관료,"황대호 위원장, 지방의회 불출마··· 한준호 경기도지사 후보 지지 선...","이어 점점 젊어지는 경기도에 걸맞은 젊은 일꾼이 필요하다고 했고, 마지막으로 관료적이고 권위적인 도정을 바꿀 수 있는 추진력 있는 리더십이 필요하다고 강조했다. 특히 용인반도체산단, K컬처밸리, 서울양평고속도로... ",https://www.jeonmae.co.kr/news/articleView.html?idxno=1238964,https://www.jeonmae.co.kr/news/articleView.html?idxno=1238964,"Mon, 16 Mar 2026 14:44:00 +0900"
관료,"&quot;NST 공통행정 채용 반대&quot;… 과학계, '즉각 중단' 촉구",풍부한 관료들이 업무를 수행해 비용 절감과 기관장 전횡 견제가 동시에 가능하다”고 밝혔다. 또 노조는 이번 채용의 추진 배경에 NST 내부 임금 인상이 연관됐다는 의혹도 제기했다. 노조는 “NST가 충원 인력 채용... ,https://www.kukinews.com/article/view/kuk202603160134,https://www.kukinews.com/article/view/kuk202603160134,"Mon, 16 Mar 2026 14:40:00 +0900"
박수영,"국민의힘, 전재수 의원 공세 수위 높여","더 이상 구태정치는 없어져야 하고 선관위가 엄정히 조사해야 합니다.) 또 이성권 의원과 박수영, 김미애, 서지영 의원 등도 페이스북을 통해 문제를 제기하는 등 국민의힘은 일찌감치 공격적인 모습을 보이고 있습니다.... ",https://news.knn.co.kr/news/article/185048,https://news.knn.co.kr/news/article/185048,"Mon, 16 Mar 2026 17:34:00 +0900"
박수영,"합천군 대양면, 경상남도 동시 산불예방 캠페인 참여",박수영 대양면장은 “산불은 대부분 사람의 작은 부주의에서 시작되는 만큼 주민들의 관심과 협조가 무엇보다 중요하다”며 “앞으로도 지속적인 산불 예방 활동을 통해 소중한 산림과 주민의 안전을 지키는 데 최선을... ,https://www.siminilbo.co.kr/news/newsview.php?ncode=1160293675113682,https://www.siminilbo.co.kr/news/newsview.php?ncode=1160293675113682,"Mon, 16 Mar 2026 16:52:00 +0900"
박수영,"박수영 그랜드모먼트 유스호스텔 대표, 청소년지도사협의회장 취임",부산 그랜드모먼트 유스호스텔 박수영(사진) 운영대표가 사단법인 한국청소년지도사협의회 신임 회장으로 취임했다. 한국청소년지도사협의회는 지난 15일 경주시 화랑마을에서 열린 2026년 정기총회에서 박 대표를... ,https://www.kmib.co.kr/article/view.asp?arcid=0029535251&code=61122019&cp=nv,https://n.news.naver.com/mnews/article/005/0001837408?sid=102,"Mon, 16 Mar 2026 16:51:00 +0900"
박수영,박대조 예비후보 &quot;양산AI데이터센터 유치로 '시민이 행복한 50만 명품도...,건축사) ▲박수영 도시재생위원회부위원장(전문직 건축사) ▲정호진 대중문화예술위원장(한국연예예술인총연합회양산지회장) ▲박정선 조직총괄본부장 ▲김인수 소상공인권익위원장 ▲김무근 SNS홍보본부장 ▲이훈... ,https://www.nbntv.co.kr/news/articleView.html?idxno=4019860,https://www.nbntv.co.kr/news/articleView.html?idxno=4019860,"Mon, 16 Mar 2026 16:16:00 +0900"
박수영,"“주진우, 박형준 넘었다”… 부산시장 판 바뀌나",국민의힘 이헌승 의원과 박수영 의원은 “부산시장 후보는 경선을 통해 결정하는 것이 맞다&quot;는 취지의 입장을 밝힌 것으로 전해졌다. 주 의원 역시 경선을 요구하고 나섰다. 그는 이날 사회관계망서비스(SNS)에 “부산의... ,https://www.ekn.kr/web/view.php?key=20260316024528186,https://www.ekn.kr/web/view.php?key=20260316024528186,"Mon, 16 Mar 2026 16:14:00 +0900"
박수영,"합천 대양면, 산불예방 캠페인 펼쳐",박수영 대양면장은 &quot;산불은 대부분 사람의 작은 부주의에서 시작되는 만큼 주민들의 관심과 협조가 무엇보다 중요하다&quot;며 &quot;앞으로도 지속적인 산불 예방 활동을 통해 소중한 산림과 주민의 안전을 지키는 데 최선을... ,https://www.newsgn.com/news/articleView.html?idxno=540271,https://www.newsgn.com/news/articleView.html?idxno=540271,"Mon, 16 Mar 2026 15:34:00 +0900"
박수영,[주간 여의도] NAN-Index 당 지도부 상위권 굳건...10위권 절반은 '차기 ...,"293점, 44위 진성준 더불어민주당 290점, 45위 주철현 더불어민주당 287점, 46위 최보윤 국민의힘 283점, 47위 김상훈 국민의힘 277점, 48위 윤재옥 국민의힘 274점, 49위 최은석 국민의힘 267점, 50위 박수영 국민의힘 264점.",https://www.thefairnews.co.kr/news/articleView.html?idxno=71607,https://www.thefairnews.co.kr/news/articleView.html?idxno=71607,"Mon, 16 Mar 2026 15:30:00 +0900"
박수영,"한국청소년지도사협의회, 제4대 박수영 회장 취임","유스호스텔 박수영 운영대표(사진)가 취임했다. 임기는 2년이며, 오는 2028년까지 한국청소년지도사협의회를 이끌게 됐다. 박수영 회장은 동명대 한국어교육다문화학과 초빙교수, 부산광역시청소년지도사협회 부회장... ",https://www.viva100.com/article/20260316501063,https://www.viva100.com/article/20260316501063,"Mon, 16 Mar 2026 15:04:00 +0900"
박수영,"그랜드모먼트 유스호스텔 박수영 운영대표, 한국청소년지도사협의회 회...","유스호스텔 박수영 운영대표가 취임했다. 한국청소년지도사협의회는 지난 15일 오후 2시 경북 경주시 화랑마을에서 개최된 2026년 정기총회에서 박수영 운영대표의 4대 회장 선임을 의결했으며, 동시에 회장 취임식을... ",https://www.busan.com/view/busan/view.php?code=2026031608170028207,https://n.news.naver.com/mnews/article/082/0001371124?sid=102,"Mon, 16 Mar 2026 14:50:00 +0900"
박수영,"합천 대양면, 육아휴직 중 민원업무 처리 공무원 '화제'",박수영 대양면장은 &quot;우리 면에 지난번 인사로 인해 결원이 되어서 걱정하고 있는데 이선희 주무관이 휴직중임에도 스스로 와서 후배공무원들에게 친절하게 대해주고 민원업무를 잘 해주어서 감사하다&quot;고 전했다.,https://www.newsgn.com/news/articleView.html?idxno=540153,https://www.newsgn.com/news/articleView.html?idxno=540153,"Mon, 16 Mar 2026 14:26:00 +0900"
박수영,국힘 '박형준 컷오프·주진우 단수' 논의 파장…지역 의원들 &quot;경선해야...,이헌승·박수영 &quot;경선 필요&quot;…부산 의원 단톡방서도 경선 의견 주진우 &quot;단수공천 아닌 경선 원해... 국민의힘 이헌승 의원과 박수영 의원은 CBS와의 통화에서 &quot;부산시장 후보는 단수 공천보다는 경선을 통해 결정하는... ,https://www.nocutnews.co.kr/news/6485479?utm_source=naver&utm_medium=article&utm_campaign=20260316021542,https://n.news.naver.com/mnews/article/079/0004125207?sid=102,"Mon, 16 Mar 2026 14:16:00 +0900"
박수영,"박대조 양산시장 예비후보, AI데이터센터 유치 공약 발표",건축사) △박수영 도시재생위원회부위원장(전문직 건축사) △정호진 대중문화예술위원장(한국연예예술인총연합회양산지회장) △박정선 조직총괄본부장 △김인수 소상공인권익위원장 △김무근 SNS홍보본부장 △이훈... ,http://www.enewstoday.co.kr/news/articleView.html?idxno=2406236,http://www.enewstoday.co.kr/news/articleView.html?idxno=2406236,"Mon, 16 Mar 2026 13:00:00 +0900"
박수영,"박수영 그랜드모먼트 운영 대표, 한국청소년지도사협회장 취임",박수영 부산 그랜드모먼트 유스호스텔 운영 대표가 지난 15일 경주시에서 열린 2026년 한국청소년지도사협의회 정기총회에서 협의회 4대 회장에 취임했다. 임기는 2년이다. 부울경 청소년학 1호 박사인 박 회장은 동명대... ,https://www.hankookilbo.com/news/article/A2026031609260000833?did=NA,https://n.news.naver.com/mnews/article/469/0000919661?sid=102,"Mon, 16 Mar 2026 12:35:00 +0900"
박수영,여야 추경 공방…與 &quot;불확실성 대응&quot; 野 &quot;선거 포퓰리즘&quot;,국회 재정경제위원회 야당 간사인 박수영 의원도 페이스북에서 &quot;유동성이 넘치고 중동 사태가 원화 가치를 끌어내리는 상황에서 돈을 더 풀겠다는 것은 표퓰리즘&quot;이라며 &quot;이재명 정권의 방탕한 경제정책을 지방선거에서... ,https://www.m-i.kr/news/articleView.html?idxno=1346728,https://www.m-i.kr/news/articleView.html?idxno=1346728,"Mon, 16 Mar 2026 11:50:00 +0900"
박수영,"재경위, 조세소위 조세특례제한법 개정안 심사",박수영 재경위 조세소위 위원장이 16일 오전 서울 여의도 국회에서 열린 재정경제기획위원회 제1차... 16박수영 재경위 조세소위 위원장이 16일 오전 서울 여의도 국회에서 열린 재정경제기획위원회 제1차... ,http://www.hansbiz.co.kr/news/articleView.html?idxno=824469,http://www.hansbiz.co.kr/news/articleView.html?idxno=824469,"Mon, 16 Mar 2026 10:58:00 +0900"
박수영,한국청소년지도사협의회 4대 회장에 박수영 씨 선출,사단법인 한국청소년지도사협의회는 15일 경북 경주시 화랑마을에서 열린 2026년 한국청소년지도사협의회 정기총회에서 부산 그랜드모먼트 유스호스텔 박수영 운영대표(41·사진)를 제4대 회장으로 선임했다고 16일... ,https://www.donga.com/news/Society/article/all/20260316/133536624/1,https://n.news.naver.com/mnews/article/020/0003704307?sid=102,"Mon, 16 Mar 2026 10:51:00 +0900"
박수영,재경위 조세소위 안건 설명하는 박수영 위원장,국회 재정경제기획위원회 조세소위원회 위원장인 국민의힘 박수영 의원이 16일 국회에서 열린 조세소위에서 안건을 설명하고 있다. 2026.3.16,https://www.yna.co.kr/view/PYH20260316055300013?input=1196m,https://n.news.naver.com/mnews/article/001/0015961041?sid=100,"Mon, 16 Mar 2026 10:29:00 +0900"
박수영,재경위 조세소위 안건 설명하는 박수영 위원장,국회 재정경제기획위원회 조세소위원회 위원장인 국민의힘 박수영 의원이 16일 국회에서 열린 조세소위에서 안건을 설명하고 있다. 2026.3.16,https://www.yna.co.kr/view/PYH20260316055200013?input=1196m,https://n.news.naver.com/mnews/article/001/0015961040?sid=100,"Mon, 16 Mar 2026 10:29:00 +0900"
박수영,재경위 조세소위 안건 설명하는 박수영 위원장,국회 재정경제기획위원회 조세소위원회 위원장인 국민의힘 박수영 의원이 16일 국회에서 열린 조세소위에서 안건을 설명하고 있다. 2026.3.16,https://www.yna.co.kr/view/PYH20260316055100013?input=1196m,https://n.news.naver.com/mnews/article/001/0015961039?sid=100,"Mon, 16 Mar 2026 10:29:00 +0900"
박수영,재경위 조세소위 개회하는 박수영 위원장,국회 재정경제기획위원회 조세소위원회 위원장인 국민의힘 박수영 의원이 16일 국회에서 조세소위를 개회하고 있다. 2026.3.16,https://www.yna.co.kr/view/PYH20260316054900013?input=1196m,https://n.news.naver.com/mnews/article/001/0015961036?sid=100,"Mon, 16 Mar 2026 10:28:00 +0900"
박수영,"한국청소년지도사협의회, 제4대 회장에 박수영 취임",회장에 박수영 부산 그랜드모먼트 유스호스텔 운영대표가 취임했다. 한국청소년지도사협의회는 지난 15일 오후 2시 경북 경주시 화랑마을에서 2026년 정기총회를 열고 박수영 신임 회장 선임 안건을 의결한 데 이어... ,https://www.fntoday.co.kr/news/articleView.html?idxno=379903,https://www.fntoday.co.kr/news/articleView.html?idxno=379903,"Mon, 16 Mar 2026 10:28:00 +0900"
박수영,재경위 조세소위 안건 설명하는 박수영 위원장,국회 재정경제기획위원회 조세소위원회 위원장인 국민의힘 박수영 의원이 16일 국회에서 열린 조세소위에서 안건을 설명하고 있다. 2026.3.16,https://www.yna.co.kr/view/PYH20260316054800013?input=1196m,https://n.news.naver.com/mnews/article/001/0015961035?sid=100,"Mon, 16 Mar 2026 10:28:00 +0900"
박수영,재경위 조세소위 개회하는 박수영 위원장,국회 재정경제기획위원회 조세소위원회 위원장인 국민의힘 박수영 의원이 16일 국회에서 조세소위를 개회하고 있다. 2026.3.16,https://www.yna.co.kr/view/PYH20260316054700013?input=1196m,https://n.news.naver.com/mnews/article/001/0015961034?sid=100,"Mon, 16 Mar 2026 10:28:00 +0900"
박수영,국회 재정경제기획위원회 조세소위원회,박수영 재정경제기획위 조세소위 위원장이 16일 오전 서울 여의도 국회에서 열린 재정경제기획위원회 조세소위원회에서 의사봉을 두드리고 있다.2026.03.16. suncho21@newsis.com,https://www.newsis.com/view/NISI20260316_0021210036,https://n.news.naver.com/mnews/article/003/0013823928?sid=100,"Mon, 16 Mar 2026 10:24:00 +0900"
박수영,재정경제기획위 조세소위 참석하는 박수영 소위원장,박수영 재정경제기획위 조세소위 위원장이 16일 오전 서울 여의도 국회에서 열린 재정경제기획위원회 조세소위원회에서 참석하고 있다.2026.03.16. suncho21@newsis.com,https://www.newsis.com/view/NISI20260316_0021210039,https://n.news.naver.com/mnews/article/003/0013823938?sid=100,"Mon, 16 Mar 2026 10:24:00 +0900"
박수영,국회 재정경제기획위원회 조세소위원회,박수영 재정경제기획위 조세소위 위원장이 16일 오전 서울 여의도 국회에서 열린 재정경제기획위원회 조세소위원회에서 회의를 주재하고 있다.2026.03.16. suncho21@newsis.com,https://www.newsis.com/view/NISI20260316_0021210038,https://n.news.naver.com/mnews/article/003/0013823930?sid=100,"Mon, 16 Mar 2026 10:24:00 +0900"
박수영,조세소위원회 주재하는 박수영,박수영 소위원장이 16일 서울 여의도 국회에서 열린 재정경제기획위원회 조세소위원회에서 의사봉을 두드리고 있다. 2026.3.16/뉴스1,https://www.news1.kr/photos/7798382,https://n.news.naver.com/mnews/article/421/0008827850?sid=100,"Mon, 16 Mar 2026 10:23:00 +0900"
박수영,재정경제기획위원회 소위원회 주재하는 박수영,박수영 소위원장이 16일 서울 여의도 국회에서 열린 재정경제기획위원회 조세소위원회를 주재하고 있다. 2026.3.16/뉴스1,https://www.news1.kr/photos/7798380,https://n.news.naver.com/mnews/article/421/0008827848?sid=100,"Mon, 16 Mar 2026 10:23:00 +0900"
박수영,조세소위원회 주재하는 박수영,박수영 소위원장이 16일 서울 여의도 국회에서 열린 재정경제기획위원회 조세소위원회를 주재하고 있다. 2026.3.16/뉴스1,https://www.news1.kr/photos/7798381,https://n.news.naver.com/mnews/article/421/0008827849?sid=100,"Mon, 16 Mar 2026 10:23:00 +0900"
박수영,청소년지도사협의회 새 수장에 박수영 회장 취임,박수영 한국청소년지도사협의회 신임 회장.  사단법인 한국청소년지도사협의회의 신임 회장에 부울경 지역 청소년학 1호 박사인 박수영 부산 그랜드모먼트 유스호스텔 운영대표가 취임했다. 협의회는 15일 화랑마을에서... ,https://daily.hankooki.com/news/articleView.html?idxno=1347193,https://daily.hankooki.com/news/articleView.html?idxno=1347193,"Mon, 16 Mar 2026 10:18:00 +0900"
박성훈,"국민의힘, 전재수 의원 공세 수위 높여",(박성훈/국민의힘 수석대변인(3월 14일)/(전재수 의원이 부산시장으로) 만약 당선되더라도 언제든 유죄 판결을 받을 수 있어 시장직 박탈의 위험도 도사리고 있습니다.) 부산시장 출마를 선언한 국민의힘 주진우 의원은... ,https://news.knn.co.kr/news/article/185048,https://news.knn.co.kr/news/article/185048,"Mon, 16 Mar 2026 17:34:00 +0900"
박성훈,배수진 친 오세훈…잦아들지 않는 '장동혁 2선 후퇴론',박성훈 국민의힘 수석대변인은 이날 오전 국회에서 열린 최고위원회의를 마친 뒤 기자들과 만나 &quot;대표가... 박성훈 국민의힘 수석대변인은 &quot;보통 선대위는 공천이 끝난 후 구성되는 것으로 안다. 공천 후보자 결정도... ,https://www.sisajournal.com/news/articleView.html?idxno=365985,https://n.news.naver.com/mnews/article/586/0000124520?sid=100,"Mon, 16 Mar 2026 17:33:00 +0900"
박성훈,"[일요서울TV] 사회주의 혁명 조직, '사노맹' 주역이 OECD 대사?",박성훈 국민의힘 수석대변인이 13일 국회에서 기자회견을 열어 논평하고 있다. 2026.03.13 일요서울TV,https://www.ilyoseoul.co.kr/news/articleView.html?idxno=514211,https://www.ilyoseoul.co.kr/news/articleView.html?idxno=514211,"Mon, 16 Mar 2026 17:30:00 +0900"
박성훈,[일요서울TV] 시행 하루 만에 증명된 '사법 3법'의 실상,박성훈 국민의힘 수석대변인이 13일 국회에서 기자회견을 열어 논평하고 있다. 2026.03.13 일요서울TV,https://www.ilyoseoul.co.kr/news/articleView.html?idxno=514212,https://www.ilyoseoul.co.kr/news/articleView.html?idxno=514212,"Mon, 16 Mar 2026 17:30:00 +0900"
