Keyword,Title,Description,Original Link,Link,Publication Date
정성호,"정성호, 유튜브 채널 오픈...'스티브 잡수'부터 '에드워드 정'까지 다양...",'인간 복사기'로 불리며 완벽한 성대모사로 웃음을 사냥하는 개그맨 정성호가 유튜브로 활동 영역을 넓혔다. 최근 정성호는 유튜브 채널 '알바정'을 개설하고 '맞춤 캐릭터 인력 보내드립니다'라는 제목의 예고 영상 한 편을... ,https://www.mydaily.co.kr/page/view/2026031915085617064,https://m.entertain.naver.com/article/117/0004045310,"Thu, 19 Mar 2026 15:09:00 +0900"
정성호,"정성호, 유튜브 채널 '알바정' 개설…첫 타자 '스티브 잡수' 완벽 오마주","달인 정성호, IT 거물 스티브 잡스 완벽 오마주하여 '스티브 잡수'로 변신 - 첫 행보는 핸드폰 매장,&quot; 짠내 나는 신고식… 매주 목요일 저녁 7시 '알바정' 공개 성대모사의 달인이자 '인간 복사기'로 불리는 개그맨 정성호가... ",https://www.sportschosun.com/entertainment/2026-03-19/202603190100133370009240,https://m.entertain.naver.com/article/076/0004386326,"Thu, 19 Mar 2026 15:08:00 +0900"
정성호,출소자에게는 새로운 출발·중소기업에는 든든한 힘...법무부 '사천희망...,19일 오전 11시 법무부(장관 정성호)교정본부는 경남 사천시에서 지역사회 내 중간처우시설인 '사천희망센터... 정성호 법무부장관은 기념사에서 &quot;희망센터가 수형자의 안정적인 사회복귀를 지원하는 핵심 기반으로... ,https://www.ajunews.com/view/20260319145733314,https://www.ajunews.com/view/20260319145733314,"Thu, 19 Mar 2026 15:06:00 +0900"
정성호,출소 전 중소기업 취직해 기반 마련…사천희망센터 개관,정성호 법무부장관은 기념사에서 “희망센터가 수형자의 안정적인 사회복귀를 지원하는 핵심 기반으로 자리매김하고 있다”며 “앞으로도 지역사회 및 관계기관과의 긴밀한 협력을 통해 취업 연계형 중간처우 모델을... ,http://www.edaily.co.kr/news/newspath.asp?newsid=04204966645384960,https://n.news.naver.com/mnews/article/018/0006238732?sid=102,"Thu, 19 Mar 2026 14:53:00 +0900"
정성호,대화하는 정성호-이언주,정성호 법무부 장관과 이언주 더불어민주당 최고위원이 19일 오후 서울 여의도 국회에서 제433회국회(임시회) 제2차 본회의 개의를 앞두고 대화를 하고 있다. 2026.03.19. kgb@newsis.com,https://www.newsis.com/view/NISI20260319_0021214655,https://n.news.naver.com/mnews/article/003/0013832968?sid=100,"Thu, 19 Mar 2026 14:52:00 +0900"
정성호,대화하는 정성호-이언주,정성호 법무부 장관과 이언주 더불어민주당 최고위원이 19일 오후 서울 여의도 국회에서 제433회국회(임시회) 제2차 본회의 개의를 앞두고 대화를 하고 있다. 2026.03.19. kgb@newsis.com,https://www.newsis.com/view/NISI20260319_0021214657,https://n.news.naver.com/mnews/article/003/0013832967?sid=100,"Thu, 19 Mar 2026 14:52:00 +0900"
정성호,대화하는 정성호 법무부 장관과 이언주 최고위원,정성호 법무부 장관(오른쪽)과 더불어민주당 이언주 최고위원이 19일 국회 본회의장에서 3월 임시국회 2차 본회의 시작에 앞서 대화하고 있다. 2026.3.19,https://www.yna.co.kr/view/PYH20260319150000013?input=1196m,https://n.news.naver.com/mnews/article/001/0015969255?sid=100,"Thu, 19 Mar 2026 14:47:00 +0900"
정일영,"박찬대 &quot;정부와의 소통, 입법, 예산...이것이 나의 강점&quot; [굿모닝 인천-...",박남춘 전 시장님 또 우리 김교흥 선배님 또 정일영 우리 선배님 이분들은 공식적으로 표현을 하셨고 그 외에도 여러 인천의 선배 의원님들께서 박찬대가 나간다면 그러면 우리가 단일된 힘으로 승리를 이끌기 위해서... ,https://news.ifm.kr/news/articleView.html?idxno=467140,https://news.ifm.kr/news/articleView.html?idxno=467140,"Thu, 19 Mar 2026 13:32:00 +0900"
정일영,"'에펠탑 명물' 파코, 첫 韓 여행 베일 벗는다…'어서와' 관전 포인트 공...","프랑스에서 9년간 거주하며 프랑스의 역사와 문화를 꿰뚫고 있는 정일영 교수와 관광통역안내사 자격증을 취득하며 '한국 역사 전문가'로 거듭난 파비앙, 그리고 최근 결혼해 알콩달콩 신혼 생활을 즐기고 있는 새신랑... ",http://enews.imbc.com/News/RetrieveNewsInfo/498520,https://m.entertain.naver.com/article/408/0000302180,"Thu, 19 Mar 2026 09:20:00 +0900"
정일영,‘어서와 한국은 처음이지’ 관전 포인트,"프랑스에서 9년간 거주하며 프랑스의 역사와 문화를 꿰뚫고 있는 정일영 교수와 관광통역안내사 자격증을 취득하며 '한국 역사 전문가'로 거듭난 파비앙, 그리고 최근 결혼해 알콩달콩 신혼 생활을 즐기고 있는 새신랑... ",https://www.bntnews.co.kr/article/view/bnt202603190078,https://www.bntnews.co.kr/article/view/bnt202603190078,"Thu, 19 Mar 2026 08:48:00 +0900"
정일영,'어서와 한국은 처음이지?' 파리 3인방과 프랑스 전문가 합류로 재정비...,"프랑스에서 9년간 거주하며 현지 역사와 문화를 공부해온 정일영 교수가 합류해 파코 일행의 배경과 행동을 프랑스 사회 맥락 속에서 짚어주고, 관광통역안내사 자격증을 취득한 파비앙은 '한국 역사 전문가'로서 한국에... ",https://www.topstarnews.net/news/articleView.html?idxno=16009009,https://www.topstarnews.net/news/articleView.html?idxno=16009009,"Thu, 19 Mar 2026 08:44:00 +0900"
정일영,"[단독]&quot;혼인신고 후 손해?&quot;…정부, 지자체 '결혼 페널티' 전수조사",실제로 정일영 더불어민주당 의원실이 국가데이터처에서 받은 자료에 따르면 결혼 후 혼인신고를 1년 넘게 미루는 부부의 비율은 2014년 10.9%에서 2024년 19.0%로 10년 새 1.7배 증가했다. 정부도 결혼 페널티 문제를 심각하게... ,https://www.newsis.com/view/NISX20260318_0003554010,https://n.news.naver.com/mnews/article/003/0013831260?sid=100,"Thu, 19 Mar 2026 06:30:00 +0900"
조승래,한정애-조승래와 논의 중인 정청래 대표,"정청래 더불어민주당 대표가 19일 오후 서울 여의도 국회 의원회관에서 열린 의원총회에서 한정애 정책위의장, 조승래 사무총장과 대화를 하고 있다. 2026.03.19 jk31@newspim.com",https://www.newspim.com/news/view/20260319001004,https://www.newspim.com/news/view/20260319001004,"Thu, 19 Mar 2026 15:41:00 +0900"
조승래,대화하는 정청래-조승래,정청래 더불어민주당 대표와 조승래 사무총장이 19일 오후 서울 여의도 국회 의원회관에서 열린 의원총회에서 대화를 하고 있다. 2026.03.19 jk31@newspim.com,https://www.newspim.com/news/view/20260319001003,https://www.newspim.com/news/view/20260319001003,"Thu, 19 Mar 2026 15:41:00 +0900"
조승래,의총에서 대화 나누는 정청래 대표와 조승래 사무총장 [포토],정청래 더불어민주당 대표(왼쪽)와 조승래 사무총장이 19일 오후 서울 여의도 국회에서 열린 의원총회에서 대화를 나누고 있다. 사진영상기획부,https://news.tf.co.kr/read/photomovie/2304054.htm,https://n.news.naver.com/mnews/article/629/0000483140?sid=100,"Thu, 19 Mar 2026 14:46:00 +0900"
조승래,대화하는 정청래 대표와 조승래 사무총장,더불어민주당 정청래 대표와 조승래 사무총장이 19일 본회의를 앞두고 국회에서 열린 의원총회에서 대화하고 있다. 2026.3.19,https://www.yna.co.kr/view/PYH20260319145400013?input=1196m,https://n.news.naver.com/mnews/article/001/0015969250?sid=100,"Thu, 19 Mar 2026 14:46:00 +0900"
조승래,대화하는 정청래 대표,"정청래 더불어민주당 대표가 19일 서울 여의도 국회에서 열린 의원총회에서 한정애 정책위의장, 조승래 사무총장과 대화하고 있다. 2026.3.19/뉴스1",https://www.news1.kr/photos/7806030,https://n.news.naver.com/mnews/article/421/0008836292?sid=100,"Thu, 19 Mar 2026 14:27:00 +0900"
조승래,대화하는 정청래 대표-조승래 사무총장,더불어민주당 정청래 대표와 조승래 사무총장이 19일 서울 여의도 국회에서 열린 의원총회에서 대화를 하고 있다.,https://www.nocutnews.co.kr/news/6487696?utm_source=naver&utm_medium=article&utm_campaign=20260319022618,https://n.news.naver.com/mnews/article/079/0004126742?sid=100,"Thu, 19 Mar 2026 14:27:00 +0900"
조승래,조승래 시인의 시통공간(詩通空間).541 - 김연종,"◇ 조승래 시인은 한국타이어 상무이사, 단국대학교 상경대 겸임교수(경영학박사)를 했고, 한국문인협회, 한국시인협회 이사, 계간문예작가회 부회장으로 활동 중이다. 또한 시향문학회와 시와시학 문인회 전임 회장이다.",https://www.newsgn.com/news/articleView.html?idxno=541006,https://www.newsgn.com/news/articleView.html?idxno=541006,"Thu, 19 Mar 2026 11:16:00 +0900"
조승래,김부겸 &quot;다음주 대구시장 출마 입장 발표&quot;,"최근 더불어민주당 조승래 사무총장이 김 전 총리를 만나 대구시장 출마를 설득했고, 김 전 총리는 당에 '지역 발전을 위한 플랜'을 마련해줄 것을 요구한 것으로 전해졌습니다. 국민의힘에서 중진 '컷오프' 논란으로... ",http://www.yonhapnewstv.co.kr/MYH20260319055917sAT,https://n.news.naver.com/mnews/article/422/0000845612?sid=100,"Thu, 19 Mar 2026 06:00:00 +0900"
조승래,[단독] 與는 ‘경선 감산 규정’ 둘러싸고 ‘잡음’,18일 국민일보 취재에 따르면 제주지사 경선에 나선 문대림 민주당 의원은 지난달 27일과 이달 5일 두 차례에 걸쳐 ‘감산 예외 적용 요청’ 공문을 조승래 사무총장에게 보냈다. 이어 6일에는 해당 사안을 최고위원회... ,https://www.kmib.co.kr/article/view.asp?arcid=1773818793&code=11121100&cp=nv,https://n.news.naver.com/mnews/article/005/0001837922?sid=100,"Wed, 18 Mar 2026 19:08:00 +0900"
조승래,충청 송전선로 건설에 정치권 움직임 확산… 국회의원 합세,조승래 의원(대전 유성 갑)도 최근 유성구 주민 간담회에 참석한 한전 측에 &quot;최적 경유지 선정 시 지역간의 소통과 갈등 해소를 우선적으로 고려해달라&quot;고 입장을 전한 것으로 알려졌다. 또 일각에서 제기된... ,https://www.daejonilbo.com/news/articleView.html?idxno=2263613,https://n.news.naver.com/mnews/article/656/0000171061?sid=100,"Wed, 18 Mar 2026 19:00:00 +0900"
조승래,김부겸 전 총리 &quot;다음주 대구시장 출마 입장 발표&quot;,"최근 더불어민주당 조승래 사무총장이 김부겸 전 총리를 만나 대구시장 출마를 설득했고, 김 전 총리는 당에 '지역 발전을 위한 플랜'을 마련해줄 것을 요구한 것으로 전해졌습니다. 대구·경북 행정통합이 사실상 무산된... ",http://www.yonhapnewstv.co.kr/AKR20260318182529Erh,https://n.news.naver.com/mnews/article/422/0000845496?sid=100,"Wed, 18 Mar 2026 18:26:00 +0900"
조승래,민주당 진주서 최고위원회의…서부경남 표심 공략 나서,"이날 회의는 정청래 대표, 한병도 원내대표, 이언주 수석최고위원, 황명선·강득구·이성윤·문정복·박지원·박규환 최고위원, 조승래 사무총장, 한정애 정책위원회 의장, 이재영 민주연구원장, 이연희 전략기획위원장 등... ",http://www.gndomin.com/news/articleView.html?idxno=468940,http://www.gndomin.com/news/articleView.html?idxno=468940,"Wed, 18 Mar 2026 18:05:00 +0900"
조승래,"민주당, 진주에서 현장 최고위원회 회의 개최","이날 회의에는 이언주 수석최고위원, 황명선·강득구·이성윤·문정복·박지원·박규환 최고위원, 조승래 사무총장, 한정애 정책위원회 의장, 이재영 민주연구원장, 이연희 전략기획위원장, 최기상 수석사무부총장, 권향엽... ",https://daily.hankooki.com/news/articleView.html?idxno=1348679,https://daily.hankooki.com/news/articleView.html?idxno=1348679,"Wed, 18 Mar 2026 17:36:00 +0900"
조승래,"더불어민주당, 진주서 최고위원회의…&quot;첨단산업 중심 경남 새출발 지원...","이날 회의에는 정청래 당대표, 한병도 원내대표, 이언주 수석최고위원, 황명선·강득구·이성윤·문정복·박지원·박규환 최고위원, 조승래 사무총장, 한정애 정책위원회 의장, 이재영 민주연구원장, 이연희 전략기획위원장... ",http://www.enewstoday.co.kr/news/articleView.html?idxno=2407659,http://www.enewstoday.co.kr/news/articleView.html?idxno=2407659,"Wed, 18 Mar 2026 17:00:00 +0900"
조승래,"민주당, 경남 진주서 현장 최고위원회의…&quot;지역 발전 당 차원 지원&quot;","이날 회의에는 정청래 당대표, 한병도 원내대표, 이언주 수석최고위원, 황명선·강득구·이성윤·문정복·박지원·박규환 최고위원, 조승래 사무총장, 한정애 정책위원회 의장, 이재영 민주연구원장, 이연희 전략기획위원장... ",https://news.tf.co.kr/read/national/2303646.htm,https://n.news.naver.com/mnews/article/629/0000482759?sid=102,"Wed, 18 Mar 2026 16:03:00 +0900"
조승래,"더불어민주당, 서부경남의 중심 진주에서 '현장 최고위원회의' 개최","이날 오후 MBC컨벤션 진주에서 열린 회의에는 정청래 당대표, 한병도 원내대표, 이언주 수석최고위원, 황명선·강득구·이성윤·문정복·박지원·박규환 최고위원, 조승래 사무총장, 한정애 정책위원회 의장, 이재영... ",https://www.gukjenews.com/news/articleView.html?idxno=3532733,https://www.gukjenews.com/news/articleView.html?idxno=3532733,"Wed, 18 Mar 2026 15:22:00 +0900"
조승래,"더불어민주당, “민생 회복과 경남 대전환, 중앙당이 함께 책임진다”","이날 회의에는 정청래 당대표, 한병도 원내대표, 이언주 수석최고위원, 황명선·강득구·이성윤·문정복·박지원·박규환 최고위원, 조승래 사무총장, 한정애 정책위원회 의장, 이재영 민주연구원장, 이연희 전략기획위원장... ",https://www.betanews.net/article/view/beta202603180069,https://www.betanews.net/article/view/beta202603180069,"Wed, 18 Mar 2026 15:20:00 +0900"
조승래,김경수 &quot;서부경남 KTX 조기완공&quot;…민주당 진주서 최고위,"한편, 이날 회의에는 정청래 당대표, 한병도 원내대표, 이언주 수석최고위원, 황명선·강득구·이성윤·문정복·박지원·박규환 최고위원, 조승래 사무총장, 한정애 정책위원회 의장, 이재영 민주연구원장, 이연희... ",https://www.newsis.com/view/NISX20260318_0003553744,https://n.news.naver.com/mnews/article/003/0013830287?sid=102,"Wed, 18 Mar 2026 15:13:00 +0900"
조승래,"'보수 심장' 대구 흔들리나…민주당, 지지율 약진 속 김부겸 '결단 임박...","당초 불출마 기조였지만, 대구 지역의 민주당 지지율 상승과 조승래 사무총장 등 당 지도부의 이른바 '삼고초려'가 마음을 돌린 결정적 계기가 된 것으로 전해집니다. 관계자는 김 전 총리가 주소지 이전 시한을 고려해... ",https://news.jtbc.co.kr/article/NB12290185?influxDiv=NAVER,https://n.news.naver.com/mnews/article/437/0000483446?sid=162,"Wed, 18 Mar 2026 14:27:00 +0900"
진성준,"진교훈 강서구청장, “어울림플라자 우리 동네 명소로”","이날 개관식에는 진교훈 강서구청장을 비롯해 오세훈 서울시장, 강서에 지역구를 둔 한정애, 진성준 국회의원 등 주요 인사와 장애인, 비장애인 160여 명이 참석했다. 진 구청장은 축사를 통해 “어울림플라자가 문을... ",https://www.siminilbo.co.kr/news/newsview.php?ncode=1160289849982300,https://www.siminilbo.co.kr/news/newsview.php?ncode=1160289849982300,"Thu, 19 Mar 2026 16:36:00 +0900"
진성준,[단독]'석유 최고가격제' 정유업계 손실 방안 정부 추경에 담는다,진성준 국회 예산결산특별위원회 위원장은 19일 아시아경제와 통화에서 &quot;최고가격제를 실시하면 손실이 발생한 경우 보전하도록 법적으로 돼 있다&quot;면서 &quot;추경에 이를 반영해야 한다고 생각한다&quot;고 말했다. 석유 및... ,https://view.asiae.co.kr/article/2026031914124848786,https://n.news.naver.com/mnews/article/277/0005736978?sid=101,"Thu, 19 Mar 2026 14:12:00 +0900"
진성준,"진성준 위원장, 석유화학 업계 간담회 발언",진성준 국회 예산결산특별위원장이 19일 오전 서울 여의도 국회 의원회관에서 열린 유가급등에 따른 대책 마련을 위한 석유화학 업계 간담회에서 발언을 하고 있다. 2026.03.19 jk31@newspim.com,https://www.newspim.com/news/view/20260319000768,https://www.newspim.com/news/view/20260319000768,"Thu, 19 Mar 2026 13:47:00 +0900"
진성준,석유화학 업계 간담회서 발언하는 진성준 예결위원장,진성준 국회 예산결산특별위원장이 19일 오전 서울 여의도 국회 의원회관에서 열린 유가급등에 따른 대책 마련을 위한 석유화학 업계 간담회에서 발언을 하고 있다. 2026.03.19 jk31@newspim.com,https://www.newspim.com/news/view/20260319000767,https://www.newspim.com/news/view/20260319000767,"Thu, 19 Mar 2026 13:46:00 +0900"
진성준,유가 유가 급등에 따른 대책 마련을 위한 석유화학 대기업 공개간담회,민병덕 더불어민주당 을지로위원장과 진성준 국회 예산결산특별위원장 등이 19일 오전 서울 여의도 국회에서 열린 유가 급등에 따른 대책 마련을 위한 석유화학 대기업 공개간담회에서 업계 관계자들의... ,https://www.newsis.com/view/NISI20260319_0021214267,https://n.news.naver.com/mnews/article/003/0013832338?sid=100,"Thu, 19 Mar 2026 11:58:00 +0900"
진성준,발언하는 민병덕 을지로위원장,민병덕 더불어민주당 을지로위원장이 19일 오전 서울 여의도 국회에서 열린 유가 급등에 따른 대책 마련을 위한 석유화학 대기업 공개간담회에서 발언을 하고 있다.왼쪽은 진성준 예산결산특별위원장.... ,https://www.newsis.com/view/NISI20260319_0021214261,https://n.news.naver.com/mnews/article/003/0013832330?sid=100,"Thu, 19 Mar 2026 11:51:00 +0900"
진성준,발언하는 진성준 국회 예결위원장,진성준 국회 예산결산특별위원장이 19일 오전 서울 여의도 국회에서 열린 유가 급등에 따른 대책 마련을 위한 석유화학 대기업 공개간담회에서 발언을 하고 있다. 2026.03.19. suncho21@newsis.com,https://www.newsis.com/view/NISI20260319_0021214255,https://n.news.naver.com/mnews/article/003/0013832329?sid=100,"Thu, 19 Mar 2026 11:51:00 +0900"
진성준,발언하는 진성준 국회 예결위원장,진성준 국회 예산결산특별위원장이 19일 오전 서울 여의도 국회에서 열린 유가 급등에 따른 대책 마련을 위한 석유화학 대기업 공개간담회에서 발언을 하고 있다. 2026.03.19. suncho21@newsis.com,https://www.newsis.com/view/NISI20260319_0021214257,https://n.news.naver.com/mnews/article/003/0013832325?sid=100,"Thu, 19 Mar 2026 11:51:00 +0900"
진성준,유가 급등에 따른 대책 마련을 위한 석유화학 대기업 공개간담회,진성준 국회 예산결산특별위원장이 19일 오전 서울 여의도 국회에서 열린 유가 급등에 따른 대책 마련을 위한 석유화학 대기업 공개간담회에서 발언을 하고 있다. 2026.03.19. suncho21@newsis.com,https://www.newsis.com/view/NISI20260319_0021214256,https://n.news.naver.com/mnews/article/003/0013832322?sid=100,"Thu, 19 Mar 2026 11:51:00 +0900"
진성준,발언하는 진성준 예결위원장,더불어민주당 소속 진성준 국회 예산결산특별위원장이 19일 서울 여의도 국회 의원회관에서 열린 유가급등에 따른 대책 마련을 위한 석유화학 업계 간담회에서 발언을 하고 있다. ※CBS노컷뉴스는 여러분의... ,https://www.nocutnews.co.kr/news/6487601?utm_source=naver&utm_medium=article&utm_campaign=20260319114616,https://n.news.naver.com/mnews/article/079/0004126675?sid=100,"Thu, 19 Mar 2026 11:47:00 +0900"
진성준,"석유화학 업계와 간담회, 발언하는 진성준 예결위원장",더불어민주당 소속 진성준 국회 예산결산특별위원장이 19일 서울 여의도 국회 의원회관에서 열린 유가급등에 따른 대책 마련을 위한 석유화학 업계 간담회에서 발언을 하고 있다. ※CBS노컷뉴스는 여러분의... ,https://www.nocutnews.co.kr/news/6487602?utm_source=naver&utm_medium=article&utm_campaign=20260319114616,https://n.news.naver.com/mnews/article/079/0004126676?sid=100,"Thu, 19 Mar 2026 11:47:00 +0900"
진성준,더불어민주당 을지로위원회가 연 석유화학 업계 간담회,국회 예산결산특별위원장인 더불어민주당 진성준 의원이 19일 국회의원회관에서 민주당 을지로위원회가 연 석유화학 업계 간담회에 참석해 발언하고 있다. 2026.3.19,https://www.yna.co.kr/view/PYH20260319091700013?input=1196m,https://n.news.naver.com/mnews/article/001/0015968608?sid=100,"Thu, 19 Mar 2026 11:41:00 +0900"
진성준,석유화학 업계 간담회서 발언하는 진성준 예결위원장,국회 예산결산특별위원장인 더불어민주당 진성준 의원이 19일 국회의원회관에서 민주당 을지로위원회가 연 석유화학 업계 간담회에 참석해 발언하고 있다. 오른쪽은 민주당 을지로위원장인 민병덕 의원. 2026.3.19,https://www.yna.co.kr/view/PYH20260319091500013?input=1196m,https://n.news.naver.com/mnews/article/001/0015968604?sid=100,"Thu, 19 Mar 2026 11:41:00 +0900"
진성준,석유화학 업계 간담회서 발언하는 진성준 예결위원장,국회 예산결산특별위원장인 더불어민주당 진성준 의원이 19일 국회의원회관에서 민주당 을지로위원회가 연 석유화학 업계 간담회에 참석해 발언하고 있다. 2026.3.19,https://www.yna.co.kr/view/PYH20260319091400013?input=1196m,https://n.news.naver.com/mnews/article/001/0015968603?sid=100,"Thu, 19 Mar 2026 11:41:00 +0900"
진성준,"[포토]을지로위원회, '유가 급등에 따른 대책 마련을 위한 석유화학 업...",19일 서울 여의도 국회 의원회관에서 더불어민주당 을지로위원회 주최로 유가 급등에 따른 대책 마련을 위한 석유화학 업계 간담회가 열렸다. 진성준 국회 예산결산특별위원장이 발언을 하고 있다.,http://www.edaily.co.kr/news/newspath.asp?newsid=03696566645384960,https://n.news.naver.com/mnews/article/018/0006238592?sid=100,"Thu, 19 Mar 2026 11:36:00 +0900"
진성준,"진교훈 강서구청장, “어울림플라자 우리 동네 명소로”... 어울림프라...","이날 개관식에는 진교훈 강서구청장을 비롯해 오세훈 서울시장, 강서에 지역구를 둔 한정애, 진성준 국회의원 등 주요 인사와 장애인, 비장애인 160여 명이 참석했다. 진 구청장은 축사를 통해 “어울림플라자가 문을... ",https://www.geconomy.co.kr/news/article.html?no=317719,https://www.geconomy.co.kr/news/article.html?no=317719,"Thu, 19 Mar 2026 09:20:00 +0900"
진성준,"진교훈 강서구청장, “어울림플라자 우리 동네 명소로”","이날 개관식에는 진교훈 강서구청장을 비롯해 오세훈 서울시장, 강서에 지역구를 둔 한정애, 진성준 국회의원 등 주요 인사와 장애인, 비장애인 160여 명이 참석했다. 진 구청장은 축사를 통해 “어울림플라자가 문을... ",https://www.munhwa.com/article/11575665?ref=naver,https://n.news.naver.com/mnews/article/021/0002778246?sid=102,"Thu, 19 Mar 2026 09:00:00 +0900"
진성준,[PICK! 이 안건] 이기헌 등 10인 &quot;예술인권리침해행위 발생사실 인지한 ...,"더불어민주당 이기헌, 진성준, 임오경, 박해철, 박지원, 김남근, 김교흥, 고민정, 장철민, 조국혁신당 정춘생 의원이다. 한편 해당 안건은 국회입법예고 홈페이지에서 해당 안건 검색 후 의견을 작성할 수 있다.",https://www.jeonmae.co.kr/news/articleView.html?idxno=1239568,https://www.jeonmae.co.kr/news/articleView.html?idxno=1239568,"Thu, 19 Mar 2026 09:00:00 +0900"
진성준,무장애 복지·문화 복합공간 ‘서울시 어울림플라자’ 개관,"이날 개관식에는 진교훈 강서구청장을 비롯해 오세훈 서울시장, 강서에 지역구를 둔 한정애, 진성준 국회의원 등 주요 인사와 장애인, 비장애인 160여 명이 참석했다. 진 구청장은 축사를 통해 “어울림플라자가 문을... ",https://biz.heraldcorp.com/article/10697516?ref=naver,https://n.news.naver.com/mnews/article/016/0002615866?sid=102,"Wed, 18 Mar 2026 22:11:00 +0900"
진성준,"진교훈 강서구청장, “어울림플라자 우리 동네 명소로”","이날 개관식에는 진교훈 강서구청장을 비롯해 오세훈 서울시장, 강서에 지역구를 둔 한정애, 진성준 국회의원 등 주요 인사와 장애인, 비장애인 160여 명이 참석했다. 진 구청장은 축사를 통해 “어울림플라자가 문을... ",https://weekly.cnbnews.com/news/article.html?no=209192,https://weekly.cnbnews.com/news/article.html?no=209192,"Wed, 18 Mar 2026 21:24:00 +0900"
