Keyword,Title,Description,Original Link,Link,Publication Date
권영세,"[현장] 국민의힘 '북미 대화 가능성' 점검, &quot;이란 사태 직후 4월 만남은...",당내 중진인 권영세 국민의힘 의원이 주최를 맡았고 북한 외교관 출신인 태영호 전 국민의힘 의원... 존경하는 권영세 의원님께서 주신 이 주제에 대해서도 미국 조야의 전문가들과 상하원 의원들을 만나 꼭 질문하고 의미... ,https://www.businesspost.co.kr/BP?command=article_view&num=431862,https://www.businesspost.co.kr/BP?command=article_view&num=431862,"Wed, 04 Mar 2026 17:50:00 +0900"
차규근,'쉬었음 청년' 70만 명… '달빛조각사' 현실판 '쌀팔이 청년' 뜬다,지난해 10월 차규근 조국혁신당 의원이 국세청으로부터 제출받은 자료에 따르면 '게임 아이템 중개 플랫폼'을 거친 최근 5년간 게임 아이템 거래 규모는 3조 원 이상으로 드러났다. 아이템 거래 플랫폼 아이템매니아도... ,https://www.ilyoseoul.co.kr/news/articleView.html?idxno=513652,https://www.ilyoseoul.co.kr/news/articleView.html?idxno=513652,"Thu, 05 Mar 2026 09:26:00 +0900"
차규근,대미투자특별법 12일 본회의 처리…국힘 “국익 차원 합의”,"특위 여당 간사인 정태호 민주당 의원이 법안소위 위원장을 맡고, 민주당 박지혜·허영 의원, 국민의힘 박수영·박상웅·강승규 의원, 조국혁신당 차규근 의원 등이 소위 위원으로 참여했다. 소위는 이날 오후 회의를 열어... ",https://www.joongang.co.kr/article/25409211,https://n.news.naver.com/mnews/article/025/0003506867?sid=100,"Thu, 05 Mar 2026 00:01:00 +0900"
차규근,"여야, 대미투자특별법 12일 본회의 처리 합의…&quot;대승적 결정&quot;","특위 여당 간사인 민주당 정태호 의원이 소위원장을 맡고 민주당 박지혜·허영 의원, 국민의힘 박수영·박상웅·강승규 의원, 조국혁신당 차규근 의원 등이 위원으로 참여했다. 회의에서 민주당 정진욱 의원은 구윤철... ",https://www.ulsanpress.net/news/articleView.html?idxno=570294,https://www.ulsanpress.net/news/articleView.html?idxno=570294,"Wed, 04 Mar 2026 21:43:00 +0900"
차규근,"여야, 대미투자법 12일 본회의 처리 합의","소위원장은 특위 여당 간사인 정태호 민주당 의원이 맡았다. 박지혜·허영 민주당 의원과 강승규·박상웅·박수영 국민의힘 의원, 차규근 조국혁신당 의원이 소위 위원으로 참여했다.",https://www.khan.co.kr/article/202603042023005,https://n.news.naver.com/mnews/article/032/0003431215?sid=100,"Wed, 04 Mar 2026 20:23:00 +0900"
차규근,"여야 대미투자특별법안 12일 본회의 처리하기로 합의, 9일까지 단일안 ...","박지혜·허영 더불어민주당 의원과 박수영·박상웅·강승규 국민의힘 의원, 차규근 조국혁신당 의원 등은 위원으로 참여한다. 법안심사소위원회는 앞으로 투자공사 신규 설립 여부, 국회 보고 및 동의 방법, 대미 투자 위험... ",https://www.businesspost.co.kr/BP?command=article_view&num=431885,https://www.businesspost.co.kr/BP?command=article_view&num=431885,"Wed, 04 Mar 2026 19:40:00 +0900"
차규근,"여야, 대미투자특별법 12일 처리 합의 &quot;국익 차원&quot;","민주당 박지혜·허영 의원, 국민의힘 박수영·박상웅·강승규 의원, 조국혁신당 차규근 의원 등이 소위 위원으로 참여한다. 소위에서는 별도 투자공사 설립 여부를 비롯한 국회 통제 정도, 정보 공개 범위, 투자 리스크 관리... ",https://www.iusm.co.kr/news/articleView.html?idxno=1060258,https://www.iusm.co.kr/news/articleView.html?idxno=1060258,"Wed, 04 Mar 2026 19:16:00 +0900"
차규근,[기자수첩] 반복되는 산림정책 논쟁 끝내려면,지난달 10일 국회 본회의 경제 분야 대정부질문에서 차규근 조국혁신당(비례) 의원은 김민석 국무총리에게 &quot;막대한 예산이 투입되는 산림정책을 둘러싸고 전문가 간 불신과 갈등이 이어지고 있다&quot;며 총리실 산하 민·관 합동... ,https://www.agrinet.co.kr/news/articleView.html?idxno=402216,https://www.agrinet.co.kr/news/articleView.html?idxno=402216,"Wed, 04 Mar 2026 18:28:00 +0900"
차규근,"여야, 대미특별법 12일 본회의 처리키로…특위 &quot;상당 부분 합의&quot;(종합2보...","비교섭단체 위원 몫은 차규근 조국혁신당 의원이 맡기로 했다. 특위는 당초 지난달 24일 법안 상정과 소위 구성 건을 처리하려고 했으나, 야당이 여당 주도의 '사법개혁 3법'에 반발해 상임위 보이콧 방침을 세우면서 일정이... ",https://www.news1.kr/politics/assembly/6090432,https://n.news.naver.com/mnews/article/421/0008806789?sid=100,"Wed, 04 Mar 2026 18:21:00 +0900"
차규근,대미투자법 12일 본회의 처리 합의…野 &quot;대승적 결정&quot;,"특위 여당 간사인 정태호 민주당 의원이 법안소위 위원장을 맡고, 민주당 박지혜·허영 의원, 국민의힘 박수영·박상웅·강승규 의원, 조국혁신당 차규근 의원 등이 소위 위원으로 참여한다. 소위는 이날 오후 회의를 열어... ",https://www.joongang.co.kr/article/25409170,https://n.news.naver.com/mnews/article/025/0003506829?sid=100,"Wed, 04 Mar 2026 18:11:00 +0900"
차규근,"여야, 대미특위 재가동…투자공사 설립·국회 동의 범위 두고 이견",법안소위는 정태호 민주당 의원이 위원장을 맡고 허영·박지혜·박수영·강명구·박상웅·차규근 의원 등이 참여한다. 특위는 이날을 시작으로 활동 기한인 9일 오전까지 세 차례 회의를 진행한 뒤 같은 날 오후... ,https://www.kukinews.com/article/view/kuk202603040214,https://www.kukinews.com/article/view/kuk202603040214,"Wed, 04 Mar 2026 17:32:00 +0900"
차규근,"여야, 대미투자특별법 처리 합의…&quot;국익 위한 결정&quot;","여당 특위 간사를 맡고있는 정태호 민주당 의원은 소위원장에 선임됐고, 박지혜·허영 더불어민주당 의원, 박수영·강승규·박상웅 국민의힘 의원, 비교섭단체 몫으로는 차규근 조국혁신당 의원이 활동한다. 여야는... ",http://www.shinailbo.co.kr/news/articleView.html?idxno=2198479,http://www.shinailbo.co.kr/news/articleView.html?idxno=2198479,"Wed, 04 Mar 2026 17:16:00 +0900"
차규근,"여야, 대미투자법 합의…&quot;이달 12일 처리&quot;","이밖에 박지혜·허영 더불어민주당 의원이 참여하고 국민의힘에서는 박수영·박상웅·강승규 의원이, 조국혁신당의 차규근 의원이 소위 위원으로 참여한다. 소위에서는 별도 투자공사 설립 여부와 국회 통제 정도 등을... ",http://www.wowtv.co.kr/NewsCenter/News/Read?articleId=A202603040457&t=NN,https://n.news.naver.com/mnews/article/215/0001243881?sid=100,"Wed, 04 Mar 2026 17:03:00 +0900"
차규근,"파행 넘은 대미투자특위…여야, 12일 본회의서 특별법 처리 합의","소위에는 민주당 박지혜·허영 의원과 국민의힘 박수영·박상웅·강승규 의원, 비교섭단체 몫으로 차규근 조국혁신당 의원이 참여한다. 소위원회에서는 별도 투자공사 설립 여부를 비롯해 국회 통제 방식, 정보 공개 범위... ",https://www.newsworks.co.kr/news/articleView.html?idxno=833028,https://www.newsworks.co.kr/news/articleView.html?idxno=833028,"Wed, 04 Mar 2026 16:30:00 +0900"
차규근,강남대 세무전문대학원 개원 기념 학술세미나 6일 개최,"개회식에서는 윤신일 강남대학교 총장, 차규근 조국혁신당 의원(국회 기획재정위원회), 이정희 고문(딜로이트 안진) 등이 축사를 할 예정이다. 이어 열리는 기조강연 및 좌담회에서는 '강남대학교 세무전문대학원 설립... ",http://www.joseilbo.com/news/news_read.php?uid=563949&class=10&grp=,https://n.news.naver.com/mnews/article/123/0002378818?sid=101,"Wed, 04 Mar 2026 16:28:00 +0900"
차규근,"예민해진 트럼프에 찍힐라…여야, 대미투자특별법 12일 처리키로","소위 위원으로는 민주당 박지혜·허영 의원, 국민의힘 박수영·박상웅·강승규 의원, 차규근 조국혁신당 의원이 들어간다. 소위에서는 별도 투자공사 설립 여부, 한미전략투자기금 재원 마련 구조 등에 대한 논의가 진행된... ",https://news.mtn.co.kr/news-detail/2026030416073384616,https://news.mtn.co.kr/news-detail/2026030416073384616,"Wed, 04 Mar 2026 16:26:00 +0900"
차규근,"여야, 대미투자특별법 12일 본회의 처리 합의…특위, 법안 상정하고 법...","소위원장은 특위 여당 간사인 정태호 민주당 의원이 맡았다. 박지혜·허영 민주당 의원과 강승규·박상웅·박수영 국민의힘 의원, 차규근 조국혁신당 의원이 소위 위원으로 참여했다.",https://www.khan.co.kr/article/202603041618001,https://n.news.naver.com/mnews/article/032/0003431144?sid=100,"Wed, 04 Mar 2026 16:18:00 +0900"
차규근,"여야, 대미투자특별법 예정대로 처리하기로 합의","소위원장은 특위 여당 간사인 정태호 의원이 맡고, 위원으로는 허영·박지혜 민주당 의원, 박수영·박상웅·강승규 의원, 차규근 조국혁신당 의원이 참여한다. 4일 국회 대미투자특별위원회 전체회의가 열리고 있다. 사진=",https://www.m-economynews.com/news/article.html?no=65104,https://www.m-economynews.com/news/article.html?no=65104,"Wed, 04 Mar 2026 16:16:00 +0900"
차규근,"여야, 대미특위 재가동...투자공사 신규 설립·국회 비준 동의 쟁점",비교섭단체 위원 몫으로는 차규근 조국혁신당 의원이 맡기로 했다. 이날 오후부터 열리는 대미특위 소위에선 ▲투자공사 신규 설립 여부 ▲국회 보고 및 동의 방법 ▲대미 투자 리스크 관리 방안 등을 둘러싼 본격 논의가... ,https://www.mediapen.com/news/view/1084962,https://www.mediapen.com/news/view/1084962,"Wed, 04 Mar 2026 16:10:00 +0900"
차규근,"대미특위 재가동…與野, 투자공사 설립·규모 놓고 이견","민주당에는 정 의원을 포함해 허영, 박지혜 의원, 국민의힘에서는 박수영, 강명구, 박상웅 의원, 비교섭단체에서는 차규근 조국혁신당 의원이 소위에 참여한다. 여야는 미국-이란 전쟁으로 인한 불안한 국제정세 등을... ",http://www.edaily.co.kr/news/newspath.asp?newsid=04575606645380040,https://n.news.naver.com/mnews/article/018/0006228466?sid=100,"Wed, 04 Mar 2026 16:09:00 +0900"
차규근,"여야, 대미투자특별법 입법 속도…12일 본회의 처리 합의","소위원장은 특위 여당 간사인 더불어민주당 정태호 의원이 맡고 같은 당 허영·박지혜 의원과 국민의힘 박수영·박상웅·강승규 의원, 조국혁신당 차규근 의원이 위원으로 참여한다. 법안심사소위는 이날 오후 첫 회의를... ",https://www.etoday.co.kr/news/view/2561838,https://www.etoday.co.kr/news/view/2561838,"Wed, 04 Mar 2026 16:06:00 +0900"
차규근,"정쟁에 묶였던 대미투자특별법, 여야 합의로 본궤도…12일 처리 가닥","소위원장은 더불어민주당 정태호 의원이 맡았으며, 민주당 박지혜·허영 의원, 국민의힘 박수영·박상웅·강승규 의원, 조국혁신당 차규근 의원 등이 위원으로 참여한다. 특위는 관세 협상 후속 입법과 대미 투자 지원 체계... ",http://www.newsian.co.kr/news/articleView.html?idxno=86775,http://www.newsian.co.kr/news/articleView.html?idxno=86775,"Wed, 04 Mar 2026 15:46:00 +0900"
차규근,"여야, '대미투자특별법' 12일 본회의 처리 합의…&quot;국익 위한 결정&quot;","의원이 맡으며, 민주당 박지혜·허영 의원과 국민의힘 박수영·박상웅·강승규 의원이 소위 위원으로 참여합니다. 비교섭단체 위원 몫은 차규근 조국혁신당 의원이 맡기로 했습니다. #대미투자특별법 #민주당 #국민의힘 #국회",https://www.ikbc.co.kr/article/view/kbc202603040045,https://n.news.naver.com/mnews/article/660/0000104574?sid=100,"Wed, 04 Mar 2026 15:33:00 +0900"
차규근,"여야, 대미투자특위 본격 가동... 투자공사 설립 공감, 시행방식 이견","민주당 박지혜·허영 의원, 국민의힘 박수영·박상웅·강승규 의원, 조국혁신당 차규근 의원 등이 소위 위원으로 참여한다. 소위는 이날 오후부터 회의를 열어 본격적인 법안 조율에 들어갔다. ▲별도 투자공사 설립 여부... ",https://www.meconomynews.com/news/articleView.html?idxno=128554,https://www.meconomynews.com/news/articleView.html?idxno=128554,"Wed, 04 Mar 2026 15:30:00 +0900"
차규근,野 복귀로 국회 대미특위 재가동…12일 법안 통과 목표,"소위원장은 특위 여당 간사인 정태호 의원이 맡고, 위원으로는 허영·박지혜 민주당 의원, 박수영·박상웅·강승규 의원, 차규근 조국혁신당 의원이 참여한다. 소위는 이날 오후 첫 회의를 열어 활동 기한인 9일 오전까지 세... ",http://www.inews24.com/view/1945194,https://n.news.naver.com/mnews/article/031/0001010240?sid=100,"Wed, 04 Mar 2026 15:22:00 +0900"
차규근,"‘대미투자특위’ 본격 가동…여야, 특별법 12일 본회의 처리 합의","소위원회에는 민주당 허영ㆍ박지혜 의원, 국민의힘 박수영ㆍ박상웅ㆍ강승규 의원, 조국혁신당 차규근 의원 등이 참여한다. 특위는 이날부터 소위원회를 열고 본격적인 법안 조율에 들어갔다. 소위는 9일 오전까지 세 차례... ",https://www.dnews.co.kr/uhtml/view.jsp?idxno=202603041454248100836,https://www.dnews.co.kr/uhtml/view.jsp?idxno=202603041454248100836,"Wed, 04 Mar 2026 15:00:00 +0900"
차규근,"정쟁에 볼모 잡혔던 대미투자법, 여야 극적 합의","민주당 박지혜·허영 의원, 국민의힘 박수영·박상웅·강승규 의원, 조국혁신당 차규근 의원 등이 소위 위원으로 참여한다. 한편 여야는 대구경북 및 충남대전 행정통합 특별법 처리에 대해서는 결론을 내지 못했다. 이미... ",https://www.m-i.kr/news/articleView.html?idxno=1342747,https://www.m-i.kr/news/articleView.html?idxno=1342747,"Wed, 04 Mar 2026 14:52:00 +0900"
차규근,"여야, 대미투자특별법 12일 본회의 처리 합의…&quot;국익 위한 결정&quot;(종합)","비교섭단체 위원 몫은 차규근 조국혁신당 의원이 맡기로 했다. 특위는 당초 지난달 24일 법안 상정과 소위 구성 건을 처리하려고 했으나, 야당이 여당 주도의 '사법개혁 3법'에 반발해 상임위 보이콧 방침을 세우면서 일정이... ",https://www.news1.kr/politics/assembly/6089999,https://n.news.naver.com/mnews/article/421/0008806082?sid=100,"Wed, 04 Mar 2026 14:45:00 +0900"
차규근,파행 끝에 ‘대미투자특위’ 정상 가동…12일 본회의 처리 전망,"민주당 박지혜·허영 의원, 국민의힘 박수영·박상웅·강승규 의원, 조국혁신당 차규근 의원 등이 위원으로 참여한다. 특위는 이날부터 소위원회를 열어 본격적인 법안 조율에 들어갈 예정이다. 주요 논의 대상은 △별도... ",https://www.viva100.com/article/20260304500926,https://www.viva100.com/article/20260304500926,"Wed, 04 Mar 2026 14:08:00 +0900"
차규근,국회 대미투자특위 재가동…관세 압박 해법 나올까,"민주당 박지혜·허영 의원, 국민의힘 박수영·박상웅·강승규 의원, 조국혁신당 차규근 의원 등이 소위 위원으로 참여한다. 소위는 이날부터 회의를 열어 본격적인 법안 조율에 들어갔다. 소위에서는 ▲별도 투자공사 설립... ",http://www.segyebiz.com/newsView/20260304511825?OutUrl=naver,http://www.segyebiz.com/newsView/20260304511825?OutUrl=naver,"Wed, 04 Mar 2026 14:02:00 +0900"
차규근,국회 '대미투자특위' 본격 가동…12일 본회의 처리 추진,"소위원회에는 더불어민주당 허영·박지혜 의원, 국민의힘 박수영·박상웅·강승규 의원, 조국혁신당 차규근 의원 등이 참여한다. 특위는 이날부터 소위원회를 열고 본격적인 법안 조율에 들어간다. 소위는 9일 오전까지 세... ",https://www.etnews.com/20260304000296,https://n.news.naver.com/mnews/article/030/0003404174?sid=100,"Wed, 04 Mar 2026 13:56:00 +0900"
천하람오늘의 주요일정,[오늘의 주요일정·5일] 이재명 대통령 임시 국무회의,"대표·천하람 원내대표, 최고위원회의(09:30 본관 170호) [외교안보] ▲ 외교부, SBS 라디오 '김태현의... [알림] 오늘의 일정 게재나 수정이 필요한 기관(단체)는 편집기획팀 전화(☎ 02-953-0119) 또는 이메일()으로 보내... ",https://www.safetimes.co.kr/news/articleView.html?idxno=240186,https://www.safetimes.co.kr/news/articleView.html?idxno=240186,"Thu, 05 Mar 2026 07:04:00 +0900"
천하람오늘의 주요일정,[오늘의 국회일정] 상임위·세미나·기자회견·주요 정당 - 3월 5일,공개일정 없음 *한병도 원내대표 09:30 정책조정회의 / 국회 본관 원내대표회의실 ◆국민의힘 *장동혁... 본회의장 ◆개혁신당 *이준석 당대표·천하람 원내대표 09:30 최고위원회의 / 개혁신당 대회의실(국회 본관 170호),https://www.newspim.com/news/view/20260304001166,https://www.newspim.com/news/view/20260304001166,"Thu, 05 Mar 2026 05:00:00 +0900"
오늘의 국회일정,"[김능구·차재원의 정국진단 3월①][전문] &quot;미-이란 전쟁, 이번 주말이 ...",▲ 김능구&gt; 제가 오늘 자료를 보다 보니까 옛날 교과서에 청춘 예찬론이라는 글을 봤는데 거기 20대 보수론과... 그때 학생들이 국회 앞에서 장기 농성을 했었잖아요. 그때 생각하면 완전히 격세지감인데 지난번 장동혁... ,https://www.polinews.co.kr/news/articleView.html?idxno=724596,https://www.polinews.co.kr/news/articleView.html?idxno=724596,"Thu, 05 Mar 2026 14:09:00 +0900"
오늘의 국회일정,[오늘의 일정] 3월 5일 목요일 국회,"여의도 국회의사당 전경. ▲ 상임위원회 대미투자특별법처리를위한특별위원회 법안심사소위원회(10:00... 정책방향 국회세미나(10:00 국회도서관 소강당) 안상훈 의원실, 국가구강검진 의무화 및 구강검진 강화를... ",https://www.jeonmae.co.kr/news/articleView.html?idxno=1235692,https://www.jeonmae.co.kr/news/articleView.html?idxno=1235692,"Thu, 05 Mar 2026 10:52:00 +0900"
오늘의 국회일정,"李대통령, 오늘 임시 국무회의 주재...중동 사태 대응책 논의 外 [오늘의...","李대통령, 오늘 임시 국무회의 주재...중동 사태 대응책 논의 이재명 대통령은 5일 오전 청와대에서 임시 국무회의를 주재하고, 중동 상황 여파에 따른 대응책을 논의한다. 싱가포르와 필리핀 국빈 방문 일정을... ",http://www.sisunnews.co.kr/news/articleView.html?idxno=235189,http://www.sisunnews.co.kr/news/articleView.html?idxno=235189,"Thu, 05 Mar 2026 09:36:00 +0900"
오늘의 국회일정,[오늘의 국회]2026년 3월 5일,"정책방향 국회세미나(국회도서관 소강당) 10:00 안상훈 의원실, 국가구강검진 의무화 및 구강검진 강화를... 14:20 김소희 의원, [서울시의원 오디션 출마선언 기자회견] ※ 상기 일정은 사정에 따라 변경될 수 있습니다.",https://www.dnews.co.kr/uhtml/view.jsp?idxno=202603050912197360915,https://www.dnews.co.kr/uhtml/view.jsp?idxno=202603050912197360915,"Thu, 05 Mar 2026 09:22:00 +0900"
오늘의 국회일정,[오늘의 주요 경제 일정] 경제(3월5일 목요일),"소위(국회) ▲16:00 이호현 기후에너지환경부 2차관, 에너지산업 통합포럼(서울) ▲10:00 여한구 산업통상부 통상교섭본부장, 임시 국무회의(비공개) ▲16:00 이호현 기후에너지환경부 2차관, 에너지산업 통합포럼... ",http://www.econonews.co.kr/news/articleView.html?idxno=429760,http://www.econonews.co.kr/news/articleView.html?idxno=429760,"Thu, 05 Mar 2026 09:18:00 +0900"
오늘의 국회일정,[오늘의 주요 정치 일정] 국회(3월5일 목요일),"정책방향 국회세미나(국회도서관 소강당) 10:00 안상훈 의원실, 국가구강검진 의무화 및 구강검진 강화를 위한 파노라마 촬영 도입 국회토론회(의원회관 제5간담회의실) 10:00 김현정 의원실, 디지털자산 법인시장... ",http://www.econonews.co.kr/news/articleView.html?idxno=429756,http://www.econonews.co.kr/news/articleView.html?idxno=429756,"Thu, 05 Mar 2026 09:14:00 +0900"
오늘의 국회일정,[오늘의 주요 사회 일정] 부산(3월5일 목요일),"전 국회의원 정치활동 반대 성명 기자회견, 부산시의회 브리핑룸 ▲오후 2시, 영도구청장 선거 예비후보 이경민, 영도구청장 선거 예비후보 이경민 출마 기자회견, 부산시의회 브리핑룸 ▲오후 4시, 부산시 미래부시장... ",http://www.econonews.co.kr/news/articleView.html?idxno=429751,http://www.econonews.co.kr/news/articleView.html?idxno=429751,"Thu, 05 Mar 2026 09:10:00 +0900"
오늘의 국회일정,[오늘의 주요 정치 일정] 정치(3월5일 목요일),공개일정 없음 【원내대표】 09:30 정책조정회의(국회 본관 원내대표회의실) ◇국민의힘【당대표】 09:30 현장 의원총회(청와대 사랑채 앞 분수대) 14:00 최고위원회의(국회 본관 228호) 【원내대표】 09:30 현장... ,http://www.econonews.co.kr/news/articleView.html?idxno=429741,http://www.econonews.co.kr/news/articleView.html?idxno=429741,"Thu, 05 Mar 2026 09:04:00 +0900"
오늘의 국회일정,[오늘의 주요 사회 일정] 충북(3월5일 목요일),"관련 국회 방문, 국회의사당 ▲오후 2시30분, 외식업중앙회 제천시지부 정기총회, 시청 청풍호실 ▲오후 3시, 제천시 여성친화도시조성위원회, 시청 박달재실 ▲오후 3시, 보은군 중초지구 풍수해생활권종합정비사업... ",http://www.econonews.co.kr/news/articleView.html?idxno=429732,http://www.econonews.co.kr/news/articleView.html?idxno=429732,"Thu, 05 Mar 2026 08:54:00 +0900"
오늘의 국회일정,【오늘의 국회일정】 2026년 3월 5일,"정책방향 국회세미나(국회도서관 소강당) 10:00 안상훈 의원실, 국가구강검진 의무화 및 구강검진 강화를... 14:20 김소희 의원, [서울시의원 오디션 출마선언 기자회견] ※ 상기 일정은 사정에 따라 변경될 수 있습니다.",https://www.lawtimes.co.kr/news/articleView.html?idxno=217223,https://www.lawtimes.co.kr/news/articleView.html?idxno=217223,"Thu, 05 Mar 2026 07:30:00 +0900"
오늘의 국회일정,[오늘의 주요일정·5일] 이재명 대통령 임시 국무회의,군산시) ▲ 국회 대미투자특별법처리를위한특별위원회 법안심사소위원회(10:00 본관 431호)... [알림] 오늘의 일정 게재나 수정이 필요한 기관(단체)는 편집기획팀 전화(☎ 02-953-0119) 또는 이메일()으로 보내 주시길... ,https://www.safetimes.co.kr/news/articleView.html?idxno=240186,https://www.safetimes.co.kr/news/articleView.html?idxno=240186,"Thu, 05 Mar 2026 07:04:00 +0900"
오늘의 국회일정,[오늘의 국회일정](5일·목),"정책방향 국회세미나(10:00 국회도서관 소강당) 안상훈 의원실, 국가구강검진 의무화 및 구강검진 강화를 위한 파노라마 촬영 도입 국회토론회(10:00 의원회관 제5간담회의실) 김현정 의원실, 디지털자산 법인시장... ",https://www.yna.co.kr/view/AKR20260304179000001?input=1195m,https://n.news.naver.com/mnews/article/001/0015938576?sid=100,"Thu, 05 Mar 2026 07:00:00 +0900"
오늘의 국회일정,"[오늘의 국회일정] (5일, 목)","국회 본회의. 2026.3.1 ◇상임위원회 10:00 대미투자특별법 처리를 위한 특별위원회 법안심사소위원회 (본관... 정책방향 국회세미나 (국회도서관 소강당) 10:00 안상훈 의원실, 국가구강검진 의무화 및 구강검진... ",http://www.queen.co.kr/news/articleView.html?idxno=452395,http://www.queen.co.kr/news/articleView.html?idxno=452395,"Thu, 05 Mar 2026 06:26:00 +0900"
오늘의 국회일정,"[오늘의 주요일정] 정치·정부 (5일, 목)",통상업무 ◇국회 -국회의장 통상업무 -상임위원회 10:00 대미투자특별법 처리를 위한 특별위원회 법안심사소위원회 (본관 431호) ◇더불어민주당 통상업무 09:30 정책조정회의 (국회 본관 원내대표회의실)... ,http://www.queen.co.kr/news/articleView.html?idxno=452394,http://www.queen.co.kr/news/articleView.html?idxno=452394,"Thu, 05 Mar 2026 06:20:00 +0900"
오늘의 국회일정,[오늘의 정치일정] 3월 5일(목),공개일정 없음 -한병도 원내대표 09:30 정책조정회의 / 국회 본관 원내대표회의실 &lt;국민의힘&gt; -장동혁 당 대표 09:30 현장 의원총회(청와대 사랑채 앞 분수대) 14:00 최고위원회의(국회 본관 228호) -송언석... ,https://www.newspim.com/news/view/20260305000025,https://www.newspim.com/news/view/20260305000025,"Thu, 05 Mar 2026 06:20:00 +0900"
