Keyword,Title,Description,Original Link,Link,Publication Date
기재부,'중대재해 책임' 공공기관장 해임…사망 사고시 경평 등급 하향,기획재정부는 1일 정부서울청사에서 구윤철 부총리 겸 기재부 장관 주재로 제8차 공공기관운영위원회를 열고 이 같은 내용의 '공공기관 안전관리 강화 방안'을 논의했다고 밝혔다. 먼저 공공기관의 안전 경영에 대한... ,https://www.ajunews.com/view/20250901090639385,https://www.ajunews.com/view/20250901090639385,"Mon, 01 Sep 2025 11:52:00 +0900"
기재부,공공기관 부채 2029년 847.8조,기획재정부는 1일 구윤철 부총리 겸 기재부 장관 주재로 열린 ‘제8차 공공기관운영위원회’에서 이런... 게 기재부의 설명이다. 다만 2028년에는 예보채상환기금 청산에 따른 자본 감소로 일시 상승할 것으로... ,https://biz.heraldcorp.com/article/10565787?ref=naver,https://n.news.naver.com/mnews/article/016/0002522243?sid=101,"Mon, 01 Sep 2025 11:50:00 +0900"
기재부,구윤철 “중대재해 발생 시 공공기관장 해임 근거 마련”,기재부에 따르면 35개 기관의 부채비율은 올해 202.2%에서 2029년 190.1%까지 개선될 전망이다. 같은 기간 부채규모는 127조6000억원 늘어나 2029년 847조8000억원에 이를 것으로 예상된다. 이에 대해 기재부 관계자는 “부채... ,https://biz.chosun.com/policy/policy_sub/2025/09/01/4L2HOEX2DZCT7N5OOLMVSIKR2Q/?utm_source=naver&utm_medium=original&utm_campaign=biz,https://n.news.naver.com/mnews/article/366/0001104434?sid=101,"Mon, 01 Sep 2025 11:50:00 +0900"
기재부,공공기관 부채 2029년 847.8조 … SOC 투자 확대에 부채도 급증,기획재정부는 1일 정부서울청사에서 구윤철 경제부총리 겸 기재부 장관 주재로 '제8차 공공기관운영위원회'를 개최하고 '2025~2029년 공공기관 중장기재무관리계획'을 논의했다. 자산 2조원 이상 또는 정부의... ,https://biz.newdaily.co.kr/site/data/html/2025/09/01/2025090100167.html,https://biz.newdaily.co.kr/site/data/html/2025/09/01/2025090100167.html,"Mon, 01 Sep 2025 11:50:00 +0900"
기재부,공공기관 부채비율 2029년 190%로 낮춘다…올해보다 12.1%p↓,"기재부는 국가 전략 과제에 맞춰 공공기관의 선도적 역할을 강화하고 주택, 도로 등 필수 사회간접자본... 기재부는 오는 3일 국회에 재무관리계획을 제출할 예정이다. 이날 공운위는 공공기관 안전관리 강화 방안도... ",https://www.news1.kr/economy/trend/5896759,https://n.news.naver.com/mnews/article/421/0008458743?sid=101,"Mon, 01 Sep 2025 11:50:00 +0900"
기재부,"정부, 중대재해 발생 공공기관장 해임 법제화 시동…&quot;산업재해 감축 체...",기획재정부는 구윤철 부총리 겸 기재부 장관 주재로 정부서울청사에서 이 같은 내용을 반영한 제8차 공공기관운영위원회를 열었다고 1일 밝혔다. 안건은 '공공기관 안전관리 강화 방안' 및 '2025∼2029년 공공기관... ,https://www.newspim.com/news/view/20250901000161,https://www.newspim.com/news/view/20250901000161,"Mon, 01 Sep 2025 11:50:00 +0900"
기재부,"정부, 공공기관 부채비율 2029년까지 12.1%p 낮추기로",기획재정부는 1일 정부서울청사에서 구윤철 부총리 겸 기재부 장관 주재로 제8차 공공기관운영위원회를 열고 이 같은 내용의 '2025~2029년 공공기관 중장기재무관리계획'을 논의했다고 밝혔다. 구 부총리는 이번... ,https://www.ajunews.com/view/20250901091749400,https://www.ajunews.com/view/20250901091749400,"Mon, 01 Sep 2025 11:50:00 +0900"
기재부,公기관 에너지·SOC 투자 확대…부채비율은 5년간 12%p 낮춘다,기획재정부는 1일 정부서울청사에서 구윤철 경제부총리 겸 기재부 장관 주재로 공공기관 운영위원회를 열고 이 같은 내용을 담은 '2025∼2029년 공공기관 중장기재무관리계획'을 논의했다. 공공기관 중장기... ,https://www.newsis.com/view/NISX20250901_0003310023,https://n.news.naver.com/mnews/article/003/0013453250?sid=101,"Mon, 01 Sep 2025 11:50:00 +0900"
기재부,'公기관 사고 되풀이 안돼'…중대재해 발생 기관장 해임·안전 경평 강화,기획재정부는 1일 정부서울청사에서 구윤철 경제부총리 겸 기재부 장관 주재로 제8차 공공기관운영위원회를 열고 '공공기관 안전관리 강화 방안' 등을 논의했다. 우선 정부는 공공기관 운영에 '안전경영'을 기본원칙으로... ,https://www.newsis.com/view/NISX20250901_0003310599,https://n.news.naver.com/mnews/article/003/0013453249?sid=101,"Mon, 01 Sep 2025 11:50:00 +0900"
기재부,공공기관 부채 2029년 847.8조…LH는 여전히 “아픈 손가락”,기획재정부는 1일 구윤철 부총리 겸 기재부 장관 주재로 열린 ‘제8차 공공기관운영위원회’에서 이런... 게 기재부의 설명이다. 다만 2028년에는 예보채상환기금 청산에 따른 자본 감소로 일시 상승할 것으로... ,https://biz.heraldcorp.com/article/10565655?ref=naver,https://n.news.naver.com/mnews/article/016/0002522242?sid=101,"Mon, 01 Sep 2025 11:50:00 +0900"
기재부,중대재해 책임 공공기관장 해임한다…법적 근거마련,기재부에 따르면 35개 기관 부채비율은 올해 202.2%에서 2029년 190.1%까지 단계적으로 개선(△12.1%p)될 전망입니다. 부채규모는 2029년 847.8조원으로 올해대비 127.6조원이 증가할 것으로 예상했습니다. 이번 계획은... ,https://biz.sbs.co.kr/article_hub/20000256530?division=NAVER,https://n.news.naver.com/mnews/article/374/0000460519?sid=101,"Mon, 01 Sep 2025 11:50:00 +0900"
기재부,"과기정통부, 내년 보안 예산 8.1% 증액...AI 기반 대응 시스템 구축",올해 각종 침해 사고들이 발생하면서 기재부에서도 지원을 늘린 영향이다. 보이스피싱 관련 통신국 연구개발(R&amp;D) 예산도 같은 기간 11.1% 증가했다. 과기정통부 관계자는 &quot;AI를 활용한 침해 사고들이 증가하고 있어 침해... ,https://www.techm.kr/news/articleView.html?idxno=143898,https://www.techm.kr/news/articleView.html?idxno=143898,"Mon, 01 Sep 2025 11:48:00 +0900"
기재부,국가채무비율 증가속도 ‘복지천국 프랑스’ 의 2.4배,기재부 관계자는 “(GDP 대비 국가채무 비율의) 마지노선과 관련해서는 특정 숫자를 정하기는 어렵다”면서도 “이번 정부 내에서는 60%를 넘기지 않으려고 노력은 할 것”이라고 말했다.,https://www.munhwa.com/article/11529730?ref=naver,https://n.news.naver.com/mnews/article/021/0002733239?sid=101,"Mon, 01 Sep 2025 11:46:00 +0900"
기재부,기재부 국고채 2년물 입찰 2.365% 2.7조 전액낙찰,이투데이=김남현 기자 | 기획재정부 국고채 2년물 “국고02250-2709” 통합발행 경쟁입찰 결과('25.9.1.) □ 입찰개요 ㅇ 입찰일시 : ’25.9.1.(월) 10:40∼11:00 (발행일: ’25.9.10.) ㅇ 입찰금액 : 2년물... ,https://www.etoday.co.kr/news/view/2501946,https://www.etoday.co.kr/news/view/2501946,"Mon, 01 Sep 2025 11:42:00 +0900"
기재부,李정부의 ‘영끌’ 나랏빚[뉴스와 시각],게다가 내년도 정부 예산안에서는 이 비율이 51.6%를 넘어 이재명 정부 말기인 2029년에는 58.0%에 도달할 것으로 기재부는 예상했다. 추가경정예산(추경) 가능성까지 고려하면 60%의 선을 넘어갈 수도 있다. 세간에서는... ,https://www.munhwa.com/article/11529720?ref=naver,https://n.news.naver.com/mnews/article/021/0002733229?sid=110,"Mon, 01 Sep 2025 11:41:00 +0900"
기재부,[정치in] 이재명 대통령 결정만 남았다… 검찰·금융위·기재부 운명은,당초 국정기획위는 금융위원회의 금융정책 기능을 기재부로 이관하고 감독 기능은 금융감독원과 합쳐... ◆기재부 '쪼개기'와 정치적 파장 기획재정부 분리 문제도 크다. 국정위가 발표한 '국정과제 5개년 계획'에는... ,https://www.newscj.com/news/articleView.html?idxno=3312183,https://www.newscj.com/news/articleView.html?idxno=3312183,"Mon, 01 Sep 2025 11:38:00 +0900"
기재부,"문성호 서울시의원, 제332회 임시회서 강북횡단선 시정 질문","있지만, 기재부가 진행하는 예비타당성조사의 경우 균형발전 평가 항목이 수도권에만 삭제돼있어 오로지... 강북횡단선이 서울시 제2차 도시철도망계획에 포함되었으나 큰 난관으로 봉착했던 단계가 바로 기재부의... ",https://www.geconomy.co.kr/news/article.html?no=305962,https://www.geconomy.co.kr/news/article.html?no=305962,"Mon, 01 Sep 2025 11:36:00 +0900"
기재부,728조 원 '슈퍼 예산'... 어떻게 짜여졌나?,co.kr&gt; 구윤철 부총리 겸 기획재정부 장관이 8월 28일 서울 중구 서울중앙우체국 포스트타워에서 열린 '초혁신 경제구현을 위한 공기업 기관장 워크숍'에서 모두발언을 하고 있다. &lt;사진= 기재부 kenews.co.kr&gt;,https://www.kenews.co.kr/news/article.html?no=87887,https://www.kenews.co.kr/news/article.html?no=87887,"Mon, 01 Sep 2025 11:32:00 +0900"
기재부,북울산역~야음사거리 13.55㎞구간… 울산 도시철도 2호선 국토부 투자심...,앞으로 도시철도 2호선은 기재부의 재정사업평가위원회 심의 절차를 앞두고 있다. 시는 오는 11월 예비타당성 조사 대상사업으로 최종 선정될 수 있도록 적극적으로 대응할 예정이다. 2호선은 예타를 통과하면... ,https://www.seoul.co.kr/news/society/2025/09/01/20250901500098?wlog_tag3=naver,https://n.news.naver.com/mnews/article/081/0003570569?sid=102,"Mon, 01 Sep 2025 11:29:00 +0900"
기재부,울산 도시철도 2호선…국토부 투자심사 첫 관문 통과,"기재부 재정사업평가위원회 심의로, 울산시는 지난 1월 미선정 사유에 대한 대응 논리를 보완해 오는 11월 최종 예비타당성 조사 대상 사업 선정에 총력을 기울일 계획입니다. 도시철도 2호선 건설 사업이 기재부... ",http://www.yonhapnewstv.co.kr/AKR20250901112756627,https://n.news.naver.com/mnews/article/422/0000776500?sid=102,"Mon, 01 Sep 2025 11:28:00 +0900"
기재부,농식품부 내년 예산 사상 첫 '20조' 돌파,"농식품부 기획재정담당관실 관계자는 &quot;농식품부가 무기질비료 지원사업 등 생산비 보전 사업을 예산안에 반영했지만, 기재부 논의 과정에서 삭감됐다&quot;고 밝혔다. 아울러 지역 소멸 개념으로 접근해 행정안전부 예산에... ",http://www.agrinet.co.kr/news/articleView.html?idxno=339602,http://www.agrinet.co.kr/news/articleView.html?idxno=339602,"Mon, 01 Sep 2025 11:24:00 +0900"
기재부,"울산 도시철도 2호선, 국토부 투자심사 통과…예타 대상 사업 ‘청신호...",울산 도시철도 2호선 건설사업이 국토교통부 투자심사를 통과해 예비타당성조사(예타) 대상사업 선정을 향한 첫 관문을 넘었다. 울산시는 지난달 28일 열린 국토부 제4차 투자심사위원회에서 울산 도시철도 2호선... ,https://www.busan.com/view/busan/view.php?code=2025090111042040884,https://n.news.naver.com/mnews/article/082/0001342582?sid=102,"Mon, 01 Sep 2025 11:17:00 +0900"
기재부,"울산2호선 트램, 국토부 투자심사 통과…예타선정 재도전","1월 기재부 재정사업평가위원회에서 사업 시급성 부족을 이유로 고배를 마셨다. 이에, 시는 지난 7월 '울산... 울산 2호선은 향후 기재부 재정사업평가위원 심의를 앞두고 있다. 시는 오는 11월 예타조사 대상사업으로... ",https://www.redaily.co.kr/news/articleView.html?idxno=13476,https://www.redaily.co.kr/news/articleView.html?idxno=13476,"Mon, 01 Sep 2025 11:16:00 +0900"
기재부,[공기업 인사] ⑦ 유재훈 예보 사장 11월 임기 만료... 차기 사장 기재부...,"유재훈 사장은 기재부 국고국장 출신으로 한국예탁결제원 사장, 아시아인프라투자은행 회계감사국장·총재 보좌관 등을 역임한 바 있다. 역대 예보 사장은 대부분 기재부, 재무부, 재정경제부 출신이었다. 기재부 출신이... ",https://www.newsfreezone.co.kr/news/articleView.html?idxno=644200,https://www.newsfreezone.co.kr/news/articleView.html?idxno=644200,"Mon, 01 Sep 2025 11:12:00 +0900"
기재부,"문성호 서울의원, 강북횡단선 시정질문서 서울시 강북횡단선 재추진 의...","있지만, 기재부가 진행하는 예비타당성조사의 경우 균형발전 평가 항목이 수도권에만 삭제되어있어 오로지... 강북횡단선이 서울시 제2차 도시철도망계획에 포함되었으나 큰 난관으로 봉착했던 단계가 바로 기재부의... ",https://www.seoul.co.kr/news/publicnews/local_govern/smc_movement/2025/09/01/20250901500072?wlog_tag3=naver,https://n.news.naver.com/mnews/article/081/0003570546?sid=102,"Mon, 01 Sep 2025 10:57:00 +0900"
기재부,"기재부-조달청, 혁신기업 전용 특례 보증 도입으로 초기 자금난 해소 위...",기획재정부와 조달청은 혁신기업의 초기 생산 자금난 애로를 해소하기 위해9월부터 혁신기업 전용 특례 보증을 새롭게 도입한다고 밝혔다.초기기업은 특성상 실제 현장에서 제조 및 납품을 위한 자금조달에 큰... ,http://www.boannews.com/media/view.asp?idx=138997&kind=,http://www.boannews.com/media/view.asp?idx=138997&kind=,"Mon, 01 Sep 2025 10:56:00 +0900"
기재부,&quot;계엄 문건 못 봤다&quot;던 한덕수...이상민과 16분간 문건 보면서 '심도 논...,다만 최상목 전 기재부장관 등 국무위원들이 &quot;서명을 못하겠다&quot;며 거부하자 실제로 부서는 이뤄지지 않았습니다. 한 전 총리가 계엄 관련 문건을 &quot;보지 못했다&quot;는 주장과 정면 배치되는 정황들도 드러났습니다. 공소장에... ,https://news.jtbc.co.kr/article/NB12261123?influxDiv=NAVER,https://n.news.naver.com/mnews/article/437/0000455000?sid=102,"Mon, 01 Sep 2025 10:55:00 +0900"
기재부,울산 도시철도 2호선 국토부 투자심사 통과,"기재부 선정이 확정되면 예비타당성 조사, 기본계획 수립 및 실시설계를 거쳐 오는 2029년 착공에 들어간다. 울산 도시철도 2호선은 4400억원이 투자돼 북울산역~북구 진장유통단지~중구 번영로~남구 야음사거리 13.55... ",https://biz.heraldcorp.com/article/10565700?ref=naver,https://n.news.naver.com/mnews/article/016/0002522100?sid=102,"Mon, 01 Sep 2025 10:52:00 +0900"
기재부,[종합]강원도 사상 첫 국비 10조 시대 열었다…10조2천억 반영,"김진태 지사는 대통령, 기획재정부 장관 등 여야를 가리지 않고 정부 고위 관계자를 만나 협조를 요청했으며 부지사를 비롯한 실무진도 40여 차례, 주 2회 기재부 관계자(2차관, 예산실장, 심의관 등)를 만나 사업의... ",https://www.kwnews.co.kr/page/view/2025090110324042770,https://n.news.naver.com/mnews/article/087/0001139388?sid=100,"Mon, 01 Sep 2025 10:38:00 +0900"
기재부,"기재부, AI 대전환 주제 ‘미래한국 아이디어 공모전’ 개최","기재부는 우수 제안이 정책 설계 과정에 반영될 수 있도록 관계부처와의 협업·검토를 추진할 계획입니다. 구체적인 일정, 접수 방법 등 자세한 사항은 아이디어 공모전 누리집(www.아이디어공모전.kr)에서 확인할 수... ",https://biz.sbs.co.kr/article_hub/20000256534?division=NAVER,https://n.news.naver.com/mnews/article/374/0000460493?sid=101,"Mon, 01 Sep 2025 10:37:00 +0900"
금융위,"당정, 경제부처 조직개편안 &quot;9월 본회의 처리 목표&quot;","기재부와 금융위원회, 금융감독원 등의 조직 개편안 마련을 &quot;(오는 25일 본회의 일정) 계획에 맞춰서 해보려고 노력하겠다&quot;고 말했다. 강 의원은 &quot;국정기획위원회에서 수차례 논의한 금융위와 기재부 조직 개편안을 가지고... ",http://www.fnnews.com/news/202509011259118484,https://n.news.naver.com/mnews/article/014/0005399630?sid=100,"Mon, 01 Sep 2025 13:45:00 +0900"
금융위,"당정, 금융위 '조직개편' 논의…&quot;25일 본회의 처리 노력&quot;","국회 정무위원회 소속 더불어민주당 의원들은 1일 정부, 대통령실과 금융위원회 해체 등을 골자로 한... 강 의원은 &quot;금융위가 정무위원회 소관이라 정부와 대통령실에서 정무위원 의견을 들으러 왔다&quot;면서 &quot;내부적으로... ",https://biz.sbs.co.kr/article_hub/20000256583?division=NAVER,https://n.news.naver.com/mnews/article/374/0000460537?sid=101,"Mon, 01 Sep 2025 13:42:00 +0900"
금융위,"&quot;예금 4000조 시대, 이자장사 그만&quot;…금융위 권대영, 은행권에 작심 비판",권대영 금융위원회 부위원장은 1일 서울 중구 하나은행 본점을 방문해 &quot;예금보호한도 1억원 확대 시행 준비상황&quot;을 점검한 뒤 기자들과 만나 &quot;이제는 국민들이 예대금리차 확대를 납득하기 어려울 것&quot;이라고 작심... ,https://news.tf.co.kr/read/economy/2239178.htm,https://n.news.naver.com/mnews/article/629/0000421656?sid=101,"Mon, 01 Sep 2025 13:37:00 +0900"
금융위,예금자보호 1억원 &quot;기대 반 우려 반&quot;…머니무브 관건은 업권별 '균형',"이 자리에는 권대영 금융위 부위원장을 비롯해 유재훈 예금보험공사 사장, 이호성 하나은행장, 소상공인... 2001년 이후 24년간 유지돼온 예금자보호 기준은 금융위기 이후 '부분 보장 원칙'을 반영한 것이었지만 시간이... ",https://www.newsway.co.kr/news/view?ud=2025090111043934595,https://www.newsway.co.kr/news/view?ud=2025090111043934595,"Mon, 01 Sep 2025 13:28:00 +0900"
금융위,예금보호한도 1억원 시대 개막..권대영 금융부위원장 “생산적 금융으로...,권대영 금융위원회 부위원장이 예금보호한도 상향 첫날 은행 영업점을 방문했다. 권 부위원장은 예금보호한도 상향으로 인한 제도적 혜택을 ‘생산적 금융’으로 환원할 것을 금융권에 주문했다.금융위원회는 1일 권... ,http://kpenews.com/View.aspx?No=3765584,http://kpenews.com/View.aspx?No=3765584,"Mon, 01 Sep 2025 13:26:00 +0900"
금융위,예금보호 1억원 시대…권대영 &quot;예대마진 넘어 생산적 금융으로&quot;,예금보호한도가 5000만원에서 1억원으로 상향된 1일 권대영 금융위원회 부위원장이 서울 중구 하나은행... 권대영 금융위원회 부위원장은 이날 서울 중구 하나은행 본점에서 직접 예금 가입 절차를 밟으며 현장을 점검했다.... ,https://www.ziksir.com/news/articleView.html?idxno=102464,https://www.ziksir.com/news/articleView.html?idxno=102464,"Mon, 01 Sep 2025 13:24:00 +0900"
금융위,"[정책포커스] 금융위원회, 첨단전략산업기금 신설...금년 말 출범",금융위원회(이하 금융위)는 지난달 27일 국회에서 한국산업은행 내에 첨단전략산업기금을 신설하고 수권자본금을 30조원에서 45조원으로 상향하는 '한국산업은행법' 개정안이 국회 본회의를 통과하였다며 위와 같이... ,http://www.sisacast.kr/news/articleView.html?idxno=80786,http://www.sisacast.kr/news/articleView.html?idxno=80786,"Mon, 01 Sep 2025 13:16:00 +0900"
금융위,"당정, '해체기로' 금융위 조직개편안 논의…&quot;25일 처리 노력&quot;","국회 정무위원회 소속 더불어민주당 의원들은 1일 정부, 대통령실과 금융위원회 해체 등을 골자로 한... 강 의원은 &quot;금융위가 정무위원회 소관이라 정부와 대통령실에서 정무위원 의견을 들으러 왔다&quot;면서 &quot;내부적으로... ",https://www.yna.co.kr/view/AKR20250901083900001?input=1195m,https://n.news.naver.com/mnews/article/001/0015597763?sid=100,"Mon, 01 Sep 2025 13:11:00 +0900"
금융위,"오늘부터 예금보호한도 1억 원 상향…금융위, 현장 점검","민주신문=허애림 기자｜권대영 금융위원회 부위원장이 예금보호한도가 1억 원으로 높아진 첫날인 1일 서울... 금융위원회는 금융업계와 소통하면서 제도 시행 상황을 관리하고, 금융감독원 등 관계기관과 함께 자금이동... ",http://www.iminju.net/news/articleView.html?idxno=139967,http://www.iminju.net/news/articleView.html?idxno=139967,"Mon, 01 Sep 2025 13:06:00 +0900"
금융위,[종합] 예금보호한도 1억 원 시대 개막…권대영 “높은 예대마진 납득 ...,이투데이=정상원 기자 | 권대영 금융위원회 부위원장이 은행권의 높은 예대금리차(예금금리와 대출금리... 금융위원회는 앞으로 금융업계와 소통하며 제도 시행 상황을 관리하고 금융감독원 등 관계기관과 함께 자금 이동... ,https://www.etoday.co.kr/news/view/2501928,https://www.etoday.co.kr/news/view/2501928,"Mon, 01 Sep 2025 13:02:00 +0900"
금융위,예금보호한도 1억원 시대 활짝…금융위 &quot;생산적 금융으로 화답해야&quot;,예금보호한도가 24년 만에 5000만원에서 1억원으로 상향된 가운데 권대영 금융위원회 부위원장은 금융회사들이 제도적 혜택을 '생산적 금융'을 통해 사회로 환원할 필요가 있다고 강조했다. 1일 금융위에 따르며 권... ,https://www.getnews.co.kr/news/articleView.html?idxno=838399,https://www.getnews.co.kr/news/articleView.html?idxno=838399,"Mon, 01 Sep 2025 13:02:00 +0900"
금융위,3500개 법인 가상자산 거래 앞두고 '가이드라인' 부재…불확실성 커져,따르면 금융위원회는 올해 하반기부터 자본시장법상 전문투자자 가운데 금융회사를 제외한 상장법인 약 2500개와 전문투자법인 약 1000개 사를 대상으로 가상자산 매매를 시범 허용할 예정이다. 앞서 2월 금융위는 은행의... ,https://www.thepublic.kr/news/articleView.html?idxno=274930,https://www.thepublic.kr/news/articleView.html?idxno=274930,"Mon, 01 Sep 2025 12:48:00 +0900"
금융위,"당정, 금융당국 조직개편 결론 못 내…&quot;숙제 많고 공론 절차 필요&quot;","금융위원회 - 금융감독위원회 (CG)[연합뉴스TV 제공] 정부와 여당이 금융위원회의 정책과 감독 기능을 분리하고, 금융 소비자 보호를 강화하는 골자로 하는 금융감독체계 개편에 대해 공감하면서도 보완해야 할 부분이... ",https://news.einfomax.co.kr/news/articleView.html?idxno=4372366,https://news.einfomax.co.kr/news/articleView.html?idxno=4372366,"Mon, 01 Sep 2025 12:48:00 +0900"
금융위,"당정, '금융위 조직개편' 협의…&quot;25일 본회의서 처리 노력&quot;",민주당은 25일 본회의에서 금융위원회 해체안을 포함한 정부조직법 개편안을 처리하겠다는 계획이다. 민주당... 조직개편안에 금융위원회와 기획재정부 조직 개편안이 있다&quot;며 &quot;대통령실에서 정무위원의 의견을 듣고자 한... ,https://www.newsis.com/view/NISX20250901_0003310714,https://n.news.naver.com/mnews/article/003/0013453393?sid=100,"Mon, 01 Sep 2025 12:42:00 +0900"
금융위,"당정 '금융위 해체안' 논의…&quot;보완 필요, 9월 본회의 처리 노력&quot;","중 금융위원회 해체안에 대해 논의했다. 당정은 국정위 조직개편안에 어느 정도 공감대를 형성했으나... 앞서 국정위는 기획재정부를 기획예산처와 재정경제부로 분리하고, 금융위원회를 해체해 금융정책 기능을... ",https://www.news1.kr/politics/assembly/5897174,https://n.news.naver.com/mnews/article/421/0008458811?sid=100,"Mon, 01 Sep 2025 12:37:00 +0900"
금융위,'금융위 해체안' 놓고 당정협의회…&quot;9월 처리 노력&quot;,당정(여당·정부)이 금융위원회 해체안을 놓고 당정협의회를 진행했다. 민주당 정무위원회 소속 의원들은... 만나 &quot;금융위 조직개편안과 관련해 정부가 정무위 의원들의 의견을 들었다&quot;며 &quot;국정기획위원회에서 나온 안에... ,https://view.asiae.co.kr/article/2025090112182867862,https://n.news.naver.com/mnews/article/277/0005644915?sid=100,"Mon, 01 Sep 2025 12:18:00 +0900"
금융위,"&quot;銀예대마진 국민 납득 어려워&quot;…권대영, 예보한도 행사서 '이자장사' 직...",권대영 금융위원회 부위원장이 1일 예금보호한도 1억 원 상향을 맞아 진행한 행사에서 “국민이 체감하는 예대마진이 생각보다 높고 이것이 지속되면 국민이 납득하기 어려울 것&quot;이라며 “가산금리 수준이나 체계를... ,https://www.sedaily.com/NewsView/2GXQE01WPL,https://n.news.naver.com/mnews/article/011/0004527563?sid=101,"Mon, 01 Sep 2025 12:05:00 +0900"
금융위,오늘부터 예금보호 1억… 2금융 쏠림 현상은 미미,권대영 금융위 부위원장은 이날 서울 중구 하나은행 본점을 찾아 “예금보호한도 1억 원은 국민의 안심과 믿음의 무게인 동시에 은행이 더 큰 역할을 할 수 있다는 자신감과 책임감의 크기”라며 “더욱 두꺼워진 둑 안에... ,https://www.munhwa.com/article/11529756?ref=naver,https://n.news.naver.com/mnews/article/021/0002733262?sid=101,"Mon, 01 Sep 2025 11:57:00 +0900"
