Keyword,Title,Description,Original Link,Link,Publication Date
국회,"우원식, 사상 첫 북한 ‘최고존엄’과 회담한 국회의장 될까?","우원식 국회의장이 내달 3일 중국 베이징에서 열리는 '항일전쟁 및 세계 반파시스트 전쟁 승전(전승절)... 특히 전례상 국가수반급 인사는 주석단 앞줄에 서는 반면, 국회의장은 의전 서열상 뒤쪽에 배치될 가능성이 크다.... ",https://www.ekn.kr/web/view.php?key=20250829028461863,https://www.ekn.kr/web/view.php?key=20250829028461863,"Sat, 30 Aug 2025 06:00:00 +0900"
국회,한중 무역수지 '아이러니'⋯서로 &quot;적자&quot;라는 까닭은,이 적자에 대해 기쁘게 생각한다.&quot; 왕원타오 중국 상무부장이 25일 베이징 둥청구 상무부 청사에서 박병석 전 국회의장을 단장으로 하는 한국 특사단을 만나 한 발언이다. 우리나라가 대중국 무역에서 2023년부터... ,https://www.etoday.co.kr/news/view/2501367,https://www.etoday.co.kr/news/view/2501367,"Sat, 30 Aug 2025 06:00:00 +0900"
국회,현장 지휘관은 “시민 충돌 최소화”…상부는 ‘민간인 노상원’에 내부...,수백명이 국회 앞으로 몰려들었다. 시민들은 총을 든 계엄군과 군용 차량을 온몸으로 막았다. 헌법재판소는 지난 4월4일 윤 전 대통령을 파면하면서 “국회가 신속하게 비상계엄 해제 요구 결의를 할 수 있었던 것은... ,https://www.khan.co.kr/article/202508300600011,https://n.news.naver.com/mnews/article/032/0003392996?sid=102,"Sat, 30 Aug 2025 06:00:00 +0900"
국회,"지방채 완화 법안 9월 중순 이후에나…서울시, 2차 소비쿠폰 선제 추경","그러나 국회 논의가 늦어지면서 본회의 처리는 9월 중순 이후로 밀릴 전망이다. 30일 서울시와 정치권에 따르면, 지방재정법 개정안은 지난 26일 국회 행정안전위원회 제1법안심사소위를 통과했고, 9월 3일로 예정된... ",https://www.news1.kr/local/moi/5895330,https://n.news.naver.com/mnews/article/421/0008456375?sid=102,"Sat, 30 Aug 2025 05:30:00 +0900"
국회,5년 공전 '패스트트랙 충돌 1심'...다음 달에야 결심공판 예정,"지난 2019년 국회에서는 법안 패스트트랙 지정 문제를 둘러싸고 물리적 충돌이 빚어졌는데요. 관련 재판이... 충돌은 국회 몸싸움으로 번졌습니다. 패스트트랙 찬성 의원의 회의 참석을 막기 위한 감금 시도에, [채이배... ",https://www.ytn.co.kr/_ln/0103_202508300521582079,https://n.news.naver.com/mnews/article/052/0002239963?sid=102,"Sat, 30 Aug 2025 05:21:00 +0900"
국회,법동네 두런두런,정 장관은 8월 27일 자신의 페이스북에 “국회 예결위를 마친 뒤 지역구(동두천양주연천갑)를 찾아 조문을 마친 뒤 귀가하니 밤 12시 30분”이라며 “아무리 짜내려고 해도 운동 시간이 부족하니 복부에 살이 찌는 느낌”... ,https://www.lawtimes.co.kr/news/210981,https://www.lawtimes.co.kr/news/210981,"Sat, 30 Aug 2025 05:08:00 +0900"
국회,"과거의 죄, 미래의 죄","국회에선 ‘검찰 개혁’ 법안과 특검법 개정 논의가 한창이다. 정치와 사법 권력이 거대하게 부딪칠수록, 그 틈에서 이름 없는 피해자의 고통은 길어진다. 그래서 권력이 무섭다. 최고 권력자를 향한 거대 수사가 만들어... ",https://www.lawtimes.co.kr/opinion/210985,https://www.lawtimes.co.kr/opinion/210985,"Sat, 30 Aug 2025 05:08:00 +0900"
국회,나사 풀린 '민중의 지팡이'에 '민주·인권·민생' 어떻게 믿고 맡기겠나...,이에 김 청장은 국회 행정안전위원회에 출석해 &quot;해병대원 사망사건 수사와 관련해 전화나 청탁을 받은 사실이 없다&quot;고 밝혔으나 당시 채 해병의 전 부대장인 이용민 중령의 변호를 맡았던 김경호 변호사는 김 청장을... ,http://www.jbsori.com/news/articleView.html?idxno=16113,http://www.jbsori.com/news/articleView.html?idxno=16113,"Sat, 30 Aug 2025 05:02:00 +0900"
기재위,'투자자 표심 잡자'…배당금 감세 입법 쏟아져,이에 대해 기재위 소속 안도걸 민주당 의원은 배당금의 절반에 대해선 최고세율을 30%로 낮추는 법안을... 기재위 한 관계자는 “최근 대주주 기준을 10억원에서 50억원 사이로 설정하는 논의에서도 드러났듯 투자자의... ,https://www.hankyung.com/article/2025082910271,https://n.news.naver.com/mnews/article/015/0005177620?sid=100,"Fri, 29 Aug 2025 17:42:00 +0900"
기재위,"[임광현 인청-18] &quot;청장 이후 정치 안한다, 약속 가능?&quot;","다음은 국회 기획재정위원회(기재위)가 임광현 후보자를 대상으로 진행한 인사청문회 가운데 조세 행정의 정치 편향 관련 권영세 의원의 질의와 답변. 권영세 의원(국힘) = 우선 임광현 후보자님, 지명을 다시 한번... ",https://www.dailybrief.co.kr/news/articleView.html?idxno=3093,https://www.dailybrief.co.kr/news/articleView.html?idxno=3093,"Fri, 29 Aug 2025 15:28:00 +0900"
기재위,[임광현 인청-17] 국세청장 평균 임기는 몇 년인가?,"다음은 국회 기획재정위원회(기재위)가 임광현 후보자를 대상으로 진행한 인사청문회 가운데 조세 정책 비전 관련 최기상 의원의 질의와 답변. 최기상 의원(민주) = 후보자님, 국세청 계실 때도 능력이 출중하시다고 널리... ",https://www.dailybrief.co.kr/news/articleView.html?idxno=3092,https://www.dailybrief.co.kr/news/articleView.html?idxno=3092,"Fri, 29 Aug 2025 14:40:00 +0900"
기재위,"[임광현 인청-16] 조승래 의원, 전관예우 의혹 무마 노력",다음은 국회 기획재정위원회(기재위)가 임광현 후보자를 대상으로 진행한 인사청문회 가운데 법무법인 선택 전관예우 관련 조승래 의원의 질의와 답변. 조승래 의원(민주) = 더불어민주당 조승래입니다. 제가 지금 막 AI... ,https://www.dailybrief.co.kr/news/articleView.html?idxno=3091,https://www.dailybrief.co.kr/news/articleView.html?idxno=3091,"Fri, 29 Aug 2025 14:36:00 +0900"
기재위,"[임광현 인청-15] &quot;6억 이상 대출 다주택자, 만기되면?&quot;",다음은 국회 기획재정위원회(기재위)가 임광현 후보자를 대상으로 진행한 인사청문회 가운데 다주택자... 거기에다가 경력을 국회의원도 1년 이상 지금 하면서 또 기재위에서 활동하면서 세법과 세제 분야까지 그 전문성을... ,https://www.dailybrief.co.kr/news/articleView.html?idxno=3090,https://www.dailybrief.co.kr/news/articleView.html?idxno=3090,"Fri, 29 Aug 2025 14:33:00 +0900"
기재위,"이채명 도의원, “안양시국학기공협회 운영에 대한 애로 사항 청취”","이에 이채명 의원(기재위, 안양6)은 “안양시국학기공협회가 지역에서 활발히 활동하는 만큼, 만안구뿐 아니라 동안구에서도 시민들이 기공 프로그램을 접할 수 있도록 지원 방안을 모색하겠다”며, “생활체육을 통해... ",https://www.ksmnews.co.kr/news/view.php?idx=559773,https://www.ksmnews.co.kr/news/view.php?idx=559773,"Thu, 28 Aug 2025 21:04:00 +0900"
기재위,'추다르크' vs '나다르크'…법사위 빅매치 열린다 [정치 인사이드],기재위 간사인 박수영 의원은 &quot;오늘 연찬회 최고 소식은 단연 5선 나 의원이 법사위 간사를 맡았다는 것&quot;이라고 했다. 유 수석부대표는 나 의원 내정 이유에 대해 &quot;이제 선수(選數)와 어떤 상황과 관계없이 전투 모드로... ,https://www.hankyung.com/article/2025082882127,https://n.news.naver.com/mnews/article/015/0005177046?sid=100,"Thu, 28 Aug 2025 20:20:00 +0900"
임이자,&quot;농작물재해보험 제도 개선 시급···산불 피해 '부채 탕감 제도' 마련...,"한국후계농업경영인 경북도연합회 집행부가 8월 27일 임이자 국회 기획재정위원장을 만나 농작물재해보험... 이에 송종만 회장을 비롯한 한국후계농업경영인 경북도연합회 집행부는 8월 27일 상경해 국회를 방문, 임이자... ",http://www.agrinet.co.kr/news/articleView.html?idxno=339578,http://www.agrinet.co.kr/news/articleView.html?idxno=339578,"Fri, 29 Aug 2025 20:04:00 +0900"
임이자,국민 73% “세제개편 주식시장 영향”…정부 강행 속 여야 법안전,"통한 임의 전화걸기(RDD) 자동응답조사 방식으로 조사, 표본오차 95% 신뢰수준에 ±4.4%포인트) 지난 21일 서울 여의도 국회에서 열린 기획재정위원회 전체회의에서 임이자 위원장이 의사봉을 두드리고 있다. (사진 = 연합뉴스)",http://www.edaily.co.kr/news/newspath.asp?newsid=04346006642271912,https://n.news.naver.com/mnews/article/018/0006100988?sid=100,"Thu, 28 Aug 2025 18:15:00 +0900"
박수영,박수영 의원 &quot;내년 정부 예산안 부산 남구 현안사업 20억원 반영&quot;,박수영 국민의힘 의원(부산 남구)은 2026년도 정부 예산안에 남구 지역 주요 현안사업 2건이 신규 반영됐다고 29일 밝혔다. 박수영 국민의힘 의원 [사진=박수영 의원실] 2025.08.29 이번에 반영된 사업은 유엔 글로벌 빌리지... ,https://www.newspim.com/news/view/20250829000923,https://www.newspim.com/news/view/20250829000923,"Fri, 29 Aug 2025 17:38:00 +0900"
박수영,"부산 남구 , 정부 예산안에 지역 신규 현안사업 20억 반영",박수영 국민의힘 의원 (부산 남구 )은 2026년도 정부 예산안에 남구 지역의 주요 현안사업 2 건이 신규 반영됐다고 29일 밝혔다. 국민의힘 박수영 의원(부산 남구) 이번에 반영된 사업은 △ 유엔 글로벌 빌리지 건립 용역 (2 억... ,https://www.gukjenews.com/news/articleView.html?idxno=3362810,https://www.gukjenews.com/news/articleView.html?idxno=3362810,"Fri, 29 Aug 2025 17:12:00 +0900"
박수영,"&quot;사탕 같은 오후&quot;…조이, 설렘 가득한 미소→러블리 에너지 폭발",이번에 레드벨벳 조이 박수영이 직접 공개한 근황은 그 어느 때보다 더욱 소녀다운 매력으로 물들어 있었다. 엷은 금발의 긴 웨이브 헤어는 핑크색 헤어밴드와 한데 어우러져 사랑스러운 분위기를 완성했다. 핑크와... ,https://www.topstarnews.net/news/articleView.html?idxno=15786702,https://www.topstarnews.net/news/articleView.html?idxno=15786702,"Fri, 29 Aug 2025 17:06:00 +0900"
박수영,남구 숙원사업 국비 반영… 유엔 글로벌 빌리지·황령산 치유숲 조성 박...,박수영 국민의힘 의원(부산 남구). [박정우 기자] 부산 남구의 오랜 숙원사업들이 정부 예산안에 반영되며 본격 추진에 속도가 붙게 됐다. 29일 박수영 국민의힘 의원(부산 남구)은 2026년도 정부 예산안에 남구 지역 핵심... ,https://www.ziksir.com/news/articleView.html?idxno=102313,https://www.ziksir.com/news/articleView.html?idxno=102313,"Fri, 29 Aug 2025 17:04:00 +0900"
박수영,"野, 새 지도부 구성 ‘고심’… 사무총장·정책위의장 이번 주 결론","이뿐만 아니라 재선 박수영 의원, 초선 강명구·조지연 의원이 주요 당직 하마평에 오르고 있다. 장 대표의 ‘젊은 이미지’가 전당대회에서 유효하게 작용했던 만큼, 당 지도부도 ‘신선한 얼굴’로 채울 수 있다는... ",https://biz.chosun.com/policy/politics/assembly/2025/08/29/IIIBTZARBVAWDHLECYHJUCYXGA/?utm_source=naver&utm_medium=original&utm_campaign=biz,https://n.news.naver.com/mnews/article/366/0001104015?sid=100,"Fri, 29 Aug 2025 16:47:00 +0900"
박수영,&quot;우리 마을을 위해 헌신한 공무원을 칭찬합니다&quot;,"이날 전달식에는 박수영 대양면장, 정용규 가회면 부면장, 신경자 합천군의원, 배몽희 전 합천군의회 의장, 이영란 합천농협 대양지점장, 백기숙 새남부농협 가회지점장, 권현노 가회면이장협의회장, 강갑상... ",https://www.ohmynews.com/NWS_Web/View/at_pg.aspx?CNTN_CD=A0003161212&CMPT_CD=P0010&utm_source=naver&utm_medium=newsearch&utm_campaign=naver_news,https://n.news.naver.com/mnews/article/047/0002486266?sid=102,"Fri, 29 Aug 2025 15:50:00 +0900"
박수영,"해수부 부산이전, 장동혁도 'OK'...국힘 부울경 &quot;정부여당 특별법 '우려...",이전에만 국한돼 본래의 취지를 크게 훼손하고 있다&quot;고 지적했다. 이날 기자회견에는 정동만 부산시당위원장을 비롯해 곽규택·김도읍·김미애·김희정·박성훈·박수영·서지영·조승환(가나다 순) 의원이 참석했다. 부산=,https://www.pennmike.com/news/articleView.html?idxno=106878,https://www.pennmike.com/news/articleView.html?idxno=106878,"Fri, 29 Aug 2025 11:54:00 +0900"
박수영,"[기획] 최교진·주병기…이재명 정부, 다시 인사리스크 휩싸이나",부산이 지역구인 같은 당 박수영 의원은 28일 자신의 페이스북을 통해 최 후보자의 '부끄러운 부산'이란 과거 글을 꼬집어 &quot;한 나라의 장관이라면 지역감정을 줄여나가서 국민통합을 추구해야 한다. 스스로 사퇴하는 게... ,http://www.sisafocus.co.kr/news/articleView.html?idxno=345711,http://www.sisafocus.co.kr/news/articleView.html?idxno=345711,"Fri, 29 Aug 2025 08:24:00 +0900"
박수영,'추다르크' vs '나다르크'…법사위 빅매치 열린다 [정치 인사이드],기재위 간사인 박수영 의원은 &quot;오늘 연찬회 최고 소식은 단연 5선 나 의원이 법사위 간사를 맡았다는 것&quot;이라고 했다. 유 수석부대표는 나 의원 내정 이유에 대해 &quot;이제 선수(選數)와 어떤 상황과 관계없이 전투 모드로... ,https://www.hankyung.com/article/2025082882127,https://n.news.naver.com/mnews/article/015/0005177046?sid=100,"Thu, 28 Aug 2025 20:20:00 +0900"
박수영,&quot;한한령 풀리는 거 아니었어?&quot;…걸그룹 中콘서트 취소에 개미들 '비명',"박수영 한화투자증권 연구원은 &quot;시장에서 기대하는 엔터 업종에 대한 중국 관련 기대감은 한한령 해제지만, 한미 정상회담 이후 중국 내부에서 다소 불만족스러운 듯한 뉘앙스의 제스처가 나오면서 우려가 확대됐다... ",https://www.sedaily.com/NewsView/2GWSX8EYOF,https://n.news.naver.com/mnews/article/011/0004526491?sid=101,"Thu, 28 Aug 2025 20:03:00 +0900"
박수영,“코스피 부진 속 단연 돋보이네”...리듬 제대로 탄 K팝 관련주,박수영 한화투자증권 연구원은 “한미 정상회담 이후 중국 내부에서 다소 불만족스러운 듯한 뉘앙스의 제스처가 나오면서 ‘제2의 사드 보복’까지 우려가 확대됐다”면서도 “엔터기업 4곳의 2025~2026년 실적... ,https://www.mk.co.kr/article/11405535,https://n.news.naver.com/mnews/article/009/0005549356?sid=101,"Thu, 28 Aug 2025 19:19:00 +0900"
박수영,"장동혁, 해수부 이전 '조건부 찬성' 선회…부산의원 압박에 전략 수정(...","부산 지역 전체 18석 중 17석을 국민의힘이 차지하고 있으며, ▷곽규택(서·동구) ▷김대식(사상구) ▷김도읍(강서구) ▷김미애(해운대구을) ▷김희정(연제구) ▷박성훈(북구을) ▷박수영(남구) ▷백종헌(금정구) ▷서지영... ",https://www.nocutnews.co.kr/news/6392117?utm_source=naver&utm_medium=article&utm_campaign=20250828065852,https://n.news.naver.com/mnews/article/079/0004060534?sid=102,"Thu, 28 Aug 2025 18:59:00 +0900"
박수영,'부메랑?' 권성동 영장 청구에 2년 전 불체포특권 포기 서약 주목,강대식·권명호·권성동·김도읍·김병욱·김상훈·김선교·김성원·김승수·김예지·김형동·김희곤·김희국·노용호·박대수·박덕흠·박수영·박정하·서범수·서병수·서일준·서정숙·안철수·양금희·엄태영·유경준... ,https://www.imaeil.com/page/view/2025082818420978818,https://n.news.naver.com/mnews/article/088/0000967014?sid=100,"Thu, 28 Aug 2025 18:43:00 +0900"
박수영,"박수영, 韓日 공동제작 연극…'야끼니꾸 드래곤' 출연",배우 박수영이 한국과 일본이 공동으로 제작하는 연극에 출연한다. 예술의 전당과 일본 신국립극장이 한일... 박수영은 '대수'로 합류했다. 대수는 생활력도 강하고 사랑에도 적극적인 캐릭터다. 돈이 되는 일이라면... ,http://www.dispatch.co.kr/2330653,https://m.entertain.naver.com/article/433/0000120145,"Thu, 28 Aug 2025 18:05:00 +0900"
정태호,"고령교육지원청, '학생맞춤통합지원 체계 구축' 연수 실시",경북고령교육지원청(교육장 정태호)은 29일 3층 대가야홀에서 관내 초·중·고 행정실장 및 업무담당교사... 정태호 교육장은 &quot;학교 현장에서 학생맞춤통합 지원 체계 구축과 현장 중심의 협력 체계를 마련해 도움이 필요한... ,https://www.pointe.co.kr/news/articleView.html?idxno=54193,https://www.pointe.co.kr/news/articleView.html?idxno=54193,"Fri, 29 Aug 2025 21:12:00 +0900"
정태호,"&quot;전자담배 용액 수입 급증, 국회 탓 아닌 정부 관리 부실&quot;","감시단은 정태호 의원의 실태조사 요청이 지연되다 최근 한국조세재정연구원에 의뢰된 점을 들어 &quot;늦었지만 바람직한 변화&quot;라고 평가했다. 감시단은 &quot;정부는 의도된 왜곡 보도에 흔들리지 말고, 위조수입과 무허가 제조... ",https://www.newsfreezone.co.kr/news/articleView.html?idxno=643862,https://www.newsfreezone.co.kr/news/articleView.html?idxno=643862,"Fri, 29 Aug 2025 11:14:00 +0900"
정태호,[클라세] 국세 안심환급 보상제의 달콤한 유혹?,또한 지난달 15일 국회 기획재정위원회 여당 간사인 더불어민주당 정태호 의원의 보도자료에 따르면 국세청이 상반기 플랫폼을 통한 환급 신고를 전수 점검한 결과 99% 이상에서 부당 공제 사실이 적발되어 약 40억 원의... ,https://www.sejungilbo.com/news/articleView.html?idxno=54640,https://www.sejungilbo.com/news/articleView.html?idxno=54640,"Fri, 29 Aug 2025 08:10:00 +0900"
정태호,기업인권ㆍ환경실사법 발의…국내 ESG 입법 불 붙이나,"정태호 의원 등 14인이 최근 기업인권ㆍ환경실사법 발의 상시근로자 500인 이상, 전년 매출액 2000억 이상... 28일 국회 및 관련 업계에 따르면 정태호 더불어민주당 의원 등 14인은 ‘기업의 지속가능경영을 위한... ",https://www.dnews.co.kr/uhtml/view.jsp?idxno=202508281050307390413,https://www.dnews.co.kr/uhtml/view.jsp?idxno=202508281050307390413,"Fri, 29 Aug 2025 06:22:00 +0900"
기재부,"“돈 없으면 청약 당첨돼도 그림의 떡”…분양 시장, 현금여력 꼼꼼히 ...",기재부는 작년 11월 전까지 매수자가 부담하는 양도세를 최초 1회만 양도가액에 합산하는 것을 허용했다. 즉... 하지만 작년 11월 이후 기재부는 해석을 바꿔 매수자가 부담하는 양도세 전부를 양도가액에 합산하도록... ,https://www.mk.co.kr/article/11406505,https://n.news.naver.com/mnews/article/009/0005549992?sid=101,"Sat, 30 Aug 2025 06:12:00 +0900"
기재부,교육세 더 걷어 어디에 쓰나 보니…‘서울대 10개 만들기’에 8700억 투...,"5%에서 1.0%로 인상하기로 했으며, 이에 따라 늘어나는 세수는 고등·평생교육지원특별회계로 전입될 예정이다. 기재부는 이번 세율 인상으로 전년 대비 약 1조3000억원에 달하는 세수 증가가 있을 것으로 내다봤다.",https://www.mk.co.kr/article/11406502,https://n.news.naver.com/mnews/article/009/0005549989?sid=101,"Sat, 30 Aug 2025 06:09:00 +0900"
기재부,내년 확장재정 기조…농업예산 20조 돌파 ‘기대’,기재부에 따르면 내년 농림·수산·식품 분야 예산은 27조9000억원으로 전년보다 7.7% 확대된다. 이 비율을 적용하면 순수 농업예산은 최초로 20조원대에 진입하게 된다. 농림축산식품부 세부 예산안은 9월1일 오전... ,https://www.nongmin.com/article/20250829500515,https://n.news.naver.com/mnews/article/662/0000076601?sid=100,"Sat, 30 Aug 2025 06:01:00 +0900"
기재부,임기 내내 적자 감수한 이재명 정부 예산안…승부수 통할까,"기재부 유병서 예산실장도 &quot;오히려 경기 대응 쪽에서는 조금 미흡하다고 얘기하는 측면도 있다&quot;고 털어놓고, &quot;내년 지출증가율을 8%는 늘려야 잠재성장률 수준까지 올릴 수 있다는 측면에서 증가율을 잡았다&quot;고... ",https://www.nocutnews.co.kr/news/6392730?utm_source=naver&utm_medium=article&utm_campaign=20250830050048,https://n.news.naver.com/mnews/article/079/0004060950?sid=101,"Sat, 30 Aug 2025 05:01:00 +0900"
기재부,&quot;권리예산 보장!&quot; 전장연 떠난 자리…환경실무원만 남았다[현장],스티커에는 전장연이 기재부를 상대로 시위를 벌인 배경인 △장애인 특별교통수단 운전원 인건비 보장... 기재부와 행정안전부로 연결되는 민원동 출입구 곳곳에는 전장연 회원들이 매직으로 쓴 '구윤철(부총리 겸 기재부... ,https://www.etoday.co.kr/news/view/2501443,https://www.etoday.co.kr/news/view/2501443,"Sat, 30 Aug 2025 05:00:00 +0900"
기재부,매년 불어나는 예산에 4년 후 국가채무 비율 58%… 재정건전성 '경고등...,기재부는 내년 예산안 편성에 따라 국채가 116조 원 순증할 것으로 보고 있다. 이에 따른 국채 이자비용은 36조 원에 이를 것으로 추정된다. 2029년에는 이자비용이 44조 원까지 20% 이상 늘어난다. 결국 국가채무는... ,https://www.hankookilbo.com/News/Read/A2025082816430002593?did=NA,https://n.news.naver.com/mnews/article/469/0000884376?sid=101,"Sat, 30 Aug 2025 04:31:00 +0900"
기재부,"“원화 스테이블코인, 통화주권·금융허브 위한 인프라”","정부 거버넌스와 관련해서는 대통령 직속 디지털자산위원회를 설치하고 기재부, 금융위, 한은, 과기정통부 등이 참여하는 다기관 협업 체제를 구축할 것을 제안했다. 감사원의 제도 참여, AI 기반 감독·규제샌드박스... ",https://www.asiatoday.co.kr/view.php?key=20250830000221422,https://www.asiatoday.co.kr/view.php?key=20250830000221422,"Sat, 30 Aug 2025 02:28:00 +0900"
기재부,[패트롤] 과천시-광명시-안산시-안양시-의왕시,"전환점&quot;이라며 “기재부, 캠코와 지속적인 협력을 이어가 사업이 신속하게 마무리될 수 있도록 끝까지... 이후 2021년 7월 부지 소유권이 기획재정부로 이전되고, 같은 해 12월 기재부 국유재산정책심의위원회에서 개발... ",https://www.ekn.kr/web/view.php?key=20250829026411939,https://www.ekn.kr/web/view.php?key=20250829026411939,"Sat, 30 Aug 2025 02:00:00 +0900"
기재부,"예산사업 1300개 폐지, 지출 27조 줄인다","기재부는 총 1만7000개 예산 사업을 구조조정 대상으로 검토하고, 이 중 4분의 1에 해당하는 4400개 사업의 예산을 줄였다. 1300여 개 사업은 아예 폐지됐다. 특히 ODA 예산은 1조1000억 원 삭감됐다. 기재부 관계자는... ",https://www.donga.com/news/Economy/article/all/20250830/132284951/2,https://n.news.naver.com/mnews/article/020/0003657637?sid=101,"Sat, 30 Aug 2025 01:44:00 +0900"
기재부,주4.5일 中企에 1인당 월 20만원… ‘소멸’ 농어촌엔 기본소득 15만원,기재부 등 주요 정부 부처가 몰려 있는 세종특별자치시에 국회 세종의사당과 대통령 세종 집무실을 건립하겠다는 공약을 구체화하기 위한 부지 매입비·설계비 등 1196억원도 이번 예산안에 넣었다. 민생 범죄를... ,https://www.chosun.com/economy/economy_general/2025/08/30/QGRNHKEJLZGBNACJFH3TQRRGTI/?utm_source=naver&utm_medium=referral&utm_campaign=naver-news,https://n.news.naver.com/mnews/article/023/0003926194?sid=101,"Sat, 30 Aug 2025 00:56:00 +0900"
기재부,[사설] 역대 최대 예산 증액…나랏빚 관리 문제 없나,당시 이재명 경기도지사는 이 칼럼을 SNS에 올리면서 “기재부와 야당 보수경제지들은 이 주장을 반박할 수 있으면 해보라”고 썼다. 한데 그때와 상황이 좀 달라졌다. 내년 정부가 발행하는 적자국채는 110조원이다.... ,https://www.joongang.co.kr/article/25362875,https://n.news.naver.com/mnews/article/353/0000052759?sid=110,"Sat, 30 Aug 2025 00:15:00 +0900"
기재부,[사설] 역대 최대 예산 증액…나랏빚 관리 문제 없나,당시 이재명 경기도지사는 이 칼럼을 SNS에 올리면서 “기재부와 야당 보수경제지들은 이 주장을 반박할 수 있으면 해보라”고 썼다. 한데 그때와 상황이 좀 달라졌다. 내년 정부가 발행하는 적자국채는 110조원이다.... ,https://www.joongang.co.kr/article/25362876,https://n.news.naver.com/mnews/article/025/0003465468?sid=110,"Sat, 30 Aug 2025 00:14:00 +0900"
기재부,[사설] '악어의 입' 경고 떠올리게 하는 국가채무비율 급등,"구윤철 부총리 겸 기재부 장관의 “경기가 나쁠 때 적자 관리만 하는 게 정부 역할 맞느냐”는 반문도... 기재부 계획을 보면 총지출 증가율은 2027년과 2028년 각 5%, 2029년에도 4%로 잡혀 있다. 국내총생산(GDP) 대비... ",https://www.hankyung.com/article/2025082909691,https://n.news.naver.com/mnews/article/015/0005177714?sid=110,"Sat, 30 Aug 2025 00:13:00 +0900"
