Keyword,Title,Description,Original Link,Link,Publication Date
재경부,"정부, 채권시장 안정화 위해 1분기 발행량 줄인다","25일 재경부는 ‘채권 발행기관 협의체’ 1차 회의를 개최하고, 올해 1분기 채권발행량을 축소조정하기로... 이날 회의에선 재경부, 금융위, 금감원, 산은, 수은, 기은, 한전, 주금공, LH, 장학재단 등 채권시장 관계기관과... ",https://www.mk.co.kr/article/11971855,https://n.news.naver.com/mnews/article/009/0005641951?sid=101,"Wed, 25 Feb 2026 16:54:00 +0900"
재경부,"정부, 1분기 채권 발행량 축소 조정…&quot;WGBI 편입 대비&quot;","재정경제부는 25일 강윤진 재경부 국고정책관 주재로 채권 발행기관 협의체 제1차 회의를 열고 채권시장 여건과 기관별 발행 실적 및 향후 계획을 점검했다고 밝혔다. 이번 회의에는 금융위원회, 금융감독원과... ",https://www.ajunews.com/view/20260225165236845,https://www.ajunews.com/view/20260225165236845,"Wed, 25 Feb 2026 16:54:00 +0900"
재경부,"정부, 1분기 공적채권 발행 6조 줄인다…'수급 부담 완화'","재경부 관계자는 &quot;시장 상황을 면밀히 모니터링하고, 채권시장 변동성을 최소화할 수 있도록 적극 공조하는데 의견을 같이 했다&quot;고 설명했다. 이어 &quot;분기별로 협의체 회의를 거쳐 발행량을 협의조정하고, 시장안정 등을... ",https://news.einfomax.co.kr/news/articleView.html?idxno=4400402,https://news.einfomax.co.kr/news/articleView.html?idxno=4400402,"Wed, 25 Feb 2026 16:52:00 +0900"
재경부,李 대통령 &quot;바가지·호객행위 '악질적 횡포'…뿌리 뽑아야&quot;,"이날 회의에는 이 대통령과 김민석 국무총리, 구윤철 재경부 장관, 최교진 교육부 장관, 최휘영 문체부 장관, 김윤덕 국토부 장관, 한성숙 중기부 장관, 이부진 한국방문의해위원장 관계 부처장 등과 항공사·크루즈... ",http://www.inews24.com/view/1942792,https://n.news.naver.com/mnews/article/031/0001008330?sid=100,"Wed, 25 Feb 2026 16:05:00 +0900"
재경부,"동화약품, 사외이사에 우병우 전 민정수석…4세 체제 굳힌다","윤 대표는 윤도준 동화약품 회장의 장남으로 2013년 8월 재경부로 입사했다. 이후 전략기획실과 생활건강사업부, OTC 총괄사업부 등 주요 부서를 거쳤다. 지난해 정기주주총회에서 사내이사로 선임된 뒤 이사회에서 유준하... ",https://www.sedaily.com/article/20012563?ref=naver,https://n.news.naver.com/mnews/article/011/0004593361?sid=101,"Wed, 25 Feb 2026 15:48:00 +0900"
재경부,"李대통령 &quot;관광 성장 과실, 지역 골목상권까지 돌아가야&quot;","문체부의 '방한관광 대전환 및 지역관광 대도약 방안', 법무부의 '출입국 편의 제고 방안', 국토부의 '지방공항의 인바운드 거점화 전략', 해수부의 '크루즈관광 수용태세 개선', 재경부의 '바가지요금 근절대책' 순으로... ",https://www.newsworks.co.kr/news/articleView.html?idxno=832171,https://www.newsworks.co.kr/news/articleView.html?idxno=832171,"Wed, 25 Feb 2026 15:42:00 +0900"
재경부,李 &quot;外관광객 3천만 조기 달성&quot;…방한 문턱 낮추고 바가지요금 정조준 ...,"이날 회의에는 이 대통령과 김민석 국무총리, 재경부 장관, 교육부 장관, 문체부 장관, 국토부 장관, 중기부 장관 등 관계 부처장과 항공사·크루즈·여행업·숙박업 등 관광산업 기업들이 참석했다.",https://www.news1.kr/industry/hotel-tourism/6081329,https://n.news.naver.com/mnews/article/421/0008793135?sid=103,"Wed, 25 Feb 2026 15:27:00 +0900"
재경부,"&quot;뼈 깎는 자구책엔 파격 보상&quot;... 정부, 대산 1호에 10조 '인공호흡기'",특히 피합병법인의 설비를 2년 이상 보유하고 50% 이상 사용해야 하는 '사업의 계속성 요건'이 걸림돌이었으나 재경부의 전향적인 유권해석을 통해 중복 자산 가동을 중단하더라도 적격합병 과세이연 혜택을 유지할 수... ,https://www.mt.co.kr/economy/2026/02/25/2026022514433085034,https://n.news.naver.com/mnews/article/008/0005322129?sid=101,"Wed, 25 Feb 2026 15:09:00 +0900"
재경부,유럽산 벽지·장판 원료 '덤핑'에 철퇴…6월까지 최대 43% 관세,이에 재경부는 최종 판정이 나오기 전이라도 피해 확산을 막기 위해 관세를 매기기로 결정했다. 공급자별... 재경부는 관계자는 “관세법상 덤핑 조사가 시작된 경우 해당 사실과 그로 인한 실질적 피해 등 사실이... ,http://www.edaily.co.kr/news/newspath.asp?newsid=04756006645354128,https://n.news.naver.com/mnews/article/018/0006224478?sid=101,"Wed, 25 Feb 2026 15:01:00 +0900"
재경부,K-관광 바가지 요금 근절대책 발표하는 강기룡 재경부 차관보,강기룡 재정경제부 차관보(오른쪽)가 지난 24일 세종시 정부세종청사 중앙동에서 제11차 국가관광전략회의에서 논의될 관광객을 대상으로 하는 '바가지요금' 근절대책'을 발표하고 있다.2026.2.25/뉴스1,https://www.news1.kr/photos/7766668,https://n.news.naver.com/mnews/article/421/0008792994?sid=102,"Wed, 25 Feb 2026 15:00:00 +0900"
재경부,K-관광 바가지 요금 근절대책 발표하는 강기룡 재경부 차관보,강기룡 재정경제부 차관보(오른쪽)가 지난 24일 세종시 정부세종청사 중앙동에서 제11차 국가관광전략회의에서 논의될 관광객을 대상으로 하는 '바가지요금' 근절대책'을 발표하고 있다.2026.2.25/뉴스1,https://www.news1.kr/photos/7766663,https://n.news.naver.com/mnews/article/421/0008792990?sid=102,"Wed, 25 Feb 2026 15:00:00 +0900"
재경부,바가지요금 뿌리뽑는다…부당운임 땐 최대 '영업장 폐쇄',▮자율요금 사전 신고제 시행하기로 재정경제부(재경부)는 25일 이재명 대통령 주재로 열린 제11차... 재경부는 “이 제도가 시행되면 (사업자가) 임의로 과도한 바가지요금을 책정하지 못할 것”이라며 “이를 통해... ,http://www.kookje.co.kr/news2011/asp/newsbody.asp?code=0200&key=20260225.99099006963,https://n.news.naver.com/mnews/article/658/0000136205?sid=101,"Wed, 25 Feb 2026 14:59:00 +0900"
재경부,대통령이 질타한 '공공계약 선금' 관리 강화한다,재정경제부는 25일 구윤철 경제부총리 겸 재경부 장관 주재로 열린 ‘경제관계장관회의 겸 산업경쟁력강화... 재경부 관계자는 “재정 당국으로서 관례로 내려갔던 자금이 실제 필요한 적기에 지급될 수 있도록... ,https://www.etoday.co.kr/news/view/2559498,https://www.etoday.co.kr/news/view/2559498,"Wed, 25 Feb 2026 14:54:00 +0900"
재경부,"바가지 시장 '온누리 상품권' 못 쓴다…정부, 폭리 점포 가맹 취소",강기룡 재경부 차관보는 전날 정부세종청사에서 열린 브리핑에서 &quot;이런 모든 행위들이 결국은 우리 시장경제 질서를 굉장히 저해하는 측면이 있다&quot;며 &quot;극소수 업자들의 위법행위 때문에 대다수 선량한 업자들이 피해를... ,https://www.news1.kr/economy/trend/6081758,https://n.news.naver.com/mnews/article/421/0008792924?sid=101,"Wed, 25 Feb 2026 14:51:00 +0900"
재경부,"“폭리 노리면 폭망”…‘K바가지’ 숙박·택시, 영업정지 철퇴 맞는다",강기룡 재경부 차관보는 “BTS 공연을 앞둔 부산지역 숙박업소의 가격 급등과 같은 일이 다시 벌어지지 않도록 하기 위한 조치”라며 “상반기 중 관련 법적 근거를 마련하고 중앙숙박협회 등과 업무협약을 맺을 예정”... ,http://www.edaily.co.kr/news/newspath.asp?newsid=04637926645354128,https://n.news.naver.com/mnews/article/018/0006224446?sid=101,"Wed, 25 Feb 2026 14:46:00 +0900"
재경부,[국가관광전략회의] 바가지 뿌리뽑고 관광객 늘린다…'다시 찾고싶은 한...,이주섭 재경부 민생경제국장은 &quot;상한 가격 사전신고 주기를 연 1회로 고려하고 있다&quot;며 &quot;가격을 게시하는 것... 강기룡 재경부 차관보는 &quot;시장에서 (요금 책정이) 원활하게 작동한다면 정부가 개입할 이유가 없지만 평상시... ,https://www.ajunews.com/view/20260225140309590,https://www.ajunews.com/view/20260225140309590,"Wed, 25 Feb 2026 14:46:00 +0900"
재경부,BTS 숙박비 논란 속 ‘바가지요금’ 제동…가격표시 위반에 ‘즉시 영업...,"강기룡 재경부 차관보는 “이른 시일 내에 입법을 통해서 공백을 보완하겠다”며 “지방정부와 지역 플랫폼 업체 간 자율적인 방법을 찾고, 공급이 부족해 생기는 문제다 보니 지자체에서 숙박시설이나 공공 휴양시설을... ",https://biz.heraldcorp.com/article/10682204?ref=naver,https://n.news.naver.com/mnews/article/016/0002604994?sid=101,"Wed, 25 Feb 2026 14:38:00 +0900"
재경부,음식점·숙박업 '바가지' 뿌리 뽑는다…적발 즉시 '영업 정지',재경부는 &quot;현지 정보가 부족한 관광객을 대상으로 한 일부 바가지 업자의 한탕주의 행태는 대다수 선량한... 재경부는 &quot;관련 법령개정 등 후속 조치를 신속히 추진할 예정&quot;이라며 &quot;주요 과제가 현장에 빠르게 안착해... ,https://news.einfomax.co.kr/news/articleView.html?idxno=4400352,https://news.einfomax.co.kr/news/articleView.html?idxno=4400352,"Wed, 25 Feb 2026 14:36:00 +0900"
재경부,'BTS 공연하니 숙박비 10배' 바가지 막는다…누적 적발시 '영업장 폐쇄',"사전신고제가 업계 담합으로 이어질 수 있다는 우려에 대해 이주섭 재경부 민생경제국장은 브리핑에서... 강기룡 재경부 차관보는 &quot;관련된 협회와 숙박 플랫폼, 소비자 등 다양한 주체들이 자율적으로 점검·지도하고... ",https://www.news1.kr/economy/trend/6081651,https://n.news.naver.com/mnews/article/421/0008792830?sid=101,"Wed, 25 Feb 2026 14:36:00 +0900"
재경부,"정부, '대산1호' 취득세 100%·투자상생협력촉진세 50% 감면","구윤철 부총리 겸 재정경제부 장관이 25일 서울 종로구 정부서울청사에서 열린 경제관계장관회의 겸 산업경쟁력강화 관계장관회의를 주재, 모두발언을 하고 있다.(사진=재경부)",https://www.taxtimes.co.kr/news/article.html?no=273964,https://www.taxtimes.co.kr/news/article.html?no=273964,"Wed, 25 Feb 2026 14:32:00 +0900"
재경부,작년 대외채무 14% 급증…1100조원 돌파,재경부는 “2026년 4월 세계국채지수(WGBI) 편입을 앞두고 한국 채권에 대한 외국인 투자가 늘어나는... 다만 재경부는 “건전성 지표가 전년 말 대비 다소 상승했으나 여전히 안정적 수준”이라며 “국내... ,https://www.joongang.co.kr/article/25407239,https://n.news.naver.com/mnews/article/025/0003505132?sid=101,"Wed, 25 Feb 2026 14:28:00 +0900"
재경부,"KB금융, 새 사외이사 후보에 서정호 변호사 추천","KB금융지주 사외이사후보추천위원회는 25일 신임 사외이사 후보로 서정호 변호사(57·사진)를 추천했다. 서 변호사는 행정고시와 사법고시에 모두 합격한 인물로 국세청과 재정경제부, 법무법인 세종, 신영증권 등을 거쳐... ",https://www.hankyung.com/article/202602254065i,https://n.news.naver.com/mnews/article/015/0005255019?sid=101,"Wed, 25 Feb 2026 14:14:00 +0900"
재경부,‘제2의 다원시스’ 막는다… 李 질타한 공공계약 선금지급 관리 강화,재경부는 관련 계약예규 개정을 올해 1분기 중으로 완료할 예정이다. 선금 제도는 원자재 구매 등 원활한... 재경부 관계자는 “재정 당국으로서 관례적으로 내려갔던 자금에 대해 실제 필요한 적기에 지급될 수 있도록... ,https://www.mk.co.kr/article/11971592,https://n.news.naver.com/mnews/article/009/0005641776?sid=101,"Wed, 25 Feb 2026 14:10:00 +0900"
재경부,공공계약 선금 첫 지급률 30~50%로···이 대통령 ‘철도차량 사기’ 지...,재경부 관계자는 “관행에서 벗어나 실제 필요한 돈이 적기에 지급될 수 있도록 중간 관리를 해보겠다는 취지”라며 “현금 지급과 실제 집행 간 괴리가 최소화될 것”이라고 말했다. 선금 활용을 증빙하는 방식도 더... ,https://www.khan.co.kr/article/202602251338001,https://n.news.naver.com/mnews/article/032/0003429676?sid=101,"Wed, 25 Feb 2026 13:38:00 +0900"
재경부,공공계약 선금한도 100→70%로 축소…관리 강화,재경부는 관련 계약예규 개정을 1분기 중으로 완료할 예정이다. 구윤철 부총리 겸 재정경제부 장관이 25일... 재경부는 이를 통해 연말에 집중되던 자금 집행 수요를 완화하고 회계연도 기준 재정 관리와의 정합성을... ,https://www.naeil.com/news/read/579093?ref=naver,https://www.naeil.com/news/read/579093?ref=naver,"Wed, 25 Feb 2026 13:06:00 +0900"
재경부,외국인 국채 러시에 대외채무 940억달러 급증…단기외채 비율 14년 만에...,재경부는 &quot;외국 투자 자금의 국내 유입 흐름이 대외채무 증가로 이어졌다&quot;고 설명했다. 문제는 외환... 재경부 관계자는 &quot;외국인 투자 흐름이 지속되도록 외환·자본시장 활성화 정책을 차질 없이 추진하겠다&quot;고... ,https://www.imaeil.com/page/view/2026022512174263700,https://n.news.naver.com/mnews/article/088/0000998350?sid=101,"Wed, 25 Feb 2026 12:19:00 +0900"
재경부,"동화약품, 이사회 전면 재편…4세 경영 장악력 강화","윤인호 대표는 윤도준(74) 동화약품 회장의 장남으로, 지난 2013년 8월 동화약품 재경부에 입사했다. 이후 전략기획실, 생활건강사업부, OTC 총괄사업부 등 주요 부서를 두루 거쳤다. 지난해 주주총회에선 사내이사로... ",https://new.dailypharm.com/user/news/335977?REFERER=NP,https://new.dailypharm.com/user/news/335977?REFERER=NP,"Wed, 25 Feb 2026 12:10:00 +0900"
재경부,작년 대외채무 14%↑ 7669억달러…재경부 &quot;단기외채 늘었지만 건전성 양...,"재경부는 총대외채무 대비 단기외채 비중(2024년 말 21.8%→2025년 말 23.3%), 준비자산 대비 단기외채 비율(35.... 재경부는 &quot;글로벌 통상환경과 통화정책 변화, 지정학적 리스크 상존 등 국제 여건이 불확실한 상황에서... ",https://www.news1.kr/economy/trend/6082408,https://n.news.naver.com/mnews/article/421/0008792392?sid=101,"Wed, 25 Feb 2026 12:09:00 +0900"
기획처,"소년원 내 정신과 전문의 부족…정부, 예산 투입 검토",기획처와 법무부는 이날 논의된 내용을 토대로 위기 청소년 지원 정책의 실효성을 높이기 위한 후속 조치를 검토하고 관련 사항을 내년 예산안과 향후 정책 추진 과정에 반영할 계획이다,https://www.dailian.co.kr/news/view/1614174/?sc=Naver,https://n.news.naver.com/mnews/article/119/0003062997?sid=101,"Wed, 25 Feb 2026 17:01:00 +0900"
기획처,"위기 청소년 교육·치료·가족 회복까지…기획처, 맞춤형 장기 지원 추...",기획처는 25일 오후 경기 안양소년원에서 '위기 청소년의 일상 회복을 위한 현장 간담회'를 개최했다고... 이제훈 기획처 행정국방예산심의관은 &quot;단기적 대응을 넘어 장기적 관점에서 지속적이고 집중적인 지원이 필요하다... ,https://www.newsis.com/view/NISX20260225_0003526255,https://n.news.naver.com/mnews/article/003/0013788371?sid=101,"Wed, 25 Feb 2026 17:00:00 +0900"
기획처,"기획처, 안양소년원서 '위기 청소년 일상 회복 지원' 전문가 간담회","기획처에 따르면 이번 간담회는 소년원에 근무하는 교사진, 의료진 등을 비롯한 현장 전문가와 기획처, 법무부, 교육청, 경찰청 등 관계부처 담당자들이 모여 위기 청소년을 위한 교육·심리 치료 강화 및 가족 관계 지원 등... ",https://www.news1.kr/economy/trend/6082957,https://n.news.naver.com/mnews/article/421/0008793508?sid=101,"Wed, 25 Feb 2026 17:00:00 +0900"
기획처,"소년원 찾은 정부, '위기 청소년'의 일상회복 위한 간담회",이제훈 기획처 행정국방예산심의관은 &quot;일상 회복이 필요한 위기 청소년의 특성에 맞게 단기적 임시 대응을 넘어 장기적 관점에서 지속·집중적인 지원이 필요하다&quot;고 말했다. 기획처와 법무부는 이날 논의된 내용을 토대로... ,https://www.yna.co.kr/view/AKR20260225133400002?input=1195m,https://n.news.naver.com/mnews/article/001/0015924632?sid=101,"Wed, 25 Feb 2026 17:00:00 +0900"
기획처,"정부, 연 130조 수가 개편 추진…고위험·저보상 필수의료 보상 강화","오늘 간담회에서 기획처와 복지부는 지역·필수의료 공백 해소를 위해 △건강보험 수가체계 개선... 조용범 기획처 예산실장은 &quot;국정과제의 주요내용인 의료의 지역격차 해소, 필수의료 확충, 공공의료 강화 등 3가지... ",http://www.bosa.co.kr/news/articleView.html?idxno=2270623,http://www.bosa.co.kr/news/articleView.html?idxno=2270623,"Wed, 25 Feb 2026 16:32:00 +0900"
기획처,&quot;건보 손질해 필수의료 확충…국립대 연계로 지역의료체계 구축&quot;,"기획처와 복지부는 지역·필수의료 공백 해소를 위해 △건강보험 수가체계 개선 △국립대병원 중심... 조용범 기획처 예산실장은 &quot;국정과제의 주요내용인 의료의 지역격차 해소, 필수의료 확충, 공공의료 강화 등 세가지... ",https://www.ajunews.com/view/20260225152536717,https://www.ajunews.com/view/20260225152536717,"Wed, 25 Feb 2026 15:48:00 +0900"
기획처,지역·필수의료 보상 강화…130조 건보수가 전면 개편,조용범 기획처 예산실장은 &quot;2027년 신설되는 지역필수의료 특별회계를 통해 보건의료 지원 예산을 안정적으로 마련해 지역완결적 의료체계 구축을 위한 지원을 강화할 것&quot;이라며 &quot;건강보험 수가체계에 대한 구조개혁이... ,https://view.asiae.co.kr/article/2026022515342622835,https://n.news.naver.com/mnews/article/277/0005725915?sid=102,"Wed, 25 Feb 2026 15:34:00 +0900"
기획처,"정부, 130조 건강보험 수가체계 개편…필수의료 공급 강화","기획처는 이날 세종충남대학교병원에서 보건복지부, 교육부, 10개 국립대병원과 함께 지역·필수의료 간담회를 개최했다. 이번 간담회는 수도권 의료 인프라 집중과 지역·필수의료 공백 심화에 대응해 지역완결적... ",https://www.etnews.com/20260225000366,https://n.news.naver.com/mnews/article/030/0003402029?sid=101,"Wed, 25 Feb 2026 15:19:00 +0900"
기획처,130조 건강보험 수가체계 정부 개편 추진…지역·필수의료 보상 강화,"기획처와 복지부는 건강보험 수가체계개선과 더불어 국립대병원 중심 협력 네트워크 구축, 중증최종치료 역량 확충, 필수의료인력 양성확충 등을 4대 개선과제를 제시했습니다. 기획처는 올해 약 2천억원 수준인... ",https://biz.sbs.co.kr/article_hub/20000293575?division=NAVER,https://n.news.naver.com/mnews/article/374/0000494375?sid=103,"Wed, 25 Feb 2026 15:14:00 +0900"
기획처,"정부, 130조 건강보험 수가체계 개편 추진…&quot;구조개혁 필수적&quot;","기획처와 복지부는 건강보험 수가체계 개선과 더불어 국립대병원 중심 협력 네트워크 구축, 중증·최종치료 역량 확충, 필수의료인력 양성·확충 등을 4대 개선과제를 제시했다. 기획처는 올해 약 2천억원 수준인... ",https://news.einfomax.co.kr/news/articleView.html?idxno=4400361,https://news.einfomax.co.kr/news/articleView.html?idxno=4400361,"Wed, 25 Feb 2026 15:06:00 +0900"
기획처,"기획처, 건보 재편해 지역·필수의료 메운다…국립대병원 허브 역할 강...","기획처는 25일 세종충남대학교병원에서 보건복지부와 교육부, 10개 국립대병원과 지역·필수의료 간담회를... 이날 기획처와 복지부 등은 ▲건강보험 수가체계 개선 ▲국립대병원 중심 협력 네트워크(Hub &amp; Spoke) 구축... ",https://www.newspim.com/news/view/20260225000840,https://www.newspim.com/news/view/20260225000840,"Wed, 25 Feb 2026 15:04:00 +0900"
기획처,기획처 예산실장 &quot;지역격차 등 의료 3대 과제에 재정지원 확대&quot;,"기획처는 이날 세종충남대학교병원에서 보건복지부, 교육부, 10개 국립대병원과 함께 지역·필수의료... 기획처와 복지부는 4대 개선과제로 ▲건강보험 수가체계 개편 ▲국립대병원 중심 협력네트워크(Hub &amp; Spoke) 구축... ",https://www.newsis.com/view/NISX20260225_0003526067,https://n.news.naver.com/mnews/article/003/0013787608?sid=101,"Wed, 25 Feb 2026 14:25:00 +0900"
기획처,"기획처, 세번째 양극화 간담회...노동시장의 AI 전환 대응 논의","이병연 기획처 통합성장정책관은 &quot;첨단기술 분야의 발전은 일자리 지형에 구조적 변화를 동반하는 만큼, 이에 맞춰 정책방향도 민간의 수요를 면밀히 파악하고, 산업-고용 관점을 아우르는 접근이 중요하다&quot;고... ",https://news.bbsi.co.kr/news/articleView.html?idxno=4068818,https://news.bbsi.co.kr/news/articleView.html?idxno=4068818,"Wed, 25 Feb 2026 14:12:00 +0900"
기획처,"기획예산처, AI 전환기 일자리 양극화 대응…32조 투입",기획처는 올해 예산을 통해 직접일자리와 고용서비스 등 재정지원 일자리를 전년 대비 6.2% 늘린 32조3000억원 규모로 확대했다. 특히 7만명을 대상으로 1800억원 규모의 AI 융복합 직업훈련을 신설·재투자했다고 설명했다.... ,https://www.etnews.com/20260225000263,https://n.news.naver.com/mnews/article/030/0003401934?sid=101,"Wed, 25 Feb 2026 14:11:00 +0900"
기획처,"정부, 일자리 양극화 해소에 32.3조 투입","(사진=연합뉴스) 기획처는 25일 정부세종청사에서 한국직업능력연구원, 한국개발연구원(KDI), 산업연구원 등... 우선 기획처는 우리 경제 최우선 과제 중 하나로 '일자리 불균형'을 꼽았습니다. 최근 쉬었음 청년이 70만명을... ",http://www.newstomato.com/ReadNews.aspx?no=1292407&inflow=N,http://www.newstomato.com/ReadNews.aspx?no=1292407&inflow=N,"Wed, 25 Feb 2026 13:58:00 +0900"
기획처,일자리 양극화 해소 32조 투입,"이혜림 기획처 포용사회전략과장은 “AI가 산업혁신을 일으키되, 그것이 일자리 소멸이 아닌 상생으로 이어질 수 있도록 정부의 역할을 강화할 것”이라며 “현장의 목소리를 반영해 노동시장 이중구조 해소를 위한... ",https://www.naeil.com/news/read/579092?ref=naver,https://www.naeil.com/news/read/579092?ref=naver,"Wed, 25 Feb 2026 13:10:00 +0900"
기획처,"기획처 복권위원회, 정월대보름 맞아 쪽방촌 도시락 나눔",행복공감봉사단 80여명 참여…오곡밥·생활용품 400명에 전달 복권기금으로 전세임대 4300호·난방개선 3.7만가구 지원 임기근 기획예산처 장관 직무대행 차관이 2월 25일 오전 서울 종로구 초동교회에서 열린 ‘제19기... ,https://biz.heraldcorp.com/article/10682080?ref=naver,https://n.news.naver.com/mnews/article/016/0002604907?sid=101,"Wed, 25 Feb 2026 12:12:00 +0900"
기획처,"기획처, 정월대보름 맞아 쪽방촌 400명에 오곡밥 도시락 전달","임기근 기획처 장관 직무대행 차관은 봉사활동에 앞서 열린 제19기 행복공감봉사단 발대식에서 복권홍보대사 겸 봉사단장인 배우 박하선 씨와 봉사단 대표에게 위촉장을 수여했다. 이어 복권위원회 민간위원, 봉사단장... ",https://www.news1.kr/economy/trend/6082239,https://n.news.naver.com/mnews/article/421/0008792374?sid=101,"Wed, 25 Feb 2026 12:00:00 +0900"
기획처,"복권위 행복공감봉사단, 쪽방촌에 대보름 도시락 배달 봉사",기획예산처 복권위원회는 25일 서울 종로구 돈의동 쪽방촌에서 '정월대보름맞이 도시락 배달' 봉사활동을 진행했다고 밝혔다. 이번 봉사활동은 정월대보름을 앞두고 쪽방촌 주민들에게 오곡밥 도시락과 생활용품을 전달... ,https://www.newsis.com/view/NISX20260225_0003525253,https://n.news.naver.com/mnews/article/003/0013787123?sid=101,"Wed, 25 Feb 2026 12:00:00 +0900"
기획처,"기획처 복권위, 돈의동 쪽방촌 '도시락 배달' 봉사활동",임기근 장관대행 및 봉사단장 박하선 배우 등 80여명 참여 기획예산처 복권위원회는 25일 서울 종로구 돈의동 쪽방촌을 찾아 '정월대보름맞이 도시락 배달' 봉사활동을 진행했다고 밝혔다. 복권위원장을 맡고 있는... ,https://www.yna.co.kr/view/AKR20260225078600002?input=1195m,https://n.news.naver.com/mnews/article/001/0015923428?sid=101,"Wed, 25 Feb 2026 12:00:00 +0900"
기획처,"&quot;AI 전환에 일자리 지형 변화 불가피&quot;…기획처, 양극화 대응 간담회",기획처는 25일 정부세종청사에서 ‘일자리’를 주제로 양극화 대응방향 모색을 위한 제3차 릴레이 간담회를... 간담회를 주재한 이병연 기획처 통합성장정책관은 &quot;첨단기술 분야의 발전은 일자리 지형에 구조적 변화를... ,https://www.ajunews.com/view/20260225094457327,https://www.ajunews.com/view/20260225094457327,"Wed, 25 Feb 2026 11:32:00 +0900"
