Keyword,Title,Description,Original Link,Link,Publication Date
오기형,[이로운주목]기초연금 개편·퇴직연금 기금화 논의 본격화…국민연금 이...,"토론회에는 남인순 연금개혁특위 위원장을 비롯해 오기형·김남근·김윤·박희승 의원이 참여했고, 김성주... 오기형 의원은 &quot;노인 70%에게 기초연금을 지급하는 구조가 지속 가능한지, 국민연금과의 연계가 효율적인지에... ",https://www.eroun.net/news/articleView.html?idxno=72217,https://www.eroun.net/news/articleView.html?idxno=72217,"Fri, 30 Jan 2026 17:12:00 +0900"
오기형,"[핀포인트] [삼목에스폼] 국회에 간 주주연대, &quot;자본 1조인데 배당 86억...",더불어민주당 김남근·오기형·이강일 의원과 경제개혁연대가 주최한 이날 행사에서 이 대표는 삼목에스폼을 기업 거버넌스 훼손의 대표 사례로 지목하며 구체적인 피해 현황과 제도 개선안을 발표했다. 이 대표는 먼저... ,https://news.dealsitetv.com/articles/164851,https://news.dealsitetv.com/articles/164851,"Fri, 30 Jan 2026 17:12:00 +0900"
오기형,&quot;주주제안이 토론의 장 연다…'권고적 주주제안' 도입해야&quot;,주주제안은 토론의 장을 열고 목소리를 들어보는 데 의의가 있습니다.&quot; 김지열 쿼드자산운용 이사는 30일 국회의원회관에서 김남근·오기형·이강일 더불어민주당 의원실과 경제개혁연대가 주최한 '주주관여활동 및... ,https://news.einfomax.co.kr/news/articleView.html?idxno=4396506,https://news.einfomax.co.kr/news/articleView.html?idxno=4396506,"Fri, 30 Jan 2026 16:44:00 +0900"
오기형,&quot;'기술탈취' 소송 증거 독점 깬다&quot;… 상생협력법에 한국형 디스커버리 ...,앞서 지난해 7월 더불어민주당 민병덕·오기형·김남근·김동아·박민규·박지혜·송재봉·오세희·정진욱 의원과 재단법인 경청(이사장 장태관)은 서울 여의도 국회의원회관에서 '기술탈취 근절을 위한 한국형 증거수집제도... ,https://news.koreanbar.or.kr/news/articleView.html?idxno=35023,https://news.koreanbar.or.kr/news/articleView.html?idxno=35023,"Fri, 30 Jan 2026 16:38:00 +0900"
오기형,NH아문디 &quot;주주 관여…제도·인프라 보완 과제&quot;,"국회 정무위원회 소속 오기형 더불어민주당 의원 (왼쪽 첫번째). 국회 정무위원회 소속 오기형 더불어민주당 의원은 &quot;시장에서 실질적으로 경영진의 태도 변화와 함께, 특히 장기 투자 기관투자자들의 역할이 중요하다&quot;고... ",https://www.straightnews.co.kr/news/articleView.html?idxno=293738,https://www.straightnews.co.kr/news/articleView.html?idxno=293738,"Fri, 30 Jan 2026 15:40:00 +0900"
이소영 의원,"“과천은 이미 한계, 대규모 주택공급 계획 철회하라”…들끓는 과천",김진웅 의원도 인터넷 커뮤니티를 통해 이소영 국회의원이 지난 29일 정부 발표 직후 내놓은 입장문 내용을 조목조목 반박하면서 “과천 시민들의 의견은 전면철회와 결사반대이다. 의원님도 신속하게 반대의사를... ,https://www.kyeongin.com/article/1758459,https://www.kyeongin.com/article/1758459,"Sat, 31 Jan 2026 09:36:00 +0900"
이소영 의원,"김한규 &quot;합당, 이해찬 추모 뒤 조용하진 않을 듯&quot;[한판승부]",그 과거에 이재명 대표 시절에 그 공천 당시에 그 공천 대학살이라든지 그러니까 힘으로 비명횡사라든지 친명횡재라든지 거기에 유일한 예외가 지금 의원님하고 그 이소영 의원인 것 같아. ◇ 박재홍&gt; 합리적인 의원 딱 두... ,https://www.nocutnews.co.kr/news/6464797?utm_source=naver&utm_medium=article&utm_campaign=20260131083020,https://n.news.naver.com/mnews/article/079/0004110962?sid=100,"Sat, 31 Jan 2026 08:31:00 +0900"
이소영 의원,"[공감2026] 의왕시장 선거, 인물론 vs 당지지율",의왕시는 최근 총선과 대선에서 민주당이 강세를 보이며 이소영 국회의원이 재선 고지에 오른 곳입니다. 그러면서도 인물론 역시 강해 당을 갈아탄 김성제 시장이 3선에 성공할 정도로 중도층의 표심도 적지 않습니다.... ,https://www.obsnews.co.kr/news/articleView.html?idxno=1512559,https://www.obsnews.co.kr/news/articleView.html?idxno=1512559,"Fri, 30 Jan 2026 20:28:00 +0900"
이소영 의원,"안철수 &quot;文 '8.4 대책' 반대 민주당 의원들, '6만호 공급'엔 찬성하나&quot;",안 의원은 &quot;과천의 이소영 의원은 정부과천청사가 문재인 정부의 8.4 대책에 포함되자 '청사는 숨통'이라며 반대 집회에서 목소리를 높였다&quot;며 &quot;경마장과 방첩사가 포함된 이번에도 그때처럼 거리로 나가실 것인지 묻고... ,https://www.mt.co.kr/politics/2026/01/30/2026013017384128278,https://n.news.naver.com/mnews/article/008/0005312061?sid=100,"Fri, 30 Jan 2026 17:46:00 +0900"
이소영 의원,"성수석 민주당 이천시지역위원장, 출판기념회 열고 이천시장 도전","문희상 더불어민주당 상임고문, 한병도 더불어민주당 원내대표, 추미애 국회 법제사법위원장, 이성윤 더불어민주당 최고위원을 비롯해 박범계·서영교·이소영 국회의원 등은 영상 축사를 통해 출판을 축하했다. 축사는... ",https://www.incheonilbo.com/news/articleView.html?idxno=1316011,https://www.incheonilbo.com/news/articleView.html?idxno=1316011,"Fri, 30 Jan 2026 15:30:00 +0900"
이소영 의원,EBS ‘주식의 시대' 개인은 왜 투자에 실패하는가 집중조명,"프로그램에는 이억원 금융위원장, 정은보 한국거래소 이사장, ‘코스피5000특별위원회’ 이소영 국회의원 등이 출연해 기업 거버넌스 개선과 개인투자자 권리 보호를... ",http://www.breaknews.com/1181210,http://www.breaknews.com/1181210,"Fri, 30 Jan 2026 12:38:00 +0900"
이소영 의원,"안철수 &quot;서울 6만 호 부동산 공급 대책, 민주당 이중성이 최대 걸림돌&quot;",안 의원은 경기 과천·의왕시를 지역구로 둔 이소영 의원에게도 &quot;'(정부서울)청사는 숨통'이라며 반대 집회에서 목소리를 높였었다. 경마장과 방첩사가 포함된 이번에도 그때처럼 거리로 나가실 건지 묻고 싶다&quot;고... ,https://www.hankookilbo.com/news/article/A2026013009170004878?did=NA,https://n.news.naver.com/mnews/article/469/0000911891?sid=100,"Fri, 30 Jan 2026 12:30:00 +0900"
이소영 의원,"안철수, 부동산 공급 대책에 &quot;정청래·우원식 이번엔 찬성인가&quot;",또 이소영 민주당 의원(의왕과천)을 향해선 &quot;과천의 이 의원은 정부과천청사가 문재인 정부의 8·4 대책에 포함되자 '청사는 숨통'이라며 반대집회에서 목소리를 높였었다&quot;라며 &quot;경마장과 방첩사가 포함된 이번에도... ,https://www.sisajournal.com/news/articleView.html?idxno=361377,https://n.news.naver.com/mnews/article/586/0000121361?sid=100,"Fri, 30 Jan 2026 12:00:00 +0900"
정성호,[인사] 한국외국어대학교,글로벌) 윤승영 ▲기획조정처장 정석오 ▲대외협력처장 김강석 ▲연구산학협력단장 전종근 ▲정보처장 신찬수 ▲대학원교학처장 김현정 ▲홍보실장 지성욱 ▲교육혁신원장 김사훈 ▲일반대학원장 정성호... ,https://www.asiatime.co.kr/article/20260130500213,https://www.asiatime.co.kr/article/20260130500213,"Sat, 31 Jan 2026 09:02:00 +0900"
정성호,[인사]헌법재판소 外,김사훈 △일반대학원장 정성호 △통번역〃 황지연 △국제지역〃 김찬완 △법학전문〃 최철 △TESOL〃 최호성 △서양어대학장 정민영 △사범〃 김의수 △AI융합〃 박정식 △미네르바〃 전학선 △인문〃 김상범 △통번역... ,https://www.donga.com/news/People/article/all/20260131/133269510/2,https://n.news.naver.com/mnews/article/020/0003693914?sid=102,"Sat, 31 Jan 2026 01:44:00 +0900"
정성호,[인사] 대법원 외,김사훈▷일반대학원장 정성호▷통번역대학원장 황지연▷국제지역대학원장 김찬완▷법학전문대학원장 최철▷TESOL대학원장 최호성▷서양어대학장 정민영▷사범대학장 김의수▷AI융합대학장 박정식▷인문대학장 김상범... ,https://www.chosun.com/national/people/2026/01/31/2HCNQHIQMBAHJNBMXQOWDKDQT4/?utm_source=naver&utm_medium=referral&utm_campaign=naver-news,https://n.news.naver.com/mnews/article/023/0003956312?sid=102,"Sat, 31 Jan 2026 00:44:00 +0900"
정성호,"원주준법지원센터, 인력난 등에 처한 농가 지원 사회봉사 국민공모제 집...","원주준법지원센터, 인력난 등에 처한 농가 지원 사회봉사 국민공모제 집행 법무부(장관 정성호) 원주준법지원센터(춘천보호관찰소 원주지소)는 2026. 1. 26.∼1. 30. 5일 동안 인력난 등으로 어려움을 겪고 있던 강원 원주시... ",https://www.gukjenews.com/news/articleView.html?idxno=3494229,https://www.gukjenews.com/news/articleView.html?idxno=3494229,"Sat, 31 Jan 2026 00:00:00 +0900"
정성호,"법무부, 교육부·법제처·헌법재판연구원과 업무협약 체결…학교현장의...","법무부(장관 정성호)는 1월 30일 오후 정부서울청사에서 교육부(장관 최교진), 법제처(처장 조원철)... 정성호 법무부장관은 “학생과 교원 모두가 헌법이 단순한 법조문이 아니라 민주시민의 기본 바탕임을 이해하고... ",http://www.lawissue.co.kr/view.php?ud=2026013018374044959a8c8bf58f_12,http://www.lawissue.co.kr/view.php?ud=2026013018374044959a8c8bf58f_12,"Fri, 30 Jan 2026 18:42:00 +0900"
정성호,1월31일 인사,김사훈 &lt;대학원장&gt; △일반 정성호 △통번역 황지연 △국제지역 김찬완 △법학전문 최철 △TESOL 최호성 &lt;대학장&gt; △서양어 정민영 △사범 김의수 △AI융합 박정식 △미네르바 전학선 △인문 김상범 △통번역 이상엽 △경상... ,https://www.hani.co.kr/arti/society/internalmove/1242608.html,https://n.news.naver.com/mnews/article/028/0002789263?sid=102,"Fri, 30 Jan 2026 18:12:00 +0900"
정성호,與 김용민 &quot;보완수사권은 사실상 직접수사권…다른 방식으로 풀어야&quot;,김 의원은 최근 정성호 법무부 장관이 '검찰 보완수사 우수사례집' 발간사에서 &quot;수사·기소 분리로 검찰은 더 이상 수사 개시를 할 수 없게 됐고 오로지 경찰만 수사를 개시하고 1차 수사를 담당하게 됐다&quot;고 말한 부분에... ,https://view.asiae.co.kr/article/2026013016573308106,https://n.news.naver.com/mnews/article/277/0005714701?sid=100,"Fri, 30 Jan 2026 17:04:00 +0900"
정성호,"교육부·법무부·법제처·헌법재판연구원, 학교 헌법교육 강화를 위한 ...","임민진 조선에듀 기자 | 교육부(장관 최교진)는 법무부(장관 정성호), 법제처(처장 조원철), 헌법재판연구원(원장 지성수)과 함께 30일 서울청사에서 학교 현장의 헌법교육 강화를 위한 업무협약을 체결했다. 교육부는 이날... ",https://edu.chosun.com/site/data/html_dir/2026/01/30/2026013080179.html,https://edu.chosun.com/site/data/html_dir/2026/01/30/2026013080179.html,"Fri, 30 Jan 2026 16:46:00 +0900"
정성호,[인사] 감사원 외,김사훈 △일반대학원장 정성호 △통번역대학원장 황지연 △국제지역대학원장 김찬완 △법학전문대학원장 최철 △TESOL대학원장 최호성 △서양어대학장 정민영 △사범대학장 김의수 △AI융합대학장 박정식 △인문대학장... ,https://www.hankookilbo.com/news/article/A2026013016080005761?did=NA,https://n.news.naver.com/mnews/article/469/0000911942?sid=102,"Fri, 30 Jan 2026 16:31:00 +0900"
정성호,김용민 &quot;보완수사권 예외 인정하면 검찰→공소청 간판만 바꾼 것&quot;,당내 검찰개혁 강경파로 꼽히는 김 의원은 정성호 법무부 장관이 이달 초 언급한 ”수사를 개시한 기관이 이를 종결하지 못하도록 하는 원칙“이 전건 송치(수사기관이 모든 사건을 공소기관으로 송치하게 하는 제도)를... ,http://www.edaily.co.kr/news/newspath.asp?newsid=04378806645322968,https://n.news.naver.com/mnews/article/018/0006210382?sid=100,"Fri, 30 Jan 2026 16:22:00 +0900"
정성호,'론스타 승소 주역' 정홍식 퇴임…중앙대 로스쿨 원장 부임,"퇴임식에는 정성호 법무부 장관, 이진수 차관을 비롯해 각 실·국장과 국제법무국 직원들이 참석했다. 정 국장은 2월 1일 자로 법무부를 떠난다. 정 국장은 “2월 1일부로 법무부에서 지난 2년간의 여정을 마치고... ",http://www.edaily.co.kr/news/newspath.asp?newsid=04296806645322968,https://n.news.naver.com/mnews/article/018/0006210360?sid=102,"Fri, 30 Jan 2026 15:57:00 +0900"
정성호,[인사] 한국외국어대,김사훈 △일반대학원장 정성호 △통번역대학원장 황지연 △국제지역대학원장 김찬완 △법학전문대학원장 최철 △TESOL대학원장 최호성 △서양어대학장 정민영 △사범대학장 김의수 △AI융합대학장 박정식... ,https://news.unn.net/news/articleView.html?idxno=589404,https://news.unn.net/news/articleView.html?idxno=589404,"Fri, 30 Jan 2026 15:56:00 +0900"
정성호,[인사] 한국외국어대학교,김사훈 △일반대학원장 정성호 △통번역대학원장 황지연 △국제지역대학원장 김찬완 △법학전문대학원장 최철 △TESOL대학원장 최호성 △서양어대학장 정민영 △사범대학장 김의수 △AI융합대학장 박정식... ,https://www.sedaily.com/article/20002938?ref=naver,https://n.news.naver.com/mnews/article/011/0004584937?sid=102,"Fri, 30 Jan 2026 15:26:00 +0900"
정성호,[인사]한국외국어대학교,김사훈 ▲일반대학원장 정성호 ▲통번역대학원장 황지연 ▲국제지역대학원장 김찬완 ▲법학전문대학원장 최철 ▲TESOL대학원장 최호성 ▲서양어대학장 정민영 ▲사범대학장 김의수 ▲AI융합대학장 박정식... ,https://view.asiae.co.kr/article/2026013015233860995,https://n.news.naver.com/mnews/article/277/0005714638?sid=102,"Fri, 30 Jan 2026 15:23:00 +0900"
정성호,[인사] 한국외국어대학교,김사훈 ▲일반대학원장 정성호 ▲통번역대학원장 황지연 ▲국제지역대학원장 김찬완 ▲법학전문대학원장 최철 ▲TESOL대학원장 최호성 ▲서양어대학장 정민영 ▲사범대학장 김의수 ▲AI융합대학장 박정식... ,https://biz.newdaily.co.kr/site/data/html/2026/01/30/2026013000262.html,https://biz.newdaily.co.kr/site/data/html/2026/01/30/2026013000262.html,"Fri, 30 Jan 2026 15:14:00 +0900"
정성호,[인사]한국외대,김사훈 △일반대학원장 정성호 △통번역대학원장 황지연 △국제지역대학원장 김찬완 △법학전문대학원장 최철 △TESOL대학원장 최호성 △서양어대학장 정민영 △사범대학장 김의수 △AI융합대학장 박정식... ,http://www.edaily.co.kr/news/newspath.asp?newsid=04122966645322968,https://n.news.naver.com/mnews/article/018/0006210318?sid=102,"Fri, 30 Jan 2026 15:03:00 +0900"
정성호,"영덕보호관찰소, 영세·고령농가에 '희망의 일손' 사회봉사 활동 펼쳐",법무부(장관 정성호) 영덕보호관찰소는 영세·고령 농가에 사회봉사 대상자 47명을 지원해 ‘희망의 일손’ 사회봉사 활동을 펼쳤다고 30일 밝혔다. 이번 봉사는 인력 수급에 어려움을 겪고 있는 지역 내 영세·고령농가를... ,http://www.lawissue.co.kr/view.php?ud=2026013014540310789a8c8bf58f_12,http://www.lawissue.co.kr/view.php?ud=2026013014540310789a8c8bf58f_12,"Fri, 30 Jan 2026 15:02:00 +0900"
정성호,"학교 현장의 헌법교육 강화를 위한 업무협약식, 발언하는 정성호 장관","정성호 법무부 장관이 30일 서울 종로구 정부서울청사에서 열린 학교 현장의 헌법교육 강화를 위한 교육부·법무부·법제처·헌법재한연구원 업무협약식에서 발언하고 있다.왼쪽부터 조원철 법제처장, 최교진... ",https://www.newspim.com/news/view/20260130000984,https://www.newspim.com/news/view/20260130000984,"Fri, 30 Jan 2026 14:58:00 +0900"
정성호,"학교 현장의 헌법교육 강화를 위한 업무협약식, 발언하는 최교진 장관","현장의 헌법교육 강화를 위한 교육부·법무부·법제처·헌법재한연구원 업무협약식에서 발언하고 있다.왼쪽부터 조원철 법제처장, 최 장관, 정성호 법무부 장관, 지성수 헌법재판연구원장. 2026.01.30gdlee@newspim.com",https://www.newspim.com/news/view/20260130000977,https://www.newspim.com/news/view/20260130000977,"Fri, 30 Jan 2026 14:58:00 +0900"
정성호,교육부·법무부·법제처·헌법재한연구원 업무협약식,"정성호 법무부 장관(왼쪽부터), 최교진 교육부 장관, 조원철 법제처장이 30일 서울 종로구 정부서울청사에서 열린 학교 현장의 헌법교육 강화를 위한 교육부·법무부·법제처·헌법재한연구원 업무협약식에... ",https://www.newspim.com/news/view/20260130000979,https://www.newspim.com/news/view/20260130000979,"Fri, 30 Jan 2026 14:58:00 +0900"
정성호,학교 현장의 헌법교육 강화를 위한 교육부 법무부 법제처 헌법재한연구...,"30일 서울 종로구 정부서울청사에서 열린 학교 현장의 헌법교육 강화를 위한 교육부·법무부·법제처·헌법재한연구원 업무협약식에서 조원철 법제처장(왼쪽부터), 최교진 교육부 장관, 정성호 법무부 장관... ",https://www.newspim.com/news/view/20260130000978,https://www.newspim.com/news/view/20260130000978,"Fri, 30 Jan 2026 14:58:00 +0900"
정성호,학교 현장의 헌법교육 강화를 위한 업무협약식,"30일 서울 종로구 정부서울청사에서 열린 학교 현장의 헌법교육 강화를 위한 교육부·법무부·법제처·헌법재한연구원 업무협약식에서 조원철 법제처장(왼쪽부터), 최교진 교육부 장관, 정성호 법무부 장관... ",https://www.newspim.com/news/view/20260130000980,https://www.newspim.com/news/view/20260130000980,"Fri, 30 Jan 2026 14:58:00 +0900"
정성호,발언하는 정성호 법무부 장관,정성호 법무부 장관이 30일 서울 종로구 정부서울청사에서 열린 학교 현장의 헌법교육 강화를 위한 교육부·법무부·법제처·헌법재한연구원 업무협약식에서 발언하고 있다. 2026.01.30gdlee@newspim.com,https://www.newspim.com/news/view/20260130000982,https://www.newspim.com/news/view/20260130000982,"Fri, 30 Jan 2026 14:58:00 +0900"
정성호,학교 현장의 헌법교육 강화를 위한 업무협약,"30일 서울 종로구 정부서울청사에서 열린 학교 현장의 헌법교육 강화를 위한 교육부·법무부·법제처·헌법재한연구원 업무협약식에서 조원철 법제처장(왼쪽부터), 최교진 교육부 장관, 정성호 법무부 장관... ",https://www.newspim.com/news/view/20260130000974,https://www.newspim.com/news/view/20260130000974,"Fri, 30 Jan 2026 14:58:00 +0900"
정성호,[인사]한국외국어대학교 교원 인사,(金思勳) ▲일반대학원장 정성호(鄭成鎬) ▲통번역대학원장 황지연(黃持淵) ▲국제지역대학원장 김찬완... 김사훈 ▲일반대학원장 정성호 ▲통번역대학원장 황지연 ▲국제지역대학원장 김찬완 ▲법학전문대학원장... ,http://www.kyosu.net/news/articleView.html?idxno=156586,http://www.kyosu.net/news/articleView.html?idxno=156586,"Fri, 30 Jan 2026 14:56:00 +0900"
정성호,[인사] 한국외대,김사훈 △일반대학원장 정성호 △통번역대학원장 황지연 △국제지역대학원장 김찬완 △법학전문대학원장 최철 △TESOL대학원장 최호성 △서양어대학장 정민영 △사범대학장 김의수 △AI융합대학장 박정식... ,https://www.segye.com/newsView/20260130510408?OutUrl=naver,https://n.news.naver.com/mnews/article/022/0004101902?sid=102,"Fri, 30 Jan 2026 14:49:00 +0900"
정성호,[인사] 한국외국어대학교,글로벌) 윤승영 ▲기획조정처장 정석오 ▲대외협력처장 김강석 ▲연구산학협력단장 전종근 ▲정보처장 신찬수 ▲대학원교학처장 김현정 ▲홍보실장 지성욱 ▲교육혁신원장 김사훈 ▲일반대학원장 정성호... ,https://dhnews.co.kr/news/view/1065591649256607,https://dhnews.co.kr/news/view/1065591649256607,"Fri, 30 Jan 2026 14:42:00 +0900"
정성호,인사말 하는 정성호 법무부 장관,20일 오후 서울 종로구 정부서울청사에서 교육부와 법무부 법제처 헌법재판연구원이 업무 협약식에서  정성호 법무부 장관이 인사말을 하고 있다. 2026.01.30 사진/임준선기자,https://ilyo.co.kr/?ac=article_view&entry_id=507470,https://ilyo.co.kr/?ac=article_view&entry_id=507470,"Fri, 30 Jan 2026 14:42:00 +0900"
정성호,[인사] 한국외국어대학교,글로벌) 윤승영 ▲기획조정처장 정석오 ▲대외협력처장 김강석 ▲연구산학협력단장 전종근 ▲정보처장 신찬수 ▲대학원교학처장 김현정 ▲홍보실장 지성욱 ▲교육혁신원장 김사훈 ▲일반대학원장 정성호... ,http://www.dailysmart.co.kr/news/articleView.html?idxno=119451,http://www.dailysmart.co.kr/news/articleView.html?idxno=119451,"Fri, 30 Jan 2026 14:40:00 +0900"
정성호,발언하는 정성호 법무부 장관,정성호 법무부 장관이 30일 서울 종로구 정부서울청사에서 열린 학교 현장의 헌법교육 강화를 위한 교육부·법무부·법제처·헌법재판연구원 업무협약에서 발언하고 있다. 2026.1.30,https://www.yna.co.kr/view/PYH20260130090700013?input=1196m,https://n.news.naver.com/mnews/article/001/0015876450?sid=102,"Fri, 30 Jan 2026 14:40:00 +0900"
정일영,"정일영 의원, “송도 6공구~강남 M6464 2월 28일 개통 환영 … 광역교통...","- 힐스테이트 레이크 2차~강남 잇는 M6464, 2월 28일부터 운행 개시 - 정일영 의원, 송도국제도시 광역교통망 확충 필요성 강조해와...GTX-B 착공, M버스 신설 등 성과내 - 정일영 의원, “광역교통망 확충 노력이 하나씩... ",https://www.geconomy.co.kr/news/article.html?no=314988,https://www.geconomy.co.kr/news/article.html?no=314988,"Sat, 31 Jan 2026 10:52:00 +0900"
정일영,“새벽 6시 오픈런에도 품절이래요”…스벅·투썸도 두쫀쿠 열풍 편승,"원재료 가격은 오르고 있다. 지난 22일 정일영 더불어민주당 의원이 분석한 관세청 자료를 보면, 지난해 1월 t당 1500만원이던 피스타치오 수입단가는 올 1월 약 2800만원으로 1년 새 84% 올랐다.",https://www.hani.co.kr/arti/society/society_general/1242588.html,https://n.news.naver.com/mnews/article/028/0002789245?sid=102,"Fri, 30 Jan 2026 16:56:00 +0900"
정일영,"스벅, '두쫀롤' 판매에 새벽 오픈런... &quot;2만원에 삽니다&quot; 당근까지",관세청이 국회 재정경제위원회 소속 정일영 더불어민주당 의원에게 제출한 자료에 따르면 피스타치오 수입량은 2020년 833t에서 지난해 2001t으로 5년 만에 2.4배 증가했습니다. 같은 기간 카다이프 수입량은 1만107t에서... ,https://www.insight.co.kr/news/540845,https://www.insight.co.kr/news/540845,"Fri, 30 Jan 2026 16:38:00 +0900"
정일영,두바이 열풍 '후끈''…출시 10분 만에 &quot;완판&quot;,"관세청이 국회 재정경제위원회 소속 정일영 더불어민주당 의원에게 제출한 자료에 따르면 피스타치오 수입량은 지난 2020년 833t에서 지난해 2001t으로 5년 만에 폭증했다. 지난해 1월 톤당 1,500만원 수준이던 가격은 올해... ",http://www.wowtv.co.kr/NewsCenter/News/Read?articleId=A202601300496&t=NN,https://n.news.naver.com/mnews/article/215/0001239923?sid=102,"Fri, 30 Jan 2026 15:24:00 +0900"
정일영,`스타벅스표` 두쫀쿠에 오픈런…대기업 참전 “가격 또 오를라”,관세청이 국회 재정경제위원회 소속 정일영 더불어민주당 의원에게 제출한 자료에 따르면 피스타치오 수입량은 지난 2020년 833t에서 지난해 2001t으로 5년 만에 2.4배 뛰었다. 같은기간 카다이프 수입량은 1만107t에서... ,http://www.edaily.co.kr/news/newspath.asp?newsid=03732646645322968,https://n.news.naver.com/mnews/article/018/0006210221?sid=103,"Fri, 30 Jan 2026 13:05:00 +0900"
정일영,"로저스 쿠팡 대표, 오후 경찰 조사‥입장 밝히나",[해롤드 로저스/쿠팡 임시 대표] &quot;저희가 중국 하천에 다이버를 보내면서 저희가 자체적으로 혼자서 자의적으로 했다고 생각하십니까?&quot; [정일영/더불어민주당 의원] &quot;그만하세요 노!&quot; [해롤드 로저스/쿠팡 임시 대표]... ,https://imnews.imbc.com/replay/2026/nw1200/article/6797488_36967.html,https://n.news.naver.com/mnews/article/214/0001477673?sid=102,"Fri, 30 Jan 2026 12:13:00 +0900"
