Keyword,Title,Description,Original Link,Link,Publication Date
국정기획위원회,"배준영 의원, 북 소음방송 피해지원 예산 반영...&quot;접경지역 주민 보상 체...","그는 법안 통과 이후에도 시행령에 대남 소음방송을 포함시키기 위해 국정감사에서 실제 방송 음원을... 위원회 질의를 통해 실태조사와 기준 마련, 예산 반영의 필요성을 지속적으로 강조했다. 8월에는 기획재정부에... ",http://www.kdfnews.com/news/articleView.html?idxno=172492,http://www.kdfnews.com/news/articleView.html?idxno=172492,"Thu, 04 Dec 2025 13:30:00 +0900"
국정기획위원회,"박수현 의원, 한국지역발전대상 수상",매일일보 = 오정환 기자  |  국회 문화체육관광위원회 박수현 의원(더불어민주당·충남 공주·부여·청양)이... 한편 박수현 의원은 국정기획위 국가균형성장특위 위원장에 이어 문체위 상임위와 국정감사를 통해... ,http://www.m-i.kr/news/articleView.html?idxno=1311192,http://www.m-i.kr/news/articleView.html?idxno=1311192,"Thu, 04 Dec 2025 13:28:00 +0900"
국정기획위원회,"“민주주의, 시민참여 없으면 후퇴”…‘국가시민참여위’ 시동","이어 “국정기획위원회에서도 이러한 방향을 체계적으로 다듬어 우리 사회 곳곳에 흩어져 있는 시민참여와 공론장 운영, 민주시민교육, 시민사회 지원 기능을 하나의 흐름 속에서 묶어내는 국가시민참여위원회 설립... ",https://www.naeil.com/news/read/569877?ref=naver,https://www.naeil.com/news/read/569877?ref=naver,"Thu, 04 Dec 2025 13:06:00 +0900"
국정기획위원회,與코스피특위 &quot;자사주 '자본' 성격 맞게 세법 개정 논의&quot;,질의하는 오기형 의원(대전=연합뉴스) 강수환 기자 = 23일 대전지방국세청에서 열린 국회 기획재정위원회의 국정감사에서 더불어민주당 오기형 의원이 질의하고 있다. 2025.10.23 swan@yna.co.kr nkhwang@yna.co.kr 본 기사는... ,https://news.einfomax.co.kr/news/articleView.html?idxno=4387239,https://news.einfomax.co.kr/news/articleView.html?idxno=4387239,"Thu, 04 Dec 2025 12:50:00 +0900"
국정기획위원회,진옥동 신한금융 회장 단수추천… 3월 주총서 확정,4일 오전 진옥동 신한금융지주 회장이 신한금융 회장후보추천위원회 최종 결정을 앞두고 회추위 참석을... 진 회장은 2030년까지 5년간 총 110조 원 규모의 생산·포용적 금융을 공급하기로 하는 등 현 정부 국정 기조에도... ,https://www.munhwa.com/article/11551853?ref=naver,https://n.news.naver.com/mnews/article/021/0002754870?sid=101,"Thu, 04 Dec 2025 12:08:00 +0900"
국정기획위원회,윤준병 국회의원 대표 발의 농어촌 빈집 정비 특별법 국회 농해수위 통...,"또한 윤 의원은 이재명 국민 주권 정부의 미래 청사진을 그리는 국정기획위원회 경제2분과 위원으로 활약하며, 이재명 정부의 123대 국정과제에 농어촌 빈집 정비를 포함 시키는 역할도 톡톡히 했다. 농어촌 빈집 정비를... ",https://www.joongdo.co.kr/web/view.php?key=20251204010001585,https://www.joongdo.co.kr/web/view.php?key=20251204010001585,"Thu, 04 Dec 2025 11:54:00 +0900"
국정기획위원회,초대 방미통위원장 후보 &quot;미디어정책 사회적 논의 필수적&quot;,이에 대통령직인수위원회 성격의 국정기획위원회는 사회적 논의 기구의 이름을 가칭 '미디어발전위원회'로 설정했다. 국정기획위는 미디어 거버넌스 개편을 비롯한 주요 미디어 정책이 '미디어발전위'에서 논의될... ,https://www.mediaus.co.kr/news/articleView.html?idxno=315407,https://www.mediaus.co.kr/news/articleView.html?idxno=315407,"Thu, 04 Dec 2025 11:44:00 +0900"
국정기획위원회,방미통위원장 후보자 &quot;野 빠진 4인 의결 최대한 유보&quot;(종합),아울 김 후보자는 대통령 직속 국정기획위원회에서 미디어 규제 개선을 위한 국정과제로 제시한 '미디어발전위원회'(가칭)를 언급했다. 김 후보자는 &quot;모든 이해관계자들의 행정 수요를 잘 수렴하고 사회적 대타협... ,https://www.news1.kr/it-science/cc-newmedia/5998035,https://n.news.naver.com/mnews/article/421/0008642774?sid=105,"Thu, 04 Dec 2025 11:39:00 +0900"
국정기획위원회,"차기 KT CEO, ‘내부출신’ 유력…16일 최종 1인 선정",전 국정기획위원회 위원 등 총 7명을 1차 ‘숏리스트(압축 후보군)’로 확정했다. 이 중 KT 현직에 있는 이현석 부문장을 포함해 6명이 KT 출신이다. 외부 인사는 주형철 위원 1명이다. 이사후보추천위원회는 오는 9일... ,https://biz.heraldcorp.com/article/10629625?ref=naver,https://n.news.naver.com/mnews/article/016/0002567256?sid=105,"Thu, 04 Dec 2025 11:34:00 +0900"
국정기획위원회,"KT, CEO 후보 7명으로 압축…16일 '최후 1인' 결정",외부 출신 주형철 전 국정기획위원회 위원도 이름을 올렸다. 위원회는 오는 9일 온라인 면접을 통해 후보를 4명으로 재압축할 계획이다. 최종 면접은 이달 16일 진행해 당일 최종 후보를 결정하는 방안이 유력한... ,http://www.newsprime.co.kr/news/article.html?no=714819,http://www.newsprime.co.kr/news/article.html?no=714819,"Thu, 04 Dec 2025 11:32:00 +0900"
국정기획위원회,"[단독] ‘李 정책 멘토’ 이한주가 이끄는 경사연, 내년 예산 82억원 증...","이 이사장은 이재명 정부 출범 후 인수위 역할을 한 국정기획위원회 위원장을 역임했다. 그는 지난 2022년 대선을 앞두고 이재명 캠프 정책본부장을 맡았고, 이 대통령이 더불어민주당 대표 시절에 민주연구원장에... ",https://www.chosun.com/politics/politics_general/2025/12/04/6ELIGHTUERBD3KUGDM4W5E42CI/?utm_source=naver&utm_medium=referral&utm_campaign=naver-news,https://n.news.naver.com/mnews/article/023/0003944904?sid=100,"Thu, 04 Dec 2025 11:23:00 +0900"
국정기획위원회,[오늘의 주요 정치 일정] 정치(12월4일 목요일),"초청 국정설명회 특별강연(광주광역시 서구) ◇국방부【장관】 공개 일정 없음 ◇외교부【장관】 통상... 최고위원회의(개혁신당 대회의실, 국회 본관 170호) 10:30 제12회 정부조달문화상품 국회특별기획전(국회... ",http://www.econonews.co.kr/news/articleView.html?idxno=416927,http://www.econonews.co.kr/news/articleView.html?idxno=416927,"Thu, 04 Dec 2025 11:20:00 +0900"
국정기획위원회,"조인철 국회의원, AI 예산 확보 위한 '광폭 행보' 눈길","도약'을 국정과제로 제시하는 등 미래산업 육성에 비중을 두고 있긴 하지만, 관련 국비를 광주로 끌어오는 데는 조인철 의원의 숨겨진 노력이 한몫을 톡톡히 해냈다는 후문이다. 조 의원은 광주시·기획재정부... ",https://view.asiae.co.kr/article/2025120410221255973,https://n.news.naver.com/mnews/article/277/0005688896?sid=102,"Thu, 04 Dec 2025 11:18:00 +0900"
국정기획위원회,"박수현 의원, 지역 언론 발전 앞장... '한국지역발전 대상' 수상",박수현 의원 국회 문화체육관광위원회 박수현 의원(더불어민주당·충남 공주·부여·청양)이 4일 한국... 한편 박수현 의원은 국정기획위 국가균형성장특위 위원장에 이어 문체위 상임위와 국정감사를 통해 지역신문기금... ,https://www.jeonmae.co.kr/news/articleView.html?idxno=1208839,https://www.jeonmae.co.kr/news/articleView.html?idxno=1208839,"Thu, 04 Dec 2025 11:14:00 +0900"
국정기획위원회,[뉴스1 PICK]첫 출근한 김종철 방미통위원장 후보자…&quot;조직 안정화 최우...,"승인 취소 판결 대응, 허위조작정보 관련 입법 및 집행 등도 주요 현안으로 거론했다. 아울 김 후보자는 대통령 직속 국정기획위원회에서 미디어 규제 개선을 위한 국정과제로 제시한 '미디어발전위원회'(가칭)를 언급했다.",https://www.news1.kr/it-science/cc-newmedia/5997962,https://n.news.naver.com/mnews/article/421/0008642603?sid=105,"Thu, 04 Dec 2025 11:10:00 +0900"
국정기획위원회,"'내란 1년'... 윤석열의 야만, 법꾸라지와 야당의 후안무치에 맞서는 법...",2019년에 대통령직속 정책기획위원장에 취임해 대통령 소속 9개 국정과제위원회를 총괄하는 국정과제협의회 의장으로 정부 일을 도왔습니다. 덧붙이는 글 | 이 글은 &lt;소셜 코리아&gt;(https://socialkorea.org)에도 게재됐습니다.... ,https://www.ohmynews.com/NWS_Web/View/at_pg.aspx?CNTN_CD=A0003188054&CMPT_CD=P0010&utm_source=naver&utm_medium=newsearch&utm_campaign=naver_news,https://n.news.naver.com/mnews/article/047/0002497256?sid=102,"Thu, 04 Dec 2025 10:59:00 +0900"
국정기획위원회,"박수현 의원, ‘한국지역발전대상’ 수상",국회 문화체육관광위원회 박수현 의원(더불어민주당·충남 공주·부여·청양)이 4일 한국지역언론인클럽이... 한편 박 의원은 국정기획위 국가균형성장특별위원장에 이어 문체위 활동을 통해 지역신문발전기금 증액... ,http://www.shinailbo.co.kr/news/articleView.html?idxno=2157308,http://www.shinailbo.co.kr/news/articleView.html?idxno=2157308,"Thu, 04 Dec 2025 10:52:00 +0900"
국정기획위원회,"거제시, 한-아세안 국가정원 조성사업 재추진 불씨 살리다","거제시는 △지난 5월 회의에서 사업 재추진과 예타면제 방안, 용역비 국가예산 반영이라는 명확한 목표를 설정하고 △6월 정부 국정과제 반영을 위한 국정기획위원회 방문 △7월 기획재정부 차관 면담 △8월 김경수... ",http://www.enewstoday.co.kr/news/articleView.html?idxno=2364297,http://www.enewstoday.co.kr/news/articleView.html?idxno=2364297,"Thu, 04 Dec 2025 10:45:00 +0900"
국정기획위원회,방미통위원장 후보자 &quot;조직 안정화 최우선…野 위원 추천 당부&quot;,아울 김 후보자는 대통령 직속 국정기획위원회에서 미디어 규제 개선을 위한 국정과제로 제시한 '미디어발전위원회'(가칭)를 언급했다. 김 후보자는 &quot;모든 이해관계자들의 행정 수요를 잘 수렴하고 사회적 대타협... ,https://www.news1.kr/it-science/cc-newmedia/5997896,https://n.news.naver.com/mnews/article/421/0008642495?sid=105,"Thu, 04 Dec 2025 10:44:00 +0900"
국정기획위원회,KT 사장 후보 7인 압축…대부분 KT 출신,온라인 면접 대상자는 ▲김철수 전 KT스카이라이프 사장 ▲김태호 전 서울교통공사 사장 ▲남규택 전 KT CS 사장 ▲박윤영 전 KT 기업부문장 ▲이현석 KT 커스터머부문장 ▲주형철 전 국정기획위원회 위원 ▲홍원표 전... ,https://www.mediaus.co.kr/news/articleView.html?idxno=315405,https://www.mediaus.co.kr/news/articleView.html?idxno=315405,"Thu, 04 Dec 2025 10:18:00 +0900"
국정기획위원회,"거제시, '한-아세안 국가정원 조성사업' 용역비 정부예산 확보","거제시는 지난 5월 회의에서 사업 재추진과 예타면제 방안, 용역비 국가예산 반영이라는 명확한 목표를 설정하고, 6월 정부 국정과제 반영을 위한 국정기획위원회 방문, 7월 기획재정부 차관 면담, 8월 김경수... ",https://www.newsfreezone.co.kr/news/articleView.html?idxno=661729,https://www.newsfreezone.co.kr/news/articleView.html?idxno=661729,"Thu, 04 Dec 2025 10:08:00 +0900"
국정기획위원회,"대구시, 2026년도 국비 9조원 시대 개막","이러한 성과는 예산정책협의회를 5차례 개최하고, 대통령실·국정기획위원회·중앙부처·국회를 지속적으로 방문하는 등 권한대행체제에서도 전 직원이 함께 여야를 넘나들며 사업 추진 타당성을 일관되게 설득한... ",http://www.shinailbo.co.kr/news/articleView.html?idxno=2157212,http://www.shinailbo.co.kr/news/articleView.html?idxno=2157212,"Thu, 04 Dec 2025 10:00:00 +0900"
국정기획위원회,"대구시, 2026년 국비 9조 원 시대 열었다…역대 최대 투자예산 확보",이러한 성과는 예산정책협의회를 5차례 개최하고 대통령실·국정기획위원회·중앙부처·국회를 지속적으로 방문하는 등 권한대행체제에서도 전 직원이 함께 여야를 넘나들며 사업 추진 타당성을 일관되게 설득한... ,http://www.hansbiz.co.kr/news/articleView.html?idxno=797516,http://www.hansbiz.co.kr/news/articleView.html?idxno=797516,"Thu, 04 Dec 2025 09:52:00 +0900"
국정기획위원회,"김남희 의원, '장애인 자립지원 확대' 한국장애인인권상 수상","국회 입성 후에는 발달장애인 지원예산 확보, 장애인 자립지원을 위해 국회 보건복지위원회와 이재명 대통령직속 국정기획위원회에서 관련 예산 증액에 힘써왔다. 특히 &lt;장애인차별금지법&gt;, &lt;장애인활동지원법&gt; 등 핵심... ",http://www.hg-times.com/news/articleView.html?idxno=277714,http://www.hg-times.com/news/articleView.html?idxno=277714,"Thu, 04 Dec 2025 09:36:00 +0900"
국정기획위원회,"김남희 의원 , 제 27 회 한국장애인인권상 수상","국회 입성 후에는 발달장애인 지원예산 확보 , 장애인 자립지원을 위해 국회 보건복지위원회와 이재명 대통령직속 국정기획위원회에서 관련 예산 증액에 힘써왔다 . 특히  장애인차별금지법, 장애인활동지원법 등 핵심... ",https://www.pinpointnews.co.kr/news/articleView.html?idxno=402511,https://www.pinpointnews.co.kr/news/articleView.html?idxno=402511,"Thu, 04 Dec 2025 09:14:00 +0900"
국정기획위원회,거제시 '한-아세안 국가정원' 조성 용역비 확보,"지난 5월 회의에서 사업 재추진과 예타면제 방안, 용역비 국가예산 반영이라는 명확한 목표를 설정하고 6월 정부 국정과제 반영을 위한 국정기획위원회 방문, 7월 기획재정부 차관 면담, 8월 김경수 지방시대위원장 면담... ",https://www.kukinews.com/article/view/kuk202512040020,https://www.kukinews.com/article/view/kuk202512040020,"Thu, 04 Dec 2025 09:00:00 +0900"
국정기획위원회,&quot;정권마다 헛돌았던 필수약 정책&quot; … 공공생산체계가 해법이 되려면 [뉴...,안정화를 국정과제로 격상했다. 그러나 흐름을 구조적으로 정리하면 '정책 발표 → TF 운영 → 보고제 강화... ◆ 李 정부 약가개선 드라이브 … 한계점 노출 정부는 최근 건강보험정책심의위원회를 통해 퇴장방지의약품... ,https://biz.newdaily.co.kr/site/data/html/2025/11/28/2025112800151.html,https://biz.newdaily.co.kr/site/data/html/2025/11/28/2025112800151.html,"Thu, 04 Dec 2025 08:00:00 +0900"
국정기획위원회,[Who Is ?] 안규백 국방부 장관,"1998년 평화민주당 당직자로 정계에 입문한 뒤 정치연수원 기획부장, 새천년민주당 조직국장 등을 거쳐... 여야가 이해와 공감을 넓히고 훈훈한 상임위가 될 것이다.&quot; (2020/10/26, 국회 국방위원회 국정감사에서 김병기... ",https://www.businesspost.co.kr/BP?command=article_view&num=422424,https://www.businesspost.co.kr/BP?command=article_view&num=422424,"Thu, 04 Dec 2025 07:56:00 +0900"
국정기획위원회,[Who Is ?] 박학규 삼성전자 사업지원실장,최순실 국정농단 사태에 연루돼 미래전략실이 해체되자 퇴사했다. 8개월만에 삼성SDS 사업운영총괄... 중소벤처기업부-공정거래위원회 합동 납품대금 연동제 현장안착 간담회에 참석하고 있다. &lt;연합뉴스... ,https://www.businesspost.co.kr/BP?command=article_view&num=422422,https://www.businesspost.co.kr/BP?command=article_view&num=422422,"Thu, 04 Dec 2025 07:56:00 +0900"
국정기획위원회,"거제시, 한-아세안 국가정원 조성사업 재추진…용역비 정부예산 확보","거제시는 ▲지난 5월 회의에서 사업 재추진과 예타면제 방안, 용역비 국가예산 반영이라는 명확한 목표를 설정하고 ▲6월 정부 국정과제 반영을 위한 국정기획위원회 방문, ▲7월 기획재정부 차관 면담, ▲8월 김경수... ",https://www.newsis.com/view/NISX20251204_0003427662,https://n.news.naver.com/mnews/article/003/0013638127?sid=102,"Thu, 04 Dec 2025 07:07:00 +0900"
국정기획위원회,"[오늘의 주요일정] 정치·정부 (4일, 목)",초청 국정설명회 특별강연 (광주광역시 서구) ◇외교부 -장관 통상업무 -1차관 미국 출장 (한미... 최고위원회의 (국회 본관 170호) 10:30 제12회 정부조달문화상품 국회특별기획전 (국회 의원회관 3층 로비) 14:00... ,http://www.queen.co.kr/news/articleView.html?idxno=447072,http://www.queen.co.kr/news/articleView.html?idxno=447072,"Thu, 04 Dec 2025 06:26:00 +0900"
국정기획위원회,"[비상계엄 1년] ①3년만에 정권 탈환…'6월 지선', 당정 역학관계 변화...","미래기획수석을 신설했다. 아울러 지난 정부에서 사라졌던 여성가족비서관을 성평등가족비서관으로 확대하고, 국정기록비서관을 복원했다. 이 대통령의 대선 공약 가운데 하나인 해양수산부의 부산 이전과 북극항로... ",http://www.inews24.com/view/1913187,https://n.news.naver.com/mnews/article/031/0000986324?sid=100,"Thu, 04 Dec 2025 06:01:00 +0900"
국정기획위원회,"[오늘의 주요일정] 정치·정부 (4일, 목)",초청 국정설명회 특별강연 (광주광역시 서구) ◇외교부 -장관 통상업무 -1차관 미국 출장 (한미... 최고위원회의 (국회 본관 170호) 10:30 제12회 정부조달문화상품 국회특별기획전 (국회 의원회관 3층 로비) 14:00... ,https://www.news1.kr/politics/president/5997372,https://n.news.naver.com/mnews/article/421/0008641833?sid=100,"Thu, 04 Dec 2025 05:00:00 +0900"
국정기획위원회,[오늘의 주요일정]정치(12월4일 목요일),"초청 국정설명회 특별강연(광주광역시 서구) ◇국방부【장관】 공개 일정 없음 ◇외교부【장관】 통상... 최고위원회의(개혁신당 대회의실, 국회 본관 170호) 10:30 제12회 정부조달문화상품 국회특별기획전(국회... ",https://www.newsis.com/view/NISX20251203_0003427601,https://n.news.naver.com/mnews/article/003/0013638038?sid=100,"Thu, 04 Dec 2025 05:00:00 +0900"
국정기획위원회,‘영종도~송도’ 인천대교 통행료 18일부터 2000원,3일 인천시에 따르면 지난달 25일 기획재정부 민간투자사업심의위원회가 인천대교 민간투자 사업 변경... 국내 민자고속도로 가운데 가장 비싸 국정감사에서 민간사업자에 과도한 이익이 돌아간다는 지적이... ,https://www.donga.com/news/Society/article/all/20251203/132895889/2,https://n.news.naver.com/mnews/article/020/0003679174?sid=102,"Thu, 04 Dec 2025 03:01:00 +0900"
국정기획위원회,"김남희 의원, 제 27회 한국장애인인권상 수상","국회 입성 후에는 발달장애인 지원예산 확보, 장애인 자립지원을 위해 국회 보건복지위원회와 이재명 대통령직속 국정기획위원회에서 관련 예산 증액에 힘써왔다. 특히 장애인차별금지법 , 장애인활동지원법 등 핵심... ",http://www.joygm.com/news/articleView.html?idxno=214804,http://www.joygm.com/news/articleView.html?idxno=214804,"Thu, 04 Dec 2025 01:30:00 +0900"
국정기획위원회,"대구시, 2026년도 국비 9조 644억 원 확보","이러한 성과는 예산정책협의회를 5차례 개최하고, 대통령실·국정기획위원회·중앙부처·국회를 지속적으로 방문하는 등 권한대행체제에서도 전 직원이 함께 여야를 넘나들며 사업 추진 타당성을 일관되게 설득한... ",https://tk.newdaily.co.kr/site/data/html/2025/12/03/2025120300411.html,https://tk.newdaily.co.kr/site/data/html/2025/12/03/2025120300411.html,"Wed, 03 Dec 2025 22:28:00 +0900"
국정기획위원회,"R]경북도, 내년 국비 12조7천억 원 확보..역대 최대",경상북도는 정부의 확장 재정 기조에서 시군별 현안사업이 일부 국정과제로 전환되는 등 골고루 증액이 이뤄진 점이 고무적이라고 밝혔습니다. ◀ 전화INT ▶김호진/경상북도 기획조정실장 &quot;영일만대교라든지 구미... ,http://andongmbc.co.kr/adboard/NewsView79418,http://andongmbc.co.kr/adboard/NewsView79418,"Wed, 03 Dec 2025 21:16:00 +0900"
국정기획위원회,"대구시, 2026년도 국비 9조원 시대 개막","이러한 성과는 예산정책협의회를 5차례 개최하고, 대통령실·국정기획위원회·중앙부처·국회를 지속적으로 방문하는 등 권한대행체제에서도 전 직원이 함께 여야를 넘나들며 사업 추진 타당성을 일관되게 설득한... ",https://ilyo.co.kr/?ac=article_view&entry_id=504324,https://ilyo.co.kr/?ac=article_view&entry_id=504324,"Wed, 03 Dec 2025 20:58:00 +0900"
국정기획위원회,"대구시, 2026년도 국비 9조원 시대 개막","이러한 성과는 예산정책협의회를 5차례 개최하고, 대통령실·국정기획위원회·중앙부처·국회를 지속적으로 방문하는 등 권한대행체제에서도 전 직원이 함께 여야를 넘나들며 사업 추진 타당성을 일관되게 설득한... ",https://www.ksmnews.co.kr/news/view.php?idx=578578,https://www.ksmnews.co.kr/news/view.php?idx=578578,"Wed, 03 Dec 2025 20:43:00 +0900"
국정기획위원회,청주공항 민간활주로 건설 첫 단추,"AI 기반 항체의약품 개발을 지원할 청주 오송 AI 바이오 데이터센터 구축 사전기획 용역비 5억원도 주목받고... 위원회 예산소위에 충북출신 의원이 없어 불리한 여건이었지만, 충북이 제안한 주요 사업들이 국정기조와... ",http://www.dynews.co.kr/news/articleView.html?idxno=830170,http://www.dynews.co.kr/news/articleView.html?idxno=830170,"Wed, 03 Dec 2025 20:32:00 +0900"
국정기획위원회,"대구광역시, 2026년도 국비 9조원 시대 개막",이러한 성과는 예산정책협의회를 5차례 개최하고 대통령실·국정기획위원회·중앙부처·국회를 지속적으로 방문하는 등 권한대행체제에서도 전 직원이 함께 여야를 넘나들며 사업 추진 타당성을 일관되게 설득한... ,https://www.nspna.com/news/?mode=view&newsid=790700,https://www.nspna.com/news/?mode=view&newsid=790700,"Wed, 03 Dec 2025 19:22:00 +0900"
국정기획위원회,"시민단체 &quot;충남도, 금강수목원 부지 민간 매각 공고 중단하라&quot;",이에 따라 세종시는 8월 충남산림자원연구소 부지의 국가 자산화를 촉구하는 최민호 세종시장과 김태흠 충남도지사 명의의 건의문을 국정기획위원회에 전달했다고 밝힌바 있다. 공동 건의문의 주요 골자는 연구소 및... ,https://www.jbnews.com/news/articleView.html?idxno=1494899,https://www.jbnews.com/news/articleView.html?idxno=1494899,"Wed, 03 Dec 2025 19:10:00 +0900"
국정기획위원회,"거제시, 한-아세안 국가정원 조성사업 용역비 확보","이후 6월 국정기획위원회 방문, 7월 기획재정부 차관 면담, 8월 김경수 지방시대위원장 면담, 우원식 국회의장 현안간담회 개최, 9월 서삼석 국회의원과 김인호 산림청장 방문 등을 통해 사업의 필요성을 전달했다.... ",https://www.newspim.com/news/view/20251203001318,https://www.newspim.com/news/view/20251203001318,"Wed, 03 Dec 2025 18:52:00 +0900"
국정기획위원회,"조호권 전 광주사회서비스원장, 민주당 중앙당 정책위 부의장에","더불어민주당 정책위원회는 국정 및 당 정책 개발을 총괄하는 핵심 조직으로, 조 부의장은 향후 사회서비스, 돌봄, 지역 균형발전, 생활정책 등 분야에서 정책 기획과 조정 역할을 맡게 된다. 조호권 부의장은 &quot;현장에서... ",http://www.mdilbo.com/detail/SexeuZ/750654,http://www.mdilbo.com/detail/SexeuZ/750654,"Wed, 03 Dec 2025 18:38:00 +0900"
국정기획위원회,[주간 처치독] 넥스트클럽의 위험한 성교육 현장,＜뉴스앤조이＞는 지난 9월부터 교육 현장 침투하는 극우 개신교라는 기획으로 반동성의 가치관과 각종... 정치권에서는 아마 국정감사 기간이나 지역 의회 행정사무감사나 이럴 때 위원회 구성의 문제도 지금 제기를 한... ,https://www.newsnjoy.or.kr/news/articleView.html?idxno=400103,https://www.newsnjoy.or.kr/news/articleView.html?idxno=400103,"Wed, 03 Dec 2025 18:34:00 +0900"
국정기획위원회,KT 차기 대표 후보 7명으로 추려...KT 출신 6명·외부 출신 1명,전 국정기획위원회 위원 등 총 7명을 1차 숏리스트로 확정했다. 내부 유일 지원자인 이현석 커스터머부문장은 조직 내에서 폭넓은 지지를 확보한 것으로 알려졌다. 그는 지난 1994년부터 통신 업무를 시작해 아이폰... ,http://www.fnnews.com/news/202512031425062378,https://n.news.naver.com/mnews/article/014/0005443845?sid=105,"Wed, 03 Dec 2025 18:31:00 +0900"
국정기획위원회,"대구시, 2026년 국비 9조 644억 확보…AI·로봇 수도 도약 기반 만들었다",이번 성과는 예산정책협의회 5차례 개최와 대통령실·국정기획위원회·중앙부처·국회 방문 등 권한대행 체제에서도 전 직원이 함께 사업 타당성을 설득한 결과로 평가된다. 지역거점 AX 혁신기술개발(229억) 등 AI... ,https://www.eroun.net/news/articleView.html?idxno=68391,https://www.eroun.net/news/articleView.html?idxno=68391,"Wed, 03 Dec 2025 18:02:00 +0900"
