Keyword,Title,Description,Original Link,Link,Publication Date
관료,"반부패 저승사자에서 행정 혁명가로...또럼 서기장, 향후 5년간 베트남...",이는 단순히 비용 절감을 넘어 민간 기업들이 겪던 고질적인 관료주의 장벽을 허무는 결정적인 계기가 되면서 베트남의 투자 환경을 획기적으로 개선시켰다는 평가를 받는다. 또 럼 서기장은 취임 초기부터 강조해... ,http://www.fnnews.com/news/202601221132169452,https://n.news.naver.com/mnews/article/014/0005467428?sid=104,"Fri, 23 Jan 2026 15:42:00 +0900"
관료,이상희 '우리 꽃문화 답사기',"경북 성주에서 태어나 고려대학 법학과를 졸업하고 고등고시 행정과에 합격, 진주시장·산림청장·대구직할시장·경북지사·내무부장관·한국토지개발공사사장·건설부장관 등 행정 관료를 지내고 &lt;꽃으로 보는 한국문화... ",https://www.ohmynews.com/NWS_Web/View/at_pg.aspx?CNTN_CD=A0003201068&CMPT_CD=P0010&utm_source=naver&utm_medium=newsearch&utm_campaign=naver_news,https://n.news.naver.com/mnews/article/047/0002502485?sid=103,"Fri, 23 Jan 2026 15:36:00 +0900"
관료,"트럼프, 미국 비판한 캐나다 평화위원회 초대 철회",트럼프 대통령은 이날 스위스 다보스포럼 행사장에서 각국 정상과 관료들을 초청해 평화위원회 헌장 서명식을 열었습니다. 트럼프 대통령은 59개국이 서명했다고 말했으나 각국 발표와 외신 보도를 종합하면 참여 의사를... ,https://news.kbs.co.kr/news/pc/view/view.do?ncd=8467394&ref=A,https://n.news.naver.com/mnews/article/056/0012111277?sid=104,"Fri, 23 Jan 2026 15:36:00 +0900"
관료,기업은행 새 행장에 내부 출신 장민영…첫날부터 '노사 정면대치',"노조는 22일 성명서를 통해 “장민영 내정자는 경력 대부분이 기업은행에 한정된 관리형 행장 후보로, 지도자가 아닌 관료에 가깝다. 대통령을 설득하고 금융위와 맞서며 국회를 설득할 역량이 보이지 않는다”며... ",https://www.bizhankook.com/bk/article/31285,https://www.bizhankook.com/bk/article/31285,"Fri, 23 Jan 2026 15:34:00 +0900"
관료,"트럼프, 미국 비판한 캐나다에 평화위원회 초대 철회",트럼프 대통령은 이날 스위스 다보스포럼 행사장에서 각국 정상과 관료들을 초청해 평화위원회 헌장 서명식을 열었다. 트럼프 대통령은 59개국이 서명했다고 말했으나 각국 발표와 외신 보도를 종합하면 참여 의사를... ,https://www.yna.co.kr/view/AKR20260123112000009?input=1195m,https://n.news.naver.com/mnews/article/001/0015864088?sid=104,"Fri, 23 Jan 2026 15:31:00 +0900"
관료,李정부 금융公기관장 인사 키워드는 '내부 출신·정치권 낙하산',"인사에서 관료 출신이 한 명도 포함되지 않은 것으로 나타났다. 반면 기관 내부 출신과 대통령 측근, 정치권 인사들이 기관장 자리를 모두 차지했다. 금융위원회, 재정경제부(옛 기획재정부) 출신 고위 관료가 기관장으로... ",https://www.hankyung.com/article/202601238845i,https://n.news.naver.com/mnews/article/015/0005241336?sid=101,"Fri, 23 Jan 2026 15:24:00 +0900"
관료,"미, WHO 탈퇴…“국제사회 질병 대응 난항 우려”","이어 “WHO는 미국이 창립 멤버이자 최대 재정 기여국임에도, 미국의 이익에 적대적인 국가들이 주도하며 관료주의적 의제를 추진해 왔다”고 주장했습니다. 트럼프 행정부는 또 WHO가 코로나19 팬데믹 초기 공중보건... ",https://news.knn.co.kr/news/article_sns/871,https://news.knn.co.kr/news/article_sns/871,"Fri, 23 Jan 2026 15:24:00 +0900"
관료,기업은행 노사 갈등 고조…행장 첫 출근 무산,"금융위 행보에 기업은행 노조는 &quot;(장 행장의) 경력 대부분이 기업은행에만 국한된 관리형 행장 후보로 지도자라기 보다 관료에 가깝다&quot;라며 &quot;현재 기업은행이 직면한 초유의 위기를 극복할 능력, 즉 대통령을 설득하고... ",https://www.ebn.co.kr/news/articleView.html?idxno=1696556,https://www.ebn.co.kr/news/articleView.html?idxno=1696556,"Fri, 23 Jan 2026 15:20:00 +0900"
관료,[오전 주요 국제금융뉴스](23일),"▲아마존, 또다시 수천 명 감원…사무직 대상 - 아마존닷컴은 관료주의를 줄이고 조직을 효율화하기 위해 수천 명 규모의 추가 감원을 준비하는 것으로 알려졌다. 22일(미국 현지시각) 주요 외신에 따르면... ",https://news.einfomax.co.kr/news/articleView.html?idxno=4395077,https://news.einfomax.co.kr/news/articleView.html?idxno=4395077,"Fri, 23 Jan 2026 15:16:00 +0900"
관료,한화오션이 캐나다 고위 관료를 거제 장영실함으로 '모셨다' : 잠수함 1...,캐나다 초계 잠수함 프로젝트(CPSP) 입찰을 앞두고 캐나다 최대 주인 온타리오주 경제개발부 장관이 한화오션의 거제사업장을 찾았다. 한화오션은 잠수함 수주를 위한 기술력을 소개하는 한편 중장기 산업협력 방안을... ,https://www.huffingtonpost.kr/news/articleView.html?idxno=241883,https://www.huffingtonpost.kr/news/articleView.html?idxno=241883,"Fri, 23 Jan 2026 15:12:00 +0900"
관료,대통령 사인받아 오라며 행장 출근 저지한 노조,"과거 관료 출신 은행장 인사에 반발해 출근을 막았던 IBK기업은행 노동조합이 내부 출신인 장민영 기업은행장을 상대로도 출근 저지를 하고 있어 논란이다. 총액인건비제도로 수당 등 임금을 받지 못했으니, 은행장에게... ",http://www.inews24.com/view/1931147,https://n.news.naver.com/mnews/article/031/0000999559?sid=101,"Fri, 23 Jan 2026 15:11:00 +0900"
관료,"[김구철의 쾌도난마] 코스피 5,000시대 한국 경제, 이대로 좋은가?",누구나 매뉴얼대로 움직여도 승리할 수 있는 조직력이 중요하다.&quot; 이에야스는 전쟁뿐 아니라 통치도 법도와 관료제에 의해 돌아가도록 설계했다. 결과 그 자손은 평범했어도 도쿠가와 막부는 260년 존속할 수 있었다.... ,https://www.pennmike.com/news/articleView.html?idxno=114132,https://www.pennmike.com/news/articleView.html?idxno=114132,"Fri, 23 Jan 2026 15:08:00 +0900"
관료,"미국, 78년 만에 WHO 탈퇴...'세계 공중보건' 빨간불",두 장관은 &quot;WHO는 미국이 창립 멤버이자 가장 큰 재정적 기부자인데도 미국의 이익에 적대적인 국가들이 주도하는 정치적이며 관료주의 의제를 추진했다&quot;고 주장했다. 트럼프 행정부는 WHO가 코로나19 초기... ,https://www.hankookilbo.com/News/Read/A2026012309460005558?did=NA,https://n.news.naver.com/mnews/article/469/0000910629?sid=104,"Fri, 23 Jan 2026 15:01:00 +0900"
관료,과학에 만능열쇠는 없다[김우재의 플라이룸](70),관료들은 과학을 거대한 자판기처럼 생각해서 예산이라는 동전을 넣으면 노벨상이나 혁신 기술이라는... 혁신은 관료들이 책상머리에서 기획한 전략기술 로드맵이 아니라 실패를 두려워하지 않는 다양한 ‘보통... ,https://weekly.khan.co.kr/article/202601231459011,https://n.news.naver.com/mnews/article/033/0000050183?sid=103,"Fri, 23 Jan 2026 14:59:00 +0900"
관료,"트럼프의 제국주의, 성공할 수 있을까[서중해의 경제망원경](57)","런던의 금융가, 귀족층, 고위 군 장교 및 관료들은 제국이라는 거대 시장을 통해 안전한 투자처를 확보하고 고소득 일자리를 가졌다. 그러면 누가 피해자였을까. 일반 납세자들이었다. 이들은 자신들에게는 직접적인... ",https://weekly.khan.co.kr/article/202601231458011,https://n.news.naver.com/mnews/article/033/0000050182?sid=101,"Fri, 23 Jan 2026 14:59:00 +0900"
관료,"트럼프 지시 1년만에…美, WHO 공식 '탈퇴'",이들은 WHO가 본래의 공중보건 임무보다 정치적·관료적 활동에 치우치며 미국의 이익에 반하는 방향으로 운영돼 왔다고 주장했다. 트럼프 행정부는 특히 코로나19 팬데믹 초기 대응을 문제 삼았다. WHO가... ,http://www.wowtv.co.kr/NewsCenter/News/Read?articleId=A202601230408&t=NN,https://n.news.naver.com/mnews/article/215/0001239007?sid=104,"Fri, 23 Jan 2026 14:48:00 +0900"
관료,"트럼프 행정부, WHO 탈퇴 완료…회비 3800억 원 미납",두 장관은 &quot;WHO는 미국이 창립 멤버이자 가장 큰 재정적 기부자인데도 미국의 이익에 적대적인 국가들이 주도하는 정치적이며 관료주의 의제를 추진했다&quot;고도 했다. 트럼프 행정부는 WHO가 코로나19 팬데믹 초기... ,https://news.tvchosun.com/site/data/html_dir/2026/01/23/2026012390151.html,https://n.news.naver.com/mnews/article/448/0000585727?sid=104,"Fri, 23 Jan 2026 14:45:00 +0900"
관료,낙하산 아니어도 문제?… 신임 행장 가로막은 기업은행 노조,"실제로 기업은행 노조는 과거 관료 출신, 이른바 '낙하산 인사'를 저지하기 위해 시위를 진행했다. 지난 2020년 관 출신 행장 반대로 27일간 출근 저지 투쟁을 진행한 바 있다. 이와는 달리 3년 전 김성태 전 행장 취임... ",https://it.chosun.com/news/articleView.html?idxno=2023092155519,https://it.chosun.com/news/articleView.html?idxno=2023092155519,"Fri, 23 Jan 2026 14:44:00 +0900"
관료,"트럼프, 가자지구 재건 계획 발표…지중해 호화 휴양지화","가자지구 재건을 목표로 트럼프 대통령이 제안한 평화위원회가 출범했으며, 가자지구 운영을 맡을 팔레스타인 기술관료 위원회도 가시화됐다. 하지만 현재로서는 가자지구를 누가 어떻게 통치할지에 대한 불확실성이 큰... ",https://www.sisajournal.com/news/articleView.html?idxno=360584,https://n.news.naver.com/mnews/article/586/0000120850?sid=104,"Fri, 23 Jan 2026 14:42:00 +0900"
관료,'사실무근'이라는데…KAI 민영화설이 계속되는 이유,"초대 대표이사를 맡았던 임인택 전 사장은 상공부와 교통부를 거친 관료 출신으로, KAI 재임 이후 건설교통부 장관으로 자리를 옮겼다. 뒤를 이은 2대 길형보 전 사장은 군 출신 인사였으며, 3대 정해주 전 사장 역시... ",https://www.ntoday.co.kr/news/articleView.html?idxno=124487,https://www.ntoday.co.kr/news/articleView.html?idxno=124487,"Fri, 23 Jan 2026 14:36:00 +0900"
관료,"美, 마침내 WHO 탈퇴…회비 3800억원 미납",두 장관은 &quot;WHO는 미국이 창립 멤버이자 가장 큰 재정적 기부자인데도 미국의 이익에 적대적인 국가들이 주도하는 정치적이며 관료주의 의제를 추진했다&quot;고 주장했다. 트럼프 행정부는 WHO가 코로나19 팬데믹(세계적... ,https://view.asiae.co.kr/article/2026012314212333240,https://n.news.naver.com/mnews/article/277/0005711140?sid=104,"Fri, 23 Jan 2026 14:34:00 +0900"
재경부,공공기관 안전등급 심사 전면 확대…건설현장·산재사망 반영 강화,"재경부는 이날 착수회의를 시작으로 4월까지 서면심사와 현장 검증, 이의신청 및 검토 절차를 진행할 계획이다. 최종 안전관리등급은 4월 말 공공기관운영위원회 의결을 거쳐 확정·공개되며, 결과는 공공기관... ",https://www.ajunews.com/view/20260123142127089,https://www.ajunews.com/view/20260123142127089,"Fri, 23 Jan 2026 16:02:00 +0900"
재경부,"재경부, '2025년도 공공기관 안전관리등급 심사' 착수",이투데이=세종=조아라 기자 | 건설현장 심사대상 28개에서 48개로 확대 정부가 '2025년도 공공기관 안전관리등급 심사'에 착수했다. 재정경제부는 23일 '2025년도 공공기관 안전관리등급 심사단 전체 회의'에서 104개... ,https://www.etoday.co.kr/news/view/2548743,https://www.etoday.co.kr/news/view/2548743,"Fri, 23 Jan 2026 16:00:00 +0900"
재경부,"재경부, 104개 공공기관 안전관리등급 심사 착수",4월말 최종등급 공개·경영평가 반영 재정경제부는 23일 '2025년도 공공기관 안전관리등급 심사단' 전체회의를 열고 104개 공공기관을 대상으로 안전관리등급 심사에 착수했다고 밝혔다. 이번 심사는 작년 정부가 발표한... ,https://www.yna.co.kr/view/AKR20260123101100002?input=1195m,https://n.news.naver.com/mnews/article/001/0015864234?sid=101,"Fri, 23 Jan 2026 16:00:00 +0900"
재경부,재경부 '2025년도 공공기관 안전관리등급' 심사 착수,재경부는 23일 오후 '2025년도 공공기관 안전관리등급 심사단 전체회의'를 개최했다. 심사단은 단장을 포함해 산업계와 학계 등 안전전문가 39명으로 구성됐다. 이번 심사는 지난해 발표한 '공공기관 안전관리 강화 방안... ,https://www.mt.co.kr/economy/2026/01/23/2026012314123244305,https://n.news.naver.com/mnews/article/008/0005308668?sid=101,"Fri, 23 Jan 2026 16:00:00 +0900"
재경부,5월초부터 다주택자 양도세 부담 커질 듯…실거주 하지 않는 1주택자 세...,재경부 관계자는 이날 통화에서 “현재 전체 부동산 세제에 대해 연구 용역이 진행 중이어서 장특공제... 재경부는 하반기 중 부동산 세제 관련 연구용역 결과가 나오면 종합적으로 검토한다는 방침이다. 다만 5월로... ,https://www.khan.co.kr/article/202601231545001,https://n.news.naver.com/mnews/article/032/0003423454?sid=101,"Fri, 23 Jan 2026 15:45:00 +0900"
재경부,"롯데건설, 공석으로 남은 ‘경영지원본부장’ 대기열 1순위는",다만 재경부문 등을 아우르는 상위 조직인 경영지원부문장을 맡을 임원이 아직 선임되지 않았다. 기존... 경영지원본부 산하 최고재무책임자(CFO)인 재경부문장은 홍종수 상무에서 올해 임원 배지를 단 송명철 상무보로... ,https://www.fetv.co.kr/news/article.html?no=210653,https://www.fetv.co.kr/news/article.html?no=210653,"Fri, 23 Jan 2026 15:34:00 +0900"
재경부,李정부 금융公기관장 인사 키워드는 '내부 출신·정치권 낙하산',반면 금융위나 재경부 등 관료 출신은 금융 공공·유관기관장 인사에서 배제되는 흐름이다. 과거 1급이나 국장급 공무원이 퇴직 후 기관장으로 다수 임명됐던 것과는 상반된다. 공공·유관기관장 자리 외에도 공무원... ,https://www.hankyung.com/article/202601238845i,https://n.news.naver.com/mnews/article/015/0005241336?sid=101,"Fri, 23 Jan 2026 15:24:00 +0900"
재경부,한수원 5개월 째 사장 없이 표류…정부 '고심'·현장 '어수선',하지만 재경부 공운위 안건에 한수원 사장 선임 내용이 없어 후속 절차는 불투명한 상황이다. 정부가 결단을... 한수원 노조 관계자는 &quot;후보자가 5명으로 추려진 것은 사실이며 현재 재경부 공운위에 명단이 제출돼 심의를... ,https://www.pinpointnews.co.kr/news/articleView.html?idxno=420752,https://www.pinpointnews.co.kr/news/articleView.html?idxno=420752,"Fri, 23 Jan 2026 14:52:00 +0900"
재경부,세무사 수험생들 &quot;한국세무사회 없었으면 2차시험 연기될 뻔&quot;,"15일로 미루려는 쪽은 7급·세무사 양시 수험생과 재경부·국세청·산인공인데, 후자가 세무사회보단 힘이 셀... 이와 관련 서울 강남의 한 세무사는 &quot;한국세무사회의 강력한 문제 제기로 재경부, 국세청 등이 재검토한... ",http://www.intn.co.kr/news/articleView.html?idxno=2048652,http://www.intn.co.kr/news/articleView.html?idxno=2048652,"Fri, 23 Jan 2026 14:30:00 +0900"
재경부,"엎친데 덮친 TBS, 공익법인 지위마저 상실","TBS는 &quot;2025년 12월 31일 자로 게시된 재정경제부(구 기획재정부, 이하 재경부) 고시에 따라 공익법인 지정 목록에서 삭제되어 '공익법인' 지위를 상실했다&quot;고 23일 밝혔다. TBS에 따르면 재경부는 TBS가 공익법인 지정... ",https://www.pdjournal.com/news/articleView.html?idxno=81111,https://www.pdjournal.com/news/articleView.html?idxno=81111,"Fri, 23 Jan 2026 13:26:00 +0900"
재경부,[시사정각] 이혜훈 후보자 청문회...&quot;부도덕성·갑질&quot; 송곳 검증,그렇기 때문에 저희도 두둔한다거나 보호한다고 하는 관점에서 청문회에 임하지 않고 공직 후보자로서 그러니까 재경부 장관으로서의 역할을 할 수 있을 것인가에 대한 소명 절차와 그리고 더불어서 자격이 있는지에 대한... ,https://www.ytn.co.kr/_ln/0101_202601231300165802,https://n.news.naver.com/mnews/article/052/0002304844?sid=100,"Fri, 23 Jan 2026 13:00:00 +0900"
재경부,"&quot;한 줄기 희망 같던 기부금마저&quot;...TBS, 공익법인 지위 상실",TBS 측은 이같은 재경부의 결정에 시민 피해를 우려하고 송구스럽다는 입장을 내놨다. TBS는 23일 보도자료를... 재경부는 TBS가 공익법인 지정 요건인 '정관 개정'을 이행하지 않아 목록에서 삭제한다고 밝혔다. TBS 측은... ,https://www.mediatoday.co.kr/news/articleView.html?idxno=331752,https://n.news.naver.com/mnews/article/006/0000133899?sid=102,"Fri, 23 Jan 2026 12:47:00 +0900"
재경부,中 저가 공습에 작년 반덤핑 조사 신청 '역대 최다',"아울러 무역위는 같은 날 태국산 이음매 없는 동관에 대한 반덤핑 조사 예비 판정에서 홍콩하이량에 대해 3.64%, 파인메탈에 대해 8.41%의 잠정 덤핑방지관세 부과를 재경부 장관에게 건의하기로 의결했다.",http://www.newsfc.co.kr/news/articleView.html?idxno=76402,http://www.newsfc.co.kr/news/articleView.html?idxno=76402,"Fri, 23 Jan 2026 11:40:00 +0900"
재경부,"TBS, 공익법인 지위 상실… 기부금 영수증 발행 불가",재경부는 지난해 12월31일 고시를 통해 공익법인 지정 목록에서 TBS를 삭제했다. 요건을 갖추지 못한... TBS에 따르면 당시 재경부는 정관을 개정하겠다는 확약서를 기반으로 TBS를 공익법인으로 신규 지정했다. TBS는... ,http://www.journalist.or.kr/news/article.html?no=60191,https://n.news.naver.com/mnews/article/127/0000038773?sid=102,"Fri, 23 Jan 2026 11:19:00 +0900"
재경부,"폐국 위기 TBS, 방미통위 구성 지연으로 기부금까지 토해내",방미통위는 재경부 결정에 관여하기 어렵다는 입장이다. 이는 취임 이후 TBS 정상화를 우선 과제로... 재경부의 공익법인 지정 취소로 TBS에 기부했던 시민들은 연말정산 시 세제 혜택을 위해 기부 내역을 기재할 경우... ,https://www.mediaus.co.kr/news/articleView.html?idxno=315948,https://www.mediaus.co.kr/news/articleView.html?idxno=315948,"Fri, 23 Jan 2026 11:12:00 +0900"
재경부,철도 공기업 수장 후보 윤곽…SR 3명·코레일 5명 공운위 추천,"재경부 공운위는 후보들의 검증절차를 진행한 후 국토교통부에 통보하고, 국토부 장관이 임명을 제청하면 대통령이 최종 1명을 임명하게 된다. SR 대표이사의 임기는 3년이다. 코레일도 지난해 8월 경북 청도 무궁화호... ",https://www.widedaily.com/news/articleView.html?idxno=287295,https://www.widedaily.com/news/articleView.html?idxno=287295,"Fri, 23 Jan 2026 09:54:00 +0900"
재경부,"원강수 원주시장, 재경부 직접 찾아갔다…“국비 확보 및 현안 해결 협...",원강수 원주시장이 재정경제부를 직접 찾아갔다. 원주시는 지난 21일 원강수 원주시장이 재정경제부 황순관 기획조정실장을 만나 원활한 2027년 국비 확보와 원주시 주요 현안 해결을 위한 정부 차원의 협조를 요청했다고... ,https://sports.donga.com/region/article/all/20260123/133215195/1,https://n.news.naver.com/mnews/article/382/0001250192?sid=102,"Fri, 23 Jan 2026 09:25:00 +0900"
재경부,철도 공기업 수장 후보 윤곽…SR 3명·코레일 5명 공운위 추천,"재경부 공운위는 후보들의 검증절차를 진행한 후 국토교통부에 통보하고, 국토부 장관이 임명을 제청하면 대통령이 최종 1명을 임명하게 된다. SR 대표이사의 임기는 3년이다. 코레일도 지난해 8월 경북 청도 무궁화호... ",https://www.newsis.com/view/NISX20260122_0003487103,https://n.news.naver.com/mnews/article/003/0013726409?sid=102,"Fri, 23 Jan 2026 08:44:00 +0900"
재경부,"중국산 단일모드 광섬유 덤핑 수입, 국내 산업 피해 최종 판정...5년간 ...","41%의 잠정덤핑방지관세 부과를 재경부 장관에게 건의하기로 의결하였다. 아울러, 중국산 인쇄제판용 평면모양 사진플레이트(2차 재심) 덤핑 방지관세부과 종료재심사 및 자동차용 배터리팩 특허권 침해... ",https://www.bizwork.co.kr/news/articleView.html?idxno=411688,https://www.bizwork.co.kr/news/articleView.html?idxno=411688,"Fri, 23 Jan 2026 08:04:00 +0900"
재경부,"임광현 국세청장, 포항 철강산업단지 방문…지역특화 세정지원 강화",이에 더해 각종 공제제도의 공제율 상향 및 사후관리 완화 등 위기지역·산업을 위한 세법 개정을 재경부에 적극 건의할 예정이다. 마지막으로 대구지방국세청 차원의 특화된 지원을 강조했다. 대구지방국세청은 포항... ,http://www.ferrotimes.com/news/articleView.html?idxno=45926,http://www.ferrotimes.com/news/articleView.html?idxno=45926,"Fri, 23 Jan 2026 07:30:00 +0900"
재경부,[초점] 코스피 5000 시대…6000 가능성은?...미투자자 소외감도,"김재훈 재경부 경제정책국장은 &quot;주가 수준을 언급하는 것은 적절하지 않다&quot;면서도, 기업 지배구조 개선과 불공정 거래 근절, 세제 인센티브 등을 통해 외국인과 개인 투자자 모두가 신뢰할 수 있는 시장을 만들겠다고... ",http://www.newsian.co.kr/news/articleView.html?idxno=85417,http://www.newsian.co.kr/news/articleView.html?idxno=85417,"Fri, 23 Jan 2026 07:26:00 +0900"
재경부,[오늘 재경부 등 경제부처 일정],▲15:00 부총리 차세대 전력반도체 현장방문(충북 음성) ▲07:30 1차관 시장상황점검회의(비공개) ※'25년도 공공기관 안전관리등급 심사 착수(16:00) ※2025년 4/4분기 가축동향조사 결과(12:00) ※차세대 전력반도체... ,https://news.einfomax.co.kr/news/articleView.html?idxno=4394935,https://news.einfomax.co.kr/news/articleView.html?idxno=4394935,"Fri, 23 Jan 2026 07:06:00 +0900"
재경부,반도체로 1% 턱걸이 성장… 정부 &quot;올핸 민간소비로 2% 전망&quot;,4% 플러스(+) 전환할 것으로 보지만 확신의 정도는 약하다. 재경부 관계자는 &quot;건설부문이 올해 플러스 전환할 것으로 보지만 회복속도가 리스크(위험) 요인이 될 수 있다&quot;고 말했다.,https://www.mt.co.kr/economy/2026/01/23/2026012219004016825,https://n.news.naver.com/mnews/article/008/0005308382?sid=101,"Fri, 23 Jan 2026 04:10:00 +0900"
재경부,무역위 '중국산 광섬유' 덤핑 피해 인정,"41%의 잠정덤핑방지관세 부과를 재경부 장관에게 건의하기로 했다. 또한 무역조사실은 2025 덤핑, 지재권침해 등 불공정무역행위 조사성과를 무역위원회에 보고했다. 최근 글로벌 공급과잉과 저성장 장기화 추세로... ",https://www.safetimes.co.kr/news/articleView.html?idxno=238692,https://www.safetimes.co.kr/news/articleView.html?idxno=238692,"Thu, 22 Jan 2026 21:00:00 +0900"
재경부,지난해 ‘1% 성장’ 턱걸이…내수 부진·4분기 역성장 영향,재경부 관계자는 “1월 들어 건설·설비투자 관련 지표가 양호하게 나타나고 있다”며 “작년 하반기부터 이어진 경기 회복 흐름이 올해도 지속될 것”이라고 밝혔다.,https://www.khan.co.kr/article/202601222058015,https://n.news.naver.com/mnews/article/032/0003423332?sid=101,"Thu, 22 Jan 2026 20:58:00 +0900"
재경부,지난해 반덤핑 조사신청 13건 ‘역대 최다’…9건이 중국 기업 대상,"아울러 무역위는 이날 태국산 이음매 없는 동관에 대한 반덤핑 조사 예비 판정에서 홍콩하이량에 대해 3.64%, 파인메탈에 대해 8.41%의 잠정 덤핑방지관세 부과를 재경부 장관에게 건의하기로 의결했습니다. [사진 출처... ",https://news.kbs.co.kr/news/pc/view/view.do?ncd=8466596&ref=A,https://n.news.naver.com/mnews/article/056/0012110675?sid=101,"Thu, 22 Jan 2026 20:27:00 +0900"
재경부,“노후 상수도 관리·도시문제 해결에 AI 접목 추진”,1996년 지방고시 합격 후 공직에 입문한 김 본부장은 30년 공직 생활 중 약 10년을 정부 중앙부처(기재부 재경부 외교부 등)에서 근무하며 중앙 및 지방 행정을 두루 경험한 베테랑 행정가다.,http://www.kookje.co.kr/news2011/asp/newsbody.asp?code=0300&key=20260123.22017006305,https://n.news.naver.com/mnews/article/658/0000133200?sid=102,"Thu, 22 Jan 2026 19:41:00 +0900"
재경부,"재경부, 1월 국고채 모집방식 비경쟁인수 발행 미실시",재정경제부는 이달 모집 방식 국고채 발행을 하지 않는다고 22일 밝혔다. 모집 방식 비경쟁 인수는 사전에 공고된 금리로 국고채를 찍는 방식이다. 국고채 전문 딜러(PD)는 연물별로 수요물량을 응찰할 수 있으며... ,https://news.einfomax.co.kr/news/articleView.html?idxno=4394902,https://news.einfomax.co.kr/news/articleView.html?idxno=4394902,"Thu, 22 Jan 2026 19:06:00 +0900"
