Keyword,Title,Description,Original Link,Link,Publication Date
정성호,"대장동 항소심, 1심 공소유지 담당검사 배제된다…대검, 발령 거절",그러나 지난해 7월 정성호 법무부 장관은 취임 1호 지시로 타청 소속 검사의 직무대리 발령을 통한 공소 관여의 적정성 등 검토를 지시하면서 이런 관행에 제동이 걸렸다. 수사 검사가 공판까지 관여하는 것은 수사·기소... ,https://www.hani.co.kr/arti/society/society_general/1241379.html,https://n.news.naver.com/mnews/article/028/0002788061?sid=102,"Fri, 23 Jan 2026 16:44:00 +0900"
정성호,"법무부 관리 정보, 경찰청 범죄위험도 분석시스템과 연계",정성호 법무부 장관은 &quot;부처 간 정보공유는 국민의 생명과 안전을 지키기 위한 효율적인 방법&quot;이라며 &quot;법무부는 앞으로도 범죄를 예방하고 국민이 안심하며 생활할 수 있도록 최선을 다하겠다&quot;고 말했다.,https://www.ajunews.com/view/20260123153155165,https://www.ajunews.com/view/20260123153155165,"Fri, 23 Jan 2026 16:28:00 +0900"
정성호,"부천준법지원센터, 역곡2동 관계자 초청 업무설명회","법무부(장관 정성호) 부천준법지원센터(부천보호관찰소)는 1월 23일 청사 5층 대회의실에서 역곡2동 행정복지센터 (동장 김준배)관계자를 초청해 업무설명회를 가졌다고 밝혔다. ‘범죄 없는 일상, 국민이 안심하는 사회’... ",http://www.lawissue.co.kr/view.php?ud=2026012315331572859a8c8bf58f_12,http://www.lawissue.co.kr/view.php?ud=2026012315331572859a8c8bf58f_12,"Fri, 23 Jan 2026 15:38:00 +0900"
정성호,법무부 “전자발찌 부착자 정보 경찰과 공유해 치안 강화”,"중심으로 배치하고, 순찰 노선을 지정해 구체적인 근무 계획을 수립할 수 있게 됐다고 했다. 정성호 법무부 장관은 “부처 간 정보 공유로 범죄를 예방하고, 국민이 안심하며 생활할 수 있도록 최선을 다하겠다”고 했다.",https://www.chosun.com/national/court_law/2026/01/23/DLTYRY2DM5EWHDM4OBAY3JCUGA/?utm_source=naver&utm_medium=referral&utm_campaign=naver-news,https://n.news.naver.com/mnews/article/023/0003954820?sid=102,"Fri, 23 Jan 2026 15:34:00 +0900"
정성호,법무부-경찰청(범죄위험도 예측·분석 시스템) 정보연계 개통,"정성호 법무부 장관은 &quot;부처 간 정보공유는 국민의 생명과 안전을 지키기 위한 효율적인 방법으로, 법무부는 앞으로도 이를 통해 범죄를 예방하고, 국민이 안심하며 생활할 수 있도록 최선을 다하겠다&quot;고 말했다. * Pre-CAS... ",https://www.gukjenews.com/news/articleView.html?idxno=3488128,https://www.gukjenews.com/news/articleView.html?idxno=3488128,"Fri, 23 Jan 2026 15:28:00 +0900"
정성호,"법무부 관리 정보, 경찰 범죄위험도 예측 분석시스템에 연계","정성호 법무부 장관은 &quot;부처 간 정보 공유는 국민의 생명과 안전을 지키기 위한 효율적인 방법&quot;이라며 &quot;이를 통해 범죄를 예방하고, 국민이 안심하며 생활할 수 있도록 최선을 다하겠다&quot;고 밝혔다.",https://www.news1.kr/society/court-prosecution/6049145,https://n.news.naver.com/mnews/article/421/0008731537?sid=102,"Fri, 23 Jan 2026 15:28:00 +0900"
정성호,"법무부·경찰청, 범죄위험도 예측 시스템 정보연계 개통",법무부(장관 정성호)와 경찰청(청장 직무대행 유재성)은 23일 보도자료를 통해 지난달부터 법무부 관리... 정성호 법무부 장관은 &quot;부처 간 정보 공유는 국민의 생명과 안전을 지키기 위한 효율적인 방법&quot;이라며 &quot;법무부는... ,https://www.newspim.com/news/view/20260123000817,https://www.newspim.com/news/view/20260123000817,"Fri, 23 Jan 2026 15:17:00 +0900"
정성호,"법무부, 경찰청(범죄위험도 예측·분석 시스템)에 전자발찌 대상자 등 ...","법무부(장관 정성호)와 경찰청(청장 직무대행 유재성)은 국민 안전 강화를 위해, 법무부가 관리하는 정보... 정성호 법무부장관은 “부처 간 정보공유는 국민의 생명과 안전을 지키기 위한 효율적인 방법으로, 법무부는... ",http://www.lawissue.co.kr/view.php?ud=202601231512418169a8c8bf58f_12,http://www.lawissue.co.kr/view.php?ud=202601231512418169a8c8bf58f_12,"Fri, 23 Jan 2026 15:16:00 +0900"
정성호,[단도직입│풀버전] 정성호 &quot;검찰개혁 소극적이지 않아&quot;…&quot;검사들에게 ...,[정성호/법무부 장관 : 정리가 됐다기보다 대통령께서 일본 방문하시기 전에 당 대표께 이런 말씀을... [정성호/법무부 장관 : 네. 그렇습니다.] [앵커] 중수청·공소청 설치 법안은 지나고 나서 보니까. 이재명 대통령의 뜻이... ,https://news.jtbc.co.kr/article/NB12281450?influxDiv=NAVER,https://n.news.naver.com/mnews/article/437/0000475025?sid=100,"Fri, 23 Jan 2026 14:43:00 +0900"
정성호,"쿠팡 주주 그린옥스ㆍ알티미터, 한-미 FTA 근거로 중재의향서 제출","법무부(장관 정성호)는 23일 이 소식을 알렸다. 청구인들은 이번 중재의향서에서 2025년 12월 1일 발생한 쿠팡의 개인정보 유출 사건 이후 국회와 행정부가 쿠팡을 대상으로 진상 조사와 각종 행정처분, 위협적 발언을... ",http://www.lawleader.co.kr/news/articleView.html?idxno=18370,http://www.lawleader.co.kr/news/articleView.html?idxno=18370,"Fri, 23 Jan 2026 14:36:00 +0900"
정성호,"법무부 부산솔로몬로파크, 겨울방학 특별프로그램 성료","법무부(장관 정성호) 부산솔로몬로파크는 지난 1월 20일부터 22일까지 3일간 초등학생과 그 가족을 대상으로 '겨울방학 특별 프로그램'을 운영했다고 23일 밝혔다. 이번 프로그램에는 총 23가족, 59명의 어린이와 부모가... ",http://www.lawissue.co.kr/view.php?ud=2026012313492274649a8c8bf58f_12,http://www.lawissue.co.kr/view.php?ud=2026012313492274649a8c8bf58f_12,"Fri, 23 Jan 2026 13:52:00 +0900"
정성호,"&quot;압류에도 지켜진다&quot;… 월 250만 원 생계비계좌, 2월부터 전면 도입","정성호 법무부 장관은 &quot;채무자와 그 가족의 생계를 보다 두텁게 보호하고, 소상공인과 청년 등 취약계층이 다시 출발할 수 있는 최소한의 안전망을 마련한 것&quot;이라며 &quot;민생을 지키는 법무행정을 지속해 나가겠다&quot;고... ",https://www.newswhoplus.com/news/articleView.html?idxno=52273,https://www.newswhoplus.com/news/articleView.html?idxno=52273,"Fri, 23 Jan 2026 12:26:00 +0900"
정성호,"검찰 개혁 '동상이몽' 속 '명·청' 엇박자…정청래, 조국과 '檢 개혁동맹...",강성 지지층 일각에선 정부안을 주도한 정성호 법무부 장관과 검찰 출신 봉욱 민정수석에 대해 불신을 표시하며 사퇴를 촉구하는 요구마저 나왔다. 여권 지지층이 많이 모여 있는 인터넷 커뮤니티에서는 이 대통령을 향한... ,https://www.sisajournal.com/news/articleView.html?idxno=360463,https://n.news.naver.com/mnews/article/586/0000120812?sid=100,"Fri, 23 Jan 2026 11:00:00 +0900"
정성호,"법무부, 민생·안전 10대 법안 추진…&quot;범죄로부터 안전한 나라를 만들겠...","정성호 법무부장관(왼쪽)이 22일 서울 여의도 국회에서 더불어민주당 한병도 원내대표를 예방, 기념 촬영하고... 정성호 법무부 장관은 22일 더불어민주당 원내대표 한병도와 국회법제사법위원회 위원장 추미애를 만나 이... ",https://www.cbci.co.kr/news/articleView.html?idxno=551514,https://www.cbci.co.kr/news/articleView.html?idxno=551514,"Fri, 23 Jan 2026 08:06:00 +0900"
정성호,코스피 6000 간다는데 성장률 -0.3% 빠진 이유는?: 슬로우레터 1월23일.,정성호(법무부 장관)가 “이재명 정부의 검찰은 다르다”고 한 걸 두고 하는 말이다. 오창익(인권연대 사무국장)은 “정성호의 발언은 순진과 오만이 섞여 있는 무책임한 언동”이라고 지적했다. “검찰은 매번 그랬다.... ,https://slownews.kr/153138,https://slownews.kr/153138,"Fri, 23 Jan 2026 07:56:00 +0900"
정성호,2월부터 월 250만원까지 압류 걱정 없는 생계비 계좌 개설 가능,"정성호 법무부장관은 &quot;이번 개정은 채무자와 그 가족의 생계를 보다 두텁게 보장하고, 소상공인 · 청년 등 취약계층의 새출발과 경제적 재기를 지원하기 위한 것&quot;이라고 밝혔다. 리걸타임즈",http://www.legaltimes.co.kr/news/articleView.html?idxno=91777,http://www.legaltimes.co.kr/news/articleView.html?idxno=91777,"Fri, 23 Jan 2026 07:46:00 +0900"
정성호,"‘정성호♥’ 경맑음 “도대체 환승연애가 뭐길래, 귓구녕 막혀있어”...","코미디언 정성호의 아내 경맑음이 미모의 딸들과의 하루를 공유했다. 경맑음은 1월 22일 자신의... 맨날 막혀있어&quot;라고 해 웃음을 주기도 했다. 한편 정성호, 경맑음 부부는 지난 2010년 결혼해 슬하에 3남 2녀를 두고 있다.",https://www.newsen.com/news_view.php?uid=202601230509462110,https://m.entertain.naver.com/article/609/0001084043,"Fri, 23 Jan 2026 06:03:00 +0900"
정성호,춘천지검장에 유광렬 법무연수원 기획부장 임명,"차범준 신임 기획조정실장은 법무부의 조직·예산을 총괄하면서 양구 출신 정성호 장관과 호흡을 맞춰 일하게 됐다. 춘천고와 고려대 법학과를 졸업한 차 실장은 2007년 임관한 후 창원지검 공공수사부장, 수원지검... ",https://www.kado.net/news/articleView.html?idxno=2029903,https://n.news.naver.com/mnews/article/654/0000163009?sid=102,"Fri, 23 Jan 2026 00:09:00 +0900"
정성호,'검찰 항소 포기 논란' 대장동 일당 항소심 시작,일각에서는 대검 수뇌부가 정성호 법무부 장관의 압박에 항소 포기를 지휘한 것 아니냐는 의혹이 제기됐다. 형사소송법상 피고인만 항소할 경우 '불이익 변경 금지' 원칙에 따라 1심 선고형보다 더 무거운 형을... ,https://news.tf.co.kr/read/life/2285082.htm,https://n.news.naver.com/mnews/article/629/0000465296?sid=102,"Fri, 23 Jan 2026 00:01:00 +0900"
정성호,"[논설실의 뉴스 읽기] “여당도 민주당, 야당도 민주당”… 최약체 야당...","김용민 의원은 국회에서 정성호 법무부 장관에게 “검사들 입김이 너무 많이 들어갔다”며 큰소리를 냈고... 민정수석, 정성호 법무장관, 김민석 총리가 검찰 개혁을 망쳤다”는 비난이 쏟아졌다. 이 대통령이 한일... ",https://www.chosun.com/opinion/2026/01/22/CAN4R3X5T5G3FJB62VR6SPS6AY/?utm_source=naver&utm_medium=referral&utm_campaign=naver-news,https://n.news.naver.com/mnews/article/023/0003954662?sid=110,"Thu, 22 Jan 2026 23:36:00 +0900"
정성호,[동아광장/정원수]‘9.99 대통령’과 너무 다른 ‘與 검찰개혁 조급증’,"여당 법사위원은 ‘검찰에 의한, 검찰을 위한 것’이라는 취지로 정성호 법무부 장관에게 고함을 쳤고, 야당 의원이 “장관님을 잡아먹으려고 하네”라며 팔짱을 끼고 비웃을 정도였다. 추진단의 구성, 논의 과정, 그... ",https://www.donga.com/news/Opinion/article/all/20260122/133214234/2,https://n.news.naver.com/mnews/article/020/0003691704?sid=110,"Thu, 22 Jan 2026 23:18:00 +0900"
정성호,신상진 &quot;정성호 법무부 장관에 손해배상 소송 검토&quot;,"항소 포기 직후 ‘성남시에 협조한다’던 정성호, 전화 한 통 없어 검찰은 ‘시민 편’ 아닌 ‘대장동 일당... 관련해 정성호 법무부 장관에 대한 손해배상 소송을 검토 중이라고 밝혔다. 신 시장은 22일 TV조선 장원준... ",https://news.tvchosun.com/site/data/html_dir/2026/01/22/2026012290316.html,https://n.news.naver.com/mnews/article/448/0000585572?sid=100,"Thu, 22 Jan 2026 21:13:00 +0900"
정성호,[단도직입] 정성호 &quot;대통령·장관이 소극적? 불가역적 검찰 개혁하려는...,"단도직입은 정성호 법무부장관을 인터뷰하겠습니다. 중수청은 제2의 검찰청인가, 수사-기소 분리가 지켜지겠는가. 논쟁적 지점에 대해 질문을 던지겠습니다. [앵커] 네. 장관님 오랜만에 뵙습니다. 반갑습니다. [정성호... ",https://news.jtbc.co.kr/article/NB12281396?influxDiv=NAVER,https://n.news.naver.com/mnews/article/437/0000474901?sid=100,"Thu, 22 Jan 2026 20:25:00 +0900"
정성호,[정동칼럼]이재명 정부의 검찰,| 오창익 인권연대 사무국장 법무부 장관 정성호. 갑자기 목소리를 높여 힘주어 말했다. 국회에서였다.... 정성호는 2004년 노무현 대통령 탄핵 사태 와중에 국회의원이 되었다. 이때부터 2008년을 제외하고 내리... ,https://www.khan.co.kr/article/202601221945005,https://n.news.naver.com/mnews/article/032/0003423272?sid=110,"Thu, 22 Jan 2026 19:45:00 +0900"
정성호,"법무부, 검찰 고위직 32명 인사… 법무부 검찰국장에 이응철",법무부(장관 정성호)는 22일 대검검사급 검사 32명에 대한 신규 보임 및 전보 인사를 오는 27일자로 시행한다고 밝혔다. 검찰 '빅2'로 꼽히는 법무부 검찰국장에는 이응철(사법시험 43회) 춘천지검장이 보임됐다. 수사... ,https://news.koreanbar.or.kr/news/articleView.html?idxno=34963,https://news.koreanbar.or.kr/news/articleView.html?idxno=34963,"Thu, 22 Jan 2026 19:40:00 +0900"
정성호,"정성호 법무, 민주당 추미애·한병도 예방…‘민생 10대 법안’ 입법 추...","정성호 법무부 장관은 이날 국회를 찾아 한병도 더불어민주당 원내대표와 추미애 국회 법제사법위원장을 예방하고, ‘민생·안전 10대 법안’을 설명하며 신속한 심사를 요청했다고 밝혔다. 정 장관은 이 자리에서 최근... ",https://www.chosun.com/national/court_law/2026/01/22/ZT7Q47Q3YZB4JIGNEVXUFERC3A/?utm_source=naver&utm_medium=referral&utm_campaign=naver-news,https://n.news.naver.com/mnews/article/023/0003954639?sid=102,"Thu, 22 Jan 2026 18:38:00 +0900"
정성호,"與, 검찰개혁 의총서 갑론을박…&quot;예외 인정&quot;·&quot;요구권&quot;","한편, 정성호 법무부 장관은 국회를 찾아 민주당 한병도 원내대표와 추미애 법제사법위원회 위원장을 만났습니다. 정 장관은 면담 뒤 취재진에게 '민생·안전 10대 법안' 입법에 대한 협조 요청 차원의 예방이라고... ",http://www.yonhapnewstv.co.kr/AKR20260122183013NmE,https://n.news.naver.com/mnews/article/422/0000825682?sid=100,"Thu, 22 Jan 2026 18:31:00 +0900"
정성호,"법무부, 집단소송법 개정 등 민생안전 10대 법안 입법 집중 추진",정성호 법무부 장관은 22일 오후 한병도 더불어민주당 원내대표와 추미애 국회법제사법위원회 위원장을 예방해 10대 법안을 설명하고 집중 심사를 요청했다고 밝혔다. 정 장관은 최근 쿠팡 개인정보 유출 사건 등 소액... ,https://www.yna.co.kr/view/AKR20260122148800004?input=1195m,https://n.news.naver.com/mnews/article/001/0015862496?sid=102,"Thu, 22 Jan 2026 18:06:00 +0900"
정성호,"순천교도소, 전문학사 졸업 수형자 19명 배출… 바리스타 등 평균 3개 자...","정성호 법무부 장관은 “오늘 받은 학위증서는 단순한 종이 한 장이 아니라, 지난 2년간의 인내와 변화의 의지가 담긴 땀방울의 결과”라며 “전문 기술과 배움에 대한 열정은 사회로 돌아가 다시 일어서는 데 가장... ",https://www.segye.com/newsView/20260122517280?OutUrl=naver,https://n.news.naver.com/mnews/article/022/0004099709?sid=102,"Thu, 22 Jan 2026 17:55:00 +0900"
정성호,"순천교도소, 전국 유일 ‘수형자 전문학사 과정’ 19명 학위 취득","법무부(장관 정성호)는 1월 22일 오전 순천교도소 대강당에서 순천제일대학교(총장 성동제)와 협력해 운영... 정성호 법무부 장관은 “오늘 받은 학위증서는 단순한 종이 한 장이 아니라, 지난 2년간의 인내와 변화의... ",http://www.lawissue.co.kr/view.php?ud=202601221748183449a8c8bf58f_12,http://www.lawissue.co.kr/view.php?ud=202601221748183449a8c8bf58f_12,"Thu, 22 Jan 2026 17:52:00 +0900"
정일영,"진통 끝 열린 이혜훈 청문회…여야, 자료 제출부터 부정 청약 의혹 등 질...","정일영 민주당 의원은 “비망록 관련해 주술적·종교적 표현, 또 여러 가지 선거에 관련되는 내용이 많은데 후보자께서 사실이 아니라고 말씀하신 걸로 안다”면서도 “후보자께서 더 구체적이고 객관적인 설명 자료를... ",https://www.seoul.co.kr/news/politics/2026/01/23/20260123500218?wlog_tag3=naver,https://n.news.naver.com/mnews/article/081/0003611310?sid=100,"Fri, 23 Jan 2026 16:43:00 +0900"
정일영,"이혜훈 청문회, ‘부정 청약·자녀 입학’ 공방…여야 &quot;집 내놔야&quot;, &quot;사...",정일영 의원 역시 “청약 가점 74점 당첨의 핵심은 부양가족 수”라며 분양 신청서와 국토부 판단 자료 제출을 요구했다. 부정청약 의혹에 대해 이 후보자는 “원펜타스와 관련해 부정청약을 했다는 생각은 전혀 없다”며... ,https://www.etoday.co.kr/news/view/2548820,https://www.etoday.co.kr/news/view/2548820,"Fri, 23 Jan 2026 16:32:00 +0900"
정일영,'부정청약·갑질·입시' 이혜훈 의혹 총망라…여야 불문 집중 질타,"정일영 의원도 &quot;재산도 늘리고, 명예도 갖고, 출세도 하고, 자녀들 좋은 학교 보내기 위해 나쁘게 표현하면 온갖 짓을 다 한 것 같다&quot;며 &quot;이런 분이 대한민국의 기획예산처 장관을 한다 그러면 청년들과 선량한 국민이... ",https://www.news1.kr/politics/assembly/6049261,https://n.news.naver.com/mnews/article/421/0008731722?sid=100,"Fri, 23 Jan 2026 16:25:00 +0900"
정일영,"여야, 이혜훈 청문회서 &quot;자료 제출 부실&quot; 한목소리",정일영 민주당 의원도 비망록과 관련해 주술적·종교적 표현과 선거 관련 내용이 포함됐다는 의혹을 언급하며 후보자의 해명에도 논란이 확산되고 있다고 지적했다. 정 의원은 &quot;의혹이 의혹을 낳고 있는 만큼 보다... ,https://www.ebn.co.kr/news/articleView.html?idxno=1696610,https://www.ebn.co.kr/news/articleView.html?idxno=1696610,"Fri, 23 Jan 2026 16:22:00 +0900"
정일영,"이혜훈 후보자, 비망록 논란과 자료 미비로 여야 질타…국회 치열 공방","민주당 정일영 의원은 &quot;언론에 보도된 여러 의혹과 관련해 후보자께서 더 구체적이고 객관적인 설명 자료를 제공해야 한다&quot;고 요청하며 비망록과 관련된 내용을 언급했다. 그는 비망록에 포함된 주술적·종교적 표현, 선거... ",https://www.gokorea.kr/news/articleView.html?idxno=855294,https://www.gokorea.kr/news/articleView.html?idxno=855294,"Fri, 23 Jan 2026 16:16:00 +0900"
정일영,"이혜훈 청문회, 국민의힘 의원들도 '난감'",국회 재정경제기획위원회 박수영 국민의힘 간사와 권영세 등 의원들이 23일 서울 여의도 국회에서 열린 이혜훈 기획예산처 장관 후보자 인사청문회에서 이 후보자가 정일영 더불어민주당 의원에게 강도... ,https://www.newsis.com/view/NISI20260123_0021137330,https://n.news.naver.com/mnews/article/003/0013727724?sid=100,"Fri, 23 Jan 2026 16:14:00 +0900"
정일영,질문공세 받는 이혜훈 바라보는 임이자,임이자 국회 재정경제기획위원장이 23일 서울 여의도 국회에서 열린 이혜훈 기획예산처 장관 후보자 인사청문회에서 정일영 더불어민주당 의원의 강도 높은 질문 공세를 받는 이혜훈 후보자를 바라보고... ,https://www.newsis.com/view/NISI20260123_0021137326,https://n.news.naver.com/mnews/article/003/0013727725?sid=100,"Fri, 23 Jan 2026 16:14:00 +0900"
정일영,"임이자, 이혜훈에 고강도 질문공세 쏟아지자",임이자 국회 재정경제기획위원장이 23일 서울 여의도 국회에서 열린 이혜훈 기획예산처 장관 후보자 인사청문회에서 이혜훈 후보자가 정일영 더불어민주당 의원에게 강도 높은 질문 공세를 받자 생각에... ,https://www.newsis.com/view/NISI20260123_0021137329,https://n.news.naver.com/mnews/article/003/0013727722?sid=100,"Fri, 23 Jan 2026 16:14:00 +0900"
정일영,질문공세 받는 이혜훈 바라보는 임이자,임이자 국회 재정경제기획위원장이 23일 서울 여의도 국회에서 열린 이혜훈 기획예산처 장관 후보자 인사청문회에서 정일영 더불어민주당 의원의 강도 높은 질문 공세를 받는 이혜훈 후보자를 바라보고... ,https://www.newsis.com/view/NISI20260123_0021137331,https://n.news.naver.com/mnews/article/003/0013727723?sid=100,"Fri, 23 Jan 2026 16:14:00 +0900"
정일영,與野 한목소리로 이혜훈 질타…&quot;입만 열면 거짓말&quot; &quot;불법 청약 받은 집...,같은 당 정일영 의원은 이 후보자의 래미안 원펜타스 부정 청약 의혹에 대해 &quot;후보 측이 분양신청서를 제출해 달라는 요청에 '낼 수 없다'고 했다. 인터넷 청약이어도 제출할 수 있다고 본다&quot;며 &quot;워낙 많은 언론에 보도가... ,https://www.ngonews.kr/news/articleView.html?idxno=223032,https://www.ngonews.kr/news/articleView.html?idxno=223032,"Fri, 23 Jan 2026 16:10:00 +0900"
정일영,“장관 하지 마시고 다른 데 가서 얘기 하시면 돼”…與의원도 이혜훈 ...,"봅니다”(정일영 더불어민주당 의원) “예, 알겠습니다.”(이혜훈 기획예산처 장관 후보자) “그런 용의가... 민주당 정일영 의원도 “저는 이 자리에서 후보자님이 며느님, 아드님의 가정 관계 막 이런 거 언급하는 것도... ",https://www.donga.com/news/Politics/article/all/20260123/133218530/2,https://n.news.naver.com/mnews/article/020/0003691940?sid=100,"Fri, 23 Jan 2026 16:10:00 +0900"
정일영,"이혜훈, 원펜타스 청약에 &quot;국민 눈높이 부족 알지만 규정·절차 따랐다...",이혜훈 후보자는 이날 국회 재정경제기획위원회에서 열린 인사청문회에서 정일영 더불어민주당 의원 질의에 이같이 답했다. 정일영 의원은 &quot;취업한 성인 자녀는 세법상 부양가족에 해당하지 않는다. 재산 등록과 연말정산... ,https://www.newsis.com/view/NISX20260123_0003488274,https://n.news.naver.com/mnews/article/003/0013727688?sid=101,"Fri, 23 Jan 2026 15:58:00 +0900"
정일영,[바로이뉴스] &quot;집 포기할 거야 말 거야!?&quot;…버티고 버티다 마지못해 &quot;네...,이 후보자 측이 50억 가까운 시세차익을 누린 이 아파트를 놓고 정일영 더불어민주당 의원이 &quot;장관직 수행에 앞서 박탈감을 느낀 신혼부부를 위해 집을 포기할 의사가 있느냐&quot;고 여러 차례 질문하자 망설이던 이 후보자는... ,https://news.sbs.co.kr/news/endPage.do?news_id=N1008415990&plink=ORI&cooper=NAVER,https://n.news.naver.com/mnews/article/055/0001326948?sid=100,"Fri, 23 Jan 2026 15:58:00 +0900"
정일영,"'원펜타스'에 집중된 청문회, 여야 이혜훈 '부정청약 의혹' 질타",정일영 더불어민주당 의원도 &quot;언론 보도로 의혹이 확산되는 상황에서 후보자는 정작 핵심 자료를 내지 않고 있다&quot;며 &quot;구체적이고 객관적인 설명 자료를 제출하라&quot;고 요구했다. 국민의힘 역시 비판 대열에 가세했다. 최은석... ,http://www.seoulwire.com/news/articleView.html?idxno=703148,http://www.seoulwire.com/news/articleView.html?idxno=703148,"Fri, 23 Jan 2026 15:44:00 +0900"
정일영,[이혜훈 청문회] 여야 &quot;자료 미흡&quot; &quot;갑질의혹&quot; 질타…李 &quot;내란동조 잘못...,"민주당 정일영 의원은 &quot;비망록 관련해 주술적·종교적 표현, 또 여러 가지 선거에 관련되는 내용이 많은데 후보자께서 사실이 아니라고 말씀하신 걸로 안다&quot;면서도 &quot;많은 언론에 보도되고, 의혹에 의혹을 낳고 있다. 그래서... ",https://www.polinews.co.kr/news/articleView.html?idxno=720749,https://www.polinews.co.kr/news/articleView.html?idxno=720749,"Fri, 23 Jan 2026 15:39:00 +0900"
정일영,가까스로 열린 이혜훈 청문회... 여야 &quot;자료 미흡&quot; 한목소리 질타,"민주당 정일영 의원은 &quot;비망록 관련해 주술적·종교적 표현, 또 여러 가지 선거에 관련되는 내용이 많은데 후보자께서 사실이 아니라고 말씀하신 걸로 안다&quot;면서도 &quot;많은 언론에 보도되고, 의혹에 의혹을 낳고 있다. 그래서... ",https://www.ltn.kr/news/articleView.html?idxno=50406,https://www.ltn.kr/news/articleView.html?idxno=50406,"Fri, 23 Jan 2026 15:32:00 +0900"
정일영,"청문회 첫날부터 '자료 공백' 논란… 여야, 이혜훈 후보자 집중 질타","민주당 정일영 의원은 이 후보자의 비망록 논란을 언급하며 &quot;주술적·종교적 표현과 선거 관련 내용이 다수 포함돼 있다는 보도가 이어지고 있다&quot;며 &quot;후보자는 사실이 아니라고 했지만, 의혹이 꼬리에 꼬리를 물고 있는 만큼... ",https://www.newswhoplus.com/news/articleView.html?idxno=52291,https://www.newswhoplus.com/news/articleView.html?idxno=52291,"Fri, 23 Jan 2026 15:30:00 +0900"
