Keyword,Title,Description,Original Link,Link,Publication Date
국정기획위원회,"당정, 금융위 '조직개편' 논의…&quot;25일 본회의 처리 노력&quot;",민주당 정무위 간사인 강준현 의원은 이날 당정 협의가 끝나고 기자들과 만나 &quot;결론이 난 것은 없다&quot;면서도 &quot;국정기획위원회에서 여러 차례 논의해 나온 안에 어느 정도 공감했다&quot;고 말했습니다. 강 의원은 &quot;금융위가... ,https://biz.sbs.co.kr/article_hub/20000256583?division=NAVER,https://n.news.naver.com/mnews/article/374/0000460537?sid=101,"Mon, 01 Sep 2025 13:42:00 +0900"
국정기획위원회,"포항시, 새정부 123대 국정과제 연계한 지역 발전 로드맵 본격 가동","시는 지난 29일 장상길 부시장 주재로 ‘새정부 국정과제 대응 전략사업 발굴 보고회’를 열고 국정기획위원회가 발표한 국정운영 5개년 계획에 대응해 철강, 이차전지 등 주력산업 경쟁력 강화, 바이오·AI 등 신산업... ",https://www.segye.com/newsView/20250901509405?OutUrl=naver,https://n.news.naver.com/mnews/article/022/0004064527?sid=102,"Mon, 01 Sep 2025 13:32:00 +0900"
국정기획위원회,"기재부 &quot;공공기관 부채, 4년후 127조 늘어날 것&quot;",겸 기획재정부 장관이 정부서울청사에서 주재한 제8차 공공기관운영위원회 회의에 제출했다. 조사... 정부 국정운영 핵심 과제에 제대로 투자하는 성과 중심의 전략적 재정 운용을 해야 한다&quot;고 지시했다. / 박태견... ,http://www.viewsnnews.com/article?q=229523,http://www.viewsnnews.com/article?q=229523,"Mon, 01 Sep 2025 13:18:00 +0900"
국정기획위원회,업무상질병 산재 처리기간 228일→120일 단축,이재명 정부의 국정운영 5개년 계획에 담긴 내용으로 국정기획위원회가 신속 추진과제로 제안한 것에 대한 후속 조치다. 노동부는 산재 처리 절차를 개선하고 재해 조사 기능을 강화해 2027년까지 처리 기간을 평균... ,https://news.tf.co.kr/read/life/2239172.htm,https://n.news.naver.com/mnews/article/629/0000421650?sid=102,"Mon, 01 Sep 2025 13:17:00 +0900"
국정기획위원회,"[세종 인사이드아웃] ‘노동부’로 공식 약칭 바꾼 날, 첫 기자간담회 ...",국정기획위원회에서는 2027년까지 이를 OECD 평균인 0.29로 낮추겠다고 했다. 이 목표를 달성하기 위해 노력할 것이다.” ―코레일에서 최근 산재 사망 사고가 있었다. 각종 경제적 제재 강화를 예고한 민간 기업뿐 아니라... ,https://biz.chosun.com/topics/topics_social/2025/09/01/LGQWKHX43ZBLXAYVZTJ7PJZ5WY/?utm_source=naver&utm_medium=original&utm_campaign=biz,https://n.news.naver.com/mnews/article/366/0001104453?sid=102,"Mon, 01 Sep 2025 13:11:00 +0900"
국정기획위원회,"당정, '해체기로' 금융위 조직개편안 논의…&quot;25일 처리 노력&quot;",민주당 정무위 간사인 강준현 의원은 이날 당정 협의가 끝나고 기자들과 만나 &quot;결론이 난 것은 없다&quot;면서도 &quot;국정기획위원회에서 여러 차례 논의해 나온 안에 어느 정도 공감했다&quot;고 말했다. 강 의원은 &quot;금융위가... ,https://www.yna.co.kr/view/AKR20250901083900001?input=1195m,https://n.news.naver.com/mnews/article/001/0015597763?sid=100,"Mon, 01 Sep 2025 13:11:00 +0900"
국정기획위원회,구윤철 부총리 “중대재해 책임 있는 공공기관장 해임 추진”,새정부 국정과제와 대국민 필수 SOC 투자소요 등을 반영한 2025~2029년 공공기관 중장기재무관리계획도 논의했다. 구윤철 부총리 겸 기획재정부장관은 1일 정부서울청사 대회의실에서 ‘2025년 제8차 공공기관운영위원회’... ,https://www.naeil.com/news/read/559631?ref=naver,https://www.naeil.com/news/read/559631?ref=naver,"Mon, 01 Sep 2025 13:08:00 +0900"
국정기획위원회,[이재명정부 5년 국정 설계자 - 박수현 의원(국정기획위 균형성장특위 ...,그래서 국정기획위원회의 균형성장 특별위원회를 이어갈 수 있는 자치분권균형발전전국회의라는 당의 조직이 만들어졌다. 설계도대로 집행이 될 수 있도록 당이 뒷받침하고 감시자 역할도 하는 시스템을 갖췄다. ●균형... ,https://www.naeil.com/news/read/559687?ref=naver,https://www.naeil.com/news/read/559687?ref=naver,"Mon, 01 Sep 2025 13:08:00 +0900"
국정기획위원회,"중수청, 행안부 산하 21%, 법무부 산하 36%","1%p, 자세한 내용은 중앙여론조사심의위원회 홈페이지 참조) 국정기획위는 이재명정부 5년 청사진을 내놓으며 ‘숙의’의 중요성을 강조한 바 있다. “중요한 정책과제에 대해 숙의 공론을 통해 정책 형성이 이뤄질... ",https://www.naeil.com/news/read/559685?ref=naver,https://www.naeil.com/news/read/559685?ref=naver,"Mon, 01 Sep 2025 13:06:00 +0900"
국정기획위원회,"윤석열 부부 기소, 특검 수사 ‘2라운드’",윤석열 전 대통령 부부와 윤석열정부 국정 2인자였던 한덕수 전 국무총리가 재판에 넘겨지면서 특별검사... 최근에는 이배용 국가교육위원회 위원장 임명과정에서 금거북이를 받았다는 의혹까지 불거졌다. 특검팀은 김... ,https://www.naeil.com/news/read/559707?ref=naver,https://www.naeil.com/news/read/559707?ref=naver,"Mon, 01 Sep 2025 13:06:00 +0900"
국정기획위원회,"민주당 “당·정 공동체, 시대적 개혁과제 완수”",최고위원회의에서 발언하고 있다. 연합뉴스 검찰개혁 등 주요 입법과제를 정권 전반부의 국정동력 확보와... “참고로 국정기획위는 행안부로 제안했다. 이 부분도 곧 공론화될 예정”이라고 강조했다. 정성호 법무부... ,https://www.naeil.com/news/read/559680?ref=naver,https://www.naeil.com/news/read/559680?ref=naver,"Mon, 01 Sep 2025 13:04:00 +0900"
국정기획위원회,업무상질병 산재처리기간 2027년 120일로,이는 8월 5일 대통령 직속 국정기획위원회에서 ‘업무상 질병 처리기간 단축’을 신속 추진과제로 제안한 것에 대한 후속조치다. 산재노동자가 질병에 걸려 산재를 신청하면 업무와 질병 사이의 상당인과관계를 확인하기... ,https://www.naeil.com/news/read/559646?ref=naver,https://www.naeil.com/news/read/559646?ref=naver,"Mon, 01 Sep 2025 13:02:00 +0900"
국정기획위원회,"[국회 라이브] &quot;15.8시간마다 여성 위협&quot;… 최기상 &quot;현장 방치, 국가가 ...","&quot; 1일 열린 국회 예산결산특별위원회에서 더불어민주당 최기상 의원은 교제폭력과 스토킹 범죄에 대한 정부... 최 의원은 이재명 정부의 국정과제 제74번을 언급하며 &quot;교제폭력 대응이 명시돼 있지만, 실행 계획은 전무하다... ",https://www.newscj.com/news/articleView.html?idxno=3312171,https://www.newscj.com/news/articleView.html?idxno=3312171,"Mon, 01 Sep 2025 12:52:00 +0900"
국정기획위원회,"당정, 금융당국 조직개편 결론 못 내…&quot;숙제 많고 공론 절차 필요&quot;",국회 정무위원회 여당 간사인 민주당 강준현 의원은 1일 국회에서 당정 협의를 마친 뒤 기자들과 만나 &quot;국정기획위원회에서 수차례 논의해 나온 안에 대해서 어느 정도 공감이 됐다&quot;면서도 &quot;내부적으로 하나하나 보완할... ,https://news.einfomax.co.kr/news/articleView.html?idxno=4372366,https://news.einfomax.co.kr/news/articleView.html?idxno=4372366,"Mon, 01 Sep 2025 12:48:00 +0900"
국정기획위원회,"당정, '금융위 조직개편' 협의…&quot;25일 본회의서 처리 노력&quot;",민주당 정무위원회 간사인 강준현 의원은 이날 서울 여의도 국회 의원회관에서 열린 정무위 당정협의 후 기자들과 만나 &quot;국정기획위원회의 조직개편안에 금융위원회와 기획재정부 조직 개편안이 있다&quot;며 &quot;대통령실에서... ,https://www.newsis.com/view/NISX20250901_0003310714,https://n.news.naver.com/mnews/article/003/0013453393?sid=100,"Mon, 01 Sep 2025 12:42:00 +0900"
국정기획위원회,"당정 '금융위 해체안' 논의…&quot;보완 필요, 9월 본회의 처리 노력&quot;",서미선 임윤지 기자 = 국회 정무위원회 소속 더불어민주당 의원들과 정부가 1일 국회 의원회관에서 당정 협의를 갖고 국정기획위원회가 내놓은 조직개편안 중 금융위원회 해체안에 대해 논의했다. 당정은 국정위... ,https://www.news1.kr/politics/assembly/5897174,https://n.news.naver.com/mnews/article/421/0008458811?sid=100,"Mon, 01 Sep 2025 12:37:00 +0900"
국정기획위원회,"경찰 &quot;'주식 의혹' 이춘석, 절차 따라 차질 없이 수사&quot;",다만 국정기획위원회에서 알게 된 미공개 정보를 이용해 선행매매한 혐의는 부인했다고 한다. 차 씨도 지난달 11~12일 경찰에 출석해 차명 거래를 인정하는 취지로 진술한 것으로 전해졌다. 경찰은 지난달 27일 국회... ,https://news.tf.co.kr/read/life/2239118.htm,https://n.news.naver.com/mnews/article/629/0000421634?sid=102,"Mon, 01 Sep 2025 12:19:00 +0900"
국정기획위원회,'금융위 해체안' 놓고 당정협의회…&quot;9월 처리 노력&quot;,1일 여의도 국회에서 열린 정무위원회 당정협의회 이후 정무위 여당 간사인 강준현 의원은 기자들과 만나 &quot;금융위 조직개편안과 관련해 정부가 정무위 의원들의 의견을 들었다&quot;며 &quot;국정기획위원회에서 나온 안에 대한... ,https://view.asiae.co.kr/article/2025090112182867862,https://n.news.naver.com/mnews/article/277/0005644915?sid=100,"Mon, 01 Sep 2025 12:18:00 +0900"
국정기획위원회,“토론은 있지만 이견은 없다”..검찰개혁 당정갈등 애써 부인,그는 그러면서 “국정기획위원회는 중수청을 행안부에 두는 것으로 의견을 모았지만 조금 더 토론해보자고 하는 것에 어떤 변화도 없는 것”이라며 “이재명 대통령이 공개토론을 말씀하신 것도 (지난달 20일) 관저 만찬... ,http://www.fnnews.com/news/202509011201396436,https://n.news.naver.com/mnews/article/014/0005399591?sid=100,"Mon, 01 Sep 2025 12:08:00 +0900"
국정기획위원회,"경찰 &quot;경찰 수사 10중 통제 … 수사·기소 분리, 경찰권 비대화와 관련...",경찰 관계자는 &quot;영장청구를 검사만 할 수 있다는 헌법 조항을 개정해야한다는 것은 경찰청의 일관된 입장&quot;이라며 &quot;개선이 필요하다는 입장을 (국정기획위원회에) 보고드렸다&quot;고 부연했다. 뉴데일리 김동우,https://www.newdaily.co.kr/site/data/html/2025/09/01/2025090100191.html,https://www.newdaily.co.kr/site/data/html/2025/09/01/2025090100191.html,"Mon, 01 Sep 2025 12:00:00 +0900"
국정기획위원회,"‘매립지 문제, 이재명 대통령 직접 나서야’… 타운홀 미팅 개최 촉구","대통령 직속 국정기획위원회가 발표한 지역별 국정과제에 ‘수도권매립지 사용 종료’가 포함됐으나, 세부적인 추진 내용이 포함돼 있지 않은 상황이다. 수도권매립지 종료 여부는 인천시와 경기도, 서울시, 환경부 간... ",https://www.kyeongin.com/article/1750496,https://www.kyeongin.com/article/1750496,"Mon, 01 Sep 2025 11:52:00 +0900"
국정기획위원회,김영훈 장관 “오늘부터 약칭은 '노동부'…27년까지 산재처리 120일로 단...,이재명 정부 국정기획위원회가 신속 추진과제로 제안한 것에 대한 후속 조치다. 김 장관은 “업무상 질병과 관련한 산업재해 처리 절차를 개편해 작년 평균 227.7일 걸리던 산업재해 처리 기간을 오는 2027년까지 120일로... ,https://www.etnews.com/20250901000177,https://n.news.naver.com/mnews/article/030/0003345695?sid=101,"Mon, 01 Sep 2025 11:51:00 +0900"
국정기획위원회,"공공기관, AI 인프라 선제 투자한다…중대재해시 기관장 해임",겸 기획재정부 장관은 1일 정부서울청사에서 열린 제8차 공공기관운영위원회를 주재하며 “모든... 구 부총리는 “공공기관도 정부와 보조를 맞추어 줄일 것은 확실하게 지출 구조조정을 단행하고 새정부 국정운영... ,https://www.sedaily.com/NewsView/2GXQEFQ9ZZ,https://n.news.naver.com/mnews/article/011/0004527555?sid=101,"Mon, 01 Sep 2025 11:51:00 +0900"
국정기획위원회,구윤철 &quot;공공기관 전략적 재정운용…국정 핵심과제 제대로 투자&quot;,공공기관운영위원회 주재…&quot;과도한 부채는 성장동력 해쳐&quot; 안전강화 관리방안 점검…&quot;경영진 인식부터 바꿔야&quot; 구윤철 부총리 겸 기획재정부 장관은 1일 &quot;초혁신 선도경제 대전환을 위해 인공지능(AI) 인프라 등 핵심... ,https://www.yna.co.kr/view/AKR20250901069300002?input=1195m,https://n.news.naver.com/mnews/article/001/0015597561?sid=101,"Mon, 01 Sep 2025 11:50:00 +0900"
국정기획위원회,"구윤철 &quot;모든 수단 동원, 공공기관 일터 안전 정책시켜야&quot;",구윤철 부총리 겸 기획재정부 장관이 &quot;모든 수단과 방법을 동원해 공공기관 일터의 안전을 반드시 정착시켜야 한다&quot;고 말했다. 구 부총리는 1일 공공기관운영위원회(공운위)를 주재하면서 &quot;산업현장 안전 확보를 최우선... ,http://news.mt.co.kr/mtview.php?no=2025090109592455928,https://n.news.naver.com/mnews/article/008/0005243715?sid=101,"Mon, 01 Sep 2025 11:50:00 +0900"
국정기획위원회,구윤철 &quot;公기관 중대재해 땐 기관장 해임&quot;…산재사망자 분기별 공시,구윤철 경제부총리 겸 기획재정부 장관은 1일 &quot;정부는 모든 수단과 방법을 동원해 공공기관 일터의 안전을... 구윤철 부총리는 이날 오전 정부서울청사 대회의실에서 2025년 제8차 공공기관운영위원회를 개최해 &quot;정부는... ,https://www.newsis.com/view/NISX20250901_0003310106,https://n.news.naver.com/mnews/article/003/0013453251?sid=101,"Mon, 01 Sep 2025 11:50:00 +0900"
국정기획위원회,"정부, 중대재해 발생 공공기관장 해임 법제화 시동…&quot;산업재해 감축 체...",이어 &quot;지출사업 재구조화를 지속 추진해 나갈 계획이다&quot;라며 &quot;공공기관도 새 정부 국정운용 핵심과제에... 겸 기획재정부 장관이 1일 서울 종로구 정부서울청사에서 열린 공공기관운영위원회에 참석하고 있다. 2025.09.... ,https://www.newspim.com/news/view/20250901000161,https://www.newspim.com/news/view/20250901000161,"Mon, 01 Sep 2025 11:50:00 +0900"
국정기획위원회,"&quot;대통령이 직접 나서라&quot;…인천 시민단체, 수도권매립지 타운홀 미팅 촉...","범시민운동본부는 이날 기자회견에서 &quot;대통령 직속 국정기획위원회가 인천 국정과제로 '수도권매립지 종료'를 채택했지만, 구체적인 실행 계획은 빠져 있다&quot;고 지적했다. 특히 &quot;지난달 김성훈 환경부 장관이... ",https://www.incheonilbo.com/news/articleView.html?idxno=1301407,https://www.incheonilbo.com/news/articleView.html?idxno=1301407,"Mon, 01 Sep 2025 11:50:00 +0900"
국정기획위원회,'기다리다 돌아가시지 않게' 업무상 질병 산재 처리기간 절반 단축,"이번 대책은 지난 8월 대통령 직속 국정기획위원회가 '신속 추진과제'로 선정한 사안에 대한 정부의 공식 후속조치로, 2027년까지 업무상 질병 산재 평균 처리 기간을 기존 228일에서 120일로 줄이는 것이 핵심이다. 김영훈... ",https://www.nocutnews.co.kr/news/6393214?utm_source=naver&utm_medium=article&utm_campaign=20250901114806,https://n.news.naver.com/mnews/article/079/0004061341?sid=101,"Mon, 01 Sep 2025 11:49:00 +0900"
국정기획위원회,"李정부 '의료정책 설계자' 이찬진 금감원장, '실손보험' 칼 대나",이 원장은 이재명 대통령 직속 국정기획위원회 사회1분과장을 맡아 정부의 보건·의료 정책의 청사진을 그린 인물이다. 이에 이 대통령의 실손보험 관련 우려를 불식시키기 위한 감독정책 수립에 나설 것이라는 전망이... ,https://www.newsworks.co.kr/news/articleView.html?idxno=809331,https://www.newsworks.co.kr/news/articleView.html?idxno=809331,"Mon, 01 Sep 2025 11:48:00 +0900"
국정기획위원회,업무상질병 산재인정 평균 228일…노동부 &quot;120일로 단축&quot;,"이재명 정부의 국정운영 5개년 계획에 담긴 내용으로 국정기획위원회가 신속 추진과제로 제안한 것에 대한 후속 조치입니다. 업무상 질병은 근로자가 업무 수행 과정에서 유해·위험 요인에 노출되거나, 소음, 반복 작업... ",https://news.sbs.co.kr/news/endPage.do?news_id=N1008238434&plink=ORI&cooper=NAVER,https://n.news.naver.com/mnews/article/055/0001288652?sid=102,"Mon, 01 Sep 2025 11:46:00 +0900"
국정기획위원회,박훈 지방세발전위원장 선임,"박 교수는 2003년 서울시립대 세무학과 교수로 임용된 후, 국세청 납세자보호관, 기획재정부 세제발전심의위원회 위원, 한국지방세학회장 등을 역임했고 현재 한국세법학회장, 국정기획위원회 자문위원 등으로 활동하고... ",https://www.munhwa.com/article/11529719?ref=naver,https://n.news.naver.com/mnews/article/021/0002733228?sid=102,"Mon, 01 Sep 2025 11:41:00 +0900"
국정기획위원회,[정치in] 이재명 대통령 결정만 남았다… 검찰·금융위·기재부 운명은,"대통령 인수위 역할을 맡은 국정기획위원회가 지난달 해산, 123개 국정과제를 포함한 향후 5년 청사진을 그려놨지만 초미의 관심사였던 조직개편안은 결국 발표되지 않았다. 조직개편이 미뤄질수록 국정 운영 동력은... ",https://www.newscj.com/news/articleView.html?idxno=3312183,https://www.newscj.com/news/articleView.html?idxno=3312183,"Mon, 01 Sep 2025 11:38:00 +0900"
국정기획위원회,최대 4년 걸리던 '업무상 질병' 산재 처리기간 120일로 단축,"이재명 정부의 국정운영 5개년 계획에 담긴 내용으로 국정기획위원회가 신속 추진과제로 제안한 것에 대한 후속 조치다. 업무상 질병은 근로자가 업무 수행 과정에서 유해·위험 요인에 노출되거나, 소음, 반복 작업... ",https://www.electimes.com/news/articleView.html?idxno=359346,https://www.electimes.com/news/articleView.html?idxno=359346,"Mon, 01 Sep 2025 11:30:00 +0900"
국정기획위원회,"구형서 충남도의원, '2025 국제환경에너지산업전' 참관…도내 기업 지원...",또한 구 의원은 최근 정부 국정과제 추진이 결정된 히트펌프와 에너지전환 관련 최신 산업 트랜드를 직접... 보좌관과 민주당 중앙당 부대변인 등을 거쳐 현재 충남도의회 기획경제위원회 부위원장으로 활동하고 있다. /내포,http://www.cctimes.kr/news/articleView.html?idxno=863283,http://www.cctimes.kr/news/articleView.html?idxno=863283,"Mon, 01 Sep 2025 11:26:00 +0900"
국정기획위원회,의무지출 5년간 100조↑…대통령 공약 이행에 재정 부담 가중,국정기획위원회는 농어촌 주민소득으로 5년 동안 6조2000억원의 예산이 투입될 것으로 봤다. 지역사랑상품권(지역화폐) 사업도 내년 예산(1조1500억원)에 새롭게 반영됐다. 지난 4일 중앙정부의 지역화폐 지원을... ,https://www.mk.co.kr/article/11407548,https://n.news.naver.com/mnews/article/024/0000099607?sid=102,"Mon, 01 Sep 2025 11:25:00 +0900"
국정기획위원회,이재명 대통령은 &quot;대통령 주재 타운홀 미팅으로 수도권매립지 문제 해결...,"이날 이들은 &quot;대통령 직속 국정기획위원회가 지난 13일, 국민보고대회를 통해 공개한 지역별 국정과제(17개 시도별 7대 공약, 15대 추진과제)에 '수도권매립지 사용 종료'를 채택했으며, 인천 지역의 여섯 번째 공약 으로... ",https://www.tournews21.com/news/articleView.html?idxno=114093,https://www.tournews21.com/news/articleView.html?idxno=114093,"Mon, 01 Sep 2025 11:20:00 +0900"
국정기획위원회,새정부 주요 경제의제로 급부상한 '상생금융지수' 도입,"이 같은 도입 급물살에 발맞춰 중소기업중앙회는 최근 '중소기업 상생금융지수 평가 방안' 초안을 국정기획위원회에 제출했다. 중기중앙회가 구상한 안은 금융위원회·금감원이 주관하는 실적평가(60%)와, 중기중앙회... ",http://www.kbiznews.co.kr/news/articleView.html?idxno=112324,http://www.kbiznews.co.kr/news/articleView.html?idxno=112324,"Mon, 01 Sep 2025 11:16:00 +0900"
국정기획위원회,업무상 질병 산재인정 평균 227일→120일로 단축 추진,"이재명 정부의 국정운영 5개년 계획에 담긴 내용으로 국정기획위원회가 신속 추진과제로 제안한 것에 대한 후속 조치입니다. 업무상 질병은 근로자가 업무 수행 과정에서 유해·위험 요인에 노출되거나, 소음, 반복 작업... ",https://news.kbs.co.kr/news/pc/view/view.do?ncd=8345245&ref=A,https://n.news.naver.com/mnews/article/056/0012019974?sid=101,"Mon, 01 Sep 2025 11:14:00 +0900"
국정기획위원회,바이오베터 키우기…프로티나·제넥신 주목,"이달 초 국정기획위원회에서 반도체는 '2030년 수출 1700억 달러', 자동차는 '2030년 세계 5위 생산국 도약' 등 구체적인 지표가 제시됐지만, 제약·바이오 관련 수치 목표나 일정은 빠져있다. 보건복지부의 내년도 예산도... ",http://www.smedaily.co.kr/news/articleView.html?idxno=336206,http://www.smedaily.co.kr/news/articleView.html?idxno=336206,"Mon, 01 Sep 2025 11:14:00 +0900"
국정기획위원회,&quot;수도권매립지 문제 해결 위해 대통령 주재 주민회의 개최해야&quot;,운동본부는 &quot;대통령 직속 국정기획위원회는 지난 13일 국민보고대회에서 지역별 국정과제로 '수도권매립지 사용 종료'를 채택했다&quot;며 &quot;인천 지역 여섯 번째 공약으로 수도권매립지 종료를 선정했다&quot;고 밝혔다. 이어 &quot;그러나... ,https://www.incheontoday.com/news/articleView.html?idxno=307544,https://www.incheontoday.com/news/articleView.html?idxno=307544,"Mon, 01 Sep 2025 11:12:00 +0900"
국정기획위원회,[전격시사] 박상혁 더불어민주당 원내소통수석부대표 - “정기국회 키워...,▶ 박상혁 : 거기에 더해서 지금 정부조직법뿐만 아니라 국정기획위원회에서 제안한 여러 가지 정부 조직 개편에 대한 내용도 함께 담겨져 있습니다. 기획재정부를 어떻게 할 것인지 또는 우리 금융위원회를 어떻게 할... ,https://news.kbs.co.kr/news/pc/view/view.do?ncd=8345235&ref=A,https://n.news.naver.com/mnews/article/056/0012019970?sid=100,"Mon, 01 Sep 2025 11:12:00 +0900"
국정기획위원회,[공기업 인사] ⑦ 유재훈 예보 사장 11월 임기 만료... 차기 사장 기재부...,업계에서는 금융권 인사가 미뤄지는 이유가 최근 국정기획위원회의 조직 개편 움직임과 무관하지 않은 것으로 판단하고 있다. 국책은행과 금융공기업 인사의 경우 정부의 조직 개편안이 확정된 후에야 이뤄질 것이라는... ,https://www.newsfreezone.co.kr/news/articleView.html?idxno=644200,https://www.newsfreezone.co.kr/news/articleView.html?idxno=644200,"Mon, 01 Sep 2025 11:12:00 +0900"
국정기획위원회,"[기획] '또 추락사' DL그룹, 대통령 격노 속 사법·세무 리스크 '사면초...",/ 알티케이뉴스 남기두 기자 환경노동위원회 국정감사에서도 DL그룹을 비롯한 대형 건설사들의 반복적인 안전사고에 대한 강도 높은 질타가 이어졌다. 이해욱 DL그룹 회장은 2023년 12월 1일 국회 환경노동위원회(환노위)... ,http://www.rightknow.co.kr/news/articleView.html?idxno=31821,http://www.rightknow.co.kr/news/articleView.html?idxno=31821,"Mon, 01 Sep 2025 11:10:00 +0900"
국정기획위원회,'업무상 질병' 산재 처리기간 120일로 단축한다,"대통령 직속 국정기획위원회가 신속 추진과제로 제안한 데 따른 대책이다. 노동자가 일을 하다 질병에 걸려 산재를 신청하면 업무와 질병 사이의 상당인과관계를 확인하기 위해 의료기관 특별진찰, 연구기관 역학조사... ",http://www.edaily.co.kr/news/newspath.asp?newsid=02837206642295856,https://n.news.naver.com/mnews/article/018/0006104079?sid=102,"Mon, 01 Sep 2025 11:01:00 +0900"
국정기획위원회,최대 4년 걸리던 업무상 질병 산재 처리…2027년엔 4개월 내 끝낸다,1일 고용부는 대통령 직속 국정기획위원회가 신속 추진 과제로 제안한 ‘업무상 질병 처리 기간 단축 방안’을 발표했다. 현재는 특별진찰·역학조사·업무상질병판정위원회 심의 등 여러 단계를 거쳐 평균 7개월(227.7일)이... ,https://biz.heraldcorp.com/article/10565721?ref=naver,https://n.news.naver.com/mnews/article/016/0002522123?sid=101,"Mon, 01 Sep 2025 11:01:00 +0900"
