Keyword,Title,Description,Original Link,Link,Publication Date
재경부,"구윤철 &quot;기름값 인상·폭리, 민생 좀먹는 몰염치한 행위&quot;",구 부총리는 또 “정부는 석유류에 대한 재경부·산업부·공정위·국세청·지방정부 등 범부처석유시장점검반을 운영하고 있다”며 “내일(6일)부터는 석유관리원·경찰청·지방정부 등과도 협력해 월 2000회 이상... ,http://www.kookje.co.kr/news2011/asp/newsbody.asp?code=0200&key=20260305.99099001702,https://n.news.naver.com/mnews/article/658/0000137017?sid=101,"Thu, 05 Mar 2026 16:55:00 +0900"
재경부,구윤철 &quot;석유가 인상 몰염치…주유소 담합 조사해 강력처벌&quot;,그러면서 &quot;정부는 재경부·산업부·공정위·국세청·지방정부 등 범부처석유시장점검반을 운영하고 있다&quot;며 &quot;6일부터는 석유관리원·경찰청·지방정부 등과도 협력해 월 2천회 이상 특별기획검사를 할 예정&quot;이라고 설명했다.... ,https://www.idaegu.co.kr/news/articleView.html?idxno=540721,https://www.idaegu.co.kr/news/articleView.html?idxno=540721,"Thu, 05 Mar 2026 16:54:00 +0900"
재경부,대선주조 ‘제60회 납세자의 날’ 재경부 장관 표창,스카이데일리 김종창기자 = ▲조우현(오른쪽) 대선주조 사장이 강성팔 부산국세청장과 기념 촬영을 하고 있다. 대선주조 부산 명문 향토기업 대선주조가 성실 납세를 통한 국가 재정 확보와 지역 사회 발전에 기여한... ,https://m.skyedaily.com/news_view.html?ID=299709,https://m.skyedaily.com/news_view.html?ID=299709,"Thu, 05 Mar 2026 16:50:00 +0900"
재경부,"정부, 석유류 최고액 지정…월 2000회 특별기획검사 추진",재경부는 산업통상부·공정거래위원회·국세청·지방정부 등과 ‘범부처 석유시장 점검반’을 운영 중이다. 이와 함께 6일부터 석유관리원·경찰청·지방정부와 협력해 불법 석유 유통 위험군 주유소에 대해 월 2000회... ,https://www.nongmin.com/article/20260305500480,https://n.news.naver.com/mnews/article/662/0000089854?sid=100,"Thu, 05 Mar 2026 16:50:00 +0900"
재경부,"정부, 6일부터 석유 유통시장 특별점검…월 2000회 암행단속","산업부와 공정위, 재경부, 국세청 등이 함께 범부처 합동점검단을 운영해 가짜 석유 판매, 매점매석 등을 특별 점검하고 석유 유통시장을 면밀히 관리할 계획이다. 중동 정세 불안 장기화 가능성에 대비해 석유화학... ",http://www.kookje.co.kr/news2011/asp/newsbody.asp?code=0200&key=20260305.99099001693,https://n.news.naver.com/mnews/article/658/0000137016?sid=101,"Thu, 05 Mar 2026 16:49:00 +0900"
재경부,"호텔스카이파크 운영사 아이큐웰 양현정 대표, 모범납세 재경부장관 표...",호텔스카이파크 운영사 ㈜아이큐웰의 양현정 대표가 성실한 납세와 투명한 경영을 인정받아 모범납세자로 선정돼 재정경제부 장관 표창을 수상했다. 아이큐웰은 지난 4일 양 대표가 서울 중부세무서에서 열린 모범납세자... ,http://www.joseilbo.com/news/news_read.php?uid=564038&class=17&grp=,https://n.news.naver.com/mnews/article/123/0002378906?sid=101,"Thu, 05 Mar 2026 16:46:00 +0900"
재경부,"구윤철 &quot;석유류값 인상 몰염치…최고가 지정, 신속 검토해달라&quot;(종합)",그러면서 &quot;정부는 석유류에 대한 재경부·산업부·공정위·국세청·지방정부 등 범부처석유시장점검반을 운영하고 있다&quot;며 &quot;내일(6일)부터는 석유관리원·경찰청·지방정부 등과도 협력해 월 2천회 이상 특별기획검사를 할... ,https://www.yna.co.kr/view/AKR20260305134251002?input=1195m,https://n.news.naver.com/mnews/article/001/0015940725?sid=101,"Thu, 05 Mar 2026 16:44:00 +0900"
재경부,"국세청 등 범부처석유시장점검반, 월 2천회 이상 특별검사","재경부·산업부·공정위·국세청 등 범부처석유시장점검반을 통해 월 2천회 이상 특별검사를 실시하고, 다른... 정부는 현재 재경부·산업부·공정위·국세청·지방정부 등 범부처석유시장점검반을 운영 중인 가운데... ",https://www.taxtimes.co.kr/news/article.html?no=274162,https://www.taxtimes.co.kr/news/article.html?no=274162,"Thu, 05 Mar 2026 16:44:00 +0900"
재경부,"중동사태 '기름값 과도한 인상', 정부 '몰염치' 비판...엄정대응키로","재경부는 오늘(5일) 오후 정부서울청사에서 구윤철 부총리 겸 재정경제부장관이 주재하는 민생물가 특별관리... 이에따라 산업부 등을 중심으로 석유사업법상 석유판매가격 최고액 지정을 검토하고, 재경부 등을 중심으로... ",https://news.bbsi.co.kr/news/articleView.html?idxno=4070325,https://news.bbsi.co.kr/news/articleView.html?idxno=4070325,"Thu, 05 Mar 2026 16:42:00 +0900"
재경부,"산업부, 내일부터 석유 유통 특별점검…고위험군 주유소 집중 단속","이날 회의에는 공정위·재경부 등 관계부처와 SK에너지·GS칼텍스·에쓰오일· HD현대오일뱅크·SK인천석유화학... 산업부와 공정위, 재경부, 국세청 등이 함께 범부처 합동점검단을 운영해 가짜 석유 판매, 매점매석 등을... ",https://news.sbs.co.kr/news/endPage.do?news_id=N1008465802&plink=ORI&cooper=NAVER,https://n.news.naver.com/mnews/article/055/0001337901?sid=101,"Thu, 05 Mar 2026 16:42:00 +0900"
재경부,전쟁 틈타 휘발유 1800원 돌파?… 정부 &quot;담합 땐 기름값 강제 인하&quot;,"산업부, 공정위, 재경부, 국세청 등 관계부처가 협력해 석유류의 매점매석을 방지하고 불법 유통 등을 방지하겠다는 것이다. 당장 6일부터 예고 없이 주유소를 방문해 휘발유 등을 정량 미달로 판매하거나 가짜 석유를... ",https://www.hankookilbo.com/news/article/A2026030515550003910?did=NA,https://n.news.naver.com/mnews/article/469/0000917753?sid=101,"Thu, 05 Mar 2026 16:41:00 +0900"
재경부,"중동 리스크에 환율 '롤러코스터'…정부, 시장 개입 나서나",지난해 말에도 환율이 1480원을 넘어서자 한국은행과 재경부가 함께 구두개입에 나서고 달러를 매도하는 등 실개입에 나서면 추가 상승을 저지한 바 있다.이와 함께 국민연금 환헤지 확대도 거론된다. 국민연금은 대규모... ,https://www.asiatoday.co.kr/view.php?key=20260305010001506,https://www.asiatoday.co.kr/view.php?key=20260305010001506,"Thu, 05 Mar 2026 16:40:00 +0900"
재경부,"동방, 27일 정기주총 개최…재무제표 승인 등 안건 상정","구체적으로는 지희진 법무법인 세종 고문, 정운건 동방 특수사업본부장, 박성준 동방 기획실장·미래전략실장, 강영진 동방 재경부문장 등이다. 지 고문은 사외이사 후보, 나머지 3인은 사내이사 후보다. 제66기 재무제표... ",https://www.bloter.net/news/articleView.html?idxno=655899,https://n.news.naver.com/mnews/article/293/0000080368?sid=101,"Thu, 05 Mar 2026 16:37:00 +0900"
재경부,구윤철 부총리 &quot;수출 中企 20조3000억 자금 지원...금리 인하·대출 확대...,구 부총리는 &quot;정부는 석유류에 대한 재경부·산업부·공정위·국세청·지방정부 등 범부처석유시장점검반을 운영하고 있다&quot;며 &quot;내일(6일)부터는 석유관리원·경찰청·지방정부 등과도 협력해 월 2000회 이상 특별기획검사를... ,https://www.pinpointnews.co.kr/news/articleView.html?idxno=434345,https://www.pinpointnews.co.kr/news/articleView.html?idxno=434345,"Thu, 05 Mar 2026 16:28:00 +0900"
재경부,구윤철 &quot;위기 악용한 석유류값 인상 포착‥최고가 지정 신속 검토&quot;,정부는 재경부·산업부·공정위·국세청·지방정부 등 범부처석유시장점검반을 운영하고 있으며 내일부터는 석유관리원·경찰청·지방정부 등과도 협력해 월 2천 회 이상 특별기획검사를 할 방침입니다.,https://imnews.imbc.com/news/2026/econo/article/6805155_36932.html,https://n.news.naver.com/mnews/article/214/0001484202?sid=101,"Thu, 05 Mar 2026 16:26:00 +0900"
재경부,"정부, 휘발유값 폭등에 석유 유통시장 특별점검…월 2000회 암행단속","이날 회의에는 공정위·재경부 등 관계부처와 SK에너지·GS칼텍스·에쓰오일·HD현대오일뱅크·SK인천석유화학... 산업부와 공정위, 재경부, 국세청 등이 함께 범부처 합동점검단을 운영해 가짜 석유 판매, 매점매석 등을... ",https://www.busan.com/view/busan/view.php?code=2026030516180318537,https://n.news.naver.com/mnews/article/082/0001369531?sid=101,"Thu, 05 Mar 2026 16:21:00 +0900"
재경부,"구윤철, 주유소 기름값 과도한 인상에 &quot;민생 좀먹는 몰염치한 행위&quot;",이어 구 부총리는 &quot;정부는 석유류에 대한 재경부·산업부·공정위·국세청·지방정부 등 범부처석유시장점검반을 운영하고 있다&quot;며 &quot;내일(6일)부터는 석유관리원·경찰청·지방정부 등과도 협력해 월 2000회 이상... ,https://www.sisajournal.com/news/articleView.html?idxno=364816,https://n.news.naver.com/mnews/article/586/0000123710?sid=101,"Thu, 05 Mar 2026 16:20:00 +0900"
재경부,"구윤철 “기름값 폭리, 민생 좀먹는 몰염치 행위”…수위 높이는 정부 ...",그러면서 &quot;정부는 석유류에 대한 재경부·산업부·공정위·국세청·지방정부 등 범부처석유시장점검반을 운영하고 있다&quot;며 &quot;내일(6일)부터는 석유관리원·경찰청·지방정부 등과도 협력해 월 2천회 이상 특별기획검사를 할... ,https://news.kbs.co.kr/news/pc/view/view.do?ncd=8500279&ref=A,https://n.news.naver.com/mnews/article/056/0012135966?sid=121,"Thu, 05 Mar 2026 16:19:00 +0900"
재경부,"치솟는 기름값…정부, '유가 불안' 악용 주유소 특별 단속한다","이날 회의에는 공정거래위원회, 재정경제부이 함께 참석, 산업부, 공정위, 재경부, 국세청 등이 함께 범부처 합동점검단을 집중 운영해 가짜 석유 판매, 매점매석 등 불법 석유 유통 행위 근절을 위한 특별 점검을 실시하는... ",https://zdnet.co.kr/view/?no=20260305155232,https://n.news.naver.com/mnews/article/092/0002413075?sid=105,"Thu, 05 Mar 2026 16:18:00 +0900"
재경부,구윤철 &quot;위기상황 악용 담합.. 명백한 범죄행위&quot;,"그러면서 &quot;시장은 자율이지만, 위기 상황을 악용하는 매점매석이나 담합 행위는 명백한 범죄 행위&quot;라며 &quot;현재 재경부·산업부·공정거래위원회·국세청·지방정부 등 범부처 석유시장점검반을 운영 중이며, 내일부터는... ",http://www.jmbc.co.kr/news/view/62864,https://n.news.naver.com/mnews/article/659/0000041818?sid=102,"Thu, 05 Mar 2026 16:15:00 +0900"
재경부,산업부 &quot;국민 불안을 이익 수단 삼는 불법유통 엄정 대응&quot;,"회의에는 공정위·재경부 등 관계부처와 SK에너지, GS칼텍스, 에쓰오일, HD현대오일뱅크, SK인천석유화학 등... 산업부와 공정위, 재경부, 국세청 등은 범부처 합동점검단을 구성해 가짜 석유 판매, 매점매석, 담합 등 불공정... ",http://www.newsroad.co.kr/news/articleView.html?idxno=55519,http://www.newsroad.co.kr/news/articleView.html?idxno=55519,"Thu, 05 Mar 2026 16:10:00 +0900"
재경부,구윤철 &quot;석유류값 인상 몰염치…최고가 지정 등 철저히 대응&quot;,구 부총리는 &quot;정부는 석유류에 대한 재경부·산업부·공정위·국세청·지방정부 등 범부처석유시장점검반을 운영하고 있다&quot;며 &quot;내일부터는 석유관리원·경찰청· 지방정부 등과도 협력해 월 2천 회 이상 특별기획검사를 할... ,https://news.sbs.co.kr/news/endPage.do?news_id=N1008465741&plink=ORI&cooper=NAVER,https://n.news.naver.com/mnews/article/055/0001337890?sid=101,"Thu, 05 Mar 2026 16:08:00 +0900"
재경부,“휘발유 바가지 엄중 대응” 李대통령 지시에… 정부 불법 유통 특별 ...,"산업부, 공정위, 재경부, 국세청 등이 함께 범부처 합동점검단을 집중 운영하여 가짜석유 판매, 매점매석 등 불법석유 유통행위 근절을 위한 특별점검을 실시하는 등 석유 유통시장을 면밀히 관리해나갈 예정이다. 양기욱... ",https://www.segye.com/newsView/20260305515785?OutUrl=naver,https://n.news.naver.com/mnews/article/022/0004110463?sid=101,"Thu, 05 Mar 2026 16:07:00 +0900"
재경부,"산업부, 내일부터 석유 유통시장 특별점검…월 2천회 암행단속","이날 회의에는 공정위·재경부 등 관계부처와 SK에너지·GS칼텍스·에쓰오일·HD현대오일뱅크·SK인천석유화학... 산업부와 공정위, 재경부, 국세청 등이 함께 범부처 합동점검단을 운영해 가짜 석유 판매, 매점매석 등을... ",https://www.yna.co.kr/view/AKR20260305141900003?input=1195m,https://n.news.naver.com/mnews/article/001/0015940584?sid=101,"Thu, 05 Mar 2026 16:06:00 +0900"
재경부,&quot;부당 폭리 주유소 다 잡아낸다&quot;...정부가 꺼낸 '초강수 카드',"현재 정부는 재경부·산업부·공정위·국세청·지방정부 등 범부처 석유시장 점검반을 운영 중이며, 6일부터는 석유관리원·경찰청·지방정부 등과 협력해 월 2000회 이상 특별기획검사를 실시할 예정이다. 한편, 정부가... ",https://www.newsway.co.kr/news/view?ud=2026030515265747745,https://www.newsway.co.kr/news/view?ud=2026030515265747745,"Thu, 05 Mar 2026 16:02:00 +0900"
재경부,"[이란사태 점검] 휘발유 가격 '출렁'…정부, 가격 인상 자제 요청","이들은 산업부와 공정위, 재경부, 국세청 등으로 범부처 합동점검단을 운영, 가짜 석유 판매와 매점매석 등 불법 석유 유통행위 근절에 나서기로 했다. 추가로 산업부는 석유관리원을 통해 불법 석유 유통 위험군... ",https://news.einfomax.co.kr/news/articleView.html?idxno=4402001,https://news.einfomax.co.kr/news/articleView.html?idxno=4402001,"Thu, 05 Mar 2026 16:02:00 +0900"
재경부,정부 &quot;석유 최고가격 지정 검토&quot;…월 2천 회 이상 특별검사,재정경제부는 5일 정부서울청사에서 구윤철 부총리 겸 재경부 장관 주재로 '민생물가 특별관리 관계장관 TF' 3차 회의'를 열고 중동 상황에 따른 에너지 가격 동향과 시장 교란 행위 대응 방안을 논의했다고 밝혔다. 구... ,https://www.nocutnews.co.kr/news/6480189?utm_source=naver&utm_medium=article&utm_campaign=20260305035427,https://n.news.naver.com/mnews/article/079/0004121573?sid=101,"Thu, 05 Mar 2026 15:55:00 +0900"
기획처,"5차 국가철도망계획 지연…지방 사업 요구액 600조, 한도는 43조?",홍 차관은 &quot;최대한 그릇에 담으려면 실링을 키워야 한다&quot;며 기획처에 국가철도망 예산 확대를 요구하고... 지역균형발전을 국정 과제로 내건 이재명 정부 기조와 맞닿아 있는 만큼 기획처가 이번 5차 계획에서는 예산... ,https://www.imaeil.com/page/view/2026030513573921528,https://n.news.naver.com/mnews/article/088/0000999690?sid=101,"Thu, 05 Mar 2026 17:00:00 +0900"
기획처,"청년이 체감하는 미래전략은?…기획처-중장기전략위, 대학 교육·일자리...","신뢰를 회복하는 것이 중요하다는 의견도 제시됐습니다. 기획처는 앞으로 성장잠재력 제고와 신산업 육성, 청년 일자리, 노동시장 유연성 등을 중심으로 정책 과제를 선별해 다음달부터 연구를 진행할 계획이라고 밝혔습니다.",https://news.bbsi.co.kr/news/articleView.html?idxno=4070324,https://news.bbsi.co.kr/news/articleView.html?idxno=4070324,"Thu, 05 Mar 2026 16:42:00 +0900"
기획처,"광주여대 국제교류처, 2026학년도 1학기 외국인 유학생 오리엔테이션 개...","이어진 부서 소개 시간에는 기획처, 교무처, 입학팀, 학생처, 국제교류처 등 주요 부서 관계자들이 참여해 학사 운영과 장학 제도, 비교과 프로그램, 상담 지원, 비자 및 체류 관련 사항 등 유학생들이 반드시 숙지해야 할... ",https://dhnews.co.kr/news/view/1065598050143740,https://dhnews.co.kr/news/view/1065598050143740,"Thu, 05 Mar 2026 16:30:00 +0900"
기획처,"광주여대 국제교류처, 2026학년도 1학기 외국인 유학생 오리엔테이션 개...","이어진 부서 소개 시간에는 기획처, 교무처, 입학팀, 학생처, 국제교류처 등 주요 부서 관계자들이 참여해 학사 운영과 장학 제도, 비교과 프로그램, 상담 지원, 비자 및 체류 관련 사항 등 유학생들이 반드시 숙지해야 할... ",http://www.veritas-a.com/news/articleView.html?idxno=600653,http://www.veritas-a.com/news/articleView.html?idxno=600653,"Thu, 05 Mar 2026 16:16:00 +0900"
기획처,"권오현 &quot;대학 교육, 시대 변화에 적합한지 점검해야&quot;","기획처와 중장기전략위는 성장잠재력 제고, 혁신과 신산업 육성, 청년 일자리 문제, 노동시장 유연성 제고 등 다양한 방안에 대해 분과 차원에서 우선순위를 선정할 계획이다. 이를 통해 다음 달부터 미래전략 과제에... ",https://www.newspim.com/news/view/20260305001146,https://www.newspim.com/news/view/20260305001146,"Thu, 05 Mar 2026 15:56:00 +0900"
기획처,"권오현 중장기전략위원장 &quot;대학 교육, 시대 변화에 적합한지 점검&quot;","중장기전략위는 중장기 전략 수립을 위한 기획처 장관 자문기구다. 권 위원장은 “현재의 대학 교육이 시대... 기획처는 중장기전략위 전체회의에서 논의된 성장 잠재력 제고, 혁신과 신산업 육성, 청년 일자리 문제... ",http://www.edaily.co.kr/news/newspath.asp?newsid=04555926645380368,https://n.news.naver.com/mnews/article/018/0006229154?sid=101,"Thu, 05 Mar 2026 15:39:00 +0900"
기획처,"기획처, 청년일자리 대학교육 방향성 논의…내달 과제연구 시작","기획처와 중장기전략위원회는 향후 성장잠재력 제고, 신산업 육성, 청년 일자리, 노동시장 유연성 등 주요 정책 과제에 대해 분과 차원에서 우선순위를 선정할 계획이다. 선정된 과제는 다음달부터 연구를 진행할 예정이다.",https://www.newsis.com/view/NISX20260305_0003536349,https://n.news.naver.com/mnews/article/003/0013804024?sid=101,"Thu, 05 Mar 2026 15:22:00 +0900"
기획처,"기획처·중장기전략위, 청년 일자리 해법 논의…대학 교육 역할 점검",기획예산처와 중장기전략위원회가 5일 제7기 중장기전략위원회 미래사회전략 분과회의를 열고 청년 세대가 체감할 수 있는 미래 전략 수립 방안을 논의했다. 회의에서는 청년 일자리 문제 해결을 위해 대학 교육의... ,https://www.etnews.com/20260305000330,https://n.news.naver.com/mnews/article/030/0003404719?sid=101,"Thu, 05 Mar 2026 15:15:00 +0900"
기획처,청년 미래전략 논의... 중장기전략위 미래사회 분과회의 개최,"기획처와 중장기전략위원회는 향후 성장 잠재력 제고, 혁신 및 신산업 육성, 청년 일자리 문제, 노동시장 유연성 확대 등 주요 의제에 대해 분과별로 우선순위를 선정할 계획이다. 이를 통해 사회적으로 중요한 동시에... ",http://www.fnnews.com/news/202603051506012572,https://n.news.naver.com/mnews/article/014/0005486795?sid=101,"Thu, 05 Mar 2026 15:10:00 +0900"
기획처,"기획처·중장기위, 사교육·정성평가 등 대학교육 개선 논의","기획처와 중장기전략위원회는 분과 논의를 통해 성장 잠재력 제고, 혁신 산업 육성, 청년 일자리 문제, 노동시장 유연성 제고 등 주요 과제의 우선순위를 정할 계획이다. 사회적 중요성과 정책 효과가 높은 미래 전략... ",https://www.ajunews.com/view/20260305145655806,https://www.ajunews.com/view/20260305145655806,"Thu, 05 Mar 2026 15:00:00 +0900"
기획처,권오현 &quot;대학교육 점검하고 사회적요구에 맞는 발전 방안 찾아야&quot;,"기획처와 중장기전략위는 성장 잠재력 제고, 혁신과 신산업 육성, 청년 일자리 문제, 노동시장 유연성 제고 등 다양한 방안에 대해 분과 차원에서 우선순위를 선정할 계획이다. 이를 통해 다음 달부터 미래전략 과제에 대한... ",https://www.news1.kr/economy/trend/6091463,https://n.news.naver.com/mnews/article/421/0008808780?sid=101,"Thu, 05 Mar 2026 14:53:00 +0900"
기획처,"차재빈 경민대학교 교수, (사)한국취업진로학회 제8대 회장 취임","현재 경민대학교(총장 홍지연) 산학기획처 부처장과 혁신지원 JOY사업 부단장을 맡고 있으며, 산학협력과 교육혁신을 연결하는 실천적 리더십을 발휘하고 있다. 연구자로서도 활발한 성과를 이어왔다. 2013년과... ",https://magazine.hankyung.com/business/article/202603050250b,https://n.news.naver.com/mnews/article/050/0000103151?sid=101,"Thu, 05 Mar 2026 09:30:00 +0900"
기획처,"안병구 밀양시장, 정부세종청사 방문 ‘국비 확보 없이는 미래도 없다’","기획처·농식품부·행안부 연쇄 면담, 푸드테크·나노산단·용두산 도로 등 3대 현안 집중 건의 안병구 밀양시장이 지역의 미래 성장동력 확보와 주요 현안 사업의 차질 없는 추진을 위해 정부 부처를 직접 방문하는 등... ",https://www.dnews.co.kr/uhtml/view.jsp?idxno=202603041826081870883,https://www.dnews.co.kr/uhtml/view.jsp?idxno=202603041826081870883,"Thu, 05 Mar 2026 09:22:00 +0900"
기획처,"정부, 개정 노동조합법 '원·하청 교섭 매뉴얼' 정비…공공부문 선도 역...",회의에는 노동부·복지부·기후부·성평등부·국토부·기획처·금융위·국조실 등 장·차관이 참여해 부처별 대응 방향을 공유했다. 정부는 개정법의 현장안착을 위한 지방관서 전담 지원팀을 통해 원·하청 교섭절차와 법... ,https://www.news2day.co.kr/article/20260304500083,https://www.news2day.co.kr/article/20260304500083,"Thu, 05 Mar 2026 09:10:00 +0900"
기획처,박홍근 ‘확장 재정’ 李와 코드 일치… 국회 통제권 강화법은 부메랑 ...,박 후보자는 지난 1월 23일 국회 재정경제기획위원회의 이혜훈 당시 기획처 장관 후보자 인사청문회에서... 한 경제부처 관계자는 “의원 시절에는 정부를 감시하는 입장에서 바라봤지만 기획처 장관이 되면 예산 편성... ,https://www.seoul.co.kr/news/economy/2026/03/05/20260305030004?wlog_tag3=naver,https://n.news.naver.com/mnews/article/081/0003623009?sid=101,"Thu, 05 Mar 2026 05:12:00 +0900"
기획처,"정부세종청사 찾은 안병구 밀양시장, 내년도 국비 확보 '총력'","먼저 기획처와 농식품부를 찾은 안 시장은 푸드테크 연구지원센터와 나노산단 폐수처리시설은 밀양의 신산업 육성과 기업 유치를 위한 필수 기반 시설임을 강조하며, 국가 차원의 적극적인 예산 지원을 건의했다. 이어... ",https://www.cnbnews.com/news/article.html?no=781637,https://www.cnbnews.com/news/article.html?no=781637,"Wed, 04 Mar 2026 17:50:00 +0900"
기획처,"기획처·중장기위, 혁신랩 도입…중요사업 실험·검증",기획예산처와 중장기전략위원회는 기획처 출범 이후 첫 회의를 가지며 중장기적으로 중요한 사업을 실험... 나타났다고 기획처는 전했습니다. 아울러 중장기전략위는 청년 세대를 위한 미래 전략을 수립하는 것을 목표로... ,https://biz.sbs.co.kr/article_hub/20000295077?division=NAVER,https://n.news.naver.com/mnews/article/374/0000495790?sid=101,"Wed, 04 Mar 2026 17:18:00 +0900"
기획처,"안병구 밀양시장, 정부세종청사 방문 &quot;국비 확보 총력&quot;",안병구 밀양시장이 지역의 미래 성장동력 확보와 주요 현안 사업의 차질 없는 추진을 위해 정부 부처를 직접 방문하는 등 선제적인 내년도 국비 확보 행보에 나섰다. 안 시장은 4일 정부세종청사를 방문해 기획예산처... ,https://www.nocutnews.co.kr/news/6479538?utm_source=naver&utm_medium=article&utm_campaign=20260304050114,https://n.news.naver.com/mnews/article/079/0004121125?sid=102,"Wed, 04 Mar 2026 17:02:00 +0900"
기획처,"기획처, 중요 사업 검증하는 '혁신랩' 도입…청년 위한 성장전략 마련",기획처는 4일 7기 중장기전략위원회 첫번째 전체회의를 열어 중장기 국가발전전략 추진 방안을... 기획처는 이날 회의에서 중장기 국가발전전략 추진 방안을 위원들과 공유했다. 또 성장 잠재력을 위협하는 양극화... ,https://www.newsis.com/view/NISX20260304_0003534911,https://n.news.naver.com/mnews/article/003/0013801775?sid=101,"Wed, 04 Mar 2026 16:56:00 +0900"
기획처,"기획처, 무작위 대조군 뽑아 정책효과성 사전 검증키로…혁신랩 도입",이에 따라 기획처는 지속가능 혁신랩 운영 방향을 확정하고 상반기내 혁신랩 총괄 운용기관을 공모·선정해 나갈 계획이다. 예를 들어 미국 오레곤 주에서는 저소득층을 대상으로 공공의료 건강보험을 확대하기 위해... ,https://www.busan.com/view/busan/view.php?code=2026030416100163285,https://n.news.naver.com/mnews/article/082/0001369319?sid=101,"Wed, 04 Mar 2026 16:20:00 +0900"
