Keyword,Title,Description,Original Link,Link,Publication Date
이재명,"윤석열, 징역 7년에도 무표정…변호인단 &quot;민주당에도 이런 판결 가능하...","▶ 인터뷰 : 송진호 / 윤석열 전 대통령 변호인 - &quot;이재명이나 민주당 정부, 민주당 사람들에게 똑같이 판결을 내릴 수 있는지 스스로 한번 자문해 보길 바랍니다. 당연히 납득이 안 되고 저희 상고하겠습니다.&quot; 특검 측은... ",http://www.mbn.co.kr/pages/news/newsView.php?news_seq_no=5191122,https://n.news.naver.com/mnews/article/057/0001946998?sid=102,"Thu, 30 Apr 2026 07:28:00 +0900"
이재명,"'구속 만료' 유동규 &quot;성남시 부조리, 시장이 모르고 진행될 수 없어&quot;",시장(이재명)도 알았다&quot;고 주장했다. 유 전 본부장은 이날 오전 0시를 기해 경기 의왕시 서울구치소 석방됐다. 그는 &quot;시장이 모르고 (사업이) 진행될 수가 없다&quot;며 당시 성남시장이었던 이재명 대통령이 대장동 사업... ,https://www.news1.kr/society/court-prosecution/6153436,https://n.news.naver.com/mnews/article/421/0008920075?sid=102,"Thu, 30 Apr 2026 07:26:00 +0900"
이재명,분산형 임상시험 확대되나…9월 처리 예정 '메가특구법' 포함 예고,"아울러, 이재명 대통령을 위원장으로 한 규제합리화위원회가 출범한 가운데 보건복지부는 국회의... 현재 더불어민주당과 정부, 청와대는 이재명 정부 기조에 맞춰 오는 9월 정기국회에서 메가특구특별법을 처리하겠다는... ",http://www.doctorsnews.co.kr/news/articleView.html?idxno=164403,http://www.doctorsnews.co.kr/news/articleView.html?idxno=164403,"Thu, 30 Apr 2026 07:26:00 +0900"
이재명,[외화채 시장 항해사들] &quot;출렁일 때가 기회…中華 자금 활용하라&quot;,NH투자증권은 이재명 정부 들어 급속도로 호전된 중국과의 관계를 기회로 삼아 아시아 특화 투자은행(IB)으로 전환할 계획입니다.&quot; 이성호 NH투자증권 글로벌FI 상무는 29일 &quot;최근 아시아 외화채 시장에서 중화권 자금의... ,https://dealsite.co.kr/articles/160655,https://dealsite.co.kr/articles/160655,"Thu, 30 Apr 2026 07:26:00 +0900"
이재명,지게차에 이주노동자 묶고 조롱…가해자 법정선 &quot;죄송하다&quot;,이재명 대통령도 당시 “명백한 인권유린”이라며 엄정 대응을 주문했고 고용당국은 외국인 고용 취약 사업장에 대한 점검에 나섰다. 이날 공판에서 A씨는 공소사실을 모두 인정하며 “죄송하다”고 밝혔다. 변호인은... ,http://www.edaily.co.kr/news/newspath.asp?newsid=02725686645421368,https://n.news.naver.com/mnews/article/018/0006269545?sid=102,"Thu, 30 Apr 2026 07:24:00 +0900"
이재명,"[박근종 칼럼] 사라져 가는 소풍·수학여행, 안전관리 방안 지혜 모으고...","급기야 이재명 대통령은 지난 4월 28일 오잔 청와대에서 열린 국무회의에서 최근 각급 학교에서 안전사고... 이재명 대통령은 &quot;저 역시 초등학교 5학년 때 다녀온 경주 수학여행이 평생의 기억으로 남아있고, 그 과정을... ",https://www.mhns.co.kr/news/articleView.html?idxno=746234,https://www.mhns.co.kr/news/articleView.html?idxno=746234,"Thu, 30 Apr 2026 07:22:00 +0900"
이재명,"[손병관의 뉴스프레소] 공소취소권 가진 특검 추진, 영남권 지선 변수될...",이렇게 되면 특검이 이재명 대통령의 대장동·쌍방울 대북송금 사건 등 7개 사건에 대해 검찰의 공소를 직접 취소할 수 있는 권한을 가지게 된다. 대장동·대북송금 사건의 1심 재판은 이재명 대통령의 당선으로 중단된... ,https://www.ohmynews.com/NWS_Web/View/at_pg.aspx?CNTN_CD=A0003229813&CMPT_CD=P0010&utm_source=naver&utm_medium=newsearch&utm_campaign=naver_news,https://n.news.naver.com/mnews/article/047/0002513988?sid=102,"Thu, 30 Apr 2026 07:21:00 +0900"
이재명,"[대경초대석] 권창준 노동부 차관 “건설업, 첨단 전문직업 재평가 위해...",이재명 대통령은 지난달 경사노위 출범 기념 토론회와 이달 민주노총 간담회에서 잇따라 이 키워드를 언급했다. 양대 노총의 지지를 받고 출범한 정부임에도 노동 시장의 금기로 여겨진 지점을 공개석상에서 언급한... ,https://www.dnews.co.kr/uhtml/view.jsp?idxno=202604300712323840229,https://www.dnews.co.kr/uhtml/view.jsp?idxno=202604300712323840229,"Thu, 30 Apr 2026 07:20:00 +0900"
이재명,"조작기소 국조 특위, 오늘 활동 마무리…'특검 드라이브' 전망",민주당은 이번 국정조사를 통해 윤석열 정권에서 이재명 대통령을 겨냥한 위법적 수사가 진행됐음이 밝혀졌다고 보고 있다. 반면 국민의힘은 수사 중인 사건 등에 대한 이번 국정조사가 위법이라는 입장을 견지해왔다.... ,http://www.joseilbo.com/news/news_read.php?uid=567518&class=32&grp=,https://n.news.naver.com/mnews/article/123/0002382280?sid=100,"Thu, 30 Apr 2026 07:12:00 +0900"
이재명,"[이채정의 엮어읽기] 교육감 선거, 정당 아닌 정책으로 승부 보려면","이재명 대통령이 현장체험학습 위축과 관련해 &quot;구더기가 무서워 장독을 없애는 식 접근이 바람직하지 않다&quot;고 말하자, 교사들은 &quot;사고발생 책임을 교사에게 돌리는 현실을 모른다&quot;며 집단 반발했다. 아이들의 SNS 중독... ",https://www.pennmike.com/news/articleView.html?idxno=119682,https://www.pennmike.com/news/articleView.html?idxno=119682,"Thu, 30 Apr 2026 07:08:00 +0900"
이재명,政 &quot;임상시험 활성화 차원 '의약품 분산형' 추진&quot;,특히 이재명 대통령을 위원장으로 하는 규제합리화위원회 출범에 따라 보건복지부는 국회의 메가특구법 제정에 발맞춰 ‘의약품 분산형 임상시험’ 제도화에 전력하게 된다. 당정청은 이재명 정부 기조에 맞춰 오는 9월... ,https://www.dailymedi.com/news/news_view.php?wr_id=936110,https://www.dailymedi.com/news/news_view.php?wr_id=936110,"Thu, 30 Apr 2026 07:08:00 +0900"
이재명,[사설] 정치 다양성 필요 보여준 비교섭단체 의원단 청와대 오찬,"이재명 대통령이 29일 국회 비교섭단체와 무소속 의원들을 청와대로 초청해 오찬 회동을 가졌다. 이날... 집권당이자 국회 1당인 민주당은 정치개혁 실현이 이재명 정부 성공을 위해서도 필수적임을 인식하고, 달라진 태도로... ",https://vop.co.kr/A00001692851.html,https://vop.co.kr/A00001692851.html,"Thu, 30 Apr 2026 07:06:00 +0900"
이재명,[칼럼] 초읽기에 들어간 삼성전자 파업.. 대통령은 뭐하나,법제화한 이재명 대통령과 더불어민주당에도 어느 정도 책임이 있다. 노란봉투법으로 기업의 대응 수단이... 이재명 대통령은 즉각 긴급조정권 발동해야 이재명 대통령과 민주당은 이 사태가 국가에 미치는 영향이 막대한... ,http://www.joseilbo.com/news/news_read.php?uid=567517&class=75&grp=,https://n.news.naver.com/mnews/article/123/0002382279?sid=004,"Thu, 30 Apr 2026 07:06:00 +0900"
이재명,[오늘의 주요일정·30일] '서부지법 난동범들' 상고심 선고,■ 분야별 ▲ 이재명 대통령 수석보좌관회의(14:00 청와대 여민관) ▲ 김민석 국무총리 민관합동 규제합리화추진단 현판식(16:30 서울 중구) 알-사예드 카타르 통상담당 국무장관 접견(18:00 정부서울청사)... ,https://www.safetimes.co.kr/news/articleView.html?idxno=242401,https://www.safetimes.co.kr/news/articleView.html?idxno=242401,"Thu, 30 Apr 2026 07:04:00 +0900"
이재명,&quot;TBS 폐지한 적 없다? 참 '오세훈스러운' 발언&quot;,"이재명 정부가 이 비상식적인 문제를 외면하지 않으리라 믿습니다. 이번 지방선거까지 간절히 기다리겠지만, 그 과정에서 TBS가 문을 닫는 비극만은 막아주십시오. 이는 TBS 구성원으로서의 요청이자, 한 사람의... ",https://www.mediaus.co.kr/news/articleView.html?idxno=316833,https://www.mediaus.co.kr/news/articleView.html?idxno=316833,"Thu, 30 Apr 2026 07:02:00 +0900"
이재명,사유재산권 제한하면 반드시 비극 찾아온다,"이재명 대통령은 지난 1월 “시장을 이기는 정부도 없지만, 정부를 이기는 시장도 없다”라며 정책 강행 의지를 밝혔다. 과도한 다주택자 규제를 비판하는 언론을 향해 “마귀에게 최소한의 양심마저 빼앗긴 건 아닌가”... ",https://shindonga.donga.com/3/all/13/6203860/1,https://n.news.naver.com/mnews/article/262/0000019339?sid=101,"Thu, 30 Apr 2026 07:02:00 +0900"
이재명,"김경수 &quot;행정통합하자는 국힘, 전남-광주처럼 이번에 했어야&quot;","한편 김 전 지사는 경남지사 선거 판세와 관련, 국민의힘 후보인 박완수 현 지사가 '발표되는 여론조사와는 달리 경남은 국민의힘 지지도가 민주당보다 훨씬 높다'고 주장한 데 대해 &quot;최근 여론조사는 이재명 대통령의... ",https://www.pressian.com/pages/articles/2026042912144946624?utm_source=naver&utm_medium=search,https://n.news.naver.com/mnews/article/002/0002439769?sid=100,"Thu, 30 Apr 2026 07:02:00 +0900"
이재명,"“분산형 임상, 메가특구법에 담는다”…복지부, 규제특례로 제도화 시...","특히 이재명 대통령을 위원장으로 한 규제합리화위원회 출범과 맞물려, 정부는 오는 9월 정기국회에서 메가특구법 처리를 목표로 속도를 내고 있다. 복지부 제약바이오산업과 임강섭 과장은 전문기자협의회와... ",http://www.whosaeng.com/sub_read.html?uid=170224&section=sc1,http://www.whosaeng.com/sub_read.html?uid=170224&section=sc1,"Thu, 30 Apr 2026 07:02:00 +0900"
이재명,"김재연 &quot;평택을, 마지막까지 감동 드라마 만들 것&quot;[한판승부]",그래서 작년부터 당장 그렇게 해서 이재명 대통령께서 지난달에 재벌들 불러놓고 잘한 거라고 칭찬도... 제가 요즘 열심히 뛰니까 최근에 진보당을 많이 바라봐 주시고 이렇게 또 진보 정당이 열심히 하면 이재명 정부의... ,https://www.nocutnews.co.kr/news/6510523?utm_source=naver&utm_medium=article&utm_campaign=20260430070039,https://n.news.naver.com/mnews/article/079/0004142346?sid=100,"Thu, 30 Apr 2026 07:01:00 +0900"
이재명,"부산 출격 '하GPT'알아본 주민들, 여든 야든 &quot;단일화 안되면 하정우&quot;","ⓒ 김보성 &quot;청와대 있던 젊은 사람이 부산 북갑에 나온다 아이가!&quot; 이재명 대통령의 사표 재가 후 부산에... ⓒ 김보성 하 전 수석은 네이버클라우드 AI혁신센터장 출신의 민간 전문가로, 이재명 정부 초대 AI수석에... ",https://www.ohmynews.com/NWS_Web/View/at_pg.aspx?CNTN_CD=A0003229720&CMPT_CD=P0010&utm_source=naver&utm_medium=newsearch&utm_campaign=naver_news,https://n.news.naver.com/mnews/article/047/0002513987?sid=162,"Thu, 30 Apr 2026 07:01:00 +0900"
이재명,"구글 첫 해외 AI 캠퍼스, 서울 강남에 연내 문 연다","정부는 이재명 대통령과 데미스 허사비스 구글 딥마인드 최고경영자(CEO) 면담에서 구글 측에 연구진 최소 10명가량의 한국 파견을 요청했고, 이에 동의한다는 취지의 답변을 들은 것으로 전해졌습니다. 다만... ",https://news.sbs.co.kr/news/endPage.do?news_id=N1008540136&plink=ORI&cooper=NAVER,https://n.news.naver.com/mnews/article/055/0001352504?sid=101,"Thu, 30 Apr 2026 07:01:00 +0900"
이재명,박찬대 민주 인천시장 후보 &quot;국무회의 생중계 벤치마킹&quot;[인터뷰],박찬대 더불어민주당 인천시장 후보가 시정 운영 효율성을 높이기 위해 이재명 대통령표 국무회의 생중계... 소감은 &quot;계엄을 막아내고 이재명 정부를 세웠던 역사적인 순간이 기억에 남는다. 국회 안에서는 의원들끼리... ,https://www.newsis.com/view/NISX20260429_0003612161,https://n.news.naver.com/mnews/article/003/0013918522?sid=102,"Thu, 30 Apr 2026 07:00:00 +0900"
이재명,한 장의 사진으로 보는 이재명 정부의 부동산 시장 흐름,"그러다 민주당 출신인 이재명 대통령이 지난해 6월 취임하자마자, 국내 주요 지역 공동주택(아파트) 가격이... 한편, 이재명 정부가 발족 직후인 지난해 6월 27일 고강도 부동산 금융 규제를 내놨다. 돈줄을 원천 봉쇄해... ",https://www.koreareport.co.kr/news/articleView.html?idxno=50251,https://www.koreareport.co.kr/news/articleView.html?idxno=50251,"Thu, 30 Apr 2026 07:00:00 +0900"
이재명,[여백] 공천은 메시지다,김 전 부원장은 대장동 개발 업자에게서 금품을 받은 혐의로 1·2심에서 유죄 판결을 받았지만 이재명 대통령의 복심으로 꼽히는 데다 민주당 의원 여러 명이 연서명으로 그의 공천을 요구했기 때문이다. 공천 배제에 대해... ,https://www.daejonilbo.com/news/articleView.html?idxno=2272457,https://n.news.naver.com/mnews/article/656/0000175203?sid=110,"Thu, 30 Apr 2026 07:00:00 +0900"
이재명,"주유소, 고유가 피해지원금 사용처 되나?",이재명 대통령이 '고유가 피해지원금'을 연 매출 30억 원 이상의 주유소에서도 사용할 수 있도록 제한을 풀어주는 방안을 검토하라고 지시한 것으로 알려졌다. 이규연 청와대 홍보소통수석은 29일 KBS 라디오에 출연해... ,https://www.bntnews.co.kr/article/view/bnt202604300020,https://www.bntnews.co.kr/article/view/bnt202604300020,"Thu, 30 Apr 2026 06:58:00 +0900"
이재명,&quot;하정우랑 붙는다니까 조금 불안해&quot;...한동훈 향한 걱정과 격려,한 전 대표는 또 하정우 전 수석을 겨냥해 &quot;결국 이재명 대통령이 나가라고 해서 (하 수석이) 나왔다는 것 아니냐. 그러면 (이번 선거는) 저와 (이 대통령의) 대리전이 될 것&quot;이라며 &quot;이번 선거를 통해 이재명 정권의 실정을... ,https://www.ohmynews.com/NWS_Web/View/at_pg.aspx?CNTN_CD=A0003229708&CMPT_CD=P0010&utm_source=naver&utm_medium=newsearch&utm_campaign=naver_news,https://n.news.naver.com/mnews/article/047/0002513984?sid=162,"Thu, 30 Apr 2026 06:56:00 +0900"
이재명,체험학습 위축에 '교사 소송 국가 책임제' 부상...정치권·교육계 동시 ...,"앞서 이재명 대통령은 국무회의에서 &quot;소풍이나 수학여행이 줄어든 것은 안전사고 책임 부담 때문&quot;이라며 개선... 같은 날 청와대 간담회에서 천하람 개혁신당 원내대표는 &quot;이재명 대통령이 소풍이나 수련회, 수학여행 이런... ",https://www.pressian.com/pages/articles/2026043006303394586?utm_source=naver&utm_medium=search,https://n.news.naver.com/mnews/article/002/0002439768?sid=102,"Thu, 30 Apr 2026 06:53:00 +0900"
이재명,"[이충재의 인사이트] '샤이 보수', 진짜 있을까",이재명 정부 출범 후 보수에서 새로 유입된 '뉴이재명' 현상이 단적인 예입니다. 보수 지지를 부끄럽게 생각하는 '샤이 보수'가 존재한다면 이들 가운데 상당수는 이미 '뉴이재명'으로 편입됐을 것으로 추정할 수 있습니다.... ,https://www.ohmynews.com/NWS_Web/View/at_pg.aspx?CNTN_CD=A0003229448&CMPT_CD=P0010&utm_source=naver&utm_medium=newsearch&utm_campaign=naver_news,https://n.news.naver.com/mnews/article/047/0002513983?sid=100,"Thu, 30 Apr 2026 06:51:00 +0900"
이재명,"[단독] &quot;백악관 보고해야, 수사 끝내달라&quot;…도 넘은 쿠팡 요구",이재명 대통령은 어제(29일) 비교섭단체 소속 또는 무소속 의원들과 오찬에서 최근 대외적 상황이 매우 안 좋다면서 이런 언급을 했습니다. [이재명 대통령 : 대외 문제에 대해서는 자해적 행위를 하는 경우는 찾기가 쉽지... ,https://news.sbs.co.kr/news/endPage.do?news_id=N1008540064&plink=ORI&cooper=NAVER,https://n.news.naver.com/mnews/article/055/0001352500?sid=100,"Thu, 30 Apr 2026 06:50:00 +0900"
이재명,"주유소에서 못 쓰는 고유가지원금…李, '사용 검토' 지시","이에 이재명 대통령이 사용 검토를 지시했는데요. 자세한 내용, 오서영 기자와 짚어보겠습니다. 그럼... [기자] 이규연 청와대 홍보소통수석은 어제(29일) 한 라디오 방송에 나와 이재명 대통령이 이용제한을 풀어주는... ",https://biz.sbs.co.kr/article_hub/20000307622?division=NAVER,https://n.news.naver.com/mnews/article/374/0000507547?sid=101,"Thu, 30 Apr 2026 06:45:00 +0900"
정상순방,"&quot;베트남, 국가 대개조 사업에 한국 참여 기대해...든든한 동반자 관계&quot;","두 정상은 3박 4일의 순방 기간 중 공식 환영식, 정상회담, 양해각서(MOU) 체결식, 국빈 만찬 등 7차례 만남을 가졌다. 극소수 참모만 배석한 비공개 소인수 회담에서는 정상 간 허심탄회한 의견 교환이 이뤄졌다. 이... ",https://www.hankookilbo.com/news/article/A2026042914570005764?did=NA,https://n.news.naver.com/mnews/article/469/0000928367?sid=104,"Thu, 30 Apr 2026 04:30:00 +0900"
정상순방,"[5박 6일 순방 결산] 이대통령, 글로벌 사우스 공략 본격화… '세일즈 외...",◆민관 총출동 '세일즈 외교' 이번 순방의 가장 직접적인 성과는 경제 분야에서 확인됐다. 이 대통령은 20일(현지시간) 나렌드라 모디 총리와의 정상회담을 통해 양국 교역 규모를 2030년까지 500억 달러로 확대하는 목표를... ,https://www.newscj.com/news/articleView.html?idxno=3397392,https://www.newscj.com/news/articleView.html?idxno=3397392,"Wed, 29 Apr 2026 21:00:00 +0900"
정상순방,"[이슈플러스] 트럼프 &quot;이란, 붕괴 상태&quot;...이란 지도부의 내홍?",그런데 하메네이가 정상적인 절차를 거쳐서 후계자에게 승계해 주고 이렇게 넘어간 게 아니라 갑자기... 그다음에 이란의 외무장관도 주변국에 다 순방을 했거든요. 그러니까 그것을 종합해서 어떤 안을 하나 만들겠죠.... ,https://www.ytn.co.kr/_ln/0104_202604291827062717,https://n.news.naver.com/mnews/article/052/0002347195?sid=104,"Wed, 29 Apr 2026 18:27:00 +0900"
정상순방,[세상의 모든 정보 윤인구입니다] 이규연 “고가 1주택 쏠린 장특공제 ...,"인도 순방, CEPA 등 양해각서 채택 등 실질적 진전 결과 - 모디 총리와 호치민 주석 등, 李대통령이 직접... ▷ 윤인구 : 많은 분들이 궁금해하시는 게 요즘 해외 정상들도 SNS를 활용해서 많은 메시지를 내고 있습니다만 우리... ",https://news.kbs.co.kr/news/pc/view/view.do?ncd=8549064&ref=A,https://n.news.naver.com/mnews/article/056/0012172132?sid=100,"Wed, 29 Apr 2026 16:07:00 +0900"
정상순방,"다카이치 하노이行 앞두고…日, 베트남에 원유 400만 배럴 공급","5·1 정상회담 의제 '에너지 안보' 사전 가시화 다카이치 사나에 일본 총리의 베트남 방문을 앞두고, 일본... 이번 공급 발표는 다카이치 총리의 첫 동남아 순방 시점에 정확히 맞물렸다. 다카이치 총리는 다음 달 1일부터... ",https://www.asiatoday.co.kr/view.php?key=20260429010009337,https://www.asiatoday.co.kr/view.php?key=20260429010009337,"Wed, 29 Apr 2026 10:26:00 +0900"
정상순방,&quot;한국 상품인 것처럼 팔리는 중&quot;...실제로 보니 더 심각한 '위조' 실태 ...,"제가 최근에 대통령 정상회담 순방 계기에 필리핀, 베트남 등 글로벌 사우스 국가들을 다녀봤는데요. 가보면 이런 제품들이 굉장히 많이 유통되고 있습니다. 보이십니까? 우리나라 제품이 아니라는 말씀이신가요? [김용선]... ",https://www.ytn.co.kr/_ln/0134_202604290823349922,https://n.news.naver.com/mnews/article/052/0002346992?sid=101,"Wed, 29 Apr 2026 08:23:00 +0900"
정상순방,"[사설] 한·미 갈등, 일방주의 아닌 상호 존중 원칙으로 풀어야",대북정보 공유를 조속히 정상화하고 한·미 안보 협의를 본격화해야 한다. 이재명 대통령은 28일 인도·베트남 순방 성과를 설명하며 “주권 국가로서 당당한 자세로 우방들과 진정한 우정을 쌓는 외교에 주력하겠다”고... ,https://www.khan.co.kr/article/202604290601011,https://n.news.naver.com/mnews/article/032/0003442742?sid=110,"Wed, 29 Apr 2026 06:01:00 +0900"
정상순방,이 대통령 &quot;국익 실용 외교 절실...전통 우방과도 미래지향적 관계&quot;,또 이번 순방에서 정상외교 수준의 힌디어 통역관이 없어 이중 통역을 했던 점을 언급하며 &quot;한국과 인도가 교류를 강화하면 언어 수요가 많아질 텐데 교육 기관 운영에도 힘을 실어 달라&quot;고 요청했다. 교육부 '민주시민교육... ,http://www.enewstoday.co.kr/news/articleView.html?idxno=2424459,http://www.enewstoday.co.kr/news/articleView.html?idxno=2424459,"Tue, 28 Apr 2026 23:04:00 +0900"
정상순방,이란 종전 제안에도 미국 '냉랭'...'고사 작전' 통할까?,그렇게 되면 자연스럽게 호르무즈 해협도 정상화될 것이고 그때 가서 호르무즈 통행에 관한 것을 논의하자.... 그리고 그 주변에 아랍국가들을 지금 순방하는 이유는 고립을 탈피하려고 하는 겁니다. 그러니까 그동안 지금... ,https://www.ytn.co.kr/_ln/0104_202604282031078403,https://n.news.naver.com/mnews/article/052/0002346851?sid=104,"Tue, 28 Apr 2026 20:31:00 +0900"
정상순방,길어지는 '이란 전쟁'...차세대 에너지 기술 어디까지?,"제가 최근에 대통령 정상회담 순방 계기에 필리핀, 베트남 등 글로벌 사우스 국가들을 다녀봤는데요. 가보면 이런 제품들이 굉장히 많이 유통되고 있습니다. 보이십니까? 우리나라 제품이 아니라는 말씀이신가요? [김용선]... ",https://www.ytn.co.kr/_ln/0115_202604281923463547,https://n.news.naver.com/mnews/article/052/0002346840?sid=102,"Tue, 28 Apr 2026 19:23:00 +0900"
정상순방,이 대통령 “외국군 없으면 왜 불안한가”...신속한 전작권 전환 시사,"이와 관련, 이 대통령의 베트남 순방을 수행한 위성락 국가안보실장은 지난 23일 현지 브리핑에서 “정부는... 그는 그러면서 “결국 결정은 양국 정상이 내리게 되는 것이고, 한미 외교·군사 당국간 대화는 계속하고... ",https://www.mediapen.com/news/view/1096121,https://www.mediapen.com/news/view/1096121,"Tue, 28 Apr 2026 17:42:00 +0900"
정상순방,李대통령 &quot;주권국가로 당당…원칙 따라 전통우방과 현안 풀겠다&quot;(종합),그러면서 이번 순방에서 정상외교 수준의 힌디어 통역관이 없어 이중 통역을 했던 점을 언급하며 관련 교육기관 운영에도 힘을 실어 줄 것을 주문했다. 경제 상황과 관련해서는 &quot;지난 1분기 GDP(국내총생산) 성장률이 당초... ,https://www.yna.co.kr/view/AKR20260428064851001?input=1195m,https://n.news.naver.com/mnews/article/001/0016048479?sid=100,"Tue, 28 Apr 2026 17:11:00 +0900"
정상순방,"李대통령, 1주택자 역차별 해소 재토론…교권·안보 전방위 메시지(종합...",또 이번 순방에서 정상외교 수준의 힌디어 통역관이 없어 '이중 통역'을 했던 점을 강하게 지적하기도 했다. 이 대통령은 &quot;한국과 인도가 교류를 강화하면 언어 수요가 많아질 텐데 교육 기관 운영에도 힘을 실어 달라&quot;고... ,https://www.news1.kr/politics/president/6151724,https://n.news.naver.com/mnews/article/421/0008917029?sid=100,"Tue, 28 Apr 2026 16:59:00 +0900"
정상순방,"다카이치, 골든위크 기간 베트남·호주 순방…“인태 구상 강조”","베트남 방문 이후에는 다음 순방지인 호주를 찾아 4일 앤서니 앨버니지 호주 총리와 정상회담을 진행한다. 올해는 양국이 우호협력기본조약을 체결한 지 50주년이 되는 해로, 양국은 안보·경제 등 다양한 분야에서 협력을... ",https://www.munhwa.com/article/11585644?ref=naver,https://n.news.naver.com/mnews/article/021/0002788031?sid=104,"Tue, 28 Apr 2026 15:46:00 +0900"
정상순방,[정부家] 이재명 대한민국 대통령 ⑩ ㅣ 권익·권력·외교까지…'자유·...,"이날 회의에서 이재명 대통령은 최근 인도와 베트남 순방 성과를 언급하며, 전통 우방과의 협력 역시... 완전히 정상화되기 전까지는 긴장을 늦추기 어렵다는 평가다. 한편, 전쟁 여파에도 불구하고 코스피가 사상... ",https://www.cbci.co.kr/news/articleView.html?idxno=568952,https://www.cbci.co.kr/news/articleView.html?idxno=568952,"Tue, 28 Apr 2026 15:32:00 +0900"
정상순방,李대통령 “원유 수입선 다변화 정착시켜야”…정상회담 후속 조치도 당...,더불어 인도·베트남 순방 이후 추가 조치를 통한 실질적인 성과도 요구했다. 이 대통령은 “과거엔 어떻게 했는지 모르겠지만 정상회담을 하면 사진만 찍고 오는 게 아니고 실제로 진척이 돼야 한다. 이걸(정상회담을)... ,https://www.etnews.com/20260428000304,https://n.news.naver.com/mnews/article/030/0003422483?sid=100,"Tue, 28 Apr 2026 14:34:00 +0900"
