Keyword,Title,Description,Original Link,Link,Publication Date
관가,원전·투자로 통상 압박 완화 시도,이를 위해 김 장관이 기업총수들과 비공개 면담을 통해 대미투자를 논의할 것으로 관가는 관측하고 있다. 미국의 관세 인상을 어떻게든 막아보겠다는 목표로 정부는 릴레이 접촉을 이어가고 있다. 김 장관에 여한구... ,https://biz.heraldcorp.com/article/10667613?ref=naver,https://n.news.naver.com/mnews/article/016/0002594466?sid=101,"Mon, 02 Feb 2026 11:12:00 +0900"
관가,"대미 관세협상 난항 속 원전, 디지털법 등 비관세 개선 논의 총력",이를 위해 김 장관이 기업총수들과 비공개 면담을 통해 대미투자를 논의할 것으로 관가는 관측하고 있다. 미국의 관세 인상을 어떻게든 막아보겠다는 목표로 정부는 릴레이 접촉을 이어가고 있다. 김 장관에 여한구... ,https://biz.heraldcorp.com/article/10667573?ref=naver,https://n.news.naver.com/mnews/article/016/0002594440?sid=101,"Mon, 02 Feb 2026 10:56:00 +0900"
관가,[세종시 프리즘] 기획처 장관 하마평에 쏠린 눈,하마평에 관가의 시선이 집중되고 있다. 이번에도 관료 출신보다 비관료 출신의 '깜짝 발탁' 가능성에 무게가 실리는 가운데 기획처 내부에서는 새 후보자 인선이 예상보다 지연될 것이란 관측이 제기된다. 2일 관가에... ,https://news.einfomax.co.kr/news/articleView.html?idxno=4396641,https://news.einfomax.co.kr/news/articleView.html?idxno=4396641,"Mon, 02 Feb 2026 09:16:00 +0900"
관가,흔들리는 ‘TK 행정통합’… 정치권 등 곳곳서 “멈춰라” 경고음,곳곳서 감지되는 기류 변화… ‘속도전’에서 ‘검증론’으로 정치권과 지역 관가의 목소리가 일치하는 지점은 결국 ‘주민 동의’와 ‘실질적 자치권’이다. 최 전... ,http://www.breaknews.com/1181544,http://www.breaknews.com/1181544,"Mon, 02 Feb 2026 08:08:00 +0900"
관가,[김성재 칼럼] 케빈 워시를 잘못 안 금은 시장의 오버 리액션,학계나 관가 출신보다 업계 출신을 선호하는 트럼프의 입맛에 딱 맞았다. 무엇보다 현재 채권 ETF 가운데... 오히려 관가 인물에 가깝다. 조지 W. 부시 대통령의 백악관 국가경제위원회(NEC)에서 선임 연구원으로 일했고... ,https://www.womaneconomy.co.kr/news/articleView.html?idxno=249172,https://www.womaneconomy.co.kr/news/articleView.html?idxno=249172,"Mon, 02 Feb 2026 08:00:00 +0900"
관가,[이슈포커스] 3월 추경 이뤄지나 …20조+α도 전망 [Pick코노미],관가에서는 청년 실업을 추경의 명분으로 앞세울 가능성이 크다는 전망이 나온다. 실제 지난해 12월 청년층 고용률(15~29세)은 44.3%로 20개월 연속 하락세다. 청년 실업률도 6.2%에 달해 전 연령대 평균 실업률(4.1%)을 크게... ,https://www.sedaily.com/article/20003435?ref=naver,https://n.news.naver.com/mnews/article/011/0004585446?sid=101,"Mon, 02 Feb 2026 07:01:00 +0900"
관가,“이재명은 尹과 다를 것”…의대증원 둘러싼 관가 기류,다만 관가 분위기는 과거와 다르다. 정부 안팎에서는 이번 국면을 두고 “전과는 완전히 다를 것”이라는... 이 같은 평가는 현재 관가에서도 나온다. 이 대통령은 국정 전반에서 갈등을 피하기 위해 사전에 완충 장치를... ,https://www.dailian.co.kr/news/view/1605196/?sc=Naver,https://n.news.naver.com/mnews/article/119/0003054737?sid=102,"Mon, 02 Feb 2026 07:01:00 +0900"
관가,경제기반 못 옮기면 혁신도시 '재탕'…&quot;지방 부동산 변동성만 키울 수도...,1일 관가에 따르면 정부는 5극 3특을 통해 수도권에 집중된 공공 기능과 산업을 권역 거점으로 분산하는 방안을 구상하고 있다. 이 과정에서 공공기관의 추가 이전이 핵심 수단으로 검토되고 있으며 정책 실행 시점은... ,https://www.etoday.co.kr/news/view/2549982,https://www.etoday.co.kr/news/view/2549982,"Mon, 02 Feb 2026 06:02:00 +0900"
관가,[칼럼]소명과 열정의 11년 여정…'주민 바라기' 3선 구청장,"공무원사회를 잘 움직이도록 하는 힘은 행정고시로 관가에 발을 들여놓은 뒤 30년 동안 이어진 공직생활에서 터득한 일머리 즉, 노하우에서 나왔다. 이 구청장이 풀뿌리행정 추진에서 특별히 중시한 부분은 주민편의의... ",https://www.nocutnews.co.kr/news/6464894?utm_source=naver&utm_medium=article&utm_campaign=20260202060045,https://n.news.naver.com/mnews/article/079/0004111165?sid=102,"Mon, 02 Feb 2026 06:01:00 +0900"
관가,"'대통령 측근' 이헌욱 변호사, 부동산원 사장 '사실상 확정'",1일 세종 관가에 따르면 기획재정부는 지난달 29일 공공기관운영위원회(이하 공운위)를 열어... 이는 이전 임추위가 외부인사를 배제한 채 LH 전현직 임원들만 사장 후보로 추천한 데 따른 후폭풍이라는 게 관가의... ,https://www.mt.co.kr/estate/2026/02/02/2026020118410065272,https://n.news.naver.com/mnews/article/008/0005312394?sid=101,"Mon, 02 Feb 2026 04:00:00 +0900"
관가,"어제의 동지가 오늘의 적?…기후부·산업부, 해외 영토 전쟁 중[세종백...","1일 관가에 따르면 외교부는 산업통상자원 분야 독일·체코·캐나다·호주 등 4개국 상무관 채용 절차를 진행... 것이 관가의 분위기다. 기후부는 산업부에서 에너지 담당 220여명이 이동했다는 점을 감안, 주요국... ",https://biz.heraldcorp.com/article/10667241?ref=naver,https://n.news.naver.com/mnews/article/016/0002594170?sid=101,"Mon, 02 Feb 2026 00:27:00 +0900"
관가,공기업 사장 공모 러시…에너지·국토 부문 리더십 공백 심화,관가 안팎에서는 새 정부의 에너지 정책 철학을 공유하면서도 복잡한 현안을 풀어낼 '실무형 리더'의 등장을 기대하고 있다. 이사장 공백이 장기화 상태인 전력거래소는 최근 임원추천위원회를 구성하고 지난 27일까지... ,https://www.g-enews.com/view.php?ud=202601301458495760a9fc143920_1,https://www.g-enews.com/view.php?ud=202601301458495760a9fc143920_1,"Sun, 01 Feb 2026 19:00:00 +0900"
관가,설 명절 앞두고 장바구니 물가 비상,관가 안팎에서는 고환율 등의 영향으로 이달 소비자물가 상승률이 2.3% 안팎을 기록할 가능성이 크다는 관측도 나온다. 전문가들은 연초부터 고물가가 이어질 경우 소비심리가 위축될 수 있다고 입을 모았다. 지역... ,http://www.jjn.co.kr/news/articleView.html?idxno=1031111,http://www.jjn.co.kr/news/articleView.html?idxno=1031111,"Sun, 01 Feb 2026 18:52:00 +0900"
관가,통상 갈등 우려·노조 반발에…'쿠팡 전방위 조사' 정부 부담 '쑥',"그러나 관가에서는 &quot;쿠팡 문제가 일찍이 한미 통상 영역의 암초로 부상했다&quot;는 시각이 많다. 제임스 헬러 주한 미국대사대리는 지난달 13일 배경훈 부총리 겸 과학기술정보통신부 장관과 김 장관, 주병기 공정거래위원장... ",https://www.hankookilbo.com/news/article/A2026020115360000955?did=NA,https://n.news.naver.com/mnews/article/469/0000912159?sid=101,"Sun, 01 Feb 2026 18:01:00 +0900"
관가,[이슈포커스] 채권시장은 3월 추경에 베팅…20조+α도 가능,관가에서는 청년 실업을 추경의 명분으로 앞세울 가능성이 크다는 전망이 나온다. 실제 지난해 12월 청년층 고용률(15~29세)은 44.3%로 20개월 연속 하락세다. 청년 실업률도 6.2%에 달해 전 연령대 평균 실업률(4.1%)을 크게... ,https://www.sedaily.com/article/20003339?ref=naver,https://n.news.naver.com/mnews/article/011/0004585329?sid=101,"Sun, 01 Feb 2026 17:48:00 +0900"
관가,&quot;통합 안정·지속성 담보 ‘조세 이양’ 명문화 절실”,"다만, 지역 정·관가에서는 조세 이양에 대한 명문화는 추후 입법 심사와 범정부 TF 과정에서 추가 논의될 가능성이 있다는 의견도 나온다. 당장 청와대가 지난달 20일 통합 지방정부에 대한 체계적인 재정 지원을... ",http://www.jndn.com/article.php?aid=1769934103426399001,http://www.jndn.com/article.php?aid=1769934103426399001,"Sun, 01 Feb 2026 17:24:00 +0900"
관가,"“국회 너무 느리다”던 이 대통령, 주말 ‘SNS 글 폭풍’…‘정책 텐션...","특히 여당이 다루기 난감한 현안(부동산 세제)이나 새로운 의제(설탕부담금)를 직접 던지고, 관가의 관심에서 멀어진 정책과 지시를 재점검(지자체 금고 이자율)하며 고삐를 죄는 식이다. “공무원은 퇴근 시간 없이... ",https://www.hani.co.kr/arti/politics/bluehouse/1242761.html,https://n.news.naver.com/mnews/article/028/0002789411?sid=100,"Sun, 01 Feb 2026 16:56:00 +0900"
관가,"&quot;집값 안정 반드시 성공…다주택자, 손해보지 않고 팔 마지막 기회&quot;","서울 송파구 롯데월드타워 서울스카이에서 아파트 단지가 보이고 있다.(사진=이영훈 기자) 李, 다주택자에게 “정부정책에 맞서 손해보지 말라” 1일 관가에 따르면 이 대통령은 지난 31일 엑스(X·옛 트위터)를 통해... ",http://www.edaily.co.kr/news/newspath.asp?newsid=01669526645346256,https://n.news.naver.com/mnews/article/018/0006210916?sid=101,"Sun, 01 Feb 2026 14:30:00 +0900"
관가,"여한구 통상본부장, 美정부·의회 접촉 '관세 인상 저지' 적극 행보 중",1일 관가 등에 따르면 여한구 본부장은 지난달 31일(현지시간) 워싱턴DC에서 트럼프 행정부 당국자와 연방 의회 및 미국 업계 관계자들을 만난 것으로 전해졌다. 여한구 산업통상부 통상교섭본부장(오른쪽)이 지난달... ,https://www.newspim.com/news/view/20260201000059,https://www.newspim.com/news/view/20260201000059,"Sun, 01 Feb 2026 13:16:00 +0900"
관가,[기획] 정부 주도 6만 가구 공급… 주민·지자체 불만 폭발,"1일 업계와 관가에 따르면 서울시는 자신들이 제시한 최소한의 전제조건이 배제된 이번 대책에 대한 불만이 큰 상태다. 그간 서울 주택공급 90% 이상을 민간 동력으로 지탱했지만, 이번 정부 발표는 규제 완화 없이... ",http://www.m-i.kr/news/articleView.html?idxno=1332075,http://www.m-i.kr/news/articleView.html?idxno=1332075,"Sun, 01 Feb 2026 12:06:00 +0900"
관료,"李대통령, 재정경제부 2차관에 허장…우주항공청장에 오태석 임명","허 신임 2차관은 국제통화기금(IMF) 상임이사와 기획재정부 국제경제관리관, 개발금융국장 등을 역임한 정통 관료 출신이다. 강 대변인은 &quot;풍부한 국제금융 경험과 폭넓은 네트워크를 바탕으로 국제경제를 총괄하는... ",https://www.jeonmae.co.kr/news/articleView.html?idxno=1227240,https://www.jeonmae.co.kr/news/articleView.html?idxno=1227240,"Mon, 02 Feb 2026 14:44:00 +0900"
관료,"李대통령, 재경부 2차관 허장·우주항공청장 오태석 임명",허 신임 차관은 국제통화기금(IMF) 상임이사와 기획재정부 국제경제관리관 및 개발금융국장 등을 거친 정통 관료 출신이다. 강 대변인은 &quot;풍부한 업무 경험과 네트워크를 토대로 국제경제를 총괄하는 2차관 업무를 수행할... ,https://www.ngonews.kr/news/articleView.html?idxno=223601,https://www.ngonews.kr/news/articleView.html?idxno=223601,"Mon, 02 Feb 2026 14:44:00 +0900"
관료,"이재명 대통령, 허장 재경부 2차관·오태석 우주항공청장 등 임명","강 대변인은 오 청장에 대해 &quot;행정고시로 과학기술처에 입직한 이래 30년간 과학기술정책의 주요 분야를 두루 거친 정통 과학 기술 행정 관료&quot;라며 &quot;과학기술정보통신부 1차관 재임 시절, 누리호 발사 관리 위원장으로... ",https://www.mt.co.kr/politics/2026/02/02/2026020213583612268,https://n.news.naver.com/mnews/article/008/0005312756?sid=100,"Mon, 02 Feb 2026 14:44:00 +0900"
관료,"李대통령, 재정경제부 2차관에 허장…우주항공청장 오태석 임명","허 신임 재정경제부 2차관은 국제통화기금(IMF) 상임이사를 비롯해 기획재정부 국제경제관리관, 개발금융국장 등을 지낸 정통 관료 출신이다. 강 대변인은 “국제경제 분야에서 축적한 경험과 네트워크를 바탕으로 2차관... ",https://www.kukinews.com/article/view/kuk202602020195,https://www.kukinews.com/article/view/kuk202602020195,"Mon, 02 Feb 2026 14:44:00 +0900"
관료,"[이슈 IN] 안호영 의원, '전주·완주 통합' 승부수... 전북지사 판세 요...",눈길을 끈 건 지역 의원과 출신 정부 관료 등의 지원사격이다. 이날 기자회견장에는 정동영 통일부장관과 이성윤 최고위원 등이 동행해 이목을 집중시켰다. 현장엔 불참 했지만 김윤덕 국토교통부장관과 전북도... ,https://www.getnews.co.kr/news/articleView.html?idxno=859685,https://www.getnews.co.kr/news/articleView.html?idxno=859685,"Mon, 02 Feb 2026 14:44:00 +0900"
관료,"李대통령, 기재부 2차관 허장·아시아문화도시위원장 김원중",출범 이후 제도 정비와 정책 방향 설정이 핵심 과제로 꼽혀온 우주항공청에 정책·예산·조정 경험을 갖춘 정통 관료 출신이 수장으로 임명됐다는 점에서 의미가 크다는 평가다. 오 청장은 30년 넘게 과학기술 정책 분야에... ,http://www.seoulwire.com/news/articleView.html?idxno=704656,http://www.seoulwire.com/news/articleView.html?idxno=704656,"Mon, 02 Feb 2026 14:42:00 +0900"
관료,[프로필] 신임 우주항공청장에 오태석 한국과학기술기획평가원장,행정 관료”라며 이같이 밝혔다. 강 대변인은 “오 신임 청장은 과학정통부 제1차관 재임 시절 누리호 발사... 오 신임 원장은 과학기술 행정 분야를 두루 거친 정통 관료다. 전북 순창 출신으로 전주고를 졸업하고... ,https://biz.chosun.com/it-science/ict/2026/02/02/C5UVUX25TJHNLDXWIPYX2YS5ZU/?utm_source=naver&utm_medium=original&utm_campaign=biz,https://n.news.naver.com/mnews/article/366/0001139941?sid=105,"Mon, 02 Feb 2026 14:41:00 +0900"
관료,[프로필] 오태석 신임 우주청장…'누리호 총괄' 경험 갖춘 정통 과기 관...,행정 관료&quot;라며 &quot;(과기정통부) 1차관 재임 시절 누리호 발사 관리위원장으로 누리호 발사 과정을 성공적으로... 이 과정에서 내부적으로는 조직 관료 운영 경험을 갖춘 관리형 리더십이 필요하다는 요구가 이어졌고 정책... ,https://www.newsis.com/view/NISX20260202_0003499193,https://n.news.naver.com/mnews/article/003/0013743659?sid=105,"Mon, 02 Feb 2026 14:36:00 +0900"
관료,"李대통령, 재경부 2차관 허장·우주항공청장 오태석 임명(상보)",허 차관은 재정경제부 출신의 정통 경제 관료로서 국제통화기금(IMF) 상임이사와 기획재정부 국제경제관리관... 행정 관료이다. 과기정통부 제1차관 재임 시절 누리호 발사관리위원장으로 누리호 발사 과정을 성공적으로... ,http://www.edaily.co.kr/news/newspath.asp?newsid=03886806645346584,https://n.news.naver.com/mnews/article/018/0006211573?sid=100,"Mon, 02 Feb 2026 14:36:00 +0900"
관료,재경부 2차관에 허장…우주항공청장 오태석,"허 차관은 재경부 출신의 정통 경제관료로 기획재정부 개발금융국장, 국제경제관리관과 국제통과기금(IMF)... 과학기술처에 입직한 이래 30년간 과학기술 정책의 주요 분야를 두루 거친 정통 과학 기술 행정 관료입니다.",https://www.ichannela.com/news/main/news_detailPage.do?publishId=000000512746,https://n.news.naver.com/mnews/article/449/0000334089?sid=100,"Mon, 02 Feb 2026 14:35:00 +0900"
관료,우주항공청장에 오태석 KISTEP 원장 임명,"오 신임청장은 과거 과학기술정보통신부 제1차관을 역임한 바 있는 관료 출신으로, 누리호 발사 등을 총괄한 바 있다. 청와대는 2일 오후 우주항공청장에 오태석 KISTEP 원장을 임명했다고 밝혔다. 오 신임 청장은 서울대... ",https://www.sedaily.com/article/20003706?ref=naver,https://n.news.naver.com/mnews/article/011/0004585648?sid=105,"Mon, 02 Feb 2026 14:35:00 +0900"
관료,"李대통령, 재경부 2차관 허장·우주항공청장 오태석 인선",허장 재경부 2차관은 재경부 출신의 정통 경제 관료로서 국제통화기금(IMF)의 상임이사와 기획재정부... 행정 관료다. 강 대변인은 &quot;오 청장은 과학기술정보통신부 제1차관 재임 시절 누리호 발사관리위원장으로 누리호... ,https://www.newspim.com/news/view/20260202000797,https://www.newspim.com/news/view/20260202000797,"Mon, 02 Feb 2026 14:33:00 +0900"
관료,[N2정치포커스 : 익산시장 선거] 전북 익산시 집값이 묻는 질문…과열된...,"고위 관료 출신 인사들이 대거 거론되며 이력의 무게가 화제가 되지만, 선거가 과열될수록 지역사회 대화는 오히려 단순해진다. ■ “누가 더 화려한가”가 아니라 “누가 더 적합한가.” 더불어민주당 공천 경쟁에는... ",https://www.news2day.co.kr/article/20260202500143,https://www.news2day.co.kr/article/20260202500143,"Mon, 02 Feb 2026 14:32:00 +0900"
관료,"시진핑, ‘강한 위안화’ 촉구⋯기축통화 야심 노골화","시 주석이 2024년 고위 지방 관료들을 상대로 비공개로 이뤄졌던 연설의 일부가 이번에 처음으로 대중에... 앞서 판궁성 중국 인민은행 총재도 지난해 투자자, 규제 당국자, 상하이 지역 관료들을 대상으로 한 연설에서... ",https://www.etoday.co.kr/news/view/2552072,https://www.etoday.co.kr/news/view/2552072,"Mon, 02 Feb 2026 14:32:00 +0900"
관료,"李대통령, 재경부 2차관 허장·우주항공청장 오태석 선임",허 신임 차관은 국제통화기금(IMF) 상임이사와 기획재정부 국제경제관리관 및 개발금융국장 등을 거친 정통 관료 출신이다. 강 대변인은 &quot;풍부한 업무 경험과 네트워크를 토대로 국제경제를 총괄하는 2차관 업무를 수행할... ,https://www.yna.co.kr/view/AKR20260202110000001?input=1195m,https://n.news.naver.com/mnews/article/001/0015879938?sid=100,"Mon, 02 Feb 2026 14:32:00 +0900"
관료,"李대통령, 재경부 2차관 허장·우주항공청장 오태석 임명",강 대변인은 허장 2차관에 대해 &quot;재정경제부 출신의 정통 경제 관료로서 국제통화기금(IMF)의 상임이사와... 행정 관료&quot;라며 &quot;과기정통부 제1차관 재임 시절 누리호 발사 관리 위원장으로 누리호 발사 과정을 성공적으로... ,https://www.newsworks.co.kr/news/articleView.html?idxno=829558,https://www.newsworks.co.kr/news/articleView.html?idxno=829558,"Mon, 02 Feb 2026 14:32:00 +0900"
관료,"李 대통령, 재경부 2차관에 허장·우주항공청장 오태석 임명","허 차관은 재정경제부(옛 기획재정부) 출신의 정통 경제관료로, 국제통화기금(IMF) 상임이사와 기획재정부... 행정관료다. 과학정통부 제1차관 재임 시절 누리호 발사 관리 위원장으로 누리호 발사 과정을 성공적으로... ",https://news.tf.co.kr/read/ptoday/2288514.htm,https://n.news.naver.com/mnews/article/629/0000468472?sid=100,"Mon, 02 Feb 2026 14:30:00 +0900"
관료,새정부 사회적 대화…&quot;취약노동자·소상공인 포괄 국민참여형&quot;,"그런 차원에서 그는 &quot;경사노위가 실질적 사회적 대화의 플랫폼으로 기능하려면 중립성·독립성·전문성을 갖춰야 하며, 관료주의적 운영을 넘어 당사자 중심·사회적 신뢰 기반으로 운영체계를 강화해야 한다&quot;고 주장했다.... ",https://www.yna.co.kr/view/AKR20260202086700530?input=1195m,https://n.news.naver.com/mnews/article/001/0015879918?sid=102,"Mon, 02 Feb 2026 14:30:00 +0900"
관료,신임 우주항공청장에 오태석 한국과학기술기획평가원장,오 신임 청장은 행정고시로 과학기술처에 입직한 이래 30년간 과학기술 정책의 주요 분야를 두루 거친 정통 과학기술 행정 관료다. 강 대변인은 &quot;오 신임 청장에 대해 과학정통부 제1차관 재임 시절 누리호 발사 관리... ,https://news.mtn.co.kr/news-detail/2026020214280814613,https://news.mtn.co.kr/news-detail/2026020214280814613,"Mon, 02 Feb 2026 14:30:00 +0900"
관료,"李 대통령, 재경부 2차관 허장 임명 … 우주항공청장엔 오태석",강 대변인은 허 차관에 대해 &quot;재정경제부 출신의 정통 경제 관료로서 국제통화기금(IMF)의 상임이사와... 행정관료&quot;라며 &quot;과학기술 정책에 대한 전문성을 바탕으로 대한민국을 우주항공 강국으로 이끌어 갈 것&quot;이라고... ,https://www.newdaily.co.kr/site/data/html/2026/02/02/2026020200300.html,https://www.newdaily.co.kr/site/data/html/2026/02/02/2026020200300.html,"Mon, 02 Feb 2026 14:30:00 +0900"
관료,[프로필] 오태석 우주항공청장…정통 과기행정 관료,우주항공청장으로 2일 선임된 오태석 한국과학기술기획평가원(KISTEP) 원장(58)은 과학기술 행정 요직을 두루 거친 정통 관료다. 그는 전북 순창 출신으로 전주고를 졸업해 서울대 경제학과에서 학사 학위를 받았다.... ,https://www.yna.co.kr/view/AKR20260202109400017?input=1195m,https://n.news.naver.com/mnews/article/001/0015879931?sid=105,"Mon, 02 Feb 2026 14:30:00 +0900"
관료,재경부 2차관에 허장 수은 ESG 위원장,"강유정 대변인은 이날 브리핑을 통해 “경제 전통 관료로 국제통화기금 상임이사와 기획재정부 국제경제관리관을 거친 국제 금융 및 대외 경제 정책 전문가”라며 “수출, 환율을 안정적으로 관리하고, 우리 경제를... ",https://www.donga.com/news/Politics/article/all/20260202/133280442/1,https://n.news.naver.com/mnews/article/020/0003694279?sid=100,"Mon, 02 Feb 2026 14:30:00 +0900"
관료,"이 대통령, 재경부 2차관 허장·우주항공청장 오태석 발탁","허 차관은 재경부 출신의 정통 경제관료로 기획재정부 개발금융국장, 국제경제관리관과 국제통과기금(IMF)... 행정 관료다. 강 대변인은 &quot;과기부 1차관 시절 누리호 발사 과정을 성공적으로 이끌었고, 우주항공기술산업... ",https://www.newsis.com/view/NISX20260202_0003499164,https://n.news.naver.com/mnews/article/003/0013743608?sid=100,"Mon, 02 Feb 2026 14:28:00 +0900"
관료,"李대통령, 재경부 2차관에 허장·우주항공청장에 오태석 임명",강유정 청와대 대변인은 춘추관 브리핑을 통해 &quot;허 차관은 재정경제부 출신의 정통 경제 관료로... 강 대변인은 오 청장에 대해 &quot;30년간 과학기술 정책의 주요 분야를 두루 거친 정통 행정 관료&quot;라며 &quot;과기부 1차관 재임시절... ,https://view.asiae.co.kr/article/2026020214270014986,https://n.news.naver.com/mnews/article/277/0005715518?sid=100,"Mon, 02 Feb 2026 14:27:00 +0900"
관료,[프로필] 허장 재경부 2차관…IMF 이사 역임한 국제경제 전문가,"경제 관료다. 허 신임 차관은 1964년생으로 영등포고, 서울대 경제학과를 졸업하고 행정고시 35회로 공직에... 겸비한 관료로 평가를 받았다. 또 특유의 친화력을 바탕으로 직원들의 의견을 경청하는 합리적 리더십의... ",https://news.einfomax.co.kr/news/articleView.html?idxno=4396751,https://news.einfomax.co.kr/news/articleView.html?idxno=4396751,"Mon, 02 Feb 2026 14:26:00 +0900"
관료,[프로필]재경부 2차관에 허장…국제금융 요직 거친 '국제경제통',재정경제부 2차관으로 임명된 허장 전 국제통화기금(IMF) 상임이사는 국제금융 분야의 요직을 거친 정통 관료 출신이다. 서울대 경제학과를 졸업하고 행정고시 35회로 공직에 입문한 허 차관은 재정경제부의 전신... ,https://www.mt.co.kr/economy/2026/02/02/2026020214173667271,https://n.news.naver.com/mnews/article/008/0005312738?sid=101,"Mon, 02 Feb 2026 14:26:00 +0900"
관료,"李대통령, 재경부 2차관에 허장…우주항공청장 오태석 임명(종합)",허 신임 재경부 2차관은 정통 경제 관료로 국제통화기금(IMF) 상임이사와 기획재정부(재경부 및 기획예산처... 행정 관료다. 과학기술정보통신부 1차관 재임 시절 누리호 발사관리위원장으로 누리호 발사 과정을 성공적으로... ,https://www.news1.kr/politics/president/6059051,https://n.news.naver.com/mnews/article/421/0008748391?sid=100,"Mon, 02 Feb 2026 14:26:00 +0900"
관료,"李 대통령, 재경부 2차관 허장·우주청장 오태석 임명",강유정 청와대 대변인은 이날 브리핑에서 “허장 차관은 재정경제부 출신의 정통 경제관료로 국제통화기금... 행정관료”라며 “과기정통부 제1차관 시절 누리호 발사 관리 위원장으로 누리호 발사과정 성공적으로... ,https://www.sedaily.com/article/20003692?ref=naver,https://n.news.naver.com/mnews/article/011/0004585639?sid=100,"Mon, 02 Feb 2026 14:25:00 +0900"
