Keyword,Title,Description,Original Link,Link,Publication Date
관가,[News Views] 시장 권한대행 체제 ‘대구시’가 TK통합 재추진에 적극 나...,"영남일보DB 이를 두고 지역 정치권과 관가에선 다양한 해석이 나온다. 일단 대구시에 단체장이 없어서... 예상 깨고 대구시, 속도감 있게 ‘통합’ 추진…행정력 집중 정치권·관가 “오히려 정치적 갈등 줄어 빠른 진행”",https://www.yeongnam.com/web/view.php?key=20260122021422103,https://www.yeongnam.com/web/view.php?key=20260122021422103,"Thu, 22 Jan 2026 18:40:00 +0900"
관가,최경환 &quot;저성장 덫 걸린 경제…과감한 구조개혁 필요&quot;,정치권과 관가를 두루 경험한 최 전 부총리가 최근 저서 &lt;박근혜 정부의 경제 정책(초이노믹스)&gt;을 출간한 것도 이 때문이다. 그는 박근혜 정부가 노동·교육·금융·공공 등 4대 개혁을 통해 한국 경제의 체질 개선을... ,https://www.hankyung.com/article/2026012272571,https://n.news.naver.com/mnews/article/015/0005240988?sid=100,"Thu, 22 Jan 2026 18:05:00 +0900"
관가,"국토부 산하기관 인사 개입 논란에…인국공 '인정', 코레일 '부정'",[사진=국토교통부] 22일 관가에 따르면 국토부는 최근 해명자료를 통해 이학재 인천국제공항공사 사장의 공개 발언을 통해 불거진 인사 개입 의혹에 선을 그었다. 이 사장은 지난 20일 국회 소통관 기자회견을 열고... ,https://www.newspim.com/news/view/20260122001153,https://www.newspim.com/news/view/20260122001153,"Thu, 22 Jan 2026 18:00:00 +0900"
관가,최인호 전 민주당 의원 … HUG 사장 사실상 선임,22일 관가와 업계에 따르면 HUG는 이날 오전 11시 부산 남구 본사에서 '2026년도 제1회 임시주주총회'를 열어 복수의 사장 후보 가운데 최 전 의원을 최종 후보로 선임하는 안건을 의결했다. 주총에서 사장 후보자가... ,https://www.mk.co.kr/article/11940451,https://n.news.naver.com/mnews/article/009/0005625905?sid=101,"Thu, 22 Jan 2026 17:35:00 +0900"
관가,"문체부, 애니메이션사업 겨냥 특별조사 '후폭풍'…순천시, '사법 리스크...",지역 관가 주변에선 문체부의 특별조사 결과와 사업변경계획 불승인 조치 등을 고려할 때 국가정원 습지센터 내에 여수MBC 스튜디오를 국고로 신축하는 것을 포함한 애니메이션 클러스터 조성사업 전반에 대한 전면적인... ,https://www.sisajournal.com/news/articleView.html?idxno=360347,https://n.news.naver.com/mnews/article/586/0000120770?sid=102,"Thu, 22 Jan 2026 17:22:00 +0900"
관가,[관가포커스] 기재부 노조위원장 일방적 기획처 발령 실수인가 고의인가,세종 관가에서는 또 다른 얘기도 나돈다. 노조가 베스트와 워스트 간부를 선정하는 과정에서 민혜수 위원장과... 재경부가 이를 어떻게 해결할지 세종관가의 눈과 귀가 집중되고 있다. 김성곤 선임기자,https://www.public25.com/news/articleView.html?idxno=38058,https://www.public25.com/news/articleView.html?idxno=38058,"Thu, 22 Jan 2026 17:16:00 +0900"
관가,HUG 신임 사장 최종 후보에 최인호 전 의원,"22일 관가와 업계에 따르면, 이날 오전 부산 남구 HUG 본사에서 열린 임시 주주총회에서 복수의 사장 후보 가운데 최 전 의원을 최종 후보로 선임하는 안건이 의결됐다. 이에 따라 국토교통부 김윤덕 장관이 이재명... ",https://www.nocutnews.co.kr/news/6460602?utm_source=naver&utm_medium=article&utm_campaign=20260122050213,https://n.news.naver.com/mnews/article/079/0004108081?sid=102,"Thu, 22 Jan 2026 17:03:00 +0900"
관가,전직 국회의원이 HUG 사장?… 최종 후보 선정에 업계 우려,22일 관가와 업계에 따르면 이날 오전 부산 남구 HUG 본사에서 열린 임시 주주총회에서 복수의 후보 가운데 최 전 의원을 사장 최종 후보로 선임하는 안건이 의결됐다. 김윤덕 국토교통부 장관이 이재명 대통령에게 임명을... ,https://www.dt.co.kr/article/12042320?ref=naver,https://n.news.naver.com/mnews/article/029/0003006544?sid=101,"Thu, 22 Jan 2026 16:27:00 +0900"
관가,HUG 신임 사장 최종 후보에 민주당 최인호 전 의원,22일 관가와 업계에 따르면 이날 오전 11시 부산 남구 HUG 본사에서 열린 HUG 임시 주주총회에서 복수의 사장 후보 가운데 최 전 의원을 최종 후보로 선임하는 안건이 의결됐다. 이에 따라 소관 부처인 국토교통부... ,https://www.viva100.com/article/20260122501255,https://www.viva100.com/article/20260122501255,"Thu, 22 Jan 2026 16:16:00 +0900"
관가,공공기관 이전·5극3특 전환 본격화…균형발전 시험대,22일 관가에 따르면 국토교통부는 최근 업무보고를 통해 오는 2027년 2차 공공기관 이전을 즉시 시작할 수 있도록 구체적인 방안을 마련하겠다는 계획을 공식화했다. 국토부는 지방 활성화를 위해 350개의 공공기관을... ,http://www.m-i.kr/news/articleView.html?idxno=1328639,http://www.m-i.kr/news/articleView.html?idxno=1328639,"Thu, 22 Jan 2026 16:08:00 +0900"
관가,주택도시보증공사 신임 사장 최종 후보에 최인호 전 의원,22일 관가와 업계에 따르면 이날 오전 11시 부산 남구 HUG 본사에서 열린 임시 주주총회에서 복수의 사장 후보 가운데 최 전 의원을 최종 후보로 선임하는 안건이 의결됐다. 이에 따라 소관 부처인 국토교통부 장관이... ,https://daily.hankooki.com/news/articleView.html?idxno=1325988,https://daily.hankooki.com/news/articleView.html?idxno=1325988,"Thu, 22 Jan 2026 16:02:00 +0900"
관가,국토부 산하기관장 인선 속도 내는데…LH는 공백 장기화,(사진=연합뉴스) 22일 관가·업계에 따르면 HUG는 이날 임시 주주총회를 열고 신임 사장 후보로 최인호 전... 한 관가 관계자는 “3~4월에는 LH 사장 인선이 마무리될 가능성이 있지만 임추위 재구성 등 넘어야 할 절차가... ,http://www.edaily.co.kr/news/newspath.asp?newsid=04116406645320344,https://n.news.naver.com/mnews/article/018/0006205528?sid=101,"Thu, 22 Jan 2026 15:55:00 +0900"
관가,HUG 신임 사장 최종 후보에 최인호 전 민주당 의원,"22일 관가에 따르면 HUG는 이날 오전 11시 부산 남구 HUG 본사에서 임시 주주총회를 열고, 여러 사장 후보 가운데 최 전 의원을 최종 후보로 선임하는 안건을 의결했다. HUG의 최대주주는 국토교통부로, 지분 89.2%를 보유... ",https://www.ebn.co.kr/news/articleView.html?idxno=1696387,https://www.ebn.co.kr/news/articleView.html?idxno=1696387,"Thu, 22 Jan 2026 15:50:00 +0900"
관가,"HUG, 신임사장 최종후보에 최인호 전 민주당 의원",22일 관가에 따르면 HUG는 이날 오전 11시 부산 남구 본사에서 임시 주주총회를 열고 복수의 사장 후보 가운데 최 전 의원을 최종후보로 의결했다. 절차에 따라 소관부처인 국토교통부가 김윤덕 장관 명의로 이재명... ,https://biz.newdaily.co.kr/site/data/html/2026/01/22/2026012200342.html,https://biz.newdaily.co.kr/site/data/html/2026/01/22/2026012200342.html,"Thu, 22 Jan 2026 15:30:00 +0900"
관가,(약수터) 허송세월Ⅲ-광주·전남 행정통합에 부쳐,당시 광주·전남 관가에서는 '허송세월'이란 말이 화자되고 있었다. 광주시가 전남도에서 행정 분리된 후 송모 광주시장과 허모 전남지사의 상생과 협력이 '동상이몽'으로 정책간 엇박자를 낸 것을 두고 지역 언론들이... ,http://www.mdilbo.com/detail/WYXZ2h/752457,http://www.mdilbo.com/detail/WYXZ2h/752457,"Thu, 22 Jan 2026 15:18:00 +0900"
관가,HUG 사장 최종후보에 최인호 전 의원…국토위 경험 주목,22일 관가와 업계에 따르면 이날 오전 HUG가 부산 본사에서 임시 주주총회를 열고 최 전 의원을 사장 최종 후보로 선임하는 안건을 의결했다. 향후 국토교통부 장관이 대통령에게 임명을 제청하고 대통령 재가가 이뤄지면... ,https://www.tfmedia.co.kr/news/article.html?no=200602,https://www.tfmedia.co.kr/news/article.html?no=200602,"Thu, 22 Jan 2026 15:08:00 +0900"
관가,"[세계를 홀린 BTS] 넥슨·CJ 이어 하이브… 총리, 'K-컬처 벨트' 마지막...","무엇보다 관가와 업계의 시선이 쏠리는 대목은 방문의 ‘시점’이다. 김 총리의 방문이 방탄소년단(BTS)의 3월 완전체 컴백, 그리고 광화문 공연 프로젝트가 가시화된 시점과 절묘하게 맞물리기 때문이다. 정부가 이들의... ",https://www.ajunews.com/view/20260122105501312,https://www.ajunews.com/view/20260122105501312,"Thu, 22 Jan 2026 15:02:00 +0900"
관가,반년 공백 끝 HUG 새 수장에 최인호 전 의원 ‘사장 선임 의결’,"22일 관가와 업계에 따르면 HUG는 이날 오전 11시 부산 남구 HUG 본사에서 임시 주주총회(2026년도 제1회)를 열고, 복수 후보 가운데 최 전 의원을 신임 사장으로 선임하는 안건을 의결했다. 이에 따라 향후 국토교통부... ",https://m.skyedaily.com/news_view.html?ID=296322,https://m.skyedaily.com/news_view.html?ID=296322,"Thu, 22 Jan 2026 14:58:00 +0900"
관가,HUG 신임 사장에 최인호 전 민주당 의원…임시주총서 선임,최인호 전 의원 2023.10.18 pangbin@newspim.com 22일 관가에 따르면 HUG는 부산 남구 본사에서 '2026년도 제1회 임시주주총회'를 열고 복수의 사장 후보 가운데 최 전 의원을 사장으로 선임하는 안건을 의결했다. 소관 부처인... ,https://www.newspim.com/news/view/20260122000743,https://www.newspim.com/news/view/20260122000743,"Thu, 22 Jan 2026 14:55:00 +0900"
관료,두바이식 초고층빌딩과 해변리조트…트럼프 '뉴 가자' 구상 공개,이 계획은 팔레스타인 기술 관료들로 구성된 '가자 행정국가위원회'(NCAG)가 행정을 맡고 하마스의 무장... 미국의 지지를 받는 팔레스타인 관료 출신인 NCAG 수장 알리 샤스는 같은 날 다보스포럼 화상 연설에서 &quot;라파... ,https://www.news1.kr/world/middleeast-africa/6049298,https://n.news.naver.com/mnews/article/421/0008731744?sid=104,"Fri, 23 Jan 2026 16:40:00 +0900"
관료,세계 스트롱맨 ‘총집합’ 트럼프 평화위…“악당 전시장이냐”,블룸버그는 “한 유럽국가 정부 관료는 평화위원회가 ‘악당들 전시장'(gallery of rogues)이 될 것이라는 우려가 있다”고 보도했다. 트럼프 대통령은 참석 규모가 크지 않은 점은 개의치 않는 듯 “오랜 시간 준비된 매우... ,https://www.hani.co.kr/arti/international/america/1241377.html,https://n.news.naver.com/mnews/article/028/0002788059?sid=104,"Fri, 23 Jan 2026 16:34:00 +0900"
관료,"조홍철 국민의힘 대구시당 부위원장, 달서구청장 출마 선언","그는 “관료 출신의 안정성보다 막힌 곳을 뚫어내는 정치적 돌파력이 지금의 달서에 절실하다”며 “정치적 계산으로 나오려는 하향 지원자가 아닌, 달서의 미래를 책임질 준비된 후보”임을 분명히 했다. 이날 조... ",https://www.cnbnews.com/news/article.html?no=774848,https://www.cnbnews.com/news/article.html?no=774848,"Fri, 23 Jan 2026 16:10:00 +0900"
관료,[현장] 장민영 기업은행장 첫 출근...노조와 눈싸움만 하고 발 돌려,"다만 이에 대해 노조는 &quot;장 신임 은행장이 가진 경력의 대부분이 기업은행에만 국한된 관리형 행장 후보로, 지도자보다는 관료에 가깝다&quot;며 &quot;19일 이재명 대통령이 업무보고에서 지적한 '총액인건비제 모순'을 해결해 줄... ",https://www.financialpost.co.kr/news/articleView.html?idxno=245272,https://www.financialpost.co.kr/news/articleView.html?idxno=245272,"Fri, 23 Jan 2026 16:08:00 +0900"
관료,머스크가 꺼낸 '고독한 인류'의 생존 전략,머스크는 DOGE를 &quot;관료주의의 전기톱(chainsaw of bureaucracy)&quot;이라고 부르며 연방 지출 2조 달러 삭감을 공언했다. 하지만 실제로는 인원 감축과 계약 취소를 통해 약 1500억 달러를 줄이는 데 그쳤다. 연방 공무원들은... ,https://www.fortunekorea.co.kr/news/articleView.html?idxno=51442,https://www.fortunekorea.co.kr/news/articleView.html?idxno=51442,"Fri, 23 Jan 2026 16:06:00 +0900"
관료,"&quot;'베트남 서열 1위' 또럼 서기장, 5년 연임 확정&quot;","그는 집권한 지난 1년여 동안 관료주의를 타파하기 위한 정부 구조조정을 단행했다. 이를 통해 중앙 정부 부처·기관을 기존 30개에서 22개로, 광역 지방 행정구역을 기존 63개에서 34개로 각각 통폐합했고 약 15만개... ",https://view.asiae.co.kr/article/2026012316012790928,https://n.news.naver.com/mnews/article/277/0005711193?sid=104,"Fri, 23 Jan 2026 16:06:00 +0900"
관료,"베트남 권력서열 1위 또럼 공산당 서기장, 연임 확정(1보)",지난 2024년 7월 응우옌 푸 쫑 서기장 별세 후 같은 해 8월 당 지도자에 오른 또럼 서기장은 관료제 축소와 부패 척결을 통한 경제 성장 촉진을 목표로 하는 개혁을 추진해왔는데 찬사와 비판을 동시에 받아왔다.,https://www.news1.kr/world/asia-australia/6049228,https://n.news.naver.com/mnews/article/421/0008731656?sid=104,"Fri, 23 Jan 2026 16:03:00 +0900"
관료,"트럼프, 평화위원회에 캐나다 초대했다가 철회…총리 연설 때문?",트럼프 대통령은 이날 스위스 다보스포럼 행사장에서 각국 정상과 관료들을 초청해 평화위원회 헌장 서명식을 열었습니다. 트럼프 대통령은 59개국이 서명했다고 말했지만 각국 발표와 외신 보도를 종합하면 참여 의사를... ,https://news.sbs.co.kr/news/endPage.do?news_id=N1008415965&plink=ORI&cooper=NAVER,https://n.news.naver.com/mnews/article/055/0001326944?sid=104,"Fri, 23 Jan 2026 15:52:00 +0900"
관료,베트남 '1인자' 또 럼 서기장 연임 확정…5년 임기 수행(종합),"그는 집권한 지난 1년여 동안 경제 성장을 가로막는 관료주의를 타파하고 신속한 의사 결정 구조를 구축하겠다면서 대대적인 정부 구조조정을 단행했다. 이를 통해 중앙 정부 부처·기관을 기존 30개에서 22개로, 광역... ",https://www.yna.co.kr/view/AKR20260123113452084?input=1195m,https://n.news.naver.com/mnews/article/001/0015864202?sid=104,"Fri, 23 Jan 2026 15:51:00 +0900"
관료,"반부패 저승사자에서 행정 혁명가로...또럼 서기장, 향후 5년간 베트남...",이는 단순히 비용 절감을 넘어 민간 기업들이 겪던 고질적인 관료주의 장벽을 허무는 결정적인 계기가 되면서 베트남의 투자 환경을 획기적으로 개선시켰다는 평가를 받는다. 또 럼 서기장은 취임 초기부터 강조해... ,http://www.fnnews.com/news/202601221132169452,https://n.news.naver.com/mnews/article/014/0005467428?sid=104,"Fri, 23 Jan 2026 15:42:00 +0900"
관료,이상희 '우리 꽃문화 답사기',"경북 성주에서 태어나 고려대학 법학과를 졸업하고 고등고시 행정과에 합격, 진주시장·산림청장·대구직할시장·경북지사·내무부장관·한국토지개발공사사장·건설부장관 등 행정 관료를 지내고 &lt;꽃으로 보는 한국문화... ",https://www.ohmynews.com/NWS_Web/View/at_pg.aspx?CNTN_CD=A0003201068&CMPT_CD=P0010&utm_source=naver&utm_medium=newsearch&utm_campaign=naver_news,https://n.news.naver.com/mnews/article/047/0002502485?sid=103,"Fri, 23 Jan 2026 15:36:00 +0900"
관료,"트럼프, 미국 비판한 캐나다 평화위원회 초대 철회",트럼프 대통령은 이날 스위스 다보스포럼 행사장에서 각국 정상과 관료들을 초청해 평화위원회 헌장 서명식을 열었습니다. 트럼프 대통령은 59개국이 서명했다고 말했으나 각국 발표와 외신 보도를 종합하면 참여 의사를... ,https://news.kbs.co.kr/news/pc/view/view.do?ncd=8467394&ref=A,https://n.news.naver.com/mnews/article/056/0012111277?sid=104,"Fri, 23 Jan 2026 15:36:00 +0900"
관료,기업은행 새 행장에 내부 출신 장민영…첫날부터 '노사 정면대치',"노조는 22일 성명서를 통해 “장민영 내정자는 경력 대부분이 기업은행에 한정된 관리형 행장 후보로, 지도자가 아닌 관료에 가깝다. 대통령을 설득하고 금융위와 맞서며 국회를 설득할 역량이 보이지 않는다”며... ",https://www.bizhankook.com/bk/article/31285,https://www.bizhankook.com/bk/article/31285,"Fri, 23 Jan 2026 15:34:00 +0900"
관료,"트럼프, 미국 비판한 캐나다에 평화위원회 초대 철회",트럼프 대통령은 이날 스위스 다보스포럼 행사장에서 각국 정상과 관료들을 초청해 평화위원회 헌장 서명식을 열었다. 트럼프 대통령은 59개국이 서명했다고 말했으나 각국 발표와 외신 보도를 종합하면 참여 의사를... ,https://www.yna.co.kr/view/AKR20260123112000009?input=1195m,https://n.news.naver.com/mnews/article/001/0015864088?sid=104,"Fri, 23 Jan 2026 15:31:00 +0900"
관료,李정부 금융公기관장 인사 키워드는 '내부 출신·정치권 낙하산',"인사에서 관료 출신이 한 명도 포함되지 않은 것으로 나타났다. 반면 기관 내부 출신과 대통령 측근, 정치권 인사들이 기관장 자리를 모두 차지했다. 금융위원회, 재정경제부(옛 기획재정부) 출신 고위 관료가 기관장으로... ",https://www.hankyung.com/article/202601238845i,https://n.news.naver.com/mnews/article/015/0005241336?sid=101,"Fri, 23 Jan 2026 15:24:00 +0900"
관료,"미, WHO 탈퇴…“국제사회 질병 대응 난항 우려”","이어 “WHO는 미국이 창립 멤버이자 최대 재정 기여국임에도, 미국의 이익에 적대적인 국가들이 주도하며 관료주의적 의제를 추진해 왔다”고 주장했습니다. 트럼프 행정부는 또 WHO가 코로나19 팬데믹 초기 공중보건... ",https://news.knn.co.kr/news/article_sns/871,https://news.knn.co.kr/news/article_sns/871,"Fri, 23 Jan 2026 15:24:00 +0900"
관료,기업은행 노사 갈등 고조…행장 첫 출근 무산,"금융위 행보에 기업은행 노조는 &quot;(장 행장의) 경력 대부분이 기업은행에만 국한된 관리형 행장 후보로 지도자라기 보다 관료에 가깝다&quot;라며 &quot;현재 기업은행이 직면한 초유의 위기를 극복할 능력, 즉 대통령을 설득하고... ",https://www.ebn.co.kr/news/articleView.html?idxno=1696556,https://www.ebn.co.kr/news/articleView.html?idxno=1696556,"Fri, 23 Jan 2026 15:20:00 +0900"
관료,[오전 주요 국제금융뉴스](23일),"▲아마존, 또다시 수천 명 감원…사무직 대상 - 아마존닷컴은 관료주의를 줄이고 조직을 효율화하기 위해 수천 명 규모의 추가 감원을 준비하는 것으로 알려졌다. 22일(미국 현지시각) 주요 외신에 따르면... ",https://news.einfomax.co.kr/news/articleView.html?idxno=4395077,https://news.einfomax.co.kr/news/articleView.html?idxno=4395077,"Fri, 23 Jan 2026 15:16:00 +0900"
관료,한화오션이 캐나다 고위 관료를 거제 장영실함으로 '모셨다' : 잠수함 1...,캐나다 초계 잠수함 프로젝트(CPSP) 입찰을 앞두고 캐나다 최대 주인 온타리오주 경제개발부 장관이 한화오션의 거제사업장을 찾았다. 한화오션은 잠수함 수주를 위한 기술력을 소개하는 한편 중장기 산업협력 방안을... ,https://www.huffingtonpost.kr/news/articleView.html?idxno=241883,https://www.huffingtonpost.kr/news/articleView.html?idxno=241883,"Fri, 23 Jan 2026 15:12:00 +0900"
관료,대통령 사인받아 오라며 행장 출근 저지한 노조,"과거 관료 출신 은행장 인사에 반발해 출근을 막았던 IBK기업은행 노동조합이 내부 출신인 장민영 기업은행장을 상대로도 출근 저지를 하고 있어 논란이다. 총액인건비제도로 수당 등 임금을 받지 못했으니, 은행장에게... ",http://www.inews24.com/view/1931147,https://n.news.naver.com/mnews/article/031/0000999559?sid=101,"Fri, 23 Jan 2026 15:11:00 +0900"
관료,"[김구철의 쾌도난마] 코스피 5,000시대 한국 경제, 이대로 좋은가?",누구나 매뉴얼대로 움직여도 승리할 수 있는 조직력이 중요하다.&quot; 이에야스는 전쟁뿐 아니라 통치도 법도와 관료제에 의해 돌아가도록 설계했다. 결과 그 자손은 평범했어도 도쿠가와 막부는 260년 존속할 수 있었다.... ,https://www.pennmike.com/news/articleView.html?idxno=114132,https://www.pennmike.com/news/articleView.html?idxno=114132,"Fri, 23 Jan 2026 15:08:00 +0900"
관료,"미국, 78년 만에 WHO 탈퇴...'세계 공중보건' 빨간불",두 장관은 &quot;WHO는 미국이 창립 멤버이자 가장 큰 재정적 기부자인데도 미국의 이익에 적대적인 국가들이 주도하는 정치적이며 관료주의 의제를 추진했다&quot;고 주장했다. 트럼프 행정부는 WHO가 코로나19 초기... ,https://www.hankookilbo.com/News/Read/A2026012309460005558?did=NA,https://n.news.naver.com/mnews/article/469/0000910629?sid=104,"Fri, 23 Jan 2026 15:01:00 +0900"
관료,과학에 만능열쇠는 없다[김우재의 플라이룸](70),관료들은 과학을 거대한 자판기처럼 생각해서 예산이라는 동전을 넣으면 노벨상이나 혁신 기술이라는... 혁신은 관료들이 책상머리에서 기획한 전략기술 로드맵이 아니라 실패를 두려워하지 않는 다양한 ‘보통... ,https://weekly.khan.co.kr/article/202601231459011,https://n.news.naver.com/mnews/article/033/0000050183?sid=103,"Fri, 23 Jan 2026 14:59:00 +0900"
관료,"트럼프의 제국주의, 성공할 수 있을까[서중해의 경제망원경](57)","런던의 금융가, 귀족층, 고위 군 장교 및 관료들은 제국이라는 거대 시장을 통해 안전한 투자처를 확보하고 고소득 일자리를 가졌다. 그러면 누가 피해자였을까. 일반 납세자들이었다. 이들은 자신들에게는 직접적인... ",https://weekly.khan.co.kr/article/202601231458011,https://n.news.naver.com/mnews/article/033/0000050182?sid=101,"Fri, 23 Jan 2026 14:59:00 +0900"
관료,"트럼프 지시 1년만에…美, WHO 공식 '탈퇴'",이들은 WHO가 본래의 공중보건 임무보다 정치적·관료적 활동에 치우치며 미국의 이익에 반하는 방향으로 운영돼 왔다고 주장했다. 트럼프 행정부는 특히 코로나19 팬데믹 초기 대응을 문제 삼았다. WHO가... ,http://www.wowtv.co.kr/NewsCenter/News/Read?articleId=A202601230408&t=NN,https://n.news.naver.com/mnews/article/215/0001239007?sid=104,"Fri, 23 Jan 2026 14:48:00 +0900"
관료,"트럼프 행정부, WHO 탈퇴 완료…회비 3800억 원 미납",두 장관은 &quot;WHO는 미국이 창립 멤버이자 가장 큰 재정적 기부자인데도 미국의 이익에 적대적인 국가들이 주도하는 정치적이며 관료주의 의제를 추진했다&quot;고도 했다. 트럼프 행정부는 WHO가 코로나19 팬데믹 초기... ,https://news.tvchosun.com/site/data/html_dir/2026/01/23/2026012390151.html,https://n.news.naver.com/mnews/article/448/0000585727?sid=104,"Fri, 23 Jan 2026 14:45:00 +0900"
관료,낙하산 아니어도 문제?… 신임 행장 가로막은 기업은행 노조,"실제로 기업은행 노조는 과거 관료 출신, 이른바 '낙하산 인사'를 저지하기 위해 시위를 진행했다. 지난 2020년 관 출신 행장 반대로 27일간 출근 저지 투쟁을 진행한 바 있다. 이와는 달리 3년 전 김성태 전 행장 취임... ",https://it.chosun.com/news/articleView.html?idxno=2023092155519,https://it.chosun.com/news/articleView.html?idxno=2023092155519,"Fri, 23 Jan 2026 14:44:00 +0900"
관료,"트럼프, 가자지구 재건 계획 발표…지중해 호화 휴양지화","가자지구 재건을 목표로 트럼프 대통령이 제안한 평화위원회가 출범했으며, 가자지구 운영을 맡을 팔레스타인 기술관료 위원회도 가시화됐다. 하지만 현재로서는 가자지구를 누가 어떻게 통치할지에 대한 불확실성이 큰... ",https://www.sisajournal.com/news/articleView.html?idxno=360584,https://n.news.naver.com/mnews/article/586/0000120850?sid=104,"Fri, 23 Jan 2026 14:42:00 +0900"
관료,'사실무근'이라는데…KAI 민영화설이 계속되는 이유,"초대 대표이사를 맡았던 임인택 전 사장은 상공부와 교통부를 거친 관료 출신으로, KAI 재임 이후 건설교통부 장관으로 자리를 옮겼다. 뒤를 이은 2대 길형보 전 사장은 군 출신 인사였으며, 3대 정해주 전 사장 역시... ",https://www.ntoday.co.kr/news/articleView.html?idxno=124487,https://www.ntoday.co.kr/news/articleView.html?idxno=124487,"Fri, 23 Jan 2026 14:36:00 +0900"
관료,"美, 마침내 WHO 탈퇴…회비 3800억원 미납",두 장관은 &quot;WHO는 미국이 창립 멤버이자 가장 큰 재정적 기부자인데도 미국의 이익에 적대적인 국가들이 주도하는 정치적이며 관료주의 의제를 추진했다&quot;고 주장했다. 트럼프 행정부는 WHO가 코로나19 팬데믹(세계적... ,https://view.asiae.co.kr/article/2026012314212333240,https://n.news.naver.com/mnews/article/277/0005711140?sid=104,"Fri, 23 Jan 2026 14:34:00 +0900"
