Keyword,Title,Description,Original Link,Link,Publication Date
산업은행,&quot;원화 기반 스테이블코인 실익 있을까&quot;...테더·서클 회동 나선 금융권,지급준비율을 초과하는 돈을 대출할 수 있는 은행과 달리 산업체의 지배력을 제한할 필요가 없다는 것이다. 윤 교수는 &quot;스테이블코인은 안정성이 자본금이 아닌 준비자산으로 확보되기 때문에 발행인 자본금 하한선이... ,http://www.fnnews.com/news/202508201546394771,https://n.news.naver.com/mnews/article/014/0005394786?sid=101,"Thu, 21 Aug 2025 14:57:00 +0900"
산업은행,"정책금융기관, 숫자에 갇힌 사회적 책임…실효성 의문","그러나 대부분 기관은 남성 육아휴직 사용률이 30% 미만이었고, 한국산업은행(9.7%), 무보(8.3%), 기업은행(3.7%) 등은 10%에도 미치지 못했습니다. KIND는 남성 육아휴직을 사용한 남성이 없었으나, 배우자 출산휴가는... ",http://www.newstomato.com/ReadNews.aspx?no=1272311&inflow=N,http://www.newstomato.com/ReadNews.aspx?no=1272311&inflow=N,"Thu, 21 Aug 2025 14:44:00 +0900"
산업은행,"정부, '공급망 금융' 50조원 대규모 지원한다…업-미들-다운스트림 '맞...","정부가 투입하는 50조원 규모 지원은 공급망안정화기금 10조원, 수출입은행 13조3000억원, 산업은행 18조원, 기업은행 4조5000억원 등 총 45조8000억원의 정책자금과 신용보증기금·기술보증기금을 통한 4조4000억원의 보증... ",https://www.greened.kr/news/articleView.html?idxno=330151,https://www.greened.kr/news/articleView.html?idxno=330151,"Thu, 21 Aug 2025 14:31:00 +0900"
산업은행,권대영 “보따리부터 내놓으라는 격… 석화업계 인식 안일” 일침,"간담회에는 KB국민·신한·하나·우리·NH농협은행 등 5대 시중은행을 비롯해 산업은행과 IBK기업은행, 수출입은행 등이 참석했다. 권 부위원장은 “어제 산업부 방안이 발표됐고, 1년간 지지부진했던 논의를 어제... ",https://biz.chosun.com/stock/finance/2025/08/21/RWLLETE62FHJ3FPZNYVOYC4CVQ/?utm_source=naver&utm_medium=original&utm_campaign=biz,https://n.news.naver.com/mnews/article/366/0001101942?sid=101,"Thu, 21 Aug 2025 14:27:00 +0900"
산업은행,GGM 대출금 조기 상환… 노사 갈등과 채권단 진실공방 확산,"산업은행은 보도자료를 통해 &quot;GGM의 자발적인 상환 문의에 대한 정보를 제공했으며, 공식적으로 조기 상환을 요구한 적이 없다&quot;고 반박했다. 또한, 광주은행 역시 노사 갈등과 조기 상환은 무관하다는 입장을 밝혔다.... ",https://www.gokorea.kr/news/articleView.html?idxno=836646,https://www.gokorea.kr/news/articleView.html?idxno=836646,"Thu, 21 Aug 2025 14:26:00 +0900"
산업은행,"사모펀드, 보험사 인수 기피 심화",이러한 '보험사 패싱' 기조는 최근 한국산업은행 자회사 KDB생명의 2개 분기 연속 자본잠식 소식이 알려진 이후 더욱 굳혀진 것으로 전해졌습니다. 사모펀드 운용사 관계자는 &quot;이제는 보험사 인수 못 한다&quot;며 &quot;이미... ,http://www.newstomato.com/ReadNews.aspx?no=1272328&inflow=N,http://www.newstomato.com/ReadNews.aspx?no=1272328&inflow=N,"Thu, 21 Aug 2025 14:22:00 +0900"
산업은행,권대영 부위원장 “석화업계 안일한 인식 유감…보따리 내놓으라는 격”,"권 부위원장은 21일 5대 시중은행(KB국민, 신한, 하나, 우리, NH농협)과 산업은행, 기업은행, 수출입은행 등과 함께 ‘석유화학 사업재편을 위한 간담회’를 열고 이같이 밝혔다. 권 부위원장은 이날 모두발언에서... ",https://www.viva100.com/article/20250821500875,https://www.viva100.com/article/20250821500875,"Thu, 21 Aug 2025 14:22:00 +0900"
산업은행,&quot;'대마불사' 씨도 안 먹힌다&quot;..석화업계 뼈깎는 자구안 요구한 정부,"21일 오전 서울 중구 은행연합회에서 KB국민·신한·하나·우리·NH농협은행 등 5대 시중은행을 비롯해 산업은행과 IBK기업은행, 수출입은행 등 국책은행을 소집해 '석유화학 사업재편 금융권 간담회'를 개최한 자리에서다.... ",http://news.mt.co.kr/mtview.php?no=2025082112342140511,https://n.news.naver.com/mnews/article/008/0005239051?sid=101,"Thu, 21 Aug 2025 14:19:00 +0900"
산업은행,"진보당, GGM 노동조합 악마화 비판 &quot;대출금 상환 광주시가 제대로 해명...",GGM의 발표가 나자 곧바로 산업은행과 광주은행 등 채권단은 대출 조기상환에 대해 먼저 문의한 쪽은 GGM이라고 밝히며 기존보다 낮은 금리고 자금을 신규차입하여 자발적으로 조기상환한 것이다며 해명했다. GGM은... ,https://www.sentv.co.kr/article/view/sentv202508210111,https://www.sentv.co.kr/article/view/sentv202508210111,"Thu, 21 Aug 2025 14:18:00 +0900"
산업은행,"GGM 1960억 대출 돌려막아 급한 불 껐는데, 노조 반발 왜?","5754억원이 투입돼 함평 빛그린국가산업단지에 들어 선 공장은 투자금 중 2700억원은 산업은행, 우리은행, 신한은행, 광주은행 등 8개 금융사가 2020년부터 2025년 12월까지 상환 조건으로 빌려줬다. GGM은 채권은행단에... ",https://www.newsis.com/view/NISX20250821_0003297902,https://n.news.naver.com/mnews/article/003/0013434572?sid=102,"Thu, 21 Aug 2025 14:17:00 +0900"
산업은행,"[단독]금융당국, 銀 석화기업 지원하면 충당금 낮출지 검토","이날 오전 금융위원회는 서울 중구 은행회관 14층 중회의실에서 5대(KB국민·신한·하나·우리·NH농협)은행과 산업·기업·수출입은행은 물론 보스턴컨설팅그룹, 기술보증기금, 신용보증기금, NICE신용평가 관계자들과... ",http://www.fnnews.com/news/202508211101289820,https://n.news.naver.com/mnews/article/014/0005394738?sid=101,"Thu, 21 Aug 2025 14:10:00 +0900"
산업은행,GGM 대출금 조기 상환 쟁점…사측·채권단 '진실게임' 비화,"노조는 '노조 파업', '노사 갈등'을 이유로 사측인 GGM에 조기 상환을 요청한 것은 노조 탄압이라고 항의하며 지난 18일 서울 용산 대통령실 앞에서 산업은행 규탄 기자회견을 열었다. 이에 대해 산업은행은 기자회견... ",https://www.yna.co.kr/view/AKR20250821097700054?input=1195m,https://n.news.naver.com/mnews/article/001/0015578530?sid=102,"Thu, 21 Aug 2025 14:05:00 +0900"
산업은행,강형준 명륜진사갈비 대표 &quot;매각 꾸준히 진행 … 지분 남겨 경영에 참여...,조사4국은 산업은행에서 조달한 자금이 고금리 대출로 전환되는 과정과 가맹점 관련 자금 흐름을 들여다보는 것으로 알려졌다. 차액가맹금 반환을 둘러싼 소수가맹점주들과의 법적 분쟁에 대해서도 입을 열었다. 강... ,https://biz.newdaily.co.kr/site/data/html/2025/08/21/2025082100131.html,https://biz.newdaily.co.kr/site/data/html/2025/08/21/2025082100131.html,"Thu, 21 Aug 2025 14:00:00 +0900"
산업은행,"&quot;30조 여신 회수 자제를&quot;…금융위, 석화산업 지원","금융위원회는 21일 5대 시중은행(KB·신한·하나·우리·NH농협)과 산업은행, 기업은행(024110), 수출입은행 등과 함께 '석화 사업 재편을 위한 간담회'를 하고 이러한 방침을 밝혔습니다. 권대영 부위원장은 &quot;석화산업은 핵심... ",http://www.newstomato.com/ReadNews.aspx?no=1272317&inflow=N,http://www.newstomato.com/ReadNews.aspx?no=1272317&inflow=N,"Thu, 21 Aug 2025 13:56:00 +0900"
산업은행,"[특징주] 석유화학株, 구조 개편 기대감에 '상승세'···롯데케미칼 8%...","이날 금융위원회는 5대 시중은행(KB국민·신한·하나·우리·NH농협), 산업은행, 기업은행, 수출입은행 등과 '석유화학 사업재편을 위한 간담회'를 열고 기업 금융지원을 위한 공동협약을 추진하기로 결정했다. 금융권에... ",http://www.todaykorea.co.kr/news/articleView.html?idxno=333481,http://www.todaykorea.co.kr/news/articleView.html?idxno=333481,"Thu, 21 Aug 2025 13:52:00 +0900"
산업은행,진보당 &quot;GGM 부도위기 발표는 대국민 사기극…광주시 책임 촉구&quot;,"산업은행은 &quot;GGM 측의 자발적인 조기상환 문의에 따라 안내한 것일 뿐 파업과는 무관하다&quot;고 밝혔으며, 광주은행도 &quot;GGM이 낮은 금리와 상환편의를 위해 채권은행을 정리한 것&quot;이라고 해명했다. 진보당은 &quot;파업은 헌법이... ",https://www.news1.kr/local/gwangju-jeonnam/5886231,https://n.news.naver.com/mnews/article/421/0008440221?sid=102,"Thu, 21 Aug 2025 13:50:00 +0900"
산업은행,"삼일PwC, 중견기업 투자 리더스 포럼 3기 개강","박재홍 고려대 교수와 최현희 산업은행 벤처투자실장, 장철혁 SM엔터테인먼트 대표, 전미영 트렌드코리아컴퍼니 대표 등이 연사로 나선다. 이날 개강식에는 민준선 삼일PwC 딜 부문 대표와 이호준 중견련 상근부회장... ",https://www.etoday.co.kr/news/view/2498914,https://www.etoday.co.kr/news/view/2498914,"Thu, 21 Aug 2025 13:48:00 +0900"
산업은행,"금융위, 석화산업 구조조정 지원…“비 올 때 우산 안 뺏어야”","금융위원회는 21일 5대 시중은행(KB·신한·하나·우리·NH농협)과 산업은행, 기업은행, 수출입은행 등과 함께 ‘석유화학 사업재편을 위한 간담회’를 하고 이 같은 방침을 밝혔다. 이날 회의는 석유화학 산업 현황과... ",https://www.busan.com/view/busan/view.php?code=2025082112495853814,https://n.news.naver.com/mnews/article/082/0001341068?sid=101,"Thu, 21 Aug 2025 13:39:00 +0900"
산업은행,"&quot;비올 때 우산 뺏으면 안 돼&quot;…금융권, 공멸위기 석화업계 금융지원",금융위원회는 21일 오전 서울 중구 은행연합회에서 KB국민·신한·하나·우리·NH농협은행 등 5대 시중은행과 산업·기업·수출입은행 등 국책은행을 불러모아 '석유화학 사업재편을 위한 간담회를 가졌다. 이는 전날 열린... ,https://www.getnews.co.kr/news/articleView.html?idxno=836952,https://www.getnews.co.kr/news/articleView.html?idxno=836952,"Thu, 21 Aug 2025 13:34:00 +0900"
산업은행,"금융권, 석유화확 대출 회수 안한다…“비올때 우산 뺏지 않아야”",금융위원회는 21일 서울 중구 은행연합회에서 5대 시중은행과 산업은행·기업은행·수출입은행 등 국책은행들이 참석한 가운데 석유화학 사업 재편 간담회를 개최해 이같은 방안을 논의했다. 이 자리에는 금융감독원... ,http://www.segyebiz.com/newsView/20250821509231?OutUrl=naver,http://www.segyebiz.com/newsView/20250821509231?OutUrl=naver,"Thu, 21 Aug 2025 13:30:00 +0900"
산업은행,"금융권, 석유화학 지원 착수… 권대영 &quot;비올 때 우산 빼앗지 않아야&quot;","금융위원회는 21일 5대 시중은행(KB국민·신한·하나·우리·NH농협)과 산업은행·기업은행·수출입은행 등 주요 국책은행과 함께 '석유화학 사업재편 간담회'를 열고, 석유화학업계 구조개편 및 금융지원 방안을 논의했다.... ",https://www.pinpointnews.co.kr/news/articleView.html?idxno=370083,https://www.pinpointnews.co.kr/news/articleView.html?idxno=370083,"Thu, 21 Aug 2025 13:26:00 +0900"
산업은행,은행권 상반기 순이익 15조 육박 '역대 최대',당시는 산업은행의 한화오션 관련 충당금 1조원 환입으로 일회성 요인이 크게 작용했다. 하지만 올해 상반기는 견고한 이자이익이 유지되는 가운데 비이자이익이 크게 늘면서 은행권의 평시 이익 체력이 크게... ,http://www.g-enews.com/ko-kr/news/article/news_all/202508211236517236bbed569d68_1/article.html,http://www.g-enews.com/ko-kr/news/article/news_all/202508211236517236bbed569d68_1/article.html,"Thu, 21 Aug 2025 13:22:00 +0900"
산업은행,"“보따리부터 내놓으라는 격”...권대영, 석화업계 안일한 인식 질타","금융위원회는 21일 KB·신한·하나·우리·NH농협 등 5대 시중은행과 산업은행, 기업은행, 수출입은행과 함께 '석유화학 사업재편을 위한 간담회'를 개최했다. 이번 회의는 석유화학 산업 현황과 사업재편 방향을 공유하고... ",https://www.ekn.kr/web/view.php?key=20250821025489019,https://www.ekn.kr/web/view.php?key=20250821025489019,"Thu, 21 Aug 2025 13:20:00 +0900"
산업은행,"금융당국 “석유화학, 대주주 뼈를 깎는 자구노력 있어야”","5대 시중은행(국민·신한·하나·우리·농협)과 은행연합회, 산업은행·수출입은행·중소기업, 신용보증기금과 기술보증기금, 무역보험공사, 자산관리공사 등 정책금융기관이 참석했다. 권 부위원장은 “석유화학산업은... ",https://www.naeil.com/news/read/558603?ref=naver,https://www.naeil.com/news/read/558603?ref=naver,"Thu, 21 Aug 2025 13:04:00 +0900"
산업은행,[재계워치] 최태원 &quot;AI를 가지고 놀며 혁신해야 성공할 수 있어&quot; 外,"박재홍 고려대 교수, 목승환 서울대 기술지주주식회사 대표이사, 최현희 한국산업은행 벤처투자실장, 장철혁 SM엔터테인먼트 대표이사 등 분야별 전문가가 연사로 참여하는 '3기 포럼'은 인공지능, 바이오, M&amp;A... ",http://www.newswatch.kr/news/articleView.html?idxno=72630,http://www.newswatch.kr/news/articleView.html?idxno=72630,"Thu, 21 Aug 2025 12:58:00 +0900"
산업은행,"[더벨][글로벌 파이낸스 2025]GDP 초고속 성장한 베트남, 하노이에서 두...","올해 IBK기업은행의 법인 설립과 KDB산업은행의 지점 개설 거점 지역도 모두 하노이다. 국내 금융사가 하노이에 설립한 사무소, 지점, 법인 등의 거점 수도 2022년 21개, 2023년 23개, 2024년 25개로 계속 증가했다. 반면 호찌민... ",https://www.thebell.co.kr/free/content/ArticleView.asp?key=202508190702495600101267,https://www.thebell.co.kr/free/content/ArticleView.asp?key=202508190702495600101267,"Thu, 21 Aug 2025 12:38:00 +0900"
산업은행,국내 은행 상반기 순익 15조…역대 최대 순이익,"당시 실적이 산업은행의 한화오션 관련 충당금 1조원 환입으로 일회성이었던 점을 감안하면, 평시 이익이 크게 늘어난 셈이다. 항목별로 보면 상반기 은행 이자이익은 29조7000억원으로 지난해 상반기... ",https://www.dailybrief.co.kr/news/articleView.html?idxno=3002,https://www.dailybrief.co.kr/news/articleView.html?idxno=3002,"Thu, 21 Aug 2025 12:24:00 +0900"
산업은행,"[단독]금융당국 &quot;석화기업, 연말까지 회사채 등 시장성차입 해결안 내야...",생산량 감축과 동시에 스페셜티 전환을 위해서는 신규자금 투입이 필요해서다. 산업은행 등 정책금융기관 중심으로 3조원대 신규공급과 1조원대 산업구조전환지원자금 확대 등의 방안이 거론되고 있다.,http://news.mt.co.kr/mtview.php?no=2025082112150067469,https://n.news.naver.com/mnews/article/008/0005238998?sid=101,"Thu, 21 Aug 2025 12:23:00 +0900"
기업은행,"&quot;의료 빈곤 막는다&quot; IBK캐피탈, 혈액암 환우에 7천만원 지원","IBK캐피탈은 IBK기업은행이 100% 지분을 보유한 자회사로, 사회적 약자를 돕기 위한 사회공헌활동을 꾸준히 이어오고 있다. 회사는 장애인, 불우아동, 독거노인, 미혼모 등 취약계층을 대상으로 한 지원 활동을 확대하고... ",https://www.mhns.co.kr/news/articleView.html?idxno=722283,https://www.mhns.co.kr/news/articleView.html?idxno=722283,"Thu, 21 Aug 2025 16:40:00 +0900"
기업은행,석유화학 구조조정 '시동'... 은행권 자본여력 시험대로 부상,"한편 이날 간담회에는 금융위원회 부위원장, 금융감독원 부원장, NICE신용평가, BCG컨설팅, 은행연합회, 5대 시중은행(KB국민은행, 신한은행, 하나은행, 우리은행, NH농협은행), 산업은행, 기업은행, 수출입은행 등이... ",https://www.newsfreezone.co.kr/news/articleView.html?idxno=642462,https://www.newsfreezone.co.kr/news/articleView.html?idxno=642462,"Thu, 21 Aug 2025 16:32:00 +0900"
기업은행,"IBK캐피탈, 한국혈액암협회에 7000만원 기부","▲ IBK캐피탈,IBK기업은행,기부 IBK캐피탈, 한국혈액암협회에 7천만원 기부. 사진=IBK캐피탈 IBK캐피탈은 지난 20일 한국혈액암협회에 경제적 어려움을 겪는 혈액암 환우를 위한 치료비 지원금 7,000만원을 전달했다고... ",https://weekly.cnbnews.com/news/article.html?no=187112,https://weekly.cnbnews.com/news/article.html?no=187112,"Thu, 21 Aug 2025 16:24:00 +0900"
기업은행,"금융당국 &quot;석화업계, 뼈 깎는 자구노력해야 금융지원&quot;","21일 금융위원회는 KB국민·신한·하나·우리·NH농협 등 5대 시중은행과 산업은행, 기업은행, 수출입은행 등 주요 정책금융기관을 불러 '석유화학 사업재편 간담회'를 열었다. 전날 정부가 나프타분해시설(NCC) 최대 370만 톤... ",https://it.chosun.com/news/articleView.html?idxno=2023092146175,https://it.chosun.com/news/articleView.html?idxno=2023092146175,"Thu, 21 Aug 2025 16:14:00 +0900"
기업은행,[업앤다운]은행주 상승…하나금융↑·iM금융↓,"06%(150원) 내려 1만3940원으로 장을 마감했고 BNK금융지주는 전거래일 대비 0.90%(130원) 하락해 1만4350원으로 장을 마쳤다. 기업은행과 우리금융지주, 카카오뱅크는 보합세를 유지했다. NSP통신",https://www.nspna.com/news/?mode=view&newsid=772684,https://www.nspna.com/news/?mode=view&newsid=772684,"Thu, 21 Aug 2025 16:12:00 +0900"
기업은행,"IBK캐피탈, 한국혈액암협회에 저소득 혈액암 환우 치료 지원금 전달","IBK캐피탈은 기업은행이 100% 지분을 가지고 있는 자회사로 장애인, 불우아동, 독거노인, 미혼모, 도움이 필요한 청소년 등 어려운 이웃을 위한 사회공헌활동을 더욱 확대할 계획이라고 전했다.",https://www.cnbnews.com/news/article.html?no=745286,https://www.cnbnews.com/news/article.html?no=745286,"Thu, 21 Aug 2025 16:10:00 +0900"
기업은행,"금융위 “석화업계 안일한 인식, 보따리부터 내놓으라는 격”","권대영 금융위 부위원장은 21일 5대 시중은행(KB·신한·하나·우리·NH농협)과 산업은행, 기업은행, 수출입은행 등과 함께 ‘석유화학 사업재편을 위한 간담회’를 열고 이같이 밝혔다. 그러면서 권 부위원장은 “지금은... ",https://www.donga.com/news/Economy/article/all/20250821/132228270/1,https://n.news.naver.com/mnews/article/020/0003655705?sid=101,"Thu, 21 Aug 2025 16:06:00 +0900"
기업은행,"[나눔뉴스] IBK캐피탈, 한국혈액암협회에 저소득 혈액암 환우 치료비 지...","한편 IBK캐피탈은 IBK기업은행이 100% 지분을 가지고 있는 자회사로 사회의 어려운 이웃을 위한 사회공헌활동을 지속적으로 실시해오고 있으며 2025년에도 장애인, 불우아동, 독거노인, 미혼모, 도움이 필요한 청소년 등... ",https://www.ibabynews.com/news/articleView.html?idxno=137697,https://www.ibabynews.com/news/articleView.html?idxno=137697,"Thu, 21 Aug 2025 16:06:00 +0900"
기업은행,금융위 &quot;보따리부터 내놓으라는 격&quot;…석화업계 작심 비판,"권 부위원장은 21일 5대 시중은행(KB·신한·하나·우리·NH농협)과 산업은행, 기업은행, 수출입은행 등과 함께 '석유화학 사업재편을 위한 간담회'를 열고 이같이 밝혔다. 권 부위원장은 이날 모두발언에서 석유화학업계... ",http://www.popcornnews.net/news/articleView.html?idxno=91078,http://www.popcornnews.net/news/articleView.html?idxno=91078,"Thu, 21 Aug 2025 16:00:00 +0900"
기업은행,"IBK캐피탈, 한국혈액암협회에 저소득 혈액암 환우 치료비 지원","한편 IBK캐피탈은 IBK기업은행이 100% 지분을 가지고 있는 자회사로 사회의 어려운 이웃을 위한 사회공헌활동을 지속적으로 실시해오고 있으며 2025년에도 장애인, 불우아동, 독거노인, 미혼모, 도움이 필요한 청소년 등... ",https://www.polinews.co.kr/news/articleView.html?idxno=704795,https://www.polinews.co.kr/news/articleView.html?idxno=704795,"Thu, 21 Aug 2025 15:58:00 +0900"
기업은행,"석유화학업계, 구조개편 지원 논의…산업 경쟁력 회복 분수령 될까","21일 서울 중구 은행연합회에서 열린 '석유화학 사업재편 간담회'에는 5대 시중은행과 산업은행·기업은행·수출입은행 등 국책은행, 금융감독원, 은행연합회, 신용보증기금, 기술보증기금, 무역보험공사, 한국자산관리공사... ",https://www.greened.kr/news/articleView.html?idxno=330190,https://www.greened.kr/news/articleView.html?idxno=330190,"Thu, 21 Aug 2025 15:54:00 +0900"
기업은행,"돈줄 열어달라 vs 리스크 부담…금융권 “석화, 대주주 자구노력부터”...",금융위원회는 21일 5대 시중은행(KB·신한·하나·우리·NH농협)과 산업·수출입·기업은행 등과 ‘석유화학 사업재편을 위한 간담회’를 열고 채권금융기관 공동협약을 통해 기업 자금 수요에 대응하겠다고 밝혔다. 이번... ,https://www.dt.co.kr/article/12012769?ref=naver,https://n.news.naver.com/mnews/article/029/0002976995?sid=101,"Thu, 21 Aug 2025 15:46:00 +0900"
기업은행,"IBK캐피탈, 한국혈액암협회에 혈액암 치료 지원금 7000만원 전달","비용을 지원해 메디컬푸어 발생를 예방하는 취지로 마련됐다. 한편, IBK캐피탈은 기업은행이 100% 지분을 갖는 자회사로 사회의 어려운 이웃을 위한 사회공헌활동을 지속적으로 펼치고 있다. [위키리크스한국=]",http://www.wikileaks-kr.org/news/articleView.html?idxno=173540,http://www.wikileaks-kr.org/news/articleView.html?idxno=173540,"Thu, 21 Aug 2025 15:42:00 +0900"
기업은행,"IBK캐피탈, 저소득 혈액암 환우 치료비 7000만원 지원",한편 IBK캐피탈은 IBK기업은행이 100% 지분을 가지고 있는 자회사로 사회의 어려운 이웃을 위한 사회공헌활동을 지속적으로 실시해오고 있으며 2025년에도 장애인·불우아동·독거노인·미혼모·도움이 필요한 청소년 등... ,http://www.newsdream.kr/news/articleView.html?idxno=92826,http://www.newsdream.kr/news/articleView.html?idxno=92826,"Thu, 21 Aug 2025 15:40:00 +0900"
기업은행,금융위 부위원장 권대영 석유화학업계 작심 비판 &quot;뼈 깎는 자구노력 보...,"&lt;연합뉴스&gt; 간담회에는 KB국민은행과 신한은행, 하나은행, 우리은행, NH농협은행, 은행연합회, 한국산업은행, 한국수출입은행, IBK기업은행, 신용보증기금, 기술보증기금, 무역보험공사, 캠코 등이 참석했다. 이날 간담회는... ",https://www.businesspost.co.kr/BP?command=article_view&num=408554,https://www.businesspost.co.kr/BP?command=article_view&num=408554,"Thu, 21 Aug 2025 15:26:00 +0900"
기업은행,"석유화학산업 재편, 금융권도 지원…금융위 &quot;비올 때 우산 뺏지 말아야...",금융위원회는 21일 오전 서울 중구 은행연합회에서 5대 시중은행(KB국민·신한·하나·우리·NH농협)과 산업은행·기업은행·수출입은행 등 국책은행이 참석한 가운데 '석유화학 사업재편 간담회'를 열고 이같은 방안을... ,https://www.1conomynews.co.kr/news/articleView.html?idxno=42909,https://www.1conomynews.co.kr/news/articleView.html?idxno=42909,"Thu, 21 Aug 2025 15:18:00 +0900"
기업은행,이찬우 NH농협금융 회장 &quot;첨단산업 지원 확대로 '생산적 금융' 다해야&quot;,이어 신용등급이 낮은 기업은 은행·증권의 자금지원으로 신용등급 상향을 유도하는 '점프업 프로젝트' 상품을 공급하는 사업도 제시됐다. 이 회장은 각 계열사에 &quot;기존의 방식을 탈피하고 발상의 전환을 통해... ,https://www.ajunews.com/view/20250821151150413,https://www.ajunews.com/view/20250821151150413,"Thu, 21 Aug 2025 15:16:00 +0900"
기업은행,"금융위 &quot;석화, 보따리부터 내놓으라는 격… 강력 자구노력해야&quot;(종합)","권대영 금융위원회 부위원장은 21일 KB·신한·하나·우리·NH농협 등 5대 시중은행과 산업은행, 기업은행, 수출입은행 등과 함께 '석유화학 사업재편을 위한 간담회'를 열고 이같이 밝혔다. 이날 회의는 석유화학산업 현황과... ",https://www.newscj.com/news/articleView.html?idxno=3308232,https://www.newscj.com/news/articleView.html?idxno=3308232,"Thu, 21 Aug 2025 15:12:00 +0900"
기업은행,금융당국·금융권 석유화학 사업재편 지원…“강력한 자구노력 필요”,"금융위원회는 21일 5대 시중은행(KB·신한·하나·우리·NH농협)과 산업은행, 기업은행, 수출입은행 등과 ‘석유화학 사업재편을 위한 간담회’를 열고 석유화학산업에 금융지원 원칙을 논의했다. 권대영 금융위 부위원장은... ",https://www.khan.co.kr/article/202508211507001,https://n.news.naver.com/mnews/article/032/0003390998?sid=101,"Thu, 21 Aug 2025 15:07:00 +0900"
