Keyword,Title,Description,Original Link,Link,Publication Date
정일영,"“AI 시대 데이터는 국가 인프라”… 조승래, ‘국가데이터기본법’ 대...","공동발의에는 이정문, 서미화, 안도걸, 김기표, 정태호, 정일영, 박민규, 맹성규, 최기상, 박상혁 의원이 참여했다. 조승래 의원(더불어민주당) 사진=의원실 제공 공공·민간 분산 데이터 “국가가 지정·관리” 구조로 전환... ",https://www.edaily.co.kr/news/newspath.asp?newsid=03929446645453512,https://n.news.naver.com/mnews/article/018/0006292244?sid=105,"Thu, 28 May 2026 12:31:00 +0900"
조승래,[굿모닝! 이 법안] 국가데이터기본법 대기 중⋯&quot;국가데이터 종합적 총괄...,[편집자주] ◆ 국가데이터기본법안 더불어민주당 조승래 의원(대전 유성구갑)은 국가데이터의 종합적인 총괄·조정을 위해 국가데이터기본법안을 대표발의했다. 현재 데이터의 관리·활용에 관해서는 공공데이터 영역에서... ,https://www.goodkyung.com/news/articleView.html?idxno=287603,https://www.goodkyung.com/news/articleView.html?idxno=287603,"Sat, 30 May 2026 07:00:00 +0900"
조승래,"'지선 D-3' 막판 변수 투표율, 與野 지지층 투표 독려 총력전…'말실수...",조승래 민주당 총괄선대본부장은 29일 기자간담회에서 사전투표율에 대해 &quot;그동안 무능한 내란 세력에 의해 어지럽혀진 대한민국을 구석구석까지 청소하겠다는 굳건한 의지를 가지고 투표에 임하시는 것&quot;이라고 말했다.... ,https://www.newsis.com/view/NISX20260529_0003649690,https://n.news.naver.com/mnews/article/003/0013976892?sid=100,"Sat, 30 May 2026 07:00:00 +0900"
조승래,"‘사전투표 2일차’ 민주당, 전남광주행…격전지 전북·평택서도 유세","조승래 선대본부장은 국회의원 재선거가 치러지는 경기 평택에서 회의를 엽니다. 사전투표 첫날이었던 어제, 민주당 지도부는 서울에 모여 유세를 시작하며 안전을 강조했습니다. [정청래/더불어민주당... ",https://news.kbs.co.kr/news/pc/view/view.do?ncd=8573912&ref=A,https://n.news.naver.com/mnews/article/056/0012190951?sid=100,"Sat, 30 May 2026 06:09:00 +0900"
조승래,[6·3 지선 D-4] 여야가 바라본 판세…서울·부산·울산·경남 '접전' 의...,◆ 민주 &quot;접전 6곳·안정권 9곳&quot;…조승래 &quot;판세 큰 변화 없어&quot; 민주당은 지난 26일 자체 판세 분석을 통해 서울... 조승래 민주당 총괄선거대책본부장(민주당 사무총장)은 지난 28일 기자간담회에서도 &quot;지금도 유지되는 것으로... ,https://www.newspim.com/news/view/20260529000796,https://www.newspim.com/news/view/20260529000796,"Sat, 30 May 2026 06:00:00 +0900"
조승래,"민주, 위기의 하정우·이원택 구하기 총력… 한동훈·김관영 집중 포화",조승래 민주당 총괄선거대책본부장은 이날 국회 간담회에서 한 후보의 유사 선거사무소 운영 의혹을 강력히 비판했다. 조 본부장은 “윤석열이 지난 2022년 대선을 치를 때 강남 모 빌딩에 유사 사무소를 설치해 운영했다”... ,https://www.dt.co.kr/article/12064963?ref=naver,https://n.news.naver.com/mnews/article/029/0003029157?sid=100,"Sat, 30 May 2026 05:10:00 +0900"
조승래,‘반만 찍혀도 괜찮나?’ 투표소 밖 나온 李대통령… 국힘 “명백한 불...,조승래 민주당 총괄선대본부장은 기자간담회에서 “듣기로는 투표하는 과정에서 인주가 번졌는지 문제가 있었던 모양이다. 실무적인 과정 속 해프닝이라 본다”라며 진화에 나섰다. 국민의힘의 관권선거 주장에 대해서는... ,https://www.dt.co.kr/article/12064964?ref=naver,https://n.news.naver.com/mnews/article/029/0003029153?sid=100,"Sat, 30 May 2026 02:39:00 +0900"
조승래,"李, 기표한 투표지 들고나와 “반만 찍혔는데 괜찮나”",민주당 조승래 사무총장은 기자들과 만나 “국민의힘 주장은 투표 과정에서 벌어진 해프닝을 억지로 공격하는 것”이라고 반박했다. 중앙선거관리위원회 관계자는 “기표소에 들어갔다가 나오는 것만으로는 선거법... ,https://www.donga.com/news/Politics/article/all/20260529/134019912/2,https://n.news.naver.com/mnews/article/020/0003723358?sid=100,"Sat, 30 May 2026 01:42:00 +0900"
조승래,“여야 지지층 결집”… 격전지 서울-부산-대구 투표율 모두 올라,민주당 총괄선대본부장인 조승래 사무총장은 “지난 선거에 비해서 투표율이 올라간다는 건 고무적”이라며 “그동안 무능한 내란 세력에 의해 대한민국이 너무 어지럽혀져 있어 (유권자들이) 구석구석까지... ,https://www.donga.com/news/Politics/article/all/20260529/134019916/2,https://n.news.naver.com/mnews/article/020/0003723357?sid=162,"Sat, 30 May 2026 01:42:00 +0900"
조승래,이 대통령 “반만 찍혀도 괜찮나”…투표 중 투표지 들고 나와 논란,더불어민주당은 “(이 대통령의 행동은) 실무적인 과정에서의 해프닝”(조승래 사무총장)이라고 감쌌다. 중앙선관위 관계자는 “기표 용지를 공개한 게 아니고 실제 사전투표관리관 역시 기표 용지를 보지 못했다고 한다”... ,https://www.joongang.co.kr/article/25432515,https://n.news.naver.com/mnews/article/353/0000055609?sid=100,"Sat, 30 May 2026 01:01:00 +0900"
조승래,"민주 &quot;투표 과정에서 해프닝...국민의힘, 억지 주장&quot;",조승래 사무총장은 어제(29일) 기자간담회에서 언뜻 듣기로는 투표하는 과정에서 실무적인 문제가 있었던 모양이라고 밝혔습니다. 국민의힘이 '선거법 위반을 조사해야 한다'고 공세를 펴는 것에 대해서는 말도 안 되는... ,https://www.ytn.co.kr/_ln/0101_202605300055543325,https://n.news.naver.com/mnews/article/052/0002359797?sid=162,"Sat, 30 May 2026 00:55:00 +0900"
조승래,"부산 선관위, 한동훈 ‘자원봉사자 쉼터’ 수사 의뢰",더불어민주당 조승래 사무총장은 지난 25일 기자간담회에서 “선관위는 유사 사무소 설치를 통한 불법 선거운동에 대해 신속하게 조사·판단해 수사기관에 수사 의뢰를 하길 바란다”고 했다. 한 후보와 경쟁하고 있는... ,https://www.chosun.com/politics/election2026/2026/05/30/LAYQGPBG4FH2DNZG7AGNRLEYKU/?utm_source=naver&utm_medium=referral&utm_campaign=naver-news,https://n.news.naver.com/mnews/article/023/0003979316?sid=162,"Sat, 30 May 2026 00:53:00 +0900"
조승래,"단일화 못한 평택을, 같은 진영 후보끼리 공격",조승래 민주당 사무총장은 앞서 예금거래내역서 등을 근거로 김용남 후보의 대부업체 운영 의혹은 사실이 아니라고 주장했다. 그렇지만 여권에선 이에 대해 의혹이 완전히 해소되지 않았다는 비판이 나오고 있다. 유시민... ,https://www.chosun.com/politics/election2026/2026/05/30/LT6DFZV6VFFK5G2GZ2HCHAY6MY/?utm_source=naver&utm_medium=referral&utm_campaign=naver-news,https://n.news.naver.com/mnews/article/023/0003979312?sid=162,"Sat, 30 May 2026 00:51:00 +0900"
조승래,6·3 지선 사전투표 첫날 투표율 역대 최고...전남 1위·대구 꼴찌,"조승래 더불어민주당 총괄선대본부장은 29일 국회 기자간담회에서 &quot;(유권자들이) 무능한 내란 세력에 어지럽혀진 대한민국을 구석구석 청소해야겠다는 의지, 국정 지원을 든든히 해줘야겠다는 생각으로 투표에... ",https://www.womennews.co.kr/news/articleView.html?idxno=278151,https://n.news.naver.com/mnews/article/310/0000137088?sid=100,"Sat, 30 May 2026 00:43:00 +0900"
조승래,이대통령 기표소 밖 문의에 여야 공방…선관위 &quot;선거법 위반 아니다&quot;,조승래 사무총장은 국회 기자간담회에서 &quot;실무적인 과정에서 발생한 해프닝으로 이해하고 있다&quot;며 &quot;국민의힘이 투표 과정에서 벌어진 일을 억지로 공격하고 있다&quot;고 말했다. 청와대도 별도 입장을 내고 &quot;투표용지를 들고... ,http://weekly.chosun.com/news/articleView.html?idxno=52040,https://n.news.naver.com/mnews/article/053/0000058690?sid=162,"Fri, 29 May 2026 23:35:00 +0900"
조승래,"선관위, 한동훈 ‘유사 선거사무소’ 의혹 수사 의뢰",민주당 조승래 사무총장은 지난 25일 기자간담회에서 “선관위는 유사 사무소 설치를 통한 불법 선거운동에 대해 신속하게 조사·판단해 수사기관에 수사 의뢰를 하길 바란다”고 했다. 부산 북갑 보궐선거에 출마한... ,https://www.chosun.com/politics/election2026/2026/05/29/I6HLJTIRVNFRVORR3S6C4CKK6M/?utm_source=naver&utm_medium=referral&utm_campaign=naver-news,https://n.news.naver.com/mnews/article/023/0003979227?sid=162,"Fri, 29 May 2026 23:10:00 +0900"
조승래,민주 &quot;감옥 3인방 이기자&quot;...&quot;주식계좌 흐뭇하면 1번&quot;,[조승래 / 더불어민주당 사무총장 : 이분은 영입 인재 1호가 아니라 우리 민주당이 용서해준 1호예요. (유권자들이) 점점 시간이 지나면서 본인의 문제 때문에 당에서 징계 제명된 것이구나…] 정청래 대표는 본 투표 전... ,https://www.ytn.co.kr/_ln/0101_202605292234069243,https://n.news.naver.com/mnews/article/052/0002359766?sid=100,"Fri, 29 May 2026 22:34:00 +0900"
조승래,"국힘, ‘李대통령 투표용지 노출’ 공세… “명백한 고의”",조승래 사무총장은 국회 기자간담회에서 “실무적인 과정에서의 해프닝으로 이해하고 있다”며 “국민의힘 주장은 억지 주장으로 투표 과정에서 벌어진 해프닝을 억지로 공격하는 것”이라고 반박했다. 연합뉴스에... ,https://m.skyedaily.com/news_view.html?ID=304961,https://m.skyedaily.com/news_view.html?ID=304961,"Fri, 29 May 2026 22:10:00 +0900"
조승래,김관영 무소속 돌풍에 다급해진 민주당 &quot;두 번 용서 없다&quot;,조승래 민주당 총괄선거대책본부장은 29일 국회에서 기자간담회를 열고 김 후보의 이른바 대리비 지급 의혹과 무소속 출마 명분을 정면으로 겨냥했다. 조 본부장은 &quot;본인이 현금을 줬다고 인정한 것만 70만 원이고 우리가... ,https://www.daejonilbo.com/news/articleView.html?idxno=2278339,https://n.news.naver.com/mnews/article/656/0000177660?sid=100,"Fri, 29 May 2026 22:07:00 +0900"
조승래,"野 &quot;이 대통령 비밀투표 훼손, 무효 처리해야&quot;…與 &quot;해프닝&quot;",조승래 민주당 총괄선대본부장은 기자간담회에서 '국민의힘 측 논평에 대한 입장'을 묻는 기자의 질문에 &quot;듣기로는 투표하는 과정에서 인주가 번졌는지 문제가 있었던 모양이다. 실무적인 과정 속 해프닝이라 본다&quot;고... ,https://www.hankyung.com/article/2026052976687,https://n.news.naver.com/mnews/article/015/0005293046?sid=162,"Fri, 29 May 2026 21:59:00 +0900"
조승래,'텃밭서 경합지로'...막판 민심 달래기,지방선거 사전 투표를 하루 앞두고 어젯밤 전북을 찾은 더불어민주당 조승래 사무총장이 후보자들을 소집해... 민주당 조승래 사무총장은 후보들의 원팀 정신을 강조하며 전북에서 압도적인 승리를 다짐했습니다. [조승래... ,https://jtv.co.kr/news/article.php?id=69413,https://jtv.co.kr/news/article.php?id=69413,"Fri, 29 May 2026 21:40:00 +0900"
조승래,민주당 &quot;계룡스파텔 이전&quot;에 대전 유성구 민심 술렁,"회의에는 정청래 대표와 조승래 사무총장, 황명선 최고위원, 안선아 상임공동선대위원장, 이정문 민주당 충남도당 위원장, 오 후보, 정준영 계룡시장 후보, 문정우 금산군수 후보 등이 참석했다. 문제는 후보들이 지역별... ",https://www.daejonilbo.com/news/articleView.html?idxno=2278338,https://n.news.naver.com/mnews/article/656/0000177658?sid=100,"Fri, 29 May 2026 21:38:00 +0900"
조승래,"李대통령, 투표용지 노출 논란…野 “불법” vs 與 “해프닝”",이에 대해 민주당 조승래 사무총장은 국회 기자간담회에서 “실무적인 과정에서의 해프닝으로 이해하고 있다”며 “국민의힘 주장은 억지 주장으로 투표 과정에서 벌어진 해프닝을 억지로 공격하는 것”이라고 반박했다.... ,https://www.kyeonggi.com/article/20260529580472,https://n.news.naver.com/mnews/article/666/0000109183?sid=100,"Fri, 29 May 2026 21:36:00 +0900"
조승래,"선관위, 한동훈 ‘유사 선거사무소 의혹’ 경찰에 수사 의뢰",조승래 민주당 사무총장은 25일 기자간담회에서 “선관위는 유사 사무소 설치를 통한 불법 선거운동에 대해 신속하게 조사·판단해 수사기관에 수사 의뢰를 하길 바란다”고 촉구했다. 하정우 민주당 부산 북갑 보궐선거... ,https://www.sedaily.com/article/20049924?ref=naver,https://n.news.naver.com/mnews/article/011/0004625960?sid=100,"Fri, 29 May 2026 21:34:00 +0900"
조승래,"국힘 “이재명 대통령, 투표용지 노출”…與 “해프닝 억지 공격” 공방",반면 조승래 민주당 총괄선대본부장은 기자간담회에서 “실무적인 과정에서의 해프닝으로 이해한다”며 “국민의힘 주장은 억지 주장으로 보여진다. 투표 과정에서 벌어진 해프닝을 너무 억지로 공격하는 것&quot;이라고... ,https://www.kgnews.co.kr/news/article.html?no=897928,https://www.kgnews.co.kr/news/article.html?no=897928,"Fri, 29 May 2026 21:04:00 +0900"
조승래,"전남 22.31% 최고, 대구 9.02% 최저…'최대승부처' 서울, 평균 밑돌아","조승래 / 더불어민주당 사무총장 &quot;대한민국을 구석구석까지 청소를 해야 되겠다, 이런 의지를 굳건히 갖고 투표에 임하시는 것으로...&quot; 박성훈 / 국민의힘 수석대변인 &quot;이재명 정부와 민주당의 오만과 독선을 심판하겠다는... ",https://news.tvchosun.com/site/data/html_dir/2026/05/29/2026052990262.html,https://n.news.naver.com/mnews/article/448/0000615481?sid=162,"Fri, 29 May 2026 21:03:00 +0900"
조승래,"국힘 &quot;이 대통령 투표지 노출, 불법 선거운동&quot;…민주 &quot;해프닝에 대한 억...",조승래 총괄선대본부장은 이날 기자간담회에서 &quot;언뜻 듣기로는 투표하는 과정에서 인주가 번졌는지 문제가 있던 모양&quot;이라며 &quot;해프닝으로 이해하는 것&quot;이라고 말했습니다. 그러면서 &quot;국민의힘 주장은 억지 주장으로... ,https://www.cjb.co.kr/home/sub.php?menukey=61&mod=view&P_NO=260529513&PRO_CODE=99,https://n.news.naver.com/mnews/article/655/0000031196?sid=102,"Fri, 29 May 2026 20:42:00 +0900"
조승래,이 대통령 &quot;반만 찍혀도 괜찮나&quot;…'여야 공방' 비화,&lt;조승래 / 더불어민주당 총괄선거대책본부장&gt; &quot;국민의힘의 주장은 억지 주장이라고 보여집니다. 투표 과정에서 벌어진 해프닝을 너무 억지로 공격하는 것이다….&quot; 이와 관련해 선관위 관계자는 &quot;기표소에 들어갔다가 나오는... ,http://www.yonhapnewstv.co.kr/news/MYH202605292035472d4,https://n.news.naver.com/mnews/article/422/0000869727?sid=161,"Fri, 29 May 2026 20:36:00 +0900"
조승래,이 대통령 '투표용지 노출' 두고 국힘 &quot;명백한 고의&quot;…민주 &quot;해프닝에 억...,반면 민주당 조승래 사무총장은 국회 기자간담회에서 국민의힘의 공세 논평 관련 물음에 &quot;실무적인 과정에서의 해프닝으로 이해하고 있다&quot;며 &quot;국민의힘 주장은 억지 주장으로 투표 과정에서 벌어진 해프닝을 억지로... ,https://www.busan.com/view/busan/view.php?code=2026052920283751698,https://n.news.naver.com/mnews/article/082/0001383043?sid=100,"Fri, 29 May 2026 20:34:00 +0900"
조승래,"역대 최고 첫날 사전투표율, 여야 모두 ‘신중’…“3일 투표 익숙해져...",조승래 더불어민주당 총괄선대본부장은 이날 국회 기자간담회에서 “무능한 내란 세력에 어지럽혀진... 조승래 민주당 총괄선대본부장도 이날 기자간담회에서 “(사전투표와 본투표까지) 3일 동안 투표한다는... ,https://www.hani.co.kr/arti/politics/politics_general/1261128.html,https://n.news.naver.com/mnews/article/028/0002807376?sid=100,"Fri, 29 May 2026 20:32:00 +0900"
조승래,"與 조승래, 김관영에 “거짓말 밥 먹듯 해” [6·3의 선택]","“현금 살포, 당선무효 사유 김 후보가 당선돼도 재선거” 더불어민주당 조승래 사무총장은 29일 무소속 김관영 전북지사 후보를 겨눠 “거짓말을 밥 먹듯이 한다”고 강력 질타했다. 김 후보는 지역 유권자들에게... ",https://www.segye.com/newsView/20260529514758?OutUrl=naver,https://n.news.naver.com/mnews/article/022/0004131636?sid=162,"Fri, 29 May 2026 20:30:00 +0900"
진성준,'여당 후광' 오중기 vs '3선 도전' 이철우...경북 선택은?,"유세장엔 국회 예산결산위원장인 진성준 의원까지 힘을 실어 정부, 또 국회와 협력을 강조했습니다. [오중기 / 더불어민주당 경북지사 후보 : 집권 여당이라고 하는 것이 그냥 집권 여당이 아니라 국회의원 160명 이상이... ",https://www.ytn.co.kr/_ln/0115_202605300506203485,https://n.news.naver.com/mnews/article/052/0002359830?sid=102,"Sat, 30 May 2026 05:06:00 +0900"
진성준,"금] 오중기·이철우, 북부권 집중 유세…막판 표심 경쟁","더불어민주당 오중기 경북도지사 후보는 어제 진성준 더불어민주당 의원과 함께 안동과 예천, 영주 등 북부권 5일장과 전통시장을 돌며 집중 유세를 이어갔습니다. 서영교 국회의원도 안동 용상시장을 찾아 이삼걸... ",http://andongmbc.co.kr/adboard/NewsView82767,http://andongmbc.co.kr/adboard/NewsView82767,"Fri, 29 May 2026 21:02:00 +0900"
진성준,"보수 결집에 전국 '접전지 증가'…민주 텃밭 전북은 '격전지' 부상, 향후...","무소속 바람에 화들짝 놀란 민주당은 정청래 대표와 한병도 원내대표, 진성준 국회 예결특위원장까지 전북을... 전북출신의 진성준 위원장은 27일 전북을 방문한 자리에서 &quot;이번 전북도지사 선거에서 무소속 후보가 민주당... ",https://www.pressian.com/pages/articles/2026052811473605213?utm_source=naver&utm_medium=search,https://n.news.naver.com/mnews/article/002/0002443204?sid=102,"Fri, 29 May 2026 11:10:00 +0900"
진성준,"진교훈 강서구청장 후보, 택시업계·교육계·민주당 지도부와 연쇄 행보","이날 현장에는 한정애·진성준 국회의원과 민주당 시·구의원 후보, 지지자와 시민들이 참석했다. 진 후보는... 이날 현장에는 한정애·진성준 국회의원과 민주당 시·구의원 후보, 지지자와 시민들이 참석했다. [진교훈... ",https://www.jeonmae.co.kr/news/articleView.html?idxno=1260109,https://www.jeonmae.co.kr/news/articleView.html?idxno=1260109,"Fri, 29 May 2026 08:28:00 +0900"
진성준,[R]박근혜·정청래 나란히 경북행..막판 세 결집,"정청래 당 대표와 상주 출신 김주영 의원, 국회 예결위원장인 진성준 의원 등이 오중기 후보 지원 유세에 나섰고, ◀ SYNC ▶ 정청래 / 더불어민주당 대표 &quot;경북도지사로 뛰고 있는 오중기, 67년생, 6전 7기의 오뚝이!... ",http://andongmbc.co.kr/adboard/NewsView82763,http://andongmbc.co.kr/adboard/NewsView82763,"Thu, 28 May 2026 21:14:00 +0900"
진성준,"라] 오중기·이철우, 북부권 집중 유세…막판 표심 경쟁","더불어민주당 오중기 경북도지사 후보는 오늘 진성준 더불어민주당 의원과 함께 안동과 예천, 영주 등 북부권 5일장과 전통시장을 돌며 집중 유세를 이어갔습니다. 서영교 국회의원도 안동 용상시장을 찾아 이삼걸... ",http://andongmbc.co.kr/adboard/NewsView82747,http://andongmbc.co.kr/adboard/NewsView82747,"Thu, 28 May 2026 21:02:00 +0900"
진성준,"박근혜 문경으로, 정청래 김천·구미로…경북서 여야 세대결","더불어민주당이 정청래 대표, 진성준 국회 예산결산특별위원회 위원장을 앞세우자 국민의힘은 박근혜 전 대통령 행보와 보조를 맞추며 맞불을 놨다. 이날 경쟁의 시동은 진성준 민주당 의원이 걸었다. 당의 정책위의장을... ",https://www.imaeil.com/page/view/2026052818231088058,https://n.news.naver.com/mnews/article/088/0001012129?sid=162,"Thu, 28 May 2026 18:49:00 +0900"
진성준,오중기 경북도지사 후보 &quot;농업 수도 경북 만들겠다&quot;…5대 공약 발표,"한편 오중기 후보는 이날 풍산 5일장 인사를 시작으로 진성준 의원과 함께 예천 및 영주 시장에서 집중유세를 펼치고, 오후에는 정청래 당대표와 합류해 김천과 구미시청 앞에서 '경북 대전환'을 위한 막판 표심 잡기... ",https://www.kyongbuk.co.kr/news/articleView.html?idxno=4074089,https://www.kyongbuk.co.kr/news/articleView.html?idxno=4074089,"Thu, 28 May 2026 18:16:00 +0900"
진성준,‘반청’ 바람 심상찮네…정청래 연임 걸림돌 떠오른 전북,진성준 의원은 5월 27일 전북도의회 기자 간담회에서 “김관영 후보의 돈봉투 문제가 불거졌을 때 단호하게 사안을 처리한 것은 잘했다”면서도 “이원택 후보의 식사비 대납 의혹이 발생했을 때는 너무 성급하게... ,https://ilyo.co.kr/?ac=article_view&entry_id=511115,https://ilyo.co.kr/?ac=article_view&entry_id=511115,"Thu, 28 May 2026 17:46:00 +0900"
진성준,오중기 &quot;농업이 경북 미래산업&quot;…'농업 수도 경북' 5대 공약 발표,"오 후보는 이날 오전 경북도청에서 진성준 민주당 의원과 공동 기자회견을 열고 &quot;경북은 대한민국 제일의 농도이자 국가 경제를 떠받쳐 온 핵심 지역이지만 농업소득 정체와 고령화, 기후위기 속에서 농촌이 생존 위기에... ",https://www.idaegu.com/news/articleView.html?idxno=662965,https://www.idaegu.com/news/articleView.html?idxno=662965,"Thu, 28 May 2026 17:20:00 +0900"
진성준,오중기 경북도지사 후보 농업 수도 경북 5대 공약 발표,"오중기 더불어민주당 경북도지사 후보는 28일 오전 11시 경북도청에서 진성준 의원과 함께 기자회견을 갖고... 한편, 오 후보는 이날 풍산 5일장 인사를 시작으로 진성준 의원과 함께 예천 및 영주 시장에서 집중유세를... ",https://www.hidomin.com/news/articleView.html?idxno=707210,https://www.hidomin.com/news/articleView.html?idxno=707210,"Thu, 28 May 2026 17:16:00 +0900"
진성준,오중기 경북도지사 후보 ‘농업 수도 경북’ 비전 발표,"더불어민주당 오중기 경북도지사 후보가 28일 경북도의회에서 진성준 의원과 함께 기자회견을 열고, 경북을 대한민국 농업의 중심지이자 미래 고부가가치 산업의 전초기지로 만들겠다며 ‘농업 수도 경북’ 비전을... ",https://www.kbmaeil.com/article/20260528500578,https://www.kbmaeil.com/article/20260528500578,"Thu, 28 May 2026 16:28:00 +0900"
진성준,"29~30일 사전투표…여·야, TK서 총력전",진성준 민주당 의원은 이날 경북도청에서 오 후보와 합동 기자회견을 가진 뒤 집중 유세에 나섰고 정청래 민주당 대표는 김천·구미에서 오 후보 지원 유세를 이어갔다. 민주당은 최근 안동 한·일정상회담과 이재명... ,https://www.idaegu.com/news/articleView.html?idxno=662953,https://www.idaegu.com/news/articleView.html?idxno=662953,"Thu, 28 May 2026 16:20:00 +0900"
진성준,"오중기 경북지사 후보, '농업 수도' 미래 비전 제시…&quot;경북 구조 혁신 완...","오중기 후보는 28일 오전 경북도청 브리핑룸에서 진성준 의원과 공동 기자회견을 열고, 경북을 대한민국 식량 안보의 거점이자 첨단 생명공학 산업의 전초기지로 탈바꿈시키겠다는 '농업 수도 경북' 5대 정책 공약을... ",https://www.eroun.net/news/articleView.html?idxno=81858,https://www.eroun.net/news/articleView.html?idxno=81858,"Thu, 28 May 2026 16:12:00 +0900"
진성준,민주 오중기 경북지사 후보 “농업이 경북의 미래 산업”…‘농업 수도...,"오 후보는 28일 오전 경북도청에서 기자회견을 열고 진성준 국회의원과 함께 농업 분야 핵심 공약을 공개했다. 그는 “경북은 대한민국 농업을 떠받쳐 온 대표 농도이지만, 농가소득 정체와 고령화, 기후위기라는 삼중고에... ",https://www.ekn.kr/web/view.php?key=20260528024168725,https://www.ekn.kr/web/view.php?key=20260528024168725,"Thu, 28 May 2026 15:56:00 +0900"
진성준,"오중기 경북도지사 후보, '농업 수도 경북' 5대 공약 발표",앞서 진성준 국회의원(서울 강서구을·국회 예산결산특별위원장)은 지원 연설에서 &quot;대통령과 뜻을 같이하는 후보가 들어서야 나라와 지역 발전이 가능하다&quot;면서 &quot;정치적 경험과 경영능력을 가진 오중기 후보에게 기회를... ,https://news.bbsi.co.kr/news/articleView.html?idxno=4086106,https://news.bbsi.co.kr/news/articleView.html?idxno=4086106,"Thu, 28 May 2026 15:44:00 +0900"
