Keyword,Title,Description,Original Link,Link,Publication Date
오기형,"與, 기초연금 개편 착수…'하후상박' 개편으로 재정 고갈 막나","재정경제기획위원회 오기형, 안도걸 의원, 국회 기후에너지환경노동위원회 박홍배 의원 등이 참석했다.... 오기형 특위 간사는 회의 직후 기자들과 만나 &quot;다양한 시뮬레이션을 통해 단계적인 사회적 합의로 (지급 대상을)... ",https://www.ajunews.com/view/20260225151913705,https://www.ajunews.com/view/20260225151913705,"Wed, 25 Feb 2026 15:32:00 +0900"
오기형,"여당, 기초연금 개편 논의 착수…소득수준 차등지급 또는 대상 감축 등...",특위 간사인 오기형 의원도 &quot;고령화 저출산에 따라 65세 기준으로 하위 70%에 지급하는 기초연금을 국가가 감당할 수 있을지 의문&quot;이라며 &quot;실질적으로 노후 보장의 효과를 누릴 수 있게 건설적인 대안을 찾아야 한다&quot;고... ,https://www.kihoilbo.co.kr/news/articleView.html?idxno=3014500,https://www.kihoilbo.co.kr/news/articleView.html?idxno=3014500,"Wed, 25 Feb 2026 15:28:00 +0900"
오기형,"與, 기초연금 개편 착수…소득 하위 70% 기준 손 본다","간사를 맡은 오기형 의원은 회의 직후 기자들과 만나 기초연금에 대해 “이미 수급 중인 분들이 있어 당장 소득 하위 70%라는 기준을 바꾸기는 어려우나, 앞으로 기초연금의 새로운 대상이 되는 사람들의 기준을 어떻게... ",https://biz.chosun.com/policy/politics/assembly/2026/02/25/E557FJ7Z2JEAJBKQFDEHJ2PJ5I/?utm_source=naver&utm_medium=original&utm_campaign=biz,https://n.news.naver.com/mnews/article/366/0001144357?sid=100,"Wed, 25 Feb 2026 15:12:00 +0900"
오기형,與 기초연금 '차등지급' 시동걸까...'퇴직연금 기금화 구조' 고심,"특위 간사인 오기형 의원은 &quot;기존 수급자가 영향을 받는 것은 아니고 이후 (수급자를 대상으로) 점진적, 단계적으로 변화가 필요한 것이 아닌가 하는 문제의식이 있다&quot;고 밝혔다. 아울러 특위는 이날 퇴직연금 기금화... ",http://www.fnnews.com/news/202602251418423395,https://n.news.naver.com/mnews/article/014/0005482712?sid=100,"Wed, 25 Feb 2026 15:09:00 +0900"
오기형,"민주, '기금형 퇴직연금' 후속 조치…기초연금도 논의",역할을 명확히 적립하고 국민연금과의 관계를 재설계하는 건 미룰 수 없는 과제&quot;라고 밝혔습니다. 오기형 의원도 &quot;실질적으로 노후 보장의 효과를 누릴 수 있게 건설적인 대안을 찾아야 한다&quot;고 말했습니다.,http://www.yonhapnewstv.co.kr/AKR202602251451049aU,https://n.news.naver.com/mnews/article/422/0000837605?sid=100,"Wed, 25 Feb 2026 14:51:00 +0900"
오기형,"여당, 3차 상법개정안 단독처리…사법개혁법안 필리버스터 대치 지속","이에 민주당 K-자본시장 특별위원회 위원장인 오기형 의원은 &quot;경영권 방어를 위한 편법을 계속 허용해달라고 이야기하는 것은 코스피 2500으로 가자는 주장&quot;이라며 &quot;비슷한 정책을 윤석열 정부가 하면 친시장, 친기업이고... ",https://www.kihoilbo.co.kr/news/articleView.html?idxno=3014480,https://www.kihoilbo.co.kr/news/articleView.html?idxno=3014480,"Wed, 25 Feb 2026 14:18:00 +0900"
오기형,국회 필리버스터 대치 계속…상법개정안 처리 임박,"이재명 정부 출범하고 나온 정책에 기업들 자유롭게 기업하게 해주는 법이 있었습니까?&quot; &lt;오기형 / 더불어민주당 의원&gt; &quot;거수기 이사회로 남용하던 것 멈추시면 된다, 그리고 이사회가 이 자사주를 앞으로 어떻게... ",http://www.yonhapnewstv.co.kr/MYH202602251401185va,https://n.news.naver.com/mnews/article/422/0000837576?sid=100,"Wed, 25 Feb 2026 14:02:00 +0900"
오기형,"기금형 퇴직연금 속도…민주, 기초연금 개편 논의도",오기형 의원도 &quot;고령화 저출산에 따라 65세 기준으로 하위 70%에 지급하는 기초연금을 국가가 감당할 수 있을지 의문&quot;이라며 &quot;실질적으로 노후 보장의 효과를 누릴 수 있게 건설적인 대안을 찾아야 한다&quot;고 말했습니다. 앞서... ,https://news.kbs.co.kr/news/pc/view/view.do?ncd=8493338&ref=A,https://n.news.naver.com/mnews/article/056/0012130821?sid=100,"Wed, 25 Feb 2026 13:59:00 +0900"
오기형,"與 기초연금 개혁 &quot;소득별 차등 지급, 대상 조정 검토&quot;",오기형 특위 간사는 회의를 마친 뒤 기자들과 만나 &quot;기존 수급자가 영향을 받는 것은 아니다&quot;라면서도 &quot;이후... 한편 이날 회의에는 남 의원을 비롯해 박홍배·오기형·김윤·박희승·안도걸·전진숙 의원과 최관병... ,https://www.m-i.kr/news/articleView.html?idxno=1340376,https://www.m-i.kr/news/articleView.html?idxno=1340376,"Wed, 25 Feb 2026 13:38:00 +0900"
오기형,상법개정안 이어 법왜곡죄 처리 수순,전날 윤한홍 국민의힘 의원의 반대토론으로 시작된 필리버스터는 오기형(민주당) 최보윤(국민의힘) 김남근(민주당) 최은석(국민의힘) 김현정(민주당) 조승환(국민의힘) 의원 순으로 25일 오전까지 이어지고 있다.... ,https://www.naeil.com/news/read/579126?ref=naver,https://www.naeil.com/news/read/579126?ref=naver,"Wed, 25 Feb 2026 13:06:00 +0900"
오기형,"'돈 잘버는 노인'에겐 기초연금 줄인다...與, 연금 개편 논의 착수","오기형 특위 간사는 회의를 마친 후 기자들과 만나 &quot;기존 수급자가 영향을 받는 것은 아니고 이후 (수급자를 대상으로) 점진적, 단계적으로 변화가 필요한 게 아닌가 하는 문제의식이 있었다&quot;며 &quot;재정 추계나 실제 인구... ",https://www.mt.co.kr/politics/2026/02/25/2026022510400247486,https://n.news.naver.com/mnews/article/008/0005322009?sid=100,"Wed, 25 Feb 2026 11:55:00 +0900"
오기형,與연금개혁특위 &quot;국민연금 스튜어드십코드 강화 법안 준비&quot;,"이날 회의에는 특위 위원장인 남인순 의원을 비롯해 박홍배·오기형·김윤·박희승·안도걸·전진숙 의원과 최관병 고용노동부 근로기준정책관, 최옥금 국민연금연구원 연금제도연구실장 등이 참석했다. 남 위원장은... ",https://news.einfomax.co.kr/news/articleView.html?idxno=4400314,https://news.einfomax.co.kr/news/articleView.html?idxno=4400314,"Wed, 25 Feb 2026 11:40:00 +0900"
오기형,'자사주 소각' 3차 상법 밤샘 공방…4시 표결 후 법왜곡죄 상정(종합),민주당 K-자본시장 특별위원회 위원장인 오기형 의원은 전날(24일) 국회에서 열린 3차 상법 개정안 필리버스터 두 번째 주자로 나서 &quot;경영권 방어를 위한 편법을 계속 허용해달라고 이야기하는 것은 코스피 2500으로 가자는... ,https://www.news1.kr/politics/assembly/6082328,https://n.news.naver.com/mnews/article/421/0008792035?sid=100,"Wed, 25 Feb 2026 10:58:00 +0900"
오기형,"기금형 퇴직연금 속도…與연금특위, 퇴직·기초연금 개혁 논의","회의에는 남 위원장과 박 의원을 비롯한 오기형·김윤·박희승·안도걸·전진숙 의원과 최관병 고용노동부 근로기준정책관, 최옥금 국민연금연구원 연금제도연구실장 등이 참석했다.",https://view.asiae.co.kr/article/2026022510234689419,https://n.news.naver.com/mnews/article/277/0005725683?sid=100,"Wed, 25 Feb 2026 10:57:00 +0900"
오기형,오기형 의원과 대화하는 남인순 민주당 연금개혁특별위원장,남인순 더불어민주당 연금개혁특별위원장과 오기형 의원이 25일 서울 여의도 국회 의원회관에서 열린 연금개혁특별위원회 전체회의에서 대화하고 있다. 2026.2.25/뉴스1,https://www.news1.kr/photos/7766356,https://n.news.naver.com/mnews/article/421/0008792002?sid=100,"Wed, 25 Feb 2026 10:52:00 +0900"
오기형,"여야, 또 시작된 ’무박 8일‘ 필리버스터 대치…2월 국회 ’정면충돌‘","(사진=연합뉴스) 이에 첫 찬성 토론자로 나선 민주당 오기형 의원은 “1·2차 상법을 개정하면서 대한민국 자본시장은 뒤통수를 치는 시장이 아니라는 점에 대한 기대감, 이사회가 거수기가 아닌 책임지는 기구로 나아갈... ",https://www.cnbnews.com/news/article.html?no=780247,https://www.cnbnews.com/news/article.html?no=780247,"Wed, 25 Feb 2026 10:46:00 +0900"
이소영 의원,李대통령 &quot;부동산→자본시장 돈줄기 고무적&quot;…'주가누르기 방지법' 강조...,이 대통령이 언급한 주가 누르기 방지법은 이소영 민주당 의원이 지난해 5월 발의해 계류중인 '상속세 및 증여세법 개정안'을 말한다. 대주주가 상속 시 세금 부담을 줄이기 위해 억지로 주가를 누르는 행위를 막겠다는... ,http://www.fnnews.com/news/202602251654029663,https://n.news.naver.com/mnews/article/014/0005482824?sid=100,"Wed, 25 Feb 2026 17:03:00 +0900"
이소영 의원,자사주 소각 의무화 입법 마무리…다음 타자는 '주가누르기 방지법',지난해 5월 민주당 이소영 의원이 대표발의한 주가누르기 방지법은 국회 세법 심사 과정에서 한차례 논의됐지만 결국 개정이 무산된 바 있다. 해당 법안은 상장주식의 상속·증여시 주식가치의 하한선을... ,https://news.einfomax.co.kr/news/articleView.html?idxno=4400403,https://news.einfomax.co.kr/news/articleView.html?idxno=4400403,"Wed, 25 Feb 2026 16:56:00 +0900"
이소영 의원,[속보] ‘코스피 6000 데이’에 ‘자사주 소각 의무화’ 3차 상법 개정안...,이 법안은 이소영 민주당 의원이 지난해 5월 대표발의한 상속세 및 증여세법 개정안으로 주가순자산비율(PBR) 0.8배 미만 상장사에 대한 상속·증여세 부과시 비상장사처럼 순자산가치의 80%를 기준으로 세금을 물리는... ,https://www.khan.co.kr/article/202602251639001,https://n.news.naver.com/mnews/article/032/0003429743?sid=100,"Wed, 25 Feb 2026 16:39:00 +0900"
이소영 의원,"&quot;그때 믿고 투자할 걸&quot;...이 대통령, '4000만→8500만원' 2배 수익","이 대통령은 지난해 5월 대선 후보이던 시절, 자신의 유튜브 채널에 나와 이소영 더불어민주당 의원과 국내 증시 선진화 방안에 대해 논의했다. 당시 이 대통령은 &quot;제가 빈 말을 한 게 아니고 실제 민주 정부... ",https://www.mt.co.kr/politics/2026/02/25/2026022516084281693,https://n.news.naver.com/mnews/article/008/0005322197?sid=100,"Wed, 25 Feb 2026 16:13:00 +0900"
이소영 의원,[‘꿈의 육천피 시대’ 개막] 이 대통령 “자사주 소각 시급”,"이소영 더불어민주당 의원 등이 주도적으로 준비하는 법안으로, 지난달 22일 이 대통령과 민주당 코스피 5000 특별위원회의 오찬 자리에서도 이 법안에 대한 논의가 이뤄진 바 있다. 또한 이 대통령은 민주당이 청와대를... ",http://www.segyebiz.com/newsView/20260225513997?OutUrl=naver,http://www.segyebiz.com/newsView/20260225513997?OutUrl=naver,"Wed, 25 Feb 2026 15:58:00 +0900"
이소영 의원,김용·추미애·강득구 등 여권 인사 대거 참석… 오동현 출판기념회 3일...,의왕시를 지역구로 둔 재선의 이소영 의원을 비롯해 이재강(의정부을)·김준혁(수원정)·김기표(부천을)·전용기(화성정)·김우영(서울 은평을)·정진욱(광주 동구남구갑) 의원이 자리합니다. 최근 대변인으로 선임된 김남국... ,https://news.ifm.kr/news/articleView.html?idxno=465552,https://news.ifm.kr/news/articleView.html?idxno=465552,"Wed, 25 Feb 2026 14:40:00 +0900"
이소영 의원,李대통령 &quot;당이 잘해야 정부도 성공…현재 당정 관계 매우 건강&quot;,"민주당 이소영 의원 등이 주도적으로 준비 중이며, 지난달 22일 이 대통령과 민주당 '코스피 5,000 특별위원회'의 오찬 자리에서도 논의된 바 있다. 이 대통령의 발언은 최근 사법개혁, 상법 개정안, 자사주 소각 의무화 등... ",https://www.fntoday.co.kr/news/articleView.html?idxno=378178,https://www.fntoday.co.kr/news/articleView.html?idxno=378178,"Wed, 25 Feb 2026 12:04:00 +0900"
이소영 의원,李 &quot;대통령 뒷전 아냐…자사주 입법 서두르고 주가 누르기 방지법도&quot;,"이소영 더불어민주당 의원이 발의한 법안으로, 지난달 22일 이 대통령과 민주당 코스피 5000 특별위원회 오찬에서도 논의된 바 있는데요. 주가 누르기가 의도적으로 이뤄지고 있다는 판단 배경에는 코스피 상장 기업들의... ",https://biz.sbs.co.kr/article_hub/20000293492?division=NAVER,https://n.news.naver.com/mnews/article/374/0000494305?sid=101,"Wed, 25 Feb 2026 11:41:00 +0900"
이소영 의원,李 “주가 누르기 방지법 등 할일 산더미”,이 대통령이 언급한 주가 누르기 방지법은 이소영 민주당 의원이 지난해 5월 발의해 계류중인 ‘상속세 및 증여세법 일부개정법률안’을 말한다. 주가순자산비율(PBR) 0.8배 미만 상장사 주주가 주식을 상속·증여할 때 상속... ,https://biz.heraldcorp.com/article/10682043?ref=naver,https://n.news.naver.com/mnews/article/016/0002604883?sid=100,"Wed, 25 Feb 2026 11:38:00 +0900"
이소영 의원,"李대통령 &quot;대통령 뒷전 된 일 없다…민주당, 잘하고 있어&quot;",이 대통령이 언급한 '주가 누르기 방지법'은 이소영 더불어민주당 의원이 발의한 '상속세 및 증여세법 일부개정법률안'을 가리킨다. 해당 법안은 현재 국회에 계류 중이다. 개정안은 주가순자산비율(PBR)이 0.8배에 미달하는... ,https://www.newsworks.co.kr/news/articleView.html?idxno=832108,https://www.newsworks.co.kr/news/articleView.html?idxno=832108,"Wed, 25 Feb 2026 11:04:00 +0900"
이소영 의원,李대통령 “대통령 뒷전 된 일 없다”…당청 불협화음 우려에 직접 진화...,"주가 누르기 방지법이란 대주주가 기업을 상속할 때 평균주가를 기준으로 상속세가 결정된다는 점을 고려해 세금 부담을 줄이고자 주가를 억누르는 행위를 하는 것을 막기 위한 법안으로, 민주당 이소영 의원 등이... ",https://www.segye.com/newsView/20260225506683?OutUrl=naver,https://n.news.naver.com/mnews/article/022/0004108310?sid=100,"Wed, 25 Feb 2026 11:02:00 +0900"
이소영 의원,李대통령 “뒷전 대통령? 과도한 걱정…민주당 ‘맡긴 일’ 잘하고 있다...,"민주당 이소영 의원 등이 주도적으로 준비하는 법안으로, 지난달 22일 이 대통령과 민주당 ‘코스피 5000 특별위원회’의 오찬 자리에서도 이 법안에 대한 논의가 이뤄진 바 있다.",https://www.segye.com/newsView/20260225506499?OutUrl=naver,https://n.news.naver.com/mnews/article/022/0004108306?sid=100,"Wed, 25 Feb 2026 10:53:00 +0900"
이소영 의원,李대통령 &quot;당청 엇박자 없다…대통령 뒷전 된 적 없어&quot; 직접 반박,"구조를 악용해 의도적으로 주가를 낮추는 행위를 막기 위한 입법을 뜻한다. 해당 법안은 민주당 이소영 의원 등이 준비 중이며, 지난달 22일 이 대통령과 민주당 '코스피 5000 특별위원회' 오찬에서도 논의된 바 있다.",https://daily.hankooki.com/news/articleView.html?idxno=1339471,https://daily.hankooki.com/news/articleView.html?idxno=1339471,"Wed, 25 Feb 2026 10:38:00 +0900"
이소영 의원,李대통령 “주가 누르기 방지법 등 할일 산더미…민주당 잘하고 있다”,이 대통령이 언급한 주가 누르기 방지법은 이소영 민주당 의원이 지난해 5월 발의해 계류중인 ‘상속세 및 증여세법 일부개정법률안’을 말한다. 주가순자산비율(PBR) 0.8배 미만 상장사 주주가 주식을 상속·증여할 때 상속... ,https://biz.heraldcorp.com/article/10681897?ref=naver,https://n.news.naver.com/mnews/article/016/0002604761?sid=100,"Wed, 25 Feb 2026 10:37:00 +0900"
이소영 의원,이 대통령 “민주당 잘하고 있어…대통령 ‘뒷전’ 된 적 없다”,"민주당 이소영 의원 등이 주도적으로 준비하는 법안으로, 지난달 22일 이 대통령과 민주당 ‘코스피 5000 특별위원회’의 오찬 자리에서도 이 법안에 대한 논의가 이뤄진 바 있다.",https://www.kbmaeil.com/article/20260225500113,https://www.kbmaeil.com/article/20260225500113,"Wed, 25 Feb 2026 10:24:00 +0900"
이소영 의원,"李, '대통령 뒷전' 보도에 &quot;민주당 부족함 없이 잘하고 있다&quot;","이소영 민주당 의원 등이 주도적으로 준비하고 있으며, 지난달 22일 이 대통령과 민주당 '코스피 5000 특별위원회'의 오찬 자리에서도 해당 법안에 대한 논의가 이뤄졌다.",https://www.sisajournal.com/news/articleView.html?idxno=363798,https://n.news.naver.com/mnews/article/586/0000123053?sid=100,"Wed, 25 Feb 2026 10:23:00 +0900"
이소영 의원,이 대통령 &quot;대통령 뒷전 된 일 없어…민주당 잘 하고 있다&quot;,"이소영 민주당 의원 등이 주도적으로 준비하는 법안으로, 지난달 22일 이 대통령과 민주당 '코스피 5000 특별위원회' 오찬 자리에서도 이 법안에 대한 논의가 이뤄졌습니다.",https://news.jtbc.co.kr/article/NB12286927?influxDiv=NAVER,https://n.news.naver.com/mnews/article/437/0000480230?sid=100,"Wed, 25 Feb 2026 10:18:00 +0900"
이소영 의원,이재명 대통령 강력 입장 표명... 당청 엇박자 '기우'인가?,"주가 누르기 방지법은 대주주의 세금 부담 완화를 위해 주가를 억제하려는 시도를 방지하는 것을 목표로 한다. 이는 이소영 의원 등이 추진하고 있는 법안으로, 이재명 대통령과 민주당이 그 중요성을 함께 논의한 바 있다.",https://www.gokorea.kr/news/articleView.html?idxno=858836,https://www.gokorea.kr/news/articleView.html?idxno=858836,"Wed, 25 Feb 2026 10:08:00 +0900"
이소영 의원,"李대통령 &quot;민주당, 정부 지원 부족함 없어…기업 수용한 입법에 왜 밤새...","이 대통령은 코스피 5000 공약이 달성된 지난달 22일 더불어민주당 '코스피 5000 특별위원회' 위원들과 비공개 오찬을 갖고, 이소영 의원이 대표 발의한 이른바 '주가 누르기 방지법'에 대한 설명을 들은 뒤 김용범 청와대... ",https://www.polinews.co.kr/news/articleView.html?idxno=723827,https://www.polinews.co.kr/news/articleView.html?idxno=723827,"Wed, 25 Feb 2026 10:05:00 +0900"
이소영 의원,이 대통령 &quot;자사주 소각 입법 빨리…주가누르기 방지법 등 할 일 산더미...,'주가 누르기 방지법은 지난해 5월 이소영 의원(더불어민주당·경기 의왕시과천시)이 대표 발의한 '상속세 및 증여세법 개정안'이다. 상장사 주가가 지나치게 낮더라도 과세 기준을 순자산가치의 최소 80%로 설정하는 것이... ,https://www.sidae.com/article/2026022509314554197,https://n.news.naver.com/mnews/article/417/0001131328?sid=100,"Wed, 25 Feb 2026 09:55:00 +0900"
이소영 의원,李대통령 &quot;농지 매각명령에 공산당 운운…경자유전 이해 못한 것&quot;,"주가 누르기 방지법이란 대주주가 기업을 상속할 때 평균주가를 기준으로 상속세가 결정된다는 점을 고려, 세금 부담을 줄이고자 주가를 억누르는 행위를 막기 위한 법안이다.민주당 이소영 의원 등이 주도적으로... ",http://www.newsfc.co.kr/news/articleView.html?idxno=76981,http://www.newsfc.co.kr/news/articleView.html?idxno=76981,"Wed, 25 Feb 2026 09:34:00 +0900"
이소영 의원,"李대통령,당청 엇박자 보도에 “기우…대통령 뒷전 된 일 없다”","이소영 민주당 의원 등이 주도적으로 준비하는 법안으로, 지난달 22일 이 대통령과 민주당 '코스피 5000 특별위원회'의 오찬 자리에서도 이 법안에 대한 논의가 이뤄진 바 있다.",https://www.dt.co.kr/article/12048246?ref=naver,https://n.news.naver.com/mnews/article/029/0003012488?sid=100,"Wed, 25 Feb 2026 09:06:00 +0900"
이소영 의원,"李대통령 '당·청 엇박자' 보도에 &quot;대통령은 뒷전이 된 일이 없고, 그렇...","민주당 이소영 의원 등이 주도적으로 준비하는 법안으로, 지난달 22일 이 대통령과 민주당 '코스피 5,000 특별위원회'의 오찬 자리에서도 이 법안에 대한 논의가 이뤄진 바 있다. 이 대통령은 농사를 안 짓는 농지의 경우... ",https://www.kwnews.co.kr/page/view/2026022508121967614,https://n.news.naver.com/mnews/article/087/0001176146?sid=100,"Wed, 25 Feb 2026 09:05:00 +0900"
이소영 의원,‘義王 오동현 인권서 민생으로’ 출판기념회,"또 의왕시를 지역구로 둔 재선의 이소영 의원을 비롯 이재강, 김준혁, 김기표, 전용기, 김우영, 정진욱, 김문수 의원과 함께 최근 대변인으로 선임된 김남국 전 의원도 자리를 함께한다. 유은혜 전 교육부총리, 성기선... ",https://www.kmib.co.kr/article/view.asp?arcid=0029440566&code=61122013&cp=nv,https://n.news.naver.com/mnews/article/005/0001833782?sid=102,"Wed, 25 Feb 2026 08:55:00 +0900"
이소영 의원,"이 대통령 “민주당 잘하고 있다, 개혁입법 극한반대 납득 안 돼”",승계할 목적으로 기업이 의도적으로 주가를 낮게 유도하는 행위를 금지하는 법이다. 이소영 더불어민주당 의원이 지난해 5월 대표발의한 법안으로 현재 상임위 계류 중이다. 3차 상법 개정안 이후 과제로 주목받고 있다.,https://vop.co.kr/A00001688484.html,https://vop.co.kr/A00001688484.html,"Wed, 25 Feb 2026 08:52:00 +0900"
이소영 의원,"李대통령 “대통령 뒷전 된 일 없다…당은 당, 청은 청의 일 잘하면 돼...","이는 민주당 이소영 의원 등이 주도적으로 준비하는 법안으로, 지난달 22일 이 대통령과 민주당 ‘코스피 5000 특별위원회’의 오찬 자리에서도 이 법안에 대한 논의가 이뤄졌다.",https://www.kukinews.com/article/view/kuk202602250014,https://www.kukinews.com/article/view/kuk202602250014,"Wed, 25 Feb 2026 08:36:00 +0900"
이소영 의원,“뒷전 대통령? 과도한 걱정”…‘당정 엇박자 지적’에 이 대통령 직접...,이는 이소영 민주당 의원 등이 주도적으로 준비하는 법안이다. 지난달 22일 이 대통령과 민주당 ‘코스피 5000 특별위원회’의 오찬 자리에서도 이 법안에 대한 논의가 이뤄진 바 있다. 한편 이 대통령은 “농사 짓겠다고... ,https://www.mk.co.kr/article/11971096,https://n.news.naver.com/mnews/article/009/0005641532?sid=101,"Wed, 25 Feb 2026 08:35:00 +0900"
이소영 의원,李대통령 “대통령 뒷전 된 일 없다... 과도한 걱정은 기우”,이 대통령은 지난달에도 “상속세를 아끼려고 주가를 억지로 낮춰 놓다니... 최대한 신속하게 개정하겠다”며 이소영 민주당 의원이 대표 발의한 ‘주가 누르기 방지법’ 관련 게시글을 공유했다.,https://www.chosun.com/politics/politics_general/2026/02/25/UYQATEC2SNAOXO4IJM6TEFPF2Y/?utm_source=naver&utm_medium=referral&utm_campaign=naver-news,https://n.news.naver.com/mnews/article/023/0003960953?sid=100,"Wed, 25 Feb 2026 08:34:00 +0900"
이소영 의원,李대통령 &quot;민주당 잘하고 있어…대통령 뒷전 된 일 없다&quot;,"민주당 이소영 의원 등이 주도적으로 준비하는 법안으로, 지난달 22일 이 대통령과 민주당 '코스피 5,000 특별위원회'의 오찬 자리에서도 이 법안에 대한 논의가 이뤄졌다.",https://www.ngonews.kr/news/articleView.html?idxno=224983,https://www.ngonews.kr/news/articleView.html?idxno=224983,"Wed, 25 Feb 2026 08:32:00 +0900"
이소영 의원,"李대통령 &quot;與, 잘하고 있어…대통령 뒷전 된 적 없다&quot;",민주당 이소영 의원 등이 주도적으로 준비하는 주가 누르기 방지법은 대주주가 기업을 상속할 때 평균주가를 기준으로 상속세가 결정된다는 점을 고려해 세금 부담을 줄이고자 주가를 억누르는 행위를 막기 위한... ,https://www.m-i.kr/news/articleView.html?idxno=1340153,https://www.m-i.kr/news/articleView.html?idxno=1340153,"Wed, 25 Feb 2026 08:24:00 +0900"
정성호,"법왜곡죄 필리버스터, 자리 지키는 정성호 법무부 장관",25일 서울 여의도 국회에서 열린 제432회국회(임시회) 8차 본회의에서 조배숙 국민의힘 의원이 이른바 '법왜곡죄' 형법일부개정법률안(대안) 수정안에 대해 무제한토론(필리버스터)을 하는 가운데 정성호 법무부... ,https://www.news1.kr/photos/7767773,https://n.news.naver.com/mnews/article/421/0008793534?sid=100,"Wed, 25 Feb 2026 17:02:00 +0900"
정성호,"법무부, 이사 주주보호 행동지침 공개…특별위·외부전문가 검토 권고","정성호 법무부 장관이 지난 23일 오후 서울 여의도 국회에서 열린 법제사법위원회 전체회의에 출석, 질의에... 정성호 법무부 장관은 “이번 가이드라인을 참고해 이사의 주주보호 노력 및 거래의 공정성에 대한 신뢰가... ",http://www.edaily.co.kr/news/newspath.asp?newsid=05303766645354128,https://n.news.naver.com/mnews/article/018/0006224610?sid=102,"Wed, 25 Feb 2026 16:59:00 +0900"
