Keyword,Title,Description,Original Link,Link,Publication Date
기재부,검찰청 폐지·기재부 분리 정부조직법 개정안 본회의 처리,"기재부 예산 기능은 국무총리 산하 기획예산처가 담당한다. 금융위원회는 개편 없이 현행 유지한다. 당초, 이재명 정부는 재정경제부가 금융위원회의 금융정책 기능을 흡수하고, 기획예산처는 기재부의 기획·예산... ",http://www.metroseoul.co.kr/article/20250926500275,http://www.metroseoul.co.kr/article/20250926500275,"Fri, 26 Sep 2025 21:10:00 +0900"
기재부,78년만 검찰청 폐지…민주 &quot;역사적인 날&quot;·국힘 &quot;범죄자 활개칠 것&quot;,검찰청이 78년 만에 폐지되는 정부조직법 개정안이 국회 본회의를 통과한 가운데 더불어민주당(민주당)과 국민의힘 반응이 극명하게 갈렸다. 검찰청 폐지를 강행한 민주당은 &quot;역사적인 날&quot;이라며 환호했고 국민의힘은... ,https://www.newspim.com/news/view/20250926001019,https://www.newspim.com/news/view/20250926001019,"Fri, 26 Sep 2025 21:10:00 +0900"
기재부,이재명 정부 첫 조직 개편안 국회 통과,"기재부 18년 만에 분리…대규모 부처 개편 기획재정부 역시 18년 만에 재정경제부와 기획예산처로 분리된다. 기재부의 예산 기능은 국무총리실 산하의 기획예산처로 이관되며, 이 분리는 내년 1월 2일부터 적용된다. 이로써... ",http://www.breaknews.com/1150907,http://www.breaknews.com/1150907,"Fri, 26 Sep 2025 21:08:00 +0900"
기재부,"정부조직법, 국회 통과… 78년 만에 검찰청 역사 속으로(종합)","기재부를 재정경제부와 기획예산처로 분리하고, 예산 기능은 국무총리실 산하 기획예산처로 이관된다. 이 조치는 내년 1월 2일부터 시행된다. 다만 당초 논의됐던 금융위원회 개편은 이번 수정안에서는 빠졌다. 금융위와... ",https://www.newscj.com/news/articleView.html?idxno=3322519,https://www.newscj.com/news/articleView.html?idxno=3322519,"Fri, 26 Sep 2025 21:00:00 +0900"
기재부,"검찰청 폐지·기재부 분리…정부조직법, 필리버스터 뚫고 통과",검찰청 폐지와 기재부 분리 방안을 담은 정부조직법 개정안이 범여권 주도로 국회 본회의 문턱을 넘었습니다. 이에 따라 검찰청은 1년의 유예 기간 뒤 역사 속으로 사라지게 됐는데요. 야당은 필리버스터 저항을... ,http://www.yonhapnewstv.co.kr/MYH20250926203722PWy,https://n.news.naver.com/mnews/article/422/0000785656?sid=161,"Fri, 26 Sep 2025 20:38:00 +0900"
기재부,[이시각헤드라인] 9월 26일 뉴스리뷰,■정부조직법 국회 통과…1년 뒤 검찰청 폐지■ 검찰청 폐지와 기재부 분리 방안을 담은 정부조직법 개정안이 범여권 주도로 국회 본회의 문턱을 넘었습니다. 이에 따라 검찰청은 1년의 유예기간 뒤 역사 속으로 사라지게... ,http://www.yonhapnewstv.co.kr/MYH20250926203620drZ,https://n.news.naver.com/mnews/article/422/0000785655?sid=102,"Fri, 26 Sep 2025 20:37:00 +0900"
기재부,외환시장 내년 24시간 개방 추진…외국인 투자유치로 달러 유입 효과,이에 대해 기재부 관계자는 “단기적 변동성에 유의하며 시장 참여자들과 소통을 강화하겠다”고 밝혔다. 이번 조치가 미국과 난항을 겪고 있는 통화 스와프 협정에 유리한 여건을 만들기 위한 준비란 시각도 있다.... ,https://www.donga.com/news/Economy/article/all/20250926/132471648/1,https://n.news.naver.com/mnews/article/020/0003664102?sid=101,"Fri, 26 Sep 2025 20:37:00 +0900"
기재부,"정부조직법, 여당 주도로 국회 통과...78년 만에 검찰청 폐지","기재부 분리 개편안은 내년 1월 2일부터 시행된다. 한편, 정부조직법 통과 직후 민주당은 '방송미디어통신위원회 설치법'을 추가로 상정했고 국민의힘은 이에 반발해 다시 필리버스터에 돌입했다.",https://www.mediapen.com/news/view/1045889,https://www.mediapen.com/news/view/1045889,"Fri, 26 Sep 2025 20:36:00 +0900"
기재부,"정부조직법, 국회 통과…여성가족부, ‘성평등가족부’로 확대·개편된...","기재부 예산 기능을 국무총리실 산하 기획예산처로 이관하는 내용도 포함됐다. 방송통신위원회를 폐지하고 방송미디어통신위원회를 신설하며, 방송 진흥에 관한 사무를 방송미디어통신위원회로 이관하는 내용도 담았다.... ",https://www.womennews.co.kr/news/articleView.html?idxno=267901,https://n.news.naver.com/mnews/article/310/0000129898?sid=100,"Fri, 26 Sep 2025 20:35:00 +0900"
기재부,정부조직법 與주도로 통과…검찰청 78년 만에 역사 속으로,"기획재정부를 재정경제부와 기획예산처로 분리하고, 기재부 예산 기능을 국무총리실 산하 기획예산처로 이관하는 내용도 수정안에 담겼다. 이는 내년 1월 2일부터 시행된다. 민주당이 추진했던 금융위원회 개편은 이번... ",https://www.seoul.co.kr/news/politics/2025/09/26/20250926500200?wlog_tag3=naver,https://n.news.naver.com/mnews/article/081/0003578330?sid=100,"Fri, 26 Sep 2025 20:35:00 +0900"
기재부,정부조직법 與주도 국회 본회의 통과…검찰청 폐지 중수청·공소청 설치,"재석 180명 중 찬성 174표, 반대 1표, 기권 5표...국민의힘 표결 불참 기재부, 재경부·기획예산처로…환경부... 개정안은 또 기획재정부를 재정경제부와 기획예산처로 분리하고, 기재부 예산 기능을 국무총리실 산하... ",https://www.kgnews.co.kr/news/article.html?no=867053,https://www.kgnews.co.kr/news/article.html?no=867053,"Fri, 26 Sep 2025 20:32:00 +0900"
기재부,78년 영욕의 검찰청 역사 속으로...정부조직법 국회 통과,"수정안은 기획재정부를 재정경제부와 기획예산처로 분리하고, 기재부 예산 기능을 국무총리실 산하 기획예산처로 이관하는 내용도 담았다. 이는 내년 1월 2일부터 시행된다. 이에 따라 2008년 이전의 재정경제부와... ",https://www.slist.kr/news/articleView.html?idxno=681253,https://www.slist.kr/news/articleView.html?idxno=681253,"Fri, 26 Sep 2025 20:28:00 +0900"
기재부,정부조직법 국회 통과…78년만 검찰청 폐지·기재부 분리,"수정안은 기획재정부를 재정경제부와 기획예산처로 분리하고, 기재부 예산 기능을 국무총리실 산하 기획예산처로 이관하는 내용도 담았습니다. 이는 내년 1월 2일부터 시행됩니다. 당초 민주당이 추진했던 금융위원회... ",https://news.sbs.co.kr/news/endPage.do?news_id=N1008274114&plink=ORI&cooper=NAVER,https://n.news.naver.com/mnews/article/055/0001295951?sid=100,"Fri, 26 Sep 2025 20:26:00 +0900"
기재부,정부조직법 與 주도 국회 통과 … 78년만 검찰청 폐지·기재부 분리,"◆검찰청 없애고 중수청 신설 … 기재부 분리·방통위 폐지도 이날 국회를 통과한 정부조직법 개정안 가운데 가장 논란이 컸던 조항은 검찰청 폐지 내용이다. 개정안은 기존 검찰청을 없애고, 중대범죄 수사는 행정안전부... ",https://www.newdaily.co.kr/site/data/html/2025/09/26/2025092600385.html,https://www.newdaily.co.kr/site/data/html/2025/09/26/2025092600385.html,"Fri, 26 Sep 2025 20:26:00 +0900"
기재부,"[기자수첩] 헛되이 소진한 금융감독 개혁동력, 또 승리한 기득권",금융산업 진흥 기능은 다시 기재부에 돌려놓고 금융감독 정책‧집행을 담당하는 금융감독기구를 만드는 것이 원칙이었다. 일단 이것까지는 학자들도 상당수 옹호한다. 그러나 새로 개편하겠다는 금융감독기구의 외형이... ,https://www.tfmedia.co.kr/news/article.html?no=195846,https://www.tfmedia.co.kr/news/article.html?no=195846,"Fri, 26 Sep 2025 20:16:00 +0900"
금융위,다음주 금융당국 일정,"금융위원장, 은행장 간담회(15:00, 은행회관) -금융감독원장, 서울핀테크위크 2025 컨퍼런스(10:30, 콘래드호텔) -금감원장, 금융소비자보호 강화를 위한 임직원 결의대회(15:00, 금감원 2층 강당) △30일(화) -금융위원... ",http://www.edaily.co.kr/news/newspath.asp?newsid=01210326642304384,https://n.news.naver.com/mnews/article/018/0006126962?sid=101,"Sat, 27 Sep 2025 06:31:00 +0900"
금융위,"정부조직법 본회의 통과…여야, 필리버스터 대치 계속","국민의힘은 표결에 불참했고, 금감원·금융위 개편 보류에 반대한 조국혁신당 의원 3명이 기권했습니다. 개정안에는 검찰청을 폐지하고, 기획재정부를 분리하는 내용이 담겼습니다. 추석 전 검찰청 폐지를 공언해온... ",https://news.kbs.co.kr/news/pc/view/view.do?ncd=8369215&ref=A,https://n.news.naver.com/mnews/article/056/0012038019?sid=100,"Sat, 27 Sep 2025 06:17:00 +0900"
금융위,금융위·금감원 ‘현행 유지’,금융위원회의 정책·감독 기능 분리와 금융소비자보호원 신설 등을 뼈대로 한 금융당국 개편안이 백지화됐다.... 만들고 금융위의 국내 금융정책을 흡수해 재정경제부로 재편하는 방안이 담겼다. 여기에 금융위를... ,https://www.nongmin.com/article/20250926500655,https://n.news.naver.com/mnews/article/662/0000078933?sid=101,"Sat, 27 Sep 2025 06:00:00 +0900"
금융위,'한숨 휴~' 금투협회장의 묵직한 '금융위-금감원 수술 중단' 환영사,"금융위원회의 정책 기능 등 일부를 기획재정부로 떼어보내고, 금융감독원의 감독기능과 소비자보호기능을 분리 편성하는 등 금융정책 및 감독 체계를 근원적으로 바꾸는 논의가 속도를 내왔다. 실제로 이 같은 금융위와... ",https://www.financialpost.co.kr/news/articleView.html?idxno=234027,https://www.financialpost.co.kr/news/articleView.html?idxno=234027,"Sat, 27 Sep 2025 05:06:00 +0900"
금융위,[주간금융] 코스피 3400대 아래로···금융감독체계 개편안 철회,"했던 금융위 정책·감독 기능 분리와 금융소비자원 신설 등을 이번 조직 개편안에 포함하지 않기로... 민주당은 당초 기획재정부를 기획예산처와 재정경제부로 분리하고, 금융위원회를 금융감독위원회(금감위)로... ",https://www.smartfn.co.kr/news/articleView.html?idxno=121378,https://www.smartfn.co.kr/news/articleView.html?idxno=121378,"Sat, 27 Sep 2025 05:00:00 +0900"
금융위,'예산 떼고 금융 불발' 기재부 '술렁'…총리실 위상 극대화,"예산 기능을 기획예산처로 분리하는 대신 금융위원회의 국내 금융정책 기능을 흡수하기로 한 것이 불발된... 27일 관계부처 등에 따르면 정부와 더불어민주당, 대통령실은 25일 긴급 고위 당정대 회의에서 금융위원회의 정책... ",https://www.etoday.co.kr/news/view/2510690,https://www.etoday.co.kr/news/view/2510690,"Sat, 27 Sep 2025 05:00:00 +0900"
금융위,정부조직법 與주도 통과…78년만 검찰청 폐지·기재부 분리,"금융위원회 개편은 제외돼 현행 체제가 유지된다. 재경부로 넘길 방침이었던 금융위의 국내 금융 정책 기능은 기존 금융위가 그대로 수행하며, 금융감독원도 현행 체제대로 유지한다. 환경부는 기후에너지환경부로 확대... ",http://www.hansbiz.co.kr/news/articleView.html?idxno=780026,http://www.hansbiz.co.kr/news/articleView.html?idxno=780026,"Sat, 27 Sep 2025 02:36:00 +0900"
금융위,대통령실이 예산권 사실상 장악… 재경부는 ‘세제’만 남아,"재경부에는 금융위원회의 금융 정책 기능을 흡수시켜 경제 정책과 세제, 국고, 금융 기능을 총괄하게 하겠다는 내용이 담겼었다. 그리고 금융감독 기능은 금융위를 쪼개서 금융감독위원회에 넘기고, 금융감독원도... ",https://www.chosun.com/economy/economy_general/2025/09/27/J53LUUMDUBEJVCBBWEMCATZECE/?utm_source=naver&utm_medium=referral&utm_campaign=naver-news,https://n.news.naver.com/mnews/article/023/0003931688?sid=101,"Sat, 27 Sep 2025 00:55:00 +0900"
금융위,감사원 1급 5명 전원 퇴직 수순,"기획재정부, 행정안전부, 보건복지부, 고용노동부, 금융위원회 등 일반 부처들도 1급을 대상으로 일괄... 금융위도 이억원 신임 금융위원장의 요구로 지난 16일 1급 4명 전원이 사직서를 냈고, 금융감독원도 이찬진... ",https://www.chosun.com/politics/goverment/2025/09/27/STI4N6BONFDDZHI3D6NFATQG34/?utm_source=naver&utm_medium=referral&utm_campaign=naver-news,https://n.news.naver.com/mnews/article/023/0003931679?sid=100,"Sat, 27 Sep 2025 00:51:00 +0900"
금융위,"검찰청, 설립 78년 만에 폐지…정부조직법 국회 통과",다만 당초 안에 포함됐던 금융위원회와 금융감독원 개편은 이번 수정안에서는 제외됐다. 앞서 더불어민주당은 고위 당정협의를 거쳐 금융위의 국내 금융기능을 재경부로 이관하고 금감원에서 금융서비자보호처를... ,https://www.newsverse.kr/news/articleView.html?idxno=8552,https://www.newsverse.kr/news/articleView.html?idxno=8552,"Sat, 27 Sep 2025 00:28:00 +0900"
금융위,[취재수첩] '탁상공론'에 헛바퀴 도는 금융감독체계 개편,"‘금융위원회의 금융정책 기능을 재정경제부로 이관’, ‘금융감독원에서 금융소비자보호원을 분리·신설’... 금융위와 금감원 ‘양대 축’으로 이뤄지는 현행 감독체계는 이명박 정부 출범 직후인 2008년 완성됐다.... ",https://www.hankyung.com/article/2025092607801,https://n.news.naver.com/mnews/article/015/0005190798?sid=110,"Sat, 27 Sep 2025 00:13:00 +0900"
금융위,"[사설] 예산·금융 기능 없는 기재부, 경제정책 조율 가능하겠나","정부와 여당이 정부조직법 처리 당일 갑자기 금융위원회 해체 방안을 철회했기 때문이다. 기획재정부 소관 국회 상임위원회인 기재위와 금융위 소관 정무위 위원장이 모두 야당 출신인데, 두 위원장 협조가 없으면... ",https://www.hankookilbo.com/News/Read/A2025092614400004534?did=NA,https://n.news.naver.com/mnews/article/469/0000889575?sid=110,"Sat, 27 Sep 2025 00:11:00 +0900"
금융위,[사설] 정부 조직 개편이 ‘묻지 마 속도전’으로 처리된 나라,"당초 금융위원회를 금융감독위로 개편하고 금융위의 금융정책 기능을 재경부가 맡기로 했던 개편안은 법안 처리 전날 갑자기 백지화됐다. 당정은 야당의 반대와 경제 상황을 이유로 들었지만, 그동안 민주당은 야당을... ",https://www.chosun.com/opinion/editorial/2025/09/27/NIA6227P3RAUHHRJN4MNSXRFCE/?utm_source=naver&utm_medium=referral&utm_campaign=naver-news,https://n.news.naver.com/mnews/article/023/0003931611?sid=110,"Sat, 27 Sep 2025 00:11:00 +0900"
금융위,"국힘 최형두, 방통위 설치법 반대 4시간째 필리버스터…&quot;단 한 사람 교체...","그는 &quot;민주당이 금융위원회 정책, 감독 기능 분리 및 금융소비자원 신설 등을 정부조직개편에서 철회하지 않았느냐&quot;며 &quot;이 방미통위 법안도 철회하고 보류했으면 좋겠다&quot;고 말했다. 최 의원은 &quot;지난 8월 방송 3법도 우리가... ",https://www.newsis.com/view/NISX20250926_0003346342,https://n.news.naver.com/mnews/article/003/0013508801?sid=100,"Fri, 26 Sep 2025 23:06:00 +0900"
금융위,"정부조직법 본회의 통과…여야, 필리버스터 대치 계속","국민의힘은 표결에 불참했고, 금감원·금융위 개편 보류에 반대한 조국혁신당 의원 3명이 기권했습니다. 개정안에는 검찰청을 폐지하고, 기획재정부를 분리하는 내용이 담겼습니다. 추석 전 검찰청 폐지를 공언해온... ",https://news.kbs.co.kr/news/pc/view/view.do?ncd=8369132&ref=A,https://n.news.naver.com/mnews/article/056/0012037969?sid=100,"Fri, 26 Sep 2025 22:54:00 +0900"
금융위,검찰청 없애고 기재부 쪼개고… 정부조직 ‘19부6처19청’ 개편,2025.9.26 /연합뉴스 민주당이 추진하던 금융위원회 개편은 이번 수정안에서는 제외됐다. 애초 재경부로 넘길 방침이었던 금융위의 국내 금융 정책 기능은 기존 금융위가 그대로 수행한다. 금융감독원도 현행 체제를... ,https://www.kyeongin.com/article/1752500,https://www.kyeongin.com/article/1752500,"Fri, 26 Sep 2025 22:28:00 +0900"
금융위,정부조직법 국회 통과…78년만에 검찰청 폐지·기재부 분리,당초 민주당이 추진했던 금융위원회 개편은 이번 수정안에서는 제외됐다. 당초 재경부로 넘길 방침이었던 금융위의 국내 금융 정책 기능은 기존 금융위가 그대로 수행한다. 금융감독원도 현행 체제대로 유지한다.... ,https://www.ngonews.kr/news/articleView.html?idxno=215005,https://www.ngonews.kr/news/articleView.html?idxno=215005,"Fri, 26 Sep 2025 22:18:00 +0900"
금융위,정부조직법 국회 통과…78년만 검찰청 폐지,당초 민주당이 추진했던 금융위원회 개편은 이번 수정안에서는 제외됐다. 당초 재경부로 넘길 방침이었던 금융위의 국내 금융 정책 기능은 기존 금융위가 그대로 수행하고 금융감독원도 현행 체제대로 유지된다.... ,http://www.kihoilbo.co.kr/news/articleView.html?idxno=1160529,http://www.kihoilbo.co.kr/news/articleView.html?idxno=1160529,"Fri, 26 Sep 2025 21:52:00 +0900"
금융위,검찰청 78년 만에 역사 속으로…정부조직법 개정안 국회 통과,"반면 금융위원회 개편은 이번 개정안에서 제외돼 금융위와 금융감독원은 현행 체제를 유지한다. 또한 방송통신위원회는 방송미디어통신위원회로 새롭게 출범하고, 환경부는 기후에너지환경부로 개편된다. 에너지... ",https://www.mhns.co.kr/news/articleView.html?idxno=726552,https://www.mhns.co.kr/news/articleView.html?idxno=726552,"Fri, 26 Sep 2025 21:28:00 +0900"
금융위,정부조직법 통과…검찰청 78년만에 역사속으로,당초 논의됐던 금융위원회 개편은 이번 개정안에서 제외돼 금융위와 금융감독원은 현행 체제를 유지한다. 방송통신위원회는 폐지되고 방송미디어통신위원회가 신설된다. 이 밖에 환경부는 기후에너지환경부로 개편돼... ,https://www.kbmaeil.com/article/20250926500193,https://www.kbmaeil.com/article/20250926500193,"Fri, 26 Sep 2025 21:24:00 +0900"
금융위,검찰청 폐지·기재부 분리 정부조직법 개정안 본회의 처리,"금융위원회는 개편 없이 현행 유지한다. 당초, 이재명 정부는 재정경제부가 금융위원회의 금융정책 기능을 흡수하고, 기획예산처는 기재부의 기획·예산 기능을 도맡기로 했다. 현재의 금융위원회는 금융감독위원회로... ",http://www.metroseoul.co.kr/article/20250926500275,http://www.metroseoul.co.kr/article/20250926500275,"Fri, 26 Sep 2025 21:10:00 +0900"
금융위,이재명 정부 첫 조직 개편안 국회 통과,"당초 논의됐던 금융위원회 개편은 이번 수정안에서 제외되어, 금융위는 국내 금융 정책 기능을 그대로 수행하며 금융감독원도 현행 체제를 유지한다. 아울러 방송통신위원회는 폐지되고 방송미디어통신위원회가... ",http://www.breaknews.com/1150907,http://www.breaknews.com/1150907,"Fri, 26 Sep 2025 21:08:00 +0900"
금융위,"정부조직법, 국회 통과… 78년 만에 검찰청 역사 속으로(종합)",다만 당초 논의됐던 금융위원회 개편은 이번 수정안에서는 빠졌다. 금융위와 금융감독원은 현행 체제를 유지한다. 전날 본회의에 상정된 개정안은 국민의힘이 곧바로 필리버스터에 나서며 긴 토론을 거쳤다. 첫 주자로... ,https://www.newscj.com/news/articleView.html?idxno=3322519,https://www.newscj.com/news/articleView.html?idxno=3322519,"Fri, 26 Sep 2025 21:00:00 +0900"
금융위,정부조직법 與주도로 통과…검찰청 78년 만에 역사 속으로,"민주당이 추진했던 금융위원회 개편은 이번 수정안에선 제외됐다. 국내 금융 정책 기능은 기존 금융위가 수행하고, 금융감독원도 현 체제대로 유지된다. 수정안에는 방송통신위원회를 폐지하고 방송미디어통신위원회를... ",https://www.seoul.co.kr/news/politics/2025/09/26/20250926500200?wlog_tag3=naver,https://n.news.naver.com/mnews/article/081/0003578330?sid=100,"Fri, 26 Sep 2025 20:35:00 +0900"
금융위,정부조직법 與주도 국회 본회의 통과…검찰청 폐지 중수청·공소청 설치,이날 통과된 수정안은 당초 개정안에 포함된 금융위원회와 금융감독원의 분리·개편을 제외하는 내용을 담았다. 이에 재경부로 넘길 방침이었던 금융위의 국내 금융 정책 기능은 기존 금융위가 그대로 수행하고... ,https://www.kgnews.co.kr/news/article.html?no=867053,https://www.kgnews.co.kr/news/article.html?no=867053,"Fri, 26 Sep 2025 20:32:00 +0900"
금융위,78년 영욕의 검찰청 역사 속으로...정부조직법 국회 통과,당초 민주당이 추진했던 금융위원회 개편은 이번 수정안에서는 제외됐다. 당초 재경부로 넘길 방침이었던 금융위의 국내 금융 정책 기능은 기존 금융위가 그대로 수행한다. 금융감독원도 현행 체제대로 유지한다.... ,https://www.slist.kr/news/articleView.html?idxno=681253,https://www.slist.kr/news/articleView.html?idxno=681253,"Fri, 26 Sep 2025 20:28:00 +0900"
금융위,"[단독] 웰바이오텍 이상거래 보고서, 검찰이 가로채고 수사 은폐?","금감원, 금융위가 아닌 검찰에 제출한 것으로 확인됐습니다. 그렇게 검찰이 사건을 덮은 게 아니냐는 의혹이... 하지만 한국거래소는 1년 뒤 조사결과인 '심리 보고서'를 금융위와 금감원이 아닌 서울남부지검에... ",https://imnews.imbc.com/replay/2025/nwdesk/article/6760319_36799.html,https://n.news.naver.com/mnews/article/214/0001451959?sid=101,"Fri, 26 Sep 2025 20:27:00 +0900"
금융위,"[단독] 한국거래소, 주가조작 의혹 웰바이오텍 이상거래 보고서 검찰에...","통상 한국거래소가 이상 거래를 심리해 금감원에 통보하면 금감원이 조사한 뒤, 금융위 증권선물위원회가... 한국거래소도 금융위와 금감원에 통보하지 않은 이유를 물었지만 답하지 않았습니다.",https://imnews.imbc.com/news/2025/econo/article/6760318_36737.html,https://n.news.naver.com/mnews/article/214/0001451956?sid=101,"Fri, 26 Sep 2025 20:27:00 +0900"
금융위,정부조직법 국회 통과…78년만 검찰청 폐지·기재부 분리,당초 민주당이 추진했던 금융위원회 개편은 이번 수정안에서는 제외됐습니다. 당초 재경부로 넘길 방침이었던 금융위의 국내 금융 정책 기능은 기존 금융위가 그대로 수행합니다. 금융감독원도 현행 체제대로... ,https://news.sbs.co.kr/news/endPage.do?news_id=N1008274114&plink=ORI&cooper=NAVER,https://n.news.naver.com/mnews/article/055/0001295951?sid=100,"Fri, 26 Sep 2025 20:26:00 +0900"
금융위,"[기자수첩] 헛되이 소진한 금융감독 개혁동력, 또 승리한 기득권",정부-여당이 금융위와 금감원 조직 개편을 사실상 포기한 모양새가 됐다. 금융위 해체-금감원 개편 논의가 발생된 이유는 관치금융 때문이다. 금융은 남의 돈을 받아다가 푸는 사람이 당장 돈 없는 사람에게 빌려주는 것을... ,https://www.tfmedia.co.kr/news/article.html?no=195846,https://www.tfmedia.co.kr/news/article.html?no=195846,"Fri, 26 Sep 2025 20:16:00 +0900"
금융위,검찰청 78년 만에 폐지…정부조직법 개정안 국회 통과,"정부조직법 수정안에는 당초 민주당이 추진했던 금융위원회 개편은 담기지 않았다. 당초 재경부로 넘길 방침이었던 금융위의 국내 금융정책 기능은 기존 금융위가 그대로 수행하며, 금융감독원도 유지된다. 또... ",https://www.viva100.com/article/20250926500845,https://www.viva100.com/article/20250926500845,"Fri, 26 Sep 2025 20:12:00 +0900"
금융위,정부조직법 與주도 국회 통과…78년만 검찰청 폐지·기재부 분리(종합),당초 민주당이 추진했던 금융위원회 개편은 이번 수정안에서는 제외됐다. 당초 재경부로 넘길 방침이었던 금융위의 국내 금융 정책 기능은 기존 금융위가 그대로 수행한다. 금융감독원도 현행 체제대로 유지한다.... ,https://www.yna.co.kr/view/AKR20250926145551001?input=1195m,https://n.news.naver.com/mnews/article/001/0015651902?sid=100,"Fri, 26 Sep 2025 20:10:00 +0900"
금융위,검찰청 78년 만에 간판 내려간다…정부조직법 與 주도 본회의 통과,"다만 당초 더불어민주당이 추진했던 금융위원회 개편안은 이번 수정안에서 제외됐다. 금융위의 국내 금융정책 기능을 재정경제부로 이관하고 금융감독위원회를 신설하는 방안이 논의됐으나, 여야 협의가 어려운... ",https://www.newsworks.co.kr/news/articleView.html?idxno=812874,https://www.newsworks.co.kr/news/articleView.html?idxno=812874,"Fri, 26 Sep 2025 20:08:00 +0900"
