Keyword,Title,Description,Original Link,Link,Publication Date
이재명,한국부동산원 신임 원장에 ‘대통령 측근’ 이헌욱 전 GH 사장,"경기주택도시공사 사장 재임 기간에는 당시 이재명 경기도지사의정책 기조에 따라 보편적 장기공공임대주택 모델인 기본주택 정책을 개발했으며, 공공주택 공급과 도시개발 등 부동산 정책 전반을 폭넓게 다뤄온 부동산... ",https://biz.chosun.com/real_estate/real_estate_general/2026/02/25/T36AS5NR3FH33KOY4SO5422CPY/?utm_source=naver&utm_medium=original&utm_campaign=biz,https://n.news.naver.com/mnews/article/366/0001144400?sid=101,"Wed, 25 Feb 2026 17:05:00 +0900"
이재명,"李대통령 &quot;與, 정부지원 부족함 없어…자사주 소각 입법 조속 처리 기대...","이재명 대통령이 &quot;대통령은 뒷전이 된 일이 없고, 그렇게 느낀 적도 없다&quot;고 밝혔다. 이 대통령은 24일 &lt;우연이 계속되면 의도?…'뒷전' 된 대통령에 與 '설왕설래'&gt;라는 제목의 기사를 'X'(옛 트위터)에 공유하며 &quot;과도한... ",https://www.gobalnews.com/news/articleView.html?idxno=201453,https://www.gobalnews.com/news/articleView.html?idxno=201453,"Wed, 25 Feb 2026 17:04:00 +0900"
이재명,설탕 16%·밀가루 6% 낮췄는데... 농심·삼양 &quot;가격인하 어렵다&quot;,사진=연합뉴스 이재명 대통령이 전분당 업체의 담합 행태를 지적하며 원가 하락 효과가 소비자 가격에도 반영돼야 한다고 강조했지만 라면·제과 등 식품업계는 난색을 표하고 있다. 인건비·물류비 등 부담이 여전히 큰... ,https://www.meconomynews.com/news/articleView.html?idxno=128141,https://www.meconomynews.com/news/articleView.html?idxno=128141,"Wed, 25 Feb 2026 17:04:00 +0900"
이재명,"민주당 상임고문단 &quot;코스피 6000 돌파, 국민들이 대통령 신뢰해 가능&quot;","이재명 대통령, 청와대 초청 오찬 간담회 진행 임채정 &quot;남북 관계 적극적으로 관리해 나가야&quot; 李 &quot;부동산 묶인 돈 자본 시장 이동은 고무적&quot; 아주경제=정해훈 기자 ewigjung@ajunews.com 이재명 대통령이 25일 청와대에서 열린... ",https://www.ajunews.com/view/20260225170024849,https://www.ajunews.com/view/20260225170024849,"Wed, 25 Feb 2026 17:04:00 +0900"
이재명,[영상] 대통령이 ‘할말’ 대신 해주자.. 얼굴 빨개진 참석자 “감사합...,2026년 2월 25일 청와대에서이재명 대통령 제11차 확대국가관광전략회의가 진행되었다. 진실언론 팩트TV가 독자 여러분의 소중한 제보를 받습니다.뉴스 가치나 화제성이 있다고 판단되는 영상을 ()으로,http://facttv.kr/facttvnews/detail.php?number=44691&thread=21r02,http://facttv.kr/facttvnews/detail.php?number=44691&thread=21r02,"Wed, 25 Feb 2026 17:04:00 +0900"
이재명,"박현탁 안산시장 예비후보, 선관위 후보자 등록 완료","뛰는 안산, 살맛 나는 안산'이라는 슬로건을 내걸었다. 박 예비후보는 다음 달 2일 오후 3시 안산시 에술의전당 국제회의장에서 '이재명주의자 박현탁의 3 Well 안산 이야기' 출판기념회를 갖는다. [신아일보] 안산",http://www.shinailbo.co.kr/news/articleView.html?idxno=2196145,http://www.shinailbo.co.kr/news/articleView.html?idxno=2196145,"Wed, 25 Feb 2026 17:04:00 +0900"
이재명,코스피 6000 시대… 정부·여당도 '주주가치' 정책으로 화답,이재명 정부가 공약으로 내걸었던 자본시장 개혁의 성과물들이 지수 신고점과 맞물려 한꺼번에 쏟아진 형국이다. 사진=연합뉴스 국회에서는 민주당 주도로 자사주 소각 의무화를 골자로 한 3차 상법 개정안이 본회의를... ,http://www.edaily.co.kr/news/newspath.asp?newsid=05359526645354128,https://n.news.naver.com/mnews/article/018/0006224622?sid=101,"Wed, 25 Feb 2026 17:04:00 +0900"
이재명,"BNK금융지주, 사외이사 과반 ‘주주 추천’…형식적 변화 벗어날까",앞서 지난해 12월 이재명 대통령은 국민연금 업무보고에서 국민연금기금이 기업의 의사결정에 개입하는 '스튜어드십 코드'를 언급하며 국민연금의 주주권 강화를 주문한 바 있다. 이에 따라 BNK금융이 처음 주주 공개... ,https://www.ekn.kr/web/view.php?key=20260225026512682,https://www.ekn.kr/web/view.php?key=20260225026512682,"Wed, 25 Feb 2026 17:04:00 +0900"
이재명,"李대통령, '무안국제공항 폐쇄 장기화'에 &quot;빨리 재개항해야&quot;","유가족 협의 등 '최대한 신속한 논의' 주문…&quot;무한대로 끌 순 없어&quot; 이재명 대통령은 25일 12·29 제주항공 여객기 참사로 무안국제공항 폐쇄 상태가 길어지는 것과 관련, 유가족과의 협의를 비롯한 재개항 논의를 신속하게... ",https://www.yna.co.kr/view/AKR20260225149000001?input=1195m,https://n.news.naver.com/mnews/article/001/0015924682?sid=100,"Wed, 25 Feb 2026 17:04:00 +0900"
이재명,3차 상법개정안도 국회 통과…남은 '지배구조' 이슈는?,이재명 대통령은 이날도 &quot;주가누르기 방지법 등 해야 할 일이 산더미&quot;라고 추진 의지를 피력했다. 민주당은... 이재명 정부의 자본시장 개혁이 2막으로 넘어가는 상황에서 거래소가 제대로 기능하지 못할 경우 개정 상법의... ,https://view.asiae.co.kr/article/2026022511240407872,https://n.news.naver.com/mnews/article/277/0005725993?sid=101,"Wed, 25 Feb 2026 17:04:00 +0900"
이재명,이헌욱 신임 한국부동산원 원장 취임,경기주택도시공사 사장 재임 기간에는 당시 이재명 경기도지사의 정책 기조에 따라 보편적 장기공공임대주택 모델인 기본주택 정책을 개발한 인물이다. 이헌욱 원장은 이날 취임식에서 &quot;부동산은 국민의 삶의 터전이자... ,https://www.imaeil.com/page/view/2026022516535321017,https://n.news.naver.com/mnews/article/088/0000998458?sid=101,"Wed, 25 Feb 2026 17:04:00 +0900"
이재명,李대통령 &quot;관세협상은 정상간 약속…美와 조율해 뚜벅뚜벅 가겠다&quot;,심언기 한재준 김근욱 기자 = 이재명 대통령은 25일 미국의 상호관세 인상 움직임과 관련해 기존 합의를 바탕으로 협의를 진행하겠다는 입장을 밝혔다. 이 대통령은 이날 청와대에서 민주당 상임고문단을 초청해 가진... ,https://www.news1.kr/politics/president/6083001,https://n.news.naver.com/mnews/article/421/0008793543?sid=100,"Wed, 25 Feb 2026 17:04:00 +0900"
이재명,이재명 정부의 '실용주의'와 장애인의 주권 / 전근배,이재명 대통령이 국무회의를 진행하는 사진 위에 칼럼의 제목인 '이재명 정부의 '실용주의'와 장애인의 주권'이 쓰여있다. 사진 청와대 &quot;정치란 무엇인가? 이 질문에 내가 항상 하는 이야기가 있다. 정치는 정해져 있는... ,https://www.beminor.com/news/articleView.html?idxno=29468,https://www.beminor.com/news/articleView.html?idxno=29468,"Wed, 25 Feb 2026 17:04:00 +0900"
이재명,김상욱 의원 &quot;울산시장 출마…정치적 험지에 정면 돌파&quot;,"김 의원은 22대 총선에서 국민의힘 소속으로 당선됐으나, 12·3 비상계엄 사태와 탄핵 정국을 거치며 당에 반발해 탈당했다. 이후 치러진 조기 대선에서 이재명 대통령을 지지하며 민주당에 입당했다.",https://www.news1.kr/local/ulsan/6082985,https://n.news.naver.com/mnews/article/421/0008793538?sid=102,"Wed, 25 Feb 2026 17:03:00 +0900"
이재명,李대통령 &quot;부동산→자본시장 돈줄기 고무적&quot;…'주가누르기 방지법' 강조...,이재명 대통령은 25일 &quot;'주가 누르기 방지법' 등 해야 할 일이 산더미&quot;라면서 자본시장 정상화에 속도를 내겠다는 의지를 재차 강조했다. 특히 이 대통령은 최근 부동산에 묶여 있던 돈이 생산적 자본 시장으로 흘러가는... ,http://www.fnnews.com/news/202602251654029663,https://n.news.naver.com/mnews/article/014/0005482824?sid=100,"Wed, 25 Feb 2026 17:03:00 +0900"
이재명,&quot;대법원 위 헌재 안 돼&quot; 사법부 집단 반발… 민주당 '사법개혁 3법' 강행...,"과거 '양승태 전 대법원장의 사법농단 사건', 이재명 대통령 후보 시절 공직선거법 위반 사건에서 대법원이 이례적인 속도로 파기 환송한 사건이 도화선이 됐다. 하지만 4심제 도입을 두고 사법제도 개선이 아닌 '대법원... ",http://www.fnnews.com/news/202602251622186699,https://n.news.naver.com/mnews/article/014/0005482823?sid=102,"Wed, 25 Feb 2026 17:03:00 +0900"
이재명,"노영민, 충북지사 예비후보 등록","이어 &quot;이재명 정부의 민생 개혁과제와 실사구시, 실용주의 정신을 충북의 최우선 정책방향으로 삼겠다&quot;며 &quot;3선 국회의원, 주중대사, 대통령 비서실장 경험에서 얻은 든든한 중앙인맥과 국정 운영 노하우를 지역 발전을... ",http://www.dynews.co.kr/news/articleView.html?idxno=840144,http://www.dynews.co.kr/news/articleView.html?idxno=840144,"Wed, 25 Feb 2026 17:02:00 +0900"
이재명,&quot;빌라 임대업 대출 막으면 서민 주거불안 심화&quot;,이재명 대통령은 지난 13일 SNS를 통해 “자가 주거용이 아닌 투자·투기용의 다주택 취득에 금융 혜택까지 주는 건 문제가 있다”고 지적했다. 정부는 임대사업자의 대출 만기 연장 때 ‘임대소득 대비 이자상환비율(RTI)... ,https://www.hankyung.com/article/2026022546901,https://n.news.naver.com/mnews/article/015/0005255156?sid=101,"Wed, 25 Feb 2026 17:02:00 +0900"
이재명,"한미, 다음 달 9일 '자유의 방패' 연합 연습 시작","이재명 정부는 임기 내 전작권 전환을 추진 중인데, 전시를 가정한 우리 군의 한미 연합군 지휘 능력 최종 검증되어야 합니다. 장도영 합참 공보실장은 &quot;미래연합사 완전 운용 능력 검증에 중점을 두고, 한미 공동 평가도... ",http://www.yonhapnewstv.co.kr/MYH20260225170112a1b,https://n.news.naver.com/mnews/article/422/0000837667?sid=100,"Wed, 25 Feb 2026 17:02:00 +0900"
이재명,김영환 충북지사 &quot;대전·충남 통합법 보류 환영&quot;,이재명 대통령이 전날 통합법 보류 결정 이후 SNS를 통해 &quot;천년의 역사를 가진 광역 행정구역의 통합을 충분한 공감 없이 일방적으로 강행할 수는 없다&quot;고 밝힌 것을 염두에 둔 발언이다. 김 지사는 &quot;행정통합은 무엇보다... ,http://www.dynews.co.kr/news/articleView.html?idxno=840140,http://www.dynews.co.kr/news/articleView.html?idxno=840140,"Wed, 25 Feb 2026 17:02:00 +0900"
이재명,[Invest]박상진 산은 회장 &quot;상반기 7대 프로젝트 승인…HMM 매각은 부산...,"이재명 대통령이 HMM의 부산 이전을 주문한 가운데, 3~4월 주주총회에서 관련 안건이 논의될 지가 관심이다.박 회장은 &quot;해진공과 해수부가 주주총회에 맞춰 부산 이전을 완료하겠다고 발표했고, 이전이 결정되면 저희도... ",https://www.investchosun.com/site/data/html_dir/2026/02/25/2026022580166.html,https://www.investchosun.com/site/data/html_dir/2026/02/25/2026022580166.html,"Wed, 25 Feb 2026 17:02:00 +0900"
이재명,[최인혁의 말줄임표] 첫 단추는 꿰었지만 흐려지는 개헌 명분,특히 이재명 대통령 또한 대선 후보 시절 대통령 권한 분산과 책임 강화를 골자로 한 개헌 필요성을 밝힌 바 있다. 그러나 정부 출범 이후 개헌 논의는 기대만큼 속도를 내지 못하고 있다. 특히 87헌법 개헌의 핵심으로... ,https://www.ajunews.com/view/20260225133708550,https://www.ajunews.com/view/20260225133708550,"Wed, 25 Feb 2026 17:02:00 +0900"
이재명,"靑 &quot;대통령·청와대 뜻과 당의 뜻, 어긋나 문제 일으켰던 적 없어&quot;","이규연 청와대 홍보소통수석은 이날 오후 청와대 춘추관 브리핑에서 관련 질문을 받고 이같이 답하며 &quot;당청 관계에 무슨 갈등이 있는 것처럼 비치는 지금 상황이 바람직하지도 않고, 또 현실에 부합하지도 않다고 (이재명... ",http://www.inews24.com/view/1942830,https://n.news.naver.com/mnews/article/031/0001008353?sid=100,"Wed, 25 Feb 2026 17:02:00 +0900"
이재명,"박상진 산은 회장, 석화 채권단에 &quot;자기입장만 고집하면 공멸&quot;","국민성장펀드는 미래 전략산업에 5년간 150조원 투자하는 이재명 정부의 대표적 정책펀드로, 산업은행이 집행과 운영을 맡고 있다. 지난 1월 1호 사업인 신안 우이 해상풍력 발전 사업이 승인됐으며, 2호와 3호 사업이... ",https://www.joongang.co.kr/article/25407316,https://n.news.naver.com/mnews/article/025/0003505198?sid=101,"Wed, 25 Feb 2026 17:02:00 +0900"
이재명,"[사설]광주 군·민간공항 무안이전, 행정통합과 별개","이재명 대통령이 지난해 6월 25일 광주·전남 타운홀 미팅에서 국가 지원, 대통령 직속 TF구성, 충분한 보상 등 통합이전 관련 3대 원칙을 제시하면서 국가주도의 이전사업으로 추진한 지 6개월만이었다. 하지만 군공항 이전... ",https://www.namdonews.com/news/articleView.html?idxno=902346,https://www.namdonews.com/news/articleView.html?idxno=902346,"Wed, 25 Feb 2026 17:02:00 +0900"
이재명,대전·충남통합법 보류 책임 두고 '네 탓 공방' 점입가경,"김태흠 충남지사도 &quot;이재명 대통령께서 법안 보류가 시도의회 탓인 양 말씀하시는데, 이는 '유체이탈 화법'이자 '무책임한 책임 전가'&quot;라면서 &quot;행정통합은 속도가 아니라 재정과 권한 이양이 중요한데, 민주당이 주도하는... ",http://www.dynews.co.kr/news/articleView.html?idxno=840142,http://www.dynews.co.kr/news/articleView.html?idxno=840142,"Wed, 25 Feb 2026 17:02:00 +0900"
이재명,"박상진 “HMM, 부산 이전 마무리 뒤 매각”",HMM 부산 이전은 이재명 대통령이 공약으로 제시했으나 노동조합 반발 등으로 지지부진한 상태다. 박 회장은 향후 HMM 매각 원칙에 대해 “가격보다 국적선사로 잘 기능할 수 있는지를 살펴볼 것”이라며 “해양수산부와... ,https://www.sedaily.com/article/20012600?ref=naver,https://n.news.naver.com/mnews/article/011/0004593412?sid=101,"Wed, 25 Feb 2026 17:01:00 +0900"
이재명,손가락 없는 장갑에 '깜놀' 룰라 대통령[오늘저녁],"특히 소년공 출신이라는 공통분모가 있는 이재명 대통령과 룰라 대통령, 두 정상의 돈독한 케미 뒤에는 이런 보이지 않는 세심한 배려가 숨어있었네요. 룰라 대통령의 기억 속에 대한민국은 '작은 것도 놓치지 않는... ",https://www.nocutnews.co.kr/news/6476326?utm_source=naver&utm_medium=article&utm_campaign=20260225050035,https://n.news.naver.com/mnews/article/079/0004118949?sid=102,"Wed, 25 Feb 2026 17:01:00 +0900"
이재명,박상진 산은 회장 “HMM 본사 부산 이전 후 매각”,그간 재무건전성 부담을 이유로 신속한 매각에 무게를 실어왔지만 이재명 대통령의 부산 이전 의지가 강한 만큼 이를 뒷받침하는 게 우선이라고 판단한 것으로 풀이된다. 빠른 부산 이전을 위해선 정부 산하 기관들이... ,https://www.mk.co.kr/article/11971800,https://n.news.naver.com/mnews/article/009/0005641952?sid=101,"Wed, 25 Feb 2026 17:01:00 +0900"
이재명,'코스피 6000 돌파' 치켜세운 與 원로들…李 대통령 반응은,&quot;코스피 6000 돌파는 국민들이 그만큼 이재명 대통령을 믿었기에 가능했다.&quot; (이용득 더불어민주당... 홍보소통수석은 &quot;이재명 대통령은 별말씀이 없으셨고 (간담회에) 참가하신 고문들의 얘기들이 굉장히 많았다&quot;고... ,https://www.mt.co.kr/politics/2026/02/25/2026022516544077896,https://n.news.naver.com/mnews/article/008/0005322247?sid=100,"Wed, 25 Feb 2026 17:01:00 +0900"
정상순방,李대통령 &quot;명청 갈등은 기우... 대통령 뒷전 된 적 없다&quot;,이 대통령은 이날 &quot;한-브라질 정상회담 성과에도 여당인 더불어민주당의 지원사격이 빈약했다는 당내 일각의... 이 대통령이 주요 외교 순방을 나섰을 때도 민주당은 '내란특별재판부'와 '전당원 1인 1표제' 등을 추진하며... ,https://www.insight.co.kr/news/544326,https://www.insight.co.kr/news/544326,"Wed, 25 Feb 2026 10:46:00 +0900"
정상순방,"李대통령, '당청 엇박자' 우려 일축",지난 1월14일 일본 순방 일정을 마친 이재명 대통령이 경기 성남 서울공항에 도착해 정청래 더불어민주당... 지난 23일 진행된 한·브라질 정상회담에서 이뤄진 성과를 제대로 띄우지 못한 것과 앞서 정청래 대표가... ,http://www.00news.co.kr/news/articleView.html?idxno=102119,http://www.00news.co.kr/news/articleView.html?idxno=102119,"Wed, 25 Feb 2026 10:14:00 +0900"
정상순방,"이 대통령, &quot;민주당 정부지원 부족함 없다&quot; 당-청 엇박자 일축","대통령과 정상회담을 갖고 67년 만에 '전략적 동반자 관계'를 맺는 등 큰 외교 성과를 가져왔지만, 성과... 외교 순방을 나갔을 때 화제성이 큰 '내란특별재판부'와 '전당원 1인 1표제' 등을 추진한 점을 들었다. 이는 매명... ",https://www.goodmorningcc.com/news/articleView.html?idxno=441656,https://www.goodmorningcc.com/news/articleView.html?idxno=441656,"Wed, 25 Feb 2026 09:32:00 +0900"
정상순방,'육천피' 앞둔 코스피…美관세 불안에도 상승 모멘텀 이어가나,"인도와 일본, 호주를 순방하면서 리튬·반도체 등에 대한 실질적인 공급망을 구축하고 있으며, EU의 무기... 지난해 10월 경주 APEC 정상회의에서 카니 총리는 이재명 대통령과 만나 '한-캐나다 안보·방산 협력 파트너십... ",https://www.itbiznews.com/news/articleView.html?idxno=204821,https://www.itbiznews.com/news/articleView.html?idxno=204821,"Wed, 25 Feb 2026 08:00:00 +0900"
정상순방,우연이 계속되면 의도?…'뒷전' 된 대통령에 與 '설왕설래',한·브라질 정상회담 성과에도 與 지원사격 빈약 계속된 지적에도 '엇박자' 계속…분열 우려 증폭 이재명... 앞서도 정 대표는 이 대통령이 주요 외교 순방을 나갔을 때 화제성이 큰 '내란특별재판부'와 '전당원 1인 1표제... ,https://news.tf.co.kr/read/ptoday/2295836.htm,https://n.news.naver.com/mnews/article/629/0000475353?sid=100,"Wed, 25 Feb 2026 00:01:00 +0900"
정상순방,방산·AI 협의 차 UAE로 출국…강훈식 “실질 성과 만들겠다”,"한편, 이 대통령은 지난해 11월 중동·아프리카 순방 중 UAE와 방산 협력과 관련한 실질적인 성과를 시사하기도 했다. 당시 이 대통령은 무함마드 빈 자이드 알 나흐얀 UAE 대통령과의 정상회담에서 단순한 무기 구매... ",http://www.edaily.co.kr/news/newspath.asp?newsid=04352566645353800,https://n.news.naver.com/mnews/article/018/0006223576?sid=100,"Tue, 24 Feb 2026 14:27:00 +0900"
정상순방,"강훈식 실장, UAE로 출국…&quot;제3국 함께 진출하는 성과 위해 힘쓸 것&quot;",강 실장은 24일 자신의 SNS(소셜미디어)에 &quot;지난해 10월 APEC(아시아태평양경제협력체) 계기 정상회담과... 당시 강 실장은 귀국하면서 순방 성과에 대해 &quot;(K-방산이) 북유럽 전체로 진출하는 전략적 교두보를 마련한 것... ,https://www.mt.co.kr/politics/2026/02/24/2026022413425140222,https://n.news.naver.com/mnews/article/008/0005321472?sid=100,"Tue, 24 Feb 2026 14:03:00 +0900"
정상순방,"강훈식, 방산·AI 협력 논의차 UAE로…&quot;실질적 성과 노력&quot;",한편 이 대통령은 지난해 11월 중동·아프리카 순방 중 UAE와의 방산 협력 관련 실질적인 성과를 시사한 바 있다. 당시 이 대통령은 무함마드 빈 자이드 알 나흐얀 UAE 대통령과의 정상회담에서 단순한 무기 구매... ,https://news.einfomax.co.kr/news/articleView.html?idxno=4400127,https://news.einfomax.co.kr/news/articleView.html?idxno=4400127,"Tue, 24 Feb 2026 13:46:00 +0900"
정상순방,“구민회관보다 못한 靑 영빈관”…이번엔 바꿀까 [런치정치],다수의 해외 순방 경험을 지닌 한 청와대 관계자는 &quot;영빈관이라면 국격 차원에서 정상급 객실(PRS·Presidential Suite)을 마련해 제공하는 것이 전형적&quot;이라며 &quot;과거와 달리 외교의 중요성이 국정의 절반 이상을 차지하는... ,https://www.ichannela.com/news/main/news_detailPage.do?publishId=000000515932,https://n.news.naver.com/mnews/article/449/0000336157?sid=100,"Tue, 24 Feb 2026 12:19:00 +0900"
국회,"거래소 이사장 “6000피, 일시적 지수 상승 아닌 축적된 결과”","정무위원회 야당 간사인 강민국 국민의힘 의원은 “오늘 이 자리는 단순한 숫자의 갱신이 아닌 우리 시장에 대한 믿음과 경쟁력, 미래에 대한 기대를 확인하는 자리”라며 “국회에서도 시장 자율성과 책임을 존중하고... ",https://www.sedaily.com/article/20012626?ref=naver,https://n.news.naver.com/mnews/article/011/0004593416?sid=101,"Wed, 25 Feb 2026 17:04:00 +0900"
국회,3차 상법개정안도 국회 통과…남은 '지배구조' 이슈는?,자사주 소각 의무화를 골자로 한 3차 상법개정안이 25일 오후 국회 본회의를 통과하면서 이제 시장의 눈은 남은 '지배구조' 현안으로 쏠리고 있다. '주가누르기 방지법'을 시작으로 한 상속·증여세 개편은 물론... ,https://view.asiae.co.kr/article/2026022511240407872,https://n.news.naver.com/mnews/article/277/0005725993?sid=101,"Wed, 25 Feb 2026 17:04:00 +0900"
국회,"전남도-헌정회, 외래어종 퇴치 및 자원화 협약",전라남도는 25일 국회 헌정회관에서 대한민국헌정회와 '생태계 교란 외래어종 퇴치 및 자원화를 위한 업무협약'을 체결했다. 이번 협약은 하천과 저수지 등 내수면 생태계에서 토종 치어와 새우류를 무분별하게 포식하는... ,http://www.ttlnews.com/news/articleView.html?idxno=3083293,http://www.ttlnews.com/news/articleView.html?idxno=3083293,"Wed, 25 Feb 2026 17:04:00 +0900"
국회,3차 상법 개정안 국회 통과… 자사주 소각 의무화,연합뉴스 자사주 소각 의무화를 주요 골자로 하는 3차 상법 개정안이 25일 국회를 통과했다. 3차 상법 개정안은 지난 24일 국회 본회의에 상정됐다. 국민의힘은 이에 반발해 필리버스터에 돌입했다. 그러나 더불어민주당이... ,https://m.skyedaily.com/news_view.html?ID=299084,https://m.skyedaily.com/news_view.html?ID=299084,"Wed, 25 Feb 2026 17:04:00 +0900"
국회,&quot;이름만 바꿀 게 아니라 명실상부하게 노동절을 법정공휴일로&quot;… 공노총...,"공노총이 홍보활동을 전개하는 것은 이런 현실을 국민에게 알리고, 국회 행정안전위원회에 계류 중인... 아울러 여·야 국회의원과의 릴레이 정책간담회를 통해 정당한 휴식권도 보장받지 못하는 공무원 노동자의 처우를... ",https://www.public25.com/news/articleView.html?idxno=41046,https://www.public25.com/news/articleView.html?idxno=41046,"Wed, 25 Feb 2026 17:04:00 +0900"
국회,국토부 산하 기관장에 인천 출신 인선 기대감 증폭,또 국토부 산하기관인 한국토지주택공사(LH) 신임 사장에 최근 무죄 판결을 받은 인천 출신 이성만 전 국회의원이 유력하게 언급되고 있다. LH는 이달 중 공공공사 발주 계획을 발표할 예정으로 사장 인선 작업도 함께... ,https://www.kihoilbo.co.kr/news/articleView.html?idxno=3014535,https://www.kihoilbo.co.kr/news/articleView.html?idxno=3014535,"Wed, 25 Feb 2026 17:04:00 +0900"
국회,"포항시, 이상휘 국회의원과 2027 국비 확보 전략 논의","이번 간담회는 이상휘 국회의원(포항 남구·울릉)을 비롯해 포항시 국장급 공무원이 참석한 가운데, 포항의... 특히 지역의 목소리가 정책에 적극 반영될 수 있도록 포항시와 지역 국회의원 간의 긴밀한 공조 체계를... ",https://www.wikitree.co.kr/articles/1120763,https://www.wikitree.co.kr/articles/1120763,"Wed, 25 Feb 2026 17:04:00 +0900"
국회,유영하 &quot;TK통합법 보류는 지역 생존 외면…책임은 지역 의원 몫&quot;,6·3지방선거 대구시장 출마예정자인 유영하 국민의힘 의원이 국회 법제사법위원회에서 '대구경북 행정통합... 있었겠느냐&quot;고 반문한 뒤 &quot;법안 표류에 대한 책임은 우리 지역구 국회의원들이 져야 할 것&quot;이라고 경고했다.,https://www.idaegu.co.kr/news/articleView.html?idxno=539867,https://www.idaegu.co.kr/news/articleView.html?idxno=539867,"Wed, 25 Feb 2026 17:04:00 +0900"
국회,"민주당 상임고문단 &quot;코스피 6000 돌파, 국민들이 대통령 신뢰해 가능&quot;","이날 간담회에는 권노갑·이용득 상임고문, 문희상·김원기·김진표·박병석·임채정·정세균 전 국회의장, 한명숙 전 국무총리, 정동영 통일부 장관 등이 참석했다. 권노갑 상임고문은 &quot;부동산과 주식 등 경제 전반에서... ",https://www.ajunews.com/view/20260225170024849,https://www.ajunews.com/view/20260225170024849,"Wed, 25 Feb 2026 17:04:00 +0900"
