Keyword,Title,Description,Original Link,Link,Publication Date
수출입은행,"&quot;全과정 블라인드&quot;...기업은행 등 국책銀, '공정·사회형평적' 채용 확대",국책은행인 IBK기업은행과 한국수출입은행이 올해 하반기 공개채용을 통해 433명의 신입 행원을 뽑을 예정이다. 29일 은행권에 따르면 기업은행과 수출입은행은 각각 내달 15일과 3일 오전 10시까지 하반기 신입 행원... ,http://www.wikileaks-kr.org/news/articleView.html?idxno=174045,http://www.wikileaks-kr.org/news/articleView.html?idxno=174045,"Fri, 29 Aug 2025 17:36:00 +0900"
수출입은행,'씨앗' 빌려 성장 가속페달…나랏빚은 매년 125조원 불어나,"일반행정 예산(121조1000억원)도 9.4% 늘었는데, 정책금융 지원을 위해 산업은행과 수출입은행 출자 등에 1조9000억원을 배정했기 때문이다. 첨단산업을 지원해 잠재성장률을 끌어올리면 세입 기반도 확충할 수 있다는... ",https://www.hankyung.com/article/2025082910171,https://n.news.naver.com/mnews/article/015/0005177608?sid=101,"Fri, 29 Aug 2025 17:36:00 +0900"
수출입은행,"[2026 예산안] 정부, '마스가' 대미 투자 지원 예산 1.9조원 편성","29일 정부가 의결·발표한 ‘2026년도 예산안’에 따르면, 정부는 내년 한미 산업 협력을 강화하기 위해 산업은행, 수출입은행, 무역보험공사 등을 통한 정책 금융 패키지 지원에 나선다. 일명 마스가(MASGA·미국 조선업을... ",http://www.shinailbo.co.kr/news/articleView.html?idxno=2107722,http://www.shinailbo.co.kr/news/articleView.html?idxno=2107722,"Fri, 29 Aug 2025 16:52:00 +0900"
수출입은행,"李정부, 통상 대응 예산 '70배' 늘려 대미 관세협상 지원","대미 투자 패키지는 조선, 반도체 등 미국이 전략적으로 키우려는 프로젝트를 직접 투자, 대출, 보증을 통해 지원하는 방식이 유력한데, 이를 차질 없이 뒷받침하기 위해 산업은행, 수출입은행, 무역보험공사 등... ",https://www.womaneconomy.co.kr/news/articleView.html?idxno=240742,https://www.womaneconomy.co.kr/news/articleView.html?idxno=240742,"Fri, 29 Aug 2025 16:32:00 +0900"
수출입은행,"정부, '마스가' 등 대미 투자에 예산 1.9조···한미 협력 본격 시동","정부는 산업은행·수출입은행·무역보험공사 등 정책금융기관을 활용한 '대미 투자 패키지'를 마련하고, 향후 상황에 유연하게 대응할 수 있도록 예산을 확보할 방침이다. 정부 관계자는 &quot;세 기관을 체계적으로 묶어... ",https://www.seoulfn.com/news/articleView.html?idxno=605303,https://www.seoulfn.com/news/articleView.html?idxno=605303,"Fri, 29 Aug 2025 16:15:00 +0900"
수출입은행,[서환] 强달러·결제수요에 상승 전환…0.80원↑,"정부는 한미 산업 협력을 강화하기 위해 산업은행, 수출입은행, 무역보험공사 등을 통한 정책 금융 패키지 지원에 나서겠다고 전했다. 같은 날 주요 외신에 따르면 크리스토퍼 월러 연방준비제도(Fed·연준)... ",https://news.einfomax.co.kr/news/articleView.html?idxno=4372148,https://news.einfomax.co.kr/news/articleView.html?idxno=4372148,"Fri, 29 Aug 2025 15:48:00 +0900"
수출입은행,"KAI, 사장 인선 대혼돈에 '올스톱'…기존 3인 멀어지고 민영화 논의 확산",이와 함께 최대주주인 수출입은행장 자리가 여전히 공석인 데다 이재명 대통령의 미국 순방 일정까지 겹치면서 KAI 차기 사장에 대한 인선 작업은 더 지연되고 있다. 사장 부재로 인한 영향은 이미 현실화하고 있다. KF-21... ,https://daily.hankooki.com/news/articleView.html?idxno=1264085,https://daily.hankooki.com/news/articleView.html?idxno=1264085,"Fri, 29 Aug 2025 15:42:00 +0900"
수출입은행,수출입은행 '중소·중견기업 해외진출 펀드'에 2000억 출자,"한국수출입은행(은행장 직무대행 안종혁, 이하 ‘수은’)은 대내외 경제여건 악화에 직면한 수출 중소·중견기업의 원활한 해외진출 지원을 위한 펀드조성에 총 2000억원을 출자한다고 12일 밝혔다. 수은이 밝힌 최종 펀드... ",https://www.hankookilbo.com/News/Read/A2025082913440004029?did=NA,https://n.news.naver.com/mnews/article/469/0000884255?sid=101,"Fri, 29 Aug 2025 15:33:00 +0900"
수출입은행,한국물 진입 기회 엿보는 국내證…토종IB 육성 속 4파전,한동안 주춤했던 미래에셋증권 또한 최근 한국수출입은행 글로벌본드(SEC Registered) 조달의 조인트 리드 매니저(JLM)로 선정돼 존재감을 드러냈다. 국내 증권사가 글로벌 DCM 영토 확장을 위한 투자를 지속하는 가운데... ,https://news.einfomax.co.kr/news/articleView.html?idxno=4372140,https://news.einfomax.co.kr/news/articleView.html?idxno=4372140,"Fri, 29 Aug 2025 15:14:00 +0900"
수출입은행,[이재명 정부 첫 예산] '마스가' 對美투자 지원 1조9천억원,"정부는 한미 산업 협력을 강화하기 위해 산업은행(산은), 수출입은행(수은), 무역보험공사(무보) 등을 통한 정책 금융 패키지 지원에 나서겠다고 했다. 이를 마스가(MASGA·미국 조선업을 다시 위대하게) 프로젝트로 불리는... ",http://www.m-i.kr/news/articleView.html?idxno=1276043,http://www.m-i.kr/news/articleView.html?idxno=1276043,"Fri, 29 Aug 2025 14:34:00 +0900"
수출입은행,"이재명 정부 첫 예산안, '에너지 전환'·'통상 대응'에 방점","산업·수출입은행, 무역보험공사 자본 확충을 통해 대미 전략산업 투자에 속도를 내겠다는 계산이다. 중소 조선사에는 RG(선수금 환급보증) 특례보증 2천억원이 공급되고, 방산 수출기업 지원펀드도 200억원에서... ",https://www.pointdaily.co.kr/news/articleView.html?idxno=266603,https://www.pointdaily.co.kr/news/articleView.html?idxno=266603,"Fri, 29 Aug 2025 14:34:00 +0900"
수출입은행,[2026 예산안] RE100 산단·차세대 전력망에 4.2조원 투입,"대미 투자 패키지는 조선, 반도체 등 미국이 전략적으로 키우려는 프로젝트를 직접 투자, 대출, 보증을 통해 지원하는 방식이 유력한데, 이를 차질 없이 뒷받침하기 위해 산업은행, 수출입은행, 무역보험공사 등... ",http://www.yonhapnewstv.co.kr/AKR20250829142702253,https://n.news.naver.com/mnews/article/422/0000775766?sid=101,"Fri, 29 Aug 2025 14:27:00 +0900"
수출입은행,"[2026 예산안] 정부, '마스가' 등 대미 투자 지원에 1조9천억원","정부는 한미 산업 협력을 강화하기 위해 산업은행(산은), 수출입은행(수은), 무역보험공사(무보) 등을 통한 정책 금융 패키지 지원에 나선다는 방침입니다. 조선 분야 대미 투자·협력과 첨단산업 투자 등 한미 무역 협의... ",http://www.yonhapnewstv.co.kr/AKR20250829141844962,https://n.news.naver.com/mnews/article/422/0000775762?sid=101,"Fri, 29 Aug 2025 14:19:00 +0900"
수출입은행,통상대응·수출기업 지원 4.3조…내연차 팔고 전기차 구매시 100만원,우선 조선·반도체 등 주요 산업의 한미 관세 협상 합의를 뒷받침하기 위해 한국산업은행(산은)·한국수출입은행(수은)·한국무역보험공사(무보) 등 정책금융기관을 통해 1조9000억원 규모의 금융 패키지를 투입한다.... ,https://www.widedaily.com/news/articleView.html?idxno=276581,https://www.widedaily.com/news/articleView.html?idxno=276581,"Fri, 29 Aug 2025 13:20:00 +0900"
수출입은행,[李정부 첫 예산] '마스가' 등 대미 투자 지원에 1조9천억원,"정부는 한미 산업 협력을 강화하기 위해 산업은행(산은), 수출입은행(수은), 무역보험공사(무보) 등을 통한 정책 금융 패키지 지원에 나서겠다고 했다. 이를 마스가(MASGA·미국 조선업을 다시 위대하게) 프로젝트로 불리는... ",https://www.yna.co.kr/view/AKR20250829085100003?input=1195m,https://n.news.naver.com/mnews/article/001/0015594213?sid=100,"Fri, 29 Aug 2025 13:14:00 +0900"
수출입은행,이재명 정부 'RE100' 투자금 50% 늘렸다 한·미 협상 대응 예산은 기존 ...,"산업은행, 수출입은행, 무역보험공사 등 정책금융기관의 자본금 확충 등에 사용된다. 또 한미 조선업 협력을 위해 한미 기술협력센터를 설립하고 중소 조선사의 함정 유지·보수·운영(MRO) 역량을 강화하는 데에... ",http://www.smedaily.co.kr/news/articleView.html?idxno=336068,http://www.smedaily.co.kr/news/articleView.html?idxno=336068,"Fri, 29 Aug 2025 13:12:00 +0900"
수출입은행,RE100 산단·차세대 전력망에 4.2조원 투자…통상 대응 예산 70배↑[2026년...,"대미 투자 패키지는 조선, 반도체 등 미국이 전략적으로 키우려는 프로젝트를 직접 투자, 대출, 보증을 통해 지원하는 방식이 유력한데, 이를 차질 없이 뒷받침하기 위해 산업은행, 수출입은행, 무역보험공사 등... ",https://biz.heraldcorp.com/article/10564754?ref=naver,https://n.news.naver.com/mnews/article/016/0002521389?sid=101,"Fri, 29 Aug 2025 13:08:00 +0900"
수출입은행,[李정부 첫 예산] RE100 산단·차세대 전력망에 4.2조원 집중 투자(종합...,"대미 투자 패키지는 조선, 반도체 등 미국이 전략적으로 키우려는 프로젝트를 직접 투자, 대출, 보증을 통해 지원하는 방식이 유력한데, 이를 차질 없이 뒷받침하기 위해 산업은행, 수출입은행, 무역보험공사 등... ",https://www.yna.co.kr/view/AKR20250829000551003?input=1195m,https://n.news.naver.com/mnews/article/001/0015594118?sid=101,"Fri, 29 Aug 2025 12:22:00 +0900"
수출입은행,[2026 예산안] 전기차 바꾸면 100만원 지원…'K-콘텐츠' 더 키운다,"산업은행·수출입은행·무역보험공사를 통한 1조9천억원 규모의 정책금융 패키지가 마련되고, 조선·반도체 등 대미 관세 협상을 지원합니다. 또한 한미 기술협력센터 설립과 중소 조선사 MRO 역량 강화에 708억원을... ",http://www.yonhapnewstv.co.kr/AKR20250829120817437,https://n.news.naver.com/mnews/article/422/0000775726?sid=101,"Fri, 29 Aug 2025 12:09:00 +0900"
수출입은행,李정부 첫 예산 728조원 국무회의 의결...올해보다 54조원 늘어,"대미 투자 패키지는 조선, 반도체 등 미국이 전략적으로 키우려는 프로젝트를 직접 투자, 대출, 보증을 통해 지원하는 방식이 유력한데, 이를 차질 없이 뒷받침하기 위해 산업은행, 수출입은행, 무역보험공사 등... ",https://www.kyeonggi.com/article/20250829580054,https://n.news.naver.com/mnews/article/666/0000082270?sid=100,"Fri, 29 Aug 2025 12:05:00 +0900"
수출입은행,산업·수출입 은행에 1.9조 투입… ‘마스가’ 전폭 지원,"한국산업은행·한국수출입은행·한국무역보험공사 등을 활용한 정책 금융 패키지 지원(1조9000억 원), 조선업 협력을 위한 한·미 기술협력센터 설립 및 중소 조선사의 신규 함정 유지·보수·정비(MRO) 역량 강화 지원... ",https://www.munhwa.com/article/11529259?ref=naver,https://n.news.naver.com/mnews/article/021/0002732774?sid=100,"Fri, 29 Aug 2025 11:53:00 +0900"
수출입은행,"[2026 예산] 정부, 내년 예산 8.1% 증가한 728조원 편성",대미국 관세협상을 지원하기 위해 산업은행·한국수출입은행 등에 국비 1조9000억원을 투입하고 미국 함정 유지·보수·운영(MRO) 등 조선산업의 세계 협력도 지원한다는 계획이다. 신재생 에너지 전환을 위한 융자... ,https://www.viva100.com/article/20250829500338,https://www.viva100.com/article/20250829500338,"Fri, 29 Aug 2025 11:48:00 +0900"
수출입은행,‘알박기 방지법’과 ‘알박기법’ 사이 [하영춘 칼럼],"국민연금이나 산업은행, 수출입은행, 한국전력처럼 고도의 전문성이나 경영능력이 필요한 곳도 있다. 따라서 물갈이를 할 때는 성과를 객관적으로 따져야 한다. 업무능력이 탁월한 기관장은 전 정부에서 임명했다고 해도... ",https://magazine.hankyung.com/business/article/202508288215b,https://n.news.naver.com/mnews/article/050/0000095577?sid=101,"Fri, 29 Aug 2025 11:48:00 +0900"
수출입은행,"李 정부, 美 관세 대응 예산 4.3조 편성…마스가 예산 신규 포함","산업은행과 수출입은행, 무역보험공사 등을 통한 1조9000억 원의 정책금융 패키지 지원을 통해 조선·반도체 등 대미 관세 협상을 차질 없이 뒷받침한다는 계획이다. 신규 사업으로 미국과의 조선업 협력을 위한... ",https://www.news1.kr/economy/trend/5894860,https://n.news.naver.com/mnews/article/421/0008455203?sid=101,"Fri, 29 Aug 2025 11:38:00 +0900"
수출입은행,"금융권 최초 AI 전담조직 하나금융융합기술원, &quot;대한민국 AI 혁신을 선도...",AI-OCR 기술의 대표적인 사례로는 ▲연간 8만여 건의 문서를 처리하는 하나은행의 수출입문서 핵심내용 자동 추출 ▲하나증권 IRP 계좌 과세이연정보 등록 자동화 ▲하나손해보험의 자동차 주행거리 인식 등이 있으며... ,https://www.fntoday.co.kr/news/articleView.html?idxno=361497,https://www.fntoday.co.kr/news/articleView.html?idxno=361497,"Fri, 29 Aug 2025 11:38:00 +0900"
수출입은행,은행 피싱 배상 ‘한도·면책·형평성’ 쟁점,"황기연(뒷줄 왼쪽부터) 한국수출입은행 상임이사, 노준섭 BNK부산은행 부행장, 황병우 iM뱅크 은행장, 정진완 우리은행장, 이호성 하나은행장, 강태영 NH농협은행장, 최우형 케이뱅크 은행장, 김복규 한국산업은행 전무이사... ",https://biz.heraldcorp.com/article/10564676?ref=naver,https://n.news.naver.com/mnews/article/016/0002521336?sid=101,"Fri, 29 Aug 2025 11:36:00 +0900"
수출입은행,이재명정부 'AI 3강' 초혁신경제에 71조원 올인 [2026년 예산안],"산업은행, 수출입은행, 무역보험공사 등의 정책금융 패키지 지원을 위해 1조9000억원을 투입한다. 한미 조선업 협력을 위한 기술협력센터를 설립하고 중소 조선사의 함정 MRO 역량을 높이는 사업 등에 708억원을... ",http://www.fnnews.com/news/202508291111125685,https://n.news.naver.com/mnews/article/014/0005398678?sid=101,"Fri, 29 Aug 2025 11:24:00 +0900"
수출입은행,"[일지]김건희 여사, 도이치·명태균·건진법사 의혹부터 기소까지","영등포구 수출입은행 본점, 정부세종청사 중앙동 기획재정부 압수수색 -윤 전 대통령·김 여사 출석 통보 ▶22일 -윤재현 참손푸드 대표 소환 조사 -윤영호 전 통일교 세계본부장 소환 조사 -최승준 전 대통령실... ",https://www.news1.kr/society/court-prosecution/5894635,https://n.news.naver.com/mnews/article/421/0008455139?sid=102,"Fri, 29 Aug 2025 11:21:00 +0900"
수출입은행,"이재명정부 첫 예산 728조, 8%대 증액…국가채무 1400조 넘어섰다 [2026년...",대미(對美) 통상 협상을 지원하기 위해 1조9000억원이 산업은행·수출입은행에 투입된다. 이를 통해 미국 함정 MRO(정비·수리·운용) 사업에 국내 조선업체들이 참여할 수 있도록 지원한다. 한류 확산에도 예산이... ,http://www.fnnews.com/news/202508291001122897,https://n.news.naver.com/mnews/article/014/0005398675?sid=101,"Fri, 29 Aug 2025 11:21:00 +0900"
수출입은행,[2026예산안] GPU 1.5만장 추가 확보 2.1조…AI 연구기반 조성 750억,대미 관세협상을 뒷받침하기 위해 산업은행과 수출입은행 등 정책금융 패키지 지원 예산 1조9000억원을 편성했다. 관세로 인한 피해 분석과 물류비 등에 활용할 수 있는 긴급지원바우처 예산은 424억원... ,https://www.etnews.com/20250829000117,https://n.news.naver.com/mnews/article/030/0003345166?sid=101,"Fri, 29 Aug 2025 11:19:00 +0900"
수출입은행,통상대응·수출기업 지원 4.3조…내연차 팔고 전기차 구매시 100만원[李...,우선 조선·반도체 등 주요 산업의 한미 관세 협상 합의를 뒷받침하기 위해 한국산업은행(산은)·한국수출입은행(수은)·한국무역보험공사(무보) 등 정책금융기관을 통해 1조9000억원 규모의 금융 패키지를 투입한다.... ,https://www.newsis.com/view/NISX20250829_0003307634,https://n.news.naver.com/mnews/article/003/0013449791?sid=101,"Fri, 29 Aug 2025 11:17:00 +0900"
수출입은행,"통상·수출 대응에 4.3조, 한류 붐업에 5조…역대 최대 투입","대미 관세협상 등 주요 통상 현안을 뒷받침하기 위해 산업은행, 수출입은행, 무역보험공사 등 정책금융 패키지에 1조9000억원을 투입한다. 조선업 협력을 위해 한·미 기술협력센터를 설립하고 중소조선사의 함정... ",http://news.mt.co.kr/mtview.php?no=2025082816504015900,https://n.news.naver.com/mnews/article/008/0005242844?sid=101,"Fri, 29 Aug 2025 11:17:00 +0900"
수출입은행,관세 피해 800개사 긴급 바우처 받는다…내년 424억원 배정[李정부 첫예...,"산업은행과 수출입은행 등 정책금융 패키지 지원을 위해서는 1조9000억원을 투입, 조선과 반도체 등 대미 관세 협상을 차질 없이 뒷받침할 계획이다. 관세 피해 기업을 지원하기 위해 424억원을 신규로 투입하는... ",https://view.asiae.co.kr/article/2025082909152575848,https://n.news.naver.com/mnews/article/277/0005644014?sid=101,"Fri, 29 Aug 2025 11:15:00 +0900"
수출입은행,대미 관세협상 뒷받침에 2조원 투입…K-유통플랫폼 해외진출 지원 신설...,우선 1조9000억원의 산업은행·수출입은행 등 정책금융 패키지 지원을 통해 조선·반도체 등 대미 관세 협상을 차질없이 뒷받침한다. 조선 협력을 위해 신규 한·미 기술 협력 센터를 설립하고 중소조선사의 신규... ,https://www.dailian.co.kr/news/view/1541857/?sc=Naver,https://n.news.naver.com/mnews/article/119/0002996546?sid=101,"Fri, 29 Aug 2025 11:14:00 +0900"
수출입은행,[李정부 첫 예산] RE100 산단·차세대 전력망에 4.2조원 집중 투자,"기업들에는 산업은행, 한국수출입은행, 무역보험공사 등을 통한 정책금융 패키지 지원과 함께 관세 피해를 보상하는 긴급지원 바우처도 제공한다. 중소 조선사들에는 선수금 환급(RG) 특례보증을 2천억원 규모로... ",https://www.yna.co.kr/view/AKR20250829000500003?input=1195m,https://n.news.naver.com/mnews/article/001/0015593859?sid=101,"Fri, 29 Aug 2025 11:14:00 +0900"
수출입은행,[2026 예산안] '마스가' 등 관세타결 뒷받침 2.1조 투입,먼저 정부는 산업은행·수출입은행·무역보험공사 등 정책금융 패키지 지원을 통해 대미 관세협상을 차질 없이 뒷받침하기 위해 1조9천억원의 예산을 투입한다. 특히 마스가 프로젝트로 명명된 조선업 협력을 위해... ,https://news.einfomax.co.kr/news/articleView.html?idxno=4372082,https://news.einfomax.co.kr/news/articleView.html?idxno=4372082,"Fri, 29 Aug 2025 11:14:00 +0900"
수출입은행,李정부 첫 예산 55조 늘린 728조 '초확장 재정'… 역대 최대 27조 '지출 ...,"대미 관세 협상을 차질 없이 뒷받침하기 위해 산업은행·수출입은행 등에 국비 1조9000억원을 투입하고, 미 함정 유지보수(MRO) 등 조선산업 글로벌 협력도 적극 지원한다. 관세 피해를 입은 800개 기업에는... ",https://biz.newdaily.co.kr/site/data/html/2025/08/28/2025082800451.html,https://biz.newdaily.co.kr/site/data/html/2025/08/28/2025082800451.html,"Fri, 29 Aug 2025 11:14:00 +0900"
수출입은행,[2026 예산안] 美 관세·수출지원 1.6조→4.3조…정책기관 총출동,"산업은행과 수출입은행, 한국무역보험공사 등 정책금융기관들이 1조9000억원 규모의 금융 지원을 통해 조선·반도체 등 대미 관세 협상을 차질없이 뒷받침할 계획이다. 또 조선업 현장 지원을 강화하기 위해... ",https://www.newspim.com/news/view/20250828001092,https://www.newspim.com/news/view/20250828001092,"Fri, 29 Aug 2025 11:14:00 +0900"
수출입은행,[李정부 첫 예산안] 내연차 전기차로 바꾸면 100만원 지원…美 관세 대...,"정부는 1조9000억원을 투입해 한국산업은행·한국수출입은행·한국무역보험공사 등을 통한 정책금융 패키지를 가동하고, 조선·반도체 등 대미 관세 협상을 지원할 방침이다. 조선업 협력을 위해서는 한·미... ",https://www.ajunews.com/view/20250829082607083,https://www.ajunews.com/view/20250829082607083,"Fri, 29 Aug 2025 11:14:00 +0900"
수출입은행,"정부, 대외 통상 대응 예산 4.3조 편성…수출 경쟁력 강화 총력","산업은행, 수출입은행, 무역보험공사를 중심으로 한 정책금융 패키지를 통해 약 1조 9천억 원이 집행될 예정이며, 중소조선사의 함정 정비 역량 강화 및 기술 협력을 위한 한·미 기술협력센터 설립 예산도 708억 원... ",https://www.nocutnews.co.kr/news/6392237?utm_source=naver&utm_medium=article&utm_campaign=20250829111231,https://n.news.naver.com/mnews/article/079/0004060676?sid=101,"Fri, 29 Aug 2025 11:13:00 +0900"
수출입은행,李정부 첫 예산 728조…총지출 증가율 8.1% '확장재정' 시동,아울러 대미 관세협상을 차질 없이 뒷받침하기 위해 산업은행·수출입은행 등에 국비 1조9천억원을 투입하고 조선산업 글로벌 협력도 적극 지원한다. 신재생 에너지 전환을 위한 융자·보조 규모도 5천억원에서... ,https://news.einfomax.co.kr/news/articleView.html?idxno=4372075,https://news.einfomax.co.kr/news/articleView.html?idxno=4372075,"Fri, 29 Aug 2025 11:12:00 +0900"
산업은행,李 특명에…금융공공기관 ‘통폐합 태풍’ 몰아치나,2019년 산업은행과 수출입은행 통합 논의는 수은 노조의 강한 반발에 부딪혀 무산된 바 있다. 한 금융공공기관 관계자는 “각 기관마다 소속 부처가 다르고 지역 이해관계나 국회 동의 등 정치적 변수가 얽혀 있어 추진이... ,https://www.kukinews.com/article/view/kuk202508290145,https://www.kukinews.com/article/view/kuk202508290145,"Sat, 30 Aug 2025 06:02:00 +0900"
산업은행,[오늘의 주요일정]사회(8월30일 토요일),"▲오후 1시 한미자유의물결, 여의도 국민의힘 당사 앞, 정책 실패 규탄 ▲오후 1시 자유통일당, 신문로1가 등 동화면세점~대한문/편도 전차로, 전국 집중 국민대회 ▲오후 2시 리바이벌코리아, 여의도 산업은행 측면 인도... ",https://www.newsis.com/view/NISX20250829_0003309085,https://n.news.naver.com/mnews/article/003/0013451006?sid=102,"Sat, 30 Aug 2025 06:00:00 +0900"
산업은행,"AI 인퍼런스 고도화 나선 프렌들리AI, 2,000만 달러 투자 유치","기존에 500만 달러를 조달한 데 이어 진행된 시드 연장 라운드는 캐피스톤 파트너스가 주도했으며, 시에라 벤처스, 얼럼나이 벤처스, 산업은행(KDB)과 KB증권 등도 새롭게 참여했다. 프렌들리AI는 AI 모델 실행... ",https://www.tokenpost.kr/news/tech/281454,https://www.tokenpost.kr/news/tech/281454,"Sat, 30 Aug 2025 05:00:00 +0900"
산업은행,"국방비 8% 늘어 66조, 7년만에 최대폭","협상을 뒷받침하기 위한 예산이 2조1000억 원 편성됐다. 산업은행과 수출입은행, 무역보험공사 등을 통한 정책금융 패키지 지원(1조9000억 원)으로 조선, 반도체 등 대미 관세 협상을 차질없이 뒷받침할 예정이다.",https://www.donga.com/news/Politics/article/all/20250830/132284953/2,https://n.news.naver.com/mnews/article/020/0003657636?sid=100,"Sat, 30 Aug 2025 01:44:00 +0900"
산업은행,8월 30일(토) 광화문역·서울역·교대역·신논현역 도심 집회 몇시에? [...,여의도 산업은행 측면 △ 14:00~18:00 교대역 9번 출구(2개 차로) 행진: 18:00 출발 → 교대역 → 강남역 → 신논현역 △ 16:00~18:00 숭현공원 행진: 17:00 출발 → 숭현공원 → 효령빌딩 △ 17:00~20:30 서울역광장 행진... ,https://www.econovill.com/news/articleView.html?idxno=709408,https://www.econovill.com/news/articleView.html?idxno=709408,"Sat, 30 Aug 2025 01:02:00 +0900"
산업은행,"AI 100조원 프로젝트, 내년 예산은 1조원에 그쳐","국민성장펀드는 연기금 등 민간 자금 50조원, 산업은행 등 국책은행 중심의 첨단전략산업기금 50조원을 마련해 향후 5년간 AI 핵심 산업과 초혁신경제 프로젝트 등에 대출이나 지분 투자 형태로 투입하는 새... ",https://www.chosun.com/economy/economy_general/2025/08/30/NUIGVHMHSNHWNAR3JLRYJUHAQ4/?utm_source=naver&utm_medium=referral&utm_campaign=naver-news,https://n.news.naver.com/mnews/article/023/0003926201?sid=101,"Sat, 30 Aug 2025 00:56:00 +0900"
산업은행,"철강 중소형 관련주, '봄꽃만개' 동일스틸럭스·화인베스틸·영흥·SK오...","산업은행 등 정책 금융기관들도 펀드 운영에 참여해 자금 조달과 보증 지원을 확대할 계획이다. 한편, 미국은 최근 의회를 중심으로 '동맹국 선박 등록제' 등 안보·경제 측면에서 조선산업 협력을 강화하는 움직임도... ",http://www.finomy.com/news/articleView.html?idxno=237662,http://www.finomy.com/news/articleView.html?idxno=237662,"Sat, 30 Aug 2025 00:06:00 +0900"
