Keyword,Title,Description,Original Link,Link,Publication Date
정태호,역대 최대 'WHE 2025' 개막…'글로벌 수소협력 플랫폼' 도약,"정태호 국회수소경제포럼 공동대표도 축사에서 &quot;청정수소 생산체계 고도화, CHPS 활성화, 수소 인프라 확충 및 활용시장 확대 등 아직 도전해야 할 과제가 산적해 있고, 시장의 불확실성과 투자 위축으로 인해서... ",https://www.energy-news.co.kr/news/articleView.html?idxno=220576,https://www.energy-news.co.kr/news/articleView.html?idxno=220576,"Thu, 04 Dec 2025 10:30:00 +0900"
정태호,"수소기술의 장, WHE 2025 개막… 글로벌 협력 본격화","국회 수소경제포럼의 공동대표 이종배 의원과 정태호 의원도 축사를 통해 대한민국의 수소경제 비전과 입법·제도적 지원을 약속했다. 특히 정 의원은 &quot;청정수소 생산 체계 고도화, 수소 인프라 확충 등 해결해야 할... ",https://www.autodaily.co.kr/news/articleView.html?idxno=539590,https://www.autodaily.co.kr/news/articleView.html?idxno=539590,"Thu, 04 Dec 2025 10:30:00 +0900"
정태호,세무사법 개정안 국회 통과.. 세무사회 &quot;업무환경 혁신 도래&quot;,세무사회는 &quot;이번 개정안은 정부가 제출한 원안과 김영환·정태호·임광현 의원이 각각 발의한 총 4건의 세무사법 개정안을 통합해 기획재정위원회가 마련한 대안으로 한국세무사회와 기획재정부가 2023년부터 함께 운영해... ,http://www.joseilbo.com/news/news_read.php?uid=558126&class=10&grp=,https://n.news.naver.com/mnews/article/123/0002373198?sid=101,"Thu, 04 Dec 2025 10:06:00 +0900"
정태호,정부조달 문화상품 국회 특별기획전 5일까지 국회서 열려,"특별기획전은 정태호·박수영 국회의원이 공동주최하고 정부조달문화상품협회 주관, 조달청 후원으로 마련됐다. 이번 국회 특별기획전은 박해도 장인의 은공예 작품인 ‘황소 부조’를 비롯해 국가무형문화재 등 총... ",https://www.hankyung.com/article/202512042971h,https://n.news.naver.com/mnews/article/015/0005220009?sid=103,"Thu, 04 Dec 2025 09:46:00 +0900"
정태호,"[특집] 한국세무사회, &quot;세무사법 개정으로 세무사제도 선진화 확립 길 ...","더불어 이번 개정안은 정부가 제출한 원안과 김영환·정태호·임광현 의원이 각각 발의한 총 4건의 세무사법 개정안을 통합해 기획재정위원회가 마련한 대안으로, 한국세무사회와 기획재정부가 2023년부터 함께 운영해온... ",http://www.suwonilbo.kr/news/articleView.html?idxno=313300,http://www.suwonilbo.kr/news/articleView.html?idxno=313300,"Thu, 04 Dec 2025 09:38:00 +0900"
정태호,새 술은 반 부대? '절반의 성공'인 '개콘' 리뉴얼 2주년 [예능 뜯어보기...,"중 정태호가 앞장서서 지난 2일 서울 홍대 인근의 치킨집에서 치킨을 쏘는 이벤트도 열었다. TV 속의... '개콘'은 터줏대감으로 불리는 박준형이 최근 코너를 통해 복귀했으며 정범균, 정태호, 신윤승, 송필근 등... ",https://www.ize.co.kr/news/articleView.html?idxno=72592,https://m.entertain.naver.com/article/465/0000014299,"Thu, 04 Dec 2025 09:28:00 +0900"
정태호,WHE 2025 개막…“글로벌 수소협력 플랫폼” 본격 시동,"개막식엔 김성환 기후에너지환경부 장관, 국회수소경제포럼 공동대표 이종배·정태호 의원, 조직위 공동위원장 강남훈·김재홍 회장 등 400여 명이 참석했다. 김재홍 조직위원장은 개회사에서 “수소경제가 조정기를... ",https://www.asiatime.co.kr/article/20251203500449,https://www.asiatime.co.kr/article/20251203500449,"Thu, 04 Dec 2025 08:24:00 +0900"
정태호,"현대차그룹 장재훈 부회장, 글로벌 수소 생태계 논의 주도","한국에서는 국회수소경제포럼 공동대표인 정태호 더불어민주당 의원, 오영훈 제주도지사, 이호현기후에너지환경부 제2차관 등이 참석해 한국의 수소 정책과 비전을 발표한다. SK그룹, 롯데그룹, 두산그룹... ",https://www.dnews.co.kr/uhtml/view.jsp?idxno=202512032349430600333,https://www.dnews.co.kr/uhtml/view.jsp?idxno=202512032349430600333,"Thu, 04 Dec 2025 00:00:00 +0900"
정태호,"'수소위 CEO 서밋' 주도한 현대차, 수소 생태계 확산 이끈다","한국에선 국회수소경제포럼 공동대표인 더불어민주당 정태호 의원, 오영훈 제주도지사, 기후에너지환경부 이호현 제2차관 등이 참석해 한국의 수소 정책과 비전을 발표한다. 현대차그룹 외에도 SK그룹(SK이노베이션)... ",http://www.fnnews.com/news/202512031856016435,https://n.news.naver.com/mnews/article/014/0005443877?sid=101,"Wed, 03 Dec 2025 18:57:00 +0900"
정태호,[단독] 돈 뽑으러 왕복 90분… 농어촌 노인 ‘ATM 찾아 삼만리’,3일 국회 기획재정위원회 소속 더불어민주당 정태호 의원실이 금융결제원으로부터 받은 자료를 보면 올해 기준 강원·경남·경북·대구·전남·전북·충남·충북 기초자치단체(시군구) 34곳에서 1㎞ 이내 현금인출기 접근... ,https://www.segye.com/newsView/20251203516335?OutUrl=naver,https://n.news.naver.com/mnews/article/022/0004087406?sid=102,"Wed, 03 Dec 2025 18:53:00 +0900"
정태호,"현대차그룹, ‘수소위원회 CEO 서밋’서 수소 생태계 확산 논의","한국에서는 국회수소경제포럼 공동대표인 정태호 더불어민주당 의원, 오영훈 제주도지사, 이호현 기후에너지환경부 제2차관 등이 참석해 한국의 수소 정책과 비전을 발표하고, 현대차그룹과 함께 SK그룹... ",http://www.segyebiz.com/newsView/20251203512383?OutUrl=naver,http://www.segyebiz.com/newsView/20251203512383?OutUrl=naver,"Wed, 03 Dec 2025 18:14:00 +0900"
기재부,"전주시, 내년 국가예산 2조 2,925억 확보…3년 연속 2조 원대 유지",시는 연초부터 도 및 정치권과 협력해 주요 부처와 기재부를 대상으로 설명·건의를 지속해 온 점을 성과 요인으로 꼽았다. 우범기 시장은 “확보한 예산이 시민 삶의 개선과 지역 경제 활력으로 이어지도록... ,https://www.betanews.net/article/view/beta202512040054,https://www.betanews.net/article/view/beta202512040054,"Thu, 04 Dec 2025 13:44:00 +0900"
기재부,TK신공항 ‘의성 화물터미널’ 마침표…‘민간공항기본계획’ 연내 고시...,기재부가 확정한 ‘민간 공항 기본 계획 총사업비 변경안’은 기존 ‘사업 계획 적정성 검토안(2조 3835억... 공조하면서 기재부·국토부·국방부 등과 약 100여 차례 협의를 진행했다. 박 의원은 지속적인 협의를 통해 올해... ,http://www.inews24.com/view/1914144,https://n.news.naver.com/mnews/article/031/0000986457?sid=102,"Thu, 04 Dec 2025 13:37:00 +0900"
기재부,"고흥군, &quot;나로우주센터로 가는 길&quot; 빨라진다",고흥군은 지난 9월 정부 예산안이 국회에 제출된 이후 공영민 군수를 중심으로 현안 사업의 예산 증액을 위해 국회와 기재부를 방문 사업의 필요성과 시급성에 대해 적극 설득한 결과 국비 105억 원을 추가로... ,http://www.jeollailbo.com/news/articleView.html?idxno=785878,http://www.jeollailbo.com/news/articleView.html?idxno=785878,"Thu, 04 Dec 2025 13:22:00 +0900"
기재부,“전세사기·공공임대 예산 증액 안돼” 비판,증액을 기재부가 막아섰다는 점은 조세와 예산 배분의 우선순위가 완전히 뒤바뀌어 있음을 보여준다”고 했다. 김형용 동국대 교수는 “내년 예산안 중 사회복지 분야의 예산 증가분은 공적연금(8.6조 원) 및 주택(2.8조... ,https://www.naeil.com/news/read/569879?ref=naver,https://www.naeil.com/news/read/569879?ref=naver,"Thu, 04 Dec 2025 13:06:00 +0900"
기재부,'해수부 이전' 정부세종청사 재배치 착수...&quot;내년 상반기 이전 완료&quot;,기재부 예산·기획 부서가 사용하던 중앙동 공간은 행복청이 옮겨와 사용하게 된다. 기후부 에너지실은 산업통상부 산하로 있던 13동에서 6동으로 이동한다. 한 건물 내에서 환경·기후·에너지 정책이 통합 추진도리 수... ,https://www.ajunews.com/view/20251204130144979,https://www.ajunews.com/view/20251204130144979,"Thu, 04 Dec 2025 13:04:00 +0900"
기재부,‘외환위기’ 보도에 발끈한 기재부 “대외건전성 양호”,기재부는 최근 조선일보가 “대외건전성 악화로 제3차 외환위기가 우려된다”는 취지로 보도하자 외환 관련 통계수치를 제공하며 반박했다. 기재부 설명에 따르면 외채 등에 대한 국내은행의 상환능력을... ,https://www.naeil.com/news/read/569800?ref=naver,https://www.naeil.com/news/read/569800?ref=naver,"Thu, 04 Dec 2025 13:02:00 +0900"
기재부,與코스피특위 &quot;자사주 '자본' 성격 맞게 세법 개정 논의&quot;,"이어 &quot;기재부의 실무적인 검토 결과가 나오면 그 시점에서 다시 논의할 것&quot;이라고 덧붙였다. 의무공개매수 제도 도입과 관련해선, &quot;기본적으로 정부도 당도 도입하자는 요구가 있어 공감하고 있다&quot;면서 &quot;12월 중에... ",https://news.einfomax.co.kr/news/articleView.html?idxno=4387239,https://news.einfomax.co.kr/news/articleView.html?idxno=4387239,"Thu, 04 Dec 2025 12:50:00 +0900"
기재부,"여수시, 내년도 국비 8169억 확보 ‘역대 최대’","앞서 정기명 여수시장은 관계 공무원들과 중앙부처와 기재부, 국회 등을 수차례 방문했으며, 한병도 예산결산특별위원회 위원장을 비롯한 예결위 위원들과 지역구 국회의원들에게 지역 현안 사업에 대해 적극적... ",http://www.shinailbo.co.kr/news/articleView.html?idxno=2157416,http://www.shinailbo.co.kr/news/articleView.html?idxno=2157416,"Thu, 04 Dec 2025 12:44:00 +0900"
기재부,"고흥군, 국회 심의서 105억 원 추가 반영… 현안사업 추진 동력 확보","고흥군에 따르면, 지난 9월 정부 예산안이 국회에 제출된 이후 공영민 군수를 중심으로 현안 사업의 예산 증액을 위해 국회와 기재부를 수시로 방문해 사업의 필요성과 시급성을 설명하는 등 적극적 행보로 국비 105억... ",http://www.shinailbo.co.kr/news/articleView.html?idxno=2157404,http://www.shinailbo.co.kr/news/articleView.html?idxno=2157404,"Thu, 04 Dec 2025 12:44:00 +0900"
기재부,"[기획] 공영민호(號),'8천억 규모' 국책사업 물꼬,고흥 비약적 발전 '기...","특히 지역구 문금주 국회의원, 박홍근 국회의원(더불어민주당) 등 정치권과 긴밀한 '원팀(One-Team)' 협력 체계를 구축해 기재부의 반대를 설득하고 증액을 이뤄냈다. 공영민 군수는 &quot;이번에 확보한 3대 사업은 고흥의... ",https://www.ppss.kr/news/articleView.html?idxno=277420,https://www.ppss.kr/news/articleView.html?idxno=277420,"Thu, 04 Dec 2025 12:29:00 +0900"
기재부,"해수부 부산 이전 시작… 행안부, 정부세종청사 재배치 착수",기재부의 예산 부서가 쓰던 중앙동 공간엔 행정중심복합도시건설청이 들어온다. 기후에너지환경부 에너지실은 산업통상부가 있는 13동에서 기후부가 주로 쓰는 6동으로 자리를 옮긴다. 또 외부 단독 건물을 사용 중인... ,https://www.segye.com/newsView/20251204508333?OutUrl=naver,https://n.news.naver.com/mnews/article/022/0004087614?sid=102,"Thu, 04 Dec 2025 12:11:00 +0900"
기재부,與 “‘의무공개매수제’ 매수 비율 유연하게 갈 것”,오 위원장은 “(지금은) 자사주가 ‘자산’이라는 전제로 세금 체계가 진행되고 있는데 (향후) 세제 개념적인 변화가 있을 것”이라면서 “기재부의 실무적인 용역 검토 결과가 나오는 대로 다시 논의할 것”이라고... ,https://biz.chosun.com/policy/politics/assembly/2025/12/04/RLWVMWU42BCONID6Y7PTTV5SI4/?utm_source=naver&utm_medium=original&utm_campaign=biz,https://n.news.naver.com/mnews/article/366/0001128015?sid=100,"Thu, 04 Dec 2025 12:11:00 +0900"
기재부,"&quot;자사주 취득 자본거래로&quot;…與, 상법 개정 후속 조치 속도",이날 기재부는 자사주의 성격을 ‘자본’으로 통일하기 위한 세법 개정 추진 상황을 발표했다. 민주당에서는... 이어 “기재부의 실무적인 검토 결과가 나오면 그 시점에서 다시 논의할 것”이라고 전했다. 오 의원도 지난... ,https://www.sedaily.com/NewsView/2H1LL4ZXAD,https://n.news.naver.com/mnews/article/011/0004563499?sid=100,"Thu, 04 Dec 2025 12:10:00 +0900"
기재부,"&quot;출범 이후 최대 규모 정부 예산 확보&quot;...세종시, 내년 정부예산 1조 7,3...",최민호 세종시장과 이승원 경제부시장이 지난 11월 24일 임기근 기재부 제2차관을 면담해 예산 반영을... 김종민 국회의원은 &quot;상반기부터 기재부와 긴밀하게 협의한 결과가 반영된 것&quot;이라며 &quot;국회세종의사당 956억 원... ,https://www.ilyoseoul.co.kr/news/articleView.html?idxno=510112,https://www.ilyoseoul.co.kr/news/articleView.html?idxno=510112,"Thu, 04 Dec 2025 12:06:00 +0900"
기재부,전셋값 상승 여파…임대보증금 10% 급증 '역대 최대 증가',이에 대해 기재부 관계자는 &quot;5분위 고소득층 소득이 4.4% 증가하며 상대적으로 큰 폭으로 상승한 영향으로... 기재부 관계자는 “AI(인공지능) 대전환과 초혁신경제 30대 선도프로젝트 등을 통해 성장 잠재력을... ,https://www.sedaily.com/NewsView/2H1LLIYKB2,https://n.news.naver.com/mnews/article/011/0004563494?sid=101,"Thu, 04 Dec 2025 12:01:00 +0900"
기재부,"정부세종청사, 해수부-기획예산처-행복청-기후부 에너지실 연쇄 이동","기재부의 예산·기획 부서가 사용하던 중앙동 공간은 행정중심복합도시건설청이 이전 배치되고, 조직이 개편돼 추가로 필요한 사무공간 조성 등으로 활용한다. 정부조직개편 이후 산업통상부 건물에서 근무하던... ",https://biz.heraldcorp.com/article/10629645?ref=naver,https://n.news.naver.com/mnews/article/016/0002567281?sid=101,"Thu, 04 Dec 2025 12:01:00 +0900"
기재부,빚 1억·세금 1400만원 시대… 부자만 더 부자됐다,"이진만 기재부 복지경제과장은 &quot;이번 조사에서 지니계수 등 주요 분배지표가 악화된 것으로 확인됐다&quot;면서 &quot;성장과 분배가 선순환할수 있도록 취약계층 사회안전망, 맞춤형 일자리 지원 등 정책 노력을... ",http://www.fnnews.com/news/202512041110517074,https://n.news.naver.com/mnews/article/014/0005444230?sid=101,"Thu, 04 Dec 2025 12:01:00 +0900"
기재부,정부세종청사 재배치…해수부 부산 이전부터 내년 상반기 완료,기재부 예산·기획 부서가 비워내는 중앙동 공간은 행복청이 옮겨와 사용하게 된다. 기후에너지환경부 에너지실은 산업통상부 산하로 있던 13동에서 6동으로 이동한다. 환경·기후·에너지 정책을 한 동에서 추진하는... ,https://www.news1.kr/local/moi/5997528,https://n.news.naver.com/mnews/article/421/0008642821?sid=102,"Thu, 04 Dec 2025 12:00:00 +0900"
기재부,"올해 가구 평균 순자산 늘었지만, 자산 불평등은 역대 최고","기재부는 “AI 대전환과 초혁신경제 30대 선도 프로젝트 등을 통해 성장 잠재력 확충에 만전을 기하는 한편, 취약계층 사회안전망 강화와 맞춤형 일자리 지원 등 정책 과제를 경제성장 전략에 반영해 단계적으로... ",https://biz.chosun.com/policy/policy_sub/2025/12/04/DPT4Q4F4BBFXJHPI7C5ALDHID4/?utm_source=naver&utm_medium=original&utm_campaign=biz,https://n.news.naver.com/mnews/article/366/0001128006?sid=101,"Thu, 04 Dec 2025 12:00:00 +0900"
기재부,지난해 가계소득 3.4% 증가한 7427만원…소득격차 6배 벌어져,"기재부는 &quot;취업자 수 증가와 공적 이전소득 확대가 소득 증가에 기여했다&quot;고 해석했다. 특히 가구 평균소득은 1~5분위 모두 증가했다. 1분위 소득은 3.1%, 2분위는 2.1%, 3분위 1.8%, 4분위 2.8%, 5분위는 4.4% 올랐다.... ",https://www.newspim.com/news/view/20251204000051,https://www.newspim.com/news/view/20251204000051,"Thu, 04 Dec 2025 12:00:00 +0900"
기재부,"여수시, 내년도 국비 8,169억 확보 '역대 최대'","앞서 정기명 여수시장은 관계 공무원들과 중앙부처와 기재부, 국회 등을 수차례 방문했으며 한병도 예산결산특별위원회 위원장을 비롯한 예결위 위원들과 지역구 국회의원들에게 지역 현안 사업에 대해 적극적... ",http://www.newsworker.co.kr/news/articleView.html?idxno=405506,http://www.newsworker.co.kr/news/articleView.html?idxno=405506,"Thu, 04 Dec 2025 12:00:00 +0900"
기재부,"고흥군, 국도 15호선 확장 등 국책사업 예산 증액 편성",지난 9월 정부 예산안이 국회에 제출된 이후 공영민 군수를 중심으로 현안 사업의 예산 증액을 위해 국회와 기재부를 수시로 방문해 사업의 필요성과 시급성을 설명하는 등 적극적 행보로 국비 105억 원을 추가로... ,https://www.joongdo.co.kr/web/view.php?key=20251207010001885,https://www.joongdo.co.kr/web/view.php?key=20251207010001885,"Thu, 04 Dec 2025 11:56:00 +0900"
기재부,[단독] 재경부 부동산정책 키잡나...부동산전담과 신설 급부상,기재부 관계자는 &quot;부동산정책과 승격은 십여 년간 숙원과도 같은 이야기였다&quot;며 &quot;워낙 하는 일이 많았다&quot;고... 이런 상황에서 재경부가 기재부에서 분리되면서 부동산 정책을 직접 챙기겠다는 의지로 읽힙니다. [앵커]... ,https://biz.sbs.co.kr/article_hub/20000276468?division=NAVER,https://n.news.naver.com/mnews/article/374/0000478743?sid=101,"Thu, 04 Dec 2025 11:53:00 +0900"
기재부,與코스피5000특위 &quot;이제는 시장의 시간&quot;…비쟁점 자본시장법 연내 처리...,오 의원은 &quot;자사주 취득을 자본거래로 보고 관련 세금 체계를 개편하는 것은 개념적 변화가 커 디테일한 검토가 필요하다&quot;며 &quot;기재부의 실무적 검토 결과가 나오면 그 시점에 다시 논의하는 것으로 정리됐다&quot;고 전했다.... ,https://www.asiatoday.co.kr/view.php?key=20251204010002534,https://www.asiatoday.co.kr/view.php?key=20251204010002534,"Thu, 04 Dec 2025 11:52:00 +0900"
기재부,"전진숙 의원, 광주운전면허시험장 조성에 국비 64억 확보…사업 탄력",전 의원은 기재부와 국회를 끈질기게 설득해 부족한 공사비와 감리비를 확보함에 따라 광주 시민들에게 최상의 서비스를 제공할 수 있는 최첨단 '1급지 운전면허시험장'을 추진할 수 있게 됐다. 이외에도... ,https://www.newsworks.co.kr/news/articleView.html?idxno=821625,https://www.newsworks.co.kr/news/articleView.html?idxno=821625,"Thu, 04 Dec 2025 11:50:00 +0900"
기재부,"고흥군, 국회 예산 증액으로 2026년 핵심 현안 본격화","이번 증액은 정부 예산안 제출 이후 공영민 군수를 중심으로 군이 국회와 기재부를 수차례 방문하며 사업의 시급성을 설명한 결과로, 총 8008억 원 규모의 대형 프로젝트들이 조기 착수할 기반이 마련됐다. 핵심 사업인... ",https://www.polinews.co.kr/news/articleView.html?idxno=715808,https://www.polinews.co.kr/news/articleView.html?idxno=715808,"Thu, 04 Dec 2025 11:50:00 +0900"
기재부,새로운 전주 위한 내년도 국가 예산 2조 2925억 원 확보,"이에 앞서 시는 연초부터 국가 예산 확보를 위해 전북특별자치도, 정치권과 공조체계를 구축해 기재부와 각 부처를 상대로 지속적인 설명과 협의를 진행했으며, 주요 사업들을 중심으로 논리 개발을 통해 사업을... ",http://www.ttlnews.com/news/articleView.html?idxno=3056871,http://www.ttlnews.com/news/articleView.html?idxno=3056871,"Thu, 04 Dec 2025 11:50:00 +0900"
기재부,"고흥군, 2026년도 국비 확보···3개 국책사업 확정",4일 군에 따르면 지난 9월부터 정부 예산안 제출 후 국회와 기재부를 방문해 사업의 필요성과 시급성을 설명하며 예산 증액을 추진했다. 이로 인해 2026년부터 시행할 수 있는 성과를 거두게 됐다. 특히 '국도 15호선 고흥... ,https://www.jeonmae.co.kr/news/articleView.html?idxno=1208845,https://www.jeonmae.co.kr/news/articleView.html?idxno=1208845,"Thu, 04 Dec 2025 11:46:00 +0900"
기재부,"여수시, 내년 예산 '국비 8,169억' 확보 역대 최대...당면 현안사업 가속...",앞서 정기명 여수시장은 관계 공무원들과 중앙부처와 기재부와 국회 등을 수차례 방문했고 한병도 예산결산특별위원회 위원장을 비롯한 예결위 위원들과 지역구... ,http://www.breaknews.com/1166548,http://www.breaknews.com/1166548,"Thu, 04 Dec 2025 11:38:00 +0900"
기재부,"여수시, 내년도 국비 8169억 확보 '역대 최대'","앞서 정기명 여수시장은 관계 공무원들과 중앙부처와 기재부, 국회 등을 수차례 방문했으며, 한병도 예산결산특별위원회 위원장을 비롯한 예결위 위원들과 지역구 국회의원들에게 지역 현안 사업에 대해 적극적... ",http://www.koreareport.co.kr/news/articleView.html?idxno=42047,http://www.koreareport.co.kr/news/articleView.html?idxno=42047,"Thu, 04 Dec 2025 11:38:00 +0900"
기재부,"여수시, 내년도 국비 8169억 확보 '역대 최대'","앞서 정기명 시장은 관계 공무원들과 중앙부처와 기재부, 국회 등을 수차례 방문했으며 한병도 예산결산특별위원회 위원장을 비롯한 예결위 위원들과 지역구 국회의원들에게 지역 현안 사업에 대해 적극적 설명하는... ",https://www.newscj.com/news/articleView.html?idxno=3347941,https://www.newscj.com/news/articleView.html?idxno=3347941,"Thu, 04 Dec 2025 11:36:00 +0900"
기재부,"고흥군 현안사업, 국회의결로 2026년부터 시작됩니다","고흥군에 따르면, 지난 9월 정부 예산안이 국회에 제출된 이후 공영민 군수를 중심으로 현안 사업의 예산 증액을 위해 국회와 기재부를 수시로 방문해 사업의 필요성과 시급성을 설명하는 등 적극적 행보로 국비 105억... ",http://www.newsworker.co.kr/news/articleView.html?idxno=405485,http://www.newsworker.co.kr/news/articleView.html?idxno=405485,"Thu, 04 Dec 2025 11:30:00 +0900"
기재부,"與, ‘코스피5000 특위’ 전체회의 개최…자사주 세법 개정 속도","기재부는 자사주 관련 세법개정 추진 현황을 발표했고, 법무부와 금융위원회는 각각 지배구조 제도개선 관련 후속조칙 준비 상황과 스튜어드십 코드 및 공시제도 개선 현황 등을 발표했다. 코스피5000특위 위원장인... ",https://biz.heraldcorp.com/article/10629576?ref=naver,https://n.news.naver.com/mnews/article/016/0002567216?sid=100,"Thu, 04 Dec 2025 11:28:00 +0900"
기재부,"고흥군 현안사업, 정부 예산 국회 통과...2026년 본격 시작","고흥군에 따르면, 지난 9월 정부 예산안이 국회에 제출된 이후 공영민 군수를 중심으로 현안 사업의 예산 증액을 위해 국회와 기재부를 수시로 방문해 사업의 필요성과 시급성을 설명하는 등 적극적 행보로 국비 105억... ",http://www.newstnt.com/news/articleView.html?idxno=562576,http://www.newstnt.com/news/articleView.html?idxno=562576,"Thu, 04 Dec 2025 11:24:00 +0900"
기재부,"여수시, 내년도 국비 8169억 원 확보…역대 최대 규모","정기명 시장과 관계 공무원들이 중앙부처와 기재부, 국회를 지속적으로 방문해 주요 현안사업을 적극 설명한 결과다. 특히 여수시는 예산결산특별위원회 한병도 위원장과 예결위 위원들, 지역구 국회의원들과... ",https://news.tf.co.kr/read/national/2269094.htm,https://n.news.naver.com/mnews/article/629/0000450077?sid=102,"Thu, 04 Dec 2025 11:22:00 +0900"
기재부,전진숙 국회의원 '광주운전면허시험장 조성사업' 탄력,"전 의원은 기재부와 국회를 끈질기게 설득해, 부족한 공사비와 감리비를 확보함에 따라, 광주 시민들에게 최상의 서비스를 제공할 수 있는 최첨단 '1급지 운전면허시험장' 추진할 수 있게 됐다. 이외에도... ",https://view.asiae.co.kr/article/2025120409582409204,https://n.news.naver.com/mnews/article/277/0005688898?sid=102,"Thu, 04 Dec 2025 11:19:00 +0900"
기재부,"고흥군,정부예산 105억 원 추가 반영…현안사업 추진 동력 확보","고흥군에 따르면, 지난 9월 정부 예산안이 국회에 제출된 이후 공영민 군수를 중심으로 현안 사업의 예산 증액을 위해 국회와 기재부를 수시로 방문해 사업의 필요성과 시급성을 설명하는 등 적극적 행보로 국비 105억... ",https://www.cnbnews.com/news/article.html?no=765486,https://www.cnbnews.com/news/article.html?no=765486,"Thu, 04 Dec 2025 11:16:00 +0900"
